dockerfiles/miopen-rocm51/gfx906_60.HIP.2_16_0_2024ff6a8.ufdb.txt
3-224-224-7x7-64-112-112-64-3x3-2x2-1x1-0-NCHW-FP32-F=miopenConvolutionFwdAlgoImplicitGEMM:ConvMlirIgemmFwd,5.47719,0,miopenConvolutionFwdAlgoImplicitGEMM,<unused>;miopenConvolutionFwdAlgoDirect:ConvAsm7x7c3h224w224k64u2v2p3q3f1,1.77879,0,miopenConvolutionFwdAlgoDirect,<unused>;miopenConvolutionFwdAlgoWinograd:ConvBinWinogradRxS,2.47354,0,miopenConvolutionFwdAlgoWinograd,<unused>;miopenConvolutionFwdAlgoGEMM:GemmFwdRest,4.50586,7375872,miopenConvolutionFwdAlgoGEMM,<unused>
64-56-56-1x1-64-56-56-64-0x0-1x1-1x1-0-NCHW-FP32-F=miopenConvolutionFwdAlgoImplicitGEMM:ConvHipImplicitGemmV4R1Fwd,0.22721,0,miopenConvolutionFwdAlgoImplicitGEMM,<unused>;miopenConvolutionFwdAlgoDirect:ConvAsm1x1U,0.199208,0,miopenConvolutionFwdAlgoDirect,<unused>;miopenConvolutionFwdAlgoWinograd:ConvBinWinogradRxSf3x2,0.454099,0,miopenConvolutionFwdAlgoWinograd,<unused>;miopenConvolutionFwdAlgoGEMM:GemmFwd1x1_0_1,0.202408,0,miopenConvolutionFwdAlgoGEMM,<unused>
64-56-56-3x3-64-56-56-64-1x1-1x1-1x1-0-NCHW-FP32-F=miopenConvolutionFwdAlgoWinograd:ConvBinWinograd3x3U,0.795073,0,miopenConvolutionFwdAlgoWinograd,<unused>
128-56-56-1x1-256-56-56-64-0x0-1x1-1x1-0-NCHW-FP32-F=miopenConvolutionFwdAlgoImplicitGEMM:ConvHipImplicitGemmV4R1Fwd,1.51078,0,miopenConvolutionFwdAlgoImplicitGEMM,<unused>;miopenConvolutionFwdAlgoDirect:ConvAsm1x1U,1.24053,0,miopenConvolutionFwdAlgoDirect,<unused>;miopenConvolutionFwdAlgoWinograd:ConvBinWinogradRxSf3x2,2.79516,0,miopenConvolutionFwdAlgoWinograd,<unused>;miopenConvolutionFwdAlgoGEMM:GemmFwd1x1_0_1,1.25525,0,miopenConvolutionFwdAlgoGEMM,<unused>
256-56-56-1x1-64-56-56-64-0x0-1x1-1x1-0-NCHW-FP32-F=miopenConvolutionFwdAlgoImplicitGEMM:ConvHipImplicitGemmV4R1Fwd,0.645627,0,miopenConvolutionFwdAlgoImplicitGEMM,<unused>;miopenConvolutionFwdAlgoDirect:ConvAsm1x1U,0.689309,0,miopenConvolutionFwdAlgoDirect,<unused>;miopenConvolutionFwdAlgoWinograd:ConvBinWinogradRxSf3x2,1.35478,0,miopenConvolutionFwdAlgoWinograd,<unused>;miopenConvolutionFwdAlgoGEMM:GemmFwd1x1_0_1,0.683869,0,miopenConvolutionFwdAlgoGEMM,<unused>
64-56-56-1x1-256-56-56-64-0x0-1x1-1x1-0-NCHW-FP32-F=miopenConvolutionFwdAlgoImplicitGEMM:ConvHipImplicitGemmV4R1Fwd,0.793153,0,miopenConvolutionFwdAlgoImplicitGEMM,<unused>;miopenConvolutionFwdAlgoDirect:ConvOclDirectFwd1x1,0.645467,0,miopenConvolutionFwdAlgoDirect,<unused>;miopenConvolutionFwdAlgoWinograd:ConvBinWinogradRxSf3x2,1.63351,0,miopenConvolutionFwdAlgoWinograd,<unused>;miopenConvolutionFwdAlgoGEMM:GemmFwd1x1_0_1,0.676028,0,miopenConvolutionFwdAlgoGEMM,<unused>
256-56-56-1x1-128-56-56-64-0x0-1x1-1x1-0-NCHW-FP32-F=miopenConvolutionFwdAlgoImplicitGEMM:ConvHipImplicitGemmV4R1Fwd,1.30208,0,miopenConvolutionFwdAlgoImplicitGEMM,<unused>;miopenConvolutionFwdAlgoDirect:ConvAsm1x1U,1.29472,0,miopenConvolutionFwdAlgoDirect,<unused>;miopenConvolutionFwdAlgoWinograd:ConvBinWinogradRxSf3x2,2.62736,0,miopenConvolutionFwdAlgoWinograd,<unused>;miopenConvolutionFwdAlgoGEMM:GemmFwd1x1_0_1,1.33888,0,miopenConvolutionFwdAlgoGEMM,<unused>
128-56-56-3x3-128-28-28-64-1x1-2x2-1x1-0-NCHW-FP32-F=miopenConvolutionFwdAlgoImplicitGEMM:ConvHipImplicitGemmV4R1Fwd,1.37968,0,miopenConvolutionFwdAlgoImplicitGEMM,<unused>;miopenConvolutionFwdAlgoDirect:ConvOclDirectFwd,12.4945,0,miopenConvolutionFwdAlgoDirect,<unused>;miopenConvolutionFwdAlgoWinograd:ConvBinWinogradRxSf2x3g1,2.94096,0,miopenConvolutionFwdAlgoWinograd,<unused>;miopenConvolutionFwdAlgoGEMM:GemmFwdRest,8.33523,3612672,miopenConvolutionFwdAlgoGEMM,<unused>
384-28-28-1x1-512-28-28-64-0x0-1x1-1x1-0-NCHW-FP32-F=miopenConvolutionFwdAlgoImplicitGEMM:ConvHipImplicitGemmV4R1Fwd,1.92821,0,miopenConvolutionFwdAlgoImplicitGEMM,<unused>;miopenConvolutionFwdAlgoDirect:ConvAsm1x1U,2.0407,0,miopenConvolutionFwdAlgoDirect,<unused>;miopenConvolutionFwdAlgoWinograd:ConvBinWinogradRxSf3x2,4.15131,0,miopenConvolutionFwdAlgoWinograd,<unused>;miopenConvolutionFwdAlgoGEMM:GemmFwd1x1_0_1,2.46615,0,miopenConvolutionFwdAlgoGEMM,<unused>
512-28-28-1x1-128-28-28-64-0x0-1x1-1x1-0-NCHW-FP32-F=miopenConvolutionFwdAlgoImplicitGEMM:ConvHipImplicitGemmV4R1Fwd,0.613617,0,miopenConvolutionFwdAlgoImplicitGEMM,<unused>;miopenConvolutionFwdAlgoDirect:ConvAsm1x1U,0.774901,0,miopenConvolutionFwdAlgoDirect,<unused>;miopenConvolutionFwdAlgoWinograd:ConvBinWinogradRxSf3x2,1.45508,0,miopenConvolutionFwdAlgoWinograd,<unused>;miopenConvolutionFwdAlgoGEMM:GemmFwd1x1_0_1,0.73538,0,miopenConvolutionFwdAlgoGEMM,<unused>
128-28-28-3x3-128-28-28-64-1x1-1x1-1x1-0-NCHW-FP32-F=miopenConvolutionFwdAlgoWinograd:ConvBinWinograd3x3U,0.755701,0,miopenConvolutionFwdAlgoWinograd,<unused>
128-28-28-1x1-512-28-28-64-0x0-1x1-1x1-0-NCHW-FP32-F=miopenConvolutionFwdAlgoImplicitGEMM:ConvHipImplicitGemmV4R1Fwd,0.661778,0,miopenConvolutionFwdAlgoImplicitGEMM,<unused>;miopenConvolutionFwdAlgoDirect:ConvOclDirectFwd1x1,0.674738,0,miopenConvolutionFwdAlgoDirect,<unused>;miopenConvolutionFwdAlgoWinograd:ConvBinWinogradRxSf3x2,1.5994,0,miopenConvolutionFwdAlgoWinograd,<unused>;miopenConvolutionFwdAlgoGEMM:GemmFwd1x1_0_1,0.673939,0,miopenConvolutionFwdAlgoGEMM,<unused>
512-28-28-1x1-256-28-28-64-0x0-1x1-1x1-0-NCHW-FP32-F=miopenConvolutionFwdAlgoImplicitGEMM:ConvHipImplicitGemmV4R1Fwd,1.19664,0,miopenConvolutionFwdAlgoImplicitGEMM,<unused>;miopenConvolutionFwdAlgoDirect:ConvOclDirectFwd1x1,1.34064,0,miopenConvolutionFwdAlgoDirect,<unused>;miopenConvolutionFwdAlgoWinograd:ConvBinWinogradRxSf3x2,2.7688,0,miopenConvolutionFwdAlgoWinograd,<unused>;miopenConvolutionFwdAlgoGEMM:GemmFwd1x1_0_1,1.4256,0,miopenConvolutionFwdAlgoGEMM,<unused>
256-28-28-3x3-256-14-14-64-1x1-2x2-1x1-0-NCHW-FP32-F=miopenConvolutionFwdAlgoImplicitGEMM:ConvHipImplicitGemmV4R1Fwd,1.49184,0,miopenConvolutionFwdAlgoImplicitGEMM,<unused>;miopenConvolutionFwdAlgoDirect:ConvOclDirectFwd,11.6761,0,miopenConvolutionFwdAlgoDirect,<unused>;miopenConvolutionFwdAlgoWinograd:ConvBinWinogradRxSf2x3g1,3.01456,0,miopenConvolutionFwdAlgoWinograd,<unused>;miopenConvolutionFwdAlgoGEMM:GemmFwdRest,9.23635,1806336,miopenConvolutionFwdAlgoGEMM,<unused>
768-14-14-1x1-1024-14-14-64-0x0-1x1-1x1-0-NCHW-FP32-F=miopenConvolutionFwdAlgoImplicitGEMM:ConvHipImplicitGemmV4R1Fwd,1.77458,0,miopenConvolutionFwdAlgoImplicitGEMM,<unused>;miopenConvolutionFwdAlgoDirect:ConvAsm1x1U,2.51539,0,miopenConvolutionFwdAlgoDirect,<unused>;miopenConvolutionFwdAlgoWinograd:ConvBinWinogradRxSf3x2,3.96869,0,miopenConvolutionFwdAlgoWinograd,<unused>;miopenConvolutionFwdAlgoGEMM:GemmFwd1x1_0_1,2.9138,0,miopenConvolutionFwdAlgoGEMM,<unused>
1024-14-14-1x1-256-14-14-64-0x0-1x1-1x1-0-NCHW-FP32-F=miopenConvolutionFwdAlgoImplicitGEMM:ConvHipImplicitGemmV4R1Fwd,0.73393,0,miopenConvolutionFwdAlgoImplicitGEMM,<unused>;miopenConvolutionFwdAlgoDirect:ConvOclDirectFwd1x1,0.897132,0,miopenConvolutionFwdAlgoDirect,<unused>;miopenConvolutionFwdAlgoWinograd:ConvBinWinogradRxSf3x2,1.43154,0,miopenConvolutionFwdAlgoWinograd,<unused>;miopenConvolutionFwdAlgoGEMM:GemmFwd1x1_0_1,0.914092,0,miopenConvolutionFwdAlgoGEMM,<unused>
256-14-14-3x3-256-14-14-64-1x1-1x1-1x1-0-NCHW-FP32-F=miopenConvolutionFwdAlgoWinograd:ConvBinWinogradRxSf2x3g1,0.75377,0,miopenConvolutionFwdAlgoWinograd,<unused>
256-14-14-1x1-1024-14-14-64-0x0-1x1-1x1-0-NCHW-FP32-F=miopenConvolutionFwdAlgoImplicitGEMM:ConvHipImplicitGemmV4R1Fwd,0.659689,0,miopenConvolutionFwdAlgoImplicitGEMM,<unused>;miopenConvolutionFwdAlgoDirect:ConvOclDirectFwd1x1,0.73729,0,miopenConvolutionFwdAlgoDirect,<unused>;miopenConvolutionFwdAlgoWinograd:ConvBinWinogradRxSf3x2,1.4941,0,miopenConvolutionFwdAlgoWinograd,<unused>;miopenConvolutionFwdAlgoGEMM:GemmFwd1x1_0_1,0.898252,0,miopenConvolutionFwdAlgoGEMM,<unused>
1024-14-14-1x1-512-14-14-64-0x0-1x1-1x1-0-NCHW-FP32-F=miopenConvolutionFwdAlgoImplicitGEMM:ConvHipImplicitGemmV4R1Fwd,1.30016,0,miopenConvolutionFwdAlgoImplicitGEMM,<unused>;miopenConvolutionFwdAlgoDirect:ConvOclDirectFwd1x1,1.56528,0,miopenConvolutionFwdAlgoDirect,<unused>;miopenConvolutionFwdAlgoWinograd:ConvBinWinogradRxSf3x2,2.81968,0,miopenConvolutionFwdAlgoWinograd,<unused>;miopenConvolutionFwdAlgoGEMM:GemmFwd1x1_0_1,2.50752,0,miopenConvolutionFwdAlgoGEMM,<unused>
512-14-14-3x3-512-7-7-64-1x1-2x2-1x1-0-NCHW-FP32-F=miopenConvolutionFwdAlgoImplicitGEMM:ConvHipImplicitGemmV4R1Fwd,1.58512,0,miopenConvolutionFwdAlgoImplicitGEMM,<unused>;miopenConvolutionFwdAlgoDirect:ConvOclDirectFwd,15.0261,0,miopenConvolutionFwdAlgoDirect,<unused>;miopenConvolutionFwdAlgoWinograd:ConvBinWinogradRxSf2x3g1,3.85904,0,miopenConvolutionFwdAlgoWinograd,<unused>;miopenConvolutionFwdAlgoGEMM:GemmFwdRest,25.9584,903168,miopenConvolutionFwdAlgoGEMM,<unused>
1536-7-7-1x1-2048-7-7-64-0x0-1x1-1x1-0-NCHW-FP32-F=miopenConvolutionFwdAlgoImplicitGEMM:ConvHipImplicitGemmV4R1Fwd,1.91234,0,miopenConvolutionFwdAlgoImplicitGEMM,<unused>;miopenConvolutionFwdAlgoDirect:ConvAsm1x1U,2.96531,0,miopenConvolutionFwdAlgoDirect,<unused>;miopenConvolutionFwdAlgoWinograd:ConvBinWinogradRxSf3x2,5.08006,0,miopenConvolutionFwdAlgoWinograd,<unused>;miopenConvolutionFwdAlgoGEMM:GemmFwd1x1_0_1,3.99253,0,miopenConvolutionFwdAlgoGEMM,<unused>
2048-7-7-1x1-512-7-7-64-0x0-1x1-1x1-0-NCHW-FP32-F=miopenConvolutionFwdAlgoImplicitGEMM:ConvHipImplicitGemmV4R1Fwd,0.88177,0,miopenConvolutionFwdAlgoImplicitGEMM,<unused>;miopenConvolutionFwdAlgoDirect:ConvAsm1x1U,1.08545,0,miopenConvolutionFwdAlgoDirect,<unused>;miopenConvolutionFwdAlgoWinograd:ConvBinWinogradRxSf3x2,1.99874,0,miopenConvolutionFwdAlgoWinograd,<unused>;miopenConvolutionFwdAlgoGEMM:GemmFwd1x1_0_1,2.29107,0,miopenConvolutionFwdAlgoGEMM,<unused>
512-7-7-3x3-512-7-7-64-1x1-1x1-1x1-0-NCHW-FP32-F=miopenConvolutionFwdAlgoWinograd:ConvBinWinogradRxSf2x3g1,0.948011,0,miopenConvolutionFwdAlgoWinograd,<unused>
512-7-7-1x1-2048-7-7-64-0x0-1x1-1x1-0-NCHW-FP32-F=miopenConvolutionFwdAlgoImplicitGEMM:ConvHipImplicitGemmV4R1Fwd,0.673768,0,miopenConvolutionFwdAlgoImplicitGEMM,<unused>;miopenConvolutionFwdAlgoDirect:ConvAsm1x1U,0.938251,0,miopenConvolutionFwdAlgoDirect,<unused>;miopenConvolutionFwdAlgoWinograd:ConvBinWinogradRxSf3x2,2.05714,0,miopenConvolutionFwdAlgoWinograd,<unused>;miopenConvolutionFwdAlgoGEMM:GemmFwd1x1_0_1,1.35746,0,miopenConvolutionFwdAlgoGEMM,<unused>
3-224-224-7x7-64-112-112-64-3x3-2x2-1x1-0-NCHW-FP16-F=miopenConvolutionFwdAlgoImplicitGEMM:ConvMlirIgemmFwd,5.40017,0,miopenConvolutionFwdAlgoImplicitGEMM,<unused>;miopenConvolutionFwdAlgoDirect:ConvOclDirectFwdGen,3.0704,0,miopenConvolutionFwdAlgoDirect,<unused>;miopenConvolutionFwdAlgoWinograd:ConvBinWinogradRxSf2x3g1,2.49024,0,miopenConvolutionFwdAlgoWinograd,<unused>;miopenConvolutionFwdAlgoGEMM:GemmFwdRest,6.2976,3687936,miopenConvolutionFwdAlgoGEMM,<unused>
64-56-56-1x1-64-56-56-64-0x0-1x1-1x1-0-NCHW-FP16-F=miopenConvolutionFwdAlgoImplicitGEMM:ConvHipImplicitGemmV4R1Fwd,0.15984,0,miopenConvolutionFwdAlgoImplicitGEMM,<unused>;miopenConvolutionFwdAlgoDirect:ConvAsm1x1U,0.144,0,miopenConvolutionFwdAlgoDirect,<unused>;miopenConvolutionFwdAlgoWinograd:ConvBinWinogradRxSf3x2,0.33552,0,miopenConvolutionFwdAlgoWinograd,<unused>;miopenConvolutionFwdAlgoGEMM:GemmFwd1x1_0_1,0.12816,0,miopenConvolutionFwdAlgoGEMM,<unused>
64-56-56-3x3-64-56-56-64-1x1-1x1-1x1-0-NCHW-FP16-F=miopenConvolutionFwdAlgoImplicitGEMM:ConvHipImplicitGemmV4R1Fwd,0.958881,0,miopenConvolutionFwdAlgoImplicitGEMM,<unused>;miopenConvolutionFwdAlgoDirect:ConvOclDirectFwd,2.57792,0,miopenConvolutionFwdAlgoDirect,<unused>;miopenConvolutionFwdAlgoWinograd:ConvBinWinogradRxS,0.52016,0,miopenConvolutionFwdAlgoWinograd,<unused>;miopenConvolutionFwdAlgoGEMM:GemmFwdRest,6.68672,3612672,miopenConvolutionFwdAlgoGEMM,<unused>
128-56-56-1x1-256-56-56-64-0x0-1x1-1x1-0-NCHW-FP16-F=miopenConvolutionFwdAlgoImplicitGEMM:ConvHipImplicitGemmV4R1Fwd,1.20784,0,miopenConvolutionFwdAlgoImplicitGEMM,<unused>;miopenConvolutionFwdAlgoDirect:ConvAsm1x1U,1.24096,0,miopenConvolutionFwdAlgoDirect,<unused>;miopenConvolutionFwdAlgoWinograd:ConvBinWinogradRxSf3x2,1.92384,0,miopenConvolutionFwdAlgoWinograd,<unused>;miopenConvolutionFwdAlgoGEMM:GemmFwd1x1_0_1,0.77136,0,miopenConvolutionFwdAlgoGEMM,<unused>
256-56-56-1x1-64-56-56-64-0x0-1x1-1x1-0-NCHW-FP16-F=miopenConvolutionFwdAlgoImplicitGEMM:ConvHipImplicitGemmV4R1Fwd,0.49104,0,miopenConvolutionFwdAlgoImplicitGEMM,<unused>;miopenConvolutionFwdAlgoDirect:ConvAsm1x1U,0.480801,0,miopenConvolutionFwdAlgoDirect,<unused>;miopenConvolutionFwdAlgoWinograd:ConvBinWinogradRxSf3x2,0.93376,0,miopenConvolutionFwdAlgoWinograd,<unused>;miopenConvolutionFwdAlgoGEMM:GemmFwd1x1_0_1,0.37136,0,miopenConvolutionFwdAlgoGEMM,<unused>
64-56-56-1x1-256-56-56-64-0x0-1x1-1x1-0-NCHW-FP16-F=miopenConvolutionFwdAlgoImplicitGEMM:ConvHipImplicitGemmV4R1Fwd,0.54352,0,miopenConvolutionFwdAlgoImplicitGEMM,<unused>;miopenConvolutionFwdAlgoDirect:ConvAsm1x1U,0.47408,0,miopenConvolutionFwdAlgoDirect,<unused>;miopenConvolutionFwdAlgoWinograd:ConvBinWinogradRxSf3x2,1.17248,0,miopenConvolutionFwdAlgoWinograd,<unused>;miopenConvolutionFwdAlgoGEMM:GemmFwd1x1_0_1,0.41968,0,miopenConvolutionFwdAlgoGEMM,<unused>
256-56-56-1x1-128-56-56-64-0x0-1x1-1x1-0-NCHW-FP16-F=miopenConvolutionFwdAlgoImplicitGEMM:ConvHipImplicitGemmV4R1Fwd,0.91568,0,miopenConvolutionFwdAlgoImplicitGEMM,<unused>;miopenConvolutionFwdAlgoDirect:ConvAsm1x1U,0.78192,0,miopenConvolutionFwdAlgoDirect,<unused>;miopenConvolutionFwdAlgoWinograd:ConvBinWinogradRxSf3x2,1.67584,0,miopenConvolutionFwdAlgoWinograd,<unused>;miopenConvolutionFwdAlgoGEMM:GemmFwd1x1_0_1,0.70768,0,miopenConvolutionFwdAlgoGEMM,<unused>
128-56-56-3x3-128-28-28-64-1x1-2x2-1x1-0-NCHW-FP16-F=miopenConvolutionFwdAlgoImplicitGEMM:ConvHipImplicitGemmV4R1Fwd,0.87392,0,miopenConvolutionFwdAlgoImplicitGEMM,<unused>;miopenConvolutionFwdAlgoDirect:ConvOclDirectFwdGen,5.29008,0,miopenConvolutionFwdAlgoDirect,<unused>;miopenConvolutionFwdAlgoWinograd:ConvBinWinogradRxS,1.99904,0,miopenConvolutionFwdAlgoWinograd,<unused>;miopenConvolutionFwdAlgoGEMM:GemmFwdRest,8.07936,1806336,miopenConvolutionFwdAlgoGEMM,<unused>
384-28-28-1x1-512-28-28-64-0x0-1x1-1x1-0-NCHW-FP16-F=miopenConvolutionFwdAlgoImplicitGEMM:ConvHipImplicitGemmV4R1Fwd,1.3104,0,miopenConvolutionFwdAlgoImplicitGEMM,<unused>;miopenConvolutionFwdAlgoDirect:ConvAsm1x1U,1.33648,0,miopenConvolutionFwdAlgoDirect,<unused>;miopenConvolutionFwdAlgoWinograd:ConvBinWinogradRxSf3x2,2.79872,0,miopenConvolutionFwdAlgoWinograd,<unused>;miopenConvolutionFwdAlgoGEMM:GemmFwd1x1_0_1,1.8888,0,miopenConvolutionFwdAlgoGEMM,<unused>
512-28-28-1x1-128-28-28-64-0x0-1x1-1x1-0-NCHW-FP16-F=miopenConvolutionFwdAlgoImplicitGEMM:ConvHipImplicitGemmV4R1Fwd,0.61968,0,miopenConvolutionFwdAlgoImplicitGEMM,<unused>;miopenConvolutionFwdAlgoDirect:ConvAsm1x1U,0.60496,0,miopenConvolutionFwdAlgoDirect,<unused>;miopenConvolutionFwdAlgoWinograd:ConvBinWinogradRxSf3x2,1.00992,0,miopenConvolutionFwdAlgoWinograd,<unused>;miopenConvolutionFwdAlgoGEMM:GemmFwd1x1_0_1,0.44976,0,miopenConvolutionFwdAlgoGEMM,<unused>
128-28-28-3x3-128-28-28-64-1x1-1x1-1x1-0-NCHW-FP16-F=miopenConvolutionFwdAlgoImplicitGEMM:ConvHipImplicitGemmV4R1Fwd,0.90656,0,miopenConvolutionFwdAlgoImplicitGEMM,<unused>;miopenConvolutionFwdAlgoDirect:ConvOclDirectFwd,2.0776,0,miopenConvolutionFwdAlgoDirect,<unused>;miopenConvolutionFwdAlgoWinograd:ConvBinWinogradRxSf2x3g1,0.48224,0,miopenConvolutionFwdAlgoWinograd,<unused>;miopenConvolutionFwdAlgoGEMM:GemmFwdRest,7.58771,1806336,miopenConvolutionFwdAlgoGEMM,<unused>
128-28-28-1x1-512-28-28-64-0x0-1x1-1x1-0-NCHW-FP16-F=miopenConvolutionFwdAlgoImplicitGEMM:ConvHipImplicitGemmV4R1Fwd,0.48096,0,miopenConvolutionFwdAlgoImplicitGEMM,<unused>;miopenConvolutionFwdAlgoDirect:ConvAsm1x1U,0.51088,0,miopenConvolutionFwdAlgoDirect,<unused>;miopenConvolutionFwdAlgoWinograd:ConvBinWinogradRxSf3x2,1.18336,0,miopenConvolutionFwdAlgoWinograd,<unused>;miopenConvolutionFwdAlgoGEMM:GemmFwd1x1_0_1,0.40352,0,miopenConvolutionFwdAlgoGEMM,<unused>
512-28-28-1x1-256-28-28-64-0x0-1x1-1x1-0-NCHW-FP16-F=miopenConvolutionFwdAlgoImplicitGEMM:ConvHipImplicitGemmV4R1Fwd,0.90032,0,miopenConvolutionFwdAlgoImplicitGEMM,<unused>;miopenConvolutionFwdAlgoDirect:ConvAsm1x1U,1.01712,0,miopenConvolutionFwdAlgoDirect,<unused>;miopenConvolutionFwdAlgoWinograd:ConvBinWinogradRxSf3x2,1.85648,0,miopenConvolutionFwdAlgoWinograd,<unused>;miopenConvolutionFwdAlgoGEMM:GemmFwd1x1_0_1,0.82416,0,miopenConvolutionFwdAlgoGEMM,<unused>
256-28-28-3x3-256-14-14-64-1x1-2x2-1x1-0-NCHW-FP16-F=miopenConvolutionFwdAlgoImplicitGEMM:ConvHipImplicitGemmV4R1Fwd,0.99232,0,miopenConvolutionFwdAlgoImplicitGEMM,<unused>;miopenConvolutionFwdAlgoDirect:ConvOclDirectFwdGen,6.4656,0,miopenConvolutionFwdAlgoDirect,<unused>;miopenConvolutionFwdAlgoWinograd:ConvBinWinogradRxSf2x3g1,2.35904,0,miopenConvolutionFwdAlgoWinograd,<unused>;miopenConvolutionFwdAlgoGEMM:GemmFwdRest,12.7898,903168,miopenConvolutionFwdAlgoGEMM,<unused>
768-14-14-1x1-1024-14-14-64-0x0-1x1-1x1-0-NCHW-FP16-F=miopenConvolutionFwdAlgoImplicitGEMM:ConvHipImplicitGemmV4R1Fwd,1.3896,0,miopenConvolutionFwdAlgoImplicitGEMM,<unused>;miopenConvolutionFwdAlgoDirect:ConvAsm1x1U,1.49072,0,miopenConvolutionFwdAlgoDirect,<unused>;miopenConvolutionFwdAlgoWinograd:ConvBinWinogradRxSf3x2,3.49808,0,miopenConvolutionFwdAlgoWinograd,<unused>;miopenConvolutionFwdAlgoGEMM:GemmFwd1x1_0_1,2.75154,0,miopenConvolutionFwdAlgoGEMM,<unused>
1024-14-14-1x1-256-14-14-64-0x0-1x1-1x1-0-NCHW-FP16-F=miopenConvolutionFwdAlgoImplicitGEMM:ConvHipImplicitGemmV4R1Fwd,0.71648,0,miopenConvolutionFwdAlgoImplicitGEMM,<unused>;miopenConvolutionFwdAlgoDirect:ConvAsm1x1U,0.675679,0,miopenConvolutionFwdAlgoDirect,<unused>;miopenConvolutionFwdAlgoWinograd:ConvBinWinogradRxSf3x2,1.22288,0,miopenConvolutionFwdAlgoWinograd,<unused>;miopenConvolutionFwdAlgoGEMM:GemmFwd1x1_0_1,0.6208,0,miopenConvolutionFwdAlgoGEMM,<unused>
256-14-14-3x3-256-14-14-64-1x1-1x1-1x1-0-NCHW-FP16-F=miopenConvolutionFwdAlgoImplicitGEMM:ConvHipImplicitGemmV4R1Fwd,0.94848,0,miopenConvolutionFwdAlgoImplicitGEMM,<unused>;miopenConvolutionFwdAlgoDirect:ConvOclDirectFwd,2.70352,0,miopenConvolutionFwdAlgoDirect,<unused>;miopenConvolutionFwdAlgoWinograd:ConvBinWinogradRxSf2x3g1,0.47184,0,miopenConvolutionFwdAlgoWinograd,<unused>;miopenConvolutionFwdAlgoGEMM:GemmFwdRest,12.5439,903168,miopenConvolutionFwdAlgoGEMM,<unused>
256-14-14-1x1-1024-14-14-64-0x0-1x1-1x1-0-NCHW-FP16-F=miopenConvolutionFwdAlgoImplicitGEMM:ConvHipImplicitGemmV4R1Fwd,0.553599,0,miopenConvolutionFwdAlgoImplicitGEMM,<unused>;miopenConvolutionFwdAlgoDirect:ConvAsm1x1U,0.56272,0,miopenConvolutionFwdAlgoDirect,<unused>;miopenConvolutionFwdAlgoWinograd:ConvBinWinogradRxSf3x2,1.40528,0,miopenConvolutionFwdAlgoWinograd,<unused>;miopenConvolutionFwdAlgoGEMM:GemmFwd1x1_0_1,0.46704,0,miopenConvolutionFwdAlgoGEMM,<unused>
1024-14-14-1x1-512-14-14-64-0x0-1x1-1x1-0-NCHW-FP16-F=miopenConvolutionFwdAlgoImplicitGEMM:ConvHipImplicitGemmV4R1Fwd,1.12304,0,miopenConvolutionFwdAlgoImplicitGEMM,<unused>;miopenConvolutionFwdAlgoDirect:ConvAsm1x1U,1.13424,0,miopenConvolutionFwdAlgoDirect,<unused>;miopenConvolutionFwdAlgoWinograd:ConvBinWinogradRxSf3x2,2.40368,0,miopenConvolutionFwdAlgoWinograd,<unused>;miopenConvolutionFwdAlgoGEMM:GemmFwd1x1_0_1,1.10784,0,miopenConvolutionFwdAlgoGEMM,<unused>
512-14-14-3x3-512-7-7-64-1x1-2x2-1x1-0-NCHW-FP16-F=miopenConvolutionFwdAlgoImplicitGEMM:ConvHipImplicitGemmV4R1Fwd,1.04256,0,miopenConvolutionFwdAlgoImplicitGEMM,<unused>;miopenConvolutionFwdAlgoDirect:ConvOclDirectFwdGen,11.7136,0,miopenConvolutionFwdAlgoDirect,<unused>;miopenConvolutionFwdAlgoWinograd:ConvBinWinogradRxSf2x3g1,3.35312,0,miopenConvolutionFwdAlgoWinograd,<unused>;miopenConvolutionFwdAlgoGEMM:GemmFwdRest,48.7525,451584,miopenConvolutionFwdAlgoGEMM,<unused>
1536-7-7-1x1-2048-7-7-64-0x0-1x1-1x1-0-NCHW-FP16-F=miopenConvolutionFwdAlgoImplicitGEMM:ConvHipImplicitGemmV4R1Fwd,1.91552,0,miopenConvolutionFwdAlgoImplicitGEMM,<unused>;miopenConvolutionFwdAlgoDirect:ConvAsm1x1U,2.03888,0,miopenConvolutionFwdAlgoDirect,<unused>;miopenConvolutionFwdAlgoWinograd:ConvBinWinogradRxSf3x2,3.98496,0,miopenConvolutionFwdAlgoWinograd,<unused>;miopenConvolutionFwdAlgoGEMM:GemmFwd1x1_0_1,4.98624,0,miopenConvolutionFwdAlgoGEMM,<unused>
2048-7-7-1x1-512-7-7-64-0x0-1x1-1x1-0-NCHW-FP16-F=miopenConvolutionFwdAlgoImplicitGEMM:ConvHipImplicitGemmV4R1Fwd,0.76768,0,miopenConvolutionFwdAlgoImplicitGEMM,<unused>;miopenConvolutionFwdAlgoDirect:ConvAsm1x1U,0.80544,0,miopenConvolutionFwdAlgoDirect,<unused>;miopenConvolutionFwdAlgoWinograd:ConvBinWinogradRxSf3x2,1.67232,0,miopenConvolutionFwdAlgoWinograd,<unused>;miopenConvolutionFwdAlgoGEMM:GemmFwd1x1_0_1,1.92288,0,miopenConvolutionFwdAlgoGEMM,<unused>
512-7-7-3x3-512-7-7-64-1x1-1x1-1x1-0-NCHW-FP16-F=miopenConvolutionFwdAlgoImplicitGEMM:ConvHipImplicitGemmV4R1Fwd,1.01392,0,miopenConvolutionFwdAlgoImplicitGEMM,<unused>;miopenConvolutionFwdAlgoDirect:ConvOclDirectFwd,4.68192,0,miopenConvolutionFwdAlgoDirect,<unused>;miopenConvolutionFwdAlgoWinograd:ConvBinWinogradRxS,0.61936,0,miopenConvolutionFwdAlgoWinograd,<unused>;miopenConvolutionFwdAlgoGEMM:GemmFwdRest,46.766,451584,miopenConvolutionFwdAlgoGEMM,<unused>
512-7-7-1x1-2048-7-7-64-0x0-1x1-1x1-0-NCHW-FP16-F=miopenConvolutionFwdAlgoImplicitGEMM:ConvHipImplicitGemmV4R1Fwd,0.63136,0,miopenConvolutionFwdAlgoImplicitGEMM,<unused>;miopenConvolutionFwdAlgoDirect:ConvAsm1x1U,0.68432,0,miopenConvolutionFwdAlgoDirect,<unused>;miopenConvolutionFwdAlgoWinograd:ConvBinWinogradRxSf3x2,1.58112,0,miopenConvolutionFwdAlgoWinograd,<unused>;miopenConvolutionFwdAlgoGEMM:GemmFwd1x1_0_1,1.4448,0,miopenConvolutionFwdAlgoGEMM,<unused>
3-224-224-11x11-64-55-55-64-2x2-4x4-1x1-0-NCHW-FP32-F=miopenConvolutionFwdAlgoImplicitGEMM:ConvMlirIgemmFwd,3.03792,0,miopenConvolutionFwdAlgoImplicitGEMM,<unused>;miopenConvolutionFwdAlgoDirect:ConvOclDirectFwd11x11,4.82512,0,miopenConvolutionFwdAlgoDirect,<unused>;miopenConvolutionFwdAlgoGEMM:GemmFwdRest,4.53632,4392300,miopenConvolutionFwdAlgoGEMM,<unused>
64-27-27-5x5-192-27-27-64-2x2-1x1-1x1-0-NCHW-FP32-F=miopenConvolutionFwdAlgoImplicitGEMM:ConvHipImplicitGemmV4R1Fwd,2.62512,0,miopenConvolutionFwdAlgoImplicitGEMM,<unused>;miopenConvolutionFwdAlgoDirect:ConvOclDirectFwd,13.2422,0,miopenConvolutionFwdAlgoDirect,<unused>;miopenConvolutionFwdAlgoWinograd:ConvBinWinogradRxSf2x3g1,2.14064,0,miopenConvolutionFwdAlgoWinograd,<unused>;miopenConvolutionFwdAlgoFFT:fft,1.16256,143720448,miopenConvolutionFwdAlgoFFT,<unused>;miopenConvolutionFwdAlgoGEMM:GemmFwdRest,7.46496,4665600,miopenConvolutionFwdAlgoGEMM,<unused>
192-13-13-3x3-384-13-13-64-1x1-1x1-1x1-0-NCHW-FP32-F=miopenConvolutionFwdAlgoWinograd:ConvBinWinograd3x3U,0.8216,0,miopenConvolutionFwdAlgoWinograd,<unused>
384-13-13-3x3-256-13-13-64-1x1-1x1-1x1-0-NCHW-FP32-F=miopenConvolutionFwdAlgoWinograd:ConvBinWinograd3x3U,1.10576,0,miopenConvolutionFwdAlgoWinograd,<unused>
256-13-13-3x3-256-13-13-64-1x1-1x1-1x1-0-NCHW-FP32-F=miopenConvolutionFwdAlgoWinograd:ConvBinWinograd3x3U,0.75648,0,miopenConvolutionFwdAlgoWinograd,<unused>
3-224-224-11x11-64-55-55-64-2x2-4x4-1x1-0-NCHW-FP16-F=miopenConvolutionFwdAlgoImplicitGEMM:ConvMlirIgemmFwd,3.03936,0,miopenConvolutionFwdAlgoImplicitGEMM,<unused>;miopenConvolutionFwdAlgoDirect:ConvOclDirectFwdGen,2.59664,0,miopenConvolutionFwdAlgoDirect,<unused>;miopenConvolutionFwdAlgoGEMM:GemmFwdRest,7.33184,2196150,miopenConvolutionFwdAlgoGEMM,<unused>
64-27-27-5x5-192-27-27-64-2x2-1x1-1x1-0-NCHW-FP16-F=miopenConvolutionFwdAlgoImplicitGEMM:ConvHipImplicitGemmV4R1Fwd,1.68385,0,miopenConvolutionFwdAlgoImplicitGEMM,<unused>;miopenConvolutionFwdAlgoDirect:ConvOclDirectFwd,3.34416,0,miopenConvolutionFwdAlgoDirect,<unused>;miopenConvolutionFwdAlgoWinograd:ConvBinWinogradRxSf3x2,1.6488,0,miopenConvolutionFwdAlgoWinograd,<unused>;miopenConvolutionFwdAlgoGEMM:GemmFwdRest,18.6368,2332800,miopenConvolutionFwdAlgoGEMM,<unused>
192-13-13-3x3-384-13-13-64-1x1-1x1-1x1-0-NCHW-FP16-F=miopenConvolutionFwdAlgoImplicitGEMM:ConvHipImplicitGemmV4R1Fwd,0.86384,0,miopenConvolutionFwdAlgoImplicitGEMM,<unused>;miopenConvolutionFwdAlgoDirect:ConvOclDirectFwd,2.63008,0,miopenConvolutionFwdAlgoDirect,<unused>;miopenConvolutionFwdAlgoWinograd:ConvBinWinogradRxSf2x3g1,0.5096,0,miopenConvolutionFwdAlgoWinograd,<unused>;miopenConvolutionFwdAlgoGEMM:GemmFwdRest,19.3946,584064,miopenConvolutionFwdAlgoGEMM,<unused>
384-13-13-3x3-256-13-13-64-1x1-1x1-1x1-0-NCHW-FP16-F=miopenConvolutionFwdAlgoImplicitGEMM:ConvHipImplicitGemmV4R1Fwd,1.22128,0,miopenConvolutionFwdAlgoImplicitGEMM,<unused>;miopenConvolutionFwdAlgoDirect:ConvOclDirectFwd,3.8784,0,miopenConvolutionFwdAlgoDirect,<unused>;miopenConvolutionFwdAlgoWinograd:ConvBinWinogradRxSf2x3g1,0.67632,0,miopenConvolutionFwdAlgoWinograd,<unused>;miopenConvolutionFwdAlgoGEMM:GemmFwdRest,35.7786,1168128,miopenConvolutionFwdAlgoGEMM,<unused>
256-13-13-3x3-256-13-13-64-1x1-1x1-1x1-0-NCHW-FP16-F=miopenConvolutionFwdAlgoImplicitGEMM:ConvHipImplicitGemmV4R1Fwd,0.82128,0,miopenConvolutionFwdAlgoImplicitGEMM,<unused>;miopenConvolutionFwdAlgoDirect:ConvOclDirectFwd,2.5912,0,miopenConvolutionFwdAlgoDirect,<unused>;miopenConvolutionFwdAlgoWinograd:ConvBinWinogradRxSf2x3g1,0.47104,0,miopenConvolutionFwdAlgoWinograd,<unused>;miopenConvolutionFwdAlgoGEMM:GemmFwdRest,27.3408,778752,miopenConvolutionFwdAlgoGEMM,<unused>
3-224-224-7x7-64-112-112-32-3x3-2x2-1x1-0-NCHW-FP32-F=miopenConvolutionFwdAlgoImplicitGEMM:ConvMlirIgemmFwd,2.77889,0,miopenConvolutionFwdAlgoImplicitGEMM,<unused>;miopenConvolutionFwdAlgoDirect:ConvAsm7x7c3h224w224k64u2v2p3q3f1,0.899043,0,miopenConvolutionFwdAlgoDirect,<unused>;miopenConvolutionFwdAlgoWinograd:ConvBinWinogradRxS,1.25536,0,miopenConvolutionFwdAlgoWinograd,<unused>;miopenConvolutionFwdAlgoGEMM:GemmFwdRest,2.2784,7375872,miopenConvolutionFwdAlgoGEMM,<unused>
64-56-56-1x1-128-56-56-32-0x0-1x1-1x1-0-NCHW-FP32-F=miopenConvolutionFwdAlgoImplicitGEMM:ConvHipImplicitGemmV4R1Fwd,0.21184,0,miopenConvolutionFwdAlgoImplicitGEMM,<unused>;miopenConvolutionFwdAlgoDirect:ConvOclDirectFwd1x1,0.20912,0,miopenConvolutionFwdAlgoDirect,<unused>;miopenConvolutionFwdAlgoWinograd:ConvBinWinogradRxSf3x2,0.45328,0,miopenConvolutionFwdAlgoWinograd,<unused>;miopenConvolutionFwdAlgoGEMM:GemmFwd1x1_0_1,0.24,0,miopenConvolutionFwdAlgoGEMM,<unused>
128-56-56-3x3-32-56-56-32-1x1-1x1-1x1-0-NCHW-FP32-F=miopenConvolutionFwdAlgoWinograd:ConvBinWinograd3x3U,0.408478,0,miopenConvolutionFwdAlgoWinograd,<unused>
96-56-56-1x1-128-56-56-32-0x0-1x1-1x1-0-NCHW-FP32-F=miopenConvolutionFwdAlgoImplicitGEMM:ConvHipImplicitGemmV4R1Fwd,0.250239,0,miopenConvolutionFwdAlgoImplicitGEMM,<unused>;miopenConvolutionFwdAlgoDirect:ConvAsm1x1U,0.346879,0,miopenConvolutionFwdAlgoDirect,<unused>;miopenConvolutionFwdAlgoWinograd:ConvBinWinogradRxSf3x2,0.66544,0,miopenConvolutionFwdAlgoWinograd,<unused>;miopenConvolutionFwdAlgoGEMM:GemmFwd1x1_0_1,0.3304,0,miopenConvolutionFwdAlgoGEMM,<unused>
128-56-56-1x1-128-56-56-32-0x0-1x1-1x1-0-NCHW-FP32-F=miopenConvolutionFwdAlgoImplicitGEMM:ConvHipImplicitGemmV4R1Fwd,0.33376,0,miopenConvolutionFwdAlgoImplicitGEMM,<unused>;miopenConvolutionFwdAlgoDirect:ConvOclDirectFwd1x1,0.39456,0,miopenConvolutionFwdAlgoDirect,<unused>;miopenConvolutionFwdAlgoWinograd:ConvBinWinogradRxSf3x2,0.75216,0,miopenConvolutionFwdAlgoWinograd,<unused>;miopenConvolutionFwdAlgoGEMM:GemmFwd1x1_0_1,0.42144,0,miopenConvolutionFwdAlgoGEMM,<unused>
160-56-56-1x1-128-56-56-32-0x0-1x1-1x1-0-NCHW-FP32-F=miopenConvolutionFwdAlgoImplicitGEMM:ConvHipImplicitGemmV4R1Fwd,0.38528,0,miopenConvolutionFwdAlgoImplicitGEMM,<unused>;miopenConvolutionFwdAlgoDirect:ConvAsm1x1U,0.57664,0,miopenConvolutionFwdAlgoDirect,<unused>;miopenConvolutionFwdAlgoWinograd:ConvBinWinogradRxSf3x2,0.90304,0,miopenConvolutionFwdAlgoWinograd,<unused>;miopenConvolutionFwdAlgoGEMM:GemmFwd1x1_0_1,0.5184,0,miopenConvolutionFwdAlgoGEMM,<unused>
192-56-56-1x1-128-56-56-32-0x0-1x1-1x1-0-NCHW-FP32-F=miopenConvolutionFwdAlgoImplicitGEMM:ConvHipImplicitGemmV4R1Fwd,0.46912,0,miopenConvolutionFwdAlgoImplicitGEMM,<unused>;miopenConvolutionFwdAlgoDirect:ConvAsm1x1U,0.6208,0,miopenConvolutionFwdAlgoDirect,<unused>;miopenConvolutionFwdAlgoWinograd:ConvBinWinogradRxSf3x2,1.0576,0,miopenConvolutionFwdAlgoWinograd,<unused>;miopenConvolutionFwdAlgoGEMM:GemmFwd1x1_0_1,0.52432,0,miopenConvolutionFwdAlgoGEMM,<unused>
224-56-56-1x1-128-56-56-32-0x0-1x1-1x1-0-NCHW-FP32-F=miopenConvolutionFwdAlgoImplicitGEMM:ConvHipImplicitGemmV4R1Fwd,0.580479,0,miopenConvolutionFwdAlgoImplicitGEMM,<unused>;miopenConvolutionFwdAlgoDirect:ConvAsm1x1U,0.79456,0,miopenConvolutionFwdAlgoDirect,<unused>;miopenConvolutionFwdAlgoWinograd:ConvBinWinogradRxSf3x2,1.20464,0,miopenConvolutionFwdAlgoWinograd,<unused>;miopenConvolutionFwdAlgoGEMM:GemmFwd1x1_0_1,0.6032,0,miopenConvolutionFwdAlgoGEMM,<unused>
256-56-56-1x1-128-56-56-32-0x0-1x1-1x1-0-NCHW-FP32-F=miopenConvolutionFwdAlgoImplicitGEMM:ConvHipImplicitGemmV4R1Fwd,0.653602,0,miopenConvolutionFwdAlgoImplicitGEMM,<unused>;miopenConvolutionFwdAlgoDirect:ConvAsm1x1U,0.684961,0,miopenConvolutionFwdAlgoDirect,<unused>;miopenConvolutionFwdAlgoWinograd:ConvBinWinogradRxSf3x2,1.35504,0,miopenConvolutionFwdAlgoWinograd,<unused>;miopenConvolutionFwdAlgoGEMM:GemmFwd1x1_0_1,0.692641,0,miopenConvolutionFwdAlgoGEMM,<unused>
128-28-28-1x1-128-28-28-32-0x0-1x1-1x1-0-NCHW-FP32-F=miopenConvolutionFwdAlgoImplicitGEMM:ConvHipImplicitGemmV4R1Fwd,0.108159,0,miopenConvolutionFwdAlgoImplicitGEMM,<unused>;miopenConvolutionFwdAlgoDirect:ConvAsm1x1U,0.12464,0,miopenConvolutionFwdAlgoDirect,<unused>;miopenConvolutionFwdAlgoWinograd:ConvBinWinogradRxSf3x2,0.24048,0,miopenConvolutionFwdAlgoWinograd,<unused>;miopenConvolutionFwdAlgoGEMM:GemmFwd1x1_0_1,0.11952,0,miopenConvolutionFwdAlgoGEMM,<unused>
128-28-28-3x3-32-28-28-32-1x1-1x1-1x1-0-NCHW-FP32-F=miopenConvolutionFwdAlgoWinograd:ConvBinWinograd3x3U,0.132958,0,miopenConvolutionFwdAlgoWinograd,<unused>
160-28-28-1x1-128-28-28-32-0x0-1x1-1x1-0-NCHW-FP32-F=miopenConvolutionFwdAlgoImplicitGEMM:ConvHipImplicitGemmV4R1Fwd,0.12464,0,miopenConvolutionFwdAlgoImplicitGEMM,<unused>;miopenConvolutionFwdAlgoDirect:ConvAsm1x1U,0.14784,0,miopenConvolutionFwdAlgoDirect,<unused>;miopenConvolutionFwdAlgoWinograd:ConvBinWinogradRxSf3x2,0.28368,0,miopenConvolutionFwdAlgoWinograd,<unused>;miopenConvolutionFwdAlgoGEMM:GemmFwd1x1_0_1,0.14128,0,miopenConvolutionFwdAlgoGEMM,<unused>
192-28-28-1x1-128-28-28-32-0x0-1x1-1x1-0-NCHW-FP32-F=miopenConvolutionFwdAlgoImplicitGEMM:ConvHipImplicitGemmV4R1Fwd,0.15184,0,miopenConvolutionFwdAlgoImplicitGEMM,<unused>;miopenConvolutionFwdAlgoDirect:ConvAsm1x1U,0.1904,0,miopenConvolutionFwdAlgoDirect,<unused>;miopenConvolutionFwdAlgoWinograd:ConvBinWinogradRxSf3x2,0.32496,0,miopenConvolutionFwdAlgoWinograd,<unused>;miopenConvolutionFwdAlgoGEMM:GemmFwd1x1_0_1,0.16544,0,miopenConvolutionFwdAlgoGEMM,<unused>
224-28-28-1x1-128-28-28-32-0x0-1x1-1x1-0-NCHW-FP32-F=miopenConvolutionFwdAlgoImplicitGEMM:ConvHipImplicitGemmV4R1Fwd,0.17072,0,miopenConvolutionFwdAlgoImplicitGEMM,<unused>;miopenConvolutionFwdAlgoDirect:ConvAsm1x1U,0.21072,0,miopenConvolutionFwdAlgoDirect,<unused>;miopenConvolutionFwdAlgoWinograd:ConvBinWinogradRxSf3x2,0.36624,0,miopenConvolutionFwdAlgoWinograd,<unused>;miopenConvolutionFwdAlgoGEMM:GemmFwd1x1_0_1,0.18688,0,miopenConvolutionFwdAlgoGEMM,<unused>
256-28-28-1x1-128-28-28-32-0x0-1x1-1x1-0-NCHW-FP32-F=miopenConvolutionFwdAlgoImplicitGEMM:ConvHipImplicitGemmV4R1Fwd,0.17328,0,miopenConvolutionFwdAlgoImplicitGEMM,<unused>;miopenConvolutionFwdAlgoDirect:ConvAsm1x1U,0.2312,0,miopenConvolutionFwdAlgoDirect,<unused>;miopenConvolutionFwdAlgoWinograd:ConvBinWinogradRxSf3x2,0.40976,0,miopenConvolutionFwdAlgoWinograd,<unused>;miopenConvolutionFwdAlgoGEMM:GemmFwd1x1_0_1,0.20912,0,miopenConvolutionFwdAlgoGEMM,<unused>
288-28-28-1x1-128-28-28-32-0x0-1x1-1x1-0-NCHW-FP32-F=miopenConvolutionFwdAlgoImplicitGEMM:ConvHipImplicitGemmV4R1Fwd,0.18288,0,miopenConvolutionFwdAlgoImplicitGEMM,<unused>;miopenConvolutionFwdAlgoDirect:ConvAsm1x1U,0.28832,0,miopenConvolutionFwdAlgoDirect,<unused>;miopenConvolutionFwdAlgoWinograd:ConvBinWinogradRxSf3x2,0.45248,0,miopenConvolutionFwdAlgoWinograd,<unused>;miopenConvolutionFwdAlgoGEMM:GemmFwd1x1_0_1,0.23376,0,miopenConvolutionFwdAlgoGEMM,<unused>
320-28-28-1x1-128-28-28-32-0x0-1x1-1x1-0-NCHW-FP32-F=miopenConvolutionFwdAlgoImplicitGEMM:ConvHipImplicitGemmV4R1Fwd,0.21296,0,miopenConvolutionFwdAlgoImplicitGEMM,<unused>;miopenConvolutionFwdAlgoDirect:ConvAsm1x1U,0.25808,0,miopenConvolutionFwdAlgoDirect,<unused>;miopenConvolutionFwdAlgoWinograd:ConvBinWinogradRxSf3x2,0.492,0,miopenConvolutionFwdAlgoWinograd,<unused>;miopenConvolutionFwdAlgoGEMM:GemmFwd1x1_0_1,0.25616,0,miopenConvolutionFwdAlgoGEMM,<unused>
352-28-28-1x1-128-28-28-32-0x0-1x1-1x1-0-NCHW-FP32-F=miopenConvolutionFwdAlgoImplicitGEMM:ConvHipImplicitGemmV4R1Fwd,0.21936,0,miopenConvolutionFwdAlgoImplicitGEMM,<unused>;miopenConvolutionFwdAlgoDirect:ConvAsm1x1U,0.33888,0,miopenConvolutionFwdAlgoDirect,<unused>;miopenConvolutionFwdAlgoWinograd:ConvBinWinogradRxSf3x2,0.53536,0,miopenConvolutionFwdAlgoWinograd,<unused>;miopenConvolutionFwdAlgoGEMM:GemmFwd1x1_0_1,0.27712,0,miopenConvolutionFwdAlgoGEMM,<unused>
384-28-28-1x1-128-28-28-32-0x0-1x1-1x1-0-NCHW-FP32-F=miopenConvolutionFwdAlgoImplicitGEMM:ConvHipImplicitGemmV4R1Fwd,0.248799,0,miopenConvolutionFwdAlgoImplicitGEMM,<unused>;miopenConvolutionFwdAlgoDirect:ConvAsm1x1U,0.452639,0,miopenConvolutionFwdAlgoDirect,<unused>;miopenConvolutionFwdAlgoWinograd:ConvBinWinogradRxSf3x2,0.576639,0,miopenConvolutionFwdAlgoWinograd,<unused>;miopenConvolutionFwdAlgoGEMM:GemmFwd1x1_0_1,0.68752,0,miopenConvolutionFwdAlgoGEMM,<unused>
416-28-28-1x1-128-28-28-32-0x0-1x1-1x1-0-NCHW-FP32-F=miopenConvolutionFwdAlgoImplicitGEMM:ConvHipImplicitGemmV4R1Fwd,0.2568,0,miopenConvolutionFwdAlgoImplicitGEMM,<unused>;miopenConvolutionFwdAlgoDirect:ConvAsm1x1U,0.39808,0,miopenConvolutionFwdAlgoDirect,<unused>;miopenConvolutionFwdAlgoWinograd:ConvBinWinogradRxSf3x2,0.62016,0,miopenConvolutionFwdAlgoWinograd,<unused>;miopenConvolutionFwdAlgoGEMM:GemmFwd1x1_0_1,0.32048,0,miopenConvolutionFwdAlgoGEMM,<unused>
448-28-28-1x1-128-28-28-32-0x0-1x1-1x1-0-NCHW-FP32-F=miopenConvolutionFwdAlgoImplicitGEMM:ConvHipImplicitGemmV4R1Fwd,0.28736,0,miopenConvolutionFwdAlgoImplicitGEMM,<unused>;miopenConvolutionFwdAlgoDirect:ConvAsm1x1U,0.427039,0,miopenConvolutionFwdAlgoDirect,<unused>;miopenConvolutionFwdAlgoWinograd:ConvBinWinogradRxSf3x2,0.660479,0,miopenConvolutionFwdAlgoWinograd,<unused>;miopenConvolutionFwdAlgoGEMM:GemmFwd1x1_0_1,0.35408,0,miopenConvolutionFwdAlgoGEMM,<unused>
480-28-28-1x1-128-28-28-32-0x0-1x1-1x1-0-NCHW-FP32-F=miopenConvolutionFwdAlgoImplicitGEMM:ConvHipImplicitGemmV4R1Fwd,0.293119,0,miopenConvolutionFwdAlgoImplicitGEMM,<unused>;miopenConvolutionFwdAlgoDirect:ConvAsm1x1U,0.43488,0,miopenConvolutionFwdAlgoDirect,<unused>;miopenConvolutionFwdAlgoWinograd:ConvBinWinogradRxSf3x2,0.705279,0,miopenConvolutionFwdAlgoWinograd,<unused>;miopenConvolutionFwdAlgoGEMM:GemmFwd1x1_0_1,0.36624,0,miopenConvolutionFwdAlgoGEMM,<unused>
512-28-28-1x1-256-28-28-32-0x0-1x1-1x1-0-NCHW-FP32-F=miopenConvolutionFwdAlgoImplicitGEMM:ConvHipImplicitGemmV4R1Fwd,0.614879,0,miopenConvolutionFwdAlgoImplicitGEMM,<unused>;miopenConvolutionFwdAlgoDirect:ConvOclDirectFwd1x1,0.677599,0,miopenConvolutionFwdAlgoDirect,<unused>;miopenConvolutionFwdAlgoWinograd:ConvBinWinogradRxSf3x2,1.45424,0,miopenConvolutionFwdAlgoWinograd,<unused>;miopenConvolutionFwdAlgoGEMM:GemmFwd1x1_0_1,0.736959,0,miopenConvolutionFwdAlgoGEMM,<unused>
256-14-14-1x1-128-14-14-32-0x0-1x1-1x1-0-NCHW-FP32-F=miopenConvolutionFwdAlgoImplicitGEMM:ConvHipImplicitGemmV4R1Fwd,0.07104,0,miopenConvolutionFwdAlgoImplicitGEMM,<unused>;miopenConvolutionFwdAlgoDirect:ConvAsm1x1U,0.096959,0,miopenConvolutionFwdAlgoDirect,<unused>;miopenConvolutionFwdAlgoWinograd:ConvBinWinogradRxSf3x2,0.14272,0,miopenConvolutionFwdAlgoWinograd,<unused>;miopenConvolutionFwdAlgoGEMM:GemmFwd1x1_0_1,0.2152,0,miopenConvolutionFwdAlgoGEMM,<unused>
128-14-14-3x3-32-14-14-32-1x1-1x1-1x1-0-NCHW-FP32-F=miopenConvolutionFwdAlgoWinograd:ConvBinWinograd3x3U,0.051678,0,miopenConvolutionFwdAlgoWinograd,<unused>
288-14-14-1x1-128-14-14-32-0x0-1x1-1x1-0-NCHW-FP32-F=miopenConvolutionFwdAlgoImplicitGEMM:ConvHipImplicitGemmV4R1Fwd,0.0776,0,miopenConvolutionFwdAlgoImplicitGEMM,<unused>;miopenConvolutionFwdAlgoDirect:ConvAsm1x1U,0.094719,0,miopenConvolutionFwdAlgoDirect,<unused>;miopenConvolutionFwdAlgoWinograd:ConvBinWinogradRxSf3x2,0.15344,0,miopenConvolutionFwdAlgoWinograd,<unused>;miopenConvolutionFwdAlgoGEMM:GemmFwd1x1_0_1,0.22288,0,miopenConvolutionFwdAlgoGEMM,<unused>
320-14-14-1x1-128-14-14-32-0x0-1x1-1x1-0-NCHW-FP32-F=miopenConvolutionFwdAlgoImplicitGEMM:ConvHipImplicitGemmV4R1Fwd,0.08624,0,miopenConvolutionFwdAlgoImplicitGEMM,<unused>;miopenConvolutionFwdAlgoDirect:ConvAsm1x1U,0.1208,0,miopenConvolutionFwdAlgoDirect,<unused>;miopenConvolutionFwdAlgoWinograd:ConvBinWinogradRxSf3x2,0.1672,0,miopenConvolutionFwdAlgoWinograd,<unused>;miopenConvolutionFwdAlgoGEMM:GemmFwd1x1_0_1,0.23808,0,miopenConvolutionFwdAlgoGEMM,<unused>
352-14-14-1x1-128-14-14-32-0x0-1x1-1x1-0-NCHW-FP32-F=miopenConvolutionFwdAlgoImplicitGEMM:ConvHipImplicitGemmV4R1Fwd,0.09136,0,miopenConvolutionFwdAlgoImplicitGEMM,<unused>;miopenConvolutionFwdAlgoDirect:ConvAsm1x1U,0.12496,0,miopenConvolutionFwdAlgoDirect,<unused>;miopenConvolutionFwdAlgoWinograd:ConvBinWinogradRxSf3x2,0.1784,0,miopenConvolutionFwdAlgoWinograd,<unused>;miopenConvolutionFwdAlgoGEMM:GemmFwd1x1_0_1,0.25136,0,miopenConvolutionFwdAlgoGEMM,<unused>
384-14-14-1x1-128-14-14-32-0x0-1x1-1x1-0-NCHW-FP32-F=miopenConvolutionFwdAlgoImplicitGEMM:ConvHipImplicitGemmV4R1Fwd,0.12528,0,miopenConvolutionFwdAlgoImplicitGEMM,<unused>;miopenConvolutionFwdAlgoDirect:ConvAsm1x1U,0.14,0,miopenConvolutionFwdAlgoDirect,<unused>;miopenConvolutionFwdAlgoWinograd:ConvBinWinogradRxSf3x2,0.1904,0,miopenConvolutionFwdAlgoWinograd,<unused>;miopenConvolutionFwdAlgoGEMM:GemmFwd1x1_0_1,0.144,0,miopenConvolutionFwdAlgoGEMM,<unused>
416-14-14-1x1-128-14-14-32-0x0-1x1-1x1-0-NCHW-FP32-F=miopenConvolutionFwdAlgoImplicitGEMM:ConvHipImplicitGemmV4R1Fwd,0.10432,0,miopenConvolutionFwdAlgoImplicitGEMM,<unused>;miopenConvolutionFwdAlgoDirect:ConvAsm1x1U,0.151679,0,miopenConvolutionFwdAlgoDirect,<unused>;miopenConvolutionFwdAlgoWinograd:ConvBinWinogradRxSf3x2,0.20016,0,miopenConvolutionFwdAlgoWinograd,<unused>;miopenConvolutionFwdAlgoGEMM:GemmFwd1x1_0_1,0.15024,0,miopenConvolutionFwdAlgoGEMM,<unused>
448-14-14-1x1-128-14-14-32-0x0-1x1-1x1-0-NCHW-FP32-F=miopenConvolutionFwdAlgoImplicitGEMM:ConvHipImplicitGemmV4R1Fwd,0.11136,0,miopenConvolutionFwdAlgoImplicitGEMM,<unused>;miopenConvolutionFwdAlgoDirect:ConvAsm1x1U,0.16128,0,miopenConvolutionFwdAlgoDirect,<unused>;miopenConvolutionFwdAlgoWinograd:ConvBinWinogradRxSf3x2,0.2144,0,miopenConvolutionFwdAlgoWinograd,<unused>;miopenConvolutionFwdAlgoGEMM:GemmFwd1x1_0_1,0.15952,0,miopenConvolutionFwdAlgoGEMM,<unused>
480-14-14-1x1-128-14-14-32-0x0-1x1-1x1-0-NCHW-FP32-F=miopenConvolutionFwdAlgoImplicitGEMM:ConvHipImplicitGemmV4R1Fwd,0.119359,0,miopenConvolutionFwdAlgoImplicitGEMM,<unused>;miopenConvolutionFwdAlgoDirect:ConvAsm1x1U,0.16224,0,miopenConvolutionFwdAlgoDirect,<unused>;miopenConvolutionFwdAlgoWinograd:ConvBinWinogradRxSf3x2,0.2264,0,miopenConvolutionFwdAlgoWinograd,<unused>;miopenConvolutionFwdAlgoGEMM:GemmFwd1x1_0_1,0.16752,0,miopenConvolutionFwdAlgoGEMM,<unused>
512-14-14-1x1-128-14-14-32-0x0-1x1-1x1-0-NCHW-FP32-F=miopenConvolutionFwdAlgoImplicitGEMM:ConvHipImplicitGemmV4R1Fwd,0.13376,0,miopenConvolutionFwdAlgoImplicitGEMM,<unused>;miopenConvolutionFwdAlgoDirect:ConvAsm1x1U,0.14768,0,miopenConvolutionFwdAlgoDirect,<unused>;miopenConvolutionFwdAlgoWinograd:ConvBinWinogradRxSf3x2,0.24064,0,miopenConvolutionFwdAlgoWinograd,<unused>;miopenConvolutionFwdAlgoGEMM:GemmFwd1x1_0_1,0.19024,0,miopenConvolutionFwdAlgoGEMM,<unused>
544-14-14-1x1-128-14-14-32-0x0-1x1-1x1-0-NCHW-FP32-F=miopenConvolutionFwdAlgoImplicitGEMM:ConvHipImplicitGemmV4R1Fwd,0.13344,0,miopenConvolutionFwdAlgoImplicitGEMM,<unused>;miopenConvolutionFwdAlgoDirect:ConvAsm1x1U,0.184,0,miopenConvolutionFwdAlgoDirect,<unused>;miopenConvolutionFwdAlgoWinograd:ConvBinWinogradRxSf3x2,0.24992,0,miopenConvolutionFwdAlgoWinograd,<unused>;miopenConvolutionFwdAlgoGEMM:GemmFwd1x1_0_1,0.18688,0,miopenConvolutionFwdAlgoGEMM,<unused>
576-14-14-1x1-128-14-14-32-0x0-1x1-1x1-0-NCHW-FP32-F=miopenConvolutionFwdAlgoImplicitGEMM:ConvHipImplicitGemmV4R1Fwd,0.13824,0,miopenConvolutionFwdAlgoImplicitGEMM,<unused>;miopenConvolutionFwdAlgoDirect:ConvAsm1x1U,0.19344,0,miopenConvolutionFwdAlgoDirect,<unused>;miopenConvolutionFwdAlgoWinograd:ConvBinWinogradRxSf3x2,0.26288,0,miopenConvolutionFwdAlgoWinograd,<unused>;miopenConvolutionFwdAlgoGEMM:GemmFwd1x1_0_1,0.19776,0,miopenConvolutionFwdAlgoGEMM,<unused>
608-14-14-1x1-128-14-14-32-0x0-1x1-1x1-0-NCHW-FP32-F=miopenConvolutionFwdAlgoImplicitGEMM:ConvHipImplicitGemmV4R1Fwd,0.145439,0,miopenConvolutionFwdAlgoImplicitGEMM,<unused>;miopenConvolutionFwdAlgoDirect:ConvAsm1x1U,0.19952,0,miopenConvolutionFwdAlgoDirect,<unused>;miopenConvolutionFwdAlgoWinograd:ConvBinWinogradRxSf3x2,0.27536,0,miopenConvolutionFwdAlgoWinograd,<unused>;miopenConvolutionFwdAlgoGEMM:GemmFwd1x1_0_1,0.20624,0,miopenConvolutionFwdAlgoGEMM,<unused>
640-14-14-1x1-128-14-14-32-0x0-1x1-1x1-0-NCHW-FP32-F=miopenConvolutionFwdAlgoImplicitGEMM:ConvHipImplicitGemmV4R1Fwd,0.15248,0,miopenConvolutionFwdAlgoImplicitGEMM,<unused>;miopenConvolutionFwdAlgoDirect:ConvAsm1x1U,0.27392,0,miopenConvolutionFwdAlgoDirect,<unused>;miopenConvolutionFwdAlgoWinograd:ConvBinWinogradRxSf3x2,0.28528,0,miopenConvolutionFwdAlgoWinograd,<unused>;miopenConvolutionFwdAlgoGEMM:GemmFwd1x1_0_1,0.21424,0,miopenConvolutionFwdAlgoGEMM,<unused>
672-14-14-1x1-128-14-14-32-0x0-1x1-1x1-0-NCHW-FP32-F=miopenConvolutionFwdAlgoImplicitGEMM:ConvHipImplicitGemmV4R1Fwd,0.16064,0,miopenConvolutionFwdAlgoImplicitGEMM,<unused>;miopenConvolutionFwdAlgoDirect:ConvAsm1x1U,0.22176,0,miopenConvolutionFwdAlgoDirect,<unused>;miopenConvolutionFwdAlgoWinograd:ConvBinWinogradRxSf3x2,0.3,0,miopenConvolutionFwdAlgoWinograd,<unused>;miopenConvolutionFwdAlgoGEMM:GemmFwd1x1_0_1,0.32032,0,miopenConvolutionFwdAlgoGEMM,<unused>
704-14-14-1x1-128-14-14-32-0x0-1x1-1x1-0-NCHW-FP32-F=miopenConvolutionFwdAlgoImplicitGEMM:ConvHipImplicitGemmV4R1Fwd,0.16944,0,miopenConvolutionFwdAlgoImplicitGEMM,<unused>;miopenConvolutionFwdAlgoDirect:ConvAsm1x1U,0.23504,0,miopenConvolutionFwdAlgoDirect,<unused>;miopenConvolutionFwdAlgoWinograd:ConvBinWinogradRxSf3x2,0.3112,0,miopenConvolutionFwdAlgoWinograd,<unused>;miopenConvolutionFwdAlgoGEMM:GemmFwd1x1_0_1,0.33408,0,miopenConvolutionFwdAlgoGEMM,<unused>
736-14-14-1x1-128-14-14-32-0x0-1x1-1x1-0-NCHW-FP32-F=miopenConvolutionFwdAlgoImplicitGEMM:ConvHipImplicitGemmV4R1Fwd,0.17344,0,miopenConvolutionFwdAlgoImplicitGEMM,<unused>;miopenConvolutionFwdAlgoDirect:ConvAsm1x1U,0.23696,0,miopenConvolutionFwdAlgoDirect,<unused>;miopenConvolutionFwdAlgoWinograd:ConvBinWinogradRxSf3x2,0.32272,0,miopenConvolutionFwdAlgoWinograd,<unused>;miopenConvolutionFwdAlgoGEMM:GemmFwd1x1_0_1,0.34768,0,miopenConvolutionFwdAlgoGEMM,<unused>
768-14-14-1x1-128-14-14-32-0x0-1x1-1x1-0-NCHW-FP32-F=miopenConvolutionFwdAlgoImplicitGEMM:ConvHipImplicitGemmV4R1Fwd,0.18144,0,miopenConvolutionFwdAlgoImplicitGEMM,<unused>;miopenConvolutionFwdAlgoDirect:ConvAsm1x1U,0.25184,0,miopenConvolutionFwdAlgoDirect,<unused>;miopenConvolutionFwdAlgoWinograd:ConvBinWinogradRxSf3x2,0.33472,0,miopenConvolutionFwdAlgoWinograd,<unused>;miopenConvolutionFwdAlgoGEMM:GemmFwd1x1_0_1,0.37808,0,miopenConvolutionFwdAlgoGEMM,<unused>
800-14-14-1x1-128-14-14-32-0x0-1x1-1x1-0-NCHW-FP32-F=miopenConvolutionFwdAlgoImplicitGEMM:ConvHipImplicitGemmV4R1Fwd,0.17312,0,miopenConvolutionFwdAlgoImplicitGEMM,<unused>;miopenConvolutionFwdAlgoDirect:ConvAsm1x1U,0.2616,0,miopenConvolutionFwdAlgoDirect,<unused>;miopenConvolutionFwdAlgoWinograd:ConvBinWinogradRxSf3x2,0.3456,0,miopenConvolutionFwdAlgoWinograd,<unused>;miopenConvolutionFwdAlgoGEMM:GemmFwd1x1_0_1,0.3736,0,miopenConvolutionFwdAlgoGEMM,<unused>
832-14-14-1x1-128-14-14-32-0x0-1x1-1x1-0-NCHW-FP32-F=miopenConvolutionFwdAlgoImplicitGEMM:ConvHipImplicitGemmV4R1Fwd,0.17872,0,miopenConvolutionFwdAlgoImplicitGEMM,<unused>;miopenConvolutionFwdAlgoDirect:ConvAsm1x1U,0.2656,0,miopenConvolutionFwdAlgoDirect,<unused>;miopenConvolutionFwdAlgoWinograd:ConvBinWinogradRxSf3x2,0.35776,0,miopenConvolutionFwdAlgoWinograd,<unused>;miopenConvolutionFwdAlgoGEMM:GemmFwd1x1_0_1,0.38976,0,miopenConvolutionFwdAlgoGEMM,<unused>
864-14-14-1x1-128-14-14-32-0x0-1x1-1x1-0-NCHW-FP32-F=miopenConvolutionFwdAlgoImplicitGEMM:ConvHipImplicitGemmV4R1Fwd,0.17584,0,miopenConvolutionFwdAlgoImplicitGEMM,<unused>;miopenConvolutionFwdAlgoDirect:ConvAsm1x1U,0.27904,0,miopenConvolutionFwdAlgoDirect,<unused>;miopenConvolutionFwdAlgoWinograd:ConvBinWinogradRxSf3x2,0.37104,0,miopenConvolutionFwdAlgoWinograd,<unused>;miopenConvolutionFwdAlgoGEMM:GemmFwd1x1_0_1,0.40768,0,miopenConvolutionFwdAlgoGEMM,<unused>
896-14-14-1x1-128-14-14-32-0x0-1x1-1x1-0-NCHW-FP32-F=miopenConvolutionFwdAlgoImplicitGEMM:ConvHipImplicitGemmV4R1Fwd,0.19072,0,miopenConvolutionFwdAlgoImplicitGEMM,<unused>;miopenConvolutionFwdAlgoDirect:ConvAsm1x1U,0.32144,0,miopenConvolutionFwdAlgoDirect,<unused>;miopenConvolutionFwdAlgoWinograd:ConvBinWinogradRxSf3x2,0.38368,0,miopenConvolutionFwdAlgoWinograd,<unused>;miopenConvolutionFwdAlgoGEMM:GemmFwd1x1_0_1,0.29312,0,miopenConvolutionFwdAlgoGEMM,<unused>
928-14-14-1x1-128-14-14-32-0x0-1x1-1x1-0-NCHW-FP32-F=miopenConvolutionFwdAlgoImplicitGEMM:ConvHipImplicitGemmV4R1Fwd,0.18576,0,miopenConvolutionFwdAlgoImplicitGEMM,<unused>;miopenConvolutionFwdAlgoDirect:ConvAsm1x1U,0.3,0,miopenConvolutionFwdAlgoDirect,<unused>;miopenConvolutionFwdAlgoWinograd:ConvBinWinogradRxSf3x2,0.39424,0,miopenConvolutionFwdAlgoWinograd,<unused>;miopenConvolutionFwdAlgoGEMM:GemmFwd1x1_0_1,0.30416,0,miopenConvolutionFwdAlgoGEMM,<unused>
960-14-14-1x1-128-14-14-32-0x0-1x1-1x1-0-NCHW-FP32-F=miopenConvolutionFwdAlgoImplicitGEMM:ConvHipImplicitGemmV4R1Fwd,0.19136,0,miopenConvolutionFwdAlgoImplicitGEMM,<unused>;miopenConvolutionFwdAlgoDirect:ConvAsm1x1U,0.30656,0,miopenConvolutionFwdAlgoDirect,<unused>;miopenConvolutionFwdAlgoWinograd:ConvBinWinogradRxSf3x2,0.40944,0,miopenConvolutionFwdAlgoWinograd,<unused>;miopenConvolutionFwdAlgoGEMM:GemmFwd1x1_0_1,0.31728,0,miopenConvolutionFwdAlgoGEMM,<unused>
992-14-14-1x1-128-14-14-32-0x0-1x1-1x1-0-NCHW-FP32-F=miopenConvolutionFwdAlgoImplicitGEMM:ConvHipImplicitGemmV4R1Fwd,0.19728,0,miopenConvolutionFwdAlgoImplicitGEMM,<unused>;miopenConvolutionFwdAlgoDirect:ConvAsm1x1U,0.32832,0,miopenConvolutionFwdAlgoDirect,<unused>;miopenConvolutionFwdAlgoWinograd:ConvBinWinogradRxSf3x2,0.41904,0,miopenConvolutionFwdAlgoWinograd,<unused>;miopenConvolutionFwdAlgoGEMM:GemmFwd1x1_0_1,0.32672,0,miopenConvolutionFwdAlgoGEMM,<unused>
1024-14-14-1x1-512-14-14-32-0x0-1x1-1x1-0-NCHW-FP32-F=miopenConvolutionFwdAlgoImplicitGEMM:ConvHipImplicitGemmV4R1Fwd,0.759678,0,miopenConvolutionFwdAlgoImplicitGEMM,<unused>;miopenConvolutionFwdAlgoDirect:ConvAsm1x1U,1.02064,0,miopenConvolutionFwdAlgoDirect,<unused>;miopenConvolutionFwdAlgoWinograd:ConvBinWinogradRxSf3x2,1.42608,0,miopenConvolutionFwdAlgoWinograd,<unused>;miopenConvolutionFwdAlgoGEMM:GemmFwd1x1_0_1,1.27184,0,miopenConvolutionFwdAlgoGEMM,<unused>
512-7-7-1x1-128-7-7-32-0x0-1x1-1x1-0-NCHW-FP32-F=miopenConvolutionFwdAlgoImplicitGEMM:ConvHipImplicitGemmV4R1Fwd,0.08272,0,miopenConvolutionFwdAlgoImplicitGEMM,<unused>;miopenConvolutionFwdAlgoDirect:ConvAsm1x1U,0.076,0,miopenConvolutionFwdAlgoDirect,<unused>;miopenConvolutionFwdAlgoWinograd:ConvBinWinogradRxSf3x2,0.13216,0,miopenConvolutionFwdAlgoWinograd,<unused>;miopenConvolutionFwdAlgoGEMM:GemmFwd1x1_0_1,0.11024,0,miopenConvolutionFwdAlgoGEMM,<unused>
128-7-7-3x3-32-7-7-32-1x1-1x1-1x1-0-NCHW-FP32-F=miopenConvolutionFwdAlgoWinograd:ConvBinWinograd3x3U,0.051038,0,miopenConvolutionFwdAlgoWinograd,<unused>
544-7-7-1x1-128-7-7-32-0x0-1x1-1x1-0-NCHW-FP32-F=miopenConvolutionFwdAlgoImplicitGEMM:ConvHipImplicitGemmV4R1Fwd,0.08144,0,miopenConvolutionFwdAlgoImplicitGEMM,<unused>;miopenConvolutionFwdAlgoDirect:ConvAsm1x1U,0.08528,0,miopenConvolutionFwdAlgoDirect,<unused>;miopenConvolutionFwdAlgoWinograd:ConvBinWinogradRxSf3x2,0.13808,0,miopenConvolutionFwdAlgoWinograd,<unused>;miopenConvolutionFwdAlgoGEMM:GemmFwd1x1_0_1,0.10336,0,miopenConvolutionFwdAlgoGEMM,<unused>
576-7-7-1x1-128-7-7-32-0x0-1x1-1x1-0-NCHW-FP32-F=miopenConvolutionFwdAlgoImplicitGEMM:ConvHipImplicitGemmV4R1Fwd,0.0856,0,miopenConvolutionFwdAlgoImplicitGEMM,<unused>;miopenConvolutionFwdAlgoDirect:ConvAsm1x1U,0.0872,0,miopenConvolutionFwdAlgoDirect,<unused>;miopenConvolutionFwdAlgoWinograd:ConvBinWinogradRxSf3x2,0.14432,0,miopenConvolutionFwdAlgoWinograd,<unused>;miopenConvolutionFwdAlgoGEMM:GemmFwd1x1_0_1,0.10576,0,miopenConvolutionFwdAlgoGEMM,<unused>
608-7-7-1x1-128-7-7-32-0x0-1x1-1x1-0-NCHW-FP32-F=miopenConvolutionFwdAlgoImplicitGEMM:ConvHipImplicitGemmV4R1Fwd,0.08976,0,miopenConvolutionFwdAlgoImplicitGEMM,<unused>;miopenConvolutionFwdAlgoDirect:ConvAsm1x1U,0.08752,0,miopenConvolutionFwdAlgoDirect,<unused>;miopenConvolutionFwdAlgoWinograd:ConvBinWinogradRxSf3x2,0.1496,0,miopenConvolutionFwdAlgoWinograd,<unused>;miopenConvolutionFwdAlgoGEMM:GemmFwd1x1_0_1,0.10992,0,miopenConvolutionFwdAlgoGEMM,<unused>
640-7-7-1x1-128-7-7-32-0x0-1x1-1x1-0-NCHW-FP32-F=miopenConvolutionFwdAlgoImplicitGEMM:ConvHipImplicitGemmV4R1Fwd,0.09408,0,miopenConvolutionFwdAlgoImplicitGEMM,<unused>;miopenConvolutionFwdAlgoDirect:ConvAsm1x1U,0.09008,0,miopenConvolutionFwdAlgoDirect,<unused>;miopenConvolutionFwdAlgoWinograd:ConvBinWinogradRxSf3x2,0.15584,0,miopenConvolutionFwdAlgoWinograd,<unused>;miopenConvolutionFwdAlgoGEMM:GemmFwd1x1_0_1,0.11968,0,miopenConvolutionFwdAlgoGEMM,<unused>
672-7-7-1x1-128-7-7-32-0x0-1x1-1x1-0-NCHW-FP32-F=miopenConvolutionFwdAlgoImplicitGEMM:ConvHipImplicitGemmV4R1Fwd,0.09648,0,miopenConvolutionFwdAlgoImplicitGEMM,<unused>;miopenConvolutionFwdAlgoDirect:ConvAsm1x1U,0.09376,0,miopenConvolutionFwdAlgoDirect,<unused>;miopenConvolutionFwdAlgoWinograd:ConvBinWinogradRxSf3x2,0.16144,0,miopenConvolutionFwdAlgoWinograd,<unused>;miopenConvolutionFwdAlgoGEMM:GemmFwd1x1_0_1,0.12384,0,miopenConvolutionFwdAlgoGEMM,<unused>
704-7-7-1x1-128-7-7-32-0x0-1x1-1x1-0-NCHW-FP32-F=miopenConvolutionFwdAlgoImplicitGEMM:ConvHipImplicitGemmV4R1Fwd,0.10096,0,miopenConvolutionFwdAlgoImplicitGEMM,<unused>;miopenConvolutionFwdAlgoDirect:ConvAsm1x1U,0.0984,0,miopenConvolutionFwdAlgoDirect,<unused>;miopenConvolutionFwdAlgoWinograd:ConvBinWinogradRxSf3x2,0.16656,0,miopenConvolutionFwdAlgoWinograd,<unused>;miopenConvolutionFwdAlgoGEMM:GemmFwd1x1_0_1,0.11904,0,miopenConvolutionFwdAlgoGEMM,<unused>
736-7-7-1x1-128-7-7-32-0x0-1x1-1x1-0-NCHW-FP32-F=miopenConvolutionFwdAlgoImplicitGEMM:ConvHipImplicitGemmV4R1Fwd,0.10512,0,miopenConvolutionFwdAlgoImplicitGEMM,<unused>;miopenConvolutionFwdAlgoDirect:ConvAsm1x1U,0.10352,0,miopenConvolutionFwdAlgoDirect,<unused>;miopenConvolutionFwdAlgoWinograd:ConvBinWinogradRxSf3x2,0.1744,0,miopenConvolutionFwdAlgoWinograd,<unused>;miopenConvolutionFwdAlgoGEMM:GemmFwd1x1_0_1,0.1224,0,miopenConvolutionFwdAlgoGEMM,<unused>
768-7-7-1x1-128-7-7-32-0x0-1x1-1x1-0-NCHW-FP32-F=miopenConvolutionFwdAlgoImplicitGEMM:ConvHipImplicitGemmV4R1Fwd,0.10656,0,miopenConvolutionFwdAlgoImplicitGEMM,<unused>;miopenConvolutionFwdAlgoDirect:ConvAsm1x1U,0.10672,0,miopenConvolutionFwdAlgoDirect,<unused>;miopenConvolutionFwdAlgoWinograd:ConvBinWinogradRxSf3x2,0.18096,0,miopenConvolutionFwdAlgoWinograd,<unused>;miopenConvolutionFwdAlgoGEMM:GemmFwd1x1_0_1,0.12976,0,miopenConvolutionFwdAlgoGEMM,<unused>
800-7-7-1x1-128-7-7-32-0x0-1x1-1x1-0-NCHW-FP32-F=miopenConvolutionFwdAlgoImplicitGEMM:ConvHipImplicitGemmV4R1Fwd,0.11392,0,miopenConvolutionFwdAlgoImplicitGEMM,<unused>;miopenConvolutionFwdAlgoDirect:ConvAsm1x1U,0.11088,0,miopenConvolutionFwdAlgoDirect,<unused>;miopenConvolutionFwdAlgoWinograd:ConvBinWinogradRxSf3x2,0.18528,0,miopenConvolutionFwdAlgoWinograd,<unused>;miopenConvolutionFwdAlgoGEMM:GemmFwd1x1_0_1,0.13008,0,miopenConvolutionFwdAlgoGEMM,<unused>
832-7-7-1x1-128-7-7-32-0x0-1x1-1x1-0-NCHW-FP32-F=miopenConvolutionFwdAlgoImplicitGEMM:ConvHipImplicitGemmV4R1Fwd,0.11824,0,miopenConvolutionFwdAlgoImplicitGEMM,<unused>;miopenConvolutionFwdAlgoDirect:ConvAsm1x1U,0.08464,0,miopenConvolutionFwdAlgoDirect,<unused>;miopenConvolutionFwdAlgoWinograd:ConvBinWinogradRxSf3x2,0.1912,0,miopenConvolutionFwdAlgoWinograd,<unused>;miopenConvolutionFwdAlgoGEMM:GemmFwd1x1_0_1,0.1304,0,miopenConvolutionFwdAlgoGEMM,<unused>
864-7-7-1x1-128-7-7-32-0x0-1x1-1x1-0-NCHW-FP32-F=miopenConvolutionFwdAlgoImplicitGEMM:ConvHipImplicitGemmV4R1Fwd,0.12256,0,miopenConvolutionFwdAlgoImplicitGEMM,<unused>;miopenConvolutionFwdAlgoDirect:ConvAsm1x1U,0.116,0,miopenConvolutionFwdAlgoDirect,<unused>;miopenConvolutionFwdAlgoWinograd:ConvBinWinogradRxSf3x2,0.1968,0,miopenConvolutionFwdAlgoWinograd,<unused>;miopenConvolutionFwdAlgoGEMM:GemmFwd1x1_0_1,0.14208,0,miopenConvolutionFwdAlgoGEMM,<unused>
896-7-7-1x1-128-7-7-32-0x0-1x1-1x1-0-NCHW-FP32-F=miopenConvolutionFwdAlgoImplicitGEMM:ConvHipImplicitGemmV4R1Fwd,0.126559,0,miopenConvolutionFwdAlgoImplicitGEMM,<unused>;miopenConvolutionFwdAlgoDirect:ConvAsm1x1U,0.12032,0,miopenConvolutionFwdAlgoDirect,<unused>;miopenConvolutionFwdAlgoWinograd:ConvBinWinogradRxSf3x2,0.2024,0,miopenConvolutionFwdAlgoWinograd,<unused>;miopenConvolutionFwdAlgoGEMM:GemmFwd1x1_0_1,0.14608,0,miopenConvolutionFwdAlgoGEMM,<unused>
928-7-7-1x1-128-7-7-32-0x0-1x1-1x1-0-NCHW-FP32-F=miopenConvolutionFwdAlgoImplicitGEMM:ConvHipImplicitGemmV4R1Fwd,0.1304,0,miopenConvolutionFwdAlgoImplicitGEMM,<unused>;miopenConvolutionFwdAlgoDirect:ConvAsm1x1U,0.131999,0,miopenConvolutionFwdAlgoDirect,<unused>;miopenConvolutionFwdAlgoWinograd:ConvBinWinogradRxSf3x2,0.20992,0,miopenConvolutionFwdAlgoWinograd,<unused>;miopenConvolutionFwdAlgoGEMM:GemmFwd1x1_0_1,0.14224,0,miopenConvolutionFwdAlgoGEMM,<unused>
960-7-7-1x1-128-7-7-32-0x0-1x1-1x1-0-NCHW-FP32-F=miopenConvolutionFwdAlgoImplicitGEMM:ConvHipImplicitGemmV4R1Fwd,0.13472,0,miopenConvolutionFwdAlgoImplicitGEMM,<unused>;miopenConvolutionFwdAlgoDirect:ConvAsm1x1U,0.12656,0,miopenConvolutionFwdAlgoDirect,<unused>;miopenConvolutionFwdAlgoWinograd:ConvBinWinogradRxSf3x2,0.21472,0,miopenConvolutionFwdAlgoWinograd,<unused>;miopenConvolutionFwdAlgoGEMM:GemmFwd1x1_0_1,0.14576,0,miopenConvolutionFwdAlgoGEMM,<unused>
992-7-7-1x1-128-7-7-32-0x0-1x1-1x1-0-NCHW-FP32-F=miopenConvolutionFwdAlgoImplicitGEMM:ConvHipImplicitGemmV4R1Fwd,0.13824,0,miopenConvolutionFwdAlgoImplicitGEMM,<unused>;miopenConvolutionFwdAlgoDirect:ConvAsm1x1U,0.13888,0,miopenConvolutionFwdAlgoDirect,<unused>;miopenConvolutionFwdAlgoWinograd:ConvBinWinogradRxSf3x2,0.22096,0,miopenConvolutionFwdAlgoWinograd,<unused>;miopenConvolutionFwdAlgoGEMM:GemmFwd1x1_0_1,0.15296,0,miopenConvolutionFwdAlgoGEMM,<unused>
3-224-224-7x7-64-112-112-32-3x3-2x2-1x1-0-NCHW-FP16-F=miopenConvolutionFwdAlgoImplicitGEMM:ConvMlirIgemmFwd,2.77439,0,miopenConvolutionFwdAlgoImplicitGEMM,<unused>;miopenConvolutionFwdAlgoDirect:ConvOclDirectFwdGen,1.57343,0,miopenConvolutionFwdAlgoDirect,<unused>;miopenConvolutionFwdAlgoWinograd:ConvBinWinogradRxSf2x3g1,1.26335,0,miopenConvolutionFwdAlgoWinograd,<unused>;miopenConvolutionFwdAlgoGEMM:GemmFwdRest,3.24608,3687936,miopenConvolutionFwdAlgoGEMM,<unused>
64-56-56-1x1-128-56-56-32-0x0-1x1-1x1-0-NCHW-FP16-F=miopenConvolutionFwdAlgoImplicitGEMM:ConvHipImplicitGemmV4R1Fwd,0.162399,0,miopenConvolutionFwdAlgoImplicitGEMM,<unused>;miopenConvolutionFwdAlgoDirect:ConvAsm1x1U,0.194879,0,miopenConvolutionFwdAlgoDirect,<unused>;miopenConvolutionFwdAlgoWinograd:ConvBinWinogradRxSf3x2,0.332319,0,miopenConvolutionFwdAlgoWinograd,<unused>;miopenConvolutionFwdAlgoGEMM:GemmFwd1x1_0_1,0.123999,0,miopenConvolutionFwdAlgoGEMM,<unused>
128-56-56-3x3-32-56-56-32-1x1-1x1-1x1-0-NCHW-FP16-F=miopenConvolutionFwdAlgoImplicitGEMM:ConvHipImplicitGemmV4R1Fwd,0.622238,0,miopenConvolutionFwdAlgoImplicitGEMM,<unused>;miopenConvolutionFwdAlgoDirect:ConvOclDirectFwd,1.66751,0,miopenConvolutionFwdAlgoDirect,<unused>;miopenConvolutionFwdAlgoWinograd:ConvBinWinogradRxSf2x3g1,0.267839,0,miopenConvolutionFwdAlgoWinograd,<unused>;miopenConvolutionFwdAlgoGEMM:GemmFwdRest,3.53789,7225344,miopenConvolutionFwdAlgoGEMM,<unused>
96-56-56-1x1-128-56-56-32-0x0-1x1-1x1-0-NCHW-FP16-F=miopenConvolutionFwdAlgoImplicitGEMM:ConvHipImplicitGemmV4R1Fwd,0.201759,0,miopenConvolutionFwdAlgoImplicitGEMM,<unused>;miopenConvolutionFwdAlgoDirect:ConvAsm1x1U,0.211679,0,miopenConvolutionFwdAlgoDirect,<unused>;miopenConvolutionFwdAlgoWinograd:ConvBinWinogradRxSf3x2,0.421278,0,miopenConvolutionFwdAlgoWinograd,<unused>;miopenConvolutionFwdAlgoGEMM:GemmFwd1x1_0_1,0.168799,0,miopenConvolutionFwdAlgoGEMM,<unused>
128-56-56-1x1-128-56-56-32-0x0-1x1-1x1-0-NCHW-FP16-F=miopenConvolutionFwdAlgoImplicitGEMM:ConvHipImplicitGemmV4R1Fwd,0.269919,0,miopenConvolutionFwdAlgoImplicitGEMM,<unused>;miopenConvolutionFwdAlgoDirect:ConvAsm1x1U,0.259679,0,miopenConvolutionFwdAlgoDirect,<unused>;miopenConvolutionFwdAlgoWinograd:ConvBinWinogradRxSf3x2,0.517918,0,miopenConvolutionFwdAlgoWinograd,<unused>;miopenConvolutionFwdAlgoGEMM:GemmFwd1x1_0_1,0.212319,0,miopenConvolutionFwdAlgoGEMM,<unused>
160-56-56-1x1-128-56-56-32-0x0-1x1-1x1-0-NCHW-FP16-F=miopenConvolutionFwdAlgoImplicitGEMM:ConvHipImplicitGemmV4R1Fwd,0.284479,0,miopenConvolutionFwdAlgoImplicitGEMM,<unused>;miopenConvolutionFwdAlgoDirect:ConvAsm1x1U,0.313759,0,miopenConvolutionFwdAlgoDirect,<unused>;miopenConvolutionFwdAlgoWinograd:ConvBinWinogradRxSf3x2,0.610238,0,miopenConvolutionFwdAlgoWinograd,<unused>;miopenConvolutionFwdAlgoGEMM:GemmFwd1x1_0_1,0.252479,0,miopenConvolutionFwdAlgoGEMM,<unused>
192-56-56-1x1-128-56-56-32-0x0-1x1-1x1-0-NCHW-FP16-F=miopenConvolutionFwdAlgoImplicitGEMM:ConvHipImplicitGemmV4R1Fwd,0.350239,0,miopenConvolutionFwdAlgoImplicitGEMM,<unused>;miopenConvolutionFwdAlgoDirect:ConvAsm1x1U,0.396798,0,miopenConvolutionFwdAlgoDirect,<unused>;miopenConvolutionFwdAlgoWinograd:ConvBinWinogradRxSf3x2,0.746878,0,miopenConvolutionFwdAlgoWinograd,<unused>;miopenConvolutionFwdAlgoGEMM:GemmFwd1x1_0_1,0.286879,0,miopenConvolutionFwdAlgoGEMM,<unused>
224-56-56-1x1-128-56-56-32-0x0-1x1-1x1-0-NCHW-FP16-F=miopenConvolutionFwdAlgoImplicitGEMM:ConvHipImplicitGemmV4R1Fwd,0.376318,0,miopenConvolutionFwdAlgoImplicitGEMM,<unused>;miopenConvolutionFwdAlgoDirect:ConvAsm1x1U,0.451678,0,miopenConvolutionFwdAlgoDirect,<unused>;miopenConvolutionFwdAlgoWinograd:ConvBinWinogradRxSf3x2,0.845597,0,miopenConvolutionFwdAlgoWinograd,<unused>;miopenConvolutionFwdAlgoGEMM:GemmFwd1x1_0_1,0.326079,0,miopenConvolutionFwdAlgoGEMM,<unused>
256-56-56-1x1-128-56-56-32-0x0-1x1-1x1-0-NCHW-FP16-F=miopenConvolutionFwdAlgoImplicitGEMM:ConvHipImplicitGemmV4R1Fwd,0.466398,0,miopenConvolutionFwdAlgoImplicitGEMM,<unused>;miopenConvolutionFwdAlgoDirect:ConvAsm1x1U,0.489439,0,miopenConvolutionFwdAlgoDirect,<unused>;miopenConvolutionFwdAlgoWinograd:ConvBinWinogradRxSf3x2,0.909437,0,miopenConvolutionFwdAlgoWinograd,<unused>;miopenConvolutionFwdAlgoGEMM:GemmFwd1x1_0_1,0.368959,0,miopenConvolutionFwdAlgoGEMM,<unused>
128-28-28-1x1-128-28-28-32-0x0-1x1-1x1-0-NCHW-FP16-F=miopenConvolutionFwdAlgoImplicitGEMM:ConvHipImplicitGemmV4R1Fwd,0.09472,0,miopenConvolutionFwdAlgoImplicitGEMM,<unused>;miopenConvolutionFwdAlgoDirect:ConvAsm1x1U,0.08272,0,miopenConvolutionFwdAlgoDirect,<unused>;miopenConvolutionFwdAlgoWinograd:ConvBinWinogradRxSf3x2,0.17648,0,miopenConvolutionFwdAlgoWinograd,<unused>;miopenConvolutionFwdAlgoGEMM:GemmFwd1x1_0_1,0.1488,0,miopenConvolutionFwdAlgoGEMM,<unused>
128-28-28-3x3-32-28-28-32-1x1-1x1-1x1-0-NCHW-FP16-F=miopenConvolutionFwdAlgoImplicitGEMM:ConvHipImplicitGemmV4R1Fwd,0.224319,0,miopenConvolutionFwdAlgoImplicitGEMM,<unused>;miopenConvolutionFwdAlgoDirect:ConvOclDirectFwd,0.460478,0,miopenConvolutionFwdAlgoDirect,<unused>;miopenConvolutionFwdAlgoWinograd:ConvBinWinogradRxS,0.09872,0,miopenConvolutionFwdAlgoWinograd,<unused>;miopenConvolutionFwdAlgoGEMM:GemmFwdRest,3.61974,1806336,miopenConvolutionFwdAlgoGEMM,<unused>
160-28-28-1x1-128-28-28-32-0x0-1x1-1x1-0-NCHW-FP16-F=miopenConvolutionFwdAlgoImplicitGEMM:ConvHipImplicitGemmV4R1Fwd,0.10448,0,miopenConvolutionFwdAlgoImplicitGEMM,<unused>;miopenConvolutionFwdAlgoDirect:ConvAsm1x1U,0.10576,0,miopenConvolutionFwdAlgoDirect,<unused>;miopenConvolutionFwdAlgoWinograd:ConvBinWinogradRxSf3x2,0.203519,0,miopenConvolutionFwdAlgoWinograd,<unused>;miopenConvolutionFwdAlgoGEMM:GemmFwd1x1_0_1,0.17472,0,miopenConvolutionFwdAlgoGEMM,<unused>
192-28-28-1x1-128-28-28-32-0x0-1x1-1x1-0-NCHW-FP16-F=miopenConvolutionFwdAlgoImplicitGEMM:ConvHipImplicitGemmV4R1Fwd,0.13216,0,miopenConvolutionFwdAlgoImplicitGEMM,<unused>;miopenConvolutionFwdAlgoDirect:ConvAsm1x1U,0.11488,0,miopenConvolutionFwdAlgoDirect,<unused>;miopenConvolutionFwdAlgoWinograd:ConvBinWinogradRxSf3x2,0.230879,0,miopenConvolutionFwdAlgoWinograd,<unused>;miopenConvolutionFwdAlgoGEMM:GemmFwd1x1_0_1,0.206239,0,miopenConvolutionFwdAlgoGEMM,<unused>
224-28-28-1x1-128-28-28-32-0x0-1x1-1x1-0-NCHW-FP16-F=miopenConvolutionFwdAlgoImplicitGEMM:ConvHipImplicitGemmV4R1Fwd,0.129599,0,miopenConvolutionFwdAlgoImplicitGEMM,<unused>;miopenConvolutionFwdAlgoDirect:ConvAsm1x1U,0.136799,0,miopenConvolutionFwdAlgoDirect,<unused>;miopenConvolutionFwdAlgoWinograd:ConvBinWinogradRxSf3x2,0.259839,0,miopenConvolutionFwdAlgoWinograd,<unused>;miopenConvolutionFwdAlgoGEMM:GemmFwd1x1_0_1,0.229119,0,miopenConvolutionFwdAlgoGEMM,<unused>
256-28-28-1x1-128-28-28-32-0x0-1x1-1x1-0-NCHW-FP16-F=miopenConvolutionFwdAlgoImplicitGEMM:ConvHipImplicitGemmV4R1Fwd,0.15056,0,miopenConvolutionFwdAlgoImplicitGEMM,<unused>;miopenConvolutionFwdAlgoDirect:ConvAsm1x1U,0.13712,0,miopenConvolutionFwdAlgoDirect,<unused>;miopenConvolutionFwdAlgoWinograd:ConvBinWinogradRxSf3x2,0.289279,0,miopenConvolutionFwdAlgoWinograd,<unused>;miopenConvolutionFwdAlgoGEMM:GemmFwd1x1_0_1,0.257919,0,miopenConvolutionFwdAlgoGEMM,<unused>
288-28-28-1x1-128-28-28-32-0x0-1x1-1x1-0-NCHW-FP16-F=miopenConvolutionFwdAlgoImplicitGEMM:ConvHipImplicitGemmV4R1Fwd,0.145599,0,miopenConvolutionFwdAlgoImplicitGEMM,<unused>;miopenConvolutionFwdAlgoDirect:ConvAsm1x1U,0.17216,0,miopenConvolutionFwdAlgoDirect,<unused>;miopenConvolutionFwdAlgoWinograd:ConvBinWinogradRxSf3x2,0.312479,0,miopenConvolutionFwdAlgoWinograd,<unused>;miopenConvolutionFwdAlgoGEMM:GemmFwd1x1_0_1,0.287359,0,miopenConvolutionFwdAlgoGEMM,<unused>
320-28-28-1x1-128-28-28-32-0x0-1x1-1x1-0-NCHW-FP16-F=miopenConvolutionFwdAlgoImplicitGEMM:ConvHipImplicitGemmV4R1Fwd,0.16896,0,miopenConvolutionFwdAlgoImplicitGEMM,<unused>;miopenConvolutionFwdAlgoDirect:ConvAsm1x1U,0.16672,0,miopenConvolutionFwdAlgoDirect,<unused>;miopenConvolutionFwdAlgoWinograd:ConvBinWinogradRxSf3x2,0.340319,0,miopenConvolutionFwdAlgoWinograd,<unused>;miopenConvolutionFwdAlgoGEMM:GemmFwd1x1_0_1,0.318079,0,miopenConvolutionFwdAlgoGEMM,<unused>
352-28-28-1x1-128-28-28-32-0x0-1x1-1x1-0-NCHW-FP16-F=miopenConvolutionFwdAlgoImplicitGEMM:ConvHipImplicitGemmV4R1Fwd,0.170559,0,miopenConvolutionFwdAlgoImplicitGEMM,<unused>;miopenConvolutionFwdAlgoDirect:ConvAsm1x1U,0.194239,0,miopenConvolutionFwdAlgoDirect,<unused>;miopenConvolutionFwdAlgoWinograd:ConvBinWinogradRxSf3x2,0.367519,0,miopenConvolutionFwdAlgoWinograd,<unused>;miopenConvolutionFwdAlgoGEMM:GemmFwd1x1_0_1,0.340959,0,miopenConvolutionFwdAlgoGEMM,<unused>
384-28-28-1x1-128-28-28-32-0x0-1x1-1x1-0-NCHW-FP16-F=miopenConvolutionFwdAlgoImplicitGEMM:ConvHipImplicitGemmV4R1Fwd,0.20032,0,miopenConvolutionFwdAlgoImplicitGEMM,<unused>;miopenConvolutionFwdAlgoDirect:ConvAsm1x1U,0.22656,0,miopenConvolutionFwdAlgoDirect,<unused>;miopenConvolutionFwdAlgoWinograd:ConvBinWinogradRxSf3x2,0.397279,0,miopenConvolutionFwdAlgoWinograd,<unused>;miopenConvolutionFwdAlgoGEMM:GemmFwd1x1_0_1,0.19648,0,miopenConvolutionFwdAlgoGEMM,<unused>
416-28-28-1x1-128-28-28-32-0x0-1x1-1x1-0-NCHW-FP16-F=miopenConvolutionFwdAlgoImplicitGEMM:ConvHipImplicitGemmV4R1Fwd,0.196799,0,miopenConvolutionFwdAlgoImplicitGEMM,<unused>;miopenConvolutionFwdAlgoDirect:ConvAsm1x1U,0.228,0,miopenConvolutionFwdAlgoDirect,<unused>;miopenConvolutionFwdAlgoWinograd:ConvBinWinogradRxSf3x2,0.420639,0,miopenConvolutionFwdAlgoWinograd,<unused>;miopenConvolutionFwdAlgoGEMM:GemmFwd1x1_0_1,0.20624,0,miopenConvolutionFwdAlgoGEMM,<unused>
448-28-28-1x1-128-28-28-32-0x0-1x1-1x1-0-NCHW-FP16-F=miopenConvolutionFwdAlgoImplicitGEMM:ConvHipImplicitGemmV4R1Fwd,0.22496,0,miopenConvolutionFwdAlgoImplicitGEMM,<unused>;miopenConvolutionFwdAlgoDirect:ConvAsm1x1U,0.241759,0,miopenConvolutionFwdAlgoDirect,<unused>;miopenConvolutionFwdAlgoWinograd:ConvBinWinogradRxSf3x2,0.449279,0,miopenConvolutionFwdAlgoWinograd,<unused>;miopenConvolutionFwdAlgoGEMM:GemmFwd1x1_0_1,0.21904,0,miopenConvolutionFwdAlgoGEMM,<unused>
480-28-28-1x1-128-28-28-32-0x0-1x1-1x1-0-NCHW-FP16-F=miopenConvolutionFwdAlgoImplicitGEMM:ConvHipImplicitGemmV4R1Fwd,0.223519,0,miopenConvolutionFwdAlgoImplicitGEMM,<unused>;miopenConvolutionFwdAlgoDirect:ConvAsm1x1U,0.269439,0,miopenConvolutionFwdAlgoDirect,<unused>;miopenConvolutionFwdAlgoWinograd:ConvBinWinogradRxSf3x2,0.475999,0,miopenConvolutionFwdAlgoWinograd,<unused>;miopenConvolutionFwdAlgoGEMM:GemmFwd1x1_0_1,0.23216,0,miopenConvolutionFwdAlgoGEMM,<unused>
512-28-28-1x1-256-28-28-32-0x0-1x1-1x1-0-NCHW-FP16-F=miopenConvolutionFwdAlgoImplicitGEMM:ConvHipImplicitGemmV4R1Fwd,0.545279,0,miopenConvolutionFwdAlgoImplicitGEMM,<unused>;miopenConvolutionFwdAlgoDirect:ConvAsm1x1U,0.556959,0,miopenConvolutionFwdAlgoDirect,<unused>;miopenConvolutionFwdAlgoWinograd:ConvBinWinogradRxSf3x2,1.024,0,miopenConvolutionFwdAlgoWinograd,<unused>;miopenConvolutionFwdAlgoGEMM:GemmFwd1x1_0_1,0.448479,0,miopenConvolutionFwdAlgoGEMM,<unused>
256-14-14-1x1-128-14-14-32-0x0-1x1-1x1-0-NCHW-FP16-F=miopenConvolutionFwdAlgoImplicitGEMM:ConvHipImplicitGemmV4R1Fwd,0.0664,0,miopenConvolutionFwdAlgoImplicitGEMM,<unused>;miopenConvolutionFwdAlgoDirect:ConvAsm1x1U,0.06736,0,miopenConvolutionFwdAlgoDirect,<unused>;miopenConvolutionFwdAlgoWinograd:ConvBinWinogradRxSf3x2,0.12768,0,miopenConvolutionFwdAlgoWinograd,<unused>;miopenConvolutionFwdAlgoGEMM:GemmFwd1x1_0_1,0.21888,0,miopenConvolutionFwdAlgoGEMM,<unused>
128-14-14-3x3-32-14-14-32-1x1-1x1-1x1-0-NCHW-FP16-F=miopenConvolutionFwdAlgoImplicitGEMM:ConvHipImplicitGemmV4R1Fwd,0.13024,0,miopenConvolutionFwdAlgoImplicitGEMM,<unused>;miopenConvolutionFwdAlgoDirect:ConvOclDirectFwd,0.20896,0,miopenConvolutionFwdAlgoDirect,<unused>;miopenConvolutionFwdAlgoWinograd:ConvBinWinogradRxS,0.04832,0,miopenConvolutionFwdAlgoWinograd,<unused>;miopenConvolutionFwdAlgoGEMM:GemmFwdRest,2.78016,451584,miopenConvolutionFwdAlgoGEMM,<unused>
288-14-14-1x1-128-14-14-32-0x0-1x1-1x1-0-NCHW-FP16-F=miopenConvolutionFwdAlgoImplicitGEMM:ConvHipImplicitGemmV4R1Fwd,0.06128,0,miopenConvolutionFwdAlgoImplicitGEMM,<unused>;miopenConvolutionFwdAlgoDirect:ConvAsm1x1U,0.0944,0,miopenConvolutionFwdAlgoDirect,<unused>;miopenConvolutionFwdAlgoWinograd:ConvBinWinogradRxSf3x2,0.13872,0,miopenConvolutionFwdAlgoWinograd,<unused>;miopenConvolutionFwdAlgoGEMM:GemmFwd1x1_0_1,0.284799,0,miopenConvolutionFwdAlgoGEMM,<unused>
320-14-14-1x1-128-14-14-32-0x0-1x1-1x1-0-NCHW-FP16-F=miopenConvolutionFwdAlgoImplicitGEMM:ConvHipImplicitGemmV4R1Fwd,0.07232,0,miopenConvolutionFwdAlgoImplicitGEMM,<unused>;miopenConvolutionFwdAlgoDirect:ConvAsm1x1U,0.1024,0,miopenConvolutionFwdAlgoDirect,<unused>;miopenConvolutionFwdAlgoWinograd:ConvBinWinogradRxSf3x2,0.147519,0,miopenConvolutionFwdAlgoWinograd,<unused>;miopenConvolutionFwdAlgoGEMM:GemmFwd1x1_0_1,0.26512,0,miopenConvolutionFwdAlgoGEMM,<unused>
352-14-14-1x1-128-14-14-32-0x0-1x1-1x1-0-NCHW-FP16-F=miopenConvolutionFwdAlgoImplicitGEMM:ConvHipImplicitGemmV4R1Fwd,0.0728,0,miopenConvolutionFwdAlgoImplicitGEMM,<unused>;miopenConvolutionFwdAlgoDirect:ConvAsm1x1U,0.1112,0,miopenConvolutionFwdAlgoDirect,<unused>;miopenConvolutionFwdAlgoWinograd:ConvBinWinogradRxSf3x2,0.15856,0,miopenConvolutionFwdAlgoWinograd,<unused>;miopenConvolutionFwdAlgoGEMM:GemmFwd1x1_0_1,0.323359,0,miopenConvolutionFwdAlgoGEMM,<unused>
384-14-14-1x1-128-14-14-32-0x0-1x1-1x1-0-NCHW-FP16-F=miopenConvolutionFwdAlgoImplicitGEMM:ConvHipImplicitGemmV4R1Fwd,0.11456,0,miopenConvolutionFwdAlgoImplicitGEMM,<unused>;miopenConvolutionFwdAlgoDirect:ConvAsm1x1U,0.1184,0,miopenConvolutionFwdAlgoDirect,<unused>;miopenConvolutionFwdAlgoWinograd:ConvBinWinogradRxSf3x2,0.168799,0,miopenConvolutionFwdAlgoWinograd,<unused>;miopenConvolutionFwdAlgoGEMM:GemmFwd1x1_0_1,0.30256,0,miopenConvolutionFwdAlgoGEMM,<unused>
416-14-14-1x1-128-14-14-32-0x0-1x1-1x1-0-NCHW-FP16-F=miopenConvolutionFwdAlgoImplicitGEMM:ConvHipImplicitGemmV4R1Fwd,0.084,0,miopenConvolutionFwdAlgoImplicitGEMM,<unused>;miopenConvolutionFwdAlgoDirect:ConvAsm1x1U,0.128959,0,miopenConvolutionFwdAlgoDirect,<unused>;miopenConvolutionFwdAlgoWinograd:ConvBinWinogradRxSf3x2,0.18,0,miopenConvolutionFwdAlgoWinograd,<unused>;miopenConvolutionFwdAlgoGEMM:GemmFwd1x1_0_1,0.365279,0,miopenConvolutionFwdAlgoGEMM,<unused>
448-14-14-1x1-128-14-14-32-0x0-1x1-1x1-0-NCHW-FP16-F=miopenConvolutionFwdAlgoImplicitGEMM:ConvHipImplicitGemmV4R1Fwd,0.09296,0,miopenConvolutionFwdAlgoImplicitGEMM,<unused>;miopenConvolutionFwdAlgoDirect:ConvAsm1x1U,0.13584,0,miopenConvolutionFwdAlgoDirect,<unused>;miopenConvolutionFwdAlgoWinograd:ConvBinWinogradRxSf3x2,0.1904,0,miopenConvolutionFwdAlgoWinograd,<unused>;miopenConvolutionFwdAlgoGEMM:GemmFwd1x1_0_1,0.34384,0,miopenConvolutionFwdAlgoGEMM,<unused>
480-14-14-1x1-128-14-14-32-0x0-1x1-1x1-0-NCHW-FP16-F=miopenConvolutionFwdAlgoImplicitGEMM:ConvHipImplicitGemmV4R1Fwd,0.09488,0,miopenConvolutionFwdAlgoImplicitGEMM,<unused>;miopenConvolutionFwdAlgoDirect:ConvAsm1x1U,0.1448,0,miopenConvolutionFwdAlgoDirect,<unused>;miopenConvolutionFwdAlgoWinograd:ConvBinWinogradRxSf3x2,0.20032,0,miopenConvolutionFwdAlgoWinograd,<unused>;miopenConvolutionFwdAlgoGEMM:GemmFwd1x1_0_1,0.411519,0,miopenConvolutionFwdAlgoGEMM,<unused>
512-14-14-1x1-128-14-14-32-0x0-1x1-1x1-0-NCHW-FP16-F=miopenConvolutionFwdAlgoImplicitGEMM:ConvHipImplicitGemmV4R1Fwd,0.24352,0,miopenConvolutionFwdAlgoImplicitGEMM,<unused>;miopenConvolutionFwdAlgoDirect:ConvAsm1x1U,0.108,0,miopenConvolutionFwdAlgoDirect,<unused>;miopenConvolutionFwdAlgoWinograd:ConvBinWinogradRxSf3x2,0.21248,0,miopenConvolutionFwdAlgoWinograd,<unused>;miopenConvolutionFwdAlgoGEMM:GemmFwd1x1_0_1,0.387839,0,miopenConvolutionFwdAlgoGEMM,<unused>
544-14-14-1x1-128-14-14-32-0x0-1x1-1x1-0-NCHW-FP16-F=miopenConvolutionFwdAlgoImplicitGEMM:ConvHipImplicitGemmV4R1Fwd,0.10736,0,miopenConvolutionFwdAlgoImplicitGEMM,<unused>;miopenConvolutionFwdAlgoDirect:ConvAsm1x1U,0.16032,0,miopenConvolutionFwdAlgoDirect,<unused>;miopenConvolutionFwdAlgoWinograd:ConvBinWinogradRxSf3x2,0.22032,0,miopenConvolutionFwdAlgoWinograd,<unused>;miopenConvolutionFwdAlgoGEMM:GemmFwd1x1_0_1,0.448799,0,miopenConvolutionFwdAlgoGEMM,<unused>
576-14-14-1x1-128-14-14-32-0x0-1x1-1x1-0-NCHW-FP16-F=miopenConvolutionFwdAlgoImplicitGEMM:ConvHipImplicitGemmV4R1Fwd,0.1624,0,miopenConvolutionFwdAlgoImplicitGEMM,<unused>;miopenConvolutionFwdAlgoDirect:ConvAsm1x1U,0.12624,0,miopenConvolutionFwdAlgoDirect,<unused>;miopenConvolutionFwdAlgoWinograd:ConvBinWinogradRxSf3x2,0.23168,0,miopenConvolutionFwdAlgoWinograd,<unused>;miopenConvolutionFwdAlgoGEMM:GemmFwd1x1_0_1,0.429119,0,miopenConvolutionFwdAlgoGEMM,<unused>
608-14-14-1x1-128-14-14-32-0x0-1x1-1x1-0-NCHW-FP16-F=miopenConvolutionFwdAlgoImplicitGEMM:ConvHipImplicitGemmV4R1Fwd,0.171679,0,miopenConvolutionFwdAlgoImplicitGEMM,<unused>;miopenConvolutionFwdAlgoDirect:ConvAsm1x1U,0.17888,0,miopenConvolutionFwdAlgoDirect,<unused>;miopenConvolutionFwdAlgoWinograd:ConvBinWinogradRxSf3x2,0.24272,0,miopenConvolutionFwdAlgoWinograd,<unused>;miopenConvolutionFwdAlgoGEMM:GemmFwd1x1_0_1,0.13248,0,miopenConvolutionFwdAlgoGEMM,<unused>
640-14-14-1x1-128-14-14-32-0x0-1x1-1x1-0-NCHW-FP16-F=miopenConvolutionFwdAlgoImplicitGEMM:ConvHipImplicitGemmV4R1Fwd,0.17824,0,miopenConvolutionFwdAlgoImplicitGEMM,<unused>;miopenConvolutionFwdAlgoDirect:ConvAsm1x1U,0.14496,0,miopenConvolutionFwdAlgoDirect,<unused>;miopenConvolutionFwdAlgoWinograd:ConvBinWinogradRxSf3x2,0.25248,0,miopenConvolutionFwdAlgoWinograd,<unused>;miopenConvolutionFwdAlgoGEMM:GemmFwd1x1_0_1,0.12432,0,miopenConvolutionFwdAlgoGEMM,<unused>
672-14-14-1x1-128-14-14-32-0x0-1x1-1x1-0-NCHW-FP16-F=miopenConvolutionFwdAlgoImplicitGEMM:ConvHipImplicitGemmV4R1Fwd,0.18592,0,miopenConvolutionFwdAlgoImplicitGEMM,<unused>;miopenConvolutionFwdAlgoDirect:ConvAsm1x1U,0.19856,0,miopenConvolutionFwdAlgoDirect,<unused>;miopenConvolutionFwdAlgoWinograd:ConvBinWinogradRxSf3x2,0.26464,0,miopenConvolutionFwdAlgoWinograd,<unused>;miopenConvolutionFwdAlgoGEMM:GemmFwd1x1_0_1,0.1264,0,miopenConvolutionFwdAlgoGEMM,<unused>
704-14-14-1x1-128-14-14-32-0x0-1x1-1x1-0-NCHW-FP16-F=miopenConvolutionFwdAlgoImplicitGEMM:ConvHipImplicitGemmV4R1Fwd,0.19536,0,miopenConvolutionFwdAlgoImplicitGEMM,<unused>;miopenConvolutionFwdAlgoDirect:ConvAsm1x1U,0.20864,0,miopenConvolutionFwdAlgoDirect,<unused>;miopenConvolutionFwdAlgoWinograd:ConvBinWinogradRxSf3x2,0.27472,0,miopenConvolutionFwdAlgoWinograd,<unused>;miopenConvolutionFwdAlgoGEMM:GemmFwd1x1_0_1,0.15568,0,miopenConvolutionFwdAlgoGEMM,<unused>
736-14-14-1x1-128-14-14-32-0x0-1x1-1x1-0-NCHW-FP16-F=miopenConvolutionFwdAlgoImplicitGEMM:ConvHipImplicitGemmV4R1Fwd,0.19648,0,miopenConvolutionFwdAlgoImplicitGEMM,<unused>;miopenConvolutionFwdAlgoDirect:ConvAsm1x1U,0.163999,0,miopenConvolutionFwdAlgoDirect,<unused>;miopenConvolutionFwdAlgoWinograd:ConvBinWinogradRxSf3x2,0.284639,0,miopenConvolutionFwdAlgoWinograd,<unused>;miopenConvolutionFwdAlgoGEMM:GemmFwd1x1_0_1,0.16656,0,miopenConvolutionFwdAlgoGEMM,<unused>
768-14-14-1x1-128-14-14-32-0x0-1x1-1x1-0-NCHW-FP16-F=miopenConvolutionFwdAlgoImplicitGEMM:ConvHipImplicitGemmV4R1Fwd,0.19568,0,miopenConvolutionFwdAlgoImplicitGEMM,<unused>;miopenConvolutionFwdAlgoDirect:ConvAsm1x1U,0.171839,0,miopenConvolutionFwdAlgoDirect,<unused>;miopenConvolutionFwdAlgoWinograd:ConvBinWinogradRxSf3x2,0.295839,0,miopenConvolutionFwdAlgoWinograd,<unused>;miopenConvolutionFwdAlgoGEMM:GemmFwd1x1_0_1,0.17248,0,miopenConvolutionFwdAlgoGEMM,<unused>
800-14-14-1x1-128-14-14-32-0x0-1x1-1x1-0-NCHW-FP16-F=miopenConvolutionFwdAlgoImplicitGEMM:ConvHipImplicitGemmV4R1Fwd,0.20288,0,miopenConvolutionFwdAlgoImplicitGEMM,<unused>;miopenConvolutionFwdAlgoDirect:ConvAsm1x1U,0.232159,0,miopenConvolutionFwdAlgoDirect,<unused>;miopenConvolutionFwdAlgoWinograd:ConvBinWinogradRxSf3x2,0.305279,0,miopenConvolutionFwdAlgoWinograd,<unused>;miopenConvolutionFwdAlgoGEMM:GemmFwd1x1_0_1,0.17808,0,miopenConvolutionFwdAlgoGEMM,<unused>
832-14-14-1x1-128-14-14-32-0x0-1x1-1x1-0-NCHW-FP16-F=miopenConvolutionFwdAlgoImplicitGEMM:ConvHipImplicitGemmV4R1Fwd,0.21184,0,miopenConvolutionFwdAlgoImplicitGEMM,<unused>;miopenConvolutionFwdAlgoDirect:ConvAsm1x1U,0.18336,0,miopenConvolutionFwdAlgoDirect,<unused>;miopenConvolutionFwdAlgoWinograd:ConvBinWinogradRxSf3x2,0.315999,0,miopenConvolutionFwdAlgoWinograd,<unused>;miopenConvolutionFwdAlgoGEMM:GemmFwd1x1_0_1,0.18688,0,miopenConvolutionFwdAlgoGEMM,<unused>
864-14-14-1x1-128-14-14-32-0x0-1x1-1x1-0-NCHW-FP16-F=miopenConvolutionFwdAlgoImplicitGEMM:ConvHipImplicitGemmV4R1Fwd,0.205919,0,miopenConvolutionFwdAlgoImplicitGEMM,<unused>;miopenConvolutionFwdAlgoDirect:ConvAsm1x1U,0.1912,0,miopenConvolutionFwdAlgoDirect,<unused>;miopenConvolutionFwdAlgoWinograd:ConvBinWinogradRxSf3x2,0.326879,0,miopenConvolutionFwdAlgoWinograd,<unused>;miopenConvolutionFwdAlgoGEMM:GemmFwd1x1_0_1,0.1928,0,miopenConvolutionFwdAlgoGEMM,<unused>
896-14-14-1x1-128-14-14-32-0x0-1x1-1x1-0-NCHW-FP16-F=miopenConvolutionFwdAlgoImplicitGEMM:ConvHipImplicitGemmV4R1Fwd,0.21104,0,miopenConvolutionFwdAlgoImplicitGEMM,<unused>;miopenConvolutionFwdAlgoDirect:ConvAsm1x1U,0.19712,0,miopenConvolutionFwdAlgoDirect,<unused>;miopenConvolutionFwdAlgoWinograd:ConvBinWinogradRxSf3x2,0.338079,0,miopenConvolutionFwdAlgoWinograd,<unused>;miopenConvolutionFwdAlgoGEMM:GemmFwd1x1_0_1,0.19792,0,miopenConvolutionFwdAlgoGEMM,<unused>
928-14-14-1x1-128-14-14-32-0x0-1x1-1x1-0-NCHW-FP16-F=miopenConvolutionFwdAlgoImplicitGEMM:ConvHipImplicitGemmV4R1Fwd,0.219199,0,miopenConvolutionFwdAlgoImplicitGEMM,<unused>;miopenConvolutionFwdAlgoDirect:ConvAsm1x1U,0.19424,0,miopenConvolutionFwdAlgoDirect,<unused>;miopenConvolutionFwdAlgoWinograd:ConvBinWinogradRxSf3x2,0.346879,0,miopenConvolutionFwdAlgoWinograd,<unused>;miopenConvolutionFwdAlgoGEMM:GemmFwd1x1_0_1,0.2072,0,miopenConvolutionFwdAlgoGEMM,<unused>
960-14-14-1x1-128-14-14-32-0x0-1x1-1x1-0-NCHW-FP16-F=miopenConvolutionFwdAlgoImplicitGEMM:ConvHipImplicitGemmV4R1Fwd,0.22448,0,miopenConvolutionFwdAlgoImplicitGEMM,<unused>;miopenConvolutionFwdAlgoDirect:ConvAsm1x1U,0.208799,0,miopenConvolutionFwdAlgoDirect,<unused>;miopenConvolutionFwdAlgoWinograd:ConvBinWinogradRxSf3x2,0.357599,0,miopenConvolutionFwdAlgoWinograd,<unused>;miopenConvolutionFwdAlgoGEMM:GemmFwd1x1_0_1,0.209599,0,miopenConvolutionFwdAlgoGEMM,<unused>
992-14-14-1x1-128-14-14-32-0x0-1x1-1x1-0-NCHW-FP16-F=miopenConvolutionFwdAlgoImplicitGEMM:ConvHipImplicitGemmV4R1Fwd,0.233438,0,miopenConvolutionFwdAlgoImplicitGEMM,<unused>;miopenConvolutionFwdAlgoDirect:ConvAsm1x1U,0.218239,0,miopenConvolutionFwdAlgoDirect,<unused>;miopenConvolutionFwdAlgoWinograd:ConvBinWinogradRxSf3x2,0.368798,0,miopenConvolutionFwdAlgoWinograd,<unused>;miopenConvolutionFwdAlgoGEMM:GemmFwd1x1_0_1,0.216798,0,miopenConvolutionFwdAlgoGEMM,<unused>
1024-14-14-1x1-512-14-14-32-0x0-1x1-1x1-0-NCHW-FP16-F=miopenConvolutionFwdAlgoImplicitGEMM:ConvHipImplicitGemmV4R1Fwd,0.696795,0,miopenConvolutionFwdAlgoImplicitGEMM,<unused>;miopenConvolutionFwdAlgoDirect:ConvAsm1x1U,0.678555,0,miopenConvolutionFwdAlgoDirect,<unused>;miopenConvolutionFwdAlgoWinograd:ConvBinWinogradRxSf3x2,1.25183,0,miopenConvolutionFwdAlgoWinograd,<unused>;miopenConvolutionFwdAlgoGEMM:GemmFwd1x1_0_1,0.608636,0,miopenConvolutionFwdAlgoGEMM,<unused>
512-7-7-1x1-128-7-7-32-0x0-1x1-1x1-0-NCHW-FP16-F=miopenConvolutionFwdAlgoImplicitGEMM:ConvHipImplicitGemmV4R1Fwd,0.06992,0,miopenConvolutionFwdAlgoImplicitGEMM,<unused>;miopenConvolutionFwdAlgoDirect:ConvAsm1x1U,0.057279,0,miopenConvolutionFwdAlgoDirect,<unused>;miopenConvolutionFwdAlgoWinograd:ConvBinWinogradRxSf3x2,0.112639,0,miopenConvolutionFwdAlgoWinograd,<unused>;miopenConvolutionFwdAlgoGEMM:GemmFwd1x1_0_1,0.121439,0,miopenConvolutionFwdAlgoGEMM,<unused>
128-7-7-3x3-32-7-7-32-1x1-1x1-1x1-0-NCHW-FP16-F=miopenConvolutionFwdAlgoImplicitGEMM:ConvHipImplicitGemmV4R1Fwd,0.104479,0,miopenConvolutionFwdAlgoImplicitGEMM,<unused>;miopenConvolutionFwdAlgoDirect:ConvOclDirectFwd,0.092479,0,miopenConvolutionFwdAlgoDirect,<unused>;miopenConvolutionFwdAlgoWinograd:ConvBinWinogradRxS,0.048,0,miopenConvolutionFwdAlgoWinograd,<unused>;miopenConvolutionFwdAlgoGEMM:GemmFwdRest,6.96314,112896,miopenConvolutionFwdAlgoGEMM,<unused>
544-7-7-1x1-128-7-7-32-0x0-1x1-1x1-0-NCHW-FP16-F=miopenConvolutionFwdAlgoImplicitGEMM:ConvHipImplicitGemmV4R1Fwd,0.063839,0,miopenConvolutionFwdAlgoImplicitGEMM,<unused>;miopenConvolutionFwdAlgoDirect:ConvAsm1x1U,0.078239,0,miopenConvolutionFwdAlgoDirect,<unused>;miopenConvolutionFwdAlgoWinograd:ConvBinWinogradRxSf3x2,0.117759,0,miopenConvolutionFwdAlgoWinograd,<unused>;miopenConvolutionFwdAlgoGEMM:GemmFwd1x1_0_1,0.128959,0,miopenConvolutionFwdAlgoGEMM,<unused>
576-7-7-1x1-128-7-7-32-0x0-1x1-1x1-0-NCHW-FP16-F=miopenConvolutionFwdAlgoImplicitGEMM:ConvHipImplicitGemmV4R1Fwd,0.075199,0,miopenConvolutionFwdAlgoImplicitGEMM,<unused>;miopenConvolutionFwdAlgoDirect:ConvAsm1x1U,0.05728,0,miopenConvolutionFwdAlgoDirect,<unused>;miopenConvolutionFwdAlgoWinograd:ConvBinWinogradRxSf3x2,0.121439,0,miopenConvolutionFwdAlgoWinograd,<unused>;miopenConvolutionFwdAlgoGEMM:GemmFwd1x1_0_1,0.134718,0,miopenConvolutionFwdAlgoGEMM,<unused>
608-7-7-1x1-128-7-7-32-0x0-1x1-1x1-0-NCHW-FP16-F=miopenConvolutionFwdAlgoImplicitGEMM:ConvHipImplicitGemmV4R1Fwd,0.06928,0,miopenConvolutionFwdAlgoImplicitGEMM,<unused>;miopenConvolutionFwdAlgoDirect:ConvAsm1x1U,0.05904,0,miopenConvolutionFwdAlgoDirect,<unused>;miopenConvolutionFwdAlgoWinograd:ConvBinWinogradRxSf3x2,0.126398,0,miopenConvolutionFwdAlgoWinograd,<unused>;miopenConvolutionFwdAlgoGEMM:GemmFwd1x1_0_1,0.142398,0,miopenConvolutionFwdAlgoGEMM,<unused>
640-7-7-1x1-128-7-7-32-0x0-1x1-1x1-0-NCHW-FP16-F=miopenConvolutionFwdAlgoImplicitGEMM:ConvHipImplicitGemmV4R1Fwd,0.082559,0,miopenConvolutionFwdAlgoImplicitGEMM,<unused>;miopenConvolutionFwdAlgoDirect:ConvAsm1x1U,0.056799,0,miopenConvolutionFwdAlgoDirect,<unused>;miopenConvolutionFwdAlgoWinograd:ConvBinWinogradRxSf3x2,0.129759,0,miopenConvolutionFwdAlgoWinograd,<unused>;miopenConvolutionFwdAlgoGEMM:GemmFwd1x1_0_1,0.147359,0,miopenConvolutionFwdAlgoGEMM,<unused>
672-7-7-1x1-128-7-7-32-0x0-1x1-1x1-0-NCHW-FP16-F=miopenConvolutionFwdAlgoImplicitGEMM:ConvHipImplicitGemmV4R1Fwd,0.078559,0,miopenConvolutionFwdAlgoImplicitGEMM,<unused>;miopenConvolutionFwdAlgoDirect:ConvAsm1x1U,0.063199,0,miopenConvolutionFwdAlgoDirect,<unused>;miopenConvolutionFwdAlgoWinograd:ConvBinWinogradRxSf3x2,0.133439,0,miopenConvolutionFwdAlgoWinograd,<unused>;miopenConvolutionFwdAlgoGEMM:GemmFwd1x1_0_1,0.152478,0,miopenConvolutionFwdAlgoGEMM,<unused>
704-7-7-1x1-128-7-7-32-0x0-1x1-1x1-0-NCHW-FP16-F=miopenConvolutionFwdAlgoImplicitGEMM:ConvHipImplicitGemmV4R1Fwd,0.088319,0,miopenConvolutionFwdAlgoImplicitGEMM,<unused>;miopenConvolutionFwdAlgoDirect:ConvAsm1x1U,0.06144,0,miopenConvolutionFwdAlgoDirect,<unused>;miopenConvolutionFwdAlgoWinograd:ConvBinWinogradRxSf3x2,0.140318,0,miopenConvolutionFwdAlgoWinograd,<unused>;miopenConvolutionFwdAlgoGEMM:GemmFwd1x1_0_1,0.160798,0,miopenConvolutionFwdAlgoGEMM,<unused>
736-7-7-1x1-128-7-7-32-0x0-1x1-1x1-0-NCHW-FP16-F=miopenConvolutionFwdAlgoImplicitGEMM:ConvHipImplicitGemmV4R1Fwd,0.081759,0,miopenConvolutionFwdAlgoImplicitGEMM,<unused>;miopenConvolutionFwdAlgoDirect:ConvAsm1x1U,0.069119,0,miopenConvolutionFwdAlgoDirect,<unused>;miopenConvolutionFwdAlgoWinograd:ConvBinWinogradRxSf3x2,0.144958,0,miopenConvolutionFwdAlgoWinograd,<unused>;miopenConvolutionFwdAlgoGEMM:GemmFwd1x1_0_1,0.167358,0,miopenConvolutionFwdAlgoGEMM,<unused>
768-7-7-1x1-128-7-7-32-0x0-1x1-1x1-0-NCHW-FP16-F=miopenConvolutionFwdAlgoImplicitGEMM:ConvHipImplicitGemmV4R1Fwd,0.099358,0,miopenConvolutionFwdAlgoImplicitGEMM,<unused>;miopenConvolutionFwdAlgoDirect:ConvAsm1x1U,0.071839,0,miopenConvolutionFwdAlgoDirect,<unused>;miopenConvolutionFwdAlgoWinograd:ConvBinWinogradRxSf3x2,0.147999,0,miopenConvolutionFwdAlgoWinograd,<unused>;miopenConvolutionFwdAlgoGEMM:GemmFwd1x1_0_1,0.181438,0,miopenConvolutionFwdAlgoGEMM,<unused>
800-7-7-1x1-128-7-7-32-0x0-1x1-1x1-0-NCHW-FP16-F=miopenConvolutionFwdAlgoImplicitGEMM:ConvHipImplicitGemmV4R1Fwd,0.088319,0,miopenConvolutionFwdAlgoImplicitGEMM,<unused>;miopenConvolutionFwdAlgoDirect:ConvAsm1x1U,0.107519,0,miopenConvolutionFwdAlgoDirect,<unused>;miopenConvolutionFwdAlgoWinograd:ConvBinWinogradRxSf3x2,0.154398,0,miopenConvolutionFwdAlgoWinograd,<unused>;miopenConvolutionFwdAlgoGEMM:GemmFwd1x1_0_1,0.189278,0,miopenConvolutionFwdAlgoGEMM,<unused>
832-7-7-1x1-128-7-7-32-0x0-1x1-1x1-0-NCHW-FP16-F=miopenConvolutionFwdAlgoImplicitGEMM:ConvHipImplicitGemmV4R1Fwd,0.101439,0,miopenConvolutionFwdAlgoImplicitGEMM,<unused>;miopenConvolutionFwdAlgoDirect:ConvAsm1x1U,0.068639,0,miopenConvolutionFwdAlgoDirect,<unused>;miopenConvolutionFwdAlgoWinograd:ConvBinWinogradRxSf3x2,0.155678,0,miopenConvolutionFwdAlgoWinograd,<unused>;miopenConvolutionFwdAlgoGEMM:GemmFwd1x1_0_1,0.195037,0,miopenConvolutionFwdAlgoGEMM,<unused>
864-7-7-1x1-128-7-7-32-0x0-1x1-1x1-0-NCHW-FP16-F=miopenConvolutionFwdAlgoImplicitGEMM:ConvHipImplicitGemmV4R1Fwd,0.094238,0,miopenConvolutionFwdAlgoImplicitGEMM,<unused>;miopenConvolutionFwdAlgoDirect:ConvAsm1x1U,0.114718,0,miopenConvolutionFwdAlgoDirect,<unused>;miopenConvolutionFwdAlgoWinograd:ConvBinWinogradRxSf3x2,0.165278,0,miopenConvolutionFwdAlgoWinograd,<unused>;miopenConvolutionFwdAlgoGEMM:GemmFwd1x1_0_1,0.202398,0,miopenConvolutionFwdAlgoGEMM,<unused>
896-7-7-1x1-128-7-7-32-0x0-1x1-1x1-0-NCHW-FP16-F=miopenConvolutionFwdAlgoImplicitGEMM:ConvHipImplicitGemmV4R1Fwd,0.109759,0,miopenConvolutionFwdAlgoImplicitGEMM,<unused>;miopenConvolutionFwdAlgoDirect:ConvAsm1x1U,0.117759,0,miopenConvolutionFwdAlgoDirect,<unused>;miopenConvolutionFwdAlgoWinograd:ConvBinWinogradRxSf3x2,0.166238,0,miopenConvolutionFwdAlgoWinograd,<unused>;miopenConvolutionFwdAlgoGEMM:GemmFwd1x1_0_1,0.208957,0,miopenConvolutionFwdAlgoGEMM,<unused>
928-7-7-1x1-128-7-7-32-0x0-1x1-1x1-0-NCHW-FP16-F=miopenConvolutionFwdAlgoImplicitGEMM:ConvHipImplicitGemmV4R1Fwd,0.100479,0,miopenConvolutionFwdAlgoImplicitGEMM,<unused>;miopenConvolutionFwdAlgoDirect:ConvAsm1x1U,0.077119,0,miopenConvolutionFwdAlgoDirect,<unused>;miopenConvolutionFwdAlgoWinograd:ConvBinWinogradRxSf3x2,0.172158,0,miopenConvolutionFwdAlgoWinograd,<unused>;miopenConvolutionFwdAlgoGEMM:GemmFwd1x1_0_1,0.215838,0,miopenConvolutionFwdAlgoGEMM,<unused>
960-7-7-1x1-128-7-7-32-0x0-1x1-1x1-0-NCHW-FP16-F=miopenConvolutionFwdAlgoImplicitGEMM:ConvHipImplicitGemmV4R1Fwd,0.113119,0,miopenConvolutionFwdAlgoImplicitGEMM,<unused>;miopenConvolutionFwdAlgoDirect:ConvAsm1x1U,0.125598,0,miopenConvolutionFwdAlgoDirect,<unused>;miopenConvolutionFwdAlgoWinograd:ConvBinWinogradRxSf3x2,0.175197,0,miopenConvolutionFwdAlgoWinograd,<unused>;miopenConvolutionFwdAlgoGEMM:GemmFwd1x1_0_1,0.225597,0,miopenConvolutionFwdAlgoGEMM,<unused>
992-7-7-1x1-128-7-7-32-0x0-1x1-1x1-0-NCHW-FP16-F=miopenConvolutionFwdAlgoImplicitGEMM:ConvHipImplicitGemmV4R1Fwd,0.107039,0,miopenConvolutionFwdAlgoImplicitGEMM,<unused>;miopenConvolutionFwdAlgoDirect:ConvAsm1x1U,0.128799,0,miopenConvolutionFwdAlgoDirect,<unused>;miopenConvolutionFwdAlgoWinograd:ConvBinWinogradRxSf3x2,0.179838,0,miopenConvolutionFwdAlgoWinograd,<unused>;miopenConvolutionFwdAlgoGEMM:GemmFwd1x1_0_1,0.230717,0,miopenConvolutionFwdAlgoGEMM,<unused>
3-299-299-3x3-32-149-149-32-0x0-2x2-1x1-0-NCHW-FP32-F=miopenConvolutionFwdAlgoImplicitGEMM:ConvMlirIgemmFwd,0.761908,0,miopenConvolutionFwdAlgoImplicitGEMM,<unused>;miopenConvolutionFwdAlgoDirect:ConvOclDirectFwd,1.66925,0,miopenConvolutionFwdAlgoDirect,<unused>;miopenConvolutionFwdAlgoWinograd:ConvBinWinogradRxSf2x3g1,0.559031,0,miopenConvolutionFwdAlgoWinograd,<unused>;miopenConvolutionFwdAlgoGEMM:GemmFwdRest,1.59744,2397708,miopenConvolutionFwdAlgoGEMM,<unused>
32-149-149-3x3-32-147-147-32-0x0-1x1-1x1-0-NCHW-FP32-F=miopenConvolutionFwdAlgoImplicitGEMM:ConvHipImplicitGemmV4R1Fwd,1.5627,0,miopenConvolutionFwdAlgoImplicitGEMM,<unused>;miopenConvolutionFwdAlgoDirect:ConvOclDirectFwd,6.20775,0,miopenConvolutionFwdAlgoDirect,<unused>;miopenConvolutionFwdAlgoWinograd:ConvBinWinogradRxS,0.829428,0,miopenConvolutionFwdAlgoWinograd,<unused>;miopenConvolutionFwdAlgoGEMM:GemmFwdRest,5.00214,24893568,miopenConvolutionFwdAlgoGEMM,<unused>
32-147-147-3x3-64-147-147-32-1x1-1x1-1x1-0-NCHW-FP32-F=miopenConvolutionFwdAlgoWinograd:ConvBinWinograd3x3U,1.56045,0,miopenConvolutionFwdAlgoWinograd,<unused>
64-73-73-1x1-80-73-73-32-0x0-1x1-1x1-0-NCHW-FP32-F=miopenConvolutionFwdAlgoImplicitGEMM:ConvMlirIgemmFwd,0.826387,0,miopenConvolutionFwdAlgoImplicitGEMM,<unused>;miopenConvolutionFwdAlgoDirect:ConvAsm1x1U,0.294555,0,miopenConvolutionFwdAlgoDirect,<unused>;miopenConvolutionFwdAlgoWinograd:ConvBinWinogradRxSf3x2,0.611031,0,miopenConvolutionFwdAlgoWinograd,<unused>;miopenConvolutionFwdAlgoGEMM:GemmFwd1x1_0_1,0.379674,0,miopenConvolutionFwdAlgoGEMM,<unused>
80-73-73-3x3-192-71-71-32-0x0-1x1-1x1-0-NCHW-FP32-F=miopenConvolutionFwdAlgoImplicitGEMM:ConvHipImplicitGemmV4R1Fwd,4.61849,0,miopenConvolutionFwdAlgoImplicitGEMM,<unused>;miopenConvolutionFwdAlgoDirect:ConvOclDirectFwd,31.8483,0,miopenConvolutionFwdAlgoDirect,<unused>;miopenConvolutionFwdAlgoWinograd:ConvBinWinogradRxS,2.31229,0,miopenConvolutionFwdAlgoWinograd,<unused>;miopenConvolutionFwdAlgoGEMM:GemmFwdRest,5.98003,14518080,miopenConvolutionFwdAlgoGEMM,<unused>
192-35-35-1x1-128-35-35-32-0x0-1x1-1x1-0-NCHW-FP32-F=miopenConvolutionFwdAlgoImplicitGEMM:ConvHipImplicitGemmV4R1Fwd,0.279035,0,miopenConvolutionFwdAlgoImplicitGEMM,<unused>;miopenConvolutionFwdAlgoDirect:ConvAsm1x1U,0.254876,0,miopenConvolutionFwdAlgoDirect,<unused>;miopenConvolutionFwdAlgoWinograd:ConvBinWinogradRxSf3x2,0.452634,0,miopenConvolutionFwdAlgoWinograd,<unused>;miopenConvolutionFwdAlgoGEMM:GemmFwd1x1_0_1,0.237436,0,miopenConvolutionFwdAlgoGEMM,<unused>
192-35-35-1x1-48-35-35-32-0x0-1x1-1x1-0-NCHW-FP32-F=miopenConvolutionFwdAlgoImplicitGEMM:ConvMlirIgemmFwd,0.350555,0,miopenConvolutionFwdAlgoImplicitGEMM,<unused>;miopenConvolutionFwdAlgoDirect:ConvAsm1x1U,0.123038,0,miopenConvolutionFwdAlgoDirect,<unused>;miopenConvolutionFwdAlgoWinograd:ConvBinWinogradRxSf3x2,0.241117,0,miopenConvolutionFwdAlgoWinograd,<unused>;miopenConvolutionFwdAlgoGEMM:GemmFwd1x1_0_1,0.140478,0,miopenConvolutionFwdAlgoGEMM,<unused>
48-35-35-5x5-64-35-35-32-2x2-1x1-1x1-0-NCHW-FP32-F=miopenConvolutionFwdAlgoImplicitGEMM:ConvHipImplicitGemmV4R1Fwd,0.675511,0,miopenConvolutionFwdAlgoImplicitGEMM,<unused>;miopenConvolutionFwdAlgoDirect:ConvOclDirectFwd,4.22666,0,miopenConvolutionFwdAlgoDirect,<unused>;miopenConvolutionFwdAlgoWinograd:ConvBinWinogradRxSf2x3g1,0.471354,0,miopenConvolutionFwdAlgoWinograd,<unused>;miopenConvolutionFwdAlgoGEMM:GemmFwdRest,2.4575,5880000,miopenConvolutionFwdAlgoGEMM,<unused>
64-35-35-3x3-96-35-35-32-1x1-1x1-1x1-0-NCHW-FP32-F=miopenConvolutionFwdAlgoWinograd:ConvBinWinograd3x3U,0.272796,0,miopenConvolutionFwdAlgoWinograd,<unused>
96-35-35-3x3-96-35-35-32-1x1-1x1-1x1-0-NCHW-FP32-F=miopenConvolutionFwdAlgoWinograd:ConvBinWinograd3x3U,0.378393,0,miopenConvolutionFwdAlgoWinograd,<unused>
192-35-35-1x1-32-35-35-32-0x0-1x1-1x1-0-NCHW-FP32-F=miopenConvolutionFwdAlgoImplicitGEMM:ConvHipImplicitGemmV4R1Fwd,0.115359,0,miopenConvolutionFwdAlgoImplicitGEMM,<unused>;miopenConvolutionFwdAlgoDirect:ConvAsm1x1U,0.076479,0,miopenConvolutionFwdAlgoDirect,<unused>;miopenConvolutionFwdAlgoWinograd:ConvBinWinogradRxSf3x2,0.154398,0,miopenConvolutionFwdAlgoWinograd,<unused>;miopenConvolutionFwdAlgoGEMM:GemmFwd1x1_0_1,0.111358,0,miopenConvolutionFwdAlgoGEMM,<unused>
256-35-35-1x1-128-35-35-32-0x0-1x1-1x1-0-NCHW-FP32-F=miopenConvolutionFwdAlgoImplicitGEMM:ConvHipImplicitGemmV4R1Fwd,0.376955,0,miopenConvolutionFwdAlgoImplicitGEMM,<unused>;miopenConvolutionFwdAlgoDirect:ConvAsm1x1U,0.333755,0,miopenConvolutionFwdAlgoDirect,<unused>;miopenConvolutionFwdAlgoWinograd:ConvBinWinogradRxSf3x2,0.574232,0,miopenConvolutionFwdAlgoWinograd,<unused>;miopenConvolutionFwdAlgoGEMM:GemmFwd1x1_0_1,0.282717,0,miopenConvolutionFwdAlgoGEMM,<unused>
256-35-35-1x1-48-35-35-32-0x0-1x1-1x1-0-NCHW-FP32-F=miopenConvolutionFwdAlgoImplicitGEMM:ConvMlirIgemmFwd,0.456794,0,miopenConvolutionFwdAlgoImplicitGEMM,<unused>;miopenConvolutionFwdAlgoDirect:ConvAsm1x1U,0.152798,0,miopenConvolutionFwdAlgoDirect,<unused>;miopenConvolutionFwdAlgoWinograd:ConvBinWinogradRxSf3x2,0.300956,0,miopenConvolutionFwdAlgoWinograd,<unused>;miopenConvolutionFwdAlgoGEMM:GemmFwd1x1_0_1,0.165598,0,miopenConvolutionFwdAlgoGEMM,<unused>
256-35-35-1x1-64-35-35-32-0x0-1x1-1x1-0-NCHW-FP32-F=miopenConvolutionFwdAlgoImplicitGEMM:ConvHipImplicitGemmV4R1Fwd,0.238877,0,miopenConvolutionFwdAlgoImplicitGEMM,<unused>;miopenConvolutionFwdAlgoDirect:ConvAsm1x1U,0.175997,0,miopenConvolutionFwdAlgoDirect,<unused>;miopenConvolutionFwdAlgoWinograd:ConvBinWinogradRxSf3x2,0.303356,0,miopenConvolutionFwdAlgoWinograd,<unused>;miopenConvolutionFwdAlgoGEMM:GemmFwd1x1_0_1,0.161758,0,miopenConvolutionFwdAlgoGEMM,<unused>
288-35-35-1x1-128-35-35-32-0x0-1x1-1x1-0-NCHW-FP32-F=miopenConvolutionFwdAlgoImplicitGEMM:ConvHipImplicitGemmV4R1Fwd,0.353436,0,miopenConvolutionFwdAlgoImplicitGEMM,<unused>;miopenConvolutionFwdAlgoDirect:ConvAsm1x1U,0.364635,0,miopenConvolutionFwdAlgoDirect,<unused>;miopenConvolutionFwdAlgoWinograd:ConvBinWinogradRxSf3x2,0.635352,0,miopenConvolutionFwdAlgoWinograd,<unused>;miopenConvolutionFwdAlgoGEMM:GemmFwd1x1_0_1,0.312476,0,miopenConvolutionFwdAlgoGEMM,<unused>
288-35-35-1x1-48-35-35-32-0x0-1x1-1x1-0-NCHW-FP32-F=miopenConvolutionFwdAlgoImplicitGEMM:ConvMlirIgemmFwd,0.506393,0,miopenConvolutionFwdAlgoImplicitGEMM,<unused>;miopenConvolutionFwdAlgoDirect:ConvAsm1x1U,0.169918,0,miopenConvolutionFwdAlgoDirect,<unused>;miopenConvolutionFwdAlgoWinograd:ConvBinWinogradRxSf3x2,0.330236,0,miopenConvolutionFwdAlgoWinograd,<unused>;miopenConvolutionFwdAlgoGEMM:GemmFwd1x1_0_1,0.179837,0,miopenConvolutionFwdAlgoGEMM,<unused>
288-35-35-1x1-64-35-35-32-0x0-1x1-1x1-0-NCHW-FP32-F=miopenConvolutionFwdAlgoImplicitGEMM:ConvHipImplicitGemmV4R1Fwd,0.222237,0,miopenConvolutionFwdAlgoImplicitGEMM,<unused>;miopenConvolutionFwdAlgoDirect:ConvAsm1x1U,0.195197,0,miopenConvolutionFwdAlgoDirect,<unused>;miopenConvolutionFwdAlgoWinograd:ConvBinWinogradRxSf3x2,0.334716,0,miopenConvolutionFwdAlgoWinograd,<unused>;miopenConvolutionFwdAlgoGEMM:GemmFwd1x1_0_1,0.179677,0,miopenConvolutionFwdAlgoGEMM,<unused>
288-35-35-3x3-384-17-17-32-0x0-2x2-1x1-0-NCHW-FP32-F=miopenConvolutionFwdAlgoImplicitGEMM:ConvHipImplicitGemmV4R1Fwd,1.95741,0,miopenConvolutionFwdAlgoImplicitGEMM,<unused>;miopenConvolutionFwdAlgoDirect:ConvOclDirectFwd,48.4955,0,miopenConvolutionFwdAlgoDirect,<unused>;miopenConvolutionFwdAlgoWinograd:ConvBinWinogradRxS,4.0929,0,miopenConvolutionFwdAlgoWinograd,<unused>;miopenConvolutionFwdAlgoGEMM:GemmFwdRest,3.66067,2996352,miopenConvolutionFwdAlgoGEMM,<unused>
96-35-35-3x3-96-17-17-32-0x0-2x2-1x1-0-NCHW-FP32-F=miopenConvolutionFwdAlgoImplicitGEMM:ConvHipImplicitGemmV4R1Fwd,0.232477,0,miopenConvolutionFwdAlgoImplicitGEMM,<unused>;miopenConvolutionFwdAlgoDirect:ConvOclDirectFwd,2.01053,0,miopenConvolutionFwdAlgoDirect,<unused>;miopenConvolutionFwdAlgoWinograd:ConvBinWinogradRxSf2x3g1,0.435514,0,miopenConvolutionFwdAlgoWinograd,<unused>;miopenConvolutionFwdAlgoGEMM:GemmFwdRest,1.66909,998784,miopenConvolutionFwdAlgoGEMM,<unused>
768-17-17-1x1-256-17-17-32-0x0-1x1-1x1-0-NCHW-FP32-F=miopenConvolutionFwdAlgoImplicitGEMM:ConvHipImplicitGemmV4R1Fwd,0.548953,0,miopenConvolutionFwdAlgoImplicitGEMM,<unused>;miopenConvolutionFwdAlgoDirect:ConvAsm1x1U,0.503514,0,miopenConvolutionFwdAlgoDirect,<unused>;miopenConvolutionFwdAlgoWinograd:ConvBinWinogradRxSf3x2,0.78639,0,miopenConvolutionFwdAlgoWinograd,<unused>;miopenConvolutionFwdAlgoGEMM:GemmFwd1x1_0_1,0.433595,0,miopenConvolutionFwdAlgoGEMM,<unused>
768-17-17-1x1-192-17-17-32-0x0-1x1-1x1-0-NCHW-FP32-F=miopenConvolutionFwdAlgoImplicitGEMM:ConvHipImplicitGemmV4R1Fwd,0.432954,0,miopenConvolutionFwdAlgoImplicitGEMM,<unused>;miopenConvolutionFwdAlgoDirect:ConvAsm1x1U,0.491513,0,miopenConvolutionFwdAlgoDirect,<unused>;miopenConvolutionFwdAlgoWinograd:ConvBinWinogradRxSf3x2,0.635672,0,miopenConvolutionFwdAlgoWinograd,<unused>;miopenConvolutionFwdAlgoGEMM:GemmFwd1x1_0_1,0.349436,0,miopenConvolutionFwdAlgoGEMM,<unused>
128-17-17-1x7-128-17-17-32-0x3-1x1-1x1-0-NCHW-FP32-F=miopenConvolutionFwdAlgoImplicitGEMM:ConvHipImplicitGemmV4R1Fwd,0.295356,0,miopenConvolutionFwdAlgoImplicitGEMM,<unused>;miopenConvolutionFwdAlgoDirect:ConvDirectNaiveConvFwd,4.76842,0,miopenConvolutionFwdAlgoDirect,<unused>;miopenConvolutionFwdAlgoWinograd:ConvBinWinogradRxSf3x2,0.341115,0,miopenConvolutionFwdAlgoWinograd,<unused>;miopenConvolutionFwdAlgoGEMM:GemmFwdRest,1.664,1035776,miopenConvolutionFwdAlgoGEMM,<unused>
128-17-17-7x1-192-17-17-32-3x0-1x1-1x1-0-NCHW-FP32-F=miopenConvolutionFwdAlgoImplicitGEMM:ConvHipImplicitGemmV4R1Fwd,0.444154,0,miopenConvolutionFwdAlgoImplicitGEMM,<unused>;miopenConvolutionFwdAlgoDirect:ConvDirectNaiveConvFwd,7.99957,0,miopenConvolutionFwdAlgoDirect,<unused>;miopenConvolutionFwdAlgoWinograd:ConvBinWinogradRxSf3x2,0.451674,0,miopenConvolutionFwdAlgoWinograd,<unused>;miopenConvolutionFwdAlgoGEMM:GemmFwdRest,1.55645,1035776,miopenConvolutionFwdAlgoGEMM,<unused>
128-17-17-7x1-128-17-17-32-3x0-1x1-1x1-0-NCHW-FP32-F=miopenConvolutionFwdAlgoImplicitGEMM:ConvHipImplicitGemmV4R1Fwd,0.353115,0,miopenConvolutionFwdAlgoImplicitGEMM,<unused>;miopenConvolutionFwdAlgoDirect:ConvDirectNaiveConvFwd,5.71992,0,miopenConvolutionFwdAlgoDirect,<unused>;miopenConvolutionFwdAlgoWinograd:ConvBinWinogradRxSf3x2,0.346395,0,miopenConvolutionFwdAlgoWinograd,<unused>;miopenConvolutionFwdAlgoGEMM:GemmFwdRest,1.75101,1035776,miopenConvolutionFwdAlgoGEMM,<unused>
128-17-17-1x7-192-17-17-32-0x3-1x1-1x1-0-NCHW-FP32-F=miopenConvolutionFwdAlgoImplicitGEMM:ConvHipImplicitGemmV4R1Fwd,0.409731,0,miopenConvolutionFwdAlgoImplicitGEMM,<unused>;miopenConvolutionFwdAlgoDirect:ConvDirectNaiveConvFwd,6.87099,0,miopenConvolutionFwdAlgoDirect,<unused>;miopenConvolutionFwdAlgoWinograd:ConvBinWinogradRxSf3x2,0.443207,0,miopenConvolutionFwdAlgoWinograd,<unused>;miopenConvolutionFwdAlgoGEMM:GemmFwdRest,1.76131,1035776,miopenConvolutionFwdAlgoGEMM,<unused>
768-17-17-1x1-320-17-17-32-0x0-1x1-1x1-0-NCHW-FP32-F=miopenConvolutionFwdAlgoImplicitGEMM:ConvHipImplicitGemmV4R1Fwd,0.681612,0,miopenConvolutionFwdAlgoImplicitGEMM,<unused>;miopenConvolutionFwdAlgoDirect:ConvOclDirectFwd1x1,0.61649,0,miopenConvolutionFwdAlgoDirect,<unused>;miopenConvolutionFwdAlgoWinograd:ConvBinWinogradRxSf3x2,0.935696,0,miopenConvolutionFwdAlgoWinograd,<unused>;miopenConvolutionFwdAlgoGEMM:GemmFwd1x1_0_1,0.512009,0,miopenConvolutionFwdAlgoGEMM,<unused>
160-17-17-1x7-160-17-17-32-0x3-1x1-1x1-0-NCHW-FP32-F=miopenConvolutionFwdAlgoImplicitGEMM:ConvHipImplicitGemmV4R1Fwd,0.413291,0,miopenConvolutionFwdAlgoImplicitGEMM,<unused>;miopenConvolutionFwdAlgoDirect:ConvDirectNaiveConvFwd,7.10994,0,miopenConvolutionFwdAlgoDirect,<unused>;miopenConvolutionFwdAlgoWinograd:ConvBinWinogradRxSf3x2,0.415211,0,miopenConvolutionFwdAlgoWinograd,<unused>;miopenConvolutionFwdAlgoGEMM:GemmFwdRest,1.81251,1294720,miopenConvolutionFwdAlgoGEMM,<unused>
160-17-17-7x1-192-17-17-32-3x0-1x1-1x1-0-NCHW-FP32-F=miopenConvolutionFwdAlgoImplicitGEMM:ConvHipImplicitGemmV4R1Fwd,0.545774,0,miopenConvolutionFwdAlgoImplicitGEMM,<unused>;miopenConvolutionFwdAlgoDirect:ConvDirectNaiveConvFwd,9.78058,0,miopenConvolutionFwdAlgoDirect,<unused>;miopenConvolutionFwdAlgoWinograd:ConvBinWinogradRxSf3x2,0.547854,0,miopenConvolutionFwdAlgoWinograd,<unused>;miopenConvolutionFwdAlgoGEMM:GemmFwdRest,1.90467,1294720,miopenConvolutionFwdAlgoGEMM,<unused>
160-17-17-7x1-160-17-17-32-3x0-1x1-1x1-0-NCHW-FP32-F=miopenConvolutionFwdAlgoImplicitGEMM:ConvHipImplicitGemmV4R1Fwd,0.497936,0,miopenConvolutionFwdAlgoImplicitGEMM,<unused>;miopenConvolutionFwdAlgoDirect:ConvDirectNaiveConvFwd,8.47484,0,miopenConvolutionFwdAlgoDirect,<unused>;miopenConvolutionFwdAlgoWinograd:ConvBinWinogradRxSf3x2,0.422094,0,miopenConvolutionFwdAlgoWinograd,<unused>;miopenConvolutionFwdAlgoGEMM:GemmFwdRest,1.90467,1294720,miopenConvolutionFwdAlgoGEMM,<unused>
160-17-17-1x7-192-17-17-32-0x3-1x1-1x1-0-NCHW-FP32-F=miopenConvolutionFwdAlgoImplicitGEMM:ConvHipImplicitGemmV4R1Fwd,0.475376,0,miopenConvolutionFwdAlgoImplicitGEMM,<unused>;miopenConvolutionFwdAlgoDirect:ConvDirectNaiveConvFwd,8.23948,0,miopenConvolutionFwdAlgoDirect,<unused>;miopenConvolutionFwdAlgoWinograd:ConvBinWinogradRxSf3x2,0.539058,0,miopenConvolutionFwdAlgoWinograd,<unused>;miopenConvolutionFwdAlgoGEMM:GemmFwdRest,1.94054,1294720,miopenConvolutionFwdAlgoGEMM,<unused>
768-17-17-1x1-576-17-17-32-0x0-1x1-1x1-0-NCHW-FP32-F=miopenConvolutionFwdAlgoImplicitGEMM:ConvHipImplicitGemmV4R1Fwd,1.19221,0,miopenConvolutionFwdAlgoImplicitGEMM,<unused>;miopenConvolutionFwdAlgoDirect:ConvAsm1x1U,0.988366,0,miopenConvolutionFwdAlgoDirect,<unused>;miopenConvolutionFwdAlgoWinograd:ConvBinWinogradRxSf3x2,1.68488,0,miopenConvolutionFwdAlgoWinograd,<unused>;miopenConvolutionFwdAlgoGEMM:GemmFwd1x1_0_1,1.03621,0,miopenConvolutionFwdAlgoGEMM,<unused>
192-17-17-1x7-192-17-17-32-0x3-1x1-1x1-0-NCHW-FP32-F=miopenConvolutionFwdAlgoImplicitGEMM:ConvHipImplicitGemmV4R1Fwd,0.56787,0,miopenConvolutionFwdAlgoImplicitGEMM,<unused>;miopenConvolutionFwdAlgoDirect:ConvDirectNaiveConvFwd,9.67811,0,miopenConvolutionFwdAlgoDirect,<unused>;miopenConvolutionFwdAlgoWinograd:ConvBinWinogradRxSf3x2,0.635713,0,miopenConvolutionFwdAlgoWinograd,<unused>;miopenConvolutionFwdAlgoGEMM:GemmFwdRest,2.04301,1553664,miopenConvolutionFwdAlgoGEMM,<unused>
192-17-17-7x1-192-17-17-32-3x0-1x1-1x1-0-NCHW-FP32-F=miopenConvolutionFwdAlgoImplicitGEMM:ConvHipImplicitGemmV4R1Fwd,0.7242,0,miopenConvolutionFwdAlgoImplicitGEMM,<unused>;miopenConvolutionFwdAlgoDirect:ConvDirectNaiveConvFwd,11.4923,0,miopenConvolutionFwdAlgoDirect,<unused>;miopenConvolutionFwdAlgoWinograd:ConvBinWinogradRxSf3x2,0.643875,0,miopenConvolutionFwdAlgoWinograd,<unused>;miopenConvolutionFwdAlgoGEMM:GemmFwdRest,1.9969,1553664,miopenConvolutionFwdAlgoGEMM,<unused>
768-17-17-1x1-384-17-17-32-0x0-1x1-1x1-0-NCHW-FP32-F=miopenConvolutionFwdAlgoImplicitGEMM:ConvHipImplicitGemmV4R1Fwd,0.810284,0,miopenConvolutionFwdAlgoImplicitGEMM,<unused>;miopenConvolutionFwdAlgoDirect:ConvOclDirectFwd1x1,0.622274,0,miopenConvolutionFwdAlgoDirect,<unused>;miopenConvolutionFwdAlgoWinograd:ConvBinWinogradRxSf3x2,1.23015,0,miopenConvolutionFwdAlgoWinograd,<unused>;miopenConvolutionFwdAlgoGEMM:GemmFwd1x1_0_1,0.586912,0,miopenConvolutionFwdAlgoGEMM,<unused>
192-17-17-3x3-320-8-8-32-0x0-2x2-1x1-0-NCHW-FP32-F=miopenConvolutionFwdAlgoImplicitGEMM:ConvHipImplicitGemmV4R1Fwd,0.281935,0,miopenConvolutionFwdAlgoImplicitGEMM,<unused>;miopenConvolutionFwdAlgoDirect:ConvOclDirectFwd,1.68409,0,miopenConvolutionFwdAlgoDirect,<unused>;miopenConvolutionFwdAlgoWinograd:ConvBinWinogradRxSf2x3g1,0.508828,0,miopenConvolutionFwdAlgoWinograd,<unused>;miopenConvolutionFwdAlgoGEMM:GemmFwdRest,2.13005,442368,miopenConvolutionFwdAlgoGEMM,<unused>
192-17-17-3x3-192-8-8-32-0x0-2x2-1x1-0-NCHW-FP32-F=miopenConvolutionFwdAlgoImplicitGEMM:ConvHipImplicitGemmV4R1Fwd,0.228493,0,miopenConvolutionFwdAlgoImplicitGEMM,<unused>;miopenConvolutionFwdAlgoDirect:ConvOclDirectFwd,1.62569,0,miopenConvolutionFwdAlgoDirect,<unused>;miopenConvolutionFwdAlgoWinograd:ConvBinWinogradRxSf2x3g1,0.348499,0,miopenConvolutionFwdAlgoWinograd,<unused>;miopenConvolutionFwdAlgoGEMM:GemmFwdRest,2.29901,442368,miopenConvolutionFwdAlgoGEMM,<unused>
1280-8-8-1x1-320-8-8-32-0x0-1x1-1x1-0-NCHW-FP32-F=miopenConvolutionFwdAlgoImplicitGEMM:ConvHipImplicitGemmV4R1Fwd,0.207212,0,miopenConvolutionFwdAlgoImplicitGEMM,<unused>;miopenConvolutionFwdAlgoDirect:ConvAsm1x1U,0.267535,0,miopenConvolutionFwdAlgoDirect,<unused>;miopenConvolutionFwdAlgoWinograd:ConvBinWinogradRxSf3x2,0.528349,0,miopenConvolutionFwdAlgoWinograd,<unused>;miopenConvolutionFwdAlgoGEMM:GemmFwd1x1_0_1,0.479387,0,miopenConvolutionFwdAlgoGEMM,<unused>
1280-8-8-1x1-384-8-8-32-0x0-1x1-1x1-0-NCHW-FP32-F=miopenConvolutionFwdAlgoImplicitGEMM:ConvHipImplicitGemmV4R1Fwd,0.252334,0,miopenConvolutionFwdAlgoImplicitGEMM,<unused>;miopenConvolutionFwdAlgoDirect:ConvAsm1x1U,0.309937,0,miopenConvolutionFwdAlgoDirect,<unused>;miopenConvolutionFwdAlgoWinograd:ConvBinWinogradRxSf3x2,0.53091,0,miopenConvolutionFwdAlgoWinograd,<unused>;miopenConvolutionFwdAlgoGEMM:GemmFwd1x1_0_1,0.570432,0,miopenConvolutionFwdAlgoGEMM,<unused>
384-8-8-1x3-384-8-8-32-0x1-1x1-1x1-0-NCHW-FP32-F=miopenConvolutionFwdAlgoImplicitGEMM:ConvHipImplicitGemmV4R1Fwd,0.271375,0,miopenConvolutionFwdAlgoImplicitGEMM,<unused>;miopenConvolutionFwdAlgoDirect:ConvDirectNaiveConvFwd,6.0269,0,miopenConvolutionFwdAlgoDirect,<unused>;miopenConvolutionFwdAlgoWinograd:ConvBinWinogradRxSf2x3g1,0.335378,0,miopenConvolutionFwdAlgoWinograd,<unused>;miopenConvolutionFwdAlgoGEMM:GemmFwdRest,1.7665,294912,miopenConvolutionFwdAlgoGEMM,<unused>
384-8-8-3x1-384-8-8-32-1x0-1x1-1x1-0-NCHW-FP32-F=miopenConvolutionFwdAlgoImplicitGEMM:ConvHipImplicitGemmV4R1Fwd,0.272656,0,miopenConvolutionFwdAlgoImplicitGEMM,<unused>;miopenConvolutionFwdAlgoDirect:ConvDirectNaiveConvFwd,6.97431,0,miopenConvolutionFwdAlgoDirect,<unused>;miopenConvolutionFwdAlgoWinograd:ConvBinWinogradRxSf2x3g1,0.336819,0,miopenConvolutionFwdAlgoWinograd,<unused>;miopenConvolutionFwdAlgoGEMM:GemmFwdRest,1.63853,294912,miopenConvolutionFwdAlgoGEMM,<unused>
1280-8-8-1x1-448-8-8-32-0x0-1x1-1x1-0-NCHW-FP32-F=miopenConvolutionFwdAlgoImplicitGEMM:ConvHipImplicitGemmV4R1Fwd,0.260014,0,miopenConvolutionFwdAlgoImplicitGEMM,<unused>;miopenConvolutionFwdAlgoDirect:ConvAsm1x1U,0.332498,0,miopenConvolutionFwdAlgoDirect,<unused>;miopenConvolutionFwdAlgoWinograd:ConvBinWinogradRxSf3x2,0.778443,0,miopenConvolutionFwdAlgoWinograd,<unused>;miopenConvolutionFwdAlgoGEMM:GemmFwd1x1_0_1,0.652356,0,miopenConvolutionFwdAlgoGEMM,<unused>
448-8-8-3x3-384-8-8-32-1x1-1x1-1x1-0-NCHW-FP32-F=miopenConvolutionFwdAlgoWinograd:ConvBinWinograd3x3U,0.38306,0,miopenConvolutionFwdAlgoWinograd,<unused>
1280-8-8-1x1-192-8-8-32-0x0-1x1-1x1-0-NCHW-FP32-F=miopenConvolutionFwdAlgoImplicitGEMM:ConvHipImplicitGemmV4R1Fwd,0.170729,0,miopenConvolutionFwdAlgoImplicitGEMM,<unused>;miopenConvolutionFwdAlgoDirect:ConvAsm1x1U,0.17985,0,miopenConvolutionFwdAlgoDirect,<unused>;miopenConvolutionFwdAlgoWinograd:ConvBinWinogradRxSf3x2,0.292977,0,miopenConvolutionFwdAlgoWinograd,<unused>;miopenConvolutionFwdAlgoGEMM:GemmFwd1x1_0_1,0.304817,0,miopenConvolutionFwdAlgoGEMM,<unused>
2048-8-8-1x1-320-8-8-32-0x0-1x1-1x1-0-NCHW-FP32-F=miopenConvolutionFwdAlgoImplicitGEMM:ConvHipImplicitGemmV4R1Fwd,0.448185,0,miopenConvolutionFwdAlgoImplicitGEMM,<unused>;miopenConvolutionFwdAlgoDirect:ConvAsm1x1U,0.656996,0,miopenConvolutionFwdAlgoDirect,<unused>;miopenConvolutionFwdAlgoWinograd:ConvBinWinogradRxSf3x2,0.835727,0,miopenConvolutionFwdAlgoWinograd,<unused>;miopenConvolutionFwdAlgoGEMM:GemmFwd1x1_0_1,0.689478,0,miopenConvolutionFwdAlgoGEMM,<unused>
2048-8-8-1x1-384-8-8-32-0x0-1x1-1x1-0-NCHW-FP32-F=miopenConvolutionFwdAlgoImplicitGEMM:ConvHipImplicitGemmV4R1Fwd,0.419223,0,miopenConvolutionFwdAlgoImplicitGEMM,<unused>;miopenConvolutionFwdAlgoDirect:ConvAsm1x1U,0.553791,0,miopenConvolutionFwdAlgoDirect,<unused>;miopenConvolutionFwdAlgoWinograd:ConvBinWinogradRxSf3x2,0.828686,0,miopenConvolutionFwdAlgoWinograd,<unused>;miopenConvolutionFwdAlgoGEMM:GemmFwd1x1_0_1,0.830766,0,miopenConvolutionFwdAlgoGEMM,<unused>
2048-8-8-1x1-448-8-8-32-0x0-1x1-1x1-0-NCHW-FP32-F=miopenConvolutionFwdAlgoImplicitGEMM:ConvHipImplicitGemmV4R1Fwd,0.453773,0,miopenConvolutionFwdAlgoImplicitGEMM,<unused>;miopenConvolutionFwdAlgoDirect:ConvAsm1x1U,0.565297,0,miopenConvolutionFwdAlgoDirect,<unused>;miopenConvolutionFwdAlgoWinograd:ConvBinWinogradRxSf3x2,1.22068,0,miopenConvolutionFwdAlgoWinograd,<unused>;miopenConvolutionFwdAlgoGEMM:GemmFwd1x1_0_1,0.952028,0,miopenConvolutionFwdAlgoGEMM,<unused>
2048-8-8-1x1-192-8-8-32-0x0-1x1-1x1-0-NCHW-FP32-F=miopenConvolutionFwdAlgoImplicitGEMM:ConvHipImplicitGemmV4R1Fwd,0.278563,0,miopenConvolutionFwdAlgoImplicitGEMM,<unused>;miopenConvolutionFwdAlgoDirect:ConvAsm1x1U,0.330244,0,miopenConvolutionFwdAlgoDirect,<unused>;miopenConvolutionFwdAlgoWinograd:ConvBinWinogradRxSf3x2,0.445445,0,miopenConvolutionFwdAlgoWinograd,<unused>;miopenConvolutionFwdAlgoGEMM:GemmFwd1x1_0_1,0.436484,0,miopenConvolutionFwdAlgoGEMM,<unused>
3-299-299-3x3-32-149-149-32-0x0-2x2-1x1-0-NCHW-FP16-F=miopenConvolutionFwdAlgoImplicitGEMM:ConvMlirIgemmFwd,0.938562,0,miopenConvolutionFwdAlgoImplicitGEMM,<unused>;miopenConvolutionFwdAlgoDirect:ConvOclDirectFwdGen,0.471361,0,miopenConvolutionFwdAlgoDirect,<unused>;miopenConvolutionFwdAlgoWinograd:ConvBinWinogradRxSf2x3g1,0.509761,0,miopenConvolutionFwdAlgoWinograd,<unused>;miopenConvolutionFwdAlgoGEMM:GemmFwdRest,1.88928,1198854,miopenConvolutionFwdAlgoGEMM,<unused>
32-149-149-3x3-32-147-147-32-0x0-1x1-1x1-0-NCHW-FP16-F=miopenConvolutionFwdAlgoImplicitGEMM:ConvHipImplicitGemmV4R1Fwd,1.19648,0,miopenConvolutionFwdAlgoImplicitGEMM,<unused>;miopenConvolutionFwdAlgoDirect:ConvOclDirectFwd,2.01697,0,miopenConvolutionFwdAlgoDirect,<unused>;miopenConvolutionFwdAlgoWinograd:ConvBinWinogradRxSf2x3g1,0.590562,0,miopenConvolutionFwdAlgoWinograd,<unused>;miopenConvolutionFwdAlgoGEMM:GemmFwdRest,7.22432,12446784,miopenConvolutionFwdAlgoGEMM,<unused>
32-147-147-3x3-64-147-147-32-1x1-1x1-1x1-0-NCHW-FP16-F=miopenConvolutionFwdAlgoImplicitGEMM:ConvHipImplicitGemmV4R1Fwd,2.12321,0,miopenConvolutionFwdAlgoImplicitGEMM,<unused>;miopenConvolutionFwdAlgoDirect:ConvOclDirectFwd,3.88754,0,miopenConvolutionFwdAlgoDirect,<unused>;miopenConvolutionFwdAlgoWinograd:ConvBinWinogradRxSf2x3g1,1.12768,0,miopenConvolutionFwdAlgoWinograd,<unused>;miopenConvolutionFwdAlgoGEMM:GemmFwdRest,7.29603,12446784,miopenConvolutionFwdAlgoGEMM,<unused>
64-73-73-1x1-80-73-73-32-0x0-1x1-1x1-0-NCHW-FP16-F=miopenConvolutionFwdAlgoImplicitGEMM:ConvMlirIgemmFwd,0.781444,0,miopenConvolutionFwdAlgoImplicitGEMM,<unused>;miopenConvolutionFwdAlgoDirect:ConvAsm1x1U,0.199681,0,miopenConvolutionFwdAlgoDirect,<unused>;miopenConvolutionFwdAlgoWinograd:ConvBinWinogradRxSf3x2,0.413282,0,miopenConvolutionFwdAlgoWinograd,<unused>;miopenConvolutionFwdAlgoGEMM:GemmFwd1x1_0_1,0.560003,0,miopenConvolutionFwdAlgoGEMM,<unused>
80-73-73-3x3-192-71-71-32-0x0-1x1-1x1-0-NCHW-FP16-F=miopenConvolutionFwdAlgoImplicitGEMM:ConvHipImplicitGemmV4R1Fwd,3.07538,0,miopenConvolutionFwdAlgoImplicitGEMM,<unused>;miopenConvolutionFwdAlgoDirect:ConvOclDirectFwd,7.37588,0,miopenConvolutionFwdAlgoDirect,<unused>;miopenConvolutionFwdAlgoWinograd:ConvBinWinogradRxS,1.47361,0,miopenConvolutionFwdAlgoWinograd,<unused>;miopenConvolutionFwdAlgoGEMM:GemmFwdRest,10.0864,7259040,miopenConvolutionFwdAlgoGEMM,<unused>
192-35-35-1x1-128-35-35-32-0x0-1x1-1x1-0-NCHW-FP16-F=miopenConvolutionFwdAlgoImplicitGEMM:ConvHipImplicitGemmV4R1Fwd,0.337923,0,miopenConvolutionFwdAlgoImplicitGEMM,<unused>;miopenConvolutionFwdAlgoDirect:ConvAsm1x1U,0.205762,0,miopenConvolutionFwdAlgoDirect,<unused>;miopenConvolutionFwdAlgoWinograd:ConvBinWinogradRxSf3x2,0.305443,0,miopenConvolutionFwdAlgoWinograd,<unused>;miopenConvolutionFwdAlgoGEMM:GemmFwd1x1_0_1,0.384643,0,miopenConvolutionFwdAlgoGEMM,<unused>
192-35-35-1x1-48-35-35-32-0x0-1x1-1x1-0-NCHW-FP16-F=miopenConvolutionFwdAlgoImplicitGEMM:ConvMlirIgemmFwd,0.418883,0,miopenConvolutionFwdAlgoImplicitGEMM,<unused>;miopenConvolutionFwdAlgoDirect:ConvAsm1x1U,0.089121,0,miopenConvolutionFwdAlgoDirect,<unused>;miopenConvolutionFwdAlgoWinograd:ConvBinWinogradRxSf3x2,0.169922,0,miopenConvolutionFwdAlgoWinograd,<unused>;miopenConvolutionFwdAlgoGEMM:GemmFwd1x1_0_1,0.206562,0,miopenConvolutionFwdAlgoGEMM,<unused>
48-35-35-5x5-64-35-35-32-2x2-1x1-1x1-0-NCHW-FP16-F=miopenConvolutionFwdAlgoImplicitGEMM:ConvHipImplicitGemmV4R1Fwd,0.502085,0,miopenConvolutionFwdAlgoImplicitGEMM,<unused>;miopenConvolutionFwdAlgoDirect:ConvOclDirectFwd,1.46465,0,miopenConvolutionFwdAlgoDirect,<unused>;miopenConvolutionFwdAlgoWinograd:ConvBinWinogradRxS,0.312802,0,miopenConvolutionFwdAlgoWinograd,<unused>;miopenConvolutionFwdAlgoGEMM:GemmFwdRest,7.6135,2940000,miopenConvolutionFwdAlgoGEMM,<unused>
64-35-35-3x3-96-35-35-32-1x1-1x1-1x1-0-NCHW-FP16-F=miopenConvolutionFwdAlgoImplicitGEMM:ConvHipImplicitGemmV4R1Fwd,0.361283,0,miopenConvolutionFwdAlgoImplicitGEMM,<unused>;miopenConvolutionFwdAlgoDirect:ConvOclDirectFwd,1.34225,0,miopenConvolutionFwdAlgoDirect,<unused>;miopenConvolutionFwdAlgoWinograd:ConvBinWinogradRxS,0.190241,0,miopenConvolutionFwdAlgoWinograd,<unused>;miopenConvolutionFwdAlgoGEMM:GemmFwdRest,4.21891,1411200,miopenConvolutionFwdAlgoGEMM,<unused>
96-35-35-3x3-96-35-35-32-1x1-1x1-1x1-0-NCHW-FP16-F=miopenConvolutionFwdAlgoImplicitGEMM:ConvHipImplicitGemmV4R1Fwd,0.538406,0,miopenConvolutionFwdAlgoImplicitGEMM,<unused>;miopenConvolutionFwdAlgoDirect:ConvOclDirectFwd,2.06738,0,miopenConvolutionFwdAlgoDirect,<unused>;miopenConvolutionFwdAlgoWinograd:ConvBinWinogradRxS,0.254722,0,miopenConvolutionFwdAlgoWinograd,<unused>;miopenConvolutionFwdAlgoGEMM:GemmFwdRest,6.16963,2116800,miopenConvolutionFwdAlgoGEMM,<unused>
192-35-35-1x1-32-35-35-32-0x0-1x1-1x1-0-NCHW-FP16-F=miopenConvolutionFwdAlgoImplicitGEMM:ConvHipImplicitGemmV4R1Fwd,0.121281,0,miopenConvolutionFwdAlgoImplicitGEMM,<unused>;miopenConvolutionFwdAlgoDirect:ConvAsm1x1U,0.065281,0,miopenConvolutionFwdAlgoDirect,<unused>;miopenConvolutionFwdAlgoWinograd:ConvBinWinogradRxSf3x2,0.111201,0,miopenConvolutionFwdAlgoWinograd,<unused>;miopenConvolutionFwdAlgoGEMM:GemmFwd1x1_0_1,0.203042,0,miopenConvolutionFwdAlgoGEMM,<unused>
256-35-35-1x1-128-35-35-32-0x0-1x1-1x1-0-NCHW-FP16-F=miopenConvolutionFwdAlgoImplicitGEMM:ConvHipImplicitGemmV4R1Fwd,0.453606,0,miopenConvolutionFwdAlgoImplicitGEMM,<unused>;miopenConvolutionFwdAlgoDirect:ConvAsm1x1U,0.263043,0,miopenConvolutionFwdAlgoDirect,<unused>;miopenConvolutionFwdAlgoWinograd:ConvBinWinogradRxSf3x2,0.379204,0,miopenConvolutionFwdAlgoWinograd,<unused>;miopenConvolutionFwdAlgoGEMM:GemmFwd1x1_0_1,0.487685,0,miopenConvolutionFwdAlgoGEMM,<unused>
256-35-35-1x1-48-35-35-32-0x0-1x1-1x1-0-NCHW-FP16-F=miopenConvolutionFwdAlgoImplicitGEMM:ConvMlirIgemmFwd,0.552007,0,miopenConvolutionFwdAlgoImplicitGEMM,<unused>;miopenConvolutionFwdAlgoDirect:ConvAsm1x1U,0.112322,0,miopenConvolutionFwdAlgoDirect,<unused>;miopenConvolutionFwdAlgoWinograd:ConvBinWinogradRxSf3x2,0.207042,0,miopenConvolutionFwdAlgoWinograd,<unused>;miopenConvolutionFwdAlgoGEMM:GemmFwd1x1_0_1,0.255843,0,miopenConvolutionFwdAlgoGEMM,<unused>
256-35-35-1x1-64-35-35-32-0x0-1x1-1x1-0-NCHW-FP16-F=miopenConvolutionFwdAlgoImplicitGEMM:ConvHipImplicitGemmV4R1Fwd,0.264483,0,miopenConvolutionFwdAlgoImplicitGEMM,<unused>;miopenConvolutionFwdAlgoDirect:ConvAsm1x1U,0.150081,0,miopenConvolutionFwdAlgoDirect,<unused>;miopenConvolutionFwdAlgoWinograd:ConvBinWinogradRxSf3x2,0.207202,0,miopenConvolutionFwdAlgoWinograd,<unused>;miopenConvolutionFwdAlgoGEMM:GemmFwd1x1_0_1,0.274403,0,miopenConvolutionFwdAlgoGEMM,<unused>
288-35-35-1x1-128-35-35-32-0x0-1x1-1x1-0-NCHW-FP16-F=miopenConvolutionFwdAlgoImplicitGEMM:ConvHipImplicitGemmV4R1Fwd,0.477286,0,miopenConvolutionFwdAlgoImplicitGEMM,<unused>;miopenConvolutionFwdAlgoDirect:ConvAsm1x1U,0.292644,0,miopenConvolutionFwdAlgoDirect,<unused>;miopenConvolutionFwdAlgoWinograd:ConvBinWinogradRxSf3x2,0.414886,0,miopenConvolutionFwdAlgoWinograd,<unused>;miopenConvolutionFwdAlgoGEMM:GemmFwd1x1_0_1,0.545927,0,miopenConvolutionFwdAlgoGEMM,<unused>
288-35-35-1x1-48-35-35-32-0x0-1x1-1x1-0-NCHW-FP16-F=miopenConvolutionFwdAlgoImplicitGEMM:ConvMlirIgemmFwd,0.611368,0,miopenConvolutionFwdAlgoImplicitGEMM,<unused>;miopenConvolutionFwdAlgoDirect:ConvAsm1x1U,0.120802,0,miopenConvolutionFwdAlgoDirect,<unused>;miopenConvolutionFwdAlgoWinograd:ConvBinWinogradRxSf3x2,0.225283,0,miopenConvolutionFwdAlgoWinograd,<unused>;miopenConvolutionFwdAlgoGEMM:GemmFwd1x1_0_1,0.290563,0,miopenConvolutionFwdAlgoGEMM,<unused>
288-35-35-1x1-64-35-35-32-0x0-1x1-1x1-0-NCHW-FP16-F=miopenConvolutionFwdAlgoImplicitGEMM:ConvHipImplicitGemmV4R1Fwd,0.260804,0,miopenConvolutionFwdAlgoImplicitGEMM,<unused>;miopenConvolutionFwdAlgoDirect:ConvAsm1x1U,0.163362,0,miopenConvolutionFwdAlgoDirect,<unused>;miopenConvolutionFwdAlgoWinograd:ConvBinWinogradRxSf3x2,0.225763,0,miopenConvolutionFwdAlgoWinograd,<unused>;miopenConvolutionFwdAlgoGEMM:GemmFwd1x1_0_1,0.294723,0,miopenConvolutionFwdAlgoGEMM,<unused>
288-35-35-3x3-384-17-17-32-0x0-2x2-1x1-0-NCHW-FP16-F=miopenConvolutionFwdAlgoImplicitGEMM:ConvHipImplicitGemmV4R1Fwd,1.6309,0,miopenConvolutionFwdAlgoImplicitGEMM,<unused>;miopenConvolutionFwdAlgoDirect:ConvOclDirectFwdGen,10.8921,0,miopenConvolutionFwdAlgoDirect,<unused>;miopenConvolutionFwdAlgoWinograd:ConvBinWinogradRxS,3.069,0,miopenConvolutionFwdAlgoWinograd,<unused>;miopenConvolutionFwdAlgoGEMM:GemmFwdRest,14.1365,1498176,miopenConvolutionFwdAlgoGEMM,<unused>
96-35-35-3x3-96-17-17-32-0x0-2x2-1x1-0-NCHW-FP16-F=miopenConvolutionFwdAlgoImplicitGEMM:ConvHipImplicitGemmV4R1Fwd,0.209123,0,miopenConvolutionFwdAlgoImplicitGEMM,<unused>;miopenConvolutionFwdAlgoDirect:ConvOclDirectFwdGen,1.07521,0,miopenConvolutionFwdAlgoDirect,<unused>;miopenConvolutionFwdAlgoWinograd:ConvBinWinogradRxS,0.334724,0,miopenConvolutionFwdAlgoWinograd,<unused>;miopenConvolutionFwdAlgoGEMM:GemmFwdRest,5.92906,499392,miopenConvolutionFwdAlgoGEMM,<unused>
768-17-17-1x1-256-17-17-32-0x0-1x1-1x1-0-NCHW-FP16-F=miopenConvolutionFwdAlgoImplicitGEMM:ConvHipImplicitGemmV4R1Fwd,0.655209,0,miopenConvolutionFwdAlgoImplicitGEMM,<unused>;miopenConvolutionFwdAlgoDirect:ConvAsm1x1U,0.421286,0,miopenConvolutionFwdAlgoDirect,<unused>;miopenConvolutionFwdAlgoWinograd:ConvBinWinogradRxSf3x2,0.559368,0,miopenConvolutionFwdAlgoWinograd,<unused>;miopenConvolutionFwdAlgoGEMM:GemmFwd1x1_0_1,0.886253,0,miopenConvolutionFwdAlgoGEMM,<unused>
768-17-17-1x1-192-17-17-32-0x0-1x1-1x1-0-NCHW-FP16-F=miopenConvolutionFwdAlgoImplicitGEMM:ConvHipImplicitGemmV4R1Fwd,0.495528,0,miopenConvolutionFwdAlgoImplicitGEMM,<unused>;miopenConvolutionFwdAlgoDirect:ConvAsm1x1U,0.315364,0,miopenConvolutionFwdAlgoDirect,<unused>;miopenConvolutionFwdAlgoWinograd:ConvBinWinogradRxSf3x2,0.443046,0,miopenConvolutionFwdAlgoWinograd,<unused>;miopenConvolutionFwdAlgoGEMM:GemmFwd1x1_0_1,0.659369,0,miopenConvolutionFwdAlgoGEMM,<unused>
128-17-17-1x7-128-17-17-32-0x3-1x1-1x1-0-NCHW-FP16-F=miopenConvolutionFwdAlgoImplicitGEMM:ConvHipImplicitGemmV4R1Fwd,0.222084,0,miopenConvolutionFwdAlgoImplicitGEMM,<unused>;miopenConvolutionFwdAlgoDirect:ConvDirectNaiveConvFwd,5.12136,0,miopenConvolutionFwdAlgoDirect,<unused>;miopenConvolutionFwdAlgoWinograd:ConvBinWinogradRxSf3x2,0.221604,0,miopenConvolutionFwdAlgoWinograd,<unused>;miopenConvolutionFwdAlgoGEMM:GemmFwdRest,5.88294,517888,miopenConvolutionFwdAlgoGEMM,<unused>
128-17-17-7x1-192-17-17-32-3x0-1x1-1x1-0-NCHW-FP16-F=miopenConvolutionFwdAlgoImplicitGEMM:ConvHipImplicitGemmV4R1Fwd,0.291045,0,miopenConvolutionFwdAlgoImplicitGEMM,<unused>;miopenConvolutionFwdAlgoDirect:ConvDirectNaiveConvFwd,8.44253,0,miopenConvolutionFwdAlgoDirect,<unused>;miopenConvolutionFwdAlgoWinograd:ConvBinWinogradRxSf3x2,0.330405,0,miopenConvolutionFwdAlgoWinograd,<unused>;miopenConvolutionFwdAlgoGEMM:GemmFwdRest,5.85222,517888,miopenConvolutionFwdAlgoGEMM,<unused>
128-17-17-7x1-128-17-17-32-3x0-1x1-1x1-0-NCHW-FP16-F=miopenConvolutionFwdAlgoImplicitGEMM:ConvHipImplicitGemmV4R1Fwd,0.250564,0,miopenConvolutionFwdAlgoImplicitGEMM,<unused>;miopenConvolutionFwdAlgoDirect:ConvDirectNaiveConvFwd,5.92073,0,miopenConvolutionFwdAlgoDirect,<unused>;miopenConvolutionFwdAlgoWinograd:ConvBinWinogradRxSf3x2,0.256484,0,miopenConvolutionFwdAlgoWinograd,<unused>;miopenConvolutionFwdAlgoGEMM:GemmFwdRest,5.90346,517888,miopenConvolutionFwdAlgoGEMM,<unused>
128-17-17-1x7-192-17-17-32-0x3-1x1-1x1-0-NCHW-FP16-F=miopenConvolutionFwdAlgoImplicitGEMM:ConvHipImplicitGemmV4R1Fwd,0.280484,0,miopenConvolutionFwdAlgoImplicitGEMM,<unused>;miopenConvolutionFwdAlgoDirect:ConvDirectNaiveConvFwd,7.34299,0,miopenConvolutionFwdAlgoDirect,<unused>;miopenConvolutionFwdAlgoWinograd:ConvBinWinogradRxSf3x2,0.285764,0,miopenConvolutionFwdAlgoWinograd,<unused>;miopenConvolutionFwdAlgoGEMM:GemmFwdRest,5.75498,517888,miopenConvolutionFwdAlgoGEMM,<unused>
768-17-17-1x1-320-17-17-32-0x0-1x1-1x1-0-NCHW-FP16-F=miopenConvolutionFwdAlgoImplicitGEMM:ConvHipImplicitGemmV4R1Fwd,0.814562,0,miopenConvolutionFwdAlgoImplicitGEMM,<unused>;miopenConvolutionFwdAlgoDirect:ConvAsm1x1U,0.539361,0,miopenConvolutionFwdAlgoDirect,<unused>;miopenConvolutionFwdAlgoWinograd:ConvBinWinogradRxSf3x2,0.642881,0,miopenConvolutionFwdAlgoWinograd,<unused>;miopenConvolutionFwdAlgoGEMM:GemmFwd1x1_0_1,1.0888,0,miopenConvolutionFwdAlgoGEMM,<unused>
160-17-17-1x7-160-17-17-32-0x3-1x1-1x1-0-NCHW-FP16-F=miopenConvolutionFwdAlgoImplicitGEMM:ConvHipImplicitGemmV4R1Fwd,0.308319,0,miopenConvolutionFwdAlgoImplicitGEMM,<unused>;miopenConvolutionFwdAlgoDirect:ConvDirectNaiveConvFwd,7.63343,0,miopenConvolutionFwdAlgoDirect,<unused>;miopenConvolutionFwdAlgoWinograd:ConvBinWinogradRxSf3x2,0.26624,0,miopenConvolutionFwdAlgoWinograd,<unused>;miopenConvolutionFwdAlgoGEMM:GemmFwdRest,6.98365,647360,miopenConvolutionFwdAlgoGEMM,<unused>
160-17-17-7x1-192-17-17-32-3x0-1x1-1x1-0-NCHW-FP16-F=miopenConvolutionFwdAlgoImplicitGEMM:ConvHipImplicitGemmV4R1Fwd,0.357119,0,miopenConvolutionFwdAlgoImplicitGEMM,<unused>;miopenConvolutionFwdAlgoDirect:ConvDirectNaiveConvFwd,10.1205,0,miopenConvolutionFwdAlgoDirect,<unused>;miopenConvolutionFwdAlgoWinograd:ConvBinWinogradRxSf3x2,0.400159,0,miopenConvolutionFwdAlgoWinograd,<unused>;miopenConvolutionFwdAlgoGEMM:GemmFwdRest,7.11162,647360,miopenConvolutionFwdAlgoGEMM,<unused>
160-17-17-7x1-160-17-17-32-3x0-1x1-1x1-0-NCHW-FP16-F=miopenConvolutionFwdAlgoImplicitGEMM:ConvHipImplicitGemmV4R1Fwd,0.336958,0,miopenConvolutionFwdAlgoImplicitGEMM,<unused>;miopenConvolutionFwdAlgoDirect:ConvDirectNaiveConvFwd,8.75724,0,miopenConvolutionFwdAlgoDirect,<unused>;miopenConvolutionFwdAlgoWinograd:ConvBinWinogradRxSf3x2,0.306399,0,miopenConvolutionFwdAlgoWinograd,<unused>;miopenConvolutionFwdAlgoGEMM:GemmFwdRest,6.92221,647360,miopenConvolutionFwdAlgoGEMM,<unused>
160-17-17-1x7-192-17-17-32-0x3-1x1-1x1-0-NCHW-FP16-F=miopenConvolutionFwdAlgoImplicitGEMM:ConvHipImplicitGemmV4R1Fwd,0.329438,0,miopenConvolutionFwdAlgoImplicitGEMM,<unused>;miopenConvolutionFwdAlgoDirect:ConvDirectNaiveConvFwd,8.91865,0,miopenConvolutionFwdAlgoDirect,<unused>;miopenConvolutionFwdAlgoWinograd:ConvBinWinogradRxSf3x2,0.341758,0,miopenConvolutionFwdAlgoWinograd,<unused>;miopenConvolutionFwdAlgoGEMM:GemmFwdRest,7.01949,647360,miopenConvolutionFwdAlgoGEMM,<unused>
768-17-17-1x1-576-17-17-32-0x0-1x1-1x1-0-NCHW-FP16-F=miopenConvolutionFwdAlgoImplicitGEMM:ConvHipImplicitGemmV4R1Fwd,1.5499,0,miopenConvolutionFwdAlgoImplicitGEMM,<unused>;miopenConvolutionFwdAlgoDirect:ConvAsm1x1U,0.79551,0,miopenConvolutionFwdAlgoDirect,<unused>;miopenConvolutionFwdAlgoWinograd:ConvBinWinogradRxSf3x2,1.18735,0,miopenConvolutionFwdAlgoWinograd,<unused>;miopenConvolutionFwdAlgoGEMM:GemmFwd1x1_0_1,1.8427,0,miopenConvolutionFwdAlgoGEMM,<unused>
192-17-17-1x7-192-17-17-32-0x3-1x1-1x1-0-NCHW-FP16-F=miopenConvolutionFwdAlgoImplicitGEMM:ConvHipImplicitGemmV4R1Fwd,0.391196,0,miopenConvolutionFwdAlgoImplicitGEMM,<unused>;miopenConvolutionFwdAlgoDirect:ConvDirectNaiveConvFwd,10.4205,0,miopenConvolutionFwdAlgoDirect,<unused>;miopenConvolutionFwdAlgoWinograd:ConvBinWinogradRxSf3x2,0.397915,0,miopenConvolutionFwdAlgoWinograd,<unused>;miopenConvolutionFwdAlgoGEMM:GemmFwdRest,8.48374,776832,miopenConvolutionFwdAlgoGEMM,<unused>
192-17-17-7x1-192-17-17-32-3x0-1x1-1x1-0-NCHW-FP16-F=miopenConvolutionFwdAlgoImplicitGEMM:ConvHipImplicitGemmV4R1Fwd,0.472954,0,miopenConvolutionFwdAlgoImplicitGEMM,<unused>;miopenConvolutionFwdAlgoDirect:ConvDirectNaiveConvFwd,11.9927,0,miopenConvolutionFwdAlgoDirect,<unused>;miopenConvolutionFwdAlgoWinograd:ConvBinWinogradRxSf3x2,0.471514,0,miopenConvolutionFwdAlgoWinograd,<unused>;miopenConvolutionFwdAlgoGEMM:GemmFwdRest,8.36592,776832,miopenConvolutionFwdAlgoGEMM,<unused>
768-17-17-1x1-384-17-17-32-0x0-1x1-1x1-0-NCHW-FP16-F=miopenConvolutionFwdAlgoImplicitGEMM:ConvHipImplicitGemmV4R1Fwd,1.04488,0,miopenConvolutionFwdAlgoImplicitGEMM,<unused>;miopenConvolutionFwdAlgoDirect:ConvAsm1x1U,0.612473,0,miopenConvolutionFwdAlgoDirect,<unused>;miopenConvolutionFwdAlgoWinograd:ConvBinWinogradRxSf3x2,0.86191,0,miopenConvolutionFwdAlgoWinograd,<unused>;miopenConvolutionFwdAlgoGEMM:GemmFwd1x1_0_1,1.24751,0,miopenConvolutionFwdAlgoGEMM,<unused>
192-17-17-3x3-320-8-8-32-0x0-2x2-1x1-0-NCHW-FP16-F=miopenConvolutionFwdAlgoImplicitGEMM:ConvHipImplicitGemmV4R1Fwd,0.207038,0,miopenConvolutionFwdAlgoImplicitGEMM,<unused>;miopenConvolutionFwdAlgoDirect:ConvOclDirectFwdGen,1.79422,0,miopenConvolutionFwdAlgoDirect,<unused>;miopenConvolutionFwdAlgoWinograd:ConvBinWinogradRxS,0.430075,0,miopenConvolutionFwdAlgoWinograd,<unused>;miopenConvolutionFwdAlgoGEMM:GemmFwdRest,3.17437,221184,miopenConvolutionFwdAlgoGEMM,<unused>
192-17-17-3x3-192-8-8-32-0x0-2x2-1x1-0-NCHW-FP16-F=miopenConvolutionFwdAlgoImplicitGEMM:ConvHipImplicitGemmV4R1Fwd,0.190558,0,miopenConvolutionFwdAlgoImplicitGEMM,<unused>;miopenConvolutionFwdAlgoDirect:ConvOclDirectFwdGen,1.63198,0,miopenConvolutionFwdAlgoDirect,<unused>;miopenConvolutionFwdAlgoWinograd:ConvBinWinogradRxS,0.295517,0,miopenConvolutionFwdAlgoWinograd,<unused>;miopenConvolutionFwdAlgoGEMM:GemmFwdRest,4.52083,221184,miopenConvolutionFwdAlgoGEMM,<unused>
1280-8-8-1x1-320-8-8-32-0x0-1x1-1x1-0-NCHW-FP16-F=miopenConvolutionFwdAlgoImplicitGEMM:ConvHipImplicitGemmV4R1Fwd,0.188318,0,miopenConvolutionFwdAlgoImplicitGEMM,<unused>;miopenConvolutionFwdAlgoDirect:ConvAsm1x1U,0.170878,0,miopenConvolutionFwdAlgoDirect,<unused>;miopenConvolutionFwdAlgoWinograd:ConvBinWinogradRxSf3x2,0.411835,0,miopenConvolutionFwdAlgoWinograd,<unused>;miopenConvolutionFwdAlgoGEMM:GemmFwd1x1_0_1,0.576795,0,miopenConvolutionFwdAlgoGEMM,<unused>
1280-8-8-1x1-384-8-8-32-0x0-1x1-1x1-0-NCHW-FP16-F=miopenConvolutionFwdAlgoImplicitGEMM:ConvHipImplicitGemmV4R1Fwd,0.323196,0,miopenConvolutionFwdAlgoImplicitGEMM,<unused>;miopenConvolutionFwdAlgoDirect:ConvAsm1x1U,0.225277,0,miopenConvolutionFwdAlgoDirect,<unused>;miopenConvolutionFwdAlgoWinograd:ConvBinWinogradRxSf3x2,0.412796,0,miopenConvolutionFwdAlgoWinograd,<unused>;miopenConvolutionFwdAlgoGEMM:GemmFwd1x1_0_1,0.682073,0,miopenConvolutionFwdAlgoGEMM,<unused>
384-8-8-1x3-384-8-8-32-0x1-1x1-1x1-0-NCHW-FP16-F=miopenConvolutionFwdAlgoImplicitGEMM:ConvHipImplicitGemmV4R1Fwd,0.195518,0,miopenConvolutionFwdAlgoImplicitGEMM,<unused>;miopenConvolutionFwdAlgoDirect:ConvDirectNaiveConvFwd,6.23866,0,miopenConvolutionFwdAlgoDirect,<unused>;miopenConvolutionFwdAlgoWinograd:ConvBinWinogradRxS,0.251358,0,miopenConvolutionFwdAlgoWinograd,<unused>;miopenConvolutionFwdAlgoGEMM:GemmFwdRest,2.33981,147456,miopenConvolutionFwdAlgoGEMM,<unused>
384-8-8-3x1-384-8-8-32-1x0-1x1-1x1-0-NCHW-FP16-F=miopenConvolutionFwdAlgoImplicitGEMM:ConvHipImplicitGemmV4R1Fwd,0.170399,0,miopenConvolutionFwdAlgoImplicitGEMM,<unused>;miopenConvolutionFwdAlgoDirect:ConvDirectNaiveConvFwd,7.23833,0,miopenConvolutionFwdAlgoDirect,<unused>;miopenConvolutionFwdAlgoWinograd:ConvBinWinogradRxSf3x2,0.270877,0,miopenConvolutionFwdAlgoWinograd,<unused>;miopenConvolutionFwdAlgoGEMM:GemmFwdRest,2.28342,147456,miopenConvolutionFwdAlgoGEMM,<unused>
1280-8-8-1x1-448-8-8-32-0x0-1x1-1x1-0-NCHW-FP16-F=miopenConvolutionFwdAlgoImplicitGEMM:ConvHipImplicitGemmV4R1Fwd,0.241278,0,miopenConvolutionFwdAlgoImplicitGEMM,<unused>;miopenConvolutionFwdAlgoDirect:ConvAsm1x1U,0.234398,0,miopenConvolutionFwdAlgoDirect,<unused>;miopenConvolutionFwdAlgoWinograd:ConvBinWinogradRxSf3x2,0.598555,0,miopenConvolutionFwdAlgoWinograd,<unused>;miopenConvolutionFwdAlgoGEMM:GemmFwd1x1_0_1,0.778713,0,miopenConvolutionFwdAlgoGEMM,<unused>
448-8-8-3x3-384-8-8-32-1x1-1x1-1x1-0-NCHW-FP16-F=miopenConvolutionFwdAlgoImplicitGEMM:ConvHipImplicitGemmV4R1Fwd,0.526075,0,miopenConvolutionFwdAlgoImplicitGEMM,<unused>;miopenConvolutionFwdAlgoDirect:ConvOclDirectFwd,1.78318,0,miopenConvolutionFwdAlgoDirect,<unused>;miopenConvolutionFwdAlgoWinograd:ConvBinWinogradRxS,0.254878,0,miopenConvolutionFwdAlgoWinograd,<unused>;miopenConvolutionFwdAlgoGEMM:GemmFwdRest,6.3641,516096,miopenConvolutionFwdAlgoGEMM,<unused>
1280-8-8-1x1-192-8-8-32-0x0-1x1-1x1-0-NCHW-FP16-F=miopenConvolutionFwdAlgoImplicitGEMM:ConvHipImplicitGemmV4R1Fwd,0.134078,0,miopenConvolutionFwdAlgoImplicitGEMM,<unused>;miopenConvolutionFwdAlgoDirect:ConvAsm1x1U,0.131679,0,miopenConvolutionFwdAlgoDirect,<unused>;miopenConvolutionFwdAlgoWinograd:ConvBinWinogradRxSf3x2,0.226878,0,miopenConvolutionFwdAlgoWinograd,<unused>;miopenConvolutionFwdAlgoGEMM:GemmFwd1x1_0_1,0.364477,0,miopenConvolutionFwdAlgoGEMM,<unused>
2048-8-8-1x1-320-8-8-32-0x0-1x1-1x1-0-NCHW-FP16-F=miopenConvolutionFwdAlgoImplicitGEMM:ConvHipImplicitGemmV4R1Fwd,0.326877,0,miopenConvolutionFwdAlgoImplicitGEMM,<unused>;miopenConvolutionFwdAlgoDirect:ConvAsm1x1U,0.299837,0,miopenConvolutionFwdAlgoDirect,<unused>;miopenConvolutionFwdAlgoWinograd:ConvBinWinogradRxSf3x2,0.630554,0,miopenConvolutionFwdAlgoWinograd,<unused>;miopenConvolutionFwdAlgoGEMM:GemmFwd1x1_0_1,0.328957,0,miopenConvolutionFwdAlgoGEMM,<unused>
2048-8-8-1x1-384-8-8-32-0x0-1x1-1x1-0-NCHW-FP16-F=miopenConvolutionFwdAlgoImplicitGEMM:ConvHipImplicitGemmV4R1Fwd,0.411196,0,miopenConvolutionFwdAlgoImplicitGEMM,<unused>;miopenConvolutionFwdAlgoDirect:ConvAsm1x1U,0.355676,0,miopenConvolutionFwdAlgoDirect,<unused>;miopenConvolutionFwdAlgoWinograd:ConvBinWinogradRxSf3x2,0.643994,0,miopenConvolutionFwdAlgoWinograd,<unused>;miopenConvolutionFwdAlgoGEMM:GemmFwd1x1_0_1,0.505435,0,miopenConvolutionFwdAlgoGEMM,<unused>
2048-8-8-1x1-448-8-8-32-0x0-1x1-1x1-0-NCHW-FP16-F=miopenConvolutionFwdAlgoImplicitGEMM:ConvHipImplicitGemmV4R1Fwd,0.419196,0,miopenConvolutionFwdAlgoImplicitGEMM,<unused>;miopenConvolutionFwdAlgoDirect:ConvAsm1x1U,0.389597,0,miopenConvolutionFwdAlgoDirect,<unused>;miopenConvolutionFwdAlgoWinograd:ConvBinWinogradRxSf3x2,0.933911,0,miopenConvolutionFwdAlgoWinograd,<unused>;miopenConvolutionFwdAlgoGEMM:GemmFwd1x1_0_1,1.22287,0,miopenConvolutionFwdAlgoGEMM,<unused>
2048-8-8-1x1-192-8-8-32-0x0-1x1-1x1-0-NCHW-FP16-F=miopenConvolutionFwdAlgoImplicitGEMM:ConvHipImplicitGemmV4R1Fwd,0.232638,0,miopenConvolutionFwdAlgoImplicitGEMM,<unused>;miopenConvolutionFwdAlgoDirect:ConvAsm1x1U,0.221118,0,miopenConvolutionFwdAlgoDirect,<unused>;miopenConvolutionFwdAlgoWinograd:ConvBinWinogradRxSf3x2,0.338877,0,miopenConvolutionFwdAlgoWinograd,<unused>;miopenConvolutionFwdAlgoGEMM:GemmFwd1x1_0_1,0.203838,0,miopenConvolutionFwdAlgoGEMM,<unused>
3-224-224-3x3-64-224-224-16-1x1-1x1-1x1-0-NCHW-FP32-F=miopenConvolutionFwdAlgoImplicitGEMM:ConvMlirIgemmFwd,1.07775,0,miopenConvolutionFwdAlgoImplicitGEMM,<unused>;miopenConvolutionFwdAlgoDirect:ConvOclDirectFwd,1.12687,0,miopenConvolutionFwdAlgoDirect,<unused>;miopenConvolutionFwdAlgoWinograd:ConvBinWinogradRxSf2x3g1,0.638074,0,miopenConvolutionFwdAlgoWinograd,<unused>;miopenConvolutionFwdAlgoGEMM:GemmFwdRest,1.18525,5419008,miopenConvolutionFwdAlgoGEMM,<unused>
64-224-224-3x3-64-224-224-16-1x1-1x1-1x1-0-NCHW-FP32-F=miopenConvolutionFwdAlgoWinograd:ConvBinWinogradRxS,2.69309,0,miopenConvolutionFwdAlgoWinograd,<unused>
64-112-112-3x3-128-112-112-16-1x1-1x1-1x1-0-NCHW-FP32-F=miopenConvolutionFwdAlgoWinograd:ConvBinWinograd3x3U,1.5147,0,miopenConvolutionFwdAlgoWinograd,<unused>
128-112-112-3x3-128-112-112-16-1x1-1x1-1x1-0-NCHW-FP32-F=miopenConvolutionFwdAlgoWinograd:ConvBinWinogradRxS,2.48014,0,miopenConvolutionFwdAlgoWinograd,<unused>
128-56-56-3x3-256-56-56-16-1x1-1x1-1x1-0-NCHW-FP32-F=miopenConvolutionFwdAlgoWinograd:ConvBinWinograd3x3U,1.45439,0,miopenConvolutionFwdAlgoWinograd,<unused>
256-56-56-3x3-256-56-56-16-1x1-1x1-1x1-0-NCHW-FP32-F=miopenConvolutionFwdAlgoWinograd:ConvBinWinogradRxS,2.42446,0,miopenConvolutionFwdAlgoWinograd,<unused>
256-28-28-3x3-512-28-28-16-1x1-1x1-1x1-0-NCHW-FP32-F=miopenConvolutionFwdAlgoWinograd:ConvBinWinograd3x3U,1.42911,0,miopenConvolutionFwdAlgoWinograd,<unused>
512-28-28-3x3-512-28-28-16-1x1-1x1-1x1-0-NCHW-FP32-F=miopenConvolutionFwdAlgoWinograd:ConvBinWinogradRxS,2.43326,0,miopenConvolutionFwdAlgoWinograd,<unused>
512-14-14-3x3-512-14-14-16-1x1-1x1-1x1-0-NCHW-FP32-F=miopenConvolutionFwdAlgoWinograd:ConvBinWinogradRxSf2x3g1,0.746393,0,miopenConvolutionFwdAlgoWinograd,<unused>
3-224-224-3x3-64-224-224-16-1x1-1x1-1x1-0-NCHW-FP16-F=miopenConvolutionFwdAlgoImplicitGEMM:ConvMlirIgemmFwd,0.946071,0,miopenConvolutionFwdAlgoImplicitGEMM,<unused>;miopenConvolutionFwdAlgoDirect:ConvOclDirectFwd,0.488796,0,miopenConvolutionFwdAlgoDirect,<unused>;miopenConvolutionFwdAlgoWinograd:ConvBinWinogradRxSf2x3g1,0.589435,0,miopenConvolutionFwdAlgoWinograd,<unused>;miopenConvolutionFwdAlgoGEMM:GemmFwdRest,1.45661,2709504,miopenConvolutionFwdAlgoGEMM,<unused>
64-224-224-3x3-64-224-224-16-1x1-1x1-1x1-0-NCHW-FP16-F=miopenConvolutionFwdAlgoImplicitGEMM:ConvHipImplicitGemmV4R1Fwd,3.49741,0,miopenConvolutionFwdAlgoImplicitGEMM,<unused>;miopenConvolutionFwdAlgoDirect:ConvOclDirectFwd,7.24601,0,miopenConvolutionFwdAlgoDirect,<unused>;miopenConvolutionFwdAlgoWinograd:ConvBinWinogradRxS,1.9715,0,miopenConvolutionFwdAlgoWinograd,<unused>;miopenConvolutionFwdAlgoGEMM:GemmFwdRest,7.16278,57802752,miopenConvolutionFwdAlgoGEMM,<unused>
64-112-112-3x3-128-112-112-16-1x1-1x1-1x1-0-NCHW-FP16-F=miopenConvolutionFwdAlgoImplicitGEMM:ConvHipImplicitGemmV4R1Fwd,1.81902,0,miopenConvolutionFwdAlgoImplicitGEMM,<unused>;miopenConvolutionFwdAlgoDirect:ConvOclDirectFwd,4.47627,0,miopenConvolutionFwdAlgoDirect,<unused>;miopenConvolutionFwdAlgoWinograd:ConvBinWinogradRxS,1.00959,0,miopenConvolutionFwdAlgoWinograd,<unused>;miopenConvolutionFwdAlgoGEMM:GemmFwdRest,3.4969,14450688,miopenConvolutionFwdAlgoGEMM,<unused>
128-112-112-3x3-128-112-112-16-1x1-1x1-1x1-0-NCHW-FP16-F=miopenConvolutionFwdAlgoImplicitGEMM:ConvHipImplicitGemmV4R1Fwd,3.15293,0,miopenConvolutionFwdAlgoImplicitGEMM,<unused>;miopenConvolutionFwdAlgoDirect:ConvOclDirectFwd,8.10839,0,miopenConvolutionFwdAlgoDirect,<unused>;miopenConvolutionFwdAlgoWinograd:ConvBinWinogradRxSf2x3g1,1.79502,0,miopenConvolutionFwdAlgoWinograd,<unused>;miopenConvolutionFwdAlgoGEMM:GemmFwdRest,6.37432,28901376,miopenConvolutionFwdAlgoGEMM,<unused>
128-56-56-3x3-256-56-56-16-1x1-1x1-1x1-0-NCHW-FP16-F=miopenConvolutionFwdAlgoImplicitGEMM:ConvHipImplicitGemmV4R1Fwd,1.83678,0,miopenConvolutionFwdAlgoImplicitGEMM,<unused>;miopenConvolutionFwdAlgoDirect:ConvOclDirectFwd,4.89531,0,miopenConvolutionFwdAlgoDirect,<unused>;miopenConvolutionFwdAlgoWinograd:ConvBinWinogradRxSf2x3g1,0.911671,0,miopenConvolutionFwdAlgoWinograd,<unused>;miopenConvolutionFwdAlgoGEMM:GemmFwdRest,3.30749,7225344,miopenConvolutionFwdAlgoGEMM,<unused>
256-56-56-3x3-256-56-56-16-1x1-1x1-1x1-0-NCHW-FP16-F=miopenConvolutionFwdAlgoImplicitGEMM:ConvHipImplicitGemmV4R1Fwd,3.37756,0,miopenConvolutionFwdAlgoImplicitGEMM,<unused>;miopenConvolutionFwdAlgoDirect:ConvOclDirectFwd,9.23014,0,miopenConvolutionFwdAlgoDirect,<unused>;miopenConvolutionFwdAlgoWinograd:ConvBinWinogradRxSf2x3g1,1.6795,0,miopenConvolutionFwdAlgoWinograd,<unused>;miopenConvolutionFwdAlgoGEMM:GemmFwdRest,7.06806,14450688,miopenConvolutionFwdAlgoGEMM,<unused>
256-28-28-3x3-512-28-28-16-1x1-1x1-1x1-0-NCHW-FP16-F=miopenConvolutionFwdAlgoImplicitGEMM:ConvHipImplicitGemmV4R1Fwd,1.74254,0,miopenConvolutionFwdAlgoImplicitGEMM,<unused>;miopenConvolutionFwdAlgoDirect:ConvOclDirectFwd,4.41467,0,miopenConvolutionFwdAlgoDirect,<unused>;miopenConvolutionFwdAlgoWinograd:ConvBinWinogradRxSf2x3g1,0.88031,0,miopenConvolutionFwdAlgoWinograd,<unused>;miopenConvolutionFwdAlgoGEMM:GemmFwdRest,5.4348,3612672,miopenConvolutionFwdAlgoGEMM,<unused>
512-28-28-3x3-512-28-28-16-1x1-1x1-1x1-0-NCHW-FP16-F=miopenConvolutionFwdAlgoImplicitGEMM:ConvHipImplicitGemmV4R1Fwd,3.29788,0,miopenConvolutionFwdAlgoImplicitGEMM,<unused>;miopenConvolutionFwdAlgoDirect:ConvOclDirectFwd,7.86663,0,miopenConvolutionFwdAlgoDirect,<unused>;miopenConvolutionFwdAlgoWinograd:ConvBinWinogradRxS,1.62094,0,miopenConvolutionFwdAlgoWinograd,<unused>;miopenConvolutionFwdAlgoGEMM:GemmFwdRest,9.01622,7225344,miopenConvolutionFwdAlgoGEMM,<unused>
512-14-14-3x3-512-14-14-16-1x1-1x1-1x1-0-NCHW-FP16-F=miopenConvolutionFwdAlgoImplicitGEMM:ConvHipImplicitGemmV4R1Fwd,1.00895,0,miopenConvolutionFwdAlgoImplicitGEMM,<unused>;miopenConvolutionFwdAlgoDirect:ConvOclDirectFwd,3.10221,0,miopenConvolutionFwdAlgoDirect,<unused>;miopenConvolutionFwdAlgoWinograd:ConvBinWinogradRxSf2x3g1,0.464635,0,miopenConvolutionFwdAlgoWinograd,<unused>;miopenConvolutionFwdAlgoGEMM:GemmFwdRest,6.32314,1806336,miopenConvolutionFwdAlgoGEMM,<unused>
64-56-56-1x1-288-56-56-32-0x0-1x1-1x1-0-NCHW-FP32-F=miopenConvolutionFwdAlgoImplicitGEMM:ConvHipImplicitGemmV4R1Fwd,0.77391,0,miopenConvolutionFwdAlgoImplicitGEMM,<unused>;miopenConvolutionFwdAlgoDirect:ConvAsm1x1U,0.447195,0,miopenConvolutionFwdAlgoDirect,<unused>;miopenConvolutionFwdAlgoWinograd:ConvBinWinogradRxSf3x2,1.03263,0,miopenConvolutionFwdAlgoWinograd,<unused>;miopenConvolutionFwdAlgoGEMM:GemmFwd1x1_0_1,0.465114,0,miopenConvolutionFwdAlgoGEMM,<unused>
64-56-56-1x1-96-56-56-32-0x0-1x1-1x1-0-NCHW-FP32-F=miopenConvolutionFwdAlgoImplicitGEMM:ConvHipImplicitGemmV4R1Fwd,0.266397,0,miopenConvolutionFwdAlgoImplicitGEMM,<unused>;miopenConvolutionFwdAlgoDirect:ConvAsm1x1U,0.170078,0,miopenConvolutionFwdAlgoDirect,<unused>;miopenConvolutionFwdAlgoWinograd:ConvBinWinogradRxSf3x2,0.359355,0,miopenConvolutionFwdAlgoWinograd,<unused>;miopenConvolutionFwdAlgoGEMM:GemmFwd1x1_0_1,0.217277,0,miopenConvolutionFwdAlgoGEMM,<unused>
96-56-56-3x3-96-56-56-32-1x1-1x1-1x1-0-NCHW-FP32-F_g32=miopenConvolutionFwdAlgoImplicitGEMM:ConvMlirIgemmFwd,3.23964,0,miopenConvolutionFwdAlgoImplicitGEMM,<unused>;miopenConvolutionFwdAlgoDirect:ConvOclDirectFwd,0.255357,0,miopenConvolutionFwdAlgoDirect,<unused>;miopenConvolutionFwdAlgoWinograd:ConvBinWinogradRxSf2x3,1.43054,0,miopenConvolutionFwdAlgoWinograd,<unused>;miopenConvolutionFwdAlgoGEMM:GemmFwdRest,3.51226,10838016,miopenConvolutionFwdAlgoGEMM,<unused>
96-56-56-1x1-272-56-56-32-0x0-1x1-1x1-0-NCHW-FP32-F=miopenConvolutionFwdAlgoImplicitGEMM:ConvHipImplicitGemmV4R1Fwd,1.72798,0,miopenConvolutionFwdAlgoImplicitGEMM,<unused>;miopenConvolutionFwdAlgoDirect:ConvAsm1x1U,0.594232,0,miopenConvolutionFwdAlgoDirect,<unused>;miopenConvolutionFwdAlgoWinograd:ConvBinWinogradRxSf3x2,1.27582,0,miopenConvolutionFwdAlgoWinograd,<unused>;miopenConvolutionFwdAlgoGEMM:GemmFwd1x1_0_1,0.629752,0,miopenConvolutionFwdAlgoGEMM,<unused>
304-56-56-1x1-96-56-56-32-0x0-1x1-1x1-0-NCHW-FP32-F=miopenConvolutionFwdAlgoImplicitGEMM:ConvHipImplicitGemmV4R1Fwd,0.98049,0,miopenConvolutionFwdAlgoImplicitGEMM,<unused>;miopenConvolutionFwdAlgoDirect:ConvAsm1x1U,0.625287,0,miopenConvolutionFwdAlgoDirect,<unused>;miopenConvolutionFwdAlgoWinograd:ConvBinWinogradRxSf3x2,1.21073,0,miopenConvolutionFwdAlgoWinograd,<unused>;miopenConvolutionFwdAlgoGEMM:GemmFwd1x1_0_1,0.834249,0,miopenConvolutionFwdAlgoGEMM,<unused>
320-56-56-1x1-96-56-56-32-0x0-1x1-1x1-0-NCHW-FP32-F=miopenConvolutionFwdAlgoImplicitGEMM:ConvHipImplicitGemmV4R1Fwd,0.988325,0,miopenConvolutionFwdAlgoImplicitGEMM,<unused>;miopenConvolutionFwdAlgoDirect:ConvAsm1x1U,0.657604,0,miopenConvolutionFwdAlgoDirect,<unused>;miopenConvolutionFwdAlgoWinograd:ConvBinWinogradRxSf3x2,1.27009,0,miopenConvolutionFwdAlgoWinograd,<unused>;miopenConvolutionFwdAlgoGEMM:GemmFwd1x1_0_1,0.873924,0,miopenConvolutionFwdAlgoGEMM,<unused>
336-56-56-1x1-576-28-28-32-0x0-2x2-1x1-0-NCHW-FP32-F=miopenConvolutionFwdAlgoImplicitGEMM:ConvHipImplicitGemmV4R1Fwd,1.47041,0,miopenConvolutionFwdAlgoImplicitGEMM,<unused>;miopenConvolutionFwdAlgoDirect:ConvAsm1x1U,1.10289,33718272,miopenConvolutionFwdAlgoDirect,<unused>;miopenConvolutionFwdAlgoWinograd:ConvBinWinogradRxS,7.15108,0,miopenConvolutionFwdAlgoWinograd,<unused>;miopenConvolutionFwdAlgoGEMM:GemmFwd1x1_0_2,1.316,91521024,miopenConvolutionFwdAlgoGEMM,<unused>
336-56-56-1x1-192-56-56-32-0x0-1x1-1x1-0-NCHW-FP32-F=miopenConvolutionFwdAlgoImplicitGEMM:ConvHipImplicitGemmV4R1Fwd,1.20401,0,miopenConvolutionFwdAlgoImplicitGEMM,<unused>;miopenConvolutionFwdAlgoDirect:ConvAsm1x1U,1.50545,0,miopenConvolutionFwdAlgoDirect,<unused>;miopenConvolutionFwdAlgoWinograd:ConvBinWinogradRxSf3x2,2.55313,0,miopenConvolutionFwdAlgoWinograd,<unused>;miopenConvolutionFwdAlgoGEMM:GemmFwd1x1_0_1,1.29521,0,miopenConvolutionFwdAlgoGEMM,<unused>
192-56-56-3x3-192-28-28-32-1x1-2x2-1x1-0-NCHW-FP32-F_g32=miopenConvolutionFwdAlgoImplicitGEMM:ConvMlirIgemmFwd,1.72449,0,miopenConvolutionFwdAlgoImplicitGEMM,<unused>;miopenConvolutionFwdAlgoDirect:ConvOclDirectFwd,0.423362,0,miopenConvolutionFwdAlgoDirect,<unused>;miopenConvolutionFwdAlgoWinograd:ConvBinWinogradRxSf2x3,0.947204,0,miopenConvolutionFwdAlgoWinograd,<unused>;miopenConvolutionFwdAlgoGEMM:GemmFwdRest,2.27843,5419008,miopenConvolutionFwdAlgoGEMM,<unused>
192-28-28-1x1-544-28-28-32-0x0-1x1-1x1-0-NCHW-FP32-F=miopenConvolutionFwdAlgoImplicitGEMM:ConvHipImplicitGemmV4R1Fwd,0.742722,0,miopenConvolutionFwdAlgoImplicitGEMM,<unused>;miopenConvolutionFwdAlgoDirect:ConvAsm1x1U,0.612001,0,miopenConvolutionFwdAlgoDirect,<unused>;miopenConvolutionFwdAlgoWinograd:ConvBinWinogradRxSf3x2,1.23424,0,miopenConvolutionFwdAlgoWinograd,<unused>;miopenConvolutionFwdAlgoGEMM:GemmFwd1x1_0_1,0.587362,0,miopenConvolutionFwdAlgoGEMM,<unused>
608-28-28-1x1-192-28-28-32-0x0-1x1-1x1-0-NCHW-FP32-F=miopenConvolutionFwdAlgoImplicitGEMM:ConvHipImplicitGemmV4R1Fwd,0.524162,0,miopenConvolutionFwdAlgoImplicitGEMM,<unused>;miopenConvolutionFwdAlgoDirect:ConvAsm1x1U,0.613443,0,miopenConvolutionFwdAlgoDirect,<unused>;miopenConvolutionFwdAlgoWinograd:ConvBinWinogradRxSf3x2,1.22993,0,miopenConvolutionFwdAlgoWinograd,<unused>;miopenConvolutionFwdAlgoGEMM:GemmFwd1x1_0_1,0.872804,0,miopenConvolutionFwdAlgoGEMM,<unused>
192-28-28-3x3-192-28-28-32-1x1-1x1-1x1-0-NCHW-FP32-F_g32=miopenConvolutionFwdAlgoImplicitGEMM:ConvMlirIgemmFwd,1.70401,0,miopenConvolutionFwdAlgoImplicitGEMM,<unused>;miopenConvolutionFwdAlgoDirect:ConvOclDirectFwd,0.211521,0,miopenConvolutionFwdAlgoDirect,<unused>;miopenConvolutionFwdAlgoWinograd:ConvBinWinogradRxSf2x3,0.445922,0,miopenConvolutionFwdAlgoWinograd,<unused>;miopenConvolutionFwdAlgoGEMM:GemmFwdRest,1.8176,5419008,miopenConvolutionFwdAlgoGEMM,<unused>
640-28-28-1x1-192-28-28-32-0x0-1x1-1x1-0-NCHW-FP32-F=miopenConvolutionFwdAlgoImplicitGEMM:ConvHipImplicitGemmV4R1Fwd,0.636801,0,miopenConvolutionFwdAlgoImplicitGEMM,<unused>;miopenConvolutionFwdAlgoDirect:ConvOclDirectFwd1x1,0.670561,0,miopenConvolutionFwdAlgoDirect,<unused>;miopenConvolutionFwdAlgoWinograd:ConvBinWinogradRxSf3x2,1.29408,0,miopenConvolutionFwdAlgoWinograd,<unused>;miopenConvolutionFwdAlgoGEMM:GemmFwd1x1_0_1,0.874242,0,miopenConvolutionFwdAlgoGEMM,<unused>
672-28-28-1x1-192-28-28-32-0x0-1x1-1x1-0-NCHW-FP32-F=miopenConvolutionFwdAlgoImplicitGEMM:ConvHipImplicitGemmV4R1Fwd,0.629441,0,miopenConvolutionFwdAlgoImplicitGEMM,<unused>;miopenConvolutionFwdAlgoDirect:ConvAsm1x1U,0.673281,0,miopenConvolutionFwdAlgoDirect,<unused>;miopenConvolutionFwdAlgoWinograd:ConvBinWinogradRxSf3x2,1.3552,0,miopenConvolutionFwdAlgoWinograd,<unused>;miopenConvolutionFwdAlgoGEMM:GemmFwd1x1_0_1,0.921442,0,miopenConvolutionFwdAlgoGEMM,<unused>
704-28-28-1x1-1072-14-14-32-0x0-2x2-1x1-0-NCHW-FP32-F=miopenConvolutionFwdAlgoImplicitGEMM:ConvHipImplicitGemmV4R1Fwd,5.44775,0,miopenConvolutionFwdAlgoImplicitGEMM,<unused>;miopenConvolutionFwdAlgoDirect:ConvAsm1x1U,1.39184,17661952,miopenConvolutionFwdAlgoDirect,<unused>;miopenConvolutionFwdAlgoWinograd:ConvBinWinogradRxS,7.04641,0,miopenConvolutionFwdAlgoWinograd,<unused>;miopenConvolutionFwdAlgoGEMM:GemmFwd1x1_0_2,1.18208,44556288,miopenConvolutionFwdAlgoGEMM,<unused>
704-28-28-1x1-384-28-28-32-0x0-1x1-1x1-0-NCHW-FP32-F=miopenConvolutionFwdAlgoImplicitGEMM:ConvHipImplicitGemmV4R1Fwd,1.16496,0,miopenConvolutionFwdAlgoImplicitGEMM,<unused>;miopenConvolutionFwdAlgoDirect:ConvAsm1x1U,1.37104,0,miopenConvolutionFwdAlgoDirect,<unused>;miopenConvolutionFwdAlgoWinograd:ConvBinWinogradRxSf3x2,2.79472,0,miopenConvolutionFwdAlgoWinograd,<unused>;miopenConvolutionFwdAlgoGEMM:GemmFwd1x1_0_1,1.5024,0,miopenConvolutionFwdAlgoGEMM,<unused>
384-28-28-3x3-384-14-14-32-1x1-2x2-1x1-0-NCHW-FP32-F_g32=miopenConvolutionFwdAlgoImplicitGEMM:ConvMlirIgemmFwd,0.784961,0,miopenConvolutionFwdAlgoImplicitGEMM,<unused>;miopenConvolutionFwdAlgoDirect:ConvOclDirectFwd,0.404481,0,miopenConvolutionFwdAlgoDirect,<unused>;miopenConvolutionFwdAlgoWinograd:ConvBinWinogradRxSf2x3,0.41024,0,miopenConvolutionFwdAlgoWinograd,<unused>;miopenConvolutionFwdAlgoGEMM:GemmFwdRest,2.2016,2709504,miopenConvolutionFwdAlgoGEMM,<unused>
384-14-14-1x1-1048-14-14-32-0x0-1x1-1x1-0-NCHW-FP32-F=miopenConvolutionFwdAlgoImplicitGEMM:ConvMlirIgemmFwd,0.95056,0,miopenConvolutionFwdAlgoImplicitGEMM,<unused>;miopenConvolutionFwdAlgoDirect:ConvAsm1x1U,0.84528,0,miopenConvolutionFwdAlgoDirect,<unused>;miopenConvolutionFwdAlgoWinograd:ConvBinWinogradRxSf3x2,1.12528,0,miopenConvolutionFwdAlgoWinograd,<unused>;miopenConvolutionFwdAlgoGEMM:GemmFwd1x1_0_1,0.66816,0,miopenConvolutionFwdAlgoGEMM,<unused>
1096-14-14-1x1-384-14-14-32-0x0-1x1-1x1-0-NCHW-FP32-F=miopenConvolutionFwdAlgoImplicitGEMM:ConvHipImplicitGemmV4R1Fwd,0.4976,0,miopenConvolutionFwdAlgoImplicitGEMM,<unused>;miopenConvolutionFwdAlgoDirect:ConvAsm1x1U,0.76576,0,miopenConvolutionFwdAlgoDirect,<unused>;miopenConvolutionFwdAlgoWinograd:ConvBinWinogradRxSf3x2,1.09712,0,miopenConvolutionFwdAlgoWinograd,<unused>;miopenConvolutionFwdAlgoGEMM:GemmFwd1x1_0_1,0.727681,0,miopenConvolutionFwdAlgoGEMM,<unused>
384-14-14-3x3-384-14-14-32-1x1-1x1-1x1-0-NCHW-FP32-F_g32=miopenConvolutionFwdAlgoImplicitGEMM:ConvMlirIgemmFwd,0.78192,0,miopenConvolutionFwdAlgoImplicitGEMM,<unused>;miopenConvolutionFwdAlgoDirect:ConvOclDirectFwd,0.17056,0,miopenConvolutionFwdAlgoDirect,<unused>;miopenConvolutionFwdAlgoWinograd:ConvBinWinogradRxSf2x3,0.18144,0,miopenConvolutionFwdAlgoWinograd,<unused>;miopenConvolutionFwdAlgoGEMM:GemmFwdRest,1.8176,2709504,miopenConvolutionFwdAlgoGEMM,<unused>
1120-14-14-1x1-384-14-14-32-0x0-1x1-1x1-0-NCHW-FP32-F=miopenConvolutionFwdAlgoImplicitGEMM:ConvHipImplicitGemmV4R1Fwd,0.504,0,miopenConvolutionFwdAlgoImplicitGEMM,<unused>;miopenConvolutionFwdAlgoDirect:ConvOclDirectFwd1x1,0.72208,0,miopenConvolutionFwdAlgoDirect,<unused>;miopenConvolutionFwdAlgoWinograd:ConvBinWinogradRxSf3x2,1.12608,0,miopenConvolutionFwdAlgoWinograd,<unused>;miopenConvolutionFwdAlgoGEMM:GemmFwd1x1_0_1,0.728641,0,miopenConvolutionFwdAlgoGEMM,<unused>
1144-14-14-1x1-384-14-14-32-0x0-1x1-1x1-0-NCHW-FP32-F=miopenConvolutionFwdAlgoImplicitGEMM:ConvHipImplicitGemmV4R1Fwd,0.53744,0,miopenConvolutionFwdAlgoImplicitGEMM,<unused>;miopenConvolutionFwdAlgoDirect:ConvAsm1x1U,0.73328,0,miopenConvolutionFwdAlgoDirect,<unused>;miopenConvolutionFwdAlgoWinograd:ConvBinWinogradRxSf3x2,1.14368,0,miopenConvolutionFwdAlgoWinograd,<unused>;miopenConvolutionFwdAlgoGEMM:GemmFwd1x1_0_1,1.6592,0,miopenConvolutionFwdAlgoGEMM,<unused>
1168-14-14-1x1-384-14-14-32-0x0-1x1-1x1-0-NCHW-FP32-F=miopenConvolutionFwdAlgoImplicitGEMM:ConvHipImplicitGemmV4R1Fwd,0.53552,0,miopenConvolutionFwdAlgoImplicitGEMM,<unused>;miopenConvolutionFwdAlgoDirect:ConvOclDirectFwd1x1,0.66816,0,miopenConvolutionFwdAlgoDirect,<unused>;miopenConvolutionFwdAlgoWinograd:ConvBinWinogradRxSf3x2,1.16608,0,miopenConvolutionFwdAlgoWinograd,<unused>;miopenConvolutionFwdAlgoGEMM:GemmFwd1x1_0_1,1.65168,0,miopenConvolutionFwdAlgoGEMM,<unused>
1192-14-14-1x1-384-14-14-32-0x0-1x1-1x1-0-NCHW-FP32-F=miopenConvolutionFwdAlgoImplicitGEMM:ConvHipImplicitGemmV4R1Fwd,0.55232,0,miopenConvolutionFwdAlgoImplicitGEMM,<unused>;miopenConvolutionFwdAlgoDirect:ConvAsm1x1U,0.7952,0,miopenConvolutionFwdAlgoDirect,<unused>;miopenConvolutionFwdAlgoWinograd:ConvBinWinogradRxSf3x2,1.18704,0,miopenConvolutionFwdAlgoWinograd,<unused>;miopenConvolutionFwdAlgoGEMM:GemmFwd1x1_0_1,1.124,0,miopenConvolutionFwdAlgoGEMM,<unused>
1216-14-14-1x1-384-14-14-32-0x0-1x1-1x1-0-NCHW-FP32-F=miopenConvolutionFwdAlgoImplicitGEMM:ConvHipImplicitGemmV4R1Fwd,0.60016,0,miopenConvolutionFwdAlgoImplicitGEMM,<unused>;miopenConvolutionFwdAlgoDirect:ConvOclDirectFwd1x1,0.7072,0,miopenConvolutionFwdAlgoDirect,<unused>;miopenConvolutionFwdAlgoWinograd:ConvBinWinogradRxSf3x2,1.212,0,miopenConvolutionFwdAlgoWinograd,<unused>;miopenConvolutionFwdAlgoGEMM:GemmFwd1x1_0_1,1.10224,0,miopenConvolutionFwdAlgoGEMM,<unused>
1240-14-14-1x1-384-14-14-32-0x0-1x1-1x1-0-NCHW-FP32-F=miopenConvolutionFwdAlgoImplicitGEMM:ConvHipImplicitGemmV4R1Fwd,0.57936,0,miopenConvolutionFwdAlgoImplicitGEMM,<unused>;miopenConvolutionFwdAlgoDirect:ConvAsm1x1U,0.74512,0,miopenConvolutionFwdAlgoDirect,<unused>;miopenConvolutionFwdAlgoWinograd:ConvBinWinogradRxSf3x2,1.23392,0,miopenConvolutionFwdAlgoWinograd,<unused>;miopenConvolutionFwdAlgoGEMM:GemmFwd1x1_0_1,1.14352,0,miopenConvolutionFwdAlgoGEMM,<unused>
1264-14-14-1x1-384-14-14-32-0x0-1x1-1x1-0-NCHW-FP32-F=miopenConvolutionFwdAlgoImplicitGEMM:ConvHipImplicitGemmV4R1Fwd,0.59872,0,miopenConvolutionFwdAlgoImplicitGEMM,<unused>;miopenConvolutionFwdAlgoDirect:ConvOclDirectFwd1x1,0.719519,0,miopenConvolutionFwdAlgoDirect,<unused>;miopenConvolutionFwdAlgoWinograd:ConvBinWinogradRxSf3x2,1.2568,0,miopenConvolutionFwdAlgoWinograd,<unused>;miopenConvolutionFwdAlgoGEMM:GemmFwd1x1_0_1,1.13072,0,miopenConvolutionFwdAlgoGEMM,<unused>
1288-14-14-1x1-384-14-14-32-0x0-1x1-1x1-0-NCHW-FP32-F=miopenConvolutionFwdAlgoImplicitGEMM:ConvHipImplicitGemmV4R1Fwd,0.6552,0,miopenConvolutionFwdAlgoImplicitGEMM,<unused>;miopenConvolutionFwdAlgoDirect:ConvAsm1x1U,0.8144,0,miopenConvolutionFwdAlgoDirect,<unused>;miopenConvolutionFwdAlgoWinograd:ConvBinWinogradRxSf3x2,1.28,0,miopenConvolutionFwdAlgoWinograd,<unused>;miopenConvolutionFwdAlgoGEMM:GemmFwd1x1_0_1,1.1824,0,miopenConvolutionFwdAlgoGEMM,<unused>
1312-14-14-1x1-384-14-14-32-0x0-1x1-1x1-0-NCHW-FP32-F=miopenConvolutionFwdAlgoImplicitGEMM:ConvHipImplicitGemmV4R1Fwd,0.61456,0,miopenConvolutionFwdAlgoImplicitGEMM,<unused>;miopenConvolutionFwdAlgoDirect:ConvOclDirectFwd1x1,0.76768,0,miopenConvolutionFwdAlgoDirect,<unused>;miopenConvolutionFwdAlgoWinograd:ConvBinWinogradRxSf3x2,1.30016,0,miopenConvolutionFwdAlgoWinograd,<unused>;miopenConvolutionFwdAlgoGEMM:GemmFwd1x1_0_1,1.14176,0,miopenConvolutionFwdAlgoGEMM,<unused>
1336-14-14-1x1-384-14-14-32-0x0-1x1-1x1-0-NCHW-FP32-F=miopenConvolutionFwdAlgoImplicitGEMM:ConvHipImplicitGemmV4R1Fwd,0.62464,0,miopenConvolutionFwdAlgoImplicitGEMM,<unused>;miopenConvolutionFwdAlgoDirect:ConvAsm1x1U,0.8176,0,miopenConvolutionFwdAlgoDirect,<unused>;miopenConvolutionFwdAlgoWinograd:ConvBinWinogradRxSf3x2,1.3248,0,miopenConvolutionFwdAlgoWinograd,<unused>;miopenConvolutionFwdAlgoGEMM:GemmFwd1x1_0_1,1.2072,0,miopenConvolutionFwdAlgoGEMM,<unused>
1360-14-14-1x1-384-14-14-32-0x0-1x1-1x1-0-NCHW-FP32-F=miopenConvolutionFwdAlgoImplicitGEMM:ConvHipImplicitGemmV4R1Fwd,0.63152,0,miopenConvolutionFwdAlgoImplicitGEMM,<unused>;miopenConvolutionFwdAlgoDirect:ConvOclDirectFwd1x1,0.800161,0,miopenConvolutionFwdAlgoDirect,<unused>;miopenConvolutionFwdAlgoWinograd:ConvBinWinogradRxSf3x2,1.34752,0,miopenConvolutionFwdAlgoWinograd,<unused>;miopenConvolutionFwdAlgoGEMM:GemmFwd1x1_0_1,1.1896,0,miopenConvolutionFwdAlgoGEMM,<unused>
1384-14-14-1x1-384-14-14-32-0x0-1x1-1x1-0-NCHW-FP32-F=miopenConvolutionFwdAlgoImplicitGEMM:ConvHipImplicitGemmV4R1Fwd,0.659039,0,miopenConvolutionFwdAlgoImplicitGEMM,<unused>;miopenConvolutionFwdAlgoDirect:ConvAsm1x1U,0.841599,0,miopenConvolutionFwdAlgoDirect,<unused>;miopenConvolutionFwdAlgoWinograd:ConvBinWinogradRxSf3x2,1.36576,0,miopenConvolutionFwdAlgoWinograd,<unused>;miopenConvolutionFwdAlgoGEMM:GemmFwd1x1_0_1,1.26256,0,miopenConvolutionFwdAlgoGEMM,<unused>
1408-14-14-1x1-384-14-14-32-0x0-1x1-1x1-0-NCHW-FP32-F=miopenConvolutionFwdAlgoImplicitGEMM:ConvHipImplicitGemmV4R1Fwd,0.708159,0,miopenConvolutionFwdAlgoImplicitGEMM,<unused>;miopenConvolutionFwdAlgoDirect:ConvOclDirectFwd1x1,0.899839,0,miopenConvolutionFwdAlgoDirect,<unused>;miopenConvolutionFwdAlgoWinograd:ConvBinWinogradRxSf3x2,1.39088,0,miopenConvolutionFwdAlgoWinograd,<unused>;miopenConvolutionFwdAlgoGEMM:GemmFwd1x1_0_1,1.24288,0,miopenConvolutionFwdAlgoGEMM,<unused>
1432-14-14-1x1-384-14-14-32-0x0-1x1-1x1-0-NCHW-FP32-F=miopenConvolutionFwdAlgoImplicitGEMM:ConvHipImplicitGemmV4R1Fwd,0.671198,0,miopenConvolutionFwdAlgoImplicitGEMM,<unused>;miopenConvolutionFwdAlgoDirect:ConvAsm1x1U,0.868317,0,miopenConvolutionFwdAlgoDirect,<unused>;miopenConvolutionFwdAlgoWinograd:ConvBinWinogradRxSf3x2,1.41279,0,miopenConvolutionFwdAlgoWinograd,<unused>;miopenConvolutionFwdAlgoGEMM:GemmFwd1x1_0_1,1.27536,0,miopenConvolutionFwdAlgoGEMM,<unused>
1456-14-14-1x1-384-14-14-32-0x0-1x1-1x1-0-NCHW-FP32-F=miopenConvolutionFwdAlgoImplicitGEMM:ConvHipImplicitGemmV4R1Fwd,0.64736,0,miopenConvolutionFwdAlgoImplicitGEMM,<unused>;miopenConvolutionFwdAlgoDirect:ConvOclDirectFwd1x1,0.83088,0,miopenConvolutionFwdAlgoDirect,<unused>;miopenConvolutionFwdAlgoWinograd:ConvBinWinogradRxSf3x2,1.43648,0,miopenConvolutionFwdAlgoWinograd,<unused>;miopenConvolutionFwdAlgoGEMM:GemmFwd1x1_0_1,1.25248,0,miopenConvolutionFwdAlgoGEMM,<unused>
1480-14-14-1x1-384-14-14-32-0x0-1x1-1x1-0-NCHW-FP32-F=miopenConvolutionFwdAlgoImplicitGEMM:ConvHipImplicitGemmV4R1Fwd,0.69008,0,miopenConvolutionFwdAlgoImplicitGEMM,<unused>;miopenConvolutionFwdAlgoDirect:ConvAsm1x1U,0.89712,0,miopenConvolutionFwdAlgoDirect,<unused>;miopenConvolutionFwdAlgoWinograd:ConvBinWinogradRxSf3x2,1.45744,0,miopenConvolutionFwdAlgoWinograd,<unused>;miopenConvolutionFwdAlgoGEMM:GemmFwd1x1_0_1,1.256,0,miopenConvolutionFwdAlgoGEMM,<unused>
1504-14-14-1x1-384-14-14-32-0x0-1x1-1x1-0-NCHW-FP32-F=miopenConvolutionFwdAlgoImplicitGEMM:ConvHipImplicitGemmV4R1Fwd,0.712161,0,miopenConvolutionFwdAlgoImplicitGEMM,<unused>;miopenConvolutionFwdAlgoDirect:ConvOclDirectFwd1x1,0.869441,0,miopenConvolutionFwdAlgoDirect,<unused>;miopenConvolutionFwdAlgoWinograd:ConvBinWinogradRxSf3x2,1.4904,0,miopenConvolutionFwdAlgoWinograd,<unused>;miopenConvolutionFwdAlgoGEMM:GemmFwd1x1_0_1,1.22672,0,miopenConvolutionFwdAlgoGEMM,<unused>
1528-14-14-1x1-384-14-14-32-0x0-1x1-1x1-0-NCHW-FP32-F=miopenConvolutionFwdAlgoImplicitGEMM:ConvHipImplicitGemmV4R1Fwd,0.682079,0,miopenConvolutionFwdAlgoImplicitGEMM,<unused>;miopenConvolutionFwdAlgoDirect:ConvAsm1x1U,0.919838,0,miopenConvolutionFwdAlgoDirect,<unused>;miopenConvolutionFwdAlgoWinograd:ConvBinWinogradRxSf3x2,1.5032,0,miopenConvolutionFwdAlgoWinograd,<unused>;miopenConvolutionFwdAlgoGEMM:GemmFwd1x1_0_1,1.31888,0,miopenConvolutionFwdAlgoGEMM,<unused>
1552-14-14-1x1-2304-7-7-32-0x0-2x2-1x1-0-NCHW-FP32-F=miopenConvolutionFwdAlgoImplicitGEMM:ConvHipImplicitGemmV4R1Fwd,1.63744,0,miopenConvolutionFwdAlgoImplicitGEMM,<unused>;miopenConvolutionFwdAlgoDirect:ConvAsm1x1U,1.57168,9734144,miopenConvolutionFwdAlgoDirect,<unused>;miopenConvolutionFwdAlgoWinograd:ConvBinWinogradRxS,11.0706,0,miopenConvolutionFwdAlgoWinograd,<unused>;miopenConvolutionFwdAlgoGEMM:GemmFwd1x1_0_2,1.27312,24184832,miopenConvolutionFwdAlgoGEMM,<unused>
1552-14-14-1x1-768-14-14-32-0x0-1x1-1x1-0-NCHW-FP32-F=miopenConvolutionFwdAlgoImplicitGEMM:ConvHipImplicitGemmV4R1Fwd,1.30192,0,miopenConvolutionFwdAlgoImplicitGEMM,<unused>;miopenConvolutionFwdAlgoDirect:ConvAsm1x1U,1.74224,0,miopenConvolutionFwdAlgoDirect,<unused>;miopenConvolutionFwdAlgoWinograd:ConvBinWinogradRxSf3x2,3.0096,0,miopenConvolutionFwdAlgoWinograd,<unused>;miopenConvolutionFwdAlgoGEMM:GemmFwd1x1_0_1,2.05168,0,miopenConvolutionFwdAlgoGEMM,<unused>
768-14-14-3x3-768-7-7-32-1x1-2x2-1x1-0-NCHW-FP32-F_g32=miopenConvolutionFwdAlgoImplicitGEMM:ConvMlirIgemmFwd,0.49248,0,miopenConvolutionFwdAlgoImplicitGEMM,<unused>;miopenConvolutionFwdAlgoDirect:ConvOclDirectFwd,0.49648,0,miopenConvolutionFwdAlgoDirect,<unused>;miopenConvolutionFwdAlgoWinograd:ConvBinWinogradRxSf2x3,0.28512,0,miopenConvolutionFwdAlgoWinograd,<unused>;miopenConvolutionFwdAlgoGEMM:GemmFwdRest,2.27328,1354752,miopenConvolutionFwdAlgoGEMM,<unused>
768-7-7-1x1-2176-7-7-32-0x0-1x1-1x1-0-NCHW-FP32-F=miopenConvolutionFwdAlgoImplicitGEMM:ConvHipImplicitGemmV4R1Fwd,0.73248,0,miopenConvolutionFwdAlgoImplicitGEMM,<unused>;miopenConvolutionFwdAlgoDirect:ConvAsm1x1U,0.746239,0,miopenConvolutionFwdAlgoDirect,<unused>;miopenConvolutionFwdAlgoWinograd:ConvBinWinogradRxSf3x2,1.67408,0,miopenConvolutionFwdAlgoWinograd,<unused>;miopenConvolutionFwdAlgoGEMM:GemmFwd1x1_0_1,0.950719,0,miopenConvolutionFwdAlgoGEMM,<unused>
2432-7-7-1x1-768-7-7-32-0x0-1x1-1x1-0-NCHW-FP32-F=miopenConvolutionFwdAlgoImplicitGEMM:ConvHipImplicitGemmV4R1Fwd,0.848319,0,miopenConvolutionFwdAlgoImplicitGEMM,<unused>;miopenConvolutionFwdAlgoDirect:ConvAsm1x1U,0.902239,0,miopenConvolutionFwdAlgoDirect,<unused>;miopenConvolutionFwdAlgoWinograd:ConvBinWinogradRxSf3x2,1.8784,0,miopenConvolutionFwdAlgoWinograd,<unused>;miopenConvolutionFwdAlgoGEMM:GemmFwd1x1_0_1,1.73216,0,miopenConvolutionFwdAlgoGEMM,<unused>
768-7-7-3x3-768-7-7-32-1x1-1x1-1x1-0-NCHW-FP32-F_g32=miopenConvolutionFwdAlgoImplicitGEMM:ConvMlirIgemmFwd,0.490399,0,miopenConvolutionFwdAlgoImplicitGEMM,<unused>;miopenConvolutionFwdAlgoDirect:ConvAsm3x3U,0.42048,0,miopenConvolutionFwdAlgoDirect,<unused>;miopenConvolutionFwdAlgoWinograd:ConvBinWinogradRxSf2x3,0.12016,0,miopenConvolutionFwdAlgoWinograd,<unused>;miopenConvolutionFwdAlgoGEMM:GemmFwdRest,1.66912,1354752,miopenConvolutionFwdAlgoGEMM,<unused>
2560-7-7-1x1-768-7-7-32-0x0-1x1-1x1-0-NCHW-FP32-F=miopenConvolutionFwdAlgoImplicitGEMM:ConvHipImplicitGemmV4R1Fwd,1.08912,0,miopenConvolutionFwdAlgoImplicitGEMM,<unused>;miopenConvolutionFwdAlgoDirect:ConvAsm1x1U,0.972319,0,miopenConvolutionFwdAlgoDirect,<unused>;miopenConvolutionFwdAlgoWinograd:ConvBinWinogradRxSf3x2,1.99632,0,miopenConvolutionFwdAlgoWinograd,<unused>;miopenConvolutionFwdAlgoGEMM:GemmFwd1x1_0_1,1.86272,0,miopenConvolutionFwdAlgoGEMM,<unused>
2688-1-1-1x1-1000-1-1-32-0x0-1x1-1x1-0-NCHW-FP32-F=miopenConvolutionFwdAlgoImplicitGEMM:ConvMlirIgemmFwd,1.22416,0,miopenConvolutionFwdAlgoImplicitGEMM,<unused>;miopenConvolutionFwdAlgoDirect:ConvOclDirectFwd1x1,0.20192,0,miopenConvolutionFwdAlgoDirect,<unused>;miopenConvolutionFwdAlgoWinograd:ConvBinWinogradRxSf3x2,0.54384,0,miopenConvolutionFwdAlgoWinograd,<unused>;miopenConvolutionFwdAlgoGEMM:GemmFwd1x1_0_1,0.851359,0,miopenConvolutionFwdAlgoGEMM,<unused>
64-56-56-1x1-64-56-56-32-0x0-1x1-1x1-0-NCHW-FP32-F=miopenConvolutionFwdAlgoImplicitGEMM:ConvHipImplicitGemmV4R1Fwd,0.13152,0,miopenConvolutionFwdAlgoImplicitGEMM,<unused>;miopenConvolutionFwdAlgoDirect:ConvAsm1x1U,0.11776,0,miopenConvolutionFwdAlgoDirect,<unused>;miopenConvolutionFwdAlgoWinograd:ConvBinWinogradRxSf3x2,0.256961,0,miopenConvolutionFwdAlgoWinograd,<unused>;miopenConvolutionFwdAlgoGEMM:GemmFwd1x1_0_1,0.11648,0,miopenConvolutionFwdAlgoGEMM,<unused>
64-56-56-3x3-64-56-56-32-1x1-1x1-1x1-0-NCHW-FP32-F=miopenConvolutionFwdAlgoWinograd:ConvBinWinograd3x3U,0.419041,0,miopenConvolutionFwdAlgoWinograd,<unused>
128-56-56-1x1-256-56-56-32-0x0-1x1-1x1-0-NCHW-FP32-F=miopenConvolutionFwdAlgoImplicitGEMM:ConvHipImplicitGemmV4R1Fwd,0.651842,0,miopenConvolutionFwdAlgoImplicitGEMM,<unused>;miopenConvolutionFwdAlgoDirect:ConvOclDirectFwd1x1,0.670882,0,miopenConvolutionFwdAlgoDirect,<unused>;miopenConvolutionFwdAlgoWinograd:ConvBinWinogradRxSf3x2,1.4328,0,miopenConvolutionFwdAlgoWinograd,<unused>;miopenConvolutionFwdAlgoGEMM:GemmFwd1x1_0_1,0.651522,0,miopenConvolutionFwdAlgoGEMM,<unused>
256-56-56-1x1-64-56-56-32-0x0-1x1-1x1-0-NCHW-FP32-F=miopenConvolutionFwdAlgoImplicitGEMM:ConvHipImplicitGemmV4R1Fwd,0.346401,0,miopenConvolutionFwdAlgoImplicitGEMM,<unused>;miopenConvolutionFwdAlgoDirect:ConvAsm1x1U,0.387841,0,miopenConvolutionFwdAlgoDirect,<unused>;miopenConvolutionFwdAlgoWinograd:ConvBinWinogradRxSf3x2,0.725762,0,miopenConvolutionFwdAlgoWinograd,<unused>;miopenConvolutionFwdAlgoGEMM:GemmFwd1x1_0_1,0.378561,0,miopenConvolutionFwdAlgoGEMM,<unused>
64-56-56-1x1-256-56-56-32-0x0-1x1-1x1-0-NCHW-FP32-F=miopenConvolutionFwdAlgoImplicitGEMM:ConvHipImplicitGemmV4R1Fwd,0.403041,0,miopenConvolutionFwdAlgoImplicitGEMM,<unused>;miopenConvolutionFwdAlgoDirect:ConvAsm1x1U,0.378881,0,miopenConvolutionFwdAlgoDirect,<unused>;miopenConvolutionFwdAlgoWinograd:ConvBinWinogradRxSf3x2,0.864642,0,miopenConvolutionFwdAlgoWinograd,<unused>;miopenConvolutionFwdAlgoGEMM:GemmFwd1x1_0_1,0.360961,0,miopenConvolutionFwdAlgoGEMM,<unused>
128-56-56-3x3-128-28-28-32-1x1-2x2-1x1-0-NCHW-FP32-F=miopenConvolutionFwdAlgoImplicitGEMM:ConvHipImplicitGemmV4R1Fwd,0.822722,0,miopenConvolutionFwdAlgoImplicitGEMM,<unused>;miopenConvolutionFwdAlgoDirect:ConvOclDirectFwd,5.47537,0,miopenConvolutionFwdAlgoDirect,<unused>;miopenConvolutionFwdAlgoWinograd:ConvBinWinogradRxSf2x3g1,1.53824,0,miopenConvolutionFwdAlgoWinograd,<unused>;miopenConvolutionFwdAlgoGEMM:GemmFwdRest,4.46464,3612672,miopenConvolutionFwdAlgoGEMM,<unused>
384-28-28-1x1-512-28-28-32-0x0-1x1-1x1-0-NCHW-FP32-F=miopenConvolutionFwdAlgoImplicitGEMM:ConvHipImplicitGemmV4R1Fwd,0.916639,0,miopenConvolutionFwdAlgoImplicitGEMM,<unused>;miopenConvolutionFwdAlgoDirect:ConvAsm1x1U,1.0032,0,miopenConvolutionFwdAlgoDirect,<unused>;miopenConvolutionFwdAlgoWinograd:ConvBinWinogradRxSf3x2,2.124,0,miopenConvolutionFwdAlgoWinograd,<unused>;miopenConvolutionFwdAlgoGEMM:GemmFwd1x1_0_1,1.26048,0,miopenConvolutionFwdAlgoGEMM,<unused>
512-28-28-1x1-128-28-28-32-0x0-1x1-1x1-0-NCHW-FP32-F=miopenConvolutionFwdAlgoImplicitGEMM:ConvHipImplicitGemmV4R1Fwd,0.33776,0,miopenConvolutionFwdAlgoImplicitGEMM,<unused>;miopenConvolutionFwdAlgoDirect:ConvAsm1x1U,0.510879,0,miopenConvolutionFwdAlgoDirect,<unused>;miopenConvolutionFwdAlgoWinograd:ConvBinWinogradRxSf3x2,0.844479,0,miopenConvolutionFwdAlgoWinograd,<unused>;miopenConvolutionFwdAlgoGEMM:GemmFwd1x1_0_1,0.410559,0,miopenConvolutionFwdAlgoGEMM,<unused>
128-28-28-3x3-128-28-28-32-1x1-1x1-1x1-0-NCHW-FP32-F=miopenConvolutionFwdAlgoWinograd:ConvBinWinograd3x3U,0.403198,0,miopenConvolutionFwdAlgoWinograd,<unused>
128-28-28-1x1-512-28-28-32-0x0-1x1-1x1-0-NCHW-FP32-F=miopenConvolutionFwdAlgoImplicitGEMM:ConvHipImplicitGemmV4R1Fwd,0.337119,0,miopenConvolutionFwdAlgoImplicitGEMM,<unused>;miopenConvolutionFwdAlgoDirect:ConvOclDirectFwd1x1,0.398239,0,miopenConvolutionFwdAlgoDirect,<unused>;miopenConvolutionFwdAlgoWinograd:ConvBinWinogradRxSf3x2,0.876799,0,miopenConvolutionFwdAlgoWinograd,<unused>;miopenConvolutionFwdAlgoGEMM:GemmFwd1x1_0_1,0.371199,0,miopenConvolutionFwdAlgoGEMM,<unused>
256-28-28-3x3-256-14-14-32-1x1-2x2-1x1-0-NCHW-FP32-F=miopenConvolutionFwdAlgoImplicitGEMM:ConvHipImplicitGemmV4R1Fwd,0.795519,0,miopenConvolutionFwdAlgoImplicitGEMM,<unused>;miopenConvolutionFwdAlgoDirect:ConvOclDirectFwd,6.71551,0,miopenConvolutionFwdAlgoDirect,<unused>;miopenConvolutionFwdAlgoWinograd:ConvBinWinogradRxSf2x3g1,1.52128,0,miopenConvolutionFwdAlgoWinograd,<unused>;miopenConvolutionFwdAlgoGEMM:GemmFwdRest,4.53632,1806336,miopenConvolutionFwdAlgoGEMM,<unused>
768-14-14-1x1-1024-14-14-32-0x0-1x1-1x1-0-NCHW-FP32-F=miopenConvolutionFwdAlgoImplicitGEMM:ConvHipImplicitGemmV4R1Fwd,0.978558,0,miopenConvolutionFwdAlgoImplicitGEMM,<unused>;miopenConvolutionFwdAlgoDirect:ConvAsm1x1U,1.256,0,miopenConvolutionFwdAlgoDirect,<unused>;miopenConvolutionFwdAlgoWinograd:ConvBinWinogradRxSf3x2,2.13568,0,miopenConvolutionFwdAlgoWinograd,<unused>;miopenConvolutionFwdAlgoGEMM:GemmFwd1x1_0_1,1.4832,0,miopenConvolutionFwdAlgoGEMM,<unused>
1024-14-14-1x1-256-14-14-32-0x0-1x1-1x1-0-NCHW-FP32-F=miopenConvolutionFwdAlgoImplicitGEMM:ConvHipImplicitGemmV4R1Fwd,0.398559,0,miopenConvolutionFwdAlgoImplicitGEMM,<unused>;miopenConvolutionFwdAlgoDirect:ConvAsm1x1U,0.562559,0,miopenConvolutionFwdAlgoDirect,<unused>;miopenConvolutionFwdAlgoWinograd:ConvBinWinogradRxSf3x2,0.829118,0,miopenConvolutionFwdAlgoWinograd,<unused>;miopenConvolutionFwdAlgoGEMM:GemmFwd1x1_0_1,0.511039,0,miopenConvolutionFwdAlgoGEMM,<unused>
256-14-14-3x3-256-14-14-32-1x1-1x1-1x1-0-NCHW-FP32-F=miopenConvolutionFwdAlgoWinograd:ConvBinWinograd3x3U,0.392318,0,miopenConvolutionFwdAlgoWinograd,<unused>
256-14-14-1x1-1024-14-14-32-0x0-1x1-1x1-0-NCHW-FP32-F=miopenConvolutionFwdAlgoImplicitGEMM:ConvHipImplicitGemmV4R1Fwd,0.33888,0,miopenConvolutionFwdAlgoImplicitGEMM,<unused>;miopenConvolutionFwdAlgoDirect:ConvAsm1x1U,0.533279,0,miopenConvolutionFwdAlgoDirect,<unused>;miopenConvolutionFwdAlgoWinograd:ConvBinWinogradRxSf3x2,0.841758,0,miopenConvolutionFwdAlgoWinograd,<unused>;miopenConvolutionFwdAlgoGEMM:GemmFwd1x1_0_1,0.471359,0,miopenConvolutionFwdAlgoGEMM,<unused>
512-14-14-3x3-512-7-7-32-1x1-2x2-1x1-0-NCHW-FP32-F=miopenConvolutionFwdAlgoImplicitGEMM:ConvHipImplicitGemmV4R1Fwd,1.33648,0,miopenConvolutionFwdAlgoImplicitGEMM,<unused>;miopenConvolutionFwdAlgoDirect:ConvOclDirectFwd,6.45999,0,miopenConvolutionFwdAlgoDirect,<unused>;miopenConvolutionFwdAlgoWinograd:ConvBinWinogradRxSf2x3g1,2.15808,0,miopenConvolutionFwdAlgoWinograd,<unused>;miopenConvolutionFwdAlgoGEMM:GemmFwdRest,13.015,903168,miopenConvolutionFwdAlgoGEMM,<unused>
1536-7-7-1x1-2048-7-7-32-0x0-1x1-1x1-0-NCHW-FP32-F=miopenConvolutionFwdAlgoImplicitGEMM:ConvHipImplicitGemmV4R1Fwd,1.57136,0,miopenConvolutionFwdAlgoImplicitGEMM,<unused>;miopenConvolutionFwdAlgoDirect:ConvAsm1x1U,1.41552,0,miopenConvolutionFwdAlgoDirect,<unused>;miopenConvolutionFwdAlgoWinograd:ConvBinWinogradRxSf3x2,2.96911,0,miopenConvolutionFwdAlgoWinograd,<unused>;miopenConvolutionFwdAlgoGEMM:GemmFwd1x1_0_1,2.05472,0,miopenConvolutionFwdAlgoGEMM,<unused>
2048-7-7-1x1-512-7-7-32-0x0-1x1-1x1-0-NCHW-FP32-F=miopenConvolutionFwdAlgoImplicitGEMM:ConvHipImplicitGemmV4R1Fwd,0.816798,0,miopenConvolutionFwdAlgoImplicitGEMM,<unused>;miopenConvolutionFwdAlgoDirect:ConvAsm1x1U,0.668318,0,miopenConvolutionFwdAlgoDirect,<unused>;miopenConvolutionFwdAlgoWinograd:ConvBinWinogradRxSf3x2,1.21408,0,miopenConvolutionFwdAlgoWinograd,<unused>;miopenConvolutionFwdAlgoGEMM:GemmFwd1x1_0_1,1.17264,0,miopenConvolutionFwdAlgoGEMM,<unused>
512-7-7-3x3-512-7-7-32-1x1-1x1-1x1-0-NCHW-FP32-F=miopenConvolutionFwdAlgoWinograd:ConvBinWinogradRxSf2x3g1,0.541759,0,miopenConvolutionFwdAlgoWinograd,<unused>
512-7-7-1x1-2048-7-7-32-0x0-1x1-1x1-0-NCHW-FP32-F=miopenConvolutionFwdAlgoImplicitGEMM:ConvHipImplicitGemmV4R1Fwd,0.539358,0,miopenConvolutionFwdAlgoImplicitGEMM,<unused>;miopenConvolutionFwdAlgoDirect:ConvAsm1x1U,0.649279,0,miopenConvolutionFwdAlgoDirect,<unused>;miopenConvolutionFwdAlgoWinograd:ConvBinWinogradRxSf3x2,1.052,0,miopenConvolutionFwdAlgoWinograd,<unused>;miopenConvolutionFwdAlgoGEMM:GemmFwd1x1_0_1,0.699998,0,miopenConvolutionFwdAlgoGEMM,<unused>
3-299-299-3x3-32-149-149-16-0x0-2x2-1x1-0-NCHW-FP32-F=miopenConvolutionFwdAlgoImplicitGEMM:ConvMlirIgemmFwd,0.45168,0,miopenConvolutionFwdAlgoImplicitGEMM,<unused>;miopenConvolutionFwdAlgoDirect:ConvOclDirectFwd,0.841438,0,miopenConvolutionFwdAlgoDirect,<unused>;miopenConvolutionFwdAlgoWinograd:ConvBinWinogradRxSf2x3g1,0.29344,0,miopenConvolutionFwdAlgoWinograd,<unused>;miopenConvolutionFwdAlgoGEMM:GemmFwdRest,0.80384,2397708,miopenConvolutionFwdAlgoGEMM,<unused>
32-149-149-3x3-32-147-147-16-0x0-1x1-1x1-0-NCHW-FP32-F=miopenConvolutionFwdAlgoImplicitGEMM:ConvMlirIgemmFwd,2.50448,0,miopenConvolutionFwdAlgoImplicitGEMM,<unused>;miopenConvolutionFwdAlgoDirect:ConvOclDirectFwd,4.96159,0,miopenConvolutionFwdAlgoDirect,<unused>;miopenConvolutionFwdAlgoWinograd:ConvBinWinogradRxS,0.426719,0,miopenConvolutionFwdAlgoWinograd,<unused>;miopenConvolutionFwdAlgoGEMM:GemmFwdRest,2.55485,24893568,miopenConvolutionFwdAlgoGEMM,<unused>
32-147-147-3x3-64-147-147-16-1x1-1x1-1x1-0-NCHW-FP32-F=miopenConvolutionFwdAlgoWinograd:ConvBinWinograd3x3U,0.798397,0,miopenConvolutionFwdAlgoWinograd,<unused>
64-147-147-3x3-96-73-73-16-0x0-2x2-1x1-0-NCHW-FP32-F=miopenConvolutionFwdAlgoImplicitGEMM:ConvMlirIgemmFwd,2.66112,0,miopenConvolutionFwdAlgoImplicitGEMM,<unused>;miopenConvolutionFwdAlgoDirect:ConvOclDirectFwd,6.71375,0,miopenConvolutionFwdAlgoDirect,<unused>;miopenConvolutionFwdAlgoWinograd:ConvBinWinogradRxSf2x3g1,1.97776,0,miopenConvolutionFwdAlgoWinograd,<unused>;miopenConvolutionFwdAlgoGEMM:GemmFwdRest,2.41917,12278016,miopenConvolutionFwdAlgoGEMM,<unused>
160-73-73-1x1-128-73-73-16-0x0-1x1-1x1-0-NCHW-FP32-F=miopenConvolutionFwdAlgoImplicitGEMM:ConvMlirIgemmFwd,0.756001,0,miopenConvolutionFwdAlgoImplicitGEMM,<unused>;miopenConvolutionFwdAlgoDirect:ConvOclDirectFwd1x1,0.40848,0,miopenConvolutionFwdAlgoDirect,<unused>;miopenConvolutionFwdAlgoWinograd:ConvBinWinogradRxSf3x2,0.765281,0,miopenConvolutionFwdAlgoWinograd,<unused>;miopenConvolutionFwdAlgoGEMM:GemmFwd1x1_0_1,0.35968,0,miopenConvolutionFwdAlgoGEMM,<unused>
64-73-73-3x3-96-71-71-16-0x0-1x1-1x1-0-NCHW-FP32-F=miopenConvolutionFwdAlgoImplicitGEMM:ConvMlirIgemmFwd,2.45168,0,miopenConvolutionFwdAlgoImplicitGEMM,<unused>;miopenConvolutionFwdAlgoDirect:ConvOclDirectFwd,7.27601,0,miopenConvolutionFwdAlgoDirect,<unused>;miopenConvolutionFwdAlgoWinograd:ConvBinWinogradRxSf2x3g1,0.5216,0,miopenConvolutionFwdAlgoWinograd,<unused>;miopenConvolutionFwdAlgoGEMM:GemmFwdRest,2.13248,11614464,miopenConvolutionFwdAlgoGEMM,<unused>
64-73-73-1x7-64-73-73-16-0x3-1x1-1x1-0-NCHW-FP32-F=miopenConvolutionFwdAlgoDirect:ConvDirectNaiveConvFwd,10.2835,0,miopenConvolutionFwdAlgoDirect,<unused>;miopenConvolutionFwdAlgoWinograd:ConvBinWinogradRxSf3x2,0.62576,0,miopenConvolutionFwdAlgoWinograd,<unused>;miopenConvolutionFwdAlgoGEMM:GemmFwdRest,1.63072,9549568,miopenConvolutionFwdAlgoGEMM,<unused>
64-73-73-7x1-64-73-73-16-3x0-1x1-1x1-0-NCHW-FP32-F=miopenConvolutionFwdAlgoDirect:ConvDirectNaiveConvFwd,12.4362,0,miopenConvolutionFwdAlgoDirect,<unused>;miopenConvolutionFwdAlgoWinograd:ConvBinWinogradRxSf3x2,0.6392,0,miopenConvolutionFwdAlgoWinograd,<unused>;miopenConvolutionFwdAlgoGEMM:GemmFwdRest,1.63328,9549568,miopenConvolutionFwdAlgoGEMM,<unused>
192-71-71-3x3-192-35-35-16-0x0-2x2-1x1-0-NCHW-FP32-F=miopenConvolutionFwdAlgoImplicitGEMM:ConvMlirIgemmFwd,2.7936,0,miopenConvolutionFwdAlgoImplicitGEMM,<unused>;miopenConvolutionFwdAlgoDirect:ConvOclDirectFwd,19.2935,0,miopenConvolutionFwdAlgoDirect,<unused>;miopenConvolutionFwdAlgoWinograd:ConvBinWinogradRxSf2x3g1,2.7592,0,miopenConvolutionFwdAlgoWinograd,<unused>;miopenConvolutionFwdAlgoGEMM:GemmFwdRest,2.44224,8467200,miopenConvolutionFwdAlgoGEMM,<unused>
384-35-35-1x1-128-35-35-16-0x0-1x1-1x1-0-NCHW-FP32-F=miopenConvolutionFwdAlgoImplicitGEMM:ConvMlirIgemmFwd,0.500481,0,miopenConvolutionFwdAlgoImplicitGEMM,<unused>;miopenConvolutionFwdAlgoDirect:ConvAsm1x1U,0.26784,0,miopenConvolutionFwdAlgoDirect,<unused>;miopenConvolutionFwdAlgoWinograd:ConvBinWinogradRxSf3x2,0.42448,0,miopenConvolutionFwdAlgoWinograd,<unused>;miopenConvolutionFwdAlgoGEMM:GemmFwd1x1_0_1,0.24384,0,miopenConvolutionFwdAlgoGEMM,<unused>
384-35-35-1x1-96-35-35-16-0x0-1x1-1x1-0-NCHW-FP32-F=miopenConvolutionFwdAlgoImplicitGEMM:ConvMlirIgemmFwd,0.52656,0,miopenConvolutionFwdAlgoImplicitGEMM,<unused>;miopenConvolutionFwdAlgoDirect:ConvAsm1x1U,0.192961,0,miopenConvolutionFwdAlgoDirect,<unused>;miopenConvolutionFwdAlgoWinograd:ConvBinWinogradRxSf3x2,0.34464,0,miopenConvolutionFwdAlgoWinograd,<unused>;miopenConvolutionFwdAlgoGEMM:GemmFwd1x1_0_1,0.17632,0,miopenConvolutionFwdAlgoGEMM,<unused>
64-35-35-3x3-96-35-35-16-1x1-1x1-1x1-0-NCHW-FP32-F=miopenConvolutionFwdAlgoWinograd:ConvBinWinograd3x3U,0.15488,0,miopenConvolutionFwdAlgoWinograd,<unused>
96-35-35-3x3-96-35-35-16-1x1-1x1-1x1-0-NCHW-FP32-F=miopenConvolutionFwdAlgoWinograd:ConvBinWinograd3x3U,0.2112,0,miopenConvolutionFwdAlgoWinograd,<unused>
384-35-35-3x3-384-17-17-16-0x0-2x2-1x1-0-NCHW-FP32-F=miopenConvolutionFwdAlgoImplicitGEMM:ConvMlirIgemmFwd,2.86608,0,miopenConvolutionFwdAlgoImplicitGEMM,<unused>;miopenConvolutionFwdAlgoDirect:ConvOclDirectFwd,33.0626,0,miopenConvolutionFwdAlgoDirect,<unused>;miopenConvolutionFwdAlgoWinograd:ConvBinWinogradRxSf2x3g1,2.89776,0,miopenConvolutionFwdAlgoWinograd,<unused>;miopenConvolutionFwdAlgoGEMM:GemmFwdRest,2.32448,3995136,miopenConvolutionFwdAlgoGEMM,<unused>
384-35-35-1x1-192-35-35-16-0x0-1x1-1x1-0-NCHW-FP32-F=miopenConvolutionFwdAlgoImplicitGEMM:ConvMlirIgemmFwd,0.63136,0,miopenConvolutionFwdAlgoImplicitGEMM,<unused>;miopenConvolutionFwdAlgoDirect:ConvAsm1x1U,0.4144,0,miopenConvolutionFwdAlgoDirect,<unused>;miopenConvolutionFwdAlgoWinograd:ConvBinWinogradRxSf3x2,0.726081,0,miopenConvolutionFwdAlgoWinograd,<unused>;miopenConvolutionFwdAlgoGEMM:GemmFwd1x1_0_1,0.31776,0,miopenConvolutionFwdAlgoGEMM,<unused>
192-35-35-3x3-224-35-35-16-1x1-1x1-1x1-0-NCHW-FP32-F=miopenConvolutionFwdAlgoWinograd:ConvBinWinograd3x3U,0.7768,0,miopenConvolutionFwdAlgoWinograd,<unused>
224-35-35-3x3-256-17-17-16-0x0-2x2-1x1-0-NCHW-FP32-F=miopenConvolutionFwdAlgoImplicitGEMM:ConvMlirIgemmFwd,1.67568,0,miopenConvolutionFwdAlgoImplicitGEMM,<unused>;miopenConvolutionFwdAlgoDirect:ConvOclDirectFwd,13.4917,0,miopenConvolutionFwdAlgoDirect,<unused>;miopenConvolutionFwdAlgoWinograd:ConvBinWinogradRxSf2x3g1,1.15088,0,miopenConvolutionFwdAlgoWinograd,<unused>;miopenConvolutionFwdAlgoGEMM:GemmFwdRest,1.4976,2330496,miopenConvolutionFwdAlgoGEMM,<unused>
1024-17-17-1x1-768-17-17-16-0x0-1x1-1x1-0-NCHW-FP32-F=miopenConvolutionFwdAlgoImplicitGEMM:ConvMlirIgemmFwd,1.63264,0,miopenConvolutionFwdAlgoImplicitGEMM,<unused>;miopenConvolutionFwdAlgoDirect:ConvAsm1x1U,0.9888,0,miopenConvolutionFwdAlgoDirect,<unused>;miopenConvolutionFwdAlgoWinograd:ConvBinWinogradRxSf3x2,1.6168,0,miopenConvolutionFwdAlgoWinograd,<unused>;miopenConvolutionFwdAlgoGEMM:GemmFwd1x1_0_1,0.885919,0,miopenConvolutionFwdAlgoGEMM,<unused>
192-17-17-1x7-224-17-17-16-0x3-1x1-1x1-0-NCHW-FP32-F=miopenConvolutionFwdAlgoDirect:ConvDirectNaiveConvFwd,6.24288,0,miopenConvolutionFwdAlgoDirect,<unused>;miopenConvolutionFwdAlgoWinograd:ConvBinWinogradRxSf3x2,0.48288,0,miopenConvolutionFwdAlgoWinograd,<unused>;miopenConvolutionFwdAlgoGEMM:GemmFwdRest,1.21856,1553664,miopenConvolutionFwdAlgoGEMM,<unused>
224-17-17-7x1-256-17-17-16-3x0-1x1-1x1-0-NCHW-FP32-F=miopenConvolutionFwdAlgoDirect:ConvDirectNaiveConvFwd,9.42991,0,miopenConvolutionFwdAlgoDirect,<unused>;miopenConvolutionFwdAlgoWinograd:ConvBinWinogradRxSf3x2,0.5616,0,miopenConvolutionFwdAlgoWinograd,<unused>;miopenConvolutionFwdAlgoGEMM:GemmFwdRest,1.32608,1812608,miopenConvolutionFwdAlgoGEMM,<unused>
192-17-17-7x1-192-17-17-16-3x0-1x1-1x1-0-NCHW-FP32-F=miopenConvolutionFwdAlgoDirect:ConvDirectNaiveConvFwd,6.46527,0,miopenConvolutionFwdAlgoDirect,<unused>;miopenConvolutionFwdAlgoWinograd:ConvBinWinogradRxSf3x2,0.324,0,miopenConvolutionFwdAlgoWinograd,<unused>;miopenConvolutionFwdAlgoGEMM:GemmFwdRest,1.06237,1553664,miopenConvolutionFwdAlgoGEMM,<unused>
224-17-17-7x1-224-17-17-16-3x0-1x1-1x1-0-NCHW-FP32-F=miopenConvolutionFwdAlgoDirect:ConvDirectNaiveConvFwd,8.37695,0,miopenConvolutionFwdAlgoDirect,<unused>;miopenConvolutionFwdAlgoWinograd:ConvBinWinogradRxSf3x2,0.544,0,miopenConvolutionFwdAlgoWinograd,<unused>;miopenConvolutionFwdAlgoGEMM:GemmFwdRest,1.32861,1812608,miopenConvolutionFwdAlgoGEMM,<unused>
224-17-17-1x7-256-17-17-16-0x3-1x1-1x1-0-NCHW-FP32-F=miopenConvolutionFwdAlgoDirect:ConvDirectNaiveConvFwd,7.96319,0,miopenConvolutionFwdAlgoDirect,<unused>;miopenConvolutionFwdAlgoWinograd:ConvBinWinogradRxSf3x2,0.544,0,miopenConvolutionFwdAlgoWinograd,<unused>;miopenConvolutionFwdAlgoGEMM:GemmFwdRest,1.27997,1812608,miopenConvolutionFwdAlgoGEMM,<unused>
1024-17-17-1x1-128-17-17-16-0x0-1x1-1x1-0-NCHW-FP32-F=miopenConvolutionFwdAlgoImplicitGEMM:ConvMlirIgemmFwd,0.54928,0,miopenConvolutionFwdAlgoImplicitGEMM,<unused>;miopenConvolutionFwdAlgoDirect:ConvAsm1x1U,0.319999,0,miopenConvolutionFwdAlgoDirect,<unused>;miopenConvolutionFwdAlgoWinograd:ConvBinWinogradRxSf3x2,0.42176,0,miopenConvolutionFwdAlgoWinograd,<unused>;miopenConvolutionFwdAlgoGEMM:GemmFwd1x1_0_1,0.196,0,miopenConvolutionFwdAlgoGEMM,<unused>
1024-17-17-1x1-192-17-17-16-0x0-1x1-1x1-0-NCHW-FP32-F=miopenConvolutionFwdAlgoImplicitGEMM:ConvMlirIgemmFwd,0.56208,0,miopenConvolutionFwdAlgoImplicitGEMM,<unused>;miopenConvolutionFwdAlgoDirect:ConvAsm1x1U,0.31952,0,miopenConvolutionFwdAlgoDirect,<unused>;miopenConvolutionFwdAlgoWinograd:ConvBinWinogradRxSf3x2,0.43424,0,miopenConvolutionFwdAlgoWinograd,<unused>;miopenConvolutionFwdAlgoGEMM:GemmFwd1x1_0_1,0.24624,0,miopenConvolutionFwdAlgoGEMM,<unused>
192-17-17-3x3-192-8-8-16-0x0-2x2-1x1-0-NCHW-FP32-F=miopenConvolutionFwdAlgoImplicitGEMM:ConvHipImplicitGemmV4R1Fwd,0.19248,0,miopenConvolutionFwdAlgoImplicitGEMM,<unused>;miopenConvolutionFwdAlgoDirect:ConvOclDirectFwd,0.637919,0,miopenConvolutionFwdAlgoDirect,<unused>;miopenConvolutionFwdAlgoWinograd:ConvBinWinogradRxSf2x3g1,0.19072,0,miopenConvolutionFwdAlgoWinograd,<unused>;miopenConvolutionFwdAlgoGEMM:GemmFwdRest,1.13152,442368,miopenConvolutionFwdAlgoGEMM,<unused>
1024-17-17-1x1-256-17-17-16-0x0-1x1-1x1-0-NCHW-FP32-F=miopenConvolutionFwdAlgoImplicitGEMM:ConvMlirIgemmFwd,0.83024,0,miopenConvolutionFwdAlgoImplicitGEMM,<unused>;miopenConvolutionFwdAlgoDirect:ConvAsm1x1U,0.59008,0,miopenConvolutionFwdAlgoDirect,<unused>;miopenConvolutionFwdAlgoWinograd:ConvBinWinogradRxSf3x2,0.629919,0,miopenConvolutionFwdAlgoWinograd,<unused>;miopenConvolutionFwdAlgoGEMM:GemmFwd1x1_0_1,0.33536,0,miopenConvolutionFwdAlgoGEMM,<unused>
256-17-17-1x7-256-17-17-16-0x3-1x1-1x1-0-NCHW-FP32-F=miopenConvolutionFwdAlgoDirect:ConvDirectNaiveConvFwd,8.94623,0,miopenConvolutionFwdAlgoDirect,<unused>;miopenConvolutionFwdAlgoWinograd:ConvBinWinogradRxSf3x2,0.61472,0,miopenConvolutionFwdAlgoWinograd,<unused>;miopenConvolutionFwdAlgoGEMM:GemmFwdRest,1.39773,2071552,miopenConvolutionFwdAlgoGEMM,<unused>
256-17-17-7x1-320-17-17-16-3x0-1x1-1x1-0-NCHW-FP32-F=miopenConvolutionFwdAlgoDirect:ConvDirectNaiveConvFwd,12.6915,0,miopenConvolutionFwdAlgoDirect,<unused>;miopenConvolutionFwdAlgoWinograd:ConvBinWinogradRxSf3x2,0.62448,0,miopenConvolutionFwdAlgoWinograd,<unused>;miopenConvolutionFwdAlgoGEMM:GemmFwdRest,1.44637,2071552,miopenConvolutionFwdAlgoGEMM,<unused>
320-17-17-3x3-320-8-8-16-0x0-2x2-1x1-0-NCHW-FP32-F=miopenConvolutionFwdAlgoImplicitGEMM:ConvHipImplicitGemmV4R1Fwd,0.35056,0,miopenConvolutionFwdAlgoImplicitGEMM,<unused>;miopenConvolutionFwdAlgoDirect:ConvOclDirectFwd,1.50272,0,miopenConvolutionFwdAlgoDirect,<unused>;miopenConvolutionFwdAlgoWinograd:ConvBinWinogradRxSf2x3g1,0.56224,0,miopenConvolutionFwdAlgoWinograd,<unused>;miopenConvolutionFwdAlgoGEMM:GemmFwdRest,1.45917,737280,miopenConvolutionFwdAlgoGEMM,<unused>
1536-8-8-1x1-768-8-8-16-0x0-1x1-1x1-0-NCHW-FP32-F=miopenConvolutionFwdAlgoImplicitGEMM:ConvHipImplicitGemmV4R1Fwd,0.30608,0,miopenConvolutionFwdAlgoImplicitGEMM,<unused>;miopenConvolutionFwdAlgoDirect:ConvAsm1x1U,0.43552,0,miopenConvolutionFwdAlgoDirect,<unused>;miopenConvolutionFwdAlgoWinograd:ConvBinWinogradRxSf3x2,0.636,0,miopenConvolutionFwdAlgoWinograd,<unused>;miopenConvolutionFwdAlgoGEMM:GemmFwd1x1_0_1,0.53984,0,miopenConvolutionFwdAlgoGEMM,<unused>
1536-8-8-1x1-256-8-8-16-0x0-1x1-1x1-0-NCHW-FP32-F=miopenConvolutionFwdAlgoImplicitGEMM:ConvHipImplicitGemmV4R1Fwd,0.24384,0,miopenConvolutionFwdAlgoImplicitGEMM,<unused>;miopenConvolutionFwdAlgoDirect:ConvAsm1x1U,0.24048,0,miopenConvolutionFwdAlgoDirect,<unused>;miopenConvolutionFwdAlgoWinograd:ConvBinWinogradRxSf3x2,0.32624,0,miopenConvolutionFwdAlgoWinograd,<unused>;miopenConvolutionFwdAlgoGEMM:GemmFwd1x1_0_1,0.22112,0,miopenConvolutionFwdAlgoGEMM,<unused>
384-8-8-1x3-256-8-8-16-0x1-1x1-1x1-0-NCHW-FP32-F=miopenConvolutionFwdAlgoImplicitGEMM:ConvHipImplicitGemmV4R1Fwd,0.17168,0,miopenConvolutionFwdAlgoImplicitGEMM,<unused>;miopenConvolutionFwdAlgoDirect:ConvDirectNaiveConvFwd,2.24912,0,miopenConvolutionFwdAlgoDirect,<unused>;miopenConvolutionFwdAlgoWinograd:ConvBinWinogradRxS,0.18032,0,miopenConvolutionFwdAlgoWinograd,<unused>;miopenConvolutionFwdAlgoGEMM:GemmFwdRest,0.91136,294912,miopenConvolutionFwdAlgoGEMM,<unused>
384-8-8-3x1-256-8-8-16-1x0-1x1-1x1-0-NCHW-FP32-F=miopenConvolutionFwdAlgoImplicitGEMM:ConvHipImplicitGemmV4R1Fwd,0.17088,0,miopenConvolutionFwdAlgoImplicitGEMM,<unused>;miopenConvolutionFwdAlgoDirect:ConvDirectNaiveConvFwd,2.61552,0,miopenConvolutionFwdAlgoDirect,<unused>;miopenConvolutionFwdAlgoWinograd:ConvBinWinogradRxSf2x3g1,0.18016,0,miopenConvolutionFwdAlgoWinograd,<unused>;miopenConvolutionFwdAlgoGEMM:GemmFwdRest,0.88576,294912,miopenConvolutionFwdAlgoGEMM,<unused>
384-8-8-3x1-448-8-8-16-1x0-1x1-1x1-0-NCHW-FP32-F=miopenConvolutionFwdAlgoImplicitGEMM:ConvHipImplicitGemmV4R1Fwd,0.172,0,miopenConvolutionFwdAlgoImplicitGEMM,<unused>;miopenConvolutionFwdAlgoDirect:ConvDirectNaiveConvFwd,4.18416,0,miopenConvolutionFwdAlgoDirect,<unused>;miopenConvolutionFwdAlgoWinograd:ConvBinWinogradRxSf2x3g1,0.18112,0,miopenConvolutionFwdAlgoWinograd,<unused>;miopenConvolutionFwdAlgoGEMM:GemmFwdRest,0.9344,294912,miopenConvolutionFwdAlgoGEMM,<unused>
448-8-8-1x3-512-8-8-16-0x1-1x1-1x1-0-NCHW-FP32-F=miopenConvolutionFwdAlgoImplicitGEMM:ConvHipImplicitGemmV4R1Fwd,0.25904,0,miopenConvolutionFwdAlgoImplicitGEMM,<unused>;miopenConvolutionFwdAlgoDirect:ConvDirectNaiveConvFwd,4.83584,0,miopenConvolutionFwdAlgoDirect,<unused>;miopenConvolutionFwdAlgoWinograd:ConvBinWinogradRxS,0.29456,0,miopenConvolutionFwdAlgoWinograd,<unused>;miopenConvolutionFwdAlgoGEMM:GemmFwdRest,1.0112,344064,miopenConvolutionFwdAlgoGEMM,<unused>
512-8-8-1x3-256-8-8-16-0x1-1x1-1x1-0-NCHW-FP32-F=miopenConvolutionFwdAlgoImplicitGEMM:ConvHipImplicitGemmV4R1Fwd,0.22496,0,miopenConvolutionFwdAlgoImplicitGEMM,<unused>;miopenConvolutionFwdAlgoDirect:ConvDirectNaiveConvFwd,3.02432,0,miopenConvolutionFwdAlgoDirect,<unused>;miopenConvolutionFwdAlgoWinograd:ConvBinWinogradRxS,0.23184,0,miopenConvolutionFwdAlgoWinograd,<unused>;miopenConvolutionFwdAlgoGEMM:GemmFwdRest,1.05728,393216,miopenConvolutionFwdAlgoGEMM,<unused>
512-8-8-3x1-256-8-8-16-1x0-1x1-1x1-0-NCHW-FP32-F=miopenConvolutionFwdAlgoImplicitGEMM:ConvHipImplicitGemmV4R1Fwd,0.22464,0,miopenConvolutionFwdAlgoImplicitGEMM,<unused>;miopenConvolutionFwdAlgoDirect:ConvDirectNaiveConvFwd,3.47328,0,miopenConvolutionFwdAlgoDirect,<unused>;miopenConvolutionFwdAlgoWinograd:ConvBinWinogradRxSf2x3g1,0.232,0,miopenConvolutionFwdAlgoWinograd,<unused>;miopenConvolutionFwdAlgoGEMM:GemmFwdRest,1.05984,393216,miopenConvolutionFwdAlgoGEMM,<unused>
3-224-224-7x7-64-112-112-16-3x3-2x2-1x1-0-NCHW-FP32-F=miopenConvolutionFwdAlgoImplicitGEMM:ConvMlirIgemmFwd,1.44832,0,miopenConvolutionFwdAlgoImplicitGEMM,<unused>;miopenConvolutionFwdAlgoDirect:ConvAsm7x7c3h224w224k64u2v2p3q3f1,0.45904,0,miopenConvolutionFwdAlgoDirect,<unused>;miopenConvolutionFwdAlgoWinograd:ConvBinWinogradRxS,0.647679,0,miopenConvolutionFwdAlgoWinograd,<unused>;miopenConvolutionFwdAlgoGEMM:GemmFwdRest,1.10848,7375872,miopenConvolutionFwdAlgoGEMM,<unused>
64-56-56-1x1-512-56-56-16-0x0-1x1-1x1-0-NCHW-FP32-F=miopenConvolutionFwdAlgoImplicitGEMM:ConvHipImplicitGemmV4R1Fwd,0.414879,0,miopenConvolutionFwdAlgoImplicitGEMM,<unused>;miopenConvolutionFwdAlgoDirect:ConvAsm1x1U,0.38208,0,miopenConvolutionFwdAlgoDirect,<unused>;miopenConvolutionFwdAlgoWinograd:ConvBinWinogradRxSf3x2,0.88,0,miopenConvolutionFwdAlgoWinograd,<unused>;miopenConvolutionFwdAlgoGEMM:GemmFwd1x1_0_1,0.58784,0,miopenConvolutionFwdAlgoGEMM,<unused>
256-56-56-3x3-256-56-56-16-1x1-1x1-1x1-0-NCHW-FP32-F_g64=miopenConvolutionFwdAlgoImplicitGEMM:ConvMlirIgemmFwd,4.45728,0,miopenConvolutionFwdAlgoImplicitGEMM,<unused>;miopenConvolutionFwdAlgoDirect:ConvAsm3x3U,0.16608,0,miopenConvolutionFwdAlgoDirect,<unused>;miopenConvolutionFwdAlgoWinograd:ConvBinWinogradRxSf2x3,1.44928,0,miopenConvolutionFwdAlgoWinograd,<unused>;miopenConvolutionFwdAlgoGEMM:GemmFwdRest,3.43805,28901376,miopenConvolutionFwdAlgoGEMM,<unused>
256-56-56-1x1-256-56-56-16-0x0-1x1-1x1-0-NCHW-FP32-F=miopenConvolutionFwdAlgoImplicitGEMM:ConvHipImplicitGemmV4R1Fwd,0.65632,0,miopenConvolutionFwdAlgoImplicitGEMM,<unused>;miopenConvolutionFwdAlgoDirect:ConvAsm1x1U,0.83008,0,miopenConvolutionFwdAlgoDirect,<unused>;miopenConvolutionFwdAlgoWinograd:ConvBinWinogradRxSf3x2,1.35216,0,miopenConvolutionFwdAlgoWinograd,<unused>;miopenConvolutionFwdAlgoGEMM:GemmFwd1x1_0_1,0.689599,0,miopenConvolutionFwdAlgoGEMM,<unused>
256-56-56-1x1-512-56-56-16-0x0-1x1-1x1-0-NCHW-FP32-F=miopenConvolutionFwdAlgoImplicitGEMM:ConvHipImplicitGemmV4R1Fwd,1.21456,0,miopenConvolutionFwdAlgoImplicitGEMM,<unused>;miopenConvolutionFwdAlgoDirect:ConvAsm1x1U,1.37152,0,miopenConvolutionFwdAlgoDirect,<unused>;miopenConvolutionFwdAlgoWinograd:ConvBinWinogradRxSf3x2,2.62784,0,miopenConvolutionFwdAlgoWinograd,<unused>;miopenConvolutionFwdAlgoGEMM:GemmFwd1x1_0_1,1.3176,0,miopenConvolutionFwdAlgoGEMM,<unused>
512-56-56-3x3-512-28-28-16-1x1-2x2-1x1-0-NCHW-FP32-F_g64=miopenConvolutionFwdAlgoImplicitGEMM:ConvMlirIgemmFwd,2.0904,0,miopenConvolutionFwdAlgoImplicitGEMM,<unused>;miopenConvolutionFwdAlgoDirect:ConvOclDirectFwd,1.15264,0,miopenConvolutionFwdAlgoDirect,<unused>;miopenConvolutionFwdAlgoWinograd:ConvBinWinogradRxSf2x3,1.15408,0,miopenConvolutionFwdAlgoWinograd,<unused>;miopenConvolutionFwdAlgoGEMM:GemmFwdRest,1.984,14450688,miopenConvolutionFwdAlgoGEMM,<unused>
768-28-28-1x1-512-28-28-16-0x0-1x1-1x1-0-NCHW-FP32-F=miopenConvolutionFwdAlgoImplicitGEMM:ConvHipImplicitGemmV4R1Fwd,0.895359,0,miopenConvolutionFwdAlgoImplicitGEMM,<unused>;miopenConvolutionFwdAlgoDirect:ConvAsm1x1U,1.17392,0,miopenConvolutionFwdAlgoDirect,<unused>;miopenConvolutionFwdAlgoWinograd:ConvBinWinogradRxSf3x2,2.12512,0,miopenConvolutionFwdAlgoWinograd,<unused>;miopenConvolutionFwdAlgoGEMM:GemmFwd1x1_0_1,1.09904,0,miopenConvolutionFwdAlgoGEMM,<unused>
512-28-28-1x1-512-28-28-16-0x0-1x1-1x1-0-NCHW-FP32-F=miopenConvolutionFwdAlgoImplicitGEMM:ConvHipImplicitGemmV4R1Fwd,0.615839,0,miopenConvolutionFwdAlgoImplicitGEMM,<unused>;miopenConvolutionFwdAlgoDirect:ConvAsm1x1U,0.932159,0,miopenConvolutionFwdAlgoDirect,<unused>;miopenConvolutionFwdAlgoWinograd:ConvBinWinogradRxSf3x2,1.45408,0,miopenConvolutionFwdAlgoWinograd,<unused>;miopenConvolutionFwdAlgoGEMM:GemmFwd1x1_0_1,0.745119,0,miopenConvolutionFwdAlgoGEMM,<unused>
512-28-28-3x3-512-28-28-16-1x1-1x1-1x1-0-NCHW-FP32-F_g64=miopenConvolutionFwdAlgoImplicitGEMM:ConvMlirIgemmFwd,2.07168,0,miopenConvolutionFwdAlgoImplicitGEMM,<unused>;miopenConvolutionFwdAlgoDirect:ConvAsm3x3U,0.21344,0,miopenConvolutionFwdAlgoDirect,<unused>;miopenConvolutionFwdAlgoWinograd:ConvBinWinogradRxSf2x3,0.513759,0,miopenConvolutionFwdAlgoWinograd,<unused>;miopenConvolutionFwdAlgoGEMM:GemmFwdRest,2.99517,14450688,miopenConvolutionFwdAlgoGEMM,<unused>
512-28-28-1x1-1024-28-28-16-0x0-1x1-1x1-0-NCHW-FP32-F=miopenConvolutionFwdAlgoImplicitGEMM:ConvHipImplicitGemmV4R1Fwd,1.19824,0,miopenConvolutionFwdAlgoImplicitGEMM,<unused>;miopenConvolutionFwdAlgoDirect:ConvAsm1x1U,1.50832,0,miopenConvolutionFwdAlgoDirect,<unused>;miopenConvolutionFwdAlgoWinograd:ConvBinWinogradRxSf3x2,2.8056,0,miopenConvolutionFwdAlgoWinograd,<unused>;miopenConvolutionFwdAlgoGEMM:GemmFwd1x1_0_1,1.43568,0,miopenConvolutionFwdAlgoGEMM,<unused>
1024-28-28-3x3-1024-14-14-16-1x1-2x2-1x1-0-NCHW-FP32-F_g64=miopenConvolutionFwdAlgoImplicitGEMM:ConvHipImplicitGemmV4R1Fwd,0.24768,0,miopenConvolutionFwdAlgoImplicitGEMM,<unused>;miopenConvolutionFwdAlgoDirect:ConvOclDirectFwd,0.867839,0,miopenConvolutionFwdAlgoDirect,<unused>;miopenConvolutionFwdAlgoWinograd:ConvBinWinogradRxSf2x3,0.549439,0,miopenConvolutionFwdAlgoWinograd,<unused>;miopenConvolutionFwdAlgoGEMM:GemmFwdRest,1.50528,7225344,miopenConvolutionFwdAlgoGEMM,<unused>
1536-14-14-1x1-1024-14-14-16-0x0-1x1-1x1-0-NCHW-FP32-F=miopenConvolutionFwdAlgoImplicitGEMM:ConvHipImplicitGemmV4R1Fwd,1.01136,0,miopenConvolutionFwdAlgoImplicitGEMM,<unused>;miopenConvolutionFwdAlgoDirect:ConvAsm1x1U,1.39248,0,miopenConvolutionFwdAlgoDirect,<unused>;miopenConvolutionFwdAlgoWinograd:ConvBinWinogradRxSf3x2,2.10912,0,miopenConvolutionFwdAlgoWinograd,<unused>;miopenConvolutionFwdAlgoGEMM:GemmFwd1x1_0_1,1.41248,0,miopenConvolutionFwdAlgoGEMM,<unused>
1024-14-14-1x1-1024-14-14-16-0x0-1x1-1x1-0-NCHW-FP32-F=miopenConvolutionFwdAlgoImplicitGEMM:ConvHipImplicitGemmV4R1Fwd,0.7504,0,miopenConvolutionFwdAlgoImplicitGEMM,<unused>;miopenConvolutionFwdAlgoDirect:ConvAsm1x1U,1.07904,0,miopenConvolutionFwdAlgoDirect,<unused>;miopenConvolutionFwdAlgoWinograd:ConvBinWinogradRxSf3x2,1.43824,0,miopenConvolutionFwdAlgoWinograd,<unused>;miopenConvolutionFwdAlgoGEMM:GemmFwd1x1_0_1,1.02768,0,miopenConvolutionFwdAlgoGEMM,<unused>
1024-14-14-3x3-1024-14-14-16-1x1-1x1-1x1-0-NCHW-FP32-F_g64=miopenConvolutionFwdAlgoImplicitGEMM:ConvHipImplicitGemmV4R1Fwd,0.19648,0,miopenConvolutionFwdAlgoImplicitGEMM,<unused>;miopenConvolutionFwdAlgoDirect:ConvAsm3x3U,0.409761,0,miopenConvolutionFwdAlgoDirect,<unused>;miopenConvolutionFwdAlgoWinograd:ConvBinWinogradRxSf2x3,0.22656,0,miopenConvolutionFwdAlgoWinograd,<unused>;miopenConvolutionFwdAlgoGEMM:GemmFwdRest,1.27488,7225344,miopenConvolutionFwdAlgoGEMM,<unused>
1024-14-14-1x1-2048-14-14-16-0x0-1x1-1x1-0-NCHW-FP32-F=miopenConvolutionFwdAlgoImplicitGEMM:ConvHipImplicitGemmV4R1Fwd,1.35952,0,miopenConvolutionFwdAlgoImplicitGEMM,<unused>;miopenConvolutionFwdAlgoDirect:ConvAsm1x1U,1.9816,0,miopenConvolutionFwdAlgoDirect,<unused>;miopenConvolutionFwdAlgoWinograd:ConvBinWinogradRxSf3x2,2.832,0,miopenConvolutionFwdAlgoWinograd,<unused>;miopenConvolutionFwdAlgoGEMM:GemmFwd1x1_0_1,2.10752,0,miopenConvolutionFwdAlgoGEMM,<unused>
2048-14-14-3x3-2048-7-7-16-1x1-2x2-1x1-0-NCHW-FP32-F_g64=miopenConvolutionFwdAlgoImplicitGEMM:ConvMlirIgemmFwd,0.607841,0,miopenConvolutionFwdAlgoImplicitGEMM,<unused>;miopenConvolutionFwdAlgoDirect:ConvOclDirectFwd,1.10752,0,miopenConvolutionFwdAlgoDirect,<unused>;miopenConvolutionFwdAlgoWinograd:ConvBinWinogradRxSf2x3,0.36288,0,miopenConvolutionFwdAlgoWinograd,<unused>;miopenConvolutionFwdAlgoGEMM:GemmFwdRest,2.2144,3612672,miopenConvolutionFwdAlgoGEMM,<unused>
3072-7-7-1x1-2048-7-7-16-0x0-1x1-1x1-0-NCHW-FP32-F=miopenConvolutionFwdAlgoImplicitGEMM:ConvMlirIgemmFwd,2.50544,0,miopenConvolutionFwdAlgoImplicitGEMM,<unused>;miopenConvolutionFwdAlgoDirect:ConvAsm1x1U,1.88544,0,miopenConvolutionFwdAlgoDirect,<unused>;miopenConvolutionFwdAlgoWinograd:ConvBinWinogradRxSf3x2,3.54368,0,miopenConvolutionFwdAlgoWinograd,<unused>;miopenConvolutionFwdAlgoGEMM:GemmFwd1x1_0_1,2.02032,0,miopenConvolutionFwdAlgoGEMM,<unused>
2048-7-7-1x1-2048-7-7-16-0x0-1x1-1x1-0-NCHW-FP32-F=miopenConvolutionFwdAlgoImplicitGEMM:ConvMlirIgemmFwd,1.70096,0,miopenConvolutionFwdAlgoImplicitGEMM,<unused>;miopenConvolutionFwdAlgoDirect:ConvAsm1x1U,1.3016,0,miopenConvolutionFwdAlgoDirect,<unused>;miopenConvolutionFwdAlgoWinograd:ConvBinWinogradRxSf3x2,2.41072,0,miopenConvolutionFwdAlgoWinograd,<unused>;miopenConvolutionFwdAlgoGEMM:GemmFwd1x1_0_1,1.15312,0,miopenConvolutionFwdAlgoGEMM,<unused>
2048-7-7-3x3-2048-7-7-16-1x1-1x1-1x1-0-NCHW-FP32-F_g64=miopenConvolutionFwdAlgoImplicitGEMM:ConvMlirIgemmFwd,0.60896,0,miopenConvolutionFwdAlgoImplicitGEMM,<unused>;miopenConvolutionFwdAlgoDirect:ConvOclDirectFwd,0.799361,0,miopenConvolutionFwdAlgoDirect,<unused>;miopenConvolutionFwdAlgoWinograd:ConvBinWinogradRxSf2x3,0.14368,0,miopenConvolutionFwdAlgoWinograd,<unused>;miopenConvolutionFwdAlgoGEMM:GemmFwdRest,1.85856,3612672,miopenConvolutionFwdAlgoGEMM,<unused>
3-225-225-3x3-32-112-112-64-0x0-2x2-1x1-0-NCHW-FP32-F=miopenConvolutionFwdAlgoImplicitGEMM:ConvMlirIgemmFwd,0.859199,0,miopenConvolutionFwdAlgoImplicitGEMM,<unused>;miopenConvolutionFwdAlgoDirect:ConvOclDirectFwd,0.964479,0,miopenConvolutionFwdAlgoDirect,<unused>;miopenConvolutionFwdAlgoWinograd:ConvBinWinogradRxSf2x3g1,0.61296,0,miopenConvolutionFwdAlgoWinograd,<unused>;miopenConvolutionFwdAlgoGEMM:GemmFwdRest,3.05152,1354752,miopenConvolutionFwdAlgoGEMM,<unused>
32-112-112-3x3-32-112-112-64-1x1-1x1-1x1-0-NCHW-FP32-F_g32=miopenConvolutionFwdAlgoImplicitGEMM:ConvMlirIgemmFwd,10.9153,0,miopenConvolutionFwdAlgoImplicitGEMM,<unused>;miopenConvolutionFwdAlgoDirect:ConvOclDirectFwd,0.422239,0,miopenConvolutionFwdAlgoDirect,<unused>;miopenConvolutionFwdAlgoWinograd:ConvBinWinogradRxSf2x3,7.08207,0,miopenConvolutionFwdAlgoWinograd,<unused>;miopenConvolutionFwdAlgoGEMM:GemmFwdRest,13.0354,14450688,miopenConvolutionFwdAlgoGEMM,<unused>
32-112-112-1x1-64-112-112-64-0x0-1x1-1x1-0-NCHW-FP32-F=miopenConvolutionFwdAlgoImplicitGEMM:ConvHipImplicitGemmV4R1Fwd,0.554079,0,miopenConvolutionFwdAlgoImplicitGEMM,<unused>;miopenConvolutionFwdAlgoDirect:ConvAsm1x1U,0.42,0,miopenConvolutionFwdAlgoDirect,<unused>;miopenConvolutionFwdAlgoWinograd:ConvBinWinogradRxSf3x2,1.16272,0,miopenConvolutionFwdAlgoWinograd,<unused>;miopenConvolutionFwdAlgoGEMM:GemmFwd1x1_0_1,0.493759,0,miopenConvolutionFwdAlgoGEMM,<unused>
64-113-113-3x3-64-56-56-64-0x0-2x2-1x1-0-NCHW-FP32-F_g64=miopenConvolutionFwdAlgoImplicitGEMM:ConvMlirIgemmFwd,5.30111,0,miopenConvolutionFwdAlgoImplicitGEMM,<unused>;miopenConvolutionFwdAlgoDirect:ConvOclDirectFwd,0.632159,0,miopenConvolutionFwdAlgoDirect,<unused>;miopenConvolutionFwdAlgoWinograd:ConvBinWinogradRxSf2x3,6.61167,0,miopenConvolutionFwdAlgoWinograd,<unused>;miopenConvolutionFwdAlgoGEMM:GemmFwdRest,10.6188,7225344,miopenConvolutionFwdAlgoGEMM,<unused>
64-56-56-1x1-128-56-56-64-0x0-1x1-1x1-0-NCHW-FP32-F=miopenConvolutionFwdAlgoImplicitGEMM:ConvHipImplicitGemmV4R1Fwd,0.370239,0,miopenConvolutionFwdAlgoImplicitGEMM,<unused>;miopenConvolutionFwdAlgoDirect:ConvAsm1x1U,0.378239,0,miopenConvolutionFwdAlgoDirect,<unused>;miopenConvolutionFwdAlgoWinograd:ConvBinWinogradRxSf3x2,0.925599,0,miopenConvolutionFwdAlgoWinograd,<unused>;miopenConvolutionFwdAlgoGEMM:GemmFwd1x1_0_1,0.456479,0,miopenConvolutionFwdAlgoGEMM,<unused>
128-56-56-3x3-128-56-56-64-1x1-1x1-1x1-0-NCHW-FP32-F_g128=miopenConvolutionFwdAlgoImplicitGEMM:ConvMlirIgemmFwd,10.9459,0,miopenConvolutionFwdAlgoImplicitGEMM,<unused>;miopenConvolutionFwdAlgoDirect:ConvOclDirectFwd,0.448159,0,miopenConvolutionFwdAlgoDirect,<unused>;miopenConvolutionFwdAlgoWinograd:ConvBinWinogradRxSf2x3,7.16399,0,miopenConvolutionFwdAlgoWinograd,<unused>;miopenConvolutionFwdAlgoGEMM:GemmFwdRest,16.0869,14450688,miopenConvolutionFwdAlgoGEMM,<unused>
128-56-56-1x1-128-56-56-64-0x0-1x1-1x1-0-NCHW-FP32-F=miopenConvolutionFwdAlgoImplicitGEMM:ConvHipImplicitGemmV4R1Fwd,0.64672,0,miopenConvolutionFwdAlgoImplicitGEMM,<unused>;miopenConvolutionFwdAlgoDirect:ConvOclDirectFwd1x1,0.618079,0,miopenConvolutionFwdAlgoDirect,<unused>;miopenConvolutionFwdAlgoWinograd:ConvBinWinogradRxSf3x2,1.43216,0,miopenConvolutionFwdAlgoWinograd,<unused>;miopenConvolutionFwdAlgoGEMM:GemmFwd1x1_0_1,0.827839,0,miopenConvolutionFwdAlgoGEMM,<unused>
128-57-57-3x3-128-28-28-64-0x0-2x2-1x1-0-NCHW-FP32-F_g128=miopenConvolutionFwdAlgoImplicitGEMM:ConvMlirIgemmFwd,3.09424,0,miopenConvolutionFwdAlgoImplicitGEMM,<unused>;miopenConvolutionFwdAlgoDirect:ConvOclDirectFwd,0.315519,0,miopenConvolutionFwdAlgoDirect,<unused>;miopenConvolutionFwdAlgoWinograd:ConvBinWinogradRxSf2x3,3.38368,0,miopenConvolutionFwdAlgoWinograd,<unused>;miopenConvolutionFwdAlgoGEMM:GemmFwdRest,6.68659,3612672,miopenConvolutionFwdAlgoGEMM,<unused>
128-28-28-1x1-256-28-28-64-0x0-1x1-1x1-0-NCHW-FP32-F=miopenConvolutionFwdAlgoImplicitGEMM:ConvHipImplicitGemmV4R1Fwd,0.3632,0,miopenConvolutionFwdAlgoImplicitGEMM,<unused>;miopenConvolutionFwdAlgoDirect:ConvAsm1x1U,0.495839,0,miopenConvolutionFwdAlgoDirect,<unused>;miopenConvolutionFwdAlgoWinograd:ConvBinWinogradRxSf3x2,0.930559,0,miopenConvolutionFwdAlgoWinograd,<unused>;miopenConvolutionFwdAlgoGEMM:GemmFwd1x1_0_1,0.44928,0,miopenConvolutionFwdAlgoGEMM,<unused>
256-28-28-3x3-256-28-28-64-1x1-1x1-1x1-0-NCHW-FP32-F_g256=miopenConvolutionFwdAlgoImplicitGEMM:ConvMlirIgemmFwd,5.33952,0,miopenConvolutionFwdAlgoImplicitGEMM,<unused>;miopenConvolutionFwdAlgoDirect:ConvOclDirectFwd,0.21504,0,miopenConvolutionFwdAlgoDirect,<unused>;miopenConvolutionFwdAlgoWinograd:ConvBinWinogradRxSf2x3,4.15344,0,miopenConvolutionFwdAlgoWinograd,<unused>;miopenConvolutionFwdAlgoGEMM:GemmFwdRest,9.12384,7225344,miopenConvolutionFwdAlgoGEMM,<unused>
256-28-28-1x1-256-28-28-64-0x0-1x1-1x1-0-NCHW-FP32-F=miopenConvolutionFwdAlgoImplicitGEMM:ConvHipImplicitGemmV4R1Fwd,0.617759,0,miopenConvolutionFwdAlgoImplicitGEMM,<unused>;miopenConvolutionFwdAlgoDirect:ConvOclDirectFwd1x1,0.624159,0,miopenConvolutionFwdAlgoDirect,<unused>;miopenConvolutionFwdAlgoWinograd:ConvBinWinogradRxSf3x2,1.47184,0,miopenConvolutionFwdAlgoWinograd,<unused>;miopenConvolutionFwdAlgoGEMM:GemmFwd1x1_0_1,0.73632,0,miopenConvolutionFwdAlgoGEMM,<unused>
256-29-29-3x3-256-14-14-64-0x0-2x2-1x1-0-NCHW-FP32-F_g256=miopenConvolutionFwdAlgoImplicitGEMM:ConvMlirIgemmFwd,1.56464,0,miopenConvolutionFwdAlgoImplicitGEMM,<unused>;miopenConvolutionFwdAlgoDirect:ConvOclDirectFwd,0.16368,0,miopenConvolutionFwdAlgoDirect,<unused>;miopenConvolutionFwdAlgoWinograd:ConvBinWinogradRxSf2x3,1.78464,0,miopenConvolutionFwdAlgoWinograd,<unused>;miopenConvolutionFwdAlgoGEMM:GemmFwdRest,5.58067,1806336,miopenConvolutionFwdAlgoGEMM,<unused>
256-14-14-1x1-512-14-14-64-0x0-1x1-1x1-0-NCHW-FP32-F=miopenConvolutionFwdAlgoImplicitGEMM:ConvHipImplicitGemmV4R1Fwd,0.338401,0,miopenConvolutionFwdAlgoImplicitGEMM,<unused>;miopenConvolutionFwdAlgoDirect:ConvOclDirectFwd1x1,0.409281,0,miopenConvolutionFwdAlgoDirect,<unused>;miopenConvolutionFwdAlgoWinograd:ConvBinWinogradRxSf3x2,0.795202,0,miopenConvolutionFwdAlgoWinograd,<unused>;miopenConvolutionFwdAlgoGEMM:GemmFwd1x1_0_1,0.469601,0,miopenConvolutionFwdAlgoGEMM,<unused>
512-14-14-3x3-512-14-14-64-1x1-1x1-1x1-0-NCHW-FP32-F_g512=miopenConvolutionFwdAlgoImplicitGEMM:ConvMlirIgemmFwd,3.11905,0,miopenConvolutionFwdAlgoImplicitGEMM,<unused>;miopenConvolutionFwdAlgoDirect:ConvOclDirectFwd,0.126881,0,miopenConvolutionFwdAlgoDirect,<unused>;miopenConvolutionFwdAlgoWinograd:ConvBinWinogradRxSf2x3,2.29009,0,miopenConvolutionFwdAlgoWinograd,<unused>;miopenConvolutionFwdAlgoGEMM:GemmFwdRest,4.48512,3612672,miopenConvolutionFwdAlgoGEMM,<unused>
512-14-14-1x1-512-14-14-64-0x0-1x1-1x1-0-NCHW-FP32-F=miopenConvolutionFwdAlgoImplicitGEMM:ConvHipImplicitGemmV4R1Fwd,0.631042,0,miopenConvolutionFwdAlgoImplicitGEMM,<unused>;miopenConvolutionFwdAlgoDirect:ConvOclDirectFwd1x1,0.737602,0,miopenConvolutionFwdAlgoDirect,<unused>;miopenConvolutionFwdAlgoWinograd:ConvBinWinogradRxSf3x2,1.46176,0,miopenConvolutionFwdAlgoWinograd,<unused>;miopenConvolutionFwdAlgoGEMM:GemmFwd1x1_0_1,1.09072,0,miopenConvolutionFwdAlgoGEMM,<unused>
512-15-15-3x3-512-7-7-64-0x0-2x2-1x1-0-NCHW-FP32-F_g512=miopenConvolutionFwdAlgoImplicitGEMM:ConvMlirIgemmFwd,0.803362,0,miopenConvolutionFwdAlgoImplicitGEMM,<unused>;miopenConvolutionFwdAlgoDirect:ConvOclDirectFwd,0.11136,0,miopenConvolutionFwdAlgoDirect,<unused>;miopenConvolutionFwdAlgoWinograd:ConvBinWinogradRxSf2x3,1.32704,0,miopenConvolutionFwdAlgoWinograd,<unused>;miopenConvolutionFwdAlgoGEMM:GemmFwdRest,4.94592,903168,miopenConvolutionFwdAlgoGEMM,<unused>
512-7-7-1x1-1024-7-7-64-0x0-1x1-1x1-0-NCHW-FP32-F=miopenConvolutionFwdAlgoImplicitGEMM:ConvHipImplicitGemmV4R1Fwd,0.393601,0,miopenConvolutionFwdAlgoImplicitGEMM,<unused>;miopenConvolutionFwdAlgoDirect:ConvAsm1x1U,0.552322,0,miopenConvolutionFwdAlgoDirect,<unused>;miopenConvolutionFwdAlgoWinograd:ConvBinWinogradRxSf3x2,1.05168,0,miopenConvolutionFwdAlgoWinograd,<unused>;miopenConvolutionFwdAlgoGEMM:GemmFwd1x1_0_1,0.768003,0,miopenConvolutionFwdAlgoGEMM,<unused>
1024-7-7-3x3-1024-7-7-64-1x1-1x1-1x1-0-NCHW-FP32-F_g1024=miopenConvolutionFwdAlgoImplicitGEMM:ConvMlirIgemmFwd,1.63633,0,miopenConvolutionFwdAlgoImplicitGEMM,<unused>;miopenConvolutionFwdAlgoDirect:ConvOclDirectFwd,0.17728,0,miopenConvolutionFwdAlgoDirect,<unused>;miopenConvolutionFwdAlgoWinograd:ConvBinWinogradRxSf2x3,1.64929,0,miopenConvolutionFwdAlgoWinograd,<unused>;miopenConvolutionFwdAlgoGEMM:GemmFwdRest,2.53952,1806336,miopenConvolutionFwdAlgoGEMM,<unused>
1024-7-7-1x1-1024-7-7-64-0x0-1x1-1x1-0-NCHW-FP32-F=miopenConvolutionFwdAlgoImplicitGEMM:ConvHipImplicitGemmV4R1Fwd,0.804003,0,miopenConvolutionFwdAlgoImplicitGEMM,<unused>;miopenConvolutionFwdAlgoDirect:ConvAsm1x1U,1.02224,0,miopenConvolutionFwdAlgoDirect,<unused>;miopenConvolutionFwdAlgoWinograd:ConvBinWinogradRxSf3x2,2.01857,0,miopenConvolutionFwdAlgoWinograd,<unused>;miopenConvolutionFwdAlgoGEMM:GemmFwd1x1_0_1,1.47553,0,miopenConvolutionFwdAlgoGEMM,<unused>
1024-1-1-1x1-1001-1-1-64-0x0-1x1-1x1-0-NCHW-FP32-F=miopenConvolutionFwdAlgoImplicitGEMM:ConvMlirIgemmFwd,0.476802,0,miopenConvolutionFwdAlgoImplicitGEMM,<unused>;miopenConvolutionFwdAlgoDirect:ConvAsm1x1U,0.262561,0,miopenConvolutionFwdAlgoDirect,<unused>;miopenConvolutionFwdAlgoWinograd:ConvBinWinogradRxSf3x2,0.425601,0,miopenConvolutionFwdAlgoWinograd,<unused>;miopenConvolutionFwdAlgoGEMM:GemmFwd1x1_0_1,0.711522,0,miopenConvolutionFwdAlgoGEMM,<unused>
3-331-331-3x3-96-165-165-64-0x0-2x2-1x1-0-NCHW-FP32-F=miopenConvolutionFwdAlgoImplicitGEMM:ConvMlirIgemmFwd,3.91554,0,miopenConvolutionFwdAlgoImplicitGEMM,<unused>;miopenConvolutionFwdAlgoDirect:ConvOclDirectFwd,5.64083,0,miopenConvolutionFwdAlgoDirect,<unused>;miopenConvolutionFwdAlgoWinograd:ConvBinWinogradRxSf2x3g1,3.7349,0,miopenConvolutionFwdAlgoWinograd,<unused>;miopenConvolutionFwdAlgoGEMM:GemmFwdRest,5.0176,2940300,miopenConvolutionFwdAlgoGEMM,<unused>
96-165-165-1x1-42-165-165-64-0x0-1x1-1x1-0-NCHW-FP32-F=miopenConvolutionFwdAlgoImplicitGEMM:ConvMlirIgemmFwd,5.27873,0,miopenConvolutionFwdAlgoImplicitGEMM,<unused>;miopenConvolutionFwdAlgoDirect:ConvAsm1x1U,2.3936,0,miopenConvolutionFwdAlgoDirect,<unused>;miopenConvolutionFwdAlgoWinograd:ConvBinWinogradRxSf3x2,4.45905,0,miopenConvolutionFwdAlgoWinograd,<unused>;miopenConvolutionFwdAlgoGEMM:GemmFwd1x1_0_1,2.59633,0,miopenConvolutionFwdAlgoGEMM,<unused>
96-165-165-7x7-96-83-83-64-3x3-2x2-1x1-0-NCHW-FP32-F_g96=miopenConvolutionFwdAlgoImplicitGEMM:ConvMlirIgemmFwd,73.9341,0,miopenConvolutionFwdAlgoImplicitGEMM,<unused>;miopenConvolutionFwdAlgoDirect:ConvOclDirectFwd,4.96065,0,miopenConvolutionFwdAlgoDirect,<unused>;miopenConvolutionFwdAlgoWinograd:ConvBinWinogradRxSf2x3,39.4298,0,miopenConvolutionFwdAlgoWinograd,<unused>;miopenConvolutionFwdAlgoGEMM:GemmFwdRest,45.3018,129623424,miopenConvolutionFwdAlgoGEMM,<unused>
96-83-83-1x1-42-83-83-64-0x0-1x1-1x1-0-NCHW-FP32-F=miopenConvolutionFwdAlgoImplicitGEMM:ConvMlirIgemmFwd,1.38048,0,miopenConvolutionFwdAlgoImplicitGEMM,<unused>;miopenConvolutionFwdAlgoDirect:ConvAsm1x1U,0.51264,0,miopenConvolutionFwdAlgoDirect,<unused>;miopenConvolutionFwdAlgoWinograd:ConvBinWinogradRxSf3x2,1.23088,0,miopenConvolutionFwdAlgoWinograd,<unused>;miopenConvolutionFwdAlgoGEMM:GemmFwd1x1_0_1,1.09632,0,miopenConvolutionFwdAlgoGEMM,<unused>
42-83-83-7x7-42-83-83-64-3x3-1x1-1x1-0-NCHW-FP32-F_g42=miopenConvolutionFwdAlgoImplicitGEMM:ConvMlirIgemmFwd,32.3042,0,miopenConvolutionFwdAlgoImplicitGEMM,<unused>;miopenConvolutionFwdAlgoDirect:ConvOclDirectFwd,0.58992,0,miopenConvolutionFwdAlgoDirect,<unused>;miopenConvolutionFwdAlgoWinograd:ConvBinWinogradRxSf3x2,12.2027,0,miopenConvolutionFwdAlgoWinograd,<unused>;miopenConvolutionFwdAlgoGEMM:GemmFwdRest,20.2341,56710248,miopenConvolutionFwdAlgoGEMM,<unused>
42-83-83-1x1-42-83-83-64-0x0-1x1-1x1-0-NCHW-FP32-F=miopenConvolutionFwdAlgoImplicitGEMM:ConvMlirIgemmFwd,0.878558,0,miopenConvolutionFwdAlgoImplicitGEMM,<unused>;miopenConvolutionFwdAlgoDirect:ConvAsm1x1U,0.322399,0,miopenConvolutionFwdAlgoDirect,<unused>;miopenConvolutionFwdAlgoWinograd:ConvBinWinogradRxSf3x2,0.722558,0,miopenConvolutionFwdAlgoWinograd,<unused>;miopenConvolutionFwdAlgoGEMM:GemmFwd1x1_0_1,0.664799,0,miopenConvolutionFwdAlgoGEMM,<unused>
96-165-165-5x5-96-83-83-64-2x2-2x2-1x1-0-NCHW-FP32-F_g96=miopenConvolutionFwdAlgoImplicitGEMM:ConvMlirIgemmFwd,35.4204,0,miopenConvolutionFwdAlgoImplicitGEMM,<unused>;miopenConvolutionFwdAlgoDirect:ConvOclDirectFwd,2.61231,0,miopenConvolutionFwdAlgoDirect,<unused>;miopenConvolutionFwdAlgoWinograd:ConvBinWinogradRxSf2x3,19.7422,0,miopenConvolutionFwdAlgoWinograd,<unused>;miopenConvolutionFwdAlgoGEMM:GemmFwdRest,26.6444,66134400,miopenConvolutionFwdAlgoGEMM,<unused>
42-83-83-5x5-42-83-83-64-2x2-1x1-1x1-0-NCHW-FP32-F_g42=miopenConvolutionFwdAlgoImplicitGEMM:ConvMlirIgemmFwd,15.1985,0,miopenConvolutionFwdAlgoImplicitGEMM,<unused>;miopenConvolutionFwdAlgoDirect:ConvOclDirectFwd,0.390719,0,miopenConvolutionFwdAlgoDirect,<unused>;miopenConvolutionFwdAlgoWinograd:ConvBinWinogradRxSf2x3,7.95934,0,miopenConvolutionFwdAlgoWinograd,<unused>;miopenConvolutionFwdAlgoGEMM:GemmFwdRest,11.4072,28933800,miopenConvolutionFwdAlgoGEMM,<unused>
42-165-165-5x5-42-83-83-64-2x2-2x2-1x1-0-NCHW-FP32-F_g42=miopenConvolutionFwdAlgoImplicitGEMM:ConvMlirIgemmFwd,15.5073,0,miopenConvolutionFwdAlgoImplicitGEMM,<unused>;miopenConvolutionFwdAlgoDirect:ConvOclDirectFwd,1.15744,0,miopenConvolutionFwdAlgoDirect,<unused>;miopenConvolutionFwdAlgoWinograd:ConvBinWinogradRxSf2x3,9.3707,0,miopenConvolutionFwdAlgoWinograd,<unused>;miopenConvolutionFwdAlgoGEMM:GemmFwdRest,11.612,28933800,miopenConvolutionFwdAlgoGEMM,<unused>
84-83-83-1x1-42-83-83-64-0x0-1x1-1x1-0-NCHW-FP32-F=miopenConvolutionFwdAlgoImplicitGEMM:ConvMlirIgemmFwd,1.12928,0,miopenConvolutionFwdAlgoImplicitGEMM,<unused>;miopenConvolutionFwdAlgoDirect:ConvAsm1x1U,0.473919,0,miopenConvolutionFwdAlgoDirect,<unused>;miopenConvolutionFwdAlgoWinograd:ConvBinWinogradRxSf3x2,1.11152,0,miopenConvolutionFwdAlgoWinograd,<unused>;miopenConvolutionFwdAlgoGEMM:GemmFwd1x1_0_1,1.00512,0,miopenConvolutionFwdAlgoGEMM,<unused>
42-83-83-3x3-42-83-83-64-1x1-1x1-1x1-0-NCHW-FP32-F_g42=miopenConvolutionFwdAlgoImplicitGEMM:ConvMlirIgemmFwd,7.75775,0,miopenConvolutionFwdAlgoImplicitGEMM,<unused>;miopenConvolutionFwdAlgoDirect:ConvOclDirectFwd,0.35696,0,miopenConvolutionFwdAlgoDirect,<unused>;miopenConvolutionFwdAlgoWinograd:ConvBinWinogradRxSf2x3,5.39135,0,miopenConvolutionFwdAlgoWinograd,<unused>;miopenConvolutionFwdAlgoGEMM:GemmFwdRest,8.86784,10416168,miopenConvolutionFwdAlgoGEMM,<unused>
168-83-83-1x1-84-83-83-64-0x0-1x1-1x1-0-NCHW-FP32-F=miopenConvolutionFwdAlgoImplicitGEMM:ConvMlirIgemmFwd,3.85152,0,miopenConvolutionFwdAlgoImplicitGEMM,<unused>;miopenConvolutionFwdAlgoDirect:ConvAsm1x1U,1.4416,0,miopenConvolutionFwdAlgoDirect,<unused>;miopenConvolutionFwdAlgoWinograd:ConvBinWinogradRxSf3x2,2.85104,0,miopenConvolutionFwdAlgoWinograd,<unused>;miopenConvolutionFwdAlgoGEMM:GemmFwd1x1_0_1,2.70032,0,miopenConvolutionFwdAlgoGEMM,<unused>
84-83-83-7x7-84-42-42-64-3x3-2x2-1x1-0-NCHW-FP32-F_g84=miopenConvolutionFwdAlgoImplicitGEMM:ConvMlirIgemmFwd,16.6294,0,miopenConvolutionFwdAlgoImplicitGEMM,<unused>;miopenConvolutionFwdAlgoDirect:ConvOclDirectFwd,1.22144,0,miopenConvolutionFwdAlgoDirect,<unused>;miopenConvolutionFwdAlgoWinograd:ConvBinWinogradRxSf2x3,9.56095,0,miopenConvolutionFwdAlgoWinograd,<unused>;miopenConvolutionFwdAlgoGEMM:GemmFwdRest,14.469,29042496,miopenConvolutionFwdAlgoGEMM,<unused>
84-42-42-1x1-84-42-42-64-0x0-1x1-1x1-0-NCHW-FP32-F=miopenConvolutionFwdAlgoImplicitGEMM:ConvMlirIgemmFwd,0.582239,0,miopenConvolutionFwdAlgoImplicitGEMM,<unused>;miopenConvolutionFwdAlgoDirect:ConvAsm1x1U,0.24768,0,miopenConvolutionFwdAlgoDirect,<unused>;miopenConvolutionFwdAlgoWinograd:ConvBinWinogradRxSf3x2,0.452,0,miopenConvolutionFwdAlgoWinograd,<unused>;miopenConvolutionFwdAlgoGEMM:GemmFwd1x1_0_1,0.513119,0,miopenConvolutionFwdAlgoGEMM,<unused>
84-42-42-7x7-84-42-42-64-3x3-1x1-1x1-0-NCHW-FP32-F_g84=miopenConvolutionFwdAlgoImplicitGEMM:ConvMlirIgemmFwd,16.5907,0,miopenConvolutionFwdAlgoImplicitGEMM,<unused>;miopenConvolutionFwdAlgoDirect:ConvOclDirectFwd,0.41024,0,miopenConvolutionFwdAlgoDirect,<unused>;miopenConvolutionFwdAlgoWinograd:ConvBinWinogradRxSf3x2,6.50831,0,miopenConvolutionFwdAlgoWinograd,<unused>;miopenConvolutionFwdAlgoGEMM:GemmFwdRest,14.0184,29042496,miopenConvolutionFwdAlgoGEMM,<unused>
84-83-83-5x5-84-42-42-64-2x2-2x2-1x1-0-NCHW-FP32-F_g84=miopenConvolutionFwdAlgoImplicitGEMM:ConvMlirIgemmFwd,8.04255,0,miopenConvolutionFwdAlgoImplicitGEMM,<unused>;miopenConvolutionFwdAlgoDirect:ConvOclDirectFwd,0.652159,0,miopenConvolutionFwdAlgoDirect,<unused>;miopenConvolutionFwdAlgoWinograd:ConvBinWinogradRxSf2x3,4.82511,0,miopenConvolutionFwdAlgoWinograd,<unused>;miopenConvolutionFwdAlgoGEMM:GemmFwdRest,7.90515,14817600,miopenConvolutionFwdAlgoGEMM,<unused>
84-42-42-5x5-84-42-42-64-2x2-1x1-1x1-0-NCHW-FP32-F_g84=miopenConvolutionFwdAlgoImplicitGEMM:ConvMlirIgemmFwd,7.81967,0,miopenConvolutionFwdAlgoImplicitGEMM,<unused>;miopenConvolutionFwdAlgoDirect:ConvOclDirectFwd,0.224,0,miopenConvolutionFwdAlgoDirect,<unused>;miopenConvolutionFwdAlgoWinograd:ConvBinWinogradRxSf2x3,4.39952,0,miopenConvolutionFwdAlgoWinograd,<unused>;miopenConvolutionFwdAlgoGEMM:GemmFwdRest,9.49235,14817600,miopenConvolutionFwdAlgoGEMM,<unused>
168-42-42-1x1-84-42-42-64-0x0-1x1-1x1-0-NCHW-FP32-F=miopenConvolutionFwdAlgoImplicitGEMM:ConvMlirIgemmFwd,0.976639,0,miopenConvolutionFwdAlgoImplicitGEMM,<unused>;miopenConvolutionFwdAlgoDirect:ConvAsm1x1U,0.444959,0,miopenConvolutionFwdAlgoDirect,<unused>;miopenConvolutionFwdAlgoWinograd:ConvBinWinogradRxSf3x2,0.763839,0,miopenConvolutionFwdAlgoWinograd,<unused>;miopenConvolutionFwdAlgoGEMM:GemmFwd1x1_0_1,0.917438,0,miopenConvolutionFwdAlgoGEMM,<unused>
84-42-42-3x3-84-42-42-64-1x1-1x1-1x1-0-NCHW-FP32-F_g84=miopenConvolutionFwdAlgoImplicitGEMM:ConvMlirIgemmFwd,4.13167,0,miopenConvolutionFwdAlgoImplicitGEMM,<unused>;miopenConvolutionFwdAlgoDirect:ConvOclDirectFwd,0.202239,0,miopenConvolutionFwdAlgoDirect,<unused>;miopenConvolutionFwdAlgoWinograd:ConvBinWinogradRxSf2x3,3.06832,0,miopenConvolutionFwdAlgoWinograd,<unused>;miopenConvolutionFwdAlgoGEMM:GemmFwdRest,4.35187,5334336,miopenConvolutionFwdAlgoGEMM,<unused>
336-42-42-1x1-336-42-42-64-0x0-1x1-1x1-0-NCHW-FP32-F=miopenConvolutionFwdAlgoImplicitGEMM:ConvHipImplicitGemmV4R1Fwd,9.02719,0,miopenConvolutionFwdAlgoImplicitGEMM,<unused>;miopenConvolutionFwdAlgoDirect:ConvAsm1x1U,2.6656,0,miopenConvolutionFwdAlgoDirect,<unused>;miopenConvolutionFwdAlgoWinograd:ConvBinWinogradRxSf3x2,4.5888,0,miopenConvolutionFwdAlgoWinograd,<unused>;miopenConvolutionFwdAlgoGEMM:GemmFwd1x1_0_1,3.0672,0,miopenConvolutionFwdAlgoGEMM,<unused>
168-42-42-5x5-168-42-42-64-2x2-1x1-1x1-0-NCHW-FP32-F_g168=miopenConvolutionFwdAlgoImplicitGEMM:ConvMlirIgemmFwd,15.6121,0,miopenConvolutionFwdAlgoImplicitGEMM,<unused>;miopenConvolutionFwdAlgoDirect:ConvOclDirectFwd,0.44048,0,miopenConvolutionFwdAlgoDirect,<unused>;miopenConvolutionFwdAlgoWinograd:ConvBinWinogradRxSf2x3,8.27839,0,miopenConvolutionFwdAlgoWinograd,<unused>;miopenConvolutionFwdAlgoGEMM:GemmFwdRest,13.2812,29635200,miopenConvolutionFwdAlgoGEMM,<unused>
168-42-42-1x1-168-42-42-64-0x0-1x1-1x1-0-NCHW-FP32-F=miopenConvolutionFwdAlgoImplicitGEMM:ConvMlirIgemmFwd,1.45536,0,miopenConvolutionFwdAlgoImplicitGEMM,<unused>;miopenConvolutionFwdAlgoDirect:ConvAsm1x1U,0.699839,0,miopenConvolutionFwdAlgoDirect,<unused>;miopenConvolutionFwdAlgoWinograd:ConvBinWinogradRxSf3x2,1.48928,0,miopenConvolutionFwdAlgoWinograd,<unused>;miopenConvolutionFwdAlgoGEMM:GemmFwd1x1_0_1,1.83712,0,miopenConvolutionFwdAlgoGEMM,<unused>
168-42-42-3x3-168-42-42-64-1x1-1x1-1x1-0-NCHW-FP32-F_g168=miopenConvolutionFwdAlgoImplicitGEMM:ConvMlirIgemmFwd,7.99567,0,miopenConvolutionFwdAlgoImplicitGEMM,<unused>;miopenConvolutionFwdAlgoDirect:ConvOclDirectFwd,0.36064,0,miopenConvolutionFwdAlgoDirect,<unused>;miopenConvolutionFwdAlgoWinograd:ConvBinWinogradRxSf2x3,5.46336,0,miopenConvolutionFwdAlgoWinograd,<unused>;miopenConvolutionFwdAlgoGEMM:GemmFwdRest,7.14739,10668672,miopenConvolutionFwdAlgoGEMM,<unused>
336-42-42-1x1-168-42-42-64-0x0-1x1-1x1-0-NCHW-FP32-F=miopenConvolutionFwdAlgoImplicitGEMM:ConvMlirIgemmFwd,2.55791,0,miopenConvolutionFwdAlgoImplicitGEMM,<unused>;miopenConvolutionFwdAlgoDirect:ConvAsm1x1U,1.3848,0,miopenConvolutionFwdAlgoDirect,<unused>;miopenConvolutionFwdAlgoWinograd:ConvBinWinogradRxSf3x2,2.75471,0,miopenConvolutionFwdAlgoWinograd,<unused>;miopenConvolutionFwdAlgoGEMM:GemmFwd1x1_0_1,1.55008,0,miopenConvolutionFwdAlgoGEMM,<unused>
1008-42-42-1x1-336-42-42-64-0x0-1x1-1x1-0-NCHW-FP32-F=miopenConvolutionFwdAlgoImplicitGEMM:ConvHipImplicitGemmV4R1Fwd,51.7909,0,miopenConvolutionFwdAlgoImplicitGEMM,<unused>;miopenConvolutionFwdAlgoDirect:ConvAsm1x1U,8.30176,0,miopenConvolutionFwdAlgoDirect,<unused>;miopenConvolutionFwdAlgoWinograd:ConvBinWinogradRxSf3x2,12.4918,0,miopenConvolutionFwdAlgoWinograd,<unused>;miopenConvolutionFwdAlgoGEMM:GemmFwd1x1_0_1,6.93632,0,miopenConvolutionFwdAlgoGEMM,<unused>
1008-42-42-1x1-168-42-42-64-0x0-1x1-1x1-0-NCHW-FP32-F=miopenConvolutionFwdAlgoImplicitGEMM:ConvMlirIgemmFwd,7.47215,0,miopenConvolutionFwdAlgoImplicitGEMM,<unused>;miopenConvolutionFwdAlgoDirect:ConvAsm1x1U,4.18224,0,miopenConvolutionFwdAlgoDirect,<unused>;miopenConvolutionFwdAlgoWinograd:ConvBinWinogradRxSf3x2,6.67535,0,miopenConvolutionFwdAlgoWinograd,<unused>;miopenConvolutionFwdAlgoGEMM:GemmFwd1x1_0_1,4.40752,0,miopenConvolutionFwdAlgoGEMM,<unused>
336-47-47-7x7-336-21-21-64-0x0-2x2-1x1-0-NCHW-FP32-F_g336=miopenConvolutionFwdAlgoImplicitGEMM:ConvMlirIgemmFwd,16.0315,0,miopenConvolutionFwdAlgoImplicitGEMM,<unused>;miopenConvolutionFwdAlgoDirect:ConvOclDirectFwd,1.9256,0,miopenConvolutionFwdAlgoDirect,<unused>;miopenConvolutionFwdAlgoWinograd:ConvBinWinogradRxSf2x3,10.6625,0,miopenConvolutionFwdAlgoWinograd,<unused>;miopenConvolutionFwdAlgoGEMM:GemmFwdRest,12.1343,29042496,miopenConvolutionFwdAlgoGEMM,<unused>
336-21-21-1x1-336-21-21-64-0x0-1x1-1x1-0-NCHW-FP32-F=miopenConvolutionFwdAlgoImplicitGEMM:ConvHipImplicitGemmV4R1Fwd,2.18,0,miopenConvolutionFwdAlgoImplicitGEMM,<unused>;miopenConvolutionFwdAlgoDirect:ConvAsm1x1U,0.701439,0,miopenConvolutionFwdAlgoDirect,<unused>;miopenConvolutionFwdAlgoWinograd:ConvBinWinogradRxSf3x2,1.2808,0,miopenConvolutionFwdAlgoWinograd,<unused>;miopenConvolutionFwdAlgoGEMM:GemmFwd1x1_0_1,1.90192,0,miopenConvolutionFwdAlgoGEMM,<unused>
336-21-21-7x7-336-21-21-64-3x3-1x1-1x1-0-NCHW-FP32-F_g336=miopenConvolutionFwdAlgoImplicitGEMM:ConvMlirIgemmFwd,16.6571,0,miopenConvolutionFwdAlgoImplicitGEMM,<unused>;miopenConvolutionFwdAlgoDirect:ConvOclDirectFwd,0.452639,0,miopenConvolutionFwdAlgoDirect,<unused>;miopenConvolutionFwdAlgoWinograd:ConvBinWinogradRxSf3x2,6.71631,0,miopenConvolutionFwdAlgoWinograd,<unused>;miopenConvolutionFwdAlgoGEMM:GemmFwdRest,11.4994,29042496,miopenConvolutionFwdAlgoGEMM,<unused>
336-45-45-5x5-336-21-21-64-0x0-2x2-1x1-0-NCHW-FP32-F_g336=miopenConvolutionFwdAlgoImplicitGEMM:ConvMlirIgemmFwd,8.05743,0,miopenConvolutionFwdAlgoImplicitGEMM,<unused>;miopenConvolutionFwdAlgoDirect:ConvOclDirectFwd,1.11712,0,miopenConvolutionFwdAlgoDirect,<unused>;miopenConvolutionFwdAlgoWinograd:ConvBinWinogradRxSf2x3,5.49327,0,miopenConvolutionFwdAlgoWinograd,<unused>;miopenConvolutionFwdAlgoGEMM:GemmFwdRest,6.79923,14817600,miopenConvolutionFwdAlgoGEMM,<unused>
336-21-21-5x5-336-21-21-64-2x2-1x1-1x1-0-NCHW-FP32-F_g336=miopenConvolutionFwdAlgoImplicitGEMM:ConvMlirIgemmFwd,7.87999,0,miopenConvolutionFwdAlgoImplicitGEMM,<unused>;miopenConvolutionFwdAlgoDirect:ConvOclDirectFwd,0.238239,0,miopenConvolutionFwdAlgoDirect,<unused>;miopenConvolutionFwdAlgoWinograd:ConvBinWinogradRxSf2x3,4.85439,0,miopenConvolutionFwdAlgoWinograd,<unused>;miopenConvolutionFwdAlgoGEMM:GemmFwdRest,6.22579,14817600,miopenConvolutionFwdAlgoGEMM,<unused>
672-21-21-1x1-336-21-21-64-0x0-1x1-1x1-0-NCHW-FP32-F=miopenConvolutionFwdAlgoImplicitGEMM:ConvHipImplicitGemmV4R1Fwd,4.17376,0,miopenConvolutionFwdAlgoImplicitGEMM,<unused>;miopenConvolutionFwdAlgoDirect:ConvAsm1x1U,1.38384,0,miopenConvolutionFwdAlgoDirect,<unused>;miopenConvolutionFwdAlgoWinograd:ConvBinWinogradRxSf3x2,2.42656,0,miopenConvolutionFwdAlgoWinograd,<unused>;miopenConvolutionFwdAlgoGEMM:GemmFwd1x1_0_1,1.42648,0,miopenConvolutionFwdAlgoGEMM,<unused>
336-21-21-3x3-336-21-21-64-1x1-1x1-1x1-0-NCHW-FP32-F_g336=miopenConvolutionFwdAlgoImplicitGEMM:ConvMlirIgemmFwd,4.09632,0,miopenConvolutionFwdAlgoImplicitGEMM,<unused>;miopenConvolutionFwdAlgoDirect:ConvOclDirectFwd,0.202399,0,miopenConvolutionFwdAlgoDirect,<unused>;miopenConvolutionFwdAlgoWinograd:ConvBinWinogradRxSf3x2,3.39872,0,miopenConvolutionFwdAlgoWinograd,<unused>;miopenConvolutionFwdAlgoGEMM:GemmFwdRest,12.6054,5334336,miopenConvolutionFwdAlgoGEMM,<unused>
1344-21-21-1x1-672-21-21-64-0x0-1x1-1x1-0-NCHW-FP32-F=miopenConvolutionFwdAlgoImplicitGEMM:ConvHipImplicitGemmV4R1Fwd,8.81567,0,miopenConvolutionFwdAlgoImplicitGEMM,<unused>;miopenConvolutionFwdAlgoDirect:ConvAsm1x1U,5.67529,0,miopenConvolutionFwdAlgoDirect,<unused>;miopenConvolutionFwdAlgoWinograd:ConvBinWinogradRxSf3x2,7.89343,0,miopenConvolutionFwdAlgoWinograd,<unused>;miopenConvolutionFwdAlgoGEMM:GemmFwd1x1_0_1,5.32928,0,miopenConvolutionFwdAlgoGEMM,<unused>
1008-21-21-1x1-168-21-21-64-0x0-1x1-1x1-0-NCHW-FP32-F=miopenConvolutionFwdAlgoImplicitGEMM:ConvMlirIgemmFwd,2.21728,0,miopenConvolutionFwdAlgoImplicitGEMM,<unused>;miopenConvolutionFwdAlgoDirect:ConvAsm1x1U,1.05568,0,miopenConvolutionFwdAlgoDirect,<unused>;miopenConvolutionFwdAlgoWinograd:ConvBinWinogradRxSf3x2,1.99152,0,miopenConvolutionFwdAlgoWinograd,<unused>;miopenConvolutionFwdAlgoGEMM:GemmFwd1x1_0_1,1.31968,0,miopenConvolutionFwdAlgoGEMM,<unused>
2016-21-21-1x1-672-21-21-64-0x0-1x1-1x1-0-NCHW-FP32-F=miopenConvolutionFwdAlgoImplicitGEMM:ConvHipImplicitGemmV4R1Fwd,12.8307,0,miopenConvolutionFwdAlgoImplicitGEMM,<unused>;miopenConvolutionFwdAlgoDirect:ConvAsm1x1U,8.40655,0,miopenConvolutionFwdAlgoDirect,<unused>;miopenConvolutionFwdAlgoWinograd:ConvBinWinogradRxSf3x2,12.2536,0,miopenConvolutionFwdAlgoWinograd,<unused>;miopenConvolutionFwdAlgoGEMM:GemmFwd1x1_0_1,7.26143,0,miopenConvolutionFwdAlgoGEMM,<unused>
2016-21-21-1x1-336-21-21-64-0x0-1x1-1x1-0-NCHW-FP32-F=miopenConvolutionFwdAlgoImplicitGEMM:ConvHipImplicitGemmV4R1Fwd,12.2269,0,miopenConvolutionFwdAlgoImplicitGEMM,<unused>;miopenConvolutionFwdAlgoDirect:ConvAsm1x1U,4.20512,0,miopenConvolutionFwdAlgoDirect,<unused>;miopenConvolutionFwdAlgoWinograd:ConvBinWinogradRxSf3x2,5.97263,0,miopenConvolutionFwdAlgoWinograd,<unused>;miopenConvolutionFwdAlgoGEMM:GemmFwd1x1_0_1,4.85776,0,miopenConvolutionFwdAlgoGEMM,<unused>
672-21-21-7x7-672-11-11-64-3x3-2x2-1x1-0-NCHW-FP32-F_g672=miopenConvolutionFwdAlgoImplicitGEMM:ConvMlirIgemmFwd,9.20431,0,miopenConvolutionFwdAlgoImplicitGEMM,<unused>;miopenConvolutionFwdAlgoDirect:ConvOclDirectFwd,1.06656,0,miopenConvolutionFwdAlgoDirect,<unused>;miopenConvolutionFwdAlgoWinograd:ConvBinWinogradRxSf2x3,6.72287,0,miopenConvolutionFwdAlgoWinograd,<unused>;miopenConvolutionFwdAlgoGEMM:GemmFwdRest,6.90163,15937152,miopenConvolutionFwdAlgoGEMM,<unused>
672-11-11-1x1-672-11-11-64-0x0-1x1-1x1-0-NCHW-FP32-F=miopenConvolutionFwdAlgoImplicitGEMM:ConvHipImplicitGemmV4R1Fwd,1.09344,0,miopenConvolutionFwdAlgoImplicitGEMM,<unused>;miopenConvolutionFwdAlgoDirect:ConvAsm1x1U,0.780319,0,miopenConvolutionFwdAlgoDirect,<unused>;miopenConvolutionFwdAlgoWinograd:ConvBinWinogradRxSf3x2,1.61392,0,miopenConvolutionFwdAlgoWinograd,<unused>;miopenConvolutionFwdAlgoGEMM:GemmFwd1x1_0_1,1.30736,0,miopenConvolutionFwdAlgoGEMM,<unused>
672-11-11-7x7-672-11-11-64-3x3-1x1-1x1-0-NCHW-FP32-F_g672=miopenConvolutionFwdAlgoImplicitGEMM:ConvMlirIgemmFwd,9.20767,0,miopenConvolutionFwdAlgoImplicitGEMM,<unused>;miopenConvolutionFwdAlgoDirect:ConvOclDirectFwd,0.42208,0,miopenConvolutionFwdAlgoDirect,<unused>;miopenConvolutionFwdAlgoWinograd:ConvBinWinogradRxSf3x2,4.49984,0,miopenConvolutionFwdAlgoWinograd,<unused>;miopenConvolutionFwdAlgoGEMM:GemmFwdRest,6.44083,15937152,miopenConvolutionFwdAlgoGEMM,<unused>
672-21-21-5x5-672-11-11-64-2x2-2x2-1x1-0-NCHW-FP32-F_g672=miopenConvolutionFwdAlgoImplicitGEMM:ConvMlirIgemmFwd,4.8864,0,miopenConvolutionFwdAlgoImplicitGEMM,<unused>;miopenConvolutionFwdAlgoDirect:ConvOclDirectFwd,0.567839,0,miopenConvolutionFwdAlgoDirect,<unused>;miopenConvolutionFwdAlgoWinograd:ConvBinWinogradRxSf2x3,3.392,0,miopenConvolutionFwdAlgoWinograd,<unused>;miopenConvolutionFwdAlgoGEMM:GemmFwdRest,4.62835,8131200,miopenConvolutionFwdAlgoGEMM,<unused>
672-11-11-5x5-672-11-11-64-2x2-1x1-1x1-0-NCHW-FP32-F_g672=miopenConvolutionFwdAlgoImplicitGEMM:ConvMlirIgemmFwd,4.48896,0,miopenConvolutionFwdAlgoImplicitGEMM,<unused>;miopenConvolutionFwdAlgoDirect:ConvOclDirectFwd,0.14384,0,miopenConvolutionFwdAlgoDirect,<unused>;miopenConvolutionFwdAlgoWinograd:ConvBinWinogradRxSf2x3,3.25424,0,miopenConvolutionFwdAlgoWinograd,<unused>;miopenConvolutionFwdAlgoGEMM:GemmFwdRest,3.64531,8131200,miopenConvolutionFwdAlgoGEMM,<unused>
1344-11-11-1x1-672-11-11-64-0x0-1x1-1x1-0-NCHW-FP32-F=miopenConvolutionFwdAlgoImplicitGEMM:ConvHipImplicitGemmV4R1Fwd,2.7048,0,miopenConvolutionFwdAlgoImplicitGEMM,<unused>;miopenConvolutionFwdAlgoDirect:ConvAsm1x1U,1.53936,0,miopenConvolutionFwdAlgoDirect,<unused>;miopenConvolutionFwdAlgoWinograd:ConvBinWinogradRxSf3x2,3.13504,0,miopenConvolutionFwdAlgoWinograd,<unused>;miopenConvolutionFwdAlgoGEMM:GemmFwd1x1_0_1,2.55296,0,miopenConvolutionFwdAlgoGEMM,<unused>
672-11-11-3x3-672-11-11-64-1x1-1x1-1x1-0-NCHW-FP32-F_g672=miopenConvolutionFwdAlgoImplicitGEMM:ConvMlirIgemmFwd,2.6392,0,miopenConvolutionFwdAlgoImplicitGEMM,<unused>;miopenConvolutionFwdAlgoDirect:ConvOclDirectFwd,0.12112,0,miopenConvolutionFwdAlgoDirect,<unused>;miopenConvolutionFwdAlgoWinograd:ConvBinWinogradRxSf2x3,2.2136,0,miopenConvolutionFwdAlgoWinograd,<unused>;miopenConvolutionFwdAlgoGEMM:GemmFwdRest,3.05152,2927232,miopenConvolutionFwdAlgoGEMM,<unused>
2688-11-11-1x1-1344-11-11-64-0x0-1x1-1x1-0-NCHW-FP32-F=miopenConvolutionFwdAlgoImplicitGEMM:ConvHipImplicitGemmV4R1Fwd,5.37328,0,miopenConvolutionFwdAlgoImplicitGEMM,<unused>;miopenConvolutionFwdAlgoDirect:ConvAsm1x1U,6.09983,0,miopenConvolutionFwdAlgoDirect,<unused>;miopenConvolutionFwdAlgoWinograd:ConvBinWinogradRxSf3x2,10.2824,0,miopenConvolutionFwdAlgoWinograd,<unused>;miopenConvolutionFwdAlgoGEMM:GemmFwd1x1_0_1,8.91135,0,miopenConvolutionFwdAlgoGEMM,<unused>
2016-11-11-1x1-336-11-11-64-0x0-1x1-1x1-0-NCHW-FP32-F=miopenConvolutionFwdAlgoImplicitGEMM:ConvHipImplicitGemmV4R1Fwd,3.26528,0,miopenConvolutionFwdAlgoImplicitGEMM,<unused>;miopenConvolutionFwdAlgoDirect:ConvAsm1x1U,1.21136,0,miopenConvolutionFwdAlgoDirect,<unused>;miopenConvolutionFwdAlgoWinograd:ConvBinWinogradRxSf3x2,2.33744,0,miopenConvolutionFwdAlgoWinograd,<unused>;miopenConvolutionFwdAlgoGEMM:GemmFwd1x1_0_1,1.928,0,miopenConvolutionFwdAlgoGEMM,<unused>
4032-11-11-1x1-1344-11-11-64-0x0-1x1-1x1-0-NCHW-FP32-F=miopenConvolutionFwdAlgoImplicitGEMM:ConvHipImplicitGemmV4R1Fwd,8.09439,0,miopenConvolutionFwdAlgoImplicitGEMM,<unused>;miopenConvolutionFwdAlgoDirect:ConvAsm1x1U,8.94239,0,miopenConvolutionFwdAlgoDirect,<unused>;miopenConvolutionFwdAlgoWinograd:ConvBinWinogradRxSf3x2,15.6505,0,miopenConvolutionFwdAlgoWinograd,<unused>;miopenConvolutionFwdAlgoGEMM:GemmFwd1x1_0_1,7.85487,0,miopenConvolutionFwdAlgoGEMM,<unused>
4032-11-11-1x1-672-11-11-64-0x0-1x1-1x1-0-NCHW-FP32-F=miopenConvolutionFwdAlgoImplicitGEMM:ConvHipImplicitGemmV4R1Fwd,7.85407,0,miopenConvolutionFwdAlgoImplicitGEMM,<unused>;miopenConvolutionFwdAlgoDirect:ConvAsm1x1U,4.60128,0,miopenConvolutionFwdAlgoDirect,<unused>;miopenConvolutionFwdAlgoWinograd:ConvBinWinogradRxSf3x2,7.85907,0,miopenConvolutionFwdAlgoWinograd,<unused>;miopenConvolutionFwdAlgoGEMM:GemmFwd1x1_0_1,4.76896,0,miopenConvolutionFwdAlgoGEMM,<unused>
64-56-56-3x3-64-28-28-64-1x1-2x2-1x1-0-NCHW-FP32-F=miopenConvolutionFwdAlgoImplicitGEMM:ConvHipImplicitGemmV4R1Fwd,0.414255,0,miopenConvolutionFwdAlgoImplicitGEMM,<unused>;miopenConvolutionFwdAlgoDirect:ConvOclDirectFwd,4.45807,0,miopenConvolutionFwdAlgoDirect,<unused>;miopenConvolutionFwdAlgoWinograd:ConvBinWinogradRxSf2x3g1,0.803068,0,miopenConvolutionFwdAlgoWinograd,<unused>;miopenConvolutionFwdAlgoGEMM:GemmFwdRest,8.34592,1806336,miopenConvolutionFwdAlgoGEMM,<unused>
64-28-28-1x1-256-28-28-64-0x0-1x1-1x1-0-NCHW-FP32-F=miopenConvolutionFwdAlgoImplicitGEMM:ConvHipImplicitGemmV4R1Fwd,0.224327,0,miopenConvolutionFwdAlgoImplicitGEMM,<unused>;miopenConvolutionFwdAlgoDirect:ConvOclDirectFwd1x1,0.199687,0,miopenConvolutionFwdAlgoDirect,<unused>;miopenConvolutionFwdAlgoWinograd:ConvBinWinogradRxSf3x2,0.527538,0,miopenConvolutionFwdAlgoWinograd,<unused>;miopenConvolutionFwdAlgoGEMM:GemmFwd1x1_0_1,0.251688,0,miopenConvolutionFwdAlgoGEMM,<unused>
256-28-28-1x1-128-28-28-64-0x0-1x1-1x1-0-NCHW-FP32-F=miopenConvolutionFwdAlgoImplicitGEMM:ConvHipImplicitGemmV4R1Fwd,0.323369,0,miopenConvolutionFwdAlgoImplicitGEMM,<unused>;miopenConvolutionFwdAlgoDirect:ConvAsm1x1U,0.390411,0,miopenConvolutionFwdAlgoDirect,<unused>;miopenConvolutionFwdAlgoWinograd:ConvBinWinogradRxSf3x2,0.877625,0,miopenConvolutionFwdAlgoWinograd,<unused>;miopenConvolutionFwdAlgoGEMM:GemmFwd1x1_0_1,0.36657,0,miopenConvolutionFwdAlgoGEMM,<unused>
128-28-28-3x3-128-14-14-64-1x1-2x2-1x1-0-NCHW-FP32-F=miopenConvolutionFwdAlgoImplicitGEMM:ConvHipImplicitGemmV4R1Fwd,0.402729,0,miopenConvolutionFwdAlgoImplicitGEMM,<unused>;miopenConvolutionFwdAlgoDirect:ConvOclDirectFwd,3.35719,0,miopenConvolutionFwdAlgoDirect,<unused>;miopenConvolutionFwdAlgoWinograd:ConvBinWinogradRxSf2x3g1,0.782097,0,miopenConvolutionFwdAlgoWinograd,<unused>;miopenConvolutionFwdAlgoGEMM:GemmFwdRest,3.7991,903168,miopenConvolutionFwdAlgoGEMM,<unused>
128-14-14-1x1-512-14-14-64-0x0-1x1-1x1-0-NCHW-FP32-F=miopenConvolutionFwdAlgoImplicitGEMM:ConvHipImplicitGemmV4R1Fwd,0.193124,0,miopenConvolutionFwdAlgoImplicitGEMM,<unused>;miopenConvolutionFwdAlgoDirect:ConvAsm1x1U,0.298726,0,miopenConvolutionFwdAlgoDirect,<unused>;miopenConvolutionFwdAlgoWinograd:ConvBinWinogradRxSf3x2,0.454568,0,miopenConvolutionFwdAlgoWinograd,<unused>;miopenConvolutionFwdAlgoGEMM:GemmFwd1x1_0_1,0.325446,0,miopenConvolutionFwdAlgoGEMM,<unused>
512-14-14-1x1-256-14-14-64-0x0-1x1-1x1-0-NCHW-FP32-F=miopenConvolutionFwdAlgoImplicitGEMM:ConvHipImplicitGemmV4R1Fwd,0.354725,0,miopenConvolutionFwdAlgoImplicitGEMM,<unused>;miopenConvolutionFwdAlgoDirect:ConvOclDirectFwd1x1,0.395366,0,miopenConvolutionFwdAlgoDirect,<unused>;miopenConvolutionFwdAlgoWinograd:ConvBinWinogradRxSf3x2,0.75777,0,miopenConvolutionFwdAlgoWinograd,<unused>;miopenConvolutionFwdAlgoGEMM:GemmFwd1x1_0_1,0.68625,0,miopenConvolutionFwdAlgoGEMM,<unused>
256-14-14-3x3-256-7-7-64-1x1-2x2-1x1-0-NCHW-FP32-F=miopenConvolutionFwdAlgoImplicitGEMM:ConvHipImplicitGemmV4R1Fwd,0.456966,0,miopenConvolutionFwdAlgoImplicitGEMM,<unused>;miopenConvolutionFwdAlgoDirect:ConvOclDirectFwd,4.53029,0,miopenConvolutionFwdAlgoDirect,<unused>;miopenConvolutionFwdAlgoWinograd:ConvBinWinogradRxSf2x3g1,1.09921,0,miopenConvolutionFwdAlgoWinograd,<unused>;miopenConvolutionFwdAlgoGEMM:GemmFwdRest,5.25318,451584,miopenConvolutionFwdAlgoGEMM,<unused>
256-7-7-1x1-1024-7-7-64-0x0-1x1-1x1-0-NCHW-FP32-F=miopenConvolutionFwdAlgoImplicitGEMM:ConvHipImplicitGemmV4R1Fwd,0.178243,0,miopenConvolutionFwdAlgoImplicitGEMM,<unused>;miopenConvolutionFwdAlgoDirect:ConvAsm1x1U,0.274883,0,miopenConvolutionFwdAlgoDirect,<unused>;miopenConvolutionFwdAlgoWinograd:ConvBinWinogradRxSf3x2,0.572327,0,miopenConvolutionFwdAlgoWinograd,<unused>;miopenConvolutionFwdAlgoGEMM:GemmFwd1x1_0_1,0.665768,0,miopenConvolutionFwdAlgoGEMM,<unused>
1024-7-7-1x1-512-7-7-64-0x0-1x1-1x1-0-NCHW-FP32-F=miopenConvolutionFwdAlgoImplicitGEMM:ConvHipImplicitGemmV4R1Fwd,0.475206,0,miopenConvolutionFwdAlgoImplicitGEMM,<unused>;miopenConvolutionFwdAlgoDirect:ConvAsm1x1U,0.578886,0,miopenConvolutionFwdAlgoDirect,<unused>;miopenConvolutionFwdAlgoWinograd:ConvBinWinogradRxSf3x2,1.02801,0,miopenConvolutionFwdAlgoWinograd,<unused>;miopenConvolutionFwdAlgoGEMM:GemmFwd1x1_0_1,1.16337,0,miopenConvolutionFwdAlgoGEMM,<unused>
2048-1-1-1x1-1001-1-1-64-0x0-1x1-1x1-0-NCHW-FP32-F=miopenConvolutionFwdAlgoImplicitGEMM:ConvMlirIgemmFwd,1.13553,0,miopenConvolutionFwdAlgoImplicitGEMM,<unused>;miopenConvolutionFwdAlgoDirect:ConvAsm1x1U,0.533285,0,miopenConvolutionFwdAlgoDirect,<unused>;miopenConvolutionFwdAlgoWinograd:ConvBinWinogradRxSf3x2,0.813769,0,miopenConvolutionFwdAlgoWinograd,<unused>;miopenConvolutionFwdAlgoGEMM:GemmFwd1x1_0_1,2.0269,0,miopenConvolutionFwdAlgoGEMM,<unused>
3-224-224-7x7-64-112-112-1-3x3-2x2-1x1-0-NCHW-FP32-F=miopenConvolutionFwdAlgoImplicitGEMM:ConvMlirIgemmFwd,0.14431,0,miopenConvolutionFwdAlgoImplicitGEMM,<unused>;miopenConvolutionFwdAlgoDirect:ConvAsm7x7c3h224w224k64u2v2p3q3f1,0.041277,0,miopenConvolutionFwdAlgoDirect,<unused>;miopenConvolutionFwdAlgoWinograd:ConvBinWinogradRxS,0.071995,0,miopenConvolutionFwdAlgoWinograd,<unused>;miopenConvolutionFwdAlgoGEMM:GemmFwdRest,0.068955,7375872,miopenConvolutionFwdAlgoGEMM,<unused>
64-56-56-1x1-64-56-56-1-0x0-1x1-1x1-0-NCHW-FP32-F=miopenConvolutionFwdAlgoImplicitGEMM:ConvHipImplicitGemmV4R4Fwd,0.018084,0,miopenConvolutionFwdAlgoImplicitGEMM,<unused>;miopenConvolutionFwdAlgoDirect:ConvAsm1x1U,0.016324,0,miopenConvolutionFwdAlgoDirect,<unused>;miopenConvolutionFwdAlgoWinograd:ConvBinWinogradRxS,0.039849,0,miopenConvolutionFwdAlgoWinograd,<unused>;miopenConvolutionFwdAlgoGEMM:GemmFwd1x1_0_1,0.030087,0,miopenConvolutionFwdAlgoGEMM,<unused>
64-56-56-3x3-64-56-56-1-1x1-1x1-1x1-0-NCHW-FP32-F=miopenConvolutionFwdAlgoWinograd:ConvBinWinogradRxS,0.039049,0,miopenConvolutionFwdAlgoWinograd,<unused>
128-56-56-1x1-256-56-56-1-0x0-1x1-1x1-0-NCHW-FP32-F=miopenConvolutionFwdAlgoImplicitGEMM:ConvHipImplicitGemmV4R4Fwd,0.038728,0,miopenConvolutionFwdAlgoImplicitGEMM,<unused>;miopenConvolutionFwdAlgoDirect:ConvAsm1x1U,0.039528,0,miopenConvolutionFwdAlgoDirect,<unused>;miopenConvolutionFwdAlgoWinograd:ConvBinWinogradRxSf3x2,0.09074,0,miopenConvolutionFwdAlgoWinograd,<unused>;miopenConvolutionFwdAlgoGEMM:GemmFwd1x1_0_1,0.048171,0,miopenConvolutionFwdAlgoGEMM,<unused>
256-56-56-1x1-64-56-56-1-0x0-1x1-1x1-0-NCHW-FP32-F=miopenConvolutionFwdAlgoImplicitGEMM:ConvHipImplicitGemmV4R4Fwd,0.039208,0,miopenConvolutionFwdAlgoImplicitGEMM,<unused>;miopenConvolutionFwdAlgoDirect:ConvAsm1x1U,0.027046,0,miopenConvolutionFwdAlgoDirect,<unused>;miopenConvolutionFwdAlgoWinograd:ConvBinWinogradRxS,0.078577,0,miopenConvolutionFwdAlgoWinograd,<unused>;miopenConvolutionFwdAlgoGEMM:GemmFwd1x1_0_1,0.067215,0,miopenConvolutionFwdAlgoGEMM,<unused>
64-56-56-1x1-256-56-56-1-0x0-1x1-1x1-0-NCHW-FP32-F=miopenConvolutionFwdAlgoImplicitGEMM:ConvHipImplicitGemmV4R4Fwd,0.024486,0,miopenConvolutionFwdAlgoImplicitGEMM,<unused>;miopenConvolutionFwdAlgoDirect:ConvAsm1x1U,0.027526,0,miopenConvolutionFwdAlgoDirect,<unused>;miopenConvolutionFwdAlgoWinograd:ConvBinWinogradRxSf3x2,0.066735,0,miopenConvolutionFwdAlgoWinograd,<unused>;miopenConvolutionFwdAlgoGEMM:GemmFwd1x1_0_1,0.035367,0,miopenConvolutionFwdAlgoGEMM,<unused>
256-56-56-1x1-128-56-56-1-0x0-1x1-1x1-0-NCHW-FP32-F=miopenConvolutionFwdAlgoImplicitGEMM:ConvHipImplicitGemmV4R4Fwd,0.0448,0,miopenConvolutionFwdAlgoImplicitGEMM,<unused>;miopenConvolutionFwdAlgoDirect:ConvAsm1x1U,0.046079,0,miopenConvolutionFwdAlgoDirect,<unused>;miopenConvolutionFwdAlgoWinograd:ConvBinWinogradRxSf3x2,0.085919,0,miopenConvolutionFwdAlgoWinograd,<unused>;miopenConvolutionFwdAlgoGEMM:GemmFwd1x1_0_1,0.063519,0,miopenConvolutionFwdAlgoGEMM,<unused>
128-56-56-3x3-128-28-28-1-1x1-2x2-1x1-0-NCHW-FP32-F=miopenConvolutionFwdAlgoImplicitGEMM:ConvMlirIgemmFwd,0.749285,0,miopenConvolutionFwdAlgoImplicitGEMM,<unused>;miopenConvolutionFwdAlgoDirect:ConvOclDirectFwd,0.567485,0,miopenConvolutionFwdAlgoDirect,<unused>;miopenConvolutionFwdAlgoWinograd:ConvBinWinogradRxSf2x3g1,0.13667,0,miopenConvolutionFwdAlgoWinograd,<unused>;miopenConvolutionFwdAlgoGEMM:GemmFwdRest,0.132508,3612672,miopenConvolutionFwdAlgoGEMM,<unused>
384-28-28-1x1-512-28-28-1-0x0-1x1-1x1-0-NCHW-FP32-F=miopenConvolutionFwdAlgoImplicitGEMM:ConvMlirIgemmFwd,0.20147,0,miopenConvolutionFwdAlgoImplicitGEMM,<unused>;miopenConvolutionFwdAlgoDirect:ConvAsm1x1U,0.061449,0,miopenConvolutionFwdAlgoDirect,<unused>;miopenConvolutionFwdAlgoWinograd:ConvBinWinogradRxS,0.183707,0,miopenConvolutionFwdAlgoWinograd,<unused>;miopenConvolutionFwdAlgoGEMM:GemmFwd1x1_0_1,0.076812,0,miopenConvolutionFwdAlgoGEMM,<unused>
512-28-28-1x1-128-28-28-1-0x0-1x1-1x1-0-NCHW-FP32-F=miopenConvolutionFwdAlgoImplicitGEMM:ConvMlirIgemmFwd,0.264999,0,miopenConvolutionFwdAlgoImplicitGEMM,<unused>;miopenConvolutionFwdAlgoDirect:ConvAsm1x1U,0.034565,0,miopenConvolutionFwdAlgoDirect,<unused>;miopenConvolutionFwdAlgoWinograd:ConvBinWinogradRxSf2x3g1,0.129459,0,miopenConvolutionFwdAlgoWinograd,<unused>;miopenConvolutionFwdAlgoGEMM:GemmFwd1x1_0_1,0.116977,0,miopenConvolutionFwdAlgoGEMM,<unused>
128-28-28-3x3-128-28-28-1-1x1-1x1-1x1-0-NCHW-FP32-F=miopenConvolutionFwdAlgoWinograd:ConvBinWinograd3x3U,0.051207,0,miopenConvolutionFwdAlgoWinograd,<unused>
128-28-28-1x1-512-28-28-1-0x0-1x1-1x1-0-NCHW-FP32-F=miopenConvolutionFwdAlgoImplicitGEMM:ConvMlirIgemmFwd,0.078732,0,miopenConvolutionFwdAlgoImplicitGEMM,<unused>;miopenConvolutionFwdAlgoDirect:ConvAsm1x1U,0.028324,0,miopenConvolutionFwdAlgoDirect,<unused>;miopenConvolutionFwdAlgoWinograd:ConvBinWinogradRxS,0.080652,0,miopenConvolutionFwdAlgoWinograd,<unused>;miopenConvolutionFwdAlgoGEMM:GemmFwd1x1_0_1,0.052168,0,miopenConvolutionFwdAlgoGEMM,<unused>
512-28-28-1x1-256-28-28-1-0x0-1x1-1x1-0-NCHW-FP32-F=miopenConvolutionFwdAlgoImplicitGEMM:ConvMlirIgemmFwd,0.262717,0,miopenConvolutionFwdAlgoImplicitGEMM,<unused>;miopenConvolutionFwdAlgoDirect:ConvAsm1x1U,0.052319,0,miopenConvolutionFwdAlgoDirect,<unused>;miopenConvolutionFwdAlgoWinograd:ConvBinWinogradRxSf2x3g1,0.130078,0,miopenConvolutionFwdAlgoWinograd,<unused>;miopenConvolutionFwdAlgoGEMM:GemmFwd1x1_0_1,0.107679,0,miopenConvolutionFwdAlgoGEMM,<unused>
256-28-28-3x3-256-14-14-1-1x1-2x2-1x1-0-NCHW-FP32-F=miopenConvolutionFwdAlgoImplicitGEMM:ConvMlirIgemmFwd,1.48486,0,miopenConvolutionFwdAlgoImplicitGEMM,<unused>;miopenConvolutionFwdAlgoDirect:ConvOclDirectFwd,0.891651,0,miopenConvolutionFwdAlgoDirect,<unused>;miopenConvolutionFwdAlgoWinograd:ConvBinWinogradRxSf2x3g1,0.243556,0,miopenConvolutionFwdAlgoWinograd,<unused>;miopenConvolutionFwdAlgoGEMM:GemmFwdRest,0.144499,1806336,miopenConvolutionFwdAlgoGEMM,<unused>
768-14-14-1x1-1024-14-14-1-0x0-1x1-1x1-0-NCHW-FP32-F=miopenConvolutionFwdAlgoImplicitGEMM:ConvMlirIgemmFwd,0.383256,0,miopenConvolutionFwdAlgoImplicitGEMM,<unused>;miopenConvolutionFwdAlgoDirect:ConvAsm1x1U,0.104175,0,miopenConvolutionFwdAlgoDirect,<unused>;miopenConvolutionFwdAlgoWinograd:ConvBinWinogradRxSf3x2,0.180187,0,miopenConvolutionFwdAlgoWinograd,<unused>;miopenConvolutionFwdAlgoGEMM:GemmFwd1x1_0_1,0.101295,0,miopenConvolutionFwdAlgoGEMM,<unused>
1024-14-14-1x1-256-14-14-1-0x0-1x1-1x1-0-NCHW-FP32-F=miopenConvolutionFwdAlgoImplicitGEMM:ConvMlirIgemmFwd,0.508555,0,miopenConvolutionFwdAlgoImplicitGEMM,<unused>;miopenConvolutionFwdAlgoDirect:ConvAsm1x1U,0.046567,0,miopenConvolutionFwdAlgoDirect,<unused>;miopenConvolutionFwdAlgoWinograd:ConvBinWinogradRxSf2x3g1,0.230753,0,miopenConvolutionFwdAlgoWinograd,<unused>;miopenConvolutionFwdAlgoGEMM:GemmFwd1x1_0_1,0.096974,0,miopenConvolutionFwdAlgoGEMM,<unused>
256-14-14-3x3-256-14-14-1-1x1-1x1-1x1-0-NCHW-FP32-F=miopenConvolutionFwdAlgoWinograd:ConvBinWinogradRxS,0.077611,0,miopenConvolutionFwdAlgoWinograd,<unused>
256-14-14-1x1-1024-14-14-1-0x0-1x1-1x1-0-NCHW-FP32-F=miopenConvolutionFwdAlgoImplicitGEMM:ConvMlirIgemmFwd,0.140341,0,miopenConvolutionFwdAlgoImplicitGEMM,<unused>;miopenConvolutionFwdAlgoDirect:ConvAsm1x1U,0.039366,0,miopenConvolutionFwdAlgoDirect,<unused>;miopenConvolutionFwdAlgoWinograd:ConvBinWinogradRxSf3x2,0.084492,0,miopenConvolutionFwdAlgoWinograd,<unused>;miopenConvolutionFwdAlgoGEMM:GemmFwd1x1_0_1,0.058568,0,miopenConvolutionFwdAlgoGEMM,<unused>
1024-14-14-1x1-512-14-14-1-0x0-1x1-1x1-0-NCHW-FP32-F=miopenConvolutionFwdAlgoImplicitGEMM:ConvMlirIgemmFwd,0.517114,0,miopenConvolutionFwdAlgoImplicitGEMM,<unused>;miopenConvolutionFwdAlgoDirect:ConvAsm1x1U,0.076319,0,miopenConvolutionFwdAlgoDirect,<unused>;miopenConvolutionFwdAlgoWinograd:ConvBinWinogradRxSf3x2,0.229437,0,miopenConvolutionFwdAlgoWinograd,<unused>;miopenConvolutionFwdAlgoGEMM:GemmFwd1x1_0_1,0.082559,0,miopenConvolutionFwdAlgoGEMM,<unused>
512-14-14-3x3-512-7-7-1-1x1-2x2-1x1-0-NCHW-FP32-F=miopenConvolutionFwdAlgoImplicitGEMM:ConvMlirIgemmFwd,3.03612,0,miopenConvolutionFwdAlgoImplicitGEMM,<unused>;miopenConvolutionFwdAlgoDirect:ConvOclDirectFwd,1.1376,0,miopenConvolutionFwdAlgoDirect,<unused>;miopenConvolutionFwdAlgoWinograd:ConvBinWinogradRxSf2x3g1,0.460547,0,miopenConvolutionFwdAlgoWinograd,<unused>;miopenConvolutionFwdAlgoGEMM:GemmFwdRest,0.40982,903168,miopenConvolutionFwdAlgoGEMM,<unused>
1536-7-7-1x1-2048-7-7-1-0x0-1x1-1x1-0-NCHW-FP32-F=miopenConvolutionFwdAlgoImplicitGEMM:ConvMlirIgemmFwd,0.911972,0,miopenConvolutionFwdAlgoImplicitGEMM,<unused>;miopenConvolutionFwdAlgoDirect:ConvOclDirectFwd1x1,0.172665,0,miopenConvolutionFwdAlgoDirect,<unused>;miopenConvolutionFwdAlgoWinograd:ConvBinWinogradRxSf3x2,0.611128,0,miopenConvolutionFwdAlgoWinograd,<unused>;miopenConvolutionFwdAlgoGEMM:GemmFwd1x1_0_1,0.118417,0,miopenConvolutionFwdAlgoGEMM,<unused>
2048-7-7-1x1-512-7-7-1-0x0-1x1-1x1-0-NCHW-FP32-F=miopenConvolutionFwdAlgoImplicitGEMM:ConvMlirIgemmFwd,1.13408,0,miopenConvolutionFwdAlgoImplicitGEMM,<unused>;miopenConvolutionFwdAlgoDirect:ConvOclDirectFwd1x1,0.07345,0,miopenConvolutionFwdAlgoDirect,<unused>;miopenConvolutionFwdAlgoWinograd:ConvBinWinogradRxSf3x2,0.421181,0,miopenConvolutionFwdAlgoWinograd,<unused>;miopenConvolutionFwdAlgoGEMM:GemmFwd1x1_0_1,0.083212,0,miopenConvolutionFwdAlgoGEMM,<unused>
512-7-7-3x3-512-7-7-1-1x1-1x1-1x1-0-NCHW-FP32-F=miopenConvolutionFwdAlgoWinograd:ConvBinWinograd3x3U,0.134739,0,miopenConvolutionFwdAlgoWinograd,<unused>
512-7-7-1x1-2048-7-7-1-0x0-1x1-1x1-0-NCHW-FP32-F=miopenConvolutionFwdAlgoImplicitGEMM:ConvMlirIgemmFwd,0.317805,0,miopenConvolutionFwdAlgoImplicitGEMM,<unused>;miopenConvolutionFwdAlgoDirect:ConvAsm1x1U,0.058728,0,miopenConvolutionFwdAlgoDirect,<unused>;miopenConvolutionFwdAlgoWinograd:ConvBinWinogradRxSf3x2,0.230753,0,miopenConvolutionFwdAlgoWinograd,<unused>;miopenConvolutionFwdAlgoGEMM:GemmFwd1x1_0_1,0.063369,0,miopenConvolutionFwdAlgoGEMM,<unused>
3-299-299-3x3-32-149-149-1-0x0-2x2-1x1-0-NCHW-FP32-F=miopenConvolutionFwdAlgoImplicitGEMM:ConvMlirIgemmFwd,0.0544,0,miopenConvolutionFwdAlgoImplicitGEMM,<unused>;miopenConvolutionFwdAlgoDirect:ConvOclDirectFwd,0.07232,0,miopenConvolutionFwdAlgoDirect,<unused>;miopenConvolutionFwdAlgoWinograd:ConvBinWinogradRxSf2x3g1,0.044,0,miopenConvolutionFwdAlgoWinograd,<unused>;miopenConvolutionFwdAlgoGEMM:GemmFwdRest,0.04752,2397708,miopenConvolutionFwdAlgoGEMM,<unused>
32-149-149-3x3-32-147-147-1-0x0-1x1-1x1-0-NCHW-FP32-F=miopenConvolutionFwdAlgoImplicitGEMM:ConvMlirIgemmFwd,0.2456,0,miopenConvolutionFwdAlgoImplicitGEMM,<unused>;miopenConvolutionFwdAlgoDirect:ConvOclDirectFwd,0.38912,0,miopenConvolutionFwdAlgoDirect,<unused>;miopenConvolutionFwdAlgoWinograd:ConvBinWinogradRxS,0.05072,0,miopenConvolutionFwdAlgoWinograd,<unused>;miopenConvolutionFwdAlgoGEMM:GemmFwdRest,0.15472,24893568,miopenConvolutionFwdAlgoGEMM,<unused>
32-147-147-3x3-64-147-147-1-1x1-1x1-1x1-0-NCHW-FP32-F=miopenConvolutionFwdAlgoWinograd:ConvBinWinograd3x3U,0.0744,0,miopenConvolutionFwdAlgoWinograd,<unused>
64-73-73-1x1-80-73-73-1-0x0-1x1-1x1-0-NCHW-FP32-F=miopenConvolutionFwdAlgoImplicitGEMM:ConvMlirIgemmFwd,0.054401,0,miopenConvolutionFwdAlgoImplicitGEMM,<unused>;miopenConvolutionFwdAlgoDirect:ConvAsm1x1U,0.02016,0,miopenConvolutionFwdAlgoDirect,<unused>;miopenConvolutionFwdAlgoWinograd:ConvBinWinogradRxSf3x2,0.051681,0,miopenConvolutionFwdAlgoWinograd,<unused>;miopenConvolutionFwdAlgoGEMM:GemmFwd1x1_0_1,0.042881,0,miopenConvolutionFwdAlgoGEMM,<unused>
80-73-73-3x3-192-71-71-1-0x0-1x1-1x1-0-NCHW-FP32-F=miopenConvolutionFwdAlgoImplicitGEMM:ConvMlirIgemmFwd,0.686253,0,miopenConvolutionFwdAlgoImplicitGEMM,<unused>;miopenConvolutionFwdAlgoDirect:ConvOclDirectFwd,1.04722,0,miopenConvolutionFwdAlgoDirect,<unused>;miopenConvolutionFwdAlgoWinograd:ConvBinWinogradRxS,0.115363,0,miopenConvolutionFwdAlgoWinograd,<unused>;miopenConvolutionFwdAlgoGEMM:GemmFwdRest,0.190563,14518080,miopenConvolutionFwdAlgoGEMM,<unused>
192-35-35-1x1-128-35-35-1-0x0-1x1-1x1-0-NCHW-FP32-F=miopenConvolutionFwdAlgoImplicitGEMM:ConvMlirIgemmFwd,0.117282,0,miopenConvolutionFwdAlgoImplicitGEMM,<unused>;miopenConvolutionFwdAlgoDirect:ConvAsm1x1U,0.02096,0,miopenConvolutionFwdAlgoDirect,<unused>;miopenConvolutionFwdAlgoWinograd:ConvBinWinogradRxS,0.064321,0,miopenConvolutionFwdAlgoWinograd,<unused>;miopenConvolutionFwdAlgoGEMM:GemmFwd1x1_0_1,0.042721,0,miopenConvolutionFwdAlgoGEMM,<unused>
192-35-35-1x1-48-35-35-1-0x0-1x1-1x1-0-NCHW-FP32-F=miopenConvolutionFwdAlgoImplicitGEMM:ConvMlirIgemmFwd,0.120482,0,miopenConvolutionFwdAlgoImplicitGEMM,<unused>;miopenConvolutionFwdAlgoDirect:ConvAsm1x1U,0.01488,0,miopenConvolutionFwdAlgoDirect,<unused>;miopenConvolutionFwdAlgoWinograd:ConvBinWinogradRxS,0.065122,0,miopenConvolutionFwdAlgoWinograd,<unused>;miopenConvolutionFwdAlgoGEMM:GemmFwd1x1_0_1,0.044801,0,miopenConvolutionFwdAlgoGEMM,<unused>
48-35-35-5x5-64-35-35-1-2x2-1x1-1x1-0-NCHW-FP32-F=miopenConvolutionFwdAlgoImplicitGEMM:ConvMlirIgemmFwd,0.750094,0,miopenConvolutionFwdAlgoImplicitGEMM,<unused>;miopenConvolutionFwdAlgoDirect:ConvOclDirectFwd,0.853936,0,miopenConvolutionFwdAlgoDirect,<unused>;miopenConvolutionFwdAlgoWinograd:ConvBinWinogradRxSf2x3g1,0.068321,0,miopenConvolutionFwdAlgoWinograd,<unused>;miopenConvolutionFwdAlgoGEMM:GemmFwdRest,0.082081,5880000,miopenConvolutionFwdAlgoGEMM,<unused>
64-35-35-3x3-96-35-35-1-1x1-1x1-1x1-0-NCHW-FP32-F=miopenConvolutionFwdAlgoWinograd:ConvBinWinograd3x3U,0.038241,0,miopenConvolutionFwdAlgoWinograd,<unused>
96-35-35-3x3-96-35-35-1-1x1-1x1-1x1-0-NCHW-FP32-F=miopenConvolutionFwdAlgoWinograd:ConvBinWinograd3x3U,0.044161,0,miopenConvolutionFwdAlgoWinograd,<unused>
192-35-35-1x1-32-35-35-1-0x0-1x1-1x1-0-NCHW-FP32-F=miopenConvolutionFwdAlgoImplicitGEMM:ConvMlirIgemmFwd,0.116963,0,miopenConvolutionFwdAlgoImplicitGEMM,<unused>;miopenConvolutionFwdAlgoDirect:ConvAsm1x1U,0.01504,0,miopenConvolutionFwdAlgoDirect,<unused>;miopenConvolutionFwdAlgoWinograd:ConvBinWinogradRxS,0.065281,0,miopenConvolutionFwdAlgoWinograd,<unused>;miopenConvolutionFwdAlgoGEMM:GemmFwd1x1_0_1,0.066721,0,miopenConvolutionFwdAlgoGEMM,<unused>
256-35-35-1x1-128-35-35-1-0x0-1x1-1x1-0-NCHW-FP32-F=miopenConvolutionFwdAlgoImplicitGEMM:ConvMlirIgemmFwd,0.152643,0,miopenConvolutionFwdAlgoImplicitGEMM,<unused>;miopenConvolutionFwdAlgoDirect:ConvAsm1x1U,0.025921,0,miopenConvolutionFwdAlgoDirect,<unused>;miopenConvolutionFwdAlgoWinograd:ConvBinWinogradRxS,0.078401,0,miopenConvolutionFwdAlgoWinograd,<unused>;miopenConvolutionFwdAlgoGEMM:GemmFwd1x1_0_1,0.068161,0,miopenConvolutionFwdAlgoGEMM,<unused>
256-35-35-1x1-48-35-35-1-0x0-1x1-1x1-0-NCHW-FP32-F=miopenConvolutionFwdAlgoImplicitGEMM:ConvMlirIgemmFwd,0.158083,0,miopenConvolutionFwdAlgoImplicitGEMM,<unused>;miopenConvolutionFwdAlgoDirect:ConvAsm1x1U,0.01632,0,miopenConvolutionFwdAlgoDirect,<unused>;miopenConvolutionFwdAlgoWinograd:ConvBinWinogradRxS,0.077762,0,miopenConvolutionFwdAlgoWinograd,<unused>;miopenConvolutionFwdAlgoGEMM:GemmFwd1x1_0_1,0.066881,0,miopenConvolutionFwdAlgoGEMM,<unused>
256-35-35-1x1-64-35-35-1-0x0-1x1-1x1-0-NCHW-FP32-F=miopenConvolutionFwdAlgoImplicitGEMM:ConvMlirIgemmFwd,0.151523,0,miopenConvolutionFwdAlgoImplicitGEMM,<unused>;miopenConvolutionFwdAlgoDirect:ConvAsm1x1U,0.02032,0,miopenConvolutionFwdAlgoDirect,<unused>;miopenConvolutionFwdAlgoWinograd:ConvBinWinogradRxS,0.077601,0,miopenConvolutionFwdAlgoWinograd,<unused>;miopenConvolutionFwdAlgoGEMM:GemmFwd1x1_0_1,0.068481,0,miopenConvolutionFwdAlgoGEMM,<unused>
288-35-35-1x1-128-35-35-1-0x0-1x1-1x1-0-NCHW-FP32-F=miopenConvolutionFwdAlgoImplicitGEMM:ConvMlirIgemmFwd,0.166717,0,miopenConvolutionFwdAlgoImplicitGEMM,<unused>;miopenConvolutionFwdAlgoDirect:ConvAsm1x1U,0.026239,0,miopenConvolutionFwdAlgoDirect,<unused>;miopenConvolutionFwdAlgoWinograd:ConvBinWinogradRxS,0.084798,0,miopenConvolutionFwdAlgoWinograd,<unused>;miopenConvolutionFwdAlgoGEMM:GemmFwd1x1_0_1,0.072959,0,miopenConvolutionFwdAlgoGEMM,<unused>
288-35-35-1x1-48-35-35-1-0x0-1x1-1x1-0-NCHW-FP32-F=miopenConvolutionFwdAlgoImplicitGEMM:ConvMlirIgemmFwd,0.173596,0,miopenConvolutionFwdAlgoImplicitGEMM,<unused>;miopenConvolutionFwdAlgoDirect:ConvAsm1x1U,0.017119,0,miopenConvolutionFwdAlgoDirect,<unused>;miopenConvolutionFwdAlgoWinograd:ConvBinWinogradRxSf2x3g1,0.084159,0,miopenConvolutionFwdAlgoWinograd,<unused>;miopenConvolutionFwdAlgoGEMM:GemmFwd1x1_0_1,0.070878,0,miopenConvolutionFwdAlgoGEMM,<unused>
288-35-35-1x1-64-35-35-1-0x0-1x1-1x1-0-NCHW-FP32-F=miopenConvolutionFwdAlgoImplicitGEMM:ConvMlirIgemmFwd,0.168957,0,miopenConvolutionFwdAlgoImplicitGEMM,<unused>;miopenConvolutionFwdAlgoDirect:ConvAsm1x1U,0.02208,0,miopenConvolutionFwdAlgoDirect,<unused>;miopenConvolutionFwdAlgoWinograd:ConvBinWinogradRxS,0.084638,0,miopenConvolutionFwdAlgoWinograd,<unused>;miopenConvolutionFwdAlgoGEMM:GemmFwd1x1_0_1,0.074239,0,miopenConvolutionFwdAlgoGEMM,<unused>
288-35-35-3x3-384-17-17-1-0x0-2x2-1x1-0-NCHW-FP32-F=miopenConvolutionFwdAlgoImplicitGEMM:ConvMlirIgemmFwd,1.48109,0,miopenConvolutionFwdAlgoImplicitGEMM,<unused>;miopenConvolutionFwdAlgoDirect:ConvOclDirectFwd,1.2899,0,miopenConvolutionFwdAlgoDirect,<unused>;miopenConvolutionFwdAlgoWinograd:ConvBinWinogradRxSf2x3g1,0.267035,0,miopenConvolutionFwdAlgoWinograd,<unused>;miopenConvolutionFwdAlgoGEMM:GemmFwdRest,0.118079,2996352,miopenConvolutionFwdAlgoGEMM,<unused>
96-35-35-3x3-96-17-17-1-0x0-2x2-1x1-0-NCHW-FP32-F=miopenConvolutionFwdAlgoImplicitGEMM:ConvMlirIgemmFwd,0.51023,0,miopenConvolutionFwdAlgoImplicitGEMM,<unused>;miopenConvolutionFwdAlgoDirect:ConvOclDirectFwd,0.361594,0,miopenConvolutionFwdAlgoDirect,<unused>;miopenConvolutionFwdAlgoWinograd:ConvBinWinogradRxSf2x3g1,0.108958,0,miopenConvolutionFwdAlgoWinograd,<unused>;miopenConvolutionFwdAlgoGEMM:GemmFwdRest,0.053437,998784,miopenConvolutionFwdAlgoGEMM,<unused>
768-17-17-1x1-256-17-17-1-0x0-1x1-1x1-0-NCHW-FP32-F=miopenConvolutionFwdAlgoImplicitGEMM:ConvMlirIgemmFwd,0.42511,0,miopenConvolutionFwdAlgoImplicitGEMM,<unused>;miopenConvolutionFwdAlgoDirect:ConvAsm1x1U,0.042079,0,miopenConvolutionFwdAlgoDirect,<unused>;miopenConvolutionFwdAlgoWinograd:ConvBinWinogradRxSf3x2,0.178556,0,miopenConvolutionFwdAlgoWinograd,<unused>;miopenConvolutionFwdAlgoGEMM:GemmFwd1x1_0_1,0.154556,0,miopenConvolutionFwdAlgoGEMM,<unused>
768-17-17-1x1-192-17-17-1-0x0-1x1-1x1-0-NCHW-FP32-F=miopenConvolutionFwdAlgoImplicitGEMM:ConvMlirIgemmFwd,0.41935,0,miopenConvolutionFwdAlgoImplicitGEMM,<unused>;miopenConvolutionFwdAlgoDirect:ConvAsm1x1U,0.033439,0,miopenConvolutionFwdAlgoDirect,<unused>;miopenConvolutionFwdAlgoWinograd:ConvBinWinogradRxSf3x2,0.177435,0,miopenConvolutionFwdAlgoWinograd,<unused>;miopenConvolutionFwdAlgoGEMM:GemmFwd1x1_0_1,0.151356,0,miopenConvolutionFwdAlgoGEMM,<unused>
128-17-17-1x7-128-17-17-1-0x3-1x1-1x1-0-NCHW-FP32-F=miopenConvolutionFwdAlgoDirect:ConvDirectNaiveConvFwd,0.568147,0,miopenConvolutionFwdAlgoDirect,<unused>;miopenConvolutionFwdAlgoWinograd:ConvBinWinogradRxSf2x3g1,0.128797,0,miopenConvolutionFwdAlgoWinograd,<unused>;miopenConvolutionFwdAlgoGEMM:GemmFwdRest,0.055679,1035776,miopenConvolutionFwdAlgoGEMM,<unused>
128-17-17-7x1-192-17-17-1-3x0-1x1-1x1-0-NCHW-FP32-F=miopenConvolutionFwdAlgoDirect:ConvDirectNaiveConvFwd,0.757902,0,miopenConvolutionFwdAlgoDirect,<unused>;miopenConvolutionFwdAlgoWinograd:ConvBinWinogradRxSf2x3g1,0.106077,0,miopenConvolutionFwdAlgoWinograd,<unused>;miopenConvolutionFwdAlgoGEMM:GemmFwdRest,0.053919,1035776,miopenConvolutionFwdAlgoGEMM,<unused>
128-17-17-7x1-128-17-17-1-3x0-1x1-1x1-0-NCHW-FP32-F=miopenConvolutionFwdAlgoDirect:ConvDirectNaiveConvFwd,0.747502,0,miopenConvolutionFwdAlgoDirect,<unused>;miopenConvolutionFwdAlgoWinograd:ConvBinWinogradRxSf2x3g1,0.104798,0,miopenConvolutionFwdAlgoWinograd,<unused>;miopenConvolutionFwdAlgoGEMM:GemmFwdRest,0.056477,1035776,miopenConvolutionFwdAlgoGEMM,<unused>
128-17-17-1x7-192-17-17-1-0x3-1x1-1x1-0-NCHW-FP32-F=miopenConvolutionFwdAlgoDirect:ConvDirectNaiveConvFwd,0.597426,0,miopenConvolutionFwdAlgoDirect,<unused>;miopenConvolutionFwdAlgoWinograd:ConvBinWinogradRxSf3x2,0.116958,0,miopenConvolutionFwdAlgoWinograd,<unused>;miopenConvolutionFwdAlgoGEMM:GemmFwdRest,0.047678,1035776,miopenConvolutionFwdAlgoGEMM,<unused>
768-17-17-1x1-320-17-17-1-0x0-1x1-1x1-0-NCHW-FP32-F=miopenConvolutionFwdAlgoImplicitGEMM:ConvMlirIgemmFwd,0.427831,0,miopenConvolutionFwdAlgoImplicitGEMM,<unused>;miopenConvolutionFwdAlgoDirect:ConvAsm1x1U,0.047038,0,miopenConvolutionFwdAlgoDirect,<unused>;miopenConvolutionFwdAlgoWinograd:ConvBinWinogradRxSf3x2,0.177436,0,miopenConvolutionFwdAlgoWinograd,<unused>;miopenConvolutionFwdAlgoGEMM:GemmFwd1x1_0_1,0.152317,0,miopenConvolutionFwdAlgoGEMM,<unused>
160-17-17-1x7-160-17-17-1-0x3-1x1-1x1-0-NCHW-FP32-F=miopenConvolutionFwdAlgoDirect:ConvDirectNaiveConvFwd,0.707664,0,miopenConvolutionFwdAlgoDirect,<unused>;miopenConvolutionFwdAlgoWinograd:ConvBinWinogradRxSf3x2,0.139516,0,miopenConvolutionFwdAlgoWinograd,<unused>;miopenConvolutionFwdAlgoGEMM:GemmFwdRest,0.069757,1294720,miopenConvolutionFwdAlgoGEMM,<unused>
160-17-17-7x1-192-17-17-1-3x0-1x1-1x1-0-NCHW-FP32-F=miopenConvolutionFwdAlgoDirect:ConvDirectNaiveConvFwd,0.94366,0,miopenConvolutionFwdAlgoDirect,<unused>;miopenConvolutionFwdAlgoWinograd:ConvBinWinogradRxSf2x3g1,0.123357,0,miopenConvolutionFwdAlgoWinograd,<unused>;miopenConvolutionFwdAlgoGEMM:GemmFwdRest,0.060637,1294720,miopenConvolutionFwdAlgoGEMM,<unused>
160-17-17-7x1-160-17-17-1-3x0-1x1-1x1-0-NCHW-FP32-F=miopenConvolutionFwdAlgoDirect:ConvDirectNaiveConvFwd,0.92062,0,miopenConvolutionFwdAlgoDirect,<unused>;miopenConvolutionFwdAlgoWinograd:ConvBinWinogradRxSf2x3g1,0.127198,0,miopenConvolutionFwdAlgoWinograd,<unused>;miopenConvolutionFwdAlgoGEMM:GemmFwdRest,0.061757,1294720,miopenConvolutionFwdAlgoGEMM,<unused>
160-17-17-1x7-192-17-17-1-0x3-1x1-1x1-0-NCHW-FP32-F=miopenConvolutionFwdAlgoDirect:ConvDirectNaiveConvFwd,0.744143,0,miopenConvolutionFwdAlgoDirect,<unused>;miopenConvolutionFwdAlgoWinograd:ConvBinWinogradRxSf3x2,0.139197,0,miopenConvolutionFwdAlgoWinograd,<unused>;miopenConvolutionFwdAlgoGEMM:GemmFwdRest,0.056477,1294720,miopenConvolutionFwdAlgoGEMM,<unused>
768-17-17-1x1-576-17-17-1-0x0-1x1-1x1-0-NCHW-FP32-F=miopenConvolutionFwdAlgoImplicitGEMM:ConvMlirIgemmFwd,0.423672,0,miopenConvolutionFwdAlgoImplicitGEMM,<unused>;miopenConvolutionFwdAlgoDirect:ConvAsm1x1U,0.075838,0,miopenConvolutionFwdAlgoDirect,<unused>;miopenConvolutionFwdAlgoWinograd:ConvBinWinogradRxSf3x2,0.178556,0,miopenConvolutionFwdAlgoWinograd,<unused>;miopenConvolutionFwdAlgoGEMM:GemmFwd1x1_0_1,0.061279,0,miopenConvolutionFwdAlgoGEMM,<unused>
192-17-17-1x7-192-17-17-1-0x3-1x1-1x1-0-NCHW-FP32-F=miopenConvolutionFwdAlgoDirect:ConvDirectNaiveConvFwd,0.889103,0,miopenConvolutionFwdAlgoDirect,<unused>;miopenConvolutionFwdAlgoWinograd:ConvBinWinogradRxSf3x2,0.162877,0,miopenConvolutionFwdAlgoWinograd,<unused>;miopenConvolutionFwdAlgoGEMM:GemmFwdRest,0.063517,1553664,miopenConvolutionFwdAlgoGEMM,<unused>
192-17-17-7x1-192-17-17-1-3x0-1x1-1x1-0-NCHW-FP32-F=miopenConvolutionFwdAlgoDirect:ConvDirectNaiveConvFwd,1.1309,0,miopenConvolutionFwdAlgoDirect,<unused>;miopenConvolutionFwdAlgoWinograd:ConvBinWinogradRxSf2x3g1,0.138082,0,miopenConvolutionFwdAlgoWinograd,<unused>;miopenConvolutionFwdAlgoGEMM:GemmFwdRest,0.065601,1553664,miopenConvolutionFwdAlgoGEMM,<unused>
768-17-17-1x1-384-17-17-1-0x0-1x1-1x1-0-NCHW-FP32-F=miopenConvolutionFwdAlgoImplicitGEMM:ConvMlirIgemmFwd,0.429433,0,miopenConvolutionFwdAlgoImplicitGEMM,<unused>;miopenConvolutionFwdAlgoDirect:ConvAsm1x1U,0.051199,0,miopenConvolutionFwdAlgoDirect,<unused>;miopenConvolutionFwdAlgoWinograd:ConvBinWinogradRxSf3x2,0.177757,0,miopenConvolutionFwdAlgoWinograd,<unused>;miopenConvolutionFwdAlgoGEMM:GemmFwd1x1_0_1,0.147998,0,miopenConvolutionFwdAlgoGEMM,<unused>
192-17-17-3x3-320-8-8-1-0x0-2x2-1x1-0-NCHW-FP32-F=miopenConvolutionFwdAlgoImplicitGEMM:ConvHipImplicitGemmV4R4Fwd,0.200317,0,miopenConvolutionFwdAlgoImplicitGEMM,<unused>;miopenConvolutionFwdAlgoDirect:ConvOclDirectFwd,0.547512,0,miopenConvolutionFwdAlgoDirect,<unused>;miopenConvolutionFwdAlgoWinograd:ConvBinWinogradRxSf2x3g1,0.189917,0,miopenConvolutionFwdAlgoWinograd,<unused>;miopenConvolutionFwdAlgoGEMM:GemmFwdRest,0.077599,442368,miopenConvolutionFwdAlgoGEMM,<unused>
192-17-17-3x3-192-8-8-1-0x0-2x2-1x1-0-NCHW-FP32-F=miopenConvolutionFwdAlgoImplicitGEMM:ConvHipImplicitGemmV4R4Fwd,0.202563,0,miopenConvolutionFwdAlgoImplicitGEMM,<unused>;miopenConvolutionFwdAlgoDirect:ConvOclDirectFwd,0.555208,0,miopenConvolutionFwdAlgoDirect,<unused>;miopenConvolutionFwdAlgoWinograd:ConvBinWinogradRxSf2x3g1,0.188163,0,miopenConvolutionFwdAlgoWinograd,<unused>;miopenConvolutionFwdAlgoGEMM:GemmFwdRest,0.068001,442368,miopenConvolutionFwdAlgoGEMM,<unused>
1280-8-8-1x1-320-8-8-1-0x0-1x1-1x1-0-NCHW-FP32-F=miopenConvolutionFwdAlgoImplicitGEMM:ConvHipImplicitGemmV4R4Fwd,0.141598,0,miopenConvolutionFwdAlgoImplicitGEMM,<unused>;miopenConvolutionFwdAlgoDirect:ConvAsm1x1U,0.042399,0,miopenConvolutionFwdAlgoDirect,<unused>;miopenConvolutionFwdAlgoWinograd:ConvBinWinogradRxSf3x2,0.271036,0,miopenConvolutionFwdAlgoWinograd,<unused>;miopenConvolutionFwdAlgoGEMM:GemmFwd1x1_0_1,0.04512,0,miopenConvolutionFwdAlgoGEMM,<unused>
1280-8-8-1x1-384-8-8-1-0x0-1x1-1x1-0-NCHW-FP32-F=miopenConvolutionFwdAlgoImplicitGEMM:ConvHipImplicitGemmV4R4Fwd,0.141278,0,miopenConvolutionFwdAlgoImplicitGEMM,<unused>;miopenConvolutionFwdAlgoDirect:ConvAsm1x1U,0.042239,0,miopenConvolutionFwdAlgoDirect,<unused>;miopenConvolutionFwdAlgoWinograd:ConvBinWinogradRxSf3x2,0.271516,0,miopenConvolutionFwdAlgoWinograd,<unused>;miopenConvolutionFwdAlgoGEMM:GemmFwd1x1_0_1,0.04816,0,miopenConvolutionFwdAlgoGEMM,<unused>
384-8-8-1x3-384-8-8-1-0x1-1x1-1x1-0-NCHW-FP32-F=miopenConvolutionFwdAlgoImplicitGEMM:ConvHipImplicitGemmV4R4Fwd,0.152157,0,miopenConvolutionFwdAlgoImplicitGEMM,<unused>;miopenConvolutionFwdAlgoDirect:ConvDirectNaiveConvFwd,0.457112,0,miopenConvolutionFwdAlgoDirect,<unused>;miopenConvolutionFwdAlgoWinograd:ConvBinWinogradRxS,0.103198,0,miopenConvolutionFwdAlgoWinograd,<unused>;miopenConvolutionFwdAlgoGEMM:GemmFwdRest,0.05424,294912,miopenConvolutionFwdAlgoGEMM,<unused>
384-8-8-3x1-384-8-8-1-1x0-1x1-1x1-0-NCHW-FP32-F=miopenConvolutionFwdAlgoImplicitGEMM:ConvHipImplicitGemmV4R4Fwd,0.149438,0,miopenConvolutionFwdAlgoImplicitGEMM,<unused>;miopenConvolutionFwdAlgoDirect:ConvDirectNaiveConvFwd,0.519352,0,miopenConvolutionFwdAlgoDirect,<unused>;miopenConvolutionFwdAlgoWinograd:ConvBinWinogradRxSf2x3g1,0.103678,0,miopenConvolutionFwdAlgoWinograd,<unused>;miopenConvolutionFwdAlgoGEMM:GemmFwdRest,0.053439,294912,miopenConvolutionFwdAlgoGEMM,<unused>
1280-8-8-1x1-448-8-8-1-0x0-1x1-1x1-0-NCHW-FP32-F=miopenConvolutionFwdAlgoImplicitGEMM:ConvHipImplicitGemmV4R4Fwd,0.141757,0,miopenConvolutionFwdAlgoImplicitGEMM,<unused>;miopenConvolutionFwdAlgoDirect:ConvAsm1x1U,0.042079,0,miopenConvolutionFwdAlgoDirect,<unused>;miopenConvolutionFwdAlgoWinograd:ConvBinWinogradRxSf3x2,0.274235,0,miopenConvolutionFwdAlgoWinograd,<unused>;miopenConvolutionFwdAlgoGEMM:GemmFwd1x1_0_1,0.050559,0,miopenConvolutionFwdAlgoGEMM,<unused>
448-8-8-3x3-384-8-8-1-1x1-1x1-1x1-0-NCHW-FP32-F=miopenConvolutionFwdAlgoWinograd:ConvBinWinograd3x3U,0.114077,0,miopenConvolutionFwdAlgoWinograd,<unused>
1280-8-8-1x1-192-8-8-1-0x0-1x1-1x1-0-NCHW-FP32-F=miopenConvolutionFwdAlgoImplicitGEMM:ConvHipImplicitGemmV4R4Fwd,0.141598,0,miopenConvolutionFwdAlgoImplicitGEMM,<unused>;miopenConvolutionFwdAlgoDirect:ConvAsm1x1U,0.044319,0,miopenConvolutionFwdAlgoDirect,<unused>;miopenConvolutionFwdAlgoWinograd:ConvBinWinogradRxSf3x2,0.271996,0,miopenConvolutionFwdAlgoWinograd,<unused>;miopenConvolutionFwdAlgoGEMM:GemmFwd1x1_0_1,0.042079,0,miopenConvolutionFwdAlgoGEMM,<unused>
2048-8-8-1x1-320-8-8-1-0x0-1x1-1x1-0-NCHW-FP32-F=miopenConvolutionFwdAlgoImplicitGEMM:ConvHipImplicitGemmV4R4Fwd,0.220957,0,miopenConvolutionFwdAlgoImplicitGEMM,<unused>;miopenConvolutionFwdAlgoDirect:ConvAsm1x1U,0.061439,0,miopenConvolutionFwdAlgoDirect,<unused>;miopenConvolutionFwdAlgoWinograd:ConvBinWinogradRxSf3x2,0.420634,0,miopenConvolutionFwdAlgoWinograd,<unused>;miopenConvolutionFwdAlgoGEMM:GemmFwd1x1_0_1,0.084479,0,miopenConvolutionFwdAlgoGEMM,<unused>
2048-8-8-1x1-384-8-8-1-0x0-1x1-1x1-0-NCHW-FP32-F=miopenConvolutionFwdAlgoImplicitGEMM:ConvHipImplicitGemmV4R4Fwd,0.219837,0,miopenConvolutionFwdAlgoImplicitGEMM,<unused>;miopenConvolutionFwdAlgoDirect:ConvAsm1x1U,0.067199,0,miopenConvolutionFwdAlgoDirect,<unused>;miopenConvolutionFwdAlgoWinograd:ConvBinWinogradRxSf3x2,0.420474,0,miopenConvolutionFwdAlgoWinograd,<unused>;miopenConvolutionFwdAlgoGEMM:GemmFwd1x1_0_1,0.091199,0,miopenConvolutionFwdAlgoGEMM,<unused>
2048-8-8-1x1-448-8-8-1-0x0-1x1-1x1-0-NCHW-FP32-F=miopenConvolutionFwdAlgoImplicitGEMM:ConvHipImplicitGemmV4R4Fwd,0.220956,0,miopenConvolutionFwdAlgoImplicitGEMM,<unused>;miopenConvolutionFwdAlgoDirect:ConvAsm1x1U,0.068799,0,miopenConvolutionFwdAlgoDirect,<unused>;miopenConvolutionFwdAlgoWinograd:ConvBinWinogradRxSf3x2,0.420954,0,miopenConvolutionFwdAlgoWinograd,<unused>;miopenConvolutionFwdAlgoGEMM:GemmFwd1x1_0_1,0.095678,0,miopenConvolutionFwdAlgoGEMM,<unused>
2048-8-8-1x1-192-8-8-1-0x0-1x1-1x1-0-NCHW-FP32-F=miopenConvolutionFwdAlgoImplicitGEMM:ConvHipImplicitGemmV4R4Fwd,0.219517,0,miopenConvolutionFwdAlgoImplicitGEMM,<unused>;miopenConvolutionFwdAlgoDirect:ConvAsm1x1U,0.059999,0,miopenConvolutionFwdAlgoDirect,<unused>;miopenConvolutionFwdAlgoWinograd:ConvBinWinogradRxSf3x2,0.433753,0,miopenConvolutionFwdAlgoWinograd,<unused>;miopenConvolutionFwdAlgoGEMM:GemmFwd1x1_0_1,0.067999,0,miopenConvolutionFwdAlgoGEMM,<unused>
64-56-56-1x1-128-56-56-1-0x0-1x1-1x1-0-NCHW-FP32-F=miopenConvolutionFwdAlgoImplicitGEMM:ConvHipImplicitGemmV4R4Fwd,0.019519,0,miopenConvolutionFwdAlgoImplicitGEMM,<unused>;miopenConvolutionFwdAlgoDirect:ConvAsm1x1U,0.017279,0,miopenConvolutionFwdAlgoDirect,<unused>;miopenConvolutionFwdAlgoWinograd:ConvBinWinogradRxSf3x2,0.049758,0,miopenConvolutionFwdAlgoWinograd,<unused>;miopenConvolutionFwdAlgoGEMM:GemmFwd1x1_0_1,0.027039,0,miopenConvolutionFwdAlgoGEMM,<unused>
128-56-56-3x3-32-56-56-1-1x1-1x1-1x1-0-NCHW-FP32-F=miopenConvolutionFwdAlgoWinograd:ConvBinWinograd3x3U,0.051838,0,miopenConvolutionFwdAlgoWinograd,<unused>
96-56-56-1x1-128-56-56-1-0x0-1x1-1x1-0-NCHW-FP32-F=miopenConvolutionFwdAlgoImplicitGEMM:ConvHipImplicitGemmV4R4Fwd,0.026079,0,miopenConvolutionFwdAlgoImplicitGEMM,<unused>;miopenConvolutionFwdAlgoDirect:ConvAsm1x1U,0.02064,0,miopenConvolutionFwdAlgoDirect,<unused>;miopenConvolutionFwdAlgoWinograd:ConvBinWinogradRxSf3x2,0.055679,0,miopenConvolutionFwdAlgoWinograd,<unused>;miopenConvolutionFwdAlgoGEMM:GemmFwd1x1_0_1,0.03072,0,miopenConvolutionFwdAlgoGEMM,<unused>
128-56-56-1x1-128-56-56-1-0x0-1x1-1x1-0-NCHW-FP32-F=miopenConvolutionFwdAlgoImplicitGEMM:ConvHipImplicitGemmV4R4Fwd,0.029919,0,miopenConvolutionFwdAlgoImplicitGEMM,<unused>;miopenConvolutionFwdAlgoDirect:ConvAsm1x1U,0.024319,0,miopenConvolutionFwdAlgoDirect,<unused>;miopenConvolutionFwdAlgoWinograd:ConvBinWinogradRxSf3x2,0.063677,0,miopenConvolutionFwdAlgoWinograd,<unused>;miopenConvolutionFwdAlgoGEMM:GemmFwd1x1_0_1,0.029119,0,miopenConvolutionFwdAlgoGEMM,<unused>
