dockerfiles/miopen-rocm42/gfx906_60.HIP.2_11_0_.ufdb.txt
3-224-224-7x7-64-112-112-64-3x3-2x2-1x1-0-NCHW-FP32-F=miopenConvolutionFwdAlgoDirect:ConvAsm7x7c3h224w224k64u2v2p3q3f1,1.7998,0,miopenConvolutionFwdAlgoDirect,<unused>;miopenConvolutionFwdAlgoGEMM:gemm,4.76141,7375872,rocBlas,<unused>;miopenConvolutionFwdAlgoWinograd:ConvBinWinogradRxS,2.48986,0,miopenConvolutionFwdAlgoWinograd,<unused>
64-56-56-1x1-64-56-56-64-0x0-1x1-1x1-0-NCHW-FP32-F=miopenConvolutionFwdAlgoImplicitGEMM:ConvHipImplicitGemmV4R1Fwd,0.255513,0,miopenConvolutionFwdAlgoImplicitGEMM,<unused>;miopenConvolutionFwdAlgoDirect:ConvOclDirectFwd1x1,0.197916,0,miopenConvolutionFwdAlgoDirect,<unused>;miopenConvolutionFwdAlgoGEMM:gemm,0.207515,0,rocBlas,<unused>;miopenConvolutionFwdAlgoWinograd:ConvBinWinogradRxSf3x2,0.471988,0,miopenConvolutionFwdAlgoWinograd,<unused>
64-56-56-3x3-64-56-56-64-1x1-1x1-1x1-0-NCHW-FP32-F=miopenConvolutionFwdAlgoWinograd:ConvBinWinograd3x3U,0.79822,0,miopenConvolutionFwdAlgoWinograd,<unused>
128-56-56-1x1-256-56-56-64-0x0-1x1-1x1-0-NCHW-FP32-F=miopenConvolutionFwdAlgoImplicitGEMM:ConvHipImplicitGemmV4R1Fwd,1.59388,0,miopenConvolutionFwdAlgoImplicitGEMM,<unused>;miopenConvolutionFwdAlgoDirect:ConvAsm1x1U,1.45116,0,miopenConvolutionFwdAlgoDirect,<unused>;miopenConvolutionFwdAlgoGEMM:gemm,1.25325,0,rocBlas,<unused>;miopenConvolutionFwdAlgoWinograd:ConvBinWinogradRxSf3x2,2.99353,0,miopenConvolutionFwdAlgoWinograd,<unused>
256-56-56-1x1-64-56-56-64-0x0-1x1-1x1-0-NCHW-FP32-F=miopenConvolutionFwdAlgoImplicitGEMM:ConvHipImplicitGemmV4R1Fwd,0.676304,0,miopenConvolutionFwdAlgoImplicitGEMM,<unused>;miopenConvolutionFwdAlgoDirect:ConvOclDirectFwd1x1,0.722062,0,miopenConvolutionFwdAlgoDirect,<unused>;miopenConvolutionFwdAlgoGEMM:gemm,0.696942,0,rocBlas,<unused>;miopenConvolutionFwdAlgoWinograd:ConvBinWinogradRxSf3x2,1.47436,0,miopenConvolutionFwdAlgoWinograd,<unused>
64-56-56-1x1-256-56-56-64-0x0-1x1-1x1-0-NCHW-FP32-F=miopenConvolutionFwdAlgoImplicitGEMM:ConvHipImplicitGemmV4R1Fwd,0.772621,0,miopenConvolutionFwdAlgoImplicitGEMM,<unused>;miopenConvolutionFwdAlgoDirect:ConvOclDirectFwd1x1,0.714063,0,miopenConvolutionFwdAlgoDirect,<unused>;miopenConvolutionFwdAlgoGEMM:gemm,0.686383,0,rocBlas,<unused>;miopenConvolutionFwdAlgoWinograd:ConvBinWinogradRxSf3x2,1.72332,0,miopenConvolutionFwdAlgoWinograd,<unused>
256-56-56-1x1-128-56-56-64-0x0-1x1-1x1-0-NCHW-FP32-F=miopenConvolutionFwdAlgoImplicitGEMM:ConvHipImplicitGemmV4R1Fwd,1.37792,0,miopenConvolutionFwdAlgoImplicitGEMM,<unused>;miopenConvolutionFwdAlgoDirect:ConvOclDirectFwd1x1,1.46352,0,miopenConvolutionFwdAlgoDirect,<unused>;miopenConvolutionFwdAlgoGEMM:gemm,1.3368,0,rocBlas,<unused>;miopenConvolutionFwdAlgoWinograd:ConvBinWinogradRxSf3x2,2.83072,0,miopenConvolutionFwdAlgoWinograd,<unused>
128-56-56-3x3-128-28-28-64-1x1-2x2-1x1-0-NCHW-FP32-F=miopenConvolutionFwdAlgoImplicitGEMM:ConvHipImplicitGemmV4R1Fwd,1.62912,0,miopenConvolutionFwdAlgoImplicitGEMM,<unused>;miopenConvolutionFwdAlgoDirect:ConvOclDirectFwd,23.7161,0,miopenConvolutionFwdAlgoDirect,<unused>;miopenConvolutionFwdAlgoGEMM:gemm,6.54336,3612672,rocBlas,<unused>;miopenConvolutionFwdAlgoWinograd:ConvBinWinogradRxSf2x3g1,2.94096,0,miopenConvolutionFwdAlgoWinograd,<unused>
384-28-28-1x1-512-28-28-64-0x0-1x1-1x1-0-NCHW-FP32-F=miopenConvolutionFwdAlgoImplicitGEMM:ConvHipImplicitGemmV4R1Fwd,2.07147,0,miopenConvolutionFwdAlgoImplicitGEMM,<unused>;miopenConvolutionFwdAlgoDirect:ConvAsm1x1U,2.33627,0,miopenConvolutionFwdAlgoDirect,<unused>;miopenConvolutionFwdAlgoGEMM:gemm,2.48186,0,rocBlas,<unused>;miopenConvolutionFwdAlgoWinograd:ConvBinWinogradRxSf3x2,4.40326,0,miopenConvolutionFwdAlgoWinograd,<unused>
512-28-28-1x1-128-28-28-64-0x0-1x1-1x1-0-NCHW-FP32-F=miopenConvolutionFwdAlgoImplicitGEMM:ConvHipImplicitGemmV4R1Fwd,0.710864,0,miopenConvolutionFwdAlgoImplicitGEMM,<unused>;miopenConvolutionFwdAlgoDirect:ConvOclDirectFwd1x1,0.796621,0,miopenConvolutionFwdAlgoDirect,<unused>;miopenConvolutionFwdAlgoGEMM:gemm,0.746862,0,rocBlas,<unused>;miopenConvolutionFwdAlgoWinograd:ConvBinWinogradRxSf3x2,1.57228,0,miopenConvolutionFwdAlgoWinograd,<unused>
128-28-28-3x3-128-28-28-64-1x1-1x1-1x1-0-NCHW-FP32-F=miopenConvolutionFwdAlgoWinograd:ConvBinWinograd3x3U,0.753582,0,miopenConvolutionFwdAlgoWinograd,<unused>
128-28-28-1x1-512-28-28-64-0x0-1x1-1x1-0-NCHW-FP32-F=miopenConvolutionFwdAlgoImplicitGEMM:ConvHipImplicitGemmV4R1Fwd,0.724143,0,miopenConvolutionFwdAlgoImplicitGEMM,<unused>;miopenConvolutionFwdAlgoDirect:ConvAsm1x1U,0.751983,0,miopenConvolutionFwdAlgoDirect,<unused>;miopenConvolutionFwdAlgoGEMM:gemm,0.683024,0,rocBlas,<unused>;miopenConvolutionFwdAlgoWinograd:ConvBinWinogradRxSf3x2,1.70748,0,miopenConvolutionFwdAlgoWinograd,<unused>
512-28-28-1x1-256-28-28-64-0x0-1x1-1x1-0-NCHW-FP32-F=miopenConvolutionFwdAlgoImplicitGEMM:ConvHipImplicitGemmV4R1Fwd,1.36736,0,miopenConvolutionFwdAlgoImplicitGEMM,<unused>;miopenConvolutionFwdAlgoDirect:ConvAsm1x1U,1.5912,0,miopenConvolutionFwdAlgoDirect,<unused>;miopenConvolutionFwdAlgoGEMM:gemm,1.4208,0,rocBlas,<unused>;miopenConvolutionFwdAlgoWinograd:ConvBinWinogradRxSf3x2,3.02,0,miopenConvolutionFwdAlgoWinograd,<unused>
256-28-28-3x3-256-14-14-64-1x1-2x2-1x1-0-NCHW-FP32-F=miopenConvolutionFwdAlgoImplicitGEMM:ConvHipImplicitGemmV4R1Fwd,1.78768,0,miopenConvolutionFwdAlgoImplicitGEMM,<unused>;miopenConvolutionFwdAlgoDirect:ConvOclDirectFwd,22.6888,0,miopenConvolutionFwdAlgoDirect,<unused>;miopenConvolutionFwdAlgoGEMM:gemm,7.46496,1806336,rocBlas,<unused>;miopenConvolutionFwdAlgoWinograd:ConvBinWinogradRxSf2x3g1,3.00576,0,miopenConvolutionFwdAlgoWinograd,<unused>
768-14-14-1x1-1024-14-14-64-0x0-1x1-1x1-0-NCHW-FP32-F=miopenConvolutionFwdAlgoImplicitGEMM:ConvHipImplicitGemmV4R1Fwd,2.06364,0,miopenConvolutionFwdAlgoImplicitGEMM,<unused>;miopenConvolutionFwdAlgoDirect:ConvAsm1x1U,2.88778,0,miopenConvolutionFwdAlgoDirect,<unused>;miopenConvolutionFwdAlgoGEMM:gemm,2.9553,0,rocBlas,<unused>;miopenConvolutionFwdAlgoWinograd:ConvBinWinogradRxSf3x2,4.3383,0,miopenConvolutionFwdAlgoWinograd,<unused>
1024-14-14-1x1-256-14-14-64-0x0-1x1-1x1-0-NCHW-FP32-F=miopenConvolutionFwdAlgoImplicitGEMM:ConvHipImplicitGemmV4R1Fwd,0.731024,0,miopenConvolutionFwdAlgoImplicitGEMM,<unused>;miopenConvolutionFwdAlgoDirect:ConvAsm1x1U,1.02078,0,miopenConvolutionFwdAlgoDirect,<unused>;miopenConvolutionFwdAlgoGEMM:gemm,0.970058,0,rocBlas,<unused>;miopenConvolutionFwdAlgoWinograd:ConvBinWinogradRxSf3x2,1.54717,0,miopenConvolutionFwdAlgoWinograd,<unused>
256-14-14-3x3-256-14-14-64-1x1-1x1-1x1-0-NCHW-FP32-F=miopenConvolutionFwdAlgoWinograd:ConvBinWinogradRxSf2x3g1,0.751344,0,miopenConvolutionFwdAlgoWinograd,<unused>
256-14-14-1x1-1024-14-14-64-0x0-1x1-1x1-0-NCHW-FP32-F=miopenConvolutionFwdAlgoImplicitGEMM:ConvHipImplicitGemmV4R1Fwd,0.667666,0,miopenConvolutionFwdAlgoImplicitGEMM,<unused>;miopenConvolutionFwdAlgoDirect:ConvAsm1x1U,1.00798,0,miopenConvolutionFwdAlgoDirect,<unused>;miopenConvolutionFwdAlgoGEMM:gemm,0.9187,0,rocBlas,<unused>;miopenConvolutionFwdAlgoWinograd:ConvBinWinogradRxSf3x2,1.58844,0,miopenConvolutionFwdAlgoWinograd,<unused>
1024-14-14-1x1-512-14-14-64-0x0-1x1-1x1-0-NCHW-FP32-F=miopenConvolutionFwdAlgoImplicitGEMM:ConvHipImplicitGemmV4R1Fwd,1.47056,0,miopenConvolutionFwdAlgoImplicitGEMM,<unused>;miopenConvolutionFwdAlgoDirect:ConvAsm1x1U,2.15664,0,miopenConvolutionFwdAlgoDirect,<unused>;miopenConvolutionFwdAlgoGEMM:gemm,2.5384,0,rocBlas,<unused>;miopenConvolutionFwdAlgoWinograd:ConvBinWinogradRxSf3x2,3.06096,0,miopenConvolutionFwdAlgoWinograd,<unused>
512-14-14-3x3-512-7-7-64-1x1-2x2-1x1-0-NCHW-FP32-F=miopenConvolutionFwdAlgoImplicitGEMM:ConvHipImplicitGemmV4R1Fwd,2.02928,0,miopenConvolutionFwdAlgoImplicitGEMM,<unused>;miopenConvolutionFwdAlgoDirect:ConvOclDirectFwd,23.2995,0,miopenConvolutionFwdAlgoDirect,<unused>;miopenConvolutionFwdAlgoGEMM:gemm,23.726,903168,rocBlas,<unused>;miopenConvolutionFwdAlgoWinograd:ConvBinWinogradRxSf2x3g1,3.86015,0,miopenConvolutionFwdAlgoWinograd,<unused>
1536-7-7-1x1-2048-7-7-64-0x0-1x1-1x1-0-NCHW-FP32-F=miopenConvolutionFwdAlgoImplicitGEMM:ConvHipImplicitGemmV4R1Fwd,2.23787,0,miopenConvolutionFwdAlgoImplicitGEMM,<unused>;miopenConvolutionFwdAlgoDirect:ConvAsm1x1U,3.36617,0,miopenConvolutionFwdAlgoDirect,<unused>;miopenConvolutionFwdAlgoGEMM:gemm,4.03959,0,rocBlas,<unused>;miopenConvolutionFwdAlgoWinograd:ConvBinWinogradRxSf3x2,5.59332,0,miopenConvolutionFwdAlgoWinograd,<unused>
2048-7-7-1x1-512-7-7-64-0x0-1x1-1x1-0-NCHW-FP32-F=miopenConvolutionFwdAlgoImplicitGEMM:ConvHipImplicitGemmV4R1Fwd,0.896461,0,miopenConvolutionFwdAlgoImplicitGEMM,<unused>;miopenConvolutionFwdAlgoDirect:ConvOclDirectFwd1x1,1.19677,0,miopenConvolutionFwdAlgoDirect,<unused>;miopenConvolutionFwdAlgoGEMM:gemm,2.33083,0,rocBlas,<unused>;miopenConvolutionFwdAlgoWinograd:ConvBinWinogradRxSf3x2,2.16539,0,miopenConvolutionFwdAlgoWinograd,<unused>
512-7-7-3x3-512-7-7-64-1x1-1x1-1x1-0-NCHW-FP32-F=miopenConvolutionFwdAlgoWinograd:ConvBinWinogradRxSf2x3g1,0.94686,0,miopenConvolutionFwdAlgoWinograd,<unused>
512-7-7-1x1-2048-7-7-64-0x0-1x1-1x1-0-NCHW-FP32-F=miopenConvolutionFwdAlgoImplicitGEMM:ConvHipImplicitGemmV4R1Fwd,0.795343,0,miopenConvolutionFwdAlgoImplicitGEMM,<unused>;miopenConvolutionFwdAlgoDirect:ConvAsm1x1U,1.10798,0,miopenConvolutionFwdAlgoDirect,<unused>;miopenConvolutionFwdAlgoGEMM:gemm,1.37117,0,rocBlas,<unused>;miopenConvolutionFwdAlgoWinograd:ConvBinWinogradRxSf3x2,2.23099,0,miopenConvolutionFwdAlgoWinograd,<unused>
3-224-224-7x7-64-112-112-64-3x3-2x2-1x1-0-NCHW-FP16-F=miopenConvolutionFwdAlgoDirect:ConvOclDirectFwdGen,3.09061,0,miopenConvolutionFwdAlgoDirect,<unused>;miopenConvolutionFwdAlgoGEMM:gemm,6.57414,3687936,rocBlas,<unused>;miopenConvolutionFwdAlgoWinograd:ConvBinWinogradRxSf2x3g1,2.49412,0,miopenConvolutionFwdAlgoWinograd,<unused>
64-56-56-1x1-64-56-56-64-0x0-1x1-1x1-0-NCHW-FP16-F=miopenConvolutionFwdAlgoImplicitGEMM:ConvHipImplicitGemmV4R1Fwd,0.201283,0,miopenConvolutionFwdAlgoImplicitGEMM,<unused>;miopenConvolutionFwdAlgoDirect:ConvAsm1x1U,0.143362,0,miopenConvolutionFwdAlgoDirect,<unused>;miopenConvolutionFwdAlgoGEMM:gemm,0.125922,0,rocBlas,<unused>;miopenConvolutionFwdAlgoWinograd:ConvBinWinogradRxS,0.519049,0,miopenConvolutionFwdAlgoWinograd,<unused>
64-56-56-3x3-64-56-56-64-1x1-1x1-1x1-0-NCHW-FP16-F=miopenConvolutionFwdAlgoImplicitGEMM:ConvHipImplicitGemmV4R1Fwd,1.13538,0,miopenConvolutionFwdAlgoImplicitGEMM,<unused>;miopenConvolutionFwdAlgoDirect:ConvOclDirectFwd,2.43988,0,miopenConvolutionFwdAlgoDirect,<unused>;miopenConvolutionFwdAlgoGEMM:gemm,7.13734,3612672,rocBlas,<unused>;miopenConvolutionFwdAlgoWinograd:ConvBinWinogradRxS,0.518088,0,miopenConvolutionFwdAlgoWinograd,<unused>
128-56-56-1x1-256-56-56-64-0x0-1x1-1x1-0-NCHW-FP16-F=miopenConvolutionFwdAlgoImplicitGEMM:ConvHipImplicitGemmV4R1Fwd,1.28674,0,miopenConvolutionFwdAlgoImplicitGEMM,<unused>;miopenConvolutionFwdAlgoDirect:ConvAsm1x1U,1.42434,0,miopenConvolutionFwdAlgoDirect,<unused>;miopenConvolutionFwdAlgoGEMM:gemm,0.777292,0,rocBlas,<unused>;miopenConvolutionFwdAlgoWinograd:ConvBinWinogradRxSf2x3g1,3.53637,0,miopenConvolutionFwdAlgoWinograd,<unused>
256-56-56-1x1-64-56-56-64-0x0-1x1-1x1-0-NCHW-FP16-F=miopenConvolutionFwdAlgoImplicitGEMM:ConvHipImplicitGemmV4R1Fwd,0.807372,0,miopenConvolutionFwdAlgoImplicitGEMM,<unused>;miopenConvolutionFwdAlgoDirect:ConvAsm1x1U,0.490408,0,miopenConvolutionFwdAlgoDirect,<unused>;miopenConvolutionFwdAlgoGEMM:gemm,0.380486,0,rocBlas,<unused>;miopenConvolutionFwdAlgoWinograd:ConvBinWinogradRxSf2x3g1,1.70243,0,miopenConvolutionFwdAlgoWinograd,<unused>
64-56-56-1x1-256-56-56-64-0x0-1x1-1x1-0-NCHW-FP16-F=miopenConvolutionFwdAlgoImplicitGEMM:ConvHipImplicitGemmV4R1Fwd,0.70129,0,miopenConvolutionFwdAlgoImplicitGEMM,<unused>;miopenConvolutionFwdAlgoDirect:ConvAsm1x1U,0.474247,0,miopenConvolutionFwdAlgoDirect,<unused>;miopenConvolutionFwdAlgoGEMM:gemm,0.418726,0,rocBlas,<unused>;miopenConvolutionFwdAlgoWinograd:ConvBinWinogradRxS,1.94851,0,miopenConvolutionFwdAlgoWinograd,<unused>
256-56-56-1x1-128-56-56-64-0x0-1x1-1x1-0-NCHW-FP16-F=miopenConvolutionFwdAlgoImplicitGEMM:ConvHipImplicitGemmV4R1Fwd,1.03633,0,miopenConvolutionFwdAlgoImplicitGEMM,<unused>;miopenConvolutionFwdAlgoDirect:ConvAsm1x1U,0.903853,0,miopenConvolutionFwdAlgoDirect,<unused>;miopenConvolutionFwdAlgoGEMM:gemm,0.70961,0,rocBlas,<unused>;miopenConvolutionFwdAlgoWinograd:ConvBinWinogradRxSf2x3g1,3.32677,0,miopenConvolutionFwdAlgoWinograd,<unused>
128-56-56-3x3-128-28-28-64-1x1-2x2-1x1-0-NCHW-FP16-F=miopenConvolutionFwdAlgoImplicitGEMM:ConvHipImplicitGemmV4R1Fwd,1.02001,0,miopenConvolutionFwdAlgoImplicitGEMM,<unused>;miopenConvolutionFwdAlgoDirect:ConvOclDirectFwdGen,5.45912,0,miopenConvolutionFwdAlgoDirect,<unused>;miopenConvolutionFwdAlgoGEMM:gemm,5.83686,1806336,rocBlas,<unused>;miopenConvolutionFwdAlgoWinograd:ConvBinWinogradRxS,1.99715,0,miopenConvolutionFwdAlgoWinograd,<unused>
384-28-28-1x1-512-28-28-64-0x0-1x1-1x1-0-NCHW-FP16-F=miopenConvolutionFwdAlgoImplicitGEMM:ConvHipImplicitGemmV4R1Fwd,1.45777,0,miopenConvolutionFwdAlgoImplicitGEMM,<unused>;miopenConvolutionFwdAlgoDirect:ConvAsm1x1U,1.56913,0,miopenConvolutionFwdAlgoDirect,<unused>;miopenConvolutionFwdAlgoGEMM:gemm,1.88563,0,rocBlas,<unused>;miopenConvolutionFwdAlgoWinograd:ConvBinWinogradRxS,4.66679,0,miopenConvolutionFwdAlgoWinograd,<unused>
512-28-28-1x1-128-28-28-64-0x0-1x1-1x1-0-NCHW-FP16-F=miopenConvolutionFwdAlgoImplicitGEMM:ConvHipImplicitGemmV4R1Fwd,0.533925,0,miopenConvolutionFwdAlgoImplicitGEMM,<unused>;miopenConvolutionFwdAlgoDirect:ConvAsm1x1U,0.576325,0,miopenConvolutionFwdAlgoDirect,<unused>;miopenConvolutionFwdAlgoGEMM:gemm,0.451684,0,rocBlas,<unused>;miopenConvolutionFwdAlgoWinograd:ConvBinWinogradRxS,1.84594,0,miopenConvolutionFwdAlgoWinograd,<unused>
128-28-28-3x3-128-28-28-64-1x1-1x1-1x1-0-NCHW-FP16-F=miopenConvolutionFwdAlgoImplicitGEMM:ConvHipImplicitGemmV4R1Fwd,1.04721,0,miopenConvolutionFwdAlgoImplicitGEMM,<unused>;miopenConvolutionFwdAlgoDirect:ConvOclDirectFwd,2.15154,0,miopenConvolutionFwdAlgoDirect,<unused>;miopenConvolutionFwdAlgoGEMM:gemm,5.85734,1806336,rocBlas,<unused>;miopenConvolutionFwdAlgoWinograd:ConvBinWinogradRxSf2x3g1,0.480644,0,miopenConvolutionFwdAlgoWinograd,<unused>
128-28-28-1x1-512-28-28-64-0x0-1x1-1x1-0-NCHW-FP16-F=miopenConvolutionFwdAlgoImplicitGEMM:ConvHipImplicitGemmV4R1Fwd,0.584645,0,miopenConvolutionFwdAlgoImplicitGEMM,<unused>;miopenConvolutionFwdAlgoDirect:ConvAsm1x1U,0.519684,0,miopenConvolutionFwdAlgoDirect,<unused>;miopenConvolutionFwdAlgoGEMM:gemm,0.407843,0,rocBlas,<unused>;miopenConvolutionFwdAlgoWinograd:ConvBinWinogradRxS,1.86065,0,miopenConvolutionFwdAlgoWinograd,<unused>
512-28-28-1x1-256-28-28-64-0x0-1x1-1x1-0-NCHW-FP16-F=miopenConvolutionFwdAlgoImplicitGEMM:ConvHipImplicitGemmV4R1Fwd,1.00897,0,miopenConvolutionFwdAlgoImplicitGEMM,<unused>;miopenConvolutionFwdAlgoDirect:ConvAsm1x1U,1.17361,0,miopenConvolutionFwdAlgoDirect,<unused>;miopenConvolutionFwdAlgoGEMM:gemm,0.812966,0,rocBlas,<unused>;miopenConvolutionFwdAlgoWinograd:ConvBinWinogradRxS,3.51651,0,miopenConvolutionFwdAlgoWinograd,<unused>
256-28-28-3x3-256-14-14-64-1x1-2x2-1x1-0-NCHW-FP16-F=miopenConvolutionFwdAlgoImplicitGEMM:ConvHipImplicitGemmV4R1Fwd,1.16113,0,miopenConvolutionFwdAlgoImplicitGEMM,<unused>;miopenConvolutionFwdAlgoDirect:ConvOclDirectFwdGen,7.0367,0,miopenConvolutionFwdAlgoDirect,<unused>;miopenConvolutionFwdAlgoGEMM:gemm,11.602,903168,rocBlas,<unused>;miopenConvolutionFwdAlgoWinograd:ConvBinWinogradRxSf2x3g1,2.35426,0,miopenConvolutionFwdAlgoWinograd,<unused>
768-14-14-1x1-1024-14-14-64-0x0-1x1-1x1-0-NCHW-FP16-F=miopenConvolutionFwdAlgoImplicitGEMM:ConvHipImplicitGemmV4R1Fwd,1.48865,0,miopenConvolutionFwdAlgoImplicitGEMM,<unused>;miopenConvolutionFwdAlgoDirect:ConvAsm1x1U,1.75153,0,miopenConvolutionFwdAlgoDirect,<unused>;miopenConvolutionFwdAlgoGEMM:gemm,2.74802,0,rocBlas,<unused>;miopenConvolutionFwdAlgoWinograd:ConvBinWinogradRxS,5.27268,0,miopenConvolutionFwdAlgoWinograd,<unused>
1024-14-14-1x1-256-14-14-64-0x0-1x1-1x1-0-NCHW-FP16-F=miopenConvolutionFwdAlgoImplicitGEMM:ConvHipImplicitGemmV4R1Fwd,0.659683,0,miopenConvolutionFwdAlgoImplicitGEMM,<unused>;miopenConvolutionFwdAlgoDirect:ConvAsm1x1U,0.657603,0,miopenConvolutionFwdAlgoDirect,<unused>;miopenConvolutionFwdAlgoGEMM:gemm,0.619043,0,rocBlas,<unused>;miopenConvolutionFwdAlgoWinograd:ConvBinWinogradRxSf2x3g1,2.15217,0,miopenConvolutionFwdAlgoWinograd,<unused>
256-14-14-3x3-256-14-14-64-1x1-1x1-1x1-0-NCHW-FP16-F=miopenConvolutionFwdAlgoImplicitGEMM:ConvHipImplicitGemmV4R1Fwd,1.14641,0,miopenConvolutionFwdAlgoImplicitGEMM,<unused>;miopenConvolutionFwdAlgoDirect:ConvOclDirectFwd,5.17299,0,miopenConvolutionFwdAlgoDirect,<unused>;miopenConvolutionFwdAlgoGEMM:gemm,10.5473,903168,rocBlas,<unused>;miopenConvolutionFwdAlgoWinograd:ConvBinWinogradRxSf2x3g1,0.467843,0,miopenConvolutionFwdAlgoWinograd,<unused>
256-14-14-1x1-1024-14-14-64-0x0-1x1-1x1-0-NCHW-FP16-F=miopenConvolutionFwdAlgoImplicitGEMM:ConvHipImplicitGemmV4R1Fwd,0.619523,0,miopenConvolutionFwdAlgoImplicitGEMM,<unused>;miopenConvolutionFwdAlgoDirect:ConvAsm1x1U,0.563043,0,miopenConvolutionFwdAlgoDirect,<unused>;miopenConvolutionFwdAlgoGEMM:gemm,0.470242,0,rocBlas,<unused>;miopenConvolutionFwdAlgoWinograd:ConvBinWinogradRxS,2.06721,0,miopenConvolutionFwdAlgoWinograd,<unused>
1024-14-14-1x1-512-14-14-64-0x0-1x1-1x1-0-NCHW-FP16-F=miopenConvolutionFwdAlgoImplicitGEMM:ConvHipImplicitGemmV4R1Fwd,1.10193,0,miopenConvolutionFwdAlgoImplicitGEMM,<unused>;miopenConvolutionFwdAlgoDirect:ConvAsm1x1U,1.30593,0,miopenConvolutionFwdAlgoDirect,<unused>;miopenConvolutionFwdAlgoGEMM:gemm,1.09905,0,rocBlas,<unused>;miopenConvolutionFwdAlgoWinograd:ConvBinWinogradRxS,3.95682,0,miopenConvolutionFwdAlgoWinograd,<unused>
512-14-14-3x3-512-7-7-64-1x1-2x2-1x1-0-NCHW-FP16-F=miopenConvolutionFwdAlgoImplicitGEMM:ConvHipImplicitGemmV4R1Fwd,1.31729,0,miopenConvolutionFwdAlgoImplicitGEMM,<unused>;miopenConvolutionFwdAlgoDirect:ConvOclDirectFwdGen,12.7642,0,miopenConvolutionFwdAlgoDirect,<unused>;miopenConvolutionFwdAlgoGEMM:gemm,43.7864,451584,rocBlas,<unused>;miopenConvolutionFwdAlgoWinograd:ConvBinWinogradRxSf2x3g1,3.34946,0,miopenConvolutionFwdAlgoWinograd,<unused>
1536-7-7-1x1-2048-7-7-64-0x0-1x1-1x1-0-NCHW-FP16-F=miopenConvolutionFwdAlgoImplicitGEMM:ConvHipImplicitGemmV4R1Fwd,2.17889,0,miopenConvolutionFwdAlgoImplicitGEMM,<unused>;miopenConvolutionFwdAlgoDirect:ConvAsm1x1U,2.34481,0,miopenConvolutionFwdAlgoDirect,<unused>;miopenConvolutionFwdAlgoGEMM:gemm,4.89427,0,rocBlas,<unused>;miopenConvolutionFwdAlgoWinograd:ConvBinWinogradRxS,7.61908,0,miopenConvolutionFwdAlgoWinograd,<unused>
2048-7-7-1x1-512-7-7-64-0x0-1x1-1x1-0-NCHW-FP16-F=miopenConvolutionFwdAlgoImplicitGEMM:ConvHipImplicitGemmV4R1Fwd,0.857604,0,miopenConvolutionFwdAlgoImplicitGEMM,<unused>;miopenConvolutionFwdAlgoDirect:ConvAsm1x1U,0.935364,0,miopenConvolutionFwdAlgoDirect,<unused>;miopenConvolutionFwdAlgoGEMM:gemm,1.86769,0,rocBlas,<unused>;miopenConvolutionFwdAlgoWinograd:ConvBinWinogradRxS,3.14097,0,miopenConvolutionFwdAlgoWinograd,<unused>
512-7-7-3x3-512-7-7-64-1x1-1x1-1x1-0-NCHW-FP16-F=miopenConvolutionFwdAlgoImplicitGEMM:ConvHipImplicitGemmV4R1Fwd,1.29329,0,miopenConvolutionFwdAlgoImplicitGEMM,<unused>;miopenConvolutionFwdAlgoDirect:ConvOclDirectFwd,5.93747,0,miopenConvolutionFwdAlgoDirect,<unused>;miopenConvolutionFwdAlgoGEMM:gemm,43.1516,451584,rocBlas,<unused>;miopenConvolutionFwdAlgoWinograd:ConvBinWinogradRxS,0.611203,0,miopenConvolutionFwdAlgoWinograd,<unused>
512-7-7-1x1-2048-7-7-64-0x0-1x1-1x1-0-NCHW-FP16-F=miopenConvolutionFwdAlgoImplicitGEMM:ConvHipImplicitGemmV4R1Fwd,0.721443,0,miopenConvolutionFwdAlgoImplicitGEMM,<unused>;miopenConvolutionFwdAlgoDirect:ConvAsm1x1U,0.787684,0,miopenConvolutionFwdAlgoDirect,<unused>;miopenConvolutionFwdAlgoGEMM:gemm,1.39569,0,rocBlas,<unused>;miopenConvolutionFwdAlgoWinograd:ConvBinWinogradRxS,2.92705,0,miopenConvolutionFwdAlgoWinograd,<unused>
3-224-224-11x11-64-55-55-64-2x2-4x4-1x1-0-NCHW-FP32-F=miopenConvolutionFwdAlgoDirect:ConvOclDirectFwd11x11,5.14816,0,miopenConvolutionFwdAlgoDirect,<unused>;miopenConvolutionFwdAlgoGEMM:gemm,4.57728,4392300,rocBlas,<unused>
64-27-27-5x5-192-27-27-64-2x2-1x1-1x1-0-NCHW-FP32-F=miopenConvolutionFwdAlgoFFT:fft,1.27184,143720448,miopenConvolutionFwdAlgoFFT,<unused>;miopenConvolutionFwdAlgoImplicitGEMM:ConvHipImplicitGemmV4R1Fwd,3.184,0,miopenConvolutionFwdAlgoImplicitGEMM,<unused>;miopenConvolutionFwdAlgoDirect:ConvOclDirectFwd,14.0984,0,miopenConvolutionFwdAlgoDirect,<unused>;miopenConvolutionFwdAlgoGEMM:gemm,7.66976,4665600,rocBlas,<unused>;miopenConvolutionFwdAlgoWinograd:ConvBinWinogradRxSf2x3g1,2.13584,0,miopenConvolutionFwdAlgoWinograd,<unused>
192-13-13-3x3-384-13-13-64-1x1-1x1-1x1-0-NCHW-FP32-F=miopenConvolutionFwdAlgoWinograd:ConvBinWinograd3x3U,0.81808,0,miopenConvolutionFwdAlgoWinograd,<unused>
384-13-13-3x3-256-13-13-64-1x1-1x1-1x1-0-NCHW-FP32-F=miopenConvolutionFwdAlgoWinograd:ConvBinWinogradRxSf2x3g1,1.10368,0,miopenConvolutionFwdAlgoWinograd,<unused>
256-13-13-3x3-256-13-13-64-1x1-1x1-1x1-0-NCHW-FP32-F=miopenConvolutionFwdAlgoWinograd:ConvBinWinograd3x3U,0.75536,0,miopenConvolutionFwdAlgoWinograd,<unused>
3-224-224-11x11-64-55-55-64-2x2-4x4-1x1-0-NCHW-FP16-F=miopenConvolutionFwdAlgoDirect:ConvOclDirectFwd11x11,1.312,0,miopenConvolutionFwdAlgoDirect,<unused>;miopenConvolutionFwdAlgoGEMM:gemm,7.38304,2196150,rocBlas,<unused>
64-27-27-5x5-192-27-27-64-2x2-1x1-1x1-0-NCHW-FP16-F=miopenConvolutionFwdAlgoImplicitGEMM:ConvHipImplicitGemmV4R1Fwd,2.18128,0,miopenConvolutionFwdAlgoImplicitGEMM,<unused>;miopenConvolutionFwdAlgoDirect:ConvOclDirectFwd,3.57024,0,miopenConvolutionFwdAlgoDirect,<unused>;miopenConvolutionFwdAlgoGEMM:gemm,17.9712,2332800,rocBlas,<unused>;miopenConvolutionFwdAlgoWinograd:ConvBinWinogradRxS,1.76496,0,miopenConvolutionFwdAlgoWinograd,<unused>
192-13-13-3x3-384-13-13-64-1x1-1x1-1x1-0-NCHW-FP16-F=miopenConvolutionFwdAlgoImplicitGEMM:ConvHipImplicitGemmV4R1Fwd,1.1136,0,miopenConvolutionFwdAlgoImplicitGEMM,<unused>;miopenConvolutionFwdAlgoDirect:ConvOclDirectFwd,2.71584,0,miopenConvolutionFwdAlgoDirect,<unused>;miopenConvolutionFwdAlgoGEMM:gemm,18.7904,584064,rocBlas,<unused>;miopenConvolutionFwdAlgoWinograd:ConvBinWinogradRxSf2x3g1,0.5072,0,miopenConvolutionFwdAlgoWinograd,<unused>
384-13-13-3x3-256-13-13-64-1x1-1x1-1x1-0-NCHW-FP16-F=miopenConvolutionFwdAlgoImplicitGEMM:ConvHipImplicitGemmV4R1Fwd,1.58352,0,miopenConvolutionFwdAlgoImplicitGEMM,<unused>;miopenConvolutionFwdAlgoDirect:ConvOclDirectFwd,4.0016,0,miopenConvolutionFwdAlgoDirect,<unused>;miopenConvolutionFwdAlgoGEMM:gemm,33.833,1168128,rocBlas,<unused>;miopenConvolutionFwdAlgoWinograd:ConvBinWinogradRxSf2x3g1,0.67536,0,miopenConvolutionFwdAlgoWinograd,<unused>
256-13-13-3x3-256-13-13-64-1x1-1x1-1x1-0-NCHW-FP16-F=miopenConvolutionFwdAlgoImplicitGEMM:ConvHipImplicitGemmV4R1Fwd,1.06032,0,miopenConvolutionFwdAlgoImplicitGEMM,<unused>;miopenConvolutionFwdAlgoDirect:ConvOclDirectFwd,2.66608,0,miopenConvolutionFwdAlgoDirect,<unused>;miopenConvolutionFwdAlgoGEMM:gemm,23.4291,778752,rocBlas,<unused>;miopenConvolutionFwdAlgoWinograd:ConvBinWinogradRxSf2x3g1,0.4688,0,miopenConvolutionFwdAlgoWinograd,<unused>
3-224-224-7x7-64-112-112-32-3x3-2x2-1x1-0-NCHW-FP32-F=miopenConvolutionFwdAlgoDirect:ConvAsm7x7c3h224w224k64u2v2p3q3f1,0.905637,0,miopenConvolutionFwdAlgoDirect,<unused>;miopenConvolutionFwdAlgoGEMM:gemm,2.34506,7375872,rocBlas,<unused>;miopenConvolutionFwdAlgoWinograd:ConvBinWinogradRxS,1.25557,0,miopenConvolutionFwdAlgoWinograd,<unused>
64-56-56-1x1-128-56-56-32-0x0-1x1-1x1-0-NCHW-FP32-F=miopenConvolutionFwdAlgoImplicitGEMM:ConvHipImplicitGemmV4R1Fwd,0.22224,0,miopenConvolutionFwdAlgoImplicitGEMM,<unused>;miopenConvolutionFwdAlgoDirect:ConvOclDirectFwd1x1,0.19552,0,miopenConvolutionFwdAlgoDirect,<unused>;miopenConvolutionFwdAlgoGEMM:gemm,0.25616,0,rocBlas,<unused>;miopenConvolutionFwdAlgoWinograd:ConvBinWinogradRxSf3x2,0.469119,0,miopenConvolutionFwdAlgoWinograd,<unused>
128-56-56-3x3-32-56-56-32-1x1-1x1-1x1-0-NCHW-FP32-F=miopenConvolutionFwdAlgoWinograd:ConvBinWinograd3x3U,0.40528,0,miopenConvolutionFwdAlgoWinograd,<unused>
96-56-56-1x1-128-56-56-32-0x0-1x1-1x1-0-NCHW-FP32-F=miopenConvolutionFwdAlgoImplicitGEMM:ConvHipImplicitGemmV4R1Fwd,0.29296,0,miopenConvolutionFwdAlgoImplicitGEMM,<unused>;miopenConvolutionFwdAlgoDirect:ConvOclDirectFwd1x1,0.34768,0,miopenConvolutionFwdAlgoDirect,<unused>;miopenConvolutionFwdAlgoGEMM:gemm,0.3504,0,rocBlas,<unused>;miopenConvolutionFwdAlgoWinograd:ConvBinWinogradRxSf3x2,0.629279,0,miopenConvolutionFwdAlgoWinograd,<unused>
128-56-56-1x1-128-56-56-32-0x0-1x1-1x1-0-NCHW-FP32-F=miopenConvolutionFwdAlgoImplicitGEMM:ConvHipImplicitGemmV4R1Fwd,0.37248,0,miopenConvolutionFwdAlgoImplicitGEMM,<unused>;miopenConvolutionFwdAlgoDirect:ConvOclDirectFwd1x1,0.37184,0,miopenConvolutionFwdAlgoDirect,<unused>;miopenConvolutionFwdAlgoGEMM:gemm,0.43856,0,rocBlas,<unused>;miopenConvolutionFwdAlgoWinograd:ConvBinWinogradRxSf3x2,0.797758,0,miopenConvolutionFwdAlgoWinograd,<unused>
160-56-56-1x1-128-56-56-32-0x0-1x1-1x1-0-NCHW-FP32-F=miopenConvolutionFwdAlgoImplicitGEMM:ConvHipImplicitGemmV4R1Fwd,0.4424,0,miopenConvolutionFwdAlgoImplicitGEMM,<unused>;miopenConvolutionFwdAlgoDirect:ConvOclDirectFwd1x1,0.48336,0,miopenConvolutionFwdAlgoDirect,<unused>;miopenConvolutionFwdAlgoGEMM:gemm,0.5344,0,rocBlas,<unused>;miopenConvolutionFwdAlgoWinograd:ConvBinWinogradRxSf3x2,0.966719,0,miopenConvolutionFwdAlgoWinograd,<unused>
192-56-56-1x1-128-56-56-32-0x0-1x1-1x1-0-NCHW-FP32-F=miopenConvolutionFwdAlgoImplicitGEMM:ConvHipImplicitGemmV4R1Fwd,0.52608,0,miopenConvolutionFwdAlgoImplicitGEMM,<unused>;miopenConvolutionFwdAlgoDirect:ConvOclDirectFwd1x1,0.58048,0,miopenConvolutionFwdAlgoDirect,<unused>;miopenConvolutionFwdAlgoGEMM:gemm,0.52944,0,rocBlas,<unused>;miopenConvolutionFwdAlgoWinograd:ConvBinWinogradRxSf3x2,1.1288,0,miopenConvolutionFwdAlgoWinograd,<unused>
224-56-56-1x1-128-56-56-32-0x0-1x1-1x1-0-NCHW-FP32-F=miopenConvolutionFwdAlgoImplicitGEMM:ConvHipImplicitGemmV4R1Fwd,0.586239,0,miopenConvolutionFwdAlgoImplicitGEMM,<unused>;miopenConvolutionFwdAlgoDirect:ConvAsm1x1U,0.809439,0,miopenConvolutionFwdAlgoDirect,<unused>;miopenConvolutionFwdAlgoGEMM:gemm,0.60704,0,rocBlas,<unused>;miopenConvolutionFwdAlgoWinograd:ConvBinWinogradRxSf3x2,1.30848,0,miopenConvolutionFwdAlgoWinograd,<unused>
256-56-56-1x1-128-56-56-32-0x0-1x1-1x1-0-NCHW-FP32-F=miopenConvolutionFwdAlgoImplicitGEMM:ConvHipImplicitGemmV4R1Fwd,0.659679,0,miopenConvolutionFwdAlgoImplicitGEMM,<unused>;miopenConvolutionFwdAlgoDirect:ConvAsm1x1U,0.738079,0,miopenConvolutionFwdAlgoDirect,<unused>;miopenConvolutionFwdAlgoGEMM:gemm,0.700799,0,rocBlas,<unused>;miopenConvolutionFwdAlgoWinograd:ConvBinWinogradRxSf3x2,1.46,0,miopenConvolutionFwdAlgoWinograd,<unused>
128-28-28-1x1-128-28-28-32-0x0-1x1-1x1-0-NCHW-FP32-F=miopenConvolutionFwdAlgoImplicitGEMM:ConvHipImplicitGemmV4R1Fwd,0.112,0,miopenConvolutionFwdAlgoImplicitGEMM,<unused>;miopenConvolutionFwdAlgoDirect:ConvAsm1x1U,0.12688,0,miopenConvolutionFwdAlgoDirect,<unused>;miopenConvolutionFwdAlgoGEMM:gemm,0.12096,0,rocBlas,<unused>;miopenConvolutionFwdAlgoWinograd:ConvBinWinogradRxSf3x2,0.247679,0,miopenConvolutionFwdAlgoWinograd,<unused>
128-28-28-3x3-32-28-28-32-1x1-1x1-1x1-0-NCHW-FP32-F=miopenConvolutionFwdAlgoWinograd:ConvBinWinograd3x3U,0.13008,0,miopenConvolutionFwdAlgoWinograd,<unused>
160-28-28-1x1-128-28-28-32-0x0-1x1-1x1-0-NCHW-FP32-F=miopenConvolutionFwdAlgoImplicitGEMM:ConvHipImplicitGemmV4R1Fwd,0.12592,0,miopenConvolutionFwdAlgoImplicitGEMM,<unused>;miopenConvolutionFwdAlgoDirect:ConvOclDirectFwd1x1,0.14832,0,miopenConvolutionFwdAlgoDirect,<unused>;miopenConvolutionFwdAlgoGEMM:gemm,0.14224,0,rocBlas,<unused>;miopenConvolutionFwdAlgoWinograd:ConvBinWinogradRxSf3x2,0.29216,0,miopenConvolutionFwdAlgoWinograd,<unused>
192-28-28-1x1-128-28-28-32-0x0-1x1-1x1-0-NCHW-FP32-F=miopenConvolutionFwdAlgoImplicitGEMM:ConvHipImplicitGemmV4R1Fwd,0.15248,0,miopenConvolutionFwdAlgoImplicitGEMM,<unused>;miopenConvolutionFwdAlgoDirect:ConvOclDirectFwd1x1,0.15072,0,miopenConvolutionFwdAlgoDirect,<unused>;miopenConvolutionFwdAlgoGEMM:gemm,0.16896,0,rocBlas,<unused>;miopenConvolutionFwdAlgoWinograd:ConvBinWinogradRxSf3x2,0.34208,0,miopenConvolutionFwdAlgoWinograd,<unused>
224-28-28-1x1-128-28-28-32-0x0-1x1-1x1-0-NCHW-FP32-F=miopenConvolutionFwdAlgoImplicitGEMM:ConvHipImplicitGemmV4R1Fwd,0.16752,0,miopenConvolutionFwdAlgoImplicitGEMM,<unused>;miopenConvolutionFwdAlgoDirect:ConvAsm1x1U,0.21328,0,miopenConvolutionFwdAlgoDirect,<unused>;miopenConvolutionFwdAlgoGEMM:gemm,0.18912,0,rocBlas,<unused>;miopenConvolutionFwdAlgoWinograd:ConvBinWinogradRxSf3x2,0.386079,0,miopenConvolutionFwdAlgoWinograd,<unused>
256-28-28-1x1-128-28-28-32-0x0-1x1-1x1-0-NCHW-FP32-F=miopenConvolutionFwdAlgoImplicitGEMM:ConvHipImplicitGemmV4R1Fwd,0.19744,0,miopenConvolutionFwdAlgoImplicitGEMM,<unused>;miopenConvolutionFwdAlgoDirect:ConvAsm1x1U,0.23216,0,miopenConvolutionFwdAlgoDirect,<unused>;miopenConvolutionFwdAlgoGEMM:gemm,0.20928,0,rocBlas,<unused>;miopenConvolutionFwdAlgoWinograd:ConvBinWinogradRxSf3x2,0.431519,0,miopenConvolutionFwdAlgoWinograd,<unused>
288-28-28-1x1-128-28-28-32-0x0-1x1-1x1-0-NCHW-FP32-F=miopenConvolutionFwdAlgoImplicitGEMM:ConvHipImplicitGemmV4R1Fwd,0.21168,0,miopenConvolutionFwdAlgoImplicitGEMM,<unused>;miopenConvolutionFwdAlgoDirect:ConvOclDirectFwd1x1,0.27312,0,miopenConvolutionFwdAlgoDirect,<unused>;miopenConvolutionFwdAlgoGEMM:gemm,0.23552,0,rocBlas,<unused>;miopenConvolutionFwdAlgoWinograd:ConvBinWinogradRxSf3x2,0.477279,0,miopenConvolutionFwdAlgoWinograd,<unused>
320-28-28-1x1-128-28-28-32-0x0-1x1-1x1-0-NCHW-FP32-F=miopenConvolutionFwdAlgoImplicitGEMM:ConvHipImplicitGemmV4R1Fwd,0.23856,0,miopenConvolutionFwdAlgoImplicitGEMM,<unused>;miopenConvolutionFwdAlgoDirect:ConvAsm1x1U,0.27536,0,miopenConvolutionFwdAlgoDirect,<unused>;miopenConvolutionFwdAlgoGEMM:gemm,0.25776,0,rocBlas,<unused>;miopenConvolutionFwdAlgoWinograd:ConvBinWinogradRxSf3x2,0.525119,0,miopenConvolutionFwdAlgoWinograd,<unused>
352-28-28-1x1-128-28-28-32-0x0-1x1-1x1-0-NCHW-FP32-F=miopenConvolutionFwdAlgoImplicitGEMM:ConvHipImplicitGemmV4R1Fwd,0.253599,0,miopenConvolutionFwdAlgoImplicitGEMM,<unused>;miopenConvolutionFwdAlgoDirect:ConvOclDirectFwd1x1,0.2768,0,miopenConvolutionFwdAlgoDirect,<unused>;miopenConvolutionFwdAlgoGEMM:gemm,0.279199,0,rocBlas,<unused>;miopenConvolutionFwdAlgoWinograd:ConvBinWinogradRxSf3x2,0.571199,0,miopenConvolutionFwdAlgoWinograd,<unused>
384-28-28-1x1-128-28-28-32-0x0-1x1-1x1-0-NCHW-FP32-F=miopenConvolutionFwdAlgoImplicitGEMM:ConvHipImplicitGemmV4R1Fwd,0.2792,0,miopenConvolutionFwdAlgoImplicitGEMM,<unused>;miopenConvolutionFwdAlgoDirect:ConvOclDirectFwd1x1,0.30304,0,miopenConvolutionFwdAlgoDirect,<unused>;miopenConvolutionFwdAlgoGEMM:gemm,0.696319,0,rocBlas,<unused>;miopenConvolutionFwdAlgoWinograd:ConvBinWinogradRxSf3x2,0.615999,0,miopenConvolutionFwdAlgoWinograd,<unused>
416-28-28-1x1-128-28-28-32-0x0-1x1-1x1-0-NCHW-FP32-F=miopenConvolutionFwdAlgoImplicitGEMM:ConvHipImplicitGemmV4R1Fwd,0.296799,0,miopenConvolutionFwdAlgoImplicitGEMM,<unused>;miopenConvolutionFwdAlgoDirect:ConvOclDirectFwd1x1,0.39936,0,miopenConvolutionFwdAlgoDirect,<unused>;miopenConvolutionFwdAlgoGEMM:gemm,0.31984,0,rocBlas,<unused>;miopenConvolutionFwdAlgoWinograd:ConvBinWinogradRxSf3x2,0.662559,0,miopenConvolutionFwdAlgoWinograd,<unused>
448-28-28-1x1-128-28-28-32-0x0-1x1-1x1-0-NCHW-FP32-F=miopenConvolutionFwdAlgoImplicitGEMM:ConvHipImplicitGemmV4R1Fwd,0.324479,0,miopenConvolutionFwdAlgoImplicitGEMM,<unused>;miopenConvolutionFwdAlgoDirect:ConvOclDirectFwd1x1,0.35056,0,miopenConvolutionFwdAlgoDirect,<unused>;miopenConvolutionFwdAlgoGEMM:gemm,0.35328,0,rocBlas,<unused>;miopenConvolutionFwdAlgoWinograd:ConvBinWinogradRxSf3x2,0.710079,0,miopenConvolutionFwdAlgoWinograd,<unused>
480-28-28-1x1-128-28-28-32-0x0-1x1-1x1-0-NCHW-FP32-F=miopenConvolutionFwdAlgoImplicitGEMM:ConvHipImplicitGemmV4R1Fwd,0.3392,0,miopenConvolutionFwdAlgoImplicitGEMM,<unused>;miopenConvolutionFwdAlgoDirect:ConvOclDirectFwd1x1,0.37456,0,miopenConvolutionFwdAlgoDirect,<unused>;miopenConvolutionFwdAlgoGEMM:gemm,0.37056,0,rocBlas,<unused>;miopenConvolutionFwdAlgoWinograd:ConvBinWinogradRxSf3x2,0.754239,0,miopenConvolutionFwdAlgoWinograd,<unused>
512-28-28-1x1-256-28-28-32-0x0-1x1-1x1-0-NCHW-FP32-F=miopenConvolutionFwdAlgoImplicitGEMM:ConvHipImplicitGemmV4R1Fwd,0.744639,0,miopenConvolutionFwdAlgoImplicitGEMM,<unused>;miopenConvolutionFwdAlgoDirect:ConvAsm1x1U,0.851839,0,miopenConvolutionFwdAlgoDirect,<unused>;miopenConvolutionFwdAlgoGEMM:gemm,0.744319,0,rocBlas,<unused>;miopenConvolutionFwdAlgoWinograd:ConvBinWinogradRxSf3x2,1.57376,0,miopenConvolutionFwdAlgoWinograd,<unused>
256-14-14-1x1-128-14-14-32-0x0-1x1-1x1-0-NCHW-FP32-F=miopenConvolutionFwdAlgoImplicitGEMM:ConvHipImplicitGemmV4R1Fwd,0.07168,0,miopenConvolutionFwdAlgoImplicitGEMM,<unused>;miopenConvolutionFwdAlgoDirect:ConvOclDirectFwd1x1,0.09248,0,miopenConvolutionFwdAlgoDirect,<unused>;miopenConvolutionFwdAlgoGEMM:gemm,0.219679,0,rocBlas,<unused>;miopenConvolutionFwdAlgoWinograd:ConvBinWinogradRxSf3x2,0.14592,0,miopenConvolutionFwdAlgoWinograd,<unused>
128-14-14-3x3-32-14-14-32-1x1-1x1-1x1-0-NCHW-FP32-F=miopenConvolutionFwdAlgoWinograd:ConvBinWinogradRxS,0.04768,0,miopenConvolutionFwdAlgoWinograd,<unused>
288-14-14-1x1-128-14-14-32-0x0-1x1-1x1-0-NCHW-FP32-F=miopenConvolutionFwdAlgoImplicitGEMM:ConvHipImplicitGemmV4R1Fwd,0.07632,0,miopenConvolutionFwdAlgoImplicitGEMM,<unused>;miopenConvolutionFwdAlgoDirect:ConvAsm1x1U,0.09456,0,miopenConvolutionFwdAlgoDirect,<unused>;miopenConvolutionFwdAlgoGEMM:gemm,0.23024,0,rocBlas,<unused>;miopenConvolutionFwdAlgoWinograd:ConvBinWinogradRxSf3x2,0.15328,0,miopenConvolutionFwdAlgoWinograd,<unused>
320-14-14-1x1-128-14-14-32-0x0-1x1-1x1-0-NCHW-FP32-F=miopenConvolutionFwdAlgoImplicitGEMM:ConvHipImplicitGemmV4R1Fwd,0.08512,0,miopenConvolutionFwdAlgoImplicitGEMM,<unused>;miopenConvolutionFwdAlgoDirect:ConvOclDirectFwd1x1,0.09216,0,miopenConvolutionFwdAlgoDirect,<unused>;miopenConvolutionFwdAlgoGEMM:gemm,0.243039,0,rocBlas,<unused>;miopenConvolutionFwdAlgoWinograd:ConvBinWinogradRxSf3x2,0.17168,0,miopenConvolutionFwdAlgoWinograd,<unused>
352-14-14-1x1-128-14-14-32-0x0-1x1-1x1-0-NCHW-FP32-F=miopenConvolutionFwdAlgoImplicitGEMM:ConvHipImplicitGemmV4R1Fwd,0.09008,0,miopenConvolutionFwdAlgoImplicitGEMM,<unused>;miopenConvolutionFwdAlgoDirect:ConvOclDirectFwd1x1,0.09936,0,miopenConvolutionFwdAlgoDirect,<unused>;miopenConvolutionFwdAlgoGEMM:gemm,0.26144,0,rocBlas,<unused>;miopenConvolutionFwdAlgoWinograd:ConvBinWinogradRxSf3x2,0.183359,0,miopenConvolutionFwdAlgoWinograd,<unused>
384-14-14-1x1-128-14-14-32-0x0-1x1-1x1-0-NCHW-FP32-F=miopenConvolutionFwdAlgoImplicitGEMM:ConvHipImplicitGemmV4R1Fwd,0.12672,0,miopenConvolutionFwdAlgoImplicitGEMM,<unused>;miopenConvolutionFwdAlgoDirect:ConvOclDirectFwd1x1,0.11104,0,miopenConvolutionFwdAlgoDirect,<unused>;miopenConvolutionFwdAlgoGEMM:gemm,0.146559,0,rocBlas,<unused>;miopenConvolutionFwdAlgoWinograd:ConvBinWinogradRxSf3x2,0.19632,0,miopenConvolutionFwdAlgoWinograd,<unused>
416-14-14-1x1-128-14-14-32-0x0-1x1-1x1-0-NCHW-FP32-F=miopenConvolutionFwdAlgoImplicitGEMM:ConvHipImplicitGemmV4R1Fwd,0.10544,0,miopenConvolutionFwdAlgoImplicitGEMM,<unused>;miopenConvolutionFwdAlgoDirect:ConvOclDirectFwd1x1,0.1128,0,miopenConvolutionFwdAlgoDirect,<unused>;miopenConvolutionFwdAlgoGEMM:gemm,0.15584,0,rocBlas,<unused>;miopenConvolutionFwdAlgoWinograd:ConvBinWinogradRxSf3x2,0.2104,0,miopenConvolutionFwdAlgoWinograd,<unused>
448-14-14-1x1-128-14-14-32-0x0-1x1-1x1-0-NCHW-FP32-F=miopenConvolutionFwdAlgoImplicitGEMM:ConvHipImplicitGemmV4R1Fwd,0.11232,0,miopenConvolutionFwdAlgoImplicitGEMM,<unused>;miopenConvolutionFwdAlgoDirect:ConvOclDirectFwd1x1,0.12736,0,miopenConvolutionFwdAlgoDirect,<unused>;miopenConvolutionFwdAlgoGEMM:gemm,0.16336,0,rocBlas,<unused>;miopenConvolutionFwdAlgoWinograd:ConvBinWinogradRxSf3x2,0.223199,0,miopenConvolutionFwdAlgoWinograd,<unused>
480-14-14-1x1-128-14-14-32-0x0-1x1-1x1-0-NCHW-FP32-F=miopenConvolutionFwdAlgoImplicitGEMM:ConvHipImplicitGemmV4R1Fwd,0.11904,0,miopenConvolutionFwdAlgoImplicitGEMM,<unused>;miopenConvolutionFwdAlgoDirect:ConvOclDirectFwd1x1,0.14832,0,miopenConvolutionFwdAlgoDirect,<unused>;miopenConvolutionFwdAlgoGEMM:gemm,0.17504,0,rocBlas,<unused>;miopenConvolutionFwdAlgoWinograd:ConvBinWinogradRxSf3x2,0.236159,0,miopenConvolutionFwdAlgoWinograd,<unused>
512-14-14-1x1-128-14-14-32-0x0-1x1-1x1-0-NCHW-FP32-F=miopenConvolutionFwdAlgoImplicitGEMM:ConvHipImplicitGemmV4R1Fwd,0.1336,0,miopenConvolutionFwdAlgoImplicitGEMM,<unused>;miopenConvolutionFwdAlgoDirect:ConvAsm1x1U,0.14624,0,miopenConvolutionFwdAlgoDirect,<unused>;miopenConvolutionFwdAlgoGEMM:gemm,0.193759,0,rocBlas,<unused>;miopenConvolutionFwdAlgoWinograd:ConvBinWinogradRxSf3x2,0.2504,0,miopenConvolutionFwdAlgoWinograd,<unused>
544-14-14-1x1-128-14-14-32-0x0-1x1-1x1-0-NCHW-FP32-F=miopenConvolutionFwdAlgoImplicitGEMM:ConvHipImplicitGemmV4R1Fwd,0.132,0,miopenConvolutionFwdAlgoImplicitGEMM,<unused>;miopenConvolutionFwdAlgoDirect:ConvOclDirectFwd1x1,0.1544,0,miopenConvolutionFwdAlgoDirect,<unused>;miopenConvolutionFwdAlgoGEMM:gemm,0.19104,0,rocBlas,<unused>;miopenConvolutionFwdAlgoWinograd:ConvBinWinogradRxSf3x2,0.261919,0,miopenConvolutionFwdAlgoWinograd,<unused>
576-14-14-1x1-128-14-14-32-0x0-1x1-1x1-0-NCHW-FP32-F=miopenConvolutionFwdAlgoImplicitGEMM:ConvHipImplicitGemmV4R1Fwd,0.1392,0,miopenConvolutionFwdAlgoImplicitGEMM,<unused>;miopenConvolutionFwdAlgoDirect:ConvOclDirectFwd1x1,0.15296,0,miopenConvolutionFwdAlgoDirect,<unused>;miopenConvolutionFwdAlgoGEMM:gemm,0.199839,0,rocBlas,<unused>;miopenConvolutionFwdAlgoWinograd:ConvBinWinogradRxSf3x2,0.27664,0,miopenConvolutionFwdAlgoWinograd,<unused>
608-14-14-1x1-128-14-14-32-0x0-1x1-1x1-0-NCHW-FP32-F=miopenConvolutionFwdAlgoImplicitGEMM:ConvHipImplicitGemmV4R1Fwd,0.1456,0,miopenConvolutionFwdAlgoImplicitGEMM,<unused>;miopenConvolutionFwdAlgoDirect:ConvOclDirectFwd1x1,0.17056,0,miopenConvolutionFwdAlgoDirect,<unused>;miopenConvolutionFwdAlgoGEMM:gemm,0.2072,0,rocBlas,<unused>;miopenConvolutionFwdAlgoWinograd:ConvBinWinogradRxSf3x2,0.288959,0,miopenConvolutionFwdAlgoWinograd,<unused>
640-14-14-1x1-128-14-14-32-0x0-1x1-1x1-0-NCHW-FP32-F=miopenConvolutionFwdAlgoImplicitGEMM:ConvHipImplicitGemmV4R1Fwd,0.15184,0,miopenConvolutionFwdAlgoImplicitGEMM,<unused>;miopenConvolutionFwdAlgoDirect:ConvOclDirectFwd1x1,0.17264,0,miopenConvolutionFwdAlgoDirect,<unused>;miopenConvolutionFwdAlgoGEMM:gemm,0.219199,0,rocBlas,<unused>;miopenConvolutionFwdAlgoWinograd:ConvBinWinogradRxSf3x2,0.30272,0,miopenConvolutionFwdAlgoWinograd,<unused>
672-14-14-1x1-128-14-14-32-0x0-1x1-1x1-0-NCHW-FP32-F=miopenConvolutionFwdAlgoImplicitGEMM:ConvHipImplicitGemmV4R1Fwd,0.15968,0,miopenConvolutionFwdAlgoImplicitGEMM,<unused>;miopenConvolutionFwdAlgoDirect:ConvOclDirectFwd1x1,0.18784,0,miopenConvolutionFwdAlgoDirect,<unused>;miopenConvolutionFwdAlgoGEMM:gemm,0.323519,0,rocBlas,<unused>;miopenConvolutionFwdAlgoWinograd:ConvBinWinogradRxSf3x2,0.3152,0,miopenConvolutionFwdAlgoWinograd,<unused>
704-14-14-1x1-128-14-14-32-0x0-1x1-1x1-0-NCHW-FP32-F=miopenConvolutionFwdAlgoImplicitGEMM:ConvHipImplicitGemmV4R1Fwd,0.165119,0,miopenConvolutionFwdAlgoImplicitGEMM,<unused>;miopenConvolutionFwdAlgoDirect:ConvOclDirectFwd1x1,0.19808,0,miopenConvolutionFwdAlgoDirect,<unused>;miopenConvolutionFwdAlgoGEMM:gemm,0.335199,0,rocBlas,<unused>;miopenConvolutionFwdAlgoWinograd:ConvBinWinogradRxSf3x2,0.32832,0,miopenConvolutionFwdAlgoWinograd,<unused>
736-14-14-1x1-128-14-14-32-0x0-1x1-1x1-0-NCHW-FP32-F=miopenConvolutionFwdAlgoImplicitGEMM:ConvHipImplicitGemmV4R1Fwd,0.17248,0,miopenConvolutionFwdAlgoImplicitGEMM,<unused>;miopenConvolutionFwdAlgoDirect:ConvOclDirectFwd1x1,0.20768,0,miopenConvolutionFwdAlgoDirect,<unused>;miopenConvolutionFwdAlgoGEMM:gemm,0.35264,0,rocBlas,<unused>;miopenConvolutionFwdAlgoWinograd:ConvBinWinogradRxSf3x2,0.3432,0,miopenConvolutionFwdAlgoWinograd,<unused>
768-14-14-1x1-128-14-14-32-0x0-1x1-1x1-0-NCHW-FP32-F=miopenConvolutionFwdAlgoImplicitGEMM:ConvHipImplicitGemmV4R1Fwd,0.18112,0,miopenConvolutionFwdAlgoImplicitGEMM,<unused>;miopenConvolutionFwdAlgoDirect:ConvOclDirectFwd1x1,0.20848,0,miopenConvolutionFwdAlgoDirect,<unused>;miopenConvolutionFwdAlgoGEMM:gemm,0.38416,0,rocBlas,<unused>;miopenConvolutionFwdAlgoWinograd:ConvBinWinogradRxSf3x2,0.355199,0,miopenConvolutionFwdAlgoWinograd,<unused>
800-14-14-1x1-128-14-14-32-0x0-1x1-1x1-0-NCHW-FP32-F=miopenConvolutionFwdAlgoImplicitGEMM:ConvHipImplicitGemmV4R1Fwd,0.186399,0,miopenConvolutionFwdAlgoImplicitGEMM,<unused>;miopenConvolutionFwdAlgoDirect:ConvOclDirectFwd1x1,0.21744,0,miopenConvolutionFwdAlgoDirect,<unused>;miopenConvolutionFwdAlgoGEMM:gemm,0.38368,0,rocBlas,<unused>;miopenConvolutionFwdAlgoWinograd:ConvBinWinogradRxSf3x2,0.36768,0,miopenConvolutionFwdAlgoWinograd,<unused>
832-14-14-1x1-128-14-14-32-0x0-1x1-1x1-0-NCHW-FP32-F=miopenConvolutionFwdAlgoImplicitGEMM:ConvHipImplicitGemmV4R1Fwd,0.19264,0,miopenConvolutionFwdAlgoImplicitGEMM,<unused>;miopenConvolutionFwdAlgoDirect:ConvOclDirectFwd1x1,0.23648,0,miopenConvolutionFwdAlgoDirect,<unused>;miopenConvolutionFwdAlgoGEMM:gemm,0.397759,0,rocBlas,<unused>;miopenConvolutionFwdAlgoWinograd:ConvBinWinogradRxSf3x2,0.382239,0,miopenConvolutionFwdAlgoWinograd,<unused>
864-14-14-1x1-128-14-14-32-0x0-1x1-1x1-0-NCHW-FP32-F=miopenConvolutionFwdAlgoImplicitGEMM:ConvHipImplicitGemmV4R1Fwd,0.20176,0,miopenConvolutionFwdAlgoImplicitGEMM,<unused>;miopenConvolutionFwdAlgoDirect:ConvOclDirectFwd1x1,0.24304,0,miopenConvolutionFwdAlgoDirect,<unused>;miopenConvolutionFwdAlgoGEMM:gemm,0.408799,0,rocBlas,<unused>;miopenConvolutionFwdAlgoWinograd:ConvBinWinogradRxSf3x2,0.39488,0,miopenConvolutionFwdAlgoWinograd,<unused>
896-14-14-1x1-128-14-14-32-0x0-1x1-1x1-0-NCHW-FP32-F=miopenConvolutionFwdAlgoImplicitGEMM:ConvHipImplicitGemmV4R1Fwd,0.20768,0,miopenConvolutionFwdAlgoImplicitGEMM,<unused>;miopenConvolutionFwdAlgoDirect:ConvOclDirectFwd1x1,0.25728,0,miopenConvolutionFwdAlgoDirect,<unused>;miopenConvolutionFwdAlgoGEMM:gemm,0.291199,0,rocBlas,<unused>;miopenConvolutionFwdAlgoWinograd:ConvBinWinogradRxSf3x2,0.4072,0,miopenConvolutionFwdAlgoWinograd,<unused>
928-14-14-1x1-128-14-14-32-0x0-1x1-1x1-0-NCHW-FP32-F=miopenConvolutionFwdAlgoImplicitGEMM:ConvHipImplicitGemmV4R1Fwd,0.214239,0,miopenConvolutionFwdAlgoImplicitGEMM,<unused>;miopenConvolutionFwdAlgoDirect:ConvOclDirectFwd1x1,0.26448,0,miopenConvolutionFwdAlgoDirect,<unused>;miopenConvolutionFwdAlgoGEMM:gemm,0.30272,0,rocBlas,<unused>;miopenConvolutionFwdAlgoWinograd:ConvBinWinogradRxSf3x2,0.42096,0,miopenConvolutionFwdAlgoWinograd,<unused>
960-14-14-1x1-128-14-14-32-0x0-1x1-1x1-0-NCHW-FP32-F=miopenConvolutionFwdAlgoImplicitGEMM:ConvHipImplicitGemmV4R1Fwd,0.2216,0,miopenConvolutionFwdAlgoImplicitGEMM,<unused>;miopenConvolutionFwdAlgoDirect:ConvOclDirectFwd1x1,0.27168,0,miopenConvolutionFwdAlgoDirect,<unused>;miopenConvolutionFwdAlgoGEMM:gemm,0.31216,0,rocBlas,<unused>;miopenConvolutionFwdAlgoWinograd:ConvBinWinogradRxSf3x2,0.434079,0,miopenConvolutionFwdAlgoWinograd,<unused>
992-14-14-1x1-128-14-14-32-0x0-1x1-1x1-0-NCHW-FP32-F=miopenConvolutionFwdAlgoImplicitGEMM:ConvHipImplicitGemmV4R1Fwd,0.22848,0,miopenConvolutionFwdAlgoImplicitGEMM,<unused>;miopenConvolutionFwdAlgoDirect:ConvOclDirectFwd1x1,0.2872,0,miopenConvolutionFwdAlgoDirect,<unused>;miopenConvolutionFwdAlgoGEMM:gemm,0.332959,0,rocBlas,<unused>;miopenConvolutionFwdAlgoWinograd:ConvBinWinogradRxSf3x2,0.446879,0,miopenConvolutionFwdAlgoWinograd,<unused>
1024-14-14-1x1-512-14-14-32-0x0-1x1-1x1-0-NCHW-FP32-F=miopenConvolutionFwdAlgoImplicitGEMM:ConvHipImplicitGemmV4R1Fwd,0.787679,0,miopenConvolutionFwdAlgoImplicitGEMM,<unused>;miopenConvolutionFwdAlgoDirect:ConvAsm1x1U,1.11392,0,miopenConvolutionFwdAlgoDirect,<unused>;miopenConvolutionFwdAlgoGEMM:gemm,1.29232,0,rocBlas,<unused>;miopenConvolutionFwdAlgoWinograd:ConvBinWinogradRxSf3x2,1.54608,0,miopenConvolutionFwdAlgoWinograd,<unused>
512-7-7-1x1-128-7-7-32-0x0-1x1-1x1-0-NCHW-FP32-F=miopenConvolutionFwdAlgoImplicitGEMM:ConvHipImplicitGemmV4R1Fwd,0.07904,0,miopenConvolutionFwdAlgoImplicitGEMM,<unused>;miopenConvolutionFwdAlgoDirect:ConvOclDirectFwd1x1,0.05424,0,miopenConvolutionFwdAlgoDirect,<unused>;miopenConvolutionFwdAlgoGEMM:gemm,0.11232,0,rocBlas,<unused>;miopenConvolutionFwdAlgoWinograd:ConvBinWinogradRxSf3x2,0.137599,0,miopenConvolutionFwdAlgoWinograd,<unused>
128-7-7-3x3-32-7-7-32-1x1-1x1-1x1-0-NCHW-FP32-F=miopenConvolutionFwdAlgoWinograd:ConvBinWinograd3x3U,0.04688,0,miopenConvolutionFwdAlgoWinograd,<unused>
544-7-7-1x1-128-7-7-32-0x0-1x1-1x1-0-NCHW-FP32-F=miopenConvolutionFwdAlgoImplicitGEMM:ConvHipImplicitGemmV4R1Fwd,0.07936,0,miopenConvolutionFwdAlgoImplicitGEMM,<unused>;miopenConvolutionFwdAlgoDirect:ConvOclDirectFwd1x1,0.06272,0,miopenConvolutionFwdAlgoDirect,<unused>;miopenConvolutionFwdAlgoGEMM:gemm,0.10576,0,rocBlas,<unused>;miopenConvolutionFwdAlgoWinograd:ConvBinWinogradRxSf3x2,0.13856,0,miopenConvolutionFwdAlgoWinograd,<unused>
576-7-7-1x1-128-7-7-32-0x0-1x1-1x1-0-NCHW-FP32-F=miopenConvolutionFwdAlgoImplicitGEMM:ConvHipImplicitGemmV4R1Fwd,0.08368,0,miopenConvolutionFwdAlgoImplicitGEMM,<unused>;miopenConvolutionFwdAlgoDirect:ConvOclDirectFwd1x1,0.06224,0,miopenConvolutionFwdAlgoDirect,<unused>;miopenConvolutionFwdAlgoGEMM:gemm,0.10544,0,rocBlas,<unused>;miopenConvolutionFwdAlgoWinograd:ConvBinWinogradRxSf3x2,0.14848,0,miopenConvolutionFwdAlgoWinograd,<unused>
608-7-7-1x1-128-7-7-32-0x0-1x1-1x1-0-NCHW-FP32-F=miopenConvolutionFwdAlgoImplicitGEMM:ConvHipImplicitGemmV4R1Fwd,0.088,0,miopenConvolutionFwdAlgoImplicitGEMM,<unused>;miopenConvolutionFwdAlgoDirect:ConvOclDirectFwd1x1,0.06432,0,miopenConvolutionFwdAlgoDirect,<unused>;miopenConvolutionFwdAlgoGEMM:gemm,0.11744,0,rocBlas,<unused>;miopenConvolutionFwdAlgoWinograd:ConvBinWinogradRxSf3x2,0.15504,0,miopenConvolutionFwdAlgoWinograd,<unused>
640-7-7-1x1-128-7-7-32-0x0-1x1-1x1-0-NCHW-FP32-F=miopenConvolutionFwdAlgoImplicitGEMM:ConvHipImplicitGemmV4R1Fwd,0.0912,0,miopenConvolutionFwdAlgoImplicitGEMM,<unused>;miopenConvolutionFwdAlgoDirect:ConvOclDirectFwd1x1,0.07552,0,miopenConvolutionFwdAlgoDirect,<unused>;miopenConvolutionFwdAlgoGEMM:gemm,0.12096,0,rocBlas,<unused>;miopenConvolutionFwdAlgoWinograd:ConvBinWinogradRxSf3x2,0.16176,0,miopenConvolutionFwdAlgoWinograd,<unused>
672-7-7-1x1-128-7-7-32-0x0-1x1-1x1-0-NCHW-FP32-F=miopenConvolutionFwdAlgoImplicitGEMM:ConvHipImplicitGemmV4R1Fwd,0.09664,0,miopenConvolutionFwdAlgoImplicitGEMM,<unused>;miopenConvolutionFwdAlgoDirect:ConvOclDirectFwd1x1,0.07328,0,miopenConvolutionFwdAlgoDirect,<unused>;miopenConvolutionFwdAlgoGEMM:gemm,0.12496,0,rocBlas,<unused>;miopenConvolutionFwdAlgoWinograd:ConvBinWinogradRxSf3x2,0.168319,0,miopenConvolutionFwdAlgoWinograd,<unused>
704-7-7-1x1-128-7-7-32-0x0-1x1-1x1-0-NCHW-FP32-F=miopenConvolutionFwdAlgoImplicitGEMM:ConvHipImplicitGemmV4R1Fwd,0.10096,0,miopenConvolutionFwdAlgoImplicitGEMM,<unused>;miopenConvolutionFwdAlgoDirect:ConvOclDirectFwd1x1,0.0752,0,miopenConvolutionFwdAlgoDirect,<unused>;miopenConvolutionFwdAlgoGEMM:gemm,0.12208,0,rocBlas,<unused>;miopenConvolutionFwdAlgoWinograd:ConvBinWinogradRxSf3x2,0.17536,0,miopenConvolutionFwdAlgoWinograd,<unused>
736-7-7-1x1-128-7-7-32-0x0-1x1-1x1-0-NCHW-FP32-F=miopenConvolutionFwdAlgoImplicitGEMM:ConvHipImplicitGemmV4R1Fwd,0.1048,0,miopenConvolutionFwdAlgoImplicitGEMM,<unused>;miopenConvolutionFwdAlgoDirect:ConvOclDirectFwd1x1,0.07728,0,miopenConvolutionFwdAlgoDirect,<unused>;miopenConvolutionFwdAlgoGEMM:gemm,0.12624,0,rocBlas,<unused>;miopenConvolutionFwdAlgoWinograd:ConvBinWinogradRxSf3x2,0.182079,0,miopenConvolutionFwdAlgoWinograd,<unused>
768-7-7-1x1-128-7-7-32-0x0-1x1-1x1-0-NCHW-FP32-F=miopenConvolutionFwdAlgoImplicitGEMM:ConvHipImplicitGemmV4R1Fwd,0.1056,0,miopenConvolutionFwdAlgoImplicitGEMM,<unused>;miopenConvolutionFwdAlgoDirect:ConvOclDirectFwd1x1,0.0824,0,miopenConvolutionFwdAlgoDirect,<unused>;miopenConvolutionFwdAlgoGEMM:gemm,0.13392,0,rocBlas,<unused>;miopenConvolutionFwdAlgoWinograd:ConvBinWinogradRxSf3x2,0.188,0,miopenConvolutionFwdAlgoWinograd,<unused>
800-7-7-1x1-128-7-7-32-0x0-1x1-1x1-0-NCHW-FP32-F=miopenConvolutionFwdAlgoImplicitGEMM:ConvHipImplicitGemmV4R1Fwd,0.09664,0,miopenConvolutionFwdAlgoImplicitGEMM,<unused>;miopenConvolutionFwdAlgoDirect:ConvOclDirectFwd1x1,0.08,0,miopenConvolutionFwdAlgoDirect,<unused>;miopenConvolutionFwdAlgoGEMM:gemm,0.136,0,rocBlas,<unused>;miopenConvolutionFwdAlgoWinograd:ConvBinWinogradRxSf3x2,0.19488,0,miopenConvolutionFwdAlgoWinograd,<unused>
832-7-7-1x1-128-7-7-32-0x0-1x1-1x1-0-NCHW-FP32-F=miopenConvolutionFwdAlgoImplicitGEMM:ConvHipImplicitGemmV4R1Fwd,0.11808,0,miopenConvolutionFwdAlgoImplicitGEMM,<unused>;miopenConvolutionFwdAlgoDirect:ConvAsm1x1U,0.08432,0,miopenConvolutionFwdAlgoDirect,<unused>;miopenConvolutionFwdAlgoGEMM:gemm,0.14,0,rocBlas,<unused>;miopenConvolutionFwdAlgoWinograd:ConvBinWinogradRxSf3x2,0.20112,0,miopenConvolutionFwdAlgoWinograd,<unused>
864-7-7-1x1-128-7-7-32-0x0-1x1-1x1-0-NCHW-FP32-F=miopenConvolutionFwdAlgoImplicitGEMM:ConvHipImplicitGemmV4R1Fwd,0.12128,0,miopenConvolutionFwdAlgoImplicitGEMM,<unused>;miopenConvolutionFwdAlgoDirect:ConvOclDirectFwd1x1,0.08448,0,miopenConvolutionFwdAlgoDirect,<unused>;miopenConvolutionFwdAlgoGEMM:gemm,0.142399,0,rocBlas,<unused>;miopenConvolutionFwdAlgoWinograd:ConvBinWinogradRxSf3x2,0.20848,0,miopenConvolutionFwdAlgoWinograd,<unused>
896-7-7-1x1-128-7-7-32-0x0-1x1-1x1-0-NCHW-FP32-F=miopenConvolutionFwdAlgoImplicitGEMM:ConvHipImplicitGemmV4R1Fwd,0.12624,0,miopenConvolutionFwdAlgoImplicitGEMM,<unused>;miopenConvolutionFwdAlgoDirect:ConvOclDirectFwd1x1,0.09184,0,miopenConvolutionFwdAlgoDirect,<unused>;miopenConvolutionFwdAlgoGEMM:gemm,0.144,0,rocBlas,<unused>;miopenConvolutionFwdAlgoWinograd:ConvBinWinogradRxSf3x2,0.21408,0,miopenConvolutionFwdAlgoWinograd,<unused>
928-7-7-1x1-128-7-7-32-0x0-1x1-1x1-0-NCHW-FP32-F=miopenConvolutionFwdAlgoImplicitGEMM:ConvHipImplicitGemmV4R1Fwd,0.12976,0,miopenConvolutionFwdAlgoImplicitGEMM,<unused>;miopenConvolutionFwdAlgoDirect:ConvOclDirectFwd1x1,0.09216,0,miopenConvolutionFwdAlgoDirect,<unused>;miopenConvolutionFwdAlgoGEMM:gemm,0.148319,0,rocBlas,<unused>;miopenConvolutionFwdAlgoWinograd:ConvBinWinogradRxSf3x2,0.22256,0,miopenConvolutionFwdAlgoWinograd,<unused>
960-7-7-1x1-128-7-7-32-0x0-1x1-1x1-0-NCHW-FP32-F=miopenConvolutionFwdAlgoImplicitGEMM:ConvHipImplicitGemmV4R1Fwd,0.13472,0,miopenConvolutionFwdAlgoImplicitGEMM,<unused>;miopenConvolutionFwdAlgoDirect:ConvOclDirectFwd1x1,0.09232,0,miopenConvolutionFwdAlgoDirect,<unused>;miopenConvolutionFwdAlgoGEMM:gemm,0.15344,0,rocBlas,<unused>;miopenConvolutionFwdAlgoWinograd:ConvBinWinogradRxSf3x2,0.228,0,miopenConvolutionFwdAlgoWinograd,<unused>
992-7-7-1x1-128-7-7-32-0x0-1x1-1x1-0-NCHW-FP32-F=miopenConvolutionFwdAlgoImplicitGEMM:ConvHipImplicitGemmV4R1Fwd,0.13712,0,miopenConvolutionFwdAlgoImplicitGEMM,<unused>;miopenConvolutionFwdAlgoDirect:ConvOclDirectFwd1x1,0.0952,0,miopenConvolutionFwdAlgoDirect,<unused>;miopenConvolutionFwdAlgoGEMM:gemm,0.15376,0,rocBlas,<unused>;miopenConvolutionFwdAlgoWinograd:ConvBinWinogradRxSf3x2,0.2352,0,miopenConvolutionFwdAlgoWinograd,<unused>
3-224-224-7x7-64-112-112-32-3x3-2x2-1x1-0-NCHW-FP16-F=miopenConvolutionFwdAlgoDirect:ConvOclDirectFwdGen,1.58048,0,miopenConvolutionFwdAlgoDirect,<unused>;miopenConvolutionFwdAlgoGEMM:gemm,3.21024,3687936,rocBlas,<unused>;miopenConvolutionFwdAlgoWinograd:ConvBinWinogradRxSf2x3g1,1.26448,0,miopenConvolutionFwdAlgoWinograd,<unused>
64-56-56-1x1-128-56-56-32-0x0-1x1-1x1-0-NCHW-FP16-F=miopenConvolutionFwdAlgoImplicitGEMM:ConvHipImplicitGemmV4R1Fwd,0.17952,0,miopenConvolutionFwdAlgoImplicitGEMM,<unused>;miopenConvolutionFwdAlgoDirect:ConvAsm1x1U,0.19632,0,miopenConvolutionFwdAlgoDirect,<unused>;miopenConvolutionFwdAlgoGEMM:gemm,0.12464,0,rocBlas,<unused>;miopenConvolutionFwdAlgoWinograd:ConvBinWinogradRxS,0.515518,0,miopenConvolutionFwdAlgoWinograd,<unused>
128-56-56-3x3-32-56-56-32-1x1-1x1-1x1-0-NCHW-FP16-F=miopenConvolutionFwdAlgoImplicitGEMM:ConvHipImplicitGemmV4R1Fwd,0.766398,0,miopenConvolutionFwdAlgoImplicitGEMM,<unused>;miopenConvolutionFwdAlgoDirect:ConvOclDirectFwd,1.72624,0,miopenConvolutionFwdAlgoDirect,<unused>;miopenConvolutionFwdAlgoGEMM:gemm,3.84,7225344,rocBlas,<unused>;miopenConvolutionFwdAlgoWinograd:ConvBinWinogradRxSf2x3g1,0.264959,0,miopenConvolutionFwdAlgoWinograd,<unused>
96-56-56-1x1-128-56-56-32-0x0-1x1-1x1-0-NCHW-FP16-F=miopenConvolutionFwdAlgoImplicitGEMM:ConvHipImplicitGemmV4R1Fwd,0.21936,0,miopenConvolutionFwdAlgoImplicitGEMM,<unused>;miopenConvolutionFwdAlgoDirect:ConvAsm1x1U,0.21088,0,miopenConvolutionFwdAlgoDirect,<unused>;miopenConvolutionFwdAlgoGEMM:gemm,0.16672,0,rocBlas,<unused>;miopenConvolutionFwdAlgoWinograd:ConvBinWinogradRxS,0.720319,0,miopenConvolutionFwdAlgoWinograd,<unused>
128-56-56-1x1-128-56-56-32-0x0-1x1-1x1-0-NCHW-FP16-F=miopenConvolutionFwdAlgoImplicitGEMM:ConvHipImplicitGemmV4R1Fwd,0.30448,0,miopenConvolutionFwdAlgoImplicitGEMM,<unused>;miopenConvolutionFwdAlgoDirect:ConvAsm1x1U,0.259199,0,miopenConvolutionFwdAlgoDirect,<unused>;miopenConvolutionFwdAlgoGEMM:gemm,0.21184,0,rocBlas,<unused>;miopenConvolutionFwdAlgoWinograd:ConvBinWinogradRxSf2x3g1,0.922557,0,miopenConvolutionFwdAlgoWinograd,<unused>
160-56-56-1x1-128-56-56-32-0x0-1x1-1x1-0-NCHW-FP16-F=miopenConvolutionFwdAlgoImplicitGEMM:ConvHipImplicitGemmV4R1Fwd,0.325919,0,miopenConvolutionFwdAlgoImplicitGEMM,<unused>;miopenConvolutionFwdAlgoDirect:ConvAsm1x1U,0.3144,0,miopenConvolutionFwdAlgoDirect,<unused>;miopenConvolutionFwdAlgoGEMM:gemm,0.24736,0,rocBlas,<unused>;miopenConvolutionFwdAlgoWinograd:ConvBinWinogradRxSf2x3g1,1.11936,0,miopenConvolutionFwdAlgoWinograd,<unused>
192-56-56-1x1-128-56-56-32-0x0-1x1-1x1-0-NCHW-FP16-F=miopenConvolutionFwdAlgoImplicitGEMM:ConvHipImplicitGemmV4R1Fwd,0.415999,0,miopenConvolutionFwdAlgoImplicitGEMM,<unused>;miopenConvolutionFwdAlgoDirect:ConvAsm1x1U,0.393599,0,miopenConvolutionFwdAlgoDirect,<unused>;miopenConvolutionFwdAlgoGEMM:gemm,0.2912,0,rocBlas,<unused>;miopenConvolutionFwdAlgoWinograd:ConvBinWinogradRxSf2x3g1,1.31472,0,miopenConvolutionFwdAlgoWinograd,<unused>
224-56-56-1x1-128-56-56-32-0x0-1x1-1x1-0-NCHW-FP16-F=miopenConvolutionFwdAlgoImplicitGEMM:ConvHipImplicitGemmV4R1Fwd,0.428799,0,miopenConvolutionFwdAlgoImplicitGEMM,<unused>;miopenConvolutionFwdAlgoDirect:ConvAsm1x1U,0.451839,0,miopenConvolutionFwdAlgoDirect,<unused>;miopenConvolutionFwdAlgoGEMM:gemm,0.32736,0,rocBlas,<unused>;miopenConvolutionFwdAlgoWinograd:ConvBinWinogradRxSf2x3g1,1.51088,0,miopenConvolutionFwdAlgoWinograd,<unused>
256-56-56-1x1-128-56-56-32-0x0-1x1-1x1-0-NCHW-FP16-F=miopenConvolutionFwdAlgoImplicitGEMM:ConvHipImplicitGemmV4R1Fwd,0.547359,0,miopenConvolutionFwdAlgoImplicitGEMM,<unused>;miopenConvolutionFwdAlgoDirect:ConvAsm1x1U,0.490239,0,miopenConvolutionFwdAlgoDirect,<unused>;miopenConvolutionFwdAlgoGEMM:gemm,0.37008,0,rocBlas,<unused>;miopenConvolutionFwdAlgoWinograd:ConvBinWinogradRxSf2x3g1,1.70992,0,miopenConvolutionFwdAlgoWinograd,<unused>
128-28-28-1x1-128-28-28-32-0x0-1x1-1x1-0-NCHW-FP16-F=miopenConvolutionFwdAlgoImplicitGEMM:ConvHipImplicitGemmV4R1Fwd,0.09456,0,miopenConvolutionFwdAlgoImplicitGEMM,<unused>;miopenConvolutionFwdAlgoDirect:ConvAsm1x1U,0.0816,0,miopenConvolutionFwdAlgoDirect,<unused>;miopenConvolutionFwdAlgoGEMM:gemm,0.15184,0,rocBlas,<unused>;miopenConvolutionFwdAlgoWinograd:ConvBinWinogradRxS,0.28112,0,miopenConvolutionFwdAlgoWinograd,<unused>
128-28-28-3x3-32-28-28-32-1x1-1x1-1x1-0-NCHW-FP16-F=miopenConvolutionFwdAlgoImplicitGEMM:ConvHipImplicitGemmV4R1Fwd,0.2336,0,miopenConvolutionFwdAlgoImplicitGEMM,<unused>;miopenConvolutionFwdAlgoDirect:ConvOclDirectFwd,0.479359,0,miopenConvolutionFwdAlgoDirect,<unused>;miopenConvolutionFwdAlgoGEMM:gemm,2.28352,1806336,rocBlas,<unused>;miopenConvolutionFwdAlgoWinograd:ConvBinWinogradRxS,0.094719,0,miopenConvolutionFwdAlgoWinograd,<unused>
160-28-28-1x1-128-28-28-32-0x0-1x1-1x1-0-NCHW-FP16-F=miopenConvolutionFwdAlgoImplicitGEMM:ConvHipImplicitGemmV4R1Fwd,0.10208,0,miopenConvolutionFwdAlgoImplicitGEMM,<unused>;miopenConvolutionFwdAlgoDirect:ConvAsm1x1U,0.10704,0,miopenConvolutionFwdAlgoDirect,<unused>;miopenConvolutionFwdAlgoGEMM:gemm,0.19312,0,rocBlas,<unused>;miopenConvolutionFwdAlgoWinograd:ConvBinWinogradRxS,0.33824,0,miopenConvolutionFwdAlgoWinograd,<unused>
192-28-28-1x1-128-28-28-32-0x0-1x1-1x1-0-NCHW-FP16-F=miopenConvolutionFwdAlgoImplicitGEMM:ConvHipImplicitGemmV4R1Fwd,0.26128,0,miopenConvolutionFwdAlgoImplicitGEMM,<unused>;miopenConvolutionFwdAlgoDirect:ConvAsm1x1U,0.11616,0,miopenConvolutionFwdAlgoDirect,<unused>;miopenConvolutionFwdAlgoGEMM:gemm,0.211679,0,rocBlas,<unused>;miopenConvolutionFwdAlgoWinograd:ConvBinWinogradRxS,0.398719,0,miopenConvolutionFwdAlgoWinograd,<unused>
224-28-28-1x1-128-28-28-32-0x0-1x1-1x1-0-NCHW-FP16-F=miopenConvolutionFwdAlgoImplicitGEMM:ConvHipImplicitGemmV4R1Fwd,0.13264,0,miopenConvolutionFwdAlgoImplicitGEMM,<unused>;miopenConvolutionFwdAlgoDirect:ConvAsm1x1U,0.14128,0,miopenConvolutionFwdAlgoDirect,<unused>;miopenConvolutionFwdAlgoGEMM:gemm,0.240319,0,rocBlas,<unused>;miopenConvolutionFwdAlgoWinograd:ConvBinWinogradRxS,0.458558,0,miopenConvolutionFwdAlgoWinograd,<unused>
256-28-28-1x1-128-28-28-32-0x0-1x1-1x1-0-NCHW-FP16-F=miopenConvolutionFwdAlgoImplicitGEMM:ConvHipImplicitGemmV4R1Fwd,0.168,0,miopenConvolutionFwdAlgoImplicitGEMM,<unused>;miopenConvolutionFwdAlgoDirect:ConvAsm1x1U,0.13712,0,miopenConvolutionFwdAlgoDirect,<unused>;miopenConvolutionFwdAlgoGEMM:gemm,0.256799,0,rocBlas,<unused>;miopenConvolutionFwdAlgoWinograd:ConvBinWinogradRxS,0.521279,0,miopenConvolutionFwdAlgoWinograd,<unused>
288-28-28-1x1-128-28-28-32-0x0-1x1-1x1-0-NCHW-FP16-F=miopenConvolutionFwdAlgoImplicitGEMM:ConvHipImplicitGemmV4R1Fwd,0.16704,0,miopenConvolutionFwdAlgoImplicitGEMM,<unused>;miopenConvolutionFwdAlgoDirect:ConvAsm1x1U,0.17216,0,miopenConvolutionFwdAlgoDirect,<unused>;miopenConvolutionFwdAlgoGEMM:gemm,0.291519,0,rocBlas,<unused>;miopenConvolutionFwdAlgoWinograd:ConvBinWinogradRxS,0.579039,0,miopenConvolutionFwdAlgoWinograd,<unused>
320-28-28-1x1-128-28-28-32-0x0-1x1-1x1-0-NCHW-FP16-F=miopenConvolutionFwdAlgoImplicitGEMM:ConvHipImplicitGemmV4R1Fwd,0.19824,0,miopenConvolutionFwdAlgoImplicitGEMM,<unused>;miopenConvolutionFwdAlgoDirect:ConvAsm1x1U,0.16496,0,miopenConvolutionFwdAlgoDirect,<unused>;miopenConvolutionFwdAlgoGEMM:gemm,0.305279,0,rocBlas,<unused>;miopenConvolutionFwdAlgoWinograd:ConvBinWinogradRxS,0.640159,0,miopenConvolutionFwdAlgoWinograd,<unused>
352-28-28-1x1-128-28-28-32-0x0-1x1-1x1-0-NCHW-FP16-F=miopenConvolutionFwdAlgoImplicitGEMM:ConvHipImplicitGemmV4R1Fwd,0.19472,0,miopenConvolutionFwdAlgoImplicitGEMM,<unused>;miopenConvolutionFwdAlgoDirect:ConvAsm1x1U,0.19552,0,miopenConvolutionFwdAlgoDirect,<unused>;miopenConvolutionFwdAlgoGEMM:gemm,0.345119,0,rocBlas,<unused>;miopenConvolutionFwdAlgoWinograd:ConvBinWinogradRxS,0.701599,0,miopenConvolutionFwdAlgoWinograd,<unused>
384-28-28-1x1-128-28-28-32-0x0-1x1-1x1-0-NCHW-FP16-F=miopenConvolutionFwdAlgoImplicitGEMM:ConvHipImplicitGemmV4R1Fwd,0.23648,0,miopenConvolutionFwdAlgoImplicitGEMM,<unused>;miopenConvolutionFwdAlgoDirect:ConvAsm1x1U,0.22688,0,miopenConvolutionFwdAlgoDirect,<unused>;miopenConvolutionFwdAlgoGEMM:gemm,0.201599,0,rocBlas,<unused>;miopenConvolutionFwdAlgoWinograd:ConvBinWinogradRxS,0.758079,0,miopenConvolutionFwdAlgoWinograd,<unused>
416-28-28-1x1-128-28-28-32-0x0-1x1-1x1-0-NCHW-FP16-F=miopenConvolutionFwdAlgoImplicitGEMM:ConvHipImplicitGemmV4R1Fwd,0.22768,0,miopenConvolutionFwdAlgoImplicitGEMM,<unused>;miopenConvolutionFwdAlgoDirect:ConvAsm1x1U,0.22928,0,miopenConvolutionFwdAlgoDirect,<unused>;miopenConvolutionFwdAlgoGEMM:gemm,0.20736,0,rocBlas,<unused>;miopenConvolutionFwdAlgoWinograd:ConvBinWinogradRxS,0.820639,0,miopenConvolutionFwdAlgoWinograd,<unused>
448-28-28-1x1-128-28-28-32-0x0-1x1-1x1-0-NCHW-FP16-F=miopenConvolutionFwdAlgoImplicitGEMM:ConvHipImplicitGemmV4R1Fwd,0.26912,0,miopenConvolutionFwdAlgoImplicitGEMM,<unused>;miopenConvolutionFwdAlgoDirect:ConvAsm1x1U,0.24784,0,miopenConvolutionFwdAlgoDirect,<unused>;miopenConvolutionFwdAlgoGEMM:gemm,0.224479,0,rocBlas,<unused>;miopenConvolutionFwdAlgoWinograd:ConvBinWinogradRxS,0.877598,0,miopenConvolutionFwdAlgoWinograd,<unused>
480-28-28-1x1-128-28-28-32-0x0-1x1-1x1-0-NCHW-FP16-F=miopenConvolutionFwdAlgoImplicitGEMM:ConvHipImplicitGemmV4R1Fwd,0.2544,0,miopenConvolutionFwdAlgoImplicitGEMM,<unused>;miopenConvolutionFwdAlgoDirect:ConvAsm1x1U,0.268,0,miopenConvolutionFwdAlgoDirect,<unused>;miopenConvolutionFwdAlgoGEMM:gemm,0.23248,0,rocBlas,<unused>;miopenConvolutionFwdAlgoWinograd:ConvBinWinogradRxS,0.939038,0,miopenConvolutionFwdAlgoWinograd,<unused>
512-28-28-1x1-256-28-28-32-0x0-1x1-1x1-0-NCHW-FP16-F=miopenConvolutionFwdAlgoImplicitGEMM:ConvHipImplicitGemmV4R1Fwd,0.639999,0,miopenConvolutionFwdAlgoImplicitGEMM,<unused>;miopenConvolutionFwdAlgoDirect:ConvAsm1x1U,0.552319,0,miopenConvolutionFwdAlgoDirect,<unused>;miopenConvolutionFwdAlgoGEMM:gemm,0.450879,0,rocBlas,<unused>;miopenConvolutionFwdAlgoWinograd:ConvBinWinogradRxS,1.89104,0,miopenConvolutionFwdAlgoWinograd,<unused>
256-14-14-1x1-128-14-14-32-0x0-1x1-1x1-0-NCHW-FP16-F=miopenConvolutionFwdAlgoImplicitGEMM:ConvHipImplicitGemmV4R1Fwd,0.06624,0,miopenConvolutionFwdAlgoImplicitGEMM,<unused>;miopenConvolutionFwdAlgoDirect:ConvAsm1x1U,0.06368,0,miopenConvolutionFwdAlgoDirect,<unused>;miopenConvolutionFwdAlgoGEMM:gemm,0.22832,0,rocBlas,<unused>;miopenConvolutionFwdAlgoWinograd:ConvBinWinogradRxS,0.187839,0,miopenConvolutionFwdAlgoWinograd,<unused>
128-14-14-3x3-32-14-14-32-1x1-1x1-1x1-0-NCHW-FP16-F=miopenConvolutionFwdAlgoImplicitGEMM:ConvHipImplicitGemmV4R1Fwd,0.13536,0,miopenConvolutionFwdAlgoImplicitGEMM,<unused>;miopenConvolutionFwdAlgoDirect:ConvOclDirectFwd,0.23376,0,miopenConvolutionFwdAlgoDirect,<unused>;miopenConvolutionFwdAlgoGEMM:gemm,2.87232,451584,rocBlas,<unused>;miopenConvolutionFwdAlgoWinograd:ConvBinWinogradRxSf2x3g1,0.0432,0,miopenConvolutionFwdAlgoWinograd,<unused>
288-14-14-1x1-128-14-14-32-0x0-1x1-1x1-0-NCHW-FP16-F=miopenConvolutionFwdAlgoImplicitGEMM:ConvHipImplicitGemmV4R1Fwd,0.06032,0,miopenConvolutionFwdAlgoImplicitGEMM,<unused>;miopenConvolutionFwdAlgoDirect:ConvAsm1x1U,0.09104,0,miopenConvolutionFwdAlgoDirect,<unused>;miopenConvolutionFwdAlgoGEMM:gemm,0.2792,0,rocBlas,<unused>;miopenConvolutionFwdAlgoWinograd:ConvBinWinogradRxS,0.205119,0,miopenConvolutionFwdAlgoWinograd,<unused>
320-14-14-1x1-128-14-14-32-0x0-1x1-1x1-0-NCHW-FP16-F=miopenConvolutionFwdAlgoImplicitGEMM:ConvHipImplicitGemmV4R1Fwd,0.0824,0,miopenConvolutionFwdAlgoImplicitGEMM,<unused>;miopenConvolutionFwdAlgoDirect:ConvAsm1x1U,0.09952,0,miopenConvolutionFwdAlgoDirect,<unused>;miopenConvolutionFwdAlgoGEMM:gemm,0.2632,0,rocBlas,<unused>;miopenConvolutionFwdAlgoWinograd:ConvBinWinogradRxS,0.224959,0,miopenConvolutionFwdAlgoWinograd,<unused>
352-14-14-1x1-128-14-14-32-0x0-1x1-1x1-0-NCHW-FP16-F=miopenConvolutionFwdAlgoImplicitGEMM:ConvHipImplicitGemmV4R1Fwd,0.06816,0,miopenConvolutionFwdAlgoImplicitGEMM,<unused>;miopenConvolutionFwdAlgoDirect:ConvAsm1x1U,0.10752,0,miopenConvolutionFwdAlgoDirect,<unused>;miopenConvolutionFwdAlgoGEMM:gemm,0.323199,0,rocBlas,<unused>;miopenConvolutionFwdAlgoWinograd:ConvBinWinogradRxS,0.244959,0,miopenConvolutionFwdAlgoWinograd,<unused>
384-14-14-1x1-128-14-14-32-0x0-1x1-1x1-0-NCHW-FP16-F=miopenConvolutionFwdAlgoImplicitGEMM:ConvHipImplicitGemmV4R1Fwd,0.08896,0,miopenConvolutionFwdAlgoImplicitGEMM,<unused>;miopenConvolutionFwdAlgoDirect:ConvAsm1x1U,0.11536,0,miopenConvolutionFwdAlgoDirect,<unused>;miopenConvolutionFwdAlgoGEMM:gemm,0.307039,0,rocBlas,<unused>;miopenConvolutionFwdAlgoWinograd:ConvBinWinogradRxS,0.26704,0,miopenConvolutionFwdAlgoWinograd,<unused>
416-14-14-1x1-128-14-14-32-0x0-1x1-1x1-0-NCHW-FP16-F=miopenConvolutionFwdAlgoImplicitGEMM:ConvHipImplicitGemmV4R1Fwd,0.08112,0,miopenConvolutionFwdAlgoImplicitGEMM,<unused>;miopenConvolutionFwdAlgoDirect:ConvAsm1x1U,0.12592,0,miopenConvolutionFwdAlgoDirect,<unused>;miopenConvolutionFwdAlgoGEMM:gemm,0.365119,0,rocBlas,<unused>;miopenConvolutionFwdAlgoWinograd:ConvBinWinogradRxS,0.283999,0,miopenConvolutionFwdAlgoWinograd,<unused>
448-14-14-1x1-128-14-14-32-0x0-1x1-1x1-0-NCHW-FP16-F=miopenConvolutionFwdAlgoImplicitGEMM:ConvHipImplicitGemmV4R1Fwd,0.09008,0,miopenConvolutionFwdAlgoImplicitGEMM,<unused>;miopenConvolutionFwdAlgoDirect:ConvAsm1x1U,0.13344,0,miopenConvolutionFwdAlgoDirect,<unused>;miopenConvolutionFwdAlgoGEMM:gemm,0.351359,0,rocBlas,<unused>;miopenConvolutionFwdAlgoWinograd:ConvBinWinogradRxS,0.30384,0,miopenConvolutionFwdAlgoWinograd,<unused>
480-14-14-1x1-128-14-14-32-0x0-1x1-1x1-0-NCHW-FP16-F=miopenConvolutionFwdAlgoImplicitGEMM:ConvHipImplicitGemmV4R1Fwd,0.0912,0,miopenConvolutionFwdAlgoImplicitGEMM,<unused>;miopenConvolutionFwdAlgoDirect:ConvAsm1x1U,0.1408,0,miopenConvolutionFwdAlgoDirect,<unused>;miopenConvolutionFwdAlgoGEMM:gemm,0.406079,0,rocBlas,<unused>;miopenConvolutionFwdAlgoWinograd:ConvBinWinogradRxS,0.323359,0,miopenConvolutionFwdAlgoWinograd,<unused>
512-14-14-1x1-128-14-14-32-0x0-1x1-1x1-0-NCHW-FP16-F=miopenConvolutionFwdAlgoImplicitGEMM:ConvHipImplicitGemmV4R1Fwd,0.1904,0,miopenConvolutionFwdAlgoImplicitGEMM,<unused>;miopenConvolutionFwdAlgoDirect:ConvAsm1x1U,0.10784,0,miopenConvolutionFwdAlgoDirect,<unused>;miopenConvolutionFwdAlgoGEMM:gemm,0.393119,0,rocBlas,<unused>;miopenConvolutionFwdAlgoWinograd:ConvBinWinogradRxS,0.345599,0,miopenConvolutionFwdAlgoWinograd,<unused>
544-14-14-1x1-128-14-14-32-0x0-1x1-1x1-0-NCHW-FP16-F=miopenConvolutionFwdAlgoImplicitGEMM:ConvHipImplicitGemmV4R1Fwd,0.10832,0,miopenConvolutionFwdAlgoImplicitGEMM,<unused>;miopenConvolutionFwdAlgoDirect:ConvAsm1x1U,0.15808,0,miopenConvolutionFwdAlgoDirect,<unused>;miopenConvolutionFwdAlgoGEMM:gemm,0.452159,0,rocBlas,<unused>;miopenConvolutionFwdAlgoWinograd:ConvBinWinogradRxS,0.363519,0,miopenConvolutionFwdAlgoWinograd,<unused>
576-14-14-1x1-128-14-14-32-0x0-1x1-1x1-0-NCHW-FP16-F=miopenConvolutionFwdAlgoImplicitGEMM:ConvHipImplicitGemmV4R1Fwd,0.11408,0,miopenConvolutionFwdAlgoImplicitGEMM,<unused>;miopenConvolutionFwdAlgoDirect:ConvAsm1x1U,0.12448,0,miopenConvolutionFwdAlgoDirect,<unused>;miopenConvolutionFwdAlgoGEMM:gemm,0.437119,0,rocBlas,<unused>;miopenConvolutionFwdAlgoWinograd:ConvBinWinogradRxS,0.382719,0,miopenConvolutionFwdAlgoWinograd,<unused>
608-14-14-1x1-128-14-14-32-0x0-1x1-1x1-0-NCHW-FP16-F=miopenConvolutionFwdAlgoImplicitGEMM:ConvHipImplicitGemmV4R1Fwd,0.11312,0,miopenConvolutionFwdAlgoImplicitGEMM,<unused>;miopenConvolutionFwdAlgoDirect:ConvAsm1x1U,0.1744,0,miopenConvolutionFwdAlgoDirect,<unused>;miopenConvolutionFwdAlgoGEMM:gemm,0.1248,0,rocBlas,<unused>;miopenConvolutionFwdAlgoWinograd:ConvBinWinogradRxS,0.4024,0,miopenConvolutionFwdAlgoWinograd,<unused>
640-14-14-1x1-128-14-14-32-0x0-1x1-1x1-0-NCHW-FP16-F=miopenConvolutionFwdAlgoImplicitGEMM:ConvHipImplicitGemmV4R1Fwd,0.14176,0,miopenConvolutionFwdAlgoImplicitGEMM,<unused>;miopenConvolutionFwdAlgoDirect:ConvAsm1x1U,0.14208,0,miopenConvolutionFwdAlgoDirect,<unused>;miopenConvolutionFwdAlgoGEMM:gemm,0.12432,0,rocBlas,<unused>;miopenConvolutionFwdAlgoWinograd:ConvBinWinogradRxS,0.42416,0,miopenConvolutionFwdAlgoWinograd,<unused>
672-14-14-1x1-128-14-14-32-0x0-1x1-1x1-0-NCHW-FP16-F=miopenConvolutionFwdAlgoImplicitGEMM:ConvHipImplicitGemmV4R1Fwd,0.18976,0,miopenConvolutionFwdAlgoImplicitGEMM,<unused>;miopenConvolutionFwdAlgoDirect:ConvAsm1x1U,0.19552,0,miopenConvolutionFwdAlgoDirect,<unused>;miopenConvolutionFwdAlgoGEMM:gemm,0.13712,0,rocBlas,<unused>;miopenConvolutionFwdAlgoWinograd:ConvBinWinogradRxS,0.441599,0,miopenConvolutionFwdAlgoWinograd,<unused>
704-14-14-1x1-128-14-14-32-0x0-1x1-1x1-0-NCHW-FP16-F=miopenConvolutionFwdAlgoImplicitGEMM:ConvHipImplicitGemmV4R1Fwd,0.13872,0,miopenConvolutionFwdAlgoImplicitGEMM,<unused>;miopenConvolutionFwdAlgoDirect:ConvAsm1x1U,0.20672,0,miopenConvolutionFwdAlgoDirect,<unused>;miopenConvolutionFwdAlgoGEMM:gemm,0.161599,0,rocBlas,<unused>;miopenConvolutionFwdAlgoWinograd:ConvBinWinogradRxS,0.461119,0,miopenConvolutionFwdAlgoWinograd,<unused>
736-14-14-1x1-128-14-14-32-0x0-1x1-1x1-0-NCHW-FP16-F=miopenConvolutionFwdAlgoImplicitGEMM:ConvHipImplicitGemmV4R1Fwd,0.26032,0,miopenConvolutionFwdAlgoImplicitGEMM,<unused>;miopenConvolutionFwdAlgoDirect:ConvAsm1x1U,0.16016,0,miopenConvolutionFwdAlgoDirect,<unused>;miopenConvolutionFwdAlgoGEMM:gemm,0.1568,0,rocBlas,<unused>;miopenConvolutionFwdAlgoWinograd:ConvBinWinogradRxS,0.481919,0,miopenConvolutionFwdAlgoWinograd,<unused>
768-14-14-1x1-128-14-14-32-0x0-1x1-1x1-0-NCHW-FP16-F=miopenConvolutionFwdAlgoImplicitGEMM:ConvHipImplicitGemmV4R1Fwd,0.164799,0,miopenConvolutionFwdAlgoImplicitGEMM,<unused>;miopenConvolutionFwdAlgoDirect:ConvAsm1x1U,0.16736,0,miopenConvolutionFwdAlgoDirect,<unused>;miopenConvolutionFwdAlgoGEMM:gemm,0.17296,0,rocBlas,<unused>;miopenConvolutionFwdAlgoWinograd:ConvBinWinogradRxS,0.502559,0,miopenConvolutionFwdAlgoWinograd,<unused>
800-14-14-1x1-128-14-14-32-0x0-1x1-1x1-0-NCHW-FP16-F=miopenConvolutionFwdAlgoImplicitGEMM:ConvHipImplicitGemmV4R1Fwd,0.15184,0,miopenConvolutionFwdAlgoImplicitGEMM,<unused>;miopenConvolutionFwdAlgoDirect:ConvAsm1x1U,0.2312,0,miopenConvolutionFwdAlgoDirect,<unused>;miopenConvolutionFwdAlgoGEMM:gemm,0.18272,0,rocBlas,<unused>;miopenConvolutionFwdAlgoWinograd:ConvBinWinogradRxS,0.520319,0,miopenConvolutionFwdAlgoWinograd,<unused>
832-14-14-1x1-128-14-14-32-0x0-1x1-1x1-0-NCHW-FP16-F=miopenConvolutionFwdAlgoImplicitGEMM:ConvHipImplicitGemmV4R1Fwd,0.30544,0,miopenConvolutionFwdAlgoImplicitGEMM,<unused>;miopenConvolutionFwdAlgoDirect:ConvAsm1x1U,0.17904,0,miopenConvolutionFwdAlgoDirect,<unused>;miopenConvolutionFwdAlgoGEMM:gemm,0.19536,0,rocBlas,<unused>;miopenConvolutionFwdAlgoWinograd:ConvBinWinogradRxS,0.540479,0,miopenConvolutionFwdAlgoWinograd,<unused>
864-14-14-1x1-128-14-14-32-0x0-1x1-1x1-0-NCHW-FP16-F=miopenConvolutionFwdAlgoImplicitGEMM:ConvHipImplicitGemmV4R1Fwd,0.30624,0,miopenConvolutionFwdAlgoImplicitGEMM,<unused>;miopenConvolutionFwdAlgoDirect:ConvAsm1x1U,0.18752,0,miopenConvolutionFwdAlgoDirect,<unused>;miopenConvolutionFwdAlgoGEMM:gemm,0.19008,0,rocBlas,<unused>;miopenConvolutionFwdAlgoWinograd:ConvBinWinogradRxS,0.560959,0,miopenConvolutionFwdAlgoWinograd,<unused>
896-14-14-1x1-128-14-14-32-0x0-1x1-1x1-0-NCHW-FP16-F=miopenConvolutionFwdAlgoImplicitGEMM:ConvHipImplicitGemmV4R1Fwd,0.19152,0,miopenConvolutionFwdAlgoImplicitGEMM,<unused>;miopenConvolutionFwdAlgoDirect:ConvAsm1x1U,0.19184,0,miopenConvolutionFwdAlgoDirect,<unused>;miopenConvolutionFwdAlgoGEMM:gemm,0.192319,0,rocBlas,<unused>;miopenConvolutionFwdAlgoWinograd:ConvBinWinogradRxS,0.582558,0,miopenConvolutionFwdAlgoWinograd,<unused>
928-14-14-1x1-128-14-14-32-0x0-1x1-1x1-0-NCHW-FP16-F=miopenConvolutionFwdAlgoImplicitGEMM:ConvHipImplicitGemmV4R1Fwd,0.17504,0,miopenConvolutionFwdAlgoImplicitGEMM,<unused>;miopenConvolutionFwdAlgoDirect:ConvAsm1x1U,0.19184,0,miopenConvolutionFwdAlgoDirect,<unused>;miopenConvolutionFwdAlgoGEMM:gemm,0.204799,0,rocBlas,<unused>;miopenConvolutionFwdAlgoWinograd:ConvBinWinogradRxS,0.600158,0,miopenConvolutionFwdAlgoWinograd,<unused>
960-14-14-1x1-128-14-14-32-0x0-1x1-1x1-0-NCHW-FP16-F=miopenConvolutionFwdAlgoImplicitGEMM:ConvHipImplicitGemmV4R1Fwd,0.18704,0,miopenConvolutionFwdAlgoImplicitGEMM,<unused>;miopenConvolutionFwdAlgoDirect:ConvAsm1x1U,0.20576,0,miopenConvolutionFwdAlgoDirect,<unused>;miopenConvolutionFwdAlgoGEMM:gemm,0.20848,0,rocBlas,<unused>;miopenConvolutionFwdAlgoWinograd:ConvBinWinogradRxS,0.620319,0,miopenConvolutionFwdAlgoWinograd,<unused>
992-14-14-1x1-128-14-14-32-0x0-1x1-1x1-0-NCHW-FP16-F=miopenConvolutionFwdAlgoImplicitGEMM:ConvHipImplicitGemmV4R1Fwd,0.1832,0,miopenConvolutionFwdAlgoImplicitGEMM,<unused>;miopenConvolutionFwdAlgoDirect:ConvAsm1x1U,0.21392,0,miopenConvolutionFwdAlgoDirect,<unused>;miopenConvolutionFwdAlgoGEMM:gemm,0.22,0,rocBlas,<unused>;miopenConvolutionFwdAlgoWinograd:ConvBinWinogradRxS,0.639678,0,miopenConvolutionFwdAlgoWinograd,<unused>
1024-14-14-1x1-512-14-14-32-0x0-1x1-1x1-0-NCHW-FP16-F=miopenConvolutionFwdAlgoImplicitGEMM:ConvHipImplicitGemmV4R1Fwd,0.665439,0,miopenConvolutionFwdAlgoImplicitGEMM,<unused>;miopenConvolutionFwdAlgoDirect:ConvAsm1x1U,0.695359,0,miopenConvolutionFwdAlgoDirect,<unused>;miopenConvolutionFwdAlgoGEMM:gemm,0.616479,0,rocBlas,<unused>;miopenConvolutionFwdAlgoWinograd:ConvBinWinogradRxS,2.25663,0,miopenConvolutionFwdAlgoWinograd,<unused>
512-7-7-1x1-128-7-7-32-0x0-1x1-1x1-0-NCHW-FP16-F=miopenConvolutionFwdAlgoImplicitGEMM:ConvHipImplicitGemmV4R1Fwd,0.06016,0,miopenConvolutionFwdAlgoImplicitGEMM,<unused>;miopenConvolutionFwdAlgoDirect:ConvAsm1x1U,0.05328,0,miopenConvolutionFwdAlgoDirect,<unused>;miopenConvolutionFwdAlgoGEMM:gemm,0.13344,0,rocBlas,<unused>;miopenConvolutionFwdAlgoWinograd:ConvBinWinogradRxS,0.18944,0,miopenConvolutionFwdAlgoWinograd,<unused>
128-7-7-3x3-32-7-7-32-1x1-1x1-1x1-0-NCHW-FP16-F=miopenConvolutionFwdAlgoImplicitGEMM:ConvHipImplicitGemmV4R1Fwd,0.11008,0,miopenConvolutionFwdAlgoImplicitGEMM,<unused>;miopenConvolutionFwdAlgoDirect:ConvOclDirectFwd,0.08784,0,miopenConvolutionFwdAlgoDirect,<unused>;miopenConvolutionFwdAlgoGEMM:gemm,6.84544,112896,rocBlas,<unused>;miopenConvolutionFwdAlgoWinograd:ConvBinWinogradRxS,0.04432,0,miopenConvolutionFwdAlgoWinograd,<unused>
544-7-7-1x1-128-7-7-32-0x0-1x1-1x1-0-NCHW-FP16-F=miopenConvolutionFwdAlgoImplicitGEMM:ConvHipImplicitGemmV4R1Fwd,0.0608,0,miopenConvolutionFwdAlgoImplicitGEMM,<unused>;miopenConvolutionFwdAlgoDirect:ConvAsm1x1U,0.07568,0,miopenConvolutionFwdAlgoDirect,<unused>;miopenConvolutionFwdAlgoGEMM:gemm,0.1368,0,rocBlas,<unused>;miopenConvolutionFwdAlgoWinograd:ConvBinWinogradRxS,0.1992,0,miopenConvolutionFwdAlgoWinograd,<unused>
576-7-7-1x1-128-7-7-32-0x0-1x1-1x1-0-NCHW-FP16-F=miopenConvolutionFwdAlgoImplicitGEMM:ConvHipImplicitGemmV4R1Fwd,0.06368,0,miopenConvolutionFwdAlgoImplicitGEMM,<unused>;miopenConvolutionFwdAlgoDirect:ConvAsm1x1U,0.05376,0,miopenConvolutionFwdAlgoDirect,<unused>;miopenConvolutionFwdAlgoGEMM:gemm,0.13968,0,rocBlas,<unused>;miopenConvolutionFwdAlgoWinograd:ConvBinWinogradRxS,0.207999,0,miopenConvolutionFwdAlgoWinograd,<unused>
608-7-7-1x1-128-7-7-32-0x0-1x1-1x1-0-NCHW-FP16-F=miopenConvolutionFwdAlgoImplicitGEMM:ConvHipImplicitGemmV4R1Fwd,0.06768,0,miopenConvolutionFwdAlgoImplicitGEMM,<unused>;miopenConvolutionFwdAlgoDirect:ConvAsm1x1U,0.05536,0,miopenConvolutionFwdAlgoDirect,<unused>;miopenConvolutionFwdAlgoGEMM:gemm,0.14448,0,rocBlas,<unused>;miopenConvolutionFwdAlgoWinograd:ConvBinWinogradRxS,0.217919,0,miopenConvolutionFwdAlgoWinograd,<unused>
640-7-7-1x1-128-7-7-32-0x0-1x1-1x1-0-NCHW-FP16-F=miopenConvolutionFwdAlgoImplicitGEMM:ConvHipImplicitGemmV4R1Fwd,0.07056,0,miopenConvolutionFwdAlgoImplicitGEMM,<unused>;miopenConvolutionFwdAlgoDirect:ConvAsm1x1U,0.05328,0,miopenConvolutionFwdAlgoDirect,<unused>;miopenConvolutionFwdAlgoGEMM:gemm,0.146879,0,rocBlas,<unused>;miopenConvolutionFwdAlgoWinograd:ConvBinWinogradRxS,0.227679,0,miopenConvolutionFwdAlgoWinograd,<unused>
672-7-7-1x1-128-7-7-32-0x0-1x1-1x1-0-NCHW-FP16-F=miopenConvolutionFwdAlgoImplicitGEMM:ConvHipImplicitGemmV4R1Fwd,0.07632,0,miopenConvolutionFwdAlgoImplicitGEMM,<unused>;miopenConvolutionFwdAlgoDirect:ConvAsm1x1U,0.06144,0,miopenConvolutionFwdAlgoDirect,<unused>;miopenConvolutionFwdAlgoGEMM:gemm,0.15552,0,rocBlas,<unused>;miopenConvolutionFwdAlgoWinograd:ConvBinWinogradRxSf2x3g1,0.239039,0,miopenConvolutionFwdAlgoWinograd,<unused>
704-7-7-1x1-128-7-7-32-0x0-1x1-1x1-0-NCHW-FP16-F=miopenConvolutionFwdAlgoImplicitGEMM:ConvHipImplicitGemmV4R1Fwd,0.07568,0,miopenConvolutionFwdAlgoImplicitGEMM,<unused>;miopenConvolutionFwdAlgoDirect:ConvAsm1x1U,0.05968,0,miopenConvolutionFwdAlgoDirect,<unused>;miopenConvolutionFwdAlgoGEMM:gemm,0.16272,0,rocBlas,<unused>;miopenConvolutionFwdAlgoWinograd:ConvBinWinogradRxS,0.247519,0,miopenConvolutionFwdAlgoWinograd,<unused>
736-7-7-1x1-128-7-7-32-0x0-1x1-1x1-0-NCHW-FP16-F=miopenConvolutionFwdAlgoImplicitGEMM:ConvHipImplicitGemmV4R1Fwd,0.0792,0,miopenConvolutionFwdAlgoImplicitGEMM,<unused>;miopenConvolutionFwdAlgoDirect:ConvAsm1x1U,0.0672,0,miopenConvolutionFwdAlgoDirect,<unused>;miopenConvolutionFwdAlgoGEMM:gemm,0.171039,0,rocBlas,<unused>;miopenConvolutionFwdAlgoWinograd:ConvBinWinogradRxS,0.25856,0,miopenConvolutionFwdAlgoWinograd,<unused>
768-7-7-1x1-128-7-7-32-0x0-1x1-1x1-0-NCHW-FP16-F=miopenConvolutionFwdAlgoImplicitGEMM:ConvHipImplicitGemmV4R1Fwd,0.08336,0,miopenConvolutionFwdAlgoImplicitGEMM,<unused>;miopenConvolutionFwdAlgoDirect:ConvAsm1x1U,0.07056,0,miopenConvolutionFwdAlgoDirect,<unused>;miopenConvolutionFwdAlgoGEMM:gemm,0.18384,0,rocBlas,<unused>;miopenConvolutionFwdAlgoWinograd:ConvBinWinogradRxSf2x3g1,0.271519,0,miopenConvolutionFwdAlgoWinograd,<unused>
800-7-7-1x1-128-7-7-32-0x0-1x1-1x1-0-NCHW-FP16-F=miopenConvolutionFwdAlgoImplicitGEMM:ConvHipImplicitGemmV4R1Fwd,0.08496,0,miopenConvolutionFwdAlgoImplicitGEMM,<unused>;miopenConvolutionFwdAlgoDirect:ConvAsm1x1U,0.10448,0,miopenConvolutionFwdAlgoDirect,<unused>;miopenConvolutionFwdAlgoGEMM:gemm,0.19216,0,rocBlas,<unused>;miopenConvolutionFwdAlgoWinograd:ConvBinWinogradRxSf2x3g1,0.280959,0,miopenConvolutionFwdAlgoWinograd,<unused>
832-7-7-1x1-128-7-7-32-0x0-1x1-1x1-0-NCHW-FP16-F=miopenConvolutionFwdAlgoImplicitGEMM:ConvHipImplicitGemmV4R1Fwd,0.08832,0,miopenConvolutionFwdAlgoImplicitGEMM,<unused>;miopenConvolutionFwdAlgoDirect:ConvAsm1x1U,0.06816,0,miopenConvolutionFwdAlgoDirect,<unused>;miopenConvolutionFwdAlgoGEMM:gemm,0.194079,0,rocBlas,<unused>;miopenConvolutionFwdAlgoWinograd:ConvBinWinogradRxS,0.29088,0,miopenConvolutionFwdAlgoWinograd,<unused>
864-7-7-1x1-128-7-7-32-0x0-1x1-1x1-0-NCHW-FP16-F=miopenConvolutionFwdAlgoImplicitGEMM:ConvHipImplicitGemmV4R1Fwd,0.0912,0,miopenConvolutionFwdAlgoImplicitGEMM,<unused>;miopenConvolutionFwdAlgoDirect:ConvAsm1x1U,0.11328,0,miopenConvolutionFwdAlgoDirect,<unused>;miopenConvolutionFwdAlgoGEMM:gemm,0.19536,0,rocBlas,<unused>;miopenConvolutionFwdAlgoWinograd:ConvBinWinogradRxS,0.30272,0,miopenConvolutionFwdAlgoWinograd,<unused>
896-7-7-1x1-128-7-7-32-0x0-1x1-1x1-0-NCHW-FP16-F=miopenConvolutionFwdAlgoImplicitGEMM:ConvHipImplicitGemmV4R1Fwd,0.09552,0,miopenConvolutionFwdAlgoImplicitGEMM,<unused>;miopenConvolutionFwdAlgoDirect:ConvAsm1x1U,0.11728,0,miopenConvolutionFwdAlgoDirect,<unused>;miopenConvolutionFwdAlgoGEMM:gemm,0.210559,0,rocBlas,<unused>;miopenConvolutionFwdAlgoWinograd:ConvBinWinogradRxS,0.3112,0,miopenConvolutionFwdAlgoWinograd,<unused>
928-7-7-1x1-128-7-7-32-0x0-1x1-1x1-0-NCHW-FP16-F=miopenConvolutionFwdAlgoImplicitGEMM:ConvHipImplicitGemmV4R1Fwd,0.09744,0,miopenConvolutionFwdAlgoImplicitGEMM,<unused>;miopenConvolutionFwdAlgoDirect:ConvAsm1x1U,0.07584,0,miopenConvolutionFwdAlgoDirect,<unused>;miopenConvolutionFwdAlgoGEMM:gemm,0.20976,0,rocBlas,<unused>;miopenConvolutionFwdAlgoWinograd:ConvBinWinogradRxS,0.321119,0,miopenConvolutionFwdAlgoWinograd,<unused>
960-7-7-1x1-128-7-7-32-0x0-1x1-1x1-0-NCHW-FP16-F=miopenConvolutionFwdAlgoImplicitGEMM:ConvHipImplicitGemmV4R1Fwd,0.1016,0,miopenConvolutionFwdAlgoImplicitGEMM,<unused>;miopenConvolutionFwdAlgoDirect:ConvAsm1x1U,0.12416,0,miopenConvolutionFwdAlgoDirect,<unused>;miopenConvolutionFwdAlgoGEMM:gemm,0.215199,0,rocBlas,<unused>;miopenConvolutionFwdAlgoWinograd:ConvBinWinogradRxS,0.33408,0,miopenConvolutionFwdAlgoWinograd,<unused>
992-7-7-1x1-128-7-7-32-0x0-1x1-1x1-0-NCHW-FP16-F=miopenConvolutionFwdAlgoImplicitGEMM:ConvHipImplicitGemmV4R1Fwd,0.10432,0,miopenConvolutionFwdAlgoImplicitGEMM,<unused>;miopenConvolutionFwdAlgoDirect:ConvAsm1x1U,0.12672,0,miopenConvolutionFwdAlgoDirect,<unused>;miopenConvolutionFwdAlgoGEMM:gemm,0.2256,0,rocBlas,<unused>;miopenConvolutionFwdAlgoWinograd:ConvBinWinogradRxS,0.341759,0,miopenConvolutionFwdAlgoWinograd,<unused>
3-299-299-3x3-32-149-149-32-0x0-2x2-1x1-0-NCHW-FP32-F=miopenConvolutionFwdAlgoDirect:ConvOclDirectFwdGen,2.31296,0,miopenConvolutionFwdAlgoDirect,<unused>;miopenConvolutionFwdAlgoGEMM:gemm,6.54848,2397708,rocBlas,<unused>;miopenConvolutionFwdAlgoWinograd:ConvBinWinogradRxSf2x3g1,0.558559,0,miopenConvolutionFwdAlgoWinograd,<unused>
32-149-149-3x3-32-147-147-32-0x0-1x1-1x1-0-NCHW-FP32-F=miopenConvolutionFwdAlgoImplicitGEMM:ConvHipImplicitGemmV4R1Fwd,1.79568,0,miopenConvolutionFwdAlgoImplicitGEMM,<unused>;miopenConvolutionFwdAlgoDirect:ConvOclDirectFwd,6.52191,0,miopenConvolutionFwdAlgoDirect,<unused>;miopenConvolutionFwdAlgoGEMM:gemm,5.01248,24893568,rocBlas,<unused>;miopenConvolutionFwdAlgoWinograd:ConvBinWinogradRxS,0.827679,0,miopenConvolutionFwdAlgoWinograd,<unused>
32-147-147-3x3-64-147-147-32-1x1-1x1-1x1-0-NCHW-FP32-F=miopenConvolutionFwdAlgoWinograd:ConvBinWinograd3x3U,1.56112,0,miopenConvolutionFwdAlgoWinograd,<unused>
64-73-73-1x1-80-73-73-32-0x0-1x1-1x1-0-NCHW-FP32-F=miopenConvolutionFwdAlgoDirect:ConvOclDirectFwd1x1,0.26224,0,miopenConvolutionFwdAlgoDirect,<unused>;miopenConvolutionFwdAlgoGEMM:gemm,0.385119,0,rocBlas,<unused>;miopenConvolutionFwdAlgoWinograd:ConvBinWinogradRxSf3x2,0.58,0,miopenConvolutionFwdAlgoWinograd,<unused>
80-73-73-3x3-192-71-71-32-0x0-1x1-1x1-0-NCHW-FP32-F=miopenConvolutionFwdAlgoImplicitGEMM:ConvHipImplicitGemmV4R1Fwd,5.15887,0,miopenConvolutionFwdAlgoImplicitGEMM,<unused>;miopenConvolutionFwdAlgoDirect:ConvOclDirectFwd,32.9465,0,miopenConvolutionFwdAlgoDirect,<unused>;miopenConvolutionFwdAlgoGEMM:gemm,6.144,14518080,rocBlas,<unused>;miopenConvolutionFwdAlgoWinograd:ConvBinWinogradRxS,2.30624,0,miopenConvolutionFwdAlgoWinograd,<unused>
192-35-35-1x1-128-35-35-32-0x0-1x1-1x1-0-NCHW-FP32-F=miopenConvolutionFwdAlgoImplicitGEMM:ConvHipImplicitGemmV4R1Fwd,0.31408,0,miopenConvolutionFwdAlgoImplicitGEMM,<unused>;miopenConvolutionFwdAlgoDirect:ConvOclDirectFwd1x1,0.25152,0,miopenConvolutionFwdAlgoDirect,<unused>;miopenConvolutionFwdAlgoGEMM:gemm,0.2368,0,rocBlas,<unused>;miopenConvolutionFwdAlgoWinograd:ConvBinWinogradRxSf3x2,0.476159,0,miopenConvolutionFwdAlgoWinograd,<unused>
192-35-35-1x1-48-35-35-32-0x0-1x1-1x1-0-NCHW-FP32-F=miopenConvolutionFwdAlgoDirect:ConvOclDirectFwd1x1,0.1048,0,miopenConvolutionFwdAlgoDirect,<unused>;miopenConvolutionFwdAlgoGEMM:gemm,0.15168,0,rocBlas,<unused>;miopenConvolutionFwdAlgoWinograd:ConvBinWinogradRxSf3x2,0.247519,0,miopenConvolutionFwdAlgoWinograd,<unused>
48-35-35-5x5-64-35-35-32-2x2-1x1-1x1-0-NCHW-FP32-F=miopenConvolutionFwdAlgoImplicitGEMM:ConvHipImplicitGemmV4R1Fwd,0.833599,0,miopenConvolutionFwdAlgoImplicitGEMM,<unused>;miopenConvolutionFwdAlgoDirect:ConvOclDirectFwd,4.08736,0,miopenConvolutionFwdAlgoDirect,<unused>;miopenConvolutionFwdAlgoGEMM:gemm,2.57536,5880000,rocBlas,<unused>;miopenConvolutionFwdAlgoWinograd:ConvBinWinogradRxSf2x3g1,0.46896,0,miopenConvolutionFwdAlgoWinograd,<unused>
64-35-35-3x3-96-35-35-32-1x1-1x1-1x1-0-NCHW-FP32-F=miopenConvolutionFwdAlgoWinograd:ConvBinWinograd3x3U,0.26976,0,miopenConvolutionFwdAlgoWinograd,<unused>
96-35-35-3x3-96-35-35-32-1x1-1x1-1x1-0-NCHW-FP32-F=miopenConvolutionFwdAlgoWinograd:ConvBinWinograd3x3U,0.37728,0,miopenConvolutionFwdAlgoWinograd,<unused>
192-35-35-1x1-32-35-35-32-0x0-1x1-1x1-0-NCHW-FP32-F=miopenConvolutionFwdAlgoImplicitGEMM:ConvHipImplicitGemmV4R1Fwd,0.14176,0,miopenConvolutionFwdAlgoImplicitGEMM,<unused>;miopenConvolutionFwdAlgoDirect:ConvAsm1x1U,0.076,0,miopenConvolutionFwdAlgoDirect,<unused>;miopenConvolutionFwdAlgoGEMM:gemm,0.10064,0,rocBlas,<unused>;miopenConvolutionFwdAlgoWinograd:ConvBinWinogradRxSf3x2,0.156,0,miopenConvolutionFwdAlgoWinograd,<unused>
256-35-35-1x1-128-35-35-32-0x0-1x1-1x1-0-NCHW-FP32-F=miopenConvolutionFwdAlgoImplicitGEMM:ConvHipImplicitGemmV4R1Fwd,0.43072,0,miopenConvolutionFwdAlgoImplicitGEMM,<unused>;miopenConvolutionFwdAlgoDirect:ConvAsm1x1U,0.33664,0,miopenConvolutionFwdAlgoDirect,<unused>;miopenConvolutionFwdAlgoGEMM:gemm,0.28384,0,rocBlas,<unused>;miopenConvolutionFwdAlgoWinograd:ConvBinWinogradRxSf3x2,0.61008,0,miopenConvolutionFwdAlgoWinograd,<unused>
256-35-35-1x1-48-35-35-32-0x0-1x1-1x1-0-NCHW-FP32-F=miopenConvolutionFwdAlgoDirect:ConvOclDirectFwd1x1,0.1392,0,miopenConvolutionFwdAlgoDirect,<unused>;miopenConvolutionFwdAlgoGEMM:gemm,0.17232,0,rocBlas,<unused>;miopenConvolutionFwdAlgoWinograd:ConvBinWinogradRxSf3x2,0.314399,0,miopenConvolutionFwdAlgoWinograd,<unused>
256-35-35-1x1-64-35-35-32-0x0-1x1-1x1-0-NCHW-FP32-F=miopenConvolutionFwdAlgoImplicitGEMM:ConvHipImplicitGemmV4R1Fwd,0.24016,0,miopenConvolutionFwdAlgoImplicitGEMM,<unused>;miopenConvolutionFwdAlgoDirect:ConvAsm1x1U,0.1776,0,miopenConvolutionFwdAlgoDirect,<unused>;miopenConvolutionFwdAlgoGEMM:gemm,0.16768,0,rocBlas,<unused>;miopenConvolutionFwdAlgoWinograd:ConvBinWinogradRxSf3x2,0.3192,0,miopenConvolutionFwdAlgoWinograd,<unused>
288-35-35-1x1-128-35-35-32-0x0-1x1-1x1-0-NCHW-FP32-F=miopenConvolutionFwdAlgoImplicitGEMM:ConvHipImplicitGemmV4R1Fwd,0.40496,0,miopenConvolutionFwdAlgoImplicitGEMM,<unused>;miopenConvolutionFwdAlgoDirect:ConvAsm1x1U,0.36768,0,miopenConvolutionFwdAlgoDirect,<unused>;miopenConvolutionFwdAlgoGEMM:gemm,0.32096,0,rocBlas,<unused>;miopenConvolutionFwdAlgoWinograd:ConvBinWinogradRxSf3x2,0.673919,0,miopenConvolutionFwdAlgoWinograd,<unused>
288-35-35-1x1-48-35-35-32-0x0-1x1-1x1-0-NCHW-FP32-F=miopenConvolutionFwdAlgoDirect:ConvOclDirectFwd1x1,0.15312,0,miopenConvolutionFwdAlgoDirect,<unused>;miopenConvolutionFwdAlgoGEMM:gemm,0.1808,0,rocBlas,<unused>;miopenConvolutionFwdAlgoWinograd:ConvBinWinogradRxSf3x2,0.3472,0,miopenConvolutionFwdAlgoWinograd,<unused>
288-35-35-1x1-64-35-35-32-0x0-1x1-1x1-0-NCHW-FP32-F=miopenConvolutionFwdAlgoImplicitGEMM:ConvHipImplicitGemmV4R1Fwd,0.22592,0,miopenConvolutionFwdAlgoImplicitGEMM,<unused>;miopenConvolutionFwdAlgoDirect:ConvOclDirectFwd1x1,0.19392,0,miopenConvolutionFwdAlgoDirect,<unused>;miopenConvolutionFwdAlgoGEMM:gemm,0.1792,0,rocBlas,<unused>;miopenConvolutionFwdAlgoWinograd:ConvBinWinogradRxSf3x2,0.35008,0,miopenConvolutionFwdAlgoWinograd,<unused>
288-35-35-3x3-384-17-17-32-0x0-2x2-1x1-0-NCHW-FP32-F=miopenConvolutionFwdAlgoImplicitGEMM:ConvHipImplicitGemmV4R1Fwd,2.24336,0,miopenConvolutionFwdAlgoImplicitGEMM,<unused>;miopenConvolutionFwdAlgoDirect:ConvOclDirectFwd,56.6196,0,miopenConvolutionFwdAlgoDirect,<unused>;miopenConvolutionFwdAlgoGEMM:gemm,3.97312,2996352,rocBlas,<unused>;miopenConvolutionFwdAlgoWinograd:ConvBinWinogradRxSf2x3g1,4.09904,0,miopenConvolutionFwdAlgoWinograd,<unused>
96-35-35-3x3-96-17-17-32-0x0-2x2-1x1-0-NCHW-FP32-F=miopenConvolutionFwdAlgoImplicitGEMM:ConvHipImplicitGemmV4R1Fwd,0.26304,0,miopenConvolutionFwdAlgoImplicitGEMM,<unused>;miopenConvolutionFwdAlgoDirect:ConvOclDirectFwd,5.14176,0,miopenConvolutionFwdAlgoDirect,<unused>;miopenConvolutionFwdAlgoGEMM:gemm,1.59232,998784,rocBlas,<unused>;miopenConvolutionFwdAlgoWinograd:ConvBinWinogradRxSf2x3g1,0.43136,0,miopenConvolutionFwdAlgoWinograd,<unused>
768-17-17-1x1-256-17-17-32-0x0-1x1-1x1-0-NCHW-FP32-F=miopenConvolutionFwdAlgoImplicitGEMM:ConvHipImplicitGemmV4R1Fwd,0.609759,0,miopenConvolutionFwdAlgoImplicitGEMM,<unused>;miopenConvolutionFwdAlgoDirect:ConvAsm1x1U,0.501279,0,miopenConvolutionFwdAlgoDirect,<unused>;miopenConvolutionFwdAlgoGEMM:gemm,0.433759,0,rocBlas,<unused>;miopenConvolutionFwdAlgoWinograd:ConvBinWinogradRxSf3x2,0.847039,0,miopenConvolutionFwdAlgoWinograd,<unused>
768-17-17-1x1-192-17-17-32-0x0-1x1-1x1-0-NCHW-FP32-F=miopenConvolutionFwdAlgoImplicitGEMM:ConvHipImplicitGemmV4R1Fwd,0.480319,0,miopenConvolutionFwdAlgoImplicitGEMM,<unused>;miopenConvolutionFwdAlgoDirect:ConvOclDirectFwd1x1,0.40032,0,miopenConvolutionFwdAlgoDirect,<unused>;miopenConvolutionFwdAlgoGEMM:gemm,0.300319,0,rocBlas,<unused>;miopenConvolutionFwdAlgoWinograd:ConvBinWinogradRxSf3x2,0.682559,0,miopenConvolutionFwdAlgoWinograd,<unused>
128-17-17-1x7-128-17-17-32-0x3-1x1-1x1-0-NCHW-FP32-F=miopenConvolutionFwdAlgoImplicitGEMM:ConvHipImplicitGemmV4R1Fwd,0.327039,0,miopenConvolutionFwdAlgoImplicitGEMM,<unused>;miopenConvolutionFwdAlgoDirect:ConvDirectNaiveConvFwd,4.79775,0,miopenConvolutionFwdAlgoDirect,<unused>;miopenConvolutionFwdAlgoGEMM:gemm,1.61792,1035776,rocBlas,<unused>;miopenConvolutionFwdAlgoWinograd:ConvBinWinogradRxSf3x2,0.360799,0,miopenConvolutionFwdAlgoWinograd,<unused>
128-17-17-7x1-192-17-17-32-3x0-1x1-1x1-0-NCHW-FP32-F=miopenConvolutionFwdAlgoImplicitGEMM:ConvHipImplicitGemmV4R1Fwd,0.506877,0,miopenConvolutionFwdAlgoImplicitGEMM,<unused>;miopenConvolutionFwdAlgoDirect:ConvDirectNaiveConvFwd,8.03676,0,miopenConvolutionFwdAlgoDirect,<unused>;miopenConvolutionFwdAlgoGEMM:gemm,1.75104,1035776,rocBlas,<unused>;miopenConvolutionFwdAlgoWinograd:ConvBinWinogradRxSf3x2,0.475198,0,miopenConvolutionFwdAlgoWinograd,<unused>
128-17-17-7x1-128-17-17-32-3x0-1x1-1x1-0-NCHW-FP32-F=miopenConvolutionFwdAlgoImplicitGEMM:ConvHipImplicitGemmV4R1Fwd,0.347998,0,miopenConvolutionFwdAlgoImplicitGEMM,<unused>;miopenConvolutionFwdAlgoDirect:ConvDirectNaiveConvFwd,5.72813,0,miopenConvolutionFwdAlgoDirect,<unused>;miopenConvolutionFwdAlgoGEMM:gemm,1.89952,1035776,rocBlas,<unused>;miopenConvolutionFwdAlgoWinograd:ConvBinWinogradRxSf3x2,0.364638,0,miopenConvolutionFwdAlgoWinograd,<unused>
128-17-17-1x7-192-17-17-32-0x3-1x1-1x1-0-NCHW-FP32-F=miopenConvolutionFwdAlgoImplicitGEMM:ConvHipImplicitGemmV4R1Fwd,0.481916,0,miopenConvolutionFwdAlgoImplicitGEMM,<unused>;miopenConvolutionFwdAlgoDirect:ConvDirectNaiveConvFwd,6.82027,0,miopenConvolutionFwdAlgoDirect,<unused>;miopenConvolutionFwdAlgoGEMM:gemm,1.7408,1035776,rocBlas,<unused>;miopenConvolutionFwdAlgoWinograd:ConvBinWinogradRxSf3x2,0.473276,0,miopenConvolutionFwdAlgoWinograd,<unused>
768-17-17-1x1-320-17-17-32-0x0-1x1-1x1-0-NCHW-FP32-F=miopenConvolutionFwdAlgoImplicitGEMM:ConvHipImplicitGemmV4R1Fwd,0.757274,0,miopenConvolutionFwdAlgoImplicitGEMM,<unused>;miopenConvolutionFwdAlgoDirect:ConvAsm1x1U,0.631195,0,miopenConvolutionFwdAlgoDirect,<unused>;miopenConvolutionFwdAlgoGEMM:gemm,0.512155,0,rocBlas,<unused>;miopenConvolutionFwdAlgoWinograd:ConvBinWinogradRxSf3x2,1.01135,0,miopenConvolutionFwdAlgoWinograd,<unused>
160-17-17-1x7-160-17-17-32-0x3-1x1-1x1-0-NCHW-FP32-F=miopenConvolutionFwdAlgoImplicitGEMM:ConvHipImplicitGemmV4R1Fwd,0.520476,0,miopenConvolutionFwdAlgoImplicitGEMM,<unused>;miopenConvolutionFwdAlgoDirect:ConvDirectNaiveConvFwd,7.25818,0,miopenConvolutionFwdAlgoDirect,<unused>;miopenConvolutionFwdAlgoGEMM:gemm,2.03776,1294720,rocBlas,<unused>;miopenConvolutionFwdAlgoWinograd:ConvBinWinogradRxSf3x2,0.442876,0,miopenConvolutionFwdAlgoWinograd,<unused>
160-17-17-7x1-192-17-17-32-3x0-1x1-1x1-0-NCHW-FP32-F=miopenConvolutionFwdAlgoImplicitGEMM:ConvHipImplicitGemmV4R1Fwd,0.647994,0,miopenConvolutionFwdAlgoImplicitGEMM,<unused>;miopenConvolutionFwdAlgoDirect:ConvDirectNaiveConvFwd,9.88536,0,miopenConvolutionFwdAlgoDirect,<unused>;miopenConvolutionFwdAlgoGEMM:gemm,1.67421,1294720,rocBlas,<unused>;miopenConvolutionFwdAlgoWinograd:ConvBinWinogradRxSf3x2,0.581275,0,miopenConvolutionFwdAlgoWinograd,<unused>
160-17-17-7x1-160-17-17-32-3x0-1x1-1x1-0-NCHW-FP32-F=miopenConvolutionFwdAlgoImplicitGEMM:ConvHipImplicitGemmV4R1Fwd,0.592475,0,miopenConvolutionFwdAlgoImplicitGEMM,<unused>;miopenConvolutionFwdAlgoDirect:ConvDirectNaiveConvFwd,8.68552,0,miopenConvolutionFwdAlgoDirect,<unused>;miopenConvolutionFwdAlgoGEMM:gemm,1.8176,1294720,rocBlas,<unused>;miopenConvolutionFwdAlgoWinograd:ConvBinWinogradRxSf3x2,0.443356,0,miopenConvolutionFwdAlgoWinograd,<unused>
160-17-17-1x7-192-17-17-32-0x3-1x1-1x1-0-NCHW-FP32-F=miopenConvolutionFwdAlgoImplicitGEMM:ConvHipImplicitGemmV4R1Fwd,0.597275,0,miopenConvolutionFwdAlgoImplicitGEMM,<unused>;miopenConvolutionFwdAlgoDirect:ConvDirectNaiveConvFwd,8.41737,0,miopenConvolutionFwdAlgoDirect,<unused>;miopenConvolutionFwdAlgoGEMM:gemm,1.87392,1294720,rocBlas,<unused>;miopenConvolutionFwdAlgoWinograd:ConvBinWinogradRxSf3x2,0.578234,0,miopenConvolutionFwdAlgoWinograd,<unused>
768-17-17-1x1-576-17-17-32-0x0-1x1-1x1-0-NCHW-FP32-F=miopenConvolutionFwdAlgoImplicitGEMM:ConvHipImplicitGemmV4R1Fwd,1.29375,0,miopenConvolutionFwdAlgoImplicitGEMM,<unused>;miopenConvolutionFwdAlgoDirect:ConvAsm1x1U,1.14799,0,miopenConvolutionFwdAlgoDirect,<unused>;miopenConvolutionFwdAlgoGEMM:gemm,1.03599,0,rocBlas,<unused>;miopenConvolutionFwdAlgoWinograd:ConvBinWinogradRxSf3x2,1.82382,0,miopenConvolutionFwdAlgoWinograd,<unused>
192-17-17-1x7-192-17-17-32-0x3-1x1-1x1-0-NCHW-FP32-F=miopenConvolutionFwdAlgoImplicitGEMM:ConvHipImplicitGemmV4R1Fwd,0.713433,0,miopenConvolutionFwdAlgoImplicitGEMM,<unused>;miopenConvolutionFwdAlgoDirect:ConvDirectNaiveConvFwd,9.74422,0,miopenConvolutionFwdAlgoDirect,<unused>;miopenConvolutionFwdAlgoGEMM:gemm,1.91485,1553664,rocBlas,<unused>;miopenConvolutionFwdAlgoWinograd:ConvBinWinogradRxSf3x2,0.684634,0,miopenConvolutionFwdAlgoWinograd,<unused>
192-17-17-7x1-192-17-17-32-3x0-1x1-1x1-0-NCHW-FP32-F=miopenConvolutionFwdAlgoImplicitGEMM:ConvHipImplicitGemmV4R1Fwd,0.808632,0,miopenConvolutionFwdAlgoImplicitGEMM,<unused>;miopenConvolutionFwdAlgoDirect:ConvDirectNaiveConvFwd,11.7136,0,miopenConvolutionFwdAlgoDirect,<unused>;miopenConvolutionFwdAlgoGEMM:gemm,2.06336,1553664,rocBlas,<unused>;miopenConvolutionFwdAlgoWinograd:ConvBinWinogradRxSf3x2,0.688313,0,miopenConvolutionFwdAlgoWinograd,<unused>
768-17-17-1x1-384-17-17-32-0x0-1x1-1x1-0-NCHW-FP32-F=miopenConvolutionFwdAlgoImplicitGEMM:ConvHipImplicitGemmV4R1Fwd,0.90127,0,miopenConvolutionFwdAlgoImplicitGEMM,<unused>;miopenConvolutionFwdAlgoDirect:ConvOclDirectFwd1x1,0.731352,0,miopenConvolutionFwdAlgoDirect,<unused>;miopenConvolutionFwdAlgoGEMM:gemm,0.609914,0,rocBlas,<unused>;miopenConvolutionFwdAlgoWinograd:ConvBinWinogradRxSf3x2,1.33375,0,miopenConvolutionFwdAlgoWinograd,<unused>
192-17-17-3x3-320-8-8-32-0x0-2x2-1x1-0-NCHW-FP32-F=miopenConvolutionFwdAlgoImplicitGEMM:ConvHipImplicitGemmV4R1Fwd,0.324956,0,miopenConvolutionFwdAlgoImplicitGEMM,<unused>;miopenConvolutionFwdAlgoDirect:ConvDirectNaiveConvFwd,7.19896,0,miopenConvolutionFwdAlgoDirect,<unused>;miopenConvolutionFwdAlgoGEMM:gemm,2.35005,442368,rocBlas,<unused>;miopenConvolutionFwdAlgoWinograd:ConvBinWinogradRxSf2x3g1,0.505594,0,miopenConvolutionFwdAlgoWinograd,<unused>
192-17-17-3x3-192-8-8-32-0x0-2x2-1x1-0-NCHW-FP32-F=miopenConvolutionFwdAlgoImplicitGEMM:ConvHipImplicitGemmV4R1Fwd,0.248317,0,miopenConvolutionFwdAlgoImplicitGEMM,<unused>;miopenConvolutionFwdAlgoDirect:ConvOclDirectFwd,3.53324,0,miopenConvolutionFwdAlgoDirect,<unused>;miopenConvolutionFwdAlgoGEMM:gemm,2.17597,442368,rocBlas,<unused>;miopenConvolutionFwdAlgoWinograd:ConvBinWinogradRxSf2x3g1,0.344957,0,miopenConvolutionFwdAlgoWinograd,<unused>
1280-8-8-1x1-320-8-8-32-0x0-1x1-1x1-0-NCHW-FP32-F=miopenConvolutionFwdAlgoImplicitGEMM:ConvHipImplicitGemmV4R1Fwd,0.237757,0,miopenConvolutionFwdAlgoImplicitGEMM,<unused>;miopenConvolutionFwdAlgoDirect:ConvAsm1x1U,0.252157,0,miopenConvolutionFwdAlgoDirect,<unused>;miopenConvolutionFwdAlgoGEMM:gemm,0.477435,0,rocBlas,<unused>;miopenConvolutionFwdAlgoWinograd:ConvBinWinogradRxSf3x2,0.568794,0,miopenConvolutionFwdAlgoWinograd,<unused>
1280-8-8-1x1-384-8-8-32-0x0-1x1-1x1-0-NCHW-FP32-F=miopenConvolutionFwdAlgoImplicitGEMM:ConvHipImplicitGemmV4R1Fwd,0.286397,0,miopenConvolutionFwdAlgoImplicitGEMM,<unused>;miopenConvolutionFwdAlgoDirect:ConvAsm1x1U,0.310557,0,miopenConvolutionFwdAlgoDirect,<unused>;miopenConvolutionFwdAlgoGEMM:gemm,0.579194,0,rocBlas,<unused>;miopenConvolutionFwdAlgoWinograd:ConvBinWinogradRxSf3x2,0.569754,0,miopenConvolutionFwdAlgoWinograd,<unused>
384-8-8-1x3-384-8-8-32-0x1-1x1-1x1-0-NCHW-FP32-F=miopenConvolutionFwdAlgoImplicitGEMM:ConvHipImplicitGemmV4R1Fwd,0.279357,0,miopenConvolutionFwdAlgoImplicitGEMM,<unused>;miopenConvolutionFwdAlgoDirect:ConvDirectNaiveConvFwd,6.03673,0,miopenConvolutionFwdAlgoDirect,<unused>;miopenConvolutionFwdAlgoGEMM:gemm,1.95584,294912,rocBlas,<unused>;miopenConvolutionFwdAlgoWinograd:ConvBinWinogradRxS,0.331516,0,miopenConvolutionFwdAlgoWinograd,<unused>
384-8-8-3x1-384-8-8-32-1x0-1x1-1x1-0-NCHW-FP32-F=miopenConvolutionFwdAlgoImplicitGEMM:ConvHipImplicitGemmV4R1Fwd,0.317436,0,miopenConvolutionFwdAlgoImplicitGEMM,<unused>;miopenConvolutionFwdAlgoDirect:ConvDirectNaiveConvFwd,6.99464,0,miopenConvolutionFwdAlgoDirect,<unused>;miopenConvolutionFwdAlgoGEMM:gemm,1.91997,294912,rocBlas,<unused>;miopenConvolutionFwdAlgoWinograd:ConvBinWinogradRxSf2x3g1,0.331676,0,miopenConvolutionFwdAlgoWinograd,<unused>
1280-8-8-1x1-448-8-8-32-0x0-1x1-1x1-0-NCHW-FP32-F=miopenConvolutionFwdAlgoImplicitGEMM:ConvHipImplicitGemmV4R1Fwd,0.303996,0,miopenConvolutionFwdAlgoImplicitGEMM,<unused>;miopenConvolutionFwdAlgoDirect:ConvAsm1x1U,0.327036,0,miopenConvolutionFwdAlgoDirect,<unused>;miopenConvolutionFwdAlgoGEMM:gemm,0.656793,0,rocBlas,<unused>;miopenConvolutionFwdAlgoWinograd:ConvBinWinogradRxSf3x2,0.836951,0,miopenConvolutionFwdAlgoWinograd,<unused>
448-8-8-3x3-384-8-8-32-1x1-1x1-1x1-0-NCHW-FP32-F=miopenConvolutionFwdAlgoWinograd:ConvBinWinogradRxS,0.380316,0,miopenConvolutionFwdAlgoWinograd,<unused>
1280-8-8-1x1-192-8-8-32-0x0-1x1-1x1-0-NCHW-FP32-F=miopenConvolutionFwdAlgoImplicitGEMM:ConvHipImplicitGemmV4R1Fwd,0.181758,0,miopenConvolutionFwdAlgoImplicitGEMM,<unused>;miopenConvolutionFwdAlgoDirect:ConvAsm1x1U,0.177438,0,miopenConvolutionFwdAlgoDirect,<unused>;miopenConvolutionFwdAlgoGEMM:gemm,0.299037,0,rocBlas,<unused>;miopenConvolutionFwdAlgoWinograd:ConvBinWinogradRxSf3x2,0.296637,0,miopenConvolutionFwdAlgoWinograd,<unused>
2048-8-8-1x1-320-8-8-32-0x0-1x1-1x1-0-NCHW-FP32-F=miopenConvolutionFwdAlgoImplicitGEMM:ConvHipImplicitGemmV4R1Fwd,0.530713,0,miopenConvolutionFwdAlgoImplicitGEMM,<unused>;miopenConvolutionFwdAlgoDirect:ConvOclDirectFwd1x1,0.449115,0,miopenConvolutionFwdAlgoDirect,<unused>;miopenConvolutionFwdAlgoGEMM:gemm,0.692472,0,rocBlas,<unused>;miopenConvolutionFwdAlgoWinograd:ConvBinWinogradRxSf3x2,0.88591,0,miopenConvolutionFwdAlgoWinograd,<unused>
2048-8-8-1x1-384-8-8-32-0x0-1x1-1x1-0-NCHW-FP32-F=miopenConvolutionFwdAlgoImplicitGEMM:ConvHipImplicitGemmV4R1Fwd,0.491834,0,miopenConvolutionFwdAlgoImplicitGEMM,<unused>;miopenConvolutionFwdAlgoDirect:ConvAsm1x1U,0.549753,0,miopenConvolutionFwdAlgoDirect,<unused>;miopenConvolutionFwdAlgoGEMM:gemm,0.82655,0,rocBlas,<unused>;miopenConvolutionFwdAlgoWinograd:ConvBinWinogradRxSf3x2,0.88623,0,miopenConvolutionFwdAlgoWinograd,<unused>
2048-8-8-1x1-448-8-8-32-0x0-1x1-1x1-0-NCHW-FP32-F=miopenConvolutionFwdAlgoImplicitGEMM:ConvHipImplicitGemmV4R1Fwd,0.513114,0,miopenConvolutionFwdAlgoImplicitGEMM,<unused>;miopenConvolutionFwdAlgoDirect:ConvAsm1x1U,0.555674,0,miopenConvolutionFwdAlgoDirect,<unused>;miopenConvolutionFwdAlgoGEMM:gemm,0.962549,0,rocBlas,<unused>;miopenConvolutionFwdAlgoWinograd:ConvBinWinogradRxSf3x2,1.31439,0,miopenConvolutionFwdAlgoWinograd,<unused>
2048-8-8-1x1-192-8-8-32-0x0-1x1-1x1-0-NCHW-FP32-F=miopenConvolutionFwdAlgoImplicitGEMM:ConvHipImplicitGemmV4R1Fwd,0.323516,0,miopenConvolutionFwdAlgoImplicitGEMM,<unused>;miopenConvolutionFwdAlgoDirect:ConvAsm1x1U,0.324156,0,miopenConvolutionFwdAlgoDirect,<unused>;miopenConvolutionFwdAlgoGEMM:gemm,0.440955,0,rocBlas,<unused>;miopenConvolutionFwdAlgoWinograd:ConvBinWinogradRxSf3x2,0.459195,0,miopenConvolutionFwdAlgoWinograd,<unused>
3-299-299-3x3-32-149-149-32-0x0-2x2-1x1-0-NCHW-FP16-F=miopenConvolutionFwdAlgoDirect:ConvOclDirectFwdGen,0.47344,0,miopenConvolutionFwdAlgoDirect,<unused>;miopenConvolutionFwdAlgoGEMM:gemm,1.89952,1198854,rocBlas,<unused>;miopenConvolutionFwdAlgoWinograd:ConvBinWinogradRxSf2x3g1,0.50816,0,miopenConvolutionFwdAlgoWinograd,<unused>
32-149-149-3x3-32-147-147-32-0x0-1x1-1x1-0-NCHW-FP16-F=miopenConvolutionFwdAlgoImplicitGEMM:ConvHipImplicitGemmV4R1Fwd,1.38752,0,miopenConvolutionFwdAlgoImplicitGEMM,<unused>;miopenConvolutionFwdAlgoDirect:ConvOclDirectFwd,1.89264,0,miopenConvolutionFwdAlgoDirect,<unused>;miopenConvolutionFwdAlgoGEMM:gemm,7.35232,12446784,rocBlas,<unused>;miopenConvolutionFwdAlgoWinograd:ConvBinWinogradRxSf2x3g1,0.59088,0,miopenConvolutionFwdAlgoWinograd,<unused>
32-147-147-3x3-64-147-147-32-1x1-1x1-1x1-0-NCHW-FP16-F=miopenConvolutionFwdAlgoImplicitGEMM:ConvHipImplicitGemmV4R1Fwd,2.43376,0,miopenConvolutionFwdAlgoImplicitGEMM,<unused>;miopenConvolutionFwdAlgoDirect:ConvOclDirectFwd,4.05472,0,miopenConvolutionFwdAlgoDirect,<unused>;miopenConvolutionFwdAlgoGEMM:gemm,7.5008,12446784,rocBlas,<unused>;miopenConvolutionFwdAlgoWinograd:ConvBinWinogradRxSf2x3g1,1.1264,0,miopenConvolutionFwdAlgoWinograd,<unused>
64-73-73-1x1-80-73-73-32-0x0-1x1-1x1-0-NCHW-FP16-F=miopenConvolutionFwdAlgoDirect:ConvAsm1x1U,0.19936,0,miopenConvolutionFwdAlgoDirect,<unused>;miopenConvolutionFwdAlgoGEMM:gemm,0.55104,0,rocBlas,<unused>;miopenConvolutionFwdAlgoWinograd:ConvBinWinogradRxS,0.668481,0,miopenConvolutionFwdAlgoWinograd,<unused>
80-73-73-3x3-192-71-71-32-0x0-1x1-1x1-0-NCHW-FP16-F=miopenConvolutionFwdAlgoImplicitGEMM:ConvHipImplicitGemmV4R1Fwd,4.27376,0,miopenConvolutionFwdAlgoImplicitGEMM,<unused>;miopenConvolutionFwdAlgoDirect:ConvOclDirectFwd,8.3016,0,miopenConvolutionFwdAlgoDirect,<unused>;miopenConvolutionFwdAlgoGEMM:gemm,10.2195,7259040,rocBlas,<unused>;miopenConvolutionFwdAlgoWinograd:ConvBinWinogradRxS,1.47296,0,miopenConvolutionFwdAlgoWinograd,<unused>
192-35-35-1x1-128-35-35-32-0x0-1x1-1x1-0-NCHW-FP16-F=miopenConvolutionFwdAlgoImplicitGEMM:ConvHipImplicitGemmV4R1Fwd,0.395993,0,miopenConvolutionFwdAlgoImplicitGEMM,<unused>;miopenConvolutionFwdAlgoDirect:ConvAsm1x1U,0.204156,0,miopenConvolutionFwdAlgoDirect,<unused>;miopenConvolutionFwdAlgoGEMM:gemm,0.37424,0,rocBlas,<unused>;miopenConvolutionFwdAlgoWinograd:ConvBinWinogradRxS,0.58176,0,miopenConvolutionFwdAlgoWinograd,<unused>
192-35-35-1x1-48-35-35-32-0x0-1x1-1x1-0-NCHW-FP16-F=miopenConvolutionFwdAlgoDirect:ConvAsm1x1U,0.088158,0,miopenConvolutionFwdAlgoDirect,<unused>;miopenConvolutionFwdAlgoGEMM:gemm,0.202556,0,rocBlas,<unused>;miopenConvolutionFwdAlgoWinograd:ConvBinWinogradRxS,0.303514,0,miopenConvolutionFwdAlgoWinograd,<unused>
48-35-35-5x5-64-35-35-32-2x2-1x1-1x1-0-NCHW-FP16-F=miopenConvolutionFwdAlgoImplicitGEMM:ConvHipImplicitGemmV4R1Fwd,0.610383,0,miopenConvolutionFwdAlgoImplicitGEMM,<unused>;miopenConvolutionFwdAlgoDirect:ConvOclDirectFwd,1.50621,0,miopenConvolutionFwdAlgoDirect,<unused>;miopenConvolutionFwdAlgoGEMM:gemm,7.4392,2940000,rocBlas,<unused>;miopenConvolutionFwdAlgoWinograd:ConvBinWinogradRxS,0.311513,0,miopenConvolutionFwdAlgoWinograd,<unused>
64-35-35-3x3-96-35-35-32-1x1-1x1-1x1-0-NCHW-FP16-F=miopenConvolutionFwdAlgoImplicitGEMM:ConvHipImplicitGemmV4R1Fwd,0.434386,0,miopenConvolutionFwdAlgoImplicitGEMM,<unused>;miopenConvolutionFwdAlgoDirect:ConvOclDirectFwd,1.42652,0,miopenConvolutionFwdAlgoDirect,<unused>;miopenConvolutionFwdAlgoGEMM:gemm,4.19827,1411200,rocBlas,<unused>;miopenConvolutionFwdAlgoWinograd:ConvBinWinogradRxS,0.186555,0,miopenConvolutionFwdAlgoWinograd,<unused>
96-35-35-3x3-96-35-35-32-1x1-1x1-1x1-0-NCHW-FP16-F=miopenConvolutionFwdAlgoImplicitGEMM:ConvHipImplicitGemmV4R1Fwd,0.656778,0,miopenConvolutionFwdAlgoImplicitGEMM,<unused>;miopenConvolutionFwdAlgoDirect:ConvOclDirectFwd,2.09385,0,miopenConvolutionFwdAlgoDirect,<unused>;miopenConvolutionFwdAlgoGEMM:gemm,5.84688,2116800,rocBlas,<unused>;miopenConvolutionFwdAlgoWinograd:ConvBinWinogradRxS,0.252152,0,miopenConvolutionFwdAlgoWinograd,<unused>
192-35-35-1x1-32-35-35-32-0x0-1x1-1x1-0-NCHW-FP16-F=miopenConvolutionFwdAlgoImplicitGEMM:ConvHipImplicitGemmV4R1Fwd,0.119356,0,miopenConvolutionFwdAlgoImplicitGEMM,<unused>;miopenConvolutionFwdAlgoDirect:ConvAsm1x1U,0.063517,0,miopenConvolutionFwdAlgoDirect,<unused>;miopenConvolutionFwdAlgoGEMM:gemm,0.194553,0,rocBlas,<unused>;miopenConvolutionFwdAlgoWinograd:ConvBinWinogradRxSf2x3g1,0.182394,0,miopenConvolutionFwdAlgoWinograd,<unused>
256-35-35-1x1-128-35-35-32-0x0-1x1-1x1-0-NCHW-FP16-F=miopenConvolutionFwdAlgoImplicitGEMM:ConvHipImplicitGemmV4R1Fwd,0.52796,0,miopenConvolutionFwdAlgoImplicitGEMM,<unused>;miopenConvolutionFwdAlgoDirect:ConvAsm1x1U,0.260621,0,miopenConvolutionFwdAlgoDirect,<unused>;miopenConvolutionFwdAlgoGEMM:gemm,0.475182,0,rocBlas,<unused>;miopenConvolutionFwdAlgoWinograd:ConvBinWinogradRxSf2x3g1,0.758851,0,miopenConvolutionFwdAlgoWinograd,<unused>
256-35-35-1x1-48-35-35-32-0x0-1x1-1x1-0-NCHW-FP16-F=miopenConvolutionFwdAlgoDirect:ConvAsm1x1U,0.112791,0,miopenConvolutionFwdAlgoDirect,<unused>;miopenConvolutionFwdAlgoGEMM:gemm,0.243982,0,rocBlas,<unused>;miopenConvolutionFwdAlgoWinograd:ConvBinWinogradRxSf2x3g1,0.39037,0,miopenConvolutionFwdAlgoWinograd,<unused>
256-35-35-1x1-64-35-35-32-0x0-1x1-1x1-0-NCHW-FP16-F=miopenConvolutionFwdAlgoImplicitGEMM:ConvHipImplicitGemmV4R1Fwd,0.276619,0,miopenConvolutionFwdAlgoImplicitGEMM,<unused>;miopenConvolutionFwdAlgoDirect:ConvAsm1x1U,0.149268,0,miopenConvolutionFwdAlgoDirect,<unused>;miopenConvolutionFwdAlgoGEMM:gemm,0.252621,0,rocBlas,<unused>;miopenConvolutionFwdAlgoWinograd:ConvBinWinogradRxSf2x3g1,0.39421,0,miopenConvolutionFwdAlgoWinograd,<unused>
288-35-35-1x1-128-35-35-32-0x0-1x1-1x1-0-NCHW-FP16-F=miopenConvolutionFwdAlgoImplicitGEMM:ConvHipImplicitGemmV4R1Fwd,0.560426,0,miopenConvolutionFwdAlgoImplicitGEMM,<unused>;miopenConvolutionFwdAlgoDirect:ConvAsm1x1U,0.288452,0,miopenConvolutionFwdAlgoDirect,<unused>;miopenConvolutionFwdAlgoGEMM:gemm,0.52892,0,rocBlas,<unused>;miopenConvolutionFwdAlgoWinograd:ConvBinWinogradRxSf2x3g1,0.845377,0,miopenConvolutionFwdAlgoWinograd,<unused>
288-35-35-1x1-48-35-35-32-0x0-1x1-1x1-0-NCHW-FP16-F=miopenConvolutionFwdAlgoDirect:ConvAsm1x1U,0.119988,0,miopenConvolutionFwdAlgoDirect,<unused>;miopenConvolutionFwdAlgoGEMM:gemm,0.277893,0,rocBlas,<unused>;miopenConvolutionFwdAlgoWinograd:ConvBinWinogradRxS,0.431479,0,miopenConvolutionFwdAlgoWinograd,<unused>
288-35-35-1x1-64-35-35-32-0x0-1x1-1x1-0-NCHW-FP16-F=miopenConvolutionFwdAlgoImplicitGEMM:ConvHipImplicitGemmV4R1Fwd,0.287813,0,miopenConvolutionFwdAlgoImplicitGEMM,<unused>;miopenConvolutionFwdAlgoDirect:ConvAsm1x1U,0.163985,0,miopenConvolutionFwdAlgoDirect,<unused>;miopenConvolutionFwdAlgoGEMM:gemm,0.284613,0,rocBlas,<unused>;miopenConvolutionFwdAlgoWinograd:ConvBinWinogradRxSf2x3g1,0.433879,0,miopenConvolutionFwdAlgoWinograd,<unused>
288-35-35-3x3-384-17-17-32-0x0-2x2-1x1-0-NCHW-FP16-F=miopenConvolutionFwdAlgoImplicitGEMM:ConvHipImplicitGemmV4R1Fwd,1.8099,0,miopenConvolutionFwdAlgoImplicitGEMM,<unused>;miopenConvolutionFwdAlgoDirect:ConvOclDirectFwdGen,11.9137,0,miopenConvolutionFwdAlgoDirect,<unused>;miopenConvolutionFwdAlgoGEMM:gemm,13.3517,1498176,rocBlas,<unused>;miopenConvolutionFwdAlgoWinograd:ConvBinWinogradRxS,3.06194,0,miopenConvolutionFwdAlgoWinograd,<unused>
96-35-35-3x3-96-17-17-32-0x0-2x2-1x1-0-NCHW-FP16-F=miopenConvolutionFwdAlgoImplicitGEMM:ConvHipImplicitGemmV4R1Fwd,0.20702,0,miopenConvolutionFwdAlgoImplicitGEMM,<unused>;miopenConvolutionFwdAlgoDirect:ConvOclDirectFwdGen,1.09029,0,miopenConvolutionFwdAlgoDirect,<unused>;miopenConvolutionFwdAlgoGEMM:gemm,5.54445,499392,rocBlas,<unused>;miopenConvolutionFwdAlgoWinograd:ConvBinWinogradRxS,0.330848,0,miopenConvolutionFwdAlgoWinograd,<unused>
768-17-17-1x1-256-17-17-32-0x0-1x1-1x1-0-NCHW-FP16-F=miopenConvolutionFwdAlgoImplicitGEMM:ConvHipImplicitGemmV4R1Fwd,0.757843,0,miopenConvolutionFwdAlgoImplicitGEMM,<unused>;miopenConvolutionFwdAlgoDirect:ConvAsm1x1U,0.420597,0,miopenConvolutionFwdAlgoDirect,<unused>;miopenConvolutionFwdAlgoGEMM:gemm,0.841838,0,rocBlas,<unused>;miopenConvolutionFwdAlgoWinograd:ConvBinWinogradRxS,1.24532,0,miopenConvolutionFwdAlgoWinograd,<unused>
768-17-17-1x1-192-17-17-32-0x0-1x1-1x1-0-NCHW-FP16-F=miopenConvolutionFwdAlgoImplicitGEMM:ConvHipImplicitGemmV4R1Fwd,0.571942,0,miopenConvolutionFwdAlgoImplicitGEMM,<unused>;miopenConvolutionFwdAlgoDirect:ConvAsm1x1U,0.313888,0,miopenConvolutionFwdAlgoDirect,<unused>;miopenConvolutionFwdAlgoGEMM:gemm,0.619617,0,rocBlas,<unused>;miopenConvolutionFwdAlgoWinograd:ConvBinWinogradRxS,1.04629,0,miopenConvolutionFwdAlgoWinograd,<unused>
128-17-17-1x7-128-17-17-32-0x3-1x1-1x1-0-NCHW-FP16-F=miopenConvolutionFwdAlgoImplicitGEMM:ConvHipImplicitGemmV4R1Fwd,0.229737,0,miopenConvolutionFwdAlgoImplicitGEMM,<unused>;miopenConvolutionFwdAlgoDirect:ConvDirectNaiveConvFwd,5.14812,0,miopenConvolutionFwdAlgoDirect,<unused>;miopenConvolutionFwdAlgoGEMM:gemm,5.68262,517888,rocBlas,<unused>;miopenConvolutionFwdAlgoWinograd:ConvBinWinogradRxS,0.453554,0,miopenConvolutionFwdAlgoWinograd,<unused>
128-17-17-7x1-192-17-17-32-3x0-1x1-1x1-0-NCHW-FP16-F=miopenConvolutionFwdAlgoImplicitGEMM:ConvHipImplicitGemmV4R1Fwd,0.360924,0,miopenConvolutionFwdAlgoImplicitGEMM,<unused>;miopenConvolutionFwdAlgoDirect:ConvDirectNaiveConvFwd,8.47178,0,miopenConvolutionFwdAlgoDirect,<unused>;miopenConvolutionFwdAlgoGEMM:gemm,5.65702,517888,rocBlas,<unused>;miopenConvolutionFwdAlgoWinograd:ConvBinWinogradRxS,0.567143,0,miopenConvolutionFwdAlgoWinograd,<unused>
128-17-17-7x1-128-17-17-32-3x0-1x1-1x1-0-NCHW-FP16-F=miopenConvolutionFwdAlgoImplicitGEMM:ConvHipImplicitGemmV4R1Fwd,0.251494,0,miopenConvolutionFwdAlgoImplicitGEMM,<unused>;miopenConvolutionFwdAlgoDirect:ConvDirectNaiveConvFwd,5.93988,0,miopenConvolutionFwdAlgoDirect,<unused>;miopenConvolutionFwdAlgoGEMM:gemm,5.68774,517888,rocBlas,<unused>;miopenConvolutionFwdAlgoWinograd:ConvBinWinogradRxS,0.387,0,miopenConvolutionFwdAlgoWinograd,<unused>
128-17-17-1x7-192-17-17-32-0x3-1x1-1x1-0-NCHW-FP16-F=miopenConvolutionFwdAlgoImplicitGEMM:ConvHipImplicitGemmV4R1Fwd,0.324767,0,miopenConvolutionFwdAlgoImplicitGEMM,<unused>;miopenConvolutionFwdAlgoDirect:ConvDirectNaiveConvFwd,7.4466,0,miopenConvolutionFwdAlgoDirect,<unused>;miopenConvolutionFwdAlgoGEMM:gemm,5.39082,517888,rocBlas,<unused>;miopenConvolutionFwdAlgoWinograd:ConvBinWinogradRxS,0.663612,0,miopenConvolutionFwdAlgoWinograd,<unused>
768-17-17-1x1-320-17-17-32-0x0-1x1-1x1-0-NCHW-FP16-F=miopenConvolutionFwdAlgoImplicitGEMM:ConvHipImplicitGemmV4R1Fwd,0.924101,0,miopenConvolutionFwdAlgoImplicitGEMM,<unused>;miopenConvolutionFwdAlgoDirect:ConvAsm1x1U,0.534045,0,miopenConvolutionFwdAlgoDirect,<unused>;miopenConvolutionFwdAlgoGEMM:gemm,1.06101,0,rocBlas,<unused>;miopenConvolutionFwdAlgoWinograd:ConvBinWinogradRxS,1.6224,0,miopenConvolutionFwdAlgoWinograd,<unused>
160-17-17-1x7-160-17-17-32-0x3-1x1-1x1-0-NCHW-FP16-F=miopenConvolutionFwdAlgoImplicitGEMM:ConvHipImplicitGemmV4R1Fwd,0.367497,0,miopenConvolutionFwdAlgoImplicitGEMM,<unused>;miopenConvolutionFwdAlgoDirect:ConvDirectNaiveConvFwd,7.7851,0,miopenConvolutionFwdAlgoDirect,<unused>;miopenConvolutionFwdAlgoGEMM:gemm,6.27158,647360,rocBlas,<unused>;miopenConvolutionFwdAlgoWinograd:ConvBinWinogradRxS,0.635799,0,miopenConvolutionFwdAlgoWinograd,<unused>
160-17-17-7x1-192-17-17-32-3x0-1x1-1x1-0-NCHW-FP16-F=miopenConvolutionFwdAlgoImplicitGEMM:ConvHipImplicitGemmV4R1Fwd,0.424933,0,miopenConvolutionFwdAlgoImplicitGEMM,<unused>;miopenConvolutionFwdAlgoDirect:ConvDirectNaiveConvFwd,10.2872,0,miopenConvolutionFwdAlgoDirect,<unused>;miopenConvolutionFwdAlgoGEMM:gemm,6.68634,647360,rocBlas,<unused>;miopenConvolutionFwdAlgoWinograd:ConvBinWinogradRxS,0.691636,0,miopenConvolutionFwdAlgoWinograd,<unused>
160-17-17-7x1-160-17-17-32-3x0-1x1-1x1-0-NCHW-FP16-F=miopenConvolutionFwdAlgoImplicitGEMM:ConvHipImplicitGemmV4R1Fwd,0.397575,0,miopenConvolutionFwdAlgoImplicitGEMM,<unused>;miopenConvolutionFwdAlgoDirect:ConvDirectNaiveConvFwd,8.80904,0,miopenConvolutionFwdAlgoDirect,<unused>;miopenConvolutionFwdAlgoGEMM:gemm,6.48662,647360,rocBlas,<unused>;miopenConvolutionFwdAlgoWinograd:ConvBinWinogradRxS,0.541885,0,miopenConvolutionFwdAlgoWinograd,<unused>
160-17-17-1x7-192-17-17-32-0x3-1x1-1x1-0-NCHW-FP16-F=miopenConvolutionFwdAlgoImplicitGEMM:ConvHipImplicitGemmV4R1Fwd,0.385736,0,miopenConvolutionFwdAlgoImplicitGEMM,<unused>;miopenConvolutionFwdAlgoDirect:ConvDirectNaiveConvFwd,9.04167,0,miopenConvolutionFwdAlgoDirect,<unused>;miopenConvolutionFwdAlgoGEMM:gemm,6.47642,647360,rocBlas,<unused>;miopenConvolutionFwdAlgoWinograd:ConvBinWinogradRxSf2x3g1,0.817069,0,miopenConvolutionFwdAlgoWinograd,<unused>
768-17-17-1x1-576-17-17-32-0x0-1x1-1x1-0-NCHW-FP16-F=miopenConvolutionFwdAlgoImplicitGEMM:ConvHipImplicitGemmV4R1Fwd,1.61992,0,miopenConvolutionFwdAlgoImplicitGEMM,<unused>;miopenConvolutionFwdAlgoDirect:ConvAsm1x1U,0.912433,0,miopenConvolutionFwdAlgoDirect,<unused>;miopenConvolutionFwdAlgoGEMM:gemm,1.77029,0,rocBlas,<unused>;miopenConvolutionFwdAlgoWinograd:ConvBinWinogradRxS,2.86126,0,miopenConvolutionFwdAlgoWinograd,<unused>
192-17-17-1x7-192-17-17-32-0x3-1x1-1x1-0-NCHW-FP16-F=miopenConvolutionFwdAlgoImplicitGEMM:ConvHipImplicitGemmV4R1Fwd,0.471495,0,miopenConvolutionFwdAlgoImplicitGEMM,<unused>;miopenConvolutionFwdAlgoDirect:ConvDirectNaiveConvFwd,10.5619,0,miopenConvolutionFwdAlgoDirect,<unused>;miopenConvolutionFwdAlgoGEMM:gemm,7.55674,776832,rocBlas,<unused>;miopenConvolutionFwdAlgoWinograd:ConvBinWinogradRxS,0.972909,0,miopenConvolutionFwdAlgoWinograd,<unused>
192-17-17-7x1-192-17-17-32-3x0-1x1-1x1-0-NCHW-FP16-F=miopenConvolutionFwdAlgoImplicitGEMM:ConvHipImplicitGemmV4R1Fwd,0.503494,0,miopenConvolutionFwdAlgoImplicitGEMM,<unused>;miopenConvolutionFwdAlgoDirect:ConvDirectNaiveConvFwd,12.1981,0,miopenConvolutionFwdAlgoDirect,<unused>;miopenConvolutionFwdAlgoGEMM:gemm,7.17277,776832,rocBlas,<unused>;miopenConvolutionFwdAlgoWinograd:ConvBinWinogradRxS,0.825398,0,miopenConvolutionFwdAlgoWinograd,<unused>
768-17-17-1x1-384-17-17-32-0x0-1x1-1x1-0-NCHW-FP16-F=miopenConvolutionFwdAlgoImplicitGEMM:ConvHipImplicitGemmV4R1Fwd,1.24576,0,miopenConvolutionFwdAlgoImplicitGEMM,<unused>;miopenConvolutionFwdAlgoDirect:ConvAsm1x1U,0.61248,0,miopenConvolutionFwdAlgoDirect,<unused>;miopenConvolutionFwdAlgoGEMM:gemm,1.20314,0,rocBlas,<unused>;miopenConvolutionFwdAlgoWinograd:ConvBinWinogradRxS,1.9623,0,miopenConvolutionFwdAlgoWinograd,<unused>
192-17-17-3x3-320-8-8-32-0x0-2x2-1x1-0-NCHW-FP16-F=miopenConvolutionFwdAlgoImplicitGEMM:ConvHipImplicitGemmV4R1Fwd,0.2288,0,miopenConvolutionFwdAlgoImplicitGEMM,<unused>;miopenConvolutionFwdAlgoDirect:ConvOclDirectFwdGen,1.80816,0,miopenConvolutionFwdAlgoDirect,<unused>;miopenConvolutionFwdAlgoGEMM:gemm,3.00032,221184,rocBlas,<unused>;miopenConvolutionFwdAlgoWinograd:ConvBinWinogradRxS,0.42736,0,miopenConvolutionFwdAlgoWinograd,<unused>
192-17-17-3x3-192-8-8-32-0x0-2x2-1x1-0-NCHW-FP16-F=miopenConvolutionFwdAlgoImplicitGEMM:ConvHipImplicitGemmV4R1Fwd,0.17072,0,miopenConvolutionFwdAlgoImplicitGEMM,<unused>;miopenConvolutionFwdAlgoDirect:ConvOclDirectFwdGen,1.6576,0,miopenConvolutionFwdAlgoDirect,<unused>;miopenConvolutionFwdAlgoGEMM:gemm,3.96288,221184,rocBlas,<unused>;miopenConvolutionFwdAlgoWinograd:ConvBinWinogradRxS,0.29136,0,miopenConvolutionFwdAlgoWinograd,<unused>
1280-8-8-1x1-320-8-8-32-0x0-1x1-1x1-0-NCHW-FP16-F=miopenConvolutionFwdAlgoImplicitGEMM:ConvHipImplicitGemmV4R1Fwd,0.20208,0,miopenConvolutionFwdAlgoImplicitGEMM,<unused>;miopenConvolutionFwdAlgoDirect:ConvAsm1x1U,0.1752,0,miopenConvolutionFwdAlgoDirect,<unused>;miopenConvolutionFwdAlgoGEMM:gemm,0.55968,0,rocBlas,<unused>;miopenConvolutionFwdAlgoWinograd:ConvBinWinogradRxS,0.64032,0,miopenConvolutionFwdAlgoWinograd,<unused>
1280-8-8-1x1-384-8-8-32-0x0-1x1-1x1-0-NCHW-FP16-F=miopenConvolutionFwdAlgoImplicitGEMM:ConvHipImplicitGemmV4R1Fwd,0.34912,0,miopenConvolutionFwdAlgoImplicitGEMM,<unused>;miopenConvolutionFwdAlgoDirect:ConvAsm1x1U,0.22064,0,miopenConvolutionFwdAlgoDirect,<unused>;miopenConvolutionFwdAlgoGEMM:gemm,0.674881,0,rocBlas,<unused>;miopenConvolutionFwdAlgoWinograd:ConvBinWinogradRxSf2x3g1,0.84592,0,miopenConvolutionFwdAlgoWinograd,<unused>
384-8-8-1x3-384-8-8-32-0x1-1x1-1x1-0-NCHW-FP16-F=miopenConvolutionFwdAlgoImplicitGEMM:ConvHipImplicitGemmV4R1Fwd,0.208159,0,miopenConvolutionFwdAlgoImplicitGEMM,<unused>;miopenConvolutionFwdAlgoDirect:ConvDirectNaiveConvFwd,6.19935,0,miopenConvolutionFwdAlgoDirect,<unused>;miopenConvolutionFwdAlgoGEMM:gemm,3.42016,147456,rocBlas,<unused>;miopenConvolutionFwdAlgoWinograd:ConvBinWinogradRxS,0.246719,0,miopenConvolutionFwdAlgoWinograd,<unused>
384-8-8-3x1-384-8-8-32-1x0-1x1-1x1-0-NCHW-FP16-F=miopenConvolutionFwdAlgoImplicitGEMM:ConvHipImplicitGemmV4R1Fwd,0.198078,0,miopenConvolutionFwdAlgoImplicitGEMM,<unused>;miopenConvolutionFwdAlgoDirect:ConvDirectNaiveConvFwd,7.21597,0,miopenConvolutionFwdAlgoDirect,<unused>;miopenConvolutionFwdAlgoGEMM:gemm,2.35005,147456,rocBlas,<unused>;miopenConvolutionFwdAlgoWinograd:ConvBinWinogradRxS,0.286558,0,miopenConvolutionFwdAlgoWinograd,<unused>
1280-8-8-1x1-448-8-8-32-0x0-1x1-1x1-0-NCHW-FP16-F=miopenConvolutionFwdAlgoImplicitGEMM:ConvHipImplicitGemmV4R1Fwd,0.247358,0,miopenConvolutionFwdAlgoImplicitGEMM,<unused>;miopenConvolutionFwdAlgoDirect:ConvAsm1x1U,0.233119,0,miopenConvolutionFwdAlgoDirect,<unused>;miopenConvolutionFwdAlgoGEMM:gemm,0.778555,0,rocBlas,<unused>;miopenConvolutionFwdAlgoWinograd:ConvBinWinogradRxS,0.845755,0,miopenConvolutionFwdAlgoWinograd,<unused>
448-8-8-3x3-384-8-8-32-1x1-1x1-1x1-0-NCHW-FP16-F=miopenConvolutionFwdAlgoImplicitGEMM:ConvHipImplicitGemmV4R1Fwd,0.649436,0,miopenConvolutionFwdAlgoImplicitGEMM,<unused>;miopenConvolutionFwdAlgoDirect:ConvOclDirectFwd,2.17119,0,miopenConvolutionFwdAlgoDirect,<unused>;miopenConvolutionFwdAlgoGEMM:gemm,5.94941,516096,rocBlas,<unused>;miopenConvolutionFwdAlgoWinograd:ConvBinWinogradRxSf2x3g1,0.251198,0,miopenConvolutionFwdAlgoWinograd,<unused>
1280-8-8-1x1-192-8-8-32-0x0-1x1-1x1-0-NCHW-FP16-F=miopenConvolutionFwdAlgoImplicitGEMM:ConvHipImplicitGemmV4R1Fwd,0.162079,0,miopenConvolutionFwdAlgoImplicitGEMM,<unused>;miopenConvolutionFwdAlgoDirect:ConvAsm1x1U,0.127999,0,miopenConvolutionFwdAlgoDirect,<unused>;miopenConvolutionFwdAlgoGEMM:gemm,0.367678,0,rocBlas,<unused>;miopenConvolutionFwdAlgoWinograd:ConvBinWinogradRxSf2x3g1,0.436157,0,miopenConvolutionFwdAlgoWinograd,<unused>
2048-8-8-1x1-320-8-8-32-0x0-1x1-1x1-0-NCHW-FP16-F=miopenConvolutionFwdAlgoImplicitGEMM:ConvHipImplicitGemmV4R1Fwd,0.379839,0,miopenConvolutionFwdAlgoImplicitGEMM,<unused>;miopenConvolutionFwdAlgoDirect:ConvAsm1x1U,0.296958,0,miopenConvolutionFwdAlgoDirect,<unused>;miopenConvolutionFwdAlgoGEMM:gemm,0.322718,0,rocBlas,<unused>;miopenConvolutionFwdAlgoWinograd:ConvBinWinogradRxSf2x3g1,1.01216,0,miopenConvolutionFwdAlgoWinograd,<unused>
2048-8-8-1x1-384-8-8-32-0x0-1x1-1x1-0-NCHW-FP16-F=miopenConvolutionFwdAlgoImplicitGEMM:ConvHipImplicitGemmV4R1Fwd,0.47232,0,miopenConvolutionFwdAlgoImplicitGEMM,<unused>;miopenConvolutionFwdAlgoDirect:ConvAsm1x1U,0.345119,0,miopenConvolutionFwdAlgoDirect,<unused>;miopenConvolutionFwdAlgoGEMM:gemm,0.482558,0,rocBlas,<unused>;miopenConvolutionFwdAlgoWinograd:ConvBinWinogradRxS,1.33904,0,miopenConvolutionFwdAlgoWinograd,<unused>
2048-8-8-1x1-448-8-8-32-0x0-1x1-1x1-0-NCHW-FP16-F=miopenConvolutionFwdAlgoImplicitGEMM:ConvHipImplicitGemmV4R1Fwd,0.48192,0,miopenConvolutionFwdAlgoImplicitGEMM,<unused>;miopenConvolutionFwdAlgoDirect:ConvAsm1x1U,0.36864,0,miopenConvolutionFwdAlgoDirect,<unused>;miopenConvolutionFwdAlgoGEMM:gemm,1.2288,0,rocBlas,<unused>;miopenConvolutionFwdAlgoWinograd:ConvBinWinogradRxS,1.34096,0,miopenConvolutionFwdAlgoWinograd,<unused>
2048-8-8-1x1-192-8-8-32-0x0-1x1-1x1-0-NCHW-FP16-F=miopenConvolutionFwdAlgoImplicitGEMM:ConvHipImplicitGemmV4R1Fwd,0.2664,0,miopenConvolutionFwdAlgoImplicitGEMM,<unused>;miopenConvolutionFwdAlgoDirect:ConvAsm1x1U,0.22176,0,miopenConvolutionFwdAlgoDirect,<unused>;miopenConvolutionFwdAlgoGEMM:gemm,0.20928,0,rocBlas,<unused>;miopenConvolutionFwdAlgoWinograd:ConvBinWinogradRxSf2x3g1,0.69136,0,miopenConvolutionFwdAlgoWinograd,<unused>
3-224-224-3x3-64-224-224-16-1x1-1x1-1x1-0-NCHW-FP32-F=miopenConvolutionFwdAlgoDirect:ConvOclDirectFwd,1.65942,0,miopenConvolutionFwdAlgoDirect,<unused>;miopenConvolutionFwdAlgoGEMM:gemm,1.17786,5419008,rocBlas,<unused>;miopenConvolutionFwdAlgoWinograd:ConvBinWinogradRxSf2x3g1,0.641745,0,miopenConvolutionFwdAlgoWinograd,<unused>
64-224-224-3x3-64-224-224-16-1x1-1x1-1x1-0-NCHW-FP32-F=miopenConvolutionFwdAlgoWinograd:ConvBinWinogradRxS,2.69229,0,miopenConvolutionFwdAlgoWinograd,<unused>
64-112-112-3x3-128-112-112-16-1x1-1x1-1x1-0-NCHW-FP32-F=miopenConvolutionFwdAlgoWinograd:ConvBinWinograd3x3U,1.51666,0,miopenConvolutionFwdAlgoWinograd,<unused>
128-112-112-3x3-128-112-112-16-1x1-1x1-1x1-0-NCHW-FP32-F=miopenConvolutionFwdAlgoWinograd:ConvBinWinogradRxS,2.48392,0,miopenConvolutionFwdAlgoWinograd,<unused>
128-56-56-3x3-256-56-56-16-1x1-1x1-1x1-0-NCHW-FP32-F=miopenConvolutionFwdAlgoWinograd:ConvBinWinograd3x3U,1.45537,0,miopenConvolutionFwdAlgoWinograd,<unused>
256-56-56-3x3-256-56-56-16-1x1-1x1-1x1-0-NCHW-FP32-F=miopenConvolutionFwdAlgoWinograd:ConvBinWinogradRxS,2.43079,0,miopenConvolutionFwdAlgoWinograd,<unused>
256-28-28-3x3-512-28-28-16-1x1-1x1-1x1-0-NCHW-FP32-F=miopenConvolutionFwdAlgoWinograd:ConvBinWinograd3x3U,1.43024,0,miopenConvolutionFwdAlgoWinograd,<unused>
512-28-28-3x3-512-28-28-16-1x1-1x1-1x1-0-NCHW-FP32-F=miopenConvolutionFwdAlgoWinograd:ConvBinWinogradRxSf2x3g1,2.43831,0,miopenConvolutionFwdAlgoWinograd,<unused>
512-14-14-3x3-512-14-14-16-1x1-1x1-1x1-0-NCHW-FP32-F=miopenConvolutionFwdAlgoWinograd:ConvBinWinogradRxSf2x3g1,0.741768,0,miopenConvolutionFwdAlgoWinograd,<unused>
3-224-224-3x3-64-224-224-16-1x1-1x1-1x1-0-NCHW-FP16-F=miopenConvolutionFwdAlgoDirect:ConvOclDirectFwd,0.499463,0,miopenConvolutionFwdAlgoDirect,<unused>;miopenConvolutionFwdAlgoGEMM:gemm,1.43901,2709504,rocBlas,<unused>;miopenConvolutionFwdAlgoWinograd:ConvBinWinogradRxSf2x3g1,0.593722,0,miopenConvolutionFwdAlgoWinograd,<unused>
64-224-224-3x3-64-224-224-16-1x1-1x1-1x1-0-NCHW-FP16-F=miopenConvolutionFwdAlgoImplicitGEMM:ConvHipImplicitGemmV4R1Fwd,4.1826,0,miopenConvolutionFwdAlgoImplicitGEMM,<unused>;miopenConvolutionFwdAlgoDirect:ConvOclDirectFwd,7.59852,0,miopenConvolutionFwdAlgoDirect,<unused>;miopenConvolutionFwdAlgoGEMM:gemm,7.33846,57802752,rocBlas,<unused>;miopenConvolutionFwdAlgoWinograd:ConvBinWinogradRxS,1.97561,0,miopenConvolutionFwdAlgoWinograd,<unused>
64-112-112-3x3-128-112-112-16-1x1-1x1-1x1-0-NCHW-FP16-F=miopenConvolutionFwdAlgoImplicitGEMM:ConvHipImplicitGemmV4R1Fwd,2.0132,0,miopenConvolutionFwdAlgoImplicitGEMM,<unused>;miopenConvolutionFwdAlgoDirect:ConvOclDirectFwd,4.58396,0,miopenConvolutionFwdAlgoDirect,<unused>;miopenConvolutionFwdAlgoGEMM:gemm,3.67432,14450688,rocBlas,<unused>;miopenConvolutionFwdAlgoWinograd:ConvBinWinogradRxS,1.00916,0,miopenConvolutionFwdAlgoWinograd,<unused>
128-112-112-3x3-128-112-112-16-1x1-1x1-1x1-0-NCHW-FP16-F=miopenConvolutionFwdAlgoImplicitGEMM:ConvHipImplicitGemmV4R1Fwd,3.74137,0,miopenConvolutionFwdAlgoImplicitGEMM,<unused>;miopenConvolutionFwdAlgoDirect:ConvOclDirectFwd,9.31848,0,miopenConvolutionFwdAlgoDirect,<unused>;miopenConvolutionFwdAlgoGEMM:gemm,6.4371,28901376,rocBlas,<unused>;miopenConvolutionFwdAlgoWinograd:ConvBinWinogradRxSf2x3g1,1.79619,0,miopenConvolutionFwdAlgoWinograd,<unused>
128-56-56-3x3-256-56-56-16-1x1-1x1-1x1-0-NCHW-FP16-F=miopenConvolutionFwdAlgoImplicitGEMM:ConvHipImplicitGemmV4R1Fwd,2.17706,0,miopenConvolutionFwdAlgoImplicitGEMM,<unused>;miopenConvolutionFwdAlgoDirect:ConvOclDirectFwd,5.26887,0,miopenConvolutionFwdAlgoDirect,<unused>;miopenConvolutionFwdAlgoGEMM:gemm,3.2723,7225344,rocBlas,<unused>;miopenConvolutionFwdAlgoWinograd:ConvBinWinogradRxSf2x3g1,0.911378,0,miopenConvolutionFwdAlgoWinograd,<unused>
256-56-56-3x3-256-56-56-16-1x1-1x1-1x1-0-NCHW-FP16-F=miopenConvolutionFwdAlgoImplicitGEMM:ConvHipImplicitGemmV4R1Fwd,4.02077,0,miopenConvolutionFwdAlgoImplicitGEMM,<unused>;miopenConvolutionFwdAlgoDirect:ConvOclDirectFwd,10.5035,0,miopenConvolutionFwdAlgoDirect,<unused>;miopenConvolutionFwdAlgoGEMM:gemm,7.0004,14450688,rocBlas,<unused>;miopenConvolutionFwdAlgoWinograd:ConvBinWinogradRxSf2x3g1,1.68272,0,miopenConvolutionFwdAlgoWinograd,<unused>
256-28-28-3x3-512-28-28-16-1x1-1x1-1x1-0-NCHW-FP16-F=miopenConvolutionFwdAlgoImplicitGEMM:ConvHipImplicitGemmV4R1Fwd,2.03302,0,miopenConvolutionFwdAlgoImplicitGEMM,<unused>;miopenConvolutionFwdAlgoDirect:ConvOclDirectFwd,4.70075,0,miopenConvolutionFwdAlgoDirect,<unused>;miopenConvolutionFwdAlgoGEMM:gemm,4.76251,3612672,rocBlas,<unused>;miopenConvolutionFwdAlgoWinograd:ConvBinWinogradRxSf2x3g1,0.87857,0,miopenConvolutionFwdAlgoWinograd,<unused>
512-28-28-3x3-512-28-28-16-1x1-1x1-1x1-0-NCHW-FP16-F=miopenConvolutionFwdAlgoImplicitGEMM:ConvHipImplicitGemmV4R1Fwd,3.90717,0,miopenConvolutionFwdAlgoImplicitGEMM,<unused>;miopenConvolutionFwdAlgoDirect:ConvOclDirectFwd,9.40618,0,miopenConvolutionFwdAlgoDirect,<unused>;miopenConvolutionFwdAlgoGEMM:gemm,9.09227,7225344,rocBlas,<unused>;miopenConvolutionFwdAlgoWinograd:ConvBinWinogradRxSf2x3g1,1.70272,0,miopenConvolutionFwdAlgoWinograd,<unused>
512-14-14-3x3-512-14-14-16-1x1-1x1-1x1-0-NCHW-FP16-F=miopenConvolutionFwdAlgoImplicitGEMM:ConvHipImplicitGemmV4R1Fwd,1.29494,0,miopenConvolutionFwdAlgoImplicitGEMM,<unused>;miopenConvolutionFwdAlgoDirect:ConvOclDirectFwd,6.09579,0,miopenConvolutionFwdAlgoDirect,<unused>;miopenConvolutionFwdAlgoGEMM:gemm,6.37234,1806336,rocBlas,<unused>;miopenConvolutionFwdAlgoWinograd:ConvBinWinogradRxSf2x3g1,0.464035,0,miopenConvolutionFwdAlgoWinograd,<unused>
64-56-56-1x1-288-56-56-32-0x0-1x1-1x1-0-NCHW-FP32-F=miopenConvolutionFwdAlgoImplicitGEMM:ConvHipImplicitGemmV4R1Fwd,0.795872,0,miopenConvolutionFwdAlgoImplicitGEMM,<unused>;miopenConvolutionFwdAlgoDirect:ConvAsm1x1U,0.462739,0,miopenConvolutionFwdAlgoDirect,<unused>;miopenConvolutionFwdAlgoGEMM:gemm,0.469299,0,rocBlas,<unused>;miopenConvolutionFwdAlgoWinograd:ConvBinWinogradRxSf3x2,0.98708,0,miopenConvolutionFwdAlgoWinograd,<unused>
64-56-56-1x1-96-56-56-32-0x0-1x1-1x1-0-NCHW-FP32-F=miopenConvolutionFwdAlgoImplicitGEMM:ConvHipImplicitGemmV4R1Fwd,0.274411,0,miopenConvolutionFwdAlgoImplicitGEMM,<unused>;miopenConvolutionFwdAlgoDirect:ConvOclDirectFwd1x1,0.165607,0,miopenConvolutionFwdAlgoDirect,<unused>;miopenConvolutionFwdAlgoGEMM:gemm,0.217448,0,rocBlas,<unused>;miopenConvolutionFwdAlgoWinograd:ConvBinWinogradRxSf3x2,0.364654,0,miopenConvolutionFwdAlgoWinograd,<unused>
96-56-56-3x3-96-56-56-32-1x1-1x1-1x1-0-NCHW-FP32-F_g32=miopenConvolutionFwdAlgoDirect:ConvOclDirectFwd,0.273291,0,miopenConvolutionFwdAlgoDirect,<unused>;miopenConvolutionFwdAlgoGEMM:gemm,3.70704,10838016,rocBlas,<unused>;miopenConvolutionFwdAlgoWinograd:ConvBinWinogradRxSf2x3,1.4303,0,miopenConvolutionFwdAlgoWinograd,<unused>
96-56-56-1x1-272-56-56-32-0x0-1x1-1x1-0-NCHW-FP32-F=miopenConvolutionFwdAlgoImplicitGEMM:ConvHipImplicitGemmV4R1Fwd,1.74695,0,miopenConvolutionFwdAlgoImplicitGEMM,<unused>;miopenConvolutionFwdAlgoDirect:ConvAsm1x1U,0.661626,0,miopenConvolutionFwdAlgoDirect,<unused>;miopenConvolutionFwdAlgoGEMM:gemm,0.631546,0,rocBlas,<unused>;miopenConvolutionFwdAlgoWinograd:ConvBinWinogradRxSf3x2,1.34693,0,miopenConvolutionFwdAlgoWinograd,<unused>
304-56-56-1x1-96-56-56-32-0x0-1x1-1x1-0-NCHW-FP32-F=miopenConvolutionFwdAlgoImplicitGEMM:ConvHipImplicitGemmV4R1Fwd,1.0114,0,miopenConvolutionFwdAlgoImplicitGEMM,<unused>;miopenConvolutionFwdAlgoDirect:ConvAsm1x1U,0.686428,0,miopenConvolutionFwdAlgoDirect,<unused>;miopenConvolutionFwdAlgoGEMM:gemm,0.830434,0,rocBlas,<unused>;miopenConvolutionFwdAlgoWinograd:ConvBinWinogradRxSf3x2,1.32133,0,miopenConvolutionFwdAlgoWinograd,<unused>
320-56-56-1x1-96-56-56-32-0x0-1x1-1x1-0-NCHW-FP32-F=miopenConvolutionFwdAlgoImplicitGEMM:ConvHipImplicitGemmV4R1Fwd,1.04084,0,miopenConvolutionFwdAlgoImplicitGEMM,<unused>;miopenConvolutionFwdAlgoDirect:ConvAsm1x1U,0.717469,0,miopenConvolutionFwdAlgoDirect,<unused>;miopenConvolutionFwdAlgoGEMM:gemm,0.880996,0,rocBlas,<unused>;miopenConvolutionFwdAlgoWinograd:ConvBinWinogradRxSf3x2,1.38198,0,miopenConvolutionFwdAlgoWinograd,<unused>
336-56-56-1x1-576-28-28-32-0x0-2x2-1x1-0-NCHW-FP32-F=miopenConvolutionFwdAlgoImplicitGEMM:ConvHipImplicitGemmV4R1Fwd,1.47254,0,miopenConvolutionFwdAlgoImplicitGEMM,<unused>;miopenConvolutionFwdAlgoDirect:ConvAsm1x1U,1.27493,33718272,miopenConvolutionFwdAlgoDirect,<unused>;miopenConvolutionFwdAlgoGEMM:gemm,1.31589,91521024,rocBlas,<unused>;miopenConvolutionFwdAlgoWinograd:ConvBinWinogradRxS,7.17917,0,miopenConvolutionFwdAlgoWinograd,<unused>
336-56-56-1x1-192-56-56-32-0x0-1x1-1x1-0-NCHW-FP32-F=miopenConvolutionFwdAlgoImplicitGEMM:ConvHipImplicitGemmV4R1Fwd,1.24645,0,miopenConvolutionFwdAlgoImplicitGEMM,<unused>;miopenConvolutionFwdAlgoDirect:ConvOclDirectFwd1x1,1.44998,0,miopenConvolutionFwdAlgoDirect,<unused>;miopenConvolutionFwdAlgoGEMM:gemm,1.29621,0,rocBlas,<unused>;miopenConvolutionFwdAlgoWinograd:ConvBinWinogradRxSf3x2,2.76219,0,miopenConvolutionFwdAlgoWinograd,<unused>
192-56-56-3x3-192-28-28-32-1x1-2x2-1x1-0-NCHW-FP32-F_g32=miopenConvolutionFwdAlgoDirect:ConvOclDirectFwd,0.520021,0,miopenConvolutionFwdAlgoDirect,<unused>;miopenConvolutionFwdAlgoGEMM:gemm,2.28362,5419008,rocBlas,<unused>;miopenConvolutionFwdAlgoWinograd:ConvBinWinogradRxSf2x3,0.947718,0,miopenConvolutionFwdAlgoWinograd,<unused>
192-28-28-1x1-544-28-28-32-0x0-1x1-1x1-0-NCHW-FP32-F=miopenConvolutionFwdAlgoImplicitGEMM:ConvHipImplicitGemmV4R1Fwd,0.763551,0,miopenConvolutionFwdAlgoImplicitGEMM,<unused>;miopenConvolutionFwdAlgoDirect:ConvAsm1x1U,0.610584,0,miopenConvolutionFwdAlgoDirect,<unused>;miopenConvolutionFwdAlgoGEMM:gemm,0.594584,0,rocBlas,<unused>;miopenConvolutionFwdAlgoWinograd:ConvBinWinogradRxSf3x2,1.31605,0,miopenConvolutionFwdAlgoWinograd,<unused>
64-56-56-1x1-64-56-56-32-0x0-1x1-1x1-0-NCHW-FP32-F=miopenConvolutionFwdAlgoImplicitGEMM:ConvHipImplicitGemmV4R1Fwd,0.139198,0,miopenConvolutionFwdAlgoImplicitGEMM,<unused>;miopenConvolutionFwdAlgoDirect:ConvOclDirectFwd1x1,0.107039,0,miopenConvolutionFwdAlgoDirect,<unused>;miopenConvolutionFwdAlgoGEMM:gemm,0.116798,0,rocBlas,<unused>;miopenConvolutionFwdAlgoWinograd:ConvBinWinogradRxSf3x2,0.261915,0,miopenConvolutionFwdAlgoWinograd,<unused>
64-56-56-3x3-64-56-56-32-1x1-1x1-1x1-0-NCHW-FP32-F=miopenConvolutionFwdAlgoWinograd:ConvBinWinograd3x3U,0.416633,0,miopenConvolutionFwdAlgoWinograd,<unused>
128-56-56-1x1-256-56-56-32-0x0-1x1-1x1-0-NCHW-FP32-F=miopenConvolutionFwdAlgoImplicitGEMM:ConvHipImplicitGemmV4R1Fwd,0.753587,0,miopenConvolutionFwdAlgoImplicitGEMM,<unused>;miopenConvolutionFwdAlgoDirect:ConvOclDirectFwd1x1,1.93165,0,miopenConvolutionFwdAlgoDirect,<unused>;miopenConvolutionFwdAlgoGEMM:gemm,0.658709,0,rocBlas,<unused>;miopenConvolutionFwdAlgoWinograd:ConvBinWinogradRxSf3x2,1.53901,0,miopenConvolutionFwdAlgoWinograd,<unused>
256-56-56-1x1-64-56-56-32-0x0-1x1-1x1-0-NCHW-FP32-F=miopenConvolutionFwdAlgoImplicitGEMM:ConvHipImplicitGemmV4R1Fwd,0.380953,0,miopenConvolutionFwdAlgoImplicitGEMM,<unused>;miopenConvolutionFwdAlgoDirect:ConvOclDirectFwd1x1,0.372793,0,miopenConvolutionFwdAlgoDirect,<unused>;miopenConvolutionFwdAlgoGEMM:gemm,0.378553,0,rocBlas,<unused>;miopenConvolutionFwdAlgoWinograd:ConvBinWinogradRxSf3x2,0.777746,0,miopenConvolutionFwdAlgoWinograd,<unused>
64-56-56-1x1-256-56-56-32-0x0-1x1-1x1-0-NCHW-FP32-F=miopenConvolutionFwdAlgoImplicitGEMM:ConvHipImplicitGemmV4R1Fwd,0.423833,0,miopenConvolutionFwdAlgoImplicitGEMM,<unused>;miopenConvolutionFwdAlgoDirect:ConvOclDirectFwd1x1,0.368633,0,miopenConvolutionFwdAlgoDirect,<unused>;miopenConvolutionFwdAlgoGEMM:gemm,0.352634,0,rocBlas,<unused>;miopenConvolutionFwdAlgoWinograd:ConvBinWinogradRxSf3x2,0.880464,0,miopenConvolutionFwdAlgoWinograd,<unused>
128-56-56-3x3-128-28-28-32-1x1-2x2-1x1-0-NCHW-FP32-F=miopenConvolutionFwdAlgoImplicitGEMM:ConvHipImplicitGemmV4R1Fwd,0.845106,0,miopenConvolutionFwdAlgoImplicitGEMM,<unused>;miopenConvolutionFwdAlgoDirect:ConvOclDirectFwd,12.8825,0,miopenConvolutionFwdAlgoDirect,<unused>;miopenConvolutionFwdAlgoGEMM:gemm,2.96954,3612672,rocBlas,<unused>;miopenConvolutionFwdAlgoWinograd:ConvBinWinogradRxSf2x3g1,1.53565,0,miopenConvolutionFwdAlgoWinograd,<unused>
384-28-28-1x1-512-28-28-32-0x0-1x1-1x1-0-NCHW-FP32-F=miopenConvolutionFwdAlgoImplicitGEMM:ConvHipImplicitGemmV4R1Fwd,1.01621,0,miopenConvolutionFwdAlgoImplicitGEMM,<unused>;miopenConvolutionFwdAlgoDirect:ConvAsm1x1U,1.17014,0,miopenConvolutionFwdAlgoDirect,<unused>;miopenConvolutionFwdAlgoGEMM:gemm,1.2747,0,rocBlas,<unused>;miopenConvolutionFwdAlgoWinograd:ConvBinWinogradRxSf3x2,2.29404,0,miopenConvolutionFwdAlgoWinograd,<unused>
512-28-28-1x1-128-28-28-32-0x0-1x1-1x1-0-NCHW-FP32-F=miopenConvolutionFwdAlgoImplicitGEMM:ConvHipImplicitGemmV4R1Fwd,0.391378,0,miopenConvolutionFwdAlgoImplicitGEMM,<unused>;miopenConvolutionFwdAlgoDirect:ConvOclDirectFwd1x1,0.412179,0,miopenConvolutionFwdAlgoDirect,<unused>;miopenConvolutionFwdAlgoGEMM:gemm,0.398259,0,rocBlas,<unused>;miopenConvolutionFwdAlgoWinograd:ConvBinWinogradRxSf3x2,0.800838,0,miopenConvolutionFwdAlgoWinograd,<unused>
128-28-28-3x3-128-28-28-32-1x1-1x1-1x1-0-NCHW-FP32-F=miopenConvolutionFwdAlgoWinograd:ConvBinWinograd3x3U,0.401778,0,miopenConvolutionFwdAlgoWinograd,<unused>
128-28-28-1x1-512-28-28-32-0x0-1x1-1x1-0-NCHW-FP32-F=miopenConvolutionFwdAlgoImplicitGEMM:ConvHipImplicitGemmV4R1Fwd,0.390097,0,miopenConvolutionFwdAlgoImplicitGEMM,<unused>;miopenConvolutionFwdAlgoDirect:ConvAsm1x1U,0.393458,0,miopenConvolutionFwdAlgoDirect,<unused>;miopenConvolutionFwdAlgoGEMM:gemm,0.351056,0,rocBlas,<unused>;miopenConvolutionFwdAlgoWinograd:ConvBinWinogradRxSf3x2,0.8666,0,miopenConvolutionFwdAlgoWinograd,<unused>
256-28-28-3x3-256-14-14-32-1x1-2x2-1x1-0-NCHW-FP32-F=miopenConvolutionFwdAlgoImplicitGEMM:ConvHipImplicitGemmV4R1Fwd,0.987245,0,miopenConvolutionFwdAlgoImplicitGEMM,<unused>;miopenConvolutionFwdAlgoDirect:ConvOclDirectFwd,12.2609,0,miopenConvolutionFwdAlgoDirect,<unused>;miopenConvolutionFwdAlgoGEMM:gemm,3.56368,1806336,rocBlas,<unused>;miopenConvolutionFwdAlgoWinograd:ConvBinWinogradRxSf2x3g1,1.51687,0,miopenConvolutionFwdAlgoWinograd,<unused>
768-14-14-1x1-1024-14-14-32-0x0-1x1-1x1-0-NCHW-FP32-F=miopenConvolutionFwdAlgoImplicitGEMM:ConvHipImplicitGemmV4R1Fwd,1.11029,0,miopenConvolutionFwdAlgoImplicitGEMM,<unused>;miopenConvolutionFwdAlgoDirect:ConvAsm1x1U,1.46279,0,miopenConvolutionFwdAlgoDirect,<unused>;miopenConvolutionFwdAlgoGEMM:gemm,1.50327,0,rocBlas,<unused>;miopenConvolutionFwdAlgoWinograd:ConvBinWinogradRxSf3x2,2.31434,0,miopenConvolutionFwdAlgoWinograd,<unused>
1024-14-14-1x1-256-14-14-32-0x0-1x1-1x1-0-NCHW-FP32-F=miopenConvolutionFwdAlgoImplicitGEMM:ConvHipImplicitGemmV4R1Fwd,0.45698,0,miopenConvolutionFwdAlgoImplicitGEMM,<unused>;miopenConvolutionFwdAlgoDirect:ConvOclDirectFwd1x1,0.565945,0,miopenConvolutionFwdAlgoDirect,<unused>;miopenConvolutionFwdAlgoGEMM:gemm,0.520663,0,rocBlas,<unused>;miopenConvolutionFwdAlgoWinograd:ConvBinWinogradRxSf3x2,0.89668,0,miopenConvolutionFwdAlgoWinograd,<unused>
256-14-14-3x3-256-14-14-32-1x1-1x1-1x1-0-NCHW-FP32-F=miopenConvolutionFwdAlgoWinograd:ConvBinWinogradRxSf2x3g1,0.389137,0,miopenConvolutionFwdAlgoWinograd,<unused>
256-14-14-1x1-1024-14-14-32-0x0-1x1-1x1-0-NCHW-FP32-F=miopenConvolutionFwdAlgoImplicitGEMM:ConvHipImplicitGemmV4R1Fwd,0.384656,0,miopenConvolutionFwdAlgoImplicitGEMM,<unused>;miopenConvolutionFwdAlgoDirect:ConvOclDirectFwd1x1,0.46738,0,miopenConvolutionFwdAlgoDirect,<unused>;miopenConvolutionFwdAlgoGEMM:gemm,0.477941,0,rocBlas,<unused>;miopenConvolutionFwdAlgoWinograd:ConvBinWinogradRxSf3x2,0.842917,0,miopenConvolutionFwdAlgoWinograd,<unused>
512-14-14-3x3-512-7-7-32-1x1-2x2-1x1-0-NCHW-FP32-F=miopenConvolutionFwdAlgoImplicitGEMM:ConvHipImplicitGemmV4R1Fwd,1.9636,0,miopenConvolutionFwdAlgoImplicitGEMM,<unused>;miopenConvolutionFwdAlgoDirect:ConvOclDirectFwd,28.1159,0,miopenConvolutionFwdAlgoDirect,<unused>;miopenConvolutionFwdAlgoGEMM:gemm,11.6025,903168,rocBlas,<unused>;miopenConvolutionFwdAlgoWinograd:ConvBinWinogradRxSf2x3g1,2.15817,0,miopenConvolutionFwdAlgoWinograd,<unused>
1536-7-7-1x1-2048-7-7-32-0x0-1x1-1x1-0-NCHW-FP32-F=miopenConvolutionFwdAlgoImplicitGEMM:ConvHipImplicitGemmV4R1Fwd,1.72215,0,miopenConvolutionFwdAlgoImplicitGEMM,<unused>;miopenConvolutionFwdAlgoDirect:ConvAsm1x1U,1.63687,0,miopenConvolutionFwdAlgoDirect,<unused>;miopenConvolutionFwdAlgoGEMM:gemm,2.08393,0,rocBlas,<unused>;miopenConvolutionFwdAlgoWinograd:ConvBinWinogradRxSf3x2,3.2411,0,miopenConvolutionFwdAlgoWinograd,<unused>
2048-7-7-1x1-512-7-7-32-0x0-1x1-1x1-0-NCHW-FP32-F=miopenConvolutionFwdAlgoImplicitGEMM:ConvHipImplicitGemmV4R1Fwd,0.953159,0,miopenConvolutionFwdAlgoImplicitGEMM,<unused>;miopenConvolutionFwdAlgoDirect:ConvAsm1x1U,0.72499,0,miopenConvolutionFwdAlgoDirect,<unused>;miopenConvolutionFwdAlgoGEMM:gemm,1.18949,0,rocBlas,<unused>;miopenConvolutionFwdAlgoWinograd:ConvBinWinogradRxSf3x2,1.31014,0,miopenConvolutionFwdAlgoWinograd,<unused>
512-7-7-3x3-512-7-7-32-1x1-1x1-1x1-0-NCHW-FP32-F=miopenConvolutionFwdAlgoWinograd:ConvBinWinogradRxSf2x3g1,0.539542,0,miopenConvolutionFwdAlgoWinograd,<unused>
512-7-7-1x1-2048-7-7-32-0x0-1x1-1x1-0-NCHW-FP32-F=miopenConvolutionFwdAlgoImplicitGEMM:ConvHipImplicitGemmV4R1Fwd,0.621305,0,miopenConvolutionFwdAlgoImplicitGEMM,<unused>;miopenConvolutionFwdAlgoDirect:ConvAsm1x1U,0.648346,0,miopenConvolutionFwdAlgoDirect,<unused>;miopenConvolutionFwdAlgoGEMM:gemm,0.704509,0,rocBlas,<unused>;miopenConvolutionFwdAlgoWinograd:ConvBinWinogradRxSf3x2,1.12997,0,miopenConvolutionFwdAlgoWinograd,<unused>
3-299-299-3x3-32-149-149-16-0x0-2x2-1x1-0-NCHW-FP32-F=miopenConvolutionFwdAlgoDirect:ConvOclDirectFwdGen,1.18162,0,miopenConvolutionFwdAlgoDirect,<unused>;miopenConvolutionFwdAlgoGEMM:gemm,0.780816,2397708,rocBlas,<unused>;miopenConvolutionFwdAlgoWinograd:ConvBinWinogradRxSf2x3g1,0.292325,0,miopenConvolutionFwdAlgoWinograd,<unused>
32-149-149-3x3-32-147-147-16-0x0-1x1-1x1-0-NCHW-FP32-F=miopenConvolutionFwdAlgoDirect:ConvOclDirectFwd,4.97353,0,miopenConvolutionFwdAlgoDirect,<unused>;miopenConvolutionFwdAlgoGEMM:gemm,2.44229,24893568,rocBlas,<unused>;miopenConvolutionFwdAlgoWinograd:ConvBinWinogradRxS,0.423847,0,miopenConvolutionFwdAlgoWinograd,<unused>
32-147-147-3x3-64-147-147-16-1x1-1x1-1x1-0-NCHW-FP32-F=miopenConvolutionFwdAlgoWinograd:ConvBinWinograd3x3U,0.795693,0,miopenConvolutionFwdAlgoWinograd,<unused>
64-147-147-3x3-96-73-73-16-0x0-2x2-1x1-0-NCHW-FP32-F=miopenConvolutionFwdAlgoDirect:ConvOclDirectFwd,8.83231,0,miopenConvolutionFwdAlgoDirect,<unused>;miopenConvolutionFwdAlgoGEMM:gemm,2.40389,12278016,rocBlas,<unused>;miopenConvolutionFwdAlgoWinograd:ConvBinWinogradRxSf2x3g1,1.97811,0,miopenConvolutionFwdAlgoWinograd,<unused>
160-73-73-1x1-128-73-73-16-0x0-1x1-1x1-0-NCHW-FP32-F=miopenConvolutionFwdAlgoDirect:ConvAsm1x1U,0.424167,0,miopenConvolutionFwdAlgoDirect,<unused>;miopenConvolutionFwdAlgoGEMM:gemm,0.358246,0,rocBlas,<unused>;miopenConvolutionFwdAlgoWinograd:ConvBinWinogradRxSf3x2,0.811054,0,miopenConvolutionFwdAlgoWinograd,<unused>
64-73-73-3x3-96-71-71-16-0x0-1x1-1x1-0-NCHW-FP32-F=miopenConvolutionFwdAlgoDirect:ConvOclDirectFwd,7.45533,0,miopenConvolutionFwdAlgoDirect,<unused>;miopenConvolutionFwdAlgoGEMM:gemm,2.08131,11614464,rocBlas,<unused>;miopenConvolutionFwdAlgoWinograd:ConvBinWinogradRxS,0.517769,0,miopenConvolutionFwdAlgoWinograd,<unused>
64-73-73-1x7-64-73-73-16-0x3-1x1-1x1-0-NCHW-FP32-F=miopenConvolutionFwdAlgoDirect:ConvDirectNaiveConvFwd,10.2939,0,miopenConvolutionFwdAlgoDirect,<unused>;miopenConvolutionFwdAlgoGEMM:gemm,1.54883,9549568,rocBlas,<unused>;miopenConvolutionFwdAlgoWinograd:ConvBinWinogradRxSf3x2,0.661131,0,miopenConvolutionFwdAlgoWinograd,<unused>
64-73-73-7x1-64-73-73-16-3x0-1x1-1x1-0-NCHW-FP32-F=miopenConvolutionFwdAlgoDirect:ConvDirectNaiveConvFwd,12.6335,0,miopenConvolutionFwdAlgoDirect,<unused>;miopenConvolutionFwdAlgoGEMM:gemm,1.52834,9549568,rocBlas,<unused>;miopenConvolutionFwdAlgoWinograd:ConvBinWinogradRxSf3x2,0.669292,0,miopenConvolutionFwdAlgoWinograd,<unused>
192-71-71-3x3-192-35-35-16-0x0-2x2-1x1-0-NCHW-FP32-F=miopenConvolutionFwdAlgoDirect:ConvOclDirectFwd,28.6235,0,miopenConvolutionFwdAlgoDirect,<unused>;miopenConvolutionFwdAlgoGEMM:gemm,2.48837,8467200,rocBlas,<unused>;miopenConvolutionFwdAlgoWinograd:ConvBinWinogradRxSf2x3g1,2.75333,0,miopenConvolutionFwdAlgoWinograd,<unused>
384-35-35-1x1-128-35-35-16-0x0-1x1-1x1-0-NCHW-FP32-F=miopenConvolutionFwdAlgoDirect:ConvAsm1x1U,0.254404,0,miopenConvolutionFwdAlgoDirect,<unused>;miopenConvolutionFwdAlgoGEMM:gemm,0.243524,0,rocBlas,<unused>;miopenConvolutionFwdAlgoWinograd:ConvBinWinogradRxSf3x2,0.449128,0,miopenConvolutionFwdAlgoWinograd,<unused>
384-35-35-1x1-96-35-35-16-0x0-1x1-1x1-0-NCHW-FP32-F=miopenConvolutionFwdAlgoDirect:ConvAsm1x1U,0.191683,0,miopenConvolutionFwdAlgoDirect,<unused>;miopenConvolutionFwdAlgoGEMM:gemm,0.162563,0,rocBlas,<unused>;miopenConvolutionFwdAlgoWinograd:ConvBinWinogradRxSf3x2,0.364646,0,miopenConvolutionFwdAlgoWinograd,<unused>
64-35-35-3x3-96-35-35-16-1x1-1x1-1x1-0-NCHW-FP32-F=miopenConvolutionFwdAlgoWinograd:ConvBinWinograd3x3U,0.151522,0,miopenConvolutionFwdAlgoWinograd,<unused>
96-35-35-3x3-96-35-35-16-1x1-1x1-1x1-0-NCHW-FP32-F=miopenConvolutionFwdAlgoWinograd:ConvBinWinograd3x3U,0.208644,0,miopenConvolutionFwdAlgoWinograd,<unused>
384-35-35-3x3-384-17-17-16-0x0-2x2-1x1-0-NCHW-FP32-F=miopenConvolutionFwdAlgoDirect:ConvOclDirectFwd,38.6136,0,miopenConvolutionFwdAlgoDirect,<unused>;miopenConvolutionFwdAlgoGEMM:gemm,2.34755,3995136,rocBlas,<unused>;miopenConvolutionFwdAlgoWinograd:ConvBinWinogradRxSf2x3g1,2.89461,0,miopenConvolutionFwdAlgoWinograd,<unused>
384-35-35-1x1-192-35-35-16-0x0-1x1-1x1-0-NCHW-FP32-F=miopenConvolutionFwdAlgoDirect:ConvAsm1x1U,0.415687,0,miopenConvolutionFwdAlgoDirect,<unused>;miopenConvolutionFwdAlgoGEMM:gemm,0.316645,0,rocBlas,<unused>;miopenConvolutionFwdAlgoWinograd:ConvBinWinogradRxSf3x2,0.704172,0,miopenConvolutionFwdAlgoWinograd,<unused>
192-35-35-3x3-224-35-35-16-1x1-1x1-1x1-0-NCHW-FP32-F=miopenConvolutionFwdAlgoWinograd:ConvBinWinograd3x3U,0.775373,0,miopenConvolutionFwdAlgoWinograd,<unused>
224-35-35-3x3-256-17-17-16-0x0-2x2-1x1-0-NCHW-FP32-F=miopenConvolutionFwdAlgoDirect:ConvOclDirectFwd,15.9073,0,miopenConvolutionFwdAlgoDirect,<unused>;miopenConvolutionFwdAlgoGEMM:gemm,1.55394,2330496,rocBlas,<unused>;miopenConvolutionFwdAlgoWinograd:ConvBinWinogradRxSf2x3g1,1.14658,0,miopenConvolutionFwdAlgoWinograd,<unused>
1024-17-17-1x1-768-17-17-16-0x0-1x1-1x1-0-NCHW-FP32-F=miopenConvolutionFwdAlgoDirect:ConvAsm1x1U,1.06386,0,miopenConvolutionFwdAlgoDirect,<unused>;miopenConvolutionFwdAlgoGEMM:gemm,0.897935,0,rocBlas,<unused>;miopenConvolutionFwdAlgoWinograd:ConvBinWinogradRxSf3x2,1.75763,0,miopenConvolutionFwdAlgoWinograd,<unused>
192-17-17-1x7-224-17-17-16-0x3-1x1-1x1-0-NCHW-FP32-F=miopenConvolutionFwdAlgoDirect:ConvDirectNaiveConvFwd,5.94202,0,miopenConvolutionFwdAlgoDirect,<unused>;miopenConvolutionFwdAlgoGEMM:gemm,1.13154,1553664,rocBlas,<unused>;miopenConvolutionFwdAlgoWinograd:ConvBinWinogradRxSf3x2,0.517609,0,miopenConvolutionFwdAlgoWinograd,<unused>
224-17-17-7x1-256-17-17-16-3x0-1x1-1x1-0-NCHW-FP32-F=miopenConvolutionFwdAlgoDirect:ConvDirectNaiveConvFwd,9.52064,0,miopenConvolutionFwdAlgoDirect,<unused>;miopenConvolutionFwdAlgoGEMM:gemm,1.26722,1812608,rocBlas,<unused>;miopenConvolutionFwdAlgoWinograd:ConvBinWinogradRxSf3x2,0.60081,0,miopenConvolutionFwdAlgoWinograd,<unused>
192-17-17-7x1-192-17-17-16-3x0-1x1-1x1-0-NCHW-FP32-F=miopenConvolutionFwdAlgoDirect:ConvDirectNaiveConvFwd,6.22267,0,miopenConvolutionFwdAlgoDirect,<unused>;miopenConvolutionFwdAlgoGEMM:gemm,1.09314,1553664,rocBlas,<unused>;miopenConvolutionFwdAlgoWinograd:ConvBinWinogradRxSf3x2,0.356006,0,miopenConvolutionFwdAlgoWinograd,<unused>
224-17-17-7x1-224-17-17-16-3x0-1x1-1x1-0-NCHW-FP32-F=miopenConvolutionFwdAlgoDirect:ConvDirectNaiveConvFwd,8.64975,0,miopenConvolutionFwdAlgoDirect,<unused>;miopenConvolutionFwdAlgoGEMM:gemm,1.21603,1812608,rocBlas,<unused>;miopenConvolutionFwdAlgoWinograd:ConvBinWinogradRxSf3x2,0.59713,0,miopenConvolutionFwdAlgoWinograd,<unused>
224-17-17-1x7-256-17-17-16-0x3-1x1-1x1-0-NCHW-FP32-F=miopenConvolutionFwdAlgoDirect:ConvDirectNaiveConvFwd,7.91214,0,miopenConvolutionFwdAlgoDirect,<unused>;miopenConvolutionFwdAlgoGEMM:gemm,1.21603,1812608,rocBlas,<unused>;miopenConvolutionFwdAlgoWinograd:ConvBinWinogradRxSf3x2,0.59697,0,miopenConvolutionFwdAlgoWinograd,<unused>
1024-17-17-1x1-128-17-17-16-0x0-1x1-1x1-0-NCHW-FP32-F=miopenConvolutionFwdAlgoDirect:ConvOclDirectFwd1x1,0.269925,0,miopenConvolutionFwdAlgoDirect,<unused>;miopenConvolutionFwdAlgoGEMM:gemm,0.197444,0,rocBlas,<unused>;miopenConvolutionFwdAlgoWinograd:ConvBinWinogradRxSf3x2,0.460327,0,miopenConvolutionFwdAlgoWinograd,<unused>
1024-17-17-1x1-192-17-17-16-0x0-1x1-1x1-0-NCHW-FP32-F=miopenConvolutionFwdAlgoDirect:ConvAsm1x1U,0.320966,0,miopenConvolutionFwdAlgoDirect,<unused>;miopenConvolutionFwdAlgoGEMM:gemm,0.256804,0,rocBlas,<unused>;miopenConvolutionFwdAlgoWinograd:ConvBinWinogradRxSf3x2,0.460328,0,miopenConvolutionFwdAlgoWinograd,<unused>
192-17-17-3x3-192-8-8-16-0x0-2x2-1x1-0-NCHW-FP32-F=miopenConvolutionFwdAlgoImplicitGEMM:ConvHipImplicitGemmV4R1Fwd,0.192964,0,miopenConvolutionFwdAlgoImplicitGEMM,<unused>;miopenConvolutionFwdAlgoDirect:ConvOclDirectFwd,2.33556,0,miopenConvolutionFwdAlgoDirect,<unused>;miopenConvolutionFwdAlgoGEMM:gemm,1.09827,442368,rocBlas,<unused>;miopenConvolutionFwdAlgoWinograd:ConvBinWinogradRxSf2x3g1,0.183523,0,miopenConvolutionFwdAlgoWinograd,<unused>
1024-17-17-1x1-256-17-17-16-0x0-1x1-1x1-0-NCHW-FP32-F=miopenConvolutionFwdAlgoDirect:ConvOclDirectFwd1x1,0.58657,0,miopenConvolutionFwdAlgoDirect,<unused>;miopenConvolutionFwdAlgoGEMM:gemm,0.340166,0,rocBlas,<unused>;miopenConvolutionFwdAlgoWinograd:ConvBinWinogradRxSf3x2,0.675372,0,miopenConvolutionFwdAlgoWinograd,<unused>
256-17-17-1x7-256-17-17-16-0x3-1x1-1x1-0-NCHW-FP32-F=miopenConvolutionFwdAlgoDirect:ConvDirectNaiveConvFwd,9.13456,0,miopenConvolutionFwdAlgoDirect,<unused>;miopenConvolutionFwdAlgoGEMM:gemm,1.37221,2071552,rocBlas,<unused>;miopenConvolutionFwdAlgoWinograd:ConvBinWinogradRxSf3x2,0.677132,0,miopenConvolutionFwdAlgoWinograd,<unused>
256-17-17-7x1-320-17-17-16-3x0-1x1-1x1-0-NCHW-FP32-F=miopenConvolutionFwdAlgoDirect:ConvDirectNaiveConvFwd,12.8882,0,miopenConvolutionFwdAlgoDirect,<unused>;miopenConvolutionFwdAlgoGEMM:gemm,1.3901,2071552,rocBlas,<unused>;miopenConvolutionFwdAlgoWinograd:ConvBinWinogradRxSf3x2,0.682732,0,miopenConvolutionFwdAlgoWinograd,<unused>
320-17-17-3x3-320-8-8-16-0x0-2x2-1x1-0-NCHW-FP32-F=miopenConvolutionFwdAlgoImplicitGEMM:ConvHipImplicitGemmV4R1Fwd,0.378566,0,miopenConvolutionFwdAlgoImplicitGEMM,<unused>;miopenConvolutionFwdAlgoDirect:ConvOclDirectFwd,6.42891,0,miopenConvolutionFwdAlgoDirect,<unused>;miopenConvolutionFwdAlgoGEMM:gemm,1.25187,737280,rocBlas,<unused>;miopenConvolutionFwdAlgoWinograd:ConvBinWinogradRxSf2x3g1,0.557289,0,miopenConvolutionFwdAlgoWinograd,<unused>
1536-8-8-1x1-768-8-8-16-0x0-1x1-1x1-0-NCHW-FP32-F=miopenConvolutionFwdAlgoImplicitGEMM:ConvHipImplicitGemmV4R1Fwd,0.358246,0,miopenConvolutionFwdAlgoImplicitGEMM,<unused>;miopenConvolutionFwdAlgoDirect:ConvAsm1x1U,0.441768,0,miopenConvolutionFwdAlgoDirect,<unused>;miopenConvolutionFwdAlgoGEMM:gemm,0.532009,0,rocBlas,<unused>;miopenConvolutionFwdAlgoWinograd:ConvBinWinogradRxSf3x2,0.674092,0,miopenConvolutionFwdAlgoWinograd,<unused>
1536-8-8-1x1-256-8-8-16-0x0-1x1-1x1-0-NCHW-FP32-F=miopenConvolutionFwdAlgoImplicitGEMM:ConvHipImplicitGemmV4R1Fwd,0.239204,0,miopenConvolutionFwdAlgoImplicitGEMM,<unused>;miopenConvolutionFwdAlgoDirect:ConvOclDirectFwd1x1,0.209124,0,miopenConvolutionFwdAlgoDirect,<unused>;miopenConvolutionFwdAlgoGEMM:gemm,0.230404,0,rocBlas,<unused>;miopenConvolutionFwdAlgoWinograd:ConvBinWinogradRxSf3x2,0.349766,0,miopenConvolutionFwdAlgoWinograd,<unused>
384-8-8-1x3-256-8-8-16-0x1-1x1-1x1-0-NCHW-FP32-F=miopenConvolutionFwdAlgoImplicitGEMM:ConvHipImplicitGemmV4R1Fwd,0.181763,0,miopenConvolutionFwdAlgoImplicitGEMM,<unused>;miopenConvolutionFwdAlgoDirect:ConvDirectNaiveConvFwd,2.24948,0,miopenConvolutionFwdAlgoDirect,<unused>;miopenConvolutionFwdAlgoGEMM:gemm,0.768016,294912,rocBlas,<unused>;miopenConvolutionFwdAlgoWinograd:ConvBinWinogradRxS,0.175523,0,miopenConvolutionFwdAlgoWinograd,<unused>
384-8-8-3x1-256-8-8-16-1x0-1x1-1x1-0-NCHW-FP32-F=miopenConvolutionFwdAlgoImplicitGEMM:ConvHipImplicitGemmV4R1Fwd,0.171683,0,miopenConvolutionFwdAlgoImplicitGEMM,<unused>;miopenConvolutionFwdAlgoDirect:ConvDirectNaiveConvFwd,2.60212,0,miopenConvolutionFwdAlgoDirect,<unused>;miopenConvolutionFwdAlgoGEMM:gemm,0.829456,294912,rocBlas,<unused>;miopenConvolutionFwdAlgoWinograd:ConvBinWinogradRxSf2x3g1,0.177283,0,miopenConvolutionFwdAlgoWinograd,<unused>
384-8-8-3x1-448-8-8-16-1x0-1x1-1x1-0-NCHW-FP32-F=miopenConvolutionFwdAlgoImplicitGEMM:ConvHipImplicitGemmV4R1Fwd,0.172163,0,miopenConvolutionFwdAlgoImplicitGEMM,<unused>;miopenConvolutionFwdAlgoDirect:ConvDirectNaiveConvFwd,4.21671,0,miopenConvolutionFwdAlgoDirect,<unused>;miopenConvolutionFwdAlgoGEMM:gemm,0.814096,294912,rocBlas,<unused>;miopenConvolutionFwdAlgoWinograd:ConvBinWinogradRxSf2x3g1,0.176963,0,miopenConvolutionFwdAlgoWinograd,<unused>
448-8-8-1x3-512-8-8-16-0x1-1x1-1x1-0-NCHW-FP32-F=miopenConvolutionFwdAlgoImplicitGEMM:ConvHipImplicitGemmV4R1Fwd,0.272645,0,miopenConvolutionFwdAlgoImplicitGEMM,<unused>;miopenConvolutionFwdAlgoDirect:ConvDirectNaiveConvFwd,4.81832,0,miopenConvolutionFwdAlgoDirect,<unused>;miopenConvolutionFwdAlgoGEMM:gemm,0.9856,344064,rocBlas,<unused>;miopenConvolutionFwdAlgoWinograd:ConvBinWinogradRxS,0.290885,0,miopenConvolutionFwdAlgoWinograd,<unused>
512-8-8-1x3-256-8-8-16-0x1-1x1-1x1-0-NCHW-FP32-F=miopenConvolutionFwdAlgoImplicitGEMM:ConvHipImplicitGemmV4R1Fwd,0.236804,0,miopenConvolutionFwdAlgoImplicitGEMM,<unused>;miopenConvolutionFwdAlgoDirect:ConvDirectNaiveConvFwd,2.99989,0,miopenConvolutionFwdAlgoDirect,<unused>;miopenConvolutionFwdAlgoGEMM:gemm,1.01634,393216,rocBlas,<unused>;miopenConvolutionFwdAlgoWinograd:ConvBinWinogradRxSf2x3g1,0.228964,0,miopenConvolutionFwdAlgoWinograd,<unused>
512-8-8-3x1-256-8-8-16-1x0-1x1-1x1-0-NCHW-FP32-F=miopenConvolutionFwdAlgoImplicitGEMM:ConvHipImplicitGemmV4R1Fwd,0.224483,0,miopenConvolutionFwdAlgoImplicitGEMM,<unused>;miopenConvolutionFwdAlgoDirect:ConvDirectNaiveConvFwd,3.4447,0,miopenConvolutionFwdAlgoDirect,<unused>;miopenConvolutionFwdAlgoGEMM:gemm,1.04706,393216,rocBlas,<unused>;miopenConvolutionFwdAlgoWinograd:ConvBinWinogradRxSf2x3g1,0.228804,0,miopenConvolutionFwdAlgoWinograd,<unused>
3-224-224-7x7-64-112-112-16-3x3-2x2-1x1-0-NCHW-FP32-F=miopenConvolutionFwdAlgoDirect:ConvAsm7x7c3h224w224k64u2v2p3q3f1,0.457753,0,miopenConvolutionFwdAlgoDirect,<unused>;miopenConvolutionFwdAlgoGEMM:gemm,1.08542,7375872,rocBlas,<unused>;miopenConvolutionFwdAlgoWinograd:ConvBinWinogradRxS,0.646871,0,miopenConvolutionFwdAlgoWinograd,<unused>
64-56-56-1x1-512-56-56-16-0x0-1x1-1x1-0-NCHW-FP32-F=miopenConvolutionFwdAlgoImplicitGEMM:ConvHipImplicitGemmV4R1Fwd,0.435993,0,miopenConvolutionFwdAlgoImplicitGEMM,<unused>;miopenConvolutionFwdAlgoDirect:ConvAsm1x1U,0.397914,0,miopenConvolutionFwdAlgoDirect,<unused>;miopenConvolutionFwdAlgoGEMM:gemm,0.592631,0,rocBlas,<unused>;miopenConvolutionFwdAlgoWinograd:ConvBinWinogradRxSf3x2,0.883987,0,miopenConvolutionFwdAlgoWinograd,<unused>
256-56-56-3x3-256-56-56-16-1x1-1x1-1x1-0-NCHW-FP32-F_g64=miopenConvolutionFwdAlgoDirect:ConvAsm3x3U,0.164478,0,miopenConvolutionFwdAlgoDirect,<unused>;miopenConvolutionFwdAlgoGEMM:gemm,3.48411,28901376,rocBlas,<unused>;miopenConvolutionFwdAlgoWinograd:ConvBinWinogradRxSf2x3,1.44702,0,miopenConvolutionFwdAlgoWinograd,<unused>
256-56-56-1x1-256-56-56-16-0x0-1x1-1x1-0-NCHW-FP32-F=miopenConvolutionFwdAlgoImplicitGEMM:ConvHipImplicitGemmV4R1Fwd,0.719989,0,miopenConvolutionFwdAlgoImplicitGEMM,<unused>;miopenConvolutionFwdAlgoDirect:ConvAsm1x1U,0.939026,0,miopenConvolutionFwdAlgoDirect,<unused>;miopenConvolutionFwdAlgoGEMM:gemm,0.69391,0,rocBlas,<unused>;miopenConvolutionFwdAlgoWinograd:ConvBinWinogradRxSf3x2,1.45742,0,miopenConvolutionFwdAlgoWinograd,<unused>
256-56-56-1x1-512-56-56-16-0x0-1x1-1x1-0-NCHW-FP32-F=miopenConvolutionFwdAlgoImplicitGEMM:ConvHipImplicitGemmV4R1Fwd,1.3443,0,miopenConvolutionFwdAlgoImplicitGEMM,<unused>;miopenConvolutionFwdAlgoDirect:ConvAsm1x1U,1.58798,0,miopenConvolutionFwdAlgoDirect,<unused>;miopenConvolutionFwdAlgoGEMM:gemm,1.31086,0,rocBlas,<unused>;miopenConvolutionFwdAlgoWinograd:ConvBinWinogradRxSf3x2,2.83516,0,miopenConvolutionFwdAlgoWinograd,<unused>
512-56-56-3x3-512-28-28-16-1x1-2x2-1x1-0-NCHW-FP32-F_g64=miopenConvolutionFwdAlgoDirect:ConvOclDirectFwd,1.5987,0,miopenConvolutionFwdAlgoDirect,<unused>;miopenConvolutionFwdAlgoGEMM:gemm,2.12477,14450688,rocBlas,<unused>;miopenConvolutionFwdAlgoWinograd:ConvBinWinogradRxSf2x3,1.15406,0,miopenConvolutionFwdAlgoWinograd,<unused>
768-28-28-1x1-512-28-28-16-0x0-1x1-1x1-0-NCHW-FP32-F=miopenConvolutionFwdAlgoImplicitGEMM:ConvHipImplicitGemmV4R1Fwd,1.04606,0,miopenConvolutionFwdAlgoImplicitGEMM,<unused>;miopenConvolutionFwdAlgoDirect:ConvAsm1x1U,1.36526,0,miopenConvolutionFwdAlgoDirect,<unused>;miopenConvolutionFwdAlgoGEMM:gemm,1.1091,0,rocBlas,<unused>;miopenConvolutionFwdAlgoWinograd:ConvBinWinogradRxSf3x2,2.30989,0,miopenConvolutionFwdAlgoWinograd,<unused>
512-28-28-1x1-512-28-28-16-0x0-1x1-1x1-0-NCHW-FP32-F=miopenConvolutionFwdAlgoImplicitGEMM:ConvHipImplicitGemmV4R1Fwd,0.628791,0,miopenConvolutionFwdAlgoImplicitGEMM,<unused>;miopenConvolutionFwdAlgoDirect:ConvOclDirectFwd1x1,1.02894,0,miopenConvolutionFwdAlgoDirect,<unused>;miopenConvolutionFwdAlgoGEMM:gemm,0.757109,0,rocBlas,<unused>;miopenConvolutionFwdAlgoWinograd:ConvBinWinogradRxSf3x2,1.57374,0,miopenConvolutionFwdAlgoWinograd,<unused>
512-28-28-3x3-512-28-28-16-1x1-1x1-1x1-0-NCHW-FP32-F_g64=miopenConvolutionFwdAlgoDirect:ConvAsm3x3U,0.211197,0,miopenConvolutionFwdAlgoDirect,<unused>;miopenConvolutionFwdAlgoGEMM:gemm,1.86875,14450688,rocBlas,<unused>;miopenConvolutionFwdAlgoWinograd:ConvBinWinogradRxSf2x3,0.515192,0,miopenConvolutionFwdAlgoWinograd,<unused>
512-28-28-1x1-1024-28-28-16-0x0-1x1-1x1-0-NCHW-FP32-F=miopenConvolutionFwdAlgoImplicitGEMM:ConvHipImplicitGemmV4R1Fwd,1.18254,0,miopenConvolutionFwdAlgoImplicitGEMM,<unused>;miopenConvolutionFwdAlgoDirect:ConvAsm1x1U,1.74557,0,miopenConvolutionFwdAlgoDirect,<unused>;miopenConvolutionFwdAlgoGEMM:gemm,1.44398,0,rocBlas,<unused>;miopenConvolutionFwdAlgoWinograd:ConvBinWinogradRxSf3x2,3.02892,0,miopenConvolutionFwdAlgoWinograd,<unused>
1024-28-28-3x3-1024-14-14-16-1x1-2x2-1x1-0-NCHW-FP32-F_g64=miopenConvolutionFwdAlgoImplicitGEMM:ConvHipImplicitGemmV4R1Fwd,0.255676,0,miopenConvolutionFwdAlgoImplicitGEMM,<unused>;miopenConvolutionFwdAlgoDirect:ConvOclDirectFwd,1.61614,0,miopenConvolutionFwdAlgoDirect,<unused>;miopenConvolutionFwdAlgoGEMM:gemm,1.6819,7225344,rocBlas,<unused>;miopenConvolutionFwdAlgoWinograd:ConvBinWinogradRxSf2x3,0.545752,0,miopenConvolutionFwdAlgoWinograd,<unused>
1536-14-14-1x1-1024-14-14-16-0x0-1x1-1x1-0-NCHW-FP32-F=miopenConvolutionFwdAlgoImplicitGEMM:ConvHipImplicitGemmV4R1Fwd,1.04974,0,miopenConvolutionFwdAlgoImplicitGEMM,<unused>;miopenConvolutionFwdAlgoDirect:ConvAsm1x1U,1.58718,0,miopenConvolutionFwdAlgoDirect,<unused>;miopenConvolutionFwdAlgoGEMM:gemm,1.42526,0,rocBlas,<unused>;miopenConvolutionFwdAlgoWinograd:ConvBinWinogradRxSf3x2,2.29757,0,miopenConvolutionFwdAlgoWinograd,<unused>
1024-14-14-1x1-1024-14-14-16-0x0-1x1-1x1-0-NCHW-FP32-F=miopenConvolutionFwdAlgoImplicitGEMM:ConvHipImplicitGemmV4R1Fwd,0.873427,0,miopenConvolutionFwdAlgoImplicitGEMM,<unused>;miopenConvolutionFwdAlgoDirect:ConvAsm1x1U,1.24334,0,miopenConvolutionFwdAlgoDirect,<unused>;miopenConvolutionFwdAlgoGEMM:gemm,1.03982,0,rocBlas,<unused>;miopenConvolutionFwdAlgoWinograd:ConvBinWinogradRxSf3x2,1.54878,0,miopenConvolutionFwdAlgoWinograd,<unused>
1024-14-14-3x3-1024-14-14-16-1x1-1x1-1x1-0-NCHW-FP32-F_g64=miopenConvolutionFwdAlgoImplicitGEMM:ConvHipImplicitGemmV4R1Fwd,0.201757,0,miopenConvolutionFwdAlgoImplicitGEMM,<unused>;miopenConvolutionFwdAlgoDirect:ConvOclDirectFwd,0.331835,0,miopenConvolutionFwdAlgoDirect,<unused>;miopenConvolutionFwdAlgoGEMM:gemm,1.30302,7225344,rocBlas,<unused>;miopenConvolutionFwdAlgoWinograd:ConvBinWinogradRxSf2x3,0.222717,0,miopenConvolutionFwdAlgoWinograd,<unused>
1024-14-14-1x1-2048-14-14-16-0x0-1x1-1x1-0-NCHW-FP32-F=miopenConvolutionFwdAlgoImplicitGEMM:ConvHipImplicitGemmV4R1Fwd,1.5531,0,miopenConvolutionFwdAlgoImplicitGEMM,<unused>;miopenConvolutionFwdAlgoDirect:ConvAsm1x1U,2.28285,0,miopenConvolutionFwdAlgoDirect,<unused>;miopenConvolutionFwdAlgoGEMM:gemm,2.13277,0,rocBlas,<unused>;miopenConvolutionFwdAlgoWinograd:ConvBinWinogradRxSf3x2,3.07595,0,miopenConvolutionFwdAlgoWinograd,<unused>
2048-14-14-3x3-2048-7-7-16-1x1-2x2-1x1-0-NCHW-FP32-F_g64=miopenConvolutionFwdAlgoDirect:ConvOclDirectFwd,1.61694,0,miopenConvolutionFwdAlgoDirect,<unused>;miopenConvolutionFwdAlgoGEMM:gemm,1.63326,3612672,rocBlas,<unused>;miopenConvolutionFwdAlgoWinograd:ConvBinWinogradRxSf2x3,0.357754,0,miopenConvolutionFwdAlgoWinograd,<unused>
3072-7-7-1x1-2048-7-7-16-0x0-1x1-1x1-0-NCHW-FP32-F=miopenConvolutionFwdAlgoDirect:ConvAsm1x1U,2.18301,0,miopenConvolutionFwdAlgoDirect,<unused>;miopenConvolutionFwdAlgoGEMM:gemm,1.99341,0,rocBlas,<unused>;miopenConvolutionFwdAlgoWinograd:ConvBinWinogradRxSf3x2,3.85306,0,miopenConvolutionFwdAlgoWinograd,<unused>
2048-7-7-1x1-2048-7-7-16-0x0-1x1-1x1-0-NCHW-FP32-F=miopenConvolutionFwdAlgoDirect:ConvAsm1x1U,1.51502,0,miopenConvolutionFwdAlgoDirect,<unused>;miopenConvolutionFwdAlgoGEMM:gemm,1.16222,0,rocBlas,<unused>;miopenConvolutionFwdAlgoWinograd:ConvBinWinogradRxSf3x2,2.64588,0,miopenConvolutionFwdAlgoWinograd,<unused>
2048-7-7-3x3-2048-7-7-16-1x1-1x1-1x1-0-NCHW-FP32-F_g64=miopenConvolutionFwdAlgoDirect:ConvOclDirectFwd,0.791348,0,miopenConvolutionFwdAlgoDirect,<unused>;miopenConvolutionFwdAlgoGEMM:gemm,1.34142,3612672,rocBlas,<unused>;miopenConvolutionFwdAlgoWinograd:ConvBinWinogradRxSf2x3,0.140638,0,miopenConvolutionFwdAlgoWinograd,<unused>
3-225-225-3x3-32-112-112-64-0x0-2x2-1x1-0-NCHW-FP32-F=miopenConvolutionFwdAlgoDirect:ConvOclDirectFwd,1.0288,0,miopenConvolutionFwdAlgoDirect,<unused>;miopenConvolutionFwdAlgoGEMM:gemm,3.30752,1354752,rocBlas,<unused>;miopenConvolutionFwdAlgoWinograd:ConvBinWinogradRxSf2x3g1,0.612001,0,miopenConvolutionFwdAlgoWinograd,<unused>
32-112-112-3x3-32-112-112-64-1x1-1x1-1x1-0-NCHW-FP32-F_g32=miopenConvolutionFwdAlgoDirect:ConvOclDirectFwd,0.45312,0,miopenConvolutionFwdAlgoDirect,<unused>;miopenConvolutionFwdAlgoGEMM:gemm,13.2506,14450688,rocBlas,<unused>;miopenConvolutionFwdAlgoWinograd:ConvBinWinogradRxSf2x3,8.17473,0,miopenConvolutionFwdAlgoWinograd,<unused>
32-112-112-1x1-64-112-112-64-0x0-1x1-1x1-0-NCHW-FP32-F=miopenConvolutionFwdAlgoImplicitGEMM:ConvHipImplicitGemmV4R1Fwd,0.6456,0,miopenConvolutionFwdAlgoImplicitGEMM,<unused>;miopenConvolutionFwdAlgoDirect:ConvOclDirectFwd1x1,0.47456,0,miopenConvolutionFwdAlgoDirect,<unused>;miopenConvolutionFwdAlgoGEMM:gemm,0.49232,0,rocBlas,<unused>;miopenConvolutionFwdAlgoWinograd:ConvBinWinogradRxSf3x2,1.07232,0,miopenConvolutionFwdAlgoWinograd,<unused>
64-113-113-3x3-64-56-56-64-0x0-2x2-1x1-0-NCHW-FP32-F_g64=miopenConvolutionFwdAlgoDirect:ConvDirectNaiveConvFwd,0.86992,0,miopenConvolutionFwdAlgoDirect,<unused>;miopenConvolutionFwdAlgoGEMM:gemm,7.95648,7225344,rocBlas,<unused>;miopenConvolutionFwdAlgoWinograd:ConvBinWinogradRxSf2x3,6.61104,0,miopenConvolutionFwdAlgoWinograd,<unused>
64-56-56-1x1-128-56-56-64-0x0-1x1-1x1-0-NCHW-FP32-F=miopenConvolutionFwdAlgoImplicitGEMM:ConvHipImplicitGemmV4R1Fwd,0.42672,0,miopenConvolutionFwdAlgoImplicitGEMM,<unused>;miopenConvolutionFwdAlgoDirect:ConvOclDirectFwd1x1,0.36992,0,miopenConvolutionFwdAlgoDirect,<unused>;miopenConvolutionFwdAlgoGEMM:gemm,0.483841,0,rocBlas,<unused>;miopenConvolutionFwdAlgoWinograd:ConvBinWinogradRxSf3x2,0.882401,0,miopenConvolutionFwdAlgoWinograd,<unused>
128-56-56-3x3-128-56-56-64-1x1-1x1-1x1-0-NCHW-FP32-F_g128=miopenConvolutionFwdAlgoDirect:ConvOclDirectFwd,0.47984,0,miopenConvolutionFwdAlgoDirect,<unused>;miopenConvolutionFwdAlgoGEMM:gemm,13.4554,14450688,rocBlas,<unused>;miopenConvolutionFwdAlgoWinograd:ConvBinWinogradRxSf2x3,8.22705,0,miopenConvolutionFwdAlgoWinograd,<unused>
128-56-56-1x1-128-56-56-64-0x0-1x1-1x1-0-NCHW-FP32-F=miopenConvolutionFwdAlgoImplicitGEMM:ConvHipImplicitGemmV4R1Fwd,0.72112,0,miopenConvolutionFwdAlgoImplicitGEMM,<unused>;miopenConvolutionFwdAlgoDirect:ConvOclDirectFwd1x1,0.76016,0,miopenConvolutionFwdAlgoDirect,<unused>;miopenConvolutionFwdAlgoGEMM:gemm,0.85744,0,rocBlas,<unused>;miopenConvolutionFwdAlgoWinograd:ConvBinWinogradRxSf3x2,1.53136,0,miopenConvolutionFwdAlgoWinograd,<unused>
128-57-57-3x3-128-28-28-64-0x0-2x2-1x1-0-NCHW-FP32-F_g128=miopenConvolutionFwdAlgoDirect:ConvOclDirectFwd,0.4424,0,miopenConvolutionFwdAlgoDirect,<unused>;miopenConvolutionFwdAlgoGEMM:gemm,4.5568,3612672,rocBlas,<unused>;miopenConvolutionFwdAlgoWinograd:ConvBinWinogradRxSf2x3,3.37968,0,miopenConvolutionFwdAlgoWinograd,<unused>
128-28-28-1x1-256-28-28-64-0x0-1x1-1x1-0-NCHW-FP32-F=miopenConvolutionFwdAlgoImplicitGEMM:ConvHipImplicitGemmV4R1Fwd,0.37344,0,miopenConvolutionFwdAlgoImplicitGEMM,<unused>;miopenConvolutionFwdAlgoDirect:ConvOclDirectFwd1x1,0.4072,0,miopenConvolutionFwdAlgoDirect,<unused>;miopenConvolutionFwdAlgoGEMM:gemm,0.4664,0,rocBlas,<unused>;miopenConvolutionFwdAlgoWinograd:ConvBinWinogradRxSf3x2,0.866881,0,miopenConvolutionFwdAlgoWinograd,<unused>
256-28-28-3x3-256-28-28-64-1x1-1x1-1x1-0-NCHW-FP32-F_g256=miopenConvolutionFwdAlgoDirect:ConvOclDirectFwd,0.23392,0,miopenConvolutionFwdAlgoDirect,<unused>;miopenConvolutionFwdAlgoGEMM:gemm,6.4512,7225344,rocBlas,<unused>;miopenConvolutionFwdAlgoWinograd:ConvBinWinogradRxSf2x3,4.2608,0,miopenConvolutionFwdAlgoWinograd,<unused>
256-28-28-1x1-256-28-28-64-0x0-1x1-1x1-0-NCHW-FP32-F=miopenConvolutionFwdAlgoImplicitGEMM:ConvHipImplicitGemmV4R1Fwd,0.69552,0,miopenConvolutionFwdAlgoImplicitGEMM,<unused>;miopenConvolutionFwdAlgoDirect:ConvAsm1x1U,0.7504,0,miopenConvolutionFwdAlgoDirect,<unused>;miopenConvolutionFwdAlgoGEMM:gemm,0.74496,0,rocBlas,<unused>;miopenConvolutionFwdAlgoWinograd:ConvBinWinogradRxSf3x2,1.58144,0,miopenConvolutionFwdAlgoWinograd,<unused>
256-29-29-3x3-256-14-14-64-0x0-2x2-1x1-0-NCHW-FP32-F_g256=miopenConvolutionFwdAlgoDirect:ConvOclDirectFwd,0.22016,0,miopenConvolutionFwdAlgoDirect,<unused>;miopenConvolutionFwdAlgoGEMM:gemm,3.47136,1806336,rocBlas,<unused>;miopenConvolutionFwdAlgoWinograd:ConvBinWinogradRxSf2x3,1.78192,0,miopenConvolutionFwdAlgoWinograd,<unused>
256-14-14-1x1-512-14-14-64-0x0-1x1-1x1-0-NCHW-FP32-F=miopenConvolutionFwdAlgoImplicitGEMM:ConvHipImplicitGemmV4R1Fwd,0.35008,0,miopenConvolutionFwdAlgoImplicitGEMM,<unused>;miopenConvolutionFwdAlgoDirect:ConvOclDirectFwd1x1,0.51488,0,miopenConvolutionFwdAlgoDirect,<unused>;miopenConvolutionFwdAlgoGEMM:gemm,0.47536,0,rocBlas,<unused>;miopenConvolutionFwdAlgoWinograd:ConvBinWinogradRxSf3x2,0.843041,0,miopenConvolutionFwdAlgoWinograd,<unused>
512-14-14-3x3-512-14-14-64-1x1-1x1-1x1-0-NCHW-FP32-F_g512=miopenConvolutionFwdAlgoDirect:ConvOclDirectFwd,0.13136,0,miopenConvolutionFwdAlgoDirect,<unused>;miopenConvolutionFwdAlgoGEMM:gemm,4.39302,3612672,rocBlas,<unused>;miopenConvolutionFwdAlgoWinograd:ConvBinWinogradRxSf2x3,2.29504,0,miopenConvolutionFwdAlgoWinograd,<unused>
512-14-14-1x1-512-14-14-64-0x0-1x1-1x1-0-NCHW-FP32-F=miopenConvolutionFwdAlgoImplicitGEMM:ConvHipImplicitGemmV4R1Fwd,0.72048,0,miopenConvolutionFwdAlgoImplicitGEMM,<unused>;miopenConvolutionFwdAlgoDirect:ConvAsm1x1U,0.999521,0,miopenConvolutionFwdAlgoDirect,<unused>;miopenConvolutionFwdAlgoGEMM:gemm,1.10144,0,rocBlas,<unused>;miopenConvolutionFwdAlgoWinograd:ConvBinWinogradRxSf3x2,1.57872,0,miopenConvolutionFwdAlgoWinograd,<unused>
512-15-15-3x3-512-7-7-64-0x0-2x2-1x1-0-NCHW-FP32-F_g512=miopenConvolutionFwdAlgoDirect:ConvOclDirectFwd,0.18672,0,miopenConvolutionFwdAlgoDirect,<unused>;miopenConvolutionFwdAlgoGEMM:gemm,2.48832,903168,rocBlas,<unused>;miopenConvolutionFwdAlgoWinograd:ConvBinWinogradRxSf2x3,1.3256,0,miopenConvolutionFwdAlgoWinograd,<unused>
512-7-7-1x1-1024-7-7-64-0x0-1x1-1x1-0-NCHW-FP32-F=miopenConvolutionFwdAlgoImplicitGEMM:ConvHipImplicitGemmV4R1Fwd,0.46416,0,miopenConvolutionFwdAlgoImplicitGEMM,<unused>;miopenConvolutionFwdAlgoDirect:ConvAsm1x1U,0.55424,0,miopenConvolutionFwdAlgoDirect,<unused>;miopenConvolutionFwdAlgoGEMM:gemm,0.778401,0,rocBlas,<unused>;miopenConvolutionFwdAlgoWinograd:ConvBinWinogradRxSf3x2,1.13504,0,miopenConvolutionFwdAlgoWinograd,<unused>
1024-7-7-3x3-1024-7-7-64-1x1-1x1-1x1-0-NCHW-FP32-F_g1024=miopenConvolutionFwdAlgoDirect:ConvOclDirectFwd,0.17584,0,miopenConvolutionFwdAlgoDirect,<unused>;miopenConvolutionFwdAlgoGEMM:gemm,2.39616,1806336,rocBlas,<unused>;miopenConvolutionFwdAlgoWinograd:ConvBinWinogradRxSf2x3,1.64688,0,miopenConvolutionFwdAlgoWinograd,<unused>
1024-7-7-1x1-1024-7-7-64-0x0-1x1-1x1-0-NCHW-FP32-F=miopenConvolutionFwdAlgoImplicitGEMM:ConvHipImplicitGemmV4R1Fwd,0.8784,0,miopenConvolutionFwdAlgoImplicitGEMM,<unused>;miopenConvolutionFwdAlgoDirect:ConvAsm1x1U,1.19648,0,miopenConvolutionFwdAlgoDirect,<unused>;miopenConvolutionFwdAlgoGEMM:gemm,1.48816,0,rocBlas,<unused>;miopenConvolutionFwdAlgoWinograd:ConvBinWinogradRxSf3x2,2.19392,0,miopenConvolutionFwdAlgoWinograd,<unused>
1024-1-1-1x1-1001-1-1-64-0x0-1x1-1x1-0-NCHW-FP32-F=miopenConvolutionFwdAlgoDirect:ConvAsm1x1U,0.26192,0,miopenConvolutionFwdAlgoDirect,<unused>;miopenConvolutionFwdAlgoGEMM:gemm,0.731041,0,rocBlas,<unused>;miopenConvolutionFwdAlgoWinograd:ConvBinWinogradRxSf2x3g1,0.432001,0,miopenConvolutionFwdAlgoWinograd,<unused>
3-331-331-3x3-96-165-165-64-0x0-2x2-1x1-0-NCHW-FP32-F=miopenConvolutionFwdAlgoDirect:ConvOclDirectFwd,6.51011,0,miopenConvolutionFwdAlgoDirect,<unused>;miopenConvolutionFwdAlgoGEMM:gemm,5.31424,2940300,rocBlas,<unused>;miopenConvolutionFwdAlgoWinograd:ConvBinWinogradRxSf2x3g1,3.71895,0,miopenConvolutionFwdAlgoWinograd,<unused>
96-165-165-1x1-42-165-165-64-0x0-1x1-1x1-0-NCHW-FP32-F=miopenConvolutionFwdAlgoDirect:ConvAsm1x1U,2.39856,0,miopenConvolutionFwdAlgoDirect,<unused>;miopenConvolutionFwdAlgoGEMM:gemm,2.58878,0,rocBlas,<unused>;miopenConvolutionFwdAlgoWinograd:ConvBinWinogradRxSf3x2,4.87615,0,miopenConvolutionFwdAlgoWinograd,<unused>
96-165-165-7x7-96-83-83-64-3x3-2x2-1x1-0-NCHW-FP32-F_g96=miopenConvolutionFwdAlgoDirect:ConvOclDirectFwd,5.5329,0,miopenConvolutionFwdAlgoDirect,<unused>;miopenConvolutionFwdAlgoGEMM:gemm,43.9778,129623424,rocBlas,<unused>;miopenConvolutionFwdAlgoWinograd:ConvBinWinogradRxSf2x3,39.5957,0,miopenConvolutionFwdAlgoWinograd,<unused>
96-83-83-1x1-42-83-83-64-0x0-1x1-1x1-0-NCHW-FP32-F=miopenConvolutionFwdAlgoDirect:ConvAsm1x1U,0.558682,0,miopenConvolutionFwdAlgoDirect,<unused>;miopenConvolutionFwdAlgoGEMM:gemm,1.37542,0,rocBlas,<unused>;miopenConvolutionFwdAlgoWinograd:ConvBinWinogradRxSf3x2,1.29239,0,miopenConvolutionFwdAlgoWinograd,<unused>
42-83-83-7x7-42-83-83-64-3x3-1x1-1x1-0-NCHW-FP32-F_g42=miopenConvolutionFwdAlgoDirect:ConvOclDirectFwd,0.670034,0,miopenConvolutionFwdAlgoDirect,<unused>;miopenConvolutionFwdAlgoGEMM:gemm,19.7107,56710248,rocBlas,<unused>;miopenConvolutionFwdAlgoWinograd:ConvBinWinogradRxSf2x3,17.21,0,miopenConvolutionFwdAlgoWinograd,<unused>
42-83-83-1x1-42-83-83-64-0x0-1x1-1x1-0-NCHW-FP32-F=miopenConvolutionFwdAlgoDirect:ConvAsm1x1U,0.302539,0,miopenConvolutionFwdAlgoDirect,<unused>;miopenConvolutionFwdAlgoGEMM:gemm,0.746349,0,rocBlas,<unused>;miopenConvolutionFwdAlgoWinograd:ConvBinWinogradRxSf3x2,0.704592,0,miopenConvolutionFwdAlgoWinograd,<unused>
96-165-165-5x5-96-83-83-64-2x2-2x2-1x1-0-NCHW-FP32-F_g96=miopenConvolutionFwdAlgoDirect:ConvOclDirectFwd,4.47089,0,miopenConvolutionFwdAlgoDirect,<unused>;miopenConvolutionFwdAlgoGEMM:gemm,24.5334,66134400,rocBlas,<unused>;miopenConvolutionFwdAlgoWinograd:ConvBinWinogradRxSf2x3,19.8332,0,miopenConvolutionFwdAlgoWinograd,<unused>
42-83-83-5x5-42-83-83-64-2x2-1x1-1x1-0-NCHW-FP32-F_g42=miopenConvolutionFwdAlgoDirect:ConvOclDirectFwd,0.479647,0,miopenConvolutionFwdAlgoDirect,<unused>;miopenConvolutionFwdAlgoGEMM:gemm,11.2018,28933800,rocBlas,<unused>;miopenConvolutionFwdAlgoWinograd:ConvBinWinogradRxSf2x3,9.1157,0,miopenConvolutionFwdAlgoWinograd,<unused>
42-165-165-5x5-42-83-83-64-2x2-2x2-1x1-0-NCHW-FP32-F_g42=miopenConvolutionFwdAlgoDirect:ConvOclDirectFwd,2.23409,0,miopenConvolutionFwdAlgoDirect,<unused>;miopenConvolutionFwdAlgoGEMM:gemm,12.1028,28933800,rocBlas,<unused>;miopenConvolutionFwdAlgoWinograd:ConvBinWinogradRxSf2x3,9.37872,0,miopenConvolutionFwdAlgoWinograd,<unused>
84-83-83-1x1-42-83-83-64-0x0-1x1-1x1-0-NCHW-FP32-F=miopenConvolutionFwdAlgoDirect:ConvAsm1x1U,0.502366,0,miopenConvolutionFwdAlgoDirect,<unused>;miopenConvolutionFwdAlgoGEMM:gemm,1.22632,0,rocBlas,<unused>;miopenConvolutionFwdAlgoWinograd:ConvBinWinogradRxSf3x2,1.15768,0,miopenConvolutionFwdAlgoWinograd,<unused>
42-83-83-3x3-42-83-83-64-1x1-1x1-1x1-0-NCHW-FP32-F_g42=miopenConvolutionFwdAlgoDirect:ConvOclDirectFwd,0.351016,0,miopenConvolutionFwdAlgoDirect,<unused>;miopenConvolutionFwdAlgoGEMM:gemm,6.40979,10416168,rocBlas,<unused>;miopenConvolutionFwdAlgoWinograd:ConvBinWinogradRxSf2x3,6.05463,0,miopenConvolutionFwdAlgoWinograd,<unused>
64-56-56-3x3-64-28-28-64-1x1-2x2-1x1-0-NCHW-FP32-F=miopenConvolutionFwdAlgoImplicitGEMM:ConvHipImplicitGemmV4R1Fwd,0.503188,0,miopenConvolutionFwdAlgoImplicitGEMM,<unused>;miopenConvolutionFwdAlgoDirect:ConvOclDirectFwd,6.46112,0,miopenConvolutionFwdAlgoDirect,<unused>;miopenConvolutionFwdAlgoGEMM:gemm,8.52973,1806336,rocBlas,<unused>;miopenConvolutionFwdAlgoWinograd:ConvBinWinogradRxSf2x3g1,0.80222,0,miopenConvolutionFwdAlgoWinograd,<unused>
64-28-28-1x1-256-28-28-64-0x0-1x1-1x1-0-NCHW-FP32-F=miopenConvolutionFwdAlgoImplicitGEMM:ConvHipImplicitGemmV4R1Fwd,0.233594,0,miopenConvolutionFwdAlgoImplicitGEMM,<unused>;miopenConvolutionFwdAlgoDirect:ConvOclDirectFwd1x1,0.204475,0,miopenConvolutionFwdAlgoDirect,<unused>;miopenConvolutionFwdAlgoGEMM:gemm,0.264473,0,rocBlas,<unused>;miopenConvolutionFwdAlgoWinograd:ConvBinWinogradRxSf3x2,0.513907,0,miopenConvolutionFwdAlgoWinograd,<unused>
256-28-28-1x1-128-28-28-64-0x0-1x1-1x1-0-NCHW-FP32-F=miopenConvolutionFwdAlgoImplicitGEMM:ConvHipImplicitGemmV4R1Fwd,0.371831,0,miopenConvolutionFwdAlgoImplicitGEMM,<unused>;miopenConvolutionFwdAlgoDirect:ConvOclDirectFwd1x1,0.373431,0,miopenConvolutionFwdAlgoDirect,<unused>;miopenConvolutionFwdAlgoGEMM:gemm,0.366711,0,rocBlas,<unused>;miopenConvolutionFwdAlgoWinograd:ConvBinWinogradRxSf3x2,0.836619,0,miopenConvolutionFwdAlgoWinograd,<unused>
128-28-28-3x3-128-14-14-64-1x1-2x2-1x1-0-NCHW-FP32-F=miopenConvolutionFwdAlgoImplicitGEMM:ConvHipImplicitGemmV4R1Fwd,0.483509,0,miopenConvolutionFwdAlgoImplicitGEMM,<unused>;miopenConvolutionFwdAlgoDirect:ConvDirectNaiveConvFwd,11.1506,0,miopenConvolutionFwdAlgoDirect,<unused>;miopenConvolutionFwdAlgoGEMM:gemm,3.64538,903168,rocBlas,<unused>;miopenConvolutionFwdAlgoWinograd:ConvBinWinogradRxSf2x3g1,0.780142,0,miopenConvolutionFwdAlgoWinograd,<unused>
128-14-14-1x1-512-14-14-64-0x0-1x1-1x1-0-NCHW-FP32-F=miopenConvolutionFwdAlgoImplicitGEMM:ConvHipImplicitGemmV4R1Fwd,0.202876,0,miopenConvolutionFwdAlgoImplicitGEMM,<unused>;miopenConvolutionFwdAlgoDirect:ConvOclDirectFwd1x1,0.283674,0,miopenConvolutionFwdAlgoDirect,<unused>;miopenConvolutionFwdAlgoGEMM:gemm,0.329432,0,rocBlas,<unused>;miopenConvolutionFwdAlgoWinograd:ConvBinWinogradRxSf3x2,0.471029,0,miopenConvolutionFwdAlgoWinograd,<unused>
512-14-14-1x1-256-14-14-64-0x0-1x1-1x1-0-NCHW-FP32-F=miopenConvolutionFwdAlgoImplicitGEMM:ConvHipImplicitGemmV4R1Fwd,0.407671,0,miopenConvolutionFwdAlgoImplicitGEMM,<unused>;miopenConvolutionFwdAlgoDirect:ConvAsm1x1U,0.522708,0,miopenConvolutionFwdAlgoDirect,<unused>;miopenConvolutionFwdAlgoGEMM:gemm,0.695185,0,rocBlas,<unused>;miopenConvolutionFwdAlgoWinograd:ConvBinWinogradRxSf3x2,0.809581,0,miopenConvolutionFwdAlgoWinograd,<unused>
256-14-14-3x3-256-7-7-64-1x1-2x2-1x1-0-NCHW-FP32-F=miopenConvolutionFwdAlgoImplicitGEMM:ConvHipImplicitGemmV4R1Fwd,0.596467,0,miopenConvolutionFwdAlgoImplicitGEMM,<unused>;miopenConvolutionFwdAlgoDirect:ConvOclDirectFwd,6.68977,0,miopenConvolutionFwdAlgoDirect,<unused>;miopenConvolutionFwdAlgoGEMM:gemm,5.2121,451584,rocBlas,<unused>;miopenConvolutionFwdAlgoWinograd:ConvBinWinogradRxSf2x3g1,1.09438,0,miopenConvolutionFwdAlgoWinograd,<unused>
256-7-7-1x1-1024-7-7-64-0x0-1x1-1x1-0-NCHW-FP32-F=miopenConvolutionFwdAlgoImplicitGEMM:ConvHipImplicitGemmV4R1Fwd,0.204956,0,miopenConvolutionFwdAlgoImplicitGEMM,<unused>;miopenConvolutionFwdAlgoDirect:ConvAsm1x1U,0.272954,0,miopenConvolutionFwdAlgoDirect,<unused>;miopenConvolutionFwdAlgoGEMM:gemm,0.651506,0,rocBlas,<unused>;miopenConvolutionFwdAlgoWinograd:ConvBinWinogradRxSf3x2,0.606547,0,miopenConvolutionFwdAlgoWinograd,<unused>
1024-7-7-1x1-512-7-7-64-0x0-1x1-1x1-0-NCHW-FP32-F=miopenConvolutionFwdAlgoImplicitGEMM:ConvHipImplicitGemmV4R1Fwd,0.532629,0,miopenConvolutionFwdAlgoImplicitGEMM,<unused>;miopenConvolutionFwdAlgoDirect:ConvOclDirectFwd1x1,0.582228,0,miopenConvolutionFwdAlgoDirect,<unused>;miopenConvolutionFwdAlgoGEMM:gemm,1.17773,0,rocBlas,<unused>;miopenConvolutionFwdAlgoWinograd:ConvBinWinogradRxSf3x2,1.10926,0,miopenConvolutionFwdAlgoWinograd,<unused>
2048-1-1-1x1-1001-1-1-64-0x0-1x1-1x1-0-NCHW-FP32-F=miopenConvolutionFwdAlgoDirect:ConvAsm1x1U,0.53775,0,miopenConvolutionFwdAlgoDirect,<unused>;miopenConvolutionFwdAlgoGEMM:gemm,2.04508,0,rocBlas,<unused>;miopenConvolutionFwdAlgoWinograd:ConvBinWinogradRxSf2x3g1,0.841263,0,miopenConvolutionFwdAlgoWinograd,<unused>
3-224-224-7x7-64-112-112-1-3x3-2x2-1x1-0-NCHW-FP32-F=miopenConvolutionFwdAlgoDirect:ConvAsm7x7c3h224w224k64u2v2p3q3f1,0.037759,0,miopenConvolutionFwdAlgoDirect,<unused>;miopenConvolutionFwdAlgoGEMM:gemm,0.069438,7375872,rocBlas,<unused>;miopenConvolutionFwdAlgoWinograd:ConvBinWinogradRxS,0.067838,0,miopenConvolutionFwdAlgoWinograd,<unused>
64-56-56-1x1-64-56-56-1-0x0-1x1-1x1-0-NCHW-FP32-F=miopenConvolutionFwdAlgoImplicitGEMM:ConvHipImplicitGemmV4R4Fwd,0.017119,0,miopenConvolutionFwdAlgoImplicitGEMM,<unused>;miopenConvolutionFwdAlgoDirect:ConvAsm1x1U,0.01424,0,miopenConvolutionFwdAlgoDirect,<unused>;miopenConvolutionFwdAlgoGEMM:gemm,0.034399,0,rocBlas,<unused>;miopenConvolutionFwdAlgoWinograd:ConvBinWinogradRxS,0.034719,0,miopenConvolutionFwdAlgoWinograd,<unused>
64-56-56-3x3-64-56-56-1-1x1-1x1-1x1-0-NCHW-FP32-F=miopenConvolutionFwdAlgoWinograd:ConvBinWinogradRxS,0.035519,0,miopenConvolutionFwdAlgoWinograd,<unused>
128-56-56-1x1-256-56-56-1-0x0-1x1-1x1-0-NCHW-FP32-F=miopenConvolutionFwdAlgoImplicitGEMM:ConvHipImplicitGemmV4R4Fwd,0.036479,0,miopenConvolutionFwdAlgoImplicitGEMM,<unused>;miopenConvolutionFwdAlgoDirect:ConvOclDirectFwd1x1,0.036799,0,miopenConvolutionFwdAlgoDirect,<unused>;miopenConvolutionFwdAlgoGEMM:gemm,0.051199,0,rocBlas,<unused>;miopenConvolutionFwdAlgoWinograd:ConvBinWinogradRxSf3x2,0.085598,0,miopenConvolutionFwdAlgoWinograd,<unused>
256-56-56-1x1-64-56-56-1-0x0-1x1-1x1-0-NCHW-FP32-F=miopenConvolutionFwdAlgoImplicitGEMM:ConvHipImplicitGemmV4R4Fwd,0.036159,0,miopenConvolutionFwdAlgoImplicitGEMM,<unused>;miopenConvolutionFwdAlgoDirect:ConvAsm1x1U,0.023359,0,miopenConvolutionFwdAlgoDirect,<unused>;miopenConvolutionFwdAlgoGEMM:gemm,0.076798,0,rocBlas,<unused>;miopenConvolutionFwdAlgoWinograd:ConvBinWinogradRxS,0.074719,0,miopenConvolutionFwdAlgoWinograd,<unused>
64-56-56-1x1-256-56-56-1-0x0-1x1-1x1-0-NCHW-FP32-F=miopenConvolutionFwdAlgoImplicitGEMM:ConvHipImplicitGemmV4R4Fwd,0.022399,0,miopenConvolutionFwdAlgoImplicitGEMM,<unused>;miopenConvolutionFwdAlgoDirect:ConvOclDirectFwd1x1,0.0216,0,miopenConvolutionFwdAlgoDirect,<unused>;miopenConvolutionFwdAlgoGEMM:gemm,0.043679,0,rocBlas,<unused>;miopenConvolutionFwdAlgoWinograd:ConvBinWinogradRxSf3x2,0.061118,0,miopenConvolutionFwdAlgoWinograd,<unused>
256-56-56-1x1-128-56-56-1-0x0-1x1-1x1-0-NCHW-FP32-F=miopenConvolutionFwdAlgoImplicitGEMM:ConvHipImplicitGemmV4R4Fwd,0.04368,0,miopenConvolutionFwdAlgoImplicitGEMM,<unused>;miopenConvolutionFwdAlgoDirect:ConvAsm1x1U,0.0424,0,miopenConvolutionFwdAlgoDirect,<unused>;miopenConvolutionFwdAlgoGEMM:gemm,0.0664,0,rocBlas,<unused>;miopenConvolutionFwdAlgoWinograd:ConvBinWinogradRxSf3x2,0.08272,0,miopenConvolutionFwdAlgoWinograd,<unused>
128-56-56-3x3-128-28-28-1-1x1-2x2-1x1-0-NCHW-FP32-F=miopenConvolutionFwdAlgoDirect:ConvOclDirectFwd,0.584306,0,miopenConvolutionFwdAlgoDirect,<unused>;miopenConvolutionFwdAlgoGEMM:gemm,0.102878,3612672,rocBlas,<unused>;miopenConvolutionFwdAlgoWinograd:ConvBinWinogradRxSf2x3g1,0.132797,0,miopenConvolutionFwdAlgoWinograd,<unused>
384-28-28-1x1-512-28-28-1-0x0-1x1-1x1-0-NCHW-FP32-F=miopenConvolutionFwdAlgoDirect:ConvAsm1x1U,0.05712,0,miopenConvolutionFwdAlgoDirect,<unused>;miopenConvolutionFwdAlgoGEMM:gemm,0.074399,0,rocBlas,<unused>;miopenConvolutionFwdAlgoWinograd:ConvBinWinogradRxSf2x3g1,0.176635,0,miopenConvolutionFwdAlgoWinograd,<unused>
512-28-28-1x1-128-28-28-1-0x0-1x1-1x1-0-NCHW-FP32-F=miopenConvolutionFwdAlgoDirect:ConvAsm1x1U,0.0312,0,miopenConvolutionFwdAlgoDirect,<unused>;miopenConvolutionFwdAlgoGEMM:gemm,0.1248,0,rocBlas,<unused>;miopenConvolutionFwdAlgoWinograd:ConvBinWinogradRxS,0.125919,0,miopenConvolutionFwdAlgoWinograd,<unused>
128-28-28-3x3-128-28-28-1-1x1-1x1-1x1-0-NCHW-FP32-F=miopenConvolutionFwdAlgoWinograd:ConvBinWinogradRxS,0.04768,0,miopenConvolutionFwdAlgoWinograd,<unused>
128-28-28-1x1-512-28-28-1-0x0-1x1-1x1-0-NCHW-FP32-F=miopenConvolutionFwdAlgoDirect:ConvAsm1x1U,0.02496,0,miopenConvolutionFwdAlgoDirect,<unused>;miopenConvolutionFwdAlgoGEMM:gemm,0.05024,0,rocBlas,<unused>;miopenConvolutionFwdAlgoWinograd:ConvBinWinogradRxS,0.07472,0,miopenConvolutionFwdAlgoWinograd,<unused>
512-28-28-1x1-256-28-28-1-0x0-1x1-1x1-0-NCHW-FP32-F=miopenConvolutionFwdAlgoDirect:ConvAsm1x1U,0.04416,0,miopenConvolutionFwdAlgoDirect,<unused>;miopenConvolutionFwdAlgoGEMM:gemm,0.11584,0,rocBlas,<unused>;miopenConvolutionFwdAlgoWinograd:ConvBinWinogradRxS,0.12608,0,miopenConvolutionFwdAlgoWinograd,<unused>
256-28-28-3x3-256-14-14-1-1x1-2x2-1x1-0-NCHW-FP32-F=miopenConvolutionFwdAlgoDirect:ConvOclDirectFwd,0.74528,0,miopenConvolutionFwdAlgoDirect,<unused>;miopenConvolutionFwdAlgoGEMM:gemm,0.10544,1806336,rocBlas,<unused>;miopenConvolutionFwdAlgoWinograd:ConvBinWinogradRxSf2x3g1,0.23984,0,miopenConvolutionFwdAlgoWinograd,<unused>
768-14-14-1x1-1024-14-14-1-0x0-1x1-1x1-0-NCHW-FP32-F=miopenConvolutionFwdAlgoDirect:ConvAsm1x1U,0.09312,0,miopenConvolutionFwdAlgoDirect,<unused>;miopenConvolutionFwdAlgoGEMM:gemm,0.090719,0,rocBlas,<unused>;miopenConvolutionFwdAlgoWinograd:ConvBinWinogradRxSf3x2,0.18992,0,miopenConvolutionFwdAlgoWinograd,<unused>
1024-14-14-1x1-256-14-14-1-0x0-1x1-1x1-0-NCHW-FP32-F=miopenConvolutionFwdAlgoDirect:ConvAsm1x1U,0.04288,0,miopenConvolutionFwdAlgoDirect,<unused>;miopenConvolutionFwdAlgoGEMM:gemm,0.34256,0,rocBlas,<unused>;miopenConvolutionFwdAlgoWinograd:ConvBinWinogradRxSf2x3g1,0.228799,0,miopenConvolutionFwdAlgoWinograd,<unused>
256-14-14-3x3-256-14-14-1-1x1-1x1-1x1-0-NCHW-FP32-F=miopenConvolutionFwdAlgoWinograd:ConvBinWinogradRxS,0.07376,0,miopenConvolutionFwdAlgoWinograd,<unused>
256-14-14-1x1-1024-14-14-1-0x0-1x1-1x1-0-NCHW-FP32-F=miopenConvolutionFwdAlgoDirect:ConvAsm1x1U,0.03664,0,miopenConvolutionFwdAlgoDirect,<unused>;miopenConvolutionFwdAlgoGEMM:gemm,0.048,0,rocBlas,<unused>;miopenConvolutionFwdAlgoWinograd:ConvBinWinogradRxSf3x2,0.08272,0,miopenConvolutionFwdAlgoWinograd,<unused>
1024-14-14-1x1-512-14-14-1-0x0-1x1-1x1-0-NCHW-FP32-F=miopenConvolutionFwdAlgoDirect:ConvOclDirectFwd1x1,0.07472,0,miopenConvolutionFwdAlgoDirect,<unused>;miopenConvolutionFwdAlgoGEMM:gemm,0.08752,0,rocBlas,<unused>;miopenConvolutionFwdAlgoWinograd:ConvBinWinogradRxSf2x3g1,0.23168,0,miopenConvolutionFwdAlgoWinograd,<unused>
512-14-14-3x3-512-7-7-1-1x1-2x2-1x1-0-NCHW-FP32-F=miopenConvolutionFwdAlgoDirect:ConvOclDirectFwd,1.13632,0,miopenConvolutionFwdAlgoDirect,<unused>;miopenConvolutionFwdAlgoGEMM:gemm,0.365761,903168,rocBlas,<unused>;miopenConvolutionFwdAlgoWinograd:ConvBinWinogradRxSf2x3g1,0.45584,0,miopenConvolutionFwdAlgoWinograd,<unused>
1536-7-7-1x1-2048-7-7-1-0x0-1x1-1x1-0-NCHW-FP32-F=miopenConvolutionFwdAlgoDirect:ConvOclDirectFwd1x1,0.11936,0,miopenConvolutionFwdAlgoDirect,<unused>;miopenConvolutionFwdAlgoGEMM:gemm,0.11312,0,rocBlas,<unused>;miopenConvolutionFwdAlgoWinograd:ConvBinWinogradRxSf2x3g1,0.62576,0,miopenConvolutionFwdAlgoWinograd,<unused>
2048-7-7-1x1-512-7-7-1-0x0-1x1-1x1-0-NCHW-FP32-F=miopenConvolutionFwdAlgoDirect:ConvOclDirectFwd1x1,0.05792,0,miopenConvolutionFwdAlgoDirect,<unused>;miopenConvolutionFwdAlgoGEMM:gemm,0.076321,0,rocBlas,<unused>;miopenConvolutionFwdAlgoWinograd:ConvBinWinogradRxSf2x3g1,0.43264,0,miopenConvolutionFwdAlgoWinograd,<unused>
512-7-7-3x3-512-7-7-1-1x1-1x1-1x1-0-NCHW-FP32-F=miopenConvolutionFwdAlgoWinograd:ConvBinWinogradRxSf2x3g1,0.13216,0,miopenConvolutionFwdAlgoWinograd,<unused>
512-7-7-1x1-2048-7-7-1-0x0-1x1-1x1-0-NCHW-FP32-F=miopenConvolutionFwdAlgoDirect:ConvOclDirectFwd1x1,0.04672,0,miopenConvolutionFwdAlgoDirect,<unused>;miopenConvolutionFwdAlgoGEMM:gemm,0.07264,0,rocBlas,<unused>;miopenConvolutionFwdAlgoWinograd:ConvBinWinogradRxSf2x3g1,0.226721,0,miopenConvolutionFwdAlgoWinograd,<unused>
3-299-299-3x3-32-149-149-1-0x0-2x2-1x1-0-NCHW-FP32-F=miopenConvolutionFwdAlgoDirect:ConvOclDirectFwdGen,0.0936,0,miopenConvolutionFwdAlgoDirect,<unused>;miopenConvolutionFwdAlgoGEMM:gemm,0.03712,2397708,rocBlas,<unused>;miopenConvolutionFwdAlgoWinograd:ConvBinWinogradRxSf2x3g1,0.04144,0,miopenConvolutionFwdAlgoWinograd,<unused>
32-149-149-3x3-32-147-147-1-0x0-1x1-1x1-0-NCHW-FP32-F=miopenConvolutionFwdAlgoDirect:ConvOclDirectFwd,0.387677,0,miopenConvolutionFwdAlgoDirect,<unused>;miopenConvolutionFwdAlgoGEMM:gemm,0.159519,24893568,rocBlas,<unused>;miopenConvolutionFwdAlgoWinograd:ConvBinWinogradRxS,0.04704,0,miopenConvolutionFwdAlgoWinograd,<unused>
32-147-147-3x3-64-147-147-1-1x1-1x1-1x1-0-NCHW-FP32-F=miopenConvolutionFwdAlgoWinograd:ConvBinWinograd3x3U,0.07152,0,miopenConvolutionFwdAlgoWinograd,<unused>
64-73-73-1x1-80-73-73-1-0x0-1x1-1x1-0-NCHW-FP32-F=miopenConvolutionFwdAlgoDirect:ConvAsm1x1U,0.0176,0,miopenConvolutionFwdAlgoDirect,<unused>;miopenConvolutionFwdAlgoGEMM:gemm,0.03392,0,rocBlas,<unused>;miopenConvolutionFwdAlgoWinograd:ConvBinWinogradRxSf3x2,0.0432,0,miopenConvolutionFwdAlgoWinograd,<unused>
80-73-73-3x3-192-71-71-1-0x0-1x1-1x1-0-NCHW-FP32-F=miopenConvolutionFwdAlgoDirect:ConvOclDirectFwd,0.817914,0,miopenConvolutionFwdAlgoDirect,<unused>;miopenConvolutionFwdAlgoGEMM:gemm,0.186399,14518080,rocBlas,<unused>;miopenConvolutionFwdAlgoWinograd:ConvBinWinogradRxS,0.112159,0,miopenConvolutionFwdAlgoWinograd,<unused>
192-35-35-1x1-128-35-35-1-0x0-1x1-1x1-0-NCHW-FP32-F=miopenConvolutionFwdAlgoDirect:ConvAsm1x1U,0.0192,0,miopenConvolutionFwdAlgoDirect,<unused>;miopenConvolutionFwdAlgoGEMM:gemm,0.03584,0,rocBlas,<unused>;miopenConvolutionFwdAlgoWinograd:ConvBinWinogradRxS,0.06128,0,miopenConvolutionFwdAlgoWinograd,<unused>
192-35-35-1x1-48-35-35-1-0x0-1x1-1x1-0-NCHW-FP32-F=miopenConvolutionFwdAlgoDirect:ConvAsm1x1U,0.0128,0,miopenConvolutionFwdAlgoDirect,<unused>;miopenConvolutionFwdAlgoGEMM:gemm,0.0488,0,rocBlas,<unused>;miopenConvolutionFwdAlgoWinograd:ConvBinWinogradRxS,0.061279,0,miopenConvolutionFwdAlgoWinograd,<unused>
48-35-35-5x5-64-35-35-1-2x2-1x1-1x1-0-NCHW-FP32-F=miopenConvolutionFwdAlgoDirect:ConvOclDirectFwd,0.851514,0,miopenConvolutionFwdAlgoDirect,<unused>;miopenConvolutionFwdAlgoGEMM:gemm,0.07648,5880000,rocBlas,<unused>;miopenConvolutionFwdAlgoWinograd:ConvBinWinogradRxSf2x3g1,0.064159,0,miopenConvolutionFwdAlgoWinograd,<unused>
64-35-35-3x3-96-35-35-1-1x1-1x1-1x1-0-NCHW-FP32-F=miopenConvolutionFwdAlgoWinograd:ConvBinWinograd3x3U,0.03456,0,miopenConvolutionFwdAlgoWinograd,<unused>
96-35-35-3x3-96-35-35-1-1x1-1x1-1x1-0-NCHW-FP32-F=miopenConvolutionFwdAlgoWinograd:ConvBinWinograd3x3U,0.04112,0,miopenConvolutionFwdAlgoWinograd,<unused>
192-35-35-1x1-32-35-35-1-0x0-1x1-1x1-0-NCHW-FP32-F=miopenConvolutionFwdAlgoDirect:ConvAsm1x1U,0.01248,0,miopenConvolutionFwdAlgoDirect,<unused>;miopenConvolutionFwdAlgoGEMM:gemm,0.06224,0,rocBlas,<unused>;miopenConvolutionFwdAlgoWinograd:ConvBinWinogradRxS,0.059359,0,miopenConvolutionFwdAlgoWinograd,<unused>
256-35-35-1x1-128-35-35-1-0x0-1x1-1x1-0-NCHW-FP32-F=miopenConvolutionFwdAlgoDirect:ConvAsm1x1U,0.02288,0,miopenConvolutionFwdAlgoDirect,<unused>;miopenConvolutionFwdAlgoGEMM:gemm,0.06448,0,rocBlas,<unused>;miopenConvolutionFwdAlgoWinograd:ConvBinWinogradRxS,0.07392,0,miopenConvolutionFwdAlgoWinograd,<unused>
256-35-35-1x1-48-35-35-1-0x0-1x1-1x1-0-NCHW-FP32-F=miopenConvolutionFwdAlgoDirect:ConvAsm1x1U,0.01264,0,miopenConvolutionFwdAlgoDirect,<unused>;miopenConvolutionFwdAlgoGEMM:gemm,0.077759,0,rocBlas,<unused>;miopenConvolutionFwdAlgoWinograd:ConvBinWinogradRxS,0.074239,0,miopenConvolutionFwdAlgoWinograd,<unused>
256-35-35-1x1-64-35-35-1-0x0-1x1-1x1-0-NCHW-FP32-F=miopenConvolutionFwdAlgoDirect:ConvAsm1x1U,0.01728,0,miopenConvolutionFwdAlgoDirect,<unused>;miopenConvolutionFwdAlgoGEMM:gemm,0.069119,0,rocBlas,<unused>;miopenConvolutionFwdAlgoWinograd:ConvBinWinogradRxSf2x3g1,0.074719,0,miopenConvolutionFwdAlgoWinograd,<unused>
288-35-35-1x1-128-35-35-1-0x0-1x1-1x1-0-NCHW-FP32-F=miopenConvolutionFwdAlgoDirect:ConvAsm1x1U,0.02448,0,miopenConvolutionFwdAlgoDirect,<unused>;miopenConvolutionFwdAlgoGEMM:gemm,0.07536,0,rocBlas,<unused>;miopenConvolutionFwdAlgoWinograd:ConvBinWinogradRxS,0.08048,0,miopenConvolutionFwdAlgoWinograd,<unused>
288-35-35-1x1-48-35-35-1-0x0-1x1-1x1-0-NCHW-FP32-F=miopenConvolutionFwdAlgoDirect:ConvAsm1x1U,0.01376,0,miopenConvolutionFwdAlgoDirect,<unused>;miopenConvolutionFwdAlgoGEMM:gemm,0.08128,0,rocBlas,<unused>;miopenConvolutionFwdAlgoWinograd:ConvBinWinogradRxS,0.081439,0,miopenConvolutionFwdAlgoWinograd,<unused>
288-35-35-1x1-64-35-35-1-0x0-1x1-1x1-0-NCHW-FP32-F=miopenConvolutionFwdAlgoDirect:ConvAsm1x1U,0.01792,0,miopenConvolutionFwdAlgoDirect,<unused>;miopenConvolutionFwdAlgoGEMM:gemm,0.073599,0,rocBlas,<unused>;miopenConvolutionFwdAlgoWinograd:ConvBinWinogradRxS,0.08064,0,miopenConvolutionFwdAlgoWinograd,<unused>
288-35-35-3x3-384-17-17-1-0x0-2x2-1x1-0-NCHW-FP32-F=miopenConvolutionFwdAlgoDirect:ConvOclDirectFwd,2.67326,0,miopenConvolutionFwdAlgoDirect,<unused>;miopenConvolutionFwdAlgoGEMM:gemm,0.11872,2996352,rocBlas,<unused>;miopenConvolutionFwdAlgoWinograd:ConvBinWinogradRxSf2x3g1,0.266398,0,miopenConvolutionFwdAlgoWinograd,<unused>
96-35-35-3x3-96-17-17-1-0x0-2x2-1x1-0-NCHW-FP32-F=miopenConvolutionFwdAlgoDirect:ConvOclDirectFwd,0.423837,0,miopenConvolutionFwdAlgoDirect,<unused>;miopenConvolutionFwdAlgoGEMM:gemm,0.04816,998784,rocBlas,<unused>;miopenConvolutionFwdAlgoWinograd:ConvBinWinogradRxSf2x3g1,0.104479,0,miopenConvolutionFwdAlgoWinograd,<unused>
768-17-17-1x1-256-17-17-1-0x0-1x1-1x1-0-NCHW-FP32-F=miopenConvolutionFwdAlgoDirect:ConvAsm1x1U,0.03856,0,miopenConvolutionFwdAlgoDirect,<unused>;miopenConvolutionFwdAlgoGEMM:gemm,0.149599,0,rocBlas,<unused>;miopenConvolutionFwdAlgoWinograd:ConvBinWinogradRxSf2x3g1,0.173919,0,miopenConvolutionFwdAlgoWinograd,<unused>
768-17-17-1x1-192-17-17-1-0x0-1x1-1x1-0-NCHW-FP32-F=miopenConvolutionFwdAlgoDirect:ConvAsm1x1U,0.02976,0,miopenConvolutionFwdAlgoDirect,<unused>;miopenConvolutionFwdAlgoGEMM:gemm,0.154079,0,rocBlas,<unused>;miopenConvolutionFwdAlgoWinograd:ConvBinWinogradRxSf2x3g1,0.174239,0,miopenConvolutionFwdAlgoWinograd,<unused>
128-17-17-1x7-128-17-17-1-0x3-1x1-1x1-0-NCHW-FP32-F=miopenConvolutionFwdAlgoDirect:ConvDirectNaiveConvFwd,0.565436,0,miopenConvolutionFwdAlgoDirect,<unused>;miopenConvolutionFwdAlgoGEMM:gemm,0.05328,1035776,rocBlas,<unused>;miopenConvolutionFwdAlgoWinograd:ConvBinWinogradRxSf2x3g1,0.124799,0,miopenConvolutionFwdAlgoWinograd,<unused>
128-17-17-7x1-192-17-17-1-3x0-1x1-1x1-0-NCHW-FP32-F=miopenConvolutionFwdAlgoDirect:ConvDirectNaiveConvFwd,0.751355,0,miopenConvolutionFwdAlgoDirect,<unused>;miopenConvolutionFwdAlgoGEMM:gemm,0.04944,1035776,rocBlas,<unused>;miopenConvolutionFwdAlgoWinograd:ConvBinWinogradRxSf2x3g1,0.103199,0,miopenConvolutionFwdAlgoWinograd,<unused>
128-17-17-7x1-128-17-17-1-3x0-1x1-1x1-0-NCHW-FP32-F=miopenConvolutionFwdAlgoDirect:ConvDirectNaiveConvFwd,0.739995,0,miopenConvolutionFwdAlgoDirect,<unused>;miopenConvolutionFwdAlgoGEMM:gemm,0.05232,1035776,rocBlas,<unused>;miopenConvolutionFwdAlgoWinograd:ConvBinWinogradRxSf2x3g1,0.099679,0,miopenConvolutionFwdAlgoWinograd,<unused>
128-17-17-1x7-192-17-17-1-0x3-1x1-1x1-0-NCHW-FP32-F=miopenConvolutionFwdAlgoDirect:ConvDirectNaiveConvFwd,0.593756,0,miopenConvolutionFwdAlgoDirect,<unused>;miopenConvolutionFwdAlgoGEMM:gemm,0.038239,1035776,rocBlas,<unused>;miopenConvolutionFwdAlgoWinograd:ConvBinWinogradRxSf2x3g1,0.123519,0,miopenConvolutionFwdAlgoWinograd,<unused>
768-17-17-1x1-320-17-17-1-0x0-1x1-1x1-0-NCHW-FP32-F=miopenConvolutionFwdAlgoDirect:ConvOclDirectFwd1x1,0.041759,0,miopenConvolutionFwdAlgoDirect,<unused>;miopenConvolutionFwdAlgoGEMM:gemm,0.155679,0,rocBlas,<unused>;miopenConvolutionFwdAlgoWinograd:ConvBinWinogradRxSf2x3g1,0.173919,0,miopenConvolutionFwdAlgoWinograd,<unused>
160-17-17-1x7-160-17-17-1-0x3-1x1-1x1-0-NCHW-FP32-F=miopenConvolutionFwdAlgoDirect:ConvDirectNaiveConvFwd,0.701435,0,miopenConvolutionFwdAlgoDirect,<unused>;miopenConvolutionFwdAlgoGEMM:gemm,0.0608,1294720,rocBlas,<unused>;miopenConvolutionFwdAlgoWinograd:ConvBinWinogradRxSf2x3g1,0.149119,0,miopenConvolutionFwdAlgoWinograd,<unused>
160-17-17-7x1-192-17-17-1-3x0-1x1-1x1-0-NCHW-FP32-F=miopenConvolutionFwdAlgoDirect:ConvDirectNaiveConvFwd,0.940313,0,miopenConvolutionFwdAlgoDirect,<unused>;miopenConvolutionFwdAlgoGEMM:gemm,0.05568,1294720,rocBlas,<unused>;miopenConvolutionFwdAlgoWinograd:ConvBinWinogradRxSf2x3g1,0.117759,0,miopenConvolutionFwdAlgoWinograd,<unused>
160-17-17-7x1-160-17-17-1-3x0-1x1-1x1-0-NCHW-FP32-F=miopenConvolutionFwdAlgoDirect:ConvDirectNaiveConvFwd,0.924474,0,miopenConvolutionFwdAlgoDirect,<unused>;miopenConvolutionFwdAlgoGEMM:gemm,0.05568,1294720,rocBlas,<unused>;miopenConvolutionFwdAlgoWinograd:ConvBinWinogradRxSf2x3g1,0.119359,0,miopenConvolutionFwdAlgoWinograd,<unused>
160-17-17-1x7-192-17-17-1-0x3-1x1-1x1-0-NCHW-FP32-F=miopenConvolutionFwdAlgoDirect:ConvDirectNaiveConvFwd,0.740795,0,miopenConvolutionFwdAlgoDirect,<unused>;miopenConvolutionFwdAlgoGEMM:gemm,0.060799,1294720,rocBlas,<unused>;miopenConvolutionFwdAlgoWinograd:ConvBinWinogradRxSf2x3g1,0.149119,0,miopenConvolutionFwdAlgoWinograd,<unused>
768-17-17-1x1-576-17-17-1-0x0-1x1-1x1-0-NCHW-FP32-F=miopenConvolutionFwdAlgoDirect:ConvAsm1x1U,0.063679,0,miopenConvolutionFwdAlgoDirect,<unused>;miopenConvolutionFwdAlgoGEMM:gemm,0.070399,0,rocBlas,<unused>;miopenConvolutionFwdAlgoWinograd:ConvBinWinogradRxSf2x3g1,0.172639,0,miopenConvolutionFwdAlgoWinograd,<unused>
192-17-17-1x7-192-17-17-1-0x3-1x1-1x1-0-NCHW-FP32-F=miopenConvolutionFwdAlgoDirect:ConvDirectNaiveConvFwd,0.886553,0,miopenConvolutionFwdAlgoDirect,<unused>;miopenConvolutionFwdAlgoGEMM:gemm,0.07168,1553664,rocBlas,<unused>;miopenConvolutionFwdAlgoWinograd:ConvBinWinogradRxS,0.174558,0,miopenConvolutionFwdAlgoWinograd,<unused>
192-17-17-7x1-192-17-17-1-3x0-1x1-1x1-0-NCHW-FP32-F=miopenConvolutionFwdAlgoDirect:ConvDirectNaiveConvFwd,1.12671,0,miopenConvolutionFwdAlgoDirect,<unused>;miopenConvolutionFwdAlgoGEMM:gemm,0.069919,1553664,rocBlas,<unused>;miopenConvolutionFwdAlgoWinograd:ConvBinWinogradRxSf2x3g1,0.136319,0,miopenConvolutionFwdAlgoWinograd,<unused>
768-17-17-1x1-384-17-17-1-0x0-1x1-1x1-0-NCHW-FP32-F=miopenConvolutionFwdAlgoDirect:ConvAsm1x1U,0.04992,0,miopenConvolutionFwdAlgoDirect,<unused>;miopenConvolutionFwdAlgoGEMM:gemm,0.153919,0,rocBlas,<unused>;miopenConvolutionFwdAlgoWinograd:ConvBinWinogradRxSf2x3g1,0.173759,0,miopenConvolutionFwdAlgoWinograd,<unused>
192-17-17-3x3-320-8-8-1-0x0-2x2-1x1-0-NCHW-FP32-F=miopenConvolutionFwdAlgoImplicitGEMM:ConvHipImplicitGemmV4R4Fwd,0.202719,0,miopenConvolutionFwdAlgoImplicitGEMM,<unused>;miopenConvolutionFwdAlgoDirect:ConvOclDirectFwd,0.580316,0,miopenConvolutionFwdAlgoDirect,<unused>;miopenConvolutionFwdAlgoGEMM:gemm,0.06512,442368,rocBlas,<unused>;miopenConvolutionFwdAlgoWinograd:ConvBinWinogradRxSf2x3g1,0.184479,0,miopenConvolutionFwdAlgoWinograd,<unused>
192-17-17-3x3-192-8-8-1-0x0-2x2-1x1-0-NCHW-FP32-F=miopenConvolutionFwdAlgoImplicitGEMM:ConvHipImplicitGemmV4R4Fwd,0.200319,0,miopenConvolutionFwdAlgoImplicitGEMM,<unused>;miopenConvolutionFwdAlgoDirect:ConvOclDirectFwd,0.563996,0,miopenConvolutionFwdAlgoDirect,<unused>;miopenConvolutionFwdAlgoGEMM:gemm,0.075199,442368,rocBlas,<unused>;miopenConvolutionFwdAlgoWinograd:ConvBinWinogradRxSf2x3g1,0.186238,0,miopenConvolutionFwdAlgoWinograd,<unused>
1280-8-8-1x1-320-8-8-1-0x0-1x1-1x1-0-NCHW-FP32-F=miopenConvolutionFwdAlgoImplicitGEMM:ConvHipImplicitGemmV4R4Fwd,0.141119,0,miopenConvolutionFwdAlgoImplicitGEMM,<unused>;miopenConvolutionFwdAlgoDirect:ConvAsm1x1U,0.0376,0,miopenConvolutionFwdAlgoDirect,<unused>;miopenConvolutionFwdAlgoGEMM:gemm,0.04816,0,rocBlas,<unused>;miopenConvolutionFwdAlgoWinograd:ConvBinWinogradRxSf2x3g1,0.286878,0,miopenConvolutionFwdAlgoWinograd,<unused>
1280-8-8-1x1-384-8-8-1-0x0-1x1-1x1-0-NCHW-FP32-F=miopenConvolutionFwdAlgoImplicitGEMM:ConvHipImplicitGemmV4R4Fwd,0.140479,0,miopenConvolutionFwdAlgoImplicitGEMM,<unused>;miopenConvolutionFwdAlgoDirect:ConvAsm1x1U,0.03792,0,miopenConvolutionFwdAlgoDirect,<unused>;miopenConvolutionFwdAlgoGEMM:gemm,0.05184,0,rocBlas,<unused>;miopenConvolutionFwdAlgoWinograd:ConvBinWinogradRxSf2x3g1,0.274078,0,miopenConvolutionFwdAlgoWinograd,<unused>
384-8-8-1x3-384-8-8-1-0x1-1x1-1x1-0-NCHW-FP32-F=miopenConvolutionFwdAlgoImplicitGEMM:ConvHipImplicitGemmV4R4Fwd,0.145599,0,miopenConvolutionFwdAlgoImplicitGEMM,<unused>;miopenConvolutionFwdAlgoDirect:ConvDirectNaiveConvFwd,0.453117,0,miopenConvolutionFwdAlgoDirect,<unused>;miopenConvolutionFwdAlgoGEMM:gemm,0.05968,294912,rocBlas,<unused>;miopenConvolutionFwdAlgoWinograd:ConvBinWinogradRxS,0.099999,0,miopenConvolutionFwdAlgoWinograd,<unused>
384-8-8-3x1-384-8-8-1-1x0-1x1-1x1-0-NCHW-FP32-F=miopenConvolutionFwdAlgoImplicitGEMM:ConvHipImplicitGemmV4R4Fwd,0.144319,0,miopenConvolutionFwdAlgoImplicitGEMM,<unused>;miopenConvolutionFwdAlgoDirect:ConvDirectNaiveConvFwd,0.514237,0,miopenConvolutionFwdAlgoDirect,<unused>;miopenConvolutionFwdAlgoGEMM:gemm,0.049599,294912,rocBlas,<unused>;miopenConvolutionFwdAlgoWinograd:ConvBinWinogradRxSf2x3g1,0.100639,0,miopenConvolutionFwdAlgoWinograd,<unused>
1280-8-8-1x1-448-8-8-1-0x0-1x1-1x1-0-NCHW-FP32-F=miopenConvolutionFwdAlgoImplicitGEMM:ConvHipImplicitGemmV4R4Fwd,0.140159,0,miopenConvolutionFwdAlgoImplicitGEMM,<unused>;miopenConvolutionFwdAlgoDirect:ConvAsm1x1U,0.03952,0,miopenConvolutionFwdAlgoDirect,<unused>;miopenConvolutionFwdAlgoGEMM:gemm,0.054239,0,rocBlas,<unused>;miopenConvolutionFwdAlgoWinograd:ConvBinWinogradRxSf2x3g1,0.273438,0,miopenConvolutionFwdAlgoWinograd,<unused>
448-8-8-3x3-384-8-8-1-1x1-1x1-1x1-0-NCHW-FP32-F=miopenConvolutionFwdAlgoWinograd:ConvBinWinogradRxS,0.110559,0,miopenConvolutionFwdAlgoWinograd,<unused>
1280-8-8-1x1-192-8-8-1-0x0-1x1-1x1-0-NCHW-FP32-F=miopenConvolutionFwdAlgoImplicitGEMM:ConvHipImplicitGemmV4R4Fwd,0.140639,0,miopenConvolutionFwdAlgoImplicitGEMM,<unused>;miopenConvolutionFwdAlgoDirect:ConvAsm1x1U,0.04176,0,miopenConvolutionFwdAlgoDirect,<unused>;miopenConvolutionFwdAlgoGEMM:gemm,0.047039,0,rocBlas,<unused>;miopenConvolutionFwdAlgoWinograd:ConvBinWinogradRxSf2x3g1,0.274558,0,miopenConvolutionFwdAlgoWinograd,<unused>
2048-8-8-1x1-320-8-8-1-0x0-1x1-1x1-0-NCHW-FP32-F=miopenConvolutionFwdAlgoImplicitGEMM:ConvHipImplicitGemmV4R4Fwd,0.219519,0,miopenConvolutionFwdAlgoImplicitGEMM,<unused>;miopenConvolutionFwdAlgoDirect:ConvAsm1x1U,0.05888,0,miopenConvolutionFwdAlgoDirect,<unused>;miopenConvolutionFwdAlgoGEMM:gemm,0.093119,0,rocBlas,<unused>;miopenConvolutionFwdAlgoWinograd:ConvBinWinogradRxSf2x3g1,0.436477,0,miopenConvolutionFwdAlgoWinograd,<unused>
2048-8-8-1x1-384-8-8-1-0x0-1x1-1x1-0-NCHW-FP32-F=miopenConvolutionFwdAlgoImplicitGEMM:ConvHipImplicitGemmV4R4Fwd,0.218399,0,miopenConvolutionFwdAlgoImplicitGEMM,<unused>;miopenConvolutionFwdAlgoDirect:ConvOclDirectFwd1x1,0.05632,0,miopenConvolutionFwdAlgoDirect,<unused>;miopenConvolutionFwdAlgoGEMM:gemm,0.09824,0,rocBlas,<unused>;miopenConvolutionFwdAlgoWinograd:ConvBinWinogradRxSf2x3g1,0.435677,0,miopenConvolutionFwdAlgoWinograd,<unused>
2048-8-8-1x1-448-8-8-1-0x0-1x1-1x1-0-NCHW-FP32-F=miopenConvolutionFwdAlgoImplicitGEMM:ConvHipImplicitGemmV4R4Fwd,0.218559,0,miopenConvolutionFwdAlgoImplicitGEMM,<unused>;miopenConvolutionFwdAlgoDirect:ConvOclDirectFwd1x1,0.05904,0,miopenConvolutionFwdAlgoDirect,<unused>;miopenConvolutionFwdAlgoGEMM:gemm,0.088799,0,rocBlas,<unused>;miopenConvolutionFwdAlgoWinograd:ConvBinWinogradRxSf2x3g1,0.429917,0,miopenConvolutionFwdAlgoWinograd,<unused>
2048-8-8-1x1-192-8-8-1-0x0-1x1-1x1-0-NCHW-FP32-F=miopenConvolutionFwdAlgoImplicitGEMM:ConvHipImplicitGemmV4R4Fwd,0.218239,0,miopenConvolutionFwdAlgoImplicitGEMM,<unused>;miopenConvolutionFwdAlgoDirect:ConvOclDirectFwd1x1,0.0424,0,miopenConvolutionFwdAlgoDirect,<unused>;miopenConvolutionFwdAlgoGEMM:gemm,0.07056,0,rocBlas,<unused>;miopenConvolutionFwdAlgoWinograd:ConvBinWinogradRxSf2x3g1,0.434557,0,miopenConvolutionFwdAlgoWinograd,<unused>
64-56-56-1x1-128-56-56-1-0x0-1x1-1x1-0-NCHW-FP32-F=miopenConvolutionFwdAlgoImplicitGEMM:ConvHipImplicitGemmV4R4Fwd,0.01728,0,miopenConvolutionFwdAlgoImplicitGEMM,<unused>;miopenConvolutionFwdAlgoDirect:ConvAsm1x1U,0.01488,0,miopenConvolutionFwdAlgoDirect,<unused>;miopenConvolutionFwdAlgoGEMM:gemm,0.03152,0,rocBlas,<unused>;miopenConvolutionFwdAlgoWinograd:ConvBinWinogradRxSf3x2,0.04624,0,miopenConvolutionFwdAlgoWinograd,<unused>
128-56-56-3x3-32-56-56-1-1x1-1x1-1x1-0-NCHW-FP32-F=miopenConvolutionFwdAlgoWinograd:ConvBinWinogradRxS,0.04784,0,miopenConvolutionFwdAlgoWinograd,<unused>
96-56-56-1x1-128-56-56-1-0x0-1x1-1x1-0-NCHW-FP32-F=miopenConvolutionFwdAlgoImplicitGEMM:ConvHipImplicitGemmV4R4Fwd,0.02176,0,miopenConvolutionFwdAlgoImplicitGEMM,<unused>;miopenConvolutionFwdAlgoDirect:ConvAsm1x1U,0.01936,0,miopenConvolutionFwdAlgoDirect,<unused>;miopenConvolutionFwdAlgoGEMM:gemm,0.04144,0,rocBlas,<unused>;miopenConvolutionFwdAlgoWinograd:ConvBinWinogradRxSf3x2,0.04832,0,miopenConvolutionFwdAlgoWinograd,<unused>
128-56-56-1x1-128-56-56-1-0x0-1x1-1x1-0-NCHW-FP32-F=miopenConvolutionFwdAlgoImplicitGEMM:ConvHipImplicitGemmV4R4Fwd,0.02736,0,miopenConvolutionFwdAlgoImplicitGEMM,<unused>;miopenConvolutionFwdAlgoDirect:ConvAsm1x1U,0.0224,0,miopenConvolutionFwdAlgoDirect,<unused>;miopenConvolutionFwdAlgoGEMM:gemm,0.03408,0,rocBlas,<unused>;miopenConvolutionFwdAlgoWinograd:ConvBinWinogradRxSf3x2,0.05712,0,miopenConvolutionFwdAlgoWinograd,<unused>
160-56-56-1x1-128-56-56-1-0x0-1x1-1x1-0-NCHW-FP32-F=miopenConvolutionFwdAlgoImplicitGEMM:ConvHipImplicitGemmV4R4Fwd,0.0304,0,miopenConvolutionFwdAlgoImplicitGEMM,<unused>;miopenConvolutionFwdAlgoDirect:ConvAsm1x1U,0.02832,0,miopenConvolutionFwdAlgoDirect,<unused>;miopenConvolutionFwdAlgoGEMM:gemm,0.04416,0,rocBlas,<unused>;miopenConvolutionFwdAlgoWinograd:ConvBinWinogradRxSf3x2,0.06336,0,miopenConvolutionFwdAlgoWinograd,<unused>
192-56-56-1x1-128-56-56-1-0x0-1x1-1x1-0-NCHW-FP32-F=miopenConvolutionFwdAlgoImplicitGEMM:ConvHipImplicitGemmV4R4Fwd,0.03392,0,miopenConvolutionFwdAlgoImplicitGEMM,<unused>;miopenConvolutionFwdAlgoDirect:ConvAsm1x1U,0.03072,0,miopenConvolutionFwdAlgoDirect,<unused>;miopenConvolutionFwdAlgoGEMM:gemm,0.05648,0,rocBlas,<unused>;miopenConvolutionFwdAlgoWinograd:ConvBinWinogradRxSf3x2,0.0704,0,miopenConvolutionFwdAlgoWinograd,<unused>
224-56-56-1x1-128-56-56-1-0x0-1x1-1x1-0-NCHW-FP32-F=miopenConvolutionFwdAlgoImplicitGEMM:ConvHipImplicitGemmV4R4Fwd,0.03824,0,miopenConvolutionFwdAlgoImplicitGEMM,<unused>;miopenConvolutionFwdAlgoDirect:ConvAsm1x1U,0.03696,0,miopenConvolutionFwdAlgoDirect,<unused>;miopenConvolutionFwdAlgoGEMM:gemm,0.06224,0,rocBlas,<unused>;miopenConvolutionFwdAlgoWinograd:ConvBinWinogradRxSf3x2,0.07648,0,miopenConvolutionFwdAlgoWinograd,<unused>
128-28-28-1x1-128-28-28-1-0x0-1x1-1x1-0-NCHW-FP32-F=miopenConvolutionFwdAlgoDirect:ConvAsm1x1U,0.01248,0,miopenConvolutionFwdAlgoDirect,<unused>;miopenConvolutionFwdAlgoGEMM:gemm,0.0408,0,rocBlas,<unused>;miopenConvolutionFwdAlgoWinograd:ConvBinWinogradRxS,0.0488,0,miopenConvolutionFwdAlgoWinograd,<unused>
128-28-28-3x3-32-28-28-1-1x1-1x1-1x1-0-NCHW-FP32-F=miopenConvolutionFwdAlgoWinograd:ConvBinWinograd3x3U,0.04736,0,miopenConvolutionFwdAlgoWinograd,<unused>
160-28-28-1x1-128-28-28-1-0x0-1x1-1x1-0-NCHW-FP32-F=miopenConvolutionFwdAlgoDirect:ConvAsm1x1U,0.01264,0,miopenConvolutionFwdAlgoDirect,<unused>;miopenConvolutionFwdAlgoGEMM:gemm,0.0528,0,rocBlas,<unused>;miopenConvolutionFwdAlgoWinograd:ConvBinWinogradRxS,0.05424,0,miopenConvolutionFwdAlgoWinograd,<unused>
192-28-28-1x1-128-28-28-1-0x0-1x1-1x1-0-NCHW-FP32-F=miopenConvolutionFwdAlgoDirect:ConvAsm1x1U,0.0136,0,miopenConvolutionFwdAlgoDirect,<unused>;miopenConvolutionFwdAlgoGEMM:gemm,0.0488,0,rocBlas,<unused>;miopenConvolutionFwdAlgoWinograd:ConvBinWinogradRxS,0.0616,0,miopenConvolutionFwdAlgoWinograd,<unused>
224-28-28-1x1-128-28-28-1-0x0-1x1-1x1-0-NCHW-FP32-F=miopenConvolutionFwdAlgoDirect:ConvAsm1x1U,0.01536,0,miopenConvolutionFwdAlgoDirect,<unused>;miopenConvolutionFwdAlgoGEMM:gemm,0.06624,0,rocBlas,<unused>;miopenConvolutionFwdAlgoWinograd:ConvBinWinogradRxS,0.06736,0,miopenConvolutionFwdAlgoWinograd,<unused>
256-28-28-1x1-128-28-28-1-0x0-1x1-1x1-0-NCHW-FP32-F=miopenConvolutionFwdAlgoDirect:ConvAsm1x1U,0.01824,0,miopenConvolutionFwdAlgoDirect,<unused>;miopenConvolutionFwdAlgoGEMM:gemm,0.07712,0,rocBlas,<unused>;miopenConvolutionFwdAlgoWinograd:ConvBinWinogradRxS,0.07424,0,miopenConvolutionFwdAlgoWinograd,<unused>
288-28-28-1x1-128-28-28-1-0x0-1x1-1x1-0-NCHW-FP32-F=miopenConvolutionFwdAlgoDirect:ConvAsm1x1U,0.02112,0,miopenConvolutionFwdAlgoDirect,<unused>;miopenConvolutionFwdAlgoGEMM:gemm,0.0848,0,rocBlas,<unused>;miopenConvolutionFwdAlgoWinograd:ConvBinWinogradRxS,0.0808,0,miopenConvolutionFwdAlgoWinograd,<unused>
320-28-28-1x1-128-28-28-1-0x0-1x1-1x1-0-NCHW-FP32-F=miopenConvolutionFwdAlgoDirect:ConvAsm1x1U,0.02208,0,miopenConvolutionFwdAlgoDirect,<unused>;miopenConvolutionFwdAlgoGEMM:gemm,0.0864,0,rocBlas,<unused>;miopenConvolutionFwdAlgoWinograd:ConvBinWinogradRxSf2x3g1,0.08704,0,miopenConvolutionFwdAlgoWinograd,<unused>
352-28-28-1x1-128-28-28-1-0x0-1x1-1x1-0-NCHW-FP32-F=miopenConvolutionFwdAlgoDirect:ConvAsm1x1U,0.024,0,miopenConvolutionFwdAlgoDirect,<unused>;miopenConvolutionFwdAlgoGEMM:gemm,0.09344,0,rocBlas,<unused>;miopenConvolutionFwdAlgoWinograd:ConvBinWinogradRxSf2x3g1,0.09296,0,miopenConvolutionFwdAlgoWinograd,<unused>
384-28-28-1x1-128-28-28-1-0x0-1x1-1x1-0-NCHW-FP32-F=miopenConvolutionFwdAlgoDirect:ConvAsm1x1U,0.02448,0,miopenConvolutionFwdAlgoDirect,<unused>;miopenConvolutionFwdAlgoGEMM:gemm,0.04656,0,rocBlas,<unused>;miopenConvolutionFwdAlgoWinograd:ConvBinWinogradRxSf2x3g1,0.0992,0,miopenConvolutionFwdAlgoWinograd,<unused>
416-28-28-1x1-128-28-28-1-0x0-1x1-1x1-0-NCHW-FP32-F=miopenConvolutionFwdAlgoDirect:ConvAsm1x1U,0.02752,0,miopenConvolutionFwdAlgoDirect,<unused>;miopenConvolutionFwdAlgoGEMM:gemm,0.09792,0,rocBlas,<unused>;miopenConvolutionFwdAlgoWinograd:ConvBinWinogradRxSf2x3g1,0.10592,0,miopenConvolutionFwdAlgoWinograd,<unused>
448-28-28-1x1-128-28-28-1-0x0-1x1-1x1-0-NCHW-FP32-F=miopenConvolutionFwdAlgoDirect:ConvAsm1x1U,0.032,0,miopenConvolutionFwdAlgoDirect,<unused>;miopenConvolutionFwdAlgoGEMM:gemm,0.10704,0,rocBlas,<unused>;miopenConvolutionFwdAlgoWinograd:ConvBinWinogradRxSf2x3g1,0.11184,0,miopenConvolutionFwdAlgoWinograd,<unused>
480-28-28-1x1-128-28-28-1-0x0-1x1-1x1-0-NCHW-FP32-F=miopenConvolutionFwdAlgoDirect:ConvAsm1x1U,0.02976,0,miopenConvolutionFwdAlgoDirect,<unused>;miopenConvolutionFwdAlgoGEMM:gemm,0.10496,0,rocBlas,<unused>;miopenConvolutionFwdAlgoWinograd:ConvBinWinogradRxSf2x3g1,0.11808,0,miopenConvolutionFwdAlgoWinograd,<unused>
256-14-14-1x1-128-14-14-1-0x0-1x1-1x1-0-NCHW-FP32-F=miopenConvolutionFwdAlgoDirect:ConvAsm1x1U,0.01264,0,miopenConvolutionFwdAlgoDirect,<unused>;miopenConvolutionFwdAlgoGEMM:gemm,0.03824,0,rocBlas,<unused>;miopenConvolutionFwdAlgoWinograd:ConvBinWinogradRxSf2x3g1,0.07456,0,miopenConvolutionFwdAlgoWinograd,<unused>
128-14-14-3x3-32-14-14-1-1x1-1x1-1x1-0-NCHW-FP32-F=miopenConvolutionFwdAlgoWinograd:ConvBinWinograd3x3U,0.0472,0,miopenConvolutionFwdAlgoWinograd,<unused>
288-14-14-1x1-128-14-14-1-0x0-1x1-1x1-0-NCHW-FP32-F=miopenConvolutionFwdAlgoDirect:ConvAsm1x1U,0.01344,0,miopenConvolutionFwdAlgoDirect,<unused>;miopenConvolutionFwdAlgoGEMM:gemm,0.04016,0,rocBlas,<unused>;miopenConvolutionFwdAlgoWinograd:ConvBinWinogradRxSf2x3g1,0.08016,0,miopenConvolutionFwdAlgoWinograd,<unused>
320-14-14-1x1-128-14-14-1-0x0-1x1-1x1-0-NCHW-FP32-F=miopenConvolutionFwdAlgoDirect:ConvAsm1x1U,0.01456,0,miopenConvolutionFwdAlgoDirect,<unused>;miopenConvolutionFwdAlgoGEMM:gemm,0.0424,0,rocBlas,<unused>;miopenConvolutionFwdAlgoWinograd:ConvBinWinogradRxSf2x3g1,0.0872,0,miopenConvolutionFwdAlgoWinograd,<unused>
352-14-14-1x1-128-14-14-1-0x0-1x1-1x1-0-NCHW-FP32-F=miopenConvolutionFwdAlgoDirect:ConvAsm1x1U,0.01472,0,miopenConvolutionFwdAlgoDirect,<unused>;miopenConvolutionFwdAlgoGEMM:gemm,0.0424,0,rocBlas,<unused>;miopenConvolutionFwdAlgoWinograd:ConvBinWinogradRxSf2x3g1,0.09312,0,miopenConvolutionFwdAlgoWinograd,<unused>
384-14-14-1x1-128-14-14-1-0x0-1x1-1x1-0-NCHW-FP32-F=miopenConvolutionFwdAlgoDirect:ConvAsm1x1U,0.01648,0,miopenConvolutionFwdAlgoDirect,<unused>;miopenConvolutionFwdAlgoGEMM:gemm,0.03904,0,rocBlas,<unused>;miopenConvolutionFwdAlgoWinograd:ConvBinWinogradRxSf2x3g1,0.09952,0,miopenConvolutionFwdAlgoWinograd,<unused>
416-14-14-1x1-128-14-14-1-0x0-1x1-1x1-0-NCHW-FP32-F=miopenConvolutionFwdAlgoDirect:ConvAsm1x1U,0.0168,0,miopenConvolutionFwdAlgoDirect,<unused>;miopenConvolutionFwdAlgoGEMM:gemm,0.03712,0,rocBlas,<unused>;miopenConvolutionFwdAlgoWinograd:ConvBinWinogradRxSf2x3g1,0.10608,0,miopenConvolutionFwdAlgoWinograd,<unused>
448-14-14-1x1-128-14-14-1-0x0-1x1-1x1-0-NCHW-FP32-F=miopenConvolutionFwdAlgoDirect:ConvAsm1x1U,0.01776,0,miopenConvolutionFwdAlgoDirect,<unused>;miopenConvolutionFwdAlgoGEMM:gemm,0.05104,0,rocBlas,<unused>;miopenConvolutionFwdAlgoWinograd:ConvBinWinogradRxSf2x3g1,0.11168,0,miopenConvolutionFwdAlgoWinograd,<unused>
480-14-14-1x1-128-14-14-1-0x0-1x1-1x1-0-NCHW-FP32-F=miopenConvolutionFwdAlgoDirect:ConvAsm1x1U,0.01904,0,miopenConvolutionFwdAlgoDirect,<unused>;miopenConvolutionFwdAlgoGEMM:gemm,0.03952,0,rocBlas,<unused>;miopenConvolutionFwdAlgoWinograd:ConvBinWinogradRxSf2x3g1,0.11824,0,miopenConvolutionFwdAlgoWinograd,<unused>
512-14-14-1x1-128-14-14-1-0x0-1x1-1x1-0-NCHW-FP32-F=miopenConvolutionFwdAlgoDirect:ConvAsm1x1U,0.01984,0,miopenConvolutionFwdAlgoDirect,<unused>;miopenConvolutionFwdAlgoGEMM:gemm,0.03584,0,rocBlas,<unused>;miopenConvolutionFwdAlgoWinograd:ConvBinWinogradRxSf2x3g1,0.12656,0,miopenConvolutionFwdAlgoWinograd,<unused>
544-14-14-1x1-128-14-14-1-0x0-1x1-1x1-0-NCHW-FP32-F=miopenConvolutionFwdAlgoDirect:ConvAsm1x1U,0.0208,0,miopenConvolutionFwdAlgoDirect,<unused>;miopenConvolutionFwdAlgoGEMM:gemm,0.04224,0,rocBlas,<unused>;miopenConvolutionFwdAlgoWinograd:ConvBinWinogradRxSf2x3g1,0.13024,0,miopenConvolutionFwdAlgoWinograd,<unused>
576-14-14-1x1-128-14-14-1-0x0-1x1-1x1-0-NCHW-FP32-F=miopenConvolutionFwdAlgoDirect:ConvAsm1x1U,0.02064,0,miopenConvolutionFwdAlgoDirect,<unused>;miopenConvolutionFwdAlgoGEMM:gemm,0.0408,0,rocBlas,<unused>;miopenConvolutionFwdAlgoWinograd:ConvBinWinogradRxSf2x3g1,0.13696,0,miopenConvolutionFwdAlgoWinograd,<unused>
608-14-14-1x1-128-14-14-1-0x0-1x1-1x1-0-NCHW-FP32-F=miopenConvolutionFwdAlgoDirect:ConvAsm1x1U,0.02192,0,miopenConvolutionFwdAlgoDirect,<unused>;miopenConvolutionFwdAlgoGEMM:gemm,0.03712,0,rocBlas,<unused>;miopenConvolutionFwdAlgoWinograd:ConvBinWinogradRxS,0.1456,0,miopenConvolutionFwdAlgoWinograd,<unused>
640-14-14-1x1-128-14-14-1-0x0-1x1-1x1-0-NCHW-FP32-F=miopenConvolutionFwdAlgoDirect:ConvAsm1x1U,0.02224,0,miopenConvolutionFwdAlgoDirect,<unused>;miopenConvolutionFwdAlgoGEMM:gemm,0.0496,0,rocBlas,<unused>;miopenConvolutionFwdAlgoWinograd:ConvBinWinogradRxSf2x3g1,0.14976,0,miopenConvolutionFwdAlgoWinograd,<unused>
672-14-14-1x1-128-14-14-1-0x0-1x1-1x1-0-NCHW-FP32-F=miopenConvolutionFwdAlgoDirect:ConvAsm1x1U,0.02336,0,miopenConvolutionFwdAlgoDirect,<unused>;miopenConvolutionFwdAlgoGEMM:gemm,0.03632,0,rocBlas,<unused>;miopenConvolutionFwdAlgoWinograd:ConvBinWinogradRxSf2x3g1,0.1544,0,miopenConvolutionFwdAlgoWinograd,<unused>
704-14-14-1x1-128-14-14-1-0x0-1x1-1x1-0-NCHW-FP32-F=miopenConvolutionFwdAlgoDirect:ConvAsm1x1U,0.02736,0,miopenConvolutionFwdAlgoDirect,<unused>;miopenConvolutionFwdAlgoGEMM:gemm,0.03808,0,rocBlas,<unused>;miopenConvolutionFwdAlgoWinograd:ConvBinWinogradRxSf2x3g1,0.16224,0,miopenConvolutionFwdAlgoWinograd,<unused>
736-14-14-1x1-128-14-14-1-0x0-1x1-1x1-0-NCHW-FP32-F=miopenConvolutionFwdAlgoDirect:ConvAsm1x1U,0.02544,0,miopenConvolutionFwdAlgoDirect,<unused>;miopenConvolutionFwdAlgoGEMM:gemm,0.0408,0,rocBlas,<unused>;miopenConvolutionFwdAlgoWinograd:ConvBinWinogradRxSf2x3g1,0.168,0,miopenConvolutionFwdAlgoWinograd,<unused>
768-14-14-1x1-128-14-14-1-0x0-1x1-1x1-0-NCHW-FP32-F=miopenConvolutionFwdAlgoDirect:ConvAsm1x1U,0.02784,0,miopenConvolutionFwdAlgoDirect,<unused>;miopenConvolutionFwdAlgoGEMM:gemm,0.04128,0,rocBlas,<unused>;miopenConvolutionFwdAlgoWinograd:ConvBinWinogradRxSf2x3g1,0.17552,0,miopenConvolutionFwdAlgoWinograd,<unused>
800-14-14-1x1-128-14-14-1-0x0-1x1-1x1-0-NCHW-FP32-F=miopenConvolutionFwdAlgoDirect:ConvAsm1x1U,0.02768,0,miopenConvolutionFwdAlgoDirect,<unused>;miopenConvolutionFwdAlgoGEMM:gemm,0.03984,0,rocBlas,<unused>;miopenConvolutionFwdAlgoWinograd:ConvBinWinogradRxSf2x3g1,0.17984,0,miopenConvolutionFwdAlgoWinograd,<unused>
832-14-14-1x1-128-14-14-1-0x0-1x1-1x1-0-NCHW-FP32-F=miopenConvolutionFwdAlgoDirect:ConvAsm1x1U,0.0288,0,miopenConvolutionFwdAlgoDirect,<unused>;miopenConvolutionFwdAlgoGEMM:gemm,0.04272,0,rocBlas,<unused>;miopenConvolutionFwdAlgoWinograd:ConvBinWinogradRxSf2x3g1,0.1864,0,miopenConvolutionFwdAlgoWinograd,<unused>
864-14-14-1x1-128-14-14-1-0x0-1x1-1x1-0-NCHW-FP32-F=miopenConvolutionFwdAlgoDirect:ConvAsm1x1U,0.02896,0,miopenConvolutionFwdAlgoDirect,<unused>;miopenConvolutionFwdAlgoGEMM:gemm,0.04272,0,rocBlas,<unused>;miopenConvolutionFwdAlgoWinograd:ConvBinWinogradRxSf2x3g1,0.19216,0,miopenConvolutionFwdAlgoWinograd,<unused>
896-14-14-1x1-128-14-14-1-0x0-1x1-1x1-0-NCHW-FP32-F=miopenConvolutionFwdAlgoDirect:ConvAsm1x1U,0.03088,0,miopenConvolutionFwdAlgoDirect,<unused>;miopenConvolutionFwdAlgoGEMM:gemm,0.04016,0,rocBlas,<unused>;miopenConvolutionFwdAlgoWinograd:ConvBinWinogradRxS,0.204001,0,miopenConvolutionFwdAlgoWinograd,<unused>
928-14-14-1x1-128-14-14-1-0x0-1x1-1x1-0-NCHW-FP32-F=miopenConvolutionFwdAlgoDirect:ConvAsm1x1U,0.03024,0,miopenConvolutionFwdAlgoDirect,<unused>;miopenConvolutionFwdAlgoGEMM:gemm,0.04384,0,rocBlas,<unused>;miopenConvolutionFwdAlgoWinograd:ConvBinWinogradRxSf2x3g1,0.20496,0,miopenConvolutionFwdAlgoWinograd,<unused>
960-14-14-1x1-128-14-14-1-0x0-1x1-1x1-0-NCHW-FP32-F=miopenConvolutionFwdAlgoDirect:ConvAsm1x1U,0.03136,0,miopenConvolutionFwdAlgoDirect,<unused>;miopenConvolutionFwdAlgoGEMM:gemm,0.04624,0,rocBlas,<unused>;miopenConvolutionFwdAlgoWinograd:ConvBinWinogradRxS,0.21648,0,miopenConvolutionFwdAlgoWinograd,<unused>
992-14-14-1x1-128-14-14-1-0x0-1x1-1x1-0-NCHW-FP32-F=miopenConvolutionFwdAlgoDirect:ConvAsm1x1U,0.03232,0,miopenConvolutionFwdAlgoDirect,<unused>;miopenConvolutionFwdAlgoGEMM:gemm,0.05168,0,rocBlas,<unused>;miopenConvolutionFwdAlgoWinograd:ConvBinWinogradRxSf2x3g1,0.21776,0,miopenConvolutionFwdAlgoWinograd,<unused>
512-7-7-1x1-128-7-7-1-0x0-1x1-1x1-0-NCHW-FP32-F=miopenConvolutionFwdAlgoDirect:ConvAsm1x1U,0.01968,0,miopenConvolutionFwdAlgoDirect,<unused>;miopenConvolutionFwdAlgoGEMM:gemm,0.03392,0,rocBlas,<unused>;miopenConvolutionFwdAlgoWinograd:ConvBinWinogradRxSf2x3g1,0.12928,0,miopenConvolutionFwdAlgoWinograd,<unused>
128-7-7-3x3-32-7-7-1-1x1-1x1-1x1-0-NCHW-FP32-F=miopenConvolutionFwdAlgoWinograd:ConvBinWinograd3x3U,0.04784,0,miopenConvolutionFwdAlgoWinograd,<unused>
544-7-7-1x1-128-7-7-1-0x0-1x1-1x1-0-NCHW-FP32-F=miopenConvolutionFwdAlgoDirect:ConvAsm1x1U,0.02,0,miopenConvolutionFwdAlgoDirect,<unused>;miopenConvolutionFwdAlgoGEMM:gemm,0.03328,0,rocBlas,<unused>;miopenConvolutionFwdAlgoWinograd:ConvBinWinogradRxSf2x3g1,0.12944,0,miopenConvolutionFwdAlgoWinograd,<unused>
576-7-7-1x1-128-7-7-1-0x0-1x1-1x1-0-NCHW-FP32-F=miopenConvolutionFwdAlgoDirect:ConvAsm1x1U,0.02096,0,miopenConvolutionFwdAlgoDirect,<unused>;miopenConvolutionFwdAlgoGEMM:gemm,0.03584,0,rocBlas,<unused>;miopenConvolutionFwdAlgoWinograd:ConvBinWinogradRxSf2x3g1,0.136799,0,miopenConvolutionFwdAlgoWinograd,<unused>
608-7-7-1x1-128-7-7-1-0x0-1x1-1x1-0-NCHW-FP32-F=miopenConvolutionFwdAlgoDirect:ConvAsm1x1U,0.02064,0,miopenConvolutionFwdAlgoDirect,<unused>;miopenConvolutionFwdAlgoGEMM:gemm,0.03568,0,rocBlas,<unused>;miopenConvolutionFwdAlgoWinograd:ConvBinWinogradRxSf2x3g1,0.143519,0,miopenConvolutionFwdAlgoWinograd,<unused>
640-7-7-1x1-128-7-7-1-0x0-1x1-1x1-0-NCHW-FP32-F=miopenConvolutionFwdAlgoDirect:ConvAsm1x1U,0.02208,0,miopenConvolutionFwdAlgoDirect,<unused>;miopenConvolutionFwdAlgoGEMM:gemm,0.03664,0,rocBlas,<unused>;miopenConvolutionFwdAlgoWinograd:ConvBinWinogradRxSf2x3g1,0.149439,0,miopenConvolutionFwdAlgoWinograd,<unused>
672-7-7-1x1-128-7-7-1-0x0-1x1-1x1-0-NCHW-FP32-F=miopenConvolutionFwdAlgoDirect:ConvAsm1x1U,0.02256,0,miopenConvolutionFwdAlgoDirect,<unused>;miopenConvolutionFwdAlgoGEMM:gemm,0.03616,0,rocBlas,<unused>;miopenConvolutionFwdAlgoWinograd:ConvBinWinogradRxSf2x3g1,0.156159,0,miopenConvolutionFwdAlgoWinograd,<unused>
704-7-7-1x1-128-7-7-1-0x0-1x1-1x1-0-NCHW-FP32-F=miopenConvolutionFwdAlgoDirect:ConvAsm1x1U,0.02416,0,miopenConvolutionFwdAlgoDirect,<unused>;miopenConvolutionFwdAlgoGEMM:gemm,0.03904,0,rocBlas,<unused>;miopenConvolutionFwdAlgoWinograd:ConvBinWinogradRxSf2x3g1,0.16112,0,miopenConvolutionFwdAlgoWinograd,<unused>
736-7-7-1x1-128-7-7-1-0x0-1x1-1x1-0-NCHW-FP32-F=miopenConvolutionFwdAlgoDirect:ConvAsm1x1U,0.02352,0,miopenConvolutionFwdAlgoDirect,<unused>;miopenConvolutionFwdAlgoGEMM:gemm,0.04016,0,rocBlas,<unused>;miopenConvolutionFwdAlgoWinograd:ConvBinWinogradRxSf2x3g1,0.168479,0,miopenConvolutionFwdAlgoWinograd,<unused>
768-7-7-1x1-128-7-7-1-0x0-1x1-1x1-0-NCHW-FP32-F=miopenConvolutionFwdAlgoDirect:ConvAsm1x1U,0.02464,0,miopenConvolutionFwdAlgoDirect,<unused>;miopenConvolutionFwdAlgoGEMM:gemm,0.038719,0,rocBlas,<unused>;miopenConvolutionFwdAlgoWinograd:ConvBinWinogradRxSf2x3g1,0.175679,0,miopenConvolutionFwdAlgoWinograd,<unused>
800-7-7-1x1-128-7-7-1-0x0-1x1-1x1-0-NCHW-FP32-F=miopenConvolutionFwdAlgoDirect:ConvAsm1x1U,0.02736,0,miopenConvolutionFwdAlgoDirect,<unused>;miopenConvolutionFwdAlgoGEMM:gemm,0.04,0,rocBlas,<unused>;miopenConvolutionFwdAlgoWinograd:ConvBinWinogradRxSf2x3g1,0.180478,0,miopenConvolutionFwdAlgoWinograd,<unused>
832-7-7-1x1-128-7-7-1-0x0-1x1-1x1-0-NCHW-FP32-F=miopenConvolutionFwdAlgoDirect:ConvAsm1x1U,0.02768,0,miopenConvolutionFwdAlgoDirect,<unused>;miopenConvolutionFwdAlgoGEMM:gemm,0.03952,0,rocBlas,<unused>;miopenConvolutionFwdAlgoWinograd:ConvBinWinogradRxSf2x3g1,0.186399,0,miopenConvolutionFwdAlgoWinograd,<unused>
864-7-7-1x1-128-7-7-1-0x0-1x1-1x1-0-NCHW-FP32-F=miopenConvolutionFwdAlgoDirect:ConvAsm1x1U,0.0264,0,miopenConvolutionFwdAlgoDirect,<unused>;miopenConvolutionFwdAlgoGEMM:gemm,0.038239,0,rocBlas,<unused>;miopenConvolutionFwdAlgoWinograd:ConvBinWinogradRxSf2x3g1,0.192958,0,miopenConvolutionFwdAlgoWinograd,<unused>
896-7-7-1x1-128-7-7-1-0x0-1x1-1x1-0-NCHW-FP32-F=miopenConvolutionFwdAlgoDirect:ConvAsm1x1U,0.02848,0,miopenConvolutionFwdAlgoDirect,<unused>;miopenConvolutionFwdAlgoGEMM:gemm,0.04064,0,rocBlas,<unused>;miopenConvolutionFwdAlgoWinograd:ConvBinWinogradRxSf2x3g1,0.199038,0,miopenConvolutionFwdAlgoWinograd,<unused>
928-7-7-1x1-128-7-7-1-0x0-1x1-1x1-0-NCHW-FP32-F=miopenConvolutionFwdAlgoDirect:ConvAsm1x1U,0.02816,0,miopenConvolutionFwdAlgoDirect,<unused>;miopenConvolutionFwdAlgoGEMM:gemm,0.0416,0,rocBlas,<unused>;miopenConvolutionFwdAlgoWinograd:ConvBinWinogradRxSf2x3g1,0.205438,0,miopenConvolutionFwdAlgoWinograd,<unused>
960-7-7-1x1-128-7-7-1-0x0-1x1-1x1-0-NCHW-FP32-F=miopenConvolutionFwdAlgoDirect:ConvAsm1x1U,0.0304,0,miopenConvolutionFwdAlgoDirect,<unused>;miopenConvolutionFwdAlgoGEMM:gemm,0.04464,0,rocBlas,<unused>;miopenConvolutionFwdAlgoWinograd:ConvBinWinogradRxSf2x3g1,0.211837,0,miopenConvolutionFwdAlgoWinograd,<unused>
992-7-7-1x1-128-7-7-1-0x0-1x1-1x1-0-NCHW-FP32-F=miopenConvolutionFwdAlgoDirect:ConvOclDirectFwd1x1,0.03008,0,miopenConvolutionFwdAlgoDirect,<unused>;miopenConvolutionFwdAlgoGEMM:gemm,0.04864,0,rocBlas,<unused>;miopenConvolutionFwdAlgoWinograd:ConvBinWinogradRxSf2x3g1,0.218398,0,miopenConvolutionFwdAlgoWinograd,<unused>
3-224-224-3x3-64-111-111-1-0x0-2x2-1x1-0-NCHW-FP32-F=miopenConvolutionFwdAlgoDirect:ConvOclDirectFwdGen,0.092323,0,miopenConvolutionFwdAlgoDirect,<unused>;miopenConvolutionFwdAlgoGEMM:gemm,0.038722,1330668,rocBlas,<unused>;miopenConvolutionFwdAlgoWinograd:ConvBinWinogradRxSf2x3g1,0.046562,0,miopenConvolutionFwdAlgoWinograd,<unused>
64-55-55-1x1-16-55-55-1-0x0-1x1-1x1-0-NCHW-FP32-F=miopenConvolutionFwdAlgoDirect:ConvAsm1x1U,0.0088,0,miopenConvolutionFwdAlgoDirect,<unused>;miopenConvolutionFwdAlgoGEMM:gemm,0.036001,0,rocBlas,<unused>;miopenConvolutionFwdAlgoWinograd:ConvBinWinogradRxS,0.036161,0,miopenConvolutionFwdAlgoWinograd,<unused>
16-55-55-1x1-64-55-55-1-0x0-1x1-1x1-0-NCHW-FP32-F=miopenConvolutionFwdAlgoDirect:ConvOclDirectFwd1x1,0.00864,0,miopenConvolutionFwdAlgoDirect,<unused>;miopenConvolutionFwdAlgoGEMM:gemm,0.033122,0,rocBlas,<unused>;miopenConvolutionFwdAlgoWinograd:ConvBinWinogradRxSf2x3g1,0.028801,0,miopenConvolutionFwdAlgoWinograd,<unused>
16-55-55-3x3-64-55-55-1-1x1-1x1-1x1-0-NCHW-FP32-F=miopenConvolutionFwdAlgoDirect:ConvAsm3x3U,0.01376,0,miopenConvolutionFwdAlgoDirect,<unused>;miopenConvolutionFwdAlgoGEMM:gemm,0.057922,1742400,rocBlas,<unused>;miopenConvolutionFwdAlgoWinograd:ConvBinWinogradRxSf2x3g1,0.026401,0,miopenConvolutionFwdAlgoWinograd,<unused>
128-55-55-1x1-16-55-55-1-0x0-1x1-1x1-0-NCHW-FP32-F=miopenConvolutionFwdAlgoDirect:ConvAsm1x1U,0.01152,0,miopenConvolutionFwdAlgoDirect,<unused>;miopenConvolutionFwdAlgoGEMM:gemm,0.048642,0,rocBlas,<unused>;miopenConvolutionFwdAlgoWinograd:ConvBinWinogradRxS,0.048322,0,miopenConvolutionFwdAlgoWinograd,<unused>
128-27-27-1x1-32-27-27-1-0x0-1x1-1x1-0-NCHW-FP32-F=miopenConvolutionFwdAlgoDirect:ConvAsm1x1U,0.00944,0,miopenConvolutionFwdAlgoDirect,<unused>;miopenConvolutionFwdAlgoGEMM:gemm,0.065442,0,rocBlas,<unused>;miopenConvolutionFwdAlgoWinograd:ConvBinWinogradRxS,0.048162,0,miopenConvolutionFwdAlgoWinograd,<unused>
32-27-27-1x1-128-27-27-1-0x0-1x1-1x1-0-NCHW-FP32-F=miopenConvolutionFwdAlgoDirect:ConvAsm1x1U,0.00768,0,miopenConvolutionFwdAlgoDirect,<unused>;miopenConvolutionFwdAlgoGEMM:gemm,0.027361,0,rocBlas,<unused>;miopenConvolutionFwdAlgoWinograd:ConvBinWinogradRxS,0.028961,0,miopenConvolutionFwdAlgoWinograd,<unused>
32-27-27-3x3-128-27-27-1-1x1-1x1-1x1-0-NCHW-FP32-F=miopenConvolutionFwdAlgoWinograd:ConvBinWinograd3x3U,0.028801,0,miopenConvolutionFwdAlgoWinograd,<unused>
256-27-27-1x1-32-27-27-1-0x0-1x1-1x1-0-NCHW-FP32-F=miopenConvolutionFwdAlgoDirect:ConvAsm1x1U,0.01248,0,miopenConvolutionFwdAlgoDirect,<unused>;miopenConvolutionFwdAlgoGEMM:gemm,0.043042,0,rocBlas,<unused>;miopenConvolutionFwdAlgoWinograd:ConvBinWinogradRxSf2x3g1,0.070403,0,miopenConvolutionFwdAlgoWinograd,<unused>
256-13-13-1x1-48-13-13-1-0x0-1x1-1x1-0-NCHW-FP32-F=miopenConvolutionFwdAlgoDirect:ConvAsm1x1U,0.012481,0,miopenConvolutionFwdAlgoDirect,<unused>;miopenConvolutionFwdAlgoGEMM:gemm,0.026721,0,rocBlas,<unused>;miopenConvolutionFwdAlgoWinograd:ConvBinWinogradRxSf2x3g1,0.075203,0,miopenConvolutionFwdAlgoWinograd,<unused>
48-13-13-1x1-192-13-13-1-0x0-1x1-1x1-0-NCHW-FP32-F=miopenConvolutionFwdAlgoDirect:ConvAsm1x1U,0.008321,0,miopenConvolutionFwdAlgoDirect,<unused>;miopenConvolutionFwdAlgoGEMM:gemm,0.038881,0,rocBlas,<unused>;miopenConvolutionFwdAlgoWinograd:ConvBinWinogradRxS,0.033762,0,miopenConvolutionFwdAlgoWinograd,<unused>
48-13-13-3x3-192-13-13-1-1x1-1x1-1x1-0-NCHW-FP32-F=miopenConvolutionFwdAlgoWinograd:ConvBinWinograd3x3U,0.031521,0,miopenConvolutionFwdAlgoWinograd,<unused>
384-13-13-1x1-48-13-13-1-0x0-1x1-1x1-0-NCHW-FP32-F=miopenConvolutionFwdAlgoDirect:ConvAsm1x1U,0.01568,0,miopenConvolutionFwdAlgoDirect,<unused>;miopenConvolutionFwdAlgoGEMM:gemm,0.036801,0,rocBlas,<unused>;miopenConvolutionFwdAlgoWinograd:ConvBinWinogradRxSf2x3g1,0.093604,0,miopenConvolutionFwdAlgoWinograd,<unused>
384-13-13-1x1-64-13-13-1-0x0-1x1-1x1-0-NCHW-FP32-F=miopenConvolutionFwdAlgoDirect:ConvAsm1x1U,0.016,0,miopenConvolutionFwdAlgoDirect,<unused>;miopenConvolutionFwdAlgoGEMM:gemm,0.040962,0,rocBlas,<unused>;miopenConvolutionFwdAlgoWinograd:ConvBinWinogradRxSf2x3g1,0.099204,0,miopenConvolutionFwdAlgoWinograd,<unused>
64-13-13-1x1-256-13-13-1-0x0-1x1-1x1-0-NCHW-FP32-F=miopenConvolutionFwdAlgoDirect:ConvAsm1x1U,0.00816,0,miopenConvolutionFwdAlgoDirect,<unused>;miopenConvolutionFwdAlgoGEMM:gemm,0.033762,0,rocBlas,<unused>;miopenConvolutionFwdAlgoWinograd:ConvBinWinogradRxS,0.037281,0,miopenConvolutionFwdAlgoWinograd,<unused>
64-13-13-3x3-256-13-13-1-1x1-1x1-1x1-0-NCHW-FP32-F=miopenConvolutionFwdAlgoWinograd:ConvBinWinograd3x3U,0.034241,0,miopenConvolutionFwdAlgoWinograd,<unused>
512-13-13-1x1-64-13-13-1-0x0-1x1-1x1-0-NCHW-FP32-F=miopenConvolutionFwdAlgoDirect:ConvAsm1x1U,0.01872,0,miopenConvolutionFwdAlgoDirect,<unused>;miopenConvolutionFwdAlgoGEMM:gemm,0.041602,0,rocBlas,<unused>;miopenConvolutionFwdAlgoWinograd:ConvBinWinogradRxSf2x3g1,0.120965,0,miopenConvolutionFwdAlgoWinograd,<unused>
512-13-13-1x1-1000-13-13-1-0x0-1x1-1x1-0-NCHW-FP32-F=miopenConvolutionFwdAlgoDirect:ConvAsm1x1U,0.059362,0,miopenConvolutionFwdAlgoDirect,<unused>;miopenConvolutionFwdAlgoGEMM:gemm,0.059842,0,rocBlas,<unused>;miopenConvolutionFwdAlgoWinograd:ConvBinWinogradRxSf3x2,0.136325,0,miopenConvolutionFwdAlgoWinograd,<unused>
3-224-224-3x3-64-224-224-1-1x1-1x1-1x1-0-NCHW-FP32-F=miopenConvolutionFwdAlgoDirect:ConvOclDirectFwd,0.100481,0,miopenConvolutionFwdAlgoDirect,<unused>;miopenConvolutionFwdAlgoGEMM:gemm,0.06992,5419008,rocBlas,<unused>;miopenConvolutionFwdAlgoWinograd:ConvBinWinogradRxSf2x3g1,0.064961,0,miopenConvolutionFwdAlgoWinograd,<unused>
64-224-224-3x3-64-224-224-1-1x1-1x1-1x1-0-NCHW-FP32-F=miopenConvolutionFwdAlgoWinograd:ConvBinWinograd3x3U,0.225602,0,miopenConvolutionFwdAlgoWinograd,<unused>
64-112-112-3x3-128-112-112-1-1x1-1x1-1x1-0-NCHW-FP32-F=miopenConvolutionFwdAlgoWinograd:ConvBinWinograd3x3U,0.120961,0,miopenConvolutionFwdAlgoWinograd,<unused>
128-112-112-3x3-128-112-112-1-1x1-1x1-1x1-0-NCHW-FP32-F=miopenConvolutionFwdAlgoWinograd:ConvBinWinograd3x3U,0.209443,0,miopenConvolutionFwdAlgoWinograd,<unused>
128-56-56-3x3-256-56-56-1-1x1-1x1-1x1-0-NCHW-FP32-F=miopenConvolutionFwdAlgoWinograd:ConvBinWinograd3x3U,0.129441,0,miopenConvolutionFwdAlgoWinograd,<unused>
256-56-56-3x3-256-56-56-1-1x1-1x1-1x1-0-NCHW-FP32-F=miopenConvolutionFwdAlgoWinograd:ConvBinWinograd3x3U,0.230882,0,miopenConvolutionFwdAlgoWinograd,<unused>
256-28-28-3x3-512-28-28-1-1x1-1x1-1x1-0-NCHW-FP32-F=miopenConvolutionFwdAlgoWinograd:ConvBinWinograd3x3U,0.125761,0,miopenConvolutionFwdAlgoWinograd,<unused>
512-28-28-3x3-512-28-28-1-1x1-1x1-1x1-0-NCHW-FP32-F=miopenConvolutionFwdAlgoWinograd:ConvBinWinogradRxSf2x3g1,0.231523,0,miopenConvolutionFwdAlgoWinograd,<unused>
512-14-14-3x3-512-14-14-1-1x1-1x1-1x1-0-NCHW-FP32-F=miopenConvolutionFwdAlgoWinograd:ConvBinWinogradRxSf2x3g1,0.130881,0,miopenConvolutionFwdAlgoWinograd,<unused>
64-56-56-1x1-288-56-56-1-0x0-1x1-1x1-0-NCHW-FP32-F=miopenConvolutionFwdAlgoImplicitGEMM:ConvHipImplicitGemmV4R4Fwd,0.028159,0,miopenConvolutionFwdAlgoImplicitGEMM,<unused>;miopenConvolutionFwdAlgoDirect:ConvAsm1x1U,0.023359,0,miopenConvolutionFwdAlgoDirect,<unused>;miopenConvolutionFwdAlgoGEMM:gemm,0.044479,0,rocBlas,<unused>;miopenConvolutionFwdAlgoWinograd:ConvBinWinogradRxSf3x2,0.063998,0,miopenConvolutionFwdAlgoWinograd,<unused>
64-56-56-1x1-96-56-56-1-0x0-1x1-1x1-0-NCHW-FP32-F=miopenConvolutionFwdAlgoImplicitGEMM:ConvHipImplicitGemmV4R4Fwd,0.01616,0,miopenConvolutionFwdAlgoImplicitGEMM,<unused>;miopenConvolutionFwdAlgoDirect:ConvAsm1x1U,0.01472,0,miopenConvolutionFwdAlgoDirect,<unused>;miopenConvolutionFwdAlgoGEMM:gemm,0.036639,0,rocBlas,<unused>;miopenConvolutionFwdAlgoWinograd:ConvBinWinogradRxSf3x2,0.043359,0,miopenConvolutionFwdAlgoWinograd,<unused>
96-56-56-3x3-96-56-56-1-1x1-1x1-1x1-0-NCHW-FP32-F_g32=miopenConvolutionFwdAlgoDirect:ConvOclDirectFwd,0.01728,0,miopenConvolutionFwdAlgoDirect,<unused>;miopenConvolutionFwdAlgoGEMM:gemm,0.115357,10838016,rocBlas,<unused>;miopenConvolutionFwdAlgoWinograd:ConvBinWinogradRxSf2x3,0.080158,0,miopenConvolutionFwdAlgoWinograd,<unused>
96-56-56-1x1-272-56-56-1-0x0-1x1-1x1-0-NCHW-FP32-F=miopenConvolutionFwdAlgoDirect:ConvOclDirectFwd1x1,0.031679,0,miopenConvolutionFwdAlgoDirect,<unused>;miopenConvolutionFwdAlgoGEMM:gemm,0.050879,0,rocBlas,<unused>;miopenConvolutionFwdAlgoWinograd:ConvBinWinogradRxSf3x2,0.076478,0,miopenConvolutionFwdAlgoWinograd,<unused>
304-56-56-1x1-96-56-56-1-0x0-1x1-1x1-0-NCHW-FP32-F=miopenConvolutionFwdAlgoImplicitGEMM:ConvHipImplicitGemmV4R4Fwd,0.047839,0,miopenConvolutionFwdAlgoImplicitGEMM,<unused>;miopenConvolutionFwdAlgoDirect:ConvAsm1x1U,0.034719,0,miopenConvolutionFwdAlgoDirect,<unused>;miopenConvolutionFwdAlgoGEMM:gemm,0.072478,0,rocBlas,<unused>;miopenConvolutionFwdAlgoWinograd:ConvBinWinogradRxSf3x2,0.093277,0,miopenConvolutionFwdAlgoWinograd,<unused>
320-56-56-1x1-96-56-56-1-0x0-1x1-1x1-0-NCHW-FP32-F=miopenConvolutionFwdAlgoImplicitGEMM:ConvHipImplicitGemmV4R4Fwd,0.049439,0,miopenConvolutionFwdAlgoImplicitGEMM,<unused>;miopenConvolutionFwdAlgoDirect:ConvAsm1x1U,0.036959,0,miopenConvolutionFwdAlgoDirect,<unused>;miopenConvolutionFwdAlgoGEMM:gemm,0.074718,0,rocBlas,<unused>;miopenConvolutionFwdAlgoWinograd:ConvBinWinogradRxSf3x2,0.095517,0,miopenConvolutionFwdAlgoWinograd,<unused>
336-56-56-1x1-576-28-28-1-0x0-2x2-1x1-0-NCHW-FP32-F=miopenConvolutionFwdAlgoDirect:ConvAsm1x1U,0.066237,1053696,miopenConvolutionFwdAlgoDirect,<unused>;miopenConvolutionFwdAlgoGEMM:gemm,0.082877,2860032,rocBlas,<unused>;miopenConvolutionFwdAlgoWinograd:ConvBinWinogradRxSf2x3g1,0.445427,0,miopenConvolutionFwdAlgoWinograd,<unused>
336-56-56-1x1-192-56-56-1-0x0-1x1-1x1-0-NCHW-FP32-F=miopenConvolutionFwdAlgoImplicitGEMM:ConvHipImplicitGemmV4R4Fwd,0.067838,0,miopenConvolutionFwdAlgoImplicitGEMM,<unused>;miopenConvolutionFwdAlgoDirect:ConvAsm1x1U,0.066718,0,miopenConvolutionFwdAlgoDirect,<unused>;miopenConvolutionFwdAlgoGEMM:gemm,0.103357,0,rocBlas,<unused>;miopenConvolutionFwdAlgoWinograd:ConvBinWinogradRxSf3x2,0.172955,0,miopenConvolutionFwdAlgoWinograd,<unused>
192-56-56-3x3-192-28-28-1-1x1-2x2-1x1-0-NCHW-FP32-F_g32=miopenConvolutionFwdAlgoDirect:ConvOclDirectFwd,0.041759,0,miopenConvolutionFwdAlgoDirect,<unused>;miopenConvolutionFwdAlgoGEMM:gemm,0.073438,5419008,rocBlas,<unused>;miopenConvolutionFwdAlgoWinograd:ConvBinWinogradRxSf2x3,0.077278,0,miopenConvolutionFwdAlgoWinograd,<unused>
192-28-28-1x1-544-28-28-1-0x0-1x1-1x1-0-NCHW-FP32-F=miopenConvolutionFwdAlgoDirect:ConvAsm1x1U,0.032,0,miopenConvolutionFwdAlgoDirect,<unused>;miopenConvolutionFwdAlgoGEMM:gemm,0.044479,0,rocBlas,<unused>;miopenConvolutionFwdAlgoWinograd:ConvBinWinogradRxS,0.102077,0,miopenConvolutionFwdAlgoWinograd,<unused>
608-28-28-1x1-192-28-28-1-0x0-1x1-1x1-0-NCHW-FP32-F=miopenConvolutionFwdAlgoDirect:ConvOclDirectFwd1x1,0.045599,0,miopenConvolutionFwdAlgoDirect,<unused>;miopenConvolutionFwdAlgoGEMM:gemm,0.128316,0,rocBlas,<unused>;miopenConvolutionFwdAlgoWinograd:ConvBinWinogradRxSf2x3g1,0.142716,0,miopenConvolutionFwdAlgoWinograd,<unused>
192-28-28-3x3-192-28-28-1-1x1-1x1-1x1-0-NCHW-FP32-F_g32=miopenConvolutionFwdAlgoDirect:ConvOclDirectFwd,0.023199,0,miopenConvolutionFwdAlgoDirect,<unused>;miopenConvolutionFwdAlgoGEMM:gemm,0.065439,5419008,rocBlas,<unused>;miopenConvolutionFwdAlgoWinograd:ConvBinWinogradRxSf2x3,0.045599,0,miopenConvolutionFwdAlgoWinograd,<unused>
640-28-28-1x1-192-28-28-1-0x0-1x1-1x1-0-NCHW-FP32-F=miopenConvolutionFwdAlgoDirect:ConvAsm1x1U,0.046079,0,miopenConvolutionFwdAlgoDirect,<unused>;miopenConvolutionFwdAlgoGEMM:gemm,0.067198,0,rocBlas,<unused>;miopenConvolutionFwdAlgoWinograd:ConvBinWinogradRxSf2x3g1,0.148955,0,miopenConvolutionFwdAlgoWinograd,<unused>
672-28-28-1x1-192-28-28-1-0x0-1x1-1x1-0-NCHW-FP32-F=miopenConvolutionFwdAlgoDirect:ConvOclDirectFwd1x1,0.053438,0,miopenConvolutionFwdAlgoDirect,<unused>;miopenConvolutionFwdAlgoGEMM:gemm,0.058079,0,rocBlas,<unused>;miopenConvolutionFwdAlgoWinograd:ConvBinWinogradRxS,0.157916,0,miopenConvolutionFwdAlgoWinograd,<unused>
704-28-28-1x1-1072-14-14-1-0x0-2x2-1x1-0-NCHW-FP32-F=miopenConvolutionFwdAlgoDirect:ConvAsm1x1U,0.087516,551936,miopenConvolutionFwdAlgoDirect,<unused>;miopenConvolutionFwdAlgoGEMM:gemm,0.078078,1392384,rocBlas,<unused>;miopenConvolutionFwdAlgoWinograd:ConvBinWinogradRxSf2x3g1,0.609423,0,miopenConvolutionFwdAlgoWinograd,<unused>
704-28-28-1x1-384-28-28-1-0x0-1x1-1x1-0-NCHW-FP32-F=miopenConvolutionFwdAlgoDirect:ConvAsm1x1U,0.089277,0,miopenConvolutionFwdAlgoDirect,<unused>;miopenConvolutionFwdAlgoGEMM:gemm,0.071838,0,rocBlas,<unused>;miopenConvolutionFwdAlgoWinograd:ConvBinWinogradRxSf3x2,0.176315,0,miopenConvolutionFwdAlgoWinograd,<unused>
384-28-28-3x3-384-14-14-1-1x1-2x2-1x1-0-NCHW-FP32-F_g32=miopenConvolutionFwdAlgoDirect:ConvOclDirectFwd,0.048799,0,miopenConvolutionFwdAlgoDirect,<unused>;miopenConvolutionFwdAlgoGEMM:gemm,0.061918,2709504,rocBlas,<unused>;miopenConvolutionFwdAlgoWinograd:ConvBinWinogradRxSf2x3,0.046719,0,miopenConvolutionFwdAlgoWinograd,<unused>
64-56-56-1x1-512-56-56-1-0x0-1x1-1x1-0-NCHW-FP32-F=miopenConvolutionFwdAlgoImplicitGEMM:ConvHipImplicitGemmV4R4Fwd,0.032958,0,miopenConvolutionFwdAlgoImplicitGEMM,<unused>;miopenConvolutionFwdAlgoDirect:ConvAsm1x1U,0.035517,0,miopenConvolutionFwdAlgoDirect,<unused>;miopenConvolutionFwdAlgoGEMM:gemm,0.067835,0,rocBlas,<unused>;miopenConvolutionFwdAlgoWinograd:ConvBinWinogradRxSf3x2,0.097593,0,miopenConvolutionFwdAlgoWinograd,<unused>
256-56-56-3x3-256-56-56-1-1x1-1x1-1x1-0-NCHW-FP32-F_g64=miopenConvolutionFwdAlgoDirect:ConvAsm3x3U,0.015839,0,miopenConvolutionFwdAlgoDirect,<unused>;miopenConvolutionFwdAlgoGEMM:gemm,0.218224,28901376,rocBlas,<unused>;miopenConvolutionFwdAlgoWinograd:ConvBinWinogradRxSf2x3,0.155028,0,miopenConvolutionFwdAlgoWinograd,<unused>
256-56-56-1x1-256-56-56-1-0x0-1x1-1x1-0-NCHW-FP32-F=miopenConvolutionFwdAlgoImplicitGEMM:ConvHipImplicitGemmV4R4Fwd,0.066395,0,miopenConvolutionFwdAlgoImplicitGEMM,<unused>;miopenConvolutionFwdAlgoDirect:ConvOclDirectFwd1x1,0.071035,0,miopenConvolutionFwdAlgoDirect,<unused>;miopenConvolutionFwdAlgoGEMM:gemm,0.097113,0,rocBlas,<unused>;miopenConvolutionFwdAlgoWinograd:ConvBinWinogradRxSf3x2,0.141909,0,miopenConvolutionFwdAlgoWinograd,<unused>
256-56-56-1x1-512-56-56-1-0x0-1x1-1x1-0-NCHW-FP32-F=miopenConvolutionFwdAlgoImplicitGEMM:ConvHipImplicitGemmV4R4Fwd,0.106712,0,miopenConvolutionFwdAlgoImplicitGEMM,<unused>;miopenConvolutionFwdAlgoDirect:ConvAsm1x1U,0.152949,0,miopenConvolutionFwdAlgoDirect,<unused>;miopenConvolutionFwdAlgoGEMM:gemm,0.13231,0,rocBlas,<unused>;miopenConvolutionFwdAlgoWinograd:ConvBinWinogradRxSf3x2,0.255821,0,miopenConvolutionFwdAlgoWinograd,<unused>
512-56-56-3x3-512-28-28-1-1x1-2x2-1x1-0-NCHW-FP32-F_g64=miopenConvolutionFwdAlgoDirect:ConvOclDirectFwd,0.183986,0,miopenConvolutionFwdAlgoDirect,<unused>;miopenConvolutionFwdAlgoGEMM:gemm,0.132629,14450688,rocBlas,<unused>;miopenConvolutionFwdAlgoWinograd:ConvBinWinogradRxSf2x3,0.155348,0,miopenConvolutionFwdAlgoWinograd,<unused>
768-28-28-1x1-512-28-28-1-0x0-1x1-1x1-0-NCHW-FP32-F=miopenConvolutionFwdAlgoDirect:ConvAsm1x1U,0.110392,0,miopenConvolutionFwdAlgoDirect,<unused>;miopenConvolutionFwdAlgoGEMM:gemm,0.102872,0,rocBlas,<unused>;miopenConvolutionFwdAlgoWinograd:ConvBinWinogradRxSf2x3g1,0.326535,0,miopenConvolutionFwdAlgoWinograd,<unused>
512-28-28-1x1-512-28-28-1-0x0-1x1-1x1-0-NCHW-FP32-F=miopenConvolutionFwdAlgoDirect:ConvAsm1x1U,0.075194,0,miopenConvolutionFwdAlgoDirect,<unused>;miopenConvolutionFwdAlgoGEMM:gemm,0.072475,0,rocBlas,<unused>;miopenConvolutionFwdAlgoWinograd:ConvBinWinogradRxSf2x3g1,0.229422,0,miopenConvolutionFwdAlgoWinograd,<unused>
512-28-28-3x3-512-28-28-1-1x1-1x1-1x1-0-NCHW-FP32-F_g64=miopenConvolutionFwdAlgoDirect:ConvAsm3x3U,0.021279,0,miopenConvolutionFwdAlgoDirect,<unused>;miopenConvolutionFwdAlgoGEMM:gemm,0.113431,14450688,rocBlas,<unused>;miopenConvolutionFwdAlgoWinograd:ConvBinWinogradRxSf2x3,0.082394,0,miopenConvolutionFwdAlgoWinograd,<unused>
512-28-28-1x1-1024-28-28-1-0x0-1x1-1x1-0-NCHW-FP32-F=miopenConvolutionFwdAlgoDirect:ConvAsm1x1U,0.154708,0,miopenConvolutionFwdAlgoDirect,<unused>;miopenConvolutionFwdAlgoGEMM:gemm,0.13359,0,rocBlas,<unused>;miopenConvolutionFwdAlgoWinograd:ConvBinWinogradRxSf3x2,0.355653,0,miopenConvolutionFwdAlgoWinograd,<unused>
1024-28-28-3x3-1024-14-14-1-1x1-2x2-1x1-0-NCHW-FP32-F_g64=miopenConvolutionFwdAlgoDirect:ConvOclDirectFwd,0.089433,0,miopenConvolutionFwdAlgoDirect,<unused>;miopenConvolutionFwdAlgoGEMM:gemm,0.097112,7225344,rocBlas,<unused>;miopenConvolutionFwdAlgoWinograd:ConvBinWinogradRxSf2x3,0.086074,0,miopenConvolutionFwdAlgoWinograd,<unused>
1536-14-14-1x1-1024-14-14-1-0x0-1x1-1x1-0-NCHW-FP32-F=miopenConvolutionFwdAlgoDirect:ConvAsm1x1U,0.164948,0,miopenConvolutionFwdAlgoDirect,<unused>;miopenConvolutionFwdAlgoGEMM:gemm,0.183346,0,rocBlas,<unused>;miopenConvolutionFwdAlgoWinograd:ConvBinWinogradRxSf3x2,0.348134,0,miopenConvolutionFwdAlgoWinograd,<unused>
1024-14-14-1x1-1024-14-14-1-0x0-1x1-1x1-0-NCHW-FP32-F=miopenConvolutionFwdAlgoDirect:ConvAsm1x1U,0.120631,0,miopenConvolutionFwdAlgoDirect,<unused>;miopenConvolutionFwdAlgoGEMM:gemm,0.120791,0,rocBlas,<unused>;miopenConvolutionFwdAlgoWinograd:ConvBinWinogradRxSf3x2,0.243501,0,miopenConvolutionFwdAlgoWinograd,<unused>
1024-14-14-3x3-1024-14-14-1-1x1-1x1-1x1-0-NCHW-FP32-F_g64=miopenConvolutionFwdAlgoDirect:ConvAsm3x3U,0.034878,0,miopenConvolutionFwdAlgoDirect,<unused>;miopenConvolutionFwdAlgoGEMM:gemm,0.085433,7225344,rocBlas,<unused>;miopenConvolutionFwdAlgoWinograd:ConvBinWinogradRxSf2x3,0.049437,0,miopenConvolutionFwdAlgoWinograd,<unused>
1024-14-14-1x1-2048-14-14-1-0x0-1x1-1x1-0-NCHW-FP32-F=miopenConvolutionFwdAlgoDirect:ConvAsm1x1U,0.210704,0,miopenConvolutionFwdAlgoDirect,<unused>;miopenConvolutionFwdAlgoGEMM:gemm,0.214544,0,rocBlas,<unused>;miopenConvolutionFwdAlgoWinograd:ConvBinWinogradRxSf3x2,0.462205,0,miopenConvolutionFwdAlgoWinograd,<unused>
2048-14-14-3x3-2048-7-7-1-1x1-2x2-1x1-0-NCHW-FP32-F_g64=miopenConvolutionFwdAlgoDirect:ConvOclDirectFwd,0.109432,0,miopenConvolutionFwdAlgoDirect,<unused>;miopenConvolutionFwdAlgoGEMM:gemm,0.104471,3612672,rocBlas,<unused>;miopenConvolutionFwdAlgoWinograd:ConvBinWinogradRxSf2x3,0.088314,0,miopenConvolutionFwdAlgoWinograd,<unused>
3072-7-7-1x1-2048-7-7-1-0x0-1x1-1x1-0-NCHW-FP32-F=miopenConvolutionFwdAlgoDirect:ConvOclDirectFwd1x1,0.252141,0,miopenConvolutionFwdAlgoDirect,<unused>;miopenConvolutionFwdAlgoGEMM:gemm,0.207344,0,rocBlas,<unused>;miopenConvolutionFwdAlgoWinograd:ConvBinWinogradRxSf2x3g1,1.22503,0,miopenConvolutionFwdAlgoWinograd,<unused>
2048-7-7-1x1-2048-7-7-1-0x0-1x1-1x1-0-NCHW-FP32-F=miopenConvolutionFwdAlgoDirect:ConvOclDirectFwd1x1,0.177747,0,miopenConvolutionFwdAlgoDirect,<unused>;miopenConvolutionFwdAlgoGEMM:gemm,0.177106,0,rocBlas,<unused>;miopenConvolutionFwdAlgoWinograd:ConvBinWinogradRxSf2x3g1,0.839777,0,miopenConvolutionFwdAlgoWinograd,<unused>
2048-7-7-3x3-2048-7-7-1-1x1-1x1-1x1-0-NCHW-FP32-F_g64=miopenConvolutionFwdAlgoDirect:ConvAsm3x3U,0.061276,0,miopenConvolutionFwdAlgoDirect,<unused>;miopenConvolutionFwdAlgoGEMM:gemm,0.090393,3612672,rocBlas,<unused>;miopenConvolutionFwdAlgoWinograd:ConvBinWinogradRxSf2x3,0.046397,0,miopenConvolutionFwdAlgoWinograd,<unused>
512-7-7-7x7-4096-1-1-1-0x0-1x1-1x1-0-NCHW-FP32-F=miopenConvolutionFwdAlgoDirect:ConvDirectNaiveConvFwd,40.9993,0,miopenConvolutionFwdAlgoDirect,<unused>;miopenConvolutionFwdAlgoGEMM:gemm,5.49029,100352,rocBlas,<unused>;miopenConvolutionFwdAlgoWinograd:ConvBinWinogradRxSf2x3g1,3.34019,0,miopenConvolutionFwdAlgoWinograd,<unused>
4096-1-1-1x1-4096-1-1-1-0x0-1x1-1x1-0-NCHW-FP32-F=miopenConvolutionFwdAlgoDirect:ConvOclDirectFwd1x1,1.42833,0,miopenConvolutionFwdAlgoDirect,<unused>;miopenConvolutionFwdAlgoGEMM:gemm,0.220642,0,rocBlas,<unused>;miopenConvolutionFwdAlgoWinograd:ConvBinWinogradRxSf2x3g1,2.52499,0,miopenConvolutionFwdAlgoWinograd,<unused>
4096-1-1-1x1-1000-1-1-1-0x0-1x1-1x1-0-NCHW-FP32-F=miopenConvolutionFwdAlgoDirect:ConvOclDirectFwd1x1,0.285283,0,miopenConvolutionFwdAlgoDirect,<unused>;miopenConvolutionFwdAlgoGEMM:gemm,0.109761,0,rocBlas,<unused>;miopenConvolutionFwdAlgoWinograd:ConvBinWinogradRxSf2x3g1,0.847528,0,miopenConvolutionFwdAlgoWinograd,<unused>
3-225-225-3x3-32-112-112-1-0x0-2x2-1x1-0-NCHW-FP32-F=miopenConvolutionFwdAlgoDirect:ConvOclDirectFwd,0.031198,0,miopenConvolutionFwdAlgoDirect,<unused>;miopenConvolutionFwdAlgoGEMM:gemm,0.056635,1354752,rocBlas,<unused>;miopenConvolutionFwdAlgoWinograd:ConvBinWinogradRxSf2x3g1,0.034717,0,miopenConvolutionFwdAlgoWinograd,<unused>
32-112-112-3x3-32-112-112-1-1x1-1x1-1x1-0-NCHW-FP32-F_g32=miopenConvolutionFwdAlgoDirect:ConvOclDirectFwd,0.012799,0,miopenConvolutionFwdAlgoDirect,<unused>;miopenConvolutionFwdAlgoGEMM:gemm,0.203665,14450688,rocBlas,<unused>;miopenConvolutionFwdAlgoWinograd:ConvBinWinogradRxSf2x3,0.181107,0,miopenConvolutionFwdAlgoWinograd,<unused>
32-112-112-1x1-64-112-112-1-0x0-1x1-1x1-0-NCHW-FP32-F=miopenConvolutionFwdAlgoImplicitGEMM:ConvHipImplicitGemmV4R4Fwd,0.017919,0,miopenConvolutionFwdAlgoImplicitGEMM,<unused>;miopenConvolutionFwdAlgoDirect:ConvOclDirectFwd1x1,0.014879,0,miopenConvolutionFwdAlgoDirect,<unused>;miopenConvolutionFwdAlgoGEMM:gemm,0.032158,0,rocBlas,<unused>;miopenConvolutionFwdAlgoWinograd:ConvBinWinogradRxSf3x2,0.049917,0,miopenConvolutionFwdAlgoWinograd,<unused>
64-113-113-3x3-64-56-56-1-0x0-2x2-1x1-0-NCHW-FP32-F_g64=miopenConvolutionFwdAlgoDirect:ConvOclDirectFwd,0.025758,0,miopenConvolutionFwdAlgoDirect,<unused>;miopenConvolutionFwdAlgoGEMM:gemm,0.12927,7225344,rocBlas,<unused>;miopenConvolutionFwdAlgoWinograd:ConvBinWinogradRxSf2x3,0.173587,0,miopenConvolutionFwdAlgoWinograd,<unused>
128-56-56-3x3-128-56-56-1-1x1-1x1-1x1-0-NCHW-FP32-F_g128=miopenConvolutionFwdAlgoDirect:ConvOclDirectFwd,0.013599,0,miopenConvolutionFwdAlgoDirect,<unused>;miopenConvolutionFwdAlgoGEMM:gemm,0.211343,14450688,rocBlas,<unused>;miopenConvolutionFwdAlgoWinograd:ConvBinWinogradRxSf2x3,0.215824,0,miopenConvolutionFwdAlgoWinograd,<unused>
128-57-57-3x3-128-28-28-1-0x0-2x2-1x1-0-NCHW-FP32-F_g128=miopenConvolutionFwdAlgoDirect:ConvOclDirectFwd,0.014559,0,miopenConvolutionFwdAlgoDirect,<unused>;miopenConvolutionFwdAlgoGEMM:gemm,0.068955,3612672,rocBlas,<unused>;miopenConvolutionFwdAlgoWinograd:ConvBinWinogradRxSf2x3,0.115672,0,miopenConvolutionFwdAlgoWinograd,<unused>
128-28-28-1x1-256-28-28-1-0x0-1x1-1x1-0-NCHW-FP32-F=miopenConvolutionFwdAlgoDirect:ConvAsm1x1U,0.015839,0,miopenConvolutionFwdAlgoDirect,<unused>;miopenConvolutionFwdAlgoGEMM:gemm,0.033118,0,rocBlas,<unused>;miopenConvolutionFwdAlgoWinograd:ConvBinWinogradRxS,0.048317,0,miopenConvolutionFwdAlgoWinograd,<unused>
256-28-28-3x3-256-28-28-1-1x1-1x1-1x1-0-NCHW-FP32-F_g256=miopenConvolutionFwdAlgoDirect:ConvOclDirectFwd,0.00896,0,miopenConvolutionFwdAlgoDirect,<unused>;miopenConvolutionFwdAlgoGEMM:gemm,0.100312,7225344,rocBlas,<unused>;miopenConvolutionFwdAlgoWinograd:ConvBinWinogradRxSf2x3,0.13823,0,miopenConvolutionFwdAlgoWinograd,<unused>
256-28-28-1x1-256-28-28-1-0x0-1x1-1x1-0-NCHW-FP32-F=miopenConvolutionFwdAlgoDirect:ConvAsm1x1U,0.024798,0,miopenConvolutionFwdAlgoDirect,<unused>;miopenConvolutionFwdAlgoGEMM:gemm,0.044797,0,rocBlas,<unused>;miopenConvolutionFwdAlgoWinograd:ConvBinWinogradRxS,0.073594,0,miopenConvolutionFwdAlgoWinograd,<unused>
256-29-29-3x3-256-14-14-1-0x0-2x2-1x1-0-NCHW-FP32-F_g256=miopenConvolutionFwdAlgoDirect:ConvDirectNaiveConvFwd,0.011359,0,miopenConvolutionFwdAlgoDirect,<unused>;miopenConvolutionFwdAlgoGEMM:gemm,0.059995,1806336,rocBlas,<unused>;miopenConvolutionFwdAlgoWinograd:ConvBinWinogradRxSf2x3,0.090714,0,miopenConvolutionFwdAlgoWinograd,<unused>
256-14-14-1x1-512-14-14-1-0x0-1x1-1x1-0-NCHW-FP32-F=miopenConvolutionFwdAlgoDirect:ConvAsm1x1U,0.019998,0,miopenConvolutionFwdAlgoDirect,<unused>;miopenConvolutionFwdAlgoGEMM:gemm,0.048156,0,rocBlas,<unused>;miopenConvolutionFwdAlgoWinograd:ConvBinWinogradRxS,0.074074,0,miopenConvolutionFwdAlgoWinograd,<unused>
512-14-14-3x3-512-14-14-1-1x1-1x1-1x1-0-NCHW-FP32-F_g512=miopenConvolutionFwdAlgoDirect:ConvOclDirectFwd,0.007999,0,miopenConvolutionFwdAlgoDirect,<unused>;miopenConvolutionFwdAlgoGEMM:gemm,0.076634,3612672,rocBlas,<unused>;miopenConvolutionFwdAlgoWinograd:ConvBinWinogradRxSf2x3,0.130391,0,miopenConvolutionFwdAlgoWinograd,<unused>
512-14-14-1x1-512-14-14-1-0x0-1x1-1x1-0-NCHW-FP32-F=miopenConvolutionFwdAlgoDirect:ConvAsm1x1U,0.037277,0,miopenConvolutionFwdAlgoDirect,<unused>;miopenConvolutionFwdAlgoGEMM:gemm,0.043037,0,rocBlas,<unused>;miopenConvolutionFwdAlgoWinograd:ConvBinWinogradRxSf2x3g1,0.126711,0,miopenConvolutionFwdAlgoWinograd,<unused>
512-15-15-3x3-512-7-7-1-0x0-2x2-1x1-0-NCHW-FP32-F_g512=miopenConvolutionFwdAlgoDirect:ConvOclDirectFwd,0.0104,0,miopenConvolutionFwdAlgoDirect,<unused>;miopenConvolutionFwdAlgoGEMM:gemm,0.040318,903168,rocBlas,<unused>;miopenConvolutionFwdAlgoWinograd:ConvBinWinogradRxSf2x3,0.119671,0,miopenConvolutionFwdAlgoWinograd,<unused>
512-7-7-1x1-1024-7-7-1-0x0-1x1-1x1-0-NCHW-FP32-F=miopenConvolutionFwdAlgoDirect:ConvOclDirectFwd1x1,0.031038,0,miopenConvolutionFwdAlgoDirect,<unused>;miopenConvolutionFwdAlgoGEMM:gemm,0.050236,0,rocBlas,<unused>;miopenConvolutionFwdAlgoWinograd:ConvBinWinogradRxSf2x3g1,0.12559,0,miopenConvolutionFwdAlgoWinograd,<unused>
1024-7-7-3x3-1024-7-7-1-1x1-1x1-1x1-0-NCHW-FP32-F_g1024=miopenConvolutionFwdAlgoDirect:ConvOclDirectFwd,0.0088,0,miopenConvolutionFwdAlgoDirect,<unused>;miopenConvolutionFwdAlgoGEMM:gemm,0.042557,1806336,rocBlas,<unused>;miopenConvolutionFwdAlgoWinograd:ConvBinWinogradRxSf2x3,0.194706,0,miopenConvolutionFwdAlgoWinograd,<unused>
1024-7-7-1x1-1024-7-7-1-0x0-1x1-1x1-0-NCHW-FP32-F=miopenConvolutionFwdAlgoDirect:ConvOclDirectFwd1x1,0.049756,0,miopenConvolutionFwdAlgoDirect,<unused>;miopenConvolutionFwdAlgoGEMM:gemm,0.082074,0,rocBlas,<unused>;miopenConvolutionFwdAlgoWinograd:ConvBinWinogradRxSf2x3g1,0.227664,0,miopenConvolutionFwdAlgoWinograd,<unused>
1024-1-1-1x1-1001-1-1-1-0x0-1x1-1x1-0-NCHW-FP32-F=miopenConvolutionFwdAlgoDirect:ConvAsm1x1U,0.052476,0,miopenConvolutionFwdAlgoDirect,<unused>;miopenConvolutionFwdAlgoGEMM:gemm,0.063995,0,rocBlas,<unused>;miopenConvolutionFwdAlgoWinograd:ConvBinWinogradRxSf2x3g1,0.228463,0,miopenConvolutionFwdAlgoWinograd,<unused>
64-147-147-3x3-96-73-73-1-0x0-2x2-1x1-0-NCHW-FP32-F=miopenConvolutionFwdAlgoDirect:ConvOclDirectFwd,1.26943,0,miopenConvolutionFwdAlgoDirect,<unused>;miopenConvolutionFwdAlgoGEMM:gemm,0.149279,12278016,rocBlas,<unused>;miopenConvolutionFwdAlgoWinograd:ConvBinWinogradRxSf2x3g1,0.191039,0,miopenConvolutionFwdAlgoWinograd,<unused>
160-73-73-1x1-128-73-73-1-0x0-1x1-1x1-0-NCHW-FP32-F=miopenConvolutionFwdAlgoDirect:ConvAsm1x1U,0.03584,0,miopenConvolutionFwdAlgoDirect,<unused>;miopenConvolutionFwdAlgoGEMM:gemm,0.05216,0,rocBlas,<unused>;miopenConvolutionFwdAlgoWinograd:ConvBinWinogradRxSf3x2,0.100319,0,miopenConvolutionFwdAlgoWinograd,<unused>
64-73-73-3x3-96-71-71-1-0x0-1x1-1x1-0-NCHW-FP32-F=miopenConvolutionFwdAlgoDirect:ConvOclDirectFwd,0.359839,0,miopenConvolutionFwdAlgoDirect,<unused>;miopenConvolutionFwdAlgoGEMM:gemm,0.1432,11614464,rocBlas,<unused>;miopenConvolutionFwdAlgoWinograd:ConvBinWinogradRxS,0.06608,0,miopenConvolutionFwdAlgoWinograd,<unused>
64-73-73-1x7-64-73-73-1-0x3-1x1-1x1-0-NCHW-FP32-F=miopenConvolutionFwdAlgoDirect:ConvDirectNaiveConvFwd,2.84095,0,miopenConvolutionFwdAlgoDirect,<unused>;miopenConvolutionFwdAlgoGEMM:gemm,0.0992,9549568,rocBlas,<unused>;miopenConvolutionFwdAlgoWinograd:ConvBinWinogradRxSf3x2,0.083839,0,miopenConvolutionFwdAlgoWinograd,<unused>
64-73-73-7x1-64-73-73-1-3x0-1x1-1x1-0-NCHW-FP32-F=miopenConvolutionFwdAlgoDirect:ConvDirectNaiveConvFwd,3.98463,0,miopenConvolutionFwdAlgoDirect,<unused>;miopenConvolutionFwdAlgoGEMM:gemm,0.10352,9549568,rocBlas,<unused>;miopenConvolutionFwdAlgoWinograd:ConvBinWinogradRxSf3x2,0.08304,0,miopenConvolutionFwdAlgoWinograd,<unused>
192-71-71-3x3-192-35-35-1-0x0-2x2-1x1-0-NCHW-FP32-F=miopenConvolutionFwdAlgoDirect:ConvDirectNaiveConvFwd,3.88975,0,miopenConvolutionFwdAlgoDirect,<unused>;miopenConvolutionFwdAlgoGEMM:gemm,0.15648,8467200,rocBlas,<unused>;miopenConvolutionFwdAlgoWinograd:ConvBinWinogradRxSf2x3g1,0.344959,0,miopenConvolutionFwdAlgoWinograd,<unused>
384-35-35-1x1-128-35-35-1-0x0-1x1-1x1-0-NCHW-FP32-F=miopenConvolutionFwdAlgoDirect:ConvAsm1x1U,0.03056,0,miopenConvolutionFwdAlgoDirect,<unused>;miopenConvolutionFwdAlgoGEMM:gemm,0.08784,0,rocBlas,<unused>;miopenConvolutionFwdAlgoWinograd:ConvBinWinogradRxS,0.10016,0,miopenConvolutionFwdAlgoWinograd,<unused>
384-35-35-1x1-96-35-35-1-0x0-1x1-1x1-0-NCHW-FP32-F=miopenConvolutionFwdAlgoDirect:ConvAsm1x1U,0.02368,0,miopenConvolutionFwdAlgoDirect,<unused>;miopenConvolutionFwdAlgoGEMM:gemm,0.08736,0,rocBlas,<unused>;miopenConvolutionFwdAlgoWinograd:ConvBinWinogradRxSf2x3g1,0.099519,0,miopenConvolutionFwdAlgoWinograd,<unused>
384-35-35-3x3-384-17-17-1-0x0-2x2-1x1-0-NCHW-FP32-F=miopenConvolutionFwdAlgoDirect:ConvOclDirectFwd,3.53792,0,miopenConvolutionFwdAlgoDirect,<unused>;miopenConvolutionFwdAlgoGEMM:gemm,0.1488,3995136,rocBlas,<unused>;miopenConvolutionFwdAlgoWinograd:ConvBinWinogradRxSf2x3g1,0.34512,0,miopenConvolutionFwdAlgoWinograd,<unused>
384-35-35-1x1-192-35-35-1-0x0-1x1-1x1-0-NCHW-FP32-F=miopenConvolutionFwdAlgoDirect:ConvAsm1x1U,0.0384,0,miopenConvolutionFwdAlgoDirect,<unused>;miopenConvolutionFwdAlgoGEMM:gemm,0.0744,0,rocBlas,<unused>;miopenConvolutionFwdAlgoWinograd:ConvBinWinogradRxSf3x2,0.10976,0,miopenConvolutionFwdAlgoWinograd,<unused>
192-35-35-3x3-224-35-35-1-1x1-1x1-1x1-0-NCHW-FP32-F=miopenConvolutionFwdAlgoWinograd:ConvBinWinogradRxS,0.10128,0,miopenConvolutionFwdAlgoWinograd,<unused>
224-35-35-3x3-256-17-17-1-0x0-2x2-1x1-0-NCHW-FP32-F=miopenConvolutionFwdAlgoDirect:ConvOclDirectFwd,1.68288,0,miopenConvolutionFwdAlgoDirect,<unused>;miopenConvolutionFwdAlgoGEMM:gemm,0.103359,2330496,rocBlas,<unused>;miopenConvolutionFwdAlgoWinograd:ConvBinWinogradRxSf2x3g1,0.21088,0,miopenConvolutionFwdAlgoWinograd,<unused>
1024-17-17-1x1-768-17-17-1-0x0-1x1-1x1-0-NCHW-FP32-F=miopenConvolutionFwdAlgoDirect:ConvAsm1x1U,0.09904,0,miopenConvolutionFwdAlgoDirect,<unused>;miopenConvolutionFwdAlgoGEMM:gemm,0.10064,0,rocBlas,<unused>;miopenConvolutionFwdAlgoWinograd:ConvBinWinogradRxSf3x2,0.242719,0,miopenConvolutionFwdAlgoWinograd,<unused>
192-17-17-1x7-224-17-17-1-0x3-1x1-1x1-0-NCHW-FP32-F=miopenConvolutionFwdAlgoDirect:ConvDirectNaiveConvFwd,0.888161,0,miopenConvolutionFwdAlgoDirect,<unused>;miopenConvolutionFwdAlgoGEMM:gemm,0.07872,1553664,rocBlas,<unused>;miopenConvolutionFwdAlgoWinograd:ConvBinWinogradRxS,0.174401,0,miopenConvolutionFwdAlgoWinograd,<unused>
224-17-17-7x1-256-17-17-1-3x0-1x1-1x1-0-NCHW-FP32-F=miopenConvolutionFwdAlgoDirect:ConvDirectNaiveConvFwd,1.37072,0,miopenConvolutionFwdAlgoDirect,<unused>;miopenConvolutionFwdAlgoGEMM:gemm,0.08032,1812608,rocBlas,<unused>;miopenConvolutionFwdAlgoWinograd:ConvBinWinogradRxSf2x3g1,0.16192,0,miopenConvolutionFwdAlgoWinograd,<unused>
224-17-17-7x1-224-17-17-1-3x0-1x1-1x1-0-NCHW-FP32-F=miopenConvolutionFwdAlgoDirect:ConvDirectNaiveConvFwd,1.31472,0,miopenConvolutionFwdAlgoDirect,<unused>;miopenConvolutionFwdAlgoGEMM:gemm,0.07712,1812608,rocBlas,<unused>;miopenConvolutionFwdAlgoWinograd:ConvBinWinogradRxSf2x3g1,0.1616,0,miopenConvolutionFwdAlgoWinograd,<unused>
224-17-17-1x7-256-17-17-1-0x3-1x1-1x1-0-NCHW-FP32-F=miopenConvolutionFwdAlgoDirect:ConvDirectNaiveConvFwd,1.13568,0,miopenConvolutionFwdAlgoDirect,<unused>;miopenConvolutionFwdAlgoGEMM:gemm,0.07776,1812608,rocBlas,<unused>;miopenConvolutionFwdAlgoWinograd:ConvBinWinogradRxS,0.1976,0,miopenConvolutionFwdAlgoWinograd,<unused>
1024-17-17-1x1-128-17-17-1-0x0-1x1-1x1-0-NCHW-FP32-F=miopenConvolutionFwdAlgoDirect:ConvAsm1x1U,0.03696,0,miopenConvolutionFwdAlgoDirect,<unused>;miopenConvolutionFwdAlgoGEMM:gemm,0.09968,0,rocBlas,<unused>;miopenConvolutionFwdAlgoWinograd:ConvBinWinogradRxSf2x3g1,0.22496,0,miopenConvolutionFwdAlgoWinograd,<unused>
1024-17-17-1x1-192-17-17-1-0x0-1x1-1x1-0-NCHW-FP32-F=miopenConvolutionFwdAlgoDirect:ConvOclDirectFwd1x1,0.048,0,miopenConvolutionFwdAlgoDirect,<unused>;miopenConvolutionFwdAlgoGEMM:gemm,0.084,0,rocBlas,<unused>;miopenConvolutionFwdAlgoWinograd:ConvBinWinogradRxSf2x3g1,0.228,0,miopenConvolutionFwdAlgoWinograd,<unused>
1024-17-17-1x1-256-17-17-1-0x0-1x1-1x1-0-NCHW-FP32-F=miopenConvolutionFwdAlgoDirect:ConvOclDirectFwd1x1,0.05808,0,miopenConvolutionFwdAlgoDirect,<unused>;miopenConvolutionFwdAlgoGEMM:gemm,0.09744,0,rocBlas,<unused>;miopenConvolutionFwdAlgoWinograd:ConvBinWinogradRxSf2x3g1,0.22848,0,miopenConvolutionFwdAlgoWinograd,<unused>
256-17-17-1x7-256-17-17-1-0x3-1x1-1x1-0-NCHW-FP32-F=miopenConvolutionFwdAlgoDirect:ConvDirectNaiveConvFwd,1.29744,0,miopenConvolutionFwdAlgoDirect,<unused>;miopenConvolutionFwdAlgoGEMM:gemm,0.09088,2071552,rocBlas,<unused>;miopenConvolutionFwdAlgoWinograd:ConvBinWinogradRxS,0.22672,0,miopenConvolutionFwdAlgoWinograd,<unused>
256-17-17-7x1-320-17-17-1-3x0-1x1-1x1-0-NCHW-FP32-F=miopenConvolutionFwdAlgoDirect:ConvDirectNaiveConvFwd,1.64032,0,miopenConvolutionFwdAlgoDirect,<unused>;miopenConvolutionFwdAlgoGEMM:gemm,0.09376,2071552,rocBlas,<unused>;miopenConvolutionFwdAlgoWinograd:ConvBinWinogradRxSf2x3g1,0.17568,0,miopenConvolutionFwdAlgoWinograd,<unused>
320-17-17-3x3-320-8-8-1-0x0-2x2-1x1-0-NCHW-FP32-F=miopenConvolutionFwdAlgoImplicitGEMM:ConvHipImplicitGemmV4R4Fwd,0.32336,0,miopenConvolutionFwdAlgoImplicitGEMM,<unused>;miopenConvolutionFwdAlgoDirect:ConvOclDirectFwd,0.958081,0,miopenConvolutionFwdAlgoDirect,<unused>;miopenConvolutionFwdAlgoGEMM:gemm,0.07952,737280,rocBlas,<unused>;miopenConvolutionFwdAlgoWinograd:ConvBinWinogradRxSf2x3g1,0.292,0,miopenConvolutionFwdAlgoWinograd,<unused>
1536-8-8-1x1-768-8-8-1-0x0-1x1-1x1-0-NCHW-FP32-F=miopenConvolutionFwdAlgoImplicitGEMM:ConvHipImplicitGemmV4R4Fwd,0.1952,0,miopenConvolutionFwdAlgoImplicitGEMM,<unused>;miopenConvolutionFwdAlgoDirect:ConvOclDirectFwd1x1,0.06784,0,miopenConvolutionFwdAlgoDirect,<unused>;miopenConvolutionFwdAlgoGEMM:gemm,0.08048,0,rocBlas,<unused>;miopenConvolutionFwdAlgoWinograd:ConvBinWinogradRxSf2x3g1,0.33472,0,miopenConvolutionFwdAlgoWinograd,<unused>
1536-8-8-1x1-256-8-8-1-0x0-1x1-1x1-0-NCHW-FP32-F=miopenConvolutionFwdAlgoImplicitGEMM:ConvHipImplicitGemmV4R4Fwd,0.16592,0,miopenConvolutionFwdAlgoImplicitGEMM,<unused>;miopenConvolutionFwdAlgoDirect:ConvAsm1x1U,0.04912,0,miopenConvolutionFwdAlgoDirect,<unused>;miopenConvolutionFwdAlgoGEMM:gemm,0.05808,0,rocBlas,<unused>;miopenConvolutionFwdAlgoWinograd:ConvBinWinogradRxSf2x3g1,0.333441,0,miopenConvolutionFwdAlgoWinograd,<unused>
384-8-8-1x3-256-8-8-1-0x1-1x1-1x1-0-NCHW-FP32-F=miopenConvolutionFwdAlgoImplicitGEMM:ConvHipImplicitGemmV4R4Fwd,0.14608,0,miopenConvolutionFwdAlgoImplicitGEMM,<unused>;miopenConvolutionFwdAlgoDirect:ConvDirectNaiveConvFwd,0.4536,0,miopenConvolutionFwdAlgoDirect,<unused>;miopenConvolutionFwdAlgoGEMM:gemm,0.05968,294912,rocBlas,<unused>;miopenConvolutionFwdAlgoWinograd:ConvBinWinogradRxS,0.09904,0,miopenConvolutionFwdAlgoWinograd,<unused>
384-8-8-3x1-256-8-8-1-1x0-1x1-1x1-0-NCHW-FP32-F=miopenConvolutionFwdAlgoImplicitGEMM:ConvHipImplicitGemmV4R4Fwd,0.14416,0,miopenConvolutionFwdAlgoImplicitGEMM,<unused>;miopenConvolutionFwdAlgoDirect:ConvDirectNaiveConvFwd,0.51504,0,miopenConvolutionFwdAlgoDirect,<unused>;miopenConvolutionFwdAlgoGEMM:gemm,0.06192,294912,rocBlas,<unused>;miopenConvolutionFwdAlgoWinograd:ConvBinWinogradRxSf2x3g1,0.10064,0,miopenConvolutionFwdAlgoWinograd,<unused>
384-8-8-3x1-448-8-8-1-1x0-1x1-1x1-0-NCHW-FP32-F=miopenConvolutionFwdAlgoImplicitGEMM:ConvHipImplicitGemmV4R4Fwd,0.14224,0,miopenConvolutionFwdAlgoImplicitGEMM,<unused>;miopenConvolutionFwdAlgoDirect:ConvDirectNaiveConvFwd,0.51488,0,miopenConvolutionFwdAlgoDirect,<unused>;miopenConvolutionFwdAlgoGEMM:gemm,0.06048,294912,rocBlas,<unused>;miopenConvolutionFwdAlgoWinograd:ConvBinWinogradRxSf2x3g1,0.10016,0,miopenConvolutionFwdAlgoWinograd,<unused>
448-8-8-1x3-512-8-8-1-0x1-1x1-1x1-0-NCHW-FP32-F=miopenConvolutionFwdAlgoImplicitGEMM:ConvHipImplicitGemmV4R4Fwd,0.17024,0,miopenConvolutionFwdAlgoImplicitGEMM,<unused>;miopenConvolutionFwdAlgoDirect:ConvDirectNaiveConvFwd,0.53104,0,miopenConvolutionFwdAlgoDirect,<unused>;miopenConvolutionFwdAlgoGEMM:gemm,0.06576,344064,rocBlas,<unused>;miopenConvolutionFwdAlgoWinograd:ConvBinWinogradRxS,0.1112,0,miopenConvolutionFwdAlgoWinograd,<unused>
512-8-8-1x3-256-8-8-1-0x1-1x1-1x1-0-NCHW-FP32-F=miopenConvolutionFwdAlgoImplicitGEMM:ConvHipImplicitGemmV4R4Fwd,0.19296,0,miopenConvolutionFwdAlgoImplicitGEMM,<unused>;miopenConvolutionFwdAlgoDirect:ConvDirectNaiveConvFwd,0.6136,0,miopenConvolutionFwdAlgoDirect,<unused>;miopenConvolutionFwdAlgoGEMM:gemm,0.06992,393216,rocBlas,<unused>;miopenConvolutionFwdAlgoWinograd:ConvBinWinogradRxSf2x3g1,0.12592,0,miopenConvolutionFwdAlgoWinograd,<unused>
512-8-8-3x1-256-8-8-1-1x0-1x1-1x1-0-NCHW-FP32-F=miopenConvolutionFwdAlgoImplicitGEMM:ConvHipImplicitGemmV4R4Fwd,0.18608,0,miopenConvolutionFwdAlgoImplicitGEMM,<unused>;miopenConvolutionFwdAlgoDirect:ConvDirectNaiveConvFwd,0.693121,0,miopenConvolutionFwdAlgoDirect,<unused>;miopenConvolutionFwdAlgoGEMM:gemm,0.066721,393216,rocBlas,<unused>;miopenConvolutionFwdAlgoWinograd:ConvBinWinogradRxSf2x3g1,0.12704,0,miopenConvolutionFwdAlgoWinograd,<unused>
8-1920-1080-3x3-16-1920-1080-1-1x1-1x1-1x1-0-NCHW-FP16-F=miopenConvolutionFwdAlgoDirect:ConvOclDirectFwd,0.734561,0,miopenConvolutionFwdAlgoDirect,<unused>;miopenConvolutionFwdAlgoGEMM:gemm,2.74048,298598400,rocBlas,<unused>;miopenConvolutionFwdAlgoWinograd:ConvBinWinogradRxSf2x3g1,1.03584,0,miopenConvolutionFwdAlgoWinograd,<unused>
16-960-540-3x3-16-960-540-1-1x1-1x1-1x1-0-NCHW-FP16-F=miopenConvolutionFwdAlgoDirect:ConvOclDirectFwd,0.36048,0,miopenConvolutionFwdAlgoDirect,<unused>;miopenConvolutionFwdAlgoGEMM:gemm,1.25792,149299200,rocBlas,<unused>;miopenConvolutionFwdAlgoWinograd:ConvBinWinogradRxSf2x3g1,0.312961,0,miopenConvolutionFwdAlgoWinograd,<unused>
16-480-270-3x3-16-480-270-1-1x1-1x1-1x1-0-NCHW-FP16-F=miopenConvolutionFwdAlgoDirect:ConvOclDirectFwd,0.11584,0,miopenConvolutionFwdAlgoDirect,<unused>;miopenConvolutionFwdAlgoGEMM:gemm,0.34352,37324800,rocBlas,<unused>;miopenConvolutionFwdAlgoWinograd:ConvBinWinogradRxSf2x3g1,0.0984,0,miopenConvolutionFwdAlgoWinograd,<unused>
16-240-135-3x3-16-240-135-1-1x1-1x1-1x1-0-NCHW-FP16-F=miopenConvolutionFwdAlgoDirect:ConvOclDirectFwd,0.05296,0,miopenConvolutionFwdAlgoDirect,<unused>;miopenConvolutionFwdAlgoGEMM:gemm,0.12048,9331200,rocBlas,<unused>;miopenConvolutionFwdAlgoWinograd:ConvBinWinogradRxSf2x3g1,0.048,0,miopenConvolutionFwdAlgoWinograd,<unused>
16-480-270-1x1-16-480-270-1-0x0-1x1-1x1-0-NCHW-FP16-F=miopenConvolutionFwdAlgoDirect:ConvAsm1x1U,0.0192,0,miopenConvolutionFwdAlgoDirect,<unused>;miopenConvolutionFwdAlgoGEMM:gemm,0.081599,0,rocBlas,<unused>;miopenConvolutionFwdAlgoWinograd:ConvBinWinogradRxSf2x3g1,0.099519,0,miopenConvolutionFwdAlgoWinograd,<unused>
16-960-540-1x1-16-960-540-1-0x0-1x1-1x1-0-NCHW-FP16-F=miopenConvolutionFwdAlgoDirect:ConvOclDirectFwd1x1,0.087839,0,miopenConvolutionFwdAlgoDirect,<unused>;miopenConvolutionFwdAlgoGEMM:gemm,0.265118,0,rocBlas,<unused>;miopenConvolutionFwdAlgoWinograd:ConvBinWinogradRxSf2x3g1,0.313758,0,miopenConvolutionFwdAlgoWinograd,<unused>
16-1920-1080-1x1-16-1920-1080-1-0x0-1x1-1x1-0-NCHW-FP16-F=miopenConvolutionFwdAlgoDirect:ConvOclDirectFwd1x1,0.332957,0,miopenConvolutionFwdAlgoDirect,<unused>;miopenConvolutionFwdAlgoGEMM:gemm,1.05743,0,rocBlas,<unused>;miopenConvolutionFwdAlgoWinograd:ConvBinWinogradRxSf2x3g1,1.25215,0,miopenConvolutionFwdAlgoWinograd,<unused>
16-1920-1080-3x3-16-1920-1080-1-1x1-1x1-1x1-0-NCHW-FP16-F=miopenConvolutionFwdAlgoDirect:ConvOclDirectFwd,1.34031,0,miopenConvolutionFwdAlgoDirect,<unused>;miopenConvolutionFwdAlgoGEMM:gemm,4.89324,597196800,rocBlas,<unused>;miopenConvolutionFwdAlgoWinograd:ConvBinWinogradRxSf2x3g1,1.25663,0,miopenConvolutionFwdAlgoWinograd,<unused>
16-1920-1080-3x3-4-1920-1080-1-1x1-1x1-1x1-0-NCHW-FP16-F=miopenConvolutionFwdAlgoDirect:ConvOclDirectFwd,0.521116,0,miopenConvolutionFwdAlgoDirect,<unused>;miopenConvolutionFwdAlgoGEMM:gemm,4.85612,597196800,rocBlas,<unused>;miopenConvolutionFwdAlgoWinograd:ConvBinWinogradRxSf2x3g1,1.15055,0,miopenConvolutionFwdAlgoWinograd,<unused>
608-28-28-1x1-192-28-28-32-0x0-1x1-1x1-0-NCHW-FP32-F=miopenConvolutionFwdAlgoImplicitGEMM:ConvHipImplicitGemmV4R1Fwd,0.689467,0,miopenConvolutionFwdAlgoImplicitGEMM,<unused>;miopenConvolutionFwdAlgoDirect:ConvAsm1x1U,0.653467,0,miopenConvolutionFwdAlgoDirect,<unused>;miopenConvolutionFwdAlgoGEMM:gemm,0.878115,0,rocBlas,<unused>;miopenConvolutionFwdAlgoWinograd:ConvBinWinogradRxSf3x2,1.33093,0,miopenConvolutionFwdAlgoWinograd,<unused>
192-28-28-3x3-192-28-28-32-1x1-1x1-1x1-0-NCHW-FP32-F_g32=miopenConvolutionFwdAlgoDirect:ConvOclDirectFwd,0.189448,0,miopenConvolutionFwdAlgoDirect,<unused>;miopenConvolutionFwdAlgoGEMM:gemm,2.04806,5419008,rocBlas,<unused>;miopenConvolutionFwdAlgoWinograd:ConvBinWinogradRxSf2x3,0.441938,0,miopenConvolutionFwdAlgoWinograd,<unused>
640-28-28-1x1-192-28-28-32-0x0-1x1-1x1-0-NCHW-FP32-F=miopenConvolutionFwdAlgoImplicitGEMM:ConvHipImplicitGemmV4R1Fwd,0.641466,0,miopenConvolutionFwdAlgoImplicitGEMM,<unused>;miopenConvolutionFwdAlgoDirect:ConvAsm1x1U,0.73555,0,miopenConvolutionFwdAlgoDirect,<unused>;miopenConvolutionFwdAlgoGEMM:gemm,0.889956,0,rocBlas,<unused>;miopenConvolutionFwdAlgoWinograd:ConvBinWinogradRxSf3x2,1.39926,0,miopenConvolutionFwdAlgoWinograd,<unused>
