dockerfiles/miopen-rocm41/gfx906_60.HIP.2_10_0_b50b9a88.ufdb.txt
3-224-224-7x7-64-112-112-64-3x3-2x2-1x1-0-NCHW-FP32-F=miopenConvolutionFwdAlgoDirect:ConvAsm7x7c3h224w224k64u2v2p3q3f1,1.79024,0,miopenConvolutionFwdAlgoDirect,<unused>;miopenConvolutionFwdAlgoGEMM:gemm,4.74112,7375872,rocBlas,<unused>;miopenConvolutionFwdAlgoWinograd:ConvBinWinogradRxSf2x3g1,2.97696,0,miopenConvolutionFwdAlgoWinograd,<unused>
64-56-56-1x1-64-56-56-64-0x0-1x1-1x1-0-NCHW-FP32-F=miopenConvolutionFwdAlgoImplicitGEMM:ConvHipImplicitGemmV4R1Fwd,0.27568,0,miopenConvolutionFwdAlgoImplicitGEMM,<unused>;miopenConvolutionFwdAlgoDirect:ConvOclDirectFwd1x1,0.21296,0,miopenConvolutionFwdAlgoDirect,<unused>;miopenConvolutionFwdAlgoGEMM:gemm,0.21664,0,rocBlas,<unused>;miopenConvolutionFwdAlgoWinograd:ConvBinWinogradRxSf3x2,0.68672,0,miopenConvolutionFwdAlgoWinograd,<unused>
64-56-56-3x3-64-56-56-64-1x1-1x1-1x1-0-NCHW-FP32-F=miopenConvolutionFwdAlgoWinograd:ConvBinWinogradRxSf2x3g1,0.919519,0,miopenConvolutionFwdAlgoWinograd,<unused>
128-56-56-1x1-256-56-56-64-0x0-1x1-1x1-0-NCHW-FP32-F=miopenConvolutionFwdAlgoImplicitGEMM:ConvHipImplicitGemmV4R1Fwd,1.62816,0,miopenConvolutionFwdAlgoImplicitGEMM,<unused>;miopenConvolutionFwdAlgoDirect:ConvOclDirectFwd1x1,1.65968,0,miopenConvolutionFwdAlgoDirect,<unused>;miopenConvolutionFwdAlgoGEMM:gemm,1.38016,0,rocBlas,<unused>;miopenConvolutionFwdAlgoWinograd:ConvBinWinogradRxSf3x2,4.60768,0,miopenConvolutionFwdAlgoWinograd,<unused>
256-56-56-1x1-64-56-56-64-0x0-1x1-1x1-0-NCHW-FP32-F=miopenConvolutionFwdAlgoImplicitGEMM:ConvHipImplicitGemmV4R1Fwd,0.74864,0,miopenConvolutionFwdAlgoImplicitGEMM,<unused>;miopenConvolutionFwdAlgoDirect:ConvOclDirectFwd1x1,0.71984,0,miopenConvolutionFwdAlgoDirect,<unused>;miopenConvolutionFwdAlgoGEMM:gemm,0.6872,0,rocBlas,<unused>;miopenConvolutionFwdAlgoWinograd:ConvBinWinogradRxSf3x2,2.27952,0,miopenConvolutionFwdAlgoWinograd,<unused>
64-56-56-1x1-256-56-56-64-0x0-1x1-1x1-0-NCHW-FP32-F=miopenConvolutionFwdAlgoImplicitGEMM:ConvHipImplicitGemmV4R1Fwd,0.940799,0,miopenConvolutionFwdAlgoImplicitGEMM,<unused>;miopenConvolutionFwdAlgoDirect:ConvOclDirectFwd1x1,0.76688,0,miopenConvolutionFwdAlgoDirect,<unused>;miopenConvolutionFwdAlgoGEMM:gemm,0.747519,0,rocBlas,<unused>;miopenConvolutionFwdAlgoWinograd:ConvBinWinogradRxSf3x2,2.54512,0,miopenConvolutionFwdAlgoWinograd,<unused>
256-56-56-1x1-128-56-56-64-0x0-1x1-1x1-0-NCHW-FP32-F=miopenConvolutionFwdAlgoImplicitGEMM:ConvHipImplicitGemmV4R1Fwd,1.43615,0,miopenConvolutionFwdAlgoImplicitGEMM,<unused>;miopenConvolutionFwdAlgoDirect:ConvOclDirectFwd1x1,1.46591,0,miopenConvolutionFwdAlgoDirect,<unused>;miopenConvolutionFwdAlgoGEMM:gemm,1.33839,0,rocBlas,<unused>;miopenConvolutionFwdAlgoWinograd:ConvBinWinogradRxSf3x2,4.43373,0,miopenConvolutionFwdAlgoWinograd,<unused>
128-56-56-3x3-128-28-28-64-1x1-2x2-1x1-0-NCHW-FP32-F=miopenConvolutionFwdAlgoImplicitGEMM:ConvHipImplicitGemmV4R1Fwd,1.66783,0,miopenConvolutionFwdAlgoImplicitGEMM,<unused>;miopenConvolutionFwdAlgoDirect:ConvOclDirectFwd,7.3542,0,miopenConvolutionFwdAlgoDirect,<unused>;miopenConvolutionFwdAlgoGEMM:gemm,6.17466,3612672,rocBlas,<unused>;miopenConvolutionFwdAlgoWinograd:ConvBinWinogradRxSf2x3g1,3.46142,0,miopenConvolutionFwdAlgoWinograd,<unused>
384-28-28-1x1-512-28-28-64-0x0-1x1-1x1-0-NCHW-FP32-F=miopenConvolutionFwdAlgoImplicitGEMM:ConvHipImplicitGemmV4R1Fwd,2.25744,0,miopenConvolutionFwdAlgoImplicitGEMM,<unused>;miopenConvolutionFwdAlgoDirect:ConvOclDirectFwd1x1,2.48368,0,miopenConvolutionFwdAlgoDirect,<unused>;miopenConvolutionFwdAlgoGEMM:gemm,2.52624,0,rocBlas,<unused>;miopenConvolutionFwdAlgoWinograd:ConvBinWinogradRxSf3x2,7.3832,0,miopenConvolutionFwdAlgoWinograd,<unused>
512-28-28-1x1-128-28-28-64-0x0-1x1-1x1-0-NCHW-FP32-F=miopenConvolutionFwdAlgoImplicitGEMM:ConvHipImplicitGemmV4R1Fwd,0.74608,0,miopenConvolutionFwdAlgoImplicitGEMM,<unused>;miopenConvolutionFwdAlgoDirect:ConvOclDirectFwd1x1,0.79184,0,miopenConvolutionFwdAlgoDirect,<unused>;miopenConvolutionFwdAlgoGEMM:gemm,0.73424,0,rocBlas,<unused>;miopenConvolutionFwdAlgoWinograd:ConvBinWinogradRxSf3x2,2.5456,0,miopenConvolutionFwdAlgoWinograd,<unused>
128-28-28-3x3-128-28-28-64-1x1-1x1-1x1-0-NCHW-FP32-F=miopenConvolutionFwdAlgoWinograd:ConvBinWinogradRxSf2x3g1,0.87104,0,miopenConvolutionFwdAlgoWinograd,<unused>
128-28-28-1x1-512-28-28-64-0x0-1x1-1x1-0-NCHW-FP32-F=miopenConvolutionFwdAlgoImplicitGEMM:ConvHipImplicitGemmV4R1Fwd,0.79504,0,miopenConvolutionFwdAlgoImplicitGEMM,<unused>;miopenConvolutionFwdAlgoDirect:ConvAsm1x1U,0.92704,0,miopenConvolutionFwdAlgoDirect,<unused>;miopenConvolutionFwdAlgoGEMM:gemm,0.71136,0,rocBlas,<unused>;miopenConvolutionFwdAlgoWinograd:ConvBinWinogradRxSf3x2,2.64912,0,miopenConvolutionFwdAlgoWinograd,<unused>
512-28-28-1x1-256-28-28-64-0x0-1x1-1x1-0-NCHW-FP32-F=miopenConvolutionFwdAlgoImplicitGEMM:ConvHipImplicitGemmV4R1Fwd,1.43631,0,miopenConvolutionFwdAlgoImplicitGEMM,<unused>;miopenConvolutionFwdAlgoDirect:ConvAsm1x1U,1.83455,0,miopenConvolutionFwdAlgoDirect,<unused>;miopenConvolutionFwdAlgoGEMM:gemm,1.40351,0,rocBlas,<unused>;miopenConvolutionFwdAlgoWinograd:ConvBinWinogradRxSf3x2,4.89965,0,miopenConvolutionFwdAlgoWinograd,<unused>
256-28-28-3x3-256-14-14-64-1x1-2x2-1x1-0-NCHW-FP32-F=miopenConvolutionFwdAlgoImplicitGEMM:ConvHipImplicitGemmV4R1Fwd,1.92991,0,miopenConvolutionFwdAlgoImplicitGEMM,<unused>;miopenConvolutionFwdAlgoDirect:ConvOclDirectFwd,6.54076,0,miopenConvolutionFwdAlgoDirect,<unused>;miopenConvolutionFwdAlgoGEMM:gemm,7.28064,1806336,rocBlas,<unused>;miopenConvolutionFwdAlgoWinograd:ConvBinWinogradRxSf2x3g1,3.54414,0,miopenConvolutionFwdAlgoWinograd,<unused>
768-14-14-1x1-1024-14-14-64-0x0-1x1-1x1-0-NCHW-FP32-F=miopenConvolutionFwdAlgoImplicitGEMM:ConvHipImplicitGemmV4R1Fwd,2.14224,0,miopenConvolutionFwdAlgoImplicitGEMM,<unused>;miopenConvolutionFwdAlgoDirect:ConvAsm1x1U,2.8456,0,miopenConvolutionFwdAlgoDirect,<unused>;miopenConvolutionFwdAlgoGEMM:gemm,3.11376,0,rocBlas,<unused>;miopenConvolutionFwdAlgoWinograd:ConvBinWinogradRxSf3x2,7.20112,0,miopenConvolutionFwdAlgoWinograd,<unused>
1024-14-14-1x1-256-14-14-64-0x0-1x1-1x1-0-NCHW-FP32-F=miopenConvolutionFwdAlgoImplicitGEMM:ConvHipImplicitGemmV4R1Fwd,0.92816,0,miopenConvolutionFwdAlgoImplicitGEMM,<unused>;miopenConvolutionFwdAlgoDirect:ConvAsm1x1U,1.07664,0,miopenConvolutionFwdAlgoDirect,<unused>;miopenConvolutionFwdAlgoGEMM:gemm,1.02144,0,rocBlas,<unused>;miopenConvolutionFwdAlgoWinograd:ConvBinWinogradRxSf3x2,2.55488,0,miopenConvolutionFwdAlgoWinograd,<unused>
256-14-14-3x3-256-14-14-64-1x1-1x1-1x1-0-NCHW-FP32-F=miopenConvolutionFwdAlgoWinograd:ConvBinWinogradRxSf2x3g1,0.93488,0,miopenConvolutionFwdAlgoWinograd,<unused>
256-14-14-1x1-1024-14-14-64-0x0-1x1-1x1-0-NCHW-FP32-F=miopenConvolutionFwdAlgoImplicitGEMM:ConvHipImplicitGemmV4R1Fwd,0.76816,0,miopenConvolutionFwdAlgoImplicitGEMM,<unused>;miopenConvolutionFwdAlgoDirect:ConvOclDirectFwd1x1,1.1152,0,miopenConvolutionFwdAlgoDirect,<unused>;miopenConvolutionFwdAlgoGEMM:gemm,0.90592,0,rocBlas,<unused>;miopenConvolutionFwdAlgoWinograd:ConvBinWinogradRxSf3x2,2.5464,0,miopenConvolutionFwdAlgoWinograd,<unused>
1024-14-14-1x1-512-14-14-64-0x0-1x1-1x1-0-NCHW-FP32-F=miopenConvolutionFwdAlgoImplicitGEMM:ConvHipImplicitGemmV4R1Fwd,1.54287,0,miopenConvolutionFwdAlgoImplicitGEMM,<unused>;miopenConvolutionFwdAlgoDirect:ConvAsm1x1U,2.38431,0,miopenConvolutionFwdAlgoDirect,<unused>;miopenConvolutionFwdAlgoGEMM:gemm,2.58063,0,rocBlas,<unused>;miopenConvolutionFwdAlgoWinograd:ConvBinWinogradRxSf3x2,5.09389,0,miopenConvolutionFwdAlgoWinograd,<unused>
512-14-14-3x3-512-7-7-64-1x1-2x2-1x1-0-NCHW-FP32-F=miopenConvolutionFwdAlgoImplicitGEMM:ConvHipImplicitGemmV4R1Fwd,1.73423,0,miopenConvolutionFwdAlgoImplicitGEMM,<unused>;miopenConvolutionFwdAlgoDirect:ConvOclDirectFwd,9.05451,0,miopenConvolutionFwdAlgoDirect,<unused>;miopenConvolutionFwdAlgoGEMM:gemm,29.6344,903168,rocBlas,<unused>;miopenConvolutionFwdAlgoWinograd:ConvBinWinogradRxSf2x3g1,4.59053,0,miopenConvolutionFwdAlgoWinograd,<unused>
1536-7-7-1x1-2048-7-7-64-0x0-1x1-1x1-0-NCHW-FP32-F=miopenConvolutionFwdAlgoImplicitGEMM:ConvHipImplicitGemmV4R1Fwd,2.65184,0,miopenConvolutionFwdAlgoImplicitGEMM,<unused>;miopenConvolutionFwdAlgoDirect:ConvAsm1x1U,3.66912,0,miopenConvolutionFwdAlgoDirect,<unused>;miopenConvolutionFwdAlgoGEMM:gemm,4.00768,0,rocBlas,<unused>;miopenConvolutionFwdAlgoWinograd:ConvBinWinogradRxSf3x2,10.4218,0,miopenConvolutionFwdAlgoWinograd,<unused>
2048-7-7-1x1-512-7-7-64-0x0-1x1-1x1-0-NCHW-FP32-F=miopenConvolutionFwdAlgoImplicitGEMM:ConvHipImplicitGemmV4R1Fwd,0.98896,0,miopenConvolutionFwdAlgoImplicitGEMM,<unused>;miopenConvolutionFwdAlgoDirect:ConvOclDirectFwd1x1,1.29072,0,miopenConvolutionFwdAlgoDirect,<unused>;miopenConvolutionFwdAlgoGEMM:gemm,2.28432,0,rocBlas,<unused>;miopenConvolutionFwdAlgoWinograd:ConvBinWinogradRxSf3x2,3.61344,0,miopenConvolutionFwdAlgoWinograd,<unused>
512-7-7-3x3-512-7-7-64-1x1-1x1-1x1-0-NCHW-FP32-F=miopenConvolutionFwdAlgoWinograd:ConvBinWinogradRxSf2x3g1,1.21136,0,miopenConvolutionFwdAlgoWinograd,<unused>
512-7-7-1x1-2048-7-7-64-0x0-1x1-1x1-0-NCHW-FP32-F=miopenConvolutionFwdAlgoImplicitGEMM:ConvHipImplicitGemmV4R1Fwd,0.92528,0,miopenConvolutionFwdAlgoImplicitGEMM,<unused>;miopenConvolutionFwdAlgoDirect:ConvAsm1x1U,1.39792,0,miopenConvolutionFwdAlgoDirect,<unused>;miopenConvolutionFwdAlgoGEMM:gemm,1.408,0,rocBlas,<unused>;miopenConvolutionFwdAlgoWinograd:ConvBinWinogradRxSf3x2,3.68352,0,miopenConvolutionFwdAlgoWinograd,<unused>
3-224-224-7x7-64-112-112-64-3x3-2x2-1x1-0-NCHW-FP16-F=miopenConvolutionFwdAlgoDirect:ConvOclDirectFwdGen,3.05167,0,miopenConvolutionFwdAlgoDirect,<unused>;miopenConvolutionFwdAlgoGEMM:gemm,6.5536,3687936,rocBlas,<unused>;miopenConvolutionFwdAlgoWinograd:ConvBinWinogradRxSf2x3g1,2.87167,0,miopenConvolutionFwdAlgoWinograd,<unused>
64-56-56-1x1-64-56-56-64-0x0-1x1-1x1-0-NCHW-FP16-F=miopenConvolutionFwdAlgoImplicitGEMM:ConvHipImplicitGemmV4R1Fwd,0.199199,0,miopenConvolutionFwdAlgoImplicitGEMM,<unused>;miopenConvolutionFwdAlgoDirect:ConvAsm1x1U,0.15712,0,miopenConvolutionFwdAlgoDirect,<unused>;miopenConvolutionFwdAlgoGEMM:gemm,0.128159,0,rocBlas,<unused>;miopenConvolutionFwdAlgoWinograd:ConvBinWinogradRxSf2x3g1,0.651358,0,miopenConvolutionFwdAlgoWinograd,<unused>
64-56-56-3x3-64-56-56-64-1x1-1x1-1x1-0-NCHW-FP16-F=miopenConvolutionFwdAlgoImplicitGEMM:ConvHipImplicitGemmV4R1Fwd,1.17136,0,miopenConvolutionFwdAlgoImplicitGEMM,<unused>;miopenConvolutionFwdAlgoDirect:ConvOclDirectFwd,2.49119,0,miopenConvolutionFwdAlgoDirect,<unused>;miopenConvolutionFwdAlgoGEMM:gemm,7.4137,3612672,rocBlas,<unused>;miopenConvolutionFwdAlgoWinograd:ConvBinWinogradRxSf2x3g1,0.632638,0,miopenConvolutionFwdAlgoWinograd,<unused>
128-56-56-1x1-256-56-56-64-0x0-1x1-1x1-0-NCHW-FP16-F=miopenConvolutionFwdAlgoImplicitGEMM:ConvHipImplicitGemmV4R1Fwd,1.53823,0,miopenConvolutionFwdAlgoImplicitGEMM,<unused>;miopenConvolutionFwdAlgoDirect:ConvAsm1x1U,1.46767,0,miopenConvolutionFwdAlgoDirect,<unused>;miopenConvolutionFwdAlgoGEMM:gemm,0.798237,0,rocBlas,<unused>;miopenConvolutionFwdAlgoWinograd:ConvBinWinogradRxSf2x3g1,4.39838,0,miopenConvolutionFwdAlgoWinograd,<unused>
256-56-56-1x1-64-56-56-64-0x0-1x1-1x1-0-NCHW-FP16-F=miopenConvolutionFwdAlgoImplicitGEMM:ConvHipImplicitGemmV4R1Fwd,0.717438,0,miopenConvolutionFwdAlgoImplicitGEMM,<unused>;miopenConvolutionFwdAlgoDirect:ConvAsm1x1U,0.502878,0,miopenConvolutionFwdAlgoDirect,<unused>;miopenConvolutionFwdAlgoGEMM:gemm,0.401759,0,rocBlas,<unused>;miopenConvolutionFwdAlgoWinograd:ConvBinWinogradRxSf2x3g1,2.09791,0,miopenConvolutionFwdAlgoWinograd,<unused>
64-56-56-1x1-256-56-56-64-0x0-1x1-1x1-0-NCHW-FP16-F=miopenConvolutionFwdAlgoImplicitGEMM:ConvHipImplicitGemmV4R1Fwd,0.903197,0,miopenConvolutionFwdAlgoImplicitGEMM,<unused>;miopenConvolutionFwdAlgoDirect:ConvAsm1x1U,0.553278,0,miopenConvolutionFwdAlgoDirect,<unused>;miopenConvolutionFwdAlgoGEMM:gemm,0.435839,0,rocBlas,<unused>;miopenConvolutionFwdAlgoWinograd:ConvBinWinogradRxSf2x3g1,2.46783,0,miopenConvolutionFwdAlgoWinograd,<unused>
256-56-56-1x1-128-56-56-64-0x0-1x1-1x1-0-NCHW-FP16-F=miopenConvolutionFwdAlgoImplicitGEMM:ConvHipImplicitGemmV4R1Fwd,1.30512,0,miopenConvolutionFwdAlgoImplicitGEMM,<unused>;miopenConvolutionFwdAlgoDirect:ConvAsm1x1U,1.03104,0,miopenConvolutionFwdAlgoDirect,<unused>;miopenConvolutionFwdAlgoGEMM:gemm,0.749278,0,rocBlas,<unused>;miopenConvolutionFwdAlgoWinograd:ConvBinWinogradRxSf2x3g1,4.11983,0,miopenConvolutionFwdAlgoWinograd,<unused>
128-56-56-3x3-128-28-28-64-1x1-2x2-1x1-0-NCHW-FP16-F=miopenConvolutionFwdAlgoImplicitGEMM:ConvHipImplicitGemmV4R1Fwd,1.26048,0,miopenConvolutionFwdAlgoImplicitGEMM,<unused>;miopenConvolutionFwdAlgoDirect:ConvOclDirectFwdGen,5.4459,0,miopenConvolutionFwdAlgoDirect,<unused>;miopenConvolutionFwdAlgoGEMM:gemm,7.67994,1806336,rocBlas,<unused>;miopenConvolutionFwdAlgoWinograd:ConvBinWinogradRxSf2x3g1,2.26319,0,miopenConvolutionFwdAlgoWinograd,<unused>
384-28-28-1x1-512-28-28-64-0x0-1x1-1x1-0-NCHW-FP16-F=miopenConvolutionFwdAlgoImplicitGEMM:ConvHipImplicitGemmV4R1Fwd,1.8136,0,miopenConvolutionFwdAlgoImplicitGEMM,<unused>;miopenConvolutionFwdAlgoDirect:ConvAsm1x1U,1.56656,0,miopenConvolutionFwdAlgoDirect,<unused>;miopenConvolutionFwdAlgoGEMM:gemm,1.92943,0,rocBlas,<unused>;miopenConvolutionFwdAlgoWinograd:ConvBinWinogradRxSf2x3g1,6.0571,0,miopenConvolutionFwdAlgoWinograd,<unused>
512-28-28-1x1-128-28-28-64-0x0-1x1-1x1-0-NCHW-FP16-F=miopenConvolutionFwdAlgoImplicitGEMM:ConvHipImplicitGemmV4R1Fwd,0.72144,0,miopenConvolutionFwdAlgoImplicitGEMM,<unused>;miopenConvolutionFwdAlgoDirect:ConvAsm1x1U,0.58048,0,miopenConvolutionFwdAlgoDirect,<unused>;miopenConvolutionFwdAlgoGEMM:gemm,0.48832,0,rocBlas,<unused>;miopenConvolutionFwdAlgoWinograd:ConvBinWinogradRxSf2x3g1,2.08144,0,miopenConvolutionFwdAlgoWinograd,<unused>
128-28-28-3x3-128-28-28-64-1x1-1x1-1x1-0-NCHW-FP16-F=miopenConvolutionFwdAlgoImplicitGEMM:ConvHipImplicitGemmV4R1Fwd,1.15952,0,miopenConvolutionFwdAlgoImplicitGEMM,<unused>;miopenConvolutionFwdAlgoDirect:ConvOclDirectFwd,2.23504,0,miopenConvolutionFwdAlgoDirect,<unused>;miopenConvolutionFwdAlgoGEMM:gemm,7.26016,1806336,rocBlas,<unused>;miopenConvolutionFwdAlgoWinograd:ConvBinWinogradRxSf2x3g1,0.57728,0,miopenConvolutionFwdAlgoWinograd,<unused>
128-28-28-1x1-512-28-28-64-0x0-1x1-1x1-0-NCHW-FP16-F=miopenConvolutionFwdAlgoImplicitGEMM:ConvHipImplicitGemmV4R1Fwd,0.743999,0,miopenConvolutionFwdAlgoImplicitGEMM,<unused>;miopenConvolutionFwdAlgoDirect:ConvAsm1x1U,0.57728,0,miopenConvolutionFwdAlgoDirect,<unused>;miopenConvolutionFwdAlgoGEMM:gemm,0.43344,0,rocBlas,<unused>;miopenConvolutionFwdAlgoWinograd:ConvBinWinogradRxSf2x3g1,2.21792,0,miopenConvolutionFwdAlgoWinograd,<unused>
512-28-28-1x1-256-28-28-64-0x0-1x1-1x1-0-NCHW-FP16-F=miopenConvolutionFwdAlgoImplicitGEMM:ConvHipImplicitGemmV4R1Fwd,1.33968,0,miopenConvolutionFwdAlgoImplicitGEMM,<unused>;miopenConvolutionFwdAlgoDirect:ConvAsm1x1U,1.09936,0,miopenConvolutionFwdAlgoDirect,<unused>;miopenConvolutionFwdAlgoGEMM:gemm,0.86688,0,rocBlas,<unused>;miopenConvolutionFwdAlgoWinograd:ConvBinWinogradRxSf2x3g1,4.04608,0,miopenConvolutionFwdAlgoWinograd,<unused>
256-28-28-3x3-256-14-14-64-1x1-2x2-1x1-0-NCHW-FP16-F=miopenConvolutionFwdAlgoImplicitGEMM:ConvHipImplicitGemmV4R1Fwd,1.43168,0,miopenConvolutionFwdAlgoImplicitGEMM,<unused>;miopenConvolutionFwdAlgoDirect:ConvOclDirectFwdGen,6.96752,0,miopenConvolutionFwdAlgoDirect,<unused>;miopenConvolutionFwdAlgoGEMM:gemm,12.2573,903168,rocBlas,<unused>;miopenConvolutionFwdAlgoWinograd:ConvBinWinogradRxSf2x3g1,2.40048,0,miopenConvolutionFwdAlgoWinograd,<unused>
768-14-14-1x1-1024-14-14-64-0x0-1x1-1x1-0-NCHW-FP16-F=miopenConvolutionFwdAlgoImplicitGEMM:ConvHipImplicitGemmV4R1Fwd,1.79024,0,miopenConvolutionFwdAlgoImplicitGEMM,<unused>;miopenConvolutionFwdAlgoDirect:ConvAsm1x1U,1.7488,0,miopenConvolutionFwdAlgoDirect,<unused>;miopenConvolutionFwdAlgoGEMM:gemm,2.73408,0,rocBlas,<unused>;miopenConvolutionFwdAlgoWinograd:ConvBinWinogradRxSf2x3g1,6.152,0,miopenConvolutionFwdAlgoWinograd,<unused>
1024-14-14-1x1-256-14-14-64-0x0-1x1-1x1-0-NCHW-FP16-F=miopenConvolutionFwdAlgoImplicitGEMM:ConvHipImplicitGemmV4R1Fwd,0.81024,0,miopenConvolutionFwdAlgoImplicitGEMM,<unused>;miopenConvolutionFwdAlgoDirect:ConvAsm1x1U,0.70512,0,miopenConvolutionFwdAlgoDirect,<unused>;miopenConvolutionFwdAlgoGEMM:gemm,0.61632,0,rocBlas,<unused>;miopenConvolutionFwdAlgoWinograd:ConvBinWinogradRxSf2x3g1,2.18864,0,miopenConvolutionFwdAlgoWinograd,<unused>
256-14-14-3x3-256-14-14-64-1x1-1x1-1x1-0-NCHW-FP16-F=miopenConvolutionFwdAlgoImplicitGEMM:ConvHipImplicitGemmV4R1Fwd,1.22112,0,miopenConvolutionFwdAlgoImplicitGEMM,<unused>;miopenConvolutionFwdAlgoDirect:ConvOclDirectFwd,2.65888,0,miopenConvolutionFwdAlgoDirect,<unused>;miopenConvolutionFwdAlgoGEMM:gemm,11.8989,903168,rocBlas,<unused>;miopenConvolutionFwdAlgoWinograd:ConvBinWinogradRxSf2x3g1,0.589281,0,miopenConvolutionFwdAlgoWinograd,<unused>
256-14-14-1x1-1024-14-14-64-0x0-1x1-1x1-0-NCHW-FP16-F=miopenConvolutionFwdAlgoImplicitGEMM:ConvHipImplicitGemmV4R1Fwd,0.68384,0,miopenConvolutionFwdAlgoImplicitGEMM,<unused>;miopenConvolutionFwdAlgoDirect:ConvAsm1x1U,0.58656,0,miopenConvolutionFwdAlgoDirect,<unused>;miopenConvolutionFwdAlgoGEMM:gemm,0.478561,0,rocBlas,<unused>;miopenConvolutionFwdAlgoWinograd:ConvBinWinogradRxSf2x3g1,2.16176,0,miopenConvolutionFwdAlgoWinograd,<unused>
1024-14-14-1x1-512-14-14-64-0x0-1x1-1x1-0-NCHW-FP16-F=miopenConvolutionFwdAlgoImplicitGEMM:ConvHipImplicitGemmV4R1Fwd,1.46144,0,miopenConvolutionFwdAlgoImplicitGEMM,<unused>;miopenConvolutionFwdAlgoDirect:ConvAsm1x1U,1.348,0,miopenConvolutionFwdAlgoDirect,<unused>;miopenConvolutionFwdAlgoGEMM:gemm,1.08832,0,rocBlas,<unused>;miopenConvolutionFwdAlgoWinograd:ConvBinWinogradRxSf2x3g1,4.17153,0,miopenConvolutionFwdAlgoWinograd,<unused>
512-14-14-3x3-512-7-7-64-1x1-2x2-1x1-0-NCHW-FP16-F=miopenConvolutionFwdAlgoImplicitGEMM:ConvHipImplicitGemmV4R1Fwd,1.36752,0,miopenConvolutionFwdAlgoImplicitGEMM,<unused>;miopenConvolutionFwdAlgoDirect:ConvOclDirectFwdGen,12.7503,0,miopenConvolutionFwdAlgoDirect,<unused>;miopenConvolutionFwdAlgoGEMM:gemm,71.8746,451584,rocBlas,<unused>;miopenConvolutionFwdAlgoWinograd:ConvBinWinogradRxSf2x3g1,3.27664,0,miopenConvolutionFwdAlgoWinograd,<unused>
1536-7-7-1x1-2048-7-7-64-0x0-1x1-1x1-0-NCHW-FP16-F=miopenConvolutionFwdAlgoImplicitGEMM:ConvHipImplicitGemmV4R1Fwd,2.19104,0,miopenConvolutionFwdAlgoImplicitGEMM,<unused>;miopenConvolutionFwdAlgoDirect:ConvAsm1x1U,2.53761,0,miopenConvolutionFwdAlgoDirect,<unused>;miopenConvolutionFwdAlgoGEMM:gemm,4.71025,0,rocBlas,<unused>;miopenConvolutionFwdAlgoWinograd:ConvBinWinogradRxSf2x3g1,7.91857,0,miopenConvolutionFwdAlgoWinograd,<unused>
2048-7-7-1x1-512-7-7-64-0x0-1x1-1x1-0-NCHW-FP16-F=miopenConvolutionFwdAlgoImplicitGEMM:ConvHipImplicitGemmV4R1Fwd,0.953282,0,miopenConvolutionFwdAlgoImplicitGEMM,<unused>;miopenConvolutionFwdAlgoDirect:ConvAsm1x1U,0.992642,0,miopenConvolutionFwdAlgoDirect,<unused>;miopenConvolutionFwdAlgoGEMM:gemm,2.31088,0,rocBlas,<unused>;miopenConvolutionFwdAlgoWinograd:ConvBinWinogradRxSf2x3g1,3.02369,0,miopenConvolutionFwdAlgoWinograd,<unused>
512-7-7-3x3-512-7-7-64-1x1-1x1-1x1-0-NCHW-FP16-F=miopenConvolutionFwdAlgoImplicitGEMM:ConvHipImplicitGemmV4R1Fwd,1.29328,0,miopenConvolutionFwdAlgoImplicitGEMM,<unused>;miopenConvolutionFwdAlgoDirect:ConvOclDirectFwd,4.73473,0,miopenConvolutionFwdAlgoDirect,<unused>;miopenConvolutionFwdAlgoGEMM:gemm,72.3765,451584,rocBlas,<unused>;miopenConvolutionFwdAlgoWinograd:ConvBinWinogradRxSf2x3g1,0.728001,0,miopenConvolutionFwdAlgoWinograd,<unused>
512-7-7-1x1-2048-7-7-64-0x0-1x1-1x1-0-NCHW-FP16-F=miopenConvolutionFwdAlgoImplicitGEMM:ConvHipImplicitGemmV4R1Fwd,0.750082,0,miopenConvolutionFwdAlgoImplicitGEMM,<unused>;miopenConvolutionFwdAlgoDirect:ConvAsm1x1U,0.865282,0,miopenConvolutionFwdAlgoDirect,<unused>;miopenConvolutionFwdAlgoGEMM:gemm,1.35344,0,rocBlas,<unused>;miopenConvolutionFwdAlgoWinograd:ConvBinWinogradRxSf2x3g1,2.90465,0,miopenConvolutionFwdAlgoWinograd,<unused>
3-224-224-11x11-64-55-55-64-2x2-4x4-1x1-0-NCHW-FP32-F=miopenConvolutionFwdAlgoDirect:ConvOclDirectFwd11x11,3.0781,0,miopenConvolutionFwdAlgoDirect,<unused>;miopenConvolutionFwdAlgoGEMM:gemm,5.35552,4392300,rocBlas,<unused>
64-27-27-5x5-192-27-27-64-2x2-1x1-1x1-0-NCHW-FP32-F=miopenConvolutionFwdAlgoFFT:fft,1.24353,143720448,miopenConvolutionFwdAlgoFFT,<unused>;miopenConvolutionFwdAlgoImplicitGEMM:ConvHipImplicitGemmV4R1Fwd,3.12099,0,miopenConvolutionFwdAlgoImplicitGEMM,<unused>;miopenConvolutionFwdAlgoDirect:ConvOclDirectFwd,5.23748,0,miopenConvolutionFwdAlgoDirect,<unused>;miopenConvolutionFwdAlgoGEMM:gemm,7.73126,4665600,rocBlas,<unused>;miopenConvolutionFwdAlgoWinograd:ConvBinWinogradRxSf2x3g1,2.72658,0,miopenConvolutionFwdAlgoWinograd,<unused>
192-13-13-3x3-384-13-13-64-1x1-1x1-1x1-0-NCHW-FP32-F=miopenConvolutionFwdAlgoWinograd:ConvBinWinogradRxSf2x3g1,1.00977,0,miopenConvolutionFwdAlgoWinograd,<unused>
384-13-13-3x3-256-13-13-64-1x1-1x1-1x1-0-NCHW-FP32-F=miopenConvolutionFwdAlgoWinograd:ConvBinWinogradRxSf2x3g1,1.37841,0,miopenConvolutionFwdAlgoWinograd,<unused>
256-13-13-3x3-256-13-13-64-1x1-1x1-1x1-0-NCHW-FP32-F=miopenConvolutionFwdAlgoWinograd:ConvBinWinogradRxSf2x3g1,0.938088,0,miopenConvolutionFwdAlgoWinograd,<unused>
3-224-224-11x11-64-55-55-64-2x2-4x4-1x1-0-NCHW-FP16-F=miopenConvolutionFwdAlgoDirect:ConvOclDirectFwd11x11,1.35937,0,miopenConvolutionFwdAlgoDirect,<unused>;miopenConvolutionFwdAlgoGEMM:gemm,8.68358,2196150,rocBlas,<unused>
64-27-27-5x5-192-27-27-64-2x2-1x1-1x1-0-NCHW-FP16-F=miopenConvolutionFwdAlgoImplicitGEMM:ConvHipImplicitGemmV4R1Fwd,2.1485,0,miopenConvolutionFwdAlgoImplicitGEMM,<unused>;miopenConvolutionFwdAlgoDirect:ConvOclDirectFwd,3.38083,0,miopenConvolutionFwdAlgoDirect,<unused>;miopenConvolutionFwdAlgoGEMM:gemm,25.846,2332800,rocBlas,<unused>;miopenConvolutionFwdAlgoWinograd:ConvBinWinogradRxSf2x3g1,1.80786,0,miopenConvolutionFwdAlgoWinograd,<unused>
192-13-13-3x3-384-13-13-64-1x1-1x1-1x1-0-NCHW-FP16-F=miopenConvolutionFwdAlgoImplicitGEMM:ConvHipImplicitGemmV4R1Fwd,1.10177,0,miopenConvolutionFwdAlgoImplicitGEMM,<unused>;miopenConvolutionFwdAlgoDirect:ConvOclDirectFwd,2.83058,0,miopenConvolutionFwdAlgoDirect,<unused>;miopenConvolutionFwdAlgoGEMM:gemm,28.1192,584064,rocBlas,<unused>;miopenConvolutionFwdAlgoWinograd:ConvBinWinogradRxSf2x3g1,0.637766,0,miopenConvolutionFwdAlgoWinograd,<unused>
384-13-13-3x3-256-13-13-64-1x1-1x1-1x1-0-NCHW-FP16-F=miopenConvolutionFwdAlgoImplicitGEMM:ConvHipImplicitGemmV4R1Fwd,1.58193,0,miopenConvolutionFwdAlgoImplicitGEMM,<unused>;miopenConvolutionFwdAlgoDirect:ConvOclDirectFwd,4.17556,0,miopenConvolutionFwdAlgoDirect,<unused>;miopenConvolutionFwdAlgoGEMM:gemm,54.4364,1168128,rocBlas,<unused>;miopenConvolutionFwdAlgoWinograd:ConvBinWinogradRxSf2x3g1,0.851368,0,miopenConvolutionFwdAlgoWinograd,<unused>
256-13-13-3x3-256-13-13-64-1x1-1x1-1x1-0-NCHW-FP16-F=miopenConvolutionFwdAlgoImplicitGEMM:ConvHipImplicitGemmV4R1Fwd,1.05617,0,miopenConvolutionFwdAlgoImplicitGEMM,<unused>;miopenConvolutionFwdAlgoDirect:ConvOclDirectFwd,2.78354,0,miopenConvolutionFwdAlgoDirect,<unused>;miopenConvolutionFwdAlgoGEMM:gemm,36.9667,778752,rocBlas,<unused>;miopenConvolutionFwdAlgoWinograd:ConvBinWinogradRxSf2x3g1,0.589766,0,miopenConvolutionFwdAlgoWinograd,<unused>
3-224-224-7x7-64-112-112-32-3x3-2x2-1x1-0-NCHW-FP32-F=miopenConvolutionFwdAlgoDirect:ConvAsm7x7c3h224w224k64u2v2p3q3f1,0.901446,0,miopenConvolutionFwdAlgoDirect,<unused>;miopenConvolutionFwdAlgoGEMM:gemm,2.34496,7375872,rocBlas,<unused>;miopenConvolutionFwdAlgoWinograd:ConvBinWinogradRxSf2x3g1,1.50289,0,miopenConvolutionFwdAlgoWinograd,<unused>
64-56-56-1x1-128-56-56-32-0x0-1x1-1x1-0-NCHW-FP32-F=miopenConvolutionFwdAlgoImplicitGEMM:ConvHipImplicitGemmV4R1Fwd,0.240162,0,miopenConvolutionFwdAlgoImplicitGEMM,<unused>;miopenConvolutionFwdAlgoDirect:ConvOclDirectFwd1x1,0.212002,0,miopenConvolutionFwdAlgoDirect,<unused>;miopenConvolutionFwdAlgoGEMM:gemm,0.205442,0,rocBlas,<unused>;miopenConvolutionFwdAlgoWinograd:ConvBinWinogradRxSf3x2,0.683046,0,miopenConvolutionFwdAlgoWinograd,<unused>
128-56-56-3x3-32-56-56-32-1x1-1x1-1x1-0-NCHW-FP32-F=miopenConvolutionFwdAlgoWinograd:ConvBinWinogradRxSf2x3g1,0.464164,0,miopenConvolutionFwdAlgoWinograd,<unused>
96-56-56-1x1-128-56-56-32-0x0-1x1-1x1-0-NCHW-FP32-F=miopenConvolutionFwdAlgoImplicitGEMM:ConvHipImplicitGemmV4R1Fwd,0.304643,0,miopenConvolutionFwdAlgoImplicitGEMM,<unused>;miopenConvolutionFwdAlgoDirect:ConvOclDirectFwd1x1,0.352963,0,miopenConvolutionFwdAlgoDirect,<unused>;miopenConvolutionFwdAlgoGEMM:gemm,0.284482,0,rocBlas,<unused>;miopenConvolutionFwdAlgoWinograd:ConvBinWinogradRxSf3x2,0.938408,0,miopenConvolutionFwdAlgoWinograd,<unused>
128-56-56-1x1-128-56-56-32-0x0-1x1-1x1-0-NCHW-FP32-F=miopenConvolutionFwdAlgoImplicitGEMM:ConvHipImplicitGemmV4R1Fwd,0.420004,0,miopenConvolutionFwdAlgoImplicitGEMM,<unused>;miopenConvolutionFwdAlgoDirect:ConvOclDirectFwd1x1,0.467684,0,miopenConvolutionFwdAlgoDirect,<unused>;miopenConvolutionFwdAlgoGEMM:gemm,0.368964,0,rocBlas,<unused>;miopenConvolutionFwdAlgoWinograd:ConvBinWinogradRxSf3x2,1.21649,0,miopenConvolutionFwdAlgoWinograd,<unused>
160-56-56-1x1-128-56-56-32-0x0-1x1-1x1-0-NCHW-FP32-F=miopenConvolutionFwdAlgoImplicitGEMM:ConvHipImplicitGemmV4R1Fwd,0.464164,0,miopenConvolutionFwdAlgoImplicitGEMM,<unused>;miopenConvolutionFwdAlgoDirect:ConvOclDirectFwd1x1,0.486564,0,miopenConvolutionFwdAlgoDirect,<unused>;miopenConvolutionFwdAlgoGEMM:gemm,0.437444,0,rocBlas,<unused>;miopenConvolutionFwdAlgoWinograd:ConvBinWinogradRxSf3x2,1.46273,0,miopenConvolutionFwdAlgoWinograd,<unused>
192-56-56-1x1-128-56-56-32-0x0-1x1-1x1-0-NCHW-FP32-F=miopenConvolutionFwdAlgoImplicitGEMM:ConvHipImplicitGemmV4R1Fwd,0.595205,0,miopenConvolutionFwdAlgoImplicitGEMM,<unused>;miopenConvolutionFwdAlgoDirect:ConvOclDirectFwd1x1,0.586085,0,miopenConvolutionFwdAlgoDirect,<unused>;miopenConvolutionFwdAlgoGEMM:gemm,0.523044,0,rocBlas,<unused>;miopenConvolutionFwdAlgoWinograd:ConvBinWinogradRxSf3x2,1.75026,0,miopenConvolutionFwdAlgoWinograd,<unused>
224-56-56-1x1-128-56-56-32-0x0-1x1-1x1-0-NCHW-FP32-F=miopenConvolutionFwdAlgoImplicitGEMM:ConvHipImplicitGemmV4R1Fwd,0.667527,0,miopenConvolutionFwdAlgoImplicitGEMM,<unused>;miopenConvolutionFwdAlgoDirect:ConvAsm1x1U,0.794087,0,miopenConvolutionFwdAlgoDirect,<unused>;miopenConvolutionFwdAlgoGEMM:gemm,0.597285,0,rocBlas,<unused>;miopenConvolutionFwdAlgoWinograd:ConvBinWinogradRxSf3x2,1.98978,0,miopenConvolutionFwdAlgoWinograd,<unused>
256-56-56-1x1-128-56-56-32-0x0-1x1-1x1-0-NCHW-FP32-F=miopenConvolutionFwdAlgoImplicitGEMM:ConvHipImplicitGemmV4R1Fwd,0.753606,0,miopenConvolutionFwdAlgoImplicitGEMM,<unused>;miopenConvolutionFwdAlgoDirect:ConvOclDirectFwd1x1,0.756165,0,miopenConvolutionFwdAlgoDirect,<unused>;miopenConvolutionFwdAlgoGEMM:gemm,0.683845,0,rocBlas,<unused>;miopenConvolutionFwdAlgoWinograd:ConvBinWinogradRxSf3x2,2.29506,0,miopenConvolutionFwdAlgoWinograd,<unused>
128-28-28-1x1-128-28-28-32-0x0-1x1-1x1-0-NCHW-FP32-F=miopenConvolutionFwdAlgoImplicitGEMM:ConvHipImplicitGemmV4R1Fwd,0.113281,0,miopenConvolutionFwdAlgoImplicitGEMM,<unused>;miopenConvolutionFwdAlgoDirect:ConvOclDirectFwd1x1,0.119041,0,miopenConvolutionFwdAlgoDirect,<unused>;miopenConvolutionFwdAlgoGEMM:gemm,0.121921,0,rocBlas,<unused>;miopenConvolutionFwdAlgoWinograd:ConvBinWinogradRxSf3x2,0.370563,0,miopenConvolutionFwdAlgoWinograd,<unused>
128-28-28-3x3-32-28-28-32-1x1-1x1-1x1-0-NCHW-FP32-F=miopenConvolutionFwdAlgoWinograd:ConvBinWinogradRxSf2x3g1,0.150081,0,miopenConvolutionFwdAlgoWinograd,<unused>
160-28-28-1x1-128-28-28-32-0x0-1x1-1x1-0-NCHW-FP32-F=miopenConvolutionFwdAlgoImplicitGEMM:ConvHipImplicitGemmV4R1Fwd,0.175042,0,miopenConvolutionFwdAlgoImplicitGEMM,<unused>;miopenConvolutionFwdAlgoDirect:ConvOclDirectFwd1x1,0.152801,0,miopenConvolutionFwdAlgoDirect,<unused>;miopenConvolutionFwdAlgoGEMM:gemm,0.145281,0,rocBlas,<unused>;miopenConvolutionFwdAlgoWinograd:ConvBinWinogradRxSf3x2,0.440164,0,miopenConvolutionFwdAlgoWinograd,<unused>
192-28-28-1x1-128-28-28-32-0x0-1x1-1x1-0-NCHW-FP32-F=miopenConvolutionFwdAlgoImplicitGEMM:ConvHipImplicitGemmV4R1Fwd,0.161602,0,miopenConvolutionFwdAlgoImplicitGEMM,<unused>;miopenConvolutionFwdAlgoDirect:ConvOclDirectFwd1x1,0.155361,0,miopenConvolutionFwdAlgoDirect,<unused>;miopenConvolutionFwdAlgoGEMM:gemm,0.165922,0,rocBlas,<unused>;miopenConvolutionFwdAlgoWinograd:ConvBinWinogradRxSf3x2,0.522885,0,miopenConvolutionFwdAlgoWinograd,<unused>
224-28-28-1x1-128-28-28-32-0x0-1x1-1x1-0-NCHW-FP32-F=miopenConvolutionFwdAlgoImplicitGEMM:ConvHipImplicitGemmV4R1Fwd,0.173441,0,miopenConvolutionFwdAlgoImplicitGEMM,<unused>;miopenConvolutionFwdAlgoDirect:ConvOclDirectFwd1x1,0.214402,0,miopenConvolutionFwdAlgoDirect,<unused>;miopenConvolutionFwdAlgoGEMM:gemm,0.190561,0,rocBlas,<unused>;miopenConvolutionFwdAlgoWinograd:ConvBinWinogradRxSf3x2,0.591046,0,miopenConvolutionFwdAlgoWinograd,<unused>
256-28-28-1x1-128-28-28-32-0x0-1x1-1x1-0-NCHW-FP32-F=miopenConvolutionFwdAlgoImplicitGEMM:ConvHipImplicitGemmV4R1Fwd,0.207842,0,miopenConvolutionFwdAlgoImplicitGEMM,<unused>;miopenConvolutionFwdAlgoDirect:ConvOclDirectFwd1x1,0.238402,0,miopenConvolutionFwdAlgoDirect,<unused>;miopenConvolutionFwdAlgoGEMM:gemm,0.218562,0,rocBlas,<unused>;miopenConvolutionFwdAlgoWinograd:ConvBinWinogradRxSf3x2,0.676327,0,miopenConvolutionFwdAlgoWinograd,<unused>
288-28-28-1x1-128-28-28-32-0x0-1x1-1x1-0-NCHW-FP32-F=miopenConvolutionFwdAlgoImplicitGEMM:ConvHipImplicitGemmV4R1Fwd,0.218083,0,miopenConvolutionFwdAlgoImplicitGEMM,<unused>;miopenConvolutionFwdAlgoDirect:ConvOclDirectFwd1x1,0.309603,0,miopenConvolutionFwdAlgoDirect,<unused>;miopenConvolutionFwdAlgoGEMM:gemm,0.233922,0,rocBlas,<unused>;miopenConvolutionFwdAlgoWinograd:ConvBinWinogradRxSf3x2,0.743207,0,miopenConvolutionFwdAlgoWinograd,<unused>
320-28-28-1x1-128-28-28-32-0x0-1x1-1x1-0-NCHW-FP32-F=miopenConvolutionFwdAlgoImplicitGEMM:ConvHipImplicitGemmV4R1Fwd,0.283843,0,miopenConvolutionFwdAlgoImplicitGEMM,<unused>;miopenConvolutionFwdAlgoDirect:ConvOclDirectFwd1x1,0.304003,0,miopenConvolutionFwdAlgoDirect,<unused>;miopenConvolutionFwdAlgoGEMM:gemm,0.259843,0,rocBlas,<unused>;miopenConvolutionFwdAlgoWinograd:ConvBinWinogradRxSf3x2,0.829929,0,miopenConvolutionFwdAlgoWinograd,<unused>
352-28-28-1x1-128-28-28-32-0x0-1x1-1x1-0-NCHW-FP32-F=miopenConvolutionFwdAlgoImplicitGEMM:ConvHipImplicitGemmV4R1Fwd,0.264003,0,miopenConvolutionFwdAlgoImplicitGEMM,<unused>;miopenConvolutionFwdAlgoDirect:ConvOclDirectFwd1x1,0.285123,0,miopenConvolutionFwdAlgoDirect,<unused>;miopenConvolutionFwdAlgoGEMM:gemm,0.279523,0,rocBlas,<unused>;miopenConvolutionFwdAlgoWinograd:ConvBinWinogradRxSf3x2,0.893449,0,miopenConvolutionFwdAlgoWinograd,<unused>
384-28-28-1x1-128-28-28-32-0x0-1x1-1x1-0-NCHW-FP32-F=miopenConvolutionFwdAlgoImplicitGEMM:ConvHipImplicitGemmV4R1Fwd,0.308803,0,miopenConvolutionFwdAlgoImplicitGEMM,<unused>;miopenConvolutionFwdAlgoDirect:ConvOclDirectFwd1x1,0.314403,0,miopenConvolutionFwdAlgoDirect,<unused>;miopenConvolutionFwdAlgoGEMM:gemm,0.691207,0,rocBlas,<unused>;miopenConvolutionFwdAlgoWinograd:ConvBinWinogradRxSf3x2,0.98433,0,miopenConvolutionFwdAlgoWinograd,<unused>
416-28-28-1x1-128-28-28-32-0x0-1x1-1x1-0-NCHW-FP32-F=miopenConvolutionFwdAlgoImplicitGEMM:ConvHipImplicitGemmV4R1Fwd,0.309123,0,miopenConvolutionFwdAlgoImplicitGEMM,<unused>;miopenConvolutionFwdAlgoDirect:ConvAsm1x1U,0.393925,0,miopenConvolutionFwdAlgoDirect,<unused>;miopenConvolutionFwdAlgoGEMM:gemm,0.319043,0,rocBlas,<unused>;miopenConvolutionFwdAlgoWinograd:ConvBinWinogradRxSf3x2,1.04577,0,miopenConvolutionFwdAlgoWinograd,<unused>
448-28-28-1x1-128-28-28-32-0x0-1x1-1x1-0-NCHW-FP32-F=miopenConvolutionFwdAlgoImplicitGEMM:ConvHipImplicitGemmV4R1Fwd,0.355844,0,miopenConvolutionFwdAlgoImplicitGEMM,<unused>;miopenConvolutionFwdAlgoDirect:ConvOclDirectFwd1x1,0.362084,0,miopenConvolutionFwdAlgoDirect,<unused>;miopenConvolutionFwdAlgoGEMM:gemm,0.351364,0,rocBlas,<unused>;miopenConvolutionFwdAlgoWinograd:ConvBinWinogradRxSf3x2,1.13761,0,miopenConvolutionFwdAlgoWinograd,<unused>
480-28-28-1x1-128-28-28-32-0x0-1x1-1x1-0-NCHW-FP32-F=miopenConvolutionFwdAlgoImplicitGEMM:ConvHipImplicitGemmV4R1Fwd,0.354564,0,miopenConvolutionFwdAlgoImplicitGEMM,<unused>;miopenConvolutionFwdAlgoDirect:ConvOclDirectFwd1x1,0.387204,0,miopenConvolutionFwdAlgoDirect,<unused>;miopenConvolutionFwdAlgoGEMM:gemm,0.364164,0,rocBlas,<unused>;miopenConvolutionFwdAlgoWinograd:ConvBinWinogradRxSf3x2,1.19505,0,miopenConvolutionFwdAlgoWinograd,<unused>
512-28-28-1x1-256-28-28-32-0x0-1x1-1x1-0-NCHW-FP32-F=miopenConvolutionFwdAlgoImplicitGEMM:ConvHipImplicitGemmV4R1Fwd,0.781434,0,miopenConvolutionFwdAlgoImplicitGEMM,<unused>;miopenConvolutionFwdAlgoDirect:ConvOclDirectFwd1x1,0.944633,0,miopenConvolutionFwdAlgoDirect,<unused>;miopenConvolutionFwdAlgoGEMM:gemm,0.729594,0,rocBlas,<unused>;miopenConvolutionFwdAlgoWinograd:ConvBinWinogradRxSf3x2,2.55934,0,miopenConvolutionFwdAlgoWinograd,<unused>
256-14-14-1x1-128-14-14-32-0x0-1x1-1x1-0-NCHW-FP32-F=miopenConvolutionFwdAlgoImplicitGEMM:ConvHipImplicitGemmV4R1Fwd,0.076001,0,miopenConvolutionFwdAlgoImplicitGEMM,<unused>;miopenConvolutionFwdAlgoDirect:ConvOclDirectFwd1x1,0.101761,0,miopenConvolutionFwdAlgoDirect,<unused>;miopenConvolutionFwdAlgoGEMM:gemm,0.217282,0,rocBlas,<unused>;miopenConvolutionFwdAlgoWinograd:ConvBinWinogradRxSf3x2,0.214402,0,miopenConvolutionFwdAlgoWinograd,<unused>
128-14-14-3x3-32-14-14-32-1x1-1x1-1x1-0-NCHW-FP32-F=miopenConvolutionFwdAlgoWinograd:ConvBinWinogradRxSf2x3g1,0.05632,0,miopenConvolutionFwdAlgoWinograd,<unused>
288-14-14-1x1-128-14-14-32-0x0-1x1-1x1-0-NCHW-FP32-F=miopenConvolutionFwdAlgoImplicitGEMM:ConvHipImplicitGemmV4R1Fwd,0.085921,0,miopenConvolutionFwdAlgoImplicitGEMM,<unused>;miopenConvolutionFwdAlgoDirect:ConvAsm1x1U,0.100321,0,miopenConvolutionFwdAlgoDirect,<unused>;miopenConvolutionFwdAlgoGEMM:gemm,0.229762,0,rocBlas,<unused>;miopenConvolutionFwdAlgoWinograd:ConvBinWinogradRxSf3x2,0.233123,0,miopenConvolutionFwdAlgoWinograd,<unused>
320-14-14-1x1-128-14-14-32-0x0-1x1-1x1-0-NCHW-FP32-F=miopenConvolutionFwdAlgoImplicitGEMM:ConvHipImplicitGemmV4R1Fwd,0.089601,0,miopenConvolutionFwdAlgoImplicitGEMM,<unused>;miopenConvolutionFwdAlgoDirect:ConvOclDirectFwd1x1,0.087201,0,miopenConvolutionFwdAlgoDirect,<unused>;miopenConvolutionFwdAlgoGEMM:gemm,0.242242,0,rocBlas,<unused>;miopenConvolutionFwdAlgoWinograd:ConvBinWinogradRxSf3x2,0.258723,0,miopenConvolutionFwdAlgoWinograd,<unused>
352-14-14-1x1-128-14-14-32-0x0-1x1-1x1-0-NCHW-FP32-F=miopenConvolutionFwdAlgoImplicitGEMM:ConvHipImplicitGemmV4R1Fwd,0.088001,0,miopenConvolutionFwdAlgoImplicitGEMM,<unused>;miopenConvolutionFwdAlgoDirect:ConvOclDirectFwd1x1,0.095521,0,miopenConvolutionFwdAlgoDirect,<unused>;miopenConvolutionFwdAlgoGEMM:gemm,0.257443,0,rocBlas,<unused>;miopenConvolutionFwdAlgoWinograd:ConvBinWinogradRxSf3x2,0.276003,0,miopenConvolutionFwdAlgoWinograd,<unused>
384-14-14-1x1-128-14-14-32-0x0-1x1-1x1-0-NCHW-FP32-F=miopenConvolutionFwdAlgoImplicitGEMM:ConvHipImplicitGemmV4R1Fwd,0.107041,0,miopenConvolutionFwdAlgoImplicitGEMM,<unused>;miopenConvolutionFwdAlgoDirect:ConvOclDirectFwd1x1,0.103841,0,miopenConvolutionFwdAlgoDirect,<unused>;miopenConvolutionFwdAlgoGEMM:gemm,0.155042,0,rocBlas,<unused>;miopenConvolutionFwdAlgoWinograd:ConvBinWinogradRxSf3x2,0.303204,0,miopenConvolutionFwdAlgoWinograd,<unused>
416-14-14-1x1-128-14-14-32-0x0-1x1-1x1-0-NCHW-FP32-F=miopenConvolutionFwdAlgoImplicitGEMM:ConvHipImplicitGemmV4R1Fwd,0.103681,0,miopenConvolutionFwdAlgoImplicitGEMM,<unused>;miopenConvolutionFwdAlgoDirect:ConvOclDirectFwd1x1,0.113601,0,miopenConvolutionFwdAlgoDirect,<unused>;miopenConvolutionFwdAlgoGEMM:gemm,0.165602,0,rocBlas,<unused>;miopenConvolutionFwdAlgoWinograd:ConvBinWinogradRxSf3x2,0.320484,0,miopenConvolutionFwdAlgoWinograd,<unused>
448-14-14-1x1-128-14-14-32-0x0-1x1-1x1-0-NCHW-FP32-F=miopenConvolutionFwdAlgoImplicitGEMM:ConvHipImplicitGemmV4R1Fwd,0.124961,0,miopenConvolutionFwdAlgoImplicitGEMM,<unused>;miopenConvolutionFwdAlgoDirect:ConvOclDirectFwd1x1,0.120801,0,miopenConvolutionFwdAlgoDirect,<unused>;miopenConvolutionFwdAlgoGEMM:gemm,0.173282,0,rocBlas,<unused>;miopenConvolutionFwdAlgoWinograd:ConvBinWinogradRxSf3x2,0.347364,0,miopenConvolutionFwdAlgoWinograd,<unused>
480-14-14-1x1-128-14-14-32-0x0-1x1-1x1-0-NCHW-FP32-F=miopenConvolutionFwdAlgoImplicitGEMM:ConvHipImplicitGemmV4R1Fwd,0.125281,0,miopenConvolutionFwdAlgoImplicitGEMM,<unused>;miopenConvolutionFwdAlgoDirect:ConvOclDirectFwd1x1,0.145922,0,miopenConvolutionFwdAlgoDirect,<unused>;miopenConvolutionFwdAlgoGEMM:gemm,0.185442,0,rocBlas,<unused>;miopenConvolutionFwdAlgoWinograd:ConvBinWinogradRxSf3x2,0.364324,0,miopenConvolutionFwdAlgoWinograd,<unused>
512-14-14-1x1-128-14-14-32-0x0-1x1-1x1-0-NCHW-FP32-F=miopenConvolutionFwdAlgoImplicitGEMM:ConvHipImplicitGemmV4R1Fwd,0.139362,0,miopenConvolutionFwdAlgoImplicitGEMM,<unused>;miopenConvolutionFwdAlgoDirect:ConvAsm1x1U,0.199043,0,miopenConvolutionFwdAlgoDirect,<unused>;miopenConvolutionFwdAlgoGEMM:gemm,0.193602,0,rocBlas,<unused>;miopenConvolutionFwdAlgoWinograd:ConvBinWinogradRxSf3x2,0.392484,0,miopenConvolutionFwdAlgoWinograd,<unused>
544-14-14-1x1-128-14-14-32-0x0-1x1-1x1-0-NCHW-FP32-F=miopenConvolutionFwdAlgoImplicitGEMM:ConvHipImplicitGemmV4R1Fwd,0.132641,0,miopenConvolutionFwdAlgoImplicitGEMM,<unused>;miopenConvolutionFwdAlgoDirect:ConvOclDirectFwd1x1,0.145922,0,miopenConvolutionFwdAlgoDirect,<unused>;miopenConvolutionFwdAlgoGEMM:gemm,0.191202,0,rocBlas,<unused>;miopenConvolutionFwdAlgoWinograd:ConvBinWinogradRxSf3x2,0.410245,0,miopenConvolutionFwdAlgoWinograd,<unused>
576-14-14-1x1-128-14-14-32-0x0-1x1-1x1-0-NCHW-FP32-F=miopenConvolutionFwdAlgoImplicitGEMM:ConvHipImplicitGemmV4R1Fwd,0.142402,0,miopenConvolutionFwdAlgoImplicitGEMM,<unused>;miopenConvolutionFwdAlgoDirect:ConvOclDirectFwd1x1,0.155522,0,miopenConvolutionFwdAlgoDirect,<unused>;miopenConvolutionFwdAlgoGEMM:gemm,0.206082,0,rocBlas,<unused>;miopenConvolutionFwdAlgoWinograd:ConvBinWinogradRxSf3x2,0.436325,0,miopenConvolutionFwdAlgoWinograd,<unused>
608-14-14-1x1-128-14-14-32-0x0-1x1-1x1-0-NCHW-FP32-F=miopenConvolutionFwdAlgoImplicitGEMM:ConvHipImplicitGemmV4R1Fwd,0.146881,0,miopenConvolutionFwdAlgoImplicitGEMM,<unused>;miopenConvolutionFwdAlgoDirect:ConvOclDirectFwd1x1,0.162082,0,miopenConvolutionFwdAlgoDirect,<unused>;miopenConvolutionFwdAlgoGEMM:gemm,0.211362,0,rocBlas,<unused>;miopenConvolutionFwdAlgoWinograd:ConvBinWinogradRxSf3x2,0.452485,0,miopenConvolutionFwdAlgoWinograd,<unused>
640-14-14-1x1-128-14-14-32-0x0-1x1-1x1-0-NCHW-FP32-F=miopenConvolutionFwdAlgoImplicitGEMM:ConvHipImplicitGemmV4R1Fwd,0.159042,0,miopenConvolutionFwdAlgoImplicitGEMM,<unused>;miopenConvolutionFwdAlgoDirect:ConvOclDirectFwd1x1,0.173922,0,miopenConvolutionFwdAlgoDirect,<unused>;miopenConvolutionFwdAlgoGEMM:gemm,0.223363,0,rocBlas,<unused>;miopenConvolutionFwdAlgoWinograd:ConvBinWinogradRxSf3x2,0.481925,0,miopenConvolutionFwdAlgoWinograd,<unused>
672-14-14-1x1-128-14-14-32-0x0-1x1-1x1-0-NCHW-FP32-F=miopenConvolutionFwdAlgoImplicitGEMM:ConvHipImplicitGemmV4R1Fwd,0.179682,0,miopenConvolutionFwdAlgoImplicitGEMM,<unused>;miopenConvolutionFwdAlgoDirect:ConvOclDirectFwd1x1,0.178562,0,miopenConvolutionFwdAlgoDirect,<unused>;miopenConvolutionFwdAlgoGEMM:gemm,0.316484,0,rocBlas,<unused>;miopenConvolutionFwdAlgoWinograd:ConvBinWinogradRxSf3x2,0.496326,0,miopenConvolutionFwdAlgoWinograd,<unused>
704-14-14-1x1-128-14-14-32-0x0-1x1-1x1-0-NCHW-FP32-F=miopenConvolutionFwdAlgoImplicitGEMM:ConvHipImplicitGemmV4R1Fwd,0.172962,0,miopenConvolutionFwdAlgoImplicitGEMM,<unused>;miopenConvolutionFwdAlgoDirect:ConvOclDirectFwd1x1,0.190562,0,miopenConvolutionFwdAlgoDirect,<unused>;miopenConvolutionFwdAlgoGEMM:gemm,0.332804,0,rocBlas,<unused>;miopenConvolutionFwdAlgoWinograd:ConvBinWinogradRxSf3x2,0.525286,0,miopenConvolutionFwdAlgoWinograd,<unused>
736-14-14-1x1-128-14-14-32-0x0-1x1-1x1-0-NCHW-FP32-F=miopenConvolutionFwdAlgoImplicitGEMM:ConvHipImplicitGemmV4R1Fwd,0.177122,0,miopenConvolutionFwdAlgoImplicitGEMM,<unused>;miopenConvolutionFwdAlgoDirect:ConvOclDirectFwd1x1,0.196322,0,miopenConvolutionFwdAlgoDirect,<unused>;miopenConvolutionFwdAlgoGEMM:gemm,0.344484,0,rocBlas,<unused>;miopenConvolutionFwdAlgoWinograd:ConvBinWinogradRxSf3x2,0.540966,0,miopenConvolutionFwdAlgoWinograd,<unused>
768-14-14-1x1-128-14-14-32-0x0-1x1-1x1-0-NCHW-FP32-F=miopenConvolutionFwdAlgoImplicitGEMM:ConvHipImplicitGemmV4R1Fwd,0.192802,0,miopenConvolutionFwdAlgoImplicitGEMM,<unused>;miopenConvolutionFwdAlgoDirect:ConvOclDirectFwd1x1,0.207682,0,miopenConvolutionFwdAlgoDirect,<unused>;miopenConvolutionFwdAlgoGEMM:gemm,0.382885,0,rocBlas,<unused>;miopenConvolutionFwdAlgoWinograd:ConvBinWinogradRxSf3x2,0.570406,0,miopenConvolutionFwdAlgoWinograd,<unused>
800-14-14-1x1-128-14-14-32-0x0-1x1-1x1-0-NCHW-FP32-F=miopenConvolutionFwdAlgoImplicitGEMM:ConvHipImplicitGemmV4R1Fwd,0.191521,0,miopenConvolutionFwdAlgoImplicitGEMM,<unused>;miopenConvolutionFwdAlgoDirect:ConvOclDirectFwd1x1,0.217442,0,miopenConvolutionFwdAlgoDirect,<unused>;miopenConvolutionFwdAlgoGEMM:gemm,0.372324,0,rocBlas,<unused>;miopenConvolutionFwdAlgoWinograd:ConvBinWinogradRxSf3x2,0.583686,0,miopenConvolutionFwdAlgoWinograd,<unused>
832-14-14-1x1-128-14-14-32-0x0-1x1-1x1-0-NCHW-FP32-F=miopenConvolutionFwdAlgoImplicitGEMM:ConvHipImplicitGemmV4R1Fwd,0.202721,0,miopenConvolutionFwdAlgoImplicitGEMM,<unused>;miopenConvolutionFwdAlgoDirect:ConvOclDirectFwd1x1,0.225281,0,miopenConvolutionFwdAlgoDirect,<unused>;miopenConvolutionFwdAlgoGEMM:gemm,0.391682,0,rocBlas,<unused>;miopenConvolutionFwdAlgoWinograd:ConvBinWinogradRxSf3x2,0.616963,0,miopenConvolutionFwdAlgoWinograd,<unused>
864-14-14-1x1-128-14-14-32-0x0-1x1-1x1-0-NCHW-FP32-F=miopenConvolutionFwdAlgoImplicitGEMM:ConvHipImplicitGemmV4R1Fwd,0.228,0,miopenConvolutionFwdAlgoImplicitGEMM,<unused>;miopenConvolutionFwdAlgoDirect:ConvOclDirectFwd1x1,0.2336,0,miopenConvolutionFwdAlgoDirect,<unused>;miopenConvolutionFwdAlgoGEMM:gemm,0.401921,0,rocBlas,<unused>;miopenConvolutionFwdAlgoWinograd:ConvBinWinogradRxSf3x2,0.625121,0,miopenConvolutionFwdAlgoWinograd,<unused>
896-14-14-1x1-128-14-14-32-0x0-1x1-1x1-0-NCHW-FP32-F=miopenConvolutionFwdAlgoImplicitGEMM:ConvHipImplicitGemmV4R1Fwd,0.2576,0,miopenConvolutionFwdAlgoImplicitGEMM,<unused>;miopenConvolutionFwdAlgoDirect:ConvOclDirectFwd1x1,0.24,0,miopenConvolutionFwdAlgoDirect,<unused>;miopenConvolutionFwdAlgoGEMM:gemm,0.301281,0,rocBlas,<unused>;miopenConvolutionFwdAlgoWinograd:ConvBinWinogradRxSf3x2,0.660162,0,miopenConvolutionFwdAlgoWinograd,<unused>
928-14-14-1x1-128-14-14-32-0x0-1x1-1x1-0-NCHW-FP32-F=miopenConvolutionFwdAlgoImplicitGEMM:ConvHipImplicitGemmV4R1Fwd,0.220639,0,miopenConvolutionFwdAlgoImplicitGEMM,<unused>;miopenConvolutionFwdAlgoDirect:ConvOclDirectFwd1x1,0.24848,0,miopenConvolutionFwdAlgoDirect,<unused>;miopenConvolutionFwdAlgoGEMM:gemm,0.309601,0,rocBlas,<unused>;miopenConvolutionFwdAlgoWinograd:ConvBinWinogradRxSf3x2,0.669761,0,miopenConvolutionFwdAlgoWinograd,<unused>
960-14-14-1x1-128-14-14-32-0x0-1x1-1x1-0-NCHW-FP32-F=miopenConvolutionFwdAlgoImplicitGEMM:ConvHipImplicitGemmV4R1Fwd,0.25088,0,miopenConvolutionFwdAlgoImplicitGEMM,<unused>;miopenConvolutionFwdAlgoDirect:ConvOclDirectFwd1x1,0.25504,0,miopenConvolutionFwdAlgoDirect,<unused>;miopenConvolutionFwdAlgoGEMM:gemm,0.32416,0,rocBlas,<unused>;miopenConvolutionFwdAlgoWinograd:ConvBinWinogradRxSf3x2,0.70544,0,miopenConvolutionFwdAlgoWinograd,<unused>
992-14-14-1x1-128-14-14-32-0x0-1x1-1x1-0-NCHW-FP32-F=miopenConvolutionFwdAlgoImplicitGEMM:ConvHipImplicitGemmV4R1Fwd,0.24688,0,miopenConvolutionFwdAlgoImplicitGEMM,<unused>;miopenConvolutionFwdAlgoDirect:ConvOclDirectFwd1x1,0.26592,0,miopenConvolutionFwdAlgoDirect,<unused>;miopenConvolutionFwdAlgoGEMM:gemm,0.33536,0,rocBlas,<unused>;miopenConvolutionFwdAlgoWinograd:ConvBinWinogradRxSf3x2,0.71552,0,miopenConvolutionFwdAlgoWinograd,<unused>
1024-14-14-1x1-512-14-14-32-0x0-1x1-1x1-0-NCHW-FP32-F=miopenConvolutionFwdAlgoImplicitGEMM:ConvHipImplicitGemmV4R1Fwd,0.914063,0,miopenConvolutionFwdAlgoImplicitGEMM,<unused>;miopenConvolutionFwdAlgoDirect:ConvOclDirectFwd1x1,1.19518,0,miopenConvolutionFwdAlgoDirect,<unused>;miopenConvolutionFwdAlgoGEMM:gemm,1.31102,0,rocBlas,<unused>;miopenConvolutionFwdAlgoWinograd:ConvBinWinogradRxSf3x2,2.55499,0,miopenConvolutionFwdAlgoWinograd,<unused>
512-7-7-1x1-128-7-7-32-0x0-1x1-1x1-0-NCHW-FP32-F=miopenConvolutionFwdAlgoImplicitGEMM:ConvHipImplicitGemmV4R1Fwd,0.0928,0,miopenConvolutionFwdAlgoImplicitGEMM,<unused>;miopenConvolutionFwdAlgoDirect:ConvOclDirectFwd1x1,0.0528,0,miopenConvolutionFwdAlgoDirect,<unused>;miopenConvolutionFwdAlgoGEMM:gemm,0.11504,0,rocBlas,<unused>;miopenConvolutionFwdAlgoWinograd:ConvBinWinogradRxSf3x2,0.21008,0,miopenConvolutionFwdAlgoWinograd,<unused>
128-7-7-3x3-32-7-7-32-1x1-1x1-1x1-0-NCHW-FP32-F=miopenConvolutionFwdAlgoWinograd:ConvBinWinogradRxSf2x3g1,0.05584,0,miopenConvolutionFwdAlgoWinograd,<unused>
544-7-7-1x1-128-7-7-32-0x0-1x1-1x1-0-NCHW-FP32-F=miopenConvolutionFwdAlgoImplicitGEMM:ConvHipImplicitGemmV4R1Fwd,0.0704,0,miopenConvolutionFwdAlgoImplicitGEMM,<unused>;miopenConvolutionFwdAlgoDirect:ConvOclDirectFwd1x1,0.06368,0,miopenConvolutionFwdAlgoDirect,<unused>;miopenConvolutionFwdAlgoGEMM:gemm,0.11168,0,rocBlas,<unused>;miopenConvolutionFwdAlgoWinograd:ConvBinWinogradRxSf3x2,0.218239,0,miopenConvolutionFwdAlgoWinograd,<unused>
576-7-7-1x1-128-7-7-32-0x0-1x1-1x1-0-NCHW-FP32-F=miopenConvolutionFwdAlgoImplicitGEMM:ConvHipImplicitGemmV4R1Fwd,0.07568,0,miopenConvolutionFwdAlgoImplicitGEMM,<unused>;miopenConvolutionFwdAlgoDirect:ConvOclDirectFwd1x1,0.06368,0,miopenConvolutionFwdAlgoDirect,<unused>;miopenConvolutionFwdAlgoGEMM:gemm,0.115199,0,rocBlas,<unused>;miopenConvolutionFwdAlgoWinograd:ConvBinWinogradRxSf3x2,0.232798,0,miopenConvolutionFwdAlgoWinograd,<unused>
608-7-7-1x1-128-7-7-32-0x0-1x1-1x1-0-NCHW-FP32-F=miopenConvolutionFwdAlgoImplicitGEMM:ConvHipImplicitGemmV4R1Fwd,0.078239,0,miopenConvolutionFwdAlgoImplicitGEMM,<unused>;miopenConvolutionFwdAlgoDirect:ConvOclDirectFwd1x1,0.065919,0,miopenConvolutionFwdAlgoDirect,<unused>;miopenConvolutionFwdAlgoGEMM:gemm,0.119839,0,rocBlas,<unused>;miopenConvolutionFwdAlgoWinograd:ConvBinWinogradRxSf3x2,0.240158,0,miopenConvolutionFwdAlgoWinograd,<unused>
640-7-7-1x1-128-7-7-32-0x0-1x1-1x1-0-NCHW-FP32-F=miopenConvolutionFwdAlgoImplicitGEMM:ConvHipImplicitGemmV4R1Fwd,0.089439,0,miopenConvolutionFwdAlgoImplicitGEMM,<unused>;miopenConvolutionFwdAlgoDirect:ConvOclDirectFwd1x1,0.078879,0,miopenConvolutionFwdAlgoDirect,<unused>;miopenConvolutionFwdAlgoGEMM:gemm,0.126238,0,rocBlas,<unused>;miopenConvolutionFwdAlgoWinograd:ConvBinWinogradRxSf3x2,0.254557,0,miopenConvolutionFwdAlgoWinograd,<unused>
672-7-7-1x1-128-7-7-32-0x0-1x1-1x1-0-NCHW-FP32-F=miopenConvolutionFwdAlgoImplicitGEMM:ConvHipImplicitGemmV4R1Fwd,0.085919,0,miopenConvolutionFwdAlgoImplicitGEMM,<unused>;miopenConvolutionFwdAlgoDirect:ConvOclDirectFwd1x1,0.072959,0,miopenConvolutionFwdAlgoDirect,<unused>;miopenConvolutionFwdAlgoGEMM:gemm,0.126878,0,rocBlas,<unused>;miopenConvolutionFwdAlgoWinograd:ConvBinWinogradRxSf3x2,0.262717,0,miopenConvolutionFwdAlgoWinograd,<unused>
704-7-7-1x1-128-7-7-32-0x0-1x1-1x1-0-NCHW-FP32-F=miopenConvolutionFwdAlgoImplicitGEMM:ConvHipImplicitGemmV4R1Fwd,0.091199,0,miopenConvolutionFwdAlgoImplicitGEMM,<unused>;miopenConvolutionFwdAlgoDirect:ConvOclDirectFwd1x1,0.074079,0,miopenConvolutionFwdAlgoDirect,<unused>;miopenConvolutionFwdAlgoGEMM:gemm,0.122398,0,rocBlas,<unused>;miopenConvolutionFwdAlgoWinograd:ConvBinWinogradRxSf3x2,0.276316,0,miopenConvolutionFwdAlgoWinograd,<unused>
736-7-7-1x1-128-7-7-32-0x0-1x1-1x1-0-NCHW-FP32-F=miopenConvolutionFwdAlgoImplicitGEMM:ConvHipImplicitGemmV4R1Fwd,0.093438,0,miopenConvolutionFwdAlgoImplicitGEMM,<unused>;miopenConvolutionFwdAlgoDirect:ConvOclDirectFwd1x1,0.075359,0,miopenConvolutionFwdAlgoDirect,<unused>;miopenConvolutionFwdAlgoGEMM:gemm,0.124638,0,rocBlas,<unused>;miopenConvolutionFwdAlgoWinograd:ConvBinWinogradRxSf3x2,0.286075,0,miopenConvolutionFwdAlgoWinograd,<unused>
768-7-7-1x1-128-7-7-32-0x0-1x1-1x1-0-NCHW-FP32-F=miopenConvolutionFwdAlgoImplicitGEMM:ConvHipImplicitGemmV4R1Fwd,0.114398,0,miopenConvolutionFwdAlgoImplicitGEMM,<unused>;miopenConvolutionFwdAlgoDirect:ConvOclDirectFwd1x1,0.082238,0,miopenConvolutionFwdAlgoDirect,<unused>;miopenConvolutionFwdAlgoGEMM:gemm,0.135838,0,rocBlas,<unused>;miopenConvolutionFwdAlgoWinograd:ConvBinWinogradRxSf3x2,0.299995,0,miopenConvolutionFwdAlgoWinograd,<unused>
800-7-7-1x1-128-7-7-32-0x0-1x1-1x1-0-NCHW-FP32-F=miopenConvolutionFwdAlgoImplicitGEMM:ConvHipImplicitGemmV4R1Fwd,0.118078,0,miopenConvolutionFwdAlgoImplicitGEMM,<unused>;miopenConvolutionFwdAlgoDirect:ConvOclDirectFwd1x1,0.078718,0,miopenConvolutionFwdAlgoDirect,<unused>;miopenConvolutionFwdAlgoGEMM:gemm,0.141277,0,rocBlas,<unused>;miopenConvolutionFwdAlgoWinograd:ConvBinWinogradRxSf3x2,0.305755,0,miopenConvolutionFwdAlgoWinograd,<unused>
832-7-7-1x1-128-7-7-32-0x0-1x1-1x1-0-NCHW-FP32-F=miopenConvolutionFwdAlgoImplicitGEMM:ConvHipImplicitGemmV4R1Fwd,0.106398,0,miopenConvolutionFwdAlgoImplicitGEMM,<unused>;miopenConvolutionFwdAlgoDirect:ConvAsm1x1U,0.087519,0,miopenConvolutionFwdAlgoDirect,<unused>;miopenConvolutionFwdAlgoGEMM:gemm,0.142077,0,rocBlas,<unused>;miopenConvolutionFwdAlgoWinograd:ConvBinWinogradRxSf3x2,0.320634,0,miopenConvolutionFwdAlgoWinograd,<unused>
864-7-7-1x1-128-7-7-32-0x0-1x1-1x1-0-NCHW-FP32-F=miopenConvolutionFwdAlgoImplicitGEMM:ConvHipImplicitGemmV4R1Fwd,0.108797,0,miopenConvolutionFwdAlgoImplicitGEMM,<unused>;miopenConvolutionFwdAlgoDirect:ConvOclDirectFwd1x1,0.083198,0,miopenConvolutionFwdAlgoDirect,<unused>;miopenConvolutionFwdAlgoGEMM:gemm,0.142878,0,rocBlas,<unused>;miopenConvolutionFwdAlgoWinograd:ConvBinWinogradRxSf3x2,0.327834,0,miopenConvolutionFwdAlgoWinograd,<unused>
896-7-7-1x1-128-7-7-32-0x0-1x1-1x1-0-NCHW-FP32-F=miopenConvolutionFwdAlgoImplicitGEMM:ConvHipImplicitGemmV4R1Fwd,0.119518,0,miopenConvolutionFwdAlgoImplicitGEMM,<unused>;miopenConvolutionFwdAlgoDirect:ConvOclDirectFwd1x1,0.094718,0,miopenConvolutionFwdAlgoDirect,<unused>;miopenConvolutionFwdAlgoGEMM:gemm,0.145917,0,rocBlas,<unused>;miopenConvolutionFwdAlgoWinograd:ConvBinWinogradRxSf3x2,0.343993,0,miopenConvolutionFwdAlgoWinograd,<unused>
928-7-7-1x1-128-7-7-32-0x0-1x1-1x1-0-NCHW-FP32-F=miopenConvolutionFwdAlgoImplicitGEMM:ConvHipImplicitGemmV4R1Fwd,0.115517,0,miopenConvolutionFwdAlgoImplicitGEMM,<unused>;miopenConvolutionFwdAlgoDirect:ConvOclDirectFwd1x1,0.095198,0,miopenConvolutionFwdAlgoDirect,<unused>;miopenConvolutionFwdAlgoGEMM:gemm,0.148317,0,rocBlas,<unused>;miopenConvolutionFwdAlgoWinograd:ConvBinWinogradRxSf3x2,0.352633,0,miopenConvolutionFwdAlgoWinograd,<unused>
960-7-7-1x1-128-7-7-32-0x0-1x1-1x1-0-NCHW-FP32-F=miopenConvolutionFwdAlgoImplicitGEMM:ConvHipImplicitGemmV4R1Fwd,0.124477,0,miopenConvolutionFwdAlgoImplicitGEMM,<unused>;miopenConvolutionFwdAlgoDirect:ConvOclDirectFwd1x1,0.093918,0,miopenConvolutionFwdAlgoDirect,<unused>;miopenConvolutionFwdAlgoGEMM:gemm,0.157917,0,rocBlas,<unused>;miopenConvolutionFwdAlgoWinograd:ConvBinWinogradRxSf3x2,0.365592,0,miopenConvolutionFwdAlgoWinograd,<unused>
992-7-7-1x1-128-7-7-32-0x0-1x1-1x1-0-NCHW-FP32-F=miopenConvolutionFwdAlgoImplicitGEMM:ConvHipImplicitGemmV4R1Fwd,0.123357,0,miopenConvolutionFwdAlgoImplicitGEMM,<unused>;miopenConvolutionFwdAlgoDirect:ConvOclDirectFwd1x1,0.096957,0,miopenConvolutionFwdAlgoDirect,<unused>;miopenConvolutionFwdAlgoGEMM:gemm,0.155357,0,rocBlas,<unused>;miopenConvolutionFwdAlgoWinograd:ConvBinWinogradRxSf3x2,0.373592,0,miopenConvolutionFwdAlgoWinograd,<unused>
3-224-224-7x7-64-112-112-32-3x3-2x2-1x1-0-NCHW-FP16-F=miopenConvolutionFwdAlgoDirect:ConvOclDirectFwdGen,1.55568,0,miopenConvolutionFwdAlgoDirect,<unused>;miopenConvolutionFwdAlgoGEMM:gemm,3.328,3687936,rocBlas,<unused>;miopenConvolutionFwdAlgoWinograd:ConvBinWinogradRxSf2x3g1,1.45216,0,miopenConvolutionFwdAlgoWinograd,<unused>
64-56-56-1x1-128-56-56-32-0x0-1x1-1x1-0-NCHW-FP16-F=miopenConvolutionFwdAlgoImplicitGEMM:ConvHipImplicitGemmV4R1Fwd,0.20144,0,miopenConvolutionFwdAlgoImplicitGEMM,<unused>;miopenConvolutionFwdAlgoDirect:ConvAsm1x1U,0.19968,0,miopenConvolutionFwdAlgoDirect,<unused>;miopenConvolutionFwdAlgoGEMM:gemm,0.12704,0,rocBlas,<unused>;miopenConvolutionFwdAlgoWinograd:ConvBinWinogradRxSf2x3g1,0.6488,0,miopenConvolutionFwdAlgoWinograd,<unused>
128-56-56-3x3-32-56-56-32-1x1-1x1-1x1-0-NCHW-FP16-F=miopenConvolutionFwdAlgoImplicitGEMM:ConvHipImplicitGemmV4R1Fwd,0.76032,0,miopenConvolutionFwdAlgoImplicitGEMM,<unused>;miopenConvolutionFwdAlgoDirect:ConvOclDirectFwd,1.77936,0,miopenConvolutionFwdAlgoDirect,<unused>;miopenConvolutionFwdAlgoGEMM:gemm,4.68992,7225344,rocBlas,<unused>;miopenConvolutionFwdAlgoWinograd:ConvBinWinogradRxSf2x3g1,0.31536,0,miopenConvolutionFwdAlgoWinograd,<unused>
96-56-56-1x1-128-56-56-32-0x0-1x1-1x1-0-NCHW-FP16-F=miopenConvolutionFwdAlgoImplicitGEMM:ConvHipImplicitGemmV4R1Fwd,0.27136,0,miopenConvolutionFwdAlgoImplicitGEMM,<unused>;miopenConvolutionFwdAlgoDirect:ConvAsm1x1U,0.21792,0,miopenConvolutionFwdAlgoDirect,<unused>;miopenConvolutionFwdAlgoGEMM:gemm,0.16992,0,rocBlas,<unused>;miopenConvolutionFwdAlgoWinograd:ConvBinWinogradRxSf2x3g1,0.885921,0,miopenConvolutionFwdAlgoWinograd,<unused>
128-56-56-1x1-128-56-56-32-0x0-1x1-1x1-0-NCHW-FP16-F=miopenConvolutionFwdAlgoImplicitGEMM:ConvHipImplicitGemmV4R1Fwd,0.388961,0,miopenConvolutionFwdAlgoImplicitGEMM,<unused>;miopenConvolutionFwdAlgoDirect:ConvAsm1x1U,0.26736,0,miopenConvolutionFwdAlgoDirect,<unused>;miopenConvolutionFwdAlgoGEMM:gemm,0.21536,0,rocBlas,<unused>;miopenConvolutionFwdAlgoWinograd:ConvBinWinogradRxSf2x3g1,1.13616,0,miopenConvolutionFwdAlgoWinograd,<unused>
160-56-56-1x1-128-56-56-32-0x0-1x1-1x1-0-NCHW-FP16-F=miopenConvolutionFwdAlgoImplicitGEMM:ConvHipImplicitGemmV4R1Fwd,0.422561,0,miopenConvolutionFwdAlgoImplicitGEMM,<unused>;miopenConvolutionFwdAlgoDirect:ConvAsm1x1U,0.3248,0,miopenConvolutionFwdAlgoDirect,<unused>;miopenConvolutionFwdAlgoGEMM:gemm,0.25472,0,rocBlas,<unused>;miopenConvolutionFwdAlgoWinograd:ConvBinWinogradRxSf2x3g1,1.36208,0,miopenConvolutionFwdAlgoWinograd,<unused>
192-56-56-1x1-128-56-56-32-0x0-1x1-1x1-0-NCHW-FP16-F=miopenConvolutionFwdAlgoImplicitGEMM:ConvHipImplicitGemmV4R1Fwd,0.552801,0,miopenConvolutionFwdAlgoImplicitGEMM,<unused>;miopenConvolutionFwdAlgoDirect:ConvAsm1x1U,0.40192,0,miopenConvolutionFwdAlgoDirect,<unused>;miopenConvolutionFwdAlgoGEMM:gemm,0.29936,0,rocBlas,<unused>;miopenConvolutionFwdAlgoWinograd:ConvBinWinogradRxSf2x3g1,1.5992,0,miopenConvolutionFwdAlgoWinograd,<unused>
224-56-56-1x1-128-56-56-32-0x0-1x1-1x1-0-NCHW-FP16-F=miopenConvolutionFwdAlgoImplicitGEMM:ConvHipImplicitGemmV4R1Fwd,0.581281,0,miopenConvolutionFwdAlgoImplicitGEMM,<unused>;miopenConvolutionFwdAlgoDirect:ConvAsm1x1U,0.46624,0,miopenConvolutionFwdAlgoDirect,<unused>;miopenConvolutionFwdAlgoGEMM:gemm,0.33984,0,rocBlas,<unused>;miopenConvolutionFwdAlgoWinograd:ConvBinWinogradRxSf2x3g1,1.8392,0,miopenConvolutionFwdAlgoWinograd,<unused>
256-56-56-1x1-128-56-56-32-0x0-1x1-1x1-0-NCHW-FP16-F=miopenConvolutionFwdAlgoImplicitGEMM:ConvHipImplicitGemmV4R1Fwd,0.722241,0,miopenConvolutionFwdAlgoImplicitGEMM,<unused>;miopenConvolutionFwdAlgoDirect:ConvAsm1x1U,0.50704,0,miopenConvolutionFwdAlgoDirect,<unused>;miopenConvolutionFwdAlgoGEMM:gemm,0.39168,0,rocBlas,<unused>;miopenConvolutionFwdAlgoWinograd:ConvBinWinogradRxSf2x3g1,2.09968,0,miopenConvolutionFwdAlgoWinograd,<unused>
128-28-28-1x1-128-28-28-32-0x0-1x1-1x1-0-NCHW-FP16-F=miopenConvolutionFwdAlgoImplicitGEMM:ConvHipImplicitGemmV4R1Fwd,0.11024,0,miopenConvolutionFwdAlgoImplicitGEMM,<unused>;miopenConvolutionFwdAlgoDirect:ConvAsm1x1U,0.08656,0,miopenConvolutionFwdAlgoDirect,<unused>;miopenConvolutionFwdAlgoGEMM:gemm,0.16032,0,rocBlas,<unused>;miopenConvolutionFwdAlgoWinograd:ConvBinWinogradRxSf2x3g1,0.32384,0,miopenConvolutionFwdAlgoWinograd,<unused>
128-28-28-3x3-32-28-28-32-1x1-1x1-1x1-0-NCHW-FP16-F=miopenConvolutionFwdAlgoImplicitGEMM:ConvHipImplicitGemmV4R1Fwd,0.23232,0,miopenConvolutionFwdAlgoImplicitGEMM,<unused>;miopenConvolutionFwdAlgoDirect:ConvOclDirectFwd,0.50752,0,miopenConvolutionFwdAlgoDirect,<unused>;miopenConvolutionFwdAlgoGEMM:gemm,4.32131,1806336,rocBlas,<unused>;miopenConvolutionFwdAlgoWinograd:ConvBinWinogradRxSf2x3g1,0.11056,0,miopenConvolutionFwdAlgoWinograd,<unused>
160-28-28-1x1-128-28-28-32-0x0-1x1-1x1-0-NCHW-FP16-F=miopenConvolutionFwdAlgoImplicitGEMM:ConvHipImplicitGemmV4R1Fwd,0.11088,0,miopenConvolutionFwdAlgoImplicitGEMM,<unused>;miopenConvolutionFwdAlgoDirect:ConvAsm1x1U,0.0992,0,miopenConvolutionFwdAlgoDirect,<unused>;miopenConvolutionFwdAlgoGEMM:gemm,0.18848,0,rocBlas,<unused>;miopenConvolutionFwdAlgoWinograd:ConvBinWinogradRxSf2x3g1,0.38224,0,miopenConvolutionFwdAlgoWinograd,<unused>
192-28-28-1x1-128-28-28-32-0x0-1x1-1x1-0-NCHW-FP16-F=miopenConvolutionFwdAlgoImplicitGEMM:ConvHipImplicitGemmV4R1Fwd,0.17024,0,miopenConvolutionFwdAlgoImplicitGEMM,<unused>;miopenConvolutionFwdAlgoDirect:ConvAsm1x1U,0.1152,0,miopenConvolutionFwdAlgoDirect,<unused>;miopenConvolutionFwdAlgoGEMM:gemm,0.21808,0,rocBlas,<unused>;miopenConvolutionFwdAlgoWinograd:ConvBinWinogradRxSf2x3g1,0.4472,0,miopenConvolutionFwdAlgoWinograd,<unused>
224-28-28-1x1-128-28-28-32-0x0-1x1-1x1-0-NCHW-FP16-F=miopenConvolutionFwdAlgoImplicitGEMM:ConvHipImplicitGemmV4R1Fwd,0.15136,0,miopenConvolutionFwdAlgoImplicitGEMM,<unused>;miopenConvolutionFwdAlgoDirect:ConvAsm1x1U,0.1368,0,miopenConvolutionFwdAlgoDirect,<unused>;miopenConvolutionFwdAlgoGEMM:gemm,0.24832,0,rocBlas,<unused>;miopenConvolutionFwdAlgoWinograd:ConvBinWinogradRxSf2x3g1,0.51088,0,miopenConvolutionFwdAlgoWinograd,<unused>
256-28-28-1x1-128-28-28-32-0x0-1x1-1x1-0-NCHW-FP16-F=miopenConvolutionFwdAlgoImplicitGEMM:ConvHipImplicitGemmV4R1Fwd,0.20912,0,miopenConvolutionFwdAlgoImplicitGEMM,<unused>;miopenConvolutionFwdAlgoDirect:ConvAsm1x1U,0.15568,0,miopenConvolutionFwdAlgoDirect,<unused>;miopenConvolutionFwdAlgoGEMM:gemm,0.278241,0,rocBlas,<unused>;miopenConvolutionFwdAlgoWinograd:ConvBinWinogradRxSf2x3g1,0.580001,0,miopenConvolutionFwdAlgoWinograd,<unused>
288-28-28-1x1-128-28-28-32-0x0-1x1-1x1-0-NCHW-FP16-F=miopenConvolutionFwdAlgoImplicitGEMM:ConvHipImplicitGemmV4R1Fwd,0.21424,0,miopenConvolutionFwdAlgoImplicitGEMM,<unused>;miopenConvolutionFwdAlgoDirect:ConvAsm1x1U,0.1792,0,miopenConvolutionFwdAlgoDirect,<unused>;miopenConvolutionFwdAlgoGEMM:gemm,0.30752,0,rocBlas,<unused>;miopenConvolutionFwdAlgoWinograd:ConvBinWinogradRxSf2x3g1,0.638081,0,miopenConvolutionFwdAlgoWinograd,<unused>
320-28-28-1x1-128-28-28-32-0x0-1x1-1x1-0-NCHW-FP16-F=miopenConvolutionFwdAlgoImplicitGEMM:ConvHipImplicitGemmV4R1Fwd,0.21424,0,miopenConvolutionFwdAlgoImplicitGEMM,<unused>;miopenConvolutionFwdAlgoDirect:ConvAsm1x1U,0.19024,0,miopenConvolutionFwdAlgoDirect,<unused>;miopenConvolutionFwdAlgoGEMM:gemm,0.33568,0,rocBlas,<unused>;miopenConvolutionFwdAlgoWinograd:ConvBinWinogradRxSf2x3g1,0.701441,0,miopenConvolutionFwdAlgoWinograd,<unused>
352-28-28-1x1-128-28-28-32-0x0-1x1-1x1-0-NCHW-FP16-F=miopenConvolutionFwdAlgoImplicitGEMM:ConvHipImplicitGemmV4R1Fwd,0.2464,0,miopenConvolutionFwdAlgoImplicitGEMM,<unused>;miopenConvolutionFwdAlgoDirect:ConvAsm1x1U,0.19664,0,miopenConvolutionFwdAlgoDirect,<unused>;miopenConvolutionFwdAlgoGEMM:gemm,0.365761,0,rocBlas,<unused>;miopenConvolutionFwdAlgoWinograd:ConvBinWinogradRxSf2x3g1,0.765442,0,miopenConvolutionFwdAlgoWinograd,<unused>
384-28-28-1x1-128-28-28-32-0x0-1x1-1x1-0-NCHW-FP16-F=miopenConvolutionFwdAlgoImplicitGEMM:ConvHipImplicitGemmV4R1Fwd,0.29472,0,miopenConvolutionFwdAlgoImplicitGEMM,<unused>;miopenConvolutionFwdAlgoDirect:ConvAsm1x1U,0.23488,0,miopenConvolutionFwdAlgoDirect,<unused>;miopenConvolutionFwdAlgoGEMM:gemm,0.206081,0,rocBlas,<unused>;miopenConvolutionFwdAlgoWinograd:ConvBinWinogradRxSf2x3g1,0.837442,0,miopenConvolutionFwdAlgoWinograd,<unused>
416-28-28-1x1-128-28-28-32-0x0-1x1-1x1-0-NCHW-FP16-F=miopenConvolutionFwdAlgoImplicitGEMM:ConvHipImplicitGemmV4R1Fwd,0.27008,0,miopenConvolutionFwdAlgoImplicitGEMM,<unused>;miopenConvolutionFwdAlgoDirect:ConvAsm1x1U,0.2256,0,miopenConvolutionFwdAlgoDirect,<unused>;miopenConvolutionFwdAlgoGEMM:gemm,0.21728,0,rocBlas,<unused>;miopenConvolutionFwdAlgoWinograd:ConvBinWinogradRxSf2x3g1,0.893122,0,miopenConvolutionFwdAlgoWinograd,<unused>
448-28-28-1x1-128-28-28-32-0x0-1x1-1x1-0-NCHW-FP16-F=miopenConvolutionFwdAlgoImplicitGEMM:ConvHipImplicitGemmV4R1Fwd,0.296637,0,miopenConvolutionFwdAlgoImplicitGEMM,<unused>;miopenConvolutionFwdAlgoDirect:ConvAsm1x1U,0.24336,0,miopenConvolutionFwdAlgoDirect,<unused>;miopenConvolutionFwdAlgoGEMM:gemm,0.22288,0,rocBlas,<unused>;miopenConvolutionFwdAlgoWinograd:ConvBinWinogradRxSf2x3g1,0.95792,0,miopenConvolutionFwdAlgoWinograd,<unused>
480-28-28-1x1-128-28-28-32-0x0-1x1-1x1-0-NCHW-FP16-F=miopenConvolutionFwdAlgoImplicitGEMM:ConvHipImplicitGemmV4R1Fwd,0.320633,0,miopenConvolutionFwdAlgoImplicitGEMM,<unused>;miopenConvolutionFwdAlgoDirect:ConvAsm1x1U,0.276957,0,miopenConvolutionFwdAlgoDirect,<unused>;miopenConvolutionFwdAlgoGEMM:gemm,0.237917,0,rocBlas,<unused>;miopenConvolutionFwdAlgoWinograd:ConvBinWinogradRxSf2x3g1,1.01903,0,miopenConvolutionFwdAlgoWinograd,<unused>
512-28-28-1x1-256-28-28-32-0x0-1x1-1x1-0-NCHW-FP16-F=miopenConvolutionFwdAlgoImplicitGEMM:ConvHipImplicitGemmV4R1Fwd,0.661426,0,miopenConvolutionFwdAlgoImplicitGEMM,<unused>;miopenConvolutionFwdAlgoDirect:ConvAsm1x1U,0.906702,0,miopenConvolutionFwdAlgoDirect,<unused>;miopenConvolutionFwdAlgoGEMM:gemm,0.482071,0,rocBlas,<unused>;miopenConvolutionFwdAlgoWinograd:ConvBinWinogradRxSf2x3g1,2.07964,0,miopenConvolutionFwdAlgoWinograd,<unused>
256-14-14-1x1-128-14-14-32-0x0-1x1-1x1-0-NCHW-FP16-F=miopenConvolutionFwdAlgoImplicitGEMM:ConvHipImplicitGemmV4R1Fwd,0.065278,0,miopenConvolutionFwdAlgoImplicitGEMM,<unused>;miopenConvolutionFwdAlgoDirect:ConvAsm1x1U,0.074078,0,miopenConvolutionFwdAlgoDirect,<unused>;miopenConvolutionFwdAlgoGEMM:gemm,0.291354,0,rocBlas,<unused>;miopenConvolutionFwdAlgoWinograd:ConvBinWinogradRxSf2x3g1,0.194235,0,miopenConvolutionFwdAlgoWinograd,<unused>
128-14-14-3x3-32-14-14-32-1x1-1x1-1x1-0-NCHW-FP16-F=miopenConvolutionFwdAlgoImplicitGEMM:ConvHipImplicitGemmV4R1Fwd,0.138876,0,miopenConvolutionFwdAlgoImplicitGEMM,<unused>;miopenConvolutionFwdAlgoDirect:ConvOclDirectFwd,0.215674,0,miopenConvolutionFwdAlgoDirect,<unused>;miopenConvolutionFwdAlgoGEMM:gemm,7.6337,451584,rocBlas,<unused>;miopenConvolutionFwdAlgoWinograd:ConvBinWinogradRxSf2x3g1,0.049119,0,miopenConvolutionFwdAlgoWinograd,<unused>
288-14-14-1x1-128-14-14-32-0x0-1x1-1x1-0-NCHW-FP16-F=miopenConvolutionFwdAlgoImplicitGEMM:ConvHipImplicitGemmV4R1Fwd,0.061438,0,miopenConvolutionFwdAlgoImplicitGEMM,<unused>;miopenConvolutionFwdAlgoDirect:ConvAsm1x1U,0.098077,0,miopenConvolutionFwdAlgoDirect,<unused>;miopenConvolutionFwdAlgoGEMM:gemm,0.352308,0,rocBlas,<unused>;miopenConvolutionFwdAlgoWinograd:ConvBinWinogradRxSf2x3g1,0.211034,0,miopenConvolutionFwdAlgoWinograd,<unused>
320-14-14-1x1-128-14-14-32-0x0-1x1-1x1-0-NCHW-FP16-F=miopenConvolutionFwdAlgoImplicitGEMM:ConvHipImplicitGemmV4R1Fwd,0.086237,0,miopenConvolutionFwdAlgoImplicitGEMM,<unused>;miopenConvolutionFwdAlgoDirect:ConvAsm1x1U,0.107036,0,miopenConvolutionFwdAlgoDirect,<unused>;miopenConvolutionFwdAlgoGEMM:gemm,0.352949,0,rocBlas,<unused>;miopenConvolutionFwdAlgoWinograd:ConvBinWinogradRxSf2x3g1,0.230072,0,miopenConvolutionFwdAlgoWinograd,<unused>
352-14-14-1x1-128-14-14-32-0x0-1x1-1x1-0-NCHW-FP16-F=miopenConvolutionFwdAlgoImplicitGEMM:ConvHipImplicitGemmV4R1Fwd,0.070238,0,miopenConvolutionFwdAlgoImplicitGEMM,<unused>;miopenConvolutionFwdAlgoDirect:ConvAsm1x1U,0.116797,0,miopenConvolutionFwdAlgoDirect,<unused>;miopenConvolutionFwdAlgoGEMM:gemm,0.410066,0,rocBlas,<unused>;miopenConvolutionFwdAlgoWinograd:ConvBinWinogradRxSf2x3g1,0.250712,0,miopenConvolutionFwdAlgoWinograd,<unused>
384-14-14-1x1-128-14-14-32-0x0-1x1-1x1-0-NCHW-FP16-F=miopenConvolutionFwdAlgoImplicitGEMM:ConvHipImplicitGemmV4R1Fwd,0.091356,0,miopenConvolutionFwdAlgoImplicitGEMM,<unused>;miopenConvolutionFwdAlgoDirect:ConvAsm1x1U,0.124315,0,miopenConvolutionFwdAlgoDirect,<unused>;miopenConvolutionFwdAlgoGEMM:gemm,0.408624,0,rocBlas,<unused>;miopenConvolutionFwdAlgoWinograd:ConvBinWinogradRxSf2x3g1,0.270389,0,miopenConvolutionFwdAlgoWinograd,<unused>
416-14-14-1x1-128-14-14-32-0x0-1x1-1x1-0-NCHW-FP16-F=miopenConvolutionFwdAlgoImplicitGEMM:ConvHipImplicitGemmV4R1Fwd,0.081596,0,miopenConvolutionFwdAlgoImplicitGEMM,<unused>;miopenConvolutionFwdAlgoDirect:ConvAsm1x1U,0.134074,0,miopenConvolutionFwdAlgoDirect,<unused>;miopenConvolutionFwdAlgoGEMM:gemm,0.473259,0,rocBlas,<unused>;miopenConvolutionFwdAlgoWinograd:ConvBinWinogradRxSf2x3g1,0.289107,0,miopenConvolutionFwdAlgoWinograd,<unused>
448-14-14-1x1-128-14-14-32-0x0-1x1-1x1-0-NCHW-FP16-F=miopenConvolutionFwdAlgoImplicitGEMM:ConvHipImplicitGemmV4R1Fwd,0.091195,0,miopenConvolutionFwdAlgoImplicitGEMM,<unused>;miopenConvolutionFwdAlgoDirect:ConvAsm1x1U,0.141593,0,miopenConvolutionFwdAlgoDirect,<unused>;miopenConvolutionFwdAlgoGEMM:gemm,0.468777,0,rocBlas,<unused>;miopenConvolutionFwdAlgoWinograd:ConvBinWinogradRxSf2x3g1,0.308625,0,miopenConvolutionFwdAlgoWinograd,<unused>
480-14-14-1x1-128-14-14-32-0x0-1x1-1x1-0-NCHW-FP16-F=miopenConvolutionFwdAlgoImplicitGEMM:ConvHipImplicitGemmV4R1Fwd,0.093594,0,miopenConvolutionFwdAlgoImplicitGEMM,<unused>;miopenConvolutionFwdAlgoDirect:ConvAsm1x1U,0.151832,0,miopenConvolutionFwdAlgoDirect,<unused>;miopenConvolutionFwdAlgoGEMM:gemm,0.530851,0,rocBlas,<unused>;miopenConvolutionFwdAlgoWinograd:ConvBinWinogradRxSf2x3g1,0.327343,0,miopenConvolutionFwdAlgoWinograd,<unused>
512-14-14-1x1-128-14-14-32-0x0-1x1-1x1-0-NCHW-FP16-F=miopenConvolutionFwdAlgoImplicitGEMM:ConvHipImplicitGemmV4R1Fwd,0.193749,0,miopenConvolutionFwdAlgoImplicitGEMM,<unused>;miopenConvolutionFwdAlgoDirect:ConvAsm1x1U,0.116474,0,miopenConvolutionFwdAlgoDirect,<unused>;miopenConvolutionFwdAlgoGEMM:gemm,0.52877,0,rocBlas,<unused>;miopenConvolutionFwdAlgoWinograd:ConvBinWinogradRxSf2x3g1,0.35006,0,miopenConvolutionFwdAlgoWinograd,<unused>
544-14-14-1x1-128-14-14-32-0x0-1x1-1x1-0-NCHW-FP16-F=miopenConvolutionFwdAlgoImplicitGEMM:ConvHipImplicitGemmV4R1Fwd,0.108793,0,miopenConvolutionFwdAlgoImplicitGEMM,<unused>;miopenConvolutionFwdAlgoDirect:ConvAsm1x1U,0.168471,0,miopenConvolutionFwdAlgoDirect,<unused>;miopenConvolutionFwdAlgoGEMM:gemm,0.589566,0,rocBlas,<unused>;miopenConvolutionFwdAlgoWinograd:ConvBinWinogradRxSf2x3g1,0.367978,0,miopenConvolutionFwdAlgoWinograd,<unused>
576-14-14-1x1-128-14-14-32-0x0-1x1-1x1-0-NCHW-FP16-F=miopenConvolutionFwdAlgoImplicitGEMM:ConvHipImplicitGemmV4R1Fwd,0.114553,0,miopenConvolutionFwdAlgoImplicitGEMM,<unused>;miopenConvolutionFwdAlgoDirect:ConvAsm1x1U,0.142712,0,miopenConvolutionFwdAlgoDirect,<unused>;miopenConvolutionFwdAlgoGEMM:gemm,0.586206,0,rocBlas,<unused>;miopenConvolutionFwdAlgoWinograd:ConvBinWinogradRxSf2x3g1,0.386378,0,miopenConvolutionFwdAlgoWinograd,<unused>
608-14-14-1x1-128-14-14-32-0x0-1x1-1x1-0-NCHW-FP16-F=miopenConvolutionFwdAlgoImplicitGEMM:ConvHipImplicitGemmV4R1Fwd,0.116312,0,miopenConvolutionFwdAlgoImplicitGEMM,<unused>;miopenConvolutionFwdAlgoDirect:ConvAsm1x1U,0.186229,0,miopenConvolutionFwdAlgoDirect,<unused>;miopenConvolutionFwdAlgoGEMM:gemm,0.122393,0,rocBlas,<unused>;miopenConvolutionFwdAlgoWinograd:ConvBinWinogradRxSf2x3g1,0.406055,0,miopenConvolutionFwdAlgoWinograd,<unused>
640-14-14-1x1-128-14-14-32-0x0-1x1-1x1-0-NCHW-FP16-F=miopenConvolutionFwdAlgoImplicitGEMM:ConvHipImplicitGemmV4R1Fwd,0.14783,0,miopenConvolutionFwdAlgoImplicitGEMM,<unused>;miopenConvolutionFwdAlgoDirect:ConvAsm1x1U,0.158709,0,miopenConvolutionFwdAlgoDirect,<unused>;miopenConvolutionFwdAlgoGEMM:gemm,0.128631,0,rocBlas,<unused>;miopenConvolutionFwdAlgoWinograd:ConvBinWinogradRxSf2x3g1,0.428452,0,miopenConvolutionFwdAlgoWinograd,<unused>
672-14-14-1x1-128-14-14-32-0x0-1x1-1x1-0-NCHW-FP16-F=miopenConvolutionFwdAlgoImplicitGEMM:ConvHipImplicitGemmV4R1Fwd,0.127671,0,miopenConvolutionFwdAlgoImplicitGEMM,<unused>;miopenConvolutionFwdAlgoDirect:ConvAsm1x1U,0.205267,0,miopenConvolutionFwdAlgoDirect,<unused>;miopenConvolutionFwdAlgoGEMM:gemm,0.134071,0,rocBlas,<unused>;miopenConvolutionFwdAlgoWinograd:ConvBinWinogradRxSf2x3g1,0.44477,0,miopenConvolutionFwdAlgoWinograd,<unused>
704-14-14-1x1-128-14-14-32-0x0-1x1-1x1-0-NCHW-FP16-F=miopenConvolutionFwdAlgoImplicitGEMM:ConvHipImplicitGemmV4R1Fwd,0.137911,0,miopenConvolutionFwdAlgoImplicitGEMM,<unused>;miopenConvolutionFwdAlgoDirect:ConvAsm1x1U,0.215026,0,miopenConvolutionFwdAlgoDirect,<unused>;miopenConvolutionFwdAlgoGEMM:gemm,0.162229,0,rocBlas,<unused>;miopenConvolutionFwdAlgoWinograd:ConvBinWinogradRxSf2x3g1,0.465248,0,miopenConvolutionFwdAlgoWinograd,<unused>
736-14-14-1x1-128-14-14-32-0x0-1x1-1x1-0-NCHW-FP16-F=miopenConvolutionFwdAlgoImplicitGEMM:ConvHipImplicitGemmV4R1Fwd,0.234703,0,miopenConvolutionFwdAlgoImplicitGEMM,<unused>;miopenConvolutionFwdAlgoDirect:ConvAsm1x1U,0.179508,0,miopenConvolutionFwdAlgoDirect,<unused>;miopenConvolutionFwdAlgoGEMM:gemm,0.169108,0,rocBlas,<unused>;miopenConvolutionFwdAlgoWinograd:ConvBinWinogradRxSf2x3g1,0.484605,0,miopenConvolutionFwdAlgoWinograd,<unused>
768-14-14-1x1-128-14-14-32-0x0-1x1-1x1-0-NCHW-FP16-F=miopenConvolutionFwdAlgoImplicitGEMM:ConvHipImplicitGemmV4R1Fwd,0.179346,0,miopenConvolutionFwdAlgoImplicitGEMM,<unused>;miopenConvolutionFwdAlgoDirect:ConvAsm1x1U,0.187347,0,miopenConvolutionFwdAlgoDirect,<unused>;miopenConvolutionFwdAlgoGEMM:gemm,0.174707,0,rocBlas,<unused>;miopenConvolutionFwdAlgoWinograd:ConvBinWinogradRxSf2x3g1,0.505564,0,miopenConvolutionFwdAlgoWinograd,<unused>
800-14-14-1x1-128-14-14-32-0x0-1x1-1x1-0-NCHW-FP16-F=miopenConvolutionFwdAlgoImplicitGEMM:ConvHipImplicitGemmV4R1Fwd,0.151508,0,miopenConvolutionFwdAlgoImplicitGEMM,<unused>;miopenConvolutionFwdAlgoDirect:ConvAsm1x1U,0.242222,0,miopenConvolutionFwdAlgoDirect,<unused>;miopenConvolutionFwdAlgoGEMM:gemm,0.181587,0,rocBlas,<unused>;miopenConvolutionFwdAlgoWinograd:ConvBinWinogradRxSf2x3g1,0.523482,0,miopenConvolutionFwdAlgoWinograd,<unused>
832-14-14-1x1-128-14-14-32-0x0-1x1-1x1-0-NCHW-FP16-F=miopenConvolutionFwdAlgoImplicitGEMM:ConvHipImplicitGemmV4R1Fwd,0.281259,0,miopenConvolutionFwdAlgoImplicitGEMM,<unused>;miopenConvolutionFwdAlgoDirect:ConvAsm1x1U,0.199185,0,miopenConvolutionFwdAlgoDirect,<unused>;miopenConvolutionFwdAlgoGEMM:gemm,0.186546,0,rocBlas,<unused>;miopenConvolutionFwdAlgoWinograd:ConvBinWinogradRxSf2x3g1,0.54252,0,miopenConvolutionFwdAlgoWinograd,<unused>
864-14-14-1x1-128-14-14-32-0x0-1x1-1x1-0-NCHW-FP16-F=miopenConvolutionFwdAlgoImplicitGEMM:ConvHipImplicitGemmV4R1Fwd,0.281259,0,miopenConvolutionFwdAlgoImplicitGEMM,<unused>;miopenConvolutionFwdAlgoDirect:ConvAsm1x1U,0.207505,0,miopenConvolutionFwdAlgoDirect,<unused>;miopenConvolutionFwdAlgoGEMM:gemm,0.193106,0,rocBlas,<unused>;miopenConvolutionFwdAlgoWinograd:ConvBinWinogradRxSf2x3g1,0.562038,0,miopenConvolutionFwdAlgoWinograd,<unused>
896-14-14-1x1-128-14-14-32-0x0-1x1-1x1-0-NCHW-FP16-F=miopenConvolutionFwdAlgoImplicitGEMM:ConvHipImplicitGemmV4R1Fwd,0.204144,0,miopenConvolutionFwdAlgoImplicitGEMM,<unused>;miopenConvolutionFwdAlgoDirect:ConvAsm1x1U,0.214864,0,miopenConvolutionFwdAlgoDirect,<unused>;miopenConvolutionFwdAlgoGEMM:gemm,0.201585,0,rocBlas,<unused>;miopenConvolutionFwdAlgoWinograd:ConvBinWinogradRxSf2x3g1,0.585556,0,miopenConvolutionFwdAlgoWinograd,<unused>
928-14-14-1x1-128-14-14-32-0x0-1x1-1x1-0-NCHW-FP16-F=miopenConvolutionFwdAlgoImplicitGEMM:ConvHipImplicitGemmV4R1Fwd,0.175346,0,miopenConvolutionFwdAlgoImplicitGEMM,<unused>;miopenConvolutionFwdAlgoDirect:ConvAsm1x1U,0.219023,0,miopenConvolutionFwdAlgoDirect,<unused>;miopenConvolutionFwdAlgoGEMM:gemm,0.206544,0,rocBlas,<unused>;miopenConvolutionFwdAlgoWinograd:ConvBinWinogradRxSf2x3g1,0.602674,0,miopenConvolutionFwdAlgoWinograd,<unused>
960-14-14-1x1-128-14-14-32-0x0-1x1-1x1-0-NCHW-FP16-F=miopenConvolutionFwdAlgoImplicitGEMM:ConvHipImplicitGemmV4R1Fwd,0.187185,0,miopenConvolutionFwdAlgoImplicitGEMM,<unused>;miopenConvolutionFwdAlgoDirect:ConvAsm1x1U,0.229422,0,miopenConvolutionFwdAlgoDirect,<unused>;miopenConvolutionFwdAlgoGEMM:gemm,0.212143,0,rocBlas,<unused>;miopenConvolutionFwdAlgoWinograd:ConvBinWinogradRxSf2x3g1,0.619952,0,miopenConvolutionFwdAlgoWinograd,<unused>
992-14-14-1x1-128-14-14-32-0x0-1x1-1x1-0-NCHW-FP16-F=miopenConvolutionFwdAlgoImplicitGEMM:ConvHipImplicitGemmV4R1Fwd,0.187505,0,miopenConvolutionFwdAlgoImplicitGEMM,<unused>;miopenConvolutionFwdAlgoDirect:ConvAsm1x1U,0.235982,0,miopenConvolutionFwdAlgoDirect,<unused>;miopenConvolutionFwdAlgoGEMM:gemm,0.217583,0,rocBlas,<unused>;miopenConvolutionFwdAlgoWinograd:ConvBinWinogradRxSf2x3g1,0.64091,0,miopenConvolutionFwdAlgoWinograd,<unused>
1024-14-14-1x1-512-14-14-32-0x0-1x1-1x1-0-NCHW-FP16-F=miopenConvolutionFwdAlgoImplicitGEMM:ConvHipImplicitGemmV4R1Fwd,0.772578,0,miopenConvolutionFwdAlgoImplicitGEMM,<unused>;miopenConvolutionFwdAlgoDirect:ConvAsm1x1U,0.702024,0,miopenConvolutionFwdAlgoDirect,<unused>;miopenConvolutionFwdAlgoGEMM:gemm,0.62171,0,rocBlas,<unused>;miopenConvolutionFwdAlgoWinograd:ConvBinWinogradRxSf2x3g1,2.2579,0,miopenConvolutionFwdAlgoWinograd,<unused>
512-7-7-1x1-128-7-7-32-0x0-1x1-1x1-0-NCHW-FP16-F=miopenConvolutionFwdAlgoImplicitGEMM:ConvHipImplicitGemmV4R1Fwd,0.071354,0,miopenConvolutionFwdAlgoImplicitGEMM,<unused>;miopenConvolutionFwdAlgoDirect:ConvAsm1x1U,0.056475,0,miopenConvolutionFwdAlgoDirect,<unused>;miopenConvolutionFwdAlgoGEMM:gemm,0.145908,0,rocBlas,<unused>;miopenConvolutionFwdAlgoWinograd:ConvBinWinogradRxSf2x3g1,0.190544,0,miopenConvolutionFwdAlgoWinograd,<unused>
128-7-7-3x3-32-7-7-32-1x1-1x1-1x1-0-NCHW-FP16-F=miopenConvolutionFwdAlgoImplicitGEMM:ConvHipImplicitGemmV4R1Fwd,0.109751,0,miopenConvolutionFwdAlgoImplicitGEMM,<unused>;miopenConvolutionFwdAlgoDirect:ConvOclDirectFwd,0.089112,0,miopenConvolutionFwdAlgoDirect,<unused>;miopenConvolutionFwdAlgoGEMM:gemm,16.567,112896,rocBlas,<unused>;miopenConvolutionFwdAlgoWinograd:ConvBinWinogradRxSf2x3g1,0.043996,0,miopenConvolutionFwdAlgoWinograd,<unused>
544-7-7-1x1-128-7-7-32-0x0-1x1-1x1-0-NCHW-FP16-F=miopenConvolutionFwdAlgoImplicitGEMM:ConvHipImplicitGemmV4R1Fwd,0.061115,0,miopenConvolutionFwdAlgoImplicitGEMM,<unused>;miopenConvolutionFwdAlgoDirect:ConvAsm1x1U,0.092632,0,miopenConvolutionFwdAlgoDirect,<unused>;miopenConvolutionFwdAlgoGEMM:gemm,0.146868,0,rocBlas,<unused>;miopenConvolutionFwdAlgoWinograd:ConvBinWinogradRxSf2x3g1,0.199344,0,miopenConvolutionFwdAlgoWinograd,<unused>
576-7-7-1x1-128-7-7-32-0x0-1x1-1x1-0-NCHW-FP16-F=miopenConvolutionFwdAlgoImplicitGEMM:ConvHipImplicitGemmV4R1Fwd,0.070554,0,miopenConvolutionFwdAlgoImplicitGEMM,<unused>;miopenConvolutionFwdAlgoDirect:ConvAsm1x1U,0.059355,0,miopenConvolutionFwdAlgoDirect,<unused>;miopenConvolutionFwdAlgoGEMM:gemm,0.152947,0,rocBlas,<unused>;miopenConvolutionFwdAlgoWinograd:ConvBinWinogradRxSf2x3g1,0.208463,0,miopenConvolutionFwdAlgoWinograd,<unused>
608-7-7-1x1-128-7-7-32-0x0-1x1-1x1-0-NCHW-FP16-F=miopenConvolutionFwdAlgoImplicitGEMM:ConvHipImplicitGemmV4R1Fwd,0.074074,0,miopenConvolutionFwdAlgoImplicitGEMM,<unused>;miopenConvolutionFwdAlgoDirect:ConvAsm1x1U,0.061595,0,miopenConvolutionFwdAlgoDirect,<unused>;miopenConvolutionFwdAlgoGEMM:gemm,0.161107,0,rocBlas,<unused>;miopenConvolutionFwdAlgoWinograd:ConvBinWinogradRxSf2x3g1,0.220142,0,miopenConvolutionFwdAlgoWinograd,<unused>
640-7-7-1x1-128-7-7-32-0x0-1x1-1x1-0-NCHW-FP16-F=miopenConvolutionFwdAlgoImplicitGEMM:ConvHipImplicitGemmV4R1Fwd,0.082553,0,miopenConvolutionFwdAlgoImplicitGEMM,<unused>;miopenConvolutionFwdAlgoDirect:ConvAsm1x1U,0.060315,0,miopenConvolutionFwdAlgoDirect,<unused>;miopenConvolutionFwdAlgoGEMM:gemm,0.174705,0,rocBlas,<unused>;miopenConvolutionFwdAlgoWinograd:ConvBinWinogradRxSf2x3g1,0.228461,0,miopenConvolutionFwdAlgoWinograd,<unused>
672-7-7-1x1-128-7-7-32-0x0-1x1-1x1-0-NCHW-FP16-F=miopenConvolutionFwdAlgoImplicitGEMM:ConvHipImplicitGemmV4R1Fwd,0.076633,0,miopenConvolutionFwdAlgoImplicitGEMM,<unused>;miopenConvolutionFwdAlgoDirect:ConvAsm1x1U,0.069434,0,miopenConvolutionFwdAlgoDirect,<unused>;miopenConvolutionFwdAlgoGEMM:gemm,0.172146,0,rocBlas,<unused>;miopenConvolutionFwdAlgoWinograd:ConvBinWinogradRxSf2x3g1,0.23918,0,miopenConvolutionFwdAlgoWinograd,<unused>
704-7-7-1x1-128-7-7-32-0x0-1x1-1x1-0-NCHW-FP16-F=miopenConvolutionFwdAlgoImplicitGEMM:ConvHipImplicitGemmV4R1Fwd,0.084313,0,miopenConvolutionFwdAlgoImplicitGEMM,<unused>;miopenConvolutionFwdAlgoDirect:ConvAsm1x1U,0.067514,0,miopenConvolutionFwdAlgoDirect,<unused>;miopenConvolutionFwdAlgoGEMM:gemm,0.180465,0,rocBlas,<unused>;miopenConvolutionFwdAlgoWinograd:ConvBinWinogradRxSf2x3g1,0.24814,0,miopenConvolutionFwdAlgoWinograd,<unused>
736-7-7-1x1-128-7-7-32-0x0-1x1-1x1-0-NCHW-FP16-F=miopenConvolutionFwdAlgoImplicitGEMM:ConvHipImplicitGemmV4R1Fwd,0.088312,0,miopenConvolutionFwdAlgoImplicitGEMM,<unused>;miopenConvolutionFwdAlgoDirect:ConvAsm1x1U,0.075193,0,miopenConvolutionFwdAlgoDirect,<unused>;miopenConvolutionFwdAlgoGEMM:gemm,0.188944,0,rocBlas,<unused>;miopenConvolutionFwdAlgoWinograd:ConvBinWinogradRxSf2x3g1,0.258859,0,miopenConvolutionFwdAlgoWinograd,<unused>
768-7-7-1x1-128-7-7-32-0x0-1x1-1x1-0-NCHW-FP16-F=miopenConvolutionFwdAlgoImplicitGEMM:ConvHipImplicitGemmV4R1Fwd,0.11791,0,miopenConvolutionFwdAlgoImplicitGEMM,<unused>;miopenConvolutionFwdAlgoDirect:ConvAsm1x1U,0.078873,0,miopenConvolutionFwdAlgoDirect,<unused>;miopenConvolutionFwdAlgoGEMM:gemm,0.231981,0,rocBlas,<unused>;miopenConvolutionFwdAlgoWinograd:ConvBinWinogradRxSf2x3g1,0.268298,0,miopenConvolutionFwdAlgoWinograd,<unused>
800-7-7-1x1-128-7-7-32-0x0-1x1-1x1-0-NCHW-FP16-F=miopenConvolutionFwdAlgoImplicitGEMM:ConvHipImplicitGemmV4R1Fwd,0.095832,0,miopenConvolutionFwdAlgoImplicitGEMM,<unused>;miopenConvolutionFwdAlgoDirect:ConvAsm1x1U,0.131029,0,miopenConvolutionFwdAlgoDirect,<unused>;miopenConvolutionFwdAlgoGEMM:gemm,0.235661,0,rocBlas,<unused>;miopenConvolutionFwdAlgoWinograd:ConvBinWinogradRxSf2x3g1,0.278217,0,miopenConvolutionFwdAlgoWinograd,<unused>
832-7-7-1x1-128-7-7-32-0x0-1x1-1x1-0-NCHW-FP16-F=miopenConvolutionFwdAlgoImplicitGEMM:ConvHipImplicitGemmV4R1Fwd,0.099031,0,miopenConvolutionFwdAlgoImplicitGEMM,<unused>;miopenConvolutionFwdAlgoDirect:ConvAsm1x1U,0.086233,0,miopenConvolutionFwdAlgoDirect,<unused>;miopenConvolutionFwdAlgoGEMM:gemm,0.245419,0,rocBlas,<unused>;miopenConvolutionFwdAlgoWinograd:ConvBinWinogradRxSf2x3g1,0.287016,0,miopenConvolutionFwdAlgoWinograd,<unused>
864-7-7-1x1-128-7-7-32-0x0-1x1-1x1-0-NCHW-FP16-F=miopenConvolutionFwdAlgoImplicitGEMM:ConvHipImplicitGemmV4R1Fwd,0.093912,0,miopenConvolutionFwdAlgoImplicitGEMM,<unused>;miopenConvolutionFwdAlgoDirect:ConvAsm1x1U,0.140468,0,miopenConvolutionFwdAlgoDirect,<unused>;miopenConvolutionFwdAlgoGEMM:gemm,0.255659,0,rocBlas,<unused>;miopenConvolutionFwdAlgoWinograd:ConvBinWinogradRxSf2x3g1,0.299335,0,miopenConvolutionFwdAlgoWinograd,<unused>
896-7-7-1x1-128-7-7-32-0x0-1x1-1x1-0-NCHW-FP16-F=miopenConvolutionFwdAlgoImplicitGEMM:ConvHipImplicitGemmV4R1Fwd,0.11295,0,miopenConvolutionFwdAlgoImplicitGEMM,<unused>;miopenConvolutionFwdAlgoDirect:ConvAsm1x1U,0.142868,0,miopenConvolutionFwdAlgoDirect,<unused>;miopenConvolutionFwdAlgoGEMM:gemm,0.259658,0,rocBlas,<unused>;miopenConvolutionFwdAlgoWinograd:ConvBinWinogradRxSf2x3g1,0.307494,0,miopenConvolutionFwdAlgoWinograd,<unused>
928-7-7-1x1-128-7-7-32-0x0-1x1-1x1-0-NCHW-FP16-F=miopenConvolutionFwdAlgoImplicitGEMM:ConvHipImplicitGemmV4R1Fwd,0.096152,0,miopenConvolutionFwdAlgoImplicitGEMM,<unused>;miopenConvolutionFwdAlgoDirect:ConvAsm1x1U,0.084473,0,miopenConvolutionFwdAlgoDirect,<unused>;miopenConvolutionFwdAlgoGEMM:gemm,0.267818,0,rocBlas,<unused>;miopenConvolutionFwdAlgoWinograd:ConvBinWinogradRxSf2x3g1,0.317093,0,miopenConvolutionFwdAlgoWinograd,<unused>
960-7-7-1x1-128-7-7-32-0x0-1x1-1x1-0-NCHW-FP16-F=miopenConvolutionFwdAlgoImplicitGEMM:ConvHipImplicitGemmV4R1Fwd,0.12687,0,miopenConvolutionFwdAlgoImplicitGEMM,<unused>;miopenConvolutionFwdAlgoDirect:ConvAsm1x1U,0.153427,0,miopenConvolutionFwdAlgoDirect,<unused>;miopenConvolutionFwdAlgoGEMM:gemm,0.276937,0,rocBlas,<unused>;miopenConvolutionFwdAlgoWinograd:ConvBinWinogradRxSf2x3g1,0.327492,0,miopenConvolutionFwdAlgoWinograd,<unused>
992-7-7-1x1-128-7-7-32-0x0-1x1-1x1-0-NCHW-FP16-F=miopenConvolutionFwdAlgoImplicitGEMM:ConvHipImplicitGemmV4R1Fwd,0.108471,0,miopenConvolutionFwdAlgoImplicitGEMM,<unused>;miopenConvolutionFwdAlgoDirect:ConvAsm1x1U,0.157747,0,miopenConvolutionFwdAlgoDirect,<unused>;miopenConvolutionFwdAlgoGEMM:gemm,0.283016,0,rocBlas,<unused>;miopenConvolutionFwdAlgoWinograd:ConvBinWinogradRxSf2x3g1,0.336931,0,miopenConvolutionFwdAlgoWinograd,<unused>
3-299-299-3x3-32-149-149-32-0x0-2x2-1x1-0-NCHW-FP32-F=miopenConvolutionFwdAlgoDirect:ConvOclDirectFwdGen,0.862011,0,miopenConvolutionFwdAlgoDirect,<unused>;miopenConvolutionFwdAlgoGEMM:gemm,1.71501,2397708,rocBlas,<unused>;miopenConvolutionFwdAlgoWinograd:ConvBinWinogradRxSf2x3g1,0.628109,0,miopenConvolutionFwdAlgoWinograd,<unused>
32-149-149-3x3-32-147-147-32-0x0-1x1-1x1-0-NCHW-FP32-F=miopenConvolutionFwdAlgoImplicitGEMM:ConvHipImplicitGemmV4R1Fwd,1.91505,0,miopenConvolutionFwdAlgoImplicitGEMM,<unused>;miopenConvolutionFwdAlgoDirect:ConvOclDirectFwd,3.29366,0,miopenConvolutionFwdAlgoDirect,<unused>;miopenConvolutionFwdAlgoGEMM:gemm,5.07354,24893568,rocBlas,<unused>;miopenConvolutionFwdAlgoWinograd:ConvBinWinogradRxSf2x3g1,0.936085,0,miopenConvolutionFwdAlgoWinograd,<unused>
32-147-147-3x3-64-147-147-32-1x1-1x1-1x1-0-NCHW-FP32-F=miopenConvolutionFwdAlgoWinograd:ConvBinWinogradRxSf2x3g1,1.81441,0,miopenConvolutionFwdAlgoWinograd,<unused>
64-73-73-1x1-80-73-73-32-0x0-1x1-1x1-0-NCHW-FP32-F=miopenConvolutionFwdAlgoDirect:ConvOclDirectFwd1x1,0.261419,0,miopenConvolutionFwdAlgoDirect,<unused>;miopenConvolutionFwdAlgoGEMM:gemm,0.37869,0,rocBlas,<unused>;miopenConvolutionFwdAlgoWinograd:ConvBinWinogradRxSf3x2,0.861691,0,miopenConvolutionFwdAlgoWinograd,<unused>
80-73-73-3x3-192-71-71-32-0x0-1x1-1x1-0-NCHW-FP32-F=miopenConvolutionFwdAlgoImplicitGEMM:ConvHipImplicitGemmV4R1Fwd,5.07336,0,miopenConvolutionFwdAlgoImplicitGEMM,<unused>;miopenConvolutionFwdAlgoDirect:ConvOclDirectFwd,11.5999,0,miopenConvolutionFwdAlgoDirect,<unused>;miopenConvolutionFwdAlgoGEMM:gemm,6.25613,14518080,rocBlas,<unused>;miopenConvolutionFwdAlgoWinograd:ConvBinWinogradRxSf2x3g1,2.62235,0,miopenConvolutionFwdAlgoWinograd,<unused>
192-35-35-1x1-128-35-35-32-0x0-1x1-1x1-0-NCHW-FP32-F=miopenConvolutionFwdAlgoImplicitGEMM:ConvHipImplicitGemmV4R1Fwd,0.340133,0,miopenConvolutionFwdAlgoImplicitGEMM,<unused>;miopenConvolutionFwdAlgoDirect:ConvOclDirectFwd1x1,0.25406,0,miopenConvolutionFwdAlgoDirect,<unused>;miopenConvolutionFwdAlgoGEMM:gemm,0.240941,0,rocBlas,<unused>;miopenConvolutionFwdAlgoWinograd:ConvBinWinogradRxSf3x2,0.726823,0,miopenConvolutionFwdAlgoWinograd,<unused>
192-35-35-1x1-48-35-35-32-0x0-1x1-1x1-0-NCHW-FP32-F=miopenConvolutionFwdAlgoDirect:ConvOclDirectFwd1x1,0.105271,0,miopenConvolutionFwdAlgoDirect,<unused>;miopenConvolutionFwdAlgoGEMM:gemm,0.155828,0,rocBlas,<unused>;miopenConvolutionFwdAlgoWinograd:ConvBinWinogradRxSf3x2,0.373571,0,miopenConvolutionFwdAlgoWinograd,<unused>
48-35-35-5x5-64-35-35-32-2x2-1x1-1x1-0-NCHW-FP32-F=miopenConvolutionFwdAlgoImplicitGEMM:ConvHipImplicitGemmV4R1Fwd,0.794659,0,miopenConvolutionFwdAlgoImplicitGEMM,<unused>;miopenConvolutionFwdAlgoDirect:ConvOclDirectFwd,2.0736,0,miopenConvolutionFwdAlgoDirect,<unused>;miopenConvolutionFwdAlgoGEMM:gemm,2.8721,5880000,rocBlas,<unused>;miopenConvolutionFwdAlgoWinograd:ConvBinWinogradRxSf2x3g1,0.555797,0,miopenConvolutionFwdAlgoWinograd,<unused>
64-35-35-3x3-96-35-35-32-1x1-1x1-1x1-0-NCHW-FP32-F=miopenConvolutionFwdAlgoWinograd:ConvBinWinogradRxSf2x3g1,0.311496,0,miopenConvolutionFwdAlgoWinograd,<unused>
96-35-35-3x3-96-35-35-32-1x1-1x1-1x1-0-NCHW-FP32-F=miopenConvolutionFwdAlgoWinograd:ConvBinWinogradRxSf2x3g1,0.432926,0,miopenConvolutionFwdAlgoWinograd,<unused>
192-35-35-1x1-32-35-35-32-0x0-1x1-1x1-0-NCHW-FP32-F=miopenConvolutionFwdAlgoImplicitGEMM:ConvHipImplicitGemmV4R1Fwd,0.161267,0,miopenConvolutionFwdAlgoImplicitGEMM,<unused>;miopenConvolutionFwdAlgoDirect:ConvOclDirectFwd1x1,0.083033,0,miopenConvolutionFwdAlgoDirect,<unused>;miopenConvolutionFwdAlgoGEMM:gemm,0.103672,0,rocBlas,<unused>;miopenConvolutionFwdAlgoWinograd:ConvBinWinogradRxSf3x2,0.237742,0,miopenConvolutionFwdAlgoWinograd,<unused>
256-35-35-1x1-128-35-35-32-0x0-1x1-1x1-0-NCHW-FP32-F=miopenConvolutionFwdAlgoImplicitGEMM:ConvHipImplicitGemmV4R1Fwd,0.478524,0,miopenConvolutionFwdAlgoImplicitGEMM,<unused>;miopenConvolutionFwdAlgoDirect:ConvOclDirectFwd1x1,0.38157,0,miopenConvolutionFwdAlgoDirect,<unused>;miopenConvolutionFwdAlgoGEMM:gemm,0.302697,0,rocBlas,<unused>;miopenConvolutionFwdAlgoWinograd:ConvBinWinogradRxSf3x2,0.942008,0,miopenConvolutionFwdAlgoWinograd,<unused>
256-35-35-1x1-48-35-35-32-0x0-1x1-1x1-0-NCHW-FP32-F=miopenConvolutionFwdAlgoDirect:ConvOclDirectFwd1x1,0.140149,0,miopenConvolutionFwdAlgoDirect,<unused>;miopenConvolutionFwdAlgoGEMM:gemm,0.180467,0,rocBlas,<unused>;miopenConvolutionFwdAlgoWinograd:ConvBinWinogradRxSf3x2,0.483483,0,miopenConvolutionFwdAlgoWinograd,<unused>
256-35-35-1x1-64-35-35-32-0x0-1x1-1x1-0-NCHW-FP32-F=miopenConvolutionFwdAlgoImplicitGEMM:ConvHipImplicitGemmV4R1Fwd,0.253741,0,miopenConvolutionFwdAlgoImplicitGEMM,<unused>;miopenConvolutionFwdAlgoDirect:ConvOclDirectFwd1x1,0.201745,0,miopenConvolutionFwdAlgoDirect,<unused>;miopenConvolutionFwdAlgoGEMM:gemm,0.177587,0,rocBlas,<unused>;miopenConvolutionFwdAlgoWinograd:ConvBinWinogradRxSf3x2,0.485564,0,miopenConvolutionFwdAlgoWinograd,<unused>
288-35-35-1x1-128-35-35-32-0x0-1x1-1x1-0-NCHW-FP32-F=miopenConvolutionFwdAlgoImplicitGEMM:ConvHipImplicitGemmV4R1Fwd,0.402369,0,miopenConvolutionFwdAlgoImplicitGEMM,<unused>;miopenConvolutionFwdAlgoDirect:ConvAsm1x1U,0.421569,0,miopenConvolutionFwdAlgoDirect,<unused>;miopenConvolutionFwdAlgoGEMM:gemm,0.323975,0,rocBlas,<unused>;miopenConvolutionFwdAlgoWinograd:ConvBinWinogradRxSf3x2,1.03304,0,miopenConvolutionFwdAlgoWinograd,<unused>
288-35-35-1x1-48-35-35-32-0x0-1x1-1x1-0-NCHW-FP32-F=miopenConvolutionFwdAlgoDirect:ConvOclDirectFwd1x1,0.156469,0,miopenConvolutionFwdAlgoDirect,<unused>;miopenConvolutionFwdAlgoGEMM:gemm,0.194385,0,rocBlas,<unused>;miopenConvolutionFwdAlgoWinograd:ConvBinWinogradRxSf3x2,0.530201,0,miopenConvolutionFwdAlgoWinograd,<unused>
288-35-35-1x1-64-35-35-32-0x0-1x1-1x1-0-NCHW-FP32-F=miopenConvolutionFwdAlgoImplicitGEMM:ConvHipImplicitGemmV4R1Fwd,0.232143,0,miopenConvolutionFwdAlgoImplicitGEMM,<unused>;miopenConvolutionFwdAlgoDirect:ConvOclDirectFwd1x1,0.200785,0,miopenConvolutionFwdAlgoDirect,<unused>;miopenConvolutionFwdAlgoGEMM:gemm,0.191186,0,rocBlas,<unused>;miopenConvolutionFwdAlgoWinograd:ConvBinWinogradRxSf3x2,0.53212,0,miopenConvolutionFwdAlgoWinograd,<unused>
288-35-35-3x3-384-17-17-32-0x0-2x2-1x1-0-NCHW-FP32-F=miopenConvolutionFwdAlgoImplicitGEMM:ConvHipImplicitGemmV4R1Fwd,2.41086,0,miopenConvolutionFwdAlgoImplicitGEMM,<unused>;miopenConvolutionFwdAlgoDirect:ConvOclDirectFwd,59.495,0,miopenConvolutionFwdAlgoDirect,<unused>;miopenConvolutionFwdAlgoGEMM:gemm,4.23901,2996352,rocBlas,<unused>;miopenConvolutionFwdAlgoWinograd:ConvBinWinogradRxSf2x3g1,4.76621,0,miopenConvolutionFwdAlgoWinograd,<unused>
96-35-35-3x3-96-17-17-32-0x0-2x2-1x1-0-NCHW-FP32-F=miopenConvolutionFwdAlgoImplicitGEMM:ConvHipImplicitGemmV4R1Fwd,0.250381,0,miopenConvolutionFwdAlgoImplicitGEMM,<unused>;miopenConvolutionFwdAlgoDirect:ConvOclDirectFwd,1.82595,0,miopenConvolutionFwdAlgoDirect,<unused>;miopenConvolutionFwdAlgoGEMM:gemm,2.21165,998784,rocBlas,<unused>;miopenConvolutionFwdAlgoWinograd:ConvBinWinogradRxSf2x3g1,0.502203,0,miopenConvolutionFwdAlgoWinograd,<unused>
768-17-17-1x1-256-17-17-32-0x0-1x1-1x1-0-NCHW-FP32-F=miopenConvolutionFwdAlgoImplicitGEMM:ConvHipImplicitGemmV4R1Fwd,0.643793,0,miopenConvolutionFwdAlgoImplicitGEMM,<unused>;miopenConvolutionFwdAlgoDirect:ConvAsm1x1U,0.575798,0,miopenConvolutionFwdAlgoDirect,<unused>;miopenConvolutionFwdAlgoGEMM:gemm,0.448927,0,rocBlas,<unused>;miopenConvolutionFwdAlgoWinograd:ConvBinWinogradRxSf3x2,1.38678,0,miopenConvolutionFwdAlgoWinograd,<unused>
768-17-17-1x1-192-17-17-32-0x0-1x1-1x1-0-NCHW-FP32-F=miopenConvolutionFwdAlgoImplicitGEMM:ConvHipImplicitGemmV4R1Fwd,0.509242,0,miopenConvolutionFwdAlgoImplicitGEMM,<unused>;miopenConvolutionFwdAlgoDirect:ConvOclDirectFwd1x1,0.392611,0,miopenConvolutionFwdAlgoDirect,<unused>;miopenConvolutionFwdAlgoGEMM:gemm,0.321577,0,rocBlas,<unused>;miopenConvolutionFwdAlgoWinograd:ConvBinWinogradRxSf3x2,1.11032,0,miopenConvolutionFwdAlgoWinograd,<unused>
128-17-17-1x7-128-17-17-32-0x3-1x1-1x1-0-NCHW-FP32-F=miopenConvolutionFwdAlgoImplicitGEMM:ConvHipImplicitGemmV4R1Fwd,0.319817,0,miopenConvolutionFwdAlgoImplicitGEMM,<unused>;miopenConvolutionFwdAlgoGEMM:gemm,2.0888,1035776,rocBlas,<unused>;miopenConvolutionFwdAlgoWinograd:ConvBinWinogradRxSf3x2,0.572278,0,miopenConvolutionFwdAlgoWinograd,<unused>
128-17-17-7x1-192-17-17-32-3x0-1x1-1x1-0-NCHW-FP32-F=miopenConvolutionFwdAlgoImplicitGEMM:ConvHipImplicitGemmV4R1Fwd,0.54732,0,miopenConvolutionFwdAlgoImplicitGEMM,<unused>;miopenConvolutionFwdAlgoGEMM:gemm,2.20147,1035776,rocBlas,<unused>;miopenConvolutionFwdAlgoWinograd:ConvBinWinogradRxSf3x2,0.762985,0,miopenConvolutionFwdAlgoWinograd,<unused>
128-17-17-7x1-128-17-17-32-3x0-1x1-1x1-0-NCHW-FP32-F=miopenConvolutionFwdAlgoImplicitGEMM:ConvHipImplicitGemmV4R1Fwd,0.356294,0,miopenConvolutionFwdAlgoImplicitGEMM,<unused>;miopenConvolutionFwdAlgoGEMM:gemm,1.92496,1035776,rocBlas,<unused>;miopenConvolutionFwdAlgoWinograd:ConvBinWinogradRxSf3x2,0.580758,0,miopenConvolutionFwdAlgoWinograd,<unused>
128-17-17-1x7-192-17-17-32-0x3-1x1-1x1-0-NCHW-FP32-F=miopenConvolutionFwdAlgoImplicitGEMM:ConvHipImplicitGemmV4R1Fwd,0.456769,0,miopenConvolutionFwdAlgoImplicitGEMM,<unused>;miopenConvolutionFwdAlgoGEMM:gemm,2.04784,1035776,rocBlas,<unused>;miopenConvolutionFwdAlgoWinograd:ConvBinWinogradRxSf3x2,0.754027,0,miopenConvolutionFwdAlgoWinograd,<unused>
768-17-17-1x1-320-17-17-32-0x0-1x1-1x1-0-NCHW-FP32-F=miopenConvolutionFwdAlgoImplicitGEMM:ConvHipImplicitGemmV4R1Fwd,0.796425,0,miopenConvolutionFwdAlgoImplicitGEMM,<unused>;miopenConvolutionFwdAlgoDirect:ConvAsm1x1U,0.699471,0,miopenConvolutionFwdAlgoDirect,<unused>;miopenConvolutionFwdAlgoGEMM:gemm,0.519484,0,rocBlas,<unused>;miopenConvolutionFwdAlgoWinograd:ConvBinWinogradRxSf3x2,1.62533,0,miopenConvolutionFwdAlgoWinograd,<unused>
160-17-17-1x7-160-17-17-32-0x3-1x1-1x1-0-NCHW-FP32-F=miopenConvolutionFwdAlgoImplicitGEMM:ConvHipImplicitGemmV4R1Fwd,0.483807,0,miopenConvolutionFwdAlgoImplicitGEMM,<unused>;miopenConvolutionFwdAlgoGEMM:gemm,2.18093,1294720,rocBlas,<unused>;miopenConvolutionFwdAlgoWinograd:ConvBinWinogradRxSf3x2,0.681072,0,miopenConvolutionFwdAlgoWinograd,<unused>
160-17-17-7x1-192-17-17-32-3x0-1x1-1x1-0-NCHW-FP32-F=miopenConvolutionFwdAlgoImplicitGEMM:ConvHipImplicitGemmV4R1Fwd,0.657395,0,miopenConvolutionFwdAlgoImplicitGEMM,<unused>;miopenConvolutionFwdAlgoGEMM:gemm,2.20144,1294720,rocBlas,<unused>;miopenConvolutionFwdAlgoWinograd:ConvBinWinogradRxSf3x2,0.926335,0,miopenConvolutionFwdAlgoWinograd,<unused>
160-17-17-7x1-160-17-17-32-3x0-1x1-1x1-0-NCHW-FP32-F=miopenConvolutionFwdAlgoImplicitGEMM:ConvHipImplicitGemmV4R1Fwd,0.579481,0,miopenConvolutionFwdAlgoImplicitGEMM,<unused>;miopenConvolutionFwdAlgoGEMM:gemm,2.25264,1294720,rocBlas,<unused>;miopenConvolutionFwdAlgoWinograd:ConvBinWinogradRxSf3x2,0.690993,0,miopenConvolutionFwdAlgoWinograd,<unused>
160-17-17-1x7-192-17-17-32-0x3-1x1-1x1-0-NCHW-FP32-F=miopenConvolutionFwdAlgoImplicitGEMM:ConvHipImplicitGemmV4R1Fwd,0.556122,0,miopenConvolutionFwdAlgoImplicitGEMM,<unused>;miopenConvolutionFwdAlgoGEMM:gemm,2.07344,1294720,rocBlas,<unused>;miopenConvolutionFwdAlgoWinograd:ConvBinWinogradRxSf3x2,0.917857,0,miopenConvolutionFwdAlgoWinograd,<unused>
768-17-17-1x1-576-17-17-32-0x0-1x1-1x1-0-NCHW-FP32-F=miopenConvolutionFwdAlgoImplicitGEMM:ConvHipImplicitGemmV4R1Fwd,1.34327,0,miopenConvolutionFwdAlgoImplicitGEMM,<unused>;miopenConvolutionFwdAlgoDirect:ConvAsm1x1U,1.28679,0,miopenConvolutionFwdAlgoDirect,<unused>;miopenConvolutionFwdAlgoGEMM:gemm,1.06233,0,rocBlas,<unused>;miopenConvolutionFwdAlgoWinograd:ConvBinWinogradRxSf3x2,2.99659,0,miopenConvolutionFwdAlgoWinograd,<unused>
192-17-17-1x7-192-17-17-32-0x3-1x1-1x1-0-NCHW-FP32-F=miopenConvolutionFwdAlgoImplicitGEMM:ConvHipImplicitGemmV4R1Fwd,0.672915,0,miopenConvolutionFwdAlgoImplicitGEMM,<unused>;miopenConvolutionFwdAlgoGEMM:gemm,2.40112,1553664,rocBlas,<unused>;miopenConvolutionFwdAlgoWinograd:ConvBinWinogradRxSf3x2,1.10793,0,miopenConvolutionFwdAlgoWinograd,<unused>
192-17-17-7x1-192-17-17-32-3x0-1x1-1x1-0-NCHW-FP32-F=miopenConvolutionFwdAlgoImplicitGEMM:ConvHipImplicitGemmV4R1Fwd,0.786988,0,miopenConvolutionFwdAlgoImplicitGEMM,<unused>;miopenConvolutionFwdAlgoGEMM:gemm,2.38576,1553664,rocBlas,<unused>;miopenConvolutionFwdAlgoWinograd:ConvBinWinogradRxSf3x2,1.11864,0,miopenConvolutionFwdAlgoWinograd,<unused>
768-17-17-1x1-384-17-17-32-0x0-1x1-1x1-0-NCHW-FP32-F=miopenConvolutionFwdAlgoImplicitGEMM:ConvHipImplicitGemmV4R1Fwd,0.939138,0,miopenConvolutionFwdAlgoImplicitGEMM,<unused>;miopenConvolutionFwdAlgoDirect:ConvAsm1x1U,0.835944,0,miopenConvolutionFwdAlgoDirect,<unused>;miopenConvolutionFwdAlgoGEMM:gemm,0.607,0,rocBlas,<unused>;miopenConvolutionFwdAlgoWinograd:ConvBinWinogradRxSf3x2,2.20065,0,miopenConvolutionFwdAlgoWinograd,<unused>
192-17-17-3x3-320-8-8-32-0x0-2x2-1x1-0-NCHW-FP32-F=miopenConvolutionFwdAlgoImplicitGEMM:ConvHipImplicitGemmV4R1Fwd,0.339338,0,miopenConvolutionFwdAlgoImplicitGEMM,<unused>;miopenConvolutionFwdAlgoDirect:ConvOclDirectFwd,1.38231,0,miopenConvolutionFwdAlgoDirect,<unused>;miopenConvolutionFwdAlgoGEMM:gemm,2.9489,442368,rocBlas,<unused>;miopenConvolutionFwdAlgoWinograd:ConvBinWinogradRxSf2x3g1,0.60444,0,miopenConvolutionFwdAlgoWinograd,<unused>
192-17-17-3x3-192-8-8-32-0x0-2x2-1x1-0-NCHW-FP32-F=miopenConvolutionFwdAlgoImplicitGEMM:ConvHipImplicitGemmV4R1Fwd,0.264943,0,miopenConvolutionFwdAlgoImplicitGEMM,<unused>;miopenConvolutionFwdAlgoDirect:ConvOclDirectFwd,0.933379,0,miopenConvolutionFwdAlgoDirect,<unused>;miopenConvolutionFwdAlgoGEMM:gemm,3.32778,442368,rocBlas,<unused>;miopenConvolutionFwdAlgoWinograd:ConvBinWinogradRxSf2x3g1,0.406694,0,miopenConvolutionFwdAlgoWinograd,<unused>
1280-8-8-1x1-320-8-8-32-0x0-1x1-1x1-0-NCHW-FP32-F=miopenConvolutionFwdAlgoImplicitGEMM:ConvHipImplicitGemmV4R1Fwd,0.244784,0,miopenConvolutionFwdAlgoImplicitGEMM,<unused>;miopenConvolutionFwdAlgoDirect:ConvAsm1x1U,0.288462,0,miopenConvolutionFwdAlgoDirect,<unused>;miopenConvolutionFwdAlgoGEMM:gemm,0.483489,0,rocBlas,<unused>;miopenConvolutionFwdAlgoWinograd:ConvBinWinogradRxSf3x2,0.92954,0,miopenConvolutionFwdAlgoWinograd,<unused>
1280-8-8-1x1-384-8-8-32-0x0-1x1-1x1-0-NCHW-FP32-F=miopenConvolutionFwdAlgoImplicitGEMM:ConvHipImplicitGemmV4R1Fwd,0.3059,0,miopenConvolutionFwdAlgoImplicitGEMM,<unused>;miopenConvolutionFwdAlgoDirect:ConvAsm1x1U,0.328778,0,miopenConvolutionFwdAlgoDirect,<unused>;miopenConvolutionFwdAlgoGEMM:gemm,0.611481,0,rocBlas,<unused>;miopenConvolutionFwdAlgoWinograd:ConvBinWinogradRxSf3x2,0.92794,0,miopenConvolutionFwdAlgoWinograd,<unused>
384-8-8-1x3-384-8-8-32-0x1-1x1-1x1-0-NCHW-FP32-F=miopenConvolutionFwdAlgoImplicitGEMM:ConvHipImplicitGemmV4R1Fwd,0.281742,0,miopenConvolutionFwdAlgoImplicitGEMM,<unused>;miopenConvolutionFwdAlgoGEMM:gemm,2.58026,294912,rocBlas,<unused>;miopenConvolutionFwdAlgoWinograd:ConvBinWinogradRxSf2x3g1,0.400135,0,miopenConvolutionFwdAlgoWinograd,<unused>
384-8-8-3x1-384-8-8-32-1x0-1x1-1x1-0-NCHW-FP32-F=miopenConvolutionFwdAlgoImplicitGEMM:ConvHipImplicitGemmV4R1Fwd,0.307341,0,miopenConvolutionFwdAlgoImplicitGEMM,<unused>;miopenConvolutionFwdAlgoGEMM:gemm,2.46765,294912,rocBlas,<unused>;miopenConvolutionFwdAlgoWinograd:ConvBinWinogradRxSf2x3g1,0.404935,0,miopenConvolutionFwdAlgoWinograd,<unused>
1280-8-8-1x1-448-8-8-32-0x0-1x1-1x1-0-NCHW-FP32-F=miopenConvolutionFwdAlgoImplicitGEMM:ConvHipImplicitGemmV4R1Fwd,0.307341,0,miopenConvolutionFwdAlgoImplicitGEMM,<unused>;miopenConvolutionFwdAlgoDirect:ConvAsm1x1U,0.337739,0,miopenConvolutionFwdAlgoDirect,<unused>;miopenConvolutionFwdAlgoGEMM:gemm,0.705076,0,rocBlas,<unused>;miopenConvolutionFwdAlgoWinograd:ConvBinWinogradRxSf2x3g1,1.25336,0,miopenConvolutionFwdAlgoWinograd,<unused>
448-8-8-3x3-384-8-8-32-1x1-1x1-1x1-0-NCHW-FP32-F=miopenConvolutionFwdAlgoWinograd:ConvBinWinogradRxSf2x3g1,0.48621,0,miopenConvolutionFwdAlgoWinograd,<unused>
1280-8-8-1x1-192-8-8-32-0x0-1x1-1x1-0-NCHW-FP32-F=miopenConvolutionFwdAlgoImplicitGEMM:ConvHipImplicitGemmV4R1Fwd,0.192308,0,miopenConvolutionFwdAlgoImplicitGEMM,<unused>;miopenConvolutionFwdAlgoDirect:ConvOclDirectFwd1x1,0.184149,0,miopenConvolutionFwdAlgoDirect,<unused>;miopenConvolutionFwdAlgoGEMM:gemm,0.305421,0,rocBlas,<unused>;miopenConvolutionFwdAlgoWinograd:ConvBinWinogradRxSf3x2,0.47997,0,miopenConvolutionFwdAlgoWinograd,<unused>
2048-8-8-1x1-320-8-8-32-0x0-1x1-1x1-0-NCHW-FP32-F=miopenConvolutionFwdAlgoImplicitGEMM:ConvHipImplicitGemmV4R1Fwd,0.538847,0,miopenConvolutionFwdAlgoImplicitGEMM,<unused>;miopenConvolutionFwdAlgoDirect:ConvOclDirectFwd1x1,0.460932,0,miopenConvolutionFwdAlgoDirect,<unused>;miopenConvolutionFwdAlgoGEMM:gemm,0.702516,0,rocBlas,<unused>;miopenConvolutionFwdAlgoWinograd:ConvBinWinogradRxSf3x2,1.46679,0,miopenConvolutionFwdAlgoWinograd,<unused>
2048-8-8-1x1-384-8-8-32-0x0-1x1-1x1-0-NCHW-FP32-F=miopenConvolutionFwdAlgoImplicitGEMM:ConvHipImplicitGemmV4R1Fwd,0.614522,0,miopenConvolutionFwdAlgoImplicitGEMM,<unused>;miopenConvolutionFwdAlgoDirect:ConvOclDirectFwd1x1,0.726995,0,miopenConvolutionFwdAlgoDirect,<unused>;miopenConvolutionFwdAlgoGEMM:gemm,0.834668,0,rocBlas,<unused>;miopenConvolutionFwdAlgoWinograd:ConvBinWinogradRxSf3x2,1.46375,0,miopenConvolutionFwdAlgoWinograd,<unused>
2048-8-8-1x1-448-8-8-32-0x0-1x1-1x1-0-NCHW-FP32-F=miopenConvolutionFwdAlgoImplicitGEMM:ConvHipImplicitGemmV4R1Fwd,0.540608,0,miopenConvolutionFwdAlgoImplicitGEMM,<unused>;miopenConvolutionFwdAlgoDirect:ConvOclDirectFwd1x1,0.791152,0,miopenConvolutionFwdAlgoDirect,<unused>;miopenConvolutionFwdAlgoGEMM:gemm,0.968581,0,rocBlas,<unused>;miopenConvolutionFwdAlgoWinograd:ConvBinWinogradRxSf2x3g1,1.981,0,miopenConvolutionFwdAlgoWinograd,<unused>
2048-8-8-1x1-192-8-8-32-0x0-1x1-1x1-0-NCHW-FP32-F=miopenConvolutionFwdAlgoImplicitGEMM:ConvHipImplicitGemmV4R1Fwd,0.33246,0,miopenConvolutionFwdAlgoImplicitGEMM,<unused>;miopenConvolutionFwdAlgoDirect:ConvAsm1x1U,0.460292,0,miopenConvolutionFwdAlgoDirect,<unused>;miopenConvolutionFwdAlgoGEMM:gemm,0.441094,0,rocBlas,<unused>;miopenConvolutionFwdAlgoWinograd:ConvBinWinogradRxSf3x2,0.747315,0,miopenConvolutionFwdAlgoWinograd,<unused>
3-299-299-3x3-32-149-149-32-0x0-2x2-1x1-0-NCHW-FP16-F=miopenConvolutionFwdAlgoDirect:ConvOclDirectFwdGen,0.476043,0,miopenConvolutionFwdAlgoDirect,<unused>;miopenConvolutionFwdAlgoGEMM:gemm,1.88435,1198854,rocBlas,<unused>;miopenConvolutionFwdAlgoWinograd:ConvBinWinogradRxSf2x3g1,0.608854,0,miopenConvolutionFwdAlgoWinograd,<unused>
32-149-149-3x3-32-147-147-32-0x0-1x1-1x1-0-NCHW-FP16-F=miopenConvolutionFwdAlgoImplicitGEMM:ConvHipImplicitGemmV4R1Fwd,1.37068,0,miopenConvolutionFwdAlgoImplicitGEMM,<unused>;miopenConvolutionFwdAlgoDirect:ConvOclDirectFwd,1.94897,0,miopenConvolutionFwdAlgoDirect,<unused>;miopenConvolutionFwdAlgoGEMM:gemm,7.46051,12446784,rocBlas,<unused>;miopenConvolutionFwdAlgoWinograd:ConvBinWinogradRxSf2x3g1,0.697662,0,miopenConvolutionFwdAlgoWinograd,<unused>
32-147-147-3x3-64-147-147-32-1x1-1x1-1x1-0-NCHW-FP16-F=miopenConvolutionFwdAlgoImplicitGEMM:ConvHipImplicitGemmV4R1Fwd,2.48246,0,miopenConvolutionFwdAlgoImplicitGEMM,<unused>;miopenConvolutionFwdAlgoDirect:ConvOclDirectFwd,4.19237,0,miopenConvolutionFwdAlgoDirect,<unused>;miopenConvolutionFwdAlgoGEMM:gemm,7.23008,12446784,rocBlas,<unused>;miopenConvolutionFwdAlgoWinograd:ConvBinWinogradRxSf2x3g1,1.32188,0,miopenConvolutionFwdAlgoWinograd,<unused>
64-73-73-1x1-80-73-73-32-0x0-1x1-1x1-0-NCHW-FP16-F=miopenConvolutionFwdAlgoDirect:ConvAsm1x1U,0.264183,0,miopenConvolutionFwdAlgoDirect,<unused>;miopenConvolutionFwdAlgoGEMM:gemm,0.566289,0,rocBlas,<unused>;miopenConvolutionFwdAlgoWinograd:ConvBinWinogradRxSf2x3g1,0.838313,0,miopenConvolutionFwdAlgoWinograd,<unused>
80-73-73-3x3-192-71-71-32-0x0-1x1-1x1-0-NCHW-FP16-F=miopenConvolutionFwdAlgoImplicitGEMM:ConvHipImplicitGemmV4R1Fwd,4.22244,0,miopenConvolutionFwdAlgoImplicitGEMM,<unused>;miopenConvolutionFwdAlgoDirect:ConvOclDirectFwd,8.54043,0,miopenConvolutionFwdAlgoDirect,<unused>;miopenConvolutionFwdAlgoGEMM:gemm,9.89782,7259040,rocBlas,<unused>;miopenConvolutionFwdAlgoWinograd:ConvBinWinogradRxSf2x3g1,1.75151,0,miopenConvolutionFwdAlgoWinograd,<unused>
192-35-35-1x1-128-35-35-32-0x0-1x1-1x1-0-NCHW-FP16-F=miopenConvolutionFwdAlgoImplicitGEMM:ConvHipImplicitGemmV4R1Fwd,0.410113,0,miopenConvolutionFwdAlgoImplicitGEMM,<unused>;miopenConvolutionFwdAlgoDirect:ConvAsm1x1U,0.225137,0,miopenConvolutionFwdAlgoDirect,<unused>;miopenConvolutionFwdAlgoGEMM:gemm,0.359711,0,rocBlas,<unused>;miopenConvolutionFwdAlgoWinograd:ConvBinWinogradRxSf2x3g1,0.685339,0,miopenConvolutionFwdAlgoWinograd,<unused>
192-35-35-1x1-48-35-35-32-0x0-1x1-1x1-0-NCHW-FP16-F=miopenConvolutionFwdAlgoDirect:ConvAsm1x1U,0.095528,0,miopenConvolutionFwdAlgoDirect,<unused>;miopenConvolutionFwdAlgoGEMM:gemm,0.196975,0,rocBlas,<unused>;miopenConvolutionFwdAlgoWinograd:ConvBinWinogradRxSf2x3g1,0.356827,0,miopenConvolutionFwdAlgoWinograd,<unused>
48-35-35-5x5-64-35-35-32-2x2-1x1-1x1-0-NCHW-FP16-F=miopenConvolutionFwdAlgoImplicitGEMM:ConvHipImplicitGemmV4R1Fwd,0.591885,0,miopenConvolutionFwdAlgoImplicitGEMM,<unused>;miopenConvolutionFwdAlgoDirect:ConvOclDirectFwd,1.32634,0,miopenConvolutionFwdAlgoDirect,<unused>;miopenConvolutionFwdAlgoGEMM:gemm,10.7273,2940000,rocBlas,<unused>;miopenConvolutionFwdAlgoWinograd:ConvBinWinogradRxSf2x3g1,0.368508,0,miopenConvolutionFwdAlgoWinograd,<unused>
64-35-35-3x3-96-35-35-32-1x1-1x1-1x1-0-NCHW-FP16-F=miopenConvolutionFwdAlgoImplicitGEMM:ConvHipImplicitGemmV4R1Fwd,0.426273,0,miopenConvolutionFwdAlgoImplicitGEMM,<unused>;miopenConvolutionFwdAlgoDirect:ConvOclDirectFwd,1.31338,0,miopenConvolutionFwdAlgoDirect,<unused>;miopenConvolutionFwdAlgoGEMM:gemm,4.71587,1411200,rocBlas,<unused>;miopenConvolutionFwdAlgoWinograd:ConvBinWinogradRxSf2x3g1,0.223377,0,miopenConvolutionFwdAlgoWinograd,<unused>
96-35-35-3x3-96-35-35-32-1x1-1x1-1x1-0-NCHW-FP16-F=miopenConvolutionFwdAlgoImplicitGEMM:ConvHipImplicitGemmV4R1Fwd,0.65509,0,miopenConvolutionFwdAlgoImplicitGEMM,<unused>;miopenConvolutionFwdAlgoDirect:ConvOclDirectFwd,2.03088,0,miopenConvolutionFwdAlgoDirect,<unused>;miopenConvolutionFwdAlgoGEMM:gemm,7.99293,2116800,rocBlas,<unused>;miopenConvolutionFwdAlgoWinograd:ConvBinWinogradRxSf2x3g1,0.299863,0,miopenConvolutionFwdAlgoWinograd,<unused>
192-35-35-1x1-32-35-35-32-0x0-1x1-1x1-0-NCHW-FP16-F=miopenConvolutionFwdAlgoImplicitGEMM:ConvHipImplicitGemmV4R1Fwd,0.118729,0,miopenConvolutionFwdAlgoImplicitGEMM,<unused>;miopenConvolutionFwdAlgoDirect:ConvAsm1x1U,0.073285,0,miopenConvolutionFwdAlgoDirect,<unused>;miopenConvolutionFwdAlgoGEMM:gemm,0.194255,0,rocBlas,<unused>;miopenConvolutionFwdAlgoWinograd:ConvBinWinogradRxSf2x3g1,0.210577,0,miopenConvolutionFwdAlgoWinograd,<unused>
256-35-35-1x1-128-35-35-32-0x0-1x1-1x1-0-NCHW-FP16-F=miopenConvolutionFwdAlgoImplicitGEMM:ConvHipImplicitGemmV4R1Fwd,0.537637,0,miopenConvolutionFwdAlgoImplicitGEMM,<unused>;miopenConvolutionFwdAlgoDirect:ConvAsm1x1U,0.2925,0,miopenConvolutionFwdAlgoDirect,<unused>;miopenConvolutionFwdAlgoGEMM:gemm,0.465315,0,rocBlas,<unused>;miopenConvolutionFwdAlgoWinograd:ConvBinWinogradRxSf2x3g1,0.891908,0,miopenConvolutionFwdAlgoWinograd,<unused>
256-35-35-1x1-48-35-35-32-0x0-1x1-1x1-0-NCHW-FP16-F=miopenConvolutionFwdAlgoDirect:ConvAsm1x1U,0.121608,0,miopenConvolutionFwdAlgoDirect,<unused>;miopenConvolutionFwdAlgoGEMM:gemm,0.250257,0,rocBlas,<unused>;miopenConvolutionFwdAlgoWinograd:ConvBinWinogradRxSf2x3g1,0.458592,0,miopenConvolutionFwdAlgoWinograd,<unused>
256-35-35-1x1-64-35-35-32-0x0-1x1-1x1-0-NCHW-FP16-F=miopenConvolutionFwdAlgoImplicitGEMM:ConvHipImplicitGemmV4R1Fwd,0.275539,0,miopenConvolutionFwdAlgoImplicitGEMM,<unused>;miopenConvolutionFwdAlgoDirect:ConvAsm1x1U,0.174732,0,miopenConvolutionFwdAlgoDirect,<unused>;miopenConvolutionFwdAlgoGEMM:gemm,0.255538,0,rocBlas,<unused>;miopenConvolutionFwdAlgoWinograd:ConvBinWinogradRxSf2x3g1,0.460512,0,miopenConvolutionFwdAlgoWinograd,<unused>
288-35-35-1x1-128-35-35-32-0x0-1x1-1x1-0-NCHW-FP16-F=miopenConvolutionFwdAlgoImplicitGEMM:ConvHipImplicitGemmV4R1Fwd,0.560195,0,miopenConvolutionFwdAlgoImplicitGEMM,<unused>;miopenConvolutionFwdAlgoDirect:ConvAsm1x1U,0.32642,0,miopenConvolutionFwdAlgoDirect,<unused>;miopenConvolutionFwdAlgoGEMM:gemm,0.515235,0,rocBlas,<unused>;miopenConvolutionFwdAlgoWinograd:ConvBinWinogradRxSf2x3g1,0.983907,0,miopenConvolutionFwdAlgoWinograd,<unused>
288-35-35-1x1-48-35-35-32-0x0-1x1-1x1-0-NCHW-FP16-F=miopenConvolutionFwdAlgoDirect:ConvAsm1x1U,0.146409,0,miopenConvolutionFwdAlgoDirect,<unused>;miopenConvolutionFwdAlgoGEMM:gemm,0.276978,0,rocBlas,<unused>;miopenConvolutionFwdAlgoWinograd:ConvBinWinogradRxSf2x3g1,0.504991,0,miopenConvolutionFwdAlgoWinograd,<unused>
288-35-35-1x1-64-35-35-32-0x0-1x1-1x1-0-NCHW-FP16-F=miopenConvolutionFwdAlgoImplicitGEMM:ConvHipImplicitGemmV4R1Fwd,0.297458,0,miopenConvolutionFwdAlgoImplicitGEMM,<unused>;miopenConvolutionFwdAlgoDirect:ConvAsm1x1U,0.194572,0,miopenConvolutionFwdAlgoDirect,<unused>;miopenConvolutionFwdAlgoGEMM:gemm,0.278898,0,rocBlas,<unused>;miopenConvolutionFwdAlgoWinograd:ConvBinWinogradRxSf2x3g1,0.506111,0,miopenConvolutionFwdAlgoWinograd,<unused>
288-35-35-3x3-384-17-17-32-0x0-2x2-1x1-0-NCHW-FP16-F=miopenConvolutionFwdAlgoImplicitGEMM:ConvHipImplicitGemmV4R1Fwd,1.85915,0,miopenConvolutionFwdAlgoImplicitGEMM,<unused>;miopenConvolutionFwdAlgoDirect:ConvOclDirectFwdGen,11.9111,0,miopenConvolutionFwdAlgoDirect,<unused>;miopenConvolutionFwdAlgoGEMM:gemm,20.3328,1498176,rocBlas,<unused>;miopenConvolutionFwdAlgoWinograd:ConvBinWinogradRxSf2x3g1,3.10451,0,miopenConvolutionFwdAlgoWinograd,<unused>
96-35-35-3x3-96-17-17-32-0x0-2x2-1x1-0-NCHW-FP16-F=miopenConvolutionFwdAlgoImplicitGEMM:ConvHipImplicitGemmV4R1Fwd,0.203852,0,miopenConvolutionFwdAlgoImplicitGEMM,<unused>;miopenConvolutionFwdAlgoDirect:ConvOclDirectFwdGen,1.08487,0,miopenConvolutionFwdAlgoDirect,<unused>;miopenConvolutionFwdAlgoGEMM:gemm,8.68918,499392,rocBlas,<unused>;miopenConvolutionFwdAlgoWinograd:ConvBinWinogradRxSf2x3g1,0.344661,0,miopenConvolutionFwdAlgoWinograd,<unused>
768-17-17-1x1-256-17-17-32-0x0-1x1-1x1-0-NCHW-FP16-F=miopenConvolutionFwdAlgoImplicitGEMM:ConvHipImplicitGemmV4R1Fwd,0.765803,0,miopenConvolutionFwdAlgoImplicitGEMM,<unused>;miopenConvolutionFwdAlgoDirect:ConvAsm1x1U,0.53747,0,miopenConvolutionFwdAlgoDirect,<unused>;miopenConvolutionFwdAlgoGEMM:gemm,0.82261,0,rocBlas,<unused>;miopenConvolutionFwdAlgoWinograd:ConvBinWinogradRxSf2x3g1,1.28392,0,miopenConvolutionFwdAlgoWinograd,<unused>
768-17-17-1x1-192-17-17-32-0x0-1x1-1x1-0-NCHW-FP16-F=miopenConvolutionFwdAlgoImplicitGEMM:ConvHipImplicitGemmV4R1Fwd,0.577472,0,miopenConvolutionFwdAlgoImplicitGEMM,<unused>;miopenConvolutionFwdAlgoDirect:ConvAsm1x1U,0.457946,0,miopenConvolutionFwdAlgoDirect,<unused>;miopenConvolutionFwdAlgoGEMM:gemm,0.619395,0,rocBlas,<unused>;miopenConvolutionFwdAlgoWinograd:ConvBinWinogradRxSf2x3g1,1.06166,0,miopenConvolutionFwdAlgoWinograd,<unused>
128-17-17-1x7-128-17-17-32-0x3-1x1-1x1-0-NCHW-FP16-F=miopenConvolutionFwdAlgoImplicitGEMM:ConvHipImplicitGemmV4R1Fwd,0.231533,0,miopenConvolutionFwdAlgoImplicitGEMM,<unused>;miopenConvolutionFwdAlgoGEMM:gemm,8.70448,517888,rocBlas,<unused>;miopenConvolutionFwdAlgoWinograd:ConvBinWinogradRxSf2x3g1,0.494588,0,miopenConvolutionFwdAlgoWinograd,<unused>
128-17-17-7x1-192-17-17-32-3x0-1x1-1x1-0-NCHW-FP16-F=miopenConvolutionFwdAlgoImplicitGEMM:ConvHipImplicitGemmV4R1Fwd,0.343219,0,miopenConvolutionFwdAlgoImplicitGEMM,<unused>;miopenConvolutionFwdAlgoGEMM:gemm,8.55597,517888,rocBlas,<unused>;miopenConvolutionFwdAlgoWinograd:ConvBinWinogradRxSf2x3g1,0.595393,0,miopenConvolutionFwdAlgoWinograd,<unused>
128-17-17-7x1-128-17-17-32-3x0-1x1-1x1-0-NCHW-FP16-F=miopenConvolutionFwdAlgoImplicitGEMM:ConvHipImplicitGemmV4R1Fwd,0.259854,0,miopenConvolutionFwdAlgoImplicitGEMM,<unused>;miopenConvolutionFwdAlgoGEMM:gemm,8.84787,517888,rocBlas,<unused>;miopenConvolutionFwdAlgoWinograd:ConvBinWinogradRxSf2x3g1,0.405942,0,miopenConvolutionFwdAlgoWinograd,<unused>
128-17-17-1x7-192-17-17-32-0x3-1x1-1x1-0-NCHW-FP16-F=miopenConvolutionFwdAlgoImplicitGEMM:ConvHipImplicitGemmV4R1Fwd,0.333778,0,miopenConvolutionFwdAlgoImplicitGEMM,<unused>;miopenConvolutionFwdAlgoGEMM:gemm,8.50989,517888,rocBlas,<unused>;miopenConvolutionFwdAlgoWinograd:ConvBinWinogradRxSf2x3g1,0.727719,0,miopenConvolutionFwdAlgoWinograd,<unused>
768-17-17-1x1-320-17-17-32-0x0-1x1-1x1-0-NCHW-FP16-F=miopenConvolutionFwdAlgoImplicitGEMM:ConvHipImplicitGemmV4R1Fwd,0.941006,0,miopenConvolutionFwdAlgoImplicitGEMM,<unused>;miopenConvolutionFwdAlgoDirect:ConvAsm1x1U,0.60947,0,miopenConvolutionFwdAlgoDirect,<unused>;miopenConvolutionFwdAlgoGEMM:gemm,1.01573,0,rocBlas,<unused>;miopenConvolutionFwdAlgoWinograd:ConvBinWinogradRxSf2x3g1,1.62969,0,miopenConvolutionFwdAlgoWinograd,<unused>
160-17-17-1x7-160-17-17-32-0x3-1x1-1x1-0-NCHW-FP16-F=miopenConvolutionFwdAlgoImplicitGEMM:ConvHipImplicitGemmV4R1Fwd,0.362098,0,miopenConvolutionFwdAlgoImplicitGEMM,<unused>;miopenConvolutionFwdAlgoGEMM:gemm,9.75411,647360,rocBlas,<unused>;miopenConvolutionFwdAlgoWinograd:ConvBinWinogradRxSf2x3g1,0.697794,0,miopenConvolutionFwdAlgoWinograd,<unused>
160-17-17-7x1-192-17-17-32-3x0-1x1-1x1-0-NCHW-FP16-F=miopenConvolutionFwdAlgoImplicitGEMM:ConvHipImplicitGemmV4R1Fwd,0.42114,0,miopenConvolutionFwdAlgoImplicitGEMM,<unused>;miopenConvolutionFwdAlgoGEMM:gemm,10.092,647360,rocBlas,<unused>;miopenConvolutionFwdAlgoWinograd:ConvBinWinogradRxSf2x3g1,0.717635,0,miopenConvolutionFwdAlgoWinograd,<unused>
160-17-17-7x1-160-17-17-32-3x0-1x1-1x1-0-NCHW-FP16-F=miopenConvolutionFwdAlgoImplicitGEMM:ConvHipImplicitGemmV4R1Fwd,0.392019,0,miopenConvolutionFwdAlgoImplicitGEMM,<unused>;miopenConvolutionFwdAlgoGEMM:gemm,10.2405,647360,rocBlas,<unused>;miopenConvolutionFwdAlgoWinograd:ConvBinWinogradRxSf2x3g1,0.561148,0,miopenConvolutionFwdAlgoWinograd,<unused>
160-17-17-1x7-192-17-17-32-0x3-1x1-1x1-0-NCHW-FP16-F=miopenConvolutionFwdAlgoImplicitGEMM:ConvHipImplicitGemmV4R1Fwd,0.387698,0,miopenConvolutionFwdAlgoImplicitGEMM,<unused>;miopenConvolutionFwdAlgoGEMM:gemm,10.0561,647360,rocBlas,<unused>;miopenConvolutionFwdAlgoWinograd:ConvBinWinogradRxSf2x3g1,0.891083,0,miopenConvolutionFwdAlgoWinograd,<unused>
768-17-17-1x1-576-17-17-32-0x0-1x1-1x1-0-NCHW-FP16-F=miopenConvolutionFwdAlgoImplicitGEMM:ConvHipImplicitGemmV4R1Fwd,1.78088,0,miopenConvolutionFwdAlgoImplicitGEMM,<unused>;miopenConvolutionFwdAlgoDirect:ConvAsm1x1U,0.976043,0,miopenConvolutionFwdAlgoDirect,<unused>;miopenConvolutionFwdAlgoGEMM:gemm,1.76104,0,rocBlas,<unused>;miopenConvolutionFwdAlgoWinograd:ConvBinWinogradRxSf2x3g1,2.89982,0,miopenConvolutionFwdAlgoWinograd,<unused>
192-17-17-1x7-192-17-17-32-0x3-1x1-1x1-0-NCHW-FP16-F=miopenConvolutionFwdAlgoImplicitGEMM:ConvHipImplicitGemmV4R1Fwd,0.477941,0,miopenConvolutionFwdAlgoImplicitGEMM,<unused>;miopenConvolutionFwdAlgoGEMM:gemm,11.5973,776832,rocBlas,<unused>;miopenConvolutionFwdAlgoWinograd:ConvBinWinogradRxSf2x3g1,1.05701,0,miopenConvolutionFwdAlgoWinograd,<unused>
192-17-17-7x1-192-17-17-32-3x0-1x1-1x1-0-NCHW-FP16-F=miopenConvolutionFwdAlgoImplicitGEMM:ConvHipImplicitGemmV4R1Fwd,0.558584,0,miopenConvolutionFwdAlgoImplicitGEMM,<unused>;miopenConvolutionFwdAlgoGEMM:gemm,11.5308,776832,rocBlas,<unused>;miopenConvolutionFwdAlgoWinograd:ConvBinWinogradRxSf2x3g1,0.844357,0,miopenConvolutionFwdAlgoWinograd,<unused>
768-17-17-1x1-384-17-17-32-0x0-1x1-1x1-0-NCHW-FP16-F=miopenConvolutionFwdAlgoImplicitGEMM:ConvHipImplicitGemmV4R1Fwd,1.21317,0,miopenConvolutionFwdAlgoImplicitGEMM,<unused>;miopenConvolutionFwdAlgoDirect:ConvAsm1x1U,0.668347,0,miopenConvolutionFwdAlgoDirect,<unused>;miopenConvolutionFwdAlgoGEMM:gemm,1.16037,0,rocBlas,<unused>;miopenConvolutionFwdAlgoWinograd:ConvBinWinogradRxSf2x3g1,1.97833,0,miopenConvolutionFwdAlgoWinograd,<unused>
192-17-17-3x3-320-8-8-32-0x0-2x2-1x1-0-NCHW-FP16-F=miopenConvolutionFwdAlgoImplicitGEMM:ConvHipImplicitGemmV4R1Fwd,0.24673,0,miopenConvolutionFwdAlgoImplicitGEMM,<unused>;miopenConvolutionFwdAlgoDirect:ConvOclDirectFwdGen,1.81255,0,miopenConvolutionFwdAlgoDirect,<unused>;miopenConvolutionFwdAlgoGEMM:gemm,5.14067,221184,rocBlas,<unused>;miopenConvolutionFwdAlgoWinograd:ConvBinWinogradRxSf2x3g1,0.430258,0,miopenConvolutionFwdAlgoWinograd,<unused>
192-17-17-3x3-192-8-8-32-0x0-2x2-1x1-0-NCHW-FP16-F=miopenConvolutionFwdAlgoImplicitGEMM:ConvHipImplicitGemmV4R1Fwd,0.190408,0,miopenConvolutionFwdAlgoImplicitGEMM,<unused>;miopenConvolutionFwdAlgoDirect:ConvOclDirectFwdGen,1.64903,0,miopenConvolutionFwdAlgoDirect,<unused>;miopenConvolutionFwdAlgoGEMM:gemm,6.2825,221184,rocBlas,<unused>;miopenConvolutionFwdAlgoWinograd:ConvBinWinogradRxSf2x3g1,0.293932,0,miopenConvolutionFwdAlgoWinograd,<unused>
1280-8-8-1x1-320-8-8-32-0x0-1x1-1x1-0-NCHW-FP16-F=miopenConvolutionFwdAlgoImplicitGEMM:ConvHipImplicitGemmV4R1Fwd,0.201448,0,miopenConvolutionFwdAlgoImplicitGEMM,<unused>;miopenConvolutionFwdAlgoDirect:ConvAsm1x1U,0.208648,0,miopenConvolutionFwdAlgoDirect,<unused>;miopenConvolutionFwdAlgoGEMM:gemm,0.794112,0,rocBlas,<unused>;miopenConvolutionFwdAlgoWinograd:ConvBinWinogradRxSf2x3g1,0.631706,0,miopenConvolutionFwdAlgoWinograd,<unused>
1280-8-8-1x1-384-8-8-32-0x0-1x1-1x1-0-NCHW-FP16-F=miopenConvolutionFwdAlgoImplicitGEMM:ConvHipImplicitGemmV4R1Fwd,0.439057,0,miopenConvolutionFwdAlgoImplicitGEMM,<unused>;miopenConvolutionFwdAlgoDirect:ConvAsm1x1U,0.297932,0,miopenConvolutionFwdAlgoDirect,<unused>;miopenConvolutionFwdAlgoGEMM:gemm,0.941958,0,rocBlas,<unused>;miopenConvolutionFwdAlgoWinograd:ConvBinWinogradRxSf2x3g1,0.829313,0,miopenConvolutionFwdAlgoWinograd,<unused>
384-8-8-1x3-384-8-8-32-0x1-1x1-1x1-0-NCHW-FP16-F=miopenConvolutionFwdAlgoImplicitGEMM:ConvHipImplicitGemmV4R1Fwd,0.223048,0,miopenConvolutionFwdAlgoImplicitGEMM,<unused>;miopenConvolutionFwdAlgoGEMM:gemm,4.01424,147456,rocBlas,<unused>;miopenConvolutionFwdAlgoWinograd:ConvBinWinogradRxSf2x3g1,0.262891,0,miopenConvolutionFwdAlgoWinograd,<unused>
384-8-8-3x1-384-8-8-32-1x0-1x1-1x1-0-NCHW-FP16-F=miopenConvolutionFwdAlgoImplicitGEMM:ConvHipImplicitGemmV4R1Fwd,0.217609,0,miopenConvolutionFwdAlgoImplicitGEMM,<unused>;miopenConvolutionFwdAlgoGEMM:gemm,4.18835,147456,rocBlas,<unused>;miopenConvolutionFwdAlgoWinograd:ConvBinWinogradRxSf2x3g1,0.288011,0,miopenConvolutionFwdAlgoWinograd,<unused>
1280-8-8-1x1-448-8-8-32-0x0-1x1-1x1-0-NCHW-FP16-F=miopenConvolutionFwdAlgoImplicitGEMM:ConvHipImplicitGemmV4R1Fwd,0.290251,0,miopenConvolutionFwdAlgoImplicitGEMM,<unused>;miopenConvolutionFwdAlgoDirect:ConvAsm1x1U,0.299851,0,miopenConvolutionFwdAlgoDirect,<unused>;miopenConvolutionFwdAlgoGEMM:gemm,1.08692,0,rocBlas,<unused>;miopenConvolutionFwdAlgoWinograd:ConvBinWinogradRxSf2x3g1,0.833632,0,miopenConvolutionFwdAlgoWinograd,<unused>
448-8-8-3x3-384-8-8-32-1x1-1x1-1x1-0-NCHW-FP16-F=miopenConvolutionFwdAlgoImplicitGEMM:ConvHipImplicitGemmV4R1Fwd,0.668026,0,miopenConvolutionFwdAlgoImplicitGEMM,<unused>;miopenConvolutionFwdAlgoDirect:ConvOclDirectFwd,1.89191,0,miopenConvolutionFwdAlgoDirect,<unused>;miopenConvolutionFwdAlgoGEMM:gemm,9.30339,516096,rocBlas,<unused>;miopenConvolutionFwdAlgoWinograd:ConvBinWinogradRxSf2x3g1,0.302091,0,miopenConvolutionFwdAlgoWinograd,<unused>
1280-8-8-1x1-192-8-8-32-0x0-1x1-1x1-0-NCHW-FP16-F=miopenConvolutionFwdAlgoImplicitGEMM:ConvHipImplicitGemmV4R1Fwd,0.188007,0,miopenConvolutionFwdAlgoImplicitGEMM,<unused>;miopenConvolutionFwdAlgoDirect:ConvAsm1x1U,0.139206,0,miopenConvolutionFwdAlgoDirect,<unused>;miopenConvolutionFwdAlgoGEMM:gemm,0.51346,0,rocBlas,<unused>;miopenConvolutionFwdAlgoWinograd:ConvBinWinogradRxSf2x3g1,0.429617,0,miopenConvolutionFwdAlgoWinograd,<unused>
2048-8-8-1x1-320-8-8-32-0x0-1x1-1x1-0-NCHW-FP16-F=miopenConvolutionFwdAlgoImplicitGEMM:ConvHipImplicitGemmV4R1Fwd,0.384494,0,miopenConvolutionFwdAlgoImplicitGEMM,<unused>;miopenConvolutionFwdAlgoDirect:ConvAsm1x1U,0.379854,0,miopenConvolutionFwdAlgoDirect,<unused>;miopenConvolutionFwdAlgoGEMM:gemm,0.356654,0,rocBlas,<unused>;miopenConvolutionFwdAlgoWinograd:ConvBinWinogradRxSf2x3g1,0.994438,0,miopenConvolutionFwdAlgoWinograd,<unused>
2048-8-8-1x1-384-8-8-32-0x0-1x1-1x1-0-NCHW-FP16-F=miopenConvolutionFwdAlgoImplicitGEMM:ConvHipImplicitGemmV4R1Fwd,0.510739,0,miopenConvolutionFwdAlgoImplicitGEMM,<unused>;miopenConvolutionFwdAlgoDirect:ConvAsm1x1U,0.487539,0,miopenConvolutionFwdAlgoDirect,<unused>;miopenConvolutionFwdAlgoGEMM:gemm,0.467538,0,rocBlas,<unused>;miopenConvolutionFwdAlgoWinograd:ConvBinWinogradRxSf2x3g1,1.31397,0,miopenConvolutionFwdAlgoWinograd,<unused>
2048-8-8-1x1-448-8-8-32-0x0-1x1-1x1-0-NCHW-FP16-F=miopenConvolutionFwdAlgoImplicitGEMM:ConvHipImplicitGemmV4R1Fwd,0.510099,0,miopenConvolutionFwdAlgoImplicitGEMM,<unused>;miopenConvolutionFwdAlgoDirect:ConvAsm1x1U,0.473618,0,miopenConvolutionFwdAlgoDirect,<unused>;miopenConvolutionFwdAlgoGEMM:gemm,1.7079,0,rocBlas,<unused>;miopenConvolutionFwdAlgoWinograd:ConvBinWinogradRxSf2x3g1,1.31893,0,miopenConvolutionFwdAlgoWinograd,<unused>
2048-8-8-1x1-192-8-8-32-0x0-1x1-1x1-0-NCHW-FP16-F=miopenConvolutionFwdAlgoImplicitGEMM:ConvHipImplicitGemmV4R1Fwd,0.28609,0,miopenConvolutionFwdAlgoImplicitGEMM,<unused>;miopenConvolutionFwdAlgoDirect:ConvAsm1x1U,0.27105,0,miopenConvolutionFwdAlgoDirect,<unused>;miopenConvolutionFwdAlgoGEMM:gemm,0.209927,0,rocBlas,<unused>;miopenConvolutionFwdAlgoWinograd:ConvBinWinogradRxSf2x3g1,0.676665,0,miopenConvolutionFwdAlgoWinograd,<unused>
3-224-224-3x3-64-224-224-16-1x1-1x1-1x1-0-NCHW-FP32-F=miopenConvolutionFwdAlgoDirect:ConvOclDirectFwd,1.34545,0,miopenConvolutionFwdAlgoDirect,<unused>;miopenConvolutionFwdAlgoGEMM:gemm,1.20066,5419008,rocBlas,<unused>;miopenConvolutionFwdAlgoWinograd:ConvBinWinogradRxSf2x3g1,0.733127,0,miopenConvolutionFwdAlgoWinograd,<unused>
64-224-224-3x3-64-224-224-16-1x1-1x1-1x1-0-NCHW-FP32-F=miopenConvolutionFwdAlgoWinograd:ConvBinWinogradRxSf2x3g1,3.01059,0,miopenConvolutionFwdAlgoWinograd,<unused>
64-112-112-3x3-128-112-112-16-1x1-1x1-1x1-0-NCHW-FP32-F=miopenConvolutionFwdAlgoWinograd:ConvBinWinogradRxSf2x3g1,1.67842,0,miopenConvolutionFwdAlgoWinograd,<unused>
128-112-112-3x3-128-112-112-16-1x1-1x1-1x1-0-NCHW-FP32-F=miopenConvolutionFwdAlgoWinograd:ConvBinWinogradRxSf2x3g1,2.77363,0,miopenConvolutionFwdAlgoWinograd,<unused>
128-56-56-3x3-256-56-56-16-1x1-1x1-1x1-0-NCHW-FP32-F=miopenConvolutionFwdAlgoWinograd:ConvBinWinogradRxSf2x3g1,1.63266,0,miopenConvolutionFwdAlgoWinograd,<unused>
256-56-56-3x3-256-56-56-16-1x1-1x1-1x1-0-NCHW-FP32-F=miopenConvolutionFwdAlgoWinograd:ConvBinWinogradRxSf2x3g1,2.76355,0,miopenConvolutionFwdAlgoWinograd,<unused>
256-28-28-3x3-512-28-28-16-1x1-1x1-1x1-0-NCHW-FP32-F=miopenConvolutionFwdAlgoWinograd:ConvBinWinogradRxSf2x3g1,1.60562,0,miopenConvolutionFwdAlgoWinograd,<unused>
512-28-28-3x3-512-28-28-16-1x1-1x1-1x1-0-NCHW-FP32-F=miopenConvolutionFwdAlgoWinograd:ConvBinWinogradRxSf2x3g1,2.89203,0,miopenConvolutionFwdAlgoWinograd,<unused>
512-14-14-3x3-512-14-14-16-1x1-1x1-1x1-0-NCHW-FP32-F=miopenConvolutionFwdAlgoWinograd:ConvBinWinogradRxSf2x3g1,0.940649,0,miopenConvolutionFwdAlgoWinograd,<unused>
3-224-224-3x3-64-224-224-16-1x1-1x1-1x1-0-NCHW-FP16-F=miopenConvolutionFwdAlgoDirect:ConvOclDirectFwd,0.551845,0,miopenConvolutionFwdAlgoDirect,<unused>;miopenConvolutionFwdAlgoGEMM:gemm,1.47714,2709504,rocBlas,<unused>;miopenConvolutionFwdAlgoWinograd:ConvBinWinogradRxSf2x3g1,0.698407,0,miopenConvolutionFwdAlgoWinograd,<unused>
64-224-224-3x3-64-224-224-16-1x1-1x1-1x1-0-NCHW-FP16-F=miopenConvolutionFwdAlgoImplicitGEMM:ConvHipImplicitGemmV4R1Fwd,4.37012,0,miopenConvolutionFwdAlgoImplicitGEMM,<unused>;miopenConvolutionFwdAlgoDirect:ConvOclDirectFwd,7.82072,0,miopenConvolutionFwdAlgoDirect,<unused>;miopenConvolutionFwdAlgoGEMM:gemm,7.5188,57802752,rocBlas,<unused>;miopenConvolutionFwdAlgoWinograd:ConvBinWinogradRxSf2x3g1,2.36578,0,miopenConvolutionFwdAlgoWinograd,<unused>
64-112-112-3x3-128-112-112-16-1x1-1x1-1x1-0-NCHW-FP16-F=miopenConvolutionFwdAlgoImplicitGEMM:ConvHipImplicitGemmV4R1Fwd,2.12866,0,miopenConvolutionFwdAlgoImplicitGEMM,<unused>;miopenConvolutionFwdAlgoDirect:ConvOclDirectFwd,4.71925,0,miopenConvolutionFwdAlgoDirect,<unused>;miopenConvolutionFwdAlgoGEMM:gemm,3.69411,14450688,rocBlas,<unused>;miopenConvolutionFwdAlgoWinograd:ConvBinWinogradRxSf2x3g1,1.20737,0,miopenConvolutionFwdAlgoWinograd,<unused>
128-112-112-3x3-128-112-112-16-1x1-1x1-1x1-0-NCHW-FP16-F=miopenConvolutionFwdAlgoImplicitGEMM:ConvHipImplicitGemmV4R1Fwd,4.4074,0,miopenConvolutionFwdAlgoImplicitGEMM,<unused>;miopenConvolutionFwdAlgoDirect:ConvOclDirectFwd,9.39402,0,miopenConvolutionFwdAlgoDirect,<unused>;miopenConvolutionFwdAlgoGEMM:gemm,6.64838,28901376,rocBlas,<unused>;miopenConvolutionFwdAlgoWinograd:ConvBinWinogradRxSf2x3g1,2.11474,0,miopenConvolutionFwdAlgoWinograd,<unused>
128-56-56-3x3-256-56-56-16-1x1-1x1-1x1-0-NCHW-FP16-F=miopenConvolutionFwdAlgoImplicitGEMM:ConvHipImplicitGemmV4R1Fwd,2.37202,0,miopenConvolutionFwdAlgoImplicitGEMM,<unused>;miopenConvolutionFwdAlgoDirect:ConvOclDirectFwd,5.41013,0,miopenConvolutionFwdAlgoDirect,<unused>;miopenConvolutionFwdAlgoGEMM:gemm,3.31267,7225344,rocBlas,<unused>;miopenConvolutionFwdAlgoWinograd:ConvBinWinogradRxSf2x3g1,1.09409,0,miopenConvolutionFwdAlgoWinograd,<unused>
256-56-56-3x3-256-56-56-16-1x1-1x1-1x1-0-NCHW-FP16-F=miopenConvolutionFwdAlgoImplicitGEMM:ConvHipImplicitGemmV4R1Fwd,4.42084,0,miopenConvolutionFwdAlgoImplicitGEMM,<unused>;miopenConvolutionFwdAlgoDirect:ConvOclDirectFwd,10.7049,0,miopenConvolutionFwdAlgoDirect,<unused>;miopenConvolutionFwdAlgoGEMM:gemm,7.25766,14450688,rocBlas,<unused>;miopenConvolutionFwdAlgoWinograd:ConvBinWinogradRxSf2x3g1,2.03378,0,miopenConvolutionFwdAlgoWinograd,<unused>
256-28-28-3x3-512-28-28-16-1x1-1x1-1x1-0-NCHW-FP16-F=miopenConvolutionFwdAlgoImplicitGEMM:ConvHipImplicitGemmV4R1Fwd,2.2669,0,miopenConvolutionFwdAlgoImplicitGEMM,<unused>;miopenConvolutionFwdAlgoDirect:ConvOclDirectFwd,4.85365,0,miopenConvolutionFwdAlgoDirect,<unused>;miopenConvolutionFwdAlgoGEMM:gemm,5.17381,3612672,rocBlas,<unused>;miopenConvolutionFwdAlgoWinograd:ConvBinWinogradRxSf2x3g1,1.06977,0,miopenConvolutionFwdAlgoWinograd,<unused>
512-28-28-3x3-512-28-28-16-1x1-1x1-1x1-0-NCHW-FP16-F=miopenConvolutionFwdAlgoImplicitGEMM:ConvHipImplicitGemmV4R1Fwd,4.33252,0,miopenConvolutionFwdAlgoImplicitGEMM,<unused>;miopenConvolutionFwdAlgoDirect:ConvOclDirectFwd,9.54218,0,miopenConvolutionFwdAlgoDirect,<unused>;miopenConvolutionFwdAlgoGEMM:gemm,9.8049,7225344,rocBlas,<unused>;miopenConvolutionFwdAlgoWinograd:ConvBinWinogradRxSf2x3g1,2.04946,0,miopenConvolutionFwdAlgoWinograd,<unused>
512-14-14-3x3-512-14-14-16-1x1-1x1-1x1-0-NCHW-FP16-F=miopenConvolutionFwdAlgoImplicitGEMM:ConvHipImplicitGemmV4R1Fwd,1.29409,0,miopenConvolutionFwdAlgoImplicitGEMM,<unused>;miopenConvolutionFwdAlgoDirect:ConvOclDirectFwd,3.53315,0,miopenConvolutionFwdAlgoDirect,<unused>;miopenConvolutionFwdAlgoGEMM:gemm,7.61606,1806336,rocBlas,<unused>;miopenConvolutionFwdAlgoWinograd:ConvBinWinogradRxSf2x3g1,0.577286,0,miopenConvolutionFwdAlgoWinograd,<unused>
64-56-56-1x1-288-56-56-32-0x0-1x1-1x1-0-NCHW-FP32-F=miopenConvolutionFwdAlgoImplicitGEMM:ConvHipImplicitGemmV4R1Fwd,0.817927,0,miopenConvolutionFwdAlgoImplicitGEMM,<unused>;miopenConvolutionFwdAlgoDirect:ConvOclDirectFwd1x1,0.538245,0,miopenConvolutionFwdAlgoDirect,<unused>;miopenConvolutionFwdAlgoGEMM:gemm,0.489445,0,rocBlas,<unused>;miopenConvolutionFwdAlgoWinograd:ConvBinWinogradRxSf3x2,1.46017,0,miopenConvolutionFwdAlgoWinograd,<unused>
64-56-56-1x1-96-56-56-32-0x0-1x1-1x1-0-NCHW-FP32-F=miopenConvolutionFwdAlgoImplicitGEMM:ConvHipImplicitGemmV4R1Fwd,0.279363,0,miopenConvolutionFwdAlgoImplicitGEMM,<unused>;miopenConvolutionFwdAlgoDirect:ConvOclDirectFwd1x1,0.168801,0,miopenConvolutionFwdAlgoDirect,<unused>;miopenConvolutionFwdAlgoGEMM:gemm,0.227042,0,rocBlas,<unused>;miopenConvolutionFwdAlgoWinograd:ConvBinWinogradRxSf3x2,0.529764,0,miopenConvolutionFwdAlgoWinograd,<unused>
96-56-56-3x3-96-56-56-32-1x1-1x1-1x1-0-NCHW-FP32-F_g32=miopenConvolutionFwdAlgoDirect:ConvOclDirectFwd,0.248322,0,miopenConvolutionFwdAlgoDirect,<unused>;miopenConvolutionFwdAlgoGEMM:gemm,3.54816,10838016,rocBlas,<unused>;miopenConvolutionFwdAlgoWinograd:ConvBinWinogradRxSf2x3,1.64817,0,miopenConvolutionFwdAlgoWinograd,<unused>
96-56-56-1x1-272-56-56-32-0x0-1x1-1x1-0-NCHW-FP32-F=miopenConvolutionFwdAlgoImplicitGEMM:ConvHipImplicitGemmV4R1Fwd,1.83186,0,miopenConvolutionFwdAlgoImplicitGEMM,<unused>;miopenConvolutionFwdAlgoDirect:ConvAsm1x1U,0.780006,0,miopenConvolutionFwdAlgoDirect,<unused>;miopenConvolutionFwdAlgoGEMM:gemm,0.639365,0,rocBlas,<unused>;miopenConvolutionFwdAlgoWinograd:ConvBinWinogradRxSf3x2,2.0341,0,miopenConvolutionFwdAlgoWinograd,<unused>
304-56-56-1x1-96-56-56-32-0x0-1x1-1x1-0-NCHW-FP32-F=miopenConvolutionFwdAlgoImplicitGEMM:ConvHipImplicitGemmV4R1Fwd,1.04082,0,miopenConvolutionFwdAlgoImplicitGEMM,<unused>;miopenConvolutionFwdAlgoDirect:ConvOclDirectFwd1x1,0.684171,0,miopenConvolutionFwdAlgoDirect,<unused>;miopenConvolutionFwdAlgoGEMM:gemm,0.818567,0,rocBlas,<unused>;miopenConvolutionFwdAlgoWinograd:ConvBinWinogradRxSf3x2,2.03282,0,miopenConvolutionFwdAlgoWinograd,<unused>
320-56-56-1x1-96-56-56-32-0x0-1x1-1x1-0-NCHW-FP32-F=miopenConvolutionFwdAlgoImplicitGEMM:ConvHipImplicitGemmV4R1Fwd,1.13138,0,miopenConvolutionFwdAlgoImplicitGEMM,<unused>;miopenConvolutionFwdAlgoDirect:ConvOclDirectFwd1x1,0.625452,0,miopenConvolutionFwdAlgoDirect,<unused>;miopenConvolutionFwdAlgoGEMM:gemm,0.858414,0,rocBlas,<unused>;miopenConvolutionFwdAlgoWinograd:ConvBinWinogradRxSf3x2,2.14755,0,miopenConvolutionFwdAlgoWinograd,<unused>
336-56-56-1x1-576-28-28-32-0x0-2x2-1x1-0-NCHW-FP32-F=miopenConvolutionFwdAlgoImplicitGEMM:ConvHipImplicitGemmV4R1Fwd,1.41635,0,miopenConvolutionFwdAlgoImplicitGEMM,<unused>;miopenConvolutionFwdAlgoDirect:ConvAsm1x1U,1.46115,33718272,miopenConvolutionFwdAlgoDirect,<unused>;miopenConvolutionFwdAlgoGEMM:gemm,1.3061,91521024,rocBlas,<unused>;miopenConvolutionFwdAlgoWinograd:ConvBinWinogradRxSf2x3g1,9.20817,0,miopenConvolutionFwdAlgoWinograd,<unused>
336-56-56-1x1-192-56-56-32-0x0-1x1-1x1-0-NCHW-FP32-F=miopenConvolutionFwdAlgoImplicitGEMM:ConvHipImplicitGemmV4R1Fwd,1.42179,0,miopenConvolutionFwdAlgoImplicitGEMM,<unused>;miopenConvolutionFwdAlgoDirect:ConvOclDirectFwd1x1,1.44547,0,miopenConvolutionFwdAlgoDirect,<unused>;miopenConvolutionFwdAlgoGEMM:gemm,1.28594,0,rocBlas,<unused>;miopenConvolutionFwdAlgoWinograd:ConvBinWinogradRxSf3x2,4.28792,0,miopenConvolutionFwdAlgoWinograd,<unused>
192-56-56-3x3-192-28-28-32-1x1-2x2-1x1-0-NCHW-FP32-F_g32=miopenConvolutionFwdAlgoDirect:ConvOclDirectFwd,0.332326,0,miopenConvolutionFwdAlgoDirect,<unused>;miopenConvolutionFwdAlgoGEMM:gemm,2.31939,5419008,rocBlas,<unused>;miopenConvolutionFwdAlgoWinograd:ConvBinWinogradRxSf2x3,1.07346,0,miopenConvolutionFwdAlgoWinograd,<unused>
192-28-28-1x1-544-28-28-32-0x0-1x1-1x1-0-NCHW-FP32-F=miopenConvolutionFwdAlgoImplicitGEMM:ConvHipImplicitGemmV4R1Fwd,0.778252,0,miopenConvolutionFwdAlgoImplicitGEMM,<unused>;miopenConvolutionFwdAlgoDirect:ConvAsm1x1U,0.65585,0,miopenConvolutionFwdAlgoDirect,<unused>;miopenConvolutionFwdAlgoGEMM:gemm,0.615531,0,rocBlas,<unused>;miopenConvolutionFwdAlgoWinograd:ConvBinWinogradRxSf3x2,2.07844,0,miopenConvolutionFwdAlgoWinograd,<unused>
64-56-56-1x1-64-56-56-32-0x0-1x1-1x1-0-NCHW-FP32-F=miopenConvolutionFwdAlgoImplicitGEMM:ConvHipImplicitGemmV4R1Fwd,0.142401,0,miopenConvolutionFwdAlgoImplicitGEMM,<unused>;miopenConvolutionFwdAlgoDirect:ConvOclDirectFwd1x1,0.10944,0,miopenConvolutionFwdAlgoDirect,<unused>;miopenConvolutionFwdAlgoGEMM:gemm,0.121281,0,rocBlas,<unused>;miopenConvolutionFwdAlgoWinograd:ConvBinWinogradRxSf3x2,0.372962,0,miopenConvolutionFwdAlgoWinograd,<unused>
64-56-56-3x3-64-56-56-32-1x1-1x1-1x1-0-NCHW-FP32-F=miopenConvolutionFwdAlgoWinograd:ConvBinWinogradRxSf2x3g1,0.479843,0,miopenConvolutionFwdAlgoWinograd,<unused>
128-56-56-1x1-256-56-56-32-0x0-1x1-1x1-0-NCHW-FP32-F=miopenConvolutionFwdAlgoImplicitGEMM:ConvHipImplicitGemmV4R1Fwd,0.790406,0,miopenConvolutionFwdAlgoImplicitGEMM,<unused>;miopenConvolutionFwdAlgoDirect:ConvOclDirectFwd1x1,1.94849,0,miopenConvolutionFwdAlgoDirect,<unused>;miopenConvolutionFwdAlgoGEMM:gemm,0.694885,0,rocBlas,<unused>;miopenConvolutionFwdAlgoWinograd:ConvBinWinogradRxSf3x2,2.34898,0,miopenConvolutionFwdAlgoWinograd,<unused>
256-56-56-1x1-64-56-56-32-0x0-1x1-1x1-0-NCHW-FP32-F=miopenConvolutionFwdAlgoImplicitGEMM:ConvHipImplicitGemmV4R1Fwd,0.402083,0,miopenConvolutionFwdAlgoImplicitGEMM,<unused>;miopenConvolutionFwdAlgoDirect:ConvOclDirectFwd1x1,0.377602,0,miopenConvolutionFwdAlgoDirect,<unused>;miopenConvolutionFwdAlgoGEMM:gemm,0.376803,0,rocBlas,<unused>;miopenConvolutionFwdAlgoWinograd:ConvBinWinogradRxSf3x2,1.20241,0,miopenConvolutionFwdAlgoWinograd,<unused>
64-56-56-1x1-256-56-56-32-0x0-1x1-1x1-0-NCHW-FP32-F=miopenConvolutionFwdAlgoImplicitGEMM:ConvHipImplicitGemmV4R1Fwd,0.464803,0,miopenConvolutionFwdAlgoImplicitGEMM,<unused>;miopenConvolutionFwdAlgoDirect:ConvOclDirectFwd1x1,0.397443,0,miopenConvolutionFwdAlgoDirect,<unused>;miopenConvolutionFwdAlgoGEMM:gemm,0.377762,0,rocBlas,<unused>;miopenConvolutionFwdAlgoWinograd:ConvBinWinogradRxSf3x2,1.30529,0,miopenConvolutionFwdAlgoWinograd,<unused>
128-56-56-3x3-128-28-28-32-1x1-2x2-1x1-0-NCHW-FP32-F=miopenConvolutionFwdAlgoImplicitGEMM:ConvHipImplicitGemmV4R1Fwd,0.975847,0,miopenConvolutionFwdAlgoImplicitGEMM,<unused>;miopenConvolutionFwdAlgoDirect:ConvOclDirectFwd,3.95283,0,miopenConvolutionFwdAlgoDirect,<unused>;miopenConvolutionFwdAlgoGEMM:gemm,3.15907,3612672,rocBlas,<unused>;miopenConvolutionFwdAlgoWinograd:ConvBinWinogradRxSf2x3g1,1.82241,0,miopenConvolutionFwdAlgoWinograd,<unused>
384-28-28-1x1-512-28-28-32-0x0-1x1-1x1-0-NCHW-FP32-F=miopenConvolutionFwdAlgoImplicitGEMM:ConvHipImplicitGemmV4R1Fwd,1.19184,0,miopenConvolutionFwdAlgoImplicitGEMM,<unused>;miopenConvolutionFwdAlgoDirect:ConvOclDirectFwd1x1,1.28112,0,miopenConvolutionFwdAlgoDirect,<unused>;miopenConvolutionFwdAlgoGEMM:gemm,1.28961,0,rocBlas,<unused>;miopenConvolutionFwdAlgoWinograd:ConvBinWinogradRxSf3x2,3.72611,0,miopenConvolutionFwdAlgoWinograd,<unused>
512-28-28-1x1-128-28-28-32-0x0-1x1-1x1-0-NCHW-FP32-F=miopenConvolutionFwdAlgoImplicitGEMM:ConvHipImplicitGemmV4R1Fwd,0.411519,0,miopenConvolutionFwdAlgoImplicitGEMM,<unused>;miopenConvolutionFwdAlgoDirect:ConvOclDirectFwd1x1,0.43808,0,miopenConvolutionFwdAlgoDirect,<unused>;miopenConvolutionFwdAlgoGEMM:gemm,0.3968,0,rocBlas,<unused>;miopenConvolutionFwdAlgoWinograd:ConvBinWinogradRxSf3x2,1.292,0,miopenConvolutionFwdAlgoWinograd,<unused>
128-28-28-3x3-128-28-28-32-1x1-1x1-1x1-0-NCHW-FP32-F=miopenConvolutionFwdAlgoWinograd:ConvBinWinogradRxSf2x3g1,0.466078,0,miopenConvolutionFwdAlgoWinograd,<unused>
128-28-28-1x1-512-28-28-32-0x0-1x1-1x1-0-NCHW-FP32-F=miopenConvolutionFwdAlgoImplicitGEMM:ConvHipImplicitGemmV4R1Fwd,0.394557,0,miopenConvolutionFwdAlgoImplicitGEMM,<unused>;miopenConvolutionFwdAlgoDirect:ConvOclDirectFwd1x1,0.473439,0,miopenConvolutionFwdAlgoDirect,<unused>;miopenConvolutionFwdAlgoGEMM:gemm,0.377439,0,rocBlas,<unused>;miopenConvolutionFwdAlgoWinograd:ConvBinWinogradRxSf3x2,1.34288,0,miopenConvolutionFwdAlgoWinograd,<unused>
256-28-28-3x3-256-14-14-32-1x1-2x2-1x1-0-NCHW-FP32-F=miopenConvolutionFwdAlgoImplicitGEMM:ConvHipImplicitGemmV4R1Fwd,1.00287,0,miopenConvolutionFwdAlgoImplicitGEMM,<unused>;miopenConvolutionFwdAlgoDirect:ConvOclDirectFwd,3.89837,0,miopenConvolutionFwdAlgoDirect,<unused>;miopenConvolutionFwdAlgoGEMM:gemm,3.67101,1806336,rocBlas,<unused>;miopenConvolutionFwdAlgoWinograd:ConvBinWinogradRxSf2x3g1,1.79967,0,miopenConvolutionFwdAlgoWinograd,<unused>
768-14-14-1x1-1024-14-14-32-0x0-1x1-1x1-0-NCHW-FP32-F=miopenConvolutionFwdAlgoImplicitGEMM:ConvHipImplicitGemmV4R1Fwd,1.18511,0,miopenConvolutionFwdAlgoImplicitGEMM,<unused>;miopenConvolutionFwdAlgoDirect:ConvAsm1x1U,1.61886,0,miopenConvolutionFwdAlgoDirect,<unused>;miopenConvolutionFwdAlgoGEMM:gemm,1.58126,0,rocBlas,<unused>;miopenConvolutionFwdAlgoWinograd:ConvBinWinogradRxSf3x2,3.83292,0,miopenConvolutionFwdAlgoWinograd,<unused>
1024-14-14-1x1-256-14-14-32-0x0-1x1-1x1-0-NCHW-FP32-F=miopenConvolutionFwdAlgoImplicitGEMM:ConvHipImplicitGemmV4R1Fwd,0.475033,0,miopenConvolutionFwdAlgoImplicitGEMM,<unused>;miopenConvolutionFwdAlgoDirect:ConvOclDirectFwd1x1,0.656632,0,miopenConvolutionFwdAlgoDirect,<unused>;miopenConvolutionFwdAlgoGEMM:gemm,0.550393,0,rocBlas,<unused>;miopenConvolutionFwdAlgoWinograd:ConvBinWinogradRxSf3x2,1.47054,0,miopenConvolutionFwdAlgoWinograd,<unused>
256-14-14-3x3-256-14-14-32-1x1-1x1-1x1-0-NCHW-FP32-F=miopenConvolutionFwdAlgoWinograd:ConvBinWinogradRxSf2x3g1,0.490072,0,miopenConvolutionFwdAlgoWinograd,<unused>
256-14-14-1x1-1024-14-14-32-0x0-1x1-1x1-0-NCHW-FP32-F=miopenConvolutionFwdAlgoImplicitGEMM:ConvHipImplicitGemmV4R1Fwd,0.401592,0,miopenConvolutionFwdAlgoImplicitGEMM,<unused>;miopenConvolutionFwdAlgoDirect:ConvAsm1x1U,0.513592,0,miopenConvolutionFwdAlgoDirect,<unused>;miopenConvolutionFwdAlgoGEMM:gemm,0.473273,0,rocBlas,<unused>;miopenConvolutionFwdAlgoWinograd:ConvBinWinogradRxSf3x2,1.33694,0,miopenConvolutionFwdAlgoWinograd,<unused>
512-14-14-3x3-512-7-7-32-1x1-2x2-1x1-0-NCHW-FP32-F=miopenConvolutionFwdAlgoImplicitGEMM:ConvHipImplicitGemmV4R1Fwd,1.74572,0,miopenConvolutionFwdAlgoImplicitGEMM,<unused>;miopenConvolutionFwdAlgoDirect:ConvOclDirectFwd,4.70087,0,miopenConvolutionFwdAlgoDirect,<unused>;miopenConvolutionFwdAlgoGEMM:gemm,15.0013,903168,rocBlas,<unused>;miopenConvolutionFwdAlgoWinograd:ConvBinWinogradRxSf2x3g1,2.56939,0,miopenConvolutionFwdAlgoWinograd,<unused>
1536-7-7-1x1-2048-7-7-32-0x0-1x1-1x1-0-NCHW-FP32-F=miopenConvolutionFwdAlgoImplicitGEMM:ConvHipImplicitGemmV4R1Fwd,1.77051,0,miopenConvolutionFwdAlgoImplicitGEMM,<unused>;miopenConvolutionFwdAlgoDirect:ConvAsm1x1U,1.85996,0,miopenConvolutionFwdAlgoDirect,<unused>;miopenConvolutionFwdAlgoGEMM:gemm,2.05963,0,rocBlas,<unused>;miopenConvolutionFwdAlgoWinograd:ConvBinWinogradRxSf3x2,5.41844,0,miopenConvolutionFwdAlgoWinograd,<unused>
2048-7-7-1x1-512-7-7-32-0x0-1x1-1x1-0-NCHW-FP32-F=miopenConvolutionFwdAlgoImplicitGEMM:ConvHipImplicitGemmV4R1Fwd,1.05629,0,miopenConvolutionFwdAlgoImplicitGEMM,<unused>;miopenConvolutionFwdAlgoDirect:ConvOclDirectFwd1x1,0.815659,0,miopenConvolutionFwdAlgoDirect,<unused>;miopenConvolutionFwdAlgoGEMM:gemm,1.16557,0,rocBlas,<unused>;miopenConvolutionFwdAlgoWinograd:ConvBinWinogradRxSf3x2,2.18202,0,miopenConvolutionFwdAlgoWinograd,<unused>
512-7-7-3x3-512-7-7-32-1x1-1x1-1x1-0-NCHW-FP32-F=miopenConvolutionFwdAlgoWinograd:ConvBinWinogradRxSf2x3g1,0.6835,0,miopenConvolutionFwdAlgoWinograd,<unused>
512-7-7-1x1-2048-7-7-32-0x0-1x1-1x1-0-NCHW-FP32-F=miopenConvolutionFwdAlgoImplicitGEMM:ConvHipImplicitGemmV4R1Fwd,0.6459,0,miopenConvolutionFwdAlgoImplicitGEMM,<unused>;miopenConvolutionFwdAlgoDirect:ConvAsm1x1U,0.628782,0,miopenConvolutionFwdAlgoDirect,<unused>;miopenConvolutionFwdAlgoGEMM:gemm,0.72254,0,rocBlas,<unused>;miopenConvolutionFwdAlgoWinograd:ConvBinWinogradRxSf3x2,1.85739,0,miopenConvolutionFwdAlgoWinograd,<unused>
3-299-299-3x3-32-149-149-16-0x0-2x2-1x1-0-NCHW-FP32-F=miopenConvolutionFwdAlgoDirect:ConvOclDirectFwdGen,0.445909,0,miopenConvolutionFwdAlgoDirect,<unused>;miopenConvolutionFwdAlgoGEMM:gemm,1.01885,2397708,rocBlas,<unused>;miopenConvolutionFwdAlgoWinograd:ConvBinWinogradRxSf2x3g1,0.327032,0,miopenConvolutionFwdAlgoWinograd,<unused>
32-149-149-3x3-32-147-147-16-0x0-1x1-1x1-0-NCHW-FP32-F=miopenConvolutionFwdAlgoDirect:ConvOclDirectFwd,1.49452,0,miopenConvolutionFwdAlgoDirect,<unused>;miopenConvolutionFwdAlgoGEMM:gemm,2.50618,24893568,rocBlas,<unused>;miopenConvolutionFwdAlgoWinograd:ConvBinWinogradRxSf2x3g1,0.479668,0,miopenConvolutionFwdAlgoWinograd,<unused>
32-147-147-3x3-64-147-147-16-1x1-1x1-1x1-0-NCHW-FP32-F=miopenConvolutionFwdAlgoWinograd:ConvBinWinogradRxSf2x3g1,0.915658,0,miopenConvolutionFwdAlgoWinograd,<unused>
64-147-147-3x3-96-73-73-16-0x0-2x2-1x1-0-NCHW-FP32-F=miopenConvolutionFwdAlgoDirect:ConvOclDirectFwd,5.5909,0,miopenConvolutionFwdAlgoDirect,<unused>;miopenConvolutionFwdAlgoGEMM:gemm,2.61114,12278016,rocBlas,<unused>;miopenConvolutionFwdAlgoWinograd:ConvBinWinogradRxSf2x3g1,2.33226,0,miopenConvolutionFwdAlgoWinograd,<unused>
160-73-73-1x1-128-73-73-16-0x0-1x1-1x1-0-NCHW-FP32-F=miopenConvolutionFwdAlgoDirect:ConvOclDirectFwd1x1,0.436631,0,miopenConvolutionFwdAlgoDirect,<unused>;miopenConvolutionFwdAlgoGEMM:gemm,0.365911,0,rocBlas,<unused>;miopenConvolutionFwdAlgoWinograd:ConvBinWinogradRxSf3x2,1.23117,0,miopenConvolutionFwdAlgoWinograd,<unused>
64-73-73-3x3-96-71-71-16-0x0-1x1-1x1-0-NCHW-FP32-F=miopenConvolutionFwdAlgoDirect:ConvOclDirectFwd,2.49291,0,miopenConvolutionFwdAlgoDirect,<unused>;miopenConvolutionFwdAlgoGEMM:gemm,2.47034,11614464,rocBlas,<unused>;miopenConvolutionFwdAlgoWinograd:ConvBinWinogradRxSf2x3g1,0.580467,0,miopenConvolutionFwdAlgoWinograd,<unused>
64-73-73-1x7-64-73-73-16-0x3-1x1-1x1-0-NCHW-FP32-F=miopenConvolutionFwdAlgoWinograd:ConvBinWinogradRxSf3x2,1.01678,0,miopenConvolutionFwdAlgoWinograd,<unused>;miopenConvolutionFwdAlgoGEMM:gemm,1.68443,9549568,rocBlas,<unused>
64-73-73-7x1-64-73-73-16-3x0-1x1-1x1-0-NCHW-FP32-F=miopenConvolutionFwdAlgoWinograd:ConvBinWinogradRxSf3x2,1.03406,0,miopenConvolutionFwdAlgoWinograd,<unused>;miopenConvolutionFwdAlgoGEMM:gemm,1.69213,9549568,rocBlas,<unused>
192-71-71-3x3-192-35-35-16-0x0-2x2-1x1-0-NCHW-FP32-F=miopenConvolutionFwdAlgoDirect:ConvOclDirectFwd,10.5201,0,miopenConvolutionFwdAlgoDirect,<unused>;miopenConvolutionFwdAlgoGEMM:gemm,2.59835,8467200,rocBlas,<unused>;miopenConvolutionFwdAlgoWinograd:ConvBinWinogradRxSf2x3g1,3.30745,0,miopenConvolutionFwdAlgoWinograd,<unused>
384-35-35-1x1-128-35-35-16-0x0-1x1-1x1-0-NCHW-FP32-F=miopenConvolutionFwdAlgoDirect:ConvAsm1x1U,0.265283,0,miopenConvolutionFwdAlgoDirect,<unused>;miopenConvolutionFwdAlgoGEMM:gemm,0.257594,0,rocBlas,<unused>;miopenConvolutionFwdAlgoWinograd:ConvBinWinogradRxSf3x2,0.702225,0,miopenConvolutionFwdAlgoWinograd,<unused>
384-35-35-1x1-96-35-35-16-0x0-1x1-1x1-0-NCHW-FP32-F=miopenConvolutionFwdAlgoDirect:ConvAsm1x1U,0.225923,0,miopenConvolutionFwdAlgoDirect,<unused>;miopenConvolutionFwdAlgoGEMM:gemm,0.189922,0,rocBlas,<unused>;miopenConvolutionFwdAlgoWinograd:ConvBinWinogradRxSf3x2,0.566566,0,miopenConvolutionFwdAlgoWinograd,<unused>
64-35-35-3x3-96-35-35-16-1x1-1x1-1x1-0-NCHW-FP32-F=miopenConvolutionFwdAlgoWinograd:ConvBinWinogradRxSf2x3g1,0.178563,0,miopenConvolutionFwdAlgoWinograd,<unused>
96-35-35-3x3-96-35-35-16-1x1-1x1-1x1-0-NCHW-FP32-F=miopenConvolutionFwdAlgoWinograd:ConvBinWinogradRxSf2x3g1,0.276004,0,miopenConvolutionFwdAlgoWinograd,<unused>
384-35-35-3x3-384-17-17-16-0x0-2x2-1x1-0-NCHW-FP32-F=miopenConvolutionFwdAlgoDirect:ConvOclDirectFwd,40.2594,0,miopenConvolutionFwdAlgoDirect,<unused>;miopenConvolutionFwdAlgoGEMM:gemm,2.65731,3995136,rocBlas,<unused>;miopenConvolutionFwdAlgoWinograd:ConvBinWinogradRxSf2x3g1,3.4722,0,miopenConvolutionFwdAlgoWinograd,<unused>
384-35-35-1x1-192-35-35-16-0x0-1x1-1x1-0-NCHW-FP32-F=miopenConvolutionFwdAlgoDirect:ConvAsm1x1U,0.450086,0,miopenConvolutionFwdAlgoDirect,<unused>;miopenConvolutionFwdAlgoGEMM:gemm,0.336485,0,rocBlas,<unused>;miopenConvolutionFwdAlgoWinograd:ConvBinWinogradRxSf3x2,1.10817,0,miopenConvolutionFwdAlgoWinograd,<unused>
192-35-35-3x3-224-35-35-16-1x1-1x1-1x1-0-NCHW-FP32-F=miopenConvolutionFwdAlgoWinograd:ConvBinWinogradRxSf2x3g1,0.906731,0,miopenConvolutionFwdAlgoWinograd,<unused>
224-35-35-3x3-256-17-17-16-0x0-2x2-1x1-0-NCHW-FP32-F=miopenConvolutionFwdAlgoDirect:ConvOclDirectFwd,16.7564,0,miopenConvolutionFwdAlgoDirect,<unused>;miopenConvolutionFwdAlgoGEMM:gemm,1.83042,2330496,rocBlas,<unused>;miopenConvolutionFwdAlgoWinograd:ConvBinWinogradRxSf2x3g1,1.37826,0,miopenConvolutionFwdAlgoWinograd,<unused>
1024-17-17-1x1-768-17-17-16-0x0-1x1-1x1-0-NCHW-FP32-F=miopenConvolutionFwdAlgoDirect:ConvAsm1x1U,1.26595,0,miopenConvolutionFwdAlgoDirect,<unused>;miopenConvolutionFwdAlgoGEMM:gemm,0.903051,0,rocBlas,<unused>;miopenConvolutionFwdAlgoWinograd:ConvBinWinogradRxSf3x2,2.91747,0,miopenConvolutionFwdAlgoWinograd,<unused>
192-17-17-1x7-224-17-17-16-0x3-1x1-1x1-0-NCHW-FP32-F=miopenConvolutionFwdAlgoWinograd:ConvBinWinogradRxSf3x2,0.839542,0,miopenConvolutionFwdAlgoWinograd,<unused>;miopenConvolutionFwdAlgoGEMM:gemm,1.30819,1553664,rocBlas,<unused>
224-17-17-7x1-256-17-17-16-3x0-1x1-1x1-0-NCHW-FP32-F=miopenConvolutionFwdAlgoWinograd:ConvBinWinogradRxSf3x2,0.965146,0,miopenConvolutionFwdAlgoWinograd,<unused>;miopenConvolutionFwdAlgoGEMM:gemm,1.41571,1812608,rocBlas,<unused>
192-17-17-7x1-192-17-17-16-3x0-1x1-1x1-0-NCHW-FP32-F=miopenConvolutionFwdAlgoWinograd:ConvBinWinogradRxSf3x2,0.573136,0,miopenConvolutionFwdAlgoWinograd,<unused>;miopenConvolutionFwdAlgoGEMM:gemm,1.20834,1553664,rocBlas,<unused>
224-17-17-7x1-224-17-17-16-3x0-1x1-1x1-0-NCHW-FP32-F=miopenConvolutionFwdAlgoWinograd:ConvBinWinogradRxSf2x3g1,0.851543,0,miopenConvolutionFwdAlgoWinograd,<unused>;miopenConvolutionFwdAlgoGEMM:gemm,1.45411,1812608,rocBlas,<unused>
224-17-17-1x7-256-17-17-16-0x3-1x1-1x1-0-NCHW-FP32-F=miopenConvolutionFwdAlgoWinograd:ConvBinWinogradRxSf3x2,0.957946,0,miopenConvolutionFwdAlgoWinograd,<unused>;miopenConvolutionFwdAlgoGEMM:gemm,1.40547,1812608,rocBlas,<unused>
1024-17-17-1x1-128-17-17-16-0x0-1x1-1x1-0-NCHW-FP32-F=miopenConvolutionFwdAlgoDirect:ConvOclDirectFwd1x1,0.262727,0,miopenConvolutionFwdAlgoDirect,<unused>;miopenConvolutionFwdAlgoGEMM:gemm,0.212806,0,rocBlas,<unused>;miopenConvolutionFwdAlgoWinograd:ConvBinWinogradRxSf2x3g1,0.74962,0,miopenConvolutionFwdAlgoWinograd,<unused>
1024-17-17-1x1-192-17-17-16-0x0-1x1-1x1-0-NCHW-FP32-F=miopenConvolutionFwdAlgoDirect:ConvOclDirectFwd1x1,0.392331,0,miopenConvolutionFwdAlgoDirect,<unused>;miopenConvolutionFwdAlgoGEMM:gemm,0.263207,0,rocBlas,<unused>;miopenConvolutionFwdAlgoWinograd:ConvBinWinogradRxSf3x2,0.74898,0,miopenConvolutionFwdAlgoWinograd,<unused>
192-17-17-3x3-192-8-8-16-0x0-2x2-1x1-0-NCHW-FP32-F=miopenConvolutionFwdAlgoImplicitGEMM:ConvHipImplicitGemmV4R1Fwd,0.229286,0,miopenConvolutionFwdAlgoImplicitGEMM,<unused>;miopenConvolutionFwdAlgoDirect:ConvOclDirectFwd,0.683058,0,miopenConvolutionFwdAlgoDirect,<unused>;miopenConvolutionFwdAlgoGEMM:gemm,2.26822,442368,rocBlas,<unused>;miopenConvolutionFwdAlgoWinograd:ConvBinWinogradRxSf2x3g1,0.217446,0,miopenConvolutionFwdAlgoWinograd,<unused>
1024-17-17-1x1-256-17-17-16-0x0-1x1-1x1-0-NCHW-FP32-F=miopenConvolutionFwdAlgoDirect:ConvAsm1x1U,0.586416,0,miopenConvolutionFwdAlgoDirect,<unused>;miopenConvolutionFwdAlgoGEMM:gemm,0.549135,0,rocBlas,<unused>;miopenConvolutionFwdAlgoWinograd:ConvBinWinogradRxSf3x2,1.11235,0,miopenConvolutionFwdAlgoWinograd,<unused>
256-17-17-1x7-256-17-17-16-0x3-1x1-1x1-0-NCHW-FP32-F=miopenConvolutionFwdAlgoWinograd:ConvBinWinogradRxSf3x2,1.10483,0,miopenConvolutionFwdAlgoWinograd,<unused>;miopenConvolutionFwdAlgoGEMM:gemm,1.55651,2071552,rocBlas,<unused>
256-17-17-7x1-320-17-17-16-3x0-1x1-1x1-0-NCHW-FP32-F=miopenConvolutionFwdAlgoWinograd:ConvBinWinogradRxSf3x2,1.09667,0,miopenConvolutionFwdAlgoWinograd,<unused>;miopenConvolutionFwdAlgoGEMM:gemm,1.56163,2071552,rocBlas,<unused>
320-17-17-3x3-320-8-8-16-0x0-2x2-1x1-0-NCHW-FP32-F=miopenConvolutionFwdAlgoImplicitGEMM:ConvHipImplicitGemmV4R1Fwd,0.437132,0,miopenConvolutionFwdAlgoImplicitGEMM,<unused>;miopenConvolutionFwdAlgoDirect:ConvOclDirectFwd,1.28275,0,miopenConvolutionFwdAlgoDirect,<unused>;miopenConvolutionFwdAlgoGEMM:gemm,1.42339,737280,rocBlas,<unused>;miopenConvolutionFwdAlgoWinograd:ConvBinWinogradRxSf2x3g1,0.660177,0,miopenConvolutionFwdAlgoWinograd,<unused>
1536-8-8-1x1-768-8-8-16-0x0-1x1-1x1-0-NCHW-FP32-F=miopenConvolutionFwdAlgoImplicitGEMM:ConvHipImplicitGemmV4R1Fwd,0.39745,0,miopenConvolutionFwdAlgoImplicitGEMM,<unused>;miopenConvolutionFwdAlgoDirect:ConvAsm1x1U,0.474572,0,miopenConvolutionFwdAlgoDirect,<unused>;miopenConvolutionFwdAlgoGEMM:gemm,0.527854,0,rocBlas,<unused>;miopenConvolutionFwdAlgoWinograd:ConvBinWinogradRxSf3x2,1.10707,0,miopenConvolutionFwdAlgoWinograd,<unused>
1536-8-8-1x1-256-8-8-16-0x0-1x1-1x1-0-NCHW-FP32-F=miopenConvolutionFwdAlgoImplicitGEMM:ConvHipImplicitGemmV4R1Fwd,0.282088,0,miopenConvolutionFwdAlgoImplicitGEMM,<unused>;miopenConvolutionFwdAlgoDirect:ConvOclDirectFwd1x1,0.211365,0,miopenConvolutionFwdAlgoDirect,<unused>;miopenConvolutionFwdAlgoGEMM:gemm,0.232966,0,rocBlas,<unused>;miopenConvolutionFwdAlgoWinograd:ConvBinWinogradRxSf3x2,0.566414,0,miopenConvolutionFwdAlgoWinograd,<unused>
384-8-8-1x3-256-8-8-16-0x1-1x1-1x1-0-NCHW-FP32-F=miopenConvolutionFwdAlgoImplicitGEMM:ConvHipImplicitGemmV4R1Fwd,0.174405,0,miopenConvolutionFwdAlgoImplicitGEMM,<unused>;miopenConvolutionFwdAlgoGEMM:gemm,1.13155,294912,rocBlas,<unused>;miopenConvolutionFwdAlgoWinograd:ConvBinWinogradRxSf2x3g1,0.210725,0,miopenConvolutionFwdAlgoWinograd,<unused>
384-8-8-3x1-256-8-8-16-1x0-1x1-1x1-0-NCHW-FP32-F=miopenConvolutionFwdAlgoImplicitGEMM:ConvHipImplicitGemmV4R1Fwd,0.176964,0,miopenConvolutionFwdAlgoImplicitGEMM,<unused>;miopenConvolutionFwdAlgoGEMM:gemm,1.32357,294912,rocBlas,<unused>;miopenConvolutionFwdAlgoWinograd:ConvBinWinogradRxSf2x3g1,0.212645,0,miopenConvolutionFwdAlgoWinograd,<unused>
384-8-8-3x1-448-8-8-16-1x0-1x1-1x1-0-NCHW-FP32-F=miopenConvolutionFwdAlgoImplicitGEMM:ConvHipImplicitGemmV4R1Fwd,0.181925,0,miopenConvolutionFwdAlgoImplicitGEMM,<unused>;miopenConvolutionFwdAlgoGEMM:gemm,1.2621,294912,rocBlas,<unused>;miopenConvolutionFwdAlgoWinograd:ConvBinWinogradRxSf2x3g1,0.216166,0,miopenConvolutionFwdAlgoWinograd,<unused>
448-8-8-1x3-512-8-8-16-0x1-1x1-1x1-0-NCHW-FP32-F=miopenConvolutionFwdAlgoImplicitGEMM:ConvHipImplicitGemmV4R1Fwd,0.258887,0,miopenConvolutionFwdAlgoImplicitGEMM,<unused>;miopenConvolutionFwdAlgoGEMM:gemm,1.32611,344064,rocBlas,<unused>;miopenConvolutionFwdAlgoWinograd:ConvBinWinogradRxSf2x3g1,0.355369,0,miopenConvolutionFwdAlgoWinograd,<unused>
512-8-8-1x3-256-8-8-16-0x1-1x1-1x1-0-NCHW-FP32-F=miopenConvolutionFwdAlgoImplicitGEMM:ConvHipImplicitGemmV4R1Fwd,0.229605,0,miopenConvolutionFwdAlgoImplicitGEMM,<unused>;miopenConvolutionFwdAlgoGEMM:gemm,1.42339,393216,rocBlas,<unused>;miopenConvolutionFwdAlgoWinograd:ConvBinWinogradRxSf2x3g1,0.278087,0,miopenConvolutionFwdAlgoWinograd,<unused>
512-8-8-3x1-256-8-8-16-1x0-1x1-1x1-0-NCHW-FP32-F=miopenConvolutionFwdAlgoImplicitGEMM:ConvHipImplicitGemmV4R1Fwd,0.236966,0,miopenConvolutionFwdAlgoImplicitGEMM,<unused>;miopenConvolutionFwdAlgoGEMM:gemm,1.47971,393216,rocBlas,<unused>;miopenConvolutionFwdAlgoWinograd:ConvBinWinogradRxSf2x3g1,0.277607,0,miopenConvolutionFwdAlgoWinograd,<unused>
3-224-224-7x7-64-112-112-16-3x3-2x2-1x1-0-NCHW-FP32-F=miopenConvolutionFwdAlgoDirect:ConvAsm7x7c3h224w224k64u2v2p3q3f1,0.456965,0,miopenConvolutionFwdAlgoDirect,<unused>;miopenConvolutionFwdAlgoGEMM:gemm,1.21858,7375872,rocBlas,<unused>;miopenConvolutionFwdAlgoWinograd:ConvBinWinogradRxSf2x3g1,0.771049,0,miopenConvolutionFwdAlgoWinograd,<unused>
64-56-56-1x1-512-56-56-16-0x0-1x1-1x1-0-NCHW-FP32-F=miopenConvolutionFwdAlgoImplicitGEMM:ConvHipImplicitGemmV4R1Fwd,0.472486,0,miopenConvolutionFwdAlgoImplicitGEMM,<unused>;miopenConvolutionFwdAlgoDirect:ConvAsm1x1U,0.499846,0,miopenConvolutionFwdAlgoDirect,<unused>;miopenConvolutionFwdAlgoGEMM:gemm,0.549286,0,rocBlas,<unused>;miopenConvolutionFwdAlgoWinograd:ConvBinWinogradRxSf3x2,1.30866,0,miopenConvolutionFwdAlgoWinograd,<unused>
256-56-56-3x3-256-56-56-16-1x1-1x1-1x1-0-NCHW-FP32-F_g64=miopenConvolutionFwdAlgoDirect:ConvAsm3x3U,0.160482,0,miopenConvolutionFwdAlgoDirect,<unused>;miopenConvolutionFwdAlgoGEMM:gemm,3.39459,28901376,rocBlas,<unused>;miopenConvolutionFwdAlgoWinograd:ConvBinWinogradRxSf2x3,1.69634,0,miopenConvolutionFwdAlgoWinograd,<unused>
256-56-56-1x1-256-56-56-16-0x0-1x1-1x1-0-NCHW-FP32-F=miopenConvolutionFwdAlgoImplicitGEMM:ConvHipImplicitGemmV4R1Fwd,0.757449,0,miopenConvolutionFwdAlgoImplicitGEMM,<unused>;miopenConvolutionFwdAlgoDirect:ConvAsm1x1U,0.982252,0,miopenConvolutionFwdAlgoDirect,<unused>;miopenConvolutionFwdAlgoGEMM:gemm,0.694409,0,rocBlas,<unused>;miopenConvolutionFwdAlgoWinograd:ConvBinWinogradRxSf3x2,2.28291,0,miopenConvolutionFwdAlgoWinograd,<unused>
256-56-56-1x1-512-56-56-16-0x0-1x1-1x1-0-NCHW-FP32-F=miopenConvolutionFwdAlgoImplicitGEMM:ConvHipImplicitGemmV4R1Fwd,1.4573,0,miopenConvolutionFwdAlgoImplicitGEMM,<unused>;miopenConvolutionFwdAlgoDirect:ConvAsm1x1U,2.38739,0,miopenConvolutionFwdAlgoDirect,<unused>;miopenConvolutionFwdAlgoGEMM:gemm,1.3893,0,rocBlas,<unused>;miopenConvolutionFwdAlgoWinograd:ConvBinWinogradRxSf3x2,4.47909,0,miopenConvolutionFwdAlgoWinograd,<unused>
512-56-56-3x3-512-28-28-16-1x1-2x2-1x1-0-NCHW-FP32-F_g64=miopenConvolutionFwdAlgoDirect:ConvOclDirectFwd,0.668328,0,miopenConvolutionFwdAlgoDirect,<unused>;miopenConvolutionFwdAlgoGEMM:gemm,2.03266,14450688,rocBlas,<unused>;miopenConvolutionFwdAlgoWinograd:ConvBinWinogradRxSf2x3,1.33298,0,miopenConvolutionFwdAlgoWinograd,<unused>
768-28-28-1x1-512-28-28-16-0x0-1x1-1x1-0-NCHW-FP32-F=miopenConvolutionFwdAlgoImplicitGEMM:ConvHipImplicitGemmV4R1Fwd,1.16161,0,miopenConvolutionFwdAlgoImplicitGEMM,<unused>;miopenConvolutionFwdAlgoDirect:ConvOclDirectFwd1x1,1.51202,0,miopenConvolutionFwdAlgoDirect,<unused>;miopenConvolutionFwdAlgoGEMM:gemm,1.09777,0,rocBlas,<unused>;miopenConvolutionFwdAlgoWinograd:ConvBinWinogradRxSf3x2,3.83573,0,miopenConvolutionFwdAlgoWinograd,<unused>
512-28-28-1x1-512-28-28-16-0x0-1x1-1x1-0-NCHW-FP32-F=miopenConvolutionFwdAlgoImplicitGEMM:ConvHipImplicitGemmV4R1Fwd,0.746729,0,miopenConvolutionFwdAlgoImplicitGEMM,<unused>;miopenConvolutionFwdAlgoDirect:ConvOclDirectFwd1x1,1.09377,0,miopenConvolutionFwdAlgoDirect,<unused>;miopenConvolutionFwdAlgoGEMM:gemm,0.79937,0,rocBlas,<unused>;miopenConvolutionFwdAlgoWinograd:ConvBinWinogradRxSf3x2,2.58435,0,miopenConvolutionFwdAlgoWinograd,<unused>
512-28-28-3x3-512-28-28-16-1x1-1x1-1x1-0-NCHW-FP32-F_g64=miopenConvolutionFwdAlgoDirect:ConvAsm3x3U,0.210243,0,miopenConvolutionFwdAlgoDirect,<unused>;miopenConvolutionFwdAlgoGEMM:gemm,1.78691,14450688,rocBlas,<unused>;miopenConvolutionFwdAlgoWinograd:ConvBinWinogradRxSf2x3,0.602087,0,miopenConvolutionFwdAlgoWinograd,<unused>
512-28-28-1x1-1024-28-28-16-0x0-1x1-1x1-0-NCHW-FP32-F=miopenConvolutionFwdAlgoImplicitGEMM:ConvHipImplicitGemmV4R1Fwd,1.44034,0,miopenConvolutionFwdAlgoImplicitGEMM,<unused>;miopenConvolutionFwdAlgoDirect:ConvAsm1x1U,1.89378,0,miopenConvolutionFwdAlgoDirect,<unused>;miopenConvolutionFwdAlgoGEMM:gemm,1.46354,0,rocBlas,<unused>;miopenConvolutionFwdAlgoWinograd:ConvBinWinogradRxSf3x2,4.9439,0,miopenConvolutionFwdAlgoWinograd,<unused>
1024-28-28-3x3-1024-14-14-16-1x1-2x2-1x1-0-NCHW-FP32-F_g64=miopenConvolutionFwdAlgoImplicitGEMM:ConvHipImplicitGemmV4R1Fwd,0.257603,0,miopenConvolutionFwdAlgoImplicitGEMM,<unused>;miopenConvolutionFwdAlgoDirect:ConvOclDirectFwd,0.456005,0,miopenConvolutionFwdAlgoDirect,<unused>;miopenConvolutionFwdAlgoGEMM:gemm,1.65634,7225344,rocBlas,<unused>;miopenConvolutionFwdAlgoWinograd:ConvBinWinogradRxSf2x3,0.631367,0,miopenConvolutionFwdAlgoWinograd,<unused>
1536-14-14-1x1-1024-14-14-16-0x0-1x1-1x1-0-NCHW-FP32-F=miopenConvolutionFwdAlgoImplicitGEMM:ConvHipImplicitGemmV4R1Fwd,1.23313,0,miopenConvolutionFwdAlgoImplicitGEMM,<unused>;miopenConvolutionFwdAlgoDirect:ConvAsm1x1U,1.69553,0,miopenConvolutionFwdAlgoDirect,<unused>;miopenConvolutionFwdAlgoGEMM:gemm,1.4189,0,rocBlas,<unused>;miopenConvolutionFwdAlgoWinograd:ConvBinWinogradRxSf3x2,3.79508,0,miopenConvolutionFwdAlgoWinograd,<unused>
1024-14-14-1x1-1024-14-14-16-0x0-1x1-1x1-0-NCHW-FP32-F=miopenConvolutionFwdAlgoImplicitGEMM:ConvHipImplicitGemmV4R1Fwd,0.927847,0,miopenConvolutionFwdAlgoImplicitGEMM,<unused>;miopenConvolutionFwdAlgoDirect:ConvAsm1x1U,1.36833,0,miopenConvolutionFwdAlgoDirect,<unused>;miopenConvolutionFwdAlgoGEMM:gemm,1.07777,0,rocBlas,<unused>;miopenConvolutionFwdAlgoWinograd:ConvBinWinogradRxSf3x2,2.55666,0,miopenConvolutionFwdAlgoWinograd,<unused>
1024-14-14-3x3-1024-14-14-16-1x1-1x1-1x1-0-NCHW-FP32-F_g64=miopenConvolutionFwdAlgoImplicitGEMM:ConvHipImplicitGemmV4R1Fwd,0.195202,0,miopenConvolutionFwdAlgoImplicitGEMM,<unused>;miopenConvolutionFwdAlgoDirect:ConvOclDirectFwd,0.259202,0,miopenConvolutionFwdAlgoDirect,<unused>;miopenConvolutionFwdAlgoGEMM:gemm,1.41312,7225344,rocBlas,<unused>;miopenConvolutionFwdAlgoWinograd:ConvBinWinogradRxSf2x3,0.264642,0,miopenConvolutionFwdAlgoWinograd,<unused>
1024-14-14-1x1-2048-14-14-16-0x0-1x1-1x1-0-NCHW-FP32-F=miopenConvolutionFwdAlgoImplicitGEMM:ConvHipImplicitGemmV4R1Fwd,1.74577,0,miopenConvolutionFwdAlgoImplicitGEMM,<unused>;miopenConvolutionFwdAlgoDirect:ConvAsm1x1U,2.34066,0,miopenConvolutionFwdAlgoDirect,<unused>;miopenConvolutionFwdAlgoGEMM:gemm,2.21138,0,rocBlas,<unused>;miopenConvolutionFwdAlgoWinograd:ConvBinWinogradRxSf3x2,5.10516,0,miopenConvolutionFwdAlgoWinograd,<unused>
2048-14-14-3x3-2048-7-7-16-1x1-2x2-1x1-0-NCHW-FP32-F_g64=miopenConvolutionFwdAlgoDirect:ConvOclDirectFwd,0.616164,0,miopenConvolutionFwdAlgoDirect,<unused>;miopenConvolutionFwdAlgoGEMM:gemm,1.61794,3612672,rocBlas,<unused>;miopenConvolutionFwdAlgoWinograd:ConvBinWinogradRxSf2x3,0.411843,0,miopenConvolutionFwdAlgoWinograd,<unused>
3072-7-7-1x1-2048-7-7-16-0x0-1x1-1x1-0-NCHW-FP32-F=miopenConvolutionFwdAlgoDirect:ConvAsm1x1U,3.0005,0,miopenConvolutionFwdAlgoDirect,<unused>;miopenConvolutionFwdAlgoGEMM:gemm,1.95202,0,rocBlas,<unused>;miopenConvolutionFwdAlgoWinograd:ConvBinWinogradRxSf2x3g1,5.85092,0,miopenConvolutionFwdAlgoWinograd,<unused>
2048-7-7-1x1-2048-7-7-16-0x0-1x1-1x1-0-NCHW-FP32-F=miopenConvolutionFwdAlgoDirect:ConvOclDirectFwd1x1,1.73345,0,miopenConvolutionFwdAlgoDirect,<unused>;miopenConvolutionFwdAlgoGEMM:gemm,1.19841,0,rocBlas,<unused>;miopenConvolutionFwdAlgoWinograd:ConvBinWinogradRxSf3x2,4.34579,0,miopenConvolutionFwdAlgoWinograd,<unused>
2048-7-7-3x3-2048-7-7-16-1x1-1x1-1x1-0-NCHW-FP32-F_g64=miopenConvolutionFwdAlgoDirect:ConvOclDirectFwd,0.350562,0,miopenConvolutionFwdAlgoDirect,<unused>;miopenConvolutionFwdAlgoGEMM:gemm,1.3312,3612672,rocBlas,<unused>;miopenConvolutionFwdAlgoWinograd:ConvBinWinogradRxSf2x3,0.166241,0,miopenConvolutionFwdAlgoWinograd,<unused>
3-225-225-3x3-32-112-112-64-0x0-2x2-1x1-0-NCHW-FP32-F=miopenConvolutionFwdAlgoDirect:ConvOclDirectFwd,0.64128,0,miopenConvolutionFwdAlgoDirect,<unused>;miopenConvolutionFwdAlgoGEMM:gemm,3.55328,1354752,rocBlas,<unused>;miopenConvolutionFwdAlgoWinograd:ConvBinWinogradRxSf2x3g1,0.692159,0,miopenConvolutionFwdAlgoWinograd,<unused>
32-112-112-3x3-32-112-112-64-1x1-1x1-1x1-0-NCHW-FP32-F_g32=miopenConvolutionFwdAlgoDirect:ConvOclDirectFwd,0.415839,0,miopenConvolutionFwdAlgoDirect,<unused>;miopenConvolutionFwdAlgoGEMM:gemm,12.4723,14450688,rocBlas,<unused>;miopenConvolutionFwdAlgoWinograd:ConvBinWinogradRxSf2x3,9.45647,0,miopenConvolutionFwdAlgoWinograd,<unused>
32-112-112-1x1-64-112-112-64-0x0-1x1-1x1-0-NCHW-FP32-F=miopenConvolutionFwdAlgoImplicitGEMM:ConvHipImplicitGemmV4R1Fwd,0.6864,0,miopenConvolutionFwdAlgoImplicitGEMM,<unused>;miopenConvolutionFwdAlgoDirect:ConvOclDirectFwd1x1,0.472,0,miopenConvolutionFwdAlgoDirect,<unused>;miopenConvolutionFwdAlgoGEMM:gemm,0.541439,0,rocBlas,<unused>;miopenConvolutionFwdAlgoWinograd:ConvBinWinogradRxSf3x2,1.49104,0,miopenConvolutionFwdAlgoWinograd,<unused>
64-113-113-3x3-64-56-56-64-0x0-2x2-1x1-0-NCHW-FP32-F_g64=miopenConvolutionFwdAlgoDirect:ConvOclDirectFwd,0.564,0,miopenConvolutionFwdAlgoDirect,<unused>;miopenConvolutionFwdAlgoGEMM:gemm,8.48896,7225344,rocBlas,<unused>;miopenConvolutionFwdAlgoWinograd:ConvBinWinogradRxSf2x3,8.04399,0,miopenConvolutionFwdAlgoWinograd,<unused>
64-56-56-1x1-128-56-56-64-0x0-1x1-1x1-0-NCHW-FP32-F=miopenConvolutionFwdAlgoImplicitGEMM:ConvHipImplicitGemmV4R1Fwd,0.47552,0,miopenConvolutionFwdAlgoImplicitGEMM,<unused>;miopenConvolutionFwdAlgoDirect:ConvOclDirectFwd1x1,0.39616,0,miopenConvolutionFwdAlgoDirect,<unused>;miopenConvolutionFwdAlgoGEMM:gemm,0.38192,0,rocBlas,<unused>;miopenConvolutionFwdAlgoWinograd:ConvBinWinogradRxSf3x2,1.30672,0,miopenConvolutionFwdAlgoWinograd,<unused>
128-56-56-3x3-128-56-56-64-1x1-1x1-1x1-0-NCHW-FP32-F_g128=miopenConvolutionFwdAlgoDirect:ConvOclDirectFwd,0.42816,0,miopenConvolutionFwdAlgoDirect,<unused>;miopenConvolutionFwdAlgoGEMM:gemm,13.5578,14450688,rocBlas,<unused>;miopenConvolutionFwdAlgoWinograd:ConvBinWinogradRxSf2x3,9.61967,0,miopenConvolutionFwdAlgoWinograd,<unused>
128-56-56-1x1-128-56-56-64-0x0-1x1-1x1-0-NCHW-FP32-F=miopenConvolutionFwdAlgoImplicitGEMM:ConvHipImplicitGemmV4R1Fwd,0.808799,0,miopenConvolutionFwdAlgoImplicitGEMM,<unused>;miopenConvolutionFwdAlgoDirect:ConvOclDirectFwd1x1,0.770399,0,miopenConvolutionFwdAlgoDirect,<unused>;miopenConvolutionFwdAlgoGEMM:gemm,0.947199,0,rocBlas,<unused>;miopenConvolutionFwdAlgoWinograd:ConvBinWinogradRxSf3x2,2.35056,0,miopenConvolutionFwdAlgoWinograd,<unused>
128-57-57-3x3-128-28-28-64-0x0-2x2-1x1-0-NCHW-FP32-F_g128=miopenConvolutionFwdAlgoDirect:ConvOclDirectFwd,0.290559,0,miopenConvolutionFwdAlgoDirect,<unused>;miopenConvolutionFwdAlgoGEMM:gemm,4.53632,3612672,rocBlas,<unused>;miopenConvolutionFwdAlgoWinograd:ConvBinWinogradRxSf2x3,3.82048,0,miopenConvolutionFwdAlgoWinograd,<unused>
128-28-28-1x1-256-28-28-64-0x0-1x1-1x1-0-NCHW-FP32-F=miopenConvolutionFwdAlgoImplicitGEMM:ConvHipImplicitGemmV4R1Fwd,0.40192,0,miopenConvolutionFwdAlgoImplicitGEMM,<unused>;miopenConvolutionFwdAlgoDirect:ConvOclDirectFwd1x1,0.40112,0,miopenConvolutionFwdAlgoDirect,<unused>;miopenConvolutionFwdAlgoGEMM:gemm,0.651679,0,rocBlas,<unused>;miopenConvolutionFwdAlgoWinograd:ConvBinWinogradRxSf3x2,1.3416,0,miopenConvolutionFwdAlgoWinograd,<unused>
256-28-28-3x3-256-28-28-64-1x1-1x1-1x1-0-NCHW-FP32-F_g256=miopenConvolutionFwdAlgoDirect:ConvOclDirectFwd,0.20768,0,miopenConvolutionFwdAlgoDirect,<unused>;miopenConvolutionFwdAlgoGEMM:gemm,6.44096,7225344,rocBlas,<unused>;miopenConvolutionFwdAlgoWinograd:ConvBinWinogradRxSf2x3,5.07759,0,miopenConvolutionFwdAlgoWinograd,<unused>
256-28-28-1x1-256-28-28-64-0x0-1x1-1x1-0-NCHW-FP32-F=miopenConvolutionFwdAlgoImplicitGEMM:ConvHipImplicitGemmV4R1Fwd,0.7656,0,miopenConvolutionFwdAlgoImplicitGEMM,<unused>;miopenConvolutionFwdAlgoDirect:ConvAsm1x1U,0.927359,0,miopenConvolutionFwdAlgoDirect,<unused>;miopenConvolutionFwdAlgoGEMM:gemm,0.741759,0,rocBlas,<unused>;miopenConvolutionFwdAlgoWinograd:ConvBinWinogradRxSf3x2,2.52,0,miopenConvolutionFwdAlgoWinograd,<unused>
256-29-29-3x3-256-14-14-64-0x0-2x2-1x1-0-NCHW-FP32-F_g256=miopenConvolutionFwdAlgoDirect:ConvOclDirectFwd,0.14544,0,miopenConvolutionFwdAlgoDirect,<unused>;miopenConvolutionFwdAlgoGEMM:gemm,4.02432,1806336,rocBlas,<unused>;miopenConvolutionFwdAlgoWinograd:ConvBinWinogradRxSf2x3,2.01376,0,miopenConvolutionFwdAlgoWinograd,<unused>
256-14-14-1x1-512-14-14-64-0x0-1x1-1x1-0-NCHW-FP32-F=miopenConvolutionFwdAlgoImplicitGEMM:ConvHipImplicitGemmV4R1Fwd,0.403039,0,miopenConvolutionFwdAlgoImplicitGEMM,<unused>;miopenConvolutionFwdAlgoDirect:ConvOclDirectFwd1x1,0.53136,0,miopenConvolutionFwdAlgoDirect,<unused>;miopenConvolutionFwdAlgoGEMM:gemm,0.47504,0,rocBlas,<unused>;miopenConvolutionFwdAlgoWinograd:ConvBinWinogradRxSf3x2,1.33568,0,miopenConvolutionFwdAlgoWinograd,<unused>
512-14-14-3x3-512-14-14-64-1x1-1x1-1x1-0-NCHW-FP32-F_g512=miopenConvolutionFwdAlgoDirect:ConvOclDirectFwd,0.1224,0,miopenConvolutionFwdAlgoDirect,<unused>;miopenConvolutionFwdAlgoGEMM:gemm,4.608,3612672,rocBlas,<unused>;miopenConvolutionFwdAlgoWinograd:ConvBinWinogradRxSf2x3,2.73408,0,miopenConvolutionFwdAlgoWinograd,<unused>
512-14-14-1x1-512-14-14-64-0x0-1x1-1x1-0-NCHW-FP32-F=miopenConvolutionFwdAlgoImplicitGEMM:ConvHipImplicitGemmV4R1Fwd,0.764,0,miopenConvolutionFwdAlgoImplicitGEMM,<unused>;miopenConvolutionFwdAlgoDirect:ConvOclDirectFwd1x1,1.0768,0,miopenConvolutionFwdAlgoDirect,<unused>;miopenConvolutionFwdAlgoGEMM:gemm,1.24384,0,rocBlas,<unused>;miopenConvolutionFwdAlgoWinograd:ConvBinWinogradRxSf3x2,2.5864,0,miopenConvolutionFwdAlgoWinograd,<unused>
512-15-15-3x3-512-7-7-64-0x0-2x2-1x1-0-NCHW-FP32-F_g512=miopenConvolutionFwdAlgoDirect:ConvOclDirectFwd,0.0896,0,miopenConvolutionFwdAlgoDirect,<unused>;miopenConvolutionFwdAlgoGEMM:gemm,3.45088,903168,rocBlas,<unused>;miopenConvolutionFwdAlgoWinograd:ConvBinWinogradRxSf2x3,1.5104,0,miopenConvolutionFwdAlgoWinograd,<unused>
512-7-7-1x1-1024-7-7-64-0x0-1x1-1x1-0-NCHW-FP32-F=miopenConvolutionFwdAlgoImplicitGEMM:ConvHipImplicitGemmV4R1Fwd,0.5008,0,miopenConvolutionFwdAlgoImplicitGEMM,<unused>;miopenConvolutionFwdAlgoDirect:ConvOclDirectFwd1x1,0.64432,0,miopenConvolutionFwdAlgoDirect,<unused>;miopenConvolutionFwdAlgoGEMM:gemm,0.773599,0,rocBlas,<unused>;miopenConvolutionFwdAlgoWinograd:ConvBinWinogradRxSf3x2,1.85936,0,miopenConvolutionFwdAlgoWinograd,<unused>
1024-7-7-3x3-1024-7-7-64-1x1-1x1-1x1-0-NCHW-FP32-F_g1024=miopenConvolutionFwdAlgoDirect:ConvOclDirectFwd,0.172799,0,miopenConvolutionFwdAlgoDirect,<unused>;miopenConvolutionFwdAlgoGEMM:gemm,3.01056,1806336,rocBlas,<unused>;miopenConvolutionFwdAlgoWinograd:ConvBinWinogradRxSf2x3,1.95648,0,miopenConvolutionFwdAlgoWinograd,<unused>
1024-7-7-1x1-1024-7-7-64-0x0-1x1-1x1-0-NCHW-FP32-F=miopenConvolutionFwdAlgoImplicitGEMM:ConvHipImplicitGemmV4R1Fwd,0.924799,0,miopenConvolutionFwdAlgoImplicitGEMM,<unused>;miopenConvolutionFwdAlgoDirect:ConvOclDirectFwd1x1,1.45456,0,miopenConvolutionFwdAlgoDirect,<unused>;miopenConvolutionFwdAlgoGEMM:gemm,1.64592,0,rocBlas,<unused>;miopenConvolutionFwdAlgoWinograd:ConvBinWinogradRxSf3x2,3.63792,0,miopenConvolutionFwdAlgoWinograd,<unused>
1024-1-1-1x1-1001-1-1-64-0x0-1x1-1x1-0-NCHW-FP32-F=miopenConvolutionFwdAlgoDirect:ConvAsm1x1U,0.34,0,miopenConvolutionFwdAlgoDirect,<unused>;miopenConvolutionFwdAlgoGEMM:gemm,0.7224,0,rocBlas,<unused>;miopenConvolutionFwdAlgoWinograd:ConvBinWinogradRxSf2x3g1,0.54768,0,miopenConvolutionFwdAlgoWinograd,<unused>
3-331-331-3x3-96-165-165-64-0x0-2x2-1x1-0-NCHW-FP32-F=miopenConvolutionFwdAlgoDirect:ConvOclDirectFwd,4.0256,0,miopenConvolutionFwdAlgoDirect,<unused>;miopenConvolutionFwdAlgoGEMM:gemm,5.21216,2940300,rocBlas,<unused>;miopenConvolutionFwdAlgoWinograd:ConvBinWinogradRxSf2x3g1,4.22464,0,miopenConvolutionFwdAlgoWinograd,<unused>
96-165-165-1x1-42-165-165-64-0x0-1x1-1x1-0-NCHW-FP32-F=miopenConvolutionFwdAlgoDirect:ConvAsm1x1U,2.42256,0,miopenConvolutionFwdAlgoDirect,<unused>;miopenConvolutionFwdAlgoGEMM:gemm,2.5264,0,rocBlas,<unused>;miopenConvolutionFwdAlgoWinograd:ConvBinWinogradRxSf3x2,7.35823,0,miopenConvolutionFwdAlgoWinograd,<unused>
96-165-165-7x7-96-83-83-64-3x3-2x2-1x1-0-NCHW-FP32-F_g96=miopenConvolutionFwdAlgoDirect:ConvOclDirectFwd,2.52,0,miopenConvolutionFwdAlgoDirect,<unused>;miopenConvolutionFwdAlgoGEMM:gemm,42.3117,129623424,rocBlas,<unused>;miopenConvolutionFwdAlgoWinograd:ConvBinWinogradRxSf2x3,43.5665,0,miopenConvolutionFwdAlgoWinograd,<unused>
96-83-83-1x1-42-83-83-64-0x0-1x1-1x1-0-NCHW-FP32-F=miopenConvolutionFwdAlgoDirect:ConvAsm1x1U,0.64176,0,miopenConvolutionFwdAlgoDirect,<unused>;miopenConvolutionFwdAlgoGEMM:gemm,1.3928,0,rocBlas,<unused>;miopenConvolutionFwdAlgoWinograd:ConvBinWinogradRxSf3x2,1.94784,0,miopenConvolutionFwdAlgoWinograd,<unused>
42-83-83-7x7-42-83-83-64-3x3-1x1-1x1-0-NCHW-FP32-F_g42=miopenConvolutionFwdAlgoDirect:ConvOclDirectFwd,0.5072,0,miopenConvolutionFwdAlgoDirect,<unused>;miopenConvolutionFwdAlgoGEMM:gemm,18.5754,56710248,rocBlas,<unused>;miopenConvolutionFwdAlgoWinograd:ConvBinWinogradRxSf2x3,19.2318,0,miopenConvolutionFwdAlgoWinograd,<unused>
42-83-83-1x1-42-83-83-64-0x0-1x1-1x1-0-NCHW-FP32-F=miopenConvolutionFwdAlgoDirect:ConvAsm1x1U,0.30272,0,miopenConvolutionFwdAlgoDirect,<unused>;miopenConvolutionFwdAlgoGEMM:gemm,0.82896,0,rocBlas,<unused>;miopenConvolutionFwdAlgoWinograd:ConvBinWinogradRxSf3x2,1.01328,0,miopenConvolutionFwdAlgoWinograd,<unused>
96-165-165-5x5-96-83-83-64-2x2-2x2-1x1-0-NCHW-FP32-F_g96=miopenConvolutionFwdAlgoDirect:ConvOclDirectFwd,2.26944,0,miopenConvolutionFwdAlgoDirect,<unused>;miopenConvolutionFwdAlgoGEMM:gemm,23.337,66134400,rocBlas,<unused>;miopenConvolutionFwdAlgoWinograd:ConvBinWinogradRxSf2x3,22.5018,0,miopenConvolutionFwdAlgoWinograd,<unused>
42-83-83-5x5-42-83-83-64-2x2-1x1-1x1-0-NCHW-FP32-F_g42=miopenConvolutionFwdAlgoDirect:ConvOclDirectFwd,0.40208,0,miopenConvolutionFwdAlgoDirect,<unused>;miopenConvolutionFwdAlgoGEMM:gemm,10.7622,28933800,rocBlas,<unused>;miopenConvolutionFwdAlgoWinograd:ConvBinWinogradRxSf2x3,10.2094,0,miopenConvolutionFwdAlgoWinograd,<unused>
42-165-165-5x5-42-83-83-64-2x2-2x2-1x1-0-NCHW-FP32-F_g42=miopenConvolutionFwdAlgoDirect:ConvOclDirectFwd,1.01872,0,miopenConvolutionFwdAlgoDirect,<unused>;miopenConvolutionFwdAlgoGEMM:gemm,11.5098,28933800,rocBlas,<unused>;miopenConvolutionFwdAlgoWinograd:ConvBinWinogradRxSf2x3,10.573,0,miopenConvolutionFwdAlgoWinograd,<unused>
84-83-83-1x1-42-83-83-64-0x0-1x1-1x1-0-NCHW-FP32-F=miopenConvolutionFwdAlgoDirect:ConvAsm1x1U,0.667839,0,miopenConvolutionFwdAlgoDirect,<unused>;miopenConvolutionFwdAlgoGEMM:gemm,1.2832,0,rocBlas,<unused>;miopenConvolutionFwdAlgoWinograd:ConvBinWinogradRxSf3x2,1.7392,0,miopenConvolutionFwdAlgoWinograd,<unused>
42-83-83-3x3-42-83-83-64-1x1-1x1-1x1-0-NCHW-FP32-F_g42=miopenConvolutionFwdAlgoDirect:ConvOclDirectFwd,0.57792,0,miopenConvolutionFwdAlgoDirect,<unused>;miopenConvolutionFwdAlgoGEMM:gemm,8.97024,10416168,rocBlas,<unused>;miopenConvolutionFwdAlgoWinograd:ConvBinWinogradRxSf2x3,7.21424,0,miopenConvolutionFwdAlgoWinograd,<unused>
64-56-56-3x3-64-28-28-64-1x1-2x2-1x1-0-NCHW-FP32-F=miopenConvolutionFwdAlgoImplicitGEMM:ConvHipImplicitGemmV4R1Fwd,0.512,0,miopenConvolutionFwdAlgoImplicitGEMM,<unused>;miopenConvolutionFwdAlgoDirect:ConvOclDirectFwd,2.36688,0,miopenConvolutionFwdAlgoDirect,<unused>;miopenConvolutionFwdAlgoGEMM:gemm,8.81664,1806336,rocBlas,<unused>;miopenConvolutionFwdAlgoWinograd:ConvBinWinogradRxSf2x3g1,0.943039,0,miopenConvolutionFwdAlgoWinograd,<unused>
64-28-28-1x1-256-28-28-64-0x0-1x1-1x1-0-NCHW-FP32-F=miopenConvolutionFwdAlgoImplicitGEMM:ConvHipImplicitGemmV4R1Fwd,0.24784,0,miopenConvolutionFwdAlgoImplicitGEMM,<unused>;miopenConvolutionFwdAlgoDirect:ConvOclDirectFwd1x1,0.22272,0,miopenConvolutionFwdAlgoDirect,<unused>;miopenConvolutionFwdAlgoGEMM:gemm,0.3856,0,rocBlas,<unused>;miopenConvolutionFwdAlgoWinograd:ConvBinWinogradRxSf3x2,0.75456,0,miopenConvolutionFwdAlgoWinograd,<unused>
256-28-28-1x1-128-28-28-64-0x0-1x1-1x1-0-NCHW-FP32-F=miopenConvolutionFwdAlgoImplicitGEMM:ConvHipImplicitGemmV4R1Fwd,0.38848,0,miopenConvolutionFwdAlgoImplicitGEMM,<unused>;miopenConvolutionFwdAlgoDirect:ConvOclDirectFwd1x1,0.39408,0,miopenConvolutionFwdAlgoDirect,<unused>;miopenConvolutionFwdAlgoGEMM:gemm,0.37488,0,rocBlas,<unused>;miopenConvolutionFwdAlgoWinograd:ConvBinWinogradRxSf3x2,1.32064,0,miopenConvolutionFwdAlgoWinograd,<unused>
128-28-28-3x3-128-14-14-64-1x1-2x2-1x1-0-NCHW-FP32-F=miopenConvolutionFwdAlgoImplicitGEMM:ConvHipImplicitGemmV4R1Fwd,0.55056,0,miopenConvolutionFwdAlgoImplicitGEMM,<unused>;miopenConvolutionFwdAlgoDirect:ConvOclDirectFwd,1.97792,0,miopenConvolutionFwdAlgoDirect,<unused>;miopenConvolutionFwdAlgoGEMM:gemm,4.608,903168,rocBlas,<unused>;miopenConvolutionFwdAlgoWinograd:ConvBinWinogradRxSf2x3g1,0.92496,0,miopenConvolutionFwdAlgoWinograd,<unused>
128-14-14-1x1-512-14-14-64-0x0-1x1-1x1-0-NCHW-FP32-F=miopenConvolutionFwdAlgoImplicitGEMM:ConvHipImplicitGemmV4R1Fwd,0.21824,0,miopenConvolutionFwdAlgoImplicitGEMM,<unused>;miopenConvolutionFwdAlgoDirect:ConvOclDirectFwd1x1,0.28224,0,miopenConvolutionFwdAlgoDirect,<unused>;miopenConvolutionFwdAlgoGEMM:gemm,0.330559,0,rocBlas,<unused>;miopenConvolutionFwdAlgoWinograd:ConvBinWinogradRxSf3x2,0.715199,0,miopenConvolutionFwdAlgoWinograd,<unused>
512-14-14-1x1-256-14-14-64-0x0-1x1-1x1-0-NCHW-FP32-F=miopenConvolutionFwdAlgoImplicitGEMM:ConvHipImplicitGemmV4R1Fwd,0.4392,0,miopenConvolutionFwdAlgoImplicitGEMM,<unused>;miopenConvolutionFwdAlgoDirect:ConvAsm1x1U,0.512,0,miopenConvolutionFwdAlgoDirect,<unused>;miopenConvolutionFwdAlgoGEMM:gemm,0.6856,0,rocBlas,<unused>;miopenConvolutionFwdAlgoWinograd:ConvBinWinogradRxSf3x2,1.30816,0,miopenConvolutionFwdAlgoWinograd,<unused>
256-14-14-3x3-256-7-7-64-1x1-2x2-1x1-0-NCHW-FP32-F=miopenConvolutionFwdAlgoImplicitGEMM:ConvHipImplicitGemmV4R1Fwd,0.58768,0,miopenConvolutionFwdAlgoImplicitGEMM,<unused>;miopenConvolutionFwdAlgoDirect:ConvOclDirectFwd,2.67408,0,miopenConvolutionFwdAlgoDirect,<unused>;miopenConvolutionFwdAlgoGEMM:gemm,7.35232,451584,rocBlas,<unused>;miopenConvolutionFwdAlgoWinograd:ConvBinWinogradRxSf2x3g1,1.31664,0,miopenConvolutionFwdAlgoWinograd,<unused>
256-7-7-1x1-1024-7-7-64-0x0-1x1-1x1-0-NCHW-FP32-F=miopenConvolutionFwdAlgoImplicitGEMM:ConvHipImplicitGemmV4R1Fwd,0.21408,0,miopenConvolutionFwdAlgoImplicitGEMM,<unused>;miopenConvolutionFwdAlgoDirect:ConvOclDirectFwd1x1,0.29376,0,miopenConvolutionFwdAlgoDirect,<unused>;miopenConvolutionFwdAlgoGEMM:gemm,0.63568,0,rocBlas,<unused>;miopenConvolutionFwdAlgoWinograd:ConvBinWinogradRxSf3x2,0.9736,0,miopenConvolutionFwdAlgoWinograd,<unused>
1024-7-7-1x1-512-7-7-64-0x0-1x1-1x1-0-NCHW-FP32-F=miopenConvolutionFwdAlgoImplicitGEMM:ConvHipImplicitGemmV4R1Fwd,0.58,0,miopenConvolutionFwdAlgoImplicitGEMM,<unused>;miopenConvolutionFwdAlgoDirect:ConvOclDirectFwd1x1,0.63072,0,miopenConvolutionFwdAlgoDirect,<unused>;miopenConvolutionFwdAlgoGEMM:gemm,1.15632,0,rocBlas,<unused>;miopenConvolutionFwdAlgoWinograd:ConvBinWinogradRxSf3x2,1.83376,0,miopenConvolutionFwdAlgoWinograd,<unused>
2048-1-1-1x1-1001-1-1-64-0x0-1x1-1x1-0-NCHW-FP32-F=miopenConvolutionFwdAlgoDirect:ConvAsm1x1U,0.74256,0,miopenConvolutionFwdAlgoDirect,<unused>;miopenConvolutionFwdAlgoGEMM:gemm,2.10592,0,rocBlas,<unused>;miopenConvolutionFwdAlgoWinograd:ConvBinWinogradRxSf2x3g1,1.06704,0,miopenConvolutionFwdAlgoWinograd,<unused>
3-224-224-7x7-64-112-112-1-3x3-2x2-1x1-0-NCHW-FP32-F=miopenConvolutionFwdAlgoDirect:ConvAsm7x7c3h224w224k64u2v2p3q3f1,0.03824,0,miopenConvolutionFwdAlgoDirect,<unused>;miopenConvolutionFwdAlgoGEMM:gemm,0.0728,7375872,rocBlas,<unused>;miopenConvolutionFwdAlgoWinograd:ConvBinWinogradRxSf2x3g1,0.079999,0,miopenConvolutionFwdAlgoWinograd,<unused>
64-56-56-1x1-64-56-56-1-0x0-1x1-1x1-0-NCHW-FP32-F=miopenConvolutionFwdAlgoImplicitGEMM:ConvHipImplicitGemmV4R4Fwd,0.0176,0,miopenConvolutionFwdAlgoImplicitGEMM,<unused>;miopenConvolutionFwdAlgoDirect:ConvAsm1x1U,0.01664,0,miopenConvolutionFwdAlgoDirect,<unused>;miopenConvolutionFwdAlgoGEMM:gemm,0.03616,0,rocBlas,<unused>;miopenConvolutionFwdAlgoWinograd:ConvBinWinogradRxSf2x3g1,0.03952,0,miopenConvolutionFwdAlgoWinograd,<unused>
64-56-56-3x3-64-56-56-1-1x1-1x1-1x1-0-NCHW-FP32-F=miopenConvolutionFwdAlgoWinograd:ConvBinWinogradRxSf2x3g1,0.03968,0,miopenConvolutionFwdAlgoWinograd,<unused>
128-56-56-1x1-256-56-56-1-0x0-1x1-1x1-0-NCHW-FP32-F=miopenConvolutionFwdAlgoImplicitGEMM:ConvHipImplicitGemmV4R4Fwd,0.03904,0,miopenConvolutionFwdAlgoImplicitGEMM,<unused>;miopenConvolutionFwdAlgoDirect:ConvOclDirectFwd1x1,0.04016,0,miopenConvolutionFwdAlgoDirect,<unused>;miopenConvolutionFwdAlgoGEMM:gemm,0.064,0,rocBlas,<unused>;miopenConvolutionFwdAlgoWinograd:ConvBinWinogradRxSf3x2,0.12576,0,miopenConvolutionFwdAlgoWinograd,<unused>
256-56-56-1x1-64-56-56-1-0x0-1x1-1x1-0-NCHW-FP32-F=miopenConvolutionFwdAlgoImplicitGEMM:ConvHipImplicitGemmV4R4Fwd,0.0456,0,miopenConvolutionFwdAlgoImplicitGEMM,<unused>;miopenConvolutionFwdAlgoDirect:ConvAsm1x1U,0.0312,0,miopenConvolutionFwdAlgoDirect,<unused>;miopenConvolutionFwdAlgoGEMM:gemm,0.07216,0,rocBlas,<unused>;miopenConvolutionFwdAlgoWinograd:ConvBinWinogradRxSf2x3g1,0.08656,0,miopenConvolutionFwdAlgoWinograd,<unused>
64-56-56-1x1-256-56-56-1-0x0-1x1-1x1-0-NCHW-FP32-F=miopenConvolutionFwdAlgoImplicitGEMM:ConvHipImplicitGemmV4R4Fwd,0.0248,0,miopenConvolutionFwdAlgoImplicitGEMM,<unused>;miopenConvolutionFwdAlgoDirect:ConvOclDirectFwd1x1,0.02224,0,miopenConvolutionFwdAlgoDirect,<unused>;miopenConvolutionFwdAlgoGEMM:gemm,0.045599,0,rocBlas,<unused>;miopenConvolutionFwdAlgoWinograd:ConvBinWinogradRxSf3x2,0.081759,0,miopenConvolutionFwdAlgoWinograd,<unused>
256-56-56-1x1-128-56-56-1-0x0-1x1-1x1-0-NCHW-FP32-F=miopenConvolutionFwdAlgoImplicitGEMM:ConvHipImplicitGemmV4R4Fwd,0.04496,0,miopenConvolutionFwdAlgoImplicitGEMM,<unused>;miopenConvolutionFwdAlgoDirect:ConvAsm1x1U,0.04816,0,miopenConvolutionFwdAlgoDirect,<unused>;miopenConvolutionFwdAlgoGEMM:gemm,0.0696,0,rocBlas,<unused>;miopenConvolutionFwdAlgoWinograd:ConvBinWinogradRxSf3x2,0.119199,0,miopenConvolutionFwdAlgoWinograd,<unused>
128-56-56-3x3-128-28-28-1-1x1-2x2-1x1-0-NCHW-FP32-F=miopenConvolutionFwdAlgoDirect:ConvOclDirectFwd,0.41728,0,miopenConvolutionFwdAlgoDirect,<unused>;miopenConvolutionFwdAlgoGEMM:gemm,0.10192,3612672,rocBlas,<unused>;miopenConvolutionFwdAlgoWinograd:ConvBinWinogradRxSf2x3g1,0.15344,0,miopenConvolutionFwdAlgoWinograd,<unused>
384-28-28-1x1-512-28-28-1-0x0-1x1-1x1-0-NCHW-FP32-F=miopenConvolutionFwdAlgoDirect:ConvAsm1x1U,0.06368,0,miopenConvolutionFwdAlgoDirect,<unused>;miopenConvolutionFwdAlgoGEMM:gemm,0.075519,0,rocBlas,<unused>;miopenConvolutionFwdAlgoWinograd:ConvBinWinogradRxSf2x3g1,0.20768,0,miopenConvolutionFwdAlgoWinograd,<unused>
512-28-28-1x1-128-28-28-1-0x0-1x1-1x1-0-NCHW-FP32-F=miopenConvolutionFwdAlgoDirect:ConvOclDirectFwd1x1,0.03904,0,miopenConvolutionFwdAlgoDirect,<unused>;miopenConvolutionFwdAlgoGEMM:gemm,0.1296,0,rocBlas,<unused>;miopenConvolutionFwdAlgoWinograd:ConvBinWinogradRxSf2x3g1,0.14896,0,miopenConvolutionFwdAlgoWinograd,<unused>
128-28-28-3x3-128-28-28-1-1x1-1x1-1x1-0-NCHW-FP32-F=miopenConvolutionFwdAlgoWinograd:ConvBinWinogradRxSf2x3g1,0.0568,0,miopenConvolutionFwdAlgoWinograd,<unused>
128-28-28-1x1-512-28-28-1-0x0-1x1-1x1-0-NCHW-FP32-F=miopenConvolutionFwdAlgoDirect:ConvAsm1x1U,0.03232,0,miopenConvolutionFwdAlgoDirect,<unused>;miopenConvolutionFwdAlgoGEMM:gemm,0.05248,0,rocBlas,<unused>;miopenConvolutionFwdAlgoWinograd:ConvBinWinogradRxSf2x3g1,0.08752,0,miopenConvolutionFwdAlgoWinograd,<unused>
512-28-28-1x1-256-28-28-1-0x0-1x1-1x1-0-NCHW-FP32-F=miopenConvolutionFwdAlgoDirect:ConvOclDirectFwd1x1,0.0536,0,miopenConvolutionFwdAlgoDirect,<unused>;miopenConvolutionFwdAlgoGEMM:gemm,0.112799,0,rocBlas,<unused>;miopenConvolutionFwdAlgoWinograd:ConvBinWinogradRxSf2x3g1,0.147039,0,miopenConvolutionFwdAlgoWinograd,<unused>
256-28-28-3x3-256-14-14-1-1x1-2x2-1x1-0-NCHW-FP32-F=miopenConvolutionFwdAlgoDirect:ConvOclDirectFwd,0.62208,0,miopenConvolutionFwdAlgoDirect,<unused>;miopenConvolutionFwdAlgoGEMM:gemm,0.11088,1806336,rocBlas,<unused>;miopenConvolutionFwdAlgoWinograd:ConvBinWinogradRxSf2x3g1,0.2864,0,miopenConvolutionFwdAlgoWinograd,<unused>
768-14-14-1x1-1024-14-14-1-0x0-1x1-1x1-0-NCHW-FP32-F=miopenConvolutionFwdAlgoDirect:ConvAsm1x1U,0.10096,0,miopenConvolutionFwdAlgoDirect,<unused>;miopenConvolutionFwdAlgoGEMM:gemm,0.103679,0,rocBlas,<unused>;miopenConvolutionFwdAlgoWinograd:ConvBinWinogradRxSf3x2,0.2992,0,miopenConvolutionFwdAlgoWinograd,<unused>
1024-14-14-1x1-256-14-14-1-0x0-1x1-1x1-0-NCHW-FP32-F=miopenConvolutionFwdAlgoDirect:ConvOclDirectFwd1x1,0.04672,0,miopenConvolutionFwdAlgoDirect,<unused>;miopenConvolutionFwdAlgoGEMM:gemm,0.11424,0,rocBlas,<unused>;miopenConvolutionFwdAlgoWinograd:ConvBinWinogradRxSf2x3g1,0.278239,0,miopenConvolutionFwdAlgoWinograd,<unused>
256-14-14-3x3-256-14-14-1-1x1-1x1-1x1-0-NCHW-FP32-F=miopenConvolutionFwdAlgoWinograd:ConvBinWinogradRxSf2x3g1,0.08832,0,miopenConvolutionFwdAlgoWinograd,<unused>
256-14-14-1x1-1024-14-14-1-0x0-1x1-1x1-0-NCHW-FP32-F=miopenConvolutionFwdAlgoDirect:ConvAsm1x1U,0.03808,0,miopenConvolutionFwdAlgoDirect,<unused>;miopenConvolutionFwdAlgoGEMM:gemm,0.05616,0,rocBlas,<unused>;miopenConvolutionFwdAlgoWinograd:ConvBinWinogradRxSf3x2,0.12016,0,miopenConvolutionFwdAlgoWinograd,<unused>
1024-14-14-1x1-512-14-14-1-0x0-1x1-1x1-0-NCHW-FP32-F=miopenConvolutionFwdAlgoDirect:ConvAsm1x1U,0.07296,0,miopenConvolutionFwdAlgoDirect,<unused>;miopenConvolutionFwdAlgoGEMM:gemm,0.0888,0,rocBlas,<unused>;miopenConvolutionFwdAlgoWinograd:ConvBinWinogradRxSf2x3g1,0.2728,0,miopenConvolutionFwdAlgoWinograd,<unused>
512-14-14-3x3-512-7-7-1-1x1-2x2-1x1-0-NCHW-FP32-F=miopenConvolutionFwdAlgoDirect:ConvOclDirectFwd,1.09808,0,miopenConvolutionFwdAlgoDirect,<unused>;miopenConvolutionFwdAlgoGEMM:gemm,0.46608,903168,rocBlas,<unused>;miopenConvolutionFwdAlgoWinograd:ConvBinWinogradRxSf2x3g1,0.55168,0,miopenConvolutionFwdAlgoWinograd,<unused>
1536-7-7-1x1-2048-7-7-1-0x0-1x1-1x1-0-NCHW-FP32-F=miopenConvolutionFwdAlgoDirect:ConvOclDirectFwd1x1,0.124,0,miopenConvolutionFwdAlgoDirect,<unused>;miopenConvolutionFwdAlgoGEMM:gemm,0.1224,0,rocBlas,<unused>;miopenConvolutionFwdAlgoWinograd:ConvBinWinogradRxSf2x3g1,0.774399,0,miopenConvolutionFwdAlgoWinograd,<unused>
2048-7-7-1x1-512-7-7-1-0x0-1x1-1x1-0-NCHW-FP32-F=miopenConvolutionFwdAlgoDirect:ConvOclDirectFwd1x1,0.056,0,miopenConvolutionFwdAlgoDirect,<unused>;miopenConvolutionFwdAlgoGEMM:gemm,0.10384,0,rocBlas,<unused>;miopenConvolutionFwdAlgoWinograd:ConvBinWinogradRxSf2x3g1,0.528959,0,miopenConvolutionFwdAlgoWinograd,<unused>
512-7-7-3x3-512-7-7-1-1x1-1x1-1x1-0-NCHW-FP32-F=miopenConvolutionFwdAlgoWinograd:ConvBinWinogradRxSf2x3g1,0.15248,0,miopenConvolutionFwdAlgoWinograd,<unused>
512-7-7-1x1-2048-7-7-1-0x0-1x1-1x1-0-NCHW-FP32-F=miopenConvolutionFwdAlgoDirect:ConvOclDirectFwd1x1,0.04512,0,miopenConvolutionFwdAlgoDirect,<unused>;miopenConvolutionFwdAlgoGEMM:gemm,0.06688,0,rocBlas,<unused>;miopenConvolutionFwdAlgoWinograd:ConvBinWinogradRxSf2x3g1,0.271199,0,miopenConvolutionFwdAlgoWinograd,<unused>
3-299-299-3x3-32-149-149-1-0x0-2x2-1x1-0-NCHW-FP32-F=miopenConvolutionFwdAlgoDirect:ConvOclDirectFwdGen,0.04272,0,miopenConvolutionFwdAlgoDirect,<unused>;miopenConvolutionFwdAlgoGEMM:gemm,0.05392,2397708,rocBlas,<unused>;miopenConvolutionFwdAlgoWinograd:ConvBinWinogradRxSf2x3g1,0.0432,0,miopenConvolutionFwdAlgoWinograd,<unused>
32-149-149-3x3-32-147-147-1-0x0-1x1-1x1-0-NCHW-FP32-F=miopenConvolutionFwdAlgoDirect:ConvOclDirectFwd,0.14304,0,miopenConvolutionFwdAlgoDirect,<unused>;miopenConvolutionFwdAlgoGEMM:gemm,0.158079,24893568,rocBlas,<unused>;miopenConvolutionFwdAlgoWinograd:ConvBinWinogradRxSf2x3g1,0.05168,0,miopenConvolutionFwdAlgoWinograd,<unused>
32-147-147-3x3-64-147-147-1-1x1-1x1-1x1-0-NCHW-FP32-F=miopenConvolutionFwdAlgoWinograd:ConvBinWinogradRxSf2x3g1,0.0808,0,miopenConvolutionFwdAlgoWinograd,<unused>
64-73-73-1x1-80-73-73-1-0x0-1x1-1x1-0-NCHW-FP32-F=miopenConvolutionFwdAlgoDirect:ConvOclDirectFwd1x1,0.01872,0,miopenConvolutionFwdAlgoDirect,<unused>;miopenConvolutionFwdAlgoGEMM:gemm,0.04,0,rocBlas,<unused>;miopenConvolutionFwdAlgoWinograd:ConvBinWinogradRxSf3x2,0.05392,0,miopenConvolutionFwdAlgoWinograd,<unused>
80-73-73-3x3-192-71-71-1-0x0-1x1-1x1-0-NCHW-FP32-F=miopenConvolutionFwdAlgoDirect:ConvOclDirectFwd,0.488796,0,miopenConvolutionFwdAlgoDirect,<unused>;miopenConvolutionFwdAlgoGEMM:gemm,0.191838,14518080,rocBlas,<unused>;miopenConvolutionFwdAlgoWinograd:ConvBinWinogradRxSf2x3g1,0.134559,0,miopenConvolutionFwdAlgoWinograd,<unused>
192-35-35-1x1-128-35-35-1-0x0-1x1-1x1-0-NCHW-FP32-F=miopenConvolutionFwdAlgoDirect:ConvAsm1x1U,0.01792,0,miopenConvolutionFwdAlgoDirect,<unused>;miopenConvolutionFwdAlgoGEMM:gemm,0.045439,0,rocBlas,<unused>;miopenConvolutionFwdAlgoWinograd:ConvBinWinogradRxSf2x3g1,0.070559,0,miopenConvolutionFwdAlgoWinograd,<unused>
192-35-35-1x1-48-35-35-1-0x0-1x1-1x1-0-NCHW-FP32-F=miopenConvolutionFwdAlgoDirect:ConvAsm1x1U,0.0152,0,miopenConvolutionFwdAlgoDirect,<unused>;miopenConvolutionFwdAlgoGEMM:gemm,0.05744,0,rocBlas,<unused>;miopenConvolutionFwdAlgoWinograd:ConvBinWinogradRxSf2x3g1,0.0712,0,miopenConvolutionFwdAlgoWinograd,<unused>
48-35-35-5x5-64-35-35-1-2x2-1x1-1x1-0-NCHW-FP32-F=miopenConvolutionFwdAlgoDirect:ConvOclDirectFwd,0.156319,0,miopenConvolutionFwdAlgoDirect,<unused>;miopenConvolutionFwdAlgoGEMM:gemm,0.08608,5880000,rocBlas,<unused>;miopenConvolutionFwdAlgoWinograd:ConvBinWinogradRxSf2x3g1,0.070879,0,miopenConvolutionFwdAlgoWinograd,<unused>
64-35-35-3x3-96-35-35-1-1x1-1x1-1x1-0-NCHW-FP32-F=miopenConvolutionFwdAlgoWinograd:ConvBinWinogradRxSf2x3g1,0.03936,0,miopenConvolutionFwdAlgoWinograd,<unused>
96-35-35-3x3-96-35-35-1-1x1-1x1-1x1-0-NCHW-FP32-F=miopenConvolutionFwdAlgoWinograd:ConvBinWinogradRxSf2x3g1,0.047839,0,miopenConvolutionFwdAlgoWinograd,<unused>
192-35-35-1x1-32-35-35-1-0x0-1x1-1x1-0-NCHW-FP32-F=miopenConvolutionFwdAlgoDirect:ConvAsm1x1U,0.01392,0,miopenConvolutionFwdAlgoDirect,<unused>;miopenConvolutionFwdAlgoGEMM:gemm,0.08128,0,rocBlas,<unused>;miopenConvolutionFwdAlgoWinograd:ConvBinWinogradRxSf2x3g1,0.070559,0,miopenConvolutionFwdAlgoWinograd,<unused>
256-35-35-1x1-128-35-35-1-0x0-1x1-1x1-0-NCHW-FP32-F=miopenConvolutionFwdAlgoDirect:ConvAsm1x1U,0.0208,0,miopenConvolutionFwdAlgoDirect,<unused>;miopenConvolutionFwdAlgoGEMM:gemm,0.079039,0,rocBlas,<unused>;miopenConvolutionFwdAlgoWinograd:ConvBinWinogradRxSf2x3g1,0.085919,0,miopenConvolutionFwdAlgoWinograd,<unused>
256-35-35-1x1-48-35-35-1-0x0-1x1-1x1-0-NCHW-FP32-F=miopenConvolutionFwdAlgoDirect:ConvAsm1x1U,0.01824,0,miopenConvolutionFwdAlgoDirect,<unused>;miopenConvolutionFwdAlgoGEMM:gemm,0.077919,0,rocBlas,<unused>;miopenConvolutionFwdAlgoWinograd:ConvBinWinogradRxSf2x3g1,0.08672,0,miopenConvolutionFwdAlgoWinograd,<unused>
256-35-35-1x1-64-35-35-1-0x0-1x1-1x1-0-NCHW-FP32-F=miopenConvolutionFwdAlgoDirect:ConvAsm1x1U,0.02176,0,miopenConvolutionFwdAlgoDirect,<unused>;miopenConvolutionFwdAlgoGEMM:gemm,0.081919,0,rocBlas,<unused>;miopenConvolutionFwdAlgoWinograd:ConvBinWinogradRxSf2x3g1,0.086239,0,miopenConvolutionFwdAlgoWinograd,<unused>
288-35-35-1x1-128-35-35-1-0x0-1x1-1x1-0-NCHW-FP32-F=miopenConvolutionFwdAlgoDirect:ConvAsm1x1U,0.02336,0,miopenConvolutionFwdAlgoDirect,<unused>;miopenConvolutionFwdAlgoGEMM:gemm,0.08112,0,rocBlas,<unused>;miopenConvolutionFwdAlgoWinograd:ConvBinWinogradRxSf2x3g1,0.093919,0,miopenConvolutionFwdAlgoWinograd,<unused>
288-35-35-1x1-48-35-35-1-0x0-1x1-1x1-0-NCHW-FP32-F=miopenConvolutionFwdAlgoDirect:ConvAsm1x1U,0.01856,0,miopenConvolutionFwdAlgoDirect,<unused>;miopenConvolutionFwdAlgoGEMM:gemm,0.087999,0,rocBlas,<unused>;miopenConvolutionFwdAlgoWinograd:ConvBinWinogradRxSf2x3g1,0.093759,0,miopenConvolutionFwdAlgoWinograd,<unused>
288-35-35-1x1-64-35-35-1-0x0-1x1-1x1-0-NCHW-FP32-F=miopenConvolutionFwdAlgoDirect:ConvAsm1x1U,0.0224,0,miopenConvolutionFwdAlgoDirect,<unused>;miopenConvolutionFwdAlgoGEMM:gemm,0.08368,0,rocBlas,<unused>;miopenConvolutionFwdAlgoWinograd:ConvBinWinogradRxSf2x3g1,0.093439,0,miopenConvolutionFwdAlgoWinograd,<unused>
288-35-35-3x3-384-17-17-1-0x0-2x2-1x1-0-NCHW-FP32-F=miopenConvolutionFwdAlgoDirect:ConvOclDirectFwd,1.22127,0,miopenConvolutionFwdAlgoDirect,<unused>;miopenConvolutionFwdAlgoGEMM:gemm,0.131359,2996352,rocBlas,<unused>;miopenConvolutionFwdAlgoWinograd:ConvBinWinogradRxSf2x3g1,0.313438,0,miopenConvolutionFwdAlgoWinograd,<unused>
96-35-35-3x3-96-17-17-1-0x0-2x2-1x1-0-NCHW-FP32-F=miopenConvolutionFwdAlgoDirect:ConvOclDirectFwd,0.310079,0,miopenConvolutionFwdAlgoDirect,<unused>;miopenConvolutionFwdAlgoGEMM:gemm,0.067039,998784,rocBlas,<unused>;miopenConvolutionFwdAlgoWinograd:ConvBinWinogradRxSf2x3g1,0.12096,0,miopenConvolutionFwdAlgoWinograd,<unused>
768-17-17-1x1-256-17-17-1-0x0-1x1-1x1-0-NCHW-FP32-F=miopenConvolutionFwdAlgoDirect:ConvAsm1x1U,0.03856,0,miopenConvolutionFwdAlgoDirect,<unused>;miopenConvolutionFwdAlgoGEMM:gemm,0.178399,0,rocBlas,<unused>;miopenConvolutionFwdAlgoWinograd:ConvBinWinogradRxSf2x3g1,0.211199,0,miopenConvolutionFwdAlgoWinograd,<unused>
768-17-17-1x1-192-17-17-1-0x0-1x1-1x1-0-NCHW-FP32-F=miopenConvolutionFwdAlgoDirect:ConvAsm1x1U,0.03648,0,miopenConvolutionFwdAlgoDirect,<unused>;miopenConvolutionFwdAlgoGEMM:gemm,0.179199,0,rocBlas,<unused>;miopenConvolutionFwdAlgoWinograd:ConvBinWinogradRxSf2x3g1,0.213599,0,miopenConvolutionFwdAlgoWinograd,<unused>
128-17-17-1x7-128-17-17-1-0x3-1x1-1x1-0-NCHW-FP32-F=miopenConvolutionFwdAlgoWinograd:ConvBinWinogradRxSf2x3g1,0.148159,0,miopenConvolutionFwdAlgoWinograd,<unused>;miopenConvolutionFwdAlgoGEMM:gemm,0.06992,1035776,rocBlas,<unused>
128-17-17-7x1-192-17-17-1-3x0-1x1-1x1-0-NCHW-FP32-F=miopenConvolutionFwdAlgoWinograd:ConvBinWinogradRxSf2x3g1,0.118399,0,miopenConvolutionFwdAlgoWinograd,<unused>;miopenConvolutionFwdAlgoGEMM:gemm,0.068,1035776,rocBlas,<unused>
128-17-17-7x1-128-17-17-1-3x0-1x1-1x1-0-NCHW-FP32-F=miopenConvolutionFwdAlgoWinograd:ConvBinWinogradRxSf2x3g1,0.118879,0,miopenConvolutionFwdAlgoWinograd,<unused>;miopenConvolutionFwdAlgoGEMM:gemm,0.0632,1035776,rocBlas,<unused>
128-17-17-1x7-192-17-17-1-0x3-1x1-1x1-0-NCHW-FP32-F=miopenConvolutionFwdAlgoWinograd:ConvBinWinogradRxSf2x3g1,0.147999,0,miopenConvolutionFwdAlgoWinograd,<unused>;miopenConvolutionFwdAlgoGEMM:gemm,0.05824,1035776,rocBlas,<unused>
768-17-17-1x1-320-17-17-1-0x0-1x1-1x1-0-NCHW-FP32-F=miopenConvolutionFwdAlgoDirect:ConvOclDirectFwd1x1,0.04176,0,miopenConvolutionFwdAlgoDirect,<unused>;miopenConvolutionFwdAlgoGEMM:gemm,0.168319,0,rocBlas,<unused>;miopenConvolutionFwdAlgoWinograd:ConvBinWinogradRxSf2x3g1,0.211359,0,miopenConvolutionFwdAlgoWinograd,<unused>
160-17-17-1x7-160-17-17-1-0x3-1x1-1x1-0-NCHW-FP32-F=miopenConvolutionFwdAlgoWinograd:ConvBinWinogradRxSf2x3g1,0.179359,0,miopenConvolutionFwdAlgoWinograd,<unused>;miopenConvolutionFwdAlgoGEMM:gemm,0.07152,1294720,rocBlas,<unused>
160-17-17-7x1-192-17-17-1-3x0-1x1-1x1-0-NCHW-FP32-F=miopenConvolutionFwdAlgoWinograd:ConvBinWinogradRxSf2x3g1,0.142399,0,miopenConvolutionFwdAlgoWinograd,<unused>;miopenConvolutionFwdAlgoGEMM:gemm,0.070079,1294720,rocBlas,<unused>
160-17-17-7x1-160-17-17-1-3x0-1x1-1x1-0-NCHW-FP32-F=miopenConvolutionFwdAlgoWinograd:ConvBinWinogradRxSf2x3g1,0.14192,0,miopenConvolutionFwdAlgoWinograd,<unused>;miopenConvolutionFwdAlgoGEMM:gemm,0.06784,1294720,rocBlas,<unused>
160-17-17-1x7-192-17-17-1-0x3-1x1-1x1-0-NCHW-FP32-F=miopenConvolutionFwdAlgoWinograd:ConvBinWinogradRxSf2x3g1,0.179519,0,miopenConvolutionFwdAlgoWinograd,<unused>;miopenConvolutionFwdAlgoGEMM:gemm,0.06896,1294720,rocBlas,<unused>
768-17-17-1x1-576-17-17-1-0x0-1x1-1x1-0-NCHW-FP32-F=miopenConvolutionFwdAlgoDirect:ConvAsm1x1U,0.07392,0,miopenConvolutionFwdAlgoDirect,<unused>;miopenConvolutionFwdAlgoGEMM:gemm,0.0704,0,rocBlas,<unused>;miopenConvolutionFwdAlgoWinograd:ConvBinWinogradRxSf2x3g1,0.211839,0,miopenConvolutionFwdAlgoWinograd,<unused>
192-17-17-1x7-192-17-17-1-0x3-1x1-1x1-0-NCHW-FP32-F=miopenConvolutionFwdAlgoWinograd:ConvBinWinogradRxSf2x3g1,0.209599,0,miopenConvolutionFwdAlgoWinograd,<unused>;miopenConvolutionFwdAlgoGEMM:gemm,0.074239,1553664,rocBlas,<unused>
192-17-17-7x1-192-17-17-1-3x0-1x1-1x1-0-NCHW-FP32-F=miopenConvolutionFwdAlgoWinograd:ConvBinWinogradRxSf2x3g1,0.164479,0,miopenConvolutionFwdAlgoWinograd,<unused>;miopenConvolutionFwdAlgoGEMM:gemm,0.07664,1553664,rocBlas,<unused>
768-17-17-1x1-384-17-17-1-0x0-1x1-1x1-0-NCHW-FP32-F=miopenConvolutionFwdAlgoDirect:ConvAsm1x1U,0.05072,0,miopenConvolutionFwdAlgoDirect,<unused>;miopenConvolutionFwdAlgoGEMM:gemm,0.171839,0,rocBlas,<unused>;miopenConvolutionFwdAlgoWinograd:ConvBinWinogradRxSf2x3g1,0.210879,0,miopenConvolutionFwdAlgoWinograd,<unused>
192-17-17-3x3-320-8-8-1-0x0-2x2-1x1-0-NCHW-FP32-F=miopenConvolutionFwdAlgoImplicitGEMM:ConvHipImplicitGemmV4R4Fwd,0.234559,0,miopenConvolutionFwdAlgoImplicitGEMM,<unused>;miopenConvolutionFwdAlgoDirect:ConvOclDirectFwd,0.539358,0,miopenConvolutionFwdAlgoDirect,<unused>;miopenConvolutionFwdAlgoGEMM:gemm,0.088479,442368,rocBlas,<unused>;miopenConvolutionFwdAlgoWinograd:ConvBinWinogradRxSf2x3g1,0.217759,0,miopenConvolutionFwdAlgoWinograd,<unused>
192-17-17-3x3-192-8-8-1-0x0-2x2-1x1-0-NCHW-FP32-F=miopenConvolutionFwdAlgoImplicitGEMM:ConvHipImplicitGemmV4R4Fwd,0.235999,0,miopenConvolutionFwdAlgoImplicitGEMM,<unused>;miopenConvolutionFwdAlgoDirect:ConvOclDirectFwd,0.532638,0,miopenConvolutionFwdAlgoDirect,<unused>;miopenConvolutionFwdAlgoGEMM:gemm,0.10736,442368,rocBlas,<unused>;miopenConvolutionFwdAlgoWinograd:ConvBinWinogradRxSf2x3g1,0.219679,0,miopenConvolutionFwdAlgoWinograd,<unused>
1280-8-8-1x1-320-8-8-1-0x0-1x1-1x1-0-NCHW-FP32-F=miopenConvolutionFwdAlgoImplicitGEMM:ConvHipImplicitGemmV4R4Fwd,0.1568,0,miopenConvolutionFwdAlgoImplicitGEMM,<unused>;miopenConvolutionFwdAlgoDirect:ConvOclDirectFwd1x1,0.05088,0,miopenConvolutionFwdAlgoDirect,<unused>;miopenConvolutionFwdAlgoGEMM:gemm,0.06864,0,rocBlas,<unused>;miopenConvolutionFwdAlgoWinograd:ConvBinWinogradRxSf2x3g1,0.336478,0,miopenConvolutionFwdAlgoWinograd,<unused>
1280-8-8-1x1-384-8-8-1-0x0-1x1-1x1-0-NCHW-FP32-F=miopenConvolutionFwdAlgoImplicitGEMM:ConvHipImplicitGemmV4R4Fwd,0.15664,0,miopenConvolutionFwdAlgoImplicitGEMM,<unused>;miopenConvolutionFwdAlgoDirect:ConvAsm1x1U,0.05392,0,miopenConvolutionFwdAlgoDirect,<unused>;miopenConvolutionFwdAlgoGEMM:gemm,0.0624,0,rocBlas,<unused>;miopenConvolutionFwdAlgoWinograd:ConvBinWinogradRxSf2x3g1,0.335359,0,miopenConvolutionFwdAlgoWinograd,<unused>
384-8-8-1x3-384-8-8-1-0x1-1x1-1x1-0-NCHW-FP32-F=miopenConvolutionFwdAlgoImplicitGEMM:ConvHipImplicitGemmV4R4Fwd,0.18064,0,miopenConvolutionFwdAlgoImplicitGEMM,<unused>;miopenConvolutionFwdAlgoGEMM:gemm,0.0712,294912,rocBlas,<unused>;miopenConvolutionFwdAlgoWinograd:ConvBinWinogradRxSf2x3g1,0.115999,0,miopenConvolutionFwdAlgoWinograd,<unused>
384-8-8-3x1-384-8-8-1-1x0-1x1-1x1-0-NCHW-FP32-F=miopenConvolutionFwdAlgoImplicitGEMM:ConvHipImplicitGemmV4R4Fwd,0.17888,0,miopenConvolutionFwdAlgoImplicitGEMM,<unused>;miopenConvolutionFwdAlgoGEMM:gemm,0.07168,294912,rocBlas,<unused>;miopenConvolutionFwdAlgoWinograd:ConvBinWinogradRxSf2x3g1,0.118399,0,miopenConvolutionFwdAlgoWinograd,<unused>
1280-8-8-1x1-448-8-8-1-0x0-1x1-1x1-0-NCHW-FP32-F=miopenConvolutionFwdAlgoImplicitGEMM:ConvHipImplicitGemmV4R4Fwd,0.15728,0,miopenConvolutionFwdAlgoImplicitGEMM,<unused>;miopenConvolutionFwdAlgoDirect:ConvAsm1x1U,0.05456,0,miopenConvolutionFwdAlgoDirect,<unused>;miopenConvolutionFwdAlgoGEMM:gemm,0.064639,0,rocBlas,<unused>;miopenConvolutionFwdAlgoWinograd:ConvBinWinogradRxSf2x3g1,0.335519,0,miopenConvolutionFwdAlgoWinograd,<unused>
448-8-8-3x3-384-8-8-1-1x1-1x1-1x1-0-NCHW-FP32-F=miopenConvolutionFwdAlgoWinograd:ConvBinWinogradRxSf2x3g1,0.13712,0,miopenConvolutionFwdAlgoWinograd,<unused>
1280-8-8-1x1-192-8-8-1-0x0-1x1-1x1-0-NCHW-FP32-F=miopenConvolutionFwdAlgoImplicitGEMM:ConvHipImplicitGemmV4R4Fwd,0.1576,0,miopenConvolutionFwdAlgoImplicitGEMM,<unused>;miopenConvolutionFwdAlgoDirect:ConvOclDirectFwd1x1,0.04352,0,miopenConvolutionFwdAlgoDirect,<unused>;miopenConvolutionFwdAlgoGEMM:gemm,0.07328,0,rocBlas,<unused>;miopenConvolutionFwdAlgoWinograd:ConvBinWinogradRxSf2x3g1,0.337599,0,miopenConvolutionFwdAlgoWinograd,<unused>
2048-8-8-1x1-320-8-8-1-0x0-1x1-1x1-0-NCHW-FP32-F=miopenConvolutionFwdAlgoImplicitGEMM:ConvHipImplicitGemmV4R4Fwd,0.226879,0,miopenConvolutionFwdAlgoImplicitGEMM,<unused>;miopenConvolutionFwdAlgoDirect:ConvOclDirectFwd1x1,0.07616,0,miopenConvolutionFwdAlgoDirect,<unused>;miopenConvolutionFwdAlgoGEMM:gemm,0.09952,0,rocBlas,<unused>;miopenConvolutionFwdAlgoWinograd:ConvBinWinogradRxSf2x3g1,0.523998,0,miopenConvolutionFwdAlgoWinograd,<unused>
2048-8-8-1x1-384-8-8-1-0x0-1x1-1x1-0-NCHW-FP32-F=miopenConvolutionFwdAlgoImplicitGEMM:ConvHipImplicitGemmV4R4Fwd,0.225599,0,miopenConvolutionFwdAlgoImplicitGEMM,<unused>;miopenConvolutionFwdAlgoDirect:ConvOclDirectFwd1x1,0.05824,0,miopenConvolutionFwdAlgoDirect,<unused>;miopenConvolutionFwdAlgoGEMM:gemm,0.10624,0,rocBlas,<unused>;miopenConvolutionFwdAlgoWinograd:ConvBinWinogradRxSf2x3g1,0.523358,0,miopenConvolutionFwdAlgoWinograd,<unused>
2048-8-8-1x1-448-8-8-1-0x0-1x1-1x1-0-NCHW-FP32-F=miopenConvolutionFwdAlgoImplicitGEMM:ConvHipImplicitGemmV4R4Fwd,0.227199,0,miopenConvolutionFwdAlgoImplicitGEMM,<unused>;miopenConvolutionFwdAlgoDirect:ConvOclDirectFwd1x1,0.06432,0,miopenConvolutionFwdAlgoDirect,<unused>;miopenConvolutionFwdAlgoGEMM:gemm,0.10112,0,rocBlas,<unused>;miopenConvolutionFwdAlgoWinograd:ConvBinWinogradRxSf2x3g1,0.531198,0,miopenConvolutionFwdAlgoWinograd,<unused>
2048-8-8-1x1-192-8-8-1-0x0-1x1-1x1-0-NCHW-FP32-F=miopenConvolutionFwdAlgoImplicitGEMM:ConvHipImplicitGemmV4R4Fwd,0.244639,0,miopenConvolutionFwdAlgoImplicitGEMM,<unused>;miopenConvolutionFwdAlgoDirect:ConvOclDirectFwd1x1,0.04288,0,miopenConvolutionFwdAlgoDirect,<unused>;miopenConvolutionFwdAlgoGEMM:gemm,0.08848,0,rocBlas,<unused>;miopenConvolutionFwdAlgoWinograd:ConvBinWinogradRxSf2x3g1,0.526398,0,miopenConvolutionFwdAlgoWinograd,<unused>
64-56-56-1x1-128-56-56-1-0x0-1x1-1x1-0-NCHW-FP32-F=miopenConvolutionFwdAlgoImplicitGEMM:ConvHipImplicitGemmV4R4Fwd,0.01856,0,miopenConvolutionFwdAlgoImplicitGEMM,<unused>;miopenConvolutionFwdAlgoDirect:ConvAsm1x1U,0.01696,0,miopenConvolutionFwdAlgoDirect,<unused>;miopenConvolutionFwdAlgoGEMM:gemm,0.03168,0,rocBlas,<unused>;miopenConvolutionFwdAlgoWinograd:ConvBinWinogradRxSf3x2,0.0528,0,miopenConvolutionFwdAlgoWinograd,<unused>
128-56-56-3x3-32-56-56-1-1x1-1x1-1x1-0-NCHW-FP32-F=miopenConvolutionFwdAlgoWinograd:ConvBinWinogradRxSf2x3g1,0.05584,0,miopenConvolutionFwdAlgoWinograd,<unused>
96-56-56-1x1-128-56-56-1-0x0-1x1-1x1-0-NCHW-FP32-F=miopenConvolutionFwdAlgoImplicitGEMM:ConvHipImplicitGemmV4R4Fwd,0.02784,0,miopenConvolutionFwdAlgoImplicitGEMM,<unused>;miopenConvolutionFwdAlgoDirect:ConvAsm1x1U,0.01984,0,miopenConvolutionFwdAlgoDirect,<unused>;miopenConvolutionFwdAlgoGEMM:gemm,0.03456,0,rocBlas,<unused>;miopenConvolutionFwdAlgoWinograd:ConvBinWinogradRxSf3x2,0.063039,0,miopenConvolutionFwdAlgoWinograd,<unused>
128-56-56-1x1-128-56-56-1-0x0-1x1-1x1-0-NCHW-FP32-F=miopenConvolutionFwdAlgoImplicitGEMM:ConvHipImplicitGemmV4R4Fwd,0.0312,0,miopenConvolutionFwdAlgoImplicitGEMM,<unused>;miopenConvolutionFwdAlgoDirect:ConvAsm1x1U,0.02576,0,miopenConvolutionFwdAlgoDirect,<unused>;miopenConvolutionFwdAlgoGEMM:gemm,0.04144,0,rocBlas,<unused>;miopenConvolutionFwdAlgoWinograd:ConvBinWinogradRxSf3x2,0.07536,0,miopenConvolutionFwdAlgoWinograd,<unused>
160-56-56-1x1-128-56-56-1-0x0-1x1-1x1-0-NCHW-FP32-F=miopenConvolutionFwdAlgoImplicitGEMM:ConvHipImplicitGemmV4R4Fwd,0.0312,0,miopenConvolutionFwdAlgoImplicitGEMM,<unused>;miopenConvolutionFwdAlgoDirect:ConvAsm1x1U,0.02864,0,miopenConvolutionFwdAlgoDirect,<unused>;miopenConvolutionFwdAlgoGEMM:gemm,0.05264,0,rocBlas,<unused>;miopenConvolutionFwdAlgoWinograd:ConvBinWinogradRxSf3x2,0.084799,0,miopenConvolutionFwdAlgoWinograd,<unused>
192-56-56-1x1-128-56-56-1-0x0-1x1-1x1-0-NCHW-FP32-F=miopenConvolutionFwdAlgoImplicitGEMM:ConvHipImplicitGemmV4R4Fwd,0.0376,0,miopenConvolutionFwdAlgoImplicitGEMM,<unused>;miopenConvolutionFwdAlgoDirect:ConvAsm1x1U,0.03248,0,miopenConvolutionFwdAlgoDirect,<unused>;miopenConvolutionFwdAlgoGEMM:gemm,0.06,0,rocBlas,<unused>;miopenConvolutionFwdAlgoWinograd:ConvBinWinogradRxSf3x2,0.097439,0,miopenConvolutionFwdAlgoWinograd,<unused>
224-56-56-1x1-128-56-56-1-0x0-1x1-1x1-0-NCHW-FP32-F=miopenConvolutionFwdAlgoImplicitGEMM:ConvHipImplicitGemmV4R4Fwd,0.03936,0,miopenConvolutionFwdAlgoImplicitGEMM,<unused>;miopenConvolutionFwdAlgoDirect:ConvAsm1x1U,0.03696,0,miopenConvolutionFwdAlgoDirect,<unused>;miopenConvolutionFwdAlgoGEMM:gemm,0.06128,0,rocBlas,<unused>;miopenConvolutionFwdAlgoWinograd:ConvBinWinogradRxSf3x2,0.10752,0,miopenConvolutionFwdAlgoWinograd,<unused>
128-28-28-1x1-128-28-28-1-0x0-1x1-1x1-0-NCHW-FP32-F=miopenConvolutionFwdAlgoDirect:ConvAsm1x1U,0.01408,0,miopenConvolutionFwdAlgoDirect,<unused>;miopenConvolutionFwdAlgoGEMM:gemm,0.04432,0,rocBlas,<unused>;miopenConvolutionFwdAlgoWinograd:ConvBinWinogradRxSf2x3g1,0.05456,0,miopenConvolutionFwdAlgoWinograd,<unused>
128-28-28-3x3-32-28-28-1-1x1-1x1-1x1-0-NCHW-FP32-F=miopenConvolutionFwdAlgoWinograd:ConvBinWinogradRxSf2x3g1,0.05584,0,miopenConvolutionFwdAlgoWinograd,<unused>
160-28-28-1x1-128-28-28-1-0x0-1x1-1x1-0-NCHW-FP32-F=miopenConvolutionFwdAlgoDirect:ConvAsm1x1U,0.016,0,miopenConvolutionFwdAlgoDirect,<unused>;miopenConvolutionFwdAlgoGEMM:gemm,0.04736,0,rocBlas,<unused>;miopenConvolutionFwdAlgoWinograd:ConvBinWinogradRxSf2x3g1,0.0624,0,miopenConvolutionFwdAlgoWinograd,<unused>
192-28-28-1x1-128-28-28-1-0x0-1x1-1x1-0-NCHW-FP32-F=miopenConvolutionFwdAlgoDirect:ConvAsm1x1U,0.01632,0,miopenConvolutionFwdAlgoDirect,<unused>;miopenConvolutionFwdAlgoGEMM:gemm,0.056,0,rocBlas,<unused>;miopenConvolutionFwdAlgoWinograd:ConvBinWinogradRxSf2x3g1,0.0704,0,miopenConvolutionFwdAlgoWinograd,<unused>
224-28-28-1x1-128-28-28-1-0x0-1x1-1x1-0-NCHW-FP32-F=miopenConvolutionFwdAlgoDirect:ConvAsm1x1U,0.01648,0,miopenConvolutionFwdAlgoDirect,<unused>;miopenConvolutionFwdAlgoGEMM:gemm,0.07872,0,rocBlas,<unused>;miopenConvolutionFwdAlgoWinograd:ConvBinWinogradRxSf2x3g1,0.07856,0,miopenConvolutionFwdAlgoWinograd,<unused>
256-28-28-1x1-128-28-28-1-0x0-1x1-1x1-0-NCHW-FP32-F=miopenConvolutionFwdAlgoDirect:ConvAsm1x1U,0.0248,0,miopenConvolutionFwdAlgoDirect,<unused>;miopenConvolutionFwdAlgoGEMM:gemm,0.082559,0,rocBlas,<unused>;miopenConvolutionFwdAlgoWinograd:ConvBinWinogradRxSf2x3g1,0.0864,0,miopenConvolutionFwdAlgoWinograd,<unused>
288-28-28-1x1-128-28-28-1-0x0-1x1-1x1-0-NCHW-FP32-F=miopenConvolutionFwdAlgoDirect:ConvAsm1x1U,0.01936,0,miopenConvolutionFwdAlgoDirect,<unused>;miopenConvolutionFwdAlgoGEMM:gemm,0.08496,0,rocBlas,<unused>;miopenConvolutionFwdAlgoWinograd:ConvBinWinogradRxSf2x3g1,0.0968,0,miopenConvolutionFwdAlgoWinograd,<unused>
320-28-28-1x1-128-28-28-1-0x0-1x1-1x1-0-NCHW-FP32-F=miopenConvolutionFwdAlgoDirect:ConvAsm1x1U,0.0216,0,miopenConvolutionFwdAlgoDirect,<unused>;miopenConvolutionFwdAlgoGEMM:gemm,0.09344,0,rocBlas,<unused>;miopenConvolutionFwdAlgoWinograd:ConvBinWinogradRxSf2x3g1,0.10256,0,miopenConvolutionFwdAlgoWinograd,<unused>
352-28-28-1x1-128-28-28-1-0x0-1x1-1x1-0-NCHW-FP32-F=miopenConvolutionFwdAlgoDirect:ConvAsm1x1U,0.02608,0,miopenConvolutionFwdAlgoDirect,<unused>;miopenConvolutionFwdAlgoGEMM:gemm,0.10032,0,rocBlas,<unused>;miopenConvolutionFwdAlgoWinograd:ConvBinWinogradRxSf2x3g1,0.109759,0,miopenConvolutionFwdAlgoWinograd,<unused>
384-28-28-1x1-128-28-28-1-0x0-1x1-1x1-0-NCHW-FP32-F=miopenConvolutionFwdAlgoDirect:ConvAsm1x1U,0.02432,0,miopenConvolutionFwdAlgoDirect,<unused>;miopenConvolutionFwdAlgoGEMM:gemm,0.04976,0,rocBlas,<unused>;miopenConvolutionFwdAlgoWinograd:ConvBinWinogradRxSf2x3g1,0.11776,0,miopenConvolutionFwdAlgoWinograd,<unused>
416-28-28-1x1-128-28-28-1-0x0-1x1-1x1-0-NCHW-FP32-F=miopenConvolutionFwdAlgoDirect:ConvAsm1x1U,0.02864,0,miopenConvolutionFwdAlgoDirect,<unused>;miopenConvolutionFwdAlgoGEMM:gemm,0.10112,0,rocBlas,<unused>;miopenConvolutionFwdAlgoWinograd:ConvBinWinogradRxSf2x3g1,0.1256,0,miopenConvolutionFwdAlgoWinograd,<unused>
448-28-28-1x1-128-28-28-1-0x0-1x1-1x1-0-NCHW-FP32-F=miopenConvolutionFwdAlgoDirect:ConvOclDirectFwd1x1,0.03296,0,miopenConvolutionFwdAlgoDirect,<unused>;miopenConvolutionFwdAlgoGEMM:gemm,0.11088,0,rocBlas,<unused>;miopenConvolutionFwdAlgoWinograd:ConvBinWinogradRxSf2x3g1,0.13216,0,miopenConvolutionFwdAlgoWinograd,<unused>
480-28-28-1x1-128-28-28-1-0x0-1x1-1x1-0-NCHW-FP32-F=miopenConvolutionFwdAlgoDirect:ConvAsm1x1U,0.0304,0,miopenConvolutionFwdAlgoDirect,<unused>;miopenConvolutionFwdAlgoGEMM:gemm,0.107359,0,rocBlas,<unused>;miopenConvolutionFwdAlgoWinograd:ConvBinWinogradRxSf2x3g1,0.141919,0,miopenConvolutionFwdAlgoWinograd,<unused>
256-14-14-1x1-128-14-14-1-0x0-1x1-1x1-0-NCHW-FP32-F=miopenConvolutionFwdAlgoDirect:ConvAsm1x1U,0.01504,0,miopenConvolutionFwdAlgoDirect,<unused>;miopenConvolutionFwdAlgoGEMM:gemm,0.04768,0,rocBlas,<unused>;miopenConvolutionFwdAlgoWinograd:ConvBinWinogradRxSf2x3g1,0.08576,0,miopenConvolutionFwdAlgoWinograd,<unused>
128-14-14-3x3-32-14-14-1-1x1-1x1-1x1-0-NCHW-FP32-F=miopenConvolutionFwdAlgoWinograd:ConvBinWinogradRxSf2x3g1,0.055679,0,miopenConvolutionFwdAlgoWinograd,<unused>
288-14-14-1x1-128-14-14-1-0x0-1x1-1x1-0-NCHW-FP32-F=miopenConvolutionFwdAlgoDirect:ConvAsm1x1U,0.0168,0,miopenConvolutionFwdAlgoDirect,<unused>;miopenConvolutionFwdAlgoGEMM:gemm,0.05152,0,rocBlas,<unused>;miopenConvolutionFwdAlgoWinograd:ConvBinWinogradRxSf2x3g1,0.09696,0,miopenConvolutionFwdAlgoWinograd,<unused>
320-14-14-1x1-128-14-14-1-0x0-1x1-1x1-0-NCHW-FP32-F=miopenConvolutionFwdAlgoDirect:ConvAsm1x1U,0.01792,0,miopenConvolutionFwdAlgoDirect,<unused>;miopenConvolutionFwdAlgoGEMM:gemm,0.049919,0,rocBlas,<unused>;miopenConvolutionFwdAlgoWinograd:ConvBinWinogradRxSf2x3g1,0.100639,0,miopenConvolutionFwdAlgoWinograd,<unused>
352-14-14-1x1-128-14-14-1-0x0-1x1-1x1-0-NCHW-FP32-F=miopenConvolutionFwdAlgoDirect:ConvAsm1x1U,0.01872,0,miopenConvolutionFwdAlgoDirect,<unused>;miopenConvolutionFwdAlgoGEMM:gemm,0.05344,0,rocBlas,<unused>;miopenConvolutionFwdAlgoWinograd:ConvBinWinogradRxSf2x3g1,0.1104,0,miopenConvolutionFwdAlgoWinograd,<unused>
384-14-14-1x1-128-14-14-1-0x0-1x1-1x1-0-NCHW-FP32-F=miopenConvolutionFwdAlgoDirect:ConvAsm1x1U,0.02016,0,miopenConvolutionFwdAlgoDirect,<unused>;miopenConvolutionFwdAlgoGEMM:gemm,0.05312,0,rocBlas,<unused>;miopenConvolutionFwdAlgoWinograd:ConvBinWinogradRxSf2x3g1,0.11904,0,miopenConvolutionFwdAlgoWinograd,<unused>
416-14-14-1x1-128-14-14-1-0x0-1x1-1x1-0-NCHW-FP32-F=miopenConvolutionFwdAlgoDirect:ConvAsm1x1U,0.02144,0,miopenConvolutionFwdAlgoDirect,<unused>;miopenConvolutionFwdAlgoGEMM:gemm,0.0544,0,rocBlas,<unused>;miopenConvolutionFwdAlgoWinograd:ConvBinWinogradRxSf2x3g1,0.125119,0,miopenConvolutionFwdAlgoWinograd,<unused>
448-14-14-1x1-128-14-14-1-0x0-1x1-1x1-0-NCHW-FP32-F=miopenConvolutionFwdAlgoDirect:ConvAsm1x1U,0.02256,0,miopenConvolutionFwdAlgoDirect,<unused>;miopenConvolutionFwdAlgoGEMM:gemm,0.04992,0,rocBlas,<unused>;miopenConvolutionFwdAlgoWinograd:ConvBinWinogradRxSf2x3g1,0.13392,0,miopenConvolutionFwdAlgoWinograd,<unused>
480-14-14-1x1-128-14-14-1-0x0-1x1-1x1-0-NCHW-FP32-F=miopenConvolutionFwdAlgoDirect:ConvAsm1x1U,0.024,0,miopenConvolutionFwdAlgoDirect,<unused>;miopenConvolutionFwdAlgoGEMM:gemm,0.05808,0,rocBlas,<unused>;miopenConvolutionFwdAlgoWinograd:ConvBinWinogradRxSf2x3g1,0.140799,0,miopenConvolutionFwdAlgoWinograd,<unused>
512-14-14-1x1-128-14-14-1-0x0-1x1-1x1-0-NCHW-FP32-F=miopenConvolutionFwdAlgoDirect:ConvAsm1x1U,0.02608,0,miopenConvolutionFwdAlgoDirect,<unused>;miopenConvolutionFwdAlgoGEMM:gemm,0.05312,0,rocBlas,<unused>;miopenConvolutionFwdAlgoWinograd:ConvBinWinogradRxSf2x3g1,0.14896,0,miopenConvolutionFwdAlgoWinograd,<unused>
544-14-14-1x1-128-14-14-1-0x0-1x1-1x1-0-NCHW-FP32-F=miopenConvolutionFwdAlgoDirect:ConvAsm1x1U,0.02672,0,miopenConvolutionFwdAlgoDirect,<unused>;miopenConvolutionFwdAlgoGEMM:gemm,0.0544,0,rocBlas,<unused>;miopenConvolutionFwdAlgoWinograd:ConvBinWinogradRxSf2x3g1,0.15728,0,miopenConvolutionFwdAlgoWinograd,<unused>
576-14-14-1x1-128-14-14-1-0x0-1x1-1x1-0-NCHW-FP32-F=miopenConvolutionFwdAlgoDirect:ConvAsm1x1U,0.02768,0,miopenConvolutionFwdAlgoDirect,<unused>;miopenConvolutionFwdAlgoGEMM:gemm,0.0496,0,rocBlas,<unused>;miopenConvolutionFwdAlgoWinograd:ConvBinWinogradRxSf2x3g1,0.16352,0,miopenConvolutionFwdAlgoWinograd,<unused>
608-14-14-1x1-128-14-14-1-0x0-1x1-1x1-0-NCHW-FP32-F=miopenConvolutionFwdAlgoDirect:ConvOclDirectFwd1x1,0.02832,0,miopenConvolutionFwdAlgoDirect,<unused>;miopenConvolutionFwdAlgoGEMM:gemm,0.04832,0,rocBlas,<unused>;miopenConvolutionFwdAlgoWinograd:ConvBinWinogradRxSf2x3g1,0.17296,0,miopenConvolutionFwdAlgoWinograd,<unused>
640-14-14-1x1-128-14-14-1-0x0-1x1-1x1-0-NCHW-FP32-F=miopenConvolutionFwdAlgoDirect:ConvAsm1x1U,0.03024,0,miopenConvolutionFwdAlgoDirect,<unused>;miopenConvolutionFwdAlgoGEMM:gemm,0.055039,0,rocBlas,<unused>;miopenConvolutionFwdAlgoWinograd:ConvBinWinogradRxSf2x3g1,0.180159,0,miopenConvolutionFwdAlgoWinograd,<unused>
672-14-14-1x1-128-14-14-1-0x0-1x1-1x1-0-NCHW-FP32-F=miopenConvolutionFwdAlgoDirect:ConvOclDirectFwd1x1,0.02976,0,miopenConvolutionFwdAlgoDirect,<unused>;miopenConvolutionFwdAlgoGEMM:gemm,0.05488,0,rocBlas,<unused>;miopenConvolutionFwdAlgoWinograd:ConvBinWinogradRxSf2x3g1,0.18896,0,miopenConvolutionFwdAlgoWinograd,<unused>
704-14-14-1x1-128-14-14-1-0x0-1x1-1x1-0-NCHW-FP32-F=miopenConvolutionFwdAlgoDirect:ConvOclDirectFwd1x1,0.03152,0,miopenConvolutionFwdAlgoDirect,<unused>;miopenConvolutionFwdAlgoGEMM:gemm,0.0504,0,rocBlas,<unused>;miopenConvolutionFwdAlgoWinograd:ConvBinWinogradRxSf2x3g1,0.1952,0,miopenConvolutionFwdAlgoWinograd,<unused>
736-14-14-1x1-128-14-14-1-0x0-1x1-1x1-0-NCHW-FP32-F=miopenConvolutionFwdAlgoDirect:ConvOclDirectFwd1x1,0.03152,0,miopenConvolutionFwdAlgoDirect,<unused>;miopenConvolutionFwdAlgoGEMM:gemm,0.05488,0,rocBlas,<unused>;miopenConvolutionFwdAlgoWinograd:ConvBinWinogradRxSf2x3g1,0.204159,0,miopenConvolutionFwdAlgoWinograd,<unused>
768-14-14-1x1-128-14-14-1-0x0-1x1-1x1-0-NCHW-FP32-F=miopenConvolutionFwdAlgoDirect:ConvOclDirectFwd1x1,0.03296,0,miopenConvolutionFwdAlgoDirect,<unused>;miopenConvolutionFwdAlgoGEMM:gemm,0.06,0,rocBlas,<unused>;miopenConvolutionFwdAlgoWinograd:ConvBinWinogradRxSf2x3g1,0.21328,0,miopenConvolutionFwdAlgoWinograd,<unused>
800-14-14-1x1-128-14-14-1-0x0-1x1-1x1-0-NCHW-FP32-F=miopenConvolutionFwdAlgoDirect:ConvOclDirectFwd1x1,0.03184,0,miopenConvolutionFwdAlgoDirect,<unused>;miopenConvolutionFwdAlgoGEMM:gemm,0.05488,0,rocBlas,<unused>;miopenConvolutionFwdAlgoWinograd:ConvBinWinogradRxSf2x3g1,0.219679,0,miopenConvolutionFwdAlgoWinograd,<unused>
832-14-14-1x1-128-14-14-1-0x0-1x1-1x1-0-NCHW-FP32-F=miopenConvolutionFwdAlgoDirect:ConvOclDirectFwd1x1,0.03328,0,miopenConvolutionFwdAlgoDirect,<unused>;miopenConvolutionFwdAlgoGEMM:gemm,0.0576,0,rocBlas,<unused>;miopenConvolutionFwdAlgoWinograd:ConvBinWinogradRxSf2x3g1,0.226399,0,miopenConvolutionFwdAlgoWinograd,<unused>
864-14-14-1x1-128-14-14-1-0x0-1x1-1x1-0-NCHW-FP32-F=miopenConvolutionFwdAlgoDirect:ConvOclDirectFwd1x1,0.03328,0,miopenConvolutionFwdAlgoDirect,<unused>;miopenConvolutionFwdAlgoGEMM:gemm,0.05728,0,rocBlas,<unused>;miopenConvolutionFwdAlgoWinograd:ConvBinWinogradRxSf2x3g1,0.23504,0,miopenConvolutionFwdAlgoWinograd,<unused>
896-14-14-1x1-128-14-14-1-0x0-1x1-1x1-0-NCHW-FP32-F=miopenConvolutionFwdAlgoDirect:ConvOclDirectFwd1x1,0.0344,0,miopenConvolutionFwdAlgoDirect,<unused>;miopenConvolutionFwdAlgoGEMM:gemm,0.05824,0,rocBlas,<unused>;miopenConvolutionFwdAlgoWinograd:ConvBinWinogradRxSf2x3g1,0.241279,0,miopenConvolutionFwdAlgoWinograd,<unused>
928-14-14-1x1-128-14-14-1-0x0-1x1-1x1-0-NCHW-FP32-F=miopenConvolutionFwdAlgoDirect:ConvOclDirectFwd1x1,0.03424,0,miopenConvolutionFwdAlgoDirect,<unused>;miopenConvolutionFwdAlgoGEMM:gemm,0.05824,0,rocBlas,<unused>;miopenConvolutionFwdAlgoWinograd:ConvBinWinogradRxSf2x3g1,0.251999,0,miopenConvolutionFwdAlgoWinograd,<unused>
960-14-14-1x1-128-14-14-1-0x0-1x1-1x1-0-NCHW-FP32-F=miopenConvolutionFwdAlgoDirect:ConvOclDirectFwd1x1,0.036,0,miopenConvolutionFwdAlgoDirect,<unused>;miopenConvolutionFwdAlgoGEMM:gemm,0.06224,0,rocBlas,<unused>;miopenConvolutionFwdAlgoWinograd:ConvBinWinogradRxSf2x3g1,0.253919,0,miopenConvolutionFwdAlgoWinograd,<unused>
992-14-14-1x1-128-14-14-1-0x0-1x1-1x1-0-NCHW-FP32-F=miopenConvolutionFwdAlgoDirect:ConvOclDirectFwd1x1,0.0368,0,miopenConvolutionFwdAlgoDirect,<unused>;miopenConvolutionFwdAlgoGEMM:gemm,0.06176,0,rocBlas,<unused>;miopenConvolutionFwdAlgoWinograd:ConvBinWinogradRxSf2x3g1,0.267359,0,miopenConvolutionFwdAlgoWinograd,<unused>
512-7-7-1x1-128-7-7-1-0x0-1x1-1x1-0-NCHW-FP32-F=miopenConvolutionFwdAlgoDirect:ConvAsm1x1U,0.02464,0,miopenConvolutionFwdAlgoDirect,<unused>;miopenConvolutionFwdAlgoGEMM:gemm,0.08992,0,rocBlas,<unused>;miopenConvolutionFwdAlgoWinograd:ConvBinWinogradRxSf2x3g1,0.14912,0,miopenConvolutionFwdAlgoWinograd,<unused>
128-7-7-3x3-32-7-7-1-1x1-1x1-1x1-0-NCHW-FP32-F=miopenConvolutionFwdAlgoWinograd:ConvBinWinogradRxSf2x3g1,0.055999,0,miopenConvolutionFwdAlgoWinograd,<unused>
544-7-7-1x1-128-7-7-1-0x0-1x1-1x1-0-NCHW-FP32-F=miopenConvolutionFwdAlgoDirect:ConvAsm1x1U,0.02592,0,miopenConvolutionFwdAlgoDirect,<unused>;miopenConvolutionFwdAlgoGEMM:gemm,0.10976,0,rocBlas,<unused>;miopenConvolutionFwdAlgoWinograd:ConvBinWinogradRxSf2x3g1,0.15712,0,miopenConvolutionFwdAlgoWinograd,<unused>
576-7-7-1x1-128-7-7-1-0x0-1x1-1x1-0-NCHW-FP32-F=miopenConvolutionFwdAlgoDirect:ConvAsm1x1U,0.02672,0,miopenConvolutionFwdAlgoDirect,<unused>;miopenConvolutionFwdAlgoGEMM:gemm,0.10176,0,rocBlas,<unused>;miopenConvolutionFwdAlgoWinograd:ConvBinWinogradRxSf2x3g1,0.163519,0,miopenConvolutionFwdAlgoWinograd,<unused>
608-7-7-1x1-128-7-7-1-0x0-1x1-1x1-0-NCHW-FP32-F=miopenConvolutionFwdAlgoDirect:ConvOclDirectFwd1x1,0.02736,0,miopenConvolutionFwdAlgoDirect,<unused>;miopenConvolutionFwdAlgoGEMM:gemm,0.11936,0,rocBlas,<unused>;miopenConvolutionFwdAlgoWinograd:ConvBinWinogradRxSf2x3g1,0.173119,0,miopenConvolutionFwdAlgoWinograd,<unused>
640-7-7-1x1-128-7-7-1-0x0-1x1-1x1-0-NCHW-FP32-F=miopenConvolutionFwdAlgoDirect:ConvAsm1x1U,0.0296,0,miopenConvolutionFwdAlgoDirect,<unused>;miopenConvolutionFwdAlgoGEMM:gemm,0.108,0,rocBlas,<unused>;miopenConvolutionFwdAlgoWinograd:ConvBinWinogradRxSf2x3g1,0.181119,0,miopenConvolutionFwdAlgoWinograd,<unused>
672-7-7-1x1-128-7-7-1-0x0-1x1-1x1-0-NCHW-FP32-F=miopenConvolutionFwdAlgoDirect:ConvOclDirectFwd1x1,0.02864,0,miopenConvolutionFwdAlgoDirect,<unused>;miopenConvolutionFwdAlgoGEMM:gemm,0.12096,0,rocBlas,<unused>;miopenConvolutionFwdAlgoWinograd:ConvBinWinogradRxSf2x3g1,0.191039,0,miopenConvolutionFwdAlgoWinograd,<unused>
704-7-7-1x1-128-7-7-1-0x0-1x1-1x1-0-NCHW-FP32-F=miopenConvolutionFwdAlgoDirect:ConvAsm1x1U,0.032,0,miopenConvolutionFwdAlgoDirect,<unused>;miopenConvolutionFwdAlgoGEMM:gemm,0.12704,0,rocBlas,<unused>;miopenConvolutionFwdAlgoWinograd:ConvBinWinogradRxSf2x3g1,0.19648,0,miopenConvolutionFwdAlgoWinograd,<unused>
736-7-7-1x1-128-7-7-1-0x0-1x1-1x1-0-NCHW-FP32-F=miopenConvolutionFwdAlgoDirect:ConvOclDirectFwd1x1,0.02864,0,miopenConvolutionFwdAlgoDirect,<unused>;miopenConvolutionFwdAlgoGEMM:gemm,0.087999,0,rocBlas,<unused>;miopenConvolutionFwdAlgoWinograd:ConvBinWinogradRxSf2x3g1,0.204319,0,miopenConvolutionFwdAlgoWinograd,<unused>
768-7-7-1x1-128-7-7-1-0x0-1x1-1x1-0-NCHW-FP32-F=miopenConvolutionFwdAlgoDirect:ConvOclDirectFwd1x1,0.03328,0,miopenConvolutionFwdAlgoDirect,<unused>;miopenConvolutionFwdAlgoGEMM:gemm,0.103999,0,rocBlas,<unused>;miopenConvolutionFwdAlgoWinograd:ConvBinWinogradRxSf2x3g1,0.210879,0,miopenConvolutionFwdAlgoWinograd,<unused>
800-7-7-1x1-128-7-7-1-0x0-1x1-1x1-0-NCHW-FP32-F=miopenConvolutionFwdAlgoDirect:ConvOclDirectFwd1x1,0.02896,0,miopenConvolutionFwdAlgoDirect,<unused>;miopenConvolutionFwdAlgoGEMM:gemm,0.09728,0,rocBlas,<unused>;miopenConvolutionFwdAlgoWinograd:ConvBinWinogradRxSf2x3g1,0.220479,0,miopenConvolutionFwdAlgoWinograd,<unused>
832-7-7-1x1-128-7-7-1-0x0-1x1-1x1-0-NCHW-FP32-F=miopenConvolutionFwdAlgoDirect:ConvOclDirectFwd1x1,0.03456,0,miopenConvolutionFwdAlgoDirect,<unused>;miopenConvolutionFwdAlgoGEMM:gemm,0.109119,0,rocBlas,<unused>;miopenConvolutionFwdAlgoWinograd:ConvBinWinogradRxSf2x3g1,0.227999,0,miopenConvolutionFwdAlgoWinograd,<unused>
864-7-7-1x1-128-7-7-1-0x0-1x1-1x1-0-NCHW-FP32-F=miopenConvolutionFwdAlgoDirect:ConvOclDirectFwd1x1,0.02976,0,miopenConvolutionFwdAlgoDirect,<unused>;miopenConvolutionFwdAlgoGEMM:gemm,0.1168,0,rocBlas,<unused>;miopenConvolutionFwdAlgoWinograd:ConvBinWinogradRxSf2x3g1,0.235679,0,miopenConvolutionFwdAlgoWinograd,<unused>
896-7-7-1x1-128-7-7-1-0x0-1x1-1x1-0-NCHW-FP32-F=miopenConvolutionFwdAlgoDirect:ConvOclDirectFwd1x1,0.03472,0,miopenConvolutionFwdAlgoDirect,<unused>;miopenConvolutionFwdAlgoGEMM:gemm,0.10624,0,rocBlas,<unused>;miopenConvolutionFwdAlgoWinograd:ConvBinWinogradRxSf2x3g1,0.243199,0,miopenConvolutionFwdAlgoWinograd,<unused>
928-7-7-1x1-128-7-7-1-0x0-1x1-1x1-0-NCHW-FP32-F=miopenConvolutionFwdAlgoDirect:ConvOclDirectFwd1x1,0.03024,0,miopenConvolutionFwdAlgoDirect,<unused>;miopenConvolutionFwdAlgoGEMM:gemm,0.102559,0,rocBlas,<unused>;miopenConvolutionFwdAlgoWinograd:ConvBinWinogradRxSf2x3g1,0.259679,0,miopenConvolutionFwdAlgoWinograd,<unused>
960-7-7-1x1-128-7-7-1-0x0-1x1-1x1-0-NCHW-FP32-F=miopenConvolutionFwdAlgoDirect:ConvOclDirectFwd1x1,0.03504,0,miopenConvolutionFwdAlgoDirect,<unused>;miopenConvolutionFwdAlgoGEMM:gemm,0.100159,0,rocBlas,<unused>;miopenConvolutionFwdAlgoWinograd:ConvBinWinogradRxSf2x3g1,0.25664,0,miopenConvolutionFwdAlgoWinograd,<unused>
992-7-7-1x1-128-7-7-1-0x0-1x1-1x1-0-NCHW-FP32-F=miopenConvolutionFwdAlgoDirect:ConvOclDirectFwd1x1,0.0304,0,miopenConvolutionFwdAlgoDirect,<unused>;miopenConvolutionFwdAlgoGEMM:gemm,0.102079,0,rocBlas,<unused>;miopenConvolutionFwdAlgoWinograd:ConvBinWinogradRxSf2x3g1,0.276159,0,miopenConvolutionFwdAlgoWinograd,<unused>
3-224-224-3x3-64-111-111-1-0x0-2x2-1x1-0-NCHW-FP32-F=miopenConvolutionFwdAlgoDirect:ConvOclDirectFwdGen,0.04224,0,miopenConvolutionFwdAlgoDirect,<unused>;miopenConvolutionFwdAlgoGEMM:gemm,0.04448,1330668,rocBlas,<unused>;miopenConvolutionFwdAlgoWinograd:ConvBinWinogradRxSf2x3g1,0.0488,0,miopenConvolutionFwdAlgoWinograd,<unused>
64-55-55-1x1-16-55-55-1-0x0-1x1-1x1-0-NCHW-FP32-F=miopenConvolutionFwdAlgoDirect:ConvAsm1x1U,0.0096,0,miopenConvolutionFwdAlgoDirect,<unused>;miopenConvolutionFwdAlgoGEMM:gemm,0.0448,0,rocBlas,<unused>;miopenConvolutionFwdAlgoWinograd:ConvBinWinogradRxSf2x3g1,0.03936,0,miopenConvolutionFwdAlgoWinograd,<unused>
16-55-55-1x1-64-55-55-1-0x0-1x1-1x1-0-NCHW-FP32-F=miopenConvolutionFwdAlgoDirect:ConvAsm1x1U,0.00848,0,miopenConvolutionFwdAlgoDirect,<unused>;miopenConvolutionFwdAlgoGEMM:gemm,0.03008,0,rocBlas,<unused>;miopenConvolutionFwdAlgoWinograd:ConvBinWinogradRxSf2x3g1,0.028479,0,miopenConvolutionFwdAlgoWinograd,<unused>
16-55-55-3x3-64-55-55-1-1x1-1x1-1x1-0-NCHW-FP32-F=miopenConvolutionFwdAlgoDirect:ConvAsm3x3U,0.0144,0,miopenConvolutionFwdAlgoDirect,<unused>;miopenConvolutionFwdAlgoGEMM:gemm,0.05856,1742400,rocBlas,<unused>;miopenConvolutionFwdAlgoWinograd:ConvBinWinogradRxSf2x3g1,0.027679,0,miopenConvolutionFwdAlgoWinograd,<unused>
128-55-55-1x1-16-55-55-1-0x0-1x1-1x1-0-NCHW-FP32-F=miopenConvolutionFwdAlgoDirect:ConvAsm1x1U,0.0128,0,miopenConvolutionFwdAlgoDirect,<unused>;miopenConvolutionFwdAlgoGEMM:gemm,0.04224,0,rocBlas,<unused>;miopenConvolutionFwdAlgoWinograd:ConvBinWinogradRxSf2x3g1,0.055679,0,miopenConvolutionFwdAlgoWinograd,<unused>
128-27-27-1x1-32-27-27-1-0x0-1x1-1x1-0-NCHW-FP32-F=miopenConvolutionFwdAlgoDirect:ConvAsm1x1U,0.012,0,miopenConvolutionFwdAlgoDirect,<unused>;miopenConvolutionFwdAlgoGEMM:gemm,0.07808,0,rocBlas,<unused>;miopenConvolutionFwdAlgoWinograd:ConvBinWinogradRxSf2x3g1,0.05536,0,miopenConvolutionFwdAlgoWinograd,<unused>
32-27-27-1x1-128-27-27-1-0x0-1x1-1x1-0-NCHW-FP32-F=miopenConvolutionFwdAlgoDirect:ConvAsm1x1U,0.00864,0,miopenConvolutionFwdAlgoDirect,<unused>;miopenConvolutionFwdAlgoGEMM:gemm,0.03136,0,rocBlas,<unused>;miopenConvolutionFwdAlgoWinograd:ConvBinWinogradRxSf2x3g1,0.03136,0,miopenConvolutionFwdAlgoWinograd,<unused>
32-27-27-3x3-128-27-27-1-1x1-1x1-1x1-0-NCHW-FP32-F=miopenConvolutionFwdAlgoWinograd:ConvBinWinogradRxSf2x3g1,0.03168,0,miopenConvolutionFwdAlgoWinograd,<unused>
256-27-27-1x1-32-27-27-1-0x0-1x1-1x1-0-NCHW-FP32-F=miopenConvolutionFwdAlgoDirect:ConvAsm1x1U,0.016,0,miopenConvolutionFwdAlgoDirect,<unused>;miopenConvolutionFwdAlgoGEMM:gemm,0.04768,0,rocBlas,<unused>;miopenConvolutionFwdAlgoWinograd:ConvBinWinogradRxSf2x3g1,0.08624,0,miopenConvolutionFwdAlgoWinograd,<unused>
256-13-13-1x1-48-13-13-1-0x0-1x1-1x1-0-NCHW-FP32-F=miopenConvolutionFwdAlgoDirect:ConvAsm1x1U,0.016,0,miopenConvolutionFwdAlgoDirect,<unused>;miopenConvolutionFwdAlgoGEMM:gemm,0.08448,0,rocBlas,<unused>;miopenConvolutionFwdAlgoWinograd:ConvBinWinogradRxSf2x3g1,0.08688,0,miopenConvolutionFwdAlgoWinograd,<unused>
48-13-13-1x1-192-13-13-1-0x0-1x1-1x1-0-NCHW-FP32-F=miopenConvolutionFwdAlgoDirect:ConvAsm1x1U,0.01072,0,miopenConvolutionFwdAlgoDirect,<unused>;miopenConvolutionFwdAlgoGEMM:gemm,0.0496,0,rocBlas,<unused>;miopenConvolutionFwdAlgoWinograd:ConvBinWinogradRxSf2x3g1,0.03568,0,miopenConvolutionFwdAlgoWinograd,<unused>
48-13-13-3x3-192-13-13-1-1x1-1x1-1x1-0-NCHW-FP32-F=miopenConvolutionFwdAlgoWinograd:ConvBinWinogradRxSf2x3g1,0.036,0,miopenConvolutionFwdAlgoWinograd,<unused>
384-13-13-1x1-48-13-13-1-0x0-1x1-1x1-0-NCHW-FP32-F=miopenConvolutionFwdAlgoDirect:ConvAsm1x1U,0.02096,0,miopenConvolutionFwdAlgoDirect,<unused>;miopenConvolutionFwdAlgoGEMM:gemm,0.090079,0,rocBlas,<unused>;miopenConvolutionFwdAlgoWinograd:ConvBinWinogradRxSf2x3g1,0.1184,0,miopenConvolutionFwdAlgoWinograd,<unused>
384-13-13-1x1-64-13-13-1-0x0-1x1-1x1-0-NCHW-FP32-F=miopenConvolutionFwdAlgoDirect:ConvAsm1x1U,0.02064,0,miopenConvolutionFwdAlgoDirect,<unused>;miopenConvolutionFwdAlgoGEMM:gemm,0.07648,0,rocBlas,<unused>;miopenConvolutionFwdAlgoWinograd:ConvBinWinogradRxSf2x3g1,0.11776,0,miopenConvolutionFwdAlgoWinograd,<unused>
64-13-13-1x1-256-13-13-1-0x0-1x1-1x1-0-NCHW-FP32-F=miopenConvolutionFwdAlgoDirect:ConvAsm1x1U,0.00896,0,miopenConvolutionFwdAlgoDirect,<unused>;miopenConvolutionFwdAlgoGEMM:gemm,0.04352,0,rocBlas,<unused>;miopenConvolutionFwdAlgoWinograd:ConvBinWinogradRxSf2x3g1,0.03904,0,miopenConvolutionFwdAlgoWinograd,<unused>
64-13-13-3x3-256-13-13-1-1x1-1x1-1x1-0-NCHW-FP32-F=miopenConvolutionFwdAlgoWinograd:ConvBinWinogradRxSf2x3g1,0.04032,0,miopenConvolutionFwdAlgoWinograd,<unused>
512-13-13-1x1-64-13-13-1-0x0-1x1-1x1-0-NCHW-FP32-F=miopenConvolutionFwdAlgoDirect:ConvAsm1x1U,0.02512,0,miopenConvolutionFwdAlgoDirect,<unused>;miopenConvolutionFwdAlgoGEMM:gemm,0.062719,0,rocBlas,<unused>;miopenConvolutionFwdAlgoWinograd:ConvBinWinogradRxSf2x3g1,0.14912,0,miopenConvolutionFwdAlgoWinograd,<unused>
512-13-13-1x1-1000-13-13-1-0x0-1x1-1x1-0-NCHW-FP32-F=miopenConvolutionFwdAlgoDirect:ConvAsm1x1U,0.05728,0,miopenConvolutionFwdAlgoDirect,<unused>;miopenConvolutionFwdAlgoGEMM:gemm,0.062079,0,rocBlas,<unused>;miopenConvolutionFwdAlgoWinograd:ConvBinWinogradRxSf3x2,0.209439,0,miopenConvolutionFwdAlgoWinograd,<unused>
3-224-224-3x3-64-224-224-1-1x1-1x1-1x1-0-NCHW-FP32-F=miopenConvolutionFwdAlgoDirect:ConvOclDirectFwd,0.06,0,miopenConvolutionFwdAlgoDirect,<unused>;miopenConvolutionFwdAlgoGEMM:gemm,0.07952,5419008,rocBlas,<unused>;miopenConvolutionFwdAlgoWinograd:ConvBinWinogradRxSf2x3g1,0.07056,0,miopenConvolutionFwdAlgoWinograd,<unused>
64-224-224-3x3-64-224-224-1-1x1-1x1-1x1-0-NCHW-FP32-F=miopenConvolutionFwdAlgoWinograd:ConvBinWinogradRxSf2x3g1,0.25648,0,miopenConvolutionFwdAlgoWinograd,<unused>
64-112-112-3x3-128-112-112-1-1x1-1x1-1x1-0-NCHW-FP32-F=miopenConvolutionFwdAlgoWinograd:ConvBinWinogradRxSf2x3g1,0.1432,0,miopenConvolutionFwdAlgoWinograd,<unused>
128-112-112-3x3-128-112-112-1-1x1-1x1-1x1-0-NCHW-FP32-F=miopenConvolutionFwdAlgoWinograd:ConvBinWinogradRxSf2x3g1,0.2488,0,miopenConvolutionFwdAlgoWinograd,<unused>
128-56-56-3x3-256-56-56-1-1x1-1x1-1x1-0-NCHW-FP32-F=miopenConvolutionFwdAlgoWinograd:ConvBinWinogradRxSf2x3g1,0.160479,0,miopenConvolutionFwdAlgoWinograd,<unused>
256-56-56-3x3-256-56-56-1-1x1-1x1-1x1-0-NCHW-FP32-F=miopenConvolutionFwdAlgoWinograd:ConvBinWinogradRxS,0.36704,0,miopenConvolutionFwdAlgoWinograd,<unused>
256-28-28-3x3-512-28-28-1-1x1-1x1-1x1-0-NCHW-FP32-F=miopenConvolutionFwdAlgoWinograd:ConvBinWinogradRxSf2x3g1,0.15648,0,miopenConvolutionFwdAlgoWinograd,<unused>
512-28-28-3x3-512-28-28-1-1x1-1x1-1x1-0-NCHW-FP32-F=miopenConvolutionFwdAlgoWinograd:ConvBinWinogradRxSf2x3g1,0.2792,0,miopenConvolutionFwdAlgoWinograd,<unused>
512-14-14-3x3-512-14-14-1-1x1-1x1-1x1-0-NCHW-FP32-F=miopenConvolutionFwdAlgoWinograd:ConvBinWinogradRxSf2x3g1,0.14832,0,miopenConvolutionFwdAlgoWinograd,<unused>
64-56-56-1x1-288-56-56-1-0x0-1x1-1x1-0-NCHW-FP32-F=miopenConvolutionFwdAlgoImplicitGEMM:ConvHipImplicitGemmV4R4Fwd,0.03008,0,miopenConvolutionFwdAlgoImplicitGEMM,<unused>;miopenConvolutionFwdAlgoDirect:ConvOclDirectFwd1x1,0.0256,0,miopenConvolutionFwdAlgoDirect,<unused>;miopenConvolutionFwdAlgoGEMM:gemm,0.048,0,rocBlas,<unused>;miopenConvolutionFwdAlgoWinograd:ConvBinWinogradRxSf3x2,0.07936,0,miopenConvolutionFwdAlgoWinograd,<unused>
64-56-56-1x1-96-56-56-1-0x0-1x1-1x1-0-NCHW-FP32-F=miopenConvolutionFwdAlgoImplicitGEMM:ConvHipImplicitGemmV4R4Fwd,0.01824,0,miopenConvolutionFwdAlgoImplicitGEMM,<unused>;miopenConvolutionFwdAlgoDirect:ConvAsm1x1U,0.0168,0,miopenConvolutionFwdAlgoDirect,<unused>;miopenConvolutionFwdAlgoGEMM:gemm,0.03392,0,rocBlas,<unused>;miopenConvolutionFwdAlgoWinograd:ConvBinWinogradRxSf3x2,0.05328,0,miopenConvolutionFwdAlgoWinograd,<unused>
96-56-56-3x3-96-56-56-1-1x1-1x1-1x1-0-NCHW-FP32-F_g32=miopenConvolutionFwdAlgoDirect:ConvOclDirectFwd,0.0144,0,miopenConvolutionFwdAlgoDirect,<unused>;miopenConvolutionFwdAlgoGEMM:gemm,0.11152,10838016,rocBlas,<unused>;miopenConvolutionFwdAlgoWinograd:ConvBinWinogradRxSf2x3,0.09056,0,miopenConvolutionFwdAlgoWinograd,<unused>
96-56-56-1x1-272-56-56-1-0x0-1x1-1x1-0-NCHW-FP32-F=miopenConvolutionFwdAlgoDirect:ConvAsm1x1U,0.03136,0,miopenConvolutionFwdAlgoDirect,<unused>;miopenConvolutionFwdAlgoGEMM:gemm,0.05568,0,rocBlas,<unused>;miopenConvolutionFwdAlgoWinograd:ConvBinWinogradRxSf3x2,0.10128,0,miopenConvolutionFwdAlgoWinograd,<unused>
304-56-56-1x1-96-56-56-1-0x0-1x1-1x1-0-NCHW-FP32-F=miopenConvolutionFwdAlgoImplicitGEMM:ConvHipImplicitGemmV4R4Fwd,0.05344,0,miopenConvolutionFwdAlgoImplicitGEMM,<unused>;miopenConvolutionFwdAlgoDirect:ConvAsm1x1U,0.04144,0,miopenConvolutionFwdAlgoDirect,<unused>;miopenConvolutionFwdAlgoGEMM:gemm,0.07504,0,rocBlas,<unused>;miopenConvolutionFwdAlgoWinograd:ConvBinWinogradRxSf3x2,0.13664,0,miopenConvolutionFwdAlgoWinograd,<unused>
320-56-56-1x1-96-56-56-1-0x0-1x1-1x1-0-NCHW-FP32-F=miopenConvolutionFwdAlgoImplicitGEMM:ConvHipImplicitGemmV4R4Fwd,0.05584,0,miopenConvolutionFwdAlgoImplicitGEMM,<unused>;miopenConvolutionFwdAlgoDirect:ConvAsm1x1U,0.04256,0,miopenConvolutionFwdAlgoDirect,<unused>;miopenConvolutionFwdAlgoGEMM:gemm,0.081119,0,rocBlas,<unused>;miopenConvolutionFwdAlgoWinograd:ConvBinWinogradRxSf3x2,0.14224,0,miopenConvolutionFwdAlgoWinograd,<unused>
336-56-56-1x1-576-28-28-1-0x0-2x2-1x1-0-NCHW-FP32-F=miopenConvolutionFwdAlgoDirect:ConvAsm1x1U,0.06848,1053696,miopenConvolutionFwdAlgoDirect,<unused>;miopenConvolutionFwdAlgoGEMM:gemm,0.08368,2860032,rocBlas,<unused>;miopenConvolutionFwdAlgoWinograd:ConvBinWinogradRxSf2x3g1,0.529919,0,miopenConvolutionFwdAlgoWinograd,<unused>
336-56-56-1x1-192-56-56-1-0x0-1x1-1x1-0-NCHW-FP32-F=miopenConvolutionFwdAlgoImplicitGEMM:ConvHipImplicitGemmV4R4Fwd,0.07056,0,miopenConvolutionFwdAlgoImplicitGEMM,<unused>;miopenConvolutionFwdAlgoDirect:ConvAsm1x1U,0.07168,0,miopenConvolutionFwdAlgoDirect,<unused>;miopenConvolutionFwdAlgoGEMM:gemm,0.10576,0,rocBlas,<unused>;miopenConvolutionFwdAlgoWinograd:ConvBinWinogradRxSf3x2,0.265759,0,miopenConvolutionFwdAlgoWinograd,<unused>
192-56-56-3x3-192-28-28-1-1x1-2x2-1x1-0-NCHW-FP32-F_g32=miopenConvolutionFwdAlgoDirect:ConvOclDirectFwd,0.02864,0,miopenConvolutionFwdAlgoDirect,<unused>;miopenConvolutionFwdAlgoGEMM:gemm,0.07312,5419008,rocBlas,<unused>;miopenConvolutionFwdAlgoWinograd:ConvBinWinogradRxSf2x3,0.08672,0,miopenConvolutionFwdAlgoWinograd,<unused>
192-28-28-1x1-544-28-28-1-0x0-1x1-1x1-0-NCHW-FP32-F=miopenConvolutionFwdAlgoDirect:ConvAsm1x1U,0.03184,0,miopenConvolutionFwdAlgoDirect,<unused>;miopenConvolutionFwdAlgoGEMM:gemm,0.0672,0,rocBlas,<unused>;miopenConvolutionFwdAlgoWinograd:ConvBinWinogradRxSf2x3g1,0.11952,0,miopenConvolutionFwdAlgoWinograd,<unused>
608-28-28-1x1-192-28-28-1-0x0-1x1-1x1-0-NCHW-FP32-F=miopenConvolutionFwdAlgoDirect:ConvAsm1x1U,0.0424,0,miopenConvolutionFwdAlgoDirect,<unused>;miopenConvolutionFwdAlgoGEMM:gemm,0.12656,0,rocBlas,<unused>;miopenConvolutionFwdAlgoWinograd:ConvBinWinogradRxSf2x3g1,0.17264,0,miopenConvolutionFwdAlgoWinograd,<unused>
192-28-28-3x3-192-28-28-1-1x1-1x1-1x1-0-NCHW-FP32-F_g32=miopenConvolutionFwdAlgoDirect:ConvOclDirectFwd,0.0192,0,miopenConvolutionFwdAlgoDirect,<unused>;miopenConvolutionFwdAlgoGEMM:gemm,0.0696,5419008,rocBlas,<unused>;miopenConvolutionFwdAlgoWinograd:ConvBinWinogradRxSf2x3,0.0504,0,miopenConvolutionFwdAlgoWinograd,<unused>
640-28-28-1x1-192-28-28-1-0x0-1x1-1x1-0-NCHW-FP32-F=miopenConvolutionFwdAlgoDirect:ConvAsm1x1U,0.0472,0,miopenConvolutionFwdAlgoDirect,<unused>;miopenConvolutionFwdAlgoGEMM:gemm,0.06832,0,rocBlas,<unused>;miopenConvolutionFwdAlgoWinograd:ConvBinWinogradRxSf2x3g1,0.18144,0,miopenConvolutionFwdAlgoWinograd,<unused>
672-28-28-1x1-192-28-28-1-0x0-1x1-1x1-0-NCHW-FP32-F=miopenConvolutionFwdAlgoDirect:ConvAsm1x1U,0.0472,0,miopenConvolutionFwdAlgoDirect,<unused>;miopenConvolutionFwdAlgoGEMM:gemm,0.07184,0,rocBlas,<unused>;miopenConvolutionFwdAlgoWinograd:ConvBinWinogradRxSf2x3g1,0.18576,0,miopenConvolutionFwdAlgoWinograd,<unused>
704-28-28-1x1-1072-14-14-1-0x0-2x2-1x1-0-NCHW-FP32-F=miopenConvolutionFwdAlgoDirect:ConvAsm1x1U,0.083839,551936,miopenConvolutionFwdAlgoDirect,<unused>;miopenConvolutionFwdAlgoGEMM:gemm,0.08912,1392384,rocBlas,<unused>;miopenConvolutionFwdAlgoWinograd:ConvBinWinogradRxSf2x3g1,0.741599,0,miopenConvolutionFwdAlgoWinograd,<unused>
704-28-28-1x1-384-28-28-1-0x0-1x1-1x1-0-NCHW-FP32-F=miopenConvolutionFwdAlgoDirect:ConvOclDirectFwd1x1,0.0896,0,miopenConvolutionFwdAlgoDirect,<unused>;miopenConvolutionFwdAlgoGEMM:gemm,0.08048,0,rocBlas,<unused>;miopenConvolutionFwdAlgoWinograd:ConvBinWinogradRxSf3x2,0.276799,0,miopenConvolutionFwdAlgoWinograd,<unused>
384-28-28-3x3-384-14-14-1-1x1-2x2-1x1-0-NCHW-FP32-F_g32=miopenConvolutionFwdAlgoDirect:ConvOclDirectFwd,0.03616,0,miopenConvolutionFwdAlgoDirect,<unused>;miopenConvolutionFwdAlgoGEMM:gemm,0.082879,2709504,rocBlas,<unused>;miopenConvolutionFwdAlgoWinograd:ConvBinWinogradRxSf2x3,0.05264,0,miopenConvolutionFwdAlgoWinograd,<unused>
64-56-56-1x1-512-56-56-1-0x0-1x1-1x1-0-NCHW-FP32-F=miopenConvolutionFwdAlgoImplicitGEMM:ConvHipImplicitGemmV4R4Fwd,0.0384,0,miopenConvolutionFwdAlgoImplicitGEMM,<unused>;miopenConvolutionFwdAlgoDirect:ConvAsm1x1U,0.03888,0,miopenConvolutionFwdAlgoDirect,<unused>;miopenConvolutionFwdAlgoGEMM:gemm,0.06544,0,rocBlas,<unused>;miopenConvolutionFwdAlgoWinograd:ConvBinWinogradRxSf3x2,0.133119,0,miopenConvolutionFwdAlgoWinograd,<unused>
256-56-56-3x3-256-56-56-1-1x1-1x1-1x1-0-NCHW-FP32-F_g64=miopenConvolutionFwdAlgoDirect:ConvAsm3x3U,0.01584,0,miopenConvolutionFwdAlgoDirect,<unused>;miopenConvolutionFwdAlgoGEMM:gemm,0.212479,28901376,rocBlas,<unused>;miopenConvolutionFwdAlgoWinograd:ConvBinWinogradRxSf2x3,0.17696,0,miopenConvolutionFwdAlgoWinograd,<unused>
256-56-56-1x1-256-56-56-1-0x0-1x1-1x1-0-NCHW-FP32-F=miopenConvolutionFwdAlgoImplicitGEMM:ConvHipImplicitGemmV4R4Fwd,0.07008,0,miopenConvolutionFwdAlgoImplicitGEMM,<unused>;miopenConvolutionFwdAlgoDirect:ConvOclDirectFwd1x1,0.07552,0,miopenConvolutionFwdAlgoDirect,<unused>;miopenConvolutionFwdAlgoGEMM:gemm,0.08992,0,rocBlas,<unused>;miopenConvolutionFwdAlgoWinograd:ConvBinWinogradRxSf3x2,0.21296,0,miopenConvolutionFwdAlgoWinograd,<unused>
256-56-56-1x1-512-56-56-1-0x0-1x1-1x1-0-NCHW-FP32-F=miopenConvolutionFwdAlgoImplicitGEMM:ConvHipImplicitGemmV4R4Fwd,0.11152,0,miopenConvolutionFwdAlgoImplicitGEMM,<unused>;miopenConvolutionFwdAlgoDirect:ConvAsm1x1U,0.16016,0,miopenConvolutionFwdAlgoDirect,<unused>;miopenConvolutionFwdAlgoGEMM:gemm,0.127839,0,rocBlas,<unused>;miopenConvolutionFwdAlgoWinograd:ConvBinWinogradRxSf3x2,0.399999,0,miopenConvolutionFwdAlgoWinograd,<unused>
512-56-56-3x3-512-28-28-1-1x1-2x2-1x1-0-NCHW-FP32-F_g64=miopenConvolutionFwdAlgoDirect:ConvOclDirectFwd,0.06224,0,miopenConvolutionFwdAlgoDirect,<unused>;miopenConvolutionFwdAlgoGEMM:gemm,0.13088,14450688,rocBlas,<unused>;miopenConvolutionFwdAlgoWinograd:ConvBinWinogradRxSf2x3,0.17456,0,miopenConvolutionFwdAlgoWinograd,<unused>
768-28-28-1x1-512-28-28-1-0x0-1x1-1x1-0-NCHW-FP32-F=miopenConvolutionFwdAlgoDirect:ConvAsm1x1U,0.1456,0,miopenConvolutionFwdAlgoDirect,<unused>;miopenConvolutionFwdAlgoGEMM:gemm,0.10848,0,rocBlas,<unused>;miopenConvolutionFwdAlgoWinograd:ConvBinWinogradRxSf2x3g1,0.397759,0,miopenConvolutionFwdAlgoWinograd,<unused>
512-28-28-1x1-512-28-28-1-0x0-1x1-1x1-0-NCHW-FP32-F=miopenConvolutionFwdAlgoDirect:ConvAsm1x1U,0.1,0,miopenConvolutionFwdAlgoDirect,<unused>;miopenConvolutionFwdAlgoGEMM:gemm,0.075359,0,rocBlas,<unused>;miopenConvolutionFwdAlgoWinograd:ConvBinWinogradRxSf2x3g1,0.272159,0,miopenConvolutionFwdAlgoWinograd,<unused>
512-28-28-3x3-512-28-28-1-1x1-1x1-1x1-0-NCHW-FP32-F_g64=miopenConvolutionFwdAlgoDirect:ConvAsm3x3U,0.02128,0,miopenConvolutionFwdAlgoDirect,<unused>;miopenConvolutionFwdAlgoGEMM:gemm,0.11248,14450688,rocBlas,<unused>;miopenConvolutionFwdAlgoWinograd:ConvBinWinogradRxSf2x3,0.09536,0,miopenConvolutionFwdAlgoWinograd,<unused>
512-28-28-1x1-1024-28-28-1-0x0-1x1-1x1-0-NCHW-FP32-F=miopenConvolutionFwdAlgoDirect:ConvAsm1x1U,0.16832,0,miopenConvolutionFwdAlgoDirect,<unused>;miopenConvolutionFwdAlgoGEMM:gemm,0.119519,0,rocBlas,<unused>;miopenConvolutionFwdAlgoWinograd:ConvBinWinogradRxSf2x3g1,0.517119,0,miopenConvolutionFwdAlgoWinograd,<unused>
1024-28-28-3x3-1024-14-14-1-1x1-2x2-1x1-0-NCHW-FP32-F_g64=miopenConvolutionFwdAlgoDirect:ConvOclDirectFwd,0.0592,0,miopenConvolutionFwdAlgoDirect,<unused>;miopenConvolutionFwdAlgoGEMM:gemm,0.10704,7225344,rocBlas,<unused>;miopenConvolutionFwdAlgoWinograd:ConvBinWinogradRxSf2x3,0.09616,0,miopenConvolutionFwdAlgoWinograd,<unused>
1536-14-14-1x1-1024-14-14-1-0x0-1x1-1x1-0-NCHW-FP32-F=miopenConvolutionFwdAlgoDirect:ConvAsm1x1U,0.1656,0,miopenConvolutionFwdAlgoDirect,<unused>;miopenConvolutionFwdAlgoGEMM:gemm,0.18912,0,rocBlas,<unused>;miopenConvolutionFwdAlgoWinograd:ConvBinWinogradRxSf3x2,0.567839,0,miopenConvolutionFwdAlgoWinograd,<unused>
1024-14-14-1x1-1024-14-14-1-0x0-1x1-1x1-0-NCHW-FP32-F=miopenConvolutionFwdAlgoDirect:ConvAsm1x1U,0.1216,0,miopenConvolutionFwdAlgoDirect,<unused>;miopenConvolutionFwdAlgoGEMM:gemm,0.13232,0,rocBlas,<unused>;miopenConvolutionFwdAlgoWinograd:ConvBinWinogradRxSf3x2,0.390879,0,miopenConvolutionFwdAlgoWinograd,<unused>
1024-14-14-3x3-1024-14-14-1-1x1-1x1-1x1-0-NCHW-FP32-F_g64=miopenConvolutionFwdAlgoDirect:ConvOclDirectFwd,0.032,0,miopenConvolutionFwdAlgoDirect,<unused>;miopenConvolutionFwdAlgoGEMM:gemm,0.08864,7225344,rocBlas,<unused>;miopenConvolutionFwdAlgoWinograd:ConvBinWinogradRxSf2x3,0.05616,0,miopenConvolutionFwdAlgoWinograd,<unused>
1024-14-14-1x1-2048-14-14-1-0x0-1x1-1x1-0-NCHW-FP32-F=miopenConvolutionFwdAlgoDirect:ConvAsm1x1U,0.21952,0,miopenConvolutionFwdAlgoDirect,<unused>;miopenConvolutionFwdAlgoGEMM:gemm,0.23168,0,rocBlas,<unused>;miopenConvolutionFwdAlgoWinograd:ConvBinWinogradRxSf3x2,0.755999,0,miopenConvolutionFwdAlgoWinograd,<unused>
2048-14-14-3x3-2048-7-7-1-1x1-2x2-1x1-0-NCHW-FP32-F_g64=miopenConvolutionFwdAlgoDirect:ConvOclDirectFwd,0.0968,0,miopenConvolutionFwdAlgoDirect,<unused>;miopenConvolutionFwdAlgoGEMM:gemm,0.10256,3612672,rocBlas,<unused>;miopenConvolutionFwdAlgoWinograd:ConvBinWinogradRxSf2x3,0.10048,0,miopenConvolutionFwdAlgoWinograd,<unused>
3072-7-7-1x1-2048-7-7-1-0x0-1x1-1x1-0-NCHW-FP32-F=miopenConvolutionFwdAlgoDirect:ConvOclDirectFwd1x1,0.24608,0,miopenConvolutionFwdAlgoDirect,<unused>;miopenConvolutionFwdAlgoGEMM:gemm,0.200639,0,rocBlas,<unused>;miopenConvolutionFwdAlgoWinograd:ConvBinWinogradRxSf2x3g1,1.50096,0,miopenConvolutionFwdAlgoWinograd,<unused>
2048-7-7-1x1-2048-7-7-1-0x0-1x1-1x1-0-NCHW-FP32-F=miopenConvolutionFwdAlgoDirect:ConvOclDirectFwd1x1,0.18896,0,miopenConvolutionFwdAlgoDirect,<unused>;miopenConvolutionFwdAlgoGEMM:gemm,0.19504,0,rocBlas,<unused>;miopenConvolutionFwdAlgoWinograd:ConvBinWinogradRxSf2x3g1,1.01872,0,miopenConvolutionFwdAlgoWinograd,<unused>
2048-7-7-3x3-2048-7-7-1-1x1-1x1-1x1-0-NCHW-FP32-F_g64=miopenConvolutionFwdAlgoDirect:ConvOclDirectFwd,0.03904,0,miopenConvolutionFwdAlgoDirect,<unused>;miopenConvolutionFwdAlgoGEMM:gemm,0.09168,3612672,rocBlas,<unused>;miopenConvolutionFwdAlgoWinograd:ConvBinWinogradRxSf2x3,0.052,0,miopenConvolutionFwdAlgoWinograd,<unused>
512-7-7-7x7-4096-1-1-1-0x0-1x1-1x1-0-NCHW-FP32-F=miopenConvolutionFwdAlgoDirect:ConvOclDirectFwd,7.21088,0,miopenConvolutionFwdAlgoDirect,<unused>;miopenConvolutionFwdAlgoGEMM:gemm,5.90064,100352,rocBlas,<unused>;miopenConvolutionFwdAlgoWinograd:ConvBinWinogradRxSf2x3g1,3.80912,0,miopenConvolutionFwdAlgoWinograd,<unused>
4096-1-1-1x1-4096-1-1-1-0x0-1x1-1x1-0-NCHW-FP32-F=miopenConvolutionFwdAlgoDirect:ConvOclDirectFwd1x1,1.3712,0,miopenConvolutionFwdAlgoDirect,<unused>;miopenConvolutionFwdAlgoGEMM:gemm,0.35232,0,rocBlas,<unused>;miopenConvolutionFwdAlgoWinograd:ConvBinWinogradRxSf2x3g1,2.98848,0,miopenConvolutionFwdAlgoWinograd,<unused>
4096-1-1-1x1-1000-1-1-1-0x0-1x1-1x1-0-NCHW-FP32-F=miopenConvolutionFwdAlgoDirect:ConvOclDirectFwd1x1,0.3064,0,miopenConvolutionFwdAlgoDirect,<unused>;miopenConvolutionFwdAlgoGEMM:gemm,0.29488,0,rocBlas,<unused>;miopenConvolutionFwdAlgoWinograd:ConvBinWinogradRxSf2x3g1,1.01456,0,miopenConvolutionFwdAlgoWinograd,<unused>
3-225-225-3x3-32-112-112-1-0x0-2x2-1x1-0-NCHW-FP32-F=miopenConvolutionFwdAlgoDirect:ConvOclDirectFwd,0.02112,0,miopenConvolutionFwdAlgoDirect,<unused>;miopenConvolutionFwdAlgoGEMM:gemm,0.04928,1354752,rocBlas,<unused>;miopenConvolutionFwdAlgoWinograd:ConvBinWinogradRxSf2x3g1,0.05296,0,miopenConvolutionFwdAlgoWinograd,<unused>
32-112-112-3x3-32-112-112-1-1x1-1x1-1x1-0-NCHW-FP32-F_g32=miopenConvolutionFwdAlgoDirect:ConvOclDirectFwd,0.01136,0,miopenConvolutionFwdAlgoDirect,<unused>;miopenConvolutionFwdAlgoGEMM:gemm,0.19248,14450688,rocBlas,<unused>;miopenConvolutionFwdAlgoWinograd:ConvBinWinogradRxSf2x3,0.21008,0,miopenConvolutionFwdAlgoWinograd,<unused>
32-112-112-1x1-64-112-112-1-0x0-1x1-1x1-0-NCHW-FP32-F=miopenConvolutionFwdAlgoImplicitGEMM:ConvHipImplicitGemmV4R4Fwd,0.01824,0,miopenConvolutionFwdAlgoImplicitGEMM,<unused>;miopenConvolutionFwdAlgoDirect:ConvOclDirectFwd1x1,0.01424,0,miopenConvolutionFwdAlgoDirect,<unused>;miopenConvolutionFwdAlgoGEMM:gemm,0.03504,0,rocBlas,<unused>;miopenConvolutionFwdAlgoWinograd:ConvBinWinogradRxSf3x2,0.05808,0,miopenConvolutionFwdAlgoWinograd,<unused>
64-113-113-3x3-64-56-56-1-0x0-2x2-1x1-0-NCHW-FP32-F_g64=miopenConvolutionFwdAlgoDirect:ConvOclDirectFwd,0.0168,0,miopenConvolutionFwdAlgoDirect,<unused>;miopenConvolutionFwdAlgoGEMM:gemm,0.1344,7225344,rocBlas,<unused>;miopenConvolutionFwdAlgoWinograd:ConvBinWinogradRxSf2x3,0.19472,0,miopenConvolutionFwdAlgoWinograd,<unused>
128-56-56-3x3-128-56-56-1-1x1-1x1-1x1-0-NCHW-FP32-F_g128=miopenConvolutionFwdAlgoDirect:ConvOclDirectFwd,0.01072,0,miopenConvolutionFwdAlgoDirect,<unused>;miopenConvolutionFwdAlgoGEMM:gemm,0.2104,14450688,rocBlas,<unused>;miopenConvolutionFwdAlgoWinograd:ConvBinWinogradRxSf2x3,0.25408,0,miopenConvolutionFwdAlgoWinograd,<unused>
128-57-57-3x3-128-28-28-1-0x0-2x2-1x1-0-NCHW-FP32-F_g128=miopenConvolutionFwdAlgoDirect:ConvOclDirectFwd,0.00912,0,miopenConvolutionFwdAlgoDirect,<unused>;miopenConvolutionFwdAlgoGEMM:gemm,0.07152,3612672,rocBlas,<unused>;miopenConvolutionFwdAlgoWinograd:ConvBinWinogradRxSf2x3,0.1288,0,miopenConvolutionFwdAlgoWinograd,<unused>
128-28-28-1x1-256-28-28-1-0x0-1x1-1x1-0-NCHW-FP32-F=miopenConvolutionFwdAlgoDirect:ConvAsm1x1U,0.0184,0,miopenConvolutionFwdAlgoDirect,<unused>;miopenConvolutionFwdAlgoGEMM:gemm,0.05168,0,rocBlas,<unused>;miopenConvolutionFwdAlgoWinograd:ConvBinWinogradRxSf2x3g1,0.05408,0,miopenConvolutionFwdAlgoWinograd,<unused>
256-28-28-3x3-256-28-28-1-1x1-1x1-1x1-0-NCHW-FP32-F_g256=miopenConvolutionFwdAlgoDirect:ConvOclDirectFwd,0.02544,0,miopenConvolutionFwdAlgoDirect,<unused>;miopenConvolutionFwdAlgoGEMM:gemm,0.10256,7225344,rocBlas,<unused>;miopenConvolutionFwdAlgoWinograd:ConvBinWinogradRxSf2x3,0.15664,0,miopenConvolutionFwdAlgoWinograd,<unused>
256-28-28-1x1-256-28-28-1-0x0-1x1-1x1-0-NCHW-FP32-F=miopenConvolutionFwdAlgoDirect:ConvAsm1x1U,0.02768,0,miopenConvolutionFwdAlgoDirect,<unused>;miopenConvolutionFwdAlgoGEMM:gemm,0.05264,0,rocBlas,<unused>;miopenConvolutionFwdAlgoWinograd:ConvBinWinogradRxSf2x3g1,0.08592,0,miopenConvolutionFwdAlgoWinograd,<unused>
256-29-29-3x3-256-14-14-1-0x0-2x2-1x1-0-NCHW-FP32-F_g256=miopenConvolutionFwdAlgoDirect:ConvOclDirectFwd,0.00656,0,miopenConvolutionFwdAlgoDirect,<unused>;miopenConvolutionFwdAlgoGEMM:gemm,0.0624,1806336,rocBlas,<unused>;miopenConvolutionFwdAlgoWinograd:ConvBinWinogradRxSf2x3,0.1008,0,miopenConvolutionFwdAlgoWinograd,<unused>
256-14-14-1x1-512-14-14-1-0x0-1x1-1x1-0-NCHW-FP32-F=miopenConvolutionFwdAlgoDirect:ConvAsm1x1U,0.0208,0,miopenConvolutionFwdAlgoDirect,<unused>;miopenConvolutionFwdAlgoGEMM:gemm,0.05344,0,rocBlas,<unused>;miopenConvolutionFwdAlgoWinograd:ConvBinWinogradRxSf2x3g1,0.08608,0,miopenConvolutionFwdAlgoWinograd,<unused>
512-14-14-3x3-512-14-14-1-1x1-1x1-1x1-0-NCHW-FP32-F_g512=miopenConvolutionFwdAlgoDirect:ConvOclDirectFwd,0.00576,0,miopenConvolutionFwdAlgoDirect,<unused>;miopenConvolutionFwdAlgoGEMM:gemm,0.07712,3612672,rocBlas,<unused>;miopenConvolutionFwdAlgoWinograd:ConvBinWinogradRxSf2x3,0.14544,0,miopenConvolutionFwdAlgoWinograd,<unused>
512-14-14-1x1-512-14-14-1-0x0-1x1-1x1-0-NCHW-FP32-F=miopenConvolutionFwdAlgoDirect:ConvAsm1x1U,0.03712,0,miopenConvolutionFwdAlgoDirect,<unused>;miopenConvolutionFwdAlgoGEMM:gemm,0.04848,0,rocBlas,<unused>;miopenConvolutionFwdAlgoWinograd:ConvBinWinogradRxSf2x3g1,0.14896,0,miopenConvolutionFwdAlgoWinograd,<unused>
512-15-15-3x3-512-7-7-1-0x0-2x2-1x1-0-NCHW-FP32-F_g512=miopenConvolutionFwdAlgoDirect:ConvOclDirectFwd,0.00592,0,miopenConvolutionFwdAlgoDirect,<unused>;miopenConvolutionFwdAlgoGEMM:gemm,0.05968,903168,rocBlas,<unused>;miopenConvolutionFwdAlgoWinograd:ConvBinWinogradRxSf2x3,0.13184,0,miopenConvolutionFwdAlgoWinograd,<unused>
512-7-7-1x1-1024-7-7-1-0x0-1x1-1x1-0-NCHW-FP32-F=miopenConvolutionFwdAlgoDirect:ConvOclDirectFwd1x1,0.03136,0,miopenConvolutionFwdAlgoDirect,<unused>;miopenConvolutionFwdAlgoGEMM:gemm,0.053919,0,rocBlas,<unused>;miopenConvolutionFwdAlgoWinograd:ConvBinWinogradRxSf2x3g1,0.15104,0,miopenConvolutionFwdAlgoWinograd,<unused>
1024-7-7-3x3-1024-7-7-1-1x1-1x1-1x1-0-NCHW-FP32-F_g1024=miopenConvolutionFwdAlgoDirect:ConvOclDirectFwd,0.00512,0,miopenConvolutionFwdAlgoDirect,<unused>;miopenConvolutionFwdAlgoGEMM:gemm,0.0528,1806336,rocBlas,<unused>;miopenConvolutionFwdAlgoWinograd:ConvBinWinogradRxSf2x3,0.21792,0,miopenConvolutionFwdAlgoWinograd,<unused>
1024-7-7-1x1-1024-7-7-1-0x0-1x1-1x1-0-NCHW-FP32-F=miopenConvolutionFwdAlgoDirect:ConvOclDirectFwd1x1,0.04752,0,miopenConvolutionFwdAlgoDirect,<unused>;miopenConvolutionFwdAlgoGEMM:gemm,0.09408,0,rocBlas,<unused>;miopenConvolutionFwdAlgoWinograd:ConvBinWinogradRxSf2x3g1,0.279199,0,miopenConvolutionFwdAlgoWinograd,<unused>
1024-1-1-1x1-1001-1-1-1-0x0-1x1-1x1-0-NCHW-FP32-F=miopenConvolutionFwdAlgoDirect:ConvOclDirectFwd1x1,0.06352,0,miopenConvolutionFwdAlgoDirect,<unused>;miopenConvolutionFwdAlgoGEMM:gemm,0.684959,0,rocBlas,<unused>;miopenConvolutionFwdAlgoWinograd:ConvBinWinogradRxSf2x3g1,0.27504,0,miopenConvolutionFwdAlgoWinograd,<unused>
64-147-147-3x3-96-73-73-1-0x0-2x2-1x1-0-NCHW-FP32-F=miopenConvolutionFwdAlgoDirect:ConvOclDirectFwd,0.473278,0,miopenConvolutionFwdAlgoDirect,<unused>;miopenConvolutionFwdAlgoGEMM:gemm,0.1616,12278016,rocBlas,<unused>;miopenConvolutionFwdAlgoWinograd:ConvBinWinogradRxSf2x3g1,0.225439,0,miopenConvolutionFwdAlgoWinograd,<unused>
160-73-73-1x1-128-73-73-1-0x0-1x1-1x1-0-NCHW-FP32-F=miopenConvolutionFwdAlgoDirect:ConvOclDirectFwd1x1,0.03856,0,miopenConvolutionFwdAlgoDirect,<unused>;miopenConvolutionFwdAlgoGEMM:gemm,0.0584,0,rocBlas,<unused>;miopenConvolutionFwdAlgoWinograd:ConvBinWinogradRxSf3x2,0.14496,0,miopenConvolutionFwdAlgoWinograd,<unused>
64-73-73-3x3-96-71-71-1-0x0-1x1-1x1-0-NCHW-FP32-F=miopenConvolutionFwdAlgoDirect:ConvOclDirectFwd,0.311199,0,miopenConvolutionFwdAlgoDirect,<unused>;miopenConvolutionFwdAlgoGEMM:gemm,0.156318,11614464,rocBlas,<unused>;miopenConvolutionFwdAlgoWinograd:ConvBinWinogradRxSf2x3g1,0.07648,0,miopenConvolutionFwdAlgoWinograd,<unused>
64-73-73-1x7-64-73-73-1-0x3-1x1-1x1-0-NCHW-FP32-F=miopenConvolutionFwdAlgoWinograd:ConvBinWinogradRxSf3x2,0.12,0,miopenConvolutionFwdAlgoWinograd,<unused>;miopenConvolutionFwdAlgoGEMM:gemm,0.10336,9549568,rocBlas,<unused>
64-73-73-7x1-64-73-73-1-3x0-1x1-1x1-0-NCHW-FP32-F=miopenConvolutionFwdAlgoWinograd:ConvBinWinogradRxSf3x2,0.121279,0,miopenConvolutionFwdAlgoWinograd,<unused>;miopenConvolutionFwdAlgoGEMM:gemm,0.10208,9549568,rocBlas,<unused>
192-71-71-3x3-192-35-35-1-0x0-2x2-1x1-0-NCHW-FP32-F=miopenConvolutionFwdAlgoDirect:ConvOclDirectFwd,0.864956,0,miopenConvolutionFwdAlgoDirect,<unused>;miopenConvolutionFwdAlgoGEMM:gemm,0.162399,8467200,rocBlas,<unused>;miopenConvolutionFwdAlgoWinograd:ConvBinWinogradRxSf2x3g1,0.412798,0,miopenConvolutionFwdAlgoWinograd,<unused>
384-35-35-1x1-128-35-35-1-0x0-1x1-1x1-0-NCHW-FP32-F=miopenConvolutionFwdAlgoDirect:ConvAsm1x1U,0.02768,0,miopenConvolutionFwdAlgoDirect,<unused>;miopenConvolutionFwdAlgoGEMM:gemm,0.08928,0,rocBlas,<unused>;miopenConvolutionFwdAlgoWinograd:ConvBinWinogradRxSf2x3g1,0.117279,0,miopenConvolutionFwdAlgoWinograd,<unused>
384-35-35-1x1-96-35-35-1-0x0-1x1-1x1-0-NCHW-FP32-F=miopenConvolutionFwdAlgoDirect:ConvAsm1x1U,0.02656,0,miopenConvolutionFwdAlgoDirect,<unused>;miopenConvolutionFwdAlgoGEMM:gemm,0.09488,0,rocBlas,<unused>;miopenConvolutionFwdAlgoWinograd:ConvBinWinogradRxSf2x3g1,0.117279,0,miopenConvolutionFwdAlgoWinograd,<unused>
384-35-35-3x3-384-17-17-1-0x0-2x2-1x1-0-NCHW-FP32-F=miopenConvolutionFwdAlgoDirect:ConvOclDirectFwd,1.51775,0,miopenConvolutionFwdAlgoDirect,<unused>;miopenConvolutionFwdAlgoGEMM:gemm,0.170878,3995136,rocBlas,<unused>;miopenConvolutionFwdAlgoWinograd:ConvBinWinogradRxSf2x3g1,0.416639,0,miopenConvolutionFwdAlgoWinograd,<unused>
384-35-35-1x1-192-35-35-1-0x0-1x1-1x1-0-NCHW-FP32-F=miopenConvolutionFwdAlgoDirect:ConvAsm1x1U,0.04496,0,miopenConvolutionFwdAlgoDirect,<unused>;miopenConvolutionFwdAlgoGEMM:gemm,0.092,0,rocBlas,<unused>;miopenConvolutionFwdAlgoWinograd:ConvBinWinogradRxSf3x2,0.1648,0,miopenConvolutionFwdAlgoWinograd,<unused>
192-35-35-3x3-224-35-35-1-1x1-1x1-1x1-0-NCHW-FP32-F=miopenConvolutionFwdAlgoWinograd:ConvBinWinogradRxSf2x3g1,0.123679,0,miopenConvolutionFwdAlgoWinograd,<unused>
224-35-35-3x3-256-17-17-1-0x0-2x2-1x1-0-NCHW-FP32-F=miopenConvolutionFwdAlgoDirect:ConvOclDirectFwd,0.809437,0,miopenConvolutionFwdAlgoDirect,<unused>;miopenConvolutionFwdAlgoGEMM:gemm,0.112,2330496,rocBlas,<unused>;miopenConvolutionFwdAlgoWinograd:ConvBinWinogradRxSf2x3g1,0.249759,0,miopenConvolutionFwdAlgoWinograd,<unused>
1024-17-17-1x1-768-17-17-1-0x0-1x1-1x1-0-NCHW-FP32-F=miopenConvolutionFwdAlgoDirect:ConvAsm1x1U,0.12064,0,miopenConvolutionFwdAlgoDirect,<unused>;miopenConvolutionFwdAlgoGEMM:gemm,0.09744,0,rocBlas,<unused>;miopenConvolutionFwdAlgoWinograd:ConvBinWinogradRxSf3x2,0.392638,0,miopenConvolutionFwdAlgoWinograd,<unused>
192-17-17-1x7-224-17-17-1-0x3-1x1-1x1-0-NCHW-FP32-F=miopenConvolutionFwdAlgoWinograd:ConvBinWinogradRxSf2x3g1,0.20832,0,miopenConvolutionFwdAlgoWinograd,<unused>;miopenConvolutionFwdAlgoGEMM:gemm,0.08544,1553664,rocBlas,<unused>
224-17-17-7x1-256-17-17-1-3x0-1x1-1x1-0-NCHW-FP32-F=miopenConvolutionFwdAlgoWinograd:ConvBinWinogradRxSf2x3g1,0.189919,0,miopenConvolutionFwdAlgoWinograd,<unused>;miopenConvolutionFwdAlgoGEMM:gemm,0.09344,1812608,rocBlas,<unused>
224-17-17-7x1-224-17-17-1-3x0-1x1-1x1-0-NCHW-FP32-F=miopenConvolutionFwdAlgoWinograd:ConvBinWinogradRxSf2x3g1,0.190079,0,miopenConvolutionFwdAlgoWinograd,<unused>;miopenConvolutionFwdAlgoGEMM:gemm,0.094719,1812608,rocBlas,<unused>
224-17-17-1x7-256-17-17-1-0x3-1x1-1x1-0-NCHW-FP32-F=miopenConvolutionFwdAlgoWinograd:ConvBinWinogradRxSf2x3g1,0.2424,0,miopenConvolutionFwdAlgoWinograd,<unused>;miopenConvolutionFwdAlgoGEMM:gemm,0.094079,1812608,rocBlas,<unused>
1024-17-17-1x1-128-17-17-1-0x0-1x1-1x1-0-NCHW-FP32-F=miopenConvolutionFwdAlgoDirect:ConvOclDirectFwd1x1,0.04176,0,miopenConvolutionFwdAlgoDirect,<unused>;miopenConvolutionFwdAlgoGEMM:gemm,0.122559,0,rocBlas,<unused>;miopenConvolutionFwdAlgoWinograd:ConvBinWinogradRxSf2x3g1,0.272319,0,miopenConvolutionFwdAlgoWinograd,<unused>
1024-17-17-1x1-192-17-17-1-0x0-1x1-1x1-0-NCHW-FP32-F=miopenConvolutionFwdAlgoDirect:ConvOclDirectFwd1x1,0.0472,0,miopenConvolutionFwdAlgoDirect,<unused>;miopenConvolutionFwdAlgoGEMM:gemm,0.1232,0,rocBlas,<unused>;miopenConvolutionFwdAlgoWinograd:ConvBinWinogradRxSf2x3g1,0.271839,0,miopenConvolutionFwdAlgoWinograd,<unused>
1024-17-17-1x1-256-17-17-1-0x0-1x1-1x1-0-NCHW-FP32-F=miopenConvolutionFwdAlgoDirect:ConvOclDirectFwd1x1,0.05568,0,miopenConvolutionFwdAlgoDirect,<unused>;miopenConvolutionFwdAlgoGEMM:gemm,0.1176,0,rocBlas,<unused>;miopenConvolutionFwdAlgoWinograd:ConvBinWinogradRxSf2x3g1,0.270719,0,miopenConvolutionFwdAlgoWinograd,<unused>
256-17-17-1x7-256-17-17-1-0x3-1x1-1x1-0-NCHW-FP32-F=miopenConvolutionFwdAlgoWinograd:ConvBinWinogradRxSf2x3g1,0.271999,0,miopenConvolutionFwdAlgoWinograd,<unused>;miopenConvolutionFwdAlgoGEMM:gemm,0.097439,2071552,rocBlas,<unused>
256-17-17-7x1-320-17-17-1-3x0-1x1-1x1-0-NCHW-FP32-F=miopenConvolutionFwdAlgoWinograd:ConvBinWinogradRxSf2x3g1,0.2144,0,miopenConvolutionFwdAlgoWinograd,<unused>;miopenConvolutionFwdAlgoGEMM:gemm,0.099679,2071552,rocBlas,<unused>
320-17-17-3x3-320-8-8-1-0x0-2x2-1x1-0-NCHW-FP32-F=miopenConvolutionFwdAlgoImplicitGEMM:ConvHipImplicitGemmV4R4Fwd,0.384799,0,miopenConvolutionFwdAlgoImplicitGEMM,<unused>;miopenConvolutionFwdAlgoDirect:ConvOclDirectFwd,0.896477,0,miopenConvolutionFwdAlgoDirect,<unused>;miopenConvolutionFwdAlgoGEMM:gemm,0.09136,737280,rocBlas,<unused>;miopenConvolutionFwdAlgoWinograd:ConvBinWinogradRxSf2x3g1,0.350239,0,miopenConvolutionFwdAlgoWinograd,<unused>
1536-8-8-1x1-768-8-8-1-0x0-1x1-1x1-0-NCHW-FP32-F=miopenConvolutionFwdAlgoImplicitGEMM:ConvHipImplicitGemmV4R4Fwd,0.20832,0,miopenConvolutionFwdAlgoImplicitGEMM,<unused>;miopenConvolutionFwdAlgoDirect:ConvOclDirectFwd1x1,0.0648,0,miopenConvolutionFwdAlgoDirect,<unused>;miopenConvolutionFwdAlgoGEMM:gemm,0.08464,0,rocBlas,<unused>;miopenConvolutionFwdAlgoWinograd:ConvBinWinogradRxSf2x3g1,0.399998,0,miopenConvolutionFwdAlgoWinograd,<unused>
1536-8-8-1x1-256-8-8-1-0x0-1x1-1x1-0-NCHW-FP32-F=miopenConvolutionFwdAlgoImplicitGEMM:ConvHipImplicitGemmV4R4Fwd,0.18608,0,miopenConvolutionFwdAlgoImplicitGEMM,<unused>;miopenConvolutionFwdAlgoDirect:ConvOclDirectFwd1x1,0.05632,0,miopenConvolutionFwdAlgoDirect,<unused>;miopenConvolutionFwdAlgoGEMM:gemm,0.07248,0,rocBlas,<unused>;miopenConvolutionFwdAlgoWinograd:ConvBinWinogradRxSf2x3g1,0.400638,0,miopenConvolutionFwdAlgoWinograd,<unused>
384-8-8-1x3-256-8-8-1-0x1-1x1-1x1-0-NCHW-FP32-F=miopenConvolutionFwdAlgoImplicitGEMM:ConvHipImplicitGemmV4R4Fwd,0.18112,0,miopenConvolutionFwdAlgoImplicitGEMM,<unused>;miopenConvolutionFwdAlgoGEMM:gemm,0.07808,294912,rocBlas,<unused>;miopenConvolutionFwdAlgoWinograd:ConvBinWinogradRxSf2x3g1,0.115359,0,miopenConvolutionFwdAlgoWinograd,<unused>
384-8-8-3x1-256-8-8-1-1x0-1x1-1x1-0-NCHW-FP32-F=miopenConvolutionFwdAlgoImplicitGEMM:ConvHipImplicitGemmV4R4Fwd,0.17936,0,miopenConvolutionFwdAlgoImplicitGEMM,<unused>;miopenConvolutionFwdAlgoGEMM:gemm,0.07856,294912,rocBlas,<unused>;miopenConvolutionFwdAlgoWinograd:ConvBinWinogradRxSf2x3g1,0.11872,0,miopenConvolutionFwdAlgoWinograd,<unused>
384-8-8-3x1-448-8-8-1-1x0-1x1-1x1-0-NCHW-FP32-F=miopenConvolutionFwdAlgoImplicitGEMM:ConvHipImplicitGemmV4R4Fwd,0.17952,0,miopenConvolutionFwdAlgoImplicitGEMM,<unused>;miopenConvolutionFwdAlgoGEMM:gemm,0.07232,294912,rocBlas,<unused>;miopenConvolutionFwdAlgoWinograd:ConvBinWinogradRxSf2x3g1,0.118079,0,miopenConvolutionFwdAlgoWinograd,<unused>
448-8-8-1x3-512-8-8-1-0x1-1x1-1x1-0-NCHW-FP32-F=miopenConvolutionFwdAlgoImplicitGEMM:ConvHipImplicitGemmV4R4Fwd,0.199199,0,miopenConvolutionFwdAlgoImplicitGEMM,<unused>;miopenConvolutionFwdAlgoGEMM:gemm,0.076319,344064,rocBlas,<unused>;miopenConvolutionFwdAlgoWinograd:ConvBinWinogradRxSf2x3g1,0.135999,0,miopenConvolutionFwdAlgoWinograd,<unused>
512-8-8-1x3-256-8-8-1-0x1-1x1-1x1-0-NCHW-FP32-F=miopenConvolutionFwdAlgoImplicitGEMM:ConvHipImplicitGemmV4R4Fwd,0.223839,0,miopenConvolutionFwdAlgoImplicitGEMM,<unused>;miopenConvolutionFwdAlgoGEMM:gemm,0.0872,393216,rocBlas,<unused>;miopenConvolutionFwdAlgoWinograd:ConvBinWinogradRxSf2x3g1,0.15264,0,miopenConvolutionFwdAlgoWinograd,<unused>
512-8-8-3x1-256-8-8-1-1x0-1x1-1x1-0-NCHW-FP32-F=miopenConvolutionFwdAlgoImplicitGEMM:ConvHipImplicitGemmV4R4Fwd,0.230079,0,miopenConvolutionFwdAlgoImplicitGEMM,<unused>;miopenConvolutionFwdAlgoGEMM:gemm,0.08912,393216,rocBlas,<unused>;miopenConvolutionFwdAlgoWinograd:ConvBinWinogradRxSf2x3g1,0.15248,0,miopenConvolutionFwdAlgoWinograd,<unused>
