dockerfiles/miopen/gfx906_60.HIP.2_3_0.ufdb.txt
3-224-224-7x7-64-112-112-1-3x3-2x2-1x1-0-NCHW-FP32-F=miopenConvolutionFwdAlgoDirect:ConvAsm7x7c3h224w224k64u2v2p3q3f1,0.04544,0,miopenConvolutionFwdAlgoDirect,<unused>;miopenConvolutionFwdAlgoGEMM:gemm,0.0952,7375872,rocBlas,<unused>;miopenConvolutionFwdAlgoWinograd:ConvBinWinogradRxSf2x3,0.07376,0,miopenConvolutionFwdAlgoWinograd,3x224x224x7x7x64x112x112x1xNCHWxFP32x3x3x2x2x1x1x1x1
64-56-56-1x1-64-56-56-1-0x0-1x1-1x1-0-NCHW-FP32-F=miopenConvolutionFwdAlgoImplicitGEMM:ConvHipImplicitGemmV4R4Fwd,0.0184,0,miopenConvolutionFwdAlgoImplicitGEMM,64x56x56x1x1x64x56x56x1xNCHWxFP32x0x0x1x1x1x1x1x1;miopenConvolutionFwdAlgoDirect:ConvAsm1x1U,0.01264,0,miopenConvolutionFwdAlgoDirect,<unused>;miopenConvolutionFwdAlgoGEMM:gemm,0.0256,0,rocBlas,<unused>;miopenConvolutionFwdAlgoWinograd:ConvBinWinogradRxS,0.03584,0,miopenConvolutionFwdAlgoWinograd,64x56x56x1x1x64x56x56x1xNCHWxFP32x0x0x1x1x1x1x1x1
64-56-56-3x3-64-56-56-1-1x1-1x1-1x1-0-NCHW-FP32-F=miopenConvolutionFwdAlgoWinograd:ConvBinWinograd3x3U,0.03536,0,miopenConvolutionFwdAlgoWinograd,64x56x56x3x3x64x56x56x1xNCHWxFP32x1x1x1x1x1x1x1x1
128-56-56-1x1-256-56-56-1-0x0-1x1-1x1-0-NCHW-FP32-F=miopenConvolutionFwdAlgoImplicitGEMM:ConvHipImplicitGemmV4R4Fwd,0.04192,0,miopenConvolutionFwdAlgoImplicitGEMM,128x56x56x1x1x256x56x56x1xNCHWxFP32x0x0x1x1x1x1x1x1;miopenConvolutionFwdAlgoDirect:ConvOclDirectFwd1x1,0.04176,0,miopenConvolutionFwdAlgoDirect,<unused>;miopenConvolutionFwdAlgoGEMM:gemm,0.0536,0,rocBlas,<unused>;miopenConvolutionFwdAlgoWinograd:ConvBinWinogradRxSf3x2,0.08848,0,miopenConvolutionFwdAlgoWinograd,128x56x56x1x1x256x56x56x1xNCHWxFP32x0x0x1x1x1x1x1x1
256-56-56-1x1-64-56-56-1-0x0-1x1-1x1-0-NCHW-FP32-F=miopenConvolutionFwdAlgoImplicitGEMM:ConvHipImplicitGemmV4R4Fwd,0.05072,0,miopenConvolutionFwdAlgoImplicitGEMM,256x56x56x1x1x64x56x56x1xNCHWxFP32x0x0x1x1x1x1x1x1;miopenConvolutionFwdAlgoDirect:ConvAsm1x1U,0.02896,0,miopenConvolutionFwdAlgoDirect,<unused>;miopenConvolutionFwdAlgoGEMM:gemm,0.06,0,rocBlas,<unused>;miopenConvolutionFwdAlgoWinograd:ConvBinWinogradRxS,0.0736,0,miopenConvolutionFwdAlgoWinograd,256x56x56x1x1x64x56x56x1xNCHWxFP32x0x0x1x1x1x1x1x1
64-56-56-1x1-256-56-56-1-0x0-1x1-1x1-0-NCHW-FP32-F=miopenConvolutionFwdAlgoImplicitGEMM:ConvHipImplicitGemmV4R4Fwd,0.03072,0,miopenConvolutionFwdAlgoImplicitGEMM,64x56x56x1x1x256x56x56x1xNCHWxFP32x0x0x1x1x1x1x1x1;miopenConvolutionFwdAlgoDirect:ConvOclDirectFwd1x1,0.02064,0,miopenConvolutionFwdAlgoDirect,<unused>;miopenConvolutionFwdAlgoGEMM:gemm,0.03616,0,rocBlas,<unused>;miopenConvolutionFwdAlgoWinograd:ConvBinWinogradRxSf3x2,0.064,0,miopenConvolutionFwdAlgoWinograd,64x56x56x1x1x256x56x56x1xNCHWxFP32x0x0x1x1x1x1x1x1
256-56-56-1x1-128-56-56-1-0x0-1x1-1x1-0-NCHW-FP32-F=miopenConvolutionFwdAlgoImplicitGEMM:ConvHipImplicitGemmV4R4Fwd,0.05696,0,miopenConvolutionFwdAlgoImplicitGEMM,256x56x56x1x1x128x56x56x1xNCHWxFP32x0x0x1x1x1x1x1x1;miopenConvolutionFwdAlgoDirect:ConvOclDirectFwd1x1,0.03952,0,miopenConvolutionFwdAlgoDirect,<unused>;miopenConvolutionFwdAlgoGEMM:gemm,0.05616,0,rocBlas,<unused>;miopenConvolutionFwdAlgoWinograd:ConvBinWinogradRxSf3x2,0.08464,0,miopenConvolutionFwdAlgoWinograd,256x56x56x1x1x128x56x56x1xNCHWxFP32x0x0x1x1x1x1x1x1
128-56-56-3x3-128-28-28-1-1x1-2x2-1x1-0-NCHW-FP32-F=miopenConvolutionFwdAlgoDirect:ConvOclDirectFwd,0.50032,0,miopenConvolutionFwdAlgoDirect,<unused>;miopenConvolutionFwdAlgoGEMM:gemm,0.09936,3612672,rocBlas,<unused>;miopenConvolutionFwdAlgoWinograd:ConvBinWinogradRxSf2x3,0.13824,0,miopenConvolutionFwdAlgoWinograd,128x56x56x3x3x128x28x28x1xNCHWxFP32x1x1x2x2x1x1x1x1
384-28-28-1x1-512-28-28-1-0x0-1x1-1x1-0-NCHW-FP32-F=miopenConvolutionFwdAlgoDirect:ConvAsm1x1U,0.07184,0,miopenConvolutionFwdAlgoDirect,<unused>;miopenConvolutionFwdAlgoGEMM:gemm,0.06192,0,rocBlas,<unused>;miopenConvolutionFwdAlgoWinograd:ConvBinWinogradRxSf2x3,0.17552,0,miopenConvolutionFwdAlgoWinograd,384x28x28x1x1x512x28x28x1xNCHWxFP32x0x0x1x1x1x1x1x1
512-28-28-1x1-128-28-28-1-0x0-1x1-1x1-0-NCHW-FP32-F=miopenConvolutionFwdAlgoDirect:ConvOclDirectFwd1x1,0.0368,0,miopenConvolutionFwdAlgoDirect,<unused>;miopenConvolutionFwdAlgoGEMM:gemm,0.11136,0,rocBlas,<unused>;miopenConvolutionFwdAlgoWinograd:ConvBinWinogradRxSf2x3,0.12464,0,miopenConvolutionFwdAlgoWinograd,512x28x28x1x1x128x28x28x1xNCHWxFP32x0x0x1x1x1x1x1x1
128-28-28-3x3-128-28-28-1-1x1-1x1-1x1-0-NCHW-FP32-F=miopenConvolutionFwdAlgoWinograd:ConvBinWinograd3x3U,0.05328,0,miopenConvolutionFwdAlgoWinograd,128x28x28x3x3x128x28x28x1xNCHWxFP32x1x1x1x1x1x1x1x1
128-28-28-1x1-512-28-28-1-0x0-1x1-1x1-0-NCHW-FP32-F=miopenConvolutionFwdAlgoDirect:ConvOclDirectFwd1x1,0.02656,0,miopenConvolutionFwdAlgoDirect,<unused>;miopenConvolutionFwdAlgoGEMM:gemm,0.04896,0,rocBlas,<unused>;miopenConvolutionFwdAlgoWinograd:ConvBinWinogradRxS,0.08224,0,miopenConvolutionFwdAlgoWinograd,128x28x28x1x1x512x28x28x1xNCHWxFP32x0x0x1x1x1x1x1x1
512-28-28-1x1-256-28-28-1-0x0-1x1-1x1-0-NCHW-FP32-F=miopenConvolutionFwdAlgoDirect:ConvAsm1x1U,0.04944,0,miopenConvolutionFwdAlgoDirect,<unused>;miopenConvolutionFwdAlgoGEMM:gemm,0.12064,0,rocBlas,<unused>;miopenConvolutionFwdAlgoWinograd:ConvBinWinogradRxSf2x3,0.12576,0,miopenConvolutionFwdAlgoWinograd,512x28x28x1x1x256x28x28x1xNCHWxFP32x0x0x1x1x1x1x1x1
256-28-28-3x3-256-14-14-1-1x1-2x2-1x1-0-NCHW-FP32-F=miopenConvolutionFwdAlgoDirect:ConvOclDirectFwd,0.793279,0,miopenConvolutionFwdAlgoDirect,<unused>;miopenConvolutionFwdAlgoGEMM:gemm,0.09952,1806336,rocBlas,<unused>;miopenConvolutionFwdAlgoWinograd:ConvBinWinogradRxSf2x3,0.2336,0,miopenConvolutionFwdAlgoWinograd,256x28x28x3x3x256x14x14x1xNCHWxFP32x1x1x2x2x1x1x1x1
768-14-14-1x1-1024-14-14-1-0x0-1x1-1x1-0-NCHW-FP32-F=miopenConvolutionFwdAlgoDirect:ConvAsm1x1U,0.11904,0,miopenConvolutionFwdAlgoDirect,<unused>;miopenConvolutionFwdAlgoGEMM:gemm,0.08464,0,rocBlas,<unused>;miopenConvolutionFwdAlgoWinograd:ConvBinWinogradRxSf3x2,0.18848,0,miopenConvolutionFwdAlgoWinograd,768x14x14x1x1x1024x14x14x1xNCHWxFP32x0x0x1x1x1x1x1x1
1024-14-14-1x1-256-14-14-1-0x0-1x1-1x1-0-NCHW-FP32-F=miopenConvolutionFwdAlgoDirect:ConvOclDirectFwd1x1,0.04576,0,miopenConvolutionFwdAlgoDirect,<unused>;miopenConvolutionFwdAlgoGEMM:gemm,0.088,0,rocBlas,<unused>;miopenConvolutionFwdAlgoWinograd:ConvBinWinogradRxSf2x3,0.22384,0,miopenConvolutionFwdAlgoWinograd,1024x14x14x1x1x256x14x14x1xNCHWxFP32x0x0x1x1x1x1x1x1
256-14-14-3x3-256-14-14-1-1x1-1x1-1x1-0-NCHW-FP32-F=miopenConvolutionFwdAlgoWinograd:ConvBinWinogradRxS,0.08112,0,miopenConvolutionFwdAlgoWinograd,256x14x14x3x3x256x14x14x1xNCHWxFP32x1x1x1x1x1x1x1x1
256-14-14-1x1-1024-14-14-1-0x0-1x1-1x1-0-NCHW-FP32-F=miopenConvolutionFwdAlgoDirect:ConvAsm1x1U,0.04,0,miopenConvolutionFwdAlgoDirect,<unused>;miopenConvolutionFwdAlgoGEMM:gemm,0.04304,0,rocBlas,<unused>;miopenConvolutionFwdAlgoWinograd:ConvBinWinogradRxSf3x2,0.08384,0,miopenConvolutionFwdAlgoWinograd,256x14x14x1x1x1024x14x14x1xNCHWxFP32x0x0x1x1x1x1x1x1
1024-14-14-1x1-512-14-14-1-0x0-1x1-1x1-0-NCHW-FP32-F=miopenConvolutionFwdAlgoDirect:ConvAsm1x1U,0.07136,0,miopenConvolutionFwdAlgoDirect,<unused>;miopenConvolutionFwdAlgoGEMM:gemm,0.072,0,rocBlas,<unused>;miopenConvolutionFwdAlgoWinograd:ConvBinWinogradRxSf2x3,0.22528,0,miopenConvolutionFwdAlgoWinograd,1024x14x14x1x1x512x14x14x1xNCHWxFP32x0x0x1x1x1x1x1x1
512-14-14-3x3-512-7-7-1-1x1-2x2-1x1-0-NCHW-FP32-F=miopenConvolutionFwdAlgoDirect:ConvOclDirectFwd,1.22992,0,miopenConvolutionFwdAlgoDirect,<unused>;miopenConvolutionFwdAlgoGEMM:gemm,0.36064,903168,rocBlas,<unused>;miopenConvolutionFwdAlgoWinograd:ConvBinWinogradRxSf2x3,0.44256,0,miopenConvolutionFwdAlgoWinograd,512x14x14x3x3x512x7x7x1xNCHWxFP32x1x1x2x2x1x1x1x1
1536-7-7-1x1-2048-7-7-1-0x0-1x1-1x1-0-NCHW-FP32-F=miopenConvolutionFwdAlgoDirect:ConvOclDirectFwd1x1,0.21088,0,miopenConvolutionFwdAlgoDirect,<unused>;miopenConvolutionFwdAlgoGEMM:gemm,0.1072,0,rocBlas,<unused>;miopenConvolutionFwdAlgoWinograd:ConvBinWinogradRxSf2x3,0.616319,0,miopenConvolutionFwdAlgoWinograd,1536x7x7x1x1x2048x7x7x1xNCHWxFP32x0x0x1x1x1x1x1x1
2048-7-7-1x1-512-7-7-1-0x0-1x1-1x1-0-NCHW-FP32-F=miopenConvolutionFwdAlgoDirect:ConvOclDirectFwd1x1,0.06464,0,miopenConvolutionFwdAlgoDirect,<unused>;miopenConvolutionFwdAlgoGEMM:gemm,0.0744,0,rocBlas,<unused>;miopenConvolutionFwdAlgoWinograd:ConvBinWinogradRxSf2x3,0.42464,0,miopenConvolutionFwdAlgoWinograd,2048x7x7x1x1x512x7x7x1xNCHWxFP32x0x0x1x1x1x1x1x1
512-7-7-3x3-512-7-7-1-1x1-1x1-1x1-0-NCHW-FP32-F=miopenConvolutionFwdAlgoWinograd:ConvBinWinograd3x3U,0.12896,0,miopenConvolutionFwdAlgoWinograd,512x7x7x3x3x512x7x7x1xNCHWxFP32x1x1x1x1x1x1x1x1
512-7-7-1x1-2048-7-7-1-0x0-1x1-1x1-0-NCHW-FP32-F=miopenConvolutionFwdAlgoDirect:ConvOclDirectFwd1x1,0.0576,0,miopenConvolutionFwdAlgoDirect,<unused>;miopenConvolutionFwdAlgoGEMM:gemm,0.052,0,rocBlas,<unused>;miopenConvolutionFwdAlgoWinograd:ConvBinWinogradRxSf2x3,0.2248,0,miopenConvolutionFwdAlgoWinograd,512x7x7x1x1x2048x7x7x1xNCHWxFP32x0x0x1x1x1x1x1x1
3-299-299-3x3-32-149-149-1-0x0-2x2-1x1-0-NCHW-FP32-F=miopenConvolutionFwdAlgoDirect:ConvOclDirectFwd,0.03264,0,miopenConvolutionFwdAlgoDirect,<unused>;miopenConvolutionFwdAlgoGEMM:gemm,0.07248,2397708,rocBlas,<unused>;miopenConvolutionFwdAlgoWinograd:ConvBinWinogradRxSf2x3,0.0416,0,miopenConvolutionFwdAlgoWinograd,3x299x299x3x3x32x149x149x1xNCHWxFP32x0x0x2x2x1x1x1x1
32-149-149-3x3-32-147-147-1-0x0-1x1-1x1-0-NCHW-FP32-F=miopenConvolutionFwdAlgoDirect:ConvOclDirectFwd,0.15088,0,miopenConvolutionFwdAlgoDirect,<unused>;miopenConvolutionFwdAlgoGEMM:gemm,0.14736,24893568,rocBlas,<unused>;miopenConvolutionFwdAlgoWinograd:ConvBinWinogradRxS,0.04848,0,miopenConvolutionFwdAlgoWinograd,32x149x149x3x3x32x147x147x1xNCHWxFP32x0x0x1x1x1x1x1x1
32-147-147-3x3-64-147-147-1-1x1-1x1-1x1-0-NCHW-FP32-F=miopenConvolutionFwdAlgoWinograd:ConvBinWinograd3x3U,0.07072,0,miopenConvolutionFwdAlgoWinograd,32x147x147x3x3x64x147x147x1xNCHWxFP32x1x1x1x1x1x1x1x1
64-73-73-1x1-80-73-73-1-0x0-1x1-1x1-0-NCHW-FP32-F=miopenConvolutionFwdAlgoDirect:ConvAsm1x1U,0.0192,0,miopenConvolutionFwdAlgoDirect,<unused>;miopenConvolutionFwdAlgoGEMM:gemm,0.03552,0,rocBlas,<unused>;miopenConvolutionFwdAlgoWinograd:ConvBinWinogradRxSf3x2,0.04416,0,miopenConvolutionFwdAlgoWinograd,64x73x73x1x1x80x73x73x1xNCHWxFP32x0x0x1x1x1x1x1x1
80-73-73-3x3-192-71-71-1-0x0-1x1-1x1-0-NCHW-FP32-F=miopenConvolutionFwdAlgoDirect:ConvOclDirectFwd,0.52048,0,miopenConvolutionFwdAlgoDirect,<unused>;miopenConvolutionFwdAlgoGEMM:gemm,0.21792,14518080,rocBlas,<unused>;miopenConvolutionFwdAlgoWinograd:ConvBinWinogradRxS,0.11152,0,miopenConvolutionFwdAlgoWinograd,80x73x73x3x3x192x71x71x1xNCHWxFP32x0x0x1x1x1x1x1x1
192-35-35-1x1-64-35-35-1-0x0-1x1-1x1-0-NCHW-FP32-F=miopenConvolutionFwdAlgoDirect:ConvAsm1x1U,0.01936,0,miopenConvolutionFwdAlgoDirect,<unused>;miopenConvolutionFwdAlgoGEMM:gemm,0.03632,0,rocBlas,<unused>;miopenConvolutionFwdAlgoWinograd:ConvBinWinogradRxS,0.0624,0,miopenConvolutionFwdAlgoWinograd,192x35x35x1x1x64x35x35x1xNCHWxFP32x0x0x1x1x1x1x1x1
192-35-35-1x1-48-35-35-1-0x0-1x1-1x1-0-NCHW-FP32-F=miopenConvolutionFwdAlgoDirect:ConvAsm1x1U,0.01488,0,miopenConvolutionFwdAlgoDirect,<unused>;miopenConvolutionFwdAlgoGEMM:gemm,0.0584,0,rocBlas,<unused>;miopenConvolutionFwdAlgoWinograd:ConvBinWinogradRxS,0.06224,0,miopenConvolutionFwdAlgoWinograd,192x35x35x1x1x48x35x35x1xNCHWxFP32x0x0x1x1x1x1x1x1
48-35-35-5x5-64-35-35-1-2x2-1x1-1x1-0-NCHW-FP32-F=miopenConvolutionFwdAlgoDirect:ConvOclDirectFwd,0.1576,0,miopenConvolutionFwdAlgoDirect,<unused>;miopenConvolutionFwdAlgoGEMM:gemm,0.08368,5880000,rocBlas,<unused>;miopenConvolutionFwdAlgoWinograd:ConvBinWinogradRxSf2x3,0.06416,0,miopenConvolutionFwdAlgoWinograd,48x35x35x5x5x64x35x35x1xNCHWxFP32x2x2x1x1x1x1x1x1
64-35-35-3x3-96-35-35-1-1x1-1x1-1x1-0-NCHW-FP32-F=miopenConvolutionFwdAlgoWinograd:ConvBinWinograd3x3U,0.04192,0,miopenConvolutionFwdAlgoWinograd,64x35x35x3x3x96x35x35x1xNCHWxFP32x1x1x1x1x1x1x1x1
96-35-35-3x3-96-35-35-1-1x1-1x1-1x1-0-NCHW-FP32-F=miopenConvolutionFwdAlgoWinograd:ConvBinWinograd3x3U,0.0408,0,miopenConvolutionFwdAlgoWinograd,96x35x35x3x3x96x35x35x1xNCHWxFP32x1x1x1x1x1x1x1x1
192-35-35-1x1-32-35-35-1-0x0-1x1-1x1-0-NCHW-FP32-F=miopenConvolutionFwdAlgoDirect:ConvAsm1x1U,0.01504,0,miopenConvolutionFwdAlgoDirect,<unused>;miopenConvolutionFwdAlgoGEMM:gemm,0.056,0,rocBlas,<unused>;miopenConvolutionFwdAlgoWinograd:ConvBinWinogradRxS,0.06112,0,miopenConvolutionFwdAlgoWinograd,192x35x35x1x1x32x35x35x1xNCHWxFP32x0x0x1x1x1x1x1x1
256-35-35-1x1-64-35-35-1-0x0-1x1-1x1-0-NCHW-FP32-F=miopenConvolutionFwdAlgoDirect:ConvAsm1x1U,0.02096,0,miopenConvolutionFwdAlgoDirect,<unused>;miopenConvolutionFwdAlgoGEMM:gemm,0.0712,0,rocBlas,<unused>;miopenConvolutionFwdAlgoWinograd:ConvBinWinogradRxS,0.08096,0,miopenConvolutionFwdAlgoWinograd,256x35x35x1x1x64x35x35x1xNCHWxFP32x0x0x1x1x1x1x1x1
256-35-35-1x1-48-35-35-1-0x0-1x1-1x1-0-NCHW-FP32-F=miopenConvolutionFwdAlgoDirect:ConvAsm1x1U,0.01728,0,miopenConvolutionFwdAlgoDirect,<unused>;miopenConvolutionFwdAlgoGEMM:gemm,0.06976,0,rocBlas,<unused>;miopenConvolutionFwdAlgoWinograd:ConvBinWinogradRxS,0.08144,0,miopenConvolutionFwdAlgoWinograd,256x35x35x1x1x48x35x35x1xNCHWxFP32x0x0x1x1x1x1x1x1
288-35-35-1x1-64-35-35-1-0x0-1x1-1x1-0-NCHW-FP32-F=miopenConvolutionFwdAlgoDirect:ConvAsm1x1U,0.0224,0,miopenConvolutionFwdAlgoDirect,<unused>;miopenConvolutionFwdAlgoGEMM:gemm,0.06528,0,rocBlas,<unused>;miopenConvolutionFwdAlgoWinograd:ConvBinWinogradRxS,0.08096,0,miopenConvolutionFwdAlgoWinograd,288x35x35x1x1x64x35x35x1xNCHWxFP32x0x0x1x1x1x1x1x1
288-35-35-1x1-48-35-35-1-0x0-1x1-1x1-0-NCHW-FP32-F=miopenConvolutionFwdAlgoDirect:ConvAsm1x1U,0.01824,0,miopenConvolutionFwdAlgoDirect,<unused>;miopenConvolutionFwdAlgoGEMM:gemm,0.07504,0,rocBlas,<unused>;miopenConvolutionFwdAlgoWinograd:ConvBinWinogradRxS,0.08768,0,miopenConvolutionFwdAlgoWinograd,288x35x35x1x1x48x35x35x1xNCHWxFP32x0x0x1x1x1x1x1x1
288-35-35-3x3-384-17-17-1-0x0-2x2-1x1-0-NCHW-FP32-F=miopenConvolutionFwdAlgoDirect:ConvOclDirectFwd,1.3592,0,miopenConvolutionFwdAlgoDirect,<unused>;miopenConvolutionFwdAlgoGEMM:gemm,0.11344,2996352,rocBlas,<unused>;miopenConvolutionFwdAlgoWinograd:ConvBinWinogradRxSf2x3,0.2608,0,miopenConvolutionFwdAlgoWinograd,288x35x35x3x3x384x17x17x1xNCHWxFP32x0x0x2x2x1x1x1x1
96-35-35-3x3-96-17-17-1-0x0-2x2-1x1-0-NCHW-FP32-F=miopenConvolutionFwdAlgoDirect:ConvOclDirectFwd,0.36128,0,miopenConvolutionFwdAlgoDirect,<unused>;miopenConvolutionFwdAlgoGEMM:gemm,0.0456,998784,rocBlas,<unused>;miopenConvolutionFwdAlgoWinograd:ConvBinWinogradRxSf2x3,0.10416,0,miopenConvolutionFwdAlgoWinograd,96x35x35x3x3x96x17x17x1xNCHWxFP32x0x0x2x2x1x1x1x1
768-17-17-1x1-192-17-17-1-0x0-1x1-1x1-0-NCHW-FP32-F=miopenConvolutionFwdAlgoDirect:ConvAsm1x1U,0.03488,0,miopenConvolutionFwdAlgoDirect,<unused>;miopenConvolutionFwdAlgoGEMM:gemm,0.148,0,rocBlas,<unused>;miopenConvolutionFwdAlgoWinograd:ConvBinWinogradRxSf2x3,0.17312,0,miopenConvolutionFwdAlgoWinograd,768x17x17x1x1x192x17x17x1xNCHWxFP32x0x0x1x1x1x1x1x1
768-17-17-1x1-128-17-17-1-0x0-1x1-1x1-0-NCHW-FP32-F=miopenConvolutionFwdAlgoDirect:ConvAsm1x1U,0.03376,0,miopenConvolutionFwdAlgoDirect,<unused>;miopenConvolutionFwdAlgoGEMM:gemm,0.07808,0,rocBlas,<unused>;miopenConvolutionFwdAlgoWinograd:ConvBinWinogradRxSf2x3,0.17296,0,miopenConvolutionFwdAlgoWinograd,768x17x17x1x1x128x17x17x1xNCHWxFP32x0x0x1x1x1x1x1x1
128-17-17-1x7-128-17-17-1-0x3-1x1-1x1-0-NCHW-FP32-F=miopenConvolutionFwdAlgoWinograd:ConvBinWinogradRxS,0.12336,0,miopenConvolutionFwdAlgoWinograd,128x17x17x1x7x128x17x17x1xNCHWxFP32x0x3x1x1x1x1x1x1;miopenConvolutionFwdAlgoGEMM:gemm,0.05248,1035776,rocBlas,<unused>
128-17-17-7x1-192-17-17-1-3x0-1x1-1x1-0-NCHW-FP32-F=miopenConvolutionFwdAlgoWinograd:ConvBinWinogradRxSf2x3,0.10768,0,miopenConvolutionFwdAlgoWinograd,128x17x17x7x1x192x17x17x1xNCHWxFP32x3x0x1x1x1x1x1x1;miopenConvolutionFwdAlgoGEMM:gemm,0.0552,1035776,rocBlas,<unused>
128-17-17-7x1-128-17-17-1-3x0-1x1-1x1-0-NCHW-FP32-F=miopenConvolutionFwdAlgoWinograd:ConvBinWinogradRxSf2x3,0.09904,0,miopenConvolutionFwdAlgoWinograd,128x17x17x7x1x128x17x17x1xNCHWxFP32x3x0x1x1x1x1x1x1;miopenConvolutionFwdAlgoGEMM:gemm,0.0464,1035776,rocBlas,<unused>
128-17-17-1x7-192-17-17-1-0x3-1x1-1x1-0-NCHW-FP32-F=miopenConvolutionFwdAlgoWinograd:ConvBinWinogradRxSf2x3,0.12288,0,miopenConvolutionFwdAlgoWinograd,128x17x17x1x7x192x17x17x1xNCHWxFP32x0x3x1x1x1x1x1x1;miopenConvolutionFwdAlgoGEMM:gemm,0.04576,1035776,rocBlas,<unused>
768-17-17-1x1-160-17-17-1-0x0-1x1-1x1-0-NCHW-FP32-F=miopenConvolutionFwdAlgoDirect:ConvAsm1x1U,0.03408,0,miopenConvolutionFwdAlgoDirect,<unused>;miopenConvolutionFwdAlgoGEMM:gemm,0.1448,0,rocBlas,<unused>;miopenConvolutionFwdAlgoWinograd:ConvBinWinogradRxSf2x3,0.17312,0,miopenConvolutionFwdAlgoWinograd,768x17x17x1x1x160x17x17x1xNCHWxFP32x0x0x1x1x1x1x1x1
160-17-17-1x7-160-17-17-1-0x3-1x1-1x1-0-NCHW-FP32-F=miopenConvolutionFwdAlgoWinograd:ConvBinWinogradRxS,0.14864,0,miopenConvolutionFwdAlgoWinograd,160x17x17x1x7x160x17x17x1xNCHWxFP32x0x3x1x1x1x1x1x1;miopenConvolutionFwdAlgoGEMM:gemm,0.05024,1294720,rocBlas,<unused>
160-17-17-7x1-192-17-17-1-3x0-1x1-1x1-0-NCHW-FP32-F=miopenConvolutionFwdAlgoWinograd:ConvBinWinogradRxSf2x3,0.11936,0,miopenConvolutionFwdAlgoWinograd,160x17x17x7x1x192x17x17x1xNCHWxFP32x3x0x1x1x1x1x1x1;miopenConvolutionFwdAlgoGEMM:gemm,0.0544,1294720,rocBlas,<unused>
160-17-17-7x1-160-17-17-1-3x0-1x1-1x1-0-NCHW-FP32-F=miopenConvolutionFwdAlgoWinograd:ConvBinWinogradRxSf2x3,0.11712,0,miopenConvolutionFwdAlgoWinograd,160x17x17x7x1x160x17x17x1xNCHWxFP32x3x0x1x1x1x1x1x1;miopenConvolutionFwdAlgoGEMM:gemm,0.05184,1294720,rocBlas,<unused>
160-17-17-1x7-192-17-17-1-0x3-1x1-1x1-0-NCHW-FP32-F=miopenConvolutionFwdAlgoWinograd:ConvBinWinogradRxSf2x3,0.14736,0,miopenConvolutionFwdAlgoWinograd,160x17x17x1x7x192x17x17x1xNCHWxFP32x0x3x1x1x1x1x1x1;miopenConvolutionFwdAlgoGEMM:gemm,0.05264,1294720,rocBlas,<unused>
192-17-17-1x7-192-17-17-1-0x3-1x1-1x1-0-NCHW-FP32-F=miopenConvolutionFwdAlgoWinograd:ConvBinWinogradRxSf2x3,0.172,0,miopenConvolutionFwdAlgoWinograd,192x17x17x1x7x192x17x17x1xNCHWxFP32x0x3x1x1x1x1x1x1;miopenConvolutionFwdAlgoGEMM:gemm,0.05856,1553664,rocBlas,<unused>
192-17-17-7x1-192-17-17-1-3x0-1x1-1x1-0-NCHW-FP32-F=miopenConvolutionFwdAlgoWinograd:ConvBinWinogradRxSf2x3,0.13824,0,miopenConvolutionFwdAlgoWinograd,192x17x17x7x1x192x17x17x1xNCHWxFP32x3x0x1x1x1x1x1x1;miopenConvolutionFwdAlgoGEMM:gemm,0.0608,1553664,rocBlas,<unused>
192-17-17-3x3-320-8-8-1-0x0-2x2-1x1-0-NCHW-FP32-F=miopenConvolutionFwdAlgoImplicitGEMM:ConvHipImplicitGemmV4R4Fwd,0.21184,0,miopenConvolutionFwdAlgoImplicitGEMM,192x17x17x3x3x320x8x8x1xNCHWxFP32x0x0x2x2x1x1x1x1;miopenConvolutionFwdAlgoDirect:ConvOclDirectFwd,0.648319,0,miopenConvolutionFwdAlgoDirect,<unused>;miopenConvolutionFwdAlgoGEMM:gemm,0.05888,442368,rocBlas,<unused>;miopenConvolutionFwdAlgoWinograd:ConvBinWinogradRxSf2x3,0.18192,0,miopenConvolutionFwdAlgoWinograd,192x17x17x3x3x320x8x8x1xNCHWxFP32x0x0x2x2x1x1x1x1
192-17-17-3x3-192-8-8-1-0x0-2x2-1x1-0-NCHW-FP32-F=miopenConvolutionFwdAlgoImplicitGEMM:ConvHipImplicitGemmV4R4Fwd,0.2152,0,miopenConvolutionFwdAlgoImplicitGEMM,192x17x17x3x3x192x8x8x1xNCHWxFP32x0x0x2x2x1x1x1x1;miopenConvolutionFwdAlgoDirect:ConvOclDirectFwd,0.649599,0,miopenConvolutionFwdAlgoDirect,<unused>;miopenConvolutionFwdAlgoGEMM:gemm,0.05792,442368,rocBlas,<unused>;miopenConvolutionFwdAlgoWinograd:ConvBinWinogradRxSf2x3,0.18384,0,miopenConvolutionFwdAlgoWinograd,192x17x17x3x3x192x8x8x1xNCHWxFP32x0x0x2x2x1x1x1x1
1280-8-8-1x1-320-8-8-1-0x0-1x1-1x1-0-NCHW-FP32-F=miopenConvolutionFwdAlgoImplicitGEMM:ConvHipImplicitGemmV4R4Fwd,0.15024,0,miopenConvolutionFwdAlgoImplicitGEMM,1280x8x8x1x1x320x8x8x1xNCHWxFP32x0x0x1x1x1x1x1x1;miopenConvolutionFwdAlgoDirect:ConvAsm1x1U,0.05072,0,miopenConvolutionFwdAlgoDirect,<unused>;miopenConvolutionFwdAlgoGEMM:gemm,0.04736,0,rocBlas,<unused>;miopenConvolutionFwdAlgoWinograd:ConvBinWinogradRxSf2x3,0.27184,0,miopenConvolutionFwdAlgoWinograd,1280x8x8x1x1x320x8x8x1xNCHWxFP32x0x0x1x1x1x1x1x1
1280-8-8-1x1-384-8-8-1-0x0-1x1-1x1-0-NCHW-FP32-F=miopenConvolutionFwdAlgoImplicitGEMM:ConvHipImplicitGemmV4R4Fwd,0.15264,0,miopenConvolutionFwdAlgoImplicitGEMM,1280x8x8x1x1x384x8x8x1xNCHWxFP32x0x0x1x1x1x1x1x1;miopenConvolutionFwdAlgoDirect:ConvAsm1x1U,0.04816,0,miopenConvolutionFwdAlgoDirect,<unused>;miopenConvolutionFwdAlgoGEMM:gemm,0.0456,0,rocBlas,<unused>;miopenConvolutionFwdAlgoWinograd:ConvBinWinogradRxSf2x3,0.27184,0,miopenConvolutionFwdAlgoWinograd,1280x8x8x1x1x384x8x8x1xNCHWxFP32x0x0x1x1x1x1x1x1
384-8-8-1x3-384-8-8-1-0x1-1x1-1x1-0-NCHW-FP32-F=miopenConvolutionFwdAlgoImplicitGEMM:ConvHipImplicitGemmV4R4Fwd,0.15808,0,miopenConvolutionFwdAlgoImplicitGEMM,384x8x8x1x3x384x8x8x1xNCHWxFP32x0x1x1x1x1x1x1x1;miopenConvolutionFwdAlgoGEMM:gemm,0.04576,294912,rocBlas,<unused>;miopenConvolutionFwdAlgoWinograd:ConvBinWinogradRxS,0.09872,0,miopenConvolutionFwdAlgoWinograd,384x8x8x1x3x384x8x8x1xNCHWxFP32x0x1x1x1x1x1x1x1
384-8-8-3x1-384-8-8-1-1x0-1x1-1x1-0-NCHW-FP32-F=miopenConvolutionFwdAlgoImplicitGEMM:ConvHipImplicitGemmV4R4Fwd,0.15456,0,miopenConvolutionFwdAlgoImplicitGEMM,384x8x8x3x1x384x8x8x1xNCHWxFP32x1x0x1x1x1x1x1x1;miopenConvolutionFwdAlgoGEMM:gemm,0.04656,294912,rocBlas,<unused>;miopenConvolutionFwdAlgoWinograd:ConvBinWinogradRxSf2x3,0.09936,0,miopenConvolutionFwdAlgoWinograd,384x8x8x3x1x384x8x8x1xNCHWxFP32x1x0x1x1x1x1x1x1
1280-8-8-1x1-448-8-8-1-0x0-1x1-1x1-0-NCHW-FP32-F=miopenConvolutionFwdAlgoImplicitGEMM:ConvHipImplicitGemmV4R4Fwd,0.15136,0,miopenConvolutionFwdAlgoImplicitGEMM,1280x8x8x1x1x448x8x8x1xNCHWxFP32x0x0x1x1x1x1x1x1;miopenConvolutionFwdAlgoDirect:ConvAsm1x1U,0.05008,0,miopenConvolutionFwdAlgoDirect,<unused>;miopenConvolutionFwdAlgoGEMM:gemm,0.0456,0,rocBlas,<unused>;miopenConvolutionFwdAlgoWinograd:ConvBinWinogradRxSf2x3,0.27088,0,miopenConvolutionFwdAlgoWinograd,1280x8x8x1x1x448x8x8x1xNCHWxFP32x0x0x1x1x1x1x1x1
448-8-8-3x3-384-8-8-1-1x1-1x1-1x1-0-NCHW-FP32-F=miopenConvolutionFwdAlgoWinograd:ConvBinWinograd3x3U,0.10912,0,miopenConvolutionFwdAlgoWinograd,448x8x8x3x3x384x8x8x1xNCHWxFP32x1x1x1x1x1x1x1x1
1280-8-8-1x1-192-8-8-1-0x0-1x1-1x1-0-NCHW-FP32-F=miopenConvolutionFwdAlgoImplicitGEMM:ConvHipImplicitGemmV4R4Fwd,0.15168,0,miopenConvolutionFwdAlgoImplicitGEMM,1280x8x8x1x1x192x8x8x1xNCHWxFP32x0x0x1x1x1x1x1x1;miopenConvolutionFwdAlgoDirect:ConvAsm1x1U,0.04864,0,miopenConvolutionFwdAlgoDirect,<unused>;miopenConvolutionFwdAlgoGEMM:gemm,0.04,0,rocBlas,<unused>;miopenConvolutionFwdAlgoWinograd:ConvBinWinogradRxSf2x3,0.27008,0,miopenConvolutionFwdAlgoWinograd,1280x8x8x1x1x192x8x8x1xNCHWxFP32x0x0x1x1x1x1x1x1
2048-8-8-1x1-320-8-8-1-0x0-1x1-1x1-0-NCHW-FP32-F=miopenConvolutionFwdAlgoImplicitGEMM:ConvHipImplicitGemmV4R4Fwd,0.27856,0,miopenConvolutionFwdAlgoImplicitGEMM,2048x8x8x1x1x320x8x8x1xNCHWxFP32x0x0x1x1x1x1x1x1;miopenConvolutionFwdAlgoDirect:ConvOclDirectFwd1x1,0.0752,0,miopenConvolutionFwdAlgoDirect,<unused>;miopenConvolutionFwdAlgoGEMM:gemm,0.0648,0,rocBlas,<unused>;miopenConvolutionFwdAlgoWinograd:ConvBinWinogradRxSf2x3,0.42048,0,miopenConvolutionFwdAlgoWinograd,2048x8x8x1x1x320x8x8x1xNCHWxFP32x0x0x1x1x1x1x1x1
2048-8-8-1x1-384-8-8-1-0x0-1x1-1x1-0-NCHW-FP32-F=miopenConvolutionFwdAlgoImplicitGEMM:ConvHipImplicitGemmV4R4Fwd,0.2752,0,miopenConvolutionFwdAlgoImplicitGEMM,2048x8x8x1x1x384x8x8x1xNCHWxFP32x0x0x1x1x1x1x1x1;miopenConvolutionFwdAlgoDirect:ConvOclDirectFwd1x1,0.0768,0,miopenConvolutionFwdAlgoDirect,<unused>;miopenConvolutionFwdAlgoGEMM:gemm,0.0696,0,rocBlas,<unused>;miopenConvolutionFwdAlgoWinograd:ConvBinWinogradRxSf2x3,0.43744,0,miopenConvolutionFwdAlgoWinograd,2048x8x8x1x1x384x8x8x1xNCHWxFP32x0x0x1x1x1x1x1x1
2048-8-8-1x1-448-8-8-1-0x0-1x1-1x1-0-NCHW-FP32-F=miopenConvolutionFwdAlgoImplicitGEMM:ConvHipImplicitGemmV4R4Fwd,0.27024,0,miopenConvolutionFwdAlgoImplicitGEMM,2048x8x8x1x1x448x8x8x1xNCHWxFP32x0x0x1x1x1x1x1x1;miopenConvolutionFwdAlgoDirect:ConvOclDirectFwd1x1,0.08944,0,miopenConvolutionFwdAlgoDirect,<unused>;miopenConvolutionFwdAlgoGEMM:gemm,0.17072,0,rocBlas,<unused>;miopenConvolutionFwdAlgoWinograd:ConvBinWinogradRxSf2x3,0.42288,0,miopenConvolutionFwdAlgoWinograd,2048x8x8x1x1x448x8x8x1xNCHWxFP32x0x0x1x1x1x1x1x1
2048-8-8-1x1-192-8-8-1-0x0-1x1-1x1-0-NCHW-FP32-F=miopenConvolutionFwdAlgoImplicitGEMM:ConvHipImplicitGemmV4R4Fwd,0.23776,0,miopenConvolutionFwdAlgoImplicitGEMM,2048x8x8x1x1x192x8x8x1xNCHWxFP32x0x0x1x1x1x1x1x1;miopenConvolutionFwdAlgoDirect:ConvOclDirectFwd1x1,0.06752,0,miopenConvolutionFwdAlgoDirect,<unused>;miopenConvolutionFwdAlgoGEMM:gemm,0.06048,0,rocBlas,<unused>;miopenConvolutionFwdAlgoWinograd:ConvBinWinogradRxSf2x3,0.42144,0,miopenConvolutionFwdAlgoWinograd,2048x8x8x1x1x192x8x8x1xNCHWxFP32x0x0x1x1x1x1x1x1
64-56-56-1x1-128-56-56-1-0x0-1x1-1x1-0-NCHW-FP32-F=miopenConvolutionFwdAlgoImplicitGEMM:ConvHipImplicitGemmV4R4Fwd,0.0192,0,miopenConvolutionFwdAlgoImplicitGEMM,64x56x56x1x1x128x56x56x1xNCHWxFP32x0x0x1x1x1x1x1x1;miopenConvolutionFwdAlgoDirect:ConvAsm1x1U,0.01584,0,miopenConvolutionFwdAlgoDirect,<unused>;miopenConvolutionFwdAlgoGEMM:gemm,0.02912,0,rocBlas,<unused>;miopenConvolutionFwdAlgoWinograd:ConvBinWinogradRxS,0.05088,0,miopenConvolutionFwdAlgoWinograd,64x56x56x1x1x128x56x56x1xNCHWxFP32x0x0x1x1x1x1x1x1
128-56-56-3x3-32-56-56-1-1x1-1x1-1x1-0-NCHW-FP32-F=miopenConvolutionFwdAlgoWinograd:ConvBinWinograd3x3U,0.04784,0,miopenConvolutionFwdAlgoWinograd,128x56x56x3x3x32x56x56x1xNCHWxFP32x1x1x1x1x1x1x1x1
96-56-56-1x1-128-56-56-1-0x0-1x1-1x1-0-NCHW-FP32-F=miopenConvolutionFwdAlgoImplicitGEMM:ConvHipImplicitGemmV4R4Fwd,0.02544,0,miopenConvolutionFwdAlgoImplicitGEMM,96x56x56x1x1x128x56x56x1xNCHWxFP32x0x0x1x1x1x1x1x1;miopenConvolutionFwdAlgoDirect:ConvAsm1x1U,0.02128,0,miopenConvolutionFwdAlgoDirect,<unused>;miopenConvolutionFwdAlgoGEMM:gemm,0.0296,0,rocBlas,<unused>;miopenConvolutionFwdAlgoWinograd:ConvBinWinogradRxSf3x2,0.04848,0,miopenConvolutionFwdAlgoWinograd,96x56x56x1x1x128x56x56x1xNCHWxFP32x0x0x1x1x1x1x1x1
128-56-56-1x1-128-56-56-1-0x0-1x1-1x1-0-NCHW-FP32-F=miopenConvolutionFwdAlgoImplicitGEMM:ConvHipImplicitGemmV4R4Fwd,0.02464,0,miopenConvolutionFwdAlgoImplicitGEMM,128x56x56x1x1x128x56x56x1xNCHWxFP32x0x0x1x1x1x1x1x1;miopenConvolutionFwdAlgoDirect:ConvAsm1x1U,0.02448,0,miopenConvolutionFwdAlgoDirect,<unused>;miopenConvolutionFwdAlgoGEMM:gemm,0.036,0,rocBlas,<unused>;miopenConvolutionFwdAlgoWinograd:ConvBinWinogradRxSf3x2,0.05776,0,miopenConvolutionFwdAlgoWinograd,128x56x56x1x1x128x56x56x1xNCHWxFP32x0x0x1x1x1x1x1x1
160-56-56-1x1-128-56-56-1-0x0-1x1-1x1-0-NCHW-FP32-F=miopenConvolutionFwdAlgoImplicitGEMM:ConvHipImplicitGemmV4R4Fwd,0.03072,0,miopenConvolutionFwdAlgoImplicitGEMM,160x56x56x1x1x128x56x56x1xNCHWxFP32x0x0x1x1x1x1x1x1;miopenConvolutionFwdAlgoDirect:ConvAsm1x1U,0.03184,0,miopenConvolutionFwdAlgoDirect,<unused>;miopenConvolutionFwdAlgoGEMM:gemm,0.03712,0,rocBlas,<unused>;miopenConvolutionFwdAlgoWinograd:ConvBinWinogradRxSf3x2,0.06448,0,miopenConvolutionFwdAlgoWinograd,160x56x56x1x1x128x56x56x1xNCHWxFP32x0x0x1x1x1x1x1x1
192-56-56-1x1-128-56-56-1-0x0-1x1-1x1-0-NCHW-FP32-F=miopenConvolutionFwdAlgoImplicitGEMM:ConvHipImplicitGemmV4R4Fwd,0.03424,0,miopenConvolutionFwdAlgoImplicitGEMM,192x56x56x1x1x128x56x56x1xNCHWxFP32x0x0x1x1x1x1x1x1;miopenConvolutionFwdAlgoDirect:ConvAsm1x1U,0.03696,0,miopenConvolutionFwdAlgoDirect,<unused>;miopenConvolutionFwdAlgoGEMM:gemm,0.04576,0,rocBlas,<unused>;miopenConvolutionFwdAlgoWinograd:ConvBinWinogradRxSf3x2,0.08,0,miopenConvolutionFwdAlgoWinograd,192x56x56x1x1x128x56x56x1xNCHWxFP32x0x0x1x1x1x1x1x1
224-56-56-1x1-128-56-56-1-0x0-1x1-1x1-0-NCHW-FP32-F=miopenConvolutionFwdAlgoImplicitGEMM:ConvHipImplicitGemmV4R4Fwd,0.0408,0,miopenConvolutionFwdAlgoImplicitGEMM,224x56x56x1x1x128x56x56x1xNCHWxFP32x0x0x1x1x1x1x1x1;miopenConvolutionFwdAlgoDirect:ConvOclDirectFwd1x1,0.04,0,miopenConvolutionFwdAlgoDirect,<unused>;miopenConvolutionFwdAlgoGEMM:gemm,0.0616,0,rocBlas,<unused>;miopenConvolutionFwdAlgoWinograd:ConvBinWinogradRxSf3x2,0.07872,0,miopenConvolutionFwdAlgoWinograd,224x56x56x1x1x128x56x56x1xNCHWxFP32x0x0x1x1x1x1x1x1
128-28-28-1x1-128-28-28-1-0x0-1x1-1x1-0-NCHW-FP32-F=miopenConvolutionFwdAlgoDirect:ConvAsm1x1U,0.016,0,miopenConvolutionFwdAlgoDirect,<unused>;miopenConvolutionFwdAlgoGEMM:gemm,0.03264,0,rocBlas,<unused>;miopenConvolutionFwdAlgoWinograd:ConvBinWinogradRxS,0.05024,0,miopenConvolutionFwdAlgoWinograd,128x28x28x1x1x128x28x28x1xNCHWxFP32x0x0x1x1x1x1x1x1
128-28-28-3x3-32-28-28-1-1x1-1x1-1x1-0-NCHW-FP32-F=miopenConvolutionFwdAlgoWinograd:ConvBinWinograd3x3U,0.05296,0,miopenConvolutionFwdAlgoWinograd,128x28x28x3x3x32x28x28x1xNCHWxFP32x1x1x1x1x1x1x1x1
160-28-28-1x1-128-28-28-1-0x0-1x1-1x1-0-NCHW-FP32-F=miopenConvolutionFwdAlgoDirect:ConvAsm1x1U,0.01552,0,miopenConvolutionFwdAlgoDirect,<unused>;miopenConvolutionFwdAlgoGEMM:gemm,0.03664,0,rocBlas,<unused>;miopenConvolutionFwdAlgoWinograd:ConvBinWinogradRxSf2x3,0.0552,0,miopenConvolutionFwdAlgoWinograd,160x28x28x1x1x128x28x28x1xNCHWxFP32x0x0x1x1x1x1x1x1
192-28-28-1x1-128-28-28-1-0x0-1x1-1x1-0-NCHW-FP32-F=miopenConvolutionFwdAlgoDirect:ConvAsm1x1U,0.016,0,miopenConvolutionFwdAlgoDirect,<unused>;miopenConvolutionFwdAlgoGEMM:gemm,0.04144,0,rocBlas,<unused>;miopenConvolutionFwdAlgoWinograd:ConvBinWinogradRxS,0.06336,0,miopenConvolutionFwdAlgoWinograd,192x28x28x1x1x128x28x28x1xNCHWxFP32x0x0x1x1x1x1x1x1
224-28-28-1x1-128-28-28-1-0x0-1x1-1x1-0-NCHW-FP32-F=miopenConvolutionFwdAlgoDirect:ConvAsm1x1U,0.01792,0,miopenConvolutionFwdAlgoDirect,<unused>;miopenConvolutionFwdAlgoGEMM:gemm,0.06208,0,rocBlas,<unused>;miopenConvolutionFwdAlgoWinograd:ConvBinWinogradRxSf2x3,0.06896,0,miopenConvolutionFwdAlgoWinograd,224x28x28x1x1x128x28x28x1xNCHWxFP32x0x0x1x1x1x1x1x1
256-28-28-1x1-128-28-28-1-0x0-1x1-1x1-0-NCHW-FP32-F=miopenConvolutionFwdAlgoDirect:ConvAsm1x1U,0.02368,0,miopenConvolutionFwdAlgoDirect,<unused>;miopenConvolutionFwdAlgoGEMM:gemm,0.06624,0,rocBlas,<unused>;miopenConvolutionFwdAlgoWinograd:ConvBinWinogradRxS,0.07536,0,miopenConvolutionFwdAlgoWinograd,256x28x28x1x1x128x28x28x1xNCHWxFP32x0x0x1x1x1x1x1x1
288-28-28-1x1-128-28-28-1-0x0-1x1-1x1-0-NCHW-FP32-F=miopenConvolutionFwdAlgoDirect:ConvAsm1x1U,0.0208,0,miopenConvolutionFwdAlgoDirect,<unused>;miopenConvolutionFwdAlgoGEMM:gemm,0.0784,0,rocBlas,<unused>;miopenConvolutionFwdAlgoWinograd:ConvBinWinogradRxS,0.08144,0,miopenConvolutionFwdAlgoWinograd,288x28x28x1x1x128x28x28x1xNCHWxFP32x0x0x1x1x1x1x1x1
320-28-28-1x1-128-28-28-1-0x0-1x1-1x1-0-NCHW-FP32-F=miopenConvolutionFwdAlgoDirect:ConvAsm1x1U,0.02272,0,miopenConvolutionFwdAlgoDirect,<unused>;miopenConvolutionFwdAlgoGEMM:gemm,0.08384,0,rocBlas,<unused>;miopenConvolutionFwdAlgoWinograd:ConvBinWinogradRxSf2x3,0.09456,0,miopenConvolutionFwdAlgoWinograd,320x28x28x1x1x128x28x28x1xNCHWxFP32x0x0x1x1x1x1x1x1
352-28-28-1x1-128-28-28-1-0x0-1x1-1x1-0-NCHW-FP32-F=miopenConvolutionFwdAlgoDirect:ConvAsm1x1U,0.02624,0,miopenConvolutionFwdAlgoDirect,<unused>;miopenConvolutionFwdAlgoGEMM:gemm,0.08912,0,rocBlas,<unused>;miopenConvolutionFwdAlgoWinograd:ConvBinWinogradRxS,0.10064,0,miopenConvolutionFwdAlgoWinograd,352x28x28x1x1x128x28x28x1xNCHWxFP32x0x0x1x1x1x1x1x1
384-28-28-1x1-128-28-28-1-0x0-1x1-1x1-0-NCHW-FP32-F=miopenConvolutionFwdAlgoDirect:ConvAsm1x1U,0.02512,0,miopenConvolutionFwdAlgoDirect,<unused>;miopenConvolutionFwdAlgoGEMM:gemm,0.0408,0,rocBlas,<unused>;miopenConvolutionFwdAlgoWinograd:ConvBinWinogradRxS,0.10128,0,miopenConvolutionFwdAlgoWinograd,384x28x28x1x1x128x28x28x1xNCHWxFP32x0x0x1x1x1x1x1x1
416-28-28-1x1-128-28-28-1-0x0-1x1-1x1-0-NCHW-FP32-F=miopenConvolutionFwdAlgoDirect:ConvAsm1x1U,0.02896,0,miopenConvolutionFwdAlgoDirect,<unused>;miopenConvolutionFwdAlgoGEMM:gemm,0.04192,0,rocBlas,<unused>;miopenConvolutionFwdAlgoWinograd:ConvBinWinogradRxS,0.10736,0,miopenConvolutionFwdAlgoWinograd,416x28x28x1x1x128x28x28x1xNCHWxFP32x0x0x1x1x1x1x1x1
448-28-28-1x1-128-28-28-1-0x0-1x1-1x1-0-NCHW-FP32-F=miopenConvolutionFwdAlgoDirect:ConvAsm1x1U,0.0328,0,miopenConvolutionFwdAlgoDirect,<unused>;miopenConvolutionFwdAlgoGEMM:gemm,0.044,0,rocBlas,<unused>;miopenConvolutionFwdAlgoWinograd:ConvBinWinogradRxSf2x3,0.1128,0,miopenConvolutionFwdAlgoWinograd,448x28x28x1x1x128x28x28x1xNCHWxFP32x0x0x1x1x1x1x1x1
480-28-28-1x1-128-28-28-1-0x0-1x1-1x1-0-NCHW-FP32-F=miopenConvolutionFwdAlgoDirect:ConvAsm1x1U,0.03136,0,miopenConvolutionFwdAlgoDirect,<unused>;miopenConvolutionFwdAlgoGEMM:gemm,0.04512,0,rocBlas,<unused>;miopenConvolutionFwdAlgoWinograd:ConvBinWinogradRxSf2x3,0.11856,0,miopenConvolutionFwdAlgoWinograd,480x28x28x1x1x128x28x28x1xNCHWxFP32x0x0x1x1x1x1x1x1
256-14-14-1x1-128-14-14-1-0x0-1x1-1x1-0-NCHW-FP32-F=miopenConvolutionFwdAlgoDirect:ConvAsm1x1U,0.0168,0,miopenConvolutionFwdAlgoDirect,<unused>;miopenConvolutionFwdAlgoGEMM:gemm,0.03472,0,rocBlas,<unused>;miopenConvolutionFwdAlgoWinograd:ConvBinWinogradRxS,0.0824,0,miopenConvolutionFwdAlgoWinograd,256x14x14x1x1x128x14x14x1xNCHWxFP32x0x0x1x1x1x1x1x1
128-14-14-3x3-32-14-14-1-1x1-1x1-1x1-0-NCHW-FP32-F=miopenConvolutionFwdAlgoWinograd:ConvBinWinogradRxS,0.04928,0,miopenConvolutionFwdAlgoWinograd,128x14x14x3x3x32x14x14x1xNCHWxFP32x1x1x1x1x1x1x1x1
288-14-14-1x1-128-14-14-1-0x0-1x1-1x1-0-NCHW-FP32-F=miopenConvolutionFwdAlgoDirect:ConvAsm1x1U,0.01744,0,miopenConvolutionFwdAlgoDirect,<unused>;miopenConvolutionFwdAlgoGEMM:gemm,0.03376,0,rocBlas,<unused>;miopenConvolutionFwdAlgoWinograd:ConvBinWinogradRxSf2x3,0.07952,0,miopenConvolutionFwdAlgoWinograd,288x14x14x1x1x128x14x14x1xNCHWxFP32x0x0x1x1x1x1x1x1
320-14-14-1x1-128-14-14-1-0x0-1x1-1x1-0-NCHW-FP32-F=miopenConvolutionFwdAlgoDirect:ConvAsm1x1U,0.0184,0,miopenConvolutionFwdAlgoDirect,<unused>;miopenConvolutionFwdAlgoGEMM:gemm,0.0336,0,rocBlas,<unused>;miopenConvolutionFwdAlgoWinograd:ConvBinWinogradRxS,0.08784,0,miopenConvolutionFwdAlgoWinograd,320x14x14x1x1x128x14x14x1xNCHWxFP32x0x0x1x1x1x1x1x1
352-14-14-1x1-128-14-14-1-0x0-1x1-1x1-0-NCHW-FP32-F=miopenConvolutionFwdAlgoDirect:ConvAsm1x1U,0.01872,0,miopenConvolutionFwdAlgoDirect,<unused>;miopenConvolutionFwdAlgoGEMM:gemm,0.0352,0,rocBlas,<unused>;miopenConvolutionFwdAlgoWinograd:ConvBinWinogradRxS,0.09376,0,miopenConvolutionFwdAlgoWinograd,352x14x14x1x1x128x14x14x1xNCHWxFP32x0x0x1x1x1x1x1x1
384-14-14-1x1-128-14-14-1-0x0-1x1-1x1-0-NCHW-FP32-F=miopenConvolutionFwdAlgoDirect:ConvAsm1x1U,0.01984,0,miopenConvolutionFwdAlgoDirect,<unused>;miopenConvolutionFwdAlgoGEMM:gemm,0.02688,0,rocBlas,<unused>;miopenConvolutionFwdAlgoWinograd:ConvBinWinogradRxSf2x3,0.1,0,miopenConvolutionFwdAlgoWinograd,384x14x14x1x1x128x14x14x1xNCHWxFP32x0x0x1x1x1x1x1x1
416-14-14-1x1-128-14-14-1-0x0-1x1-1x1-0-NCHW-FP32-F=miopenConvolutionFwdAlgoDirect:ConvAsm1x1U,0.02112,0,miopenConvolutionFwdAlgoDirect,<unused>;miopenConvolutionFwdAlgoGEMM:gemm,0.02752,0,rocBlas,<unused>;miopenConvolutionFwdAlgoWinograd:ConvBinWinogradRxSf2x3,0.1056,0,miopenConvolutionFwdAlgoWinograd,416x14x14x1x1x128x14x14x1xNCHWxFP32x0x0x1x1x1x1x1x1
448-14-14-1x1-128-14-14-1-0x0-1x1-1x1-0-NCHW-FP32-F=miopenConvolutionFwdAlgoDirect:ConvAsm1x1U,0.02304,0,miopenConvolutionFwdAlgoDirect,<unused>;miopenConvolutionFwdAlgoGEMM:gemm,0.04656,0,rocBlas,<unused>;miopenConvolutionFwdAlgoWinograd:ConvBinWinogradRxSf2x3,0.112,0,miopenConvolutionFwdAlgoWinograd,448x14x14x1x1x128x14x14x1xNCHWxFP32x0x0x1x1x1x1x1x1
480-14-14-1x1-128-14-14-1-0x0-1x1-1x1-0-NCHW-FP32-F=miopenConvolutionFwdAlgoDirect:ConvAsm1x1U,0.02336,0,miopenConvolutionFwdAlgoDirect,<unused>;miopenConvolutionFwdAlgoGEMM:gemm,0.02832,0,rocBlas,<unused>;miopenConvolutionFwdAlgoWinograd:ConvBinWinogradRxSf2x3,0.1184,0,miopenConvolutionFwdAlgoWinograd,480x14x14x1x1x128x14x14x1xNCHWxFP32x0x0x1x1x1x1x1x1
512-14-14-1x1-128-14-14-1-0x0-1x1-1x1-0-NCHW-FP32-F=miopenConvolutionFwdAlgoDirect:ConvAsm1x1U,0.02448,0,miopenConvolutionFwdAlgoDirect,<unused>;miopenConvolutionFwdAlgoGEMM:gemm,0.02768,0,rocBlas,<unused>;miopenConvolutionFwdAlgoWinograd:ConvBinWinogradRxSf2x3,0.12432,0,miopenConvolutionFwdAlgoWinograd,512x14x14x1x1x128x14x14x1xNCHWxFP32x0x0x1x1x1x1x1x1
544-14-14-1x1-128-14-14-1-0x0-1x1-1x1-0-NCHW-FP32-F=miopenConvolutionFwdAlgoDirect:ConvAsm1x1U,0.02528,0,miopenConvolutionFwdAlgoDirect,<unused>;miopenConvolutionFwdAlgoGEMM:gemm,0.02848,0,rocBlas,<unused>;miopenConvolutionFwdAlgoWinograd:ConvBinWinogradRxSf2x3,0.13072,0,miopenConvolutionFwdAlgoWinograd,544x14x14x1x1x128x14x14x1xNCHWxFP32x0x0x1x1x1x1x1x1
576-14-14-1x1-128-14-14-1-0x0-1x1-1x1-0-NCHW-FP32-F=miopenConvolutionFwdAlgoDirect:ConvAsm1x1U,0.02752,0,miopenConvolutionFwdAlgoDirect,<unused>;miopenConvolutionFwdAlgoGEMM:gemm,0.02864,0,rocBlas,<unused>;miopenConvolutionFwdAlgoWinograd:ConvBinWinogradRxSf2x3,0.13696,0,miopenConvolutionFwdAlgoWinograd,576x14x14x1x1x128x14x14x1xNCHWxFP32x0x0x1x1x1x1x1x1
608-14-14-1x1-128-14-14-1-0x0-1x1-1x1-0-NCHW-FP32-F=miopenConvolutionFwdAlgoDirect:ConvAsm1x1U,0.02752,0,miopenConvolutionFwdAlgoDirect,<unused>;miopenConvolutionFwdAlgoGEMM:gemm,0.0288,0,rocBlas,<unused>;miopenConvolutionFwdAlgoWinograd:ConvBinWinogradRxSf2x3,0.14208,0,miopenConvolutionFwdAlgoWinograd,608x14x14x1x1x128x14x14x1xNCHWxFP32x0x0x1x1x1x1x1x1
640-14-14-1x1-128-14-14-1-0x0-1x1-1x1-0-NCHW-FP32-F=miopenConvolutionFwdAlgoDirect:ConvAsm1x1U,0.02976,0,miopenConvolutionFwdAlgoDirect,<unused>;miopenConvolutionFwdAlgoGEMM:gemm,0.02992,0,rocBlas,<unused>;miopenConvolutionFwdAlgoWinograd:ConvBinWinogradRxSf2x3,0.14864,0,miopenConvolutionFwdAlgoWinograd,640x14x14x1x1x128x14x14x1xNCHWxFP32x0x0x1x1x1x1x1x1
672-14-14-1x1-128-14-14-1-0x0-1x1-1x1-0-NCHW-FP32-F=miopenConvolutionFwdAlgoDirect:ConvAsm1x1U,0.02992,0,miopenConvolutionFwdAlgoDirect,<unused>;miopenConvolutionFwdAlgoGEMM:gemm,0.028,0,rocBlas,<unused>;miopenConvolutionFwdAlgoWinograd:ConvBinWinogradRxSf2x3,0.15472,0,miopenConvolutionFwdAlgoWinograd,672x14x14x1x1x128x14x14x1xNCHWxFP32x0x0x1x1x1x1x1x1
704-14-14-1x1-128-14-14-1-0x0-1x1-1x1-0-NCHW-FP32-F=miopenConvolutionFwdAlgoDirect:ConvOclDirectFwd1x1,0.03232,0,miopenConvolutionFwdAlgoDirect,<unused>;miopenConvolutionFwdAlgoGEMM:gemm,0.0288,0,rocBlas,<unused>;miopenConvolutionFwdAlgoWinograd:ConvBinWinogradRxSf2x3,0.16112,0,miopenConvolutionFwdAlgoWinograd,704x14x14x1x1x128x14x14x1xNCHWxFP32x0x0x1x1x1x1x1x1
736-14-14-1x1-128-14-14-1-0x0-1x1-1x1-0-NCHW-FP32-F=miopenConvolutionFwdAlgoDirect:ConvOclDirectFwd1x1,0.03008,0,miopenConvolutionFwdAlgoDirect,<unused>;miopenConvolutionFwdAlgoGEMM:gemm,0.03008,0,rocBlas,<unused>;miopenConvolutionFwdAlgoWinograd:ConvBinWinogradRxSf2x3,0.1672,0,miopenConvolutionFwdAlgoWinograd,736x14x14x1x1x128x14x14x1xNCHWxFP32x0x0x1x1x1x1x1x1
768-14-14-1x1-128-14-14-1-0x0-1x1-1x1-0-NCHW-FP32-F=miopenConvolutionFwdAlgoDirect:ConvOclDirectFwd1x1,0.03328,0,miopenConvolutionFwdAlgoDirect,<unused>;miopenConvolutionFwdAlgoGEMM:gemm,0.03136,0,rocBlas,<unused>;miopenConvolutionFwdAlgoWinograd:ConvBinWinogradRxSf2x3,0.17312,0,miopenConvolutionFwdAlgoWinograd,768x14x14x1x1x128x14x14x1xNCHWxFP32x0x0x1x1x1x1x1x1
800-14-14-1x1-128-14-14-1-0x0-1x1-1x1-0-NCHW-FP32-F=miopenConvolutionFwdAlgoDirect:ConvOclDirectFwd1x1,0.03184,0,miopenConvolutionFwdAlgoDirect,<unused>;miopenConvolutionFwdAlgoGEMM:gemm,0.03152,0,rocBlas,<unused>;miopenConvolutionFwdAlgoWinograd:ConvBinWinogradRxSf2x3,0.17952,0,miopenConvolutionFwdAlgoWinograd,800x14x14x1x1x128x14x14x1xNCHWxFP32x0x0x1x1x1x1x1x1
832-14-14-1x1-128-14-14-1-0x0-1x1-1x1-0-NCHW-FP32-F=miopenConvolutionFwdAlgoDirect:ConvOclDirectFwd1x1,0.03424,0,miopenConvolutionFwdAlgoDirect,<unused>;miopenConvolutionFwdAlgoGEMM:gemm,0.03152,0,rocBlas,<unused>;miopenConvolutionFwdAlgoWinograd:ConvBinWinogradRxSf2x3,0.18576,0,miopenConvolutionFwdAlgoWinograd,832x14x14x1x1x128x14x14x1xNCHWxFP32x0x0x1x1x1x1x1x1
864-14-14-1x1-128-14-14-1-0x0-1x1-1x1-0-NCHW-FP32-F=miopenConvolutionFwdAlgoDirect:ConvOclDirectFwd1x1,0.03232,0,miopenConvolutionFwdAlgoDirect,<unused>;miopenConvolutionFwdAlgoGEMM:gemm,0.03264,0,rocBlas,<unused>;miopenConvolutionFwdAlgoWinograd:ConvBinWinogradRxSf2x3,0.192,0,miopenConvolutionFwdAlgoWinograd,864x14x14x1x1x128x14x14x1xNCHWxFP32x0x0x1x1x1x1x1x1
896-14-14-1x1-128-14-14-1-0x0-1x1-1x1-0-NCHW-FP32-F=miopenConvolutionFwdAlgoDirect:ConvOclDirectFwd1x1,0.03488,0,miopenConvolutionFwdAlgoDirect,<unused>;miopenConvolutionFwdAlgoGEMM:gemm,0.03424,0,rocBlas,<unused>;miopenConvolutionFwdAlgoWinograd:ConvBinWinogradRxSf2x3,0.19776,0,miopenConvolutionFwdAlgoWinograd,896x14x14x1x1x128x14x14x1xNCHWxFP32x0x0x1x1x1x1x1x1
928-14-14-1x1-128-14-14-1-0x0-1x1-1x1-0-NCHW-FP32-F=miopenConvolutionFwdAlgoDirect:ConvOclDirectFwd1x1,0.0336,0,miopenConvolutionFwdAlgoDirect,<unused>;miopenConvolutionFwdAlgoGEMM:gemm,0.0344,0,rocBlas,<unused>;miopenConvolutionFwdAlgoWinograd:ConvBinWinogradRxSf2x3,0.20496,0,miopenConvolutionFwdAlgoWinograd,928x14x14x1x1x128x14x14x1xNCHWxFP32x0x0x1x1x1x1x1x1
960-14-14-1x1-128-14-14-1-0x0-1x1-1x1-0-NCHW-FP32-F=miopenConvolutionFwdAlgoDirect:ConvOclDirectFwd1x1,0.03616,0,miopenConvolutionFwdAlgoDirect,<unused>;miopenConvolutionFwdAlgoGEMM:gemm,0.0368,0,rocBlas,<unused>;miopenConvolutionFwdAlgoWinograd:ConvBinWinogradRxSf2x3,0.20992,0,miopenConvolutionFwdAlgoWinograd,960x14x14x1x1x128x14x14x1xNCHWxFP32x0x0x1x1x1x1x1x1
992-14-14-1x1-128-14-14-1-0x0-1x1-1x1-0-NCHW-FP32-F=miopenConvolutionFwdAlgoDirect:ConvOclDirectFwd1x1,0.03488,0,miopenConvolutionFwdAlgoDirect,<unused>;miopenConvolutionFwdAlgoGEMM:gemm,0.03648,0,rocBlas,<unused>;miopenConvolutionFwdAlgoWinograd:ConvBinWinogradRxSf2x3,0.21616,0,miopenConvolutionFwdAlgoWinograd,992x14x14x1x1x128x14x14x1xNCHWxFP32x0x0x1x1x1x1x1x1
512-7-7-1x1-128-7-7-1-0x0-1x1-1x1-0-NCHW-FP32-F=miopenConvolutionFwdAlgoDirect:ConvAsm1x1U,0.02512,0,miopenConvolutionFwdAlgoDirect,<unused>;miopenConvolutionFwdAlgoGEMM:gemm,0.0256,0,rocBlas,<unused>;miopenConvolutionFwdAlgoWinograd:ConvBinWinogradRxSf2x3,0.12512,0,miopenConvolutionFwdAlgoWinograd,512x7x7x1x1x128x7x7x1xNCHWxFP32x0x0x1x1x1x1x1x1
128-7-7-3x3-32-7-7-1-1x1-1x1-1x1-0-NCHW-FP32-F=miopenConvolutionFwdAlgoWinograd:ConvBinWinograd3x3U,0.04656,0,miopenConvolutionFwdAlgoWinograd,128x7x7x3x3x32x7x7x1xNCHWxFP32x1x1x1x1x1x1x1x1
544-7-7-1x1-128-7-7-1-0x0-1x1-1x1-0-NCHW-FP32-F=miopenConvolutionFwdAlgoDirect:ConvAsm1x1U,0.024,0,miopenConvolutionFwdAlgoDirect,<unused>;miopenConvolutionFwdAlgoGEMM:gemm,0.02544,0,rocBlas,<unused>;miopenConvolutionFwdAlgoWinograd:ConvBinWinogradRxSf2x3,0.12928,0,miopenConvolutionFwdAlgoWinograd,544x7x7x1x1x128x7x7x1xNCHWxFP32x0x0x1x1x1x1x1x1
576-7-7-1x1-128-7-7-1-0x0-1x1-1x1-0-NCHW-FP32-F=miopenConvolutionFwdAlgoDirect:ConvAsm1x1U,0.0256,0,miopenConvolutionFwdAlgoDirect,<unused>;miopenConvolutionFwdAlgoGEMM:gemm,0.0264,0,rocBlas,<unused>;miopenConvolutionFwdAlgoWinograd:ConvBinWinogradRxSf2x3,0.13616,0,miopenConvolutionFwdAlgoWinograd,576x7x7x1x1x128x7x7x1xNCHWxFP32x0x0x1x1x1x1x1x1
608-7-7-1x1-128-7-7-1-0x0-1x1-1x1-0-NCHW-FP32-F=miopenConvolutionFwdAlgoDirect:ConvAsm1x1U,0.0264,0,miopenConvolutionFwdAlgoDirect,<unused>;miopenConvolutionFwdAlgoGEMM:gemm,0.02656,0,rocBlas,<unused>;miopenConvolutionFwdAlgoWinograd:ConvBinWinogradRxSf2x3,0.14336,0,miopenConvolutionFwdAlgoWinograd,608x7x7x1x1x128x7x7x1xNCHWxFP32x0x0x1x1x1x1x1x1
640-7-7-1x1-128-7-7-1-0x0-1x1-1x1-0-NCHW-FP32-F=miopenConvolutionFwdAlgoDirect:ConvAsm1x1U,0.02864,0,miopenConvolutionFwdAlgoDirect,<unused>;miopenConvolutionFwdAlgoGEMM:gemm,0.02752,0,rocBlas,<unused>;miopenConvolutionFwdAlgoWinograd:ConvBinWinogradRxSf2x3,0.14848,0,miopenConvolutionFwdAlgoWinograd,640x7x7x1x1x128x7x7x1xNCHWxFP32x0x0x1x1x1x1x1x1
672-7-7-1x1-128-7-7-1-0x0-1x1-1x1-0-NCHW-FP32-F=miopenConvolutionFwdAlgoDirect:ConvAsm1x1U,0.02912,0,miopenConvolutionFwdAlgoDirect,<unused>;miopenConvolutionFwdAlgoGEMM:gemm,0.02816,0,rocBlas,<unused>;miopenConvolutionFwdAlgoWinograd:ConvBinWinogradRxSf2x3,0.1552,0,miopenConvolutionFwdAlgoWinograd,672x7x7x1x1x128x7x7x1xNCHWxFP32x0x0x1x1x1x1x1x1
704-7-7-1x1-128-7-7-1-0x0-1x1-1x1-0-NCHW-FP32-F=miopenConvolutionFwdAlgoDirect:ConvAsm1x1U,0.02944,0,miopenConvolutionFwdAlgoDirect,<unused>;miopenConvolutionFwdAlgoGEMM:gemm,0.028,0,rocBlas,<unused>;miopenConvolutionFwdAlgoWinograd:ConvBinWinogradRxSf2x3,0.16032,0,miopenConvolutionFwdAlgoWinograd,704x7x7x1x1x128x7x7x1xNCHWxFP32x0x0x1x1x1x1x1x1
736-7-7-1x1-128-7-7-1-0x0-1x1-1x1-0-NCHW-FP32-F=miopenConvolutionFwdAlgoDirect:ConvOclDirectFwd1x1,0.028,0,miopenConvolutionFwdAlgoDirect,<unused>;miopenConvolutionFwdAlgoGEMM:gemm,0.02896,0,rocBlas,<unused>;miopenConvolutionFwdAlgoWinograd:ConvBinWinogradRxSf2x3,0.1672,0,miopenConvolutionFwdAlgoWinograd,736x7x7x1x1x128x7x7x1xNCHWxFP32x0x0x1x1x1x1x1x1
768-7-7-1x1-128-7-7-1-0x0-1x1-1x1-0-NCHW-FP32-F=miopenConvolutionFwdAlgoDirect:ConvOclDirectFwd1x1,0.03024,0,miopenConvolutionFwdAlgoDirect,<unused>;miopenConvolutionFwdAlgoGEMM:gemm,0.02928,0,rocBlas,<unused>;miopenConvolutionFwdAlgoWinograd:ConvBinWinogradRxSf2x3,0.17312,0,miopenConvolutionFwdAlgoWinograd,768x7x7x1x1x128x7x7x1xNCHWxFP32x0x0x1x1x1x1x1x1
800-7-7-1x1-128-7-7-1-0x0-1x1-1x1-0-NCHW-FP32-F=miopenConvolutionFwdAlgoDirect:ConvOclDirectFwd1x1,0.03104,0,miopenConvolutionFwdAlgoDirect,<unused>;miopenConvolutionFwdAlgoGEMM:gemm,0.0288,0,rocBlas,<unused>;miopenConvolutionFwdAlgoWinograd:ConvBinWinogradRxSf2x3,0.17952,0,miopenConvolutionFwdAlgoWinograd,800x7x7x1x1x128x7x7x1xNCHWxFP32x0x0x1x1x1x1x1x1
832-7-7-1x1-128-7-7-1-0x0-1x1-1x1-0-NCHW-FP32-F=miopenConvolutionFwdAlgoDirect:ConvOclDirectFwd1x1,0.03104,0,miopenConvolutionFwdAlgoDirect,<unused>;miopenConvolutionFwdAlgoGEMM:gemm,0.03072,0,rocBlas,<unused>;miopenConvolutionFwdAlgoWinograd:ConvBinWinogradRxSf2x3,0.18464,0,miopenConvolutionFwdAlgoWinograd,832x7x7x1x1x128x7x7x1xNCHWxFP32x0x0x1x1x1x1x1x1
864-7-7-1x1-128-7-7-1-0x0-1x1-1x1-0-NCHW-FP32-F=miopenConvolutionFwdAlgoDirect:ConvOclDirectFwd1x1,0.03088,0,miopenConvolutionFwdAlgoDirect,<unused>;miopenConvolutionFwdAlgoGEMM:gemm,0.03088,0,rocBlas,<unused>;miopenConvolutionFwdAlgoWinograd:ConvBinWinogradRxSf2x3,0.19168,0,miopenConvolutionFwdAlgoWinograd,864x7x7x1x1x128x7x7x1xNCHWxFP32x0x0x1x1x1x1x1x1
896-7-7-1x1-128-7-7-1-0x0-1x1-1x1-0-NCHW-FP32-F=miopenConvolutionFwdAlgoDirect:ConvOclDirectFwd1x1,0.03184,0,miopenConvolutionFwdAlgoDirect,<unused>;miopenConvolutionFwdAlgoGEMM:gemm,0.03088,0,rocBlas,<unused>;miopenConvolutionFwdAlgoWinograd:ConvBinWinogradRxSf2x3,0.1976,0,miopenConvolutionFwdAlgoWinograd,896x7x7x1x1x128x7x7x1xNCHWxFP32x0x0x1x1x1x1x1x1
928-7-7-1x1-128-7-7-1-0x0-1x1-1x1-0-NCHW-FP32-F=miopenConvolutionFwdAlgoDirect:ConvOclDirectFwd1x1,0.03024,0,miopenConvolutionFwdAlgoDirect,<unused>;miopenConvolutionFwdAlgoGEMM:gemm,0.0312,0,rocBlas,<unused>;miopenConvolutionFwdAlgoWinograd:ConvBinWinogradRxSf2x3,0.20416,0,miopenConvolutionFwdAlgoWinograd,928x7x7x1x1x128x7x7x1xNCHWxFP32x0x0x1x1x1x1x1x1
960-7-7-1x1-128-7-7-1-0x0-1x1-1x1-0-NCHW-FP32-F=miopenConvolutionFwdAlgoDirect:ConvOclDirectFwd1x1,0.03328,0,miopenConvolutionFwdAlgoDirect,<unused>;miopenConvolutionFwdAlgoGEMM:gemm,0.032,0,rocBlas,<unused>;miopenConvolutionFwdAlgoWinograd:ConvBinWinogradRxSf2x3,0.20992,0,miopenConvolutionFwdAlgoWinograd,960x7x7x1x1x128x7x7x1xNCHWxFP32x0x0x1x1x1x1x1x1
992-7-7-1x1-128-7-7-1-0x0-1x1-1x1-0-NCHW-FP32-F=miopenConvolutionFwdAlgoDirect:ConvOclDirectFwd1x1,0.03024,0,miopenConvolutionFwdAlgoDirect,<unused>;miopenConvolutionFwdAlgoGEMM:gemm,0.03264,0,rocBlas,<unused>;miopenConvolutionFwdAlgoWinograd:ConvBinWinogradRxSf2x3,0.21696,0,miopenConvolutionFwdAlgoWinograd,992x7x7x1x1x128x7x7x1xNCHWxFP32x0x0x1x1x1x1x1x1
3-224-224-3x3-64-111-111-1-0x0-2x2-1x1-0-NCHW-FP32-F=miopenConvolutionFwdAlgoDirect:ConvOclDirectFwd,0.03888,0,miopenConvolutionFwdAlgoDirect,<unused>;miopenConvolutionFwdAlgoGEMM:gemm,0.06352,1330668,rocBlas,<unused>;miopenConvolutionFwdAlgoWinograd:ConvBinWinogradRxSf2x3,0.04672,0,miopenConvolutionFwdAlgoWinograd,3x224x224x3x3x64x111x111x1xNCHWxFP32x0x0x2x2x1x1x1x1
64-55-55-1x1-16-55-55-1-0x0-1x1-1x1-0-NCHW-FP32-F=miopenConvolutionFwdAlgoDirect:ConvAsm1x1U,0.012,0,miopenConvolutionFwdAlgoDirect,<unused>;miopenConvolutionFwdAlgoGEMM:gemm,0.02896,0,rocBlas,<unused>;miopenConvolutionFwdAlgoWinograd:ConvBinWinogradRxS,0.036,0,miopenConvolutionFwdAlgoWinograd,64x55x55x1x1x16x55x55x1xNCHWxFP32x0x0x1x1x1x1x1x1
16-55-55-1x1-64-55-55-1-0x0-1x1-1x1-0-NCHW-FP32-F=miopenConvolutionFwdAlgoDirect:ConvOclDirectFwd1x1,0.01072,0,miopenConvolutionFwdAlgoDirect,<unused>;miopenConvolutionFwdAlgoGEMM:gemm,0.02256,0,rocBlas,<unused>;miopenConvolutionFwdAlgoWinograd:ConvBinWinogradRxSf2x3,0.02928,0,miopenConvolutionFwdAlgoWinograd,16x55x55x1x1x64x55x55x1xNCHWxFP32x0x0x1x1x1x1x1x1
16-55-55-3x3-64-55-55-1-1x1-1x1-1x1-0-NCHW-FP32-F=miopenConvolutionFwdAlgoDirect:ConvAsm3x3U,0.0176,0,miopenConvolutionFwdAlgoDirect,<unused>;miopenConvolutionFwdAlgoGEMM:gemm,0.0768,1742400,rocBlas,<unused>;miopenConvolutionFwdAlgoWinograd:ConvBinWinogradRxSf2x3,0.03632,0,miopenConvolutionFwdAlgoWinograd,16x55x55x3x3x64x55x55x1xNCHWxFP32x1x1x1x1x1x1x1x1
128-55-55-1x1-16-55-55-1-0x0-1x1-1x1-0-NCHW-FP32-F=miopenConvolutionFwdAlgoDirect:ConvAsm1x1U,0.01568,0,miopenConvolutionFwdAlgoDirect,<unused>;miopenConvolutionFwdAlgoGEMM:gemm,0.03664,0,rocBlas,<unused>;miopenConvolutionFwdAlgoWinograd:ConvBinWinogradRxS,0.05536,0,miopenConvolutionFwdAlgoWinograd,128x55x55x1x1x16x55x55x1xNCHWxFP32x0x0x1x1x1x1x1x1
128-27-27-1x1-32-27-27-1-0x0-1x1-1x1-0-NCHW-FP32-F=miopenConvolutionFwdAlgoDirect:ConvAsm1x1U,0.01248,0,miopenConvolutionFwdAlgoDirect,<unused>;miopenConvolutionFwdAlgoGEMM:gemm,0.05312,0,rocBlas,<unused>;miopenConvolutionFwdAlgoWinograd:ConvBinWinogradRxS,0.0488,0,miopenConvolutionFwdAlgoWinograd,128x27x27x1x1x32x27x27x1xNCHWxFP32x0x0x1x1x1x1x1x1
32-27-27-1x1-128-27-27-1-0x0-1x1-1x1-0-NCHW-FP32-F=miopenConvolutionFwdAlgoDirect:ConvAsm1x1U,0.01056,0,miopenConvolutionFwdAlgoDirect,<unused>;miopenConvolutionFwdAlgoGEMM:gemm,0.0192,0,rocBlas,<unused>;miopenConvolutionFwdAlgoWinograd:ConvBinWinogradRxS,0.03024,0,miopenConvolutionFwdAlgoWinograd,32x27x27x1x1x128x27x27x1xNCHWxFP32x0x0x1x1x1x1x1x1
32-27-27-3x3-128-27-27-1-1x1-1x1-1x1-0-NCHW-FP32-F=miopenConvolutionFwdAlgoWinograd:ConvBinWinograd3x3U,0.0288,0,miopenConvolutionFwdAlgoWinograd,32x27x27x3x3x128x27x27x1xNCHWxFP32x1x1x1x1x1x1x1x1
256-27-27-1x1-32-27-27-1-0x0-1x1-1x1-0-NCHW-FP32-F=miopenConvolutionFwdAlgoDirect:ConvAsm1x1U,0.01664,0,miopenConvolutionFwdAlgoDirect,<unused>;miopenConvolutionFwdAlgoGEMM:gemm,0.03408,0,rocBlas,<unused>;miopenConvolutionFwdAlgoWinograd:ConvBinWinogradRxS,0.07424,0,miopenConvolutionFwdAlgoWinograd,256x27x27x1x1x32x27x27x1xNCHWxFP32x0x0x1x1x1x1x1x1
256-13-13-1x1-48-13-13-1-0x0-1x1-1x1-0-NCHW-FP32-F=miopenConvolutionFwdAlgoDirect:ConvAsm1x1U,0.0168,0,miopenConvolutionFwdAlgoDirect,<unused>;miopenConvolutionFwdAlgoGEMM:gemm,0.02976,0,rocBlas,<unused>;miopenConvolutionFwdAlgoWinograd:ConvBinWinogradRxS,0.07472,0,miopenConvolutionFwdAlgoWinograd,256x13x13x1x1x48x13x13x1xNCHWxFP32x0x0x1x1x1x1x1x1
48-13-13-1x1-192-13-13-1-0x0-1x1-1x1-0-NCHW-FP32-F=miopenConvolutionFwdAlgoDirect:ConvAsm1x1U,0.0104,0,miopenConvolutionFwdAlgoDirect,<unused>;miopenConvolutionFwdAlgoGEMM:gemm,0.02,0,rocBlas,<unused>;miopenConvolutionFwdAlgoWinograd:ConvBinWinogradRxS,0.03344,0,miopenConvolutionFwdAlgoWinograd,48x13x13x1x1x192x13x13x1xNCHWxFP32x0x0x1x1x1x1x1x1
48-13-13-3x3-192-13-13-1-1x1-1x1-1x1-0-NCHW-FP32-F=miopenConvolutionFwdAlgoWinograd:ConvBinWinograd3x3U,0.03136,0,miopenConvolutionFwdAlgoWinograd,48x13x13x3x3x192x13x13x1xNCHWxFP32x1x1x1x1x1x1x1x1
384-13-13-1x1-48-13-13-1-0x0-1x1-1x1-0-NCHW-FP32-F=miopenConvolutionFwdAlgoDirect:ConvAsm1x1U,0.02032,0,miopenConvolutionFwdAlgoDirect,<unused>;miopenConvolutionFwdAlgoGEMM:gemm,0.02624,0,rocBlas,<unused>;miopenConvolutionFwdAlgoWinograd:ConvBinWinogradRxS,0.10048,0,miopenConvolutionFwdAlgoWinograd,384x13x13x1x1x48x13x13x1xNCHWxFP32x0x0x1x1x1x1x1x1
384-13-13-1x1-64-13-13-1-0x0-1x1-1x1-0-NCHW-FP32-F=miopenConvolutionFwdAlgoDirect:ConvAsm1x1U,0.0208,0,miopenConvolutionFwdAlgoDirect,<unused>;miopenConvolutionFwdAlgoGEMM:gemm,0.02912,0,rocBlas,<unused>;miopenConvolutionFwdAlgoWinograd:ConvBinWinogradRxSf2x3,0.1,0,miopenConvolutionFwdAlgoWinograd,384x13x13x1x1x64x13x13x1xNCHWxFP32x0x0x1x1x1x1x1x1
64-13-13-1x1-256-13-13-1-0x0-1x1-1x1-0-NCHW-FP32-F=miopenConvolutionFwdAlgoDirect:ConvAsm1x1U,0.0112,0,miopenConvolutionFwdAlgoDirect,<unused>;miopenConvolutionFwdAlgoGEMM:gemm,0.01824,0,rocBlas,<unused>;miopenConvolutionFwdAlgoWinograd:ConvBinWinogradRxS,0.03728,0,miopenConvolutionFwdAlgoWinograd,64x13x13x1x1x256x13x13x1xNCHWxFP32x0x0x1x1x1x1x1x1
64-13-13-3x3-256-13-13-1-1x1-1x1-1x1-0-NCHW-FP32-F=miopenConvolutionFwdAlgoWinograd:ConvBinWinograd3x3U,0.03504,0,miopenConvolutionFwdAlgoWinograd,64x13x13x3x3x256x13x13x1xNCHWxFP32x1x1x1x1x1x1x1x1
512-13-13-1x1-64-13-13-1-0x0-1x1-1x1-0-NCHW-FP32-F=miopenConvolutionFwdAlgoDirect:ConvAsm1x1U,0.02464,0,miopenConvolutionFwdAlgoDirect,<unused>;miopenConvolutionFwdAlgoGEMM:gemm,0.02624,0,rocBlas,<unused>;miopenConvolutionFwdAlgoWinograd:ConvBinWinogradRxSf2x3,0.12576,0,miopenConvolutionFwdAlgoWinograd,512x13x13x1x1x64x13x13x1xNCHWxFP32x0x0x1x1x1x1x1x1
512-13-13-1x1-1000-13-13-1-0x0-1x1-1x1-0-NCHW-FP32-F=miopenConvolutionFwdAlgoDirect:ConvAsm1x1U,0.0592,0,miopenConvolutionFwdAlgoDirect,<unused>;miopenConvolutionFwdAlgoGEMM:gemm,0.04752,0,rocBlas,<unused>;miopenConvolutionFwdAlgoWinograd:ConvBinWinogradRxSf3x2,0.1352,0,miopenConvolutionFwdAlgoWinograd,512x13x13x1x1x1000x13x13x1xNCHWxFP32x0x0x1x1x1x1x1x1
3-224-224-3x3-64-224-224-1-1x1-1x1-1x1-0-NCHW-FP32-F=miopenConvolutionFwdAlgoDirect:ConvOclDirectFwd,0.07856,0,miopenConvolutionFwdAlgoDirect,<unused>;miopenConvolutionFwdAlgoGEMM:gemm,0.11072,5419008,rocBlas,<unused>;miopenConvolutionFwdAlgoWinograd:ConvBinWinogradRxSf2x3,0.06224,0,miopenConvolutionFwdAlgoWinograd,3x224x224x3x3x64x224x224x1xNCHWxFP32x1x1x1x1x1x1x1x1
64-224-224-3x3-64-224-224-1-1x1-1x1-1x1-0-NCHW-FP32-F=miopenConvolutionFwdAlgoWinograd:ConvBinWinograd3x3U,0.22384,0,miopenConvolutionFwdAlgoWinograd,64x224x224x3x3x64x224x224x1xNCHWxFP32x1x1x1x1x1x1x1x1
64-112-112-3x3-128-112-112-1-1x1-1x1-1x1-0-NCHW-FP32-F=miopenConvolutionFwdAlgoWinograd:ConvBinWinograd3x3U,0.12144,0,miopenConvolutionFwdAlgoWinograd,64x112x112x3x3x128x112x112x1xNCHWxFP32x1x1x1x1x1x1x1x1
128-112-112-3x3-128-112-112-1-1x1-1x1-1x1-0-NCHW-FP32-F=miopenConvolutionFwdAlgoWinograd:ConvBinWinograd3x3U,0.20992,0,miopenConvolutionFwdAlgoWinograd,128x112x112x3x3x128x112x112x1xNCHWxFP32x1x1x1x1x1x1x1x1
128-56-56-3x3-256-56-56-1-1x1-1x1-1x1-0-NCHW-FP32-F=miopenConvolutionFwdAlgoWinograd:ConvBinWinogradRxS,0.13072,0,miopenConvolutionFwdAlgoWinograd,128x56x56x3x3x256x56x56x1xNCHWxFP32x1x1x1x1x1x1x1x1
256-56-56-3x3-256-56-56-1-1x1-1x1-1x1-0-NCHW-FP32-F=miopenConvolutionFwdAlgoWinograd:ConvBinWinogradRxS,0.23104,0,miopenConvolutionFwdAlgoWinograd,256x56x56x3x3x256x56x56x1xNCHWxFP32x1x1x1x1x1x1x1x1
256-28-28-3x3-512-28-28-1-1x1-1x1-1x1-0-NCHW-FP32-F=miopenConvolutionFwdAlgoWinograd:ConvBinWinogradRxS,0.12752,0,miopenConvolutionFwdAlgoWinograd,256x28x28x3x3x512x28x28x1xNCHWxFP32x1x1x1x1x1x1x1x1
512-28-28-3x3-512-28-28-1-1x1-1x1-1x1-0-NCHW-FP32-F=miopenConvolutionFwdAlgoWinograd:ConvBinWinogradRxSf2x3,0.23376,0,miopenConvolutionFwdAlgoWinograd,512x28x28x3x3x512x28x28x1xNCHWxFP32x1x1x1x1x1x1x1x1
512-14-14-3x3-512-14-14-1-1x1-1x1-1x1-0-NCHW-FP32-F=miopenConvolutionFwdAlgoWinograd:ConvBinWinogradRxSf2x3,0.13056,0,miopenConvolutionFwdAlgoWinograd,512x14x14x3x3x512x14x14x1xNCHWxFP32x1x1x1x1x1x1x1x1
64-56-56-1x1-288-56-56-1-0x0-1x1-1x1-0-NCHW-FP32-F=miopenConvolutionFwdAlgoImplicitGEMM:ConvHipImplicitGemmV4R4Fwd,0.03024,0,miopenConvolutionFwdAlgoImplicitGEMM,64x56x56x1x1x288x56x56x1xNCHWxFP32x0x0x1x1x1x1x1x1;miopenConvolutionFwdAlgoDirect:ConvOclDirectFwd1x1,0.02592,0,miopenConvolutionFwdAlgoDirect,<unused>;miopenConvolutionFwdAlgoGEMM:gemm,0.03872,0,rocBlas,<unused>;miopenConvolutionFwdAlgoWinograd:ConvBinWinogradRxSf3x2,0.06496,0,miopenConvolutionFwdAlgoWinograd,64x56x56x1x1x288x56x56x1xNCHWxFP32x0x0x1x1x1x1x1x1
64-56-56-1x1-96-56-56-1-0x0-1x1-1x1-0-NCHW-FP32-F=miopenConvolutionFwdAlgoImplicitGEMM:ConvHipImplicitGemmV4R4Fwd,0.0208,0,miopenConvolutionFwdAlgoImplicitGEMM,64x56x56x1x1x96x56x56x1xNCHWxFP32x0x0x1x1x1x1x1x1;miopenConvolutionFwdAlgoDirect:ConvOclDirectFwd1x1,0.01728,0,miopenConvolutionFwdAlgoDirect,<unused>;miopenConvolutionFwdAlgoGEMM:gemm,0.02752,0,rocBlas,<unused>;miopenConvolutionFwdAlgoWinograd:ConvBinWinogradRxSf3x2,0.04464,0,miopenConvolutionFwdAlgoWinograd,64x56x56x1x1x96x56x56x1xNCHWxFP32x0x0x1x1x1x1x1x1
96-56-56-3x3-96-56-56-1-1x1-1x1-1x1-0-NCHW-FP32-F_g32=miopenConvolutionFwdAlgoDirect:ConvOclDirectFwd,0.02192,0,miopenConvolutionFwdAlgoDirect,<unused>;miopenConvolutionFwdAlgoGEMM:gemm,0.0856,10838016,rocBlas,<unused>;miopenConvolutionFwdAlgoWinograd:ConvBinWinogradRxSf2x3,0.08208,0,miopenConvolutionFwdAlgoWinograd,96x56x56x3x3x96x56x56x1xNCHWxFP32x1x1x1x1x1x1x32x1
96-56-56-1x1-272-56-56-1-0x0-1x1-1x1-0-NCHW-FP32-F=miopenConvolutionFwdAlgoDirect:ConvOclDirectFwd1x1,0.03376,0,miopenConvolutionFwdAlgoDirect,<unused>;miopenConvolutionFwdAlgoGEMM:gemm,0.05088,0,rocBlas,<unused>;miopenConvolutionFwdAlgoWinograd:ConvBinWinogradRxSf3x2,0.084,0,miopenConvolutionFwdAlgoWinograd,96x56x56x1x1x272x56x56x1xNCHWxFP32x0x0x1x1x1x1x1x1
304-56-56-1x1-96-56-56-1-0x0-1x1-1x1-0-NCHW-FP32-F=miopenConvolutionFwdAlgoImplicitGEMM:ConvHipImplicitGemmV4R4Fwd,0.0536,0,miopenConvolutionFwdAlgoImplicitGEMM,304x56x56x1x1x96x56x56x1xNCHWxFP32x0x0x1x1x1x1x1x1;miopenConvolutionFwdAlgoDirect:ConvAsm1x1U,0.0408,0,miopenConvolutionFwdAlgoDirect,<unused>;miopenConvolutionFwdAlgoGEMM:gemm,0.04592,0,rocBlas,<unused>;miopenConvolutionFwdAlgoWinograd:ConvBinWinogradRxSf3x2,0.09248,0,miopenConvolutionFwdAlgoWinograd,304x56x56x1x1x96x56x56x1xNCHWxFP32x0x0x1x1x1x1x1x1
320-56-56-1x1-96-56-56-1-0x0-1x1-1x1-0-NCHW-FP32-F=miopenConvolutionFwdAlgoImplicitGEMM:ConvHipImplicitGemmV4R4Fwd,0.05312,0,miopenConvolutionFwdAlgoImplicitGEMM,320x56x56x1x1x96x56x56x1xNCHWxFP32x0x0x1x1x1x1x1x1;miopenConvolutionFwdAlgoDirect:ConvAsm1x1U,0.04096,0,miopenConvolutionFwdAlgoDirect,<unused>;miopenConvolutionFwdAlgoGEMM:gemm,0.04768,0,rocBlas,<unused>;miopenConvolutionFwdAlgoWinograd:ConvBinWinogradRxSf3x2,0.09536,0,miopenConvolutionFwdAlgoWinograd,320x56x56x1x1x96x56x56x1xNCHWxFP32x0x0x1x1x1x1x1x1
336-56-56-1x1-576-28-28-1-0x0-2x2-1x1-0-NCHW-FP32-F=miopenConvolutionFwdAlgoDirect:ConvAsm1x1UV2,0.08176,0,miopenConvolutionFwdAlgoDirect,<unused>;miopenConvolutionFwdAlgoGEMM:gemm,0.07728,2860032,rocBlas,<unused>;miopenConvolutionFwdAlgoWinograd:ConvBinWinogradRxSf2x3,0.44576,0,miopenConvolutionFwdAlgoWinograd,336x56x56x1x1x576x28x28x1xNCHWxFP32x0x0x2x2x1x1x1x1
336-56-56-1x1-192-56-56-1-0x0-1x1-1x1-0-NCHW-FP32-F=miopenConvolutionFwdAlgoImplicitGEMM:ConvHipImplicitGemmV4R4Fwd,0.07344,0,miopenConvolutionFwdAlgoImplicitGEMM,336x56x56x1x1x192x56x56x1xNCHWxFP32x0x0x1x1x1x1x1x1;miopenConvolutionFwdAlgoDirect:ConvAsm1x1U,0.07408,0,miopenConvolutionFwdAlgoDirect,<unused>;miopenConvolutionFwdAlgoGEMM:gemm,0.08608,0,rocBlas,<unused>;miopenConvolutionFwdAlgoWinograd:ConvBinWinogradRxSf3x2,0.18128,0,miopenConvolutionFwdAlgoWinograd,336x56x56x1x1x192x56x56x1xNCHWxFP32x0x0x1x1x1x1x1x1
192-56-56-3x3-192-28-28-1-1x1-2x2-1x1-0-NCHW-FP32-F_g32=miopenConvolutionFwdAlgoDirect:ConvOclDirectFwd,0.0368,0,miopenConvolutionFwdAlgoDirect,<unused>;miopenConvolutionFwdAlgoGEMM:gemm,0.06496,5419008,rocBlas,<unused>;miopenConvolutionFwdAlgoWinograd:ConvBinWinogradRxSf2x3,0.07408,0,miopenConvolutionFwdAlgoWinograd,192x56x56x3x3x192x28x28x1xNCHWxFP32x1x1x2x2x1x1x32x1
192-28-28-1x1-544-28-28-1-0x0-1x1-1x1-0-NCHW-FP32-F=miopenConvolutionFwdAlgoDirect:ConvOclDirectFwd1x1,0.03952,0,miopenConvolutionFwdAlgoDirect,<unused>;miopenConvolutionFwdAlgoGEMM:gemm,0.044,0,rocBlas,<unused>;miopenConvolutionFwdAlgoWinograd:ConvBinWinogradRxSf2x3,0.10224,0,miopenConvolutionFwdAlgoWinograd,192x28x28x1x1x544x28x28x1xNCHWxFP32x0x0x1x1x1x1x1x1
608-28-28-1x1-192-28-28-1-0x0-1x1-1x1-0-NCHW-FP32-F=miopenConvolutionFwdAlgoDirect:ConvOclDirectFwd1x1,0.04496,0,miopenConvolutionFwdAlgoDirect,<unused>;miopenConvolutionFwdAlgoGEMM:gemm,0.05792,0,rocBlas,<unused>;miopenConvolutionFwdAlgoWinograd:ConvBinWinogradRxSf2x3,0.15056,0,miopenConvolutionFwdAlgoWinograd,608x28x28x1x1x192x28x28x1xNCHWxFP32x0x0x1x1x1x1x1x1
192-28-28-3x3-192-28-28-1-1x1-1x1-1x1-0-NCHW-FP32-F_g32=miopenConvolutionFwdAlgoDirect:ConvOclDirectFwd,0.02368,0,miopenConvolutionFwdAlgoDirect,<unused>;miopenConvolutionFwdAlgoGEMM:gemm,0.06528,5419008,rocBlas,<unused>;miopenConvolutionFwdAlgoWinograd:ConvBinWinogradRxSf2x3,0.0784,0,miopenConvolutionFwdAlgoWinograd,192x28x28x3x3x192x28x28x1xNCHWxFP32x1x1x1x1x1x1x32x1
640-28-28-1x1-192-28-28-1-0x0-1x1-1x1-0-NCHW-FP32-F=miopenConvolutionFwdAlgoDirect:ConvOclDirectFwd1x1,0.04544,0,miopenConvolutionFwdAlgoDirect,<unused>;miopenConvolutionFwdAlgoGEMM:gemm,0.05408,0,rocBlas,<unused>;miopenConvolutionFwdAlgoWinograd:ConvBinWinogradRxSf2x3,0.14928,0,miopenConvolutionFwdAlgoWinograd,640x28x28x1x1x192x28x28x1xNCHWxFP32x0x0x1x1x1x1x1x1
672-28-28-1x1-192-28-28-1-0x0-1x1-1x1-0-NCHW-FP32-F=miopenConvolutionFwdAlgoDirect:ConvOclDirectFwd1x1,0.05056,0,miopenConvolutionFwdAlgoDirect,<unused>;miopenConvolutionFwdAlgoGEMM:gemm,0.05648,0,rocBlas,<unused>;miopenConvolutionFwdAlgoWinograd:ConvBinWinogradRxSf2x3,0.15616,0,miopenConvolutionFwdAlgoWinograd,672x28x28x1x1x192x28x28x1xNCHWxFP32x0x0x1x1x1x1x1x1
704-28-28-1x1-1072-14-14-1-0x0-2x2-1x1-0-NCHW-FP32-F=miopenConvolutionFwdAlgoDirect:ConvAsm1x1U,0.09488,551936,miopenConvolutionFwdAlgoDirect,<unused>;miopenConvolutionFwdAlgoGEMM:gemm,0.07696,1392384,rocBlas,<unused>;miopenConvolutionFwdAlgoWinograd:ConvBinWinogradRxSf2x3,0.608319,0,miopenConvolutionFwdAlgoWinograd,704x28x28x1x1x1072x14x14x1xNCHWxFP32x0x0x2x2x1x1x1x1
704-28-28-1x1-384-28-28-1-0x0-1x1-1x1-0-NCHW-FP32-F=miopenConvolutionFwdAlgoDirect:ConvOclDirectFwd1x1,0.08768,0,miopenConvolutionFwdAlgoDirect,<unused>;miopenConvolutionFwdAlgoGEMM:gemm,0.07312,0,rocBlas,<unused>;miopenConvolutionFwdAlgoWinograd:ConvBinWinogradRxSf3x2,0.17552,0,miopenConvolutionFwdAlgoWinograd,704x28x28x1x1x384x28x28x1xNCHWxFP32x0x0x1x1x1x1x1x1
384-28-28-3x3-384-14-14-1-1x1-2x2-1x1-0-NCHW-FP32-F_g32=miopenConvolutionFwdAlgoDirect:ConvOclDirectFwd,0.0464,0,miopenConvolutionFwdAlgoDirect,<unused>;miopenConvolutionFwdAlgoGEMM:gemm,0.0624,2709504,rocBlas,<unused>;miopenConvolutionFwdAlgoWinograd:ConvBinWinogradRxSf2x3,0.04608,0,miopenConvolutionFwdAlgoWinograd,384x28x28x3x3x384x14x14x1xNCHWxFP32x1x1x2x2x1x1x32x1
384-14-14-1x1-1048-14-14-1-0x0-1x1-1x1-0-NCHW-FP32-F=miopenConvolutionFwdAlgoDirect:ConvOclDirectFwd1x1,0.05312,0,miopenConvolutionFwdAlgoDirect,<unused>;miopenConvolutionFwdAlgoGEMM:gemm,0.04048,0,rocBlas,<unused>;miopenConvolutionFwdAlgoWinograd:ConvBinWinogradRxSf3x2,0.11088,0,miopenConvolutionFwdAlgoWinograd,384x14x14x1x1x1048x14x14x1xNCHWxFP32x0x0x1x1x1x1x1x1
1096-14-14-1x1-384-14-14-1-0x0-1x1-1x1-0-NCHW-FP32-F=miopenConvolutionFwdAlgoDirect:ConvOclDirectFwd1x1,0.07856,0,miopenConvolutionFwdAlgoDirect,<unused>;miopenConvolutionFwdAlgoGEMM:gemm,0.15104,0,rocBlas,<unused>;miopenConvolutionFwdAlgoWinograd:ConvBinWinogradRxS,0.2368,0,miopenConvolutionFwdAlgoWinograd,1096x14x14x1x1x384x14x14x1xNCHWxFP32x0x0x1x1x1x1x1x1
384-14-14-3x3-384-14-14-1-1x1-1x1-1x1-0-NCHW-FP32-F_g32=miopenConvolutionFwdAlgoDirect:ConvAsm3x3U,0.01536,0,miopenConvolutionFwdAlgoDirect,<unused>;miopenConvolutionFwdAlgoGEMM:gemm,0.05792,2709504,rocBlas,<unused>;miopenConvolutionFwdAlgoWinograd:ConvBinWinogradRxSf2x3,0.03056,0,miopenConvolutionFwdAlgoWinograd,384x14x14x3x3x384x14x14x1xNCHWxFP32x1x1x1x1x1x1x32x1
1120-14-14-1x1-384-14-14-1-0x0-1x1-1x1-0-NCHW-FP32-F=miopenConvolutionFwdAlgoDirect:ConvOclDirectFwd1x1,0.05424,0,miopenConvolutionFwdAlgoDirect,<unused>;miopenConvolutionFwdAlgoGEMM:gemm,0.07552,0,rocBlas,<unused>;miopenConvolutionFwdAlgoWinograd:ConvBinWinogradRxSf2x3,0.24176,0,miopenConvolutionFwdAlgoWinograd,1120x14x14x1x1x384x14x14x1xNCHWxFP32x0x0x1x1x1x1x1x1
1144-14-14-1x1-384-14-14-1-0x0-1x1-1x1-0-NCHW-FP32-F=miopenConvolutionFwdAlgoDirect:ConvAsm1x1U,0.08608,0,miopenConvolutionFwdAlgoDirect,<unused>;miopenConvolutionFwdAlgoGEMM:gemm,0.07584,0,rocBlas,<unused>;miopenConvolutionFwdAlgoWinograd:ConvBinWinogradRxS,0.24592,0,miopenConvolutionFwdAlgoWinograd,1144x14x14x1x1x384x14x14x1xNCHWxFP32x0x0x1x1x1x1x1x1
1168-14-14-1x1-384-14-14-1-0x0-1x1-1x1-0-NCHW-FP32-F=miopenConvolutionFwdAlgoDirect:ConvOclDirectFwd1x1,0.0544,0,miopenConvolutionFwdAlgoDirect,<unused>;miopenConvolutionFwdAlgoGEMM:gemm,0.07056,0,rocBlas,<unused>;miopenConvolutionFwdAlgoWinograd:ConvBinWinogradRxSf2x3,0.25136,0,miopenConvolutionFwdAlgoWinograd,1168x14x14x1x1x384x14x14x1xNCHWxFP32x0x0x1x1x1x1x1x1
1192-14-14-1x1-384-14-14-1-0x0-1x1-1x1-0-NCHW-FP32-F=miopenConvolutionFwdAlgoDirect:ConvOclDirectFwd1x1,0.24928,0,miopenConvolutionFwdAlgoDirect,<unused>;miopenConvolutionFwdAlgoGEMM:gemm,0.06832,0,rocBlas,<unused>;miopenConvolutionFwdAlgoWinograd:ConvBinWinogradRxSf2x3,0.25552,0,miopenConvolutionFwdAlgoWinograd,1192x14x14x1x1x384x14x14x1xNCHWxFP32x0x0x1x1x1x1x1x1
1216-14-14-1x1-384-14-14-1-0x0-1x1-1x1-0-NCHW-FP32-F=miopenConvolutionFwdAlgoDirect:ConvOclDirectFwd1x1,0.06752,0,miopenConvolutionFwdAlgoDirect,<unused>;miopenConvolutionFwdAlgoGEMM:gemm,0.06624,0,rocBlas,<unused>;miopenConvolutionFwdAlgoWinograd:ConvBinWinogradRxSf2x3,0.26048,0,miopenConvolutionFwdAlgoWinograd,1216x14x14x1x1x384x14x14x1xNCHWxFP32x0x0x1x1x1x1x1x1
1240-14-14-1x1-384-14-14-1-0x0-1x1-1x1-0-NCHW-FP32-F=miopenConvolutionFwdAlgoDirect:ConvOclDirectFwd1x1,0.26176,0,miopenConvolutionFwdAlgoDirect,<unused>;miopenConvolutionFwdAlgoGEMM:gemm,0.06688,0,rocBlas,<unused>;miopenConvolutionFwdAlgoWinograd:ConvBinWinogradRxS,0.26608,0,miopenConvolutionFwdAlgoWinograd,1240x14x14x1x1x384x14x14x1xNCHWxFP32x0x0x1x1x1x1x1x1
1264-14-14-1x1-384-14-14-1-0x0-1x1-1x1-0-NCHW-FP32-F=miopenConvolutionFwdAlgoDirect:ConvOclDirectFwd1x1,0.0704,0,miopenConvolutionFwdAlgoDirect,<unused>;miopenConvolutionFwdAlgoGEMM:gemm,0.068,0,rocBlas,<unused>;miopenConvolutionFwdAlgoWinograd:ConvBinWinogradRxSf2x3,0.26944,0,miopenConvolutionFwdAlgoWinograd,1264x14x14x1x1x384x14x14x1xNCHWxFP32x0x0x1x1x1x1x1x1
1288-14-14-1x1-384-14-14-1-0x0-1x1-1x1-0-NCHW-FP32-F=miopenConvolutionFwdAlgoDirect:ConvOclDirectFwd1x1,0.2768,0,miopenConvolutionFwdAlgoDirect,<unused>;miopenConvolutionFwdAlgoGEMM:gemm,0.06864,0,rocBlas,<unused>;miopenConvolutionFwdAlgoWinograd:ConvBinWinogradRxSf2x3,0.2736,0,miopenConvolutionFwdAlgoWinograd,1288x14x14x1x1x384x14x14x1xNCHWxFP32x0x0x1x1x1x1x1x1
1312-14-14-1x1-384-14-14-1-0x0-1x1-1x1-0-NCHW-FP32-F=miopenConvolutionFwdAlgoDirect:ConvOclDirectFwd1x1,0.07504,0,miopenConvolutionFwdAlgoDirect,<unused>;miopenConvolutionFwdAlgoGEMM:gemm,0.06768,0,rocBlas,<unused>;miopenConvolutionFwdAlgoWinograd:ConvBinWinogradRxSf2x3,0.27808,0,miopenConvolutionFwdAlgoWinograd,1312x14x14x1x1x384x14x14x1xNCHWxFP32x0x0x1x1x1x1x1x1
1336-14-14-1x1-384-14-14-1-0x0-1x1-1x1-0-NCHW-FP32-F=miopenConvolutionFwdAlgoDirect:ConvOclDirectFwd1x1,0.28496,0,miopenConvolutionFwdAlgoDirect,<unused>;miopenConvolutionFwdAlgoGEMM:gemm,0.07024,0,rocBlas,<unused>;miopenConvolutionFwdAlgoWinograd:ConvBinWinogradRxS,0.28384,0,miopenConvolutionFwdAlgoWinograd,1336x14x14x1x1x384x14x14x1xNCHWxFP32x0x0x1x1x1x1x1x1
1360-14-14-1x1-384-14-14-1-0x0-1x1-1x1-0-NCHW-FP32-F=miopenConvolutionFwdAlgoDirect:ConvOclDirectFwd1x1,0.076,0,miopenConvolutionFwdAlgoDirect,<unused>;miopenConvolutionFwdAlgoGEMM:gemm,0.0712,0,rocBlas,<unused>;miopenConvolutionFwdAlgoWinograd:ConvBinWinogradRxSf2x3,0.28736,0,miopenConvolutionFwdAlgoWinograd,1360x14x14x1x1x384x14x14x1xNCHWxFP32x0x0x1x1x1x1x1x1
1384-14-14-1x1-384-14-14-1-0x0-1x1-1x1-0-NCHW-FP32-F=miopenConvolutionFwdAlgoDirect:ConvOclDirectFwd1x1,0.3056,0,miopenConvolutionFwdAlgoDirect,<unused>;miopenConvolutionFwdAlgoGEMM:gemm,0.07312,0,rocBlas,<unused>;miopenConvolutionFwdAlgoWinograd:ConvBinWinogradRxS,0.2928,0,miopenConvolutionFwdAlgoWinograd,1384x14x14x1x1x384x14x14x1xNCHWxFP32x0x0x1x1x1x1x1x1
1408-14-14-1x1-384-14-14-1-0x0-1x1-1x1-0-NCHW-FP32-F=miopenConvolutionFwdAlgoDirect:ConvOclDirectFwd1x1,0.08496,0,miopenConvolutionFwdAlgoDirect,<unused>;miopenConvolutionFwdAlgoGEMM:gemm,0.07216,0,rocBlas,<unused>;miopenConvolutionFwdAlgoWinograd:ConvBinWinogradRxSf2x3,0.2968,0,miopenConvolutionFwdAlgoWinograd,1408x14x14x1x1x384x14x14x1xNCHWxFP32x0x0x1x1x1x1x1x1
1432-14-14-1x1-384-14-14-1-0x0-1x1-1x1-0-NCHW-FP32-F=miopenConvolutionFwdAlgoDirect:ConvOclDirectFwd1x1,0.32032,0,miopenConvolutionFwdAlgoDirect,<unused>;miopenConvolutionFwdAlgoGEMM:gemm,0.07152,0,rocBlas,<unused>;miopenConvolutionFwdAlgoWinograd:ConvBinWinogradRxSf2x3,0.30192,0,miopenConvolutionFwdAlgoWinograd,1432x14x14x1x1x384x14x14x1xNCHWxFP32x0x0x1x1x1x1x1x1
1456-14-14-1x1-384-14-14-1-0x0-1x1-1x1-0-NCHW-FP32-F=miopenConvolutionFwdAlgoDirect:ConvOclDirectFwd1x1,0.07856,0,miopenConvolutionFwdAlgoDirect,<unused>;miopenConvolutionFwdAlgoGEMM:gemm,0.06,0,rocBlas,<unused>;miopenConvolutionFwdAlgoWinograd:ConvBinWinogradRxSf2x3,0.30592,0,miopenConvolutionFwdAlgoWinograd,1456x14x14x1x1x384x14x14x1xNCHWxFP32x0x0x1x1x1x1x1x1
1480-14-14-1x1-384-14-14-1-0x0-1x1-1x1-0-NCHW-FP32-F=miopenConvolutionFwdAlgoDirect:ConvOclDirectFwd1x1,0.33872,0,miopenConvolutionFwdAlgoDirect,<unused>;miopenConvolutionFwdAlgoGEMM:gemm,0.06,0,rocBlas,<unused>;miopenConvolutionFwdAlgoWinograd:ConvBinWinogradRxSf2x3,0.31024,0,miopenConvolutionFwdAlgoWinograd,1480x14x14x1x1x384x14x14x1xNCHWxFP32x0x0x1x1x1x1x1x1
1504-14-14-1x1-384-14-14-1-0x0-1x1-1x1-0-NCHW-FP32-F=miopenConvolutionFwdAlgoDirect:ConvOclDirectFwd1x1,0.08,0,miopenConvolutionFwdAlgoDirect,<unused>;miopenConvolutionFwdAlgoGEMM:gemm,0.05888,0,rocBlas,<unused>;miopenConvolutionFwdAlgoWinograd:ConvBinWinogradRxSf2x3,0.31536,0,miopenConvolutionFwdAlgoWinograd,1504x14x14x1x1x384x14x14x1xNCHWxFP32x0x0x1x1x1x1x1x1
1528-14-14-1x1-384-14-14-1-0x0-1x1-1x1-0-NCHW-FP32-F=miopenConvolutionFwdAlgoDirect:ConvOclDirectFwd1x1,0.35888,0,miopenConvolutionFwdAlgoDirect,<unused>;miopenConvolutionFwdAlgoGEMM:gemm,0.06272,0,rocBlas,<unused>;miopenConvolutionFwdAlgoWinograd:ConvBinWinogradRxS,0.32064,0,miopenConvolutionFwdAlgoWinograd,1528x14x14x1x1x384x14x14x1xNCHWxFP32x0x0x1x1x1x1x1x1
1552-14-14-1x1-2304-7-7-1-0x0-2x2-1x1-0-NCHW-FP32-F=miopenConvolutionFwdAlgoDirect:ConvOclDirectFwd1x1,0.21264,0,miopenConvolutionFwdAlgoDirect,<unused>;miopenConvolutionFwdAlgoGEMM:gemm,0.136,755776,rocBlas,<unused>;miopenConvolutionFwdAlgoWinograd:ConvBinWinogradRxSf2x3,1.30704,0,miopenConvolutionFwdAlgoWinograd,1552x14x14x1x1x2304x7x7x1xNCHWxFP32x0x0x2x2x1x1x1x1
1552-14-14-1x1-768-14-14-1-0x0-1x1-1x1-0-NCHW-FP32-F=miopenConvolutionFwdAlgoDirect:ConvOclDirectFwd1x1,0.21648,0,miopenConvolutionFwdAlgoDirect,<unused>;miopenConvolutionFwdAlgoGEMM:gemm,0.13184,0,rocBlas,<unused>;miopenConvolutionFwdAlgoWinograd:ConvBinWinogradRxSf2x3,0.3288,0,miopenConvolutionFwdAlgoWinograd,1552x14x14x1x1x768x14x14x1xNCHWxFP32x0x0x1x1x1x1x1x1
768-14-14-3x3-768-7-7-1-1x1-2x2-1x1-0-NCHW-FP32-F_g32=miopenConvolutionFwdAlgoDirect:ConvOclDirectFwd,0.12704,0,miopenConvolutionFwdAlgoDirect,<unused>;miopenConvolutionFwdAlgoGEMM:gemm,0.06,1354752,rocBlas,<unused>;miopenConvolutionFwdAlgoWinograd:ConvBinWinogradRxSf2x3,0.04272,0,miopenConvolutionFwdAlgoWinograd,768x14x14x3x3x768x7x7x1xNCHWxFP32x1x1x2x2x1x1x32x1
768-7-7-1x1-2176-7-7-1-0x0-1x1-1x1-0-NCHW-FP32-F=miopenConvolutionFwdAlgoDirect:ConvOclDirectFwd1x1,0.10048,0,miopenConvolutionFwdAlgoDirect,<unused>;miopenConvolutionFwdAlgoGEMM:gemm,0.0584,0,rocBlas,<unused>;miopenConvolutionFwdAlgoWinograd:ConvBinWinogradRxSf2x3,0.32432,0,miopenConvolutionFwdAlgoWinograd,768x7x7x1x1x2176x7x7x1xNCHWxFP32x0x0x1x1x1x1x1x1
2432-7-7-1x1-768-7-7-1-0x0-1x1-1x1-0-NCHW-FP32-F=miopenConvolutionFwdAlgoDirect:ConvOclDirectFwd1x1,0.10624,0,miopenConvolutionFwdAlgoDirect,<unused>;miopenConvolutionFwdAlgoGEMM:gemm,0.09376,0,rocBlas,<unused>;miopenConvolutionFwdAlgoWinograd:ConvBinWinogradRxSf2x3,0.49824,0,miopenConvolutionFwdAlgoWinograd,2432x7x7x1x1x768x7x7x1xNCHWxFP32x0x0x1x1x1x1x1x1
768-7-7-3x3-768-7-7-1-1x1-1x1-1x1-0-NCHW-FP32-F_g32=miopenConvolutionFwdAlgoDirect:ConvAsm3x3U,0.03152,0,miopenConvolutionFwdAlgoDirect,<unused>;miopenConvolutionFwdAlgoGEMM:gemm,0.05264,1354752,rocBlas,<unused>;miopenConvolutionFwdAlgoWinograd:ConvBinWinogradRxSf2x3,0.02816,0,miopenConvolutionFwdAlgoWinograd,768x7x7x3x3x768x7x7x1xNCHWxFP32x1x1x1x1x1x1x32x1
2560-7-7-1x1-768-7-7-1-0x0-1x1-1x1-0-NCHW-FP32-F=miopenConvolutionFwdAlgoDirect:ConvOclDirectFwd1x1,0.11136,0,miopenConvolutionFwdAlgoDirect,<unused>;miopenConvolutionFwdAlgoGEMM:gemm,0.0952,0,rocBlas,<unused>;miopenConvolutionFwdAlgoWinograd:ConvBinWinogradRxSf2x3,0.52704,0,miopenConvolutionFwdAlgoWinograd,2560x7x7x1x1x768x7x7x1xNCHWxFP32x0x0x1x1x1x1x1x1
2688-1-1-1x1-1000-1-1-1-0x0-1x1-1x1-0-NCHW-FP32-F=miopenConvolutionFwdAlgoDirect:ConvOclDirectFwd1x1,0.35408,0,miopenConvolutionFwdAlgoDirect,<unused>;miopenConvolutionFwdAlgoGEMM:gemm,0.05376,0,rocBlas,<unused>;miopenConvolutionFwdAlgoWinograd:ConvBinWinogradRxSf2x3,0.4776,0,miopenConvolutionFwdAlgoWinograd,2688x1x1x1x1x1000x1x1x1xNCHWxFP32x0x0x1x1x1x1x1x1
256-56-56-3x3-256-56-56-1-1x1-1x1-1x1-0-NCHW-FP32-F_g64=miopenConvolutionFwdAlgoDirect:ConvAsm3x3U,0.0224,0,miopenConvolutionFwdAlgoDirect,<unused>;miopenConvolutionFwdAlgoGEMM:gemm,0.1936,28901376,rocBlas,<unused>;miopenConvolutionFwdAlgoWinograd:ConvBinWinogradRxSf2x3,0.30128,0,miopenConvolutionFwdAlgoWinograd,256x56x56x3x3x256x56x56x1xNCHWxFP32x1x1x1x1x1x1x64x1
320-56-56-1x1-256-56-56-1-0x0-1x1-1x1-0-NCHW-FP32-F=miopenConvolutionFwdAlgoImplicitGEMM:ConvHipImplicitGemmV4R4Fwd,0.08656,0,miopenConvolutionFwdAlgoImplicitGEMM,320x56x56x1x1x256x56x56x1xNCHWxFP32x0x0x1x1x1x1x1x1;miopenConvolutionFwdAlgoDirect:ConvAsm1x1U,0.08992,0,miopenConvolutionFwdAlgoDirect,<unused>;miopenConvolutionFwdAlgoGEMM:gemm,0.08272,0,rocBlas,<unused>;miopenConvolutionFwdAlgoWinograd:ConvBinWinogradRxSf3x2,0.16704,0,miopenConvolutionFwdAlgoWinograd,320x56x56x1x1x256x56x56x1xNCHWxFP32x0x0x1x1x1x1x1x1
256-56-56-1x1-256-56-56-1-0x0-1x1-1x1-0-NCHW-FP32-F=miopenConvolutionFwdAlgoImplicitGEMM:ConvHipImplicitGemmV4R4Fwd,0.09424,0,miopenConvolutionFwdAlgoImplicitGEMM,256x56x56x1x1x256x56x56x1xNCHWxFP32x0x0x1x1x1x1x1x1;miopenConvolutionFwdAlgoDirect:ConvOclDirectFwd1x1,0.07632,0,miopenConvolutionFwdAlgoDirect,<unused>;miopenConvolutionFwdAlgoGEMM:gemm,0.06992,0,rocBlas,<unused>;miopenConvolutionFwdAlgoWinograd:ConvBinWinogradRxSf3x2,0.14096,0,miopenConvolutionFwdAlgoWinograd,256x56x56x1x1x256x56x56x1xNCHWxFP32x0x0x1x1x1x1x1x1
256-56-56-1x1-512-56-56-1-0x0-1x1-1x1-0-NCHW-FP32-F=miopenConvolutionFwdAlgoImplicitGEMM:ConvHipImplicitGemmV4R4Fwd,0.11264,0,miopenConvolutionFwdAlgoImplicitGEMM,256x56x56x1x1x512x56x56x1xNCHWxFP32x0x0x1x1x1x1x1x1;miopenConvolutionFwdAlgoDirect:ConvAsm1x1U,0.16816,0,miopenConvolutionFwdAlgoDirect,<unused>;miopenConvolutionFwdAlgoGEMM:gemm,0.11408,0,rocBlas,<unused>;miopenConvolutionFwdAlgoWinograd:ConvBinWinogradRxSf3x2,0.25408,0,miopenConvolutionFwdAlgoWinograd,256x56x56x1x1x512x56x56x1xNCHWxFP32x0x0x1x1x1x1x1x1
512-56-56-3x3-512-28-28-1-1x1-2x2-1x1-0-NCHW-FP32-F_g64=miopenConvolutionFwdAlgoDirect:ConvOclDirectFwd,0.07536,0,miopenConvolutionFwdAlgoDirect,<unused>;miopenConvolutionFwdAlgoGEMM:gemm,0.12512,14450688,rocBlas,<unused>;miopenConvolutionFwdAlgoWinograd:ConvBinWinogradRxSf2x3,0.15184,0,miopenConvolutionFwdAlgoWinograd,512x56x56x3x3x512x28x28x1xNCHWxFP32x1x1x2x2x1x1x64x1
768-28-28-1x1-512-28-28-1-0x0-1x1-1x1-0-NCHW-FP32-F=miopenConvolutionFwdAlgoDirect:ConvAsm1x1U,0.12704,0,miopenConvolutionFwdAlgoDirect,<unused>;miopenConvolutionFwdAlgoGEMM:gemm,0.09664,0,rocBlas,<unused>;miopenConvolutionFwdAlgoWinograd:ConvBinWinogradRxS,0.33456,0,miopenConvolutionFwdAlgoWinograd,768x28x28x1x1x512x28x28x1xNCHWxFP32x0x0x1x1x1x1x1x1
512-28-28-1x1-512-28-28-1-0x0-1x1-1x1-0-NCHW-FP32-F=miopenConvolutionFwdAlgoDirect:ConvAsm1x1U,0.0872,0,miopenConvolutionFwdAlgoDirect,<unused>;miopenConvolutionFwdAlgoGEMM:gemm,0.06928,0,rocBlas,<unused>;miopenConvolutionFwdAlgoWinograd:ConvBinWinogradRxSf2x3,0.22816,0,miopenConvolutionFwdAlgoWinograd,512x28x28x1x1x512x28x28x1xNCHWxFP32x0x0x1x1x1x1x1x1
512-28-28-3x3-512-28-28-1-1x1-1x1-1x1-0-NCHW-FP32-F_g64=miopenConvolutionFwdAlgoDirect:ConvAsm3x3U,0.02784,0,miopenConvolutionFwdAlgoDirect,<unused>;miopenConvolutionFwdAlgoGEMM:gemm,0.13472,14450688,rocBlas,<unused>;miopenConvolutionFwdAlgoWinograd:ConvBinWinogradRxSf2x3,0.10432,0,miopenConvolutionFwdAlgoWinograd,512x28x28x3x3x512x28x28x1xNCHWxFP32x1x1x1x1x1x1x64x1
512-28-28-1x1-1024-28-28-1-0x0-1x1-1x1-0-NCHW-FP32-F=miopenConvolutionFwdAlgoDirect:ConvAsm1x1U,0.16448,0,miopenConvolutionFwdAlgoDirect,<unused>;miopenConvolutionFwdAlgoGEMM:gemm,0.11824,0,rocBlas,<unused>;miopenConvolutionFwdAlgoWinograd:ConvBinWinogradRxSf3x2,0.3808,0,miopenConvolutionFwdAlgoWinograd,512x28x28x1x1x1024x28x28x1xNCHWxFP32x0x0x1x1x1x1x1x1
1024-28-28-3x3-1024-14-14-1-1x1-2x2-1x1-0-NCHW-FP32-F_g64=miopenConvolutionFwdAlgoDirect:ConvOclDirectFwd,0.06912,0,miopenConvolutionFwdAlgoDirect,<unused>;miopenConvolutionFwdAlgoGEMM:gemm,0.11728,7225344,rocBlas,<unused>;miopenConvolutionFwdAlgoWinograd:ConvBinWinogradRxSf2x3,0.10048,0,miopenConvolutionFwdAlgoWinograd,1024x28x28x3x3x1024x14x14x1xNCHWxFP32x1x1x2x2x1x1x64x1
1536-14-14-1x1-1024-14-14-1-0x0-1x1-1x1-0-NCHW-FP32-F=miopenConvolutionFwdAlgoDirect:ConvAsm1x1U,0.1672,0,miopenConvolutionFwdAlgoDirect,<unused>;miopenConvolutionFwdAlgoGEMM:gemm,0.1736,0,rocBlas,<unused>;miopenConvolutionFwdAlgoWinograd:ConvBinWinogradRxSf3x2,0.3456,0,miopenConvolutionFwdAlgoWinograd,1536x14x14x1x1x1024x14x14x1xNCHWxFP32x0x0x1x1x1x1x1x1
1024-14-14-1x1-1024-14-14-1-0x0-1x1-1x1-0-NCHW-FP32-F=miopenConvolutionFwdAlgoDirect:ConvAsm1x1U,0.12352,0,miopenConvolutionFwdAlgoDirect,<unused>;miopenConvolutionFwdAlgoGEMM:gemm,0.13808,0,rocBlas,<unused>;miopenConvolutionFwdAlgoWinograd:ConvBinWinogradRxSf3x2,0.28512,0,miopenConvolutionFwdAlgoWinograd,1024x14x14x1x1x1024x14x14x1xNCHWxFP32x0x0x1x1x1x1x1x1
1024-14-14-3x3-1024-14-14-1-1x1-1x1-1x1-0-NCHW-FP32-F_g64=miopenConvolutionFwdAlgoDirect:ConvOclDirectFwd,0.03568,0,miopenConvolutionFwdAlgoDirect,<unused>;miopenConvolutionFwdAlgoGEMM:gemm,0.0872,7225344,rocBlas,<unused>;miopenConvolutionFwdAlgoWinograd:ConvBinWinogradRxSf2x3,0.05168,0,miopenConvolutionFwdAlgoWinograd,1024x14x14x3x3x1024x14x14x1xNCHWxFP32x1x1x1x1x1x1x64x1
1024-14-14-1x1-2048-14-14-1-0x0-1x1-1x1-0-NCHW-FP32-F=miopenConvolutionFwdAlgoDirect:ConvAsm1x1U,0.2168,0,miopenConvolutionFwdAlgoDirect,<unused>;miopenConvolutionFwdAlgoGEMM:gemm,0.21104,0,rocBlas,<unused>;miopenConvolutionFwdAlgoWinograd:ConvBinWinogradRxSf3x2,0.45808,0,miopenConvolutionFwdAlgoWinograd,1024x14x14x1x1x2048x14x14x1xNCHWxFP32x0x0x1x1x1x1x1x1
2048-14-14-3x3-2048-7-7-1-1x1-2x2-1x1-0-NCHW-FP32-F_g64=miopenConvolutionFwdAlgoDirect:ConvOclDirectFwd,0.11664,0,miopenConvolutionFwdAlgoDirect,<unused>;miopenConvolutionFwdAlgoGEMM:gemm,0.1064,3612672,rocBlas,<unused>;miopenConvolutionFwdAlgoWinograd:ConvBinWinogradRxSf2x3,0.08704,0,miopenConvolutionFwdAlgoWinograd,2048x14x14x3x3x2048x7x7x1xNCHWxFP32x1x1x2x2x1x1x64x1
3072-7-7-1x1-2048-7-7-1-0x0-1x1-1x1-0-NCHW-FP32-F=miopenConvolutionFwdAlgoDirect:ConvOclDirectFwd1x1,0.39168,0,miopenConvolutionFwdAlgoDirect,<unused>;miopenConvolutionFwdAlgoGEMM:gemm,0.18864,0,rocBlas,<unused>;miopenConvolutionFwdAlgoWinograd:ConvBinWinogradRxSf2x3,1.21968,0,miopenConvolutionFwdAlgoWinograd,3072x7x7x1x1x2048x7x7x1xNCHWxFP32x0x0x1x1x1x1x1x1
2048-7-7-1x1-2048-7-7-1-0x0-1x1-1x1-0-NCHW-FP32-F=miopenConvolutionFwdAlgoDirect:ConvOclDirectFwd1x1,0.29024,0,miopenConvolutionFwdAlgoDirect,<unused>;miopenConvolutionFwdAlgoGEMM:gemm,0.1576,0,rocBlas,<unused>;miopenConvolutionFwdAlgoWinograd:ConvBinWinogradRxSf2x3,0.831199,0,miopenConvolutionFwdAlgoWinograd,2048x7x7x1x1x2048x7x7x1xNCHWxFP32x0x0x1x1x1x1x1x1
2048-7-7-3x3-2048-7-7-1-1x1-1x1-1x1-0-NCHW-FP32-F_g64=miopenConvolutionFwdAlgoDirect:ConvOclDirectFwd,0.0416,0,miopenConvolutionFwdAlgoDirect,<unused>;miopenConvolutionFwdAlgoGEMM:gemm,0.1144,3612672,rocBlas,<unused>;miopenConvolutionFwdAlgoWinograd:ConvBinWinogradRxSf2x3,0.05344,0,miopenConvolutionFwdAlgoWinograd,2048x7x7x3x3x2048x7x7x1xNCHWxFP32x1x1x1x1x1x1x64x1
512-7-7-7x7-4096-1-1-1-0x0-1x1-1x1-0-NCHW-FP32-F=miopenConvolutionFwdAlgoDirect:ConvOclDirectFwd,4.52975,0,miopenConvolutionFwdAlgoDirect,<unused>;miopenConvolutionFwdAlgoGEMM:gemm,1.52048,100352,rocBlas,<unused>;miopenConvolutionFwdAlgoWinograd:ConvBinWinogradRxSf2x3,3.31439,0,miopenConvolutionFwdAlgoWinograd,512x7x7x7x7x4096x1x1x1xNCHWxFP32x0x0x1x1x1x1x1x1
4096-1-1-1x1-4096-1-1-1-0x0-1x1-1x1-0-NCHW-FP32-F=miopenConvolutionFwdAlgoDirect:ConvOclDirectFwd1x1,1.05872,0,miopenConvolutionFwdAlgoDirect,<unused>;miopenConvolutionFwdAlgoGEMM:gemm,0.216,0,rocBlas,<unused>;miopenConvolutionFwdAlgoWinograd:ConvBinWinogradRxS,2.42304,0,miopenConvolutionFwdAlgoWinograd,4096x1x1x1x1x4096x1x1x1xNCHWxFP32x0x0x1x1x1x1x1x1
4096-1-1-1x1-1000-1-1-1-0x0-1x1-1x1-0-NCHW-FP32-F=miopenConvolutionFwdAlgoDirect:ConvOclDirectFwd1x1,0.27664,0,miopenConvolutionFwdAlgoDirect,<unused>;miopenConvolutionFwdAlgoGEMM:gemm,0.0832,0,rocBlas,<unused>;miopenConvolutionFwdAlgoWinograd:ConvBinWinogradRxSf2x3,0.729439,0,miopenConvolutionFwdAlgoWinograd,4096x1x1x1x1x1000x1x1x1xNCHWxFP32x0x0x1x1x1x1x1x1
3-225-225-3x3-32-112-112-1-0x0-2x2-1x1-0-NCHW-FP32-F=miopenConvolutionFwdAlgoDirect:ConvOclDirectFwd,0.01888,0,miopenConvolutionFwdAlgoDirect,<unused>;miopenConvolutionFwdAlgoGEMM:gemm,0.06608,1354752,rocBlas,<unused>;miopenConvolutionFwdAlgoWinograd:ConvBinWinogradRxSf2x3,0.03536,0,miopenConvolutionFwdAlgoWinograd,3x225x225x3x3x32x112x112x1xNCHWxFP32x0x0x2x2x1x1x1x1
32-112-112-3x3-32-112-112-1-1x1-1x1-1x1-0-NCHW-FP32-F_g32=miopenConvolutionFwdAlgoDirect:ConvOclDirectFwd,0.01568,0,miopenConvolutionFwdAlgoDirect,<unused>;miopenConvolutionFwdAlgoGEMM:gemm,0.14864,14450688,rocBlas,<unused>;miopenConvolutionFwdAlgoWinograd:ConvBinWinogradRxSf2x3,0.19024,0,miopenConvolutionFwdAlgoWinograd,32x112x112x3x3x32x112x112x1xNCHWxFP32x1x1x1x1x1x1x32x1
32-112-112-1x1-64-112-112-1-0x0-1x1-1x1-0-NCHW-FP32-F=miopenConvolutionFwdAlgoImplicitGEMM:ConvHipImplicitGemmV4R4Fwd,0.02,0,miopenConvolutionFwdAlgoImplicitGEMM,32x112x112x1x1x64x112x112x1xNCHWxFP32x0x0x1x1x1x1x1x1;miopenConvolutionFwdAlgoDirect:ConvAsm1x1U,0.0208,0,miopenConvolutionFwdAlgoDirect,<unused>;miopenConvolutionFwdAlgoGEMM:gemm,0.02544,0,rocBlas,<unused>;miopenConvolutionFwdAlgoWinograd:ConvBinWinogradRxSf3x2,0.04992,0,miopenConvolutionFwdAlgoWinograd,32x112x112x1x1x64x112x112x1xNCHWxFP32x0x0x1x1x1x1x1x1
64-113-113-3x3-64-56-56-1-0x0-2x2-1x1-0-NCHW-FP32-F_g64=miopenConvolutionFwdAlgoDirect:ConvOclDirectFwd,0.02368,0,miopenConvolutionFwdAlgoDirect,<unused>;miopenConvolutionFwdAlgoGEMM:gemm,0.08992,7225344,rocBlas,<unused>;miopenConvolutionFwdAlgoWinograd:ConvBinWinogradRxSf2x3,0.21328,0,miopenConvolutionFwdAlgoWinograd,64x113x113x3x3x64x56x56x1xNCHWxFP32x0x0x2x2x1x1x64x1
128-56-56-3x3-128-56-56-1-1x1-1x1-1x1-0-NCHW-FP32-F_g128=miopenConvolutionFwdAlgoDirect:ConvOclDirectFwd,0.01568,0,miopenConvolutionFwdAlgoDirect,<unused>;miopenConvolutionFwdAlgoGEMM:gemm,0.14672,14450688,rocBlas,<unused>;miopenConvolutionFwdAlgoWinograd:ConvBinWinogradRxSf2x3,0.23296,0,miopenConvolutionFwdAlgoWinograd,128x56x56x3x3x128x56x56x1xNCHWxFP32x1x1x1x1x1x1x128x1
128-57-57-3x3-128-28-28-1-0x0-2x2-1x1-0-NCHW-FP32-F_g128=miopenConvolutionFwdAlgoDirect:ConvOclDirectFwd,0.01536,0,miopenConvolutionFwdAlgoDirect,<unused>;miopenConvolutionFwdAlgoGEMM:gemm,0.05376,3612672,rocBlas,<unused>;miopenConvolutionFwdAlgoWinograd:ConvBinWinogradRxSf2x3,0.1336,0,miopenConvolutionFwdAlgoWinograd,128x57x57x3x3x128x28x28x1xNCHWxFP32x0x0x2x2x1x1x128x1
128-28-28-1x1-256-28-28-1-0x0-1x1-1x1-0-NCHW-FP32-F=miopenConvolutionFwdAlgoDirect:ConvAsm1x1U,0.01808,0,miopenConvolutionFwdAlgoDirect,<unused>;miopenConvolutionFwdAlgoGEMM:gemm,0.04896,0,rocBlas,<unused>;miopenConvolutionFwdAlgoWinograd:ConvBinWinogradRxS,0.05776,0,miopenConvolutionFwdAlgoWinograd,128x28x28x1x1x256x28x28x1xNCHWxFP32x0x0x1x1x1x1x1x1
256-28-28-3x3-256-28-28-1-1x1-1x1-1x1-0-NCHW-FP32-F_g256=miopenConvolutionFwdAlgoDirect:ConvOclDirectFwd,0.01232,0,miopenConvolutionFwdAlgoDirect,<unused>;miopenConvolutionFwdAlgoGEMM:gemm,0.07184,7225344,rocBlas,<unused>;miopenConvolutionFwdAlgoWinograd:ConvBinWinogradRxSf2x3,0.31104,0,miopenConvolutionFwdAlgoWinograd,256x28x28x3x3x256x28x28x1xNCHWxFP32x1x1x1x1x1x1x256x1
256-28-28-1x1-256-28-28-1-0x0-1x1-1x1-0-NCHW-FP32-F=miopenConvolutionFwdAlgoDirect:ConvAsm1x1U,0.02816,0,miopenConvolutionFwdAlgoDirect,<unused>;miopenConvolutionFwdAlgoGEMM:gemm,0.04752,0,rocBlas,<unused>;miopenConvolutionFwdAlgoWinograd:ConvBinWinogradRxSf2x3,0.07568,0,miopenConvolutionFwdAlgoWinograd,256x28x28x1x1x256x28x28x1xNCHWxFP32x0x0x1x1x1x1x1x1
256-29-29-3x3-256-14-14-1-0x0-2x2-1x1-0-NCHW-FP32-F_g256=miopenConvolutionFwdAlgoDirect:ConvOclDirectFwd,0.01056,0,miopenConvolutionFwdAlgoDirect,<unused>;miopenConvolutionFwdAlgoGEMM:gemm,0.04224,1806336,rocBlas,<unused>;miopenConvolutionFwdAlgoWinograd:ConvBinWinogradRxSf2x3,0.09504,0,miopenConvolutionFwdAlgoWinograd,256x29x29x3x3x256x14x14x1xNCHWxFP32x0x0x2x2x1x1x256x1
256-14-14-1x1-512-14-14-1-0x0-1x1-1x1-0-NCHW-FP32-F=miopenConvolutionFwdAlgoDirect:ConvAsm1x1U,0.03152,0,miopenConvolutionFwdAlgoDirect,<unused>;miopenConvolutionFwdAlgoGEMM:gemm,0.04192,0,rocBlas,<unused>;miopenConvolutionFwdAlgoWinograd:ConvBinWinogradRxSf2x3,0.0824,0,miopenConvolutionFwdAlgoWinograd,256x14x14x1x1x512x14x14x1xNCHWxFP32x0x0x1x1x1x1x1x1
512-14-14-3x3-512-14-14-1-1x1-1x1-1x1-0-NCHW-FP32-F_g512=miopenConvolutionFwdAlgoDirect:ConvOclDirectFwd,0.00928,0,miopenConvolutionFwdAlgoDirect,<unused>;miopenConvolutionFwdAlgoGEMM:gemm,0.07488,3612672,rocBlas,<unused>;miopenConvolutionFwdAlgoWinograd:ConvBinWinogradRxSf2x3,0.12672,0,miopenConvolutionFwdAlgoWinograd,512x14x14x3x3x512x14x14x1xNCHWxFP32x1x1x1x1x1x1x512x1
512-14-14-1x1-512-14-14-1-0x0-1x1-1x1-0-NCHW-FP32-F=miopenConvolutionFwdAlgoDirect:ConvAsm1x1U,0.0416,0,miopenConvolutionFwdAlgoDirect,<unused>;miopenConvolutionFwdAlgoGEMM:gemm,0.0344,0,rocBlas,<unused>;miopenConvolutionFwdAlgoWinograd:ConvBinWinogradRxS,0.12608,0,miopenConvolutionFwdAlgoWinograd,512x14x14x1x1x512x14x14x1xNCHWxFP32x0x0x1x1x1x1x1x1
512-15-15-3x3-512-7-7-1-0x0-2x2-1x1-0-NCHW-FP32-F_g512=miopenConvolutionFwdAlgoDirect:ConvOclDirectFwd,0.00992,0,miopenConvolutionFwdAlgoDirect,<unused>;miopenConvolutionFwdAlgoGEMM:gemm,0.04192,903168,rocBlas,<unused>;miopenConvolutionFwdAlgoWinograd:ConvBinWinogradRxSf2x3,0.11696,0,miopenConvolutionFwdAlgoWinograd,512x15x15x3x3x512x7x7x1xNCHWxFP32x0x0x2x2x1x1x512x1
512-7-7-1x1-1024-7-7-1-0x0-1x1-1x1-0-NCHW-FP32-F=miopenConvolutionFwdAlgoDirect:ConvOclDirectFwd1x1,0.03232,0,miopenConvolutionFwdAlgoDirect,<unused>;miopenConvolutionFwdAlgoGEMM:gemm,0.0368,0,rocBlas,<unused>;miopenConvolutionFwdAlgoWinograd:ConvBinWinogradRxSf2x3,0.12528,0,miopenConvolutionFwdAlgoWinograd,512x7x7x1x1x1024x7x7x1xNCHWxFP32x0x0x1x1x1x1x1x1
1024-7-7-3x3-1024-7-7-1-1x1-1x1-1x1-0-NCHW-FP32-F_g1024=miopenConvolutionFwdAlgoDirect:ConvOclDirectFwd,0.008,0,miopenConvolutionFwdAlgoDirect,<unused>;miopenConvolutionFwdAlgoGEMM:gemm,0.05152,1806336,rocBlas,<unused>;miopenConvolutionFwdAlgoWinograd:ConvBinWinogradRxSf2x3,0.19088,0,miopenConvolutionFwdAlgoWinograd,1024x7x7x3x3x1024x7x7x1xNCHWxFP32x1x1x1x1x1x1x1024x1
1024-7-7-1x1-1024-7-7-1-0x0-1x1-1x1-0-NCHW-FP32-F=miopenConvolutionFwdAlgoDirect:ConvOclDirectFwd1x1,0.05696,0,miopenConvolutionFwdAlgoDirect,<unused>;miopenConvolutionFwdAlgoGEMM:gemm,0.0616,0,rocBlas,<unused>;miopenConvolutionFwdAlgoWinograd:ConvBinWinogradRxSf2x3,0.22688,0,miopenConvolutionFwdAlgoWinograd,1024x7x7x1x1x1024x7x7x1xNCHWxFP32x0x0x1x1x1x1x1x1
1024-1-1-1x1-1001-1-1-1-0x0-1x1-1x1-0-NCHW-FP32-F=miopenConvolutionFwdAlgoDirect:ConvOclDirectFwd1x1,0.05568,0,miopenConvolutionFwdAlgoDirect,<unused>;miopenConvolutionFwdAlgoGEMM:gemm,0.21136,0,rocBlas,<unused>;miopenConvolutionFwdAlgoWinograd:ConvBinWinogradRxSf2x3,0.21424,0,miopenConvolutionFwdAlgoWinograd,1024x1x1x1x1x1001x1x1x1xNCHWxFP32x0x0x1x1x1x1x1x1
64-147-147-3x3-96-73-73-1-0x0-2x2-1x1-0-NCHW-FP32-F=miopenConvolutionFwdAlgoDirect:ConvOclDirectFwd,0.486239,0,miopenConvolutionFwdAlgoDirect,<unused>;miopenConvolutionFwdAlgoGEMM:gemm,0.16304,12278016,rocBlas,<unused>;miopenConvolutionFwdAlgoWinograd:ConvBinWinogradRxS,0.1928,0,miopenConvolutionFwdAlgoWinograd,64x147x147x3x3x96x73x73x1xNCHWxFP32x0x0x2x2x1x1x1x1
160-73-73-1x1-64-73-73-1-0x0-1x1-1x1-0-NCHW-FP32-F=miopenConvolutionFwdAlgoDirect:ConvAsm1x1U,0.02784,0,miopenConvolutionFwdAlgoDirect,<unused>;miopenConvolutionFwdAlgoGEMM:gemm,0.0544,0,rocBlas,<unused>;miopenConvolutionFwdAlgoWinograd:ConvBinWinogradRxSf3x2,0.06352,0,miopenConvolutionFwdAlgoWinograd,160x73x73x1x1x64x73x73x1xNCHWxFP32x0x0x1x1x1x1x1x1
64-73-73-3x3-96-71-71-1-0x0-1x1-1x1-0-NCHW-FP32-F=miopenConvolutionFwdAlgoDirect:ConvOclDirectFwd,0.24192,0,miopenConvolutionFwdAlgoDirect,<unused>;miopenConvolutionFwdAlgoGEMM:gemm,0.1264,11614464,rocBlas,<unused>;miopenConvolutionFwdAlgoWinograd:ConvBinWinogradRxS,0.06528,0,miopenConvolutionFwdAlgoWinograd,64x73x73x3x3x96x71x71x1xNCHWxFP32x0x0x1x1x1x1x1x1
64-73-73-1x7-64-73-73-1-0x3-1x1-1x1-0-NCHW-FP32-F=miopenConvolutionFwdAlgoWinograd:ConvBinWinogradRxSf3x2,0.0832,0,miopenConvolutionFwdAlgoWinograd,64x73x73x1x7x64x73x73x1xNCHWxFP32x0x3x1x1x1x1x1x1;miopenConvolutionFwdAlgoGEMM:gemm,0.10816,9549568,rocBlas,<unused>
64-73-73-7x1-64-73-73-1-3x0-1x1-1x1-0-NCHW-FP32-F=miopenConvolutionFwdAlgoWinograd:ConvBinWinogradRxSf3x2,0.08416,0,miopenConvolutionFwdAlgoWinograd,64x73x73x7x1x64x73x73x1xNCHWxFP32x3x0x1x1x1x1x1x1;miopenConvolutionFwdAlgoGEMM:gemm,0.09888,9549568,rocBlas,<unused>
192-71-71-3x3-192-35-35-1-0x0-2x2-1x1-0-NCHW-FP32-F=miopenConvolutionFwdAlgoDirect:ConvOclDirectFwd,0.924959,0,miopenConvolutionFwdAlgoDirect,<unused>;miopenConvolutionFwdAlgoGEMM:gemm,0.15152,8467200,rocBlas,<unused>;miopenConvolutionFwdAlgoWinograd:ConvBinWinogradRxSf2x3,0.34336,0,miopenConvolutionFwdAlgoWinograd,192x71x71x3x3x192x35x35x1xNCHWxFP32x0x0x2x2x1x1x1x1
384-35-35-1x1-96-35-35-1-0x0-1x1-1x1-0-NCHW-FP32-F=miopenConvolutionFwdAlgoDirect:ConvAsm1x1U,0.02688,0,miopenConvolutionFwdAlgoDirect,<unused>;miopenConvolutionFwdAlgoGEMM:gemm,0.06528,0,rocBlas,<unused>;miopenConvolutionFwdAlgoWinograd:ConvBinWinogradRxSf2x3,0.10016,0,miopenConvolutionFwdAlgoWinograd,384x35x35x1x1x96x35x35x1xNCHWxFP32x0x0x1x1x1x1x1x1
384-35-35-1x1-64-35-35-1-0x0-1x1-1x1-0-NCHW-FP32-F=miopenConvolutionFwdAlgoDirect:ConvAsm1x1U,0.02288,0,miopenConvolutionFwdAlgoDirect,<unused>;miopenConvolutionFwdAlgoGEMM:gemm,0.08112,0,rocBlas,<unused>;miopenConvolutionFwdAlgoWinograd:ConvBinWinogradRxS,0.10064,0,miopenConvolutionFwdAlgoWinograd,384x35x35x1x1x64x35x35x1xNCHWxFP32x0x0x1x1x1x1x1x1
384-35-35-3x3-384-17-17-1-0x0-2x2-1x1-0-NCHW-FP32-F=miopenConvolutionFwdAlgoDirect:ConvOclDirectFwd,1.66336,0,miopenConvolutionFwdAlgoDirect,<unused>;miopenConvolutionFwdAlgoGEMM:gemm,0.14608,3995136,rocBlas,<unused>;miopenConvolutionFwdAlgoWinograd:ConvBinWinogradRxSf2x3,0.34064,0,miopenConvolutionFwdAlgoWinograd,384x35x35x3x3x384x17x17x1xNCHWxFP32x0x0x2x2x1x1x1x1
384-35-35-1x1-192-35-35-1-0x0-1x1-1x1-0-NCHW-FP32-F=miopenConvolutionFwdAlgoDirect:ConvAsm1x1U,0.0432,0,miopenConvolutionFwdAlgoDirect,<unused>;miopenConvolutionFwdAlgoGEMM:gemm,0.07264,0,rocBlas,<unused>;miopenConvolutionFwdAlgoWinograd:ConvBinWinogradRxSf3x2,0.1088,0,miopenConvolutionFwdAlgoWinograd,384x35x35x1x1x192x35x35x1xNCHWxFP32x0x0x1x1x1x1x1x1
192-35-35-3x3-224-35-35-1-1x1-1x1-1x1-0-NCHW-FP32-F=miopenConvolutionFwdAlgoWinograd:ConvBinWinograd3x3U,0.10592,0,miopenConvolutionFwdAlgoWinograd,192x35x35x3x3x224x35x35x1xNCHWxFP32x1x1x1x1x1x1x1x1
224-35-35-3x3-256-17-17-1-0x0-2x2-1x1-0-NCHW-FP32-F=miopenConvolutionFwdAlgoDirect:ConvOclDirectFwd,0.927839,0,miopenConvolutionFwdAlgoDirect,<unused>;miopenConvolutionFwdAlgoGEMM:gemm,0.09136,2330496,rocBlas,<unused>;miopenConvolutionFwdAlgoWinograd:ConvBinWinogradRxSf2x3,0.20896,0,miopenConvolutionFwdAlgoWinograd,224x35x35x3x3x256x17x17x1xNCHWxFP32x0x0x2x2x1x1x1x1
1024-17-17-1x1-384-17-17-1-0x0-1x1-1x1-0-NCHW-FP32-F=miopenConvolutionFwdAlgoDirect:ConvOclDirectFwd1x1,0.07472,0,miopenConvolutionFwdAlgoDirect,<unused>;miopenConvolutionFwdAlgoGEMM:gemm,0.16176,0,rocBlas,<unused>;miopenConvolutionFwdAlgoWinograd:ConvBinWinogradRxS,0.23184,0,miopenConvolutionFwdAlgoWinograd,1024x17x17x1x1x384x17x17x1xNCHWxFP32x0x0x1x1x1x1x1x1
1024-17-17-1x1-192-17-17-1-0x0-1x1-1x1-0-NCHW-FP32-F=miopenConvolutionFwdAlgoDirect:ConvOclDirectFwd1x1,0.04608,0,miopenConvolutionFwdAlgoDirect,<unused>;miopenConvolutionFwdAlgoGEMM:gemm,0.09376,0,rocBlas,<unused>;miopenConvolutionFwdAlgoWinograd:ConvBinWinogradRxSf2x3,0.22672,0,miopenConvolutionFwdAlgoWinograd,1024x17x17x1x1x192x17x17x1xNCHWxFP32x0x0x1x1x1x1x1x1
192-17-17-1x7-224-17-17-1-0x3-1x1-1x1-0-NCHW-FP32-F=miopenConvolutionFwdAlgoWinograd:ConvBinWinogradRxS,0.17424,0,miopenConvolutionFwdAlgoWinograd,192x17x17x1x7x224x17x17x1xNCHWxFP32x0x3x1x1x1x1x1x1;miopenConvolutionFwdAlgoGEMM:gemm,0.06672,1553664,rocBlas,<unused>
224-17-17-7x1-256-17-17-1-3x0-1x1-1x1-0-NCHW-FP32-F=miopenConvolutionFwdAlgoWinograd:ConvBinWinogradRxSf2x3,0.16512,0,miopenConvolutionFwdAlgoWinograd,224x17x17x7x1x256x17x17x1xNCHWxFP32x3x0x1x1x1x1x1x1;miopenConvolutionFwdAlgoGEMM:gemm,0.08,1812608,rocBlas,<unused>
224-17-17-7x1-224-17-17-1-3x0-1x1-1x1-0-NCHW-FP32-F=miopenConvolutionFwdAlgoWinograd:ConvBinWinogradRxSf2x3,0.156,0,miopenConvolutionFwdAlgoWinograd,224x17x17x7x1x224x17x17x1xNCHWxFP32x3x0x1x1x1x1x1x1;miopenConvolutionFwdAlgoGEMM:gemm,0.07328,1812608,rocBlas,<unused>
224-17-17-1x7-256-17-17-1-0x3-1x1-1x1-0-NCHW-FP32-F=miopenConvolutionFwdAlgoWinograd:ConvBinWinogradRxSf2x3,0.19856,0,miopenConvolutionFwdAlgoWinograd,224x17x17x1x7x256x17x17x1xNCHWxFP32x0x3x1x1x1x1x1x1;miopenConvolutionFwdAlgoGEMM:gemm,0.07072,1812608,rocBlas,<unused>
1024-17-17-1x1-128-17-17-1-0x0-1x1-1x1-0-NCHW-FP32-F=miopenConvolutionFwdAlgoDirect:ConvOclDirectFwd1x1,0.03616,0,miopenConvolutionFwdAlgoDirect,<unused>;miopenConvolutionFwdAlgoGEMM:gemm,0.04432,0,rocBlas,<unused>;miopenConvolutionFwdAlgoWinograd:ConvBinWinogradRxSf2x3,0.22512,0,miopenConvolutionFwdAlgoWinograd,1024x17x17x1x1x128x17x17x1xNCHWxFP32x0x0x1x1x1x1x1x1
1024-17-17-1x1-256-17-17-1-0x0-1x1-1x1-0-NCHW-FP32-F=miopenConvolutionFwdAlgoDirect:ConvOclDirectFwd1x1,0.05168,0,miopenConvolutionFwdAlgoDirect,<unused>;miopenConvolutionFwdAlgoGEMM:gemm,0.12032,0,rocBlas,<unused>;miopenConvolutionFwdAlgoWinograd:ConvBinWinogradRxSf2x3,0.22528,0,miopenConvolutionFwdAlgoWinograd,1024x17x17x1x1x256x17x17x1xNCHWxFP32x0x0x1x1x1x1x1x1
256-17-17-1x7-256-17-17-1-0x3-1x1-1x1-0-NCHW-FP32-F=miopenConvolutionFwdAlgoWinograd:ConvBinWinogradRxS,0.22384,0,miopenConvolutionFwdAlgoWinograd,256x17x17x1x7x256x17x17x1xNCHWxFP32x0x3x1x1x1x1x1x1;miopenConvolutionFwdAlgoGEMM:gemm,0.08096,2071552,rocBlas,<unused>
256-17-17-7x1-320-17-17-1-3x0-1x1-1x1-0-NCHW-FP32-F=miopenConvolutionFwdAlgoWinograd:ConvBinWinogradRxS,0.1936,0,miopenConvolutionFwdAlgoWinograd,256x17x17x7x1x320x17x17x1xNCHWxFP32x3x0x1x1x1x1x1x1;miopenConvolutionFwdAlgoGEMM:gemm,0.09456,2071552,rocBlas,<unused>
320-17-17-3x3-320-8-8-1-0x0-2x2-1x1-0-NCHW-FP32-F=miopenConvolutionFwdAlgoImplicitGEMM:ConvHipImplicitGemmV4R4Fwd,0.37584,0,miopenConvolutionFwdAlgoImplicitGEMM,320x17x17x3x3x320x8x8x1xNCHWxFP32x0x0x2x2x1x1x1x1;miopenConvolutionFwdAlgoDirect:ConvOclDirectFwd,1.07536,0,miopenConvolutionFwdAlgoDirect,<unused>;miopenConvolutionFwdAlgoGEMM:gemm,0.08784,737280,rocBlas,<unused>;miopenConvolutionFwdAlgoWinograd:ConvBinWinogradRxSf2x3,0.29904,0,miopenConvolutionFwdAlgoWinograd,320x17x17x3x3x320x8x8x1xNCHWxFP32x0x0x2x2x1x1x1x1
1536-8-8-1x1-256-8-8-1-0x0-1x1-1x1-0-NCHW-FP32-F=miopenConvolutionFwdAlgoImplicitGEMM:ConvHipImplicitGemmV4R4Fwd,0.17888,0,miopenConvolutionFwdAlgoImplicitGEMM,1536x8x8x1x1x256x8x8x1xNCHWxFP32x0x0x1x1x1x1x1x1;miopenConvolutionFwdAlgoDirect:ConvOclDirectFwd1x1,0.04928,0,miopenConvolutionFwdAlgoDirect,<unused>;miopenConvolutionFwdAlgoGEMM:gemm,0.04592,0,rocBlas,<unused>;miopenConvolutionFwdAlgoWinograd:ConvBinWinogradRxSf2x3,0.32624,0,miopenConvolutionFwdAlgoWinograd,1536x8x8x1x1x256x8x8x1xNCHWxFP32x0x0x1x1x1x1x1x1
1536-8-8-1x1-384-8-8-1-0x0-1x1-1x1-0-NCHW-FP32-F=miopenConvolutionFwdAlgoImplicitGEMM:ConvHipImplicitGemmV4R4Fwd,0.17904,0,miopenConvolutionFwdAlgoImplicitGEMM,1536x8x8x1x1x384x8x8x1xNCHWxFP32x0x0x1x1x1x1x1x1;miopenConvolutionFwdAlgoDirect:ConvOclDirectFwd1x1,0.05744,0,miopenConvolutionFwdAlgoDirect,<unused>;miopenConvolutionFwdAlgoGEMM:gemm,0.06032,0,rocBlas,<unused>;miopenConvolutionFwdAlgoWinograd:ConvBinWinogradRxSf2x3,0.32608,0,miopenConvolutionFwdAlgoWinograd,1536x8x8x1x1x384x8x8x1xNCHWxFP32x0x0x1x1x1x1x1x1
384-8-8-1x3-256-8-8-1-0x1-1x1-1x1-0-NCHW-FP32-F=miopenConvolutionFwdAlgoImplicitGEMM:ConvHipImplicitGemmV4R4Fwd,0.15776,0,miopenConvolutionFwdAlgoImplicitGEMM,384x8x8x1x3x256x8x8x1xNCHWxFP32x0x1x1x1x1x1x1x1;miopenConvolutionFwdAlgoGEMM:gemm,0.04496,294912,rocBlas,<unused>;miopenConvolutionFwdAlgoWinograd:ConvBinWinogradRxS,0.09888,0,miopenConvolutionFwdAlgoWinograd,384x8x8x1x3x256x8x8x1xNCHWxFP32x0x1x1x1x1x1x1x1
384-8-8-3x1-256-8-8-1-1x0-1x1-1x1-0-NCHW-FP32-F=miopenConvolutionFwdAlgoImplicitGEMM:ConvHipImplicitGemmV4R4Fwd,0.15472,0,miopenConvolutionFwdAlgoImplicitGEMM,384x8x8x3x1x256x8x8x1xNCHWxFP32x1x0x1x1x1x1x1x1;miopenConvolutionFwdAlgoGEMM:gemm,0.04608,294912,rocBlas,<unused>;miopenConvolutionFwdAlgoWinograd:ConvBinWinogradRxSf2x3,0.1,0,miopenConvolutionFwdAlgoWinograd,384x8x8x3x1x256x8x8x1xNCHWxFP32x1x0x1x1x1x1x1x1
384-8-8-3x1-448-8-8-1-1x0-1x1-1x1-0-NCHW-FP32-F=miopenConvolutionFwdAlgoImplicitGEMM:ConvHipImplicitGemmV4R4Fwd,0.15472,0,miopenConvolutionFwdAlgoImplicitGEMM,384x8x8x3x1x448x8x8x1xNCHWxFP32x1x0x1x1x1x1x1x1;miopenConvolutionFwdAlgoGEMM:gemm,0.0472,294912,rocBlas,<unused>;miopenConvolutionFwdAlgoWinograd:ConvBinWinogradRxSf2x3,0.10016,0,miopenConvolutionFwdAlgoWinograd,384x8x8x3x1x448x8x8x1xNCHWxFP32x1x0x1x1x1x1x1x1
448-8-8-1x3-512-8-8-1-0x1-1x1-1x1-0-NCHW-FP32-F=miopenConvolutionFwdAlgoImplicitGEMM:ConvHipImplicitGemmV4R4Fwd,0.18064,0,miopenConvolutionFwdAlgoImplicitGEMM,448x8x8x1x3x512x8x8x1xNCHWxFP32x0x1x1x1x1x1x1x1;miopenConvolutionFwdAlgoGEMM:gemm,0.05456,344064,rocBlas,<unused>;miopenConvolutionFwdAlgoWinograd:ConvBinWinogradRxS,0.1112,0,miopenConvolutionFwdAlgoWinograd,448x8x8x1x3x512x8x8x1xNCHWxFP32x0x1x1x1x1x1x1x1
512-8-8-1x3-256-8-8-1-0x1-1x1-1x1-0-NCHW-FP32-F=miopenConvolutionFwdAlgoImplicitGEMM:ConvHipImplicitGemmV4R4Fwd,0.20464,0,miopenConvolutionFwdAlgoImplicitGEMM,512x8x8x1x3x256x8x8x1xNCHWxFP32x0x1x1x1x1x1x1x1;miopenConvolutionFwdAlgoGEMM:gemm,0.05424,393216,rocBlas,<unused>;miopenConvolutionFwdAlgoWinograd:ConvBinWinogradRxS,0.12432,0,miopenConvolutionFwdAlgoWinograd,512x8x8x1x3x256x8x8x1xNCHWxFP32x0x1x1x1x1x1x1x1
512-8-8-3x1-256-8-8-1-1x0-1x1-1x1-0-NCHW-FP32-F=miopenConvolutionFwdAlgoImplicitGEMM:ConvHipImplicitGemmV4R4Fwd,0.19856,0,miopenConvolutionFwdAlgoImplicitGEMM,512x8x8x3x1x256x8x8x1xNCHWxFP32x1x0x1x1x1x1x1x1;miopenConvolutionFwdAlgoGEMM:gemm,0.05552,393216,rocBlas,<unused>;miopenConvolutionFwdAlgoWinograd:ConvBinWinogradRxSf2x3,0.1256,0,miopenConvolutionFwdAlgoWinograd,512x8x8x3x1x256x8x8x1xNCHWxFP32x1x0x1x1x1x1x1x1
3-224-224-7x7-64-112-112-64-3x3-2x2-1x1-0-NCHW-FP32-F=miopenConvolutionFwdAlgoDirect:ConvAsm7x7c3h224w224k64u2v2p3q3f1,1.87296,0,miopenConvolutionFwdAlgoDirect,<unused>;miopenConvolutionFwdAlgoGEMM:gemm,6.05184,7375872,rocBlas,<unused>;miopenConvolutionFwdAlgoWinograd:ConvBinWinogradRxS,2.47248,0,miopenConvolutionFwdAlgoWinograd,3x224x224x7x7x64x112x112x64xNCHWxFP32x3x3x2x2x1x1x1x1
64-56-56-1x1-64-56-56-64-0x0-1x1-1x1-0-NCHW-FP32-F=miopenConvolutionFwdAlgoImplicitGEMM:ConvHipImplicitGemmV4_1x1,0.49392,0,miopenConvolutionFwdAlgoImplicitGEMM,64x56x56x1x1x64x56x56x64xNCHWxFP32x0x0x1x1x1x1x1x1;miopenConvolutionFwdAlgoDirect:ConvOclDirectFwd1x1,0.38496,0,miopenConvolutionFwdAlgoDirect,<unused>;miopenConvolutionFwdAlgoGEMM:gemm,0.19824,0,rocBlas,<unused>;miopenConvolutionFwdAlgoWinograd:ConvBinWinogradRxSf3x2,0.46656,0,miopenConvolutionFwdAlgoWinograd,64x56x56x1x1x64x56x56x64xNCHWxFP32x0x0x1x1x1x1x1x1
64-56-56-3x3-64-56-56-64-1x1-1x1-1x1-0-NCHW-FP32-F=miopenConvolutionFwdAlgoWinograd:ConvBinWinograd3x3U,0.795199,0,miopenConvolutionFwdAlgoWinograd,64x56x56x3x3x64x56x56x64xNCHWxFP32x1x1x1x1x1x1x1x1
128-56-56-1x1-256-56-56-64-0x0-1x1-1x1-0-NCHW-FP32-F=miopenConvolutionFwdAlgoImplicitGEMM:ConvHipImplicitGemmV4_1x1,1.52576,0,miopenConvolutionFwdAlgoImplicitGEMM,128x56x56x1x1x256x56x56x64xNCHWxFP32x0x0x1x1x1x1x1x1;miopenConvolutionFwdAlgoDirect:ConvAsm1x1U,1.72752,0,miopenConvolutionFwdAlgoDirect,<unused>;miopenConvolutionFwdAlgoGEMM:gemm,1.24944,0,rocBlas,<unused>;miopenConvolutionFwdAlgoWinograd:ConvBinWinogradRxSf3x2,2.97008,0,miopenConvolutionFwdAlgoWinograd,128x56x56x1x1x256x56x56x64xNCHWxFP32x0x0x1x1x1x1x1x1
256-56-56-1x1-64-56-56-64-0x0-1x1-1x1-0-NCHW-FP32-F=miopenConvolutionFwdAlgoImplicitGEMM:ConvHipImplicitGemmV4_1x1,1.1776,0,miopenConvolutionFwdAlgoImplicitGEMM,256x56x56x1x1x64x56x56x64xNCHWxFP32x0x0x1x1x1x1x1x1;miopenConvolutionFwdAlgoDirect:ConvOclDirectFwd1x1,0.711679,0,miopenConvolutionFwdAlgoDirect,<unused>;miopenConvolutionFwdAlgoGEMM:gemm,0.66672,0,rocBlas,<unused>;miopenConvolutionFwdAlgoWinograd:ConvBinWinogradRxSf3x2,1.44944,0,miopenConvolutionFwdAlgoWinograd,256x56x56x1x1x64x56x56x64xNCHWxFP32x0x0x1x1x1x1x1x1
64-56-56-1x1-256-56-56-64-0x0-1x1-1x1-0-NCHW-FP32-F=miopenConvolutionFwdAlgoImplicitGEMM:ConvHipImplicitGemmV4_1x1,1.34416,0,miopenConvolutionFwdAlgoImplicitGEMM,64x56x56x1x1x256x56x56x64xNCHWxFP32x0x0x1x1x1x1x1x1;miopenConvolutionFwdAlgoDirect:ConvOclDirectFwd1x1,0.7408,0,miopenConvolutionFwdAlgoDirect,<unused>;miopenConvolutionFwdAlgoGEMM:gemm,0.676,0,rocBlas,<unused>;miopenConvolutionFwdAlgoWinograd:ConvBinWinogradRxSf3x2,1.7096,0,miopenConvolutionFwdAlgoWinograd,64x56x56x1x1x256x56x56x64xNCHWxFP32x0x0x1x1x1x1x1x1
256-56-56-1x1-128-56-56-64-0x0-1x1-1x1-0-NCHW-FP32-F=miopenConvolutionFwdAlgoImplicitGEMM:ConvHipImplicitGemmV4_1x1,1.54768,0,miopenConvolutionFwdAlgoImplicitGEMM,256x56x56x1x1x128x56x56x64xNCHWxFP32x0x0x1x1x1x1x1x1;miopenConvolutionFwdAlgoDirect:ConvOclDirectFwd1x1,1.56176,0,miopenConvolutionFwdAlgoDirect,<unused>;miopenConvolutionFwdAlgoGEMM:gemm,1.296,0,rocBlas,<unused>;miopenConvolutionFwdAlgoWinograd:ConvBinWinogradRxSf3x2,2.80032,0,miopenConvolutionFwdAlgoWinograd,256x56x56x1x1x128x56x56x64xNCHWxFP32x0x0x1x1x1x1x1x1
128-56-56-3x3-128-28-28-64-1x1-2x2-1x1-0-NCHW-FP32-F=miopenConvolutionFwdAlgoImplicitGEMM:ConvHipImplicitGemmV4R1Fwd,1.62144,0,miopenConvolutionFwdAlgoImplicitGEMM,128x56x56x3x3x128x28x28x64xNCHWxFP32x1x1x2x2x1x1x1x1;miopenConvolutionFwdAlgoDirect:ConvOclDirectFwd,9.20287,0,miopenConvolutionFwdAlgoDirect,<unused>;miopenConvolutionFwdAlgoGEMM:gemm,6.26688,3612672,rocBlas,<unused>;miopenConvolutionFwdAlgoWinograd:ConvBinWinogradRxS,2.97728,0,miopenConvolutionFwdAlgoWinograd,128x56x56x3x3x128x28x28x64xNCHWxFP32x1x1x2x2x1x1x1x1
384-28-28-1x1-512-28-28-64-0x0-1x1-1x1-0-NCHW-FP32-F=miopenConvolutionFwdAlgoImplicitGEMM:ConvHipImplicitGemmV4_1x1,2.17936,0,miopenConvolutionFwdAlgoImplicitGEMM,384x28x28x1x1x512x28x28x64xNCHWxFP32x0x0x1x1x1x1x1x1;miopenConvolutionFwdAlgoDirect:ConvAsm1x1U,2.46784,0,miopenConvolutionFwdAlgoDirect,<unused>;miopenConvolutionFwdAlgoGEMM:gemm,2.45056,0,rocBlas,<unused>;miopenConvolutionFwdAlgoWinograd:ConvBinWinogradRxSf3x2,4.4192,0,miopenConvolutionFwdAlgoWinograd,384x28x28x1x1x512x28x28x64xNCHWxFP32x0x0x1x1x1x1x1x1
512-28-28-1x1-128-28-28-64-0x0-1x1-1x1-0-NCHW-FP32-F=miopenConvolutionFwdAlgoImplicitGEMM:ConvHipImplicitGemmV4_1x1,0.80384,0,miopenConvolutionFwdAlgoImplicitGEMM,512x28x28x1x1x128x28x28x64xNCHWxFP32x0x0x1x1x1x1x1x1;miopenConvolutionFwdAlgoDirect:ConvOclDirectFwd1x1,0.76784,0,miopenConvolutionFwdAlgoDirect,<unused>;miopenConvolutionFwdAlgoGEMM:gemm,0.73552,0,rocBlas,<unused>;miopenConvolutionFwdAlgoWinograd:ConvBinWinogradRxSf3x2,1.5672,0,miopenConvolutionFwdAlgoWinograd,512x28x28x1x1x128x28x28x64xNCHWxFP32x0x0x1x1x1x1x1x1
128-28-28-3x3-128-28-28-64-1x1-1x1-1x1-0-NCHW-FP32-F=miopenConvolutionFwdAlgoWinograd:ConvBinWinograd3x3U,0.7544,0,miopenConvolutionFwdAlgoWinograd,128x28x28x3x3x128x28x28x64xNCHWxFP32x1x1x1x1x1x1x1x1
128-28-28-1x1-512-28-28-64-0x0-1x1-1x1-0-NCHW-FP32-F=miopenConvolutionFwdAlgoImplicitGEMM:ConvHipImplicitGemmV4_1x1,1.0568,0,miopenConvolutionFwdAlgoImplicitGEMM,128x28x28x1x1x512x28x28x64xNCHWxFP32x0x0x1x1x1x1x1x1;miopenConvolutionFwdAlgoDirect:ConvOclDirectFwd1x1,0.969439,0,miopenConvolutionFwdAlgoDirect,<unused>;miopenConvolutionFwdAlgoGEMM:gemm,0.67616,0,rocBlas,<unused>;miopenConvolutionFwdAlgoWinograd:ConvBinWinogradRxSf3x2,1.69824,0,miopenConvolutionFwdAlgoWinograd,128x28x28x1x1x512x28x28x64xNCHWxFP32x0x0x1x1x1x1x1x1
512-28-28-1x1-256-28-28-64-0x0-1x1-1x1-0-NCHW-FP32-F=miopenConvolutionFwdAlgoImplicitGEMM:ConvHipImplicitGemmV4_1x1,1.50512,0,miopenConvolutionFwdAlgoImplicitGEMM,512x28x28x1x1x256x28x28x64xNCHWxFP32x0x0x1x1x1x1x1x1;miopenConvolutionFwdAlgoDirect:ConvOclDirectFwd1x1,1.64768,0,miopenConvolutionFwdAlgoDirect,<unused>;miopenConvolutionFwdAlgoGEMM:gemm,1.4056,0,rocBlas,<unused>;miopenConvolutionFwdAlgoWinograd:ConvBinWinogradRxSf3x2,3.00336,0,miopenConvolutionFwdAlgoWinograd,512x28x28x1x1x256x28x28x64xNCHWxFP32x0x0x1x1x1x1x1x1
256-28-28-3x3-256-14-14-64-1x1-2x2-1x1-0-NCHW-FP32-F=miopenConvolutionFwdAlgoImplicitGEMM:ConvHipImplicitGemmV4R1Fwd,1.79824,0,miopenConvolutionFwdAlgoImplicitGEMM,256x28x28x3x3x256x14x14x64xNCHWxFP32x1x1x2x2x1x1x1x1;miopenConvolutionFwdAlgoDirect:ConvOclDirectFwd,7.76751,0,miopenConvolutionFwdAlgoDirect,<unused>;miopenConvolutionFwdAlgoGEMM:gemm,6.84032,1806336,rocBlas,<unused>;miopenConvolutionFwdAlgoWinograd:ConvBinWinogradRxSf2x3,3.06528,0,miopenConvolutionFwdAlgoWinograd,256x28x28x3x3x256x14x14x64xNCHWxFP32x1x1x2x2x1x1x1x1
768-14-14-1x1-1024-14-14-64-0x0-1x1-1x1-0-NCHW-FP32-F=miopenConvolutionFwdAlgoImplicitGEMM:ConvHipImplicitGemmV4_1x1,2.41184,0,miopenConvolutionFwdAlgoImplicitGEMM,768x14x14x1x1x1024x14x14x64xNCHWxFP32x0x0x1x1x1x1x1x1;miopenConvolutionFwdAlgoDirect:ConvAsm1x1U,2.92576,0,miopenConvolutionFwdAlgoDirect,<unused>;miopenConvolutionFwdAlgoGEMM:gemm,2.92768,0,rocBlas,<unused>;miopenConvolutionFwdAlgoWinograd:ConvBinWinogradRxSf3x2,4.19279,0,miopenConvolutionFwdAlgoWinograd,768x14x14x1x1x1024x14x14x64xNCHWxFP32x0x0x1x1x1x1x1x1
1024-14-14-1x1-256-14-14-64-0x0-1x1-1x1-0-NCHW-FP32-F=miopenConvolutionFwdAlgoImplicitGEMM:ConvHipImplicitGemmV4_1x1,0.882879,0,miopenConvolutionFwdAlgoImplicitGEMM,1024x14x14x1x1x256x14x14x64xNCHWxFP32x0x0x1x1x1x1x1x1;miopenConvolutionFwdAlgoDirect:ConvOclDirectFwd1x1,0.891039,0,miopenConvolutionFwdAlgoDirect,<unused>;miopenConvolutionFwdAlgoGEMM:gemm,0.909279,0,rocBlas,<unused>;miopenConvolutionFwdAlgoWinograd:ConvBinWinogradRxSf3x2,1.54512,0,miopenConvolutionFwdAlgoWinograd,1024x14x14x1x1x256x14x14x64xNCHWxFP32x0x0x1x1x1x1x1x1
256-14-14-3x3-256-14-14-64-1x1-1x1-1x1-0-NCHW-FP32-F=miopenConvolutionFwdAlgoWinograd:ConvBinWinogradRxSf2x3,0.74928,0,miopenConvolutionFwdAlgoWinograd,256x14x14x3x3x256x14x14x64xNCHWxFP32x1x1x1x1x1x1x1x1
256-14-14-1x1-1024-14-14-64-0x0-1x1-1x1-0-NCHW-FP32-F=miopenConvolutionFwdAlgoImplicitGEMM:ConvHipImplicitGemmV4_1x1,0.878239,0,miopenConvolutionFwdAlgoImplicitGEMM,256x14x14x1x1x1024x14x14x64xNCHWxFP32x0x0x1x1x1x1x1x1;miopenConvolutionFwdAlgoDirect:ConvOclDirectFwd1x1,0.989599,0,miopenConvolutionFwdAlgoDirect,<unused>;miopenConvolutionFwdAlgoGEMM:gemm,0.911839,0,rocBlas,<unused>;miopenConvolutionFwdAlgoWinograd:ConvBinWinogradRxSf3x2,1.58208,0,miopenConvolutionFwdAlgoWinograd,256x14x14x1x1x1024x14x14x64xNCHWxFP32x0x0x1x1x1x1x1x1
1024-14-14-1x1-512-14-14-64-0x0-1x1-1x1-0-NCHW-FP32-F=miopenConvolutionFwdAlgoImplicitGEMM:ConvHipImplicitGemmV4_1x1,1.96688,0,miopenConvolutionFwdAlgoImplicitGEMM,1024x14x14x1x1x512x14x14x64xNCHWxFP32x0x0x1x1x1x1x1x1;miopenConvolutionFwdAlgoDirect:ConvOclDirectFwd1x1,2.22352,0,miopenConvolutionFwdAlgoDirect,<unused>;miopenConvolutionFwdAlgoGEMM:gemm,2.51536,0,rocBlas,<unused>;miopenConvolutionFwdAlgoWinograd:ConvBinWinogradRxSf3x2,3.05792,0,miopenConvolutionFwdAlgoWinograd,1024x14x14x1x1x512x14x14x64xNCHWxFP32x0x0x1x1x1x1x1x1
512-14-14-3x3-512-7-7-64-1x1-2x2-1x1-0-NCHW-FP32-F=miopenConvolutionFwdAlgoImplicitGEMM:ConvHipImplicitGemmV4R1Fwd,1.88544,0,miopenConvolutionFwdAlgoImplicitGEMM,512x14x14x3x3x512x7x7x64xNCHWxFP32x1x1x2x2x1x1x1x1;miopenConvolutionFwdAlgoDirect:ConvOclDirectFwd,9.60639,0,miopenConvolutionFwdAlgoDirect,<unused>;miopenConvolutionFwdAlgoGEMM:gemm,24.5965,903168,rocBlas,<unused>;miopenConvolutionFwdAlgoWinograd:ConvBinWinogradRxSf2x3,3.84367,0,miopenConvolutionFwdAlgoWinograd,512x14x14x3x3x512x7x7x64xNCHWxFP32x1x1x2x2x1x1x1x1
1536-7-7-1x1-2048-7-7-64-0x0-1x1-1x1-0-NCHW-FP32-F=miopenConvolutionFwdAlgoImplicitGEMM:ConvHipImplicitGemmV4_1x1,2.36784,0,miopenConvolutionFwdAlgoImplicitGEMM,1536x7x7x1x1x2048x7x7x64xNCHWxFP32x0x0x1x1x1x1x1x1;miopenConvolutionFwdAlgoDirect:ConvAsm1x1U,3.48512,0,miopenConvolutionFwdAlgoDirect,<unused>;miopenConvolutionFwdAlgoGEMM:gemm,4.11839,0,rocBlas,<unused>;miopenConvolutionFwdAlgoWinograd:ConvBinWinogradRxSf3x2,5.55519,0,miopenConvolutionFwdAlgoWinograd,1536x7x7x1x1x2048x7x7x64xNCHWxFP32x0x0x1x1x1x1x1x1
2048-7-7-1x1-512-7-7-64-0x0-1x1-1x1-0-NCHW-FP32-F=miopenConvolutionFwdAlgoImplicitGEMM:ConvHipImplicitGemmV4_1x1,1.09184,0,miopenConvolutionFwdAlgoImplicitGEMM,2048x7x7x1x1x512x7x7x64xNCHWxFP32x0x0x1x1x1x1x1x1;miopenConvolutionFwdAlgoDirect:ConvOclDirectFwd1x1,1.2904,0,miopenConvolutionFwdAlgoDirect,<unused>;miopenConvolutionFwdAlgoGEMM:gemm,2.2624,0,rocBlas,<unused>;miopenConvolutionFwdAlgoWinograd:ConvBinWinogradRxSf3x2,2.16448,0,miopenConvolutionFwdAlgoWinograd,2048x7x7x1x1x512x7x7x64xNCHWxFP32x0x0x1x1x1x1x1x1
512-7-7-3x3-512-7-7-64-1x1-1x1-1x1-0-NCHW-FP32-F=miopenConvolutionFwdAlgoWinograd:ConvBinWinogradRxSf2x3,0.946719,0,miopenConvolutionFwdAlgoWinograd,512x7x7x3x3x512x7x7x64xNCHWxFP32x1x1x1x1x1x1x1x1
512-7-7-1x1-2048-7-7-64-0x0-1x1-1x1-0-NCHW-FP32-F=miopenConvolutionFwdAlgoImplicitGEMM:ConvHipImplicitGemmV4_1x1,1.08448,0,miopenConvolutionFwdAlgoImplicitGEMM,512x7x7x1x1x2048x7x7x64xNCHWxFP32x0x0x1x1x1x1x1x1;miopenConvolutionFwdAlgoDirect:ConvAsm1x1U,1.17616,0,miopenConvolutionFwdAlgoDirect,<unused>;miopenConvolutionFwdAlgoGEMM:gemm,1.35824,0,rocBlas,<unused>;miopenConvolutionFwdAlgoWinograd:ConvBinWinogradRxSf3x2,2.23296,0,miopenConvolutionFwdAlgoWinograd,512x7x7x1x1x2048x7x7x64xNCHWxFP32x0x0x1x1x1x1x1x1
3-224-224-7x7-64-112-112-64-3x3-2x2-1x1-0-NCHW-FP16-F=miopenConvolutionFwdAlgoDirect:ConvOclDirectFwdGen,3.128,0,miopenConvolutionFwdAlgoDirect,<unused>;miopenConvolutionFwdAlgoGEMM:gemm,7.69024,3687936,rocBlas,<unused>
64-56-56-1x1-64-56-56-64-0x0-1x1-1x1-0-NCHW-FP16-F=miopenConvolutionFwdAlgoImplicitGEMM:ConvHipImplicitGemmV4Fwd,0.2632,0,miopenConvolutionFwdAlgoImplicitGEMM,64x56x56x1x1x64x56x56x64xNCHWxFP16x0x0x1x1x1x1x1x1;miopenConvolutionFwdAlgoDirect:ConvAsm1x1U,0.2168,0,miopenConvolutionFwdAlgoDirect,<unused>;miopenConvolutionFwdAlgoGEMM:gemm,0.12304,0,rocBlas,<unused>;miopenConvolutionFwdAlgoWinograd:ConvBinWinogradRxS,0.60192,0,miopenConvolutionFwdAlgoWinograd,64x56x56x1x1x64x56x56x64xNCHWxFP16x0x0x1x1x1x1x1x1
64-56-56-3x3-64-56-56-64-1x1-1x1-1x1-0-NCHW-FP16-F=miopenConvolutionFwdAlgoImplicitGEMM:ConvHipImplicitGemmV4R1Fwd,1.13744,0,miopenConvolutionFwdAlgoImplicitGEMM,64x56x56x3x3x64x56x56x64xNCHWxFP16x1x1x1x1x1x1x1x1;miopenConvolutionFwdAlgoDirect:ConvOclDirectFwd,2.98016,0,miopenConvolutionFwdAlgoDirect,<unused>;miopenConvolutionFwdAlgoGEMM:gemm,6.43072,3612672,rocBlas,<unused>;miopenConvolutionFwdAlgoWinograd:ConvBinWinogradRxS,0.51616,0,miopenConvolutionFwdAlgoWinograd,64x56x56x3x3x64x56x56x64xNCHWxFP16x1x1x1x1x1x1x1x1
128-56-56-1x1-256-56-56-64-0x0-1x1-1x1-0-NCHW-FP16-F=miopenConvolutionFwdAlgoImplicitGEMM:ConvHipImplicitGemmV4Fwd,1.152,0,miopenConvolutionFwdAlgoImplicitGEMM,128x56x56x1x1x256x56x56x64xNCHWxFP16x0x0x1x1x1x1x1x1;miopenConvolutionFwdAlgoDirect:ConvAsm1x1U,0.94464,0,miopenConvolutionFwdAlgoDirect,<unused>;miopenConvolutionFwdAlgoGEMM:gemm,0.7608,0,rocBlas,<unused>;miopenConvolutionFwdAlgoWinograd:ConvBinWinogradRxS,3.55488,0,miopenConvolutionFwdAlgoWinograd,128x56x56x1x1x256x56x56x64xNCHWxFP16x0x0x1x1x1x1x1x1
256-56-56-1x1-64-56-56-64-0x0-1x1-1x1-0-NCHW-FP16-F=miopenConvolutionFwdAlgoImplicitGEMM:ConvHipImplicitGemmV4Fwd,0.72656,0,miopenConvolutionFwdAlgoImplicitGEMM,256x56x56x1x1x64x56x56x64xNCHWxFP16x0x0x1x1x1x1x1x1;miopenConvolutionFwdAlgoDirect:ConvAsm1x1U,0.53216,0,miopenConvolutionFwdAlgoDirect,<unused>;miopenConvolutionFwdAlgoGEMM:gemm,0.36912,0,rocBlas,<unused>;miopenConvolutionFwdAlgoWinograd:ConvBinWinogradRxS,1.7416,0,miopenConvolutionFwdAlgoWinograd,256x56x56x1x1x64x56x56x64xNCHWxFP16x0x0x1x1x1x1x1x1
64-56-56-1x1-256-56-56-64-0x0-1x1-1x1-0-NCHW-FP16-F=miopenConvolutionFwdAlgoImplicitGEMM:ConvHipImplicitGemmV4Fwd,0.73696,0,miopenConvolutionFwdAlgoImplicitGEMM,64x56x56x1x1x256x56x56x64xNCHWxFP16x0x0x1x1x1x1x1x1;miopenConvolutionFwdAlgoDirect:ConvAsm1x1U,0.63664,0,miopenConvolutionFwdAlgoDirect,<unused>;miopenConvolutionFwdAlgoGEMM:gemm,0.42016,0,rocBlas,<unused>;miopenConvolutionFwdAlgoWinograd:ConvBinWinogradRxS,1.94192,0,miopenConvolutionFwdAlgoWinograd,64x56x56x1x1x256x56x56x64xNCHWxFP16x0x0x1x1x1x1x1x1
256-56-56-1x1-128-56-56-64-0x0-1x1-1x1-0-NCHW-FP16-F=miopenConvolutionFwdAlgoImplicitGEMM:ConvHipImplicitGemmV4Fwd,1.71232,0,miopenConvolutionFwdAlgoImplicitGEMM,256x56x56x1x1x128x56x56x64xNCHWxFP16x0x0x1x1x1x1x1x1;miopenConvolutionFwdAlgoDirect:ConvAsm1x1U,1.10048,0,miopenConvolutionFwdAlgoDirect,<unused>;miopenConvolutionFwdAlgoGEMM:gemm,0.70944,0,rocBlas,<unused>;miopenConvolutionFwdAlgoWinograd:ConvBinWinogradRxS,3.40368,0,miopenConvolutionFwdAlgoWinograd,256x56x56x1x1x128x56x56x64xNCHWxFP16x0x0x1x1x1x1x1x1
128-56-56-3x3-128-28-28-64-1x1-2x2-1x1-0-NCHW-FP16-F=miopenConvolutionFwdAlgoImplicitGEMM:ConvHipImplicitGemmV4R1Fwd,1.09216,0,miopenConvolutionFwdAlgoImplicitGEMM,128x56x56x3x3x128x28x28x64xNCHWxFP16x1x1x2x2x1x1x1x1;miopenConvolutionFwdAlgoDirect:ConvOclDirectFwdGen,5.62368,0,miopenConvolutionFwdAlgoDirect,<unused>;miopenConvolutionFwdAlgoGEMM:gemm,5.69344,1806336,rocBlas,<unused>;miopenConvolutionFwdAlgoWinograd:ConvBinWinogradRxS,2.24416,0,miopenConvolutionFwdAlgoWinograd,128x56x56x3x3x128x28x28x64xNCHWxFP16x1x1x2x2x1x1x1x1
384-28-28-1x1-512-28-28-64-0x0-1x1-1x1-0-NCHW-FP16-F=miopenConvolutionFwdAlgoImplicitGEMM:ConvHipImplicitGemmV4Fwd,1.36224,0,miopenConvolutionFwdAlgoImplicitGEMM,384x28x28x1x1x512x28x28x64xNCHWxFP16x0x0x1x1x1x1x1x1;miopenConvolutionFwdAlgoDirect:ConvAsm1x1U,1.65072,0,miopenConvolutionFwdAlgoDirect,<unused>;miopenConvolutionFwdAlgoGEMM:gemm,1.8816,0,rocBlas,<unused>;miopenConvolutionFwdAlgoWinograd:ConvBinWinogradRxS,5.1304,0,miopenConvolutionFwdAlgoWinograd,384x28x28x1x1x512x28x28x64xNCHWxFP16x0x0x1x1x1x1x1x1
512-28-28-1x1-128-28-28-64-0x0-1x1-1x1-0-NCHW-FP16-F=miopenConvolutionFwdAlgoImplicitGEMM:ConvHipImplicitGemmV4Fwd,0.8,0,miopenConvolutionFwdAlgoImplicitGEMM,512x28x28x1x1x128x28x28x64xNCHWxFP16x0x0x1x1x1x1x1x1;miopenConvolutionFwdAlgoDirect:ConvAsm1x1U,0.56272,0,miopenConvolutionFwdAlgoDirect,<unused>;miopenConvolutionFwdAlgoGEMM:gemm,0.46768,0,rocBlas,<unused>;miopenConvolutionFwdAlgoWinograd:ConvBinWinogradRxS,1.8544,0,miopenConvolutionFwdAlgoWinograd,512x28x28x1x1x128x28x28x64xNCHWxFP16x0x0x1x1x1x1x1x1
128-28-28-3x3-128-28-28-64-1x1-1x1-1x1-0-NCHW-FP16-F=miopenConvolutionFwdAlgoImplicitGEMM:ConvHipImplicitGemmV4R1Fwd,1.05648,0,miopenConvolutionFwdAlgoImplicitGEMM,128x28x28x3x3x128x28x28x64xNCHWxFP16x1x1x1x1x1x1x1x1;miopenConvolutionFwdAlgoDirect:ConvOclDirectFwd,2.67584,0,miopenConvolutionFwdAlgoDirect,<unused>;miopenConvolutionFwdAlgoGEMM:gemm,5.35552,1806336,rocBlas,<unused>;miopenConvolutionFwdAlgoWinograd:ConvBinWinogradRxS,0.4952,0,miopenConvolutionFwdAlgoWinograd,128x28x28x3x3x128x28x28x64xNCHWxFP16x1x1x1x1x1x1x1x1
128-28-28-1x1-512-28-28-64-0x0-1x1-1x1-0-NCHW-FP16-F=miopenConvolutionFwdAlgoImplicitGEMM:ConvHipImplicitGemmV4Fwd,0.88544,0,miopenConvolutionFwdAlgoImplicitGEMM,128x28x28x1x1x512x28x28x64xNCHWxFP16x0x0x1x1x1x1x1x1;miopenConvolutionFwdAlgoDirect:ConvAsm1x1U,0.5424,0,miopenConvolutionFwdAlgoDirect,<unused>;miopenConvolutionFwdAlgoGEMM:gemm,0.4016,0,rocBlas,<unused>;miopenConvolutionFwdAlgoWinograd:ConvBinWinogradRxS,1.8544,0,miopenConvolutionFwdAlgoWinograd,128x28x28x1x1x512x28x28x64xNCHWxFP16x0x0x1x1x1x1x1x1
512-28-28-1x1-256-28-28-64-0x0-1x1-1x1-0-NCHW-FP16-F=miopenConvolutionFwdAlgoImplicitGEMM:ConvHipImplicitGemmV4Fwd,1.48336,0,miopenConvolutionFwdAlgoImplicitGEMM,512x28x28x1x1x256x28x28x64xNCHWxFP16x0x0x1x1x1x1x1x1;miopenConvolutionFwdAlgoDirect:ConvAsm1x1U,1.1696,0,miopenConvolutionFwdAlgoDirect,<unused>;miopenConvolutionFwdAlgoGEMM:gemm,0.81632,0,rocBlas,<unused>;miopenConvolutionFwdAlgoWinograd:ConvBinWinogradRxS,3.5872,0,miopenConvolutionFwdAlgoWinograd,512x28x28x1x1x256x28x28x64xNCHWxFP16x0x0x1x1x1x1x1x1
256-28-28-3x3-256-14-14-64-1x1-2x2-1x1-0-NCHW-FP16-F=miopenConvolutionFwdAlgoImplicitGEMM:ConvHipImplicitGemmV4R1Fwd,1.26512,0,miopenConvolutionFwdAlgoImplicitGEMM,256x28x28x3x3x256x14x14x64xNCHWxFP16x1x1x2x2x1x1x1x1;miopenConvolutionFwdAlgoDirect:ConvOclDirectFwdGen,7.20703,0,miopenConvolutionFwdAlgoDirect,<unused>;miopenConvolutionFwdAlgoGEMM:gemm,9.27744,903168,rocBlas,<unused>;miopenConvolutionFwdAlgoWinograd:ConvBinWinogradRxS,2.36416,0,miopenConvolutionFwdAlgoWinograd,256x28x28x3x3x256x14x14x64xNCHWxFP16x1x1x2x2x1x1x1x1
768-14-14-1x1-1024-14-14-64-0x0-1x1-1x1-0-NCHW-FP16-F=miopenConvolutionFwdAlgoImplicitGEMM:ConvHipImplicitGemmV4Fwd,1.4864,0,miopenConvolutionFwdAlgoImplicitGEMM,768x14x14x1x1x1024x14x14x64xNCHWxFP16x0x0x1x1x1x1x1x1;miopenConvolutionFwdAlgoDirect:ConvAsm1x1U,1.83696,0,miopenConvolutionFwdAlgoDirect,<unused>;miopenConvolutionFwdAlgoGEMM:gemm,1.29152,0,rocBlas,<unused>;miopenConvolutionFwdAlgoWinograd:ConvBinWinogradRxS,6.07663,0,miopenConvolutionFwdAlgoWinograd,768x14x14x1x1x1024x14x14x64xNCHWxFP16x0x0x1x1x1x1x1x1
1024-14-14-1x1-256-14-14-64-0x0-1x1-1x1-0-NCHW-FP16-F=miopenConvolutionFwdAlgoImplicitGEMM:ConvHipImplicitGemmV4Fwd,0.74208,0,miopenConvolutionFwdAlgoImplicitGEMM,1024x14x14x1x1x256x14x14x64xNCHWxFP16x0x0x1x1x1x1x1x1;miopenConvolutionFwdAlgoDirect:ConvAsm1x1U,0.77664,0,miopenConvolutionFwdAlgoDirect,<unused>;miopenConvolutionFwdAlgoGEMM:gemm,0.60576,0,rocBlas,<unused>;miopenConvolutionFwdAlgoWinograd:ConvBinWinogradRxS,2.15648,0,miopenConvolutionFwdAlgoWinograd,1024x14x14x1x1x256x14x14x64xNCHWxFP16x0x0x1x1x1x1x1x1
256-14-14-3x3-256-14-14-64-1x1-1x1-1x1-0-NCHW-FP16-F=miopenConvolutionFwdAlgoImplicitGEMM:ConvHipImplicitGemmV4R1Fwd,1.21792,0,miopenConvolutionFwdAlgoImplicitGEMM,256x14x14x3x3x256x14x14x64xNCHWxFP16x1x1x1x1x1x1x1x1;miopenConvolutionFwdAlgoDirect:ConvOclDirectFwd,3.2304,0,miopenConvolutionFwdAlgoDirect,<unused>;miopenConvolutionFwdAlgoGEMM:gemm,10.2707,903168,rocBlas,<unused>;miopenConvolutionFwdAlgoWinograd:ConvBinWinogradRxS,0.54176,0,miopenConvolutionFwdAlgoWinograd,256x14x14x3x3x256x14x14x64xNCHWxFP16x1x1x1x1x1x1x1x1
256-14-14-1x1-1024-14-14-64-0x0-1x1-1x1-0-NCHW-FP16-F=miopenConvolutionFwdAlgoImplicitGEMM:ConvHipImplicitGemmV4Fwd,0.61152,0,miopenConvolutionFwdAlgoImplicitGEMM,256x14x14x1x1x1024x14x14x64xNCHWxFP16x0x0x1x1x1x1x1x1;miopenConvolutionFwdAlgoDirect:ConvAsm1x1U,0.6464,0,miopenConvolutionFwdAlgoDirect,<unused>;miopenConvolutionFwdAlgoGEMM:gemm,0.46016,0,rocBlas,<unused>;miopenConvolutionFwdAlgoWinograd:ConvBinWinogradRxS,2.07088,0,miopenConvolutionFwdAlgoWinograd,256x14x14x1x1x1024x14x14x64xNCHWxFP16x0x0x1x1x1x1x1x1
1024-14-14-1x1-512-14-14-64-0x0-1x1-1x1-0-NCHW-FP16-F=miopenConvolutionFwdAlgoImplicitGEMM:ConvHipImplicitGemmV4Fwd,2.15312,0,miopenConvolutionFwdAlgoImplicitGEMM,1024x14x14x1x1x512x14x14x64xNCHWxFP16x0x0x1x1x1x1x1x1;miopenConvolutionFwdAlgoDirect:ConvAsm1x1U,1.3544,0,miopenConvolutionFwdAlgoDirect,<unused>;miopenConvolutionFwdAlgoGEMM:gemm,1.088,0,rocBlas,<unused>;miopenConvolutionFwdAlgoWinograd:ConvBinWinogradRxS,4.1312,0,miopenConvolutionFwdAlgoWinograd,1024x14x14x1x1x512x14x14x64xNCHWxFP16x0x0x1x1x1x1x1x1
512-14-14-3x3-512-7-7-64-1x1-2x2-1x1-0-NCHW-FP16-F=miopenConvolutionFwdAlgoImplicitGEMM:ConvHipImplicitGemmV4R1Fwd,1.37984,0,miopenConvolutionFwdAlgoImplicitGEMM,512x14x14x3x3x512x7x7x64xNCHWxFP16x1x1x2x2x1x1x1x1;miopenConvolutionFwdAlgoDirect:ConvOclDirectFwdGen,12.9387,0,miopenConvolutionFwdAlgoDirect,<unused>;miopenConvolutionFwdAlgoGEMM:gemm,51.0771,451584,rocBlas,<unused>;miopenConvolutionFwdAlgoWinograd:ConvBinWinogradRxS,3.54144,0,miopenConvolutionFwdAlgoWinograd,512x14x14x3x3x512x7x7x64xNCHWxFP16x1x1x2x2x1x1x1x1
1536-7-7-1x1-2048-7-7-64-0x0-1x1-1x1-0-NCHW-FP16-F=miopenConvolutionFwdAlgoImplicitGEMM:ConvHipImplicitGemmV4Fwd,2.21072,0,miopenConvolutionFwdAlgoImplicitGEMM,1536x7x7x1x1x2048x7x7x64xNCHWxFP16x0x0x1x1x1x1x1x1;miopenConvolutionFwdAlgoDirect:ConvAsm1x1U,2.3872,0,miopenConvolutionFwdAlgoDirect,<unused>;miopenConvolutionFwdAlgoGEMM:gemm,5.35007,0,rocBlas,<unused>;miopenConvolutionFwdAlgoWinograd:ConvBinWinogradRxS,7.93663,0,miopenConvolutionFwdAlgoWinograd,1536x7x7x1x1x2048x7x7x64xNCHWxFP16x0x0x1x1x1x1x1x1
2048-7-7-1x1-512-7-7-64-0x0-1x1-1x1-0-NCHW-FP16-F=miopenConvolutionFwdAlgoImplicitGEMM:ConvHipImplicitGemmV4Fwd,0.941439,0,miopenConvolutionFwdAlgoImplicitGEMM,2048x7x7x1x1x512x7x7x64xNCHWxFP16x0x0x1x1x1x1x1x1;miopenConvolutionFwdAlgoDirect:ConvAsm1x1U,0.974559,0,miopenConvolutionFwdAlgoDirect,<unused>;miopenConvolutionFwdAlgoGEMM:gemm,2.11856,0,rocBlas,<unused>;miopenConvolutionFwdAlgoWinograd:ConvBinWinogradRxS,3.27056,0,miopenConvolutionFwdAlgoWinograd,2048x7x7x1x1x512x7x7x64xNCHWxFP16x0x0x1x1x1x1x1x1
512-7-7-3x3-512-7-7-64-1x1-1x1-1x1-0-NCHW-FP16-F=miopenConvolutionFwdAlgoImplicitGEMM:ConvHipImplicitGemmV4R1Fwd,1.29968,0,miopenConvolutionFwdAlgoImplicitGEMM,512x7x7x3x3x512x7x7x64xNCHWxFP16x1x1x1x1x1x1x1x1;miopenConvolutionFwdAlgoDirect:ConvOclDirectFwd,5.19407,0,miopenConvolutionFwdAlgoDirect,<unused>;miopenConvolutionFwdAlgoGEMM:gemm,50.4831,451584,rocBlas,<unused>;miopenConvolutionFwdAlgoWinograd:ConvBinWinogradRxS,0.61184,0,miopenConvolutionFwdAlgoWinograd,512x7x7x3x3x512x7x7x64xNCHWxFP16x1x1x1x1x1x1x1x1
512-7-7-1x1-2048-7-7-64-0x0-1x1-1x1-0-NCHW-FP16-F=miopenConvolutionFwdAlgoImplicitGEMM:ConvHipImplicitGemmV4Fwd,0.56912,0,miopenConvolutionFwdAlgoImplicitGEMM,512x7x7x1x1x2048x7x7x64xNCHWxFP16x0x0x1x1x1x1x1x1;miopenConvolutionFwdAlgoDirect:ConvAsm1x1U,0.861279,0,miopenConvolutionFwdAlgoDirect,<unused>;miopenConvolutionFwdAlgoGEMM:gemm,1.64496,0,rocBlas,<unused>;miopenConvolutionFwdAlgoWinograd:ConvBinWinogradRxS,2.9216,0,miopenConvolutionFwdAlgoWinograd,512x7x7x1x1x2048x7x7x64xNCHWxFP16x0x0x1x1x1x1x1x1
3-224-224-11x11-64-55-55-64-2x2-4x4-1x1-0-NCHW-FP32-F=miopenConvolutionFwdAlgoDirect:ConvOclDirectFwd11x11,2.99904,0,miopenConvolutionFwdAlgoDirect,<unused>;miopenConvolutionFwdAlgoGEMM:gemm,5.3248,4392300,rocBlas,<unused>
64-27-27-5x5-192-27-27-64-2x2-1x1-1x1-0-NCHW-FP32-F=miopenConvolutionFwdAlgoFFT:fft,1.57888,143720448,miopenConvolutionFwdAlgoFFT,FFT_x_in_h_27_in_w_27_in_n_64_in_c_64_out_c_192_kernel_;miopenConvolutionFwdAlgoImplicitGEMM:ConvHipImplicitGemmV4R1Fwd,3.17952,0,miopenConvolutionFwdAlgoImplicitGEMM,64x27x27x5x5x192x27x27x64xNCHWxFP32x2x2x1x1x1x1x1x1;miopenConvolutionFwdAlgoDirect:ConvOclDirectFwd,5.66367,0,miopenConvolutionFwdAlgoDirect,<unused>;miopenConvolutionFwdAlgoGEMM:gemm,9.04192,4665600,rocBlas,<unused>;miopenConvolutionFwdAlgoWinograd:ConvBinWinogradRxSf2x3,2.12224,0,miopenConvolutionFwdAlgoWinograd,64x27x27x5x5x192x27x27x64xNCHWxFP32x2x2x1x1x1x1x1x1
192-13-13-3x3-384-13-13-64-1x1-1x1-1x1-0-NCHW-FP32-F=miopenConvolutionFwdAlgoWinograd:ConvBinWinogradRxSf2x3,0.815519,0,miopenConvolutionFwdAlgoWinograd,192x13x13x3x3x384x13x13x64xNCHWxFP32x1x1x1x1x1x1x1x1
384-13-13-3x3-256-13-13-64-1x1-1x1-1x1-0-NCHW-FP32-F=miopenConvolutionFwdAlgoWinograd:ConvBinWinogradRxSf2x3,1.09984,0,miopenConvolutionFwdAlgoWinograd,384x13x13x3x3x256x13x13x64xNCHWxFP32x1x1x1x1x1x1x1x1
256-13-13-3x3-256-13-13-64-1x1-1x1-1x1-0-NCHW-FP32-F=miopenConvolutionFwdAlgoWinograd:ConvBinWinogradRxS,0.75648,0,miopenConvolutionFwdAlgoWinograd,256x13x13x3x3x256x13x13x64xNCHWxFP32x1x1x1x1x1x1x1x1
3-224-224-11x11-64-55-55-64-2x2-4x4-1x1-0-NCHW-FP16-F=miopenConvolutionFwdAlgoDirect:ConvOclDirectFwd11x11,1.3688,0,miopenConvolutionFwdAlgoDirect,<unused>;miopenConvolutionFwdAlgoGEMM:gemm,8.48896,2196150,rocBlas,<unused>
64-27-27-5x5-192-27-27-64-2x2-1x1-1x1-0-NCHW-FP16-F=miopenConvolutionFwdAlgoImplicitGEMM:ConvHipImplicitGemmV4R1Fwd,2.14944,0,miopenConvolutionFwdAlgoImplicitGEMM,64x27x27x5x5x192x27x27x64xNCHWxFP16x2x2x1x1x1x1x1x1;miopenConvolutionFwdAlgoDirect:ConvOclDirectFwd,3.44992,0,miopenConvolutionFwdAlgoDirect,<unused>;miopenConvolutionFwdAlgoGEMM:gemm,20.3571,2332800,rocBlas,<unused>;miopenConvolutionFwdAlgoWinograd:ConvBinWinogradRxS,1.75584,0,miopenConvolutionFwdAlgoWinograd,64x27x27x5x5x192x27x27x64xNCHWxFP16x2x2x1x1x1x1x1x1
192-13-13-3x3-384-13-13-64-1x1-1x1-1x1-0-NCHW-FP16-F=miopenConvolutionFwdAlgoImplicitGEMM:ConvHipImplicitGemmV4R1Fwd,1.1184,0,miopenConvolutionFwdAlgoImplicitGEMM,192x13x13x3x3x384x13x13x64xNCHWxFP16x1x1x1x1x1x1x1x1;miopenConvolutionFwdAlgoDirect:ConvOclDirectFwd,2.9568,0,miopenConvolutionFwdAlgoDirect,<unused>;miopenConvolutionFwdAlgoGEMM:gemm,20.5107,584064,rocBlas,<unused>;miopenConvolutionFwdAlgoWinograd:ConvBinWinogradRxS,0.51696,0,miopenConvolutionFwdAlgoWinograd,192x13x13x3x3x384x13x13x64xNCHWxFP16x1x1x1x1x1x1x1x1
384-13-13-3x3-256-13-13-64-1x1-1x1-1x1-0-NCHW-FP16-F=miopenConvolutionFwdAlgoImplicitGEMM:ConvHipImplicitGemmV4R1Fwd,1.59392,0,miopenConvolutionFwdAlgoImplicitGEMM,384x13x13x3x3x256x13x13x64xNCHWxFP16x1x1x1x1x1x1x1x1;miopenConvolutionFwdAlgoDirect:ConvOclDirectFwd,4.42512,0,miopenConvolutionFwdAlgoDirect,<unused>;miopenConvolutionFwdAlgoGEMM:gemm,38.7994,1168128,rocBlas,<unused>;miopenConvolutionFwdAlgoWinograd:ConvBinWinogradRxS,0.68944,0,miopenConvolutionFwdAlgoWinograd,384x13x13x3x3x256x13x13x64xNCHWxFP16x1x1x1x1x1x1x1x1
256-13-13-3x3-256-13-13-64-1x1-1x1-1x1-0-NCHW-FP16-F=miopenConvolutionFwdAlgoImplicitGEMM:ConvHipImplicitGemmV4R1Fwd,1.07168,0,miopenConvolutionFwdAlgoImplicitGEMM,256x13x13x3x3x256x13x13x64xNCHWxFP16x1x1x1x1x1x1x1x1;miopenConvolutionFwdAlgoDirect:ConvOclDirectFwd,2.93104,0,miopenConvolutionFwdAlgoDirect,<unused>;miopenConvolutionFwdAlgoGEMM:gemm,26.7776,778752,rocBlas,<unused>;miopenConvolutionFwdAlgoWinograd:ConvBinWinogradRxS,0.47632,0,miopenConvolutionFwdAlgoWinograd,256x13x13x3x3x256x13x13x64xNCHWxFP16x1x1x1x1x1x1x1x1
3-224-224-7x7-64-112-112-32-3x3-2x2-1x1-0-NCHW-FP32-F=miopenConvolutionFwdAlgoDirect:ConvAsm7x7c3h224w224k64u2v2p3q3f1,0.920479,0,miopenConvolutionFwdAlgoDirect,<unused>;miopenConvolutionFwdAlgoGEMM:gemm,3.13856,7375872,rocBlas,<unused>;miopenConvolutionFwdAlgoWinograd:ConvBinWinogradRxS,1.24704,0,miopenConvolutionFwdAlgoWinograd,3x224x224x7x7x64x112x112x32xNCHWxFP32x3x3x2x2x1x1x1x1
64-56-56-1x1-128-56-56-32-0x0-1x1-1x1-0-NCHW-FP32-F=miopenConvolutionFwdAlgoImplicitGEMM:ConvHipImplicitGemmV4_1x1,0.44992,0,miopenConvolutionFwdAlgoImplicitGEMM,64x56x56x1x1x128x56x56x32xNCHWxFP32x0x0x1x1x1x1x1x1;miopenConvolutionFwdAlgoDirect:ConvOclDirectFwd1x1,0.30944,0,miopenConvolutionFwdAlgoDirect,<unused>;miopenConvolutionFwdAlgoGEMM:gemm,0.18928,0,rocBlas,<unused>;miopenConvolutionFwdAlgoWinograd:ConvBinWinogradRxSf3x2,0.46192,0,miopenConvolutionFwdAlgoWinograd,64x56x56x1x1x128x56x56x32xNCHWxFP32x0x0x1x1x1x1x1x1
128-56-56-3x3-32-56-56-32-1x1-1x1-1x1-0-NCHW-FP32-F=miopenConvolutionFwdAlgoWinograd:ConvBinWinogradRxSf2x3,0.40544,0,miopenConvolutionFwdAlgoWinograd,128x56x56x3x3x32x56x56x32xNCHWxFP32x1x1x1x1x1x1x1x1
96-56-56-1x1-128-56-56-32-0x0-1x1-1x1-0-NCHW-FP32-F=miopenConvolutionFwdAlgoImplicitGEMM:ConvHipImplicitGemmV4_1x1,0.64032,0,miopenConvolutionFwdAlgoImplicitGEMM,96x56x56x1x1x128x56x56x32xNCHWxFP32x0x0x1x1x1x1x1x1;miopenConvolutionFwdAlgoDirect:ConvOclDirectFwd1x1,0.3864,0,miopenConvolutionFwdAlgoDirect,<unused>;miopenConvolutionFwdAlgoGEMM:gemm,0.26688,0,rocBlas,<unused>;miopenConvolutionFwdAlgoWinograd:ConvBinWinogradRxSf3x2,0.62528,0,miopenConvolutionFwdAlgoWinograd,96x56x56x1x1x128x56x56x32xNCHWxFP32x0x0x1x1x1x1x1x1
128-56-56-1x1-128-56-56-32-0x0-1x1-1x1-0-NCHW-FP32-F=miopenConvolutionFwdAlgoImplicitGEMM:ConvHipImplicitGemmV4_1x1,0.73152,0,miopenConvolutionFwdAlgoImplicitGEMM,128x56x56x1x1x128x56x56x32xNCHWxFP32x0x0x1x1x1x1x1x1;miopenConvolutionFwdAlgoDirect:ConvOclDirectFwd1x1,0.45664,0,miopenConvolutionFwdAlgoDirect,<unused>;miopenConvolutionFwdAlgoGEMM:gemm,0.46064,0,rocBlas,<unused>;miopenConvolutionFwdAlgoWinograd:ConvBinWinogradRxSf3x2,0.790719,0,miopenConvolutionFwdAlgoWinograd,128x56x56x1x1x128x56x56x32xNCHWxFP32x0x0x1x1x1x1x1x1
160-56-56-1x1-128-56-56-32-0x0-1x1-1x1-0-NCHW-FP32-F=miopenConvolutionFwdAlgoImplicitGEMM:ConvHipImplicitGemmV4_1x1,0.834559,0,miopenConvolutionFwdAlgoImplicitGEMM,160x56x56x1x1x128x56x56x32xNCHWxFP32x0x0x1x1x1x1x1x1;miopenConvolutionFwdAlgoDirect:ConvOclDirectFwd1x1,0.47952,0,miopenConvolutionFwdAlgoDirect,<unused>;miopenConvolutionFwdAlgoGEMM:gemm,0.42784,0,rocBlas,<unused>;miopenConvolutionFwdAlgoWinograd:ConvBinWinogradRxSf3x2,0.957279,0,miopenConvolutionFwdAlgoWinograd,160x56x56x1x1x128x56x56x32xNCHWxFP32x0x0x1x1x1x1x1x1
192-56-56-1x1-128-56-56-32-0x0-1x1-1x1-0-NCHW-FP32-F=miopenConvolutionFwdAlgoImplicitGEMM:ConvHipImplicitGemmV4_1x1,0.959199,0,miopenConvolutionFwdAlgoImplicitGEMM,192x56x56x1x1x128x56x56x32xNCHWxFP32x0x0x1x1x1x1x1x1;miopenConvolutionFwdAlgoDirect:ConvOclDirectFwd1x1,0.60992,0,miopenConvolutionFwdAlgoDirect,<unused>;miopenConvolutionFwdAlgoGEMM:gemm,0.5336,0,rocBlas,<unused>;miopenConvolutionFwdAlgoWinograd:ConvBinWinogradRxSf3x2,1.12064,0,miopenConvolutionFwdAlgoWinograd,192x56x56x1x1x128x56x56x32xNCHWxFP32x0x0x1x1x1x1x1x1
224-56-56-1x1-128-56-56-32-0x0-1x1-1x1-0-NCHW-FP32-F=miopenConvolutionFwdAlgoImplicitGEMM:ConvHipImplicitGemmV4_1x1,0.74784,0,miopenConvolutionFwdAlgoImplicitGEMM,224x56x56x1x1x128x56x56x32xNCHWxFP32x0x0x1x1x1x1x1x1;miopenConvolutionFwdAlgoDirect:ConvOclDirectFwd1x1,0.67216,0,miopenConvolutionFwdAlgoDirect,<unused>;miopenConvolutionFwdAlgoGEMM:gemm,0.632,0,rocBlas,<unused>;miopenConvolutionFwdAlgoWinograd:ConvBinWinogradRxSf3x2,1.30128,0,miopenConvolutionFwdAlgoWinograd,224x56x56x1x1x128x56x56x32xNCHWxFP32x0x0x1x1x1x1x1x1
256-56-56-1x1-128-56-56-32-0x0-1x1-1x1-0-NCHW-FP32-F=miopenConvolutionFwdAlgoImplicitGEMM:ConvHipImplicitGemmV4_1x1,1.01712,0,miopenConvolutionFwdAlgoImplicitGEMM,256x56x56x1x1x128x56x56x32xNCHWxFP32x0x0x1x1x1x1x1x1;miopenConvolutionFwdAlgoDirect:ConvOclDirectFwd1x1,0.73552,0,miopenConvolutionFwdAlgoDirect,<unused>;miopenConvolutionFwdAlgoGEMM:gemm,0.66096,0,rocBlas,<unused>;miopenConvolutionFwdAlgoWinograd:ConvBinWinogradRxSf3x2,1.44912,0,miopenConvolutionFwdAlgoWinograd,256x56x56x1x1x128x56x56x32xNCHWxFP32x0x0x1x1x1x1x1x1
128-28-28-1x1-128-28-28-32-0x0-1x1-1x1-0-NCHW-FP32-F=miopenConvolutionFwdAlgoImplicitGEMM:ConvHipImplicitGemmV4_1x1,0.14384,0,miopenConvolutionFwdAlgoImplicitGEMM,128x28x28x1x1x128x28x28x32xNCHWxFP32x0x0x1x1x1x1x1x1;miopenConvolutionFwdAlgoDirect:ConvOclDirectFwd1x1,0.12656,0,miopenConvolutionFwdAlgoDirect,<unused>;miopenConvolutionFwdAlgoGEMM:gemm,0.14768,0,rocBlas,<unused>;miopenConvolutionFwdAlgoWinograd:ConvBinWinogradRxSf3x2,0.29248,0,miopenConvolutionFwdAlgoWinograd,128x28x28x1x1x128x28x28x32xNCHWxFP32x0x0x1x1x1x1x1x1
128-28-28-3x3-32-28-28-32-1x1-1x1-1x1-0-NCHW-FP32-F=miopenConvolutionFwdAlgoWinograd:ConvBinWinogradRxSf2x3,0.13104,0,miopenConvolutionFwdAlgoWinograd,128x28x28x3x3x32x28x28x32xNCHWxFP32x1x1x1x1x1x1x1x1
160-28-28-1x1-128-28-28-32-0x0-1x1-1x1-0-NCHW-FP32-F=miopenConvolutionFwdAlgoImplicitGEMM:ConvHipImplicitGemmV4_1x1,0.1496,0,miopenConvolutionFwdAlgoImplicitGEMM,160x28x28x1x1x128x28x28x32xNCHWxFP32x0x0x1x1x1x1x1x1;miopenConvolutionFwdAlgoDirect:ConvOclDirectFwd1x1,0.14864,0,miopenConvolutionFwdAlgoDirect,<unused>;miopenConvolutionFwdAlgoGEMM:gemm,0.13888,0,rocBlas,<unused>;miopenConvolutionFwdAlgoWinograd:ConvBinWinogradRxSf3x2,0.28704,0,miopenConvolutionFwdAlgoWinograd,160x28x28x1x1x128x28x28x32xNCHWxFP32x0x0x1x1x1x1x1x1
192-28-28-1x1-128-28-28-32-0x0-1x1-1x1-0-NCHW-FP32-F=miopenConvolutionFwdAlgoImplicitGEMM:ConvHipImplicitGemmV4_1x1,0.1856,0,miopenConvolutionFwdAlgoImplicitGEMM,192x28x28x1x1x128x28x28x32xNCHWxFP32x0x0x1x1x1x1x1x1;miopenConvolutionFwdAlgoDirect:ConvOclDirectFwd1x1,0.1792,0,miopenConvolutionFwdAlgoDirect,<unused>;miopenConvolutionFwdAlgoGEMM:gemm,0.16144,0,rocBlas,<unused>;miopenConvolutionFwdAlgoWinograd:ConvBinWinogradRxSf3x2,0.33824,0,miopenConvolutionFwdAlgoWinograd,192x28x28x1x1x128x28x28x32xNCHWxFP32x0x0x1x1x1x1x1x1
224-28-28-1x1-128-28-28-32-0x0-1x1-1x1-0-NCHW-FP32-F=miopenConvolutionFwdAlgoImplicitGEMM:ConvHipImplicitGemmV4_1x1,0.19392,0,miopenConvolutionFwdAlgoImplicitGEMM,224x28x28x1x1x128x28x28x32xNCHWxFP32x0x0x1x1x1x1x1x1;miopenConvolutionFwdAlgoDirect:ConvOclDirectFwd1x1,0.19824,0,miopenConvolutionFwdAlgoDirect,<unused>;miopenConvolutionFwdAlgoGEMM:gemm,0.19328,0,rocBlas,<unused>;miopenConvolutionFwdAlgoWinograd:ConvBinWinogradRxSf3x2,0.408,0,miopenConvolutionFwdAlgoWinograd,224x28x28x1x1x128x28x28x32xNCHWxFP32x0x0x1x1x1x1x1x1
256-28-28-1x1-128-28-28-32-0x0-1x1-1x1-0-NCHW-FP32-F=miopenConvolutionFwdAlgoImplicitGEMM:ConvHipImplicitGemmV4_1x1,0.23616,0,miopenConvolutionFwdAlgoImplicitGEMM,256x28x28x1x1x128x28x28x32xNCHWxFP32x0x0x1x1x1x1x1x1;miopenConvolutionFwdAlgoDirect:ConvOclDirectFwd1x1,0.22992,0,miopenConvolutionFwdAlgoDirect,<unused>;miopenConvolutionFwdAlgoGEMM:gemm,0.20496,0,rocBlas,<unused>;miopenConvolutionFwdAlgoWinograd:ConvBinWinogradRxSf3x2,0.42976,0,miopenConvolutionFwdAlgoWinograd,256x28x28x1x1x128x28x28x32xNCHWxFP32x0x0x1x1x1x1x1x1
288-28-28-1x1-128-28-28-32-0x0-1x1-1x1-0-NCHW-FP32-F=miopenConvolutionFwdAlgoImplicitGEMM:ConvHipImplicitGemmV4_1x1,0.23184,0,miopenConvolutionFwdAlgoImplicitGEMM,288x28x28x1x1x128x28x28x32xNCHWxFP32x0x0x1x1x1x1x1x1;miopenConvolutionFwdAlgoDirect:ConvOclDirectFwd1x1,0.25072,0,miopenConvolutionFwdAlgoDirect,<unused>;miopenConvolutionFwdAlgoGEMM:gemm,0.22672,0,rocBlas,<unused>;miopenConvolutionFwdAlgoWinograd:ConvBinWinogradRxSf3x2,0.47456,0,miopenConvolutionFwdAlgoWinograd,288x28x28x1x1x128x28x28x32xNCHWxFP32x0x0x1x1x1x1x1x1
320-28-28-1x1-128-28-28-32-0x0-1x1-1x1-0-NCHW-FP32-F=miopenConvolutionFwdAlgoImplicitGEMM:ConvHipImplicitGemmV4_1x1,0.28608,0,miopenConvolutionFwdAlgoImplicitGEMM,320x28x28x1x1x128x28x28x32xNCHWxFP32x0x0x1x1x1x1x1x1;miopenConvolutionFwdAlgoDirect:ConvOclDirectFwd1x1,0.27728,0,miopenConvolutionFwdAlgoDirect,<unused>;miopenConvolutionFwdAlgoGEMM:gemm,0.2504,0,rocBlas,<unused>;miopenConvolutionFwdAlgoWinograd:ConvBinWinogradRxSf3x2,0.52224,0,miopenConvolutionFwdAlgoWinograd,320x28x28x1x1x128x28x28x32xNCHWxFP32x0x0x1x1x1x1x1x1
352-28-28-1x1-128-28-28-32-0x0-1x1-1x1-0-NCHW-FP32-F=miopenConvolutionFwdAlgoImplicitGEMM:ConvHipImplicitGemmV4_1x1,0.27264,0,miopenConvolutionFwdAlgoImplicitGEMM,352x28x28x1x1x128x28x28x32xNCHWxFP32x0x0x1x1x1x1x1x1;miopenConvolutionFwdAlgoDirect:ConvOclDirectFwd1x1,0.31088,0,miopenConvolutionFwdAlgoDirect,<unused>;miopenConvolutionFwdAlgoGEMM:gemm,0.2728,0,rocBlas,<unused>;miopenConvolutionFwdAlgoWinograd:ConvBinWinogradRxSf3x2,0.56784,0,miopenConvolutionFwdAlgoWinograd,352x28x28x1x1x128x28x28x32xNCHWxFP32x0x0x1x1x1x1x1x1
384-28-28-1x1-128-28-28-32-0x0-1x1-1x1-0-NCHW-FP32-F=miopenConvolutionFwdAlgoImplicitGEMM:ConvHipImplicitGemmV4_1x1,0.3352,0,miopenConvolutionFwdAlgoImplicitGEMM,384x28x28x1x1x128x28x28x32xNCHWxFP32x0x0x1x1x1x1x1x1;miopenConvolutionFwdAlgoDirect:ConvOclDirectFwd1x1,0.332,0,miopenConvolutionFwdAlgoDirect,<unused>;miopenConvolutionFwdAlgoGEMM:gemm,0.66768,0,rocBlas,<unused>;miopenConvolutionFwdAlgoWinograd:ConvBinWinogradRxSf3x2,0.61424,0,miopenConvolutionFwdAlgoWinograd,384x28x28x1x1x128x28x28x32xNCHWxFP32x0x0x1x1x1x1x1x1
416-28-28-1x1-128-28-28-32-0x0-1x1-1x1-0-NCHW-FP32-F=miopenConvolutionFwdAlgoImplicitGEMM:ConvHipImplicitGemmV4_1x1,0.31936,0,miopenConvolutionFwdAlgoImplicitGEMM,416x28x28x1x1x128x28x28x32xNCHWxFP32x0x0x1x1x1x1x1x1;miopenConvolutionFwdAlgoDirect:ConvOclDirectFwd1x1,0.36192,0,miopenConvolutionFwdAlgoDirect,<unused>;miopenConvolutionFwdAlgoGEMM:gemm,0.74336,0,rocBlas,<unused>;miopenConvolutionFwdAlgoWinograd:ConvBinWinogradRxSf3x2,0.66112,0,miopenConvolutionFwdAlgoWinograd,416x28x28x1x1x128x28x28x32xNCHWxFP32x0x0x1x1x1x1x1x1
448-28-28-1x1-128-28-28-32-0x0-1x1-1x1-0-NCHW-FP32-F=miopenConvolutionFwdAlgoImplicitGEMM:ConvHipImplicitGemmV4_1x1,0.38176,0,miopenConvolutionFwdAlgoImplicitGEMM,448x28x28x1x1x128x28x28x32xNCHWxFP32x0x0x1x1x1x1x1x1;miopenConvolutionFwdAlgoDirect:ConvOclDirectFwd1x1,0.388,0,miopenConvolutionFwdAlgoDirect,<unused>;miopenConvolutionFwdAlgoGEMM:gemm,0.81408,0,rocBlas,<unused>;miopenConvolutionFwdAlgoWinograd:ConvBinWinogradRxSf3x2,0.7336,0,miopenConvolutionFwdAlgoWinograd,448x28x28x1x1x128x28x28x32xNCHWxFP32x0x0x1x1x1x1x1x1
480-28-28-1x1-128-28-28-32-0x0-1x1-1x1-0-NCHW-FP32-F=miopenConvolutionFwdAlgoImplicitGEMM:ConvHipImplicitGemmV4_1x1,0.35776,0,miopenConvolutionFwdAlgoImplicitGEMM,480x28x28x1x1x128x28x28x32xNCHWxFP32x0x0x1x1x1x1x1x1;miopenConvolutionFwdAlgoDirect:ConvOclDirectFwd1x1,0.41472,0,miopenConvolutionFwdAlgoDirect,<unused>;miopenConvolutionFwdAlgoGEMM:gemm,0.36112,0,rocBlas,<unused>;miopenConvolutionFwdAlgoWinograd:ConvBinWinogradRxSf3x2,0.75136,0,miopenConvolutionFwdAlgoWinograd,480x28x28x1x1x128x28x28x32xNCHWxFP32x0x0x1x1x1x1x1x1
512-28-28-1x1-256-28-28-32-0x0-1x1-1x1-0-NCHW-FP32-F=miopenConvolutionFwdAlgoImplicitGEMM:ConvHipImplicitGemmV4_1x1,0.781919,0,miopenConvolutionFwdAlgoImplicitGEMM,512x28x28x1x1x256x28x28x32xNCHWxFP32x0x0x1x1x1x1x1x1;miopenConvolutionFwdAlgoDirect:ConvOclDirectFwd1x1,0.949919,0,miopenConvolutionFwdAlgoDirect,<unused>;miopenConvolutionFwdAlgoGEMM:gemm,0.74624,0,rocBlas,<unused>;miopenConvolutionFwdAlgoWinograd:ConvBinWinogradRxSf3x2,1.56816,0,miopenConvolutionFwdAlgoWinograd,512x28x28x1x1x256x28x28x32xNCHWxFP32x0x0x1x1x1x1x1x1
256-14-14-1x1-128-14-14-32-0x0-1x1-1x1-0-NCHW-FP32-F=miopenConvolutionFwdAlgoImplicitGEMM:ConvHipImplicitGemmV4_1x1,0.07744,0,miopenConvolutionFwdAlgoImplicitGEMM,256x14x14x1x1x128x14x14x32xNCHWxFP32x0x0x1x1x1x1x1x1;miopenConvolutionFwdAlgoDirect:ConvOclDirectFwd1x1,0.0848,0,miopenConvolutionFwdAlgoDirect,<unused>;miopenConvolutionFwdAlgoGEMM:gemm,0.24304,0,rocBlas,<unused>;miopenConvolutionFwdAlgoWinograd:ConvBinWinogradRxSf3x2,0.15824,0,miopenConvolutionFwdAlgoWinograd,256x14x14x1x1x128x14x14x32xNCHWxFP32x0x0x1x1x1x1x1x1
128-14-14-3x3-32-14-14-32-1x1-1x1-1x1-0-NCHW-FP32-F=miopenConvolutionFwdAlgoWinograd:ConvBinWinograd3x3U,0.05536,0,miopenConvolutionFwdAlgoWinograd,128x14x14x3x3x32x14x14x32xNCHWxFP32x1x1x1x1x1x1x1x1
288-14-14-1x1-128-14-14-32-0x0-1x1-1x1-0-NCHW-FP32-F=miopenConvolutionFwdAlgoImplicitGEMM:ConvHipImplicitGemmV4_1x1,0.10192,0,miopenConvolutionFwdAlgoImplicitGEMM,288x14x14x1x1x128x14x14x32xNCHWxFP32x0x0x1x1x1x1x1x1;miopenConvolutionFwdAlgoDirect:ConvAsm1x1U,0.1008,0,miopenConvolutionFwdAlgoDirect,<unused>;miopenConvolutionFwdAlgoGEMM:gemm,0.23568,0,rocBlas,<unused>;miopenConvolutionFwdAlgoWinograd:ConvBinWinogradRxSf3x2,0.1512,0,miopenConvolutionFwdAlgoWinograd,288x14x14x1x1x128x14x14x32xNCHWxFP32x0x0x1x1x1x1x1x1
320-14-14-1x1-128-14-14-32-0x0-1x1-1x1-0-NCHW-FP32-F=miopenConvolutionFwdAlgoImplicitGEMM:ConvHipImplicitGemmV4_1x1,0.09008,0,miopenConvolutionFwdAlgoImplicitGEMM,320x14x14x1x1x128x14x14x32xNCHWxFP32x0x0x1x1x1x1x1x1;miopenConvolutionFwdAlgoDirect:ConvOclDirectFwd1x1,0.09744,0,miopenConvolutionFwdAlgoDirect,<unused>;miopenConvolutionFwdAlgoGEMM:gemm,0.26768,0,rocBlas,<unused>;miopenConvolutionFwdAlgoWinograd:ConvBinWinogradRxSf3x2,0.1832,0,miopenConvolutionFwdAlgoWinograd,320x14x14x1x1x128x14x14x32xNCHWxFP32x0x0x1x1x1x1x1x1
352-14-14-1x1-128-14-14-32-0x0-1x1-1x1-0-NCHW-FP32-F=miopenConvolutionFwdAlgoImplicitGEMM:ConvHipImplicitGemmV4_1x1,0.09376,0,miopenConvolutionFwdAlgoImplicitGEMM,352x14x14x1x1x128x14x14x32xNCHWxFP32x0x0x1x1x1x1x1x1;miopenConvolutionFwdAlgoDirect:ConvOclDirectFwd1x1,0.10464,0,miopenConvolutionFwdAlgoDirect,<unused>;miopenConvolutionFwdAlgoGEMM:gemm,0.2624,0,rocBlas,<unused>;miopenConvolutionFwdAlgoWinograd:ConvBinWinogradRxSf3x2,0.18352,0,miopenConvolutionFwdAlgoWinograd,352x14x14x1x1x128x14x14x32xNCHWxFP32x0x0x1x1x1x1x1x1
384-14-14-1x1-128-14-14-32-0x0-1x1-1x1-0-NCHW-FP32-F=miopenConvolutionFwdAlgoImplicitGEMM:ConvHipImplicitGemmV4_1x1,0.13312,0,miopenConvolutionFwdAlgoImplicitGEMM,384x14x14x1x1x128x14x14x32xNCHWxFP32x0x0x1x1x1x1x1x1;miopenConvolutionFwdAlgoDirect:ConvOclDirectFwd1x1,0.11728,0,miopenConvolutionFwdAlgoDirect,<unused>;miopenConvolutionFwdAlgoGEMM:gemm,0.1616,0,rocBlas,<unused>;miopenConvolutionFwdAlgoWinograd:ConvBinWinogradRxSf3x2,0.19712,0,miopenConvolutionFwdAlgoWinograd,384x14x14x1x1x128x14x14x32xNCHWxFP32x0x0x1x1x1x1x1x1
416-14-14-1x1-128-14-14-32-0x0-1x1-1x1-0-NCHW-FP32-F=miopenConvolutionFwdAlgoImplicitGEMM:ConvHipImplicitGemmV4_1x1,0.10912,0,miopenConvolutionFwdAlgoImplicitGEMM,416x14x14x1x1x128x14x14x32xNCHWxFP32x0x0x1x1x1x1x1x1;miopenConvolutionFwdAlgoDirect:ConvOclDirectFwd1x1,0.12512,0,miopenConvolutionFwdAlgoDirect,<unused>;miopenConvolutionFwdAlgoGEMM:gemm,0.16976,0,rocBlas,<unused>;miopenConvolutionFwdAlgoWinograd:ConvBinWinogradRxSf3x2,0.23456,0,miopenConvolutionFwdAlgoWinograd,416x14x14x1x1x128x14x14x32xNCHWxFP32x0x0x1x1x1x1x1x1
448-14-14-1x1-128-14-14-32-0x0-1x1-1x1-0-NCHW-FP32-F=miopenConvolutionFwdAlgoImplicitGEMM:ConvHipImplicitGemmV4_1x1,0.12192,0,miopenConvolutionFwdAlgoImplicitGEMM,448x14x14x1x1x128x14x14x32xNCHWxFP32x0x0x1x1x1x1x1x1;miopenConvolutionFwdAlgoDirect:ConvOclDirectFwd1x1,0.1336,0,miopenConvolutionFwdAlgoDirect,<unused>;miopenConvolutionFwdAlgoGEMM:gemm,0.15312,0,rocBlas,<unused>;miopenConvolutionFwdAlgoWinograd:ConvBinWinogradRxSf3x2,0.22336,0,miopenConvolutionFwdAlgoWinograd,448x14x14x1x1x128x14x14x32xNCHWxFP32x0x0x1x1x1x1x1x1
480-14-14-1x1-128-14-14-32-0x0-1x1-1x1-0-NCHW-FP32-F=miopenConvolutionFwdAlgoImplicitGEMM:ConvHipImplicitGemmV4_1x1,0.12192,0,miopenConvolutionFwdAlgoImplicitGEMM,480x14x14x1x1x128x14x14x32xNCHWxFP32x0x0x1x1x1x1x1x1;miopenConvolutionFwdAlgoDirect:ConvOclDirectFwd1x1,0.1576,0,miopenConvolutionFwdAlgoDirect,<unused>;miopenConvolutionFwdAlgoGEMM:gemm,0.18336,0,rocBlas,<unused>;miopenConvolutionFwdAlgoWinograd:ConvBinWinogradRxSf3x2,0.23632,0,miopenConvolutionFwdAlgoWinograd,480x14x14x1x1x128x14x14x32xNCHWxFP32x0x0x1x1x1x1x1x1
512-14-14-1x1-128-14-14-32-0x0-1x1-1x1-0-NCHW-FP32-F=miopenConvolutionFwdAlgoImplicitGEMM:ConvHipImplicitGemmV4_1x1,0.14896,0,miopenConvolutionFwdAlgoImplicitGEMM,512x14x14x1x1x128x14x14x32xNCHWxFP32x0x0x1x1x1x1x1x1;miopenConvolutionFwdAlgoDirect:ConvOclDirectFwd1x1,0.16224,0,miopenConvolutionFwdAlgoDirect,<unused>;miopenConvolutionFwdAlgoGEMM:gemm,0.20144,0,rocBlas,<unused>;miopenConvolutionFwdAlgoWinograd:ConvBinWinogradRxSf3x2,0.24992,0,miopenConvolutionFwdAlgoWinograd,512x14x14x1x1x128x14x14x32xNCHWxFP32x0x0x1x1x1x1x1x1
544-14-14-1x1-128-14-14-32-0x0-1x1-1x1-0-NCHW-FP32-F=miopenConvolutionFwdAlgoImplicitGEMM:ConvHipImplicitGemmV4_1x1,0.13968,0,miopenConvolutionFwdAlgoImplicitGEMM,544x14x14x1x1x128x14x14x32xNCHWxFP32x0x0x1x1x1x1x1x1;miopenConvolutionFwdAlgoDirect:ConvOclDirectFwd1x1,0.16288,0,miopenConvolutionFwdAlgoDirect,<unused>;miopenConvolutionFwdAlgoGEMM:gemm,0.18784,0,rocBlas,<unused>;miopenConvolutionFwdAlgoWinograd:ConvBinWinogradRxSf3x2,0.28736,0,miopenConvolutionFwdAlgoWinograd,544x14x14x1x1x128x14x14x32xNCHWxFP32x0x0x1x1x1x1x1x1
576-14-14-1x1-128-14-14-32-0x0-1x1-1x1-0-NCHW-FP32-F=miopenConvolutionFwdAlgoImplicitGEMM:ConvHipImplicitGemmV4_1x1,0.15248,0,miopenConvolutionFwdAlgoImplicitGEMM,576x14x14x1x1x128x14x14x32xNCHWxFP32x0x0x1x1x1x1x1x1;miopenConvolutionFwdAlgoDirect:ConvOclDirectFwd1x1,0.1736,0,miopenConvolutionFwdAlgoDirect,<unused>;miopenConvolutionFwdAlgoGEMM:gemm,0.18928,0,rocBlas,<unused>;miopenConvolutionFwdAlgoWinograd:ConvBinWinogradRxSf3x2,0.2888,0,miopenConvolutionFwdAlgoWinograd,576x14x14x1x1x128x14x14x32xNCHWxFP32x0x0x1x1x1x1x1x1
608-14-14-1x1-128-14-14-32-0x0-1x1-1x1-0-NCHW-FP32-F=miopenConvolutionFwdAlgoImplicitGEMM:ConvHipImplicitGemmV4_1x1,0.15248,0,miopenConvolutionFwdAlgoImplicitGEMM,608x14x14x1x1x128x14x14x32xNCHWxFP32x0x0x1x1x1x1x1x1;miopenConvolutionFwdAlgoDirect:ConvOclDirectFwd1x1,0.17952,0,miopenConvolutionFwdAlgoDirect,<unused>;miopenConvolutionFwdAlgoGEMM:gemm,0.21888,0,rocBlas,<unused>;miopenConvolutionFwdAlgoWinograd:ConvBinWinogradRxSf3x2,0.28864,0,miopenConvolutionFwdAlgoWinograd,608x14x14x1x1x128x14x14x32xNCHWxFP32x0x0x1x1x1x1x1x1
640-14-14-1x1-128-14-14-32-0x0-1x1-1x1-0-NCHW-FP32-F=miopenConvolutionFwdAlgoImplicitGEMM:ConvHipImplicitGemmV4_1x1,0.16752,0,miopenConvolutionFwdAlgoImplicitGEMM,640x14x14x1x1x128x14x14x32xNCHWxFP32x0x0x1x1x1x1x1x1;miopenConvolutionFwdAlgoDirect:ConvOclDirectFwd1x1,0.19584,0,miopenConvolutionFwdAlgoDirect,<unused>;miopenConvolutionFwdAlgoGEMM:gemm,0.20768,0,rocBlas,<unused>;miopenConvolutionFwdAlgoWinograd:ConvBinWinogradRxSf3x2,0.31648,0,miopenConvolutionFwdAlgoWinograd,640x14x14x1x1x128x14x14x32xNCHWxFP32x0x0x1x1x1x1x1x1
672-14-14-1x1-128-14-14-32-0x0-1x1-1x1-0-NCHW-FP32-F=miopenConvolutionFwdAlgoImplicitGEMM:ConvHipImplicitGemmV4_1x1,0.17216,0,miopenConvolutionFwdAlgoImplicitGEMM,672x14x14x1x1x128x14x14x32xNCHWxFP32x0x0x1x1x1x1x1x1;miopenConvolutionFwdAlgoDirect:ConvOclDirectFwd1x1,0.18288,0,miopenConvolutionFwdAlgoDirect,<unused>;miopenConvolutionFwdAlgoGEMM:gemm,0.30848,0,rocBlas,<unused>;miopenConvolutionFwdAlgoWinograd:ConvBinWinogradRxSf3x2,0.3152,0,miopenConvolutionFwdAlgoWinograd,672x14x14x1x1x128x14x14x32xNCHWxFP32x0x0x1x1x1x1x1x1
704-14-14-1x1-128-14-14-32-0x0-1x1-1x1-0-NCHW-FP32-F=miopenConvolutionFwdAlgoImplicitGEMM:ConvHipImplicitGemmV4_1x1,0.17984,0,miopenConvolutionFwdAlgoImplicitGEMM,704x14x14x1x1x128x14x14x32xNCHWxFP32x0x0x1x1x1x1x1x1;miopenConvolutionFwdAlgoDirect:ConvOclDirectFwd1x1,0.21136,0,miopenConvolutionFwdAlgoDirect,<unused>;miopenConvolutionFwdAlgoGEMM:gemm,0.34144,0,rocBlas,<unused>;miopenConvolutionFwdAlgoWinograd:ConvBinWinogradRxSf3x2,0.35328,0,miopenConvolutionFwdAlgoWinograd,704x14x14x1x1x128x14x14x32xNCHWxFP32x0x0x1x1x1x1x1x1
736-14-14-1x1-128-14-14-32-0x0-1x1-1x1-0-NCHW-FP32-F=miopenConvolutionFwdAlgoImplicitGEMM:ConvHipImplicitGemmV4_1x1,0.18096,0,miopenConvolutionFwdAlgoImplicitGEMM,736x14x14x1x1x128x14x14x32xNCHWxFP32x0x0x1x1x1x1x1x1;miopenConvolutionFwdAlgoDirect:ConvOclDirectFwd1x1,0.22208,0,miopenConvolutionFwdAlgoDirect,<unused>;miopenConvolutionFwdAlgoGEMM:gemm,0.35248,0,rocBlas,<unused>;miopenConvolutionFwdAlgoWinograd:ConvBinWinogradRxSf3x2,0.36704,0,miopenConvolutionFwdAlgoWinograd,736x14x14x1x1x128x14x14x32xNCHWxFP32x0x0x1x1x1x1x1x1
768-14-14-1x1-128-14-14-32-0x0-1x1-1x1-0-NCHW-FP32-F=miopenConvolutionFwdAlgoImplicitGEMM:ConvHipImplicitGemmV4_1x1,0.19808,0,miopenConvolutionFwdAlgoImplicitGEMM,768x14x14x1x1x128x14x14x32xNCHWxFP32x0x0x1x1x1x1x1x1;miopenConvolutionFwdAlgoDirect:ConvOclDirectFwd1x1,0.23488,0,miopenConvolutionFwdAlgoDirect,<unused>;miopenConvolutionFwdAlgoGEMM:gemm,0.40368,0,rocBlas,<unused>;miopenConvolutionFwdAlgoWinograd:ConvBinWinogradRxSf3x2,0.35552,0,miopenConvolutionFwdAlgoWinograd,768x14x14x1x1x128x14x14x32xNCHWxFP32x0x0x1x1x1x1x1x1
800-14-14-1x1-128-14-14-32-0x0-1x1-1x1-0-NCHW-FP32-F=miopenConvolutionFwdAlgoImplicitGEMM:ConvHipImplicitGemmV4_1x1,0.19968,0,miopenConvolutionFwdAlgoImplicitGEMM,800x14x14x1x1x128x14x14x32xNCHWxFP32x0x0x1x1x1x1x1x1;miopenConvolutionFwdAlgoDirect:ConvOclDirectFwd1x1,0.2448,0,miopenConvolutionFwdAlgoDirect,<unused>;miopenConvolutionFwdAlgoGEMM:gemm,0.38,0,rocBlas,<unused>;miopenConvolutionFwdAlgoWinograd:ConvBinWinogradRxSf3x2,0.39392,0,miopenConvolutionFwdAlgoWinograd,800x14x14x1x1x128x14x14x32xNCHWxFP32x0x0x1x1x1x1x1x1
832-14-14-1x1-128-14-14-32-0x0-1x1-1x1-0-NCHW-FP32-F=miopenConvolutionFwdAlgoImplicitGEMM:ConvHipImplicitGemmV4_1x1,0.21568,0,miopenConvolutionFwdAlgoImplicitGEMM,832x14x14x1x1x128x14x14x32xNCHWxFP32x0x0x1x1x1x1x1x1;miopenConvolutionFwdAlgoDirect:ConvOclDirectFwd1x1,0.24944,0,miopenConvolutionFwdAlgoDirect,<unused>;miopenConvolutionFwdAlgoGEMM:gemm,0.38272,0,rocBlas,<unused>;miopenConvolutionFwdAlgoWinograd:ConvBinWinogradRxSf3x2,0.38064,0,miopenConvolutionFwdAlgoWinograd,832x14x14x1x1x128x14x14x32xNCHWxFP32x0x0x1x1x1x1x1x1
864-14-14-1x1-128-14-14-32-0x0-1x1-1x1-0-NCHW-FP32-F=miopenConvolutionFwdAlgoImplicitGEMM:ConvHipImplicitGemmV4_1x1,0.22528,0,miopenConvolutionFwdAlgoImplicitGEMM,864x14x14x1x1x128x14x14x32xNCHWxFP32x0x0x1x1x1x1x1x1;miopenConvolutionFwdAlgoDirect:ConvOclDirectFwd1x1,0.25792,0,miopenConvolutionFwdAlgoDirect,<unused>;miopenConvolutionFwdAlgoGEMM:gemm,0.41456,0,rocBlas,<unused>;miopenConvolutionFwdAlgoWinograd:ConvBinWinogradRxSf3x2,0.39344,0,miopenConvolutionFwdAlgoWinograd,864x14x14x1x1x128x14x14x32xNCHWxFP32x0x0x1x1x1x1x1x1
896-14-14-1x1-128-14-14-32-0x0-1x1-1x1-0-NCHW-FP32-F=miopenConvolutionFwdAlgoImplicitGEMM:ConvHipImplicitGemmV4_1x1,0.23232,0,miopenConvolutionFwdAlgoImplicitGEMM,896x14x14x1x1x128x14x14x32xNCHWxFP32x0x0x1x1x1x1x1x1;miopenConvolutionFwdAlgoDirect:ConvOclDirectFwd1x1,0.26752,0,miopenConvolutionFwdAlgoDirect,<unused>;miopenConvolutionFwdAlgoGEMM:gemm,0.29024,0,rocBlas,<unused>;miopenConvolutionFwdAlgoWinograd:ConvBinWinogradRxSf3x2,0.40736,0,miopenConvolutionFwdAlgoWinograd,896x14x14x1x1x128x14x14x32xNCHWxFP32x0x0x1x1x1x1x1x1
928-14-14-1x1-128-14-14-32-0x0-1x1-1x1-0-NCHW-FP32-F=miopenConvolutionFwdAlgoImplicitGEMM:ConvHipImplicitGemmV4_1x1,0.22592,0,miopenConvolutionFwdAlgoImplicitGEMM,928x14x14x1x1x128x14x14x32xNCHWxFP32x0x0x1x1x1x1x1x1;miopenConvolutionFwdAlgoDirect:ConvOclDirectFwd1x1,0.2576,0,miopenConvolutionFwdAlgoDirect,<unused>;miopenConvolutionFwdAlgoGEMM:gemm,0.31808,0,rocBlas,<unused>;miopenConvolutionFwdAlgoWinograd:ConvBinWinogradRxSf3x2,0.4192,0,miopenConvolutionFwdAlgoWinograd,928x14x14x1x1x128x14x14x32xNCHWxFP32x0x0x1x1x1x1x1x1
960-14-14-1x1-128-14-14-32-0x0-1x1-1x1-0-NCHW-FP32-F=miopenConvolutionFwdAlgoImplicitGEMM:ConvHipImplicitGemmV4_1x1,0.24256,0,miopenConvolutionFwdAlgoImplicitGEMM,960x14x14x1x1x128x14x14x32xNCHWxFP32x0x0x1x1x1x1x1x1;miopenConvolutionFwdAlgoDirect:ConvOclDirectFwd1x1,0.2832,0,miopenConvolutionFwdAlgoDirect,<unused>;miopenConvolutionFwdAlgoGEMM:gemm,0.31024,0,rocBlas,<unused>;miopenConvolutionFwdAlgoWinograd:ConvBinWinogradRxSf3x2,0.4336,0,miopenConvolutionFwdAlgoWinograd,960x14x14x1x1x128x14x14x32xNCHWxFP32x0x0x1x1x1x1x1x1
992-14-14-1x1-128-14-14-32-0x0-1x1-1x1-0-NCHW-FP32-F=miopenConvolutionFwdAlgoImplicitGEMM:ConvHipImplicitGemmV4_1x1,0.2424,0,miopenConvolutionFwdAlgoImplicitGEMM,992x14x14x1x1x128x14x14x32xNCHWxFP32x0x0x1x1x1x1x1x1;miopenConvolutionFwdAlgoDirect:ConvOclDirectFwd1x1,0.30368,0,miopenConvolutionFwdAlgoDirect,<unused>;miopenConvolutionFwdAlgoGEMM:gemm,0.3216,0,rocBlas,<unused>;miopenConvolutionFwdAlgoWinograd:ConvBinWinogradRxSf3x2,0.44592,0,miopenConvolutionFwdAlgoWinograd,992x14x14x1x1x128x14x14x32xNCHWxFP32x0x0x1x1x1x1x1x1
1024-14-14-1x1-512-14-14-32-0x0-1x1-1x1-0-NCHW-FP32-F=miopenConvolutionFwdAlgoImplicitGEMM:ConvHipImplicitGemmV4_1x1,1.17584,0,miopenConvolutionFwdAlgoImplicitGEMM,1024x14x14x1x1x512x14x14x32xNCHWxFP32x0x0x1x1x1x1x1x1;miopenConvolutionFwdAlgoDirect:ConvOclDirectFwd1x1,1.13472,0,miopenConvolutionFwdAlgoDirect,<unused>;miopenConvolutionFwdAlgoGEMM:gemm,1.2792,0,rocBlas,<unused>;miopenConvolutionFwdAlgoWinograd:ConvBinWinogradRxSf3x2,1.54288,0,miopenConvolutionFwdAlgoWinograd,1024x14x14x1x1x512x14x14x32xNCHWxFP32x0x0x1x1x1x1x1x1
512-7-7-1x1-128-7-7-32-0x0-1x1-1x1-0-NCHW-FP32-F=miopenConvolutionFwdAlgoImplicitGEMM:ConvHipImplicitGemmV4R1Fwd,0.0824,0,miopenConvolutionFwdAlgoImplicitGEMM,512x7x7x1x1x128x7x7x32xNCHWxFP32x0x0x1x1x1x1x1x1;miopenConvolutionFwdAlgoDirect:ConvOclDirectFwd1x1,0.06736,0,miopenConvolutionFwdAlgoDirect,<unused>;miopenConvolutionFwdAlgoGEMM:gemm,0.10048,0,rocBlas,<unused>;miopenConvolutionFwdAlgoWinograd:ConvBinWinogradRxSf3x2,0.1376,0,miopenConvolutionFwdAlgoWinograd,512x7x7x1x1x128x7x7x32xNCHWxFP32x0x0x1x1x1x1x1x1
128-7-7-3x3-32-7-7-32-1x1-1x1-1x1-0-NCHW-FP32-F=miopenConvolutionFwdAlgoWinograd:ConvBinWinograd3x3U,0.04624,0,miopenConvolutionFwdAlgoWinograd,128x7x7x3x3x32x7x7x32xNCHWxFP32x1x1x1x1x1x1x1x1
544-7-7-1x1-128-7-7-32-0x0-1x1-1x1-0-NCHW-FP32-F=miopenConvolutionFwdAlgoImplicitGEMM:ConvHipImplicitGemmV4R1Fwd,0.07536,0,miopenConvolutionFwdAlgoImplicitGEMM,544x7x7x1x1x128x7x7x32xNCHWxFP32x0x0x1x1x1x1x1x1;miopenConvolutionFwdAlgoDirect:ConvAsm1x1U,0.08864,0,miopenConvolutionFwdAlgoDirect,<unused>;miopenConvolutionFwdAlgoGEMM:gemm,0.10576,0,rocBlas,<unused>;miopenConvolutionFwdAlgoWinograd:ConvBinWinogradRxSf3x2,0.14336,0,miopenConvolutionFwdAlgoWinograd,544x7x7x1x1x128x7x7x32xNCHWxFP32x0x0x1x1x1x1x1x1
576-7-7-1x1-128-7-7-32-0x0-1x1-1x1-0-NCHW-FP32-F=miopenConvolutionFwdAlgoImplicitGEMM:ConvHipImplicitGemmV4R1Fwd,0.07904,0,miopenConvolutionFwdAlgoImplicitGEMM,576x7x7x1x1x128x7x7x32xNCHWxFP32x0x0x1x1x1x1x1x1;miopenConvolutionFwdAlgoDirect:ConvOclDirectFwd1x1,0.08144,0,miopenConvolutionFwdAlgoDirect,<unused>;miopenConvolutionFwdAlgoGEMM:gemm,0.10048,0,rocBlas,<unused>;miopenConvolutionFwdAlgoWinograd:ConvBinWinogradRxSf3x2,0.14912,0,miopenConvolutionFwdAlgoWinograd,576x7x7x1x1x128x7x7x32xNCHWxFP32x0x0x1x1x1x1x1x1
608-7-7-1x1-128-7-7-32-0x0-1x1-1x1-0-NCHW-FP32-F=miopenConvolutionFwdAlgoImplicitGEMM:ConvHipImplicitGemmV4R1Fwd,0.08032,0,miopenConvolutionFwdAlgoImplicitGEMM,608x7x7x1x1x128x7x7x32xNCHWxFP32x0x0x1x1x1x1x1x1;miopenConvolutionFwdAlgoDirect:ConvOclDirectFwd1x1,0.08656,0,miopenConvolutionFwdAlgoDirect,<unused>;miopenConvolutionFwdAlgoGEMM:gemm,0.11504,0,rocBlas,<unused>;miopenConvolutionFwdAlgoWinograd:ConvBinWinogradRxSf3x2,0.16512,0,miopenConvolutionFwdAlgoWinograd,608x7x7x1x1x128x7x7x32xNCHWxFP32x0x0x1x1x1x1x1x1
640-7-7-1x1-128-7-7-32-0x0-1x1-1x1-0-NCHW-FP32-F=miopenConvolutionFwdAlgoImplicitGEMM:ConvHipImplicitGemmV4R1Fwd,0.0872,0,miopenConvolutionFwdAlgoImplicitGEMM,640x7x7x1x1x128x7x7x32xNCHWxFP32x0x0x1x1x1x1x1x1;miopenConvolutionFwdAlgoDirect:ConvOclDirectFwd1x1,0.09728,0,miopenConvolutionFwdAlgoDirect,<unused>;miopenConvolutionFwdAlgoGEMM:gemm,0.11936,0,rocBlas,<unused>;miopenConvolutionFwdAlgoWinograd:ConvBinWinogradRxSf3x2,0.17136,0,miopenConvolutionFwdAlgoWinograd,640x7x7x1x1x128x7x7x32xNCHWxFP32x0x0x1x1x1x1x1x1
672-7-7-1x1-128-7-7-32-0x0-1x1-1x1-0-NCHW-FP32-F=miopenConvolutionFwdAlgoImplicitGEMM:ConvHipImplicitGemmV4R1Fwd,0.09072,0,miopenConvolutionFwdAlgoImplicitGEMM,672x7x7x1x1x128x7x7x32xNCHWxFP32x0x0x1x1x1x1x1x1;miopenConvolutionFwdAlgoDirect:ConvOclDirectFwd1x1,0.08112,0,miopenConvolutionFwdAlgoDirect,<unused>;miopenConvolutionFwdAlgoGEMM:gemm,0.11424,0,rocBlas,<unused>;miopenConvolutionFwdAlgoWinograd:ConvBinWinogradRxSf3x2,0.16864,0,miopenConvolutionFwdAlgoWinograd,672x7x7x1x1x128x7x7x32xNCHWxFP32x0x0x1x1x1x1x1x1
704-7-7-1x1-128-7-7-32-0x0-1x1-1x1-0-NCHW-FP32-F=miopenConvolutionFwdAlgoImplicitGEMM:ConvHipImplicitGemmV4R1Fwd,0.0936,0,miopenConvolutionFwdAlgoImplicitGEMM,704x7x7x1x1x128x7x7x32xNCHWxFP32x0x0x1x1x1x1x1x1;miopenConvolutionFwdAlgoDirect:ConvOclDirectFwd1x1,0.10304,0,miopenConvolutionFwdAlgoDirect,<unused>;miopenConvolutionFwdAlgoGEMM:gemm,0.11504,0,rocBlas,<unused>;miopenConvolutionFwdAlgoWinograd:ConvBinWinogradRxSf3x2,0.1856,0,miopenConvolutionFwdAlgoWinograd,704x7x7x1x1x128x7x7x32xNCHWxFP32x0x0x1x1x1x1x1x1
736-7-7-1x1-128-7-7-32-0x0-1x1-1x1-0-NCHW-FP32-F=miopenConvolutionFwdAlgoImplicitGEMM:ConvHipImplicitGemmV4R1Fwd,0.09536,0,miopenConvolutionFwdAlgoImplicitGEMM,736x7x7x1x1x128x7x7x32xNCHWxFP32x0x0x1x1x1x1x1x1;miopenConvolutionFwdAlgoDirect:ConvAsm1x1U,0.1104,0,miopenConvolutionFwdAlgoDirect,<unused>;miopenConvolutionFwdAlgoGEMM:gemm,0.11936,0,rocBlas,<unused>;miopenConvolutionFwdAlgoWinograd:ConvBinWinogradRxSf3x2,0.19168,0,miopenConvolutionFwdAlgoWinograd,736x7x7x1x1x128x7x7x32xNCHWxFP32x0x0x1x1x1x1x1x1
768-7-7-1x1-128-7-7-32-0x0-1x1-1x1-0-NCHW-FP32-F=miopenConvolutionFwdAlgoImplicitGEMM:ConvHipImplicitGemmV4R1Fwd,0.10944,0,miopenConvolutionFwdAlgoImplicitGEMM,768x7x7x1x1x128x7x7x32xNCHWxFP32x0x0x1x1x1x1x1x1;miopenConvolutionFwdAlgoDirect:ConvOclDirectFwd1x1,0.10592,0,miopenConvolutionFwdAlgoDirect,<unused>;miopenConvolutionFwdAlgoGEMM:gemm,0.12496,0,rocBlas,<unused>;miopenConvolutionFwdAlgoWinograd:ConvBinWinogradRxSf3x2,0.1896,0,miopenConvolutionFwdAlgoWinograd,768x7x7x1x1x128x7x7x32xNCHWxFP32x0x0x1x1x1x1x1x1
800-7-7-1x1-128-7-7-32-0x0-1x1-1x1-0-NCHW-FP32-F=miopenConvolutionFwdAlgoImplicitGEMM:ConvHipImplicitGemmV4R1Fwd,0.1016,0,miopenConvolutionFwdAlgoImplicitGEMM,800x7x7x1x1x128x7x7x32xNCHWxFP32x0x0x1x1x1x1x1x1;miopenConvolutionFwdAlgoDirect:ConvOclDirectFwd1x1,0.1088,0,miopenConvolutionFwdAlgoDirect,<unused>;miopenConvolutionFwdAlgoGEMM:gemm,0.12464,0,rocBlas,<unused>;miopenConvolutionFwdAlgoWinograd:ConvBinWinogradRxSf3x2,0.19536,0,miopenConvolutionFwdAlgoWinograd,800x7x7x1x1x128x7x7x32xNCHWxFP32x0x0x1x1x1x1x1x1
832-7-7-1x1-128-7-7-32-0x0-1x1-1x1-0-NCHW-FP32-F=miopenConvolutionFwdAlgoImplicitGEMM:ConvHipImplicitGemmV4R1Fwd,0.1048,0,miopenConvolutionFwdAlgoImplicitGEMM,832x7x7x1x1x128x7x7x32xNCHWxFP32x0x0x1x1x1x1x1x1;miopenConvolutionFwdAlgoDirect:ConvAsm1x1U,0.08368,0,miopenConvolutionFwdAlgoDirect,<unused>;miopenConvolutionFwdAlgoGEMM:gemm,0.1328,0,rocBlas,<unused>;miopenConvolutionFwdAlgoWinograd:ConvBinWinogradRxSf3x2,0.2104,0,miopenConvolutionFwdAlgoWinograd,832x7x7x1x1x128x7x7x32xNCHWxFP32x0x0x1x1x1x1x1x1
864-7-7-1x1-128-7-7-32-0x0-1x1-1x1-0-NCHW-FP32-F=miopenConvolutionFwdAlgoImplicitGEMM:ConvHipImplicitGemmV4R1Fwd,0.10864,0,miopenConvolutionFwdAlgoImplicitGEMM,864x7x7x1x1x128x7x7x32xNCHWxFP32x0x0x1x1x1x1x1x1;miopenConvolutionFwdAlgoDirect:ConvOclDirectFwd1x1,0.10656,0,miopenConvolutionFwdAlgoDirect,<unused>;miopenConvolutionFwdAlgoGEMM:gemm,0.13088,0,rocBlas,<unused>;miopenConvolutionFwdAlgoWinograd:ConvBinWinogradRxSf3x2,0.20848,0,miopenConvolutionFwdAlgoWinograd,864x7x7x1x1x128x7x7x32xNCHWxFP32x0x0x1x1x1x1x1x1
896-7-7-1x1-128-7-7-32-0x0-1x1-1x1-0-NCHW-FP32-F=miopenConvolutionFwdAlgoImplicitGEMM:ConvHipImplicitGemmV4R1Fwd,0.1192,0,miopenConvolutionFwdAlgoImplicitGEMM,896x7x7x1x1x128x7x7x32xNCHWxFP32x0x0x1x1x1x1x1x1;miopenConvolutionFwdAlgoDirect:ConvOclDirectFwd1x1,0.1208,0,miopenConvolutionFwdAlgoDirect,<unused>;miopenConvolutionFwdAlgoGEMM:gemm,0.13328,0,rocBlas,<unused>;miopenConvolutionFwdAlgoWinograd:ConvBinWinogradRxSf3x2,0.2144,0,miopenConvolutionFwdAlgoWinograd,896x7x7x1x1x128x7x7x32xNCHWxFP32x0x0x1x1x1x1x1x1
928-7-7-1x1-128-7-7-32-0x0-1x1-1x1-0-NCHW-FP32-F=miopenConvolutionFwdAlgoImplicitGEMM:ConvHipImplicitGemmV4R1Fwd,0.11568,0,miopenConvolutionFwdAlgoImplicitGEMM,928x7x7x1x1x128x7x7x32xNCHWxFP32x0x0x1x1x1x1x1x1;miopenConvolutionFwdAlgoDirect:ConvOclDirectFwd1x1,0.11296,0,miopenConvolutionFwdAlgoDirect,<unused>;miopenConvolutionFwdAlgoGEMM:gemm,0.14016,0,rocBlas,<unused>;miopenConvolutionFwdAlgoWinograd:ConvBinWinogradRxSf3x2,0.22096,0,miopenConvolutionFwdAlgoWinograd,928x7x7x1x1x128x7x7x32xNCHWxFP32x0x0x1x1x1x1x1x1
960-7-7-1x1-128-7-7-32-0x0-1x1-1x1-0-NCHW-FP32-F=miopenConvolutionFwdAlgoImplicitGEMM:ConvHipImplicitGemmV4R1Fwd,0.12016,0,miopenConvolutionFwdAlgoImplicitGEMM,960x7x7x1x1x128x7x7x32xNCHWxFP32x0x0x1x1x1x1x1x1;miopenConvolutionFwdAlgoDirect:ConvOclDirectFwd1x1,0.11856,0,miopenConvolutionFwdAlgoDirect,<unused>;miopenConvolutionFwdAlgoGEMM:gemm,0.14624,0,rocBlas,<unused>;miopenConvolutionFwdAlgoWinograd:ConvBinWinogradRxSf3x2,0.23728,0,miopenConvolutionFwdAlgoWinograd,960x7x7x1x1x128x7x7x32xNCHWxFP32x0x0x1x1x1x1x1x1
992-7-7-1x1-128-7-7-32-0x0-1x1-1x1-0-NCHW-FP32-F=miopenConvolutionFwdAlgoImplicitGEMM:ConvHipImplicitGemmV4R1Fwd,0.12288,0,miopenConvolutionFwdAlgoImplicitGEMM,992x7x7x1x1x128x7x7x32xNCHWxFP32x0x0x1x1x1x1x1x1;miopenConvolutionFwdAlgoDirect:ConvOclDirectFwd1x1,0.12304,0,miopenConvolutionFwdAlgoDirect,<unused>;miopenConvolutionFwdAlgoGEMM:gemm,0.16672,0,rocBlas,<unused>;miopenConvolutionFwdAlgoWinograd:ConvBinWinogradRxSf3x2,0.24448,0,miopenConvolutionFwdAlgoWinograd,992x7x7x1x1x128x7x7x32xNCHWxFP32x0x0x1x1x1x1x1x1
3-224-224-7x7-64-112-112-32-3x3-2x2-1x1-0-NCHW-FP16-F=miopenConvolutionFwdAlgoDirect:ConvOclDirectFwdGen,1.61088,0,miopenConvolutionFwdAlgoDirect,<unused>;miopenConvolutionFwdAlgoGEMM:gemm,3.84512,3687936,rocBlas,<unused>
64-56-56-1x1-128-56-56-32-0x0-1x1-1x1-0-NCHW-FP16-F=miopenConvolutionFwdAlgoImplicitGEMM:ConvHipImplicitGemmV4Fwd,0.24448,0,miopenConvolutionFwdAlgoImplicitGEMM,64x56x56x1x1x128x56x56x32xNCHWxFP16x0x0x1x1x1x1x1x1;miopenConvolutionFwdAlgoDirect:ConvAsm1x1U,0.19872,0,miopenConvolutionFwdAlgoDirect,<unused>;miopenConvolutionFwdAlgoGEMM:gemm,0.1208,0,rocBlas,<unused>;miopenConvolutionFwdAlgoWinograd:ConvBinWinogradRxS,0.51424,0,miopenConvolutionFwdAlgoWinograd,64x56x56x1x1x128x56x56x32xNCHWxFP16x0x0x1x1x1x1x1x1
128-56-56-3x3-32-56-56-32-1x1-1x1-1x1-0-NCHW-FP16-F=miopenConvolutionFwdAlgoImplicitGEMM:ConvHipImplicitGemmV4R1Fwd,0.76624,0,miopenConvolutionFwdAlgoImplicitGEMM,128x56x56x3x3x32x56x56x32xNCHWxFP16x1x1x1x1x1x1x1x1;miopenConvolutionFwdAlgoDirect:ConvOclDirectFwd,2.00944,0,miopenConvolutionFwdAlgoDirect,<unused>;miopenConvolutionFwdAlgoGEMM:gemm,3.55328,7225344,rocBlas,<unused>;miopenConvolutionFwdAlgoWinograd:ConvBinWinogradRxS,0.26576,0,miopenConvolutionFwdAlgoWinograd,128x56x56x3x3x32x56x56x32xNCHWxFP16x1x1x1x1x1x1x1x1
96-56-56-1x1-128-56-56-32-0x0-1x1-1x1-0-NCHW-FP16-F=miopenConvolutionFwdAlgoImplicitGEMM:ConvHipImplicitGemmV4Fwd,0.30992,0,miopenConvolutionFwdAlgoImplicitGEMM,96x56x56x1x1x128x56x56x32xNCHWxFP16x0x0x1x1x1x1x1x1;miopenConvolutionFwdAlgoDirect:ConvAsm1x1U,0.27328,0,miopenConvolutionFwdAlgoDirect,<unused>;miopenConvolutionFwdAlgoGEMM:gemm,0.18096,0,rocBlas,<unused>;miopenConvolutionFwdAlgoWinograd:ConvBinWinogradRxS,0.71776,0,miopenConvolutionFwdAlgoWinograd,96x56x56x1x1x128x56x56x32xNCHWxFP16x0x0x1x1x1x1x1x1
128-56-56-1x1-128-56-56-32-0x0-1x1-1x1-0-NCHW-FP16-F=miopenConvolutionFwdAlgoImplicitGEMM:ConvHipImplicitGemmV4Fwd,0.33552,0,miopenConvolutionFwdAlgoImplicitGEMM,128x56x56x1x1x128x56x56x32xNCHWxFP16x0x0x1x1x1x1x1x1;miopenConvolutionFwdAlgoDirect:ConvAsm1x1U,0.32592,0,miopenConvolutionFwdAlgoDirect,<unused>;miopenConvolutionFwdAlgoGEMM:gemm,0.20912,0,rocBlas,<unused>;miopenConvolutionFwdAlgoWinograd:ConvBinWinogradRxS,0.924319,0,miopenConvolutionFwdAlgoWinograd,128x56x56x1x1x128x56x56x32xNCHWxFP16x0x0x1x1x1x1x1x1
160-56-56-1x1-128-56-56-32-0x0-1x1-1x1-0-NCHW-FP16-F=miopenConvolutionFwdAlgoImplicitGEMM:ConvHipImplicitGemmV4Fwd,0.44704,0,miopenConvolutionFwdAlgoImplicitGEMM,160x56x56x1x1x128x56x56x32xNCHWxFP16x0x0x1x1x1x1x1x1;miopenConvolutionFwdAlgoDirect:ConvAsm1x1U,0.39536,0,miopenConvolutionFwdAlgoDirect,<unused>;miopenConvolutionFwdAlgoGEMM:gemm,0.2448,0,rocBlas,<unused>;miopenConvolutionFwdAlgoWinograd:ConvBinWinogradRxS,1.12736,0,miopenConvolutionFwdAlgoWinograd,160x56x56x1x1x128x56x56x32xNCHWxFP16x0x0x1x1x1x1x1x1
192-56-56-1x1-128-56-56-32-0x0-1x1-1x1-0-NCHW-FP16-F=miopenConvolutionFwdAlgoImplicitGEMM:ConvHipImplicitGemmV4Fwd,0.42656,0,miopenConvolutionFwdAlgoImplicitGEMM,192x56x56x1x1x128x56x56x32xNCHWxFP16x0x0x1x1x1x1x1x1;miopenConvolutionFwdAlgoDirect:ConvAsm1x1U,0.47072,0,miopenConvolutionFwdAlgoDirect,<unused>;miopenConvolutionFwdAlgoGEMM:gemm,0.28608,0,rocBlas,<unused>;miopenConvolutionFwdAlgoWinograd:ConvBinWinogradRxS,1.33296,0,miopenConvolutionFwdAlgoWinograd,192x56x56x1x1x128x56x56x32xNCHWxFP16x0x0x1x1x1x1x1x1
224-56-56-1x1-128-56-56-32-0x0-1x1-1x1-0-NCHW-FP16-F=miopenConvolutionFwdAlgoImplicitGEMM:ConvHipImplicitGemmV4Fwd,0.46608,0,miopenConvolutionFwdAlgoImplicitGEMM,224x56x56x1x1x128x56x56x32xNCHWxFP16x0x0x1x1x1x1x1x1;miopenConvolutionFwdAlgoDirect:ConvAsm1x1U,0.53792,0,miopenConvolutionFwdAlgoDirect,<unused>;miopenConvolutionFwdAlgoGEMM:gemm,0.35168,0,rocBlas,<unused>;miopenConvolutionFwdAlgoWinograd:ConvBinWinogradRxS,1.57696,0,miopenConvolutionFwdAlgoWinograd,224x56x56x1x1x128x56x56x32xNCHWxFP16x0x0x1x1x1x1x1x1
256-56-56-1x1-128-56-56-32-0x0-1x1-1x1-0-NCHW-FP16-F=miopenConvolutionFwdAlgoImplicitGEMM:ConvHipImplicitGemmV4Fwd,0.72912,0,miopenConvolutionFwdAlgoImplicitGEMM,256x56x56x1x1x128x56x56x32xNCHWxFP16x0x0x1x1x1x1x1x1;miopenConvolutionFwdAlgoDirect:ConvAsm1x1U,0.55152,0,miopenConvolutionFwdAlgoDirect,<unused>;miopenConvolutionFwdAlgoGEMM:gemm,0.40912,0,rocBlas,<unused>;miopenConvolutionFwdAlgoWinograd:ConvBinWinogradRxS,1.7448,0,miopenConvolutionFwdAlgoWinograd,256x56x56x1x1x128x56x56x32xNCHWxFP16x0x0x1x1x1x1x1x1
128-28-28-1x1-128-28-28-32-0x0-1x1-1x1-0-NCHW-FP16-F=miopenConvolutionFwdAlgoImplicitGEMM:ConvHipImplicitGemmV4Fwd,0.11008,0,miopenConvolutionFwdAlgoImplicitGEMM,128x28x28x1x1x128x28x28x32xNCHWxFP16x0x0x1x1x1x1x1x1;miopenConvolutionFwdAlgoDirect:ConvAsm1x1U,0.09824,0,miopenConvolutionFwdAlgoDirect,<unused>;miopenConvolutionFwdAlgoGEMM:gemm,0.14448,0,rocBlas,<unused>;miopenConvolutionFwdAlgoWinograd:ConvBinWinogradRxS,0.27904,0,miopenConvolutionFwdAlgoWinograd,128x28x28x1x1x128x28x28x32xNCHWxFP16x0x0x1x1x1x1x1x1
128-28-28-3x3-32-28-28-32-1x1-1x1-1x1-0-NCHW-FP16-F=miopenConvolutionFwdAlgoImplicitGEMM:ConvHipImplicitGemmV4R1Fwd,0.24528,0,miopenConvolutionFwdAlgoImplicitGEMM,128x28x28x3x3x32x28x28x32xNCHWxFP16x1x1x1x1x1x1x1x1;miopenConvolutionFwdAlgoDirect:ConvOclDirectFwd,0.56368,0,miopenConvolutionFwdAlgoDirect,<unused>;miopenConvolutionFwdAlgoGEMM:gemm,2.32448,1806336,rocBlas,<unused>;miopenConvolutionFwdAlgoWinograd:ConvBinWinogradRxS,0.0944,0,miopenConvolutionFwdAlgoWinograd,128x28x28x3x3x32x28x28x32xNCHWxFP16x1x1x1x1x1x1x1x1
160-28-28-1x1-128-28-28-32-0x0-1x1-1x1-0-NCHW-FP16-F=miopenConvolutionFwdAlgoImplicitGEMM:ConvHipImplicitGemmV4Fwd,0.11728,0,miopenConvolutionFwdAlgoImplicitGEMM,160x28x28x1x1x128x28x28x32xNCHWxFP16x0x0x1x1x1x1x1x1;miopenConvolutionFwdAlgoDirect:ConvAsm1x1U,0.10928,0,miopenConvolutionFwdAlgoDirect,<unused>;miopenConvolutionFwdAlgoGEMM:gemm,0.17136,0,rocBlas,<unused>;miopenConvolutionFwdAlgoWinograd:ConvBinWinogradRxS,0.3392,0,miopenConvolutionFwdAlgoWinograd,160x28x28x1x1x128x28x28x32xNCHWxFP16x0x0x1x1x1x1x1x1
192-28-28-1x1-128-28-28-32-0x0-1x1-1x1-0-NCHW-FP16-F=miopenConvolutionFwdAlgoImplicitGEMM:ConvHipImplicitGemmV4Fwd,0.13264,0,miopenConvolutionFwdAlgoImplicitGEMM,192x28x28x1x1x128x28x28x32xNCHWxFP16x0x0x1x1x1x1x1x1;miopenConvolutionFwdAlgoDirect:ConvAsm1x1U,0.12704,0,miopenConvolutionFwdAlgoDirect,<unused>;miopenConvolutionFwdAlgoGEMM:gemm,0.20128,0,rocBlas,<unused>;miopenConvolutionFwdAlgoWinograd:ConvBinWinogradRxS,0.42848,0,miopenConvolutionFwdAlgoWinograd,192x28x28x1x1x128x28x28x32xNCHWxFP16x0x0x1x1x1x1x1x1
224-28-28-1x1-128-28-28-32-0x0-1x1-1x1-0-NCHW-FP16-F=miopenConvolutionFwdAlgoImplicitGEMM:ConvHipImplicitGemmV4Fwd,0.15072,0,miopenConvolutionFwdAlgoImplicitGEMM,224x28x28x1x1x128x28x28x32xNCHWxFP16x0x0x1x1x1x1x1x1;miopenConvolutionFwdAlgoDirect:ConvAsm1x1U,0.15136,0,miopenConvolutionFwdAlgoDirect,<unused>;miopenConvolutionFwdAlgoGEMM:gemm,0.2272,0,rocBlas,<unused>;miopenConvolutionFwdAlgoWinograd:ConvBinWinogradRxS,0.45968,0,miopenConvolutionFwdAlgoWinograd,224x28x28x1x1x128x28x28x32xNCHWxFP16x0x0x1x1x1x1x1x1
256-28-28-1x1-128-28-28-32-0x0-1x1-1x1-0-NCHW-FP16-F=miopenConvolutionFwdAlgoImplicitGEMM:ConvHipImplicitGemmV4Fwd,0.18192,0,miopenConvolutionFwdAlgoImplicitGEMM,256x28x28x1x1x128x28x28x32xNCHWxFP16x0x0x1x1x1x1x1x1;miopenConvolutionFwdAlgoDirect:ConvAsm1x1U,0.15808,0,miopenConvolutionFwdAlgoDirect,<unused>;miopenConvolutionFwdAlgoGEMM:gemm,0.2568,0,rocBlas,<unused>;miopenConvolutionFwdAlgoWinograd:ConvBinWinogradRxS,0.61904,0,miopenConvolutionFwdAlgoWinograd,256x28x28x1x1x128x28x28x32xNCHWxFP16x0x0x1x1x1x1x1x1
288-28-28-1x1-128-28-28-32-0x0-1x1-1x1-0-NCHW-FP16-F=miopenConvolutionFwdAlgoImplicitGEMM:ConvHipImplicitGemmV4Fwd,0.17712,0,miopenConvolutionFwdAlgoImplicitGEMM,288x28x28x1x1x128x28x28x32xNCHWxFP16x0x0x1x1x1x1x1x1;miopenConvolutionFwdAlgoDirect:ConvAsm1x1U,0.20048,0,miopenConvolutionFwdAlgoDirect,<unused>;miopenConvolutionFwdAlgoGEMM:gemm,0.28352,0,rocBlas,<unused>;miopenConvolutionFwdAlgoWinograd:ConvBinWinogradRxS,0.58,0,miopenConvolutionFwdAlgoWinograd,288x28x28x1x1x128x28x28x32xNCHWxFP16x0x0x1x1x1x1x1x1
320-28-28-1x1-128-28-28-32-0x0-1x1-1x1-0-NCHW-FP16-F=miopenConvolutionFwdAlgoImplicitGEMM:ConvHipImplicitGemmV4Fwd,0.20464,0,miopenConvolutionFwdAlgoImplicitGEMM,320x28x28x1x1x128x28x28x32xNCHWxFP16x0x0x1x1x1x1x1x1;miopenConvolutionFwdAlgoDirect:ConvAsm1x1U,0.18992,0,miopenConvolutionFwdAlgoDirect,<unused>;miopenConvolutionFwdAlgoGEMM:gemm,0.3096,0,rocBlas,<unused>;miopenConvolutionFwdAlgoWinograd:ConvBinWinogradRxS,0.64,0,miopenConvolutionFwdAlgoWinograd,320x28x28x1x1x128x28x28x32xNCHWxFP16x0x0x1x1x1x1x1x1
352-28-28-1x1-128-28-28-32-0x0-1x1-1x1-0-NCHW-FP16-F=miopenConvolutionFwdAlgoImplicitGEMM:ConvHipImplicitGemmV4Fwd,0.212,0,miopenConvolutionFwdAlgoImplicitGEMM,352x28x28x1x1x128x28x28x32xNCHWxFP16x0x0x1x1x1x1x1x1;miopenConvolutionFwdAlgoDirect:ConvAsm1x1U,0.21856,0,miopenConvolutionFwdAlgoDirect,<unused>;miopenConvolutionFwdAlgoGEMM:gemm,0.33648,0,rocBlas,<unused>;miopenConvolutionFwdAlgoWinograd:ConvBinWinogradRxS,0.70176,0,miopenConvolutionFwdAlgoWinograd,352x28x28x1x1x128x28x28x32xNCHWxFP16x0x0x1x1x1x1x1x1
384-28-28-1x1-128-28-28-32-0x0-1x1-1x1-0-NCHW-FP16-F=miopenConvolutionFwdAlgoImplicitGEMM:ConvHipImplicitGemmV4Fwd,0.23152,0,miopenConvolutionFwdAlgoImplicitGEMM,384x28x28x1x1x128x28x28x32xNCHWxFP16x0x0x1x1x1x1x1x1;miopenConvolutionFwdAlgoDirect:ConvAsm1x1U,0.25936,0,miopenConvolutionFwdAlgoDirect,<unused>;miopenConvolutionFwdAlgoGEMM:gemm,0.20752,0,rocBlas,<unused>;miopenConvolutionFwdAlgoWinograd:ConvBinWinogradRxS,0.940319,0,miopenConvolutionFwdAlgoWinograd,384x28x28x1x1x128x28x28x32xNCHWxFP16x0x0x1x1x1x1x1x1
416-28-28-1x1-128-28-28-32-0x0-1x1-1x1-0-NCHW-FP16-F=miopenConvolutionFwdAlgoImplicitGEMM:ConvHipImplicitGemmV4Fwd,0.248,0,miopenConvolutionFwdAlgoImplicitGEMM,416x28x28x1x1x128x28x28x32xNCHWxFP16x0x0x1x1x1x1x1x1;miopenConvolutionFwdAlgoDirect:ConvAsm1x1U,0.2552,0,miopenConvolutionFwdAlgoDirect,<unused>;miopenConvolutionFwdAlgoGEMM:gemm,0.20432,0,rocBlas,<unused>;miopenConvolutionFwdAlgoWinograd:ConvBinWinogradRxS,0.950879,0,miopenConvolutionFwdAlgoWinograd,416x28x28x1x1x128x28x28x32xNCHWxFP16x0x0x1x1x1x1x1x1
448-28-28-1x1-128-28-28-32-0x0-1x1-1x1-0-NCHW-FP16-F=miopenConvolutionFwdAlgoImplicitGEMM:ConvHipImplicitGemmV4Fwd,0.25872,0,miopenConvolutionFwdAlgoImplicitGEMM,448x28x28x1x1x128x28x28x32xNCHWxFP16x0x0x1x1x1x1x1x1;miopenConvolutionFwdAlgoDirect:ConvAsm1x1U,0.2712,0,miopenConvolutionFwdAlgoDirect,<unused>;miopenConvolutionFwdAlgoGEMM:gemm,0.21568,0,rocBlas,<unused>;miopenConvolutionFwdAlgoWinograd:ConvBinWinogradRxS,0.942079,0,miopenConvolutionFwdAlgoWinograd,448x28x28x1x1x128x28x28x32xNCHWxFP16x0x0x1x1x1x1x1x1
480-28-28-1x1-128-28-28-32-0x0-1x1-1x1-0-NCHW-FP16-F=miopenConvolutionFwdAlgoImplicitGEMM:ConvHipImplicitGemmV4Fwd,0.26336,0,miopenConvolutionFwdAlgoImplicitGEMM,480x28x28x1x1x128x28x28x32xNCHWxFP16x0x0x1x1x1x1x1x1;miopenConvolutionFwdAlgoDirect:ConvAsm1x1U,0.30144,0,miopenConvolutionFwdAlgoDirect,<unused>;miopenConvolutionFwdAlgoGEMM:gemm,0.22928,0,rocBlas,<unused>;miopenConvolutionFwdAlgoWinograd:ConvBinWinogradRxS,1.15504,0,miopenConvolutionFwdAlgoWinograd,480x28x28x1x1x128x28x28x32xNCHWxFP16x0x0x1x1x1x1x1x1
512-28-28-1x1-256-28-28-32-0x0-1x1-1x1-0-NCHW-FP16-F=miopenConvolutionFwdAlgoImplicitGEMM:ConvHipImplicitGemmV4Fwd,0.79824,0,miopenConvolutionFwdAlgoImplicitGEMM,512x28x28x1x1x256x28x28x32xNCHWxFP16x0x0x1x1x1x1x1x1;miopenConvolutionFwdAlgoDirect:ConvAsm1x1U,0.688,0,miopenConvolutionFwdAlgoDirect,<unused>;miopenConvolutionFwdAlgoGEMM:gemm,0.45472,0,rocBlas,<unused>;miopenConvolutionFwdAlgoWinograd:ConvBinWinogradRxS,1.9616,0,miopenConvolutionFwdAlgoWinograd,512x28x28x1x1x256x28x28x32xNCHWxFP16x0x0x1x1x1x1x1x1
256-14-14-1x1-128-14-14-32-0x0-1x1-1x1-0-NCHW-FP16-F=miopenConvolutionFwdAlgoImplicitGEMM:ConvHipImplicitGemmV4Fwd,0.0576,0,miopenConvolutionFwdAlgoImplicitGEMM,256x14x14x1x1x128x14x14x32xNCHWxFP16x0x0x1x1x1x1x1x1;miopenConvolutionFwdAlgoDirect:ConvAsm1x1U,0.07968,0,miopenConvolutionFwdAlgoDirect,<unused>;miopenConvolutionFwdAlgoGEMM:gemm,0.21312,0,rocBlas,<unused>;miopenConvolutionFwdAlgoWinograd:ConvBinWinogradRxS,0.18752,0,miopenConvolutionFwdAlgoWinograd,256x14x14x1x1x128x14x14x32xNCHWxFP16x0x0x1x1x1x1x1x1
128-14-14-3x3-32-14-14-32-1x1-1x1-1x1-0-NCHW-FP16-F=miopenConvolutionFwdAlgoImplicitGEMM:ConvHipImplicitGemmV4R1Fwd,0.13808,0,miopenConvolutionFwdAlgoImplicitGEMM,128x14x14x3x3x32x14x14x32xNCHWxFP16x1x1x1x1x1x1x1x1;miopenConvolutionFwdAlgoDirect:ConvOclDirectFwd,0.2416,0,miopenConvolutionFwdAlgoDirect,<unused>;miopenConvolutionFwdAlgoGEMM:gemm,2.47808,451584,rocBlas,<unused>;miopenConvolutionFwdAlgoWinograd:ConvBinWinogradRxS,0.044,0,miopenConvolutionFwdAlgoWinograd,128x14x14x3x3x32x14x14x32xNCHWxFP16x1x1x1x1x1x1x1x1
288-14-14-1x1-128-14-14-32-0x0-1x1-1x1-0-NCHW-FP16-F=miopenConvolutionFwdAlgoImplicitGEMM:ConvHipImplicitGemmV4Fwd,0.0536,0,miopenConvolutionFwdAlgoImplicitGEMM,288x14x14x1x1x128x14x14x32xNCHWxFP16x0x0x1x1x1x1x1x1;miopenConvolutionFwdAlgoDirect:ConvAsm1x1U,0.10208,0,miopenConvolutionFwdAlgoDirect,<unused>;miopenConvolutionFwdAlgoGEMM:gemm,0.27488,0,rocBlas,<unused>;miopenConvolutionFwdAlgoWinograd:ConvBinWinogradRxS,0.23904,0,miopenConvolutionFwdAlgoWinograd,288x14x14x1x1x128x14x14x32xNCHWxFP16x0x0x1x1x1x1x1x1
320-14-14-1x1-128-14-14-32-0x0-1x1-1x1-0-NCHW-FP16-F=miopenConvolutionFwdAlgoImplicitGEMM:ConvHipImplicitGemmV4Fwd,0.0584,0,miopenConvolutionFwdAlgoImplicitGEMM,320x14x14x1x1x128x14x14x32xNCHWxFP16x0x0x1x1x1x1x1x1;miopenConvolutionFwdAlgoDirect:ConvAsm1x1U,0.1088,0,miopenConvolutionFwdAlgoDirect,<unused>;miopenConvolutionFwdAlgoGEMM:gemm,0.25792,0,rocBlas,<unused>;miopenConvolutionFwdAlgoWinograd:ConvBinWinogradRxS,0.26368,0,miopenConvolutionFwdAlgoWinograd,320x14x14x1x1x128x14x14x32xNCHWxFP16x0x0x1x1x1x1x1x1
352-14-14-1x1-128-14-14-32-0x0-1x1-1x1-0-NCHW-FP16-F=miopenConvolutionFwdAlgoImplicitGEMM:ConvHipImplicitGemmV4Fwd,0.06208,0,miopenConvolutionFwdAlgoImplicitGEMM,352x14x14x1x1x128x14x14x32xNCHWxFP16x0x0x1x1x1x1x1x1;miopenConvolutionFwdAlgoDirect:ConvAsm1x1U,0.13104,0,miopenConvolutionFwdAlgoDirect,<unused>;miopenConvolutionFwdAlgoGEMM:gemm,0.31728,0,rocBlas,<unused>;miopenConvolutionFwdAlgoWinograd:ConvBinWinogradRxS,0.29024,0,miopenConvolutionFwdAlgoWinograd,352x14x14x1x1x128x14x14x32xNCHWxFP16x0x0x1x1x1x1x1x1
384-14-14-1x1-128-14-14-32-0x0-1x1-1x1-0-NCHW-FP16-F=miopenConvolutionFwdAlgoImplicitGEMM:ConvHipImplicitGemmV4Fwd,0.07264,0,miopenConvolutionFwdAlgoImplicitGEMM,384x14x14x1x1x128x14x14x32xNCHWxFP16x0x0x1x1x1x1x1x1;miopenConvolutionFwdAlgoDirect:ConvAsm1x1U,0.12656,0,miopenConvolutionFwdAlgoDirect,<unused>;miopenConvolutionFwdAlgoGEMM:gemm,0.3,0,rocBlas,<unused>;miopenConvolutionFwdAlgoWinograd:ConvBinWinogradRxS,0.31856,0,miopenConvolutionFwdAlgoWinograd,384x14x14x1x1x128x14x14x32xNCHWxFP16x0x0x1x1x1x1x1x1
416-14-14-1x1-128-14-14-32-0x0-1x1-1x1-0-NCHW-FP16-F=miopenConvolutionFwdAlgoImplicitGEMM:ConvHipImplicitGemmV4Fwd,0.07152,0,miopenConvolutionFwdAlgoImplicitGEMM,416x14x14x1x1x128x14x14x32xNCHWxFP16x0x0x1x1x1x1x1x1;miopenConvolutionFwdAlgoDirect:ConvAsm1x1U,0.13952,0,miopenConvolutionFwdAlgoDirect,<unused>;miopenConvolutionFwdAlgoGEMM:gemm,0.3696,0,rocBlas,<unused>;miopenConvolutionFwdAlgoWinograd:ConvBinWinogradRxS,0.284,0,miopenConvolutionFwdAlgoWinograd,416x14x14x1x1x128x14x14x32xNCHWxFP16x0x0x1x1x1x1x1x1
448-14-14-1x1-128-14-14-32-0x0-1x1-1x1-0-NCHW-FP16-F=miopenConvolutionFwdAlgoImplicitGEMM:ConvHipImplicitGemmV4Fwd,0.07648,0,miopenConvolutionFwdAlgoImplicitGEMM,448x14x14x1x1x128x14x14x32xNCHWxFP16x0x0x1x1x1x1x1x1;miopenConvolutionFwdAlgoDirect:ConvAsm1x1U,0.14576,0,miopenConvolutionFwdAlgoDirect,<unused>;miopenConvolutionFwdAlgoGEMM:gemm,0.34208,0,rocBlas,<unused>;miopenConvolutionFwdAlgoWinograd:ConvBinWinogradRxS,0.32512,0,miopenConvolutionFwdAlgoWinograd,448x14x14x1x1x128x14x14x32xNCHWxFP16x0x0x1x1x1x1x1x1
480-14-14-1x1-128-14-14-32-0x0-1x1-1x1-0-NCHW-FP16-F=miopenConvolutionFwdAlgoImplicitGEMM:ConvHipImplicitGemmV4Fwd,0.08208,0,miopenConvolutionFwdAlgoImplicitGEMM,480x14x14x1x1x128x14x14x32xNCHWxFP16x0x0x1x1x1x1x1x1;miopenConvolutionFwdAlgoDirect:ConvAsm1x1U,0.15552,0,miopenConvolutionFwdAlgoDirect,<unused>;miopenConvolutionFwdAlgoGEMM:gemm,0.40272,0,rocBlas,<unused>;miopenConvolutionFwdAlgoWinograd:ConvBinWinogradRxS,0.3968,0,miopenConvolutionFwdAlgoWinograd,480x14x14x1x1x128x14x14x32xNCHWxFP16x0x0x1x1x1x1x1x1
512-14-14-1x1-128-14-14-32-0x0-1x1-1x1-0-NCHW-FP16-F=miopenConvolutionFwdAlgoImplicitGEMM:ConvHipImplicitGemmV4Fwd,0.11072,0,miopenConvolutionFwdAlgoImplicitGEMM,512x14x14x1x1x128x14x14x32xNCHWxFP16x0x0x1x1x1x1x1x1;miopenConvolutionFwdAlgoDirect:ConvAsm1x1U,0.1296,0,miopenConvolutionFwdAlgoDirect,<unused>;miopenConvolutionFwdAlgoGEMM:gemm,0.39984,0,rocBlas,<unused>;miopenConvolutionFwdAlgoWinograd:ConvBinWinogradRxS,0.42,0,miopenConvolutionFwdAlgoWinograd,512x14x14x1x1x128x14x14x32xNCHWxFP16x0x0x1x1x1x1x1x1
544-14-14-1x1-128-14-14-32-0x0-1x1-1x1-0-NCHW-FP16-F=miopenConvolutionFwdAlgoImplicitGEMM:ConvHipImplicitGemmV4Fwd,0.08848,0,miopenConvolutionFwdAlgoImplicitGEMM,544x14x14x1x1x128x14x14x32xNCHWxFP16x0x0x1x1x1x1x1x1;miopenConvolutionFwdAlgoDirect:ConvAsm1x1U,0.1752,0,miopenConvolutionFwdAlgoDirect,<unused>;miopenConvolutionFwdAlgoGEMM:gemm,0.4432,0,rocBlas,<unused>;miopenConvolutionFwdAlgoWinograd:ConvBinWinogradRxS,0.43888,0,miopenConvolutionFwdAlgoWinograd,544x14x14x1x1x128x14x14x32xNCHWxFP16x0x0x1x1x1x1x1x1
576-14-14-1x1-128-14-14-32-0x0-1x1-1x1-0-NCHW-FP16-F=miopenConvolutionFwdAlgoImplicitGEMM:ConvHipImplicitGemmV4Fwd,0.09392,0,miopenConvolutionFwdAlgoImplicitGEMM,576x14x14x1x1x128x14x14x32xNCHWxFP16x0x0x1x1x1x1x1x1;miopenConvolutionFwdAlgoDirect:ConvAsm1x1U,0.15024,0,miopenConvolutionFwdAlgoDirect,<unused>;miopenConvolutionFwdAlgoGEMM:gemm,0.42448,0,rocBlas,<unused>;miopenConvolutionFwdAlgoWinograd:ConvBinWinogradRxS,0.40848,0,miopenConvolutionFwdAlgoWinograd,576x14x14x1x1x128x14x14x32xNCHWxFP16x0x0x1x1x1x1x1x1
608-14-14-1x1-128-14-14-32-0x0-1x1-1x1-0-NCHW-FP16-F=miopenConvolutionFwdAlgoImplicitGEMM:ConvHipImplicitGemmV4Fwd,0.09968,0,miopenConvolutionFwdAlgoImplicitGEMM,608x14x14x1x1x128x14x14x32xNCHWxFP16x0x0x1x1x1x1x1x1;miopenConvolutionFwdAlgoDirect:ConvAsm1x1U,0.192,0,miopenConvolutionFwdAlgoDirect,<unused>;miopenConvolutionFwdAlgoGEMM:gemm,0.11248,0,rocBlas,<unused>;miopenConvolutionFwdAlgoWinograd:ConvBinWinogradRxS,0.40128,0,miopenConvolutionFwdAlgoWinograd,608x14x14x1x1x128x14x14x32xNCHWxFP16x0x0x1x1x1x1x1x1
640-14-14-1x1-128-14-14-32-0x0-1x1-1x1-0-NCHW-FP16-F=miopenConvolutionFwdAlgoImplicitGEMM:ConvHipImplicitGemmV4Fwd,0.11136,0,miopenConvolutionFwdAlgoImplicitGEMM,640x14x14x1x1x128x14x14x32xNCHWxFP16x0x0x1x1x1x1x1x1;miopenConvolutionFwdAlgoDirect:ConvAsm1x1U,0.17232,0,miopenConvolutionFwdAlgoDirect,<unused>;miopenConvolutionFwdAlgoGEMM:gemm,0.11808,0,rocBlas,<unused>;miopenConvolutionFwdAlgoWinograd:ConvBinWinogradRxS,0.42272,0,miopenConvolutionFwdAlgoWinograd,640x14x14x1x1x128x14x14x32xNCHWxFP16x0x0x1x1x1x1x1x1
672-14-14-1x1-128-14-14-32-0x0-1x1-1x1-0-NCHW-FP16-F=miopenConvolutionFwdAlgoImplicitGEMM:ConvHipImplicitGemmV4Fwd,0.10784,0,miopenConvolutionFwdAlgoImplicitGEMM,672x14x14x1x1x128x14x14x32xNCHWxFP16x0x0x1x1x1x1x1x1;miopenConvolutionFwdAlgoDirect:ConvAsm1x1U,0.2112,0,miopenConvolutionFwdAlgoDirect,<unused>;miopenConvolutionFwdAlgoGEMM:gemm,0.12336,0,rocBlas,<unused>;miopenConvolutionFwdAlgoWinograd:ConvBinWinogradRxS,0.44144,0,miopenConvolutionFwdAlgoWinograd,672x14x14x1x1x128x14x14x32xNCHWxFP16x0x0x1x1x1x1x1x1
704-14-14-1x1-128-14-14-32-0x0-1x1-1x1-0-NCHW-FP16-F=miopenConvolutionFwdAlgoImplicitGEMM:ConvHipImplicitGemmV4Fwd,0.11472,0,miopenConvolutionFwdAlgoImplicitGEMM,704x14x14x1x1x128x14x14x32xNCHWxFP16x0x0x1x1x1x1x1x1;miopenConvolutionFwdAlgoDirect:ConvAsm1x1U,0.22112,0,miopenConvolutionFwdAlgoDirect,<unused>;miopenConvolutionFwdAlgoGEMM:gemm,0.15296,0,rocBlas,<unused>;miopenConvolutionFwdAlgoWinograd:ConvBinWinogradRxS,0.46112,0,miopenConvolutionFwdAlgoWinograd,704x14x14x1x1x128x14x14x32xNCHWxFP16x0x0x1x1x1x1x1x1
736-14-14-1x1-128-14-14-32-0x0-1x1-1x1-0-NCHW-FP16-F=miopenConvolutionFwdAlgoImplicitGEMM:ConvHipImplicitGemmV4Fwd,0.11648,0,miopenConvolutionFwdAlgoImplicitGEMM,736x14x14x1x1x128x14x14x32xNCHWxFP16x0x0x1x1x1x1x1x1;miopenConvolutionFwdAlgoDirect:ConvAsm1x1U,0.19552,0,miopenConvolutionFwdAlgoDirect,<unused>;miopenConvolutionFwdAlgoGEMM:gemm,0.17888,0,rocBlas,<unused>;miopenConvolutionFwdAlgoWinograd:ConvBinWinogradRxS,0.48,0,miopenConvolutionFwdAlgoWinograd,736x14x14x1x1x128x14x14x32xNCHWxFP16x0x0x1x1x1x1x1x1
768-14-14-1x1-128-14-14-32-0x0-1x1-1x1-0-NCHW-FP16-F=miopenConvolutionFwdAlgoImplicitGEMM:ConvHipImplicitGemmV4Fwd,0.15392,0,miopenConvolutionFwdAlgoImplicitGEMM,768x14x14x1x1x128x14x14x32xNCHWxFP16x0x0x1x1x1x1x1x1;miopenConvolutionFwdAlgoDirect:ConvAsm1x1U,0.20352,0,miopenConvolutionFwdAlgoDirect,<unused>;miopenConvolutionFwdAlgoGEMM:gemm,0.16528,0,rocBlas,<unused>;miopenConvolutionFwdAlgoWinograd:ConvBinWinogradRxS,0.50352,0,miopenConvolutionFwdAlgoWinograd,768x14x14x1x1x128x14x14x32xNCHWxFP16x0x0x1x1x1x1x1x1
800-14-14-1x1-128-14-14-32-0x0-1x1-1x1-0-NCHW-FP16-F=miopenConvolutionFwdAlgoImplicitGEMM:ConvHipImplicitGemmV4Fwd,0.12464,0,miopenConvolutionFwdAlgoImplicitGEMM,800x14x14x1x1x128x14x14x32xNCHWxFP16x0x0x1x1x1x1x1x1;miopenConvolutionFwdAlgoDirect:ConvAsm1x1U,0.25104,0,miopenConvolutionFwdAlgoDirect,<unused>;miopenConvolutionFwdAlgoGEMM:gemm,0.17136,0,rocBlas,<unused>;miopenConvolutionFwdAlgoWinograd:ConvBinWinogradRxS,0.51984,0,miopenConvolutionFwdAlgoWinograd,800x14x14x1x1x128x14x14x32xNCHWxFP16x0x0x1x1x1x1x1x1
832-14-14-1x1-128-14-14-32-0x0-1x1-1x1-0-NCHW-FP16-F=miopenConvolutionFwdAlgoImplicitGEMM:ConvHipImplicitGemmV4Fwd,0.13264,0,miopenConvolutionFwdAlgoImplicitGEMM,832x14x14x1x1x128x14x14x32xNCHWxFP16x0x0x1x1x1x1x1x1;miopenConvolutionFwdAlgoDirect:ConvAsm1x1U,0.21872,0,miopenConvolutionFwdAlgoDirect,<unused>;miopenConvolutionFwdAlgoGEMM:gemm,0.1784,0,rocBlas,<unused>;miopenConvolutionFwdAlgoWinograd:ConvBinWinogradRxS,0.53952,0,miopenConvolutionFwdAlgoWinograd,832x14x14x1x1x128x14x14x32xNCHWxFP16x0x0x1x1x1x1x1x1
864-14-14-1x1-128-14-14-32-0x0-1x1-1x1-0-NCHW-FP16-F=miopenConvolutionFwdAlgoImplicitGEMM:ConvHipImplicitGemmV4Fwd,0.13424,0,miopenConvolutionFwdAlgoImplicitGEMM,864x14x14x1x1x128x14x14x32xNCHWxFP16x0x0x1x1x1x1x1x1;miopenConvolutionFwdAlgoDirect:ConvAsm1x1U,0.22896,0,miopenConvolutionFwdAlgoDirect,<unused>;miopenConvolutionFwdAlgoGEMM:gemm,0.18464,0,rocBlas,<unused>;miopenConvolutionFwdAlgoWinograd:ConvBinWinogradRxS,0.55856,0,miopenConvolutionFwdAlgoWinograd,864x14x14x1x1x128x14x14x32xNCHWxFP16x0x0x1x1x1x1x1x1
896-14-14-1x1-128-14-14-32-0x0-1x1-1x1-0-NCHW-FP16-F=miopenConvolutionFwdAlgoImplicitGEMM:ConvHipImplicitGemmV4Fwd,0.15168,0,miopenConvolutionFwdAlgoImplicitGEMM,896x14x14x1x1x128x14x14x32xNCHWxFP16x0x0x1x1x1x1x1x1;miopenConvolutionFwdAlgoDirect:ConvAsm1x1U,0.2336,0,miopenConvolutionFwdAlgoDirect,<unused>;miopenConvolutionFwdAlgoGEMM:gemm,0.1904,0,rocBlas,<unused>;miopenConvolutionFwdAlgoWinograd:ConvBinWinogradRxS,0.58032,0,miopenConvolutionFwdAlgoWinograd,896x14x14x1x1x128x14x14x32xNCHWxFP16x0x0x1x1x1x1x1x1
928-14-14-1x1-128-14-14-32-0x0-1x1-1x1-0-NCHW-FP16-F=miopenConvolutionFwdAlgoImplicitGEMM:ConvHipImplicitGemmV4Fwd,0.14416,0,miopenConvolutionFwdAlgoImplicitGEMM,928x14x14x1x1x128x14x14x32xNCHWxFP16x0x0x1x1x1x1x1x1;miopenConvolutionFwdAlgoDirect:ConvAsm1x1U,0.23472,0,miopenConvolutionFwdAlgoDirect,<unused>;miopenConvolutionFwdAlgoGEMM:gemm,0.19664,0,rocBlas,<unused>;miopenConvolutionFwdAlgoWinograd:ConvBinWinogradRxS,0.68048,0,miopenConvolutionFwdAlgoWinograd,928x14x14x1x1x128x14x14x32xNCHWxFP16x0x0x1x1x1x1x1x1
960-14-14-1x1-128-14-14-32-0x0-1x1-1x1-0-NCHW-FP16-F=miopenConvolutionFwdAlgoImplicitGEMM:ConvHipImplicitGemmV4Fwd,0.14992,0,miopenConvolutionFwdAlgoImplicitGEMM,960x14x14x1x1x128x14x14x32xNCHWxFP16x0x0x1x1x1x1x1x1;miopenConvolutionFwdAlgoDirect:ConvAsm1x1U,0.25104,0,miopenConvolutionFwdAlgoDirect,<unused>;miopenConvolutionFwdAlgoGEMM:gemm,0.21264,0,rocBlas,<unused>;miopenConvolutionFwdAlgoWinograd:ConvBinWinogradRxS,0.69296,0,miopenConvolutionFwdAlgoWinograd,960x14x14x1x1x128x14x14x32xNCHWxFP16x0x0x1x1x1x1x1x1
992-14-14-1x1-128-14-14-32-0x0-1x1-1x1-0-NCHW-FP16-F=miopenConvolutionFwdAlgoImplicitGEMM:ConvHipImplicitGemmV4Fwd,0.15344,0,miopenConvolutionFwdAlgoImplicitGEMM,992x14x14x1x1x128x14x14x32xNCHWxFP16x0x0x1x1x1x1x1x1;miopenConvolutionFwdAlgoDirect:ConvAsm1x1U,0.26512,0,miopenConvolutionFwdAlgoDirect,<unused>;miopenConvolutionFwdAlgoGEMM:gemm,0.20864,0,rocBlas,<unused>;miopenConvolutionFwdAlgoWinograd:ConvBinWinogradRxS,0.63696,0,miopenConvolutionFwdAlgoWinograd,992x14x14x1x1x128x14x14x32xNCHWxFP16x0x0x1x1x1x1x1x1
1024-14-14-1x1-512-14-14-32-0x0-1x1-1x1-0-NCHW-FP16-F=miopenConvolutionFwdAlgoImplicitGEMM:ConvHipImplicitGemmV4Fwd,0.67568,0,miopenConvolutionFwdAlgoImplicitGEMM,1024x14x14x1x1x512x14x14x32xNCHWxFP16x0x0x1x1x1x1x1x1;miopenConvolutionFwdAlgoDirect:ConvAsm1x1U,0.70816,0,miopenConvolutionFwdAlgoDirect,<unused>;miopenConvolutionFwdAlgoGEMM:gemm,0.59104,0,rocBlas,<unused>;miopenConvolutionFwdAlgoWinograd:ConvBinWinogradRxS,2.25248,0,miopenConvolutionFwdAlgoWinograd,1024x14x14x1x1x512x14x14x32xNCHWxFP16x0x0x1x1x1x1x1x1
512-7-7-1x1-128-7-7-32-0x0-1x1-1x1-0-NCHW-FP16-F=miopenConvolutionFwdAlgoImplicitGEMM:ConvHipImplicitGemmV4R1Fwd,0.05744,0,miopenConvolutionFwdAlgoImplicitGEMM,512x7x7x1x1x128x7x7x32xNCHWxFP16x0x0x1x1x1x1x1x1;miopenConvolutionFwdAlgoDirect:ConvAsm1x1U,0.05552,0,miopenConvolutionFwdAlgoDirect,<unused>;miopenConvolutionFwdAlgoGEMM:gemm,0.14352,0,rocBlas,<unused>;miopenConvolutionFwdAlgoWinograd:ConvBinWinogradRxS,0.19136,0,miopenConvolutionFwdAlgoWinograd,512x7x7x1x1x128x7x7x32xNCHWxFP16x0x0x1x1x1x1x1x1
128-7-7-3x3-32-7-7-32-1x1-1x1-1x1-0-NCHW-FP16-F=miopenConvolutionFwdAlgoImplicitGEMM:ConvHipImplicitGemmV4R1Fwd,0.11984,0,miopenConvolutionFwdAlgoImplicitGEMM,128x7x7x3x3x32x7x7x32xNCHWxFP16x1x1x1x1x1x1x1x1;miopenConvolutionFwdAlgoDirect:ConvOclDirectFwd,0.09472,0,miopenConvolutionFwdAlgoDirect,<unused>;miopenConvolutionFwdAlgoGEMM:gemm,6.35392,112896,rocBlas,<unused>;miopenConvolutionFwdAlgoWinograd:ConvBinWinogradRxS,0.04064,0,miopenConvolutionFwdAlgoWinograd,128x7x7x3x3x32x7x7x32xNCHWxFP16x1x1x1x1x1x1x1x1
544-7-7-1x1-128-7-7-32-0x0-1x1-1x1-0-NCHW-FP16-F=miopenConvolutionFwdAlgoImplicitGEMM:ConvHipImplicitGemmV4R1Fwd,0.0536,0,miopenConvolutionFwdAlgoImplicitGEMM,544x7x7x1x1x128x7x7x32xNCHWxFP16x0x0x1x1x1x1x1x1;miopenConvolutionFwdAlgoDirect:ConvAsm1x1U,0.0904,0,miopenConvolutionFwdAlgoDirect,<unused>;miopenConvolutionFwdAlgoGEMM:gemm,0.15056,0,rocBlas,<unused>;miopenConvolutionFwdAlgoWinograd:ConvBinWinogradRxS,0.20016,0,miopenConvolutionFwdAlgoWinograd,544x7x7x1x1x128x7x7x32xNCHWxFP16x0x0x1x1x1x1x1x1
576-7-7-1x1-128-7-7-32-0x0-1x1-1x1-0-NCHW-FP16-F=miopenConvolutionFwdAlgoImplicitGEMM:ConvHipImplicitGemmV4R1Fwd,0.0544,0,miopenConvolutionFwdAlgoImplicitGEMM,576x7x7x1x1x128x7x7x32xNCHWxFP16x0x0x1x1x1x1x1x1;miopenConvolutionFwdAlgoDirect:ConvAsm1x1U,0.06304,0,miopenConvolutionFwdAlgoDirect,<unused>;miopenConvolutionFwdAlgoGEMM:gemm,0.15536,0,rocBlas,<unused>;miopenConvolutionFwdAlgoWinograd:ConvBinWinogradRxS,0.208,0,miopenConvolutionFwdAlgoWinograd,576x7x7x1x1x128x7x7x32xNCHWxFP16x0x0x1x1x1x1x1x1
608-7-7-1x1-128-7-7-32-0x0-1x1-1x1-0-NCHW-FP16-F=miopenConvolutionFwdAlgoImplicitGEMM:ConvHipImplicitGemmV4R1Fwd,0.05568,0,miopenConvolutionFwdAlgoImplicitGEMM,608x7x7x1x1x128x7x7x32xNCHWxFP16x0x0x1x1x1x1x1x1;miopenConvolutionFwdAlgoDirect:ConvAsm1x1U,0.0656,0,miopenConvolutionFwdAlgoDirect,<unused>;miopenConvolutionFwdAlgoGEMM:gemm,0.16624,0,rocBlas,<unused>;miopenConvolutionFwdAlgoWinograd:ConvBinWinogradRxS,0.27136,0,miopenConvolutionFwdAlgoWinograd,608x7x7x1x1x128x7x7x32xNCHWxFP16x0x0x1x1x1x1x1x1
640-7-7-1x1-128-7-7-32-0x0-1x1-1x1-0-NCHW-FP16-F=miopenConvolutionFwdAlgoImplicitGEMM:ConvHipImplicitGemmV4R1Fwd,0.06096,0,miopenConvolutionFwdAlgoImplicitGEMM,640x7x7x1x1x128x7x7x32xNCHWxFP16x0x0x1x1x1x1x1x1;miopenConvolutionFwdAlgoDirect:ConvAsm1x1U,0.06032,0,miopenConvolutionFwdAlgoDirect,<unused>;miopenConvolutionFwdAlgoGEMM:gemm,0.17344,0,rocBlas,<unused>;miopenConvolutionFwdAlgoWinograd:ConvBinWinogradRxS,0.22848,0,miopenConvolutionFwdAlgoWinograd,640x7x7x1x1x128x7x7x32xNCHWxFP16x0x0x1x1x1x1x1x1
672-7-7-1x1-128-7-7-32-0x0-1x1-1x1-0-NCHW-FP16-F=miopenConvolutionFwdAlgoImplicitGEMM:ConvHipImplicitGemmV4R1Fwd,0.06096,0,miopenConvolutionFwdAlgoImplicitGEMM,672x7x7x1x1x128x7x7x32xNCHWxFP16x0x0x1x1x1x1x1x1;miopenConvolutionFwdAlgoDirect:ConvAsm1x1U,0.07136,0,miopenConvolutionFwdAlgoDirect,<unused>;miopenConvolutionFwdAlgoGEMM:gemm,0.19488,0,rocBlas,<unused>;miopenConvolutionFwdAlgoWinograd:ConvBinWinogradRxS,0.23984,0,miopenConvolutionFwdAlgoWinograd,672x7x7x1x1x128x7x7x32xNCHWxFP16x0x0x1x1x1x1x1x1
704-7-7-1x1-128-7-7-32-0x0-1x1-1x1-0-NCHW-FP16-F=miopenConvolutionFwdAlgoImplicitGEMM:ConvHipImplicitGemmV4R1Fwd,0.0632,0,miopenConvolutionFwdAlgoImplicitGEMM,704x7x7x1x1x128x7x7x32xNCHWxFP16x0x0x1x1x1x1x1x1;miopenConvolutionFwdAlgoDirect:ConvAsm1x1U,0.06736,0,miopenConvolutionFwdAlgoDirect,<unused>;miopenConvolutionFwdAlgoGEMM:gemm,0.18976,0,rocBlas,<unused>;miopenConvolutionFwdAlgoWinograd:ConvBinWinogradRxS,0.30992,0,miopenConvolutionFwdAlgoWinograd,704x7x7x1x1x128x7x7x32xNCHWxFP16x0x0x1x1x1x1x1x1
736-7-7-1x1-128-7-7-32-0x0-1x1-1x1-0-NCHW-FP16-F=miopenConvolutionFwdAlgoImplicitGEMM:ConvHipImplicitGemmV4R1Fwd,0.06528,0,miopenConvolutionFwdAlgoImplicitGEMM,736x7x7x1x1x128x7x7x32xNCHWxFP16x0x0x1x1x1x1x1x1;miopenConvolutionFwdAlgoDirect:ConvAsm1x1U,0.07728,0,miopenConvolutionFwdAlgoDirect,<unused>;miopenConvolutionFwdAlgoGEMM:gemm,0.19808,0,rocBlas,<unused>;miopenConvolutionFwdAlgoWinograd:ConvBinWinogradRxS,0.30768,0,miopenConvolutionFwdAlgoWinograd,736x7x7x1x1x128x7x7x32xNCHWxFP16x0x0x1x1x1x1x1x1
768-7-7-1x1-128-7-7-32-0x0-1x1-1x1-0-NCHW-FP16-F=miopenConvolutionFwdAlgoImplicitGEMM:ConvHipImplicitGemmV4R1Fwd,0.06496,0,miopenConvolutionFwdAlgoImplicitGEMM,768x7x7x1x1x128x7x7x32xNCHWxFP16x0x0x1x1x1x1x1x1;miopenConvolutionFwdAlgoDirect:ConvAsm1x1U,0.08128,0,miopenConvolutionFwdAlgoDirect,<unused>;miopenConvolutionFwdAlgoGEMM:gemm,0.20544,0,rocBlas,<unused>;miopenConvolutionFwdAlgoWinograd:ConvBinWinogradRxS,0.27056,0,miopenConvolutionFwdAlgoWinograd,768x7x7x1x1x128x7x7x32xNCHWxFP16x0x0x1x1x1x1x1x1
800-7-7-1x1-128-7-7-32-0x0-1x1-1x1-0-NCHW-FP16-F=miopenConvolutionFwdAlgoImplicitGEMM:ConvHipImplicitGemmV4R1Fwd,0.06992,0,miopenConvolutionFwdAlgoImplicitGEMM,800x7x7x1x1x128x7x7x32xNCHWxFP16x0x0x1x1x1x1x1x1;miopenConvolutionFwdAlgoDirect:ConvAsm1x1U,0.1256,0,miopenConvolutionFwdAlgoDirect,<unused>;miopenConvolutionFwdAlgoGEMM:gemm,0.20912,0,rocBlas,<unused>;miopenConvolutionFwdAlgoWinograd:ConvBinWinogradRxS,0.27984,0,miopenConvolutionFwdAlgoWinograd,800x7x7x1x1x128x7x7x32xNCHWxFP16x0x0x1x1x1x1x1x1
832-7-7-1x1-128-7-7-32-0x0-1x1-1x1-0-NCHW-FP16-F=miopenConvolutionFwdAlgoImplicitGEMM:ConvHipImplicitGemmV4R1Fwd,0.0704,0,miopenConvolutionFwdAlgoImplicitGEMM,832x7x7x1x1x128x7x7x32xNCHWxFP16x0x0x1x1x1x1x1x1;miopenConvolutionFwdAlgoDirect:ConvAsm1x1U,0.0768,0,miopenConvolutionFwdAlgoDirect,<unused>;miopenConvolutionFwdAlgoGEMM:gemm,0.21552,0,rocBlas,<unused>;miopenConvolutionFwdAlgoWinograd:ConvBinWinogradRxS,0.28736,0,miopenConvolutionFwdAlgoWinograd,832x7x7x1x1x128x7x7x32xNCHWxFP16x0x0x1x1x1x1x1x1
864-7-7-1x1-128-7-7-32-0x0-1x1-1x1-0-NCHW-FP16-F=miopenConvolutionFwdAlgoImplicitGEMM:ConvHipImplicitGemmV4R1Fwd,0.07488,0,miopenConvolutionFwdAlgoImplicitGEMM,864x7x7x1x1x128x7x7x32xNCHWxFP16x0x0x1x1x1x1x1x1;miopenConvolutionFwdAlgoDirect:ConvAsm1x1U,0.13152,0,miopenConvolutionFwdAlgoDirect,<unused>;miopenConvolutionFwdAlgoGEMM:gemm,0.22288,0,rocBlas,<unused>;miopenConvolutionFwdAlgoWinograd:ConvBinWinogradRxS,0.304,0,miopenConvolutionFwdAlgoWinograd,864x7x7x1x1x128x7x7x32xNCHWxFP16x0x0x1x1x1x1x1x1
896-7-7-1x1-128-7-7-32-0x0-1x1-1x1-0-NCHW-FP16-F=miopenConvolutionFwdAlgoImplicitGEMM:ConvHipImplicitGemmV4R1Fwd,0.07792,0,miopenConvolutionFwdAlgoImplicitGEMM,896x7x7x1x1x128x7x7x32xNCHWxFP16x0x0x1x1x1x1x1x1;miopenConvolutionFwdAlgoDirect:ConvAsm1x1U,0.136,0,miopenConvolutionFwdAlgoDirect,<unused>;miopenConvolutionFwdAlgoGEMM:gemm,0.2312,0,rocBlas,<unused>;miopenConvolutionFwdAlgoWinograd:ConvBinWinogradRxS,0.37888,0,miopenConvolutionFwdAlgoWinograd,896x7x7x1x1x128x7x7x32xNCHWxFP16x0x0x1x1x1x1x1x1
928-7-7-1x1-128-7-7-32-0x0-1x1-1x1-0-NCHW-FP16-F=miopenConvolutionFwdAlgoImplicitGEMM:ConvHipImplicitGemmV4R1Fwd,0.07472,0,miopenConvolutionFwdAlgoImplicitGEMM,928x7x7x1x1x128x7x7x32xNCHWxFP16x0x0x1x1x1x1x1x1;miopenConvolutionFwdAlgoDirect:ConvAsm1x1U,0.08528,0,miopenConvolutionFwdAlgoDirect,<unused>;miopenConvolutionFwdAlgoGEMM:gemm,0.23888,0,rocBlas,<unused>;miopenConvolutionFwdAlgoWinograd:ConvBinWinogradRxS,0.32256,0,miopenConvolutionFwdAlgoWinograd,928x7x7x1x1x128x7x7x32xNCHWxFP16x0x0x1x1x1x1x1x1
960-7-7-1x1-128-7-7-32-0x0-1x1-1x1-0-NCHW-FP16-F=miopenConvolutionFwdAlgoImplicitGEMM:ConvHipImplicitGemmV4R1Fwd,0.076,0,miopenConvolutionFwdAlgoImplicitGEMM,960x7x7x1x1x128x7x7x32xNCHWxFP16x0x0x1x1x1x1x1x1;miopenConvolutionFwdAlgoDirect:ConvAsm1x1U,0.14368,0,miopenConvolutionFwdAlgoDirect,<unused>;miopenConvolutionFwdAlgoGEMM:gemm,0.24784,0,rocBlas,<unused>;miopenConvolutionFwdAlgoWinograd:ConvBinWinogradRxS,0.35312,0,miopenConvolutionFwdAlgoWinograd,960x7x7x1x1x128x7x7x32xNCHWxFP16x0x0x1x1x1x1x1x1
992-7-7-1x1-128-7-7-32-0x0-1x1-1x1-0-NCHW-FP16-F=miopenConvolutionFwdAlgoImplicitGEMM:ConvHipImplicitGemmV4R1Fwd,0.08224,0,miopenConvolutionFwdAlgoImplicitGEMM,992x7x7x1x1x128x7x7x32xNCHWxFP16x0x0x1x1x1x1x1x1;miopenConvolutionFwdAlgoDirect:ConvAsm1x1U,0.1488,0,miopenConvolutionFwdAlgoDirect,<unused>;miopenConvolutionFwdAlgoGEMM:gemm,0.25472,0,rocBlas,<unused>;miopenConvolutionFwdAlgoWinograd:ConvBinWinogradRxS,0.42368,0,miopenConvolutionFwdAlgoWinograd,992x7x7x1x1x128x7x7x32xNCHWxFP16x0x0x1x1x1x1x1x1
3-299-299-3x3-32-149-149-32-0x0-2x2-1x1-0-NCHW-FP32-F=miopenConvolutionFwdAlgoDirect:ConvOclDirectFwd,0.73328,0,miopenConvolutionFwdAlgoDirect,<unused>;miopenConvolutionFwdAlgoGEMM:gemm,2.48832,2397708,rocBlas,<unused>;miopenConvolutionFwdAlgoWinograd:ConvBinWinogradRxSf2x3,0.59312,0,miopenConvolutionFwdAlgoWinograd,3x299x299x3x3x32x149x149x32xNCHWxFP32x0x0x2x2x1x1x1x1
32-149-149-3x3-32-147-147-32-0x0-1x1-1x1-0-NCHW-FP32-F=miopenConvolutionFwdAlgoImplicitGEMM:ConvHipImplicitGemmV4R1Fwd,1.78752,0,miopenConvolutionFwdAlgoImplicitGEMM,32x149x149x3x3x32x147x147x32xNCHWxFP32x0x0x1x1x1x1x1x1;miopenConvolutionFwdAlgoDirect:ConvOclDirectFwd,4.32911,0,miopenConvolutionFwdAlgoDirect,<unused>;miopenConvolutionFwdAlgoGEMM:gemm,7.424,24893568,rocBlas,<unused>;miopenConvolutionFwdAlgoWinograd:ConvBinWinogradRxSf2x3,0.818559,0,miopenConvolutionFwdAlgoWinograd,32x149x149x3x3x32x147x147x32xNCHWxFP32x0x0x1x1x1x1x1x1
32-147-147-3x3-64-147-147-32-1x1-1x1-1x1-0-NCHW-FP32-F=miopenConvolutionFwdAlgoWinograd:ConvBinWinograd3x3U,1.55456,0,miopenConvolutionFwdAlgoWinograd,32x147x147x3x3x64x147x147x32xNCHWxFP32x1x1x1x1x1x1x1x1
64-73-73-1x1-80-73-73-32-0x0-1x1-1x1-0-NCHW-FP32-F=miopenConvolutionFwdAlgoDirect:ConvOclDirectFwd1x1,0.38848,0,miopenConvolutionFwdAlgoDirect,<unused>;miopenConvolutionFwdAlgoGEMM:gemm,0.32848,0,rocBlas,<unused>;miopenConvolutionFwdAlgoWinograd:ConvBinWinogradRxSf3x2,0.57872,0,miopenConvolutionFwdAlgoWinograd,64x73x73x1x1x80x73x73x32xNCHWxFP32x0x0x1x1x1x1x1x1
80-73-73-3x3-192-71-71-32-0x0-1x1-1x1-0-NCHW-FP32-F=miopenConvolutionFwdAlgoImplicitGEMM:ConvHipImplicitGemmV4R1Fwd,5.00079,0,miopenConvolutionFwdAlgoImplicitGEMM,80x73x73x3x3x192x71x71x32xNCHWxFP32x0x0x1x1x1x1x1x1;miopenConvolutionFwdAlgoDirect:ConvOclDirectFwd,11.5462,0,miopenConvolutionFwdAlgoDirect,<unused>;miopenConvolutionFwdAlgoGEMM:gemm,7.30624,14518080,rocBlas,<unused>;miopenConvolutionFwdAlgoWinograd:ConvBinWinogradRxS,2.30304,0,miopenConvolutionFwdAlgoWinograd,80x73x73x3x3x192x71x71x32xNCHWxFP32x0x0x1x1x1x1x1x1
192-35-35-1x1-64-35-35-32-0x0-1x1-1x1-0-NCHW-FP32-F=miopenConvolutionFwdAlgoImplicitGEMM:ConvHipImplicitGemmV4R1Fwd,0.22416,0,miopenConvolutionFwdAlgoImplicitGEMM,192x35x35x1x1x64x35x35x32xNCHWxFP32x0x0x1x1x1x1x1x1;miopenConvolutionFwdAlgoDirect:ConvAsm1x1U,0.16672,0,miopenConvolutionFwdAlgoDirect,<unused>;miopenConvolutionFwdAlgoGEMM:gemm,0.1896,0,rocBlas,<unused>;miopenConvolutionFwdAlgoWinograd:ConvBinWinogradRxSf3x2,0.29744,0,miopenConvolutionFwdAlgoWinograd,192x35x35x1x1x64x35x35x32xNCHWxFP32x0x0x1x1x1x1x1x1
192-35-35-1x1-48-35-35-32-0x0-1x1-1x1-0-NCHW-FP32-F=miopenConvolutionFwdAlgoDirect:ConvOclDirectFwd1x1,0.15744,0,miopenConvolutionFwdAlgoDirect,<unused>;miopenConvolutionFwdAlgoGEMM:gemm,0.1432,0,rocBlas,<unused>;miopenConvolutionFwdAlgoWinograd:ConvBinWinogradRxSf3x2,0.24688,0,miopenConvolutionFwdAlgoWinograd,192x35x35x1x1x48x35x35x32xNCHWxFP32x0x0x1x1x1x1x1x1
48-35-35-5x5-64-35-35-32-2x2-1x1-1x1-0-NCHW-FP32-F=miopenConvolutionFwdAlgoImplicitGEMM:ConvHipImplicitGemmV4R1Fwd,0.78944,0,miopenConvolutionFwdAlgoImplicitGEMM,48x35x35x5x5x64x35x35x32xNCHWxFP32x2x2x1x1x1x1x1x1;miopenConvolutionFwdAlgoDirect:ConvOclDirectFwd,2.13616,0,miopenConvolutionFwdAlgoDirect,<unused>;miopenConvolutionFwdAlgoGEMM:gemm,2.432,5880000,rocBlas,<unused>;miopenConvolutionFwdAlgoWinograd:ConvBinWinogradRxSf2x3,0.4648,0,miopenConvolutionFwdAlgoWinograd,48x35x35x5x5x64x35x35x32xNCHWxFP32x2x2x1x1x1x1x1x1
64-35-35-3x3-96-35-35-32-1x1-1x1-1x1-0-NCHW-FP32-F=miopenConvolutionFwdAlgoWinograd:ConvBinWinogradRxSf2x3,0.27328,0,miopenConvolutionFwdAlgoWinograd,64x35x35x3x3x96x35x35x32xNCHWxFP32x1x1x1x1x1x1x1x1
96-35-35-3x3-96-35-35-32-1x1-1x1-1x1-0-NCHW-FP32-F=miopenConvolutionFwdAlgoWinograd:ConvBinWinograd3x3U,0.37648,0,miopenConvolutionFwdAlgoWinograd,96x35x35x3x3x96x35x35x32xNCHWxFP32x1x1x1x1x1x1x1x1
192-35-35-1x1-32-35-35-32-0x0-1x1-1x1-0-NCHW-FP32-F=miopenConvolutionFwdAlgoImplicitGEMM:ConvHipImplicitGemmV4R1Fwd,0.1896,0,miopenConvolutionFwdAlgoImplicitGEMM,192x35x35x1x1x32x35x35x32xNCHWxFP32x0x0x1x1x1x1x1x1;miopenConvolutionFwdAlgoDirect:ConvAsm1x1U,0.13648,0,miopenConvolutionFwdAlgoDirect,<unused>;miopenConvolutionFwdAlgoGEMM:gemm,0.1448,0,rocBlas,<unused>;miopenConvolutionFwdAlgoWinograd:ConvBinWinogradRxSf3x2,0.1552,0,miopenConvolutionFwdAlgoWinograd,192x35x35x1x1x32x35x35x32xNCHWxFP32x0x0x1x1x1x1x1x1
256-35-35-1x1-64-35-35-32-0x0-1x1-1x1-0-NCHW-FP32-F=miopenConvolutionFwdAlgoImplicitGEMM:ConvHipImplicitGemmV4R1Fwd,0.29152,0,miopenConvolutionFwdAlgoImplicitGEMM,256x35x35x1x1x64x35x35x32xNCHWxFP32x0x0x1x1x1x1x1x1;miopenConvolutionFwdAlgoDirect:ConvAsm1x1U,0.20864,0,miopenConvolutionFwdAlgoDirect,<unused>;miopenConvolutionFwdAlgoGEMM:gemm,0.22704,0,rocBlas,<unused>;miopenConvolutionFwdAlgoWinograd:ConvBinWinogradRxSf3x2,0.36768,0,miopenConvolutionFwdAlgoWinograd,256x35x35x1x1x64x35x35x32xNCHWxFP32x0x0x1x1x1x1x1x1
256-35-35-1x1-48-35-35-32-0x0-1x1-1x1-0-NCHW-FP32-F=miopenConvolutionFwdAlgoDirect:ConvAsm1x1U,0.18928,0,miopenConvolutionFwdAlgoDirect,<unused>;miopenConvolutionFwdAlgoGEMM:gemm,0.22224,0,rocBlas,<unused>;miopenConvolutionFwdAlgoWinograd:ConvBinWinogradRxSf3x2,0.36272,0,miopenConvolutionFwdAlgoWinograd,256x35x35x1x1x48x35x35x32xNCHWxFP32x0x0x1x1x1x1x1x1
288-35-35-1x1-64-35-35-32-0x0-1x1-1x1-0-NCHW-FP32-F=miopenConvolutionFwdAlgoImplicitGEMM:ConvHipImplicitGemmV4R1Fwd,0.26448,0,miopenConvolutionFwdAlgoImplicitGEMM,288x35x35x1x1x64x35x35x32xNCHWxFP32x0x0x1x1x1x1x1x1;miopenConvolutionFwdAlgoDirect:ConvAsm1x1U,0.24032,0,miopenConvolutionFwdAlgoDirect,<unused>;miopenConvolutionFwdAlgoGEMM:gemm,0.1768,0,rocBlas,<unused>;miopenConvolutionFwdAlgoWinograd:ConvBinWinogradRxSf3x2,0.34912,0,miopenConvolutionFwdAlgoWinograd,288x35x35x1x1x64x35x35x32xNCHWxFP32x0x0x1x1x1x1x1x1
288-35-35-1x1-48-35-35-32-0x0-1x1-1x1-0-NCHW-FP32-F=miopenConvolutionFwdAlgoDirect:ConvAsm1x1U,0.2176,0,miopenConvolutionFwdAlgoDirect,<unused>;miopenConvolutionFwdAlgoGEMM:gemm,0.18288,0,rocBlas,<unused>;miopenConvolutionFwdAlgoWinograd:ConvBinWinogradRxSf3x2,0.3448,0,miopenConvolutionFwdAlgoWinograd,288x35x35x1x1x48x35x35x32xNCHWxFP32x0x0x1x1x1x1x1x1
288-35-35-3x3-384-17-17-32-0x0-2x2-1x1-0-NCHW-FP32-F=miopenConvolutionFwdAlgoImplicitGEMM:ConvHipImplicitGemmV4R1Fwd,2.41328,0,miopenConvolutionFwdAlgoImplicitGEMM,288x35x35x3x3x384x17x17x32xNCHWxFP32x0x0x2x2x1x1x1x1;miopenConvolutionFwdAlgoDirect:ConvOclDirectFwd,48.5388,0,miopenConvolutionFwdAlgoDirect,<unused>;miopenConvolutionFwdAlgoGEMM:gemm,4.06528,2996352,rocBlas,<unused>;miopenConvolutionFwdAlgoWinograd:ConvBinWinogradRxSf2x3,4.12176,0,miopenConvolutionFwdAlgoWinograd,288x35x35x3x3x384x17x17x32xNCHWxFP32x0x0x2x2x1x1x1x1
96-35-35-3x3-96-17-17-32-0x0-2x2-1x1-0-NCHW-FP32-F=miopenConvolutionFwdAlgoImplicitGEMM:ConvHipImplicitGemmV4R1Fwd,0.28464,0,miopenConvolutionFwdAlgoImplicitGEMM,96x35x35x3x3x96x17x17x32xNCHWxFP32x0x0x2x2x1x1x1x1;miopenConvolutionFwdAlgoDirect:ConvOclDirectFwd,1.96112,0,miopenConvolutionFwdAlgoDirect,<unused>;miopenConvolutionFwdAlgoGEMM:gemm,1.47968,998784,rocBlas,<unused>;miopenConvolutionFwdAlgoWinograd:ConvBinWinogradRxSf2x3,0.4312,0,miopenConvolutionFwdAlgoWinograd,96x35x35x3x3x96x17x17x32xNCHWxFP32x0x0x2x2x1x1x1x1
768-17-17-1x1-192-17-17-32-0x0-1x1-1x1-0-NCHW-FP32-F=miopenConvolutionFwdAlgoImplicitGEMM:ConvHipImplicitGemmV4R1Fwd,0.63472,0,miopenConvolutionFwdAlgoImplicitGEMM,768x17x17x1x1x192x17x17x32xNCHWxFP32x0x0x1x1x1x1x1x1;miopenConvolutionFwdAlgoDirect:ConvOclDirectFwd1x1,0.45056,0,miopenConvolutionFwdAlgoDirect,<unused>;miopenConvolutionFwdAlgoGEMM:gemm,0.36256,0,rocBlas,<unused>;miopenConvolutionFwdAlgoWinograd:ConvBinWinogradRxSf3x2,0.68256,0,miopenConvolutionFwdAlgoWinograd,768x17x17x1x1x192x17x17x32xNCHWxFP32x0x0x1x1x1x1x1x1
768-17-17-1x1-128-17-17-32-0x0-1x1-1x1-0-NCHW-FP32-F=miopenConvolutionFwdAlgoImplicitGEMM:ConvHipImplicitGemmV4R1Fwd,0.41824,0,miopenConvolutionFwdAlgoImplicitGEMM,768x17x17x1x1x128x17x17x32xNCHWxFP32x0x0x1x1x1x1x1x1;miopenConvolutionFwdAlgoDirect:ConvAsm1x1U,0.29184,0,miopenConvolutionFwdAlgoDirect,<unused>;miopenConvolutionFwdAlgoGEMM:gemm,0.2512,0,rocBlas,<unused>;miopenConvolutionFwdAlgoWinograd:ConvBinWinogradRxSf3x2,0.51632,0,miopenConvolutionFwdAlgoWinograd,768x17x17x1x1x128x17x17x32xNCHWxFP32x0x0x1x1x1x1x1x1
128-17-17-1x7-128-17-17-32-0x3-1x1-1x1-0-NCHW-FP32-F=miopenConvolutionFwdAlgoImplicitGEMM:ConvHipImplicitGemmV4R1Fwd,0.3184,0,miopenConvolutionFwdAlgoImplicitGEMM,128x17x17x1x7x128x17x17x32xNCHWxFP32x0x3x1x1x1x1x1x1;miopenConvolutionFwdAlgoGEMM:gemm,1.50528,1035776,rocBlas,<unused>;miopenConvolutionFwdAlgoWinograd:ConvBinWinogradRxSf3x2,0.3592,0,miopenConvolutionFwdAlgoWinograd,128x17x17x1x7x128x17x17x32xNCHWxFP32x0x3x1x1x1x1x1x1
128-17-17-7x1-192-17-17-32-3x0-1x1-1x1-0-NCHW-FP32-F=miopenConvolutionFwdAlgoImplicitGEMM:ConvHipImplicitGemmV4R1Fwd,0.51872,0,miopenConvolutionFwdAlgoImplicitGEMM,128x17x17x7x1x192x17x17x32xNCHWxFP32x3x0x1x1x1x1x1x1;miopenConvolutionFwdAlgoGEMM:gemm,1.57696,1035776,rocBlas,<unused>;miopenConvolutionFwdAlgoWinograd:ConvBinWinogradRxSf3x2,0.47616,0,miopenConvolutionFwdAlgoWinograd,128x17x17x7x1x192x17x17x32xNCHWxFP32x3x0x1x1x1x1x1x1
128-17-17-7x1-128-17-17-32-3x0-1x1-1x1-0-NCHW-FP32-F=miopenConvolutionFwdAlgoImplicitGEMM:ConvHipImplicitGemmV4R1Fwd,0.35312,0,miopenConvolutionFwdAlgoImplicitGEMM,128x17x17x7x1x128x17x17x32xNCHWxFP32x3x0x1x1x1x1x1x1;miopenConvolutionFwdAlgoGEMM:gemm,1.46432,1035776,rocBlas,<unused>;miopenConvolutionFwdAlgoWinograd:ConvBinWinogradRxSf3x2,0.36224,0,miopenConvolutionFwdAlgoWinograd,128x17x17x7x1x128x17x17x32xNCHWxFP32x3x0x1x1x1x1x1x1
128-17-17-1x7-192-17-17-32-0x3-1x1-1x1-0-NCHW-FP32-F=miopenConvolutionFwdAlgoImplicitGEMM:ConvHipImplicitGemmV4R1Fwd,0.47952,0,miopenConvolutionFwdAlgoImplicitGEMM,128x17x17x1x7x192x17x17x32xNCHWxFP32x0x3x1x1x1x1x1x1;miopenConvolutionFwdAlgoGEMM:gemm,1.48992,1035776,rocBlas,<unused>;miopenConvolutionFwdAlgoWinograd:ConvBinWinogradRxSf3x2,0.47056,0,miopenConvolutionFwdAlgoWinograd,128x17x17x1x7x192x17x17x32xNCHWxFP32x0x3x1x1x1x1x1x1
768-17-17-1x1-160-17-17-32-0x0-1x1-1x1-0-NCHW-FP32-F=miopenConvolutionFwdAlgoImplicitGEMM:ConvHipImplicitGemmV4R1Fwd,1.0728,0,miopenConvolutionFwdAlgoImplicitGEMM,768x17x17x1x1x160x17x17x32xNCHWxFP32x0x0x1x1x1x1x1x1;miopenConvolutionFwdAlgoDirect:ConvAsm1x1U,0.3584,0,miopenConvolutionFwdAlgoDirect,<unused>;miopenConvolutionFwdAlgoGEMM:gemm,0.30144,0,rocBlas,<unused>;miopenConvolutionFwdAlgoWinograd:ConvBinWinogradRxSf3x2,0.51952,0,miopenConvolutionFwdAlgoWinograd,768x17x17x1x1x160x17x17x32xNCHWxFP32x0x0x1x1x1x1x1x1
160-17-17-1x7-160-17-17-32-0x3-1x1-1x1-0-NCHW-FP32-F=miopenConvolutionFwdAlgoImplicitGEMM:ConvHipImplicitGemmV4R1Fwd,0.48896,0,miopenConvolutionFwdAlgoImplicitGEMM,160x17x17x1x7x160x17x17x32xNCHWxFP32x0x3x1x1x1x1x1x1;miopenConvolutionFwdAlgoGEMM:gemm,1.64864,1294720,rocBlas,<unused>;miopenConvolutionFwdAlgoWinograd:ConvBinWinogradRxSf3x2,0.44096,0,miopenConvolutionFwdAlgoWinograd,160x17x17x1x7x160x17x17x32xNCHWxFP32x0x3x1x1x1x1x1x1
160-17-17-7x1-192-17-17-32-3x0-1x1-1x1-0-NCHW-FP32-F=miopenConvolutionFwdAlgoImplicitGEMM:ConvHipImplicitGemmV4R1Fwd,0.553279,0,miopenConvolutionFwdAlgoImplicitGEMM,160x17x17x7x1x192x17x17x32xNCHWxFP32x3x0x1x1x1x1x1x1;miopenConvolutionFwdAlgoGEMM:gemm,1.73568,1294720,rocBlas,<unused>;miopenConvolutionFwdAlgoWinograd:ConvBinWinogradRxSf3x2,0.581439,0,miopenConvolutionFwdAlgoWinograd,160x17x17x7x1x192x17x17x32xNCHWxFP32x3x0x1x1x1x1x1x1
160-17-17-7x1-160-17-17-32-3x0-1x1-1x1-0-NCHW-FP32-F=miopenConvolutionFwdAlgoImplicitGEMM:ConvHipImplicitGemmV4R1Fwd,0.559839,0,miopenConvolutionFwdAlgoImplicitGEMM,160x17x17x7x1x160x17x17x32xNCHWxFP32x3x0x1x1x1x1x1x1;miopenConvolutionFwdAlgoGEMM:gemm,1.67936,1294720,rocBlas,<unused>;miopenConvolutionFwdAlgoWinograd:ConvBinWinogradRxSf3x2,0.444639,0,miopenConvolutionFwdAlgoWinograd,160x17x17x7x1x160x17x17x32xNCHWxFP32x3x0x1x1x1x1x1x1
160-17-17-1x7-192-17-17-32-0x3-1x1-1x1-0-NCHW-FP32-F=miopenConvolutionFwdAlgoImplicitGEMM:ConvHipImplicitGemmV4R1Fwd,0.559199,0,miopenConvolutionFwdAlgoImplicitGEMM,160x17x17x1x7x192x17x17x32xNCHWxFP32x0x3x1x1x1x1x1x1;miopenConvolutionFwdAlgoGEMM:gemm,1.72032,1294720,rocBlas,<unused>;miopenConvolutionFwdAlgoWinograd:ConvBinWinogradRxSf3x2,0.576319,0,miopenConvolutionFwdAlgoWinograd,160x17x17x1x7x192x17x17x32xNCHWxFP32x0x3x1x1x1x1x1x1
192-17-17-1x7-192-17-17-32-0x3-1x1-1x1-0-NCHW-FP32-F=miopenConvolutionFwdAlgoImplicitGEMM:ConvHipImplicitGemmV4R1Fwd,0.730558,0,miopenConvolutionFwdAlgoImplicitGEMM,192x17x17x1x7x192x17x17x32xNCHWxFP32x0x3x1x1x1x1x1x1;miopenConvolutionFwdAlgoGEMM:gemm,1.8688,1553664,rocBlas,<unused>;miopenConvolutionFwdAlgoWinograd:ConvBinWinogradRxSf3x2,0.680639,0,miopenConvolutionFwdAlgoWinograd,192x17x17x1x7x192x17x17x32xNCHWxFP32x0x3x1x1x1x1x1x1
192-17-17-7x1-192-17-17-32-3x0-1x1-1x1-0-NCHW-FP32-F=miopenConvolutionFwdAlgoImplicitGEMM:ConvHipImplicitGemmV4R1Fwd,0.718878,0,miopenConvolutionFwdAlgoImplicitGEMM,192x17x17x7x1x192x17x17x32xNCHWxFP32x3x0x1x1x1x1x1x1;miopenConvolutionFwdAlgoGEMM:gemm,1.93024,1553664,rocBlas,<unused>;miopenConvolutionFwdAlgoWinograd:ConvBinWinogradRxSf3x2,0.685759,0,miopenConvolutionFwdAlgoWinograd,192x17x17x7x1x192x17x17x32xNCHWxFP32x3x0x1x1x1x1x1x1
192-17-17-3x3-320-8-8-32-0x0-2x2-1x1-0-NCHW-FP32-F=miopenConvolutionFwdAlgoImplicitGEMM:ConvHipImplicitGemmV4Fwd,0.331039,0,miopenConvolutionFwdAlgoImplicitGEMM,192x17x17x3x3x320x8x8x32xNCHWxFP32x0x0x2x2x1x1x1x1;miopenConvolutionFwdAlgoDirect:ConvOclDirectFwd,2.09167,0,miopenConvolutionFwdAlgoDirect,<unused>;miopenConvolutionFwdAlgoGEMM:gemm,1.8688,442368,rocBlas,<unused>;miopenConvolutionFwdAlgoWinograd:ConvBinWinogradRxSf2x3,0.504639,0,miopenConvolutionFwdAlgoWinograd,192x17x17x3x3x320x8x8x32xNCHWxFP32x0x0x2x2x1x1x1x1
192-17-17-3x3-192-8-8-32-0x0-2x2-1x1-0-NCHW-FP32-F=miopenConvolutionFwdAlgoImplicitGEMM:ConvHipImplicitGemmV4Fwd,0.335519,0,miopenConvolutionFwdAlgoImplicitGEMM,192x17x17x3x3x192x8x8x32xNCHWxFP32x0x0x2x2x1x1x1x1;miopenConvolutionFwdAlgoDirect:ConvOclDirectFwd,1.04688,0,miopenConvolutionFwdAlgoDirect,<unused>;miopenConvolutionFwdAlgoGEMM:gemm,1.85856,442368,rocBlas,<unused>;miopenConvolutionFwdAlgoWinograd:ConvBinWinogradRxSf2x3,0.343039,0,miopenConvolutionFwdAlgoWinograd,192x17x17x3x3x192x8x8x32xNCHWxFP32x0x0x2x2x1x1x1x1
1280-8-8-1x1-320-8-8-32-0x0-1x1-1x1-0-NCHW-FP32-F=miopenConvolutionFwdAlgoImplicitGEMM:ConvHipImplicitGemmV4_1x1,0.24592,0,miopenConvolutionFwdAlgoImplicitGEMM,1280x8x8x1x1x320x8x8x32xNCHWxFP32x0x0x1x1x1x1x1x1;miopenConvolutionFwdAlgoDirect:ConvAsm1x1U,0.27184,0,miopenConvolutionFwdAlgoDirect,<unused>;miopenConvolutionFwdAlgoGEMM:gemm,0.507359,0,rocBlas,<unused>;miopenConvolutionFwdAlgoWinograd:ConvBinWinogradRxSf3x2,0.566239,0,miopenConvolutionFwdAlgoWinograd,1280x8x8x1x1x320x8x8x32xNCHWxFP32x0x0x1x1x1x1x1x1
1280-8-8-1x1-384-8-8-32-0x0-1x1-1x1-0-NCHW-FP32-F=miopenConvolutionFwdAlgoImplicitGEMM:ConvHipImplicitGemmV4_1x1,0.31216,0,miopenConvolutionFwdAlgoImplicitGEMM,1280x8x8x1x1x384x8x8x32xNCHWxFP32x0x0x1x1x1x1x1x1;miopenConvolutionFwdAlgoDirect:ConvAsm1x1U,0.329759,0,miopenConvolutionFwdAlgoDirect,<unused>;miopenConvolutionFwdAlgoGEMM:gemm,0.616959,0,rocBlas,<unused>;miopenConvolutionFwdAlgoWinograd:ConvBinWinogradRxSf3x2,0.567999,0,miopenConvolutionFwdAlgoWinograd,1280x8x8x1x1x384x8x8x32xNCHWxFP32x0x0x1x1x1x1x1x1
384-8-8-1x3-384-8-8-32-0x1-1x1-1x1-0-NCHW-FP32-F=miopenConvolutionFwdAlgoImplicitGEMM:ConvHipImplicitGemmV4R1Fwd,0.27984,0,miopenConvolutionFwdAlgoImplicitGEMM,384x8x8x1x3x384x8x8x32xNCHWxFP32x0x1x1x1x1x1x1x1;miopenConvolutionFwdAlgoGEMM:gemm,1.70496,294912,rocBlas,<unused>;miopenConvolutionFwdAlgoWinograd:ConvBinWinogradRxSf2x3,0.3312,0,miopenConvolutionFwdAlgoWinograd,384x8x8x1x3x384x8x8x32xNCHWxFP32x0x1x1x1x1x1x1x1
384-8-8-3x1-384-8-8-32-1x0-1x1-1x1-0-NCHW-FP32-F=miopenConvolutionFwdAlgoImplicitGEMM:ConvHipImplicitGemmV4R1Fwd,0.284,0,miopenConvolutionFwdAlgoImplicitGEMM,384x8x8x3x1x384x8x8x32xNCHWxFP32x1x0x1x1x1x1x1x1;miopenConvolutionFwdAlgoGEMM:gemm,1.70496,294912,rocBlas,<unused>;miopenConvolutionFwdAlgoWinograd:ConvBinWinogradRxSf2x3,0.33168,0,miopenConvolutionFwdAlgoWinograd,384x8x8x3x1x384x8x8x32xNCHWxFP32x1x0x1x1x1x1x1x1
1280-8-8-1x1-448-8-8-32-0x0-1x1-1x1-0-NCHW-FP32-F=miopenConvolutionFwdAlgoImplicitGEMM:ConvHipImplicitGemmV4_1x1,0.31312,0,miopenConvolutionFwdAlgoImplicitGEMM,1280x8x8x1x1x448x8x8x32xNCHWxFP32x0x0x1x1x1x1x1x1;miopenConvolutionFwdAlgoDirect:ConvAsm1x1U,0.3536,0,miopenConvolutionFwdAlgoDirect,<unused>;miopenConvolutionFwdAlgoGEMM:gemm,0.6512,0,rocBlas,<unused>;miopenConvolutionFwdAlgoWinograd:ConvBinWinogradRxSf3x2,0.8312,0,miopenConvolutionFwdAlgoWinograd,1280x8x8x1x1x448x8x8x32xNCHWxFP32x0x0x1x1x1x1x1x1
448-8-8-3x3-384-8-8-32-1x1-1x1-1x1-0-NCHW-FP32-F=miopenConvolutionFwdAlgoWinograd:ConvBinWinogradRxSf2x3,0.3792,0,miopenConvolutionFwdAlgoWinograd,448x8x8x3x3x384x8x8x32xNCHWxFP32x1x1x1x1x1x1x1x1
1280-8-8-1x1-192-8-8-32-0x0-1x1-1x1-0-NCHW-FP32-F=miopenConvolutionFwdAlgoImplicitGEMM:ConvHipImplicitGemmV4_1x1,0.19088,0,miopenConvolutionFwdAlgoImplicitGEMM,1280x8x8x1x1x192x8x8x32xNCHWxFP32x0x0x1x1x1x1x1x1;miopenConvolutionFwdAlgoDirect:ConvAsm1x1U,0.20928,0,miopenConvolutionFwdAlgoDirect,<unused>;miopenConvolutionFwdAlgoGEMM:gemm,0.32528,0,rocBlas,<unused>;miopenConvolutionFwdAlgoWinograd:ConvBinWinogradRxSf3x2,0.31392,0,miopenConvolutionFwdAlgoWinograd,1280x8x8x1x1x192x8x8x32xNCHWxFP32x0x0x1x1x1x1x1x1
2048-8-8-1x1-320-8-8-32-0x0-1x1-1x1-0-NCHW-FP32-F=miopenConvolutionFwdAlgoImplicitGEMM:ConvHipImplicitGemmV4_1x1,0.52144,0,miopenConvolutionFwdAlgoImplicitGEMM,2048x8x8x1x1x320x8x8x32xNCHWxFP32x0x0x1x1x1x1x1x1;miopenConvolutionFwdAlgoDirect:ConvAsm1x1U,0.70576,0,miopenConvolutionFwdAlgoDirect,<unused>;miopenConvolutionFwdAlgoGEMM:gemm,0.67552,0,rocBlas,<unused>;miopenConvolutionFwdAlgoWinograd:ConvBinWinogradRxSf3x2,0.88208,0,miopenConvolutionFwdAlgoWinograd,2048x8x8x1x1x320x8x8x32xNCHWxFP32x0x0x1x1x1x1x1x1
2048-8-8-1x1-384-8-8-32-0x0-1x1-1x1-0-NCHW-FP32-F=miopenConvolutionFwdAlgoImplicitGEMM:ConvHipImplicitGemmV4_1x1,0.51808,0,miopenConvolutionFwdAlgoImplicitGEMM,2048x8x8x1x1x384x8x8x32xNCHWxFP32x0x0x1x1x1x1x1x1;miopenConvolutionFwdAlgoDirect:ConvAsm1x1U,0.59888,0,miopenConvolutionFwdAlgoDirect,<unused>;miopenConvolutionFwdAlgoGEMM:gemm,0.80384,0,rocBlas,<unused>;miopenConvolutionFwdAlgoWinograd:ConvBinWinogradRxSf3x2,0.88384,0,miopenConvolutionFwdAlgoWinograd,2048x8x8x1x1x384x8x8x32xNCHWxFP32x0x0x1x1x1x1x1x1
2048-8-8-1x1-448-8-8-32-0x0-1x1-1x1-0-NCHW-FP32-F=miopenConvolutionFwdAlgoImplicitGEMM:ConvHipImplicitGemmV4_1x1,0.55168,0,miopenConvolutionFwdAlgoImplicitGEMM,2048x8x8x1x1x448x8x8x32xNCHWxFP32x0x0x1x1x1x1x1x1;miopenConvolutionFwdAlgoDirect:ConvAsm1x1U,0.6072,0,miopenConvolutionFwdAlgoDirect,<unused>;miopenConvolutionFwdAlgoGEMM:gemm,0.934399,0,rocBlas,<unused>;miopenConvolutionFwdAlgoWinograd:ConvBinWinogradRxSf3x2,1.30672,0,miopenConvolutionFwdAlgoWinograd,2048x8x8x1x1x448x8x8x32xNCHWxFP32x0x0x1x1x1x1x1x1
2048-8-8-1x1-192-8-8-32-0x0-1x1-1x1-0-NCHW-FP32-F=miopenConvolutionFwdAlgoImplicitGEMM:ConvHipImplicitGemmV4_1x1,0.3272,0,miopenConvolutionFwdAlgoImplicitGEMM,2048x8x8x1x1x192x8x8x32xNCHWxFP32x0x0x1x1x1x1x1x1;miopenConvolutionFwdAlgoDirect:ConvAsm1x1U,0.40368,0,miopenConvolutionFwdAlgoDirect,<unused>;miopenConvolutionFwdAlgoGEMM:gemm,0.42272,0,rocBlas,<unused>;miopenConvolutionFwdAlgoWinograd:ConvBinWinogradRxSf3x2,0.45936,0,miopenConvolutionFwdAlgoWinograd,2048x8x8x1x1x192x8x8x32xNCHWxFP32x0x0x1x1x1x1x1x1
3-299-299-3x3-32-149-149-32-0x0-2x2-1x1-0-NCHW-FP16-F=miopenConvolutionFwdAlgoDirect:ConvOclDirectFwdGen,0.5216,0,miopenConvolutionFwdAlgoDirect,<unused>;miopenConvolutionFwdAlgoGEMM:gemm,2.52416,1198854,rocBlas,<unused>
32-149-149-3x3-32-147-147-32-0x0-1x1-1x1-0-NCHW-FP16-F=miopenConvolutionFwdAlgoImplicitGEMM:ConvHipImplicitGemmV4R1Fwd,1.33328,0,miopenConvolutionFwdAlgoImplicitGEMM,32x149x149x3x3x32x147x147x32xNCHWxFP16x0x0x1x1x1x1x1x1;miopenConvolutionFwdAlgoGEMM:gemm,8.71936,12446784,rocBlas,<unused>;miopenConvolutionFwdAlgoDirect:ConvOclDirectFwd,2.23504,0,miopenConvolutionFwdAlgoDirect,<unused>
32-147-147-3x3-64-147-147-32-1x1-1x1-1x1-0-NCHW-FP16-F=miopenConvolutionFwdAlgoImplicitGEMM:ConvHipImplicitGemmV4R1Fwd,2.45375,0,miopenConvolutionFwdAlgoImplicitGEMM,32x147x147x3x3x64x147x147x32xNCHWxFP16x1x1x1x1x1x1x1x1;miopenConvolutionFwdAlgoGEMM:gemm,8.22272,12446784,rocBlas,<unused>;miopenConvolutionFwdAlgoDirect:ConvOclDirectFwd,4.24095,0,miopenConvolutionFwdAlgoDirect,<unused>
64-73-73-1x1-80-73-73-32-0x0-1x1-1x1-0-NCHW-FP16-F=miopenConvolutionFwdAlgoDirect:ConvAsm1x1U,0.27744,0,miopenConvolutionFwdAlgoDirect,<unused>;miopenConvolutionFwdAlgoGEMM:gemm,0.642559,0,rocBlas,<unused>;miopenConvolutionFwdAlgoWinograd:ConvBinWinogradRxS,0.714399,0,miopenConvolutionFwdAlgoWinograd,64x73x73x1x1x80x73x73x32xNCHWxFP16x0x0x1x1x1x1x1x1
80-73-73-3x3-192-71-71-32-0x0-1x1-1x1-0-NCHW-FP16-F=miopenConvolutionFwdAlgoImplicitGEMM:ConvHipImplicitGemmV4R1Fwd,4.22575,0,miopenConvolutionFwdAlgoImplicitGEMM,80x73x73x3x3x192x71x71x32xNCHWxFP16x0x0x1x1x1x1x1x1;miopenConvolutionFwdAlgoDirect:ConvOclDirectFwd,8.60334,0,miopenConvolutionFwdAlgoDirect,<unused>;miopenConvolutionFwdAlgoGEMM:gemm,12.0781,7259040,rocBlas,<unused>;miopenConvolutionFwdAlgoWinograd:ConvBinWinogradRxS,1.46928,0,miopenConvolutionFwdAlgoWinograd,80x73x73x3x3x192x71x71x32xNCHWxFP16x0x0x1x1x1x1x1x1
192-35-35-1x1-64-35-35-32-0x0-1x1-1x1-0-NCHW-FP16-F=miopenConvolutionFwdAlgoImplicitGEMM:ConvHipImplicitGemmV4R1Fwd,0.16064,0,miopenConvolutionFwdAlgoImplicitGEMM,192x35x35x1x1x64x35x35x32xNCHWxFP16x0x0x1x1x1x1x1x1;miopenConvolutionFwdAlgoDirect:ConvAsm1x1U,0.14752,0,miopenConvolutionFwdAlgoDirect,<unused>;miopenConvolutionFwdAlgoGEMM:gemm,0.24144,0,rocBlas,<unused>;miopenConvolutionFwdAlgoWinograd:ConvBinWinogradRxS,0.30512,0,miopenConvolutionFwdAlgoWinograd,192x35x35x1x1x64x35x35x32xNCHWxFP16x0x0x1x1x1x1x1x1
192-35-35-1x1-48-35-35-32-0x0-1x1-1x1-0-NCHW-FP16-F=miopenConvolutionFwdAlgoDirect:ConvAsm1x1U,0.11952,0,miopenConvolutionFwdAlgoDirect,<unused>;miopenConvolutionFwdAlgoGEMM:gemm,0.2264,0,rocBlas,<unused>;miopenConvolutionFwdAlgoWinograd:ConvBinWinogradRxS,0.35408,0,miopenConvolutionFwdAlgoWinograd,192x35x35x1x1x48x35x35x32xNCHWxFP16x0x0x1x1x1x1x1x1
48-35-35-5x5-64-35-35-32-2x2-1x1-1x1-0-NCHW-FP16-F=miopenConvolutionFwdAlgoImplicitGEMM:ConvHipImplicitGemmV4R1Fwd,0.599679,0,miopenConvolutionFwdAlgoImplicitGEMM,48x35x35x5x5x64x35x35x32xNCHWxFP16x2x2x1x1x1x1x1x1;miopenConvolutionFwdAlgoDirect:ConvOclDirectFwd,1.70192,0,miopenConvolutionFwdAlgoDirect,<unused>;miopenConvolutionFwdAlgoGEMM:gemm,8.53504,2940000,rocBlas,<unused>;miopenConvolutionFwdAlgoWinograd:ConvBinWinogradRxS,0.31152,0,miopenConvolutionFwdAlgoWinograd,48x35x35x5x5x64x35x35x32xNCHWxFP16x2x2x1x1x1x1x1x1
64-35-35-3x3-96-35-35-32-1x1-1x1-1x1-0-NCHW-FP16-F=miopenConvolutionFwdAlgoImplicitGEMM:ConvHipImplicitGemmV4R1Fwd,0.44976,0,miopenConvolutionFwdAlgoImplicitGEMM,64x35x35x3x3x96x35x35x32xNCHWxFP16x1x1x1x1x1x1x1x1;miopenConvolutionFwdAlgoDirect:ConvOclDirectFwd,1.70656,0,miopenConvolutionFwdAlgoDirect,<unused>;miopenConvolutionFwdAlgoGEMM:gemm,4.9152,1411200,rocBlas,<unused>;miopenConvolutionFwdAlgoWinograd:ConvBinWinogradRxS,0.21104,0,miopenConvolutionFwdAlgoWinograd,64x35x35x3x3x96x35x35x32xNCHWxFP16x1x1x1x1x1x1x1x1
96-35-35-3x3-96-35-35-32-1x1-1x1-1x1-0-NCHW-FP16-F=miopenConvolutionFwdAlgoImplicitGEMM:ConvHipImplicitGemmV4R1Fwd,0.664959,0,miopenConvolutionFwdAlgoImplicitGEMM,96x35x35x3x3x96x35x35x32xNCHWxFP16x1x1x1x1x1x1x1x1;miopenConvolutionFwdAlgoDirect:ConvOclDirectFwd,2.55808,0,miopenConvolutionFwdAlgoDirect,<unused>;miopenConvolutionFwdAlgoGEMM:gemm,6.2464,2116800,rocBlas,<unused>;miopenConvolutionFwdAlgoWinograd:ConvBinWinogradRxS,0.25088,0,miopenConvolutionFwdAlgoWinograd,96x35x35x3x3x96x35x35x32xNCHWxFP16x1x1x1x1x1x1x1x1
192-35-35-1x1-32-35-35-32-0x0-1x1-1x1-0-NCHW-FP16-F=miopenConvolutionFwdAlgoImplicitGEMM:ConvHipImplicitGemmV4R1Fwd,0.0976,0,miopenConvolutionFwdAlgoImplicitGEMM,192x35x35x1x1x32x35x35x32xNCHWxFP16x0x0x1x1x1x1x1x1;miopenConvolutionFwdAlgoDirect:ConvAsm1x1U,0.07776,0,miopenConvolutionFwdAlgoDirect,<unused>;miopenConvolutionFwdAlgoGEMM:gemm,0.22288,0,rocBlas,<unused>;miopenConvolutionFwdAlgoWinograd:ConvBinWinogradRxS,0.18224,0,miopenConvolutionFwdAlgoWinograd,192x35x35x1x1x32x35x35x32xNCHWxFP16x0x0x1x1x1x1x1x1
256-35-35-1x1-64-35-35-32-0x0-1x1-1x1-0-NCHW-FP16-F=miopenConvolutionFwdAlgoImplicitGEMM:ConvHipImplicitGemmV4R1Fwd,0.26128,0,miopenConvolutionFwdAlgoImplicitGEMM,256x35x35x1x1x64x35x35x32xNCHWxFP16x0x0x1x1x1x1x1x1;miopenConvolutionFwdAlgoDirect:ConvAsm1x1U,0.17664,0,miopenConvolutionFwdAlgoDirect,<unused>;miopenConvolutionFwdAlgoGEMM:gemm,0.30784,0,rocBlas,<unused>;miopenConvolutionFwdAlgoWinograd:ConvBinWinogradRxS,0.39488,0,miopenConvolutionFwdAlgoWinograd,256x35x35x1x1x64x35x35x32xNCHWxFP16x0x0x1x1x1x1x1x1
256-35-35-1x1-48-35-35-32-0x0-1x1-1x1-0-NCHW-FP16-F=miopenConvolutionFwdAlgoDirect:ConvAsm1x1U,0.15232,0,miopenConvolutionFwdAlgoDirect,<unused>;miopenConvolutionFwdAlgoGEMM:gemm,0.28976,0,rocBlas,<unused>;miopenConvolutionFwdAlgoWinograd:ConvBinWinogradRxS,0.39216,0,miopenConvolutionFwdAlgoWinograd,256x35x35x1x1x48x35x35x32xNCHWxFP16x0x0x1x1x1x1x1x1
288-35-35-1x1-64-35-35-32-0x0-1x1-1x1-0-NCHW-FP16-F=miopenConvolutionFwdAlgoImplicitGEMM:ConvHipImplicitGemmV4R1Fwd,0.2176,0,miopenConvolutionFwdAlgoImplicitGEMM,288x35x35x1x1x64x35x35x32xNCHWxFP16x0x0x1x1x1x1x1x1;miopenConvolutionFwdAlgoDirect:ConvAsm1x1U,0.19392,0,miopenConvolutionFwdAlgoDirect,<unused>;miopenConvolutionFwdAlgoGEMM:gemm,0.32672,0,rocBlas,<unused>;miopenConvolutionFwdAlgoWinograd:ConvBinWinogradRxS,0.51216,0,miopenConvolutionFwdAlgoWinograd,288x35x35x1x1x64x35x35x32xNCHWxFP16x0x0x1x1x1x1x1x1
288-35-35-1x1-48-35-35-32-0x0-1x1-1x1-0-NCHW-FP16-F=miopenConvolutionFwdAlgoDirect:ConvAsm1x1U,0.14672,0,miopenConvolutionFwdAlgoDirect,<unused>;miopenConvolutionFwdAlgoGEMM:gemm,0.32272,0,rocBlas,<unused>;miopenConvolutionFwdAlgoWinograd:ConvBinWinogradRxS,0.43456,0,miopenConvolutionFwdAlgoWinograd,288x35x35x1x1x48x35x35x32xNCHWxFP16x0x0x1x1x1x1x1x1
288-35-35-3x3-384-17-17-32-0x0-2x2-1x1-0-NCHW-FP16-F=miopenConvolutionFwdAlgoImplicitGEMM:ConvHipImplicitGemmV4R1Fwd,1.77648,0,miopenConvolutionFwdAlgoImplicitGEMM,288x35x35x3x3x384x17x17x32xNCHWxFP16x0x0x2x2x1x1x1x1;miopenConvolutionFwdAlgoDirect:ConvOclDirectFwdGen,12.051,0,miopenConvolutionFwdAlgoDirect,<unused>;miopenConvolutionFwdAlgoGEMM:gemm,15.3037,1498176,rocBlas,<unused>;miopenConvolutionFwdAlgoWinograd:ConvBinWinogradRxS,3.16368,0,miopenConvolutionFwdAlgoWinograd,288x35x35x3x3x384x17x17x32xNCHWxFP16x0x0x2x2x1x1x1x1
96-35-35-3x3-96-17-17-32-0x0-2x2-1x1-0-NCHW-FP16-F=miopenConvolutionFwdAlgoImplicitGEMM:ConvHipImplicitGemmV4R1Fwd,0.20512,0,miopenConvolutionFwdAlgoImplicitGEMM,96x35x35x3x3x96x17x17x32xNCHWxFP16x0x0x2x2x1x1x1x1;miopenConvolutionFwdAlgoDirect:ConvOclDirectFwdGen,1.1264,0,miopenConvolutionFwdAlgoDirect,<unused>;miopenConvolutionFwdAlgoGEMM:gemm,5.89824,499392,rocBlas,<unused>;miopenConvolutionFwdAlgoWinograd:ConvBinWinogradRxS,0.33104,0,miopenConvolutionFwdAlgoWinograd,96x35x35x3x3x96x17x17x32xNCHWxFP16x0x0x2x2x1x1x1x1
768-17-17-1x1-192-17-17-32-0x0-1x1-1x1-0-NCHW-FP16-F=miopenConvolutionFwdAlgoImplicitGEMM:ConvHipImplicitGemmV4R1Fwd,0.324,0,miopenConvolutionFwdAlgoImplicitGEMM,768x17x17x1x1x192x17x17x32xNCHWxFP16x0x0x1x1x1x1x1x1;miopenConvolutionFwdAlgoDirect:ConvAsm1x1U,0.34688,0,miopenConvolutionFwdAlgoDirect,<unused>;miopenConvolutionFwdAlgoGEMM:gemm,0.726719,0,rocBlas,<unused>;miopenConvolutionFwdAlgoWinograd:ConvBinWinogradRxS,1.0408,0,miopenConvolutionFwdAlgoWinograd,768x17x17x1x1x192x17x17x32xNCHWxFP16x0x0x1x1x1x1x1x1
768-17-17-1x1-128-17-17-32-0x0-1x1-1x1-0-NCHW-FP16-F=miopenConvolutionFwdAlgoImplicitGEMM:ConvHipImplicitGemmV4R1Fwd,0.2152,0,miopenConvolutionFwdAlgoImplicitGEMM,768x17x17x1x1x128x17x17x32xNCHWxFP16x0x0x1x1x1x1x1x1;miopenConvolutionFwdAlgoDirect:ConvAsm1x1U,0.25216,0,miopenConvolutionFwdAlgoDirect,<unused>;miopenConvolutionFwdAlgoGEMM:gemm,0.55264,0,rocBlas,<unused>;miopenConvolutionFwdAlgoWinograd:ConvBinWinogradRxS,0.699359,0,miopenConvolutionFwdAlgoWinograd,768x17x17x1x1x128x17x17x32xNCHWxFP16x0x0x1x1x1x1x1x1
128-17-17-1x7-128-17-17-32-0x3-1x1-1x1-0-NCHW-FP16-F=miopenConvolutionFwdAlgoImplicitGEMM:ConvHipImplicitGemmV4R1Fwd,0.24528,0,miopenConvolutionFwdAlgoImplicitGEMM,128x17x17x1x7x128x17x17x32xNCHWxFP16x0x3x1x1x1x1x1x1;miopenConvolutionFwdAlgoGEMM:gemm,6.02112,517888,rocBlas,<unused>;miopenConvolutionFwdAlgoWinograd:ConvBinWinogradRxS,0.4504,0,miopenConvolutionFwdAlgoWinograd,128x17x17x1x7x128x17x17x32xNCHWxFP16x0x3x1x1x1x1x1x1
128-17-17-7x1-192-17-17-32-3x0-1x1-1x1-0-NCHW-FP16-F=miopenConvolutionFwdAlgoImplicitGEMM:ConvHipImplicitGemmV4R1Fwd,0.37888,0,miopenConvolutionFwdAlgoImplicitGEMM,128x17x17x7x1x192x17x17x32xNCHWxFP16x3x0x1x1x1x1x1x1;miopenConvolutionFwdAlgoGEMM:gemm,5.56544,517888,rocBlas,<unused>;miopenConvolutionFwdAlgoWinograd:ConvBinWinogradRxS,0.56576,0,miopenConvolutionFwdAlgoWinograd,128x17x17x7x1x192x17x17x32xNCHWxFP16x3x0x1x1x1x1x1x1
128-17-17-7x1-128-17-17-32-3x0-1x1-1x1-0-NCHW-FP16-F=miopenConvolutionFwdAlgoImplicitGEMM:ConvHipImplicitGemmV4R1Fwd,0.2824,0,miopenConvolutionFwdAlgoImplicitGEMM,128x17x17x7x1x128x17x17x32xNCHWxFP16x3x0x1x1x1x1x1x1;miopenConvolutionFwdAlgoGEMM:gemm,6.02112,517888,rocBlas,<unused>;miopenConvolutionFwdAlgoWinograd:ConvBinWinogradRxS,0.38576,0,miopenConvolutionFwdAlgoWinograd,128x17x17x7x1x128x17x17x32xNCHWxFP16x3x0x1x1x1x1x1x1
128-17-17-1x7-192-17-17-32-0x3-1x1-1x1-0-NCHW-FP16-F=miopenConvolutionFwdAlgoImplicitGEMM:ConvHipImplicitGemmV4R1Fwd,0.33616,0,miopenConvolutionFwdAlgoImplicitGEMM,128x17x17x1x7x192x17x17x32xNCHWxFP16x0x3x1x1x1x1x1x1;miopenConvolutionFwdAlgoGEMM:gemm,5.55008,517888,rocBlas,<unused>;miopenConvolutionFwdAlgoWinograd:ConvBinWinogradRxS,0.6616,0,miopenConvolutionFwdAlgoWinograd,128x17x17x1x7x192x17x17x32xNCHWxFP16x0x3x1x1x1x1x1x1
768-17-17-1x1-160-17-17-32-0x0-1x1-1x1-0-NCHW-FP16-F=miopenConvolutionFwdAlgoImplicitGEMM:ConvHipImplicitGemmV4R1Fwd,0.51104,0,miopenConvolutionFwdAlgoImplicitGEMM,768x17x17x1x1x160x17x17x32xNCHWxFP16x0x0x1x1x1x1x1x1;miopenConvolutionFwdAlgoDirect:ConvAsm1x1U,0.30064,0,miopenConvolutionFwdAlgoDirect,<unused>;miopenConvolutionFwdAlgoGEMM:gemm,0.725599,0,rocBlas,<unused>;miopenConvolutionFwdAlgoWinograd:ConvBinWinogradRxS,0.810719,0,miopenConvolutionFwdAlgoWinograd,768x17x17x1x1x160x17x17x32xNCHWxFP16x0x0x1x1x1x1x1x1
160-17-17-1x7-160-17-17-32-0x3-1x1-1x1-0-NCHW-FP16-F=miopenConvolutionFwdAlgoImplicitGEMM:ConvHipImplicitGemmV4R1Fwd,0.37568,0,miopenConvolutionFwdAlgoImplicitGEMM,160x17x17x1x7x160x17x17x32xNCHWxFP16x0x3x1x1x1x1x1x1;miopenConvolutionFwdAlgoGEMM:gemm,7.19872,647360,rocBlas,<unused>;miopenConvolutionFwdAlgoWinograd:ConvBinWinogradRxS,0.63392,0,miopenConvolutionFwdAlgoWinograd,160x17x17x1x7x160x17x17x32xNCHWxFP16x0x3x1x1x1x1x1x1
160-17-17-7x1-192-17-17-32-3x0-1x1-1x1-0-NCHW-FP16-F=miopenConvolutionFwdAlgoImplicitGEMM:ConvHipImplicitGemmV4R1Fwd,0.40208,0,miopenConvolutionFwdAlgoImplicitGEMM,160x17x17x7x1x192x17x17x32xNCHWxFP16x3x0x1x1x1x1x1x1;miopenConvolutionFwdAlgoGEMM:gemm,6.71744,647360,rocBlas,<unused>;miopenConvolutionFwdAlgoWinograd:ConvBinWinogradRxS,0.69088,0,miopenConvolutionFwdAlgoWinograd,160x17x17x7x1x192x17x17x32xNCHWxFP16x3x0x1x1x1x1x1x1
160-17-17-7x1-160-17-17-32-3x0-1x1-1x1-0-NCHW-FP16-F=miopenConvolutionFwdAlgoImplicitGEMM:ConvHipImplicitGemmV4R1Fwd,0.40208,0,miopenConvolutionFwdAlgoImplicitGEMM,160x17x17x7x1x160x17x17x32xNCHWxFP16x3x0x1x1x1x1x1x1;miopenConvolutionFwdAlgoGEMM:gemm,7.15776,647360,rocBlas,<unused>;miopenConvolutionFwdAlgoWinograd:ConvBinWinogradRxS,0.54224,0,miopenConvolutionFwdAlgoWinograd,160x17x17x7x1x160x17x17x32xNCHWxFP16x3x0x1x1x1x1x1x1
160-17-17-1x7-192-17-17-32-0x3-1x1-1x1-0-NCHW-FP16-F=miopenConvolutionFwdAlgoImplicitGEMM:ConvHipImplicitGemmV4R1Fwd,0.40304,0,miopenConvolutionFwdAlgoImplicitGEMM,160x17x17x1x7x192x17x17x32xNCHWxFP16x0x3x1x1x1x1x1x1;miopenConvolutionFwdAlgoGEMM:gemm,6.71744,647360,rocBlas,<unused>;miopenConvolutionFwdAlgoWinograd:ConvBinWinogradRxS,0.814239,0,miopenConvolutionFwdAlgoWinograd,160x17x17x1x7x192x17x17x32xNCHWxFP16x0x3x1x1x1x1x1x1
192-17-17-1x7-192-17-17-32-0x3-1x1-1x1-0-NCHW-FP16-F=miopenConvolutionFwdAlgoImplicitGEMM:ConvHipImplicitGemmV4R1Fwd,0.48064,0,miopenConvolutionFwdAlgoImplicitGEMM,192x17x17x1x7x192x17x17x32xNCHWxFP16x0x3x1x1x1x1x1x1;miopenConvolutionFwdAlgoGEMM:gemm,7.90016,776832,rocBlas,<unused>;miopenConvolutionFwdAlgoWinograd:ConvBinWinogradRxS,0.968639,0,miopenConvolutionFwdAlgoWinograd,192x17x17x1x7x192x17x17x32xNCHWxFP16x0x3x1x1x1x1x1x1
192-17-17-7x1-192-17-17-32-3x0-1x1-1x1-0-NCHW-FP16-F=miopenConvolutionFwdAlgoImplicitGEMM:ConvHipImplicitGemmV4R1Fwd,0.47856,0,miopenConvolutionFwdAlgoImplicitGEMM,192x17x17x7x1x192x17x17x32xNCHWxFP16x3x0x1x1x1x1x1x1;miopenConvolutionFwdAlgoGEMM:gemm,7.87968,776832,rocBlas,<unused>;miopenConvolutionFwdAlgoWinograd:ConvBinWinogradRxS,0.823199,0,miopenConvolutionFwdAlgoWinograd,192x17x17x7x1x192x17x17x32xNCHWxFP16x3x0x1x1x1x1x1x1
192-17-17-3x3-320-8-8-32-0x0-2x2-1x1-0-NCHW-FP16-F=miopenConvolutionFwdAlgoImplicitGEMM:ConvHipImplicitGemmV4Fwd,0.22224,0,miopenConvolutionFwdAlgoImplicitGEMM,192x17x17x3x3x320x8x8x32xNCHWxFP16x0x0x2x2x1x1x1x1;miopenConvolutionFwdAlgoDirect:ConvOclDirectFwdGen,1.85792,0,miopenConvolutionFwdAlgoDirect,<unused>;miopenConvolutionFwdAlgoGEMM:gemm,2.87744,221184,rocBlas,<unused>;miopenConvolutionFwdAlgoWinograd:ConvBinWinogradRxS,0.42704,0,miopenConvolutionFwdAlgoWinograd,192x17x17x3x3x320x8x8x32xNCHWxFP16x0x0x2x2x1x1x1x1
192-17-17-3x3-192-8-8-32-0x0-2x2-1x1-0-NCHW-FP16-F=miopenConvolutionFwdAlgoImplicitGEMM:ConvHipImplicitGemmV4Fwd,0.17264,0,miopenConvolutionFwdAlgoImplicitGEMM,192x17x17x3x3x192x8x8x32xNCHWxFP16x0x0x2x2x1x1x1x1;miopenConvolutionFwdAlgoDirect:ConvOclDirectFwdGen,1.76864,0,miopenConvolutionFwdAlgoDirect,<unused>;miopenConvolutionFwdAlgoGEMM:gemm,3.67616,221184,rocBlas,<unused>;miopenConvolutionFwdAlgoWinograd:ConvBinWinogradRxS,0.29072,0,miopenConvolutionFwdAlgoWinograd,192x17x17x3x3x192x8x8x32xNCHWxFP16x0x0x2x2x1x1x1x1
1280-8-8-1x1-320-8-8-32-0x0-1x1-1x1-0-NCHW-FP16-F=miopenConvolutionFwdAlgoImplicitGEMM:ConvHipImplicitGemmV4Fwd,0.17584,0,miopenConvolutionFwdAlgoImplicitGEMM,1280x8x8x1x1x320x8x8x32xNCHWxFP16x0x0x1x1x1x1x1x1;miopenConvolutionFwdAlgoDirect:ConvAsm1x1U,0.18208,0,miopenConvolutionFwdAlgoDirect,<unused>;miopenConvolutionFwdAlgoGEMM:gemm,0.57952,0,rocBlas,<unused>;miopenConvolutionFwdAlgoWinograd:ConvBinWinogradRxS,0.64944,0,miopenConvolutionFwdAlgoWinograd,1280x8x8x1x1x320x8x8x32xNCHWxFP16x0x0x1x1x1x1x1x1
1280-8-8-1x1-384-8-8-32-0x0-1x1-1x1-0-NCHW-FP16-F=miopenConvolutionFwdAlgoImplicitGEMM:ConvHipImplicitGemmV4Fwd,0.23968,0,miopenConvolutionFwdAlgoImplicitGEMM,1280x8x8x1x1x384x8x8x32xNCHWxFP16x0x0x1x1x1x1x1x1;miopenConvolutionFwdAlgoDirect:ConvAsm1x1U,0.22848,0,miopenConvolutionFwdAlgoDirect,<unused>;miopenConvolutionFwdAlgoGEMM:gemm,0.6808,0,rocBlas,<unused>;miopenConvolutionFwdAlgoWinograd:ConvBinWinogradRxS,0.853759,0,miopenConvolutionFwdAlgoWinograd,1280x8x8x1x1x384x8x8x32xNCHWxFP16x0x0x1x1x1x1x1x1
384-8-8-1x3-384-8-8-32-0x1-1x1-1x1-0-NCHW-FP16-F=miopenConvolutionFwdAlgoImplicitGEMM:ConvHipImplicitGemmV4R1Fwd,0.21904,0,miopenConvolutionFwdAlgoImplicitGEMM,384x8x8x1x3x384x8x8x32xNCHWxFP16x0x1x1x1x1x1x1x1;miopenConvolutionFwdAlgoGEMM:gemm,2.10944,147456,rocBlas,<unused>;miopenConvolutionFwdAlgoWinograd:ConvBinWinogradRxS,0.24736,0,miopenConvolutionFwdAlgoWinograd,384x8x8x1x3x384x8x8x32xNCHWxFP16x0x1x1x1x1x1x1x1
384-8-8-3x1-384-8-8-32-1x0-1x1-1x1-0-NCHW-FP16-F=miopenConvolutionFwdAlgoImplicitGEMM:ConvHipImplicitGemmV4R1Fwd,0.21696,0,miopenConvolutionFwdAlgoImplicitGEMM,384x8x8x3x1x384x8x8x32xNCHWxFP16x1x0x1x1x1x1x1x1;miopenConvolutionFwdAlgoGEMM:gemm,2.08384,147456,rocBlas,<unused>;miopenConvolutionFwdAlgoWinograd:ConvBinWinogradRxS,0.31504,0,miopenConvolutionFwdAlgoWinograd,384x8x8x3x1x384x8x8x32xNCHWxFP16x1x0x1x1x1x1x1x1
1280-8-8-1x1-448-8-8-32-0x0-1x1-1x1-0-NCHW-FP16-F=miopenConvolutionFwdAlgoImplicitGEMM:ConvHipImplicitGemmV4Fwd,0.24528,0,miopenConvolutionFwdAlgoImplicitGEMM,1280x8x8x1x1x448x8x8x32xNCHWxFP16x0x0x1x1x1x1x1x1;miopenConvolutionFwdAlgoDirect:ConvAsm1x1U,0.24256,0,miopenConvolutionFwdAlgoDirect,<unused>;miopenConvolutionFwdAlgoGEMM:gemm,0.769119,0,rocBlas,<unused>;miopenConvolutionFwdAlgoWinograd:ConvBinWinogradRxS,0.859519,0,miopenConvolutionFwdAlgoWinograd,1280x8x8x1x1x448x8x8x32xNCHWxFP16x0x0x1x1x1x1x1x1
448-8-8-3x3-384-8-8-32-1x1-1x1-1x1-0-NCHW-FP16-F=miopenConvolutionFwdAlgoImplicitGEMM:ConvHipImplicitGemmV4R1Fwd,0.68736,0,miopenConvolutionFwdAlgoImplicitGEMM,448x8x8x3x3x384x8x8x32xNCHWxFP16x1x1x1x1x1x1x1x1;miopenConvolutionFwdAlgoDirect:ConvOclDirectFwd,1.94048,0,miopenConvolutionFwdAlgoDirect,<unused>;miopenConvolutionFwdAlgoGEMM:gemm,5.96992,516096,rocBlas,<unused>;miopenConvolutionFwdAlgoWinograd:ConvBinWinogradRxS,0.25184,0,miopenConvolutionFwdAlgoWinograd,448x8x8x3x3x384x8x8x32xNCHWxFP16x1x1x1x1x1x1x1x1
1280-8-8-1x1-192-8-8-32-0x0-1x1-1x1-0-NCHW-FP16-F=miopenConvolutionFwdAlgoImplicitGEMM:ConvHipImplicitGemmV4Fwd,0.13296,0,miopenConvolutionFwdAlgoImplicitGEMM,1280x8x8x1x1x192x8x8x32xNCHWxFP16x0x0x1x1x1x1x1x1;miopenConvolutionFwdAlgoDirect:ConvAsm1x1U,0.14704,0,miopenConvolutionFwdAlgoDirect,<unused>;miopenConvolutionFwdAlgoGEMM:gemm,0.36176,0,rocBlas,<unused>;miopenConvolutionFwdAlgoWinograd:ConvBinWinogradRxS,0.44432,0,miopenConvolutionFwdAlgoWinograd,1280x8x8x1x1x192x8x8x32xNCHWxFP16x0x0x1x1x1x1x1x1
2048-8-8-1x1-320-8-8-32-0x0-1x1-1x1-0-NCHW-FP16-F=miopenConvolutionFwdAlgoImplicitGEMM:ConvHipImplicitGemmV4Fwd,0.47552,0,miopenConvolutionFwdAlgoImplicitGEMM,2048x8x8x1x1x320x8x8x32xNCHWxFP16x0x0x1x1x1x1x1x1;miopenConvolutionFwdAlgoDirect:ConvAsm1x1U,0.3296,0,miopenConvolutionFwdAlgoDirect,<unused>;miopenConvolutionFwdAlgoGEMM:gemm,0.29104,0,rocBlas,<unused>;miopenConvolutionFwdAlgoWinograd:ConvBinWinogradRxS,1.02752,0,miopenConvolutionFwdAlgoWinograd,2048x8x8x1x1x320x8x8x32xNCHWxFP16x0x0x1x1x1x1x1x1
2048-8-8-1x1-384-8-8-32-0x0-1x1-1x1-0-NCHW-FP16-F=miopenConvolutionFwdAlgoImplicitGEMM:ConvHipImplicitGemmV4Fwd,0.49632,0,miopenConvolutionFwdAlgoImplicitGEMM,2048x8x8x1x1x384x8x8x32xNCHWxFP16x0x0x1x1x1x1x1x1;miopenConvolutionFwdAlgoDirect:ConvAsm1x1U,0.38112,0,miopenConvolutionFwdAlgoDirect,<unused>;miopenConvolutionFwdAlgoGEMM:gemm,0.45632,0,rocBlas,<unused>;miopenConvolutionFwdAlgoWinograd:ConvBinWinogradRxS,1.33904,0,miopenConvolutionFwdAlgoWinograd,2048x8x8x1x1x384x8x8x32xNCHWxFP16x0x0x1x1x1x1x1x1
2048-8-8-1x1-448-8-8-32-0x0-1x1-1x1-0-NCHW-FP16-F=miopenConvolutionFwdAlgoImplicitGEMM:ConvHipImplicitGemmV4Fwd,0.52944,0,miopenConvolutionFwdAlgoImplicitGEMM,2048x8x8x1x1x448x8x8x32xNCHWxFP16x0x0x1x1x1x1x1x1;miopenConvolutionFwdAlgoDirect:ConvAsm1x1U,0.39088,0,miopenConvolutionFwdAlgoDirect,<unused>;miopenConvolutionFwdAlgoGEMM:gemm,1.22784,0,rocBlas,<unused>;miopenConvolutionFwdAlgoWinograd:ConvBinWinogradRxS,1.3384,0,miopenConvolutionFwdAlgoWinograd,2048x8x8x1x1x448x8x8x32xNCHWxFP16x0x0x1x1x1x1x1x1
2048-8-8-1x1-192-8-8-32-0x0-1x1-1x1-0-NCHW-FP16-F=miopenConvolutionFwdAlgoImplicitGEMM:ConvHipImplicitGemmV4Fwd,0.24112,0,miopenConvolutionFwdAlgoImplicitGEMM,2048x8x8x1x1x192x8x8x32xNCHWxFP16x0x0x1x1x1x1x1x1;miopenConvolutionFwdAlgoDirect:ConvAsm1x1U,0.25552,0,miopenConvolutionFwdAlgoDirect,<unused>;miopenConvolutionFwdAlgoGEMM:gemm,0.20096,0,rocBlas,<unused>;miopenConvolutionFwdAlgoWinograd:ConvBinWinogradRxS,0.6864,0,miopenConvolutionFwdAlgoWinograd,2048x8x8x1x1x192x8x8x32xNCHWxFP16x0x0x1x1x1x1x1x1
3-224-224-3x3-64-224-224-16-1x1-1x1-1x1-0-NCHW-FP32-F=miopenConvolutionFwdAlgoDirect:ConvOclDirectFwd,2.14672,0,miopenConvolutionFwdAlgoDirect,<unused>;miopenConvolutionFwdAlgoGEMM:gemm,1.97888,5419008,rocBlas,<unused>;miopenConvolutionFwdAlgoWinograd:ConvBinWinogradRxSf2x3,0.59552,0,miopenConvolutionFwdAlgoWinograd,3x224x224x3x3x64x224x224x16xNCHWxFP32x1x1x1x1x1x1x1x1
64-224-224-3x3-64-224-224-16-1x1-1x1-1x1-0-NCHW-FP32-F=miopenConvolutionFwdAlgoWinograd:ConvBinWinogradRxS,2.7096,0,miopenConvolutionFwdAlgoWinograd,64x224x224x3x3x64x224x224x16xNCHWxFP32x1x1x1x1x1x1x1x1
64-112-112-3x3-128-112-112-16-1x1-1x1-1x1-0-NCHW-FP32-F=miopenConvolutionFwdAlgoWinograd:ConvBinWinograd3x3U,1.51376,0,miopenConvolutionFwdAlgoWinograd,64x112x112x3x3x128x112x112x16xNCHWxFP32x1x1x1x1x1x1x1x1
128-112-112-3x3-128-112-112-16-1x1-1x1-1x1-0-NCHW-FP32-F=miopenConvolutionFwdAlgoWinograd:ConvBinWinogradRxS,2.48992,0,miopenConvolutionFwdAlgoWinograd,128x112x112x3x3x128x112x112x16xNCHWxFP32x1x1x1x1x1x1x1x1
128-56-56-3x3-256-56-56-16-1x1-1x1-1x1-0-NCHW-FP32-F=miopenConvolutionFwdAlgoWinograd:ConvBinWinograd3x3U,1.45264,0,miopenConvolutionFwdAlgoWinograd,128x56x56x3x3x256x56x56x16xNCHWxFP32x1x1x1x1x1x1x1x1
256-56-56-3x3-256-56-56-16-1x1-1x1-1x1-0-NCHW-FP32-F=miopenConvolutionFwdAlgoWinograd:ConvBinWinogradRxS,2.43136,0,miopenConvolutionFwdAlgoWinograd,256x56x56x3x3x256x56x56x16xNCHWxFP32x1x1x1x1x1x1x1x1
256-28-28-3x3-512-28-28-16-1x1-1x1-1x1-0-NCHW-FP32-F=miopenConvolutionFwdAlgoWinograd:ConvBinWinogradRxS,1.43472,0,miopenConvolutionFwdAlgoWinograd,256x28x28x3x3x512x28x28x16xNCHWxFP32x1x1x1x1x1x1x1x1
512-28-28-3x3-512-28-28-16-1x1-1x1-1x1-0-NCHW-FP32-F=miopenConvolutionFwdAlgoWinograd:ConvBinWinogradRxS,2.44064,0,miopenConvolutionFwdAlgoWinograd,512x28x28x3x3x512x28x28x16xNCHWxFP32x1x1x1x1x1x1x1x1
512-14-14-3x3-512-14-14-16-1x1-1x1-1x1-0-NCHW-FP32-F=miopenConvolutionFwdAlgoWinograd:ConvBinWinogradRxSf2x3,0.74272,0,miopenConvolutionFwdAlgoWinograd,512x14x14x3x3x512x14x14x16xNCHWxFP32x1x1x1x1x1x1x1x1
3-224-224-3x3-64-224-224-16-1x1-1x1-1x1-0-NCHW-FP16-F=miopenConvolutionFwdAlgoDirect:ConvOclDirectFwd,0.59104,0,miopenConvolutionFwdAlgoDirect,<unused>;miopenConvolutionFwdAlgoGEMM:gemm,1.85088,2709504,rocBlas,<unused>
64-224-224-3x3-64-224-224-16-1x1-1x1-1x1-0-NCHW-FP16-F=miopenConvolutionFwdAlgoImplicitGEMM:ConvHipImplicitGemmV4R1Fwd,4.27248,0,miopenConvolutionFwdAlgoImplicitGEMM,64x224x224x3x3x64x224x224x16xNCHWxFP16x1x1x1x1x1x1x1x1;miopenConvolutionFwdAlgoDirect:ConvOclDirectFwd,9.01247,0,miopenConvolutionFwdAlgoDirect,<unused>;miopenConvolutionFwdAlgoGEMM:gemm,8.128,57802752,rocBlas,<unused>;miopenConvolutionFwdAlgoWinograd:ConvBinWinogradRxS,1.96752,0,miopenConvolutionFwdAlgoWinograd,64x224x224x3x3x64x224x224x16xNCHWxFP16x1x1x1x1x1x1x1x1
64-112-112-3x3-128-112-112-16-1x1-1x1-1x1-0-NCHW-FP16-F=miopenConvolutionFwdAlgoImplicitGEMM:ConvHipImplicitGemmV4R1Fwd,2.00896,0,miopenConvolutionFwdAlgoImplicitGEMM,64x112x112x3x3x128x112x112x16xNCHWxFP16x1x1x1x1x1x1x1x1;miopenConvolutionFwdAlgoDirect:ConvOclDirectFwd,4.84752,0,miopenConvolutionFwdAlgoDirect,<unused>;miopenConvolutionFwdAlgoGEMM:gemm,3.74016,14450688,rocBlas,<unused>;miopenConvolutionFwdAlgoWinograd:ConvBinWinogradRxS,1.0048,0,miopenConvolutionFwdAlgoWinograd,64x112x112x3x3x128x112x112x16xNCHWxFP16x1x1x1x1x1x1x1x1
128-112-112-3x3-128-112-112-16-1x1-1x1-1x1-0-NCHW-FP16-F=miopenConvolutionFwdAlgoImplicitGEMM:ConvHipImplicitGemmV4R1Fwd,3.94992,0,miopenConvolutionFwdAlgoImplicitGEMM,128x112x112x3x3x128x112x112x16xNCHWxFP16x1x1x1x1x1x1x1x1;miopenConvolutionFwdAlgoDirect:ConvOclDirectFwd,9.59631,0,miopenConvolutionFwdAlgoDirect,<unused>;miopenConvolutionFwdAlgoGEMM:gemm,6.78656,28901376,rocBlas,<unused>;miopenConvolutionFwdAlgoWinograd:ConvBinWinogradRxS,1.8072,0,miopenConvolutionFwdAlgoWinograd,128x112x112x3x3x128x112x112x16xNCHWxFP16x1x1x1x1x1x1x1x1
128-56-56-3x3-256-56-56-16-1x1-1x1-1x1-0-NCHW-FP16-F=miopenConvolutionFwdAlgoImplicitGEMM:ConvHipImplicitGemmV4R1Fwd,2.03776,0,miopenConvolutionFwdAlgoImplicitGEMM,128x56x56x3x3x256x56x56x16xNCHWxFP16x1x1x1x1x1x1x1x1;miopenConvolutionFwdAlgoDirect:ConvOclDirectFwd,5.54799,0,miopenConvolutionFwdAlgoDirect,<unused>;miopenConvolutionFwdAlgoGEMM:gemm,3.24864,7225344,rocBlas,<unused>;miopenConvolutionFwdAlgoWinograd:ConvBinWinogradRxS,0.915839,0,miopenConvolutionFwdAlgoWinograd,128x56x56x3x3x256x56x56x16xNCHWxFP16x1x1x1x1x1x1x1x1
256-56-56-3x3-256-56-56-16-1x1-1x1-1x1-0-NCHW-FP16-F=miopenConvolutionFwdAlgoImplicitGEMM:ConvHipImplicitGemmV4R1Fwd,3.96688,0,miopenConvolutionFwdAlgoImplicitGEMM,256x56x56x3x3x256x56x56x16xNCHWxFP16x1x1x1x1x1x1x1x1;miopenConvolutionFwdAlgoDirect:ConvOclDirectFwd,10.9901,0,miopenConvolutionFwdAlgoDirect,<unused>;miopenConvolutionFwdAlgoGEMM:gemm,6.92224,14450688,rocBlas,<unused>;miopenConvolutionFwdAlgoWinograd:ConvBinWinogradRxS,1.72656,0,miopenConvolutionFwdAlgoWinograd,256x56x56x3x3x256x56x56x16xNCHWxFP16x1x1x1x1x1x1x1x1
256-28-28-3x3-512-28-28-16-1x1-1x1-1x1-0-NCHW-FP16-F=miopenConvolutionFwdAlgoImplicitGEMM:ConvHipImplicitGemmV4R1Fwd,2.03712,0,miopenConvolutionFwdAlgoImplicitGEMM,256x28x28x3x3x512x28x28x16xNCHWxFP16x1x1x1x1x1x1x1x1;miopenConvolutionFwdAlgoDirect:ConvOclDirectFwd,5.09135,0,miopenConvolutionFwdAlgoDirect,<unused>;miopenConvolutionFwdAlgoGEMM:gemm,4.67968,3612672,rocBlas,<unused>;miopenConvolutionFwdAlgoWinograd:ConvBinWinogradRxS,0.894559,0,miopenConvolutionFwdAlgoWinograd,256x28x28x3x3x512x28x28x16xNCHWxFP16x1x1x1x1x1x1x1x1
512-28-28-3x3-512-28-28-16-1x1-1x1-1x1-0-NCHW-FP16-F=miopenConvolutionFwdAlgoImplicitGEMM:ConvHipImplicitGemmV4R1Fwd,4.13456,0,miopenConvolutionFwdAlgoImplicitGEMM,512x28x28x3x3x512x28x28x16xNCHWxFP16x1x1x1x1x1x1x1x1;miopenConvolutionFwdAlgoDirect:ConvOclDirectFwd,9.80703,0,miopenConvolutionFwdAlgoDirect,<unused>;miopenConvolutionFwdAlgoGEMM:gemm,8.96256,7225344,rocBlas,<unused>;miopenConvolutionFwdAlgoWinograd:ConvBinWinogradRxS,1.7176,0,miopenConvolutionFwdAlgoWinograd,512x28x28x3x3x512x28x28x16xNCHWxFP16x1x1x1x1x1x1x1x1
512-14-14-3x3-512-14-14-16-1x1-1x1-1x1-0-NCHW-FP16-F=miopenConvolutionFwdAlgoImplicitGEMM:ConvHipImplicitGemmV4R1Fwd,1.29968,0,miopenConvolutionFwdAlgoImplicitGEMM,512x14x14x3x3x512x14x14x16xNCHWxFP16x1x1x1x1x1x1x1x1;miopenConvolutionFwdAlgoDirect:ConvOclDirectFwd,3.33104,0,miopenConvolutionFwdAlgoDirect,<unused>;miopenConvolutionFwdAlgoGEMM:gemm,4.07296,1806336,rocBlas,<unused>;miopenConvolutionFwdAlgoWinograd:ConvBinWinogradRxS,0.46784,0,miopenConvolutionFwdAlgoWinograd,512x14x14x3x3x512x14x14x16xNCHWxFP16x1x1x1x1x1x1x1x1
64-56-56-1x1-288-56-56-32-0x0-1x1-1x1-0-NCHW-FP32-F=miopenConvolutionFwdAlgoImplicitGEMM:ConvHipImplicitGemmV4_1x1,1.2984,0,miopenConvolutionFwdAlgoImplicitGEMM,64x56x56x1x1x288x56x56x32xNCHWxFP32x0x0x1x1x1x1x1x1;miopenConvolutionFwdAlgoDirect:ConvOclDirectFwd1x1,0.56672,0,miopenConvolutionFwdAlgoDirect,<unused>;miopenConvolutionFwdAlgoGEMM:gemm,0.45792,0,rocBlas,<unused>;miopenConvolutionFwdAlgoWinograd:ConvBinWinogradRxSf3x2,0.973599,0,miopenConvolutionFwdAlgoWinograd,64x56x56x1x1x288x56x56x32xNCHWxFP32x0x0x1x1x1x1x1x1
64-56-56-1x1-96-56-56-32-0x0-1x1-1x1-0-NCHW-FP32-F=miopenConvolutionFwdAlgoImplicitGEMM:ConvHipImplicitGemmV4_1x1,0.51728,0,miopenConvolutionFwdAlgoImplicitGEMM,64x56x56x1x1x96x56x56x32xNCHWxFP32x0x0x1x1x1x1x1x1;miopenConvolutionFwdAlgoDirect:ConvOclDirectFwd1x1,0.26272,0,miopenConvolutionFwdAlgoDirect,<unused>;miopenConvolutionFwdAlgoGEMM:gemm,0.2808,0,rocBlas,<unused>;miopenConvolutionFwdAlgoWinograd:ConvBinWinogradRxSf3x2,0.53088,0,miopenConvolutionFwdAlgoWinograd,64x56x56x1x1x96x56x56x32xNCHWxFP32x0x0x1x1x1x1x1x1
96-56-56-3x3-96-56-56-32-1x1-1x1-1x1-0-NCHW-FP32-F_g32=miopenConvolutionFwdAlgoDirect:ConvOclDirectFwd,0.38048,0,miopenConvolutionFwdAlgoDirect,<unused>;miopenConvolutionFwdAlgoGEMM:gemm,3.3792,10838016,rocBlas,<unused>;miopenConvolutionFwdAlgoWinograd:ConvBinWinogradRxSf2x3,1.39104,0,miopenConvolutionFwdAlgoWinograd,96x56x56x3x3x96x56x56x32xNCHWxFP32x1x1x1x1x1x1x32x1
96-56-56-1x1-272-56-56-32-0x0-1x1-1x1-0-NCHW-FP32-F=miopenConvolutionFwdAlgoImplicitGEMM:ConvHipImplicitGemmV4_1x1,2.37792,0,miopenConvolutionFwdAlgoImplicitGEMM,96x56x56x1x1x272x56x56x32xNCHWxFP32x0x0x1x1x1x1x1x1;miopenConvolutionFwdAlgoDirect:ConvOclDirectFwd1x1,0.890079,0,miopenConvolutionFwdAlgoDirect,<unused>;miopenConvolutionFwdAlgoGEMM:gemm,0.61712,0,rocBlas,<unused>;miopenConvolutionFwdAlgoWinograd:ConvBinWinogradRxSf3x2,1.33088,0,miopenConvolutionFwdAlgoWinograd,96x56x56x1x1x272x56x56x32xNCHWxFP32x0x0x1x1x1x1x1x1
304-56-56-1x1-96-56-56-32-0x0-1x1-1x1-0-NCHW-FP32-F=miopenConvolutionFwdAlgoImplicitGEMM:ConvHipImplicitGemmV4_1x1,1.33056,0,miopenConvolutionFwdAlgoImplicitGEMM,304x56x56x1x1x96x56x56x32xNCHWxFP32x0x0x1x1x1x1x1x1;miopenConvolutionFwdAlgoDirect:ConvOclDirectFwd1x1,0.79136,0,miopenConvolutionFwdAlgoDirect,<unused>;miopenConvolutionFwdAlgoGEMM:gemm,0.788959,0,rocBlas,<unused>;miopenConvolutionFwdAlgoWinograd:ConvBinWinogradRxSf3x2,1.29776,0,miopenConvolutionFwdAlgoWinograd,304x56x56x1x1x96x56x56x32xNCHWxFP32x0x0x1x1x1x1x1x1
320-56-56-1x1-96-56-56-32-0x0-1x1-1x1-0-NCHW-FP32-F=miopenConvolutionFwdAlgoImplicitGEMM:ConvHipImplicitGemmV4_1x1,1.3328,0,miopenConvolutionFwdAlgoImplicitGEMM,320x56x56x1x1x96x56x56x32xNCHWxFP32x0x0x1x1x1x1x1x1;miopenConvolutionFwdAlgoDirect:ConvAsm1x1U,0.820959,0,miopenConvolutionFwdAlgoDirect,<unused>;miopenConvolutionFwdAlgoGEMM:gemm,0.827839,0,rocBlas,<unused>;miopenConvolutionFwdAlgoWinograd:ConvBinWinogradRxSf3x2,1.3736,0,miopenConvolutionFwdAlgoWinograd,320x56x56x1x1x96x56x56x32xNCHWxFP32x0x0x1x1x1x1x1x1
336-56-56-1x1-576-28-28-32-0x0-2x2-1x1-0-NCHW-FP32-F=miopenConvolutionFwdAlgoImplicitGEMM:ConvHipImplicitGemmV4_1x1,1.99744,0,miopenConvolutionFwdAlgoImplicitGEMM,336x56x56x1x1x576x28x28x32xNCHWxFP32x0x0x2x2x1x1x1x1;miopenConvolutionFwdAlgoDirect:ConvAsm1x1UV2,1.6784,0,miopenConvolutionFwdAlgoDirect,<unused>;miopenConvolutionFwdAlgoGEMM:gemm,1.75776,91521024,rocBlas,<unused>;miopenConvolutionFwdAlgoWinograd:ConvBinWinogradRxS,7.17439,0,miopenConvolutionFwdAlgoWinograd,336x56x56x1x1x576x28x28x32xNCHWxFP32x0x0x2x2x1x1x1x1
336-56-56-1x1-192-56-56-32-0x0-1x1-1x1-0-NCHW-FP32-F=miopenConvolutionFwdAlgoImplicitGEMM:ConvHipImplicitGemmV4_1x1,1.9992,0,miopenConvolutionFwdAlgoImplicitGEMM,336x56x56x1x1x192x56x56x32xNCHWxFP32x0x0x1x1x1x1x1x1;miopenConvolutionFwdAlgoDirect:ConvOclDirectFwd1x1,1.64304,0,miopenConvolutionFwdAlgoDirect,<unused>;miopenConvolutionFwdAlgoGEMM:gemm,1.66272,0,rocBlas,<unused>;miopenConvolutionFwdAlgoWinograd:ConvBinWinogradRxSf3x2,2.732,0,miopenConvolutionFwdAlgoWinograd,336x56x56x1x1x192x56x56x32xNCHWxFP32x0x0x1x1x1x1x1x1
192-56-56-3x3-192-28-28-32-1x1-2x2-1x1-0-NCHW-FP32-F_g32=miopenConvolutionFwdAlgoDirect:ConvOclDirectFwd,0.52128,0,miopenConvolutionFwdAlgoDirect,<unused>;miopenConvolutionFwdAlgoGEMM:gemm,2.3808,5419008,rocBlas,<unused>;miopenConvolutionFwdAlgoWinograd:ConvBinWinogradRxSf2x3,0.942559,0,miopenConvolutionFwdAlgoWinograd,192x56x56x3x3x192x28x28x32xNCHWxFP32x1x1x2x2x1x1x32x1
192-28-28-1x1-544-28-28-32-0x0-1x1-1x1-0-NCHW-FP32-F=miopenConvolutionFwdAlgoWinograd:ConvBinWinogradRxSf3x2,1.30688,0,miopenConvolutionFwdAlgoWinograd,192x28x28x1x1x544x28x28x32xNCHWxFP32x0x0x1x1x1x1x1x1;miopenConvolutionFwdAlgoGEMM:gemm,0.6184,0,rocBlas,<unused>
64-56-56-1x1-64-56-56-32-0x0-1x1-1x1-0-NCHW-FP32-F=miopenConvolutionFwdAlgoImplicitGEMM:ConvHipImplicitGemmV4_1x1,0.23648,0,miopenConvolutionFwdAlgoImplicitGEMM,64x56x56x1x1x64x56x56x32xNCHWxFP32x0x0x1x1x1x1x1x1;miopenConvolutionFwdAlgoDirect:ConvOclDirectFwd1x1,0.20368,0,miopenConvolutionFwdAlgoDirect,<unused>;miopenConvolutionFwdAlgoGEMM:gemm,0.1104,0,rocBlas,<unused>;miopenConvolutionFwdAlgoWinograd:ConvBinWinogradRxSf3x2,0.26048,0,miopenConvolutionFwdAlgoWinograd,64x56x56x1x1x64x56x56x32xNCHWxFP32x0x0x1x1x1x1x1x1
64-56-56-3x3-64-56-56-32-1x1-1x1-1x1-0-NCHW-FP32-F=miopenConvolutionFwdAlgoWinograd:ConvBinWinogradRxSf2x3,0.41968,0,miopenConvolutionFwdAlgoWinograd,64x56x56x3x3x64x56x56x32xNCHWxFP32x1x1x1x1x1x1x1x1
128-56-56-1x1-256-56-56-32-0x0-1x1-1x1-0-NCHW-FP32-F=miopenConvolutionFwdAlgoImplicitGEMM:ConvHipImplicitGemmV4_1x1,1.40992,0,miopenConvolutionFwdAlgoImplicitGEMM,128x56x56x1x1x256x56x56x32xNCHWxFP32x0x0x1x1x1x1x1x1;miopenConvolutionFwdAlgoDirect:ConvOclDirectFwd1x1,0.78464,0,miopenConvolutionFwdAlgoDirect,<unused>;miopenConvolutionFwdAlgoGEMM:gemm,0.63632,0,rocBlas,<unused>;miopenConvolutionFwdAlgoWinograd:ConvBinWinogradRxSf3x2,1.52848,0,miopenConvolutionFwdAlgoWinograd,128x56x56x1x1x256x56x56x32xNCHWxFP32x0x0x1x1x1x1x1x1
256-56-56-1x1-64-56-56-32-0x0-1x1-1x1-0-NCHW-FP32-F=miopenConvolutionFwdAlgoImplicitGEMM:ConvHipImplicitGemmV4_1x1,0.58816,0,miopenConvolutionFwdAlgoImplicitGEMM,256x56x56x1x1x64x56x56x32xNCHWxFP32x0x0x1x1x1x1x1x1;miopenConvolutionFwdAlgoDirect:ConvOclDirectFwd1x1,0.42768,0,miopenConvolutionFwdAlgoDirect,<unused>;miopenConvolutionFwdAlgoGEMM:gemm,0.35712,0,rocBlas,<unused>;miopenConvolutionFwdAlgoWinograd:ConvBinWinogradRxSf3x2,0.76912,0,miopenConvolutionFwdAlgoWinograd,256x56x56x1x1x64x56x56x32xNCHWxFP32x0x0x1x1x1x1x1x1
64-56-56-1x1-256-56-56-32-0x0-1x1-1x1-0-NCHW-FP32-F=miopenConvolutionFwdAlgoImplicitGEMM:ConvHipImplicitGemmV4_1x1,0.70096,0,miopenConvolutionFwdAlgoImplicitGEMM,64x56x56x1x1x256x56x56x32xNCHWxFP32x0x0x1x1x1x1x1x1;miopenConvolutionFwdAlgoDirect:ConvOclDirectFwd1x1,0.47424,0,miopenConvolutionFwdAlgoDirect,<unused>;miopenConvolutionFwdAlgoGEMM:gemm,0.35168,0,rocBlas,<unused>;miopenConvolutionFwdAlgoWinograd:ConvBinWinogradRxSf3x2,0.86848,0,miopenConvolutionFwdAlgoWinograd,64x56x56x1x1x256x56x56x32xNCHWxFP32x0x0x1x1x1x1x1x1
128-56-56-3x3-128-28-28-32-1x1-2x2-1x1-0-NCHW-FP32-F=miopenConvolutionFwdAlgoImplicitGEMM:ConvHipImplicitGemmV4R1Fwd,0.87136,0,miopenConvolutionFwdAlgoImplicitGEMM,128x56x56x3x3x128x28x28x32xNCHWxFP32x1x1x2x2x1x1x1x1;miopenConvolutionFwdAlgoDirect:ConvOclDirectFwd,5.16,0,miopenConvolutionFwdAlgoDirect,<unused>;miopenConvolutionFwdAlgoGEMM:gemm,3.07712,3612672,rocBlas,<unused>;miopenConvolutionFwdAlgoWinograd:ConvBinWinogradRxS,1.54656,0,miopenConvolutionFwdAlgoWinograd,128x56x56x3x3x128x28x28x32xNCHWxFP32x1x1x2x2x1x1x1x1
384-28-28-1x1-512-28-28-32-0x0-1x1-1x1-0-NCHW-FP32-F=miopenConvolutionFwdAlgoImplicitGEMM:ConvHipImplicitGemmV4_1x1,1.16304,0,miopenConvolutionFwdAlgoImplicitGEMM,384x28x28x1x1x512x28x28x32xNCHWxFP32x0x0x1x1x1x1x1x1;miopenConvolutionFwdAlgoDirect:ConvOclDirectFwd1x1,1.23936,0,miopenConvolutionFwdAlgoDirect,<unused>;miopenConvolutionFwdAlgoGEMM:gemm,1.24224,0,rocBlas,<unused>;miopenConvolutionFwdAlgoWinograd:ConvBinWinogradRxSf3x2,2.28448,0,miopenConvolutionFwdAlgoWinograd,384x28x28x1x1x512x28x28x32xNCHWxFP32x0x0x1x1x1x1x1x1
512-28-28-1x1-128-28-28-32-0x0-1x1-1x1-0-NCHW-FP32-F=miopenConvolutionFwdAlgoImplicitGEMM:ConvHipImplicitGemmV4_1x1,0.46176,0,miopenConvolutionFwdAlgoImplicitGEMM,512x28x28x1x1x128x28x28x32xNCHWxFP32x0x0x1x1x1x1x1x1;miopenConvolutionFwdAlgoDirect:ConvOclDirectFwd1x1,0.43744,0,miopenConvolutionFwdAlgoDirect,<unused>;miopenConvolutionFwdAlgoGEMM:gemm,0.4312,0,rocBlas,<unused>;miopenConvolutionFwdAlgoWinograd:ConvBinWinogradRxSf3x2,0.918399,0,miopenConvolutionFwdAlgoWinograd,512x28x28x1x1x128x28x28x32xNCHWxFP32x0x0x1x1x1x1x1x1
128-28-28-3x3-128-28-28-32-1x1-1x1-1x1-0-NCHW-FP32-F=miopenConvolutionFwdAlgoWinograd:ConvBinWinogradRxSf2x3,0.40208,0,miopenConvolutionFwdAlgoWinograd,128x28x28x3x3x128x28x28x32xNCHWxFP32x1x1x1x1x1x1x1x1
128-28-28-1x1-512-28-28-32-0x0-1x1-1x1-0-NCHW-FP32-F=miopenConvolutionFwdAlgoImplicitGEMM:ConvHipImplicitGemmV4_1x1,0.54784,0,miopenConvolutionFwdAlgoImplicitGEMM,128x28x28x1x1x512x28x28x32xNCHWxFP32x0x0x1x1x1x1x1x1;miopenConvolutionFwdAlgoDirect:ConvOclDirectFwd1x1,0.53632,0,miopenConvolutionFwdAlgoDirect,<unused>;miopenConvolutionFwdAlgoGEMM:gemm,0.3864,0,rocBlas,<unused>;miopenConvolutionFwdAlgoWinograd:ConvBinWinogradRxSf3x2,0.864799,0,miopenConvolutionFwdAlgoWinograd,128x28x28x1x1x512x28x28x32xNCHWxFP32x0x0x1x1x1x1x1x1
256-28-28-3x3-256-14-14-32-1x1-2x2-1x1-0-NCHW-FP32-F=miopenConvolutionFwdAlgoImplicitGEMM:ConvHipImplicitGemmV4R1Fwd,0.955839,0,miopenConvolutionFwdAlgoImplicitGEMM,256x28x28x3x3x256x14x14x32xNCHWxFP32x1x1x2x2x1x1x1x1;miopenConvolutionFwdAlgoDirect:ConvOclDirectFwd,4.34351,0,miopenConvolutionFwdAlgoDirect,<unused>;miopenConvolutionFwdAlgoGEMM:gemm,3.45088,1806336,rocBlas,<unused>;miopenConvolutionFwdAlgoWinograd:ConvBinWinogradRxS,1.576,0,miopenConvolutionFwdAlgoWinograd,256x28x28x3x3x256x14x14x32xNCHWxFP32x1x1x2x2x1x1x1x1
768-14-14-1x1-1024-14-14-32-0x0-1x1-1x1-0-NCHW-FP32-F=miopenConvolutionFwdAlgoImplicitGEMM:ConvHipImplicitGemmV4_1x1,1.47872,0,miopenConvolutionFwdAlgoImplicitGEMM,768x14x14x1x1x1024x14x14x32xNCHWxFP32x0x0x1x1x1x1x1x1;miopenConvolutionFwdAlgoDirect:ConvAsm1x1U,1.60608,0,miopenConvolutionFwdAlgoDirect,<unused>;miopenConvolutionFwdAlgoGEMM:gemm,1.48176,0,rocBlas,<unused>;miopenConvolutionFwdAlgoWinograd:ConvBinWinogradRxSf3x2,2.30832,0,miopenConvolutionFwdAlgoWinograd,768x14x14x1x1x1024x14x14x32xNCHWxFP32x0x0x1x1x1x1x1x1
1024-14-14-1x1-256-14-14-32-0x0-1x1-1x1-0-NCHW-FP32-F=miopenConvolutionFwdAlgoImplicitGEMM:ConvHipImplicitGemmV4_1x1,0.6456,0,miopenConvolutionFwdAlgoImplicitGEMM,1024x14x14x1x1x256x14x14x32xNCHWxFP32x0x0x1x1x1x1x1x1;miopenConvolutionFwdAlgoDirect:ConvAsm1x1U,0.6216,0,miopenConvolutionFwdAlgoDirect,<unused>;miopenConvolutionFwdAlgoGEMM:gemm,0.528,0,rocBlas,<unused>;miopenConvolutionFwdAlgoWinograd:ConvBinWinogradRxSf3x2,0.920639,0,miopenConvolutionFwdAlgoWinograd,1024x14x14x1x1x256x14x14x32xNCHWxFP32x0x0x1x1x1x1x1x1
256-14-14-3x3-256-14-14-32-1x1-1x1-1x1-0-NCHW-FP32-F=miopenConvolutionFwdAlgoWinograd:ConvBinWinogradRxSf2x3,0.38832,0,miopenConvolutionFwdAlgoWinograd,256x14x14x3x3x256x14x14x32xNCHWxFP32x1x1x1x1x1x1x1x1
256-14-14-1x1-1024-14-14-32-0x0-1x1-1x1-0-NCHW-FP32-F=miopenConvolutionFwdAlgoImplicitGEMM:ConvHipImplicitGemmV4_1x1,0.564,0,miopenConvolutionFwdAlgoImplicitGEMM,256x14x14x1x1x1024x14x14x32xNCHWxFP32x0x0x1x1x1x1x1x1;miopenConvolutionFwdAlgoDirect:ConvAsm1x1U,0.5448,0,miopenConvolutionFwdAlgoDirect,<unused>;miopenConvolutionFwdAlgoGEMM:gemm,0.4784,0,rocBlas,<unused>;miopenConvolutionFwdAlgoWinograd:ConvBinWinogradRxSf3x2,0.840479,0,miopenConvolutionFwdAlgoWinograd,256x14x14x1x1x1024x14x14x32xNCHWxFP32x0x0x1x1x1x1x1x1
512-14-14-3x3-512-7-7-32-1x1-2x2-1x1-0-NCHW-FP32-F=miopenConvolutionFwdAlgoImplicitGEMM:ConvHipImplicitGemmV4R1Fwd,1.51696,0,miopenConvolutionFwdAlgoImplicitGEMM,512x14x14x3x3x512x7x7x32xNCHWxFP32x1x1x2x2x1x1x1x1;miopenConvolutionFwdAlgoDirect:ConvOclDirectFwd,5.78031,0,miopenConvolutionFwdAlgoDirect,<unused>;miopenConvolutionFwdAlgoGEMM:gemm,11.5558,903168,rocBlas,<unused>;miopenConvolutionFwdAlgoWinograd:ConvBinWinogradRxSf2x3,2.1464,0,miopenConvolutionFwdAlgoWinograd,512x14x14x3x3x512x7x7x32xNCHWxFP32x1x1x2x2x1x1x1x1
1536-7-7-1x1-2048-7-7-32-0x0-1x1-1x1-0-NCHW-FP32-F=miopenConvolutionFwdAlgoImplicitGEMM:ConvHipImplicitGemmV4R1Fwd,1.80224,0,miopenConvolutionFwdAlgoImplicitGEMM,1536x7x7x1x1x2048x7x7x32xNCHWxFP32x0x0x1x1x1x1x1x1;miopenConvolutionFwdAlgoDirect:ConvAsm1x1U,1.70512,0,miopenConvolutionFwdAlgoDirect,<unused>;miopenConvolutionFwdAlgoGEMM:gemm,2.108,0,rocBlas,<unused>;miopenConvolutionFwdAlgoWinograd:ConvBinWinogradRxSf3x2,3.23552,0,miopenConvolutionFwdAlgoWinograd,1536x7x7x1x1x2048x7x7x32xNCHWxFP32x0x0x1x1x1x1x1x1
2048-7-7-1x1-512-7-7-32-0x0-1x1-1x1-0-NCHW-FP32-F=miopenConvolutionFwdAlgoImplicitGEMM:ConvHipImplicitGemmV4R1Fwd,1.25824,0,miopenConvolutionFwdAlgoImplicitGEMM,2048x7x7x1x1x512x7x7x32xNCHWxFP32x0x0x1x1x1x1x1x1;miopenConvolutionFwdAlgoDirect:ConvAsm1x1U,0.848959,0,miopenConvolutionFwdAlgoDirect,<unused>;miopenConvolutionFwdAlgoGEMM:gemm,1.1496,0,rocBlas,<unused>;miopenConvolutionFwdAlgoWinograd:ConvBinWinogradRxSf3x2,1.30496,0,miopenConvolutionFwdAlgoWinograd,2048x7x7x1x1x512x7x7x32xNCHWxFP32x0x0x1x1x1x1x1x1
512-7-7-3x3-512-7-7-32-1x1-1x1-1x1-0-NCHW-FP32-F=miopenConvolutionFwdAlgoWinograd:ConvBinWinogradRxSf2x3,0.53792,0,miopenConvolutionFwdAlgoWinograd,512x7x7x3x3x512x7x7x32xNCHWxFP32x1x1x1x1x1x1x1x1
512-7-7-1x1-2048-7-7-32-0x0-1x1-1x1-0-NCHW-FP32-F=miopenConvolutionFwdAlgoImplicitGEMM:ConvHipImplicitGemmV4R1Fwd,0.61312,0,miopenConvolutionFwdAlgoImplicitGEMM,512x7x7x1x1x2048x7x7x32xNCHWxFP32x0x0x1x1x1x1x1x1;miopenConvolutionFwdAlgoDirect:ConvAsm1x1U,0.61536,0,miopenConvolutionFwdAlgoDirect,<unused>;miopenConvolutionFwdAlgoGEMM:gemm,0.6904,0,rocBlas,<unused>;miopenConvolutionFwdAlgoWinograd:ConvBinWinogradRxSf3x2,1.13072,0,miopenConvolutionFwdAlgoWinograd,512x7x7x1x1x2048x7x7x32xNCHWxFP32x0x0x1x1x1x1x1x1
3-299-299-3x3-32-149-149-16-0x0-2x2-1x1-0-NCHW-FP32-F=miopenConvolutionFwdAlgoDirect:ConvOclDirectFwd,0.4512,0,miopenConvolutionFwdAlgoDirect,<unused>;miopenConvolutionFwdAlgoGEMM:gemm,1.16992,2397708,rocBlas,<unused>;miopenConvolutionFwdAlgoWinograd:ConvBinWinogradRxSf2x3,0.3016,0,miopenConvolutionFwdAlgoWinograd,3x299x299x3x3x32x149x149x16xNCHWxFP32x0x0x2x2x1x1x1x1
32-149-149-3x3-32-147-147-16-0x0-1x1-1x1-0-NCHW-FP32-F=miopenConvolutionFwdAlgoDirect:ConvOclDirectFwd,1.74448,0,miopenConvolutionFwdAlgoDirect,<unused>;miopenConvolutionFwdAlgoGEMM:gemm,3.74016,24893568,rocBlas,<unused>;miopenConvolutionFwdAlgoWinograd:ConvBinWinogradRxSf2x3,0.42224,0,miopenConvolutionFwdAlgoWinograd,32x149x149x3x3x32x147x147x16xNCHWxFP32x0x0x1x1x1x1x1x1
32-147-147-3x3-64-147-147-16-1x1-1x1-1x1-0-NCHW-FP32-F=miopenConvolutionFwdAlgoWinograd:ConvBinWinogradRxSf2x3,0.80464,0,miopenConvolutionFwdAlgoWinograd,32x147x147x3x3x64x147x147x16xNCHWxFP32x1x1x1x1x1x1x1x1
64-147-147-3x3-96-73-73-16-0x0-2x2-1x1-0-NCHW-FP32-F=miopenConvolutionFwdAlgoDirect:ConvOclDirectFwd,5.86207,0,miopenConvolutionFwdAlgoDirect,<unused>;miopenConvolutionFwdAlgoGEMM:gemm,2.99264,12278016,rocBlas,<unused>;miopenConvolutionFwdAlgoWinograd:ConvBinWinogradRxSf2x3,1.97024,0,miopenConvolutionFwdAlgoWinograd,64x147x147x3x3x96x73x73x16xNCHWxFP32x0x0x2x2x1x1x1x1
160-73-73-1x1-64-73-73-16-0x0-1x1-1x1-0-NCHW-FP32-F=miopenConvolutionFwdAlgoDirect:ConvOclDirectFwd1x1,0.33184,0,miopenConvolutionFwdAlgoDirect,<unused>;miopenConvolutionFwdAlgoGEMM:gemm,0.19904,0,rocBlas,<unused>;miopenConvolutionFwdAlgoWinograd:ConvBinWinogradRxSf3x2,0.4384,0,miopenConvolutionFwdAlgoWinograd,160x73x73x1x1x64x73x73x16xNCHWxFP32x0x0x1x1x1x1x1x1
64-73-73-3x3-96-71-71-16-0x0-1x1-1x1-0-NCHW-FP32-F=miopenConvolutionFwdAlgoDirect:ConvOclDirectFwd,2.54656,0,miopenConvolutionFwdAlgoDirect,<unused>;miopenConvolutionFwdAlgoGEMM:gemm,2.00192,11614464,rocBlas,<unused>;miopenConvolutionFwdAlgoWinograd:ConvBinWinogradRxSf2x3,0.51168,0,miopenConvolutionFwdAlgoWinograd,64x73x73x3x3x96x71x71x16xNCHWxFP32x0x0x1x1x1x1x1x1
64-73-73-1x7-64-73-73-16-0x3-1x1-1x1-0-NCHW-FP32-F=miopenConvolutionFwdAlgoWinograd:ConvBinWinogradRxSf3x2,0.65856,0,miopenConvolutionFwdAlgoWinograd,64x73x73x1x7x64x73x73x16xNCHWxFP32x0x3x1x1x1x1x1x1;miopenConvolutionFwdAlgoGEMM:gemm,1.6896,9549568,rocBlas,<unused>
64-73-73-7x1-64-73-73-16-3x0-1x1-1x1-0-NCHW-FP32-F=miopenConvolutionFwdAlgoWinograd:ConvBinWinogradRxSf3x2,0.721439,0,miopenConvolutionFwdAlgoWinograd,64x73x73x7x1x64x73x73x16xNCHWxFP32x3x0x1x1x1x1x1x1;miopenConvolutionFwdAlgoGEMM:gemm,1.78176,9549568,rocBlas,<unused>
192-71-71-3x3-192-35-35-16-0x0-2x2-1x1-0-NCHW-FP32-F=miopenConvolutionFwdAlgoDirect:ConvOclDirectFwd,10.5403,0,miopenConvolutionFwdAlgoDirect,<unused>;miopenConvolutionFwdAlgoGEMM:gemm,2.87744,8467200,rocBlas,<unused>;miopenConvolutionFwdAlgoWinograd:ConvBinWinogradRxSf2x3,2.74816,0,miopenConvolutionFwdAlgoWinograd,192x71x71x3x3x192x35x35x16xNCHWxFP32x0x0x2x2x1x1x1x1
384-35-35-1x1-96-35-35-16-0x0-1x1-1x1-0-NCHW-FP32-F=miopenConvolutionFwdAlgoDirect:ConvAsm1x1U,0.21136,0,miopenConvolutionFwdAlgoDirect,<unused>;miopenConvolutionFwdAlgoGEMM:gemm,0.22592,0,rocBlas,<unused>;miopenConvolutionFwdAlgoWinograd:ConvBinWinogradRxSf3x2,0.36304,0,miopenConvolutionFwdAlgoWinograd,384x35x35x1x1x96x35x35x16xNCHWxFP32x0x0x1x1x1x1x1x1
384-35-35-1x1-64-35-35-16-0x0-1x1-1x1-0-NCHW-FP32-F=miopenConvolutionFwdAlgoDirect:ConvAsm1x1U,0.2056,0,miopenConvolutionFwdAlgoDirect,<unused>;miopenConvolutionFwdAlgoGEMM:gemm,0.16352,0,rocBlas,<unused>;miopenConvolutionFwdAlgoWinograd:ConvBinWinogradRxSf3x2,0.316,0,miopenConvolutionFwdAlgoWinograd,384x35x35x1x1x64x35x35x16xNCHWxFP32x0x0x1x1x1x1x1x1
64-35-35-3x3-96-35-35-16-1x1-1x1-1x1-0-NCHW-FP32-F=miopenConvolutionFwdAlgoWinograd:ConvBinWinograd3x3U,0.1528,0,miopenConvolutionFwdAlgoWinograd,64x35x35x3x3x96x35x35x16xNCHWxFP32x1x1x1x1x1x1x1x1
96-35-35-3x3-96-35-35-16-1x1-1x1-1x1-0-NCHW-FP32-F=miopenConvolutionFwdAlgoWinograd:ConvBinWinograd3x3U,0.20992,0,miopenConvolutionFwdAlgoWinograd,96x35x35x3x3x96x35x35x16xNCHWxFP32x1x1x1x1x1x1x1x1
