dockerfiles/miopen/gfx906_60.HIP.2_3_0.ufdb.txt
3-224-224-7x7-64-112-112-1-3x3-2x2-1x1-0-NCHW-FP32-F=miopenConvolutionFwdAlgoDirect:ConvAsm7x7c3h224w224k64u2v2p3q3f1,0.04016,0,miopenConvolutionFwdAlgoDirect,<unused>;miopenConvolutionFwdAlgoGEMM:gemm,0.09232,7375872,rocBlas,<unused>;miopenConvolutionFwdAlgoWinograd:ConvBinWinogradRxS,0.07008,0,miopenConvolutionFwdAlgoWinograd,3x224x224x7x7x64x112x112x1xNCHWxFP32x3x3x2x2x1x1x1x1
64-56-56-1x1-64-56-56-1-0x0-1x1-1x1-0-NCHW-FP32-F=miopenConvolutionFwdAlgoImplicitGEMM:ConvHipImplicitGemmV4R4Fwd,0.01824,0,miopenConvolutionFwdAlgoImplicitGEMM,64x56x56x1x1x64x56x56x1xNCHWxFP32x0x0x1x1x1x1x1x1;miopenConvolutionFwdAlgoDirect:ConvAsm1x1U,0.01088,0,miopenConvolutionFwdAlgoDirect,<unused>;miopenConvolutionFwdAlgoGEMM:gemm,0.02656,0,rocBlas,<unused>;miopenConvolutionFwdAlgoWinograd:ConvBinWinogradRxS,0.03648,0,miopenConvolutionFwdAlgoWinograd,64x56x56x1x1x64x56x56x1xNCHWxFP32x0x0x1x1x1x1x1x1
64-56-56-3x3-64-56-56-1-1x1-1x1-1x1-0-NCHW-FP32-F=miopenConvolutionFwdAlgoWinograd:ConvBinWinograd3x3U,0.03504,0,miopenConvolutionFwdAlgoWinograd,64x56x56x3x3x64x56x56x1xNCHWxFP32x1x1x1x1x1x1x1x1
128-56-56-1x1-256-56-56-1-0x0-1x1-1x1-0-NCHW-FP32-F=miopenConvolutionFwdAlgoImplicitGEMM:ConvHipImplicitGemmV4R4Fwd,0.03824,0,miopenConvolutionFwdAlgoImplicitGEMM,128x56x56x1x1x256x56x56x1xNCHWxFP32x0x0x1x1x1x1x1x1;miopenConvolutionFwdAlgoDirect:ConvOclDirectFwd1x1,0.0416,0,miopenConvolutionFwdAlgoDirect,<unused>;miopenConvolutionFwdAlgoGEMM:gemm,0.05248,0,rocBlas,<unused>;miopenConvolutionFwdAlgoWinograd:ConvBinWinogradRxSf3x2,0.08816,0,miopenConvolutionFwdAlgoWinograd,128x56x56x1x1x256x56x56x1xNCHWxFP32x0x0x1x1x1x1x1x1
256-56-56-1x1-64-56-56-1-0x0-1x1-1x1-0-NCHW-FP32-F=miopenConvolutionFwdAlgoImplicitGEMM:ConvHipImplicitGemmV4R4Fwd,0.06048,0,miopenConvolutionFwdAlgoImplicitGEMM,256x56x56x1x1x64x56x56x1xNCHWxFP32x0x0x1x1x1x1x1x1;miopenConvolutionFwdAlgoDirect:ConvAsm1x1U,0.0296,0,miopenConvolutionFwdAlgoDirect,<unused>;miopenConvolutionFwdAlgoGEMM:gemm,0.05984,0,rocBlas,<unused>;miopenConvolutionFwdAlgoWinograd:ConvBinWinogradRxS,0.07408,0,miopenConvolutionFwdAlgoWinograd,256x56x56x1x1x64x56x56x1xNCHWxFP32x0x0x1x1x1x1x1x1
64-56-56-1x1-256-56-56-1-0x0-1x1-1x1-0-NCHW-FP32-F=miopenConvolutionFwdAlgoImplicitGEMM:ConvHipImplicitGemmV4R4Fwd,0.02912,0,miopenConvolutionFwdAlgoImplicitGEMM,64x56x56x1x1x256x56x56x1xNCHWxFP32x0x0x1x1x1x1x1x1;miopenConvolutionFwdAlgoDirect:ConvOclDirectFwd1x1,0.02304,0,miopenConvolutionFwdAlgoDirect,<unused>;miopenConvolutionFwdAlgoGEMM:gemm,0.036,0,rocBlas,<unused>;miopenConvolutionFwdAlgoWinograd:ConvBinWinogradRxSf3x2,0.06304,0,miopenConvolutionFwdAlgoWinograd,64x56x56x1x1x256x56x56x1xNCHWxFP32x0x0x1x1x1x1x1x1
256-56-56-1x1-128-56-56-1-0x0-1x1-1x1-0-NCHW-FP32-F=miopenConvolutionFwdAlgoImplicitGEMM:ConvHipImplicitGemmV4R4Fwd,0.05584,0,miopenConvolutionFwdAlgoImplicitGEMM,256x56x56x1x1x128x56x56x1xNCHWxFP32x0x0x1x1x1x1x1x1;miopenConvolutionFwdAlgoDirect:ConvAsm1x1U,0.04272,0,miopenConvolutionFwdAlgoDirect,<unused>;miopenConvolutionFwdAlgoGEMM:gemm,0.06624,0,rocBlas,<unused>;miopenConvolutionFwdAlgoWinograd:ConvBinWinogradRxSf3x2,0.0848,0,miopenConvolutionFwdAlgoWinograd,256x56x56x1x1x128x56x56x1xNCHWxFP32x0x0x1x1x1x1x1x1
128-56-56-3x3-128-28-28-1-1x1-2x2-1x1-0-NCHW-FP32-F=miopenConvolutionFwdAlgoDirect:ConvOclDirectFwd,0.41056,0,miopenConvolutionFwdAlgoDirect,<unused>;miopenConvolutionFwdAlgoGEMM:gemm,0.09552,3612672,rocBlas,<unused>;miopenConvolutionFwdAlgoWinograd:ConvBinWinogradRxS,0.13344,0,miopenConvolutionFwdAlgoWinograd,128x56x56x3x3x128x28x28x1xNCHWxFP32x1x1x2x2x1x1x1x1
384-28-28-1x1-512-28-28-1-0x0-1x1-1x1-0-NCHW-FP32-F=miopenConvolutionFwdAlgoDirect:ConvOclDirectFwd1x1,0.06304,0,miopenConvolutionFwdAlgoDirect,<unused>;miopenConvolutionFwdAlgoGEMM:gemm,0.064,0,rocBlas,<unused>;miopenConvolutionFwdAlgoWinograd:ConvBinWinogradRxS,0.18016,0,miopenConvolutionFwdAlgoWinograd,384x28x28x1x1x512x28x28x1xNCHWxFP32x0x0x1x1x1x1x1x1
512-28-28-1x1-128-28-28-1-0x0-1x1-1x1-0-NCHW-FP32-F=miopenConvolutionFwdAlgoDirect:ConvOclDirectFwd1x1,0.03408,0,miopenConvolutionFwdAlgoDirect,<unused>;miopenConvolutionFwdAlgoGEMM:gemm,0.10912,0,rocBlas,<unused>;miopenConvolutionFwdAlgoWinograd:ConvBinWinogradRxSf2x3,0.1264,0,miopenConvolutionFwdAlgoWinograd,512x28x28x1x1x128x28x28x1xNCHWxFP32x0x0x1x1x1x1x1x1
128-28-28-3x3-128-28-28-1-1x1-1x1-1x1-0-NCHW-FP32-F=miopenConvolutionFwdAlgoWinograd:ConvBinWinograd3x3U,0.05232,0,miopenConvolutionFwdAlgoWinograd,128x28x28x3x3x128x28x28x1xNCHWxFP32x1x1x1x1x1x1x1x1
128-28-28-1x1-512-28-28-1-0x0-1x1-1x1-0-NCHW-FP32-F=miopenConvolutionFwdAlgoDirect:ConvOclDirectFwd1x1,0.02864,0,miopenConvolutionFwdAlgoDirect,<unused>;miopenConvolutionFwdAlgoGEMM:gemm,0.04512,0,rocBlas,<unused>;miopenConvolutionFwdAlgoWinograd:ConvBinWinogradRxS,0.07632,0,miopenConvolutionFwdAlgoWinograd,128x28x28x1x1x512x28x28x1xNCHWxFP32x0x0x1x1x1x1x1x1
512-28-28-1x1-256-28-28-1-0x0-1x1-1x1-0-NCHW-FP32-F=miopenConvolutionFwdAlgoDirect:ConvAsm1x1U,0.04416,0,miopenConvolutionFwdAlgoDirect,<unused>;miopenConvolutionFwdAlgoGEMM:gemm,0.10384,0,rocBlas,<unused>;miopenConvolutionFwdAlgoWinograd:ConvBinWinogradRxSf2x3,0.1264,0,miopenConvolutionFwdAlgoWinograd,512x28x28x1x1x256x28x28x1xNCHWxFP32x0x0x1x1x1x1x1x1
256-28-28-3x3-256-14-14-1-1x1-2x2-1x1-0-NCHW-FP32-F=miopenConvolutionFwdAlgoDirect:ConvOclDirectFwd,0.730719,0,miopenConvolutionFwdAlgoDirect,<unused>;miopenConvolutionFwdAlgoGEMM:gemm,0.09952,1806336,rocBlas,<unused>;miopenConvolutionFwdAlgoWinograd:ConvBinWinogradRxSf2x3,0.236,0,miopenConvolutionFwdAlgoWinograd,256x28x28x3x3x256x14x14x1xNCHWxFP32x1x1x2x2x1x1x1x1
768-14-14-1x1-1024-14-14-1-0x0-1x1-1x1-0-NCHW-FP32-F=miopenConvolutionFwdAlgoDirect:ConvAsm1x1U,0.11264,0,miopenConvolutionFwdAlgoDirect,<unused>;miopenConvolutionFwdAlgoGEMM:gemm,0.08448,0,rocBlas,<unused>;miopenConvolutionFwdAlgoWinograd:ConvBinWinogradRxSf3x2,0.18848,0,miopenConvolutionFwdAlgoWinograd,768x14x14x1x1x1024x14x14x1xNCHWxFP32x0x0x1x1x1x1x1x1
1024-14-14-1x1-256-14-14-1-0x0-1x1-1x1-0-NCHW-FP32-F=miopenConvolutionFwdAlgoDirect:ConvAsm1x1U,0.04224,0,miopenConvolutionFwdAlgoDirect,<unused>;miopenConvolutionFwdAlgoGEMM:gemm,0.08656,0,rocBlas,<unused>;miopenConvolutionFwdAlgoWinograd:ConvBinWinogradRxSf2x3,0.22688,0,miopenConvolutionFwdAlgoWinograd,1024x14x14x1x1x256x14x14x1xNCHWxFP32x0x0x1x1x1x1x1x1
256-14-14-3x3-256-14-14-1-1x1-1x1-1x1-0-NCHW-FP32-F=miopenConvolutionFwdAlgoWinograd:ConvBinWinograd3x3U,0.07296,0,miopenConvolutionFwdAlgoWinograd,256x14x14x3x3x256x14x14x1xNCHWxFP32x1x1x1x1x1x1x1x1
256-14-14-1x1-1024-14-14-1-0x0-1x1-1x1-0-NCHW-FP32-F=miopenConvolutionFwdAlgoDirect:ConvAsm1x1U,0.03488,0,miopenConvolutionFwdAlgoDirect,<unused>;miopenConvolutionFwdAlgoGEMM:gemm,0.0432,0,rocBlas,<unused>;miopenConvolutionFwdAlgoWinograd:ConvBinWinogradRxSf3x2,0.08384,0,miopenConvolutionFwdAlgoWinograd,256x14x14x1x1x1024x14x14x1xNCHWxFP32x0x0x1x1x1x1x1x1
1024-14-14-1x1-512-14-14-1-0x0-1x1-1x1-0-NCHW-FP32-F=miopenConvolutionFwdAlgoDirect:ConvOclDirectFwd1x1,0.0744,0,miopenConvolutionFwdAlgoDirect,<unused>;miopenConvolutionFwdAlgoGEMM:gemm,0.09328,0,rocBlas,<unused>;miopenConvolutionFwdAlgoWinograd:ConvBinWinogradRxS,0.2328,0,miopenConvolutionFwdAlgoWinograd,1024x14x14x1x1x512x14x14x1xNCHWxFP32x0x0x1x1x1x1x1x1
512-14-14-3x3-512-7-7-1-1x1-2x2-1x1-0-NCHW-FP32-F=miopenConvolutionFwdAlgoDirect:ConvOclDirectFwd,1.15232,0,miopenConvolutionFwdAlgoDirect,<unused>;miopenConvolutionFwdAlgoGEMM:gemm,0.3592,903168,rocBlas,<unused>;miopenConvolutionFwdAlgoWinograd:ConvBinWinogradRxSf2x3,0.44832,0,miopenConvolutionFwdAlgoWinograd,512x14x14x3x3x512x7x7x1xNCHWxFP32x1x1x2x2x1x1x1x1
1536-7-7-1x1-2048-7-7-1-0x0-1x1-1x1-0-NCHW-FP32-F=miopenConvolutionFwdAlgoDirect:ConvOclDirectFwd1x1,0.14752,0,miopenConvolutionFwdAlgoDirect,<unused>;miopenConvolutionFwdAlgoGEMM:gemm,0.10608,0,rocBlas,<unused>;miopenConvolutionFwdAlgoWinograd:ConvBinWinogradRxSf2x3,0.62352,0,miopenConvolutionFwdAlgoWinograd,1536x7x7x1x1x2048x7x7x1xNCHWxFP32x0x0x1x1x1x1x1x1
2048-7-7-1x1-512-7-7-1-0x0-1x1-1x1-0-NCHW-FP32-F=miopenConvolutionFwdAlgoDirect:ConvOclDirectFwd1x1,0.05648,0,miopenConvolutionFwdAlgoDirect,<unused>;miopenConvolutionFwdAlgoGEMM:gemm,0.07088,0,rocBlas,<unused>;miopenConvolutionFwdAlgoWinograd:ConvBinWinogradRxSf2x3,0.42864,0,miopenConvolutionFwdAlgoWinograd,2048x7x7x1x1x512x7x7x1xNCHWxFP32x0x0x1x1x1x1x1x1
512-7-7-3x3-512-7-7-1-1x1-1x1-1x1-0-NCHW-FP32-F=miopenConvolutionFwdAlgoWinograd:ConvBinWinograd3x3U,0.132,0,miopenConvolutionFwdAlgoWinograd,512x7x7x3x3x512x7x7x1xNCHWxFP32x1x1x1x1x1x1x1x1
512-7-7-1x1-2048-7-7-1-0x0-1x1-1x1-0-NCHW-FP32-F=miopenConvolutionFwdAlgoDirect:ConvOclDirectFwd1x1,0.04656,0,miopenConvolutionFwdAlgoDirect,<unused>;miopenConvolutionFwdAlgoGEMM:gemm,0.04592,0,rocBlas,<unused>;miopenConvolutionFwdAlgoWinograd:ConvBinWinogradRxSf2x3,0.22592,0,miopenConvolutionFwdAlgoWinograd,512x7x7x1x1x2048x7x7x1xNCHWxFP32x0x0x1x1x1x1x1x1
3-299-299-3x3-32-149-149-1-0x0-2x2-1x1-0-NCHW-FP32-F=miopenConvolutionFwdAlgoDirect:ConvOclDirectFwd,0.03968,0,miopenConvolutionFwdAlgoDirect,<unused>;miopenConvolutionFwdAlgoGEMM:gemm,0.06256,2397708,rocBlas,<unused>;miopenConvolutionFwdAlgoWinograd:ConvBinWinogradRxSf2x3,0.04,0,miopenConvolutionFwdAlgoWinograd,3x299x299x3x3x32x149x149x1xNCHWxFP32x0x0x2x2x1x1x1x1
32-149-149-3x3-32-147-147-1-0x0-1x1-1x1-0-NCHW-FP32-F=miopenConvolutionFwdAlgoDirect:ConvOclDirectFwd,0.15088,0,miopenConvolutionFwdAlgoDirect,<unused>;miopenConvolutionFwdAlgoGEMM:gemm,0.14656,24893568,rocBlas,<unused>;miopenConvolutionFwdAlgoWinograd:ConvBinWinogradRxS,0.04832,0,miopenConvolutionFwdAlgoWinograd,32x149x149x3x3x32x147x147x1xNCHWxFP32x0x0x1x1x1x1x1x1
32-147-147-3x3-64-147-147-1-1x1-1x1-1x1-0-NCHW-FP32-F=miopenConvolutionFwdAlgoWinograd:ConvBinWinograd3x3U,0.07136,0,miopenConvolutionFwdAlgoWinograd,32x147x147x3x3x64x147x147x1xNCHWxFP32x1x1x1x1x1x1x1x1
64-73-73-1x1-80-73-73-1-0x0-1x1-1x1-0-NCHW-FP32-F=miopenConvolutionFwdAlgoDirect:ConvOclDirectFwd1x1,0.0144,0,miopenConvolutionFwdAlgoDirect,<unused>;miopenConvolutionFwdAlgoGEMM:gemm,0.03408,0,rocBlas,<unused>;miopenConvolutionFwdAlgoWinograd:ConvBinWinogradRxSf3x2,0.04496,0,miopenConvolutionFwdAlgoWinograd,64x73x73x1x1x80x73x73x1xNCHWxFP32x0x0x1x1x1x1x1x1
80-73-73-3x3-192-71-71-1-0x0-1x1-1x1-0-NCHW-FP32-F=miopenConvolutionFwdAlgoDirect:ConvOclDirectFwd,0.51744,0,miopenConvolutionFwdAlgoDirect,<unused>;miopenConvolutionFwdAlgoGEMM:gemm,0.18416,14518080,rocBlas,<unused>;miopenConvolutionFwdAlgoWinograd:ConvBinWinogradRxS,0.11232,0,miopenConvolutionFwdAlgoWinograd,80x73x73x3x3x192x71x71x1xNCHWxFP32x0x0x1x1x1x1x1x1
192-35-35-1x1-64-35-35-1-0x0-1x1-1x1-0-NCHW-FP32-F=miopenConvolutionFwdAlgoDirect:ConvAsm1x1U,0.01872,0,miopenConvolutionFwdAlgoDirect,<unused>;miopenConvolutionFwdAlgoGEMM:gemm,0.03776,0,rocBlas,<unused>;miopenConvolutionFwdAlgoWinograd:ConvBinWinogradRxS,0.06256,0,miopenConvolutionFwdAlgoWinograd,192x35x35x1x1x64x35x35x1xNCHWxFP32x0x0x1x1x1x1x1x1
192-35-35-1x1-48-35-35-1-0x0-1x1-1x1-0-NCHW-FP32-F=miopenConvolutionFwdAlgoDirect:ConvAsm1x1U,0.01152,0,miopenConvolutionFwdAlgoDirect,<unused>;miopenConvolutionFwdAlgoGEMM:gemm,0.05344,0,rocBlas,<unused>;miopenConvolutionFwdAlgoWinograd:ConvBinWinogradRxS,0.0624,0,miopenConvolutionFwdAlgoWinograd,192x35x35x1x1x48x35x35x1xNCHWxFP32x0x0x1x1x1x1x1x1
48-35-35-5x5-64-35-35-1-2x2-1x1-1x1-0-NCHW-FP32-F=miopenConvolutionFwdAlgoDirect:ConvOclDirectFwd,0.15936,0,miopenConvolutionFwdAlgoDirect,<unused>;miopenConvolutionFwdAlgoGEMM:gemm,0.06976,5880000,rocBlas,<unused>;miopenConvolutionFwdAlgoWinograd:ConvBinWinogradRxSf2x3,0.06496,0,miopenConvolutionFwdAlgoWinograd,48x35x35x5x5x64x35x35x1xNCHWxFP32x2x2x1x1x1x1x1x1
64-35-35-3x3-96-35-35-1-1x1-1x1-1x1-0-NCHW-FP32-F=miopenConvolutionFwdAlgoWinograd:ConvBinWinograd3x3U,0.03504,0,miopenConvolutionFwdAlgoWinograd,64x35x35x3x3x96x35x35x1xNCHWxFP32x1x1x1x1x1x1x1x1
96-35-35-3x3-96-35-35-1-1x1-1x1-1x1-0-NCHW-FP32-F=miopenConvolutionFwdAlgoWinograd:ConvBinWinograd3x3U,0.04064,0,miopenConvolutionFwdAlgoWinograd,96x35x35x3x3x96x35x35x1xNCHWxFP32x1x1x1x1x1x1x1x1
192-35-35-1x1-32-35-35-1-0x0-1x1-1x1-0-NCHW-FP32-F=miopenConvolutionFwdAlgoDirect:ConvAsm1x1U,0.01088,0,miopenConvolutionFwdAlgoDirect,<unused>;miopenConvolutionFwdAlgoGEMM:gemm,0.05568,0,rocBlas,<unused>;miopenConvolutionFwdAlgoWinograd:ConvBinWinogradRxSf2x3,0.06144,0,miopenConvolutionFwdAlgoWinograd,192x35x35x1x1x32x35x35x1xNCHWxFP32x0x0x1x1x1x1x1x1
256-35-35-1x1-64-35-35-1-0x0-1x1-1x1-0-NCHW-FP32-F=miopenConvolutionFwdAlgoDirect:ConvAsm1x1U,0.01696,0,miopenConvolutionFwdAlgoDirect,<unused>;miopenConvolutionFwdAlgoGEMM:gemm,0.06128,0,rocBlas,<unused>;miopenConvolutionFwdAlgoWinograd:ConvBinWinogradRxS,0.0752,0,miopenConvolutionFwdAlgoWinograd,256x35x35x1x1x64x35x35x1xNCHWxFP32x0x0x1x1x1x1x1x1
256-35-35-1x1-48-35-35-1-0x0-1x1-1x1-0-NCHW-FP32-F=miopenConvolutionFwdAlgoDirect:ConvAsm1x1U,0.01312,0,miopenConvolutionFwdAlgoDirect,<unused>;miopenConvolutionFwdAlgoGEMM:gemm,0.06064,0,rocBlas,<unused>;miopenConvolutionFwdAlgoWinograd:ConvBinWinogradRxS,0.07536,0,miopenConvolutionFwdAlgoWinograd,256x35x35x1x1x48x35x35x1xNCHWxFP32x0x0x1x1x1x1x1x1
288-35-35-1x1-64-35-35-1-0x0-1x1-1x1-0-NCHW-FP32-F=miopenConvolutionFwdAlgoDirect:ConvAsm1x1U,0.0184,0,miopenConvolutionFwdAlgoDirect,<unused>;miopenConvolutionFwdAlgoGEMM:gemm,0.06448,0,rocBlas,<unused>;miopenConvolutionFwdAlgoWinograd:ConvBinWinogradRxS,0.08176,0,miopenConvolutionFwdAlgoWinograd,288x35x35x1x1x64x35x35x1xNCHWxFP32x0x0x1x1x1x1x1x1
288-35-35-1x1-48-35-35-1-0x0-1x1-1x1-0-NCHW-FP32-F=miopenConvolutionFwdAlgoDirect:ConvAsm1x1U,0.01776,0,miopenConvolutionFwdAlgoDirect,<unused>;miopenConvolutionFwdAlgoGEMM:gemm,0.0648,0,rocBlas,<unused>;miopenConvolutionFwdAlgoWinograd:ConvBinWinogradRxSf2x3,0.08192,0,miopenConvolutionFwdAlgoWinograd,288x35x35x1x1x48x35x35x1xNCHWxFP32x0x0x1x1x1x1x1x1
288-35-35-3x3-384-17-17-1-0x0-2x2-1x1-0-NCHW-FP32-F=miopenConvolutionFwdAlgoDirect:ConvOclDirectFwd,1.20864,0,miopenConvolutionFwdAlgoDirect,<unused>;miopenConvolutionFwdAlgoGEMM:gemm,0.11616,2996352,rocBlas,<unused>;miopenConvolutionFwdAlgoWinograd:ConvBinWinogradRxSf2x3,0.26304,0,miopenConvolutionFwdAlgoWinograd,288x35x35x3x3x384x17x17x1xNCHWxFP32x0x0x2x2x1x1x1x1
96-35-35-3x3-96-17-17-1-0x0-2x2-1x1-0-NCHW-FP32-F=miopenConvolutionFwdAlgoDirect:ConvOclDirectFwd,0.32224,0,miopenConvolutionFwdAlgoDirect,<unused>;miopenConvolutionFwdAlgoGEMM:gemm,0.0448,998784,rocBlas,<unused>;miopenConvolutionFwdAlgoWinograd:ConvBinWinogradRxSf2x3,0.10512,0,miopenConvolutionFwdAlgoWinograd,96x35x35x3x3x96x17x17x1xNCHWxFP32x0x0x2x2x1x1x1x1
768-17-17-1x1-192-17-17-1-0x0-1x1-1x1-0-NCHW-FP32-F=miopenConvolutionFwdAlgoDirect:ConvAsm1x1U,0.03456,0,miopenConvolutionFwdAlgoDirect,<unused>;miopenConvolutionFwdAlgoGEMM:gemm,0.14752,0,rocBlas,<unused>;miopenConvolutionFwdAlgoWinograd:ConvBinWinogradRxSf2x3,0.17376,0,miopenConvolutionFwdAlgoWinograd,768x17x17x1x1x192x17x17x1xNCHWxFP32x0x0x1x1x1x1x1x1
768-17-17-1x1-128-17-17-1-0x0-1x1-1x1-0-NCHW-FP32-F=miopenConvolutionFwdAlgoDirect:ConvAsm1x1U,0.0272,0,miopenConvolutionFwdAlgoDirect,<unused>;miopenConvolutionFwdAlgoGEMM:gemm,0.0776,0,rocBlas,<unused>;miopenConvolutionFwdAlgoWinograd:ConvBinWinogradRxSf2x3,0.17376,0,miopenConvolutionFwdAlgoWinograd,768x17x17x1x1x128x17x17x1xNCHWxFP32x0x0x1x1x1x1x1x1
128-17-17-1x7-128-17-17-1-0x3-1x1-1x1-0-NCHW-FP32-F=miopenConvolutionFwdAlgoWinograd:ConvBinWinogradRxSf2x3,0.12496,0,miopenConvolutionFwdAlgoWinograd,128x17x17x1x7x128x17x17x1xNCHWxFP32x0x3x1x1x1x1x1x1;miopenConvolutionFwdAlgoGEMM:gemm,0.04528,1035776,rocBlas,<unused>
128-17-17-7x1-192-17-17-1-3x0-1x1-1x1-0-NCHW-FP32-F=miopenConvolutionFwdAlgoWinograd:ConvBinWinogradRxSf2x3,0.10096,0,miopenConvolutionFwdAlgoWinograd,128x17x17x7x1x192x17x17x1xNCHWxFP32x3x0x1x1x1x1x1x1;miopenConvolutionFwdAlgoGEMM:gemm,0.04752,1035776,rocBlas,<unused>
128-17-17-7x1-128-17-17-1-3x0-1x1-1x1-0-NCHW-FP32-F=miopenConvolutionFwdAlgoWinograd:ConvBinWinogradRxSf2x3,0.09952,0,miopenConvolutionFwdAlgoWinograd,128x17x17x7x1x128x17x17x1xNCHWxFP32x3x0x1x1x1x1x1x1;miopenConvolutionFwdAlgoGEMM:gemm,0.04608,1035776,rocBlas,<unused>
128-17-17-1x7-192-17-17-1-0x3-1x1-1x1-0-NCHW-FP32-F=miopenConvolutionFwdAlgoWinograd:ConvBinWinogradRxSf2x3,0.124,0,miopenConvolutionFwdAlgoWinograd,128x17x17x1x7x192x17x17x1xNCHWxFP32x0x3x1x1x1x1x1x1;miopenConvolutionFwdAlgoGEMM:gemm,0.04576,1035776,rocBlas,<unused>
768-17-17-1x1-160-17-17-1-0x0-1x1-1x1-0-NCHW-FP32-F=miopenConvolutionFwdAlgoDirect:ConvAsm1x1U,0.03328,0,miopenConvolutionFwdAlgoDirect,<unused>;miopenConvolutionFwdAlgoGEMM:gemm,0.14496,0,rocBlas,<unused>;miopenConvolutionFwdAlgoWinograd:ConvBinWinogradRxSf2x3,0.17408,0,miopenConvolutionFwdAlgoWinograd,768x17x17x1x1x160x17x17x1xNCHWxFP32x0x0x1x1x1x1x1x1
160-17-17-1x7-160-17-17-1-0x3-1x1-1x1-0-NCHW-FP32-F=miopenConvolutionFwdAlgoWinograd:ConvBinWinogradRxSf2x3,0.1496,0,miopenConvolutionFwdAlgoWinograd,160x17x17x1x7x160x17x17x1xNCHWxFP32x0x3x1x1x1x1x1x1;miopenConvolutionFwdAlgoGEMM:gemm,0.0504,1294720,rocBlas,<unused>
160-17-17-7x1-192-17-17-1-3x0-1x1-1x1-0-NCHW-FP32-F=miopenConvolutionFwdAlgoWinograd:ConvBinWinogradRxSf2x3,0.12032,0,miopenConvolutionFwdAlgoWinograd,160x17x17x7x1x192x17x17x1xNCHWxFP32x3x0x1x1x1x1x1x1;miopenConvolutionFwdAlgoGEMM:gemm,0.05296,1294720,rocBlas,<unused>
160-17-17-7x1-160-17-17-1-3x0-1x1-1x1-0-NCHW-FP32-F=miopenConvolutionFwdAlgoWinograd:ConvBinWinogradRxSf2x3,0.11776,0,miopenConvolutionFwdAlgoWinograd,160x17x17x7x1x160x17x17x1xNCHWxFP32x3x0x1x1x1x1x1x1;miopenConvolutionFwdAlgoGEMM:gemm,0.05152,1294720,rocBlas,<unused>
160-17-17-1x7-192-17-17-1-0x3-1x1-1x1-0-NCHW-FP32-F=miopenConvolutionFwdAlgoWinograd:ConvBinWinogradRxSf2x3,0.14832,0,miopenConvolutionFwdAlgoWinograd,160x17x17x1x7x192x17x17x1xNCHWxFP32x0x3x1x1x1x1x1x1;miopenConvolutionFwdAlgoGEMM:gemm,0.05264,1294720,rocBlas,<unused>
192-17-17-1x7-192-17-17-1-0x3-1x1-1x1-0-NCHW-FP32-F=miopenConvolutionFwdAlgoWinograd:ConvBinWinogradRxSf2x3,0.17328,0,miopenConvolutionFwdAlgoWinograd,192x17x17x1x7x192x17x17x1xNCHWxFP32x0x3x1x1x1x1x1x1;miopenConvolutionFwdAlgoGEMM:gemm,0.05872,1553664,rocBlas,<unused>
192-17-17-7x1-192-17-17-1-3x0-1x1-1x1-0-NCHW-FP32-F=miopenConvolutionFwdAlgoWinograd:ConvBinWinogradRxSf2x3,0.13872,0,miopenConvolutionFwdAlgoWinograd,192x17x17x7x1x192x17x17x1xNCHWxFP32x3x0x1x1x1x1x1x1;miopenConvolutionFwdAlgoGEMM:gemm,0.05888,1553664,rocBlas,<unused>
192-17-17-3x3-320-8-8-1-0x0-2x2-1x1-0-NCHW-FP32-F=miopenConvolutionFwdAlgoImplicitGEMM:ConvHipImplicitGemmV4R4Fwd,0.21312,0,miopenConvolutionFwdAlgoImplicitGEMM,192x17x17x3x3x320x8x8x1xNCHWxFP32x0x0x2x2x1x1x1x1;miopenConvolutionFwdAlgoDirect:ConvOclDirectFwd,0.65072,0,miopenConvolutionFwdAlgoDirect,<unused>;miopenConvolutionFwdAlgoGEMM:gemm,0.0592,442368,rocBlas,<unused>;miopenConvolutionFwdAlgoWinograd:ConvBinWinogradRxSf2x3,0.18288,0,miopenConvolutionFwdAlgoWinograd,192x17x17x3x3x320x8x8x1xNCHWxFP32x0x0x2x2x1x1x1x1
192-17-17-3x3-192-8-8-1-0x0-2x2-1x1-0-NCHW-FP32-F=miopenConvolutionFwdAlgoImplicitGEMM:ConvHipImplicitGemmV4R4Fwd,0.216,0,miopenConvolutionFwdAlgoImplicitGEMM,192x17x17x3x3x192x8x8x1xNCHWxFP32x0x0x2x2x1x1x1x1;miopenConvolutionFwdAlgoDirect:ConvOclDirectFwd,0.65856,0,miopenConvolutionFwdAlgoDirect,<unused>;miopenConvolutionFwdAlgoGEMM:gemm,0.05904,442368,rocBlas,<unused>;miopenConvolutionFwdAlgoWinograd:ConvBinWinogradRxSf2x3,0.18304,0,miopenConvolutionFwdAlgoWinograd,192x17x17x3x3x192x8x8x1xNCHWxFP32x0x0x2x2x1x1x1x1
1280-8-8-1x1-320-8-8-1-0x0-1x1-1x1-0-NCHW-FP32-F=miopenConvolutionFwdAlgoImplicitGEMM:ConvHipImplicitGemmV4R4Fwd,0.15152,0,miopenConvolutionFwdAlgoImplicitGEMM,1280x8x8x1x1x320x8x8x1xNCHWxFP32x0x0x1x1x1x1x1x1;miopenConvolutionFwdAlgoDirect:ConvAsm1x1U,0.05136,0,miopenConvolutionFwdAlgoDirect,<unused>;miopenConvolutionFwdAlgoGEMM:gemm,0.048,0,rocBlas,<unused>;miopenConvolutionFwdAlgoWinograd:ConvBinWinogradRxSf2x3,0.2736,0,miopenConvolutionFwdAlgoWinograd,1280x8x8x1x1x320x8x8x1xNCHWxFP32x0x0x1x1x1x1x1x1
1280-8-8-1x1-384-8-8-1-0x0-1x1-1x1-0-NCHW-FP32-F=miopenConvolutionFwdAlgoImplicitGEMM:ConvHipImplicitGemmV4R4Fwd,0.1464,0,miopenConvolutionFwdAlgoImplicitGEMM,1280x8x8x1x1x384x8x8x1xNCHWxFP32x0x0x1x1x1x1x1x1;miopenConvolutionFwdAlgoDirect:ConvAsm1x1U,0.03824,0,miopenConvolutionFwdAlgoDirect,<unused>;miopenConvolutionFwdAlgoGEMM:gemm,0.0496,0,rocBlas,<unused>;miopenConvolutionFwdAlgoWinograd:ConvBinWinogradRxSf2x3,0.27504,0,miopenConvolutionFwdAlgoWinograd,1280x8x8x1x1x384x8x8x1xNCHWxFP32x0x0x1x1x1x1x1x1
384-8-8-1x3-384-8-8-1-0x1-1x1-1x1-0-NCHW-FP32-F=miopenConvolutionFwdAlgoImplicitGEMM:ConvHipImplicitGemmV4R4Fwd,0.1592,0,miopenConvolutionFwdAlgoImplicitGEMM,384x8x8x1x3x384x8x8x1xNCHWxFP32x0x1x1x1x1x1x1x1;miopenConvolutionFwdAlgoGEMM:gemm,0.04464,294912,rocBlas,<unused>;miopenConvolutionFwdAlgoWinograd:ConvBinWinogradRxS,0.09904,0,miopenConvolutionFwdAlgoWinograd,384x8x8x1x3x384x8x8x1xNCHWxFP32x0x1x1x1x1x1x1x1
384-8-8-3x1-384-8-8-1-1x0-1x1-1x1-0-NCHW-FP32-F=miopenConvolutionFwdAlgoImplicitGEMM:ConvHipImplicitGemmV4R4Fwd,0.15488,0,miopenConvolutionFwdAlgoImplicitGEMM,384x8x8x3x1x384x8x8x1xNCHWxFP32x1x0x1x1x1x1x1x1;miopenConvolutionFwdAlgoGEMM:gemm,0.04496,294912,rocBlas,<unused>;miopenConvolutionFwdAlgoWinograd:ConvBinWinogradRxSf2x3,0.09968,0,miopenConvolutionFwdAlgoWinograd,384x8x8x3x1x384x8x8x1xNCHWxFP32x1x0x1x1x1x1x1x1
1280-8-8-1x1-448-8-8-1-0x0-1x1-1x1-0-NCHW-FP32-F=miopenConvolutionFwdAlgoImplicitGEMM:ConvHipImplicitGemmV4R4Fwd,0.1624,0,miopenConvolutionFwdAlgoImplicitGEMM,1280x8x8x1x1x448x8x8x1xNCHWxFP32x0x0x1x1x1x1x1x1;miopenConvolutionFwdAlgoDirect:ConvAsm1x1U,0.03888,0,miopenConvolutionFwdAlgoDirect,<unused>;miopenConvolutionFwdAlgoGEMM:gemm,0.04448,0,rocBlas,<unused>;miopenConvolutionFwdAlgoWinograd:ConvBinWinogradRxSf2x3,0.27648,0,miopenConvolutionFwdAlgoWinograd,1280x8x8x1x1x448x8x8x1xNCHWxFP32x0x0x1x1x1x1x1x1
448-8-8-3x3-384-8-8-1-1x1-1x1-1x1-0-NCHW-FP32-F=miopenConvolutionFwdAlgoWinograd:ConvBinWinograd3x3U,0.10912,0,miopenConvolutionFwdAlgoWinograd,448x8x8x3x3x384x8x8x1xNCHWxFP32x1x1x1x1x1x1x1x1
1280-8-8-1x1-192-8-8-1-0x0-1x1-1x1-0-NCHW-FP32-F=miopenConvolutionFwdAlgoImplicitGEMM:ConvHipImplicitGemmV4R4Fwd,0.16304,0,miopenConvolutionFwdAlgoImplicitGEMM,1280x8x8x1x1x192x8x8x1xNCHWxFP32x0x0x1x1x1x1x1x1;miopenConvolutionFwdAlgoDirect:ConvAsm1x1U,0.04,0,miopenConvolutionFwdAlgoDirect,<unused>;miopenConvolutionFwdAlgoGEMM:gemm,0.04016,0,rocBlas,<unused>;miopenConvolutionFwdAlgoWinograd:ConvBinWinogradRxSf2x3,0.27168,0,miopenConvolutionFwdAlgoWinograd,1280x8x8x1x1x192x8x8x1xNCHWxFP32x0x0x1x1x1x1x1x1
2048-8-8-1x1-320-8-8-1-0x0-1x1-1x1-0-NCHW-FP32-F=miopenConvolutionFwdAlgoImplicitGEMM:ConvHipImplicitGemmV4R4Fwd,0.25536,0,miopenConvolutionFwdAlgoImplicitGEMM,2048x8x8x1x1x320x8x8x1xNCHWxFP32x0x0x1x1x1x1x1x1;miopenConvolutionFwdAlgoDirect:ConvOclDirectFwd1x1,0.0744,0,miopenConvolutionFwdAlgoDirect,<unused>;miopenConvolutionFwdAlgoGEMM:gemm,0.14224,0,rocBlas,<unused>;miopenConvolutionFwdAlgoWinograd:ConvBinWinogradRxSf2x3,0.4256,0,miopenConvolutionFwdAlgoWinograd,2048x8x8x1x1x320x8x8x1xNCHWxFP32x0x0x1x1x1x1x1x1
2048-8-8-1x1-384-8-8-1-0x0-1x1-1x1-0-NCHW-FP32-F=miopenConvolutionFwdAlgoImplicitGEMM:ConvHipImplicitGemmV4R4Fwd,0.25296,0,miopenConvolutionFwdAlgoImplicitGEMM,2048x8x8x1x1x384x8x8x1xNCHWxFP32x0x0x1x1x1x1x1x1;miopenConvolutionFwdAlgoDirect:ConvOclDirectFwd1x1,0.06448,0,miopenConvolutionFwdAlgoDirect,<unused>;miopenConvolutionFwdAlgoGEMM:gemm,0.14816,0,rocBlas,<unused>;miopenConvolutionFwdAlgoWinograd:ConvBinWinogradRxSf2x3,0.42592,0,miopenConvolutionFwdAlgoWinograd,2048x8x8x1x1x384x8x8x1xNCHWxFP32x0x0x1x1x1x1x1x1
2048-8-8-1x1-448-8-8-1-0x0-1x1-1x1-0-NCHW-FP32-F=miopenConvolutionFwdAlgoImplicitGEMM:ConvHipImplicitGemmV4R4Fwd,0.26224,0,miopenConvolutionFwdAlgoImplicitGEMM,2048x8x8x1x1x448x8x8x1xNCHWxFP32x0x0x1x1x1x1x1x1;miopenConvolutionFwdAlgoDirect:ConvAsm1x1U,0.0648,0,miopenConvolutionFwdAlgoDirect,<unused>;miopenConvolutionFwdAlgoGEMM:gemm,0.06992,0,rocBlas,<unused>;miopenConvolutionFwdAlgoWinograd:ConvBinWinogradRxSf2x3,0.42688,0,miopenConvolutionFwdAlgoWinograd,2048x8x8x1x1x448x8x8x1xNCHWxFP32x0x0x1x1x1x1x1x1
2048-8-8-1x1-192-8-8-1-0x0-1x1-1x1-0-NCHW-FP32-F=miopenConvolutionFwdAlgoImplicitGEMM:ConvHipImplicitGemmV4R4Fwd,0.2656,0,miopenConvolutionFwdAlgoImplicitGEMM,2048x8x8x1x1x192x8x8x1xNCHWxFP32x0x0x1x1x1x1x1x1;miopenConvolutionFwdAlgoDirect:ConvOclDirectFwd1x1,0.0488,0,miopenConvolutionFwdAlgoDirect,<unused>;miopenConvolutionFwdAlgoGEMM:gemm,0.06064,0,rocBlas,<unused>;miopenConvolutionFwdAlgoWinograd:ConvBinWinogradRxSf2x3,0.42272,0,miopenConvolutionFwdAlgoWinograd,2048x8x8x1x1x192x8x8x1xNCHWxFP32x0x0x1x1x1x1x1x1
64-56-56-1x1-128-56-56-1-0x0-1x1-1x1-0-NCHW-FP32-F=miopenConvolutionFwdAlgoImplicitGEMM:ConvHipImplicitGemmV4R4Fwd,0.02256,0,miopenConvolutionFwdAlgoImplicitGEMM,64x56x56x1x1x128x56x56x1xNCHWxFP32x0x0x1x1x1x1x1x1;miopenConvolutionFwdAlgoDirect:ConvOclDirectFwd1x1,0.01648,0,miopenConvolutionFwdAlgoDirect,<unused>;miopenConvolutionFwdAlgoGEMM:gemm,0.02544,0,rocBlas,<unused>;miopenConvolutionFwdAlgoWinograd:ConvBinWinogradRxSf3x2,0.04528,0,miopenConvolutionFwdAlgoWinograd,64x56x56x1x1x128x56x56x1xNCHWxFP32x0x0x1x1x1x1x1x1
128-56-56-3x3-32-56-56-1-1x1-1x1-1x1-0-NCHW-FP32-F=miopenConvolutionFwdAlgoWinograd:ConvBinWinograd3x3U,0.04768,0,miopenConvolutionFwdAlgoWinograd,128x56x56x3x3x32x56x56x1xNCHWxFP32x1x1x1x1x1x1x1x1
96-56-56-1x1-128-56-56-1-0x0-1x1-1x1-0-NCHW-FP32-F=miopenConvolutionFwdAlgoImplicitGEMM:ConvHipImplicitGemmV4R4Fwd,0.02224,0,miopenConvolutionFwdAlgoImplicitGEMM,96x56x56x1x1x128x56x56x1xNCHWxFP32x0x0x1x1x1x1x1x1;miopenConvolutionFwdAlgoDirect:ConvOclDirectFwd1x1,0.01744,0,miopenConvolutionFwdAlgoDirect,<unused>;miopenConvolutionFwdAlgoGEMM:gemm,0.02944,0,rocBlas,<unused>;miopenConvolutionFwdAlgoWinograd:ConvBinWinogradRxSf3x2,0.04784,0,miopenConvolutionFwdAlgoWinograd,96x56x56x1x1x128x56x56x1xNCHWxFP32x0x0x1x1x1x1x1x1
128-56-56-1x1-128-56-56-1-0x0-1x1-1x1-0-NCHW-FP32-F=miopenConvolutionFwdAlgoImplicitGEMM:ConvHipImplicitGemmV4R4Fwd,0.02416,0,miopenConvolutionFwdAlgoImplicitGEMM,128x56x56x1x1x128x56x56x1xNCHWxFP32x0x0x1x1x1x1x1x1;miopenConvolutionFwdAlgoDirect:ConvAsm1x1U,0.02272,0,miopenConvolutionFwdAlgoDirect,<unused>;miopenConvolutionFwdAlgoGEMM:gemm,0.0336,0,rocBlas,<unused>;miopenConvolutionFwdAlgoWinograd:ConvBinWinogradRxSf3x2,0.05696,0,miopenConvolutionFwdAlgoWinograd,128x56x56x1x1x128x56x56x1xNCHWxFP32x0x0x1x1x1x1x1x1
160-56-56-1x1-128-56-56-1-0x0-1x1-1x1-0-NCHW-FP32-F=miopenConvolutionFwdAlgoImplicitGEMM:ConvHipImplicitGemmV4R4Fwd,0.0288,0,miopenConvolutionFwdAlgoImplicitGEMM,160x56x56x1x1x128x56x56x1xNCHWxFP32x0x0x1x1x1x1x1x1;miopenConvolutionFwdAlgoDirect:ConvOclDirectFwd1x1,0.02656,0,miopenConvolutionFwdAlgoDirect,<unused>;miopenConvolutionFwdAlgoGEMM:gemm,0.0368,0,rocBlas,<unused>;miopenConvolutionFwdAlgoWinograd:ConvBinWinogradRxSf3x2,0.06432,0,miopenConvolutionFwdAlgoWinograd,160x56x56x1x1x128x56x56x1xNCHWxFP32x0x0x1x1x1x1x1x1
192-56-56-1x1-128-56-56-1-0x0-1x1-1x1-0-NCHW-FP32-F=miopenConvolutionFwdAlgoImplicitGEMM:ConvHipImplicitGemmV4R4Fwd,0.03328,0,miopenConvolutionFwdAlgoImplicitGEMM,192x56x56x1x1x128x56x56x1xNCHWxFP32x0x0x1x1x1x1x1x1;miopenConvolutionFwdAlgoDirect:ConvAsm1x1U,0.03184,0,miopenConvolutionFwdAlgoDirect,<unused>;miopenConvolutionFwdAlgoGEMM:gemm,0.04128,0,rocBlas,<unused>;miopenConvolutionFwdAlgoWinograd:ConvBinWinogradRxSf3x2,0.07024,0,miopenConvolutionFwdAlgoWinograd,192x56x56x1x1x128x56x56x1xNCHWxFP32x0x0x1x1x1x1x1x1
224-56-56-1x1-128-56-56-1-0x0-1x1-1x1-0-NCHW-FP32-F=miopenConvolutionFwdAlgoImplicitGEMM:ConvHipImplicitGemmV4R4Fwd,0.03776,0,miopenConvolutionFwdAlgoImplicitGEMM,224x56x56x1x1x128x56x56x1xNCHWxFP32x0x0x1x1x1x1x1x1;miopenConvolutionFwdAlgoDirect:ConvOclDirectFwd1x1,0.04112,0,miopenConvolutionFwdAlgoDirect,<unused>;miopenConvolutionFwdAlgoGEMM:gemm,0.05408,0,rocBlas,<unused>;miopenConvolutionFwdAlgoWinograd:ConvBinWinogradRxSf3x2,0.07728,0,miopenConvolutionFwdAlgoWinograd,224x56x56x1x1x128x56x56x1xNCHWxFP32x0x0x1x1x1x1x1x1
128-28-28-1x1-128-28-28-1-0x0-1x1-1x1-0-NCHW-FP32-F=miopenConvolutionFwdAlgoDirect:ConvAsm1x1U,0.016,0,miopenConvolutionFwdAlgoDirect,<unused>;miopenConvolutionFwdAlgoGEMM:gemm,0.03328,0,rocBlas,<unused>;miopenConvolutionFwdAlgoWinograd:ConvBinWinogradRxS,0.05024,0,miopenConvolutionFwdAlgoWinograd,128x28x28x1x1x128x28x28x1xNCHWxFP32x0x0x1x1x1x1x1x1
128-28-28-3x3-32-28-28-1-1x1-1x1-1x1-0-NCHW-FP32-F=miopenConvolutionFwdAlgoWinograd:ConvBinWinograd3x3U,0.0464,0,miopenConvolutionFwdAlgoWinograd,128x28x28x3x3x32x28x28x1xNCHWxFP32x1x1x1x1x1x1x1x1
160-28-28-1x1-128-28-28-1-0x0-1x1-1x1-0-NCHW-FP32-F=miopenConvolutionFwdAlgoDirect:ConvAsm1x1U,0.01328,0,miopenConvolutionFwdAlgoDirect,<unused>;miopenConvolutionFwdAlgoGEMM:gemm,0.03696,0,rocBlas,<unused>;miopenConvolutionFwdAlgoWinograd:ConvBinWinogradRxSf2x3,0.05472,0,miopenConvolutionFwdAlgoWinograd,160x28x28x1x1x128x28x28x1xNCHWxFP32x0x0x1x1x1x1x1x1
192-28-28-1x1-128-28-28-1-0x0-1x1-1x1-0-NCHW-FP32-F=miopenConvolutionFwdAlgoDirect:ConvAsm1x1U,0.01456,0,miopenConvolutionFwdAlgoDirect,<unused>;miopenConvolutionFwdAlgoGEMM:gemm,0.0456,0,rocBlas,<unused>;miopenConvolutionFwdAlgoWinograd:ConvBinWinogradRxSf2x3,0.0704,0,miopenConvolutionFwdAlgoWinograd,192x28x28x1x1x128x28x28x1xNCHWxFP32x0x0x1x1x1x1x1x1
224-28-28-1x1-128-28-28-1-0x0-1x1-1x1-0-NCHW-FP32-F=miopenConvolutionFwdAlgoDirect:ConvAsm1x1U,0.01584,0,miopenConvolutionFwdAlgoDirect,<unused>;miopenConvolutionFwdAlgoGEMM:gemm,0.06176,0,rocBlas,<unused>;miopenConvolutionFwdAlgoWinograd:ConvBinWinogradRxS,0.06864,0,miopenConvolutionFwdAlgoWinograd,224x28x28x1x1x128x28x28x1xNCHWxFP32x0x0x1x1x1x1x1x1
256-28-28-1x1-128-28-28-1-0x0-1x1-1x1-0-NCHW-FP32-F=miopenConvolutionFwdAlgoDirect:ConvOclDirectFwd1x1,0.03296,0,miopenConvolutionFwdAlgoDirect,<unused>;miopenConvolutionFwdAlgoGEMM:gemm,0.0664,0,rocBlas,<unused>;miopenConvolutionFwdAlgoWinograd:ConvBinWinogradRxSf2x3,0.07584,0,miopenConvolutionFwdAlgoWinograd,256x28x28x1x1x128x28x28x1xNCHWxFP32x0x0x1x1x1x1x1x1
288-28-28-1x1-128-28-28-1-0x0-1x1-1x1-0-NCHW-FP32-F=miopenConvolutionFwdAlgoDirect:ConvAsm1x1U,0.0192,0,miopenConvolutionFwdAlgoDirect,<unused>;miopenConvolutionFwdAlgoGEMM:gemm,0.07264,0,rocBlas,<unused>;miopenConvolutionFwdAlgoWinograd:ConvBinWinogradRxS,0.08192,0,miopenConvolutionFwdAlgoWinograd,288x28x28x1x1x128x28x28x1xNCHWxFP32x0x0x1x1x1x1x1x1
320-28-28-1x1-128-28-28-1-0x0-1x1-1x1-0-NCHW-FP32-F=miopenConvolutionFwdAlgoDirect:ConvAsm1x1U,0.02144,0,miopenConvolutionFwdAlgoDirect,<unused>;miopenConvolutionFwdAlgoGEMM:gemm,0.08512,0,rocBlas,<unused>;miopenConvolutionFwdAlgoWinograd:ConvBinWinogradRxS,0.09504,0,miopenConvolutionFwdAlgoWinograd,320x28x28x1x1x128x28x28x1xNCHWxFP32x0x0x1x1x1x1x1x1
352-28-28-1x1-128-28-28-1-0x0-1x1-1x1-0-NCHW-FP32-F=miopenConvolutionFwdAlgoDirect:ConvAsm1x1U,0.02416,0,miopenConvolutionFwdAlgoDirect,<unused>;miopenConvolutionFwdAlgoGEMM:gemm,0.08288,0,rocBlas,<unused>;miopenConvolutionFwdAlgoWinograd:ConvBinWinogradRxSf2x3,0.09376,0,miopenConvolutionFwdAlgoWinograd,352x28x28x1x1x128x28x28x1xNCHWxFP32x0x0x1x1x1x1x1x1
384-28-28-1x1-128-28-28-1-0x0-1x1-1x1-0-NCHW-FP32-F=miopenConvolutionFwdAlgoDirect:ConvAsm1x1U,0.02576,0,miopenConvolutionFwdAlgoDirect,<unused>;miopenConvolutionFwdAlgoGEMM:gemm,0.03936,0,rocBlas,<unused>;miopenConvolutionFwdAlgoWinograd:ConvBinWinogradRxSf2x3,0.09968,0,miopenConvolutionFwdAlgoWinograd,384x28x28x1x1x128x28x28x1xNCHWxFP32x0x0x1x1x1x1x1x1
416-28-28-1x1-128-28-28-1-0x0-1x1-1x1-0-NCHW-FP32-F=miopenConvolutionFwdAlgoDirect:ConvAsm1x1U,0.02784,0,miopenConvolutionFwdAlgoDirect,<unused>;miopenConvolutionFwdAlgoGEMM:gemm,0.03904,0,rocBlas,<unused>;miopenConvolutionFwdAlgoWinograd:ConvBinWinogradRxSf2x3,0.10656,0,miopenConvolutionFwdAlgoWinograd,416x28x28x1x1x128x28x28x1xNCHWxFP32x0x0x1x1x1x1x1x1
448-28-28-1x1-128-28-28-1-0x0-1x1-1x1-0-NCHW-FP32-F=miopenConvolutionFwdAlgoDirect:ConvAsm1x1U,0.03104,0,miopenConvolutionFwdAlgoDirect,<unused>;miopenConvolutionFwdAlgoGEMM:gemm,0.04112,0,rocBlas,<unused>;miopenConvolutionFwdAlgoWinograd:ConvBinWinogradRxSf2x3,0.1128,0,miopenConvolutionFwdAlgoWinograd,448x28x28x1x1x128x28x28x1xNCHWxFP32x0x0x1x1x1x1x1x1
480-28-28-1x1-128-28-28-1-0x0-1x1-1x1-0-NCHW-FP32-F=miopenConvolutionFwdAlgoDirect:ConvAsm1x1U,0.02992,0,miopenConvolutionFwdAlgoDirect,<unused>;miopenConvolutionFwdAlgoGEMM:gemm,0.04288,0,rocBlas,<unused>;miopenConvolutionFwdAlgoWinograd:ConvBinWinogradRxSf2x3,0.1192,0,miopenConvolutionFwdAlgoWinograd,480x28x28x1x1x128x28x28x1xNCHWxFP32x0x0x1x1x1x1x1x1
256-14-14-1x1-128-14-14-1-0x0-1x1-1x1-0-NCHW-FP32-F=miopenConvolutionFwdAlgoDirect:ConvAsm1x1U,0.01328,0,miopenConvolutionFwdAlgoDirect,<unused>;miopenConvolutionFwdAlgoGEMM:gemm,0.03616,0,rocBlas,<unused>;miopenConvolutionFwdAlgoWinograd:ConvBinWinogradRxS,0.08128,0,miopenConvolutionFwdAlgoWinograd,256x14x14x1x1x128x14x14x1xNCHWxFP32x0x0x1x1x1x1x1x1
128-14-14-3x3-32-14-14-1-1x1-1x1-1x1-0-NCHW-FP32-F=miopenConvolutionFwdAlgoWinograd:ConvBinWinograd3x3U,0.04672,0,miopenConvolutionFwdAlgoWinograd,128x14x14x3x3x32x14x14x1xNCHWxFP32x1x1x1x1x1x1x1x1
288-14-14-1x1-128-14-14-1-0x0-1x1-1x1-0-NCHW-FP32-F=miopenConvolutionFwdAlgoDirect:ConvAsm1x1U,0.0168,0,miopenConvolutionFwdAlgoDirect,<unused>;miopenConvolutionFwdAlgoGEMM:gemm,0.03152,0,rocBlas,<unused>;miopenConvolutionFwdAlgoWinograd:ConvBinWinogradRxS,0.08048,0,miopenConvolutionFwdAlgoWinograd,288x14x14x1x1x128x14x14x1xNCHWxFP32x0x0x1x1x1x1x1x1
320-14-14-1x1-128-14-14-1-0x0-1x1-1x1-0-NCHW-FP32-F=miopenConvolutionFwdAlgoDirect:ConvAsm1x1U,0.0184,0,miopenConvolutionFwdAlgoDirect,<unused>;miopenConvolutionFwdAlgoGEMM:gemm,0.0328,0,rocBlas,<unused>;miopenConvolutionFwdAlgoWinograd:ConvBinWinogradRxSf2x3,0.08816,0,miopenConvolutionFwdAlgoWinograd,320x14x14x1x1x128x14x14x1xNCHWxFP32x0x0x1x1x1x1x1x1
352-14-14-1x1-128-14-14-1-0x0-1x1-1x1-0-NCHW-FP32-F=miopenConvolutionFwdAlgoDirect:ConvAsm1x1U,0.01552,0,miopenConvolutionFwdAlgoDirect,<unused>;miopenConvolutionFwdAlgoGEMM:gemm,0.03536,0,rocBlas,<unused>;miopenConvolutionFwdAlgoWinograd:ConvBinWinogradRxSf2x3,0.09408,0,miopenConvolutionFwdAlgoWinograd,352x14x14x1x1x128x14x14x1xNCHWxFP32x0x0x1x1x1x1x1x1
384-14-14-1x1-128-14-14-1-0x0-1x1-1x1-0-NCHW-FP32-F=miopenConvolutionFwdAlgoDirect:ConvAsm1x1U,0.01584,0,miopenConvolutionFwdAlgoDirect,<unused>;miopenConvolutionFwdAlgoGEMM:gemm,0.02704,0,rocBlas,<unused>;miopenConvolutionFwdAlgoWinograd:ConvBinWinogradRxSf2x3,0.09984,0,miopenConvolutionFwdAlgoWinograd,384x14x14x1x1x128x14x14x1xNCHWxFP32x0x0x1x1x1x1x1x1
416-14-14-1x1-128-14-14-1-0x0-1x1-1x1-0-NCHW-FP32-F=miopenConvolutionFwdAlgoDirect:ConvAsm1x1U,0.01728,0,miopenConvolutionFwdAlgoDirect,<unused>;miopenConvolutionFwdAlgoGEMM:gemm,0.02752,0,rocBlas,<unused>;miopenConvolutionFwdAlgoWinograd:ConvBinWinogradRxSf2x3,0.10608,0,miopenConvolutionFwdAlgoWinograd,416x14x14x1x1x128x14x14x1xNCHWxFP32x0x0x1x1x1x1x1x1
448-14-14-1x1-128-14-14-1-0x0-1x1-1x1-0-NCHW-FP32-F=miopenConvolutionFwdAlgoDirect:ConvAsm1x1U,0.01808,0,miopenConvolutionFwdAlgoDirect,<unused>;miopenConvolutionFwdAlgoGEMM:gemm,0.02832,0,rocBlas,<unused>;miopenConvolutionFwdAlgoWinograd:ConvBinWinogradRxSf2x3,0.11296,0,miopenConvolutionFwdAlgoWinograd,448x14x14x1x1x128x14x14x1xNCHWxFP32x0x0x1x1x1x1x1x1
480-14-14-1x1-128-14-14-1-0x0-1x1-1x1-0-NCHW-FP32-F=miopenConvolutionFwdAlgoDirect:ConvAsm1x1U,0.02384,0,miopenConvolutionFwdAlgoDirect,<unused>;miopenConvolutionFwdAlgoGEMM:gemm,0.044,0,rocBlas,<unused>;miopenConvolutionFwdAlgoWinograd:ConvBinWinogradRxSf2x3,0.11824,0,miopenConvolutionFwdAlgoWinograd,480x14x14x1x1x128x14x14x1xNCHWxFP32x0x0x1x1x1x1x1x1
512-14-14-1x1-128-14-14-1-0x0-1x1-1x1-0-NCHW-FP32-F=miopenConvolutionFwdAlgoDirect:ConvAsm1x1U,0.02512,0,miopenConvolutionFwdAlgoDirect,<unused>;miopenConvolutionFwdAlgoGEMM:gemm,0.02768,0,rocBlas,<unused>;miopenConvolutionFwdAlgoWinograd:ConvBinWinogradRxSf2x3,0.12608,0,miopenConvolutionFwdAlgoWinograd,512x14x14x1x1x128x14x14x1xNCHWxFP32x0x0x1x1x1x1x1x1
544-14-14-1x1-128-14-14-1-0x0-1x1-1x1-0-NCHW-FP32-F=miopenConvolutionFwdAlgoDirect:ConvAsm1x1U,0.02048,0,miopenConvolutionFwdAlgoDirect,<unused>;miopenConvolutionFwdAlgoGEMM:gemm,0.04688,0,rocBlas,<unused>;miopenConvolutionFwdAlgoWinograd:ConvBinWinogradRxSf2x3,0.13072,0,miopenConvolutionFwdAlgoWinograd,544x14x14x1x1x128x14x14x1xNCHWxFP32x0x0x1x1x1x1x1x1
576-14-14-1x1-128-14-14-1-0x0-1x1-1x1-0-NCHW-FP32-F=miopenConvolutionFwdAlgoDirect:ConvAsm1x1U,0.02096,0,miopenConvolutionFwdAlgoDirect,<unused>;miopenConvolutionFwdAlgoGEMM:gemm,0.03232,0,rocBlas,<unused>;miopenConvolutionFwdAlgoWinograd:ConvBinWinogradRxSf2x3,0.14368,0,miopenConvolutionFwdAlgoWinograd,576x14x14x1x1x128x14x14x1xNCHWxFP32x0x0x1x1x1x1x1x1
608-14-14-1x1-128-14-14-1-0x0-1x1-1x1-0-NCHW-FP32-F=miopenConvolutionFwdAlgoDirect:ConvAsm1x1U,0.02272,0,miopenConvolutionFwdAlgoDirect,<unused>;miopenConvolutionFwdAlgoGEMM:gemm,0.0296,0,rocBlas,<unused>;miopenConvolutionFwdAlgoWinograd:ConvBinWinogradRxSf2x3,0.14288,0,miopenConvolutionFwdAlgoWinograd,608x14x14x1x1x128x14x14x1xNCHWxFP32x0x0x1x1x1x1x1x1
640-14-14-1x1-128-14-14-1-0x0-1x1-1x1-0-NCHW-FP32-F=miopenConvolutionFwdAlgoDirect:ConvAsm1x1U,0.02864,0,miopenConvolutionFwdAlgoDirect,<unused>;miopenConvolutionFwdAlgoGEMM:gemm,0.03008,0,rocBlas,<unused>;miopenConvolutionFwdAlgoWinograd:ConvBinWinogradRxSf2x3,0.14928,0,miopenConvolutionFwdAlgoWinograd,640x14x14x1x1x128x14x14x1xNCHWxFP32x0x0x1x1x1x1x1x1
672-14-14-1x1-128-14-14-1-0x0-1x1-1x1-0-NCHW-FP32-F=miopenConvolutionFwdAlgoDirect:ConvAsm1x1U,0.02352,0,miopenConvolutionFwdAlgoDirect,<unused>;miopenConvolutionFwdAlgoGEMM:gemm,0.02848,0,rocBlas,<unused>;miopenConvolutionFwdAlgoWinograd:ConvBinWinogradRxSf2x3,0.156,0,miopenConvolutionFwdAlgoWinograd,672x14x14x1x1x128x14x14x1xNCHWxFP32x0x0x1x1x1x1x1x1
704-14-14-1x1-128-14-14-1-0x0-1x1-1x1-0-NCHW-FP32-F=miopenConvolutionFwdAlgoDirect:ConvAsm1x1U,0.0272,0,miopenConvolutionFwdAlgoDirect,<unused>;miopenConvolutionFwdAlgoGEMM:gemm,0.02912,0,rocBlas,<unused>;miopenConvolutionFwdAlgoWinograd:ConvBinWinogradRxSf2x3,0.16096,0,miopenConvolutionFwdAlgoWinograd,704x14x14x1x1x128x14x14x1xNCHWxFP32x0x0x1x1x1x1x1x1
736-14-14-1x1-128-14-14-1-0x0-1x1-1x1-0-NCHW-FP32-F=miopenConvolutionFwdAlgoDirect:ConvOclDirectFwd1x1,0.02768,0,miopenConvolutionFwdAlgoDirect,<unused>;miopenConvolutionFwdAlgoGEMM:gemm,0.03008,0,rocBlas,<unused>;miopenConvolutionFwdAlgoWinograd:ConvBinWinogradRxSf2x3,0.16768,0,miopenConvolutionFwdAlgoWinograd,736x14x14x1x1x128x14x14x1xNCHWxFP32x0x0x1x1x1x1x1x1
768-14-14-1x1-128-14-14-1-0x0-1x1-1x1-0-NCHW-FP32-F=miopenConvolutionFwdAlgoDirect:ConvOclDirectFwd1x1,0.03232,0,miopenConvolutionFwdAlgoDirect,<unused>;miopenConvolutionFwdAlgoGEMM:gemm,0.0312,0,rocBlas,<unused>;miopenConvolutionFwdAlgoWinograd:ConvBinWinogradRxSf2x3,0.17408,0,miopenConvolutionFwdAlgoWinograd,768x14x14x1x1x128x14x14x1xNCHWxFP32x0x0x1x1x1x1x1x1
800-14-14-1x1-128-14-14-1-0x0-1x1-1x1-0-NCHW-FP32-F=miopenConvolutionFwdAlgoDirect:ConvAsm1x1U,0.0272,0,miopenConvolutionFwdAlgoDirect,<unused>;miopenConvolutionFwdAlgoGEMM:gemm,0.03136,0,rocBlas,<unused>;miopenConvolutionFwdAlgoWinograd:ConvBinWinogradRxSf2x3,0.18,0,miopenConvolutionFwdAlgoWinograd,800x14x14x1x1x128x14x14x1xNCHWxFP32x0x0x1x1x1x1x1x1
832-14-14-1x1-128-14-14-1-0x0-1x1-1x1-0-NCHW-FP32-F=miopenConvolutionFwdAlgoDirect:ConvOclDirectFwd1x1,0.03488,0,miopenConvolutionFwdAlgoDirect,<unused>;miopenConvolutionFwdAlgoGEMM:gemm,0.03136,0,rocBlas,<unused>;miopenConvolutionFwdAlgoWinograd:ConvBinWinogradRxSf2x3,0.18576,0,miopenConvolutionFwdAlgoWinograd,832x14x14x1x1x128x14x14x1xNCHWxFP32x0x0x1x1x1x1x1x1
864-14-14-1x1-128-14-14-1-0x0-1x1-1x1-0-NCHW-FP32-F=miopenConvolutionFwdAlgoDirect:ConvAsm1x1U,0.02864,0,miopenConvolutionFwdAlgoDirect,<unused>;miopenConvolutionFwdAlgoGEMM:gemm,0.03264,0,rocBlas,<unused>;miopenConvolutionFwdAlgoWinograd:ConvBinWinogradRxSf2x3,0.19216,0,miopenConvolutionFwdAlgoWinograd,864x14x14x1x1x128x14x14x1xNCHWxFP32x0x0x1x1x1x1x1x1
896-14-14-1x1-128-14-14-1-0x0-1x1-1x1-0-NCHW-FP32-F=miopenConvolutionFwdAlgoDirect:ConvOclDirectFwd1x1,0.03472,0,miopenConvolutionFwdAlgoDirect,<unused>;miopenConvolutionFwdAlgoGEMM:gemm,0.0344,0,rocBlas,<unused>;miopenConvolutionFwdAlgoWinograd:ConvBinWinogradRxSf2x3,0.19904,0,miopenConvolutionFwdAlgoWinograd,896x14x14x1x1x128x14x14x1xNCHWxFP32x0x0x1x1x1x1x1x1
928-14-14-1x1-128-14-14-1-0x0-1x1-1x1-0-NCHW-FP32-F=miopenConvolutionFwdAlgoDirect:ConvAsm1x1U,0.03056,0,miopenConvolutionFwdAlgoDirect,<unused>;miopenConvolutionFwdAlgoGEMM:gemm,0.03472,0,rocBlas,<unused>;miopenConvolutionFwdAlgoWinograd:ConvBinWinogradRxSf2x3,0.20512,0,miopenConvolutionFwdAlgoWinograd,928x14x14x1x1x128x14x14x1xNCHWxFP32x0x0x1x1x1x1x1x1
960-14-14-1x1-128-14-14-1-0x0-1x1-1x1-0-NCHW-FP32-F=miopenConvolutionFwdAlgoDirect:ConvAsm1x1U,0.03136,0,miopenConvolutionFwdAlgoDirect,<unused>;miopenConvolutionFwdAlgoGEMM:gemm,0.03664,0,rocBlas,<unused>;miopenConvolutionFwdAlgoWinograd:ConvBinWinogradRxSf2x3,0.2112,0,miopenConvolutionFwdAlgoWinograd,960x14x14x1x1x128x14x14x1xNCHWxFP32x0x0x1x1x1x1x1x1
992-14-14-1x1-128-14-14-1-0x0-1x1-1x1-0-NCHW-FP32-F=miopenConvolutionFwdAlgoDirect:ConvOclDirectFwd1x1,0.03456,0,miopenConvolutionFwdAlgoDirect,<unused>;miopenConvolutionFwdAlgoGEMM:gemm,0.03632,0,rocBlas,<unused>;miopenConvolutionFwdAlgoWinograd:ConvBinWinogradRxSf2x3,0.2168,0,miopenConvolutionFwdAlgoWinograd,992x14x14x1x1x128x14x14x1xNCHWxFP32x0x0x1x1x1x1x1x1
512-7-7-1x1-128-7-7-1-0x0-1x1-1x1-0-NCHW-FP32-F=miopenConvolutionFwdAlgoDirect:ConvAsm1x1U,0.02416,0,miopenConvolutionFwdAlgoDirect,<unused>;miopenConvolutionFwdAlgoGEMM:gemm,0.0256,0,rocBlas,<unused>;miopenConvolutionFwdAlgoWinograd:ConvBinWinogradRxSf2x3,0.12496,0,miopenConvolutionFwdAlgoWinograd,512x7x7x1x1x128x7x7x1xNCHWxFP32x0x0x1x1x1x1x1x1
128-7-7-3x3-32-7-7-1-1x1-1x1-1x1-0-NCHW-FP32-F=miopenConvolutionFwdAlgoWinograd:ConvBinWinograd3x3U,0.0472,0,miopenConvolutionFwdAlgoWinograd,128x7x7x3x3x32x7x7x1xNCHWxFP32x1x1x1x1x1x1x1x1
544-7-7-1x1-128-7-7-1-0x0-1x1-1x1-0-NCHW-FP32-F=miopenConvolutionFwdAlgoDirect:ConvAsm1x1U,0.01904,0,miopenConvolutionFwdAlgoDirect,<unused>;miopenConvolutionFwdAlgoGEMM:gemm,0.02528,0,rocBlas,<unused>;miopenConvolutionFwdAlgoWinograd:ConvBinWinogradRxSf2x3,0.1304,0,miopenConvolutionFwdAlgoWinograd,544x7x7x1x1x128x7x7x1xNCHWxFP32x0x0x1x1x1x1x1x1
576-7-7-1x1-128-7-7-1-0x0-1x1-1x1-0-NCHW-FP32-F=miopenConvolutionFwdAlgoDirect:ConvOclDirectFwd1x1,0.02608,0,miopenConvolutionFwdAlgoDirect,<unused>;miopenConvolutionFwdAlgoGEMM:gemm,0.02624,0,rocBlas,<unused>;miopenConvolutionFwdAlgoWinograd:ConvBinWinogradRxSf2x3,0.13664,0,miopenConvolutionFwdAlgoWinograd,576x7x7x1x1x128x7x7x1xNCHWxFP32x0x0x1x1x1x1x1x1
608-7-7-1x1-128-7-7-1-0x0-1x1-1x1-0-NCHW-FP32-F=miopenConvolutionFwdAlgoDirect:ConvAsm1x1U,0.02128,0,miopenConvolutionFwdAlgoDirect,<unused>;miopenConvolutionFwdAlgoGEMM:gemm,0.0272,0,rocBlas,<unused>;miopenConvolutionFwdAlgoWinograd:ConvBinWinogradRxSf2x3,0.1424,0,miopenConvolutionFwdAlgoWinograd,608x7x7x1x1x128x7x7x1xNCHWxFP32x0x0x1x1x1x1x1x1
640-7-7-1x1-128-7-7-1-0x0-1x1-1x1-0-NCHW-FP32-F=miopenConvolutionFwdAlgoDirect:ConvAsm1x1U,0.02864,0,miopenConvolutionFwdAlgoDirect,<unused>;miopenConvolutionFwdAlgoGEMM:gemm,0.02736,0,rocBlas,<unused>;miopenConvolutionFwdAlgoWinograd:ConvBinWinogradRxSf2x3,0.14976,0,miopenConvolutionFwdAlgoWinograd,640x7x7x1x1x128x7x7x1xNCHWxFP32x0x0x1x1x1x1x1x1
672-7-7-1x1-128-7-7-1-0x0-1x1-1x1-0-NCHW-FP32-F=miopenConvolutionFwdAlgoDirect:ConvAsm1x1U,0.0224,0,miopenConvolutionFwdAlgoDirect,<unused>;miopenConvolutionFwdAlgoGEMM:gemm,0.02784,0,rocBlas,<unused>;miopenConvolutionFwdAlgoWinograd:ConvBinWinogradRxSf2x3,0.15552,0,miopenConvolutionFwdAlgoWinograd,672x7x7x1x1x128x7x7x1xNCHWxFP32x0x0x1x1x1x1x1x1
704-7-7-1x1-128-7-7-1-0x0-1x1-1x1-0-NCHW-FP32-F=miopenConvolutionFwdAlgoDirect:ConvAsm1x1U,0.02976,0,miopenConvolutionFwdAlgoDirect,<unused>;miopenConvolutionFwdAlgoGEMM:gemm,0.028,0,rocBlas,<unused>;miopenConvolutionFwdAlgoWinograd:ConvBinWinogradRxSf2x3,0.16112,0,miopenConvolutionFwdAlgoWinograd,704x7x7x1x1x128x7x7x1xNCHWxFP32x0x0x1x1x1x1x1x1
736-7-7-1x1-128-7-7-1-0x0-1x1-1x1-0-NCHW-FP32-F=miopenConvolutionFwdAlgoDirect:ConvAsm1x1U,0.02352,0,miopenConvolutionFwdAlgoDirect,<unused>;miopenConvolutionFwdAlgoGEMM:gemm,0.02832,0,rocBlas,<unused>;miopenConvolutionFwdAlgoWinograd:ConvBinWinogradRxSf2x3,0.168,0,miopenConvolutionFwdAlgoWinograd,736x7x7x1x1x128x7x7x1xNCHWxFP32x0x0x1x1x1x1x1x1
768-7-7-1x1-128-7-7-1-0x0-1x1-1x1-0-NCHW-FP32-F=miopenConvolutionFwdAlgoDirect:ConvAsm1x1U,0.02464,0,miopenConvolutionFwdAlgoDirect,<unused>;miopenConvolutionFwdAlgoGEMM:gemm,0.02944,0,rocBlas,<unused>;miopenConvolutionFwdAlgoWinograd:ConvBinWinogradRxSf2x3,0.17312,0,miopenConvolutionFwdAlgoWinograd,768x7x7x1x1x128x7x7x1xNCHWxFP32x0x0x1x1x1x1x1x1
800-7-7-1x1-128-7-7-1-0x0-1x1-1x1-0-NCHW-FP32-F=miopenConvolutionFwdAlgoDirect:ConvOclDirectFwd1x1,0.03056,0,miopenConvolutionFwdAlgoDirect,<unused>;miopenConvolutionFwdAlgoGEMM:gemm,0.02896,0,rocBlas,<unused>;miopenConvolutionFwdAlgoWinograd:ConvBinWinogradRxSf2x3,0.18,0,miopenConvolutionFwdAlgoWinograd,800x7x7x1x1x128x7x7x1xNCHWxFP32x0x0x1x1x1x1x1x1
832-7-7-1x1-128-7-7-1-0x0-1x1-1x1-0-NCHW-FP32-F=miopenConvolutionFwdAlgoDirect:ConvAsm1x1U,0.0272,0,miopenConvolutionFwdAlgoDirect,<unused>;miopenConvolutionFwdAlgoGEMM:gemm,0.03024,0,rocBlas,<unused>;miopenConvolutionFwdAlgoWinograd:ConvBinWinogradRxSf2x3,0.18544,0,miopenConvolutionFwdAlgoWinograd,832x7x7x1x1x128x7x7x1xNCHWxFP32x0x0x1x1x1x1x1x1
864-7-7-1x1-128-7-7-1-0x0-1x1-1x1-0-NCHW-FP32-F=miopenConvolutionFwdAlgoDirect:ConvOclDirectFwd1x1,0.02912,0,miopenConvolutionFwdAlgoDirect,<unused>;miopenConvolutionFwdAlgoGEMM:gemm,0.03056,0,rocBlas,<unused>;miopenConvolutionFwdAlgoWinograd:ConvBinWinogradRxSf2x3,0.19424,0,miopenConvolutionFwdAlgoWinograd,864x7x7x1x1x128x7x7x1xNCHWxFP32x0x0x1x1x1x1x1x1
896-7-7-1x1-128-7-7-1-0x0-1x1-1x1-0-NCHW-FP32-F=miopenConvolutionFwdAlgoDirect:ConvOclDirectFwd1x1,0.028,0,miopenConvolutionFwdAlgoDirect,<unused>;miopenConvolutionFwdAlgoGEMM:gemm,0.03056,0,rocBlas,<unused>;miopenConvolutionFwdAlgoWinograd:ConvBinWinogradRxSf2x3,0.1984,0,miopenConvolutionFwdAlgoWinograd,896x7x7x1x1x128x7x7x1xNCHWxFP32x0x0x1x1x1x1x1x1
928-7-7-1x1-128-7-7-1-0x0-1x1-1x1-0-NCHW-FP32-F=miopenConvolutionFwdAlgoDirect:ConvOclDirectFwd1x1,0.02704,0,miopenConvolutionFwdAlgoDirect,<unused>;miopenConvolutionFwdAlgoGEMM:gemm,0.0304,0,rocBlas,<unused>;miopenConvolutionFwdAlgoWinograd:ConvBinWinogradRxSf2x3,0.20448,0,miopenConvolutionFwdAlgoWinograd,928x7x7x1x1x128x7x7x1xNCHWxFP32x0x0x1x1x1x1x1x1
960-7-7-1x1-128-7-7-1-0x0-1x1-1x1-0-NCHW-FP32-F=miopenConvolutionFwdAlgoDirect:ConvOclDirectFwd1x1,0.02912,0,miopenConvolutionFwdAlgoDirect,<unused>;miopenConvolutionFwdAlgoGEMM:gemm,0.0328,0,rocBlas,<unused>;miopenConvolutionFwdAlgoWinograd:ConvBinWinogradRxSf2x3,0.21072,0,miopenConvolutionFwdAlgoWinograd,960x7x7x1x1x128x7x7x1xNCHWxFP32x0x0x1x1x1x1x1x1
992-7-7-1x1-128-7-7-1-0x0-1x1-1x1-0-NCHW-FP32-F=miopenConvolutionFwdAlgoDirect:ConvOclDirectFwd1x1,0.03024,0,miopenConvolutionFwdAlgoDirect,<unused>;miopenConvolutionFwdAlgoGEMM:gemm,0.03248,0,rocBlas,<unused>;miopenConvolutionFwdAlgoWinograd:ConvBinWinogradRxSf2x3,0.21664,0,miopenConvolutionFwdAlgoWinograd,992x7x7x1x1x128x7x7x1xNCHWxFP32x0x0x1x1x1x1x1x1
3-224-224-3x3-64-111-111-1-0x0-2x2-1x1-0-NCHW-FP32-F=miopenConvolutionFwdAlgoDirect:ConvOclDirectFwd,0.03072,0,miopenConvolutionFwdAlgoDirect,<unused>;miopenConvolutionFwdAlgoGEMM:gemm,0.06848,1330668,rocBlas,<unused>;miopenConvolutionFwdAlgoWinograd:ConvBinWinogradRxSf2x3,0.04624,0,miopenConvolutionFwdAlgoWinograd,3x224x224x3x3x64x111x111x1xNCHWxFP32x0x0x2x2x1x1x1x1
64-55-55-1x1-16-55-55-1-0x0-1x1-1x1-0-NCHW-FP32-F=miopenConvolutionFwdAlgoDirect:ConvAsm1x1U,0.01008,0,miopenConvolutionFwdAlgoDirect,<unused>;miopenConvolutionFwdAlgoGEMM:gemm,0.02864,0,rocBlas,<unused>;miopenConvolutionFwdAlgoWinograd:ConvBinWinogradRxS,0.03616,0,miopenConvolutionFwdAlgoWinograd,64x55x55x1x1x16x55x55x1xNCHWxFP32x0x0x1x1x1x1x1x1
16-55-55-1x1-64-55-55-1-0x0-1x1-1x1-0-NCHW-FP32-F=miopenConvolutionFwdAlgoDirect:ConvOclDirectFwd1x1,0.00992,0,miopenConvolutionFwdAlgoDirect,<unused>;miopenConvolutionFwdAlgoGEMM:gemm,0.0216,0,rocBlas,<unused>;miopenConvolutionFwdAlgoWinograd:ConvBinWinogradRxSf2x3,0.02944,0,miopenConvolutionFwdAlgoWinograd,16x55x55x1x1x64x55x55x1xNCHWxFP32x0x0x1x1x1x1x1x1
16-55-55-3x3-64-55-55-1-1x1-1x1-1x1-0-NCHW-FP32-F=miopenConvolutionFwdAlgoDirect:ConvAsm3x3U,0.01696,0,miopenConvolutionFwdAlgoDirect,<unused>;miopenConvolutionFwdAlgoGEMM:gemm,0.0784,1742400,rocBlas,<unused>;miopenConvolutionFwdAlgoWinograd:ConvBinWinogradRxSf2x3,0.03632,0,miopenConvolutionFwdAlgoWinograd,16x55x55x3x3x64x55x55x1xNCHWxFP32x1x1x1x1x1x1x1x1
128-55-55-1x1-16-55-55-1-0x0-1x1-1x1-0-NCHW-FP32-F=miopenConvolutionFwdAlgoDirect:ConvAsm1x1U,0.01488,0,miopenConvolutionFwdAlgoDirect,<unused>;miopenConvolutionFwdAlgoGEMM:gemm,0.03376,0,rocBlas,<unused>;miopenConvolutionFwdAlgoWinograd:ConvBinWinogradRxS,0.0488,0,miopenConvolutionFwdAlgoWinograd,128x55x55x1x1x16x55x55x1xNCHWxFP32x0x0x1x1x1x1x1x1
128-27-27-1x1-32-27-27-1-0x0-1x1-1x1-0-NCHW-FP32-F=miopenConvolutionFwdAlgoDirect:ConvAsm1x1U,0.01312,0,miopenConvolutionFwdAlgoDirect,<unused>;miopenConvolutionFwdAlgoGEMM:gemm,0.05296,0,rocBlas,<unused>;miopenConvolutionFwdAlgoWinograd:ConvBinWinogradRxS,0.0496,0,miopenConvolutionFwdAlgoWinograd,128x27x27x1x1x32x27x27x1xNCHWxFP32x0x0x1x1x1x1x1x1
32-27-27-1x1-128-27-27-1-0x0-1x1-1x1-0-NCHW-FP32-F=miopenConvolutionFwdAlgoDirect:ConvAsm1x1U,0.0112,0,miopenConvolutionFwdAlgoDirect,<unused>;miopenConvolutionFwdAlgoGEMM:gemm,0.01712,0,rocBlas,<unused>;miopenConvolutionFwdAlgoWinograd:ConvBinWinogradRxS,0.03024,0,miopenConvolutionFwdAlgoWinograd,32x27x27x1x1x128x27x27x1xNCHWxFP32x0x0x1x1x1x1x1x1
32-27-27-3x3-128-27-27-1-1x1-1x1-1x1-0-NCHW-FP32-F=miopenConvolutionFwdAlgoWinograd:ConvBinWinograd3x3U,0.02928,0,miopenConvolutionFwdAlgoWinograd,32x27x27x3x3x128x27x27x1xNCHWxFP32x1x1x1x1x1x1x1x1
256-27-27-1x1-32-27-27-1-0x0-1x1-1x1-0-NCHW-FP32-F=miopenConvolutionFwdAlgoDirect:ConvAsm1x1U,0.01696,0,miopenConvolutionFwdAlgoDirect,<unused>;miopenConvolutionFwdAlgoGEMM:gemm,0.03296,0,rocBlas,<unused>;miopenConvolutionFwdAlgoWinograd:ConvBinWinogradRxS,0.07456,0,miopenConvolutionFwdAlgoWinograd,256x27x27x1x1x32x27x27x1xNCHWxFP32x0x0x1x1x1x1x1x1
256-13-13-1x1-48-13-13-1-0x0-1x1-1x1-0-NCHW-FP32-F=miopenConvolutionFwdAlgoDirect:ConvAsm1x1U,0.01648,0,miopenConvolutionFwdAlgoDirect,<unused>;miopenConvolutionFwdAlgoGEMM:gemm,0.02992,0,rocBlas,<unused>;miopenConvolutionFwdAlgoWinograd:ConvBinWinogradRxS,0.07488,0,miopenConvolutionFwdAlgoWinograd,256x13x13x1x1x48x13x13x1xNCHWxFP32x0x0x1x1x1x1x1x1
48-13-13-1x1-192-13-13-1-0x0-1x1-1x1-0-NCHW-FP32-F=miopenConvolutionFwdAlgoDirect:ConvAsm1x1U,0.0112,0,miopenConvolutionFwdAlgoDirect,<unused>;miopenConvolutionFwdAlgoGEMM:gemm,0.01952,0,rocBlas,<unused>;miopenConvolutionFwdAlgoWinograd:ConvBinWinogradRxS,0.03376,0,miopenConvolutionFwdAlgoWinograd,48x13x13x1x1x192x13x13x1xNCHWxFP32x0x0x1x1x1x1x1x1
48-13-13-3x3-192-13-13-1-1x1-1x1-1x1-0-NCHW-FP32-F=miopenConvolutionFwdAlgoWinograd:ConvBinWinograd3x3U,0.0312,0,miopenConvolutionFwdAlgoWinograd,48x13x13x3x3x192x13x13x1xNCHWxFP32x1x1x1x1x1x1x1x1
384-13-13-1x1-48-13-13-1-0x0-1x1-1x1-0-NCHW-FP32-F=miopenConvolutionFwdAlgoDirect:ConvAsm1x1U,0.02064,0,miopenConvolutionFwdAlgoDirect,<unused>;miopenConvolutionFwdAlgoGEMM:gemm,0.02512,0,rocBlas,<unused>;miopenConvolutionFwdAlgoWinograd:ConvBinWinogradRxSf2x3,0.10064,0,miopenConvolutionFwdAlgoWinograd,384x13x13x1x1x48x13x13x1xNCHWxFP32x0x0x1x1x1x1x1x1
384-13-13-1x1-64-13-13-1-0x0-1x1-1x1-0-NCHW-FP32-F=miopenConvolutionFwdAlgoDirect:ConvAsm1x1U,0.0208,0,miopenConvolutionFwdAlgoDirect,<unused>;miopenConvolutionFwdAlgoGEMM:gemm,0.02656,0,rocBlas,<unused>;miopenConvolutionFwdAlgoWinograd:ConvBinWinogradRxSf2x3,0.10048,0,miopenConvolutionFwdAlgoWinograd,384x13x13x1x1x64x13x13x1xNCHWxFP32x0x0x1x1x1x1x1x1
64-13-13-1x1-256-13-13-1-0x0-1x1-1x1-0-NCHW-FP32-F=miopenConvolutionFwdAlgoDirect:ConvAsm1x1U,0.01168,0,miopenConvolutionFwdAlgoDirect,<unused>;miopenConvolutionFwdAlgoGEMM:gemm,0.01776,0,rocBlas,<unused>;miopenConvolutionFwdAlgoWinograd:ConvBinWinogradRxS,0.03696,0,miopenConvolutionFwdAlgoWinograd,64x13x13x1x1x256x13x13x1xNCHWxFP32x0x0x1x1x1x1x1x1
64-13-13-3x3-256-13-13-1-1x1-1x1-1x1-0-NCHW-FP32-F=miopenConvolutionFwdAlgoWinograd:ConvBinWinograd3x3U,0.0344,0,miopenConvolutionFwdAlgoWinograd,64x13x13x3x3x256x13x13x1xNCHWxFP32x1x1x1x1x1x1x1x1
512-13-13-1x1-64-13-13-1-0x0-1x1-1x1-0-NCHW-FP32-F=miopenConvolutionFwdAlgoDirect:ConvAsm1x1U,0.02416,0,miopenConvolutionFwdAlgoDirect,<unused>;miopenConvolutionFwdAlgoGEMM:gemm,0.0264,0,rocBlas,<unused>;miopenConvolutionFwdAlgoWinograd:ConvBinWinogradRxSf2x3,0.1256,0,miopenConvolutionFwdAlgoWinograd,512x13x13x1x1x64x13x13x1xNCHWxFP32x0x0x1x1x1x1x1x1
512-13-13-1x1-1000-13-13-1-0x0-1x1-1x1-0-NCHW-FP32-F=miopenConvolutionFwdAlgoDirect:ConvAsm1x1U,0.0584,0,miopenConvolutionFwdAlgoDirect,<unused>;miopenConvolutionFwdAlgoGEMM:gemm,0.0464,0,rocBlas,<unused>;miopenConvolutionFwdAlgoWinograd:ConvBinWinogradRxSf3x2,0.13552,0,miopenConvolutionFwdAlgoWinograd,512x13x13x1x1x1000x13x13x1xNCHWxFP32x0x0x1x1x1x1x1x1
3-224-224-3x3-64-224-224-1-1x1-1x1-1x1-0-NCHW-FP32-F=miopenConvolutionFwdAlgoDirect:ConvOclDirectFwd,0.07952,0,miopenConvolutionFwdAlgoDirect,<unused>;miopenConvolutionFwdAlgoGEMM:gemm,0.12208,5419008,rocBlas,<unused>;miopenConvolutionFwdAlgoWinograd:ConvBinWinogradRxSf2x3,0.07728,0,miopenConvolutionFwdAlgoWinograd,3x224x224x3x3x64x224x224x1xNCHWxFP32x1x1x1x1x1x1x1x1
64-224-224-3x3-64-224-224-1-1x1-1x1-1x1-0-NCHW-FP32-F=miopenConvolutionFwdAlgoWinograd:ConvBinWinograd3x3U,0.2248,0,miopenConvolutionFwdAlgoWinograd,64x224x224x3x3x64x224x224x1xNCHWxFP32x1x1x1x1x1x1x1x1
64-112-112-3x3-128-112-112-1-1x1-1x1-1x1-0-NCHW-FP32-F=miopenConvolutionFwdAlgoWinograd:ConvBinWinograd3x3U,0.12112,0,miopenConvolutionFwdAlgoWinograd,64x112x112x3x3x128x112x112x1xNCHWxFP32x1x1x1x1x1x1x1x1
128-112-112-3x3-128-112-112-1-1x1-1x1-1x1-0-NCHW-FP32-F=miopenConvolutionFwdAlgoWinograd:ConvBinWinograd3x3U,0.2088,0,miopenConvolutionFwdAlgoWinograd,128x112x112x3x3x128x112x112x1xNCHWxFP32x1x1x1x1x1x1x1x1
128-56-56-3x3-256-56-56-1-1x1-1x1-1x1-0-NCHW-FP32-F=miopenConvolutionFwdAlgoWinograd:ConvBinWinograd3x3U,0.12912,0,miopenConvolutionFwdAlgoWinograd,128x56x56x3x3x256x56x56x1xNCHWxFP32x1x1x1x1x1x1x1x1
256-56-56-3x3-256-56-56-1-1x1-1x1-1x1-0-NCHW-FP32-F=miopenConvolutionFwdAlgoWinograd:ConvBinWinogradRxS,0.23136,0,miopenConvolutionFwdAlgoWinograd,256x56x56x3x3x256x56x56x1xNCHWxFP32x1x1x1x1x1x1x1x1
256-28-28-3x3-512-28-28-1-1x1-1x1-1x1-0-NCHW-FP32-F=miopenConvolutionFwdAlgoWinograd:ConvBinWinograd3x3U,0.13408,0,miopenConvolutionFwdAlgoWinograd,256x28x28x3x3x512x28x28x1xNCHWxFP32x1x1x1x1x1x1x1x1
512-28-28-3x3-512-28-28-1-1x1-1x1-1x1-0-NCHW-FP32-F=miopenConvolutionFwdAlgoWinograd:ConvBinWinogradRxSf2x3,0.23248,0,miopenConvolutionFwdAlgoWinograd,512x28x28x3x3x512x28x28x1xNCHWxFP32x1x1x1x1x1x1x1x1
512-14-14-3x3-512-14-14-1-1x1-1x1-1x1-0-NCHW-FP32-F=miopenConvolutionFwdAlgoWinograd:ConvBinWinogradRxSf2x3,0.13184,0,miopenConvolutionFwdAlgoWinograd,512x14x14x3x3x512x14x14x1xNCHWxFP32x1x1x1x1x1x1x1x1
64-56-56-1x1-288-56-56-1-0x0-1x1-1x1-0-NCHW-FP32-F=miopenConvolutionFwdAlgoImplicitGEMM:ConvHipImplicitGemmV4R4Fwd,0.02592,0,miopenConvolutionFwdAlgoImplicitGEMM,64x56x56x1x1x288x56x56x1xNCHWxFP32x0x0x1x1x1x1x1x1;miopenConvolutionFwdAlgoDirect:ConvOclDirectFwd1x1,0.02448,0,miopenConvolutionFwdAlgoDirect,<unused>;miopenConvolutionFwdAlgoGEMM:gemm,0.03888,0,rocBlas,<unused>;miopenConvolutionFwdAlgoWinograd:ConvBinWinogradRxSf3x2,0.06464,0,miopenConvolutionFwdAlgoWinograd,64x56x56x1x1x288x56x56x1xNCHWxFP32x0x0x1x1x1x1x1x1
64-56-56-1x1-96-56-56-1-0x0-1x1-1x1-0-NCHW-FP32-F=miopenConvolutionFwdAlgoImplicitGEMM:ConvHipImplicitGemmV4R4Fwd,0.01728,0,miopenConvolutionFwdAlgoImplicitGEMM,64x56x56x1x1x96x56x56x1xNCHWxFP32x0x0x1x1x1x1x1x1;miopenConvolutionFwdAlgoDirect:ConvOclDirectFwd1x1,0.01696,0,miopenConvolutionFwdAlgoDirect,<unused>;miopenConvolutionFwdAlgoGEMM:gemm,0.0272,0,rocBlas,<unused>;miopenConvolutionFwdAlgoWinograd:ConvBinWinogradRxSf3x2,0.044,0,miopenConvolutionFwdAlgoWinograd,64x56x56x1x1x96x56x56x1xNCHWxFP32x0x0x1x1x1x1x1x1
96-56-56-3x3-96-56-56-1-1x1-1x1-1x1-0-NCHW-FP32-F_g32=miopenConvolutionFwdAlgoDirect:ConvOclDirectFwd,0.0224,0,miopenConvolutionFwdAlgoDirect,<unused>;miopenConvolutionFwdAlgoGEMM:gemm,0.0848,10838016,rocBlas,<unused>;miopenConvolutionFwdAlgoWinograd:ConvBinWinogradRxSf2x3,0.08176,0,miopenConvolutionFwdAlgoWinograd,96x56x56x3x3x96x56x56x1xNCHWxFP32x1x1x1x1x1x1x32x1
96-56-56-1x1-272-56-56-1-0x0-1x1-1x1-0-NCHW-FP32-F=miopenConvolutionFwdAlgoDirect:ConvOclDirectFwd1x1,0.0328,0,miopenConvolutionFwdAlgoDirect,<unused>;miopenConvolutionFwdAlgoGEMM:gemm,0.04576,0,rocBlas,<unused>;miopenConvolutionFwdAlgoWinograd:ConvBinWinogradRxSf3x2,0.07664,0,miopenConvolutionFwdAlgoWinograd,96x56x56x1x1x272x56x56x1xNCHWxFP32x0x0x1x1x1x1x1x1
304-56-56-1x1-96-56-56-1-0x0-1x1-1x1-0-NCHW-FP32-F=miopenConvolutionFwdAlgoImplicitGEMM:ConvHipImplicitGemmV4R4Fwd,0.04928,0,miopenConvolutionFwdAlgoImplicitGEMM,304x56x56x1x1x96x56x56x1xNCHWxFP32x0x0x1x1x1x1x1x1;miopenConvolutionFwdAlgoDirect:ConvAsm1x1U,0.03936,0,miopenConvolutionFwdAlgoDirect,<unused>;miopenConvolutionFwdAlgoGEMM:gemm,0.04624,0,rocBlas,<unused>;miopenConvolutionFwdAlgoWinograd:ConvBinWinogradRxSf3x2,0.09328,0,miopenConvolutionFwdAlgoWinograd,304x56x56x1x1x96x56x56x1xNCHWxFP32x0x0x1x1x1x1x1x1
320-56-56-1x1-96-56-56-1-0x0-1x1-1x1-0-NCHW-FP32-F=miopenConvolutionFwdAlgoImplicitGEMM:ConvHipImplicitGemmV4R4Fwd,0.0504,0,miopenConvolutionFwdAlgoImplicitGEMM,320x56x56x1x1x96x56x56x1xNCHWxFP32x0x0x1x1x1x1x1x1;miopenConvolutionFwdAlgoDirect:ConvAsm1x1U,0.04176,0,miopenConvolutionFwdAlgoDirect,<unused>;miopenConvolutionFwdAlgoGEMM:gemm,0.04688,0,rocBlas,<unused>;miopenConvolutionFwdAlgoWinograd:ConvBinWinogradRxSf3x2,0.09552,0,miopenConvolutionFwdAlgoWinograd,320x56x56x1x1x96x56x56x1xNCHWxFP32x0x0x1x1x1x1x1x1
336-56-56-1x1-576-28-28-1-0x0-2x2-1x1-0-NCHW-FP32-F=miopenConvolutionFwdAlgoDirect:ConvAsm1x1U,0.0664,1053696,miopenConvolutionFwdAlgoDirect,<unused>;miopenConvolutionFwdAlgoGEMM:gemm,0.0696,2860032,rocBlas,<unused>;miopenConvolutionFwdAlgoWinograd:ConvBinWinogradRxSf2x3,0.4416,0,miopenConvolutionFwdAlgoWinograd,336x56x56x1x1x576x28x28x1xNCHWxFP32x0x0x2x2x1x1x1x1
336-56-56-1x1-192-56-56-1-0x0-1x1-1x1-0-NCHW-FP32-F=miopenConvolutionFwdAlgoImplicitGEMM:ConvHipImplicitGemmV4R4Fwd,0.068,0,miopenConvolutionFwdAlgoImplicitGEMM,336x56x56x1x1x192x56x56x1xNCHWxFP32x0x0x1x1x1x1x1x1;miopenConvolutionFwdAlgoDirect:ConvAsm1x1U,0.0736,0,miopenConvolutionFwdAlgoDirect,<unused>;miopenConvolutionFwdAlgoGEMM:gemm,0.08592,0,rocBlas,<unused>;miopenConvolutionFwdAlgoWinograd:ConvBinWinogradRxSf3x2,0.17904,0,miopenConvolutionFwdAlgoWinograd,336x56x56x1x1x192x56x56x1xNCHWxFP32x0x0x1x1x1x1x1x1
192-56-56-3x3-192-28-28-1-1x1-2x2-1x1-0-NCHW-FP32-F_g32=miopenConvolutionFwdAlgoDirect:ConvOclDirectFwd,0.03088,0,miopenConvolutionFwdAlgoDirect,<unused>;miopenConvolutionFwdAlgoGEMM:gemm,0.06496,5419008,rocBlas,<unused>;miopenConvolutionFwdAlgoWinograd:ConvBinWinogradRxSf2x3,0.0744,0,miopenConvolutionFwdAlgoWinograd,192x56x56x3x3x192x28x28x1xNCHWxFP32x1x1x2x2x1x1x32x1
192-28-28-1x1-544-28-28-1-0x0-1x1-1x1-0-NCHW-FP32-F=miopenConvolutionFwdAlgoDirect:ConvAsm1x1U,0.03984,0,miopenConvolutionFwdAlgoDirect,<unused>;miopenConvolutionFwdAlgoGEMM:gemm,0.0448,0,rocBlas,<unused>;miopenConvolutionFwdAlgoWinograd:ConvBinWinogradRxS,0.10944,0,miopenConvolutionFwdAlgoWinograd,192x28x28x1x1x544x28x28x1xNCHWxFP32x0x0x1x1x1x1x1x1
608-28-28-1x1-192-28-28-1-0x0-1x1-1x1-0-NCHW-FP32-F=miopenConvolutionFwdAlgoDirect:ConvOclDirectFwd1x1,0.04528,0,miopenConvolutionFwdAlgoDirect,<unused>;miopenConvolutionFwdAlgoGEMM:gemm,0.05248,0,rocBlas,<unused>;miopenConvolutionFwdAlgoWinograd:ConvBinWinogradRxSf2x3,0.14416,0,miopenConvolutionFwdAlgoWinograd,608x28x28x1x1x192x28x28x1xNCHWxFP32x0x0x1x1x1x1x1x1
192-28-28-3x3-192-28-28-1-1x1-1x1-1x1-0-NCHW-FP32-F_g32=miopenConvolutionFwdAlgoDirect:ConvOclDirectFwd,0.02096,0,miopenConvolutionFwdAlgoDirect,<unused>;miopenConvolutionFwdAlgoGEMM:gemm,0.05728,5419008,rocBlas,<unused>;miopenConvolutionFwdAlgoWinograd:ConvBinWinogradRxSf2x3,0.05824,0,miopenConvolutionFwdAlgoWinograd,192x28x28x3x3x192x28x28x1xNCHWxFP32x1x1x1x1x1x1x32x1
640-28-28-1x1-192-28-28-1-0x0-1x1-1x1-0-NCHW-FP32-F=miopenConvolutionFwdAlgoDirect:ConvAsm1x1U,0.04544,0,miopenConvolutionFwdAlgoDirect,<unused>;miopenConvolutionFwdAlgoGEMM:gemm,0.05472,0,rocBlas,<unused>;miopenConvolutionFwdAlgoWinograd:ConvBinWinogradRxSf2x3,0.1496,0,miopenConvolutionFwdAlgoWinograd,640x28x28x1x1x192x28x28x1xNCHWxFP32x0x0x1x1x1x1x1x1
672-28-28-1x1-192-28-28-1-0x0-1x1-1x1-0-NCHW-FP32-F=miopenConvolutionFwdAlgoDirect:ConvOclDirectFwd1x1,0.04928,0,miopenConvolutionFwdAlgoDirect,<unused>;miopenConvolutionFwdAlgoGEMM:gemm,0.06272,0,rocBlas,<unused>;miopenConvolutionFwdAlgoWinograd:ConvBinWinogradRxSf2x3,0.16592,0,miopenConvolutionFwdAlgoWinograd,672x28x28x1x1x192x28x28x1xNCHWxFP32x0x0x1x1x1x1x1x1
704-28-28-1x1-1072-14-14-1-0x0-2x2-1x1-0-NCHW-FP32-F=miopenConvolutionFwdAlgoDirect:ConvAsm1x1U,0.0952,551936,miopenConvolutionFwdAlgoDirect,<unused>;miopenConvolutionFwdAlgoGEMM:gemm,0.07184,1392384,rocBlas,<unused>;miopenConvolutionFwdAlgoWinograd:ConvBinWinogradRxSf2x3,0.60096,0,miopenConvolutionFwdAlgoWinograd,704x28x28x1x1x1072x14x14x1xNCHWxFP32x0x0x2x2x1x1x1x1
704-28-28-1x1-384-28-28-1-0x0-1x1-1x1-0-NCHW-FP32-F=miopenConvolutionFwdAlgoDirect:ConvOclDirectFwd1x1,0.08624,0,miopenConvolutionFwdAlgoDirect,<unused>;miopenConvolutionFwdAlgoGEMM:gemm,0.07248,0,rocBlas,<unused>;miopenConvolutionFwdAlgoWinograd:ConvBinWinogradRxSf3x2,0.17552,0,miopenConvolutionFwdAlgoWinograd,704x28x28x1x1x384x28x28x1xNCHWxFP32x0x0x1x1x1x1x1x1
384-28-28-3x3-384-14-14-1-1x1-2x2-1x1-0-NCHW-FP32-F_g32=miopenConvolutionFwdAlgoDirect:ConvOclDirectFwd,0.03792,0,miopenConvolutionFwdAlgoDirect,<unused>;miopenConvolutionFwdAlgoGEMM:gemm,0.06272,2709504,rocBlas,<unused>;miopenConvolutionFwdAlgoWinograd:ConvBinWinogradRxSf2x3,0.04656,0,miopenConvolutionFwdAlgoWinograd,384x28x28x3x3x384x14x14x1xNCHWxFP32x1x1x2x2x1x1x32x1
384-14-14-1x1-1048-14-14-1-0x0-1x1-1x1-0-NCHW-FP32-F=miopenConvolutionFwdAlgoDirect:ConvAsm1x1U,0.04272,0,miopenConvolutionFwdAlgoDirect,<unused>;miopenConvolutionFwdAlgoGEMM:gemm,0.03968,0,rocBlas,<unused>;miopenConvolutionFwdAlgoWinograd:ConvBinWinogradRxSf3x2,0.1104,0,miopenConvolutionFwdAlgoWinograd,384x14x14x1x1x1048x14x14x1xNCHWxFP32x0x0x1x1x1x1x1x1
1096-14-14-1x1-384-14-14-1-0x0-1x1-1x1-0-NCHW-FP32-F=miopenConvolutionFwdAlgoDirect:ConvOclDirectFwd1x1,0.06944,0,miopenConvolutionFwdAlgoDirect,<unused>;miopenConvolutionFwdAlgoGEMM:gemm,0.13344,0,rocBlas,<unused>;miopenConvolutionFwdAlgoWinograd:ConvBinWinogradRxS,0.23744,0,miopenConvolutionFwdAlgoWinograd,1096x14x14x1x1x384x14x14x1xNCHWxFP32x0x0x1x1x1x1x1x1
384-14-14-3x3-384-14-14-1-1x1-1x1-1x1-0-NCHW-FP32-F_g32=miopenConvolutionFwdAlgoDirect:ConvAsm3x3U,0.01408,0,miopenConvolutionFwdAlgoDirect,<unused>;miopenConvolutionFwdAlgoGEMM:gemm,0.05536,2709504,rocBlas,<unused>;miopenConvolutionFwdAlgoWinograd:ConvBinWinogradRxSf2x3,0.02976,0,miopenConvolutionFwdAlgoWinograd,384x14x14x3x3x384x14x14x1xNCHWxFP32x1x1x1x1x1x1x32x1
1120-14-14-1x1-384-14-14-1-0x0-1x1-1x1-0-NCHW-FP32-F=miopenConvolutionFwdAlgoDirect:ConvOclDirectFwd1x1,0.05488,0,miopenConvolutionFwdAlgoDirect,<unused>;miopenConvolutionFwdAlgoGEMM:gemm,0.07152,0,rocBlas,<unused>;miopenConvolutionFwdAlgoWinograd:ConvBinWinogradRxSf2x3,0.24224,0,miopenConvolutionFwdAlgoWinograd,1120x14x14x1x1x384x14x14x1xNCHWxFP32x0x0x1x1x1x1x1x1
1144-14-14-1x1-384-14-14-1-0x0-1x1-1x1-0-NCHW-FP32-F=miopenConvolutionFwdAlgoDirect:ConvAsm1x1U,0.07584,0,miopenConvolutionFwdAlgoDirect,<unused>;miopenConvolutionFwdAlgoGEMM:gemm,0.07552,0,rocBlas,<unused>;miopenConvolutionFwdAlgoWinograd:ConvBinWinogradRxS,0.24704,0,miopenConvolutionFwdAlgoWinograd,1144x14x14x1x1x384x14x14x1xNCHWxFP32x0x0x1x1x1x1x1x1
1168-14-14-1x1-384-14-14-1-0x0-1x1-1x1-0-NCHW-FP32-F=miopenConvolutionFwdAlgoDirect:ConvOclDirectFwd1x1,0.05136,0,miopenConvolutionFwdAlgoDirect,<unused>;miopenConvolutionFwdAlgoGEMM:gemm,0.076,0,rocBlas,<unused>;miopenConvolutionFwdAlgoWinograd:ConvBinWinogradRxSf2x3,0.252,0,miopenConvolutionFwdAlgoWinograd,1168x14x14x1x1x384x14x14x1xNCHWxFP32x0x0x1x1x1x1x1x1
1192-14-14-1x1-384-14-14-1-0x0-1x1-1x1-0-NCHW-FP32-F=miopenConvolutionFwdAlgoDirect:ConvOclDirectFwd1x1,0.24928,0,miopenConvolutionFwdAlgoDirect,<unused>;miopenConvolutionFwdAlgoGEMM:gemm,0.06736,0,rocBlas,<unused>;miopenConvolutionFwdAlgoWinograd:ConvBinWinogradRxSf2x3,0.256,0,miopenConvolutionFwdAlgoWinograd,1192x14x14x1x1x384x14x14x1xNCHWxFP32x0x0x1x1x1x1x1x1
1216-14-14-1x1-384-14-14-1-0x0-1x1-1x1-0-NCHW-FP32-F=miopenConvolutionFwdAlgoDirect:ConvOclDirectFwd1x1,0.06176,0,miopenConvolutionFwdAlgoDirect,<unused>;miopenConvolutionFwdAlgoGEMM:gemm,0.06672,0,rocBlas,<unused>;miopenConvolutionFwdAlgoWinograd:ConvBinWinogradRxSf2x3,0.26112,0,miopenConvolutionFwdAlgoWinograd,1216x14x14x1x1x384x14x14x1xNCHWxFP32x0x0x1x1x1x1x1x1
1240-14-14-1x1-384-14-14-1-0x0-1x1-1x1-0-NCHW-FP32-F=miopenConvolutionFwdAlgoDirect:ConvOclDirectFwd1x1,0.26448,0,miopenConvolutionFwdAlgoDirect,<unused>;miopenConvolutionFwdAlgoGEMM:gemm,0.06672,0,rocBlas,<unused>;miopenConvolutionFwdAlgoWinograd:ConvBinWinogradRxS,0.26608,0,miopenConvolutionFwdAlgoWinograd,1240x14x14x1x1x384x14x14x1xNCHWxFP32x0x0x1x1x1x1x1x1
1264-14-14-1x1-384-14-14-1-0x0-1x1-1x1-0-NCHW-FP32-F=miopenConvolutionFwdAlgoDirect:ConvOclDirectFwd1x1,0.06672,0,miopenConvolutionFwdAlgoDirect,<unused>;miopenConvolutionFwdAlgoGEMM:gemm,0.06848,0,rocBlas,<unused>;miopenConvolutionFwdAlgoWinograd:ConvBinWinogradRxSf2x3,0.27168,0,miopenConvolutionFwdAlgoWinograd,1264x14x14x1x1x384x14x14x1xNCHWxFP32x0x0x1x1x1x1x1x1
1288-14-14-1x1-384-14-14-1-0x0-1x1-1x1-0-NCHW-FP32-F=miopenConvolutionFwdAlgoDirect:ConvOclDirectFwd1x1,0.27872,0,miopenConvolutionFwdAlgoDirect,<unused>;miopenConvolutionFwdAlgoGEMM:gemm,0.06752,0,rocBlas,<unused>;miopenConvolutionFwdAlgoWinograd:ConvBinWinogradRxS,0.27552,0,miopenConvolutionFwdAlgoWinograd,1288x14x14x1x1x384x14x14x1xNCHWxFP32x0x0x1x1x1x1x1x1
1312-14-14-1x1-384-14-14-1-0x0-1x1-1x1-0-NCHW-FP32-F=miopenConvolutionFwdAlgoDirect:ConvOclDirectFwd1x1,0.07488,0,miopenConvolutionFwdAlgoDirect,<unused>;miopenConvolutionFwdAlgoGEMM:gemm,0.06864,0,rocBlas,<unused>;miopenConvolutionFwdAlgoWinograd:ConvBinWinogradRxSf2x3,0.28176,0,miopenConvolutionFwdAlgoWinograd,1312x14x14x1x1x384x14x14x1xNCHWxFP32x0x0x1x1x1x1x1x1
1336-14-14-1x1-384-14-14-1-0x0-1x1-1x1-0-NCHW-FP32-F=miopenConvolutionFwdAlgoDirect:ConvOclDirectFwd1x1,0.29328,0,miopenConvolutionFwdAlgoDirect,<unused>;miopenConvolutionFwdAlgoGEMM:gemm,0.07088,0,rocBlas,<unused>;miopenConvolutionFwdAlgoWinograd:ConvBinWinogradRxSf2x3,0.28336,0,miopenConvolutionFwdAlgoWinograd,1336x14x14x1x1x384x14x14x1xNCHWxFP32x0x0x1x1x1x1x1x1
1360-14-14-1x1-384-14-14-1-0x0-1x1-1x1-0-NCHW-FP32-F=miopenConvolutionFwdAlgoDirect:ConvOclDirectFwd1x1,0.076,0,miopenConvolutionFwdAlgoDirect,<unused>;miopenConvolutionFwdAlgoGEMM:gemm,0.06944,0,rocBlas,<unused>;miopenConvolutionFwdAlgoWinograd:ConvBinWinogradRxSf2x3,0.28848,0,miopenConvolutionFwdAlgoWinograd,1360x14x14x1x1x384x14x14x1xNCHWxFP32x0x0x1x1x1x1x1x1
1384-14-14-1x1-384-14-14-1-0x0-1x1-1x1-0-NCHW-FP32-F=miopenConvolutionFwdAlgoDirect:ConvOclDirectFwd1x1,0.30672,0,miopenConvolutionFwdAlgoDirect,<unused>;miopenConvolutionFwdAlgoGEMM:gemm,0.07264,0,rocBlas,<unused>;miopenConvolutionFwdAlgoWinograd:ConvBinWinogradRxSf2x3,0.29312,0,miopenConvolutionFwdAlgoWinograd,1384x14x14x1x1x384x14x14x1xNCHWxFP32x0x0x1x1x1x1x1x1
1408-14-14-1x1-384-14-14-1-0x0-1x1-1x1-0-NCHW-FP32-F=miopenConvolutionFwdAlgoDirect:ConvOclDirectFwd1x1,0.0848,0,miopenConvolutionFwdAlgoDirect,<unused>;miopenConvolutionFwdAlgoGEMM:gemm,0.0712,0,rocBlas,<unused>;miopenConvolutionFwdAlgoWinograd:ConvBinWinogradRxSf2x3,0.3024,0,miopenConvolutionFwdAlgoWinograd,1408x14x14x1x1x384x14x14x1xNCHWxFP32x0x0x1x1x1x1x1x1
1432-14-14-1x1-384-14-14-1-0x0-1x1-1x1-0-NCHW-FP32-F=miopenConvolutionFwdAlgoDirect:ConvOclDirectFwd1x1,0.40816,0,miopenConvolutionFwdAlgoDirect,<unused>;miopenConvolutionFwdAlgoGEMM:gemm,0.07184,0,rocBlas,<unused>;miopenConvolutionFwdAlgoWinograd:ConvBinWinogradRxSf2x3,0.30192,0,miopenConvolutionFwdAlgoWinograd,1432x14x14x1x1x384x14x14x1xNCHWxFP32x0x0x1x1x1x1x1x1
1456-14-14-1x1-384-14-14-1-0x0-1x1-1x1-0-NCHW-FP32-F=miopenConvolutionFwdAlgoDirect:ConvOclDirectFwd1x1,0.07904,0,miopenConvolutionFwdAlgoDirect,<unused>;miopenConvolutionFwdAlgoGEMM:gemm,0.06048,0,rocBlas,<unused>;miopenConvolutionFwdAlgoWinograd:ConvBinWinogradRxSf2x3,0.30688,0,miopenConvolutionFwdAlgoWinograd,1456x14x14x1x1x384x14x14x1xNCHWxFP32x0x0x1x1x1x1x1x1
1480-14-14-1x1-384-14-14-1-0x0-1x1-1x1-0-NCHW-FP32-F=miopenConvolutionFwdAlgoDirect:ConvOclDirectFwd1x1,0.33392,0,miopenConvolutionFwdAlgoDirect,<unused>;miopenConvolutionFwdAlgoGEMM:gemm,0.05968,0,rocBlas,<unused>;miopenConvolutionFwdAlgoWinograd:ConvBinWinogradRxSf2x3,0.31296,0,miopenConvolutionFwdAlgoWinograd,1480x14x14x1x1x384x14x14x1xNCHWxFP32x0x0x1x1x1x1x1x1
1504-14-14-1x1-384-14-14-1-0x0-1x1-1x1-0-NCHW-FP32-F=miopenConvolutionFwdAlgoDirect:ConvOclDirectFwd1x1,0.07968,0,miopenConvolutionFwdAlgoDirect,<unused>;miopenConvolutionFwdAlgoGEMM:gemm,0.0592,0,rocBlas,<unused>;miopenConvolutionFwdAlgoWinograd:ConvBinWinogradRxSf2x3,0.3176,0,miopenConvolutionFwdAlgoWinograd,1504x14x14x1x1x384x14x14x1xNCHWxFP32x0x0x1x1x1x1x1x1
1528-14-14-1x1-384-14-14-1-0x0-1x1-1x1-0-NCHW-FP32-F=miopenConvolutionFwdAlgoDirect:ConvOclDirectFwd1x1,0.35296,0,miopenConvolutionFwdAlgoDirect,<unused>;miopenConvolutionFwdAlgoGEMM:gemm,0.06256,0,rocBlas,<unused>;miopenConvolutionFwdAlgoWinograd:ConvBinWinogradRxSf2x3,0.32096,0,miopenConvolutionFwdAlgoWinograd,1528x14x14x1x1x384x14x14x1xNCHWxFP32x0x0x1x1x1x1x1x1
1552-14-14-1x1-2304-7-7-1-0x0-2x2-1x1-0-NCHW-FP32-F=miopenConvolutionFwdAlgoDirect:ConvOclDirectFwd1x1,0.21232,0,miopenConvolutionFwdAlgoDirect,<unused>;miopenConvolutionFwdAlgoGEMM:gemm,0.12928,755776,rocBlas,<unused>;miopenConvolutionFwdAlgoWinograd:ConvBinWinogradRxSf2x3,1.28736,0,miopenConvolutionFwdAlgoWinograd,1552x14x14x1x1x2304x7x7x1xNCHWxFP32x0x0x2x2x1x1x1x1
1552-14-14-1x1-768-14-14-1-0x0-1x1-1x1-0-NCHW-FP32-F=miopenConvolutionFwdAlgoDirect:ConvOclDirectFwd1x1,0.21456,0,miopenConvolutionFwdAlgoDirect,<unused>;miopenConvolutionFwdAlgoGEMM:gemm,0.1288,0,rocBlas,<unused>;miopenConvolutionFwdAlgoWinograd:ConvBinWinogradRxSf2x3,0.32976,0,miopenConvolutionFwdAlgoWinograd,1552x14x14x1x1x768x14x14x1xNCHWxFP32x0x0x1x1x1x1x1x1
768-14-14-3x3-768-7-7-1-1x1-2x2-1x1-0-NCHW-FP32-F_g32=miopenConvolutionFwdAlgoDirect:ConvOclDirectFwd,0.12736,0,miopenConvolutionFwdAlgoDirect,<unused>;miopenConvolutionFwdAlgoGEMM:gemm,0.06048,1354752,rocBlas,<unused>;miopenConvolutionFwdAlgoWinograd:ConvBinWinogradRxSf2x3,0.0432,0,miopenConvolutionFwdAlgoWinograd,768x14x14x3x3x768x7x7x1xNCHWxFP32x1x1x2x2x1x1x32x1
768-7-7-1x1-2176-7-7-1-0x0-1x1-1x1-0-NCHW-FP32-F=miopenConvolutionFwdAlgoDirect:ConvOclDirectFwd1x1,0.09728,0,miopenConvolutionFwdAlgoDirect,<unused>;miopenConvolutionFwdAlgoGEMM:gemm,0.05808,0,rocBlas,<unused>;miopenConvolutionFwdAlgoWinograd:ConvBinWinogradRxSf2x3,0.3272,0,miopenConvolutionFwdAlgoWinograd,768x7x7x1x1x2176x7x7x1xNCHWxFP32x0x0x1x1x1x1x1x1
2432-7-7-1x1-768-7-7-1-0x0-1x1-1x1-0-NCHW-FP32-F=miopenConvolutionFwdAlgoDirect:ConvOclDirectFwd1x1,0.10592,0,miopenConvolutionFwdAlgoDirect,<unused>;miopenConvolutionFwdAlgoGEMM:gemm,0.09232,0,rocBlas,<unused>;miopenConvolutionFwdAlgoWinograd:ConvBinWinogradRxSf2x3,0.5016,0,miopenConvolutionFwdAlgoWinograd,2432x7x7x1x1x768x7x7x1xNCHWxFP32x0x0x1x1x1x1x1x1
768-7-7-3x3-768-7-7-1-1x1-1x1-1x1-0-NCHW-FP32-F_g32=miopenConvolutionFwdAlgoDirect:ConvAsm3x3U,0.03104,0,miopenConvolutionFwdAlgoDirect,<unused>;miopenConvolutionFwdAlgoGEMM:gemm,0.05248,1354752,rocBlas,<unused>;miopenConvolutionFwdAlgoWinograd:ConvBinWinogradRxSf2x3,0.02656,0,miopenConvolutionFwdAlgoWinograd,768x7x7x3x3x768x7x7x1xNCHWxFP32x1x1x1x1x1x1x32x1
2560-7-7-1x1-768-7-7-1-0x0-1x1-1x1-0-NCHW-FP32-F=miopenConvolutionFwdAlgoDirect:ConvOclDirectFwd1x1,0.10896,0,miopenConvolutionFwdAlgoDirect,<unused>;miopenConvolutionFwdAlgoGEMM:gemm,0.0952,0,rocBlas,<unused>;miopenConvolutionFwdAlgoWinograd:ConvBinWinogradRxSf2x3,0.52896,0,miopenConvolutionFwdAlgoWinograd,2560x7x7x1x1x768x7x7x1xNCHWxFP32x0x0x1x1x1x1x1x1
2688-1-1-1x1-1000-1-1-1-0x0-1x1-1x1-0-NCHW-FP32-F=miopenConvolutionFwdAlgoDirect:ConvOclDirectFwd1x1,0.31488,0,miopenConvolutionFwdAlgoDirect,<unused>;miopenConvolutionFwdAlgoGEMM:gemm,0.0544,0,rocBlas,<unused>;miopenConvolutionFwdAlgoWinograd:ConvBinWinogradRxSf2x3,0.47728,0,miopenConvolutionFwdAlgoWinograd,2688x1x1x1x1x1000x1x1x1xNCHWxFP32x0x0x1x1x1x1x1x1
256-56-56-3x3-256-56-56-1-1x1-1x1-1x1-0-NCHW-FP32-F_g64=miopenConvolutionFwdAlgoDirect:ConvAsm3x3U,0.02256,0,miopenConvolutionFwdAlgoDirect,<unused>;miopenConvolutionFwdAlgoGEMM:gemm,0.19536,28901376,rocBlas,<unused>;miopenConvolutionFwdAlgoWinograd:ConvBinWinogradRxSf2x3,0.30192,0,miopenConvolutionFwdAlgoWinograd,256x56x56x3x3x256x56x56x1xNCHWxFP32x1x1x1x1x1x1x64x1
320-56-56-1x1-256-56-56-1-0x0-1x1-1x1-0-NCHW-FP32-F=miopenConvolutionFwdAlgoImplicitGEMM:ConvHipImplicitGemmV4R4Fwd,0.08016,0,miopenConvolutionFwdAlgoImplicitGEMM,320x56x56x1x1x256x56x56x1xNCHWxFP32x0x0x1x1x1x1x1x1;miopenConvolutionFwdAlgoDirect:ConvOclDirectFwd1x1,0.0824,0,miopenConvolutionFwdAlgoDirect,<unused>;miopenConvolutionFwdAlgoGEMM:gemm,0.08288,0,rocBlas,<unused>;miopenConvolutionFwdAlgoWinograd:ConvBinWinogradRxSf3x2,0.1672,0,miopenConvolutionFwdAlgoWinograd,320x56x56x1x1x256x56x56x1xNCHWxFP32x0x0x1x1x1x1x1x1
256-56-56-1x1-256-56-56-1-0x0-1x1-1x1-0-NCHW-FP32-F=miopenConvolutionFwdAlgoImplicitGEMM:ConvHipImplicitGemmV4R4Fwd,0.08816,0,miopenConvolutionFwdAlgoImplicitGEMM,256x56x56x1x1x256x56x56x1xNCHWxFP32x0x0x1x1x1x1x1x1;miopenConvolutionFwdAlgoDirect:ConvOclDirectFwd1x1,0.07776,0,miopenConvolutionFwdAlgoDirect,<unused>;miopenConvolutionFwdAlgoGEMM:gemm,0.07312,0,rocBlas,<unused>;miopenConvolutionFwdAlgoWinograd:ConvBinWinogradRxSf3x2,0.15168,0,miopenConvolutionFwdAlgoWinograd,256x56x56x1x1x256x56x56x1xNCHWxFP32x0x0x1x1x1x1x1x1
256-56-56-1x1-512-56-56-1-0x0-1x1-1x1-0-NCHW-FP32-F=miopenConvolutionFwdAlgoImplicitGEMM:ConvHipImplicitGemmV4R4Fwd,0.11152,0,miopenConvolutionFwdAlgoImplicitGEMM,256x56x56x1x1x512x56x56x1xNCHWxFP32x0x0x1x1x1x1x1x1;miopenConvolutionFwdAlgoDirect:ConvAsm1x1U,0.16864,0,miopenConvolutionFwdAlgoDirect,<unused>;miopenConvolutionFwdAlgoGEMM:gemm,0.11456,0,rocBlas,<unused>;miopenConvolutionFwdAlgoWinograd:ConvBinWinogradRxSf3x2,0.25392,0,miopenConvolutionFwdAlgoWinograd,256x56x56x1x1x512x56x56x1xNCHWxFP32x0x0x1x1x1x1x1x1
512-56-56-3x3-512-28-28-1-1x1-2x2-1x1-0-NCHW-FP32-F_g64=miopenConvolutionFwdAlgoDirect:ConvOclDirectFwd,0.07616,0,miopenConvolutionFwdAlgoDirect,<unused>;miopenConvolutionFwdAlgoGEMM:gemm,0.12528,14450688,rocBlas,<unused>;miopenConvolutionFwdAlgoWinograd:ConvBinWinogradRxSf2x3,0.15216,0,miopenConvolutionFwdAlgoWinograd,512x56x56x3x3x512x28x28x1xNCHWxFP32x1x1x2x2x1x1x64x1
768-28-28-1x1-512-28-28-1-0x0-1x1-1x1-0-NCHW-FP32-F=miopenConvolutionFwdAlgoDirect:ConvAsm1x1U,0.10912,0,miopenConvolutionFwdAlgoDirect,<unused>;miopenConvolutionFwdAlgoGEMM:gemm,0.0992,0,rocBlas,<unused>;miopenConvolutionFwdAlgoWinograd:ConvBinWinogradRxSf2x3,0.33568,0,miopenConvolutionFwdAlgoWinograd,768x28x28x1x1x512x28x28x1xNCHWxFP32x0x0x1x1x1x1x1x1
512-28-28-1x1-512-28-28-1-0x0-1x1-1x1-0-NCHW-FP32-F=miopenConvolutionFwdAlgoDirect:ConvAsm1x1U,0.07488,0,miopenConvolutionFwdAlgoDirect,<unused>;miopenConvolutionFwdAlgoGEMM:gemm,0.06496,0,rocBlas,<unused>;miopenConvolutionFwdAlgoWinograd:ConvBinWinogradRxSf2x3,0.22848,0,miopenConvolutionFwdAlgoWinograd,512x28x28x1x1x512x28x28x1xNCHWxFP32x0x0x1x1x1x1x1x1
512-28-28-3x3-512-28-28-1-1x1-1x1-1x1-0-NCHW-FP32-F_g64=miopenConvolutionFwdAlgoDirect:ConvAsm3x3U,0.02512,0,miopenConvolutionFwdAlgoDirect,<unused>;miopenConvolutionFwdAlgoGEMM:gemm,0.14528,14450688,rocBlas,<unused>;miopenConvolutionFwdAlgoWinograd:ConvBinWinogradRxSf2x3,0.11248,0,miopenConvolutionFwdAlgoWinograd,512x28x28x3x3x512x28x28x1xNCHWxFP32x1x1x1x1x1x1x64x1
512-28-28-1x1-1024-28-28-1-0x0-1x1-1x1-0-NCHW-FP32-F=miopenConvolutionFwdAlgoDirect:ConvAsm1x1U,0.15216,0,miopenConvolutionFwdAlgoDirect,<unused>;miopenConvolutionFwdAlgoGEMM:gemm,0.11104,0,rocBlas,<unused>;miopenConvolutionFwdAlgoWinograd:ConvBinWinogradRxSf3x2,0.35456,0,miopenConvolutionFwdAlgoWinograd,512x28x28x1x1x1024x28x28x1xNCHWxFP32x0x0x1x1x1x1x1x1
1024-28-28-3x3-1024-14-14-1-1x1-2x2-1x1-0-NCHW-FP32-F_g64=miopenConvolutionFwdAlgoDirect:ConvOclDirectFwd,0.068,0,miopenConvolutionFwdAlgoDirect,<unused>;miopenConvolutionFwdAlgoGEMM:gemm,0.1168,7225344,rocBlas,<unused>;miopenConvolutionFwdAlgoWinograd:ConvBinWinogradRxSf2x3,0.10112,0,miopenConvolutionFwdAlgoWinograd,1024x28x28x3x3x1024x14x14x1xNCHWxFP32x1x1x2x2x1x1x64x1
1536-14-14-1x1-1024-14-14-1-0x0-1x1-1x1-0-NCHW-FP32-F=miopenConvolutionFwdAlgoDirect:ConvAsm1x1U,0.16144,0,miopenConvolutionFwdAlgoDirect,<unused>;miopenConvolutionFwdAlgoGEMM:gemm,0.17072,0,rocBlas,<unused>;miopenConvolutionFwdAlgoWinograd:ConvBinWinogradRxSf3x2,0.34544,0,miopenConvolutionFwdAlgoWinograd,1536x14x14x1x1x1024x14x14x1xNCHWxFP32x0x0x1x1x1x1x1x1
1024-14-14-1x1-1024-14-14-1-0x0-1x1-1x1-0-NCHW-FP32-F=miopenConvolutionFwdAlgoDirect:ConvAsm1x1U,0.12096,0,miopenConvolutionFwdAlgoDirect,<unused>;miopenConvolutionFwdAlgoGEMM:gemm,0.13664,0,rocBlas,<unused>;miopenConvolutionFwdAlgoWinograd:ConvBinWinogradRxSf3x2,0.2432,0,miopenConvolutionFwdAlgoWinograd,1024x14x14x1x1x1024x14x14x1xNCHWxFP32x0x0x1x1x1x1x1x1
1024-14-14-3x3-1024-14-14-1-1x1-1x1-1x1-0-NCHW-FP32-F_g64=miopenConvolutionFwdAlgoDirect:ConvOclDirectFwd,0.03344,0,miopenConvolutionFwdAlgoDirect,<unused>;miopenConvolutionFwdAlgoGEMM:gemm,0.07888,7225344,rocBlas,<unused>;miopenConvolutionFwdAlgoWinograd:ConvBinWinogradRxSf2x3,0.05136,0,miopenConvolutionFwdAlgoWinograd,1024x14x14x3x3x1024x14x14x1xNCHWxFP32x1x1x1x1x1x1x64x1
1024-14-14-1x1-2048-14-14-1-0x0-1x1-1x1-0-NCHW-FP32-F=miopenConvolutionFwdAlgoDirect:ConvAsm1x1U,0.20176,0,miopenConvolutionFwdAlgoDirect,<unused>;miopenConvolutionFwdAlgoGEMM:gemm,0.2096,0,rocBlas,<unused>;miopenConvolutionFwdAlgoWinograd:ConvBinWinogradRxSf3x2,0.4592,0,miopenConvolutionFwdAlgoWinograd,1024x14x14x1x1x2048x14x14x1xNCHWxFP32x0x0x1x1x1x1x1x1
2048-14-14-3x3-2048-7-7-1-1x1-2x2-1x1-0-NCHW-FP32-F_g64=miopenConvolutionFwdAlgoDirect:ConvOclDirectFwd,0.09872,0,miopenConvolutionFwdAlgoDirect,<unused>;miopenConvolutionFwdAlgoGEMM:gemm,0.09792,3612672,rocBlas,<unused>;miopenConvolutionFwdAlgoWinograd:ConvBinWinogradRxSf2x3,0.08672,0,miopenConvolutionFwdAlgoWinograd,2048x14x14x3x3x2048x7x7x1xNCHWxFP32x1x1x2x2x1x1x64x1
3072-7-7-1x1-2048-7-7-1-0x0-1x1-1x1-0-NCHW-FP32-F=miopenConvolutionFwdAlgoDirect:ConvOclDirectFwd1x1,0.24496,0,miopenConvolutionFwdAlgoDirect,<unused>;miopenConvolutionFwdAlgoGEMM:gemm,0.18848,0,rocBlas,<unused>;miopenConvolutionFwdAlgoWinograd:ConvBinWinogradRxSf2x3,1.22816,0,miopenConvolutionFwdAlgoWinograd,3072x7x7x1x1x2048x7x7x1xNCHWxFP32x0x0x1x1x1x1x1x1
2048-7-7-1x1-2048-7-7-1-0x0-1x1-1x1-0-NCHW-FP32-F=miopenConvolutionFwdAlgoDirect:ConvOclDirectFwd1x1,0.18064,0,miopenConvolutionFwdAlgoDirect,<unused>;miopenConvolutionFwdAlgoGEMM:gemm,0.3128,0,rocBlas,<unused>;miopenConvolutionFwdAlgoWinograd:ConvBinWinogradRxSf2x3,0.83104,0,miopenConvolutionFwdAlgoWinograd,2048x7x7x1x1x2048x7x7x1xNCHWxFP32x0x0x1x1x1x1x1x1
2048-7-7-3x3-2048-7-7-1-1x1-1x1-1x1-0-NCHW-FP32-F_g64=miopenConvolutionFwdAlgoDirect:ConvOclDirectFwd,0.0392,0,miopenConvolutionFwdAlgoDirect,<unused>;miopenConvolutionFwdAlgoGEMM:gemm,0.0784,3612672,rocBlas,<unused>;miopenConvolutionFwdAlgoWinograd:ConvBinWinogradRxSf2x3,0.04608,0,miopenConvolutionFwdAlgoWinograd,2048x7x7x3x3x2048x7x7x1xNCHWxFP32x1x1x1x1x1x1x64x1
512-7-7-7x7-4096-1-1-1-0x0-1x1-1x1-0-NCHW-FP32-F=miopenConvolutionFwdAlgoDirect:ConvOclDirectFwd,4.53776,0,miopenConvolutionFwdAlgoDirect,<unused>;miopenConvolutionFwdAlgoGEMM:gemm,1.47696,100352,rocBlas,<unused>;miopenConvolutionFwdAlgoWinograd:ConvBinWinogradRxSf2x3,3.32208,0,miopenConvolutionFwdAlgoWinograd,512x7x7x7x7x4096x1x1x1xNCHWxFP32x0x0x1x1x1x1x1x1
4096-1-1-1x1-4096-1-1-1-0x0-1x1-1x1-0-NCHW-FP32-F=miopenConvolutionFwdAlgoDirect:ConvOclDirectFwd1x1,1.03008,0,miopenConvolutionFwdAlgoDirect,<unused>;miopenConvolutionFwdAlgoGEMM:gemm,0.21744,0,rocBlas,<unused>;miopenConvolutionFwdAlgoWinograd:ConvBinWinogradRxSf2x3,2.46272,0,miopenConvolutionFwdAlgoWinograd,4096x1x1x1x1x4096x1x1x1xNCHWxFP32x0x0x1x1x1x1x1x1
4096-1-1-1x1-1000-1-1-1-0x0-1x1-1x1-0-NCHW-FP32-F=miopenConvolutionFwdAlgoDirect:ConvAsm1x1U,0.2552,0,miopenConvolutionFwdAlgoDirect,<unused>;miopenConvolutionFwdAlgoGEMM:gemm,0.08752,0,rocBlas,<unused>;miopenConvolutionFwdAlgoWinograd:ConvBinWinogradRxSf2x3,0.73216,0,miopenConvolutionFwdAlgoWinograd,4096x1x1x1x1x1000x1x1x1xNCHWxFP32x0x0x1x1x1x1x1x1
3-225-225-3x3-32-112-112-1-0x0-2x2-1x1-0-NCHW-FP32-F=miopenConvolutionFwdAlgoDirect:ConvOclDirectFwd,0.01824,0,miopenConvolutionFwdAlgoDirect,<unused>;miopenConvolutionFwdAlgoGEMM:gemm,0.06592,1354752,rocBlas,<unused>;miopenConvolutionFwdAlgoWinograd:ConvBinWinogradRxSf2x3,0.03568,0,miopenConvolutionFwdAlgoWinograd,3x225x225x3x3x32x112x112x1xNCHWxFP32x0x0x2x2x1x1x1x1
32-112-112-3x3-32-112-112-1-1x1-1x1-1x1-0-NCHW-FP32-F_g32=miopenConvolutionFwdAlgoDirect:ConvOclDirectFwd,0.01248,0,miopenConvolutionFwdAlgoDirect,<unused>;miopenConvolutionFwdAlgoGEMM:gemm,0.12016,14450688,rocBlas,<unused>;miopenConvolutionFwdAlgoWinograd:ConvBinWinogradRxSf2x3,0.1896,0,miopenConvolutionFwdAlgoWinograd,32x112x112x3x3x32x112x112x1xNCHWxFP32x1x1x1x1x1x1x32x1
32-112-112-1x1-64-112-112-1-0x0-1x1-1x1-0-NCHW-FP32-F=miopenConvolutionFwdAlgoImplicitGEMM:ConvHipImplicitGemmV4R4Fwd,0.01664,0,miopenConvolutionFwdAlgoImplicitGEMM,32x112x112x1x1x64x112x112x1xNCHWxFP32x0x0x1x1x1x1x1x1;miopenConvolutionFwdAlgoDirect:ConvOclDirectFwd1x1,0.01456,0,miopenConvolutionFwdAlgoDirect,<unused>;miopenConvolutionFwdAlgoGEMM:gemm,0.02544,0,rocBlas,<unused>;miopenConvolutionFwdAlgoWinograd:ConvBinWinogradRxSf3x2,0.05056,0,miopenConvolutionFwdAlgoWinograd,32x112x112x1x1x64x112x112x1xNCHWxFP32x0x0x1x1x1x1x1x1
64-113-113-3x3-64-56-56-1-0x0-2x2-1x1-0-NCHW-FP32-F_g64=miopenConvolutionFwdAlgoDirect:ConvOclDirectFwd,0.01808,0,miopenConvolutionFwdAlgoDirect,<unused>;miopenConvolutionFwdAlgoGEMM:gemm,0.07376,7225344,rocBlas,<unused>;miopenConvolutionFwdAlgoWinograd:ConvBinWinogradRxSf2x3,0.19344,0,miopenConvolutionFwdAlgoWinograd,64x113x113x3x3x64x56x56x1xNCHWxFP32x0x0x2x2x1x1x64x1
128-56-56-3x3-128-56-56-1-1x1-1x1-1x1-0-NCHW-FP32-F_g128=miopenConvolutionFwdAlgoDirect:ConvOclDirectFwd,0.01328,0,miopenConvolutionFwdAlgoDirect,<unused>;miopenConvolutionFwdAlgoGEMM:gemm,0.11056,14450688,rocBlas,<unused>;miopenConvolutionFwdAlgoWinograd:ConvBinWinogradRxSf2x3,0.22736,0,miopenConvolutionFwdAlgoWinograd,128x56x56x3x3x128x56x56x1xNCHWxFP32x1x1x1x1x1x1x128x1
128-57-57-3x3-128-28-28-1-0x0-2x2-1x1-0-NCHW-FP32-F_g128=miopenConvolutionFwdAlgoDirect:ConvOclDirectFwd,0.01376,0,miopenConvolutionFwdAlgoDirect,<unused>;miopenConvolutionFwdAlgoGEMM:gemm,0.04944,3612672,rocBlas,<unused>;miopenConvolutionFwdAlgoWinograd:ConvBinWinogradRxSf2x3,0.12608,0,miopenConvolutionFwdAlgoWinograd,128x57x57x3x3x128x28x28x1xNCHWxFP32x0x0x2x2x1x1x128x1
128-28-28-1x1-256-28-28-1-0x0-1x1-1x1-0-NCHW-FP32-F=miopenConvolutionFwdAlgoDirect:ConvAsm1x1U,0.01664,0,miopenConvolutionFwdAlgoDirect,<unused>;miopenConvolutionFwdAlgoGEMM:gemm,0.03984,0,rocBlas,<unused>;miopenConvolutionFwdAlgoWinograd:ConvBinWinogradRxS,0.0496,0,miopenConvolutionFwdAlgoWinograd,128x28x28x1x1x256x28x28x1xNCHWxFP32x0x0x1x1x1x1x1x1
256-28-28-3x3-256-28-28-1-1x1-1x1-1x1-0-NCHW-FP32-F_g256=miopenConvolutionFwdAlgoDirect:ConvOclDirectFwd,0.0104,0,miopenConvolutionFwdAlgoDirect,<unused>;miopenConvolutionFwdAlgoGEMM:gemm,0.06848,7225344,rocBlas,<unused>;miopenConvolutionFwdAlgoWinograd:ConvBinWinogradRxSf2x3,0.3112,0,miopenConvolutionFwdAlgoWinograd,256x28x28x3x3x256x28x28x1xNCHWxFP32x1x1x1x1x1x1x256x1
256-28-28-1x1-256-28-28-1-0x0-1x1-1x1-0-NCHW-FP32-F=miopenConvolutionFwdAlgoDirect:ConvAsm1x1U,0.0296,0,miopenConvolutionFwdAlgoDirect,<unused>;miopenConvolutionFwdAlgoGEMM:gemm,0.04112,0,rocBlas,<unused>;miopenConvolutionFwdAlgoWinograd:ConvBinWinogradRxS,0.07584,0,miopenConvolutionFwdAlgoWinograd,256x28x28x1x1x256x28x28x1xNCHWxFP32x0x0x1x1x1x1x1x1
256-29-29-3x3-256-14-14-1-0x0-2x2-1x1-0-NCHW-FP32-F_g256=miopenConvolutionFwdAlgoDirect:ConvOclDirectFwd,0.00896,0,miopenConvolutionFwdAlgoDirect,<unused>;miopenConvolutionFwdAlgoGEMM:gemm,0.0392,1806336,rocBlas,<unused>;miopenConvolutionFwdAlgoWinograd:ConvBinWinogradRxSf2x3,0.088,0,miopenConvolutionFwdAlgoWinograd,256x29x29x3x3x256x14x14x1xNCHWxFP32x0x0x2x2x1x1x256x1
256-14-14-1x1-512-14-14-1-0x0-1x1-1x1-0-NCHW-FP32-F=miopenConvolutionFwdAlgoDirect:ConvAsm1x1U,0.02416,0,miopenConvolutionFwdAlgoDirect,<unused>;miopenConvolutionFwdAlgoGEMM:gemm,0.03936,0,rocBlas,<unused>;miopenConvolutionFwdAlgoWinograd:ConvBinWinogradRxS,0.0752,0,miopenConvolutionFwdAlgoWinograd,256x14x14x1x1x512x14x14x1xNCHWxFP32x0x0x1x1x1x1x1x1
512-14-14-3x3-512-14-14-1-1x1-1x1-1x1-0-NCHW-FP32-F_g512=miopenConvolutionFwdAlgoDirect:ConvOclDirectFwd,0.008,0,miopenConvolutionFwdAlgoDirect,<unused>;miopenConvolutionFwdAlgoGEMM:gemm,0.07392,3612672,rocBlas,<unused>;miopenConvolutionFwdAlgoWinograd:ConvBinWinogradRxSf2x3,0.12608,0,miopenConvolutionFwdAlgoWinograd,512x14x14x3x3x512x14x14x1xNCHWxFP32x1x1x1x1x1x1x512x1
512-14-14-1x1-512-14-14-1-0x0-1x1-1x1-0-NCHW-FP32-F=miopenConvolutionFwdAlgoDirect:ConvAsm1x1U,0.03872,0,miopenConvolutionFwdAlgoDirect,<unused>;miopenConvolutionFwdAlgoGEMM:gemm,0.03424,0,rocBlas,<unused>;miopenConvolutionFwdAlgoWinograd:ConvBinWinogradRxSf2x3,0.12592,0,miopenConvolutionFwdAlgoWinograd,512x14x14x1x1x512x14x14x1xNCHWxFP32x0x0x1x1x1x1x1x1
512-15-15-3x3-512-7-7-1-0x0-2x2-1x1-0-NCHW-FP32-F_g512=miopenConvolutionFwdAlgoDirect:ConvOclDirectFwd,0.00848,0,miopenConvolutionFwdAlgoDirect,<unused>;miopenConvolutionFwdAlgoGEMM:gemm,0.04336,903168,rocBlas,<unused>;miopenConvolutionFwdAlgoWinograd:ConvBinWinogradRxSf2x3,0.11648,0,miopenConvolutionFwdAlgoWinograd,512x15x15x3x3x512x7x7x1xNCHWxFP32x0x0x2x2x1x1x512x1
512-7-7-1x1-1024-7-7-1-0x0-1x1-1x1-0-NCHW-FP32-F=miopenConvolutionFwdAlgoDirect:ConvOclDirectFwd1x1,0.03008,0,miopenConvolutionFwdAlgoDirect,<unused>;miopenConvolutionFwdAlgoGEMM:gemm,0.03584,0,rocBlas,<unused>;miopenConvolutionFwdAlgoWinograd:ConvBinWinogradRxSf2x3,0.12592,0,miopenConvolutionFwdAlgoWinograd,512x7x7x1x1x1024x7x7x1xNCHWxFP32x0x0x1x1x1x1x1x1
1024-7-7-3x3-1024-7-7-1-1x1-1x1-1x1-0-NCHW-FP32-F_g1024=miopenConvolutionFwdAlgoDirect:ConvOclDirectFwd,0.00704,0,miopenConvolutionFwdAlgoDirect,<unused>;miopenConvolutionFwdAlgoGEMM:gemm,0.0504,1806336,rocBlas,<unused>;miopenConvolutionFwdAlgoWinograd:ConvBinWinogradRxSf2x3,0.19088,0,miopenConvolutionFwdAlgoWinograd,1024x7x7x3x3x1024x7x7x1xNCHWxFP32x1x1x1x1x1x1x1024x1
1024-7-7-1x1-1024-7-7-1-0x0-1x1-1x1-0-NCHW-FP32-F=miopenConvolutionFwdAlgoDirect:ConvOclDirectFwd1x1,0.056,0,miopenConvolutionFwdAlgoDirect,<unused>;miopenConvolutionFwdAlgoGEMM:gemm,0.06112,0,rocBlas,<unused>;miopenConvolutionFwdAlgoWinograd:ConvBinWinogradRxSf2x3,0.22928,0,miopenConvolutionFwdAlgoWinograd,1024x7x7x1x1x1024x7x7x1xNCHWxFP32x0x0x1x1x1x1x1x1
1024-1-1-1x1-1001-1-1-1-0x0-1x1-1x1-0-NCHW-FP32-F=miopenConvolutionFwdAlgoDirect:ConvOclDirectFwd1x1,0.04592,0,miopenConvolutionFwdAlgoDirect,<unused>;miopenConvolutionFwdAlgoGEMM:gemm,0.18656,0,rocBlas,<unused>;miopenConvolutionFwdAlgoWinograd:ConvBinWinogradRxSf2x3,0.20032,0,miopenConvolutionFwdAlgoWinograd,1024x1x1x1x1x1001x1x1x1xNCHWxFP32x0x0x1x1x1x1x1x1
64-147-147-3x3-96-73-73-1-0x0-2x2-1x1-0-NCHW-FP32-F=miopenConvolutionFwdAlgoDirect:ConvOclDirectFwd,0.4856,0,miopenConvolutionFwdAlgoDirect,<unused>;miopenConvolutionFwdAlgoGEMM:gemm,0.14672,12278016,rocBlas,<unused>;miopenConvolutionFwdAlgoWinograd:ConvBinWinogradRxSf2x3,0.19104,0,miopenConvolutionFwdAlgoWinograd,64x147x147x3x3x96x73x73x1xNCHWxFP32x0x0x2x2x1x1x1x1
160-73-73-1x1-64-73-73-1-0x0-1x1-1x1-0-NCHW-FP32-F=miopenConvolutionFwdAlgoDirect:ConvAsm1x1U,0.02784,0,miopenConvolutionFwdAlgoDirect,<unused>;miopenConvolutionFwdAlgoGEMM:gemm,0.05392,0,rocBlas,<unused>;miopenConvolutionFwdAlgoWinograd:ConvBinWinogradRxSf3x2,0.06432,0,miopenConvolutionFwdAlgoWinograd,160x73x73x1x1x64x73x73x1xNCHWxFP32x0x0x1x1x1x1x1x1
64-73-73-3x3-96-71-71-1-0x0-1x1-1x1-0-NCHW-FP32-F=miopenConvolutionFwdAlgoDirect:ConvOclDirectFwd,0.24064,0,miopenConvolutionFwdAlgoDirect,<unused>;miopenConvolutionFwdAlgoGEMM:gemm,0.1248,11614464,rocBlas,<unused>;miopenConvolutionFwdAlgoWinograd:ConvBinWinogradRxS,0.06608,0,miopenConvolutionFwdAlgoWinograd,64x73x73x3x3x96x71x71x1xNCHWxFP32x0x0x1x1x1x1x1x1
64-73-73-1x7-64-73-73-1-0x3-1x1-1x1-0-NCHW-FP32-F=miopenConvolutionFwdAlgoWinograd:ConvBinWinogradRxSf3x2,0.08384,0,miopenConvolutionFwdAlgoWinograd,64x73x73x1x7x64x73x73x1xNCHWxFP32x0x3x1x1x1x1x1x1;miopenConvolutionFwdAlgoGEMM:gemm,0.09248,9549568,rocBlas,<unused>
64-73-73-7x1-64-73-73-1-3x0-1x1-1x1-0-NCHW-FP32-F=miopenConvolutionFwdAlgoWinograd:ConvBinWinogradRxSf3x2,0.08416,0,miopenConvolutionFwdAlgoWinograd,64x73x73x7x1x64x73x73x1xNCHWxFP32x3x0x1x1x1x1x1x1;miopenConvolutionFwdAlgoGEMM:gemm,0.09824,9549568,rocBlas,<unused>
192-71-71-3x3-192-35-35-1-0x0-2x2-1x1-0-NCHW-FP32-F=miopenConvolutionFwdAlgoDirect:ConvOclDirectFwd,0.918719,0,miopenConvolutionFwdAlgoDirect,<unused>;miopenConvolutionFwdAlgoGEMM:gemm,0.15072,8467200,rocBlas,<unused>;miopenConvolutionFwdAlgoWinograd:ConvBinWinogradRxSf2x3,0.34304,0,miopenConvolutionFwdAlgoWinograd,192x71x71x3x3x192x35x35x1xNCHWxFP32x0x0x2x2x1x1x1x1
384-35-35-1x1-96-35-35-1-0x0-1x1-1x1-0-NCHW-FP32-F=miopenConvolutionFwdAlgoDirect:ConvAsm1x1U,0.0272,0,miopenConvolutionFwdAlgoDirect,<unused>;miopenConvolutionFwdAlgoGEMM:gemm,0.06544,0,rocBlas,<unused>;miopenConvolutionFwdAlgoWinograd:ConvBinWinogradRxSf2x3,0.09968,0,miopenConvolutionFwdAlgoWinograd,384x35x35x1x1x96x35x35x1xNCHWxFP32x0x0x1x1x1x1x1x1
384-35-35-1x1-64-35-35-1-0x0-1x1-1x1-0-NCHW-FP32-F=miopenConvolutionFwdAlgoDirect:ConvAsm1x1U,0.02288,0,miopenConvolutionFwdAlgoDirect,<unused>;miopenConvolutionFwdAlgoGEMM:gemm,0.0728,0,rocBlas,<unused>;miopenConvolutionFwdAlgoWinograd:ConvBinWinogradRxSf2x3,0.10032,0,miopenConvolutionFwdAlgoWinograd,384x35x35x1x1x64x35x35x1xNCHWxFP32x0x0x1x1x1x1x1x1
384-35-35-3x3-384-17-17-1-0x0-2x2-1x1-0-NCHW-FP32-F=miopenConvolutionFwdAlgoDirect:ConvOclDirectFwd,1.58096,0,miopenConvolutionFwdAlgoDirect,<unused>;miopenConvolutionFwdAlgoGEMM:gemm,0.14576,3995136,rocBlas,<unused>;miopenConvolutionFwdAlgoWinograd:ConvBinWinogradRxSf2x3,0.34096,0,miopenConvolutionFwdAlgoWinograd,384x35x35x3x3x384x17x17x1xNCHWxFP32x0x0x2x2x1x1x1x1
384-35-35-1x1-192-35-35-1-0x0-1x1-1x1-0-NCHW-FP32-F=miopenConvolutionFwdAlgoDirect:ConvAsm1x1U,0.04368,0,miopenConvolutionFwdAlgoDirect,<unused>;miopenConvolutionFwdAlgoGEMM:gemm,0.07264,0,rocBlas,<unused>;miopenConvolutionFwdAlgoWinograd:ConvBinWinogradRxSf3x2,0.1096,0,miopenConvolutionFwdAlgoWinograd,384x35x35x1x1x192x35x35x1xNCHWxFP32x0x0x1x1x1x1x1x1
192-35-35-3x3-224-35-35-1-1x1-1x1-1x1-0-NCHW-FP32-F=miopenConvolutionFwdAlgoWinograd:ConvBinWinograd3x3U,0.10016,0,miopenConvolutionFwdAlgoWinograd,192x35x35x3x3x224x35x35x1xNCHWxFP32x1x1x1x1x1x1x1x1
224-35-35-3x3-256-17-17-1-0x0-2x2-1x1-0-NCHW-FP32-F=miopenConvolutionFwdAlgoDirect:ConvOclDirectFwd,0.899679,0,miopenConvolutionFwdAlgoDirect,<unused>;miopenConvolutionFwdAlgoGEMM:gemm,0.09248,2330496,rocBlas,<unused>;miopenConvolutionFwdAlgoWinograd:ConvBinWinogradRxSf2x3,0.2096,0,miopenConvolutionFwdAlgoWinograd,224x35x35x3x3x256x17x17x1xNCHWxFP32x0x0x2x2x1x1x1x1
1024-17-17-1x1-384-17-17-1-0x0-1x1-1x1-0-NCHW-FP32-F=miopenConvolutionFwdAlgoDirect:ConvAsm1x1U,0.07392,0,miopenConvolutionFwdAlgoDirect,<unused>;miopenConvolutionFwdAlgoGEMM:gemm,0.13824,0,rocBlas,<unused>;miopenConvolutionFwdAlgoWinograd:ConvBinWinogradRxSf2x3,0.22752,0,miopenConvolutionFwdAlgoWinograd,1024x17x17x1x1x384x17x17x1xNCHWxFP32x0x0x1x1x1x1x1x1
1024-17-17-1x1-192-17-17-1-0x0-1x1-1x1-0-NCHW-FP32-F=miopenConvolutionFwdAlgoDirect:ConvOclDirectFwd1x1,0.04752,0,miopenConvolutionFwdAlgoDirect,<unused>;miopenConvolutionFwdAlgoGEMM:gemm,0.09504,0,rocBlas,<unused>;miopenConvolutionFwdAlgoWinograd:ConvBinWinogradRxSf2x3,0.22736,0,miopenConvolutionFwdAlgoWinograd,1024x17x17x1x1x192x17x17x1xNCHWxFP32x0x0x1x1x1x1x1x1
192-17-17-1x7-224-17-17-1-0x3-1x1-1x1-0-NCHW-FP32-F=miopenConvolutionFwdAlgoWinograd:ConvBinWinogradRxSf2x3,0.17488,0,miopenConvolutionFwdAlgoWinograd,192x17x17x1x7x224x17x17x1xNCHWxFP32x0x3x1x1x1x1x1x1;miopenConvolutionFwdAlgoGEMM:gemm,0.0656,1553664,rocBlas,<unused>
224-17-17-7x1-256-17-17-1-3x0-1x1-1x1-0-NCHW-FP32-F=miopenConvolutionFwdAlgoWinograd:ConvBinWinogradRxSf2x3,0.15712,0,miopenConvolutionFwdAlgoWinograd,224x17x17x7x1x256x17x17x1xNCHWxFP32x3x0x1x1x1x1x1x1;miopenConvolutionFwdAlgoGEMM:gemm,0.0744,1812608,rocBlas,<unused>
224-17-17-7x1-224-17-17-1-3x0-1x1-1x1-0-NCHW-FP32-F=miopenConvolutionFwdAlgoWinograd:ConvBinWinogradRxSf2x3,0.156,0,miopenConvolutionFwdAlgoWinograd,224x17x17x7x1x224x17x17x1xNCHWxFP32x3x0x1x1x1x1x1x1;miopenConvolutionFwdAlgoGEMM:gemm,0.07328,1812608,rocBlas,<unused>
224-17-17-1x7-256-17-17-1-0x3-1x1-1x1-0-NCHW-FP32-F=miopenConvolutionFwdAlgoWinograd:ConvBinWinogradRxSf2x3,0.19824,0,miopenConvolutionFwdAlgoWinograd,224x17x17x1x7x256x17x17x1xNCHWxFP32x0x3x1x1x1x1x1x1;miopenConvolutionFwdAlgoGEMM:gemm,0.07184,1812608,rocBlas,<unused>
1024-17-17-1x1-128-17-17-1-0x0-1x1-1x1-0-NCHW-FP32-F=miopenConvolutionFwdAlgoDirect:ConvOclDirectFwd1x1,0.03744,0,miopenConvolutionFwdAlgoDirect,<unused>;miopenConvolutionFwdAlgoGEMM:gemm,0.04704,0,rocBlas,<unused>;miopenConvolutionFwdAlgoWinograd:ConvBinWinogradRxSf2x3,0.22672,0,miopenConvolutionFwdAlgoWinograd,1024x17x17x1x1x128x17x17x1xNCHWxFP32x0x0x1x1x1x1x1x1
1024-17-17-1x1-256-17-17-1-0x0-1x1-1x1-0-NCHW-FP32-F=miopenConvolutionFwdAlgoDirect:ConvOclDirectFwd1x1,0.05168,0,miopenConvolutionFwdAlgoDirect,<unused>;miopenConvolutionFwdAlgoGEMM:gemm,0.08896,0,rocBlas,<unused>;miopenConvolutionFwdAlgoWinograd:ConvBinWinogradRxSf2x3,0.22672,0,miopenConvolutionFwdAlgoWinograd,1024x17x17x1x1x256x17x17x1xNCHWxFP32x0x0x1x1x1x1x1x1
256-17-17-1x7-256-17-17-1-0x3-1x1-1x1-0-NCHW-FP32-F=miopenConvolutionFwdAlgoWinograd:ConvBinWinogradRxSf2x3,0.22384,0,miopenConvolutionFwdAlgoWinograd,256x17x17x1x7x256x17x17x1xNCHWxFP32x0x3x1x1x1x1x1x1;miopenConvolutionFwdAlgoGEMM:gemm,0.07984,2071552,rocBlas,<unused>
256-17-17-7x1-320-17-17-1-3x0-1x1-1x1-0-NCHW-FP32-F=miopenConvolutionFwdAlgoWinograd:ConvBinWinogradRxSf2x3,0.17616,0,miopenConvolutionFwdAlgoWinograd,256x17x17x7x1x320x17x17x1xNCHWxFP32x3x0x1x1x1x1x1x1;miopenConvolutionFwdAlgoGEMM:gemm,0.08432,2071552,rocBlas,<unused>
320-17-17-3x3-320-8-8-1-0x0-2x2-1x1-0-NCHW-FP32-F=miopenConvolutionFwdAlgoImplicitGEMM:ConvHipImplicitGemmV4R4Fwd,0.37632,0,miopenConvolutionFwdAlgoImplicitGEMM,320x17x17x3x3x320x8x8x1xNCHWxFP32x0x0x2x2x1x1x1x1;miopenConvolutionFwdAlgoDirect:ConvOclDirectFwd,1.07376,0,miopenConvolutionFwdAlgoDirect,<unused>;miopenConvolutionFwdAlgoGEMM:gemm,0.08224,737280,rocBlas,<unused>;miopenConvolutionFwdAlgoWinograd:ConvBinWinogradRxSf2x3,0.29696,0,miopenConvolutionFwdAlgoWinograd,320x17x17x3x3x320x8x8x1xNCHWxFP32x0x0x2x2x1x1x1x1
1536-8-8-1x1-256-8-8-1-0x0-1x1-1x1-0-NCHW-FP32-F=miopenConvolutionFwdAlgoImplicitGEMM:ConvHipImplicitGemmV4R4Fwd,0.17792,0,miopenConvolutionFwdAlgoImplicitGEMM,1536x8x8x1x1x256x8x8x1xNCHWxFP32x0x0x1x1x1x1x1x1;miopenConvolutionFwdAlgoDirect:ConvOclDirectFwd1x1,0.04912,0,miopenConvolutionFwdAlgoDirect,<unused>;miopenConvolutionFwdAlgoGEMM:gemm,0.05648,0,rocBlas,<unused>;miopenConvolutionFwdAlgoWinograd:ConvBinWinogradRxSf2x3,0.32336,0,miopenConvolutionFwdAlgoWinograd,1536x8x8x1x1x256x8x8x1xNCHWxFP32x0x0x1x1x1x1x1x1
1536-8-8-1x1-384-8-8-1-0x0-1x1-1x1-0-NCHW-FP32-F=miopenConvolutionFwdAlgoImplicitGEMM:ConvHipImplicitGemmV4R4Fwd,0.17952,0,miopenConvolutionFwdAlgoImplicitGEMM,1536x8x8x1x1x384x8x8x1xNCHWxFP32x0x0x1x1x1x1x1x1;miopenConvolutionFwdAlgoDirect:ConvOclDirectFwd1x1,0.05792,0,miopenConvolutionFwdAlgoDirect,<unused>;miopenConvolutionFwdAlgoGEMM:gemm,0.04656,0,rocBlas,<unused>;miopenConvolutionFwdAlgoWinograd:ConvBinWinogradRxSf2x3,0.32432,0,miopenConvolutionFwdAlgoWinograd,1536x8x8x1x1x384x8x8x1xNCHWxFP32x0x0x1x1x1x1x1x1
384-8-8-1x3-256-8-8-1-0x1-1x1-1x1-0-NCHW-FP32-F=miopenConvolutionFwdAlgoImplicitGEMM:ConvHipImplicitGemmV4R4Fwd,0.15936,0,miopenConvolutionFwdAlgoImplicitGEMM,384x8x8x1x3x256x8x8x1xNCHWxFP32x0x1x1x1x1x1x1x1;miopenConvolutionFwdAlgoGEMM:gemm,0.04304,294912,rocBlas,<unused>;miopenConvolutionFwdAlgoWinograd:ConvBinWinogradRxS,0.09888,0,miopenConvolutionFwdAlgoWinograd,384x8x8x1x3x256x8x8x1xNCHWxFP32x0x1x1x1x1x1x1x1
384-8-8-3x1-256-8-8-1-1x0-1x1-1x1-0-NCHW-FP32-F=miopenConvolutionFwdAlgoImplicitGEMM:ConvHipImplicitGemmV4R4Fwd,0.15504,0,miopenConvolutionFwdAlgoImplicitGEMM,384x8x8x3x1x256x8x8x1xNCHWxFP32x1x0x1x1x1x1x1x1;miopenConvolutionFwdAlgoGEMM:gemm,0.04512,294912,rocBlas,<unused>;miopenConvolutionFwdAlgoWinograd:ConvBinWinogradRxSf2x3,0.09968,0,miopenConvolutionFwdAlgoWinograd,384x8x8x3x1x256x8x8x1xNCHWxFP32x1x0x1x1x1x1x1x1
384-8-8-3x1-448-8-8-1-1x0-1x1-1x1-0-NCHW-FP32-F=miopenConvolutionFwdAlgoImplicitGEMM:ConvHipImplicitGemmV4R4Fwd,0.15232,0,miopenConvolutionFwdAlgoImplicitGEMM,384x8x8x3x1x448x8x8x1xNCHWxFP32x1x0x1x1x1x1x1x1;miopenConvolutionFwdAlgoGEMM:gemm,0.04512,294912,rocBlas,<unused>;miopenConvolutionFwdAlgoWinograd:ConvBinWinogradRxSf2x3,0.1,0,miopenConvolutionFwdAlgoWinograd,384x8x8x3x1x448x8x8x1xNCHWxFP32x1x0x1x1x1x1x1x1
448-8-8-1x3-512-8-8-1-0x1-1x1-1x1-0-NCHW-FP32-F=miopenConvolutionFwdAlgoImplicitGEMM:ConvHipImplicitGemmV4R4Fwd,0.17952,0,miopenConvolutionFwdAlgoImplicitGEMM,448x8x8x1x3x512x8x8x1xNCHWxFP32x0x1x1x1x1x1x1x1;miopenConvolutionFwdAlgoGEMM:gemm,0.05488,344064,rocBlas,<unused>;miopenConvolutionFwdAlgoWinograd:ConvBinWinogradRxS,0.11136,0,miopenConvolutionFwdAlgoWinograd,448x8x8x1x3x512x8x8x1xNCHWxFP32x0x1x1x1x1x1x1x1
512-8-8-1x3-256-8-8-1-0x1-1x1-1x1-0-NCHW-FP32-F=miopenConvolutionFwdAlgoImplicitGEMM:ConvHipImplicitGemmV4R4Fwd,0.20384,0,miopenConvolutionFwdAlgoImplicitGEMM,512x8x8x1x3x256x8x8x1xNCHWxFP32x0x1x1x1x1x1x1x1;miopenConvolutionFwdAlgoGEMM:gemm,0.0656,393216,rocBlas,<unused>;miopenConvolutionFwdAlgoWinograd:ConvBinWinogradRxS,0.12432,0,miopenConvolutionFwdAlgoWinograd,512x8x8x1x3x256x8x8x1xNCHWxFP32x0x1x1x1x1x1x1x1
512-8-8-3x1-256-8-8-1-1x0-1x1-1x1-0-NCHW-FP32-F=miopenConvolutionFwdAlgoImplicitGEMM:ConvHipImplicitGemmV4R4Fwd,0.19872,0,miopenConvolutionFwdAlgoImplicitGEMM,512x8x8x3x1x256x8x8x1xNCHWxFP32x1x0x1x1x1x1x1x1;miopenConvolutionFwdAlgoGEMM:gemm,0.05152,393216,rocBlas,<unused>;miopenConvolutionFwdAlgoWinograd:ConvBinWinogradRxSf2x3,0.12576,0,miopenConvolutionFwdAlgoWinograd,512x8x8x3x1x256x8x8x1xNCHWxFP32x1x0x1x1x1x1x1x1
3-224-224-7x7-64-112-112-64-3x3-2x2-1x1-0-NCHW-FP32-F=miopenConvolutionFwdAlgoDirect:ConvAsm7x7c3h224w224k64u2v2p3q3f1,1.8336,0,miopenConvolutionFwdAlgoDirect,<unused>;miopenConvolutionFwdAlgoGEMM:gemm,6.93248,7375872,rocBlas,<unused>;miopenConvolutionFwdAlgoWinograd:ConvBinWinogradRxS,2.46832,0,miopenConvolutionFwdAlgoWinograd,3x224x224x7x7x64x112x112x64xNCHWxFP32x3x3x2x2x1x1x1x1
64-56-56-1x1-64-56-56-64-0x0-1x1-1x1-0-NCHW-FP32-F=miopenConvolutionFwdAlgoImplicitGEMM:ConvHipImplicitGemmV4_1x1,0.28512,0,miopenConvolutionFwdAlgoImplicitGEMM,64x56x56x1x1x64x56x56x64xNCHWxFP32x0x0x1x1x1x1x1x1;miopenConvolutionFwdAlgoDirect:ConvOclDirectFwd1x1,0.2008,0,miopenConvolutionFwdAlgoDirect,<unused>;miopenConvolutionFwdAlgoGEMM:gemm,0.19904,0,rocBlas,<unused>;miopenConvolutionFwdAlgoWinograd:ConvBinWinogradRxSf3x2,0.46416,0,miopenConvolutionFwdAlgoWinograd,64x56x56x1x1x64x56x56x64xNCHWxFP32x0x0x1x1x1x1x1x1
64-56-56-3x3-64-56-56-64-1x1-1x1-1x1-0-NCHW-FP32-F=miopenConvolutionFwdAlgoWinograd:ConvBinWinogradRxSf2x3,0.80176,0,miopenConvolutionFwdAlgoWinograd,64x56x56x3x3x64x56x56x64xNCHWxFP32x1x1x1x1x1x1x1x1
128-56-56-1x1-256-56-56-64-0x0-1x1-1x1-0-NCHW-FP32-F=miopenConvolutionFwdAlgoImplicitGEMM:ConvHipImplicitGemmV4_1x1,1.63056,0,miopenConvolutionFwdAlgoImplicitGEMM,128x56x56x1x1x256x56x56x64xNCHWxFP32x0x0x1x1x1x1x1x1;miopenConvolutionFwdAlgoDirect:ConvAsm1x1U,1.48832,0,miopenConvolutionFwdAlgoDirect,<unused>;miopenConvolutionFwdAlgoGEMM:gemm,1.27376,0,rocBlas,<unused>;miopenConvolutionFwdAlgoWinograd:ConvBinWinogradRxSf3x2,2.9544,0,miopenConvolutionFwdAlgoWinograd,128x56x56x1x1x256x56x56x64xNCHWxFP32x0x0x1x1x1x1x1x1
256-56-56-1x1-64-56-56-64-0x0-1x1-1x1-0-NCHW-FP32-F=miopenConvolutionFwdAlgoImplicitGEMM:ConvHipImplicitGemmV4_1x1,0.807679,0,miopenConvolutionFwdAlgoImplicitGEMM,256x56x56x1x1x64x56x56x64xNCHWxFP32x0x0x1x1x1x1x1x1;miopenConvolutionFwdAlgoDirect:ConvOclDirectFwd1x1,0.71168,0,miopenConvolutionFwdAlgoDirect,<unused>;miopenConvolutionFwdAlgoGEMM:gemm,0.6688,0,rocBlas,<unused>;miopenConvolutionFwdAlgoWinograd:ConvBinWinogradRxSf3x2,1.46352,0,miopenConvolutionFwdAlgoWinograd,256x56x56x1x1x64x56x56x64xNCHWxFP32x0x0x1x1x1x1x1x1
64-56-56-1x1-256-56-56-64-0x0-1x1-1x1-0-NCHW-FP32-F=miopenConvolutionFwdAlgoImplicitGEMM:ConvHipImplicitGemmV4_1x1,1.1128,0,miopenConvolutionFwdAlgoImplicitGEMM,64x56x56x1x1x256x56x56x64xNCHWxFP32x0x0x1x1x1x1x1x1;miopenConvolutionFwdAlgoDirect:ConvOclDirectFwd1x1,0.73488,0,miopenConvolutionFwdAlgoDirect,<unused>;miopenConvolutionFwdAlgoGEMM:gemm,0.6808,0,rocBlas,<unused>;miopenConvolutionFwdAlgoWinograd:ConvBinWinogradRxSf3x2,1.67984,0,miopenConvolutionFwdAlgoWinograd,64x56x56x1x1x256x56x56x64xNCHWxFP32x0x0x1x1x1x1x1x1
256-56-56-1x1-128-56-56-64-0x0-1x1-1x1-0-NCHW-FP32-F=miopenConvolutionFwdAlgoImplicitGEMM:ConvHipImplicitGemmV4_1x1,1.63568,0,miopenConvolutionFwdAlgoImplicitGEMM,256x56x56x1x1x128x56x56x64xNCHWxFP32x0x0x1x1x1x1x1x1;miopenConvolutionFwdAlgoDirect:ConvOclDirectFwd1x1,1.56512,0,miopenConvolutionFwdAlgoDirect,<unused>;miopenConvolutionFwdAlgoGEMM:gemm,1.29664,0,rocBlas,<unused>;miopenConvolutionFwdAlgoWinograd:ConvBinWinogradRxSf3x2,2.81408,0,miopenConvolutionFwdAlgoWinograd,256x56x56x1x1x128x56x56x64xNCHWxFP32x0x0x1x1x1x1x1x1
128-56-56-3x3-128-28-28-64-1x1-2x2-1x1-0-NCHW-FP32-F=miopenConvolutionFwdAlgoImplicitGEMM:ConvHipImplicitGemmV4R1Fwd,1.62048,0,miopenConvolutionFwdAlgoImplicitGEMM,128x56x56x3x3x128x28x28x64xNCHWxFP32x1x1x2x2x1x1x1x1;miopenConvolutionFwdAlgoDirect:ConvOclDirectFwd,9.09503,0,miopenConvolutionFwdAlgoDirect,<unused>;miopenConvolutionFwdAlgoGEMM:gemm,6.10304,3612672,rocBlas,<unused>;miopenConvolutionFwdAlgoWinograd:ConvBinWinogradRxSf2x3,2.9328,0,miopenConvolutionFwdAlgoWinograd,128x56x56x3x3x128x28x28x64xNCHWxFP32x1x1x2x2x1x1x1x1
384-28-28-1x1-512-28-28-64-0x0-1x1-1x1-0-NCHW-FP32-F=miopenConvolutionFwdAlgoImplicitGEMM:ConvHipImplicitGemmV4_1x1,2.14112,0,miopenConvolutionFwdAlgoImplicitGEMM,384x28x28x1x1x512x28x28x64xNCHWxFP32x0x0x1x1x1x1x1x1;miopenConvolutionFwdAlgoDirect:ConvOclDirectFwd1x1,2.55808,0,miopenConvolutionFwdAlgoDirect,<unused>;miopenConvolutionFwdAlgoGEMM:gemm,2.44672,0,rocBlas,<unused>;miopenConvolutionFwdAlgoWinograd:ConvBinWinogradRxSf3x2,4.38128,0,miopenConvolutionFwdAlgoWinograd,384x28x28x1x1x512x28x28x64xNCHWxFP32x0x0x1x1x1x1x1x1
512-28-28-1x1-128-28-28-64-0x0-1x1-1x1-0-NCHW-FP32-F=miopenConvolutionFwdAlgoImplicitGEMM:ConvHipImplicitGemmV4_1x1,0.79072,0,miopenConvolutionFwdAlgoImplicitGEMM,512x28x28x1x1x128x28x28x64xNCHWxFP32x0x0x1x1x1x1x1x1;miopenConvolutionFwdAlgoDirect:ConvOclDirectFwd1x1,0.84016,0,miopenConvolutionFwdAlgoDirect,<unused>;miopenConvolutionFwdAlgoGEMM:gemm,0.77792,0,rocBlas,<unused>;miopenConvolutionFwdAlgoWinograd:ConvBinWinogradRxSf3x2,1.56608,0,miopenConvolutionFwdAlgoWinograd,512x28x28x1x1x128x28x28x64xNCHWxFP32x0x0x1x1x1x1x1x1
128-28-28-3x3-128-28-28-64-1x1-1x1-1x1-0-NCHW-FP32-F=miopenConvolutionFwdAlgoWinograd:ConvBinWinogradRxSf2x3,0.7544,0,miopenConvolutionFwdAlgoWinograd,128x28x28x3x3x128x28x28x64xNCHWxFP32x1x1x1x1x1x1x1x1
128-28-28-1x1-512-28-28-64-0x0-1x1-1x1-0-NCHW-FP32-F=miopenConvolutionFwdAlgoImplicitGEMM:ConvHipImplicitGemmV4_1x1,0.996639,0,miopenConvolutionFwdAlgoImplicitGEMM,128x28x28x1x1x512x28x28x64xNCHWxFP32x0x0x1x1x1x1x1x1;miopenConvolutionFwdAlgoDirect:ConvOclDirectFwd1x1,0.881599,0,miopenConvolutionFwdAlgoDirect,<unused>;miopenConvolutionFwdAlgoGEMM:gemm,0.72896,0,rocBlas,<unused>;miopenConvolutionFwdAlgoWinograd:ConvBinWinogradRxSf3x2,1.70976,0,miopenConvolutionFwdAlgoWinograd,128x28x28x1x1x512x28x28x64xNCHWxFP32x0x0x1x1x1x1x1x1
512-28-28-1x1-256-28-28-64-0x0-1x1-1x1-0-NCHW-FP32-F=miopenConvolutionFwdAlgoImplicitGEMM:ConvHipImplicitGemmV4_1x1,1.5096,0,miopenConvolutionFwdAlgoImplicitGEMM,512x28x28x1x1x256x28x28x64xNCHWxFP32x0x0x1x1x1x1x1x1;miopenConvolutionFwdAlgoDirect:ConvOclDirectFwd1x1,1.65072,0,miopenConvolutionFwdAlgoDirect,<unused>;miopenConvolutionFwdAlgoGEMM:gemm,1.40368,0,rocBlas,<unused>;miopenConvolutionFwdAlgoWinograd:ConvBinWinogradRxSf3x2,3.0048,0,miopenConvolutionFwdAlgoWinograd,512x28x28x1x1x256x28x28x64xNCHWxFP32x0x0x1x1x1x1x1x1
256-28-28-3x3-256-14-14-64-1x1-2x2-1x1-0-NCHW-FP32-F=miopenConvolutionFwdAlgoImplicitGEMM:ConvHipImplicitGemmV4R1Fwd,1.82752,0,miopenConvolutionFwdAlgoImplicitGEMM,256x28x28x3x3x256x14x14x64xNCHWxFP32x1x1x2x2x1x1x1x1;miopenConvolutionFwdAlgoDirect:ConvOclDirectFwd,7.71935,0,miopenConvolutionFwdAlgoDirect,<unused>;miopenConvolutionFwdAlgoGEMM:gemm,6.76864,1806336,rocBlas,<unused>;miopenConvolutionFwdAlgoWinograd:ConvBinWinogradRxSf2x3,3.03071,0,miopenConvolutionFwdAlgoWinograd,256x28x28x3x3x256x14x14x64xNCHWxFP32x1x1x2x2x1x1x1x1
768-14-14-1x1-1024-14-14-64-0x0-1x1-1x1-0-NCHW-FP32-F=miopenConvolutionFwdAlgoImplicitGEMM:ConvHipImplicitGemmV4_1x1,2.63888,0,miopenConvolutionFwdAlgoImplicitGEMM,768x14x14x1x1x1024x14x14x64xNCHWxFP32x0x0x1x1x1x1x1x1;miopenConvolutionFwdAlgoDirect:ConvAsm1x1U,2.93504,0,miopenConvolutionFwdAlgoDirect,<unused>;miopenConvolutionFwdAlgoGEMM:gemm,2.92416,0,rocBlas,<unused>;miopenConvolutionFwdAlgoWinograd:ConvBinWinogradRxSf3x2,4.11983,0,miopenConvolutionFwdAlgoWinograd,768x14x14x1x1x1024x14x14x64xNCHWxFP32x0x0x1x1x1x1x1x1
1024-14-14-1x1-256-14-14-64-0x0-1x1-1x1-0-NCHW-FP32-F=miopenConvolutionFwdAlgoImplicitGEMM:ConvHipImplicitGemmV4_1x1,0.930559,0,miopenConvolutionFwdAlgoImplicitGEMM,1024x14x14x1x1x256x14x14x64xNCHWxFP32x0x0x1x1x1x1x1x1;miopenConvolutionFwdAlgoDirect:ConvOclDirectFwd1x1,0.914079,0,miopenConvolutionFwdAlgoDirect,<unused>;miopenConvolutionFwdAlgoGEMM:gemm,0.912639,0,rocBlas,<unused>;miopenConvolutionFwdAlgoWinograd:ConvBinWinogradRxSf3x2,1.54368,0,miopenConvolutionFwdAlgoWinograd,1024x14x14x1x1x256x14x14x64xNCHWxFP32x0x0x1x1x1x1x1x1
256-14-14-3x3-256-14-14-64-1x1-1x1-1x1-0-NCHW-FP32-F=miopenConvolutionFwdAlgoWinograd:ConvBinWinogradRxSf2x3,0.748,0,miopenConvolutionFwdAlgoWinograd,256x14x14x3x3x256x14x14x64xNCHWxFP32x1x1x1x1x1x1x1x1
256-14-14-1x1-1024-14-14-64-0x0-1x1-1x1-0-NCHW-FP32-F=miopenConvolutionFwdAlgoImplicitGEMM:ConvHipImplicitGemmV4_1x1,0.883519,0,miopenConvolutionFwdAlgoImplicitGEMM,256x14x14x1x1x1024x14x14x64xNCHWxFP32x0x0x1x1x1x1x1x1;miopenConvolutionFwdAlgoDirect:ConvOclDirectFwd1x1,0.964159,0,miopenConvolutionFwdAlgoDirect,<unused>;miopenConvolutionFwdAlgoGEMM:gemm,0.895999,0,rocBlas,<unused>;miopenConvolutionFwdAlgoWinograd:ConvBinWinogradRxSf3x2,1.5816,0,miopenConvolutionFwdAlgoWinograd,256x14x14x1x1x1024x14x14x64xNCHWxFP32x0x0x1x1x1x1x1x1
1024-14-14-1x1-512-14-14-64-0x0-1x1-1x1-0-NCHW-FP32-F=miopenConvolutionFwdAlgoImplicitGEMM:ConvHipImplicitGemmV4_1x1,1.7656,0,miopenConvolutionFwdAlgoImplicitGEMM,1024x14x14x1x1x512x14x14x64xNCHWxFP32x0x0x1x1x1x1x1x1;miopenConvolutionFwdAlgoDirect:ConvOclDirectFwd1x1,2.13456,0,miopenConvolutionFwdAlgoDirect,<unused>;miopenConvolutionFwdAlgoGEMM:gemm,2.51856,0,rocBlas,<unused>;miopenConvolutionFwdAlgoWinograd:ConvBinWinogradRxSf3x2,3.03455,0,miopenConvolutionFwdAlgoWinograd,1024x14x14x1x1x512x14x14x64xNCHWxFP32x0x0x1x1x1x1x1x1
512-14-14-3x3-512-7-7-64-1x1-2x2-1x1-0-NCHW-FP32-F=miopenConvolutionFwdAlgoImplicitGEMM:ConvHipImplicitGemmV4R1Fwd,1.90752,0,miopenConvolutionFwdAlgoImplicitGEMM,512x14x14x3x3x512x7x7x64xNCHWxFP32x1x1x2x2x1x1x1x1;miopenConvolutionFwdAlgoDirect:ConvOclDirectFwd,9.60958,0,miopenConvolutionFwdAlgoDirect,<unused>;miopenConvolutionFwdAlgoGEMM:gemm,23.0195,903168,rocBlas,<unused>;miopenConvolutionFwdAlgoWinograd:ConvBinWinogradRxSf2x3,3.84127,0,miopenConvolutionFwdAlgoWinograd,512x14x14x3x3x512x7x7x64xNCHWxFP32x1x1x2x2x1x1x1x1
1536-7-7-1x1-2048-7-7-64-0x0-1x1-1x1-0-NCHW-FP32-F=miopenConvolutionFwdAlgoImplicitGEMM:ConvHipImplicitGemmV4_1x1,2.40928,0,miopenConvolutionFwdAlgoImplicitGEMM,1536x7x7x1x1x2048x7x7x64xNCHWxFP32x0x0x1x1x1x1x1x1;miopenConvolutionFwdAlgoDirect:ConvAsm1x1U,3.4968,0,miopenConvolutionFwdAlgoDirect,<unused>;miopenConvolutionFwdAlgoGEMM:gemm,4.11279,0,rocBlas,<unused>;miopenConvolutionFwdAlgoWinograd:ConvBinWinogradRxSf3x2,5.55871,0,miopenConvolutionFwdAlgoWinograd,1536x7x7x1x1x2048x7x7x64xNCHWxFP32x0x0x1x1x1x1x1x1
2048-7-7-1x1-512-7-7-64-0x0-1x1-1x1-0-NCHW-FP32-F=miopenConvolutionFwdAlgoImplicitGEMM:ConvHipImplicitGemmV4_1x1,1.56544,0,miopenConvolutionFwdAlgoImplicitGEMM,2048x7x7x1x1x512x7x7x64xNCHWxFP32x0x0x1x1x1x1x1x1;miopenConvolutionFwdAlgoDirect:ConvOclDirectFwd1x1,1.37696,0,miopenConvolutionFwdAlgoDirect,<unused>;miopenConvolutionFwdAlgoGEMM:gemm,2.26224,0,rocBlas,<unused>;miopenConvolutionFwdAlgoWinograd:ConvBinWinogradRxSf3x2,2.15792,0,miopenConvolutionFwdAlgoWinograd,2048x7x7x1x1x512x7x7x64xNCHWxFP32x0x0x1x1x1x1x1x1
512-7-7-3x3-512-7-7-64-1x1-1x1-1x1-0-NCHW-FP32-F=miopenConvolutionFwdAlgoWinograd:ConvBinWinogradRxSf2x3,0.945279,0,miopenConvolutionFwdAlgoWinograd,512x7x7x3x3x512x7x7x64xNCHWxFP32x1x1x1x1x1x1x1x1
512-7-7-1x1-2048-7-7-64-0x0-1x1-1x1-0-NCHW-FP32-F=miopenConvolutionFwdAlgoImplicitGEMM:ConvHipImplicitGemmV4_1x1,1.1856,0,miopenConvolutionFwdAlgoImplicitGEMM,512x7x7x1x1x2048x7x7x64xNCHWxFP32x0x0x1x1x1x1x1x1;miopenConvolutionFwdAlgoDirect:ConvAsm1x1U,1.1752,0,miopenConvolutionFwdAlgoDirect,<unused>;miopenConvolutionFwdAlgoGEMM:gemm,1.34672,0,rocBlas,<unused>;miopenConvolutionFwdAlgoWinograd:ConvBinWinogradRxSf3x2,2.21904,0,miopenConvolutionFwdAlgoWinograd,512x7x7x1x1x2048x7x7x64xNCHWxFP32x0x0x1x1x1x1x1x1
3-224-224-7x7-64-112-112-64-3x3-2x2-1x1-0-NCHW-FP16-F=miopenConvolutionFwdAlgoDirect:ConvOclDirectFwdGen,3.11391,0,miopenConvolutionFwdAlgoDirect,<unused>;miopenConvolutionFwdAlgoGEMM:gemm,6.78912,3687936,rocBlas,<unused>
64-56-56-1x1-64-56-56-64-0x0-1x1-1x1-0-NCHW-FP16-F=miopenConvolutionFwdAlgoImplicitGEMM:ConvHipImplicitGemmV4Fwd,0.26304,0,miopenConvolutionFwdAlgoImplicitGEMM,64x56x56x1x1x64x56x56x64xNCHWxFP16x0x0x1x1x1x1x1x1;miopenConvolutionFwdAlgoDirect:ConvAsm1x1U,0.21792,0,miopenConvolutionFwdAlgoDirect,<unused>;miopenConvolutionFwdAlgoGEMM:gemm,0.1232,0,rocBlas,<unused>;miopenConvolutionFwdAlgoWinograd:ConvBinWinogradRxS,0.603519,0,miopenConvolutionFwdAlgoWinograd,64x56x56x1x1x64x56x56x64xNCHWxFP16x0x0x1x1x1x1x1x1
64-56-56-3x3-64-56-56-64-1x1-1x1-1x1-0-NCHW-FP16-F=miopenConvolutionFwdAlgoImplicitGEMM:ConvHipImplicitGemmV4R1Fwd,1.14032,0,miopenConvolutionFwdAlgoImplicitGEMM,64x56x56x3x3x64x56x56x64xNCHWxFP16x1x1x1x1x1x1x1x1;miopenConvolutionFwdAlgoDirect:ConvOclDirectFwd,2.9544,0,miopenConvolutionFwdAlgoDirect,<unused>;miopenConvolutionFwdAlgoGEMM:gemm,7.03488,3612672,rocBlas,<unused>;miopenConvolutionFwdAlgoWinograd:ConvBinWinogradRxS,0.5408,0,miopenConvolutionFwdAlgoWinograd,64x56x56x3x3x64x56x56x64xNCHWxFP16x1x1x1x1x1x1x1x1
128-56-56-1x1-256-56-56-64-0x0-1x1-1x1-0-NCHW-FP16-F=miopenConvolutionFwdAlgoImplicitGEMM:ConvHipImplicitGemmV4Fwd,1.24224,0,miopenConvolutionFwdAlgoImplicitGEMM,128x56x56x1x1x256x56x56x64xNCHWxFP16x0x0x1x1x1x1x1x1;miopenConvolutionFwdAlgoDirect:ConvAsm1x1U,1.05472,0,miopenConvolutionFwdAlgoDirect,<unused>;miopenConvolutionFwdAlgoGEMM:gemm,0.759519,0,rocBlas,<unused>;miopenConvolutionFwdAlgoWinograd:ConvBinWinogradRxS,3.55279,0,miopenConvolutionFwdAlgoWinograd,128x56x56x1x1x256x56x56x64xNCHWxFP16x0x0x1x1x1x1x1x1
256-56-56-1x1-64-56-56-64-0x0-1x1-1x1-0-NCHW-FP16-F=miopenConvolutionFwdAlgoImplicitGEMM:ConvHipImplicitGemmV4Fwd,0.57936,0,miopenConvolutionFwdAlgoImplicitGEMM,256x56x56x1x1x64x56x56x64xNCHWxFP16x0x0x1x1x1x1x1x1;miopenConvolutionFwdAlgoDirect:ConvAsm1x1U,0.60944,0,miopenConvolutionFwdAlgoDirect,<unused>;miopenConvolutionFwdAlgoGEMM:gemm,0.53568,0,rocBlas,<unused>;miopenConvolutionFwdAlgoWinograd:ConvBinWinogradRxS,1.744,0,miopenConvolutionFwdAlgoWinograd,256x56x56x1x1x64x56x56x64xNCHWxFP16x0x0x1x1x1x1x1x1
64-56-56-1x1-256-56-56-64-0x0-1x1-1x1-0-NCHW-FP16-F=miopenConvolutionFwdAlgoImplicitGEMM:ConvHipImplicitGemmV4Fwd,0.628639,0,miopenConvolutionFwdAlgoImplicitGEMM,64x56x56x1x1x256x56x56x64xNCHWxFP16x0x0x1x1x1x1x1x1;miopenConvolutionFwdAlgoDirect:ConvAsm1x1U,0.705599,0,miopenConvolutionFwdAlgoDirect,<unused>;miopenConvolutionFwdAlgoGEMM:gemm,0.42096,0,rocBlas,<unused>;miopenConvolutionFwdAlgoWinograd:ConvBinWinogradRxS,1.94368,0,miopenConvolutionFwdAlgoWinograd,64x56x56x1x1x256x56x56x64xNCHWxFP16x0x0x1x1x1x1x1x1
256-56-56-1x1-128-56-56-64-0x0-1x1-1x1-0-NCHW-FP16-F=miopenConvolutionFwdAlgoImplicitGEMM:ConvHipImplicitGemmV4Fwd,1.67904,0,miopenConvolutionFwdAlgoImplicitGEMM,256x56x56x1x1x128x56x56x64xNCHWxFP16x0x0x1x1x1x1x1x1;miopenConvolutionFwdAlgoDirect:ConvAsm1x1U,1.11744,0,miopenConvolutionFwdAlgoDirect,<unused>;miopenConvolutionFwdAlgoGEMM:gemm,0.709439,0,rocBlas,<unused>;miopenConvolutionFwdAlgoWinograd:ConvBinWinogradRxS,3.42063,0,miopenConvolutionFwdAlgoWinograd,256x56x56x1x1x128x56x56x64xNCHWxFP16x0x0x1x1x1x1x1x1
128-56-56-3x3-128-28-28-64-1x1-2x2-1x1-0-NCHW-FP16-F=miopenConvolutionFwdAlgoImplicitGEMM:ConvHipImplicitGemmV4R1Fwd,1.09568,0,miopenConvolutionFwdAlgoImplicitGEMM,128x56x56x3x3x128x28x28x64xNCHWxFP16x1x1x2x2x1x1x1x1;miopenConvolutionFwdAlgoDirect:ConvOclDirectFwdGen,5.58799,0,miopenConvolutionFwdAlgoDirect,<unused>;miopenConvolutionFwdAlgoGEMM:gemm,5.6832,1806336,rocBlas,<unused>;miopenConvolutionFwdAlgoWinograd:ConvBinWinogradRxS,2.30704,0,miopenConvolutionFwdAlgoWinograd,128x56x56x3x3x128x28x28x64xNCHWxFP16x1x1x2x2x1x1x1x1
384-28-28-1x1-512-28-28-64-0x0-1x1-1x1-0-NCHW-FP16-F=miopenConvolutionFwdAlgoImplicitGEMM:ConvHipImplicitGemmV4Fwd,1.3296,0,miopenConvolutionFwdAlgoImplicitGEMM,384x28x28x1x1x512x28x28x64xNCHWxFP16x0x0x1x1x1x1x1x1;miopenConvolutionFwdAlgoDirect:ConvAsm1x1U,1.65008,0,miopenConvolutionFwdAlgoDirect,<unused>;miopenConvolutionFwdAlgoGEMM:gemm,1.8832,0,rocBlas,<unused>;miopenConvolutionFwdAlgoWinograd:ConvBinWinogradRxS,5.26863,0,miopenConvolutionFwdAlgoWinograd,384x28x28x1x1x512x28x28x64xNCHWxFP16x0x0x1x1x1x1x1x1
512-28-28-1x1-128-28-28-64-0x0-1x1-1x1-0-NCHW-FP16-F=miopenConvolutionFwdAlgoImplicitGEMM:ConvHipImplicitGemmV4Fwd,0.794559,0,miopenConvolutionFwdAlgoImplicitGEMM,512x28x28x1x1x128x28x28x64xNCHWxFP16x0x0x1x1x1x1x1x1;miopenConvolutionFwdAlgoDirect:ConvAsm1x1U,0.5664,0,miopenConvolutionFwdAlgoDirect,<unused>;miopenConvolutionFwdAlgoGEMM:gemm,0.448,0,rocBlas,<unused>;miopenConvolutionFwdAlgoWinograd:ConvBinWinogradRxS,1.85488,0,miopenConvolutionFwdAlgoWinograd,512x28x28x1x1x128x28x28x64xNCHWxFP16x0x0x1x1x1x1x1x1
128-28-28-3x3-128-28-28-64-1x1-1x1-1x1-0-NCHW-FP16-F=miopenConvolutionFwdAlgoImplicitGEMM:ConvHipImplicitGemmV4R1Fwd,1.05504,0,miopenConvolutionFwdAlgoImplicitGEMM,128x28x28x3x3x128x28x28x64xNCHWxFP16x1x1x1x1x1x1x1x1;miopenConvolutionFwdAlgoDirect:ConvOclDirectFwd,2.61472,0,miopenConvolutionFwdAlgoDirect,<unused>;miopenConvolutionFwdAlgoGEMM:gemm,5.36576,1806336,rocBlas,<unused>;miopenConvolutionFwdAlgoWinograd:ConvBinWinogradRxS,0.51168,0,miopenConvolutionFwdAlgoWinograd,128x28x28x3x3x128x28x28x64xNCHWxFP16x1x1x1x1x1x1x1x1
128-28-28-1x1-512-28-28-64-0x0-1x1-1x1-0-NCHW-FP16-F=miopenConvolutionFwdAlgoImplicitGEMM:ConvHipImplicitGemmV4Fwd,0.891679,0,miopenConvolutionFwdAlgoImplicitGEMM,128x28x28x1x1x512x28x28x64xNCHWxFP16x0x0x1x1x1x1x1x1;miopenConvolutionFwdAlgoDirect:ConvAsm1x1U,0.544,0,miopenConvolutionFwdAlgoDirect,<unused>;miopenConvolutionFwdAlgoGEMM:gemm,0.40112,0,rocBlas,<unused>;miopenConvolutionFwdAlgoWinograd:ConvBinWinogradRxS,1.85456,0,miopenConvolutionFwdAlgoWinograd,128x28x28x1x1x512x28x28x64xNCHWxFP16x0x0x1x1x1x1x1x1
512-28-28-1x1-256-28-28-64-0x0-1x1-1x1-0-NCHW-FP16-F=miopenConvolutionFwdAlgoImplicitGEMM:ConvHipImplicitGemmV4Fwd,1.18944,0,miopenConvolutionFwdAlgoImplicitGEMM,512x28x28x1x1x256x28x28x64xNCHWxFP16x0x0x1x1x1x1x1x1;miopenConvolutionFwdAlgoDirect:ConvAsm1x1U,1.16144,0,miopenConvolutionFwdAlgoDirect,<unused>;miopenConvolutionFwdAlgoGEMM:gemm,0.833439,0,rocBlas,<unused>;miopenConvolutionFwdAlgoWinograd:ConvBinWinogradRxS,3.5952,0,miopenConvolutionFwdAlgoWinograd,512x28x28x1x1x256x28x28x64xNCHWxFP16x0x0x1x1x1x1x1x1
256-28-28-3x3-256-14-14-64-1x1-2x2-1x1-0-NCHW-FP16-F=miopenConvolutionFwdAlgoImplicitGEMM:ConvHipImplicitGemmV4R1Fwd,1.2528,0,miopenConvolutionFwdAlgoImplicitGEMM,256x28x28x3x3x256x14x14x64xNCHWxFP16x1x1x2x2x1x1x1x1;miopenConvolutionFwdAlgoDirect:ConvOclDirectFwdGen,7.20175,0,miopenConvolutionFwdAlgoDirect,<unused>;miopenConvolutionFwdAlgoGEMM:gemm,10.455,903168,rocBlas,<unused>;miopenConvolutionFwdAlgoWinograd:ConvBinWinogradRxS,2.42912,0,miopenConvolutionFwdAlgoWinograd,256x28x28x3x3x256x14x14x64xNCHWxFP16x1x1x2x2x1x1x1x1
768-14-14-1x1-1024-14-14-64-0x0-1x1-1x1-0-NCHW-FP16-F=miopenConvolutionFwdAlgoImplicitGEMM:ConvHipImplicitGemmV4Fwd,1.3392,0,miopenConvolutionFwdAlgoImplicitGEMM,768x14x14x1x1x1024x14x14x64xNCHWxFP16x0x0x1x1x1x1x1x1;miopenConvolutionFwdAlgoDirect:ConvAsm1x1U,1.8768,0,miopenConvolutionFwdAlgoDirect,<unused>;miopenConvolutionFwdAlgoGEMM:gemm,1.29312,0,rocBlas,<unused>;miopenConvolutionFwdAlgoWinograd:ConvBinWinogradRxS,6.04543,0,miopenConvolutionFwdAlgoWinograd,768x14x14x1x1x1024x14x14x64xNCHWxFP16x0x0x1x1x1x1x1x1
1024-14-14-1x1-256-14-14-64-0x0-1x1-1x1-0-NCHW-FP16-F=miopenConvolutionFwdAlgoImplicitGEMM:ConvHipImplicitGemmV4Fwd,0.74896,0,miopenConvolutionFwdAlgoImplicitGEMM,1024x14x14x1x1x256x14x14x64xNCHWxFP16x0x0x1x1x1x1x1x1;miopenConvolutionFwdAlgoDirect:ConvAsm1x1U,0.775199,0,miopenConvolutionFwdAlgoDirect,<unused>;miopenConvolutionFwdAlgoGEMM:gemm,0.58704,0,rocBlas,<unused>;miopenConvolutionFwdAlgoWinograd:ConvBinWinogradRxS,2.16384,0,miopenConvolutionFwdAlgoWinograd,1024x14x14x1x1x256x14x14x64xNCHWxFP16x0x0x1x1x1x1x1x1
256-14-14-3x3-256-14-14-64-1x1-1x1-1x1-0-NCHW-FP16-F=miopenConvolutionFwdAlgoImplicitGEMM:ConvHipImplicitGemmV4R1Fwd,1.20528,0,miopenConvolutionFwdAlgoImplicitGEMM,256x14x14x3x3x256x14x14x64xNCHWxFP16x1x1x1x1x1x1x1x1;miopenConvolutionFwdAlgoDirect:ConvOclDirectFwd,3.16016,0,miopenConvolutionFwdAlgoDirect,<unused>;miopenConvolutionFwdAlgoGEMM:gemm,10.1376,903168,rocBlas,<unused>;miopenConvolutionFwdAlgoWinograd:ConvBinWinogradRxS,0.50944,0,miopenConvolutionFwdAlgoWinograd,256x14x14x3x3x256x14x14x64xNCHWxFP16x1x1x1x1x1x1x1x1
256-14-14-1x1-1024-14-14-64-0x0-1x1-1x1-0-NCHW-FP16-F=miopenConvolutionFwdAlgoImplicitGEMM:ConvHipImplicitGemmV4Fwd,0.6072,0,miopenConvolutionFwdAlgoImplicitGEMM,256x14x14x1x1x1024x14x14x64xNCHWxFP16x0x0x1x1x1x1x1x1;miopenConvolutionFwdAlgoDirect:ConvAsm1x1U,0.65568,0,miopenConvolutionFwdAlgoDirect,<unused>;miopenConvolutionFwdAlgoGEMM:gemm,0.46544,0,rocBlas,<unused>;miopenConvolutionFwdAlgoWinograd:ConvBinWinogradRxS,2.0712,0,miopenConvolutionFwdAlgoWinograd,256x14x14x1x1x1024x14x14x64xNCHWxFP16x0x0x1x1x1x1x1x1
1024-14-14-1x1-512-14-14-64-0x0-1x1-1x1-0-NCHW-FP16-F=miopenConvolutionFwdAlgoImplicitGEMM:ConvHipImplicitGemmV4Fwd,2.17344,0,miopenConvolutionFwdAlgoImplicitGEMM,1024x14x14x1x1x512x14x14x64xNCHWxFP16x0x0x1x1x1x1x1x1;miopenConvolutionFwdAlgoDirect:ConvAsm1x1U,1.33856,0,miopenConvolutionFwdAlgoDirect,<unused>;miopenConvolutionFwdAlgoGEMM:gemm,1.09024,0,rocBlas,<unused>;miopenConvolutionFwdAlgoWinograd:ConvBinWinogradRxS,4.12672,0,miopenConvolutionFwdAlgoWinograd,1024x14x14x1x1x512x14x14x64xNCHWxFP16x0x0x1x1x1x1x1x1
512-14-14-3x3-512-7-7-64-1x1-2x2-1x1-0-NCHW-FP16-F=miopenConvolutionFwdAlgoImplicitGEMM:ConvHipImplicitGemmV4R1Fwd,1.35936,0,miopenConvolutionFwdAlgoImplicitGEMM,512x14x14x3x3x512x7x7x64xNCHWxFP16x1x1x2x2x1x1x1x1;miopenConvolutionFwdAlgoDirect:ConvOclDirectFwdGen,13.072,0,miopenConvolutionFwdAlgoDirect,<unused>;miopenConvolutionFwdAlgoGEMM:gemm,51.0874,451584,rocBlas,<unused>;miopenConvolutionFwdAlgoWinograd:ConvBinWinogradRxS,3.55152,0,miopenConvolutionFwdAlgoWinograd,512x14x14x3x3x512x7x7x64xNCHWxFP16x1x1x2x2x1x1x1x1
1536-7-7-1x1-2048-7-7-64-0x0-1x1-1x1-0-NCHW-FP16-F=miopenConvolutionFwdAlgoImplicitGEMM:ConvHipImplicitGemmV4Fwd,1.71024,0,miopenConvolutionFwdAlgoImplicitGEMM,1536x7x7x1x1x2048x7x7x64xNCHWxFP16x0x0x1x1x1x1x1x1;miopenConvolutionFwdAlgoDirect:ConvAsm1x1U,2.46448,0,miopenConvolutionFwdAlgoDirect,<unused>;miopenConvolutionFwdAlgoGEMM:gemm,5.43087,0,rocBlas,<unused>;miopenConvolutionFwdAlgoWinograd:ConvBinWinogradRxS,7.86335,0,miopenConvolutionFwdAlgoWinograd,1536x7x7x1x1x2048x7x7x64xNCHWxFP16x0x0x1x1x1x1x1x1
2048-7-7-1x1-512-7-7-64-0x0-1x1-1x1-0-NCHW-FP16-F=miopenConvolutionFwdAlgoImplicitGEMM:ConvHipImplicitGemmV4Fwd,0.946719,0,miopenConvolutionFwdAlgoImplicitGEMM,2048x7x7x1x1x512x7x7x64xNCHWxFP16x0x0x1x1x1x1x1x1;miopenConvolutionFwdAlgoDirect:ConvAsm1x1U,0.968479,0,miopenConvolutionFwdAlgoDirect,<unused>;miopenConvolutionFwdAlgoGEMM:gemm,2.11792,0,rocBlas,<unused>;miopenConvolutionFwdAlgoWinograd:ConvBinWinogradRxS,3.25296,0,miopenConvolutionFwdAlgoWinograd,2048x7x7x1x1x512x7x7x64xNCHWxFP16x0x0x1x1x1x1x1x1
512-7-7-3x3-512-7-7-64-1x1-1x1-1x1-0-NCHW-FP16-F=miopenConvolutionFwdAlgoImplicitGEMM:ConvHipImplicitGemmV4R1Fwd,1.29504,0,miopenConvolutionFwdAlgoImplicitGEMM,512x7x7x3x3x512x7x7x64xNCHWxFP16x1x1x1x1x1x1x1x1;miopenConvolutionFwdAlgoDirect:ConvOclDirectFwd,5.16255,0,miopenConvolutionFwdAlgoDirect,<unused>;miopenConvolutionFwdAlgoGEMM:gemm,50.5242,451584,rocBlas,<unused>;miopenConvolutionFwdAlgoWinograd:ConvBinWinogradRxS,0.6144,0,miopenConvolutionFwdAlgoWinograd,512x7x7x3x3x512x7x7x64xNCHWxFP16x1x1x1x1x1x1x1x1
512-7-7-1x1-2048-7-7-64-0x0-1x1-1x1-0-NCHW-FP16-F=miopenConvolutionFwdAlgoImplicitGEMM:ConvHipImplicitGemmV4Fwd,0.5576,0,miopenConvolutionFwdAlgoImplicitGEMM,512x7x7x1x1x2048x7x7x64xNCHWxFP16x0x0x1x1x1x1x1x1;miopenConvolutionFwdAlgoDirect:ConvAsm1x1U,0.859039,0,miopenConvolutionFwdAlgoDirect,<unused>;miopenConvolutionFwdAlgoGEMM:gemm,1.644,0,rocBlas,<unused>;miopenConvolutionFwdAlgoWinograd:ConvBinWinogradRxS,2.9264,0,miopenConvolutionFwdAlgoWinograd,512x7x7x1x1x2048x7x7x64xNCHWxFP16x0x0x1x1x1x1x1x1
3-224-224-11x11-64-55-55-64-2x2-4x4-1x1-0-NCHW-FP32-F=miopenConvolutionFwdAlgoDirect:ConvOclDirectFwd11x11,2.99984,0,miopenConvolutionFwdAlgoDirect,<unused>;miopenConvolutionFwdAlgoGEMM:gemm,4.97664,4392300,rocBlas,<unused>
64-27-27-5x5-192-27-27-64-2x2-1x1-1x1-0-NCHW-FP32-F=miopenConvolutionFwdAlgoFFT:fft,1.76256,143720448,miopenConvolutionFwdAlgoFFT,FFT_x_in_h_27_in_w_27_in_n_64_in_c_64_out_c_192_kernel_;miopenConvolutionFwdAlgoImplicitGEMM:ConvHipImplicitGemmV4R1Fwd,3.11856,0,miopenConvolutionFwdAlgoImplicitGEMM,64x27x27x5x5x192x27x27x64xNCHWxFP32x2x2x1x1x1x1x1x1;miopenConvolutionFwdAlgoDirect:ConvOclDirectFwd,5.65983,0,miopenConvolutionFwdAlgoDirect,<unused>;miopenConvolutionFwdAlgoGEMM:gemm,6.68672,4665600,rocBlas,<unused>;miopenConvolutionFwdAlgoWinograd:ConvBinWinogradRxSf2x3,2.12256,0,miopenConvolutionFwdAlgoWinograd,64x27x27x5x5x192x27x27x64xNCHWxFP32x2x2x1x1x1x1x1x1
192-13-13-3x3-384-13-13-64-1x1-1x1-1x1-0-NCHW-FP32-F=miopenConvolutionFwdAlgoWinograd:ConvBinWinogradRxSf2x3,0.81584,0,miopenConvolutionFwdAlgoWinograd,192x13x13x3x3x384x13x13x64xNCHWxFP32x1x1x1x1x1x1x1x1
384-13-13-3x3-256-13-13-64-1x1-1x1-1x1-0-NCHW-FP32-F=miopenConvolutionFwdAlgoWinograd:ConvBinWinogradRxSf2x3,1.1008,0,miopenConvolutionFwdAlgoWinograd,384x13x13x3x3x256x13x13x64xNCHWxFP32x1x1x1x1x1x1x1x1
256-13-13-3x3-256-13-13-64-1x1-1x1-1x1-0-NCHW-FP32-F=miopenConvolutionFwdAlgoWinograd:ConvBinWinogradRxSf2x3,0.75328,0,miopenConvolutionFwdAlgoWinograd,256x13x13x3x3x256x13x13x64xNCHWxFP32x1x1x1x1x1x1x1x1
3-224-224-11x11-64-55-55-64-2x2-4x4-1x1-0-NCHW-FP16-F=miopenConvolutionFwdAlgoDirect:ConvOclDirectFwd11x11,1.39056,0,miopenConvolutionFwdAlgoDirect,<unused>;miopenConvolutionFwdAlgoGEMM:gemm,8.84736,2196150,rocBlas,<unused>
64-27-27-5x5-192-27-27-64-2x2-1x1-1x1-0-NCHW-FP16-F=miopenConvolutionFwdAlgoImplicitGEMM:ConvHipImplicitGemmV4R1Fwd,2.15088,0,miopenConvolutionFwdAlgoImplicitGEMM,64x27x27x5x5x192x27x27x64xNCHWxFP16x2x2x1x1x1x1x1x1;miopenConvolutionFwdAlgoDirect:ConvOclDirectFwd,3.47376,0,miopenConvolutionFwdAlgoDirect,<unused>;miopenConvolutionFwdAlgoGEMM:gemm,20.3264,2332800,rocBlas,<unused>;miopenConvolutionFwdAlgoWinograd:ConvBinWinogradRxS,1.75536,0,miopenConvolutionFwdAlgoWinograd,64x27x27x5x5x192x27x27x64xNCHWxFP16x2x2x1x1x1x1x1x1
192-13-13-3x3-384-13-13-64-1x1-1x1-1x1-0-NCHW-FP16-F=miopenConvolutionFwdAlgoImplicitGEMM:ConvHipImplicitGemmV4R1Fwd,1.11856,0,miopenConvolutionFwdAlgoImplicitGEMM,192x13x13x3x3x384x13x13x64xNCHWxFP16x1x1x1x1x1x1x1x1;miopenConvolutionFwdAlgoDirect:ConvOclDirectFwd,2.99712,0,miopenConvolutionFwdAlgoDirect,<unused>;miopenConvolutionFwdAlgoGEMM:gemm,20.5619,584064,rocBlas,<unused>;miopenConvolutionFwdAlgoWinograd:ConvBinWinogradRxS,0.51584,0,miopenConvolutionFwdAlgoWinograd,192x13x13x3x3x384x13x13x64xNCHWxFP16x1x1x1x1x1x1x1x1
384-13-13-3x3-256-13-13-64-1x1-1x1-1x1-0-NCHW-FP16-F=miopenConvolutionFwdAlgoImplicitGEMM:ConvHipImplicitGemmV4R1Fwd,1.592,0,miopenConvolutionFwdAlgoImplicitGEMM,384x13x13x3x3x256x13x13x64xNCHWxFP16x1x1x1x1x1x1x1x1;miopenConvolutionFwdAlgoDirect:ConvOclDirectFwd,4.44864,0,miopenConvolutionFwdAlgoDirect,<unused>;miopenConvolutionFwdAlgoGEMM:gemm,38.8403,1168128,rocBlas,<unused>;miopenConvolutionFwdAlgoWinograd:ConvBinWinogradRxS,0.69072,0,miopenConvolutionFwdAlgoWinograd,384x13x13x3x3x256x13x13x64xNCHWxFP16x1x1x1x1x1x1x1x1
256-13-13-3x3-256-13-13-64-1x1-1x1-1x1-0-NCHW-FP16-F=miopenConvolutionFwdAlgoImplicitGEMM:ConvHipImplicitGemmV4R1Fwd,1.0728,0,miopenConvolutionFwdAlgoImplicitGEMM,256x13x13x3x3x256x13x13x64xNCHWxFP16x1x1x1x1x1x1x1x1;miopenConvolutionFwdAlgoDirect:ConvOclDirectFwd,2.94112,0,miopenConvolutionFwdAlgoDirect,<unused>;miopenConvolutionFwdAlgoGEMM:gemm,26.7264,778752,rocBlas,<unused>;miopenConvolutionFwdAlgoWinograd:ConvBinWinogradRxS,0.47632,0,miopenConvolutionFwdAlgoWinograd,256x13x13x3x3x256x13x13x64xNCHWxFP16x1x1x1x1x1x1x1x1
3-224-224-7x7-64-112-112-32-3x3-2x2-1x1-0-NCHW-FP32-F=miopenConvolutionFwdAlgoDirect:ConvAsm7x7c3h224w224k64u2v2p3q3f1,0.938718,0,miopenConvolutionFwdAlgoDirect,<unused>;miopenConvolutionFwdAlgoGEMM:gemm,3.18464,7375872,rocBlas,<unused>;miopenConvolutionFwdAlgoWinograd:ConvBinWinogradRxS,1.248,0,miopenConvolutionFwdAlgoWinograd,3x224x224x7x7x64x112x112x32xNCHWxFP32x3x3x2x2x1x1x1x1
64-56-56-1x1-128-56-56-32-0x0-1x1-1x1-0-NCHW-FP32-F=miopenConvolutionFwdAlgoImplicitGEMM:ConvHipImplicitGemmV4_1x1,0.44896,0,miopenConvolutionFwdAlgoImplicitGEMM,64x56x56x1x1x128x56x56x32xNCHWxFP32x0x0x1x1x1x1x1x1;miopenConvolutionFwdAlgoDirect:ConvOclDirectFwd1x1,0.26304,0,miopenConvolutionFwdAlgoDirect,<unused>;miopenConvolutionFwdAlgoGEMM:gemm,0.18896,0,rocBlas,<unused>;miopenConvolutionFwdAlgoWinograd:ConvBinWinogradRxSf3x2,0.46608,0,miopenConvolutionFwdAlgoWinograd,64x56x56x1x1x128x56x56x32xNCHWxFP32x0x0x1x1x1x1x1x1
128-56-56-3x3-32-56-56-32-1x1-1x1-1x1-0-NCHW-FP32-F=miopenConvolutionFwdAlgoWinograd:ConvBinWinogradRxSf2x3,0.40512,0,miopenConvolutionFwdAlgoWinograd,128x56x56x3x3x32x56x56x32xNCHWxFP32x1x1x1x1x1x1x1x1
96-56-56-1x1-128-56-56-32-0x0-1x1-1x1-0-NCHW-FP32-F=miopenConvolutionFwdAlgoImplicitGEMM:ConvHipImplicitGemmV4_1x1,0.46496,0,miopenConvolutionFwdAlgoImplicitGEMM,96x56x56x1x1x128x56x56x32xNCHWxFP32x0x0x1x1x1x1x1x1;miopenConvolutionFwdAlgoDirect:ConvOclDirectFwd1x1,0.28176,0,miopenConvolutionFwdAlgoDirect,<unused>;miopenConvolutionFwdAlgoGEMM:gemm,0.2672,0,rocBlas,<unused>;miopenConvolutionFwdAlgoWinograd:ConvBinWinogradRxSf3x2,0.62688,0,miopenConvolutionFwdAlgoWinograd,96x56x56x1x1x128x56x56x32xNCHWxFP32x0x0x1x1x1x1x1x1
128-56-56-1x1-128-56-56-32-0x0-1x1-1x1-0-NCHW-FP32-F=miopenConvolutionFwdAlgoImplicitGEMM:ConvHipImplicitGemmV4_1x1,0.7224,0,miopenConvolutionFwdAlgoImplicitGEMM,128x56x56x1x1x128x56x56x32xNCHWxFP32x0x0x1x1x1x1x1x1;miopenConvolutionFwdAlgoDirect:ConvOclDirectFwd1x1,0.4584,0,miopenConvolutionFwdAlgoDirect,<unused>;miopenConvolutionFwdAlgoGEMM:gemm,0.34832,0,rocBlas,<unused>;miopenConvolutionFwdAlgoWinograd:ConvBinWinogradRxSf3x2,0.79312,0,miopenConvolutionFwdAlgoWinograd,128x56x56x1x1x128x56x56x32xNCHWxFP32x0x0x1x1x1x1x1x1
160-56-56-1x1-128-56-56-32-0x0-1x1-1x1-0-NCHW-FP32-F=miopenConvolutionFwdAlgoImplicitGEMM:ConvHipImplicitGemmV4_1x1,0.5488,0,miopenConvolutionFwdAlgoImplicitGEMM,160x56x56x1x1x128x56x56x32xNCHWxFP32x0x0x1x1x1x1x1x1;miopenConvolutionFwdAlgoDirect:ConvOclDirectFwd1x1,0.51552,0,miopenConvolutionFwdAlgoDirect,<unused>;miopenConvolutionFwdAlgoGEMM:gemm,0.42784,0,rocBlas,<unused>;miopenConvolutionFwdAlgoWinograd:ConvBinWinogradRxSf3x2,0.957599,0,miopenConvolutionFwdAlgoWinograd,160x56x56x1x1x128x56x56x32xNCHWxFP32x0x0x1x1x1x1x1x1
192-56-56-1x1-128-56-56-32-0x0-1x1-1x1-0-NCHW-FP32-F=miopenConvolutionFwdAlgoImplicitGEMM:ConvHipImplicitGemmV4_1x1,0.67808,0,miopenConvolutionFwdAlgoImplicitGEMM,192x56x56x1x1x128x56x56x32xNCHWxFP32x0x0x1x1x1x1x1x1;miopenConvolutionFwdAlgoDirect:ConvOclDirectFwd1x1,0.56944,0,miopenConvolutionFwdAlgoDirect,<unused>;miopenConvolutionFwdAlgoGEMM:gemm,0.50752,0,rocBlas,<unused>;miopenConvolutionFwdAlgoWinograd:ConvBinWinogradRxSf3x2,1.13296,0,miopenConvolutionFwdAlgoWinograd,192x56x56x1x1x128x56x56x32xNCHWxFP32x0x0x1x1x1x1x1x1
224-56-56-1x1-128-56-56-32-0x0-1x1-1x1-0-NCHW-FP32-F=miopenConvolutionFwdAlgoImplicitGEMM:ConvHipImplicitGemmV4_1x1,0.72352,0,miopenConvolutionFwdAlgoImplicitGEMM,224x56x56x1x1x128x56x56x32xNCHWxFP32x0x0x1x1x1x1x1x1;miopenConvolutionFwdAlgoDirect:ConvOclDirectFwd1x1,0.6528,0,miopenConvolutionFwdAlgoDirect,<unused>;miopenConvolutionFwdAlgoGEMM:gemm,0.58016,0,rocBlas,<unused>;miopenConvolutionFwdAlgoWinograd:ConvBinWinogradRxSf3x2,1.29776,0,miopenConvolutionFwdAlgoWinograd,224x56x56x1x1x128x56x56x32xNCHWxFP32x0x0x1x1x1x1x1x1
256-56-56-1x1-128-56-56-32-0x0-1x1-1x1-0-NCHW-FP32-F=miopenConvolutionFwdAlgoImplicitGEMM:ConvHipImplicitGemmV4_1x1,1.2368,0,miopenConvolutionFwdAlgoImplicitGEMM,256x56x56x1x1x128x56x56x32xNCHWxFP32x0x0x1x1x1x1x1x1;miopenConvolutionFwdAlgoDirect:ConvOclDirectFwd1x1,0.739679,0,miopenConvolutionFwdAlgoDirect,<unused>;miopenConvolutionFwdAlgoGEMM:gemm,0.661599,0,rocBlas,<unused>;miopenConvolutionFwdAlgoWinograd:ConvBinWinogradRxSf3x2,1.45024,0,miopenConvolutionFwdAlgoWinograd,256x56x56x1x1x128x56x56x32xNCHWxFP32x0x0x1x1x1x1x1x1
128-28-28-1x1-128-28-28-32-0x0-1x1-1x1-0-NCHW-FP32-F=miopenConvolutionFwdAlgoImplicitGEMM:ConvHipImplicitGemmV4_1x1,0.14464,0,miopenConvolutionFwdAlgoImplicitGEMM,128x28x28x1x1x128x28x28x32xNCHWxFP32x0x0x1x1x1x1x1x1;miopenConvolutionFwdAlgoDirect:ConvOclDirectFwd1x1,0.12592,0,miopenConvolutionFwdAlgoDirect,<unused>;miopenConvolutionFwdAlgoGEMM:gemm,0.11424,0,rocBlas,<unused>;miopenConvolutionFwdAlgoWinograd:ConvBinWinogradRxSf3x2,0.24496,0,miopenConvolutionFwdAlgoWinograd,128x28x28x1x1x128x28x28x32xNCHWxFP32x0x0x1x1x1x1x1x1
128-28-28-3x3-32-28-28-32-1x1-1x1-1x1-0-NCHW-FP32-F=miopenConvolutionFwdAlgoWinograd:ConvBinWinograd3x3U,0.1304,0,miopenConvolutionFwdAlgoWinograd,128x28x28x3x3x32x28x28x32xNCHWxFP32x1x1x1x1x1x1x1x1
160-28-28-1x1-128-28-28-32-0x0-1x1-1x1-0-NCHW-FP32-F=miopenConvolutionFwdAlgoImplicitGEMM:ConvHipImplicitGemmV4_1x1,0.14832,0,miopenConvolutionFwdAlgoImplicitGEMM,160x28x28x1x1x128x28x28x32xNCHWxFP32x0x0x1x1x1x1x1x1;miopenConvolutionFwdAlgoDirect:ConvOclDirectFwd1x1,0.14784,0,miopenConvolutionFwdAlgoDirect,<unused>;miopenConvolutionFwdAlgoGEMM:gemm,0.16304,0,rocBlas,<unused>;miopenConvolutionFwdAlgoWinograd:ConvBinWinogradRxSf3x2,0.33104,0,miopenConvolutionFwdAlgoWinograd,160x28x28x1x1x128x28x28x32xNCHWxFP32x0x0x1x1x1x1x1x1
192-28-28-1x1-128-28-28-32-0x0-1x1-1x1-0-NCHW-FP32-F=miopenConvolutionFwdAlgoImplicitGEMM:ConvHipImplicitGemmV4_1x1,0.27024,0,miopenConvolutionFwdAlgoImplicitGEMM,192x28x28x1x1x128x28x28x32xNCHWxFP32x0x0x1x1x1x1x1x1;miopenConvolutionFwdAlgoDirect:ConvOclDirectFwd1x1,0.17728,0,miopenConvolutionFwdAlgoDirect,<unused>;miopenConvolutionFwdAlgoGEMM:gemm,0.1624,0,rocBlas,<unused>;miopenConvolutionFwdAlgoWinograd:ConvBinWinogradRxSf3x2,0.33936,0,miopenConvolutionFwdAlgoWinograd,192x28x28x1x1x128x28x28x32xNCHWxFP32x0x0x1x1x1x1x1x1
224-28-28-1x1-128-28-28-32-0x0-1x1-1x1-0-NCHW-FP32-F=miopenConvolutionFwdAlgoImplicitGEMM:ConvHipImplicitGemmV4_1x1,0.19024,0,miopenConvolutionFwdAlgoImplicitGEMM,224x28x28x1x1x128x28x28x32xNCHWxFP32x0x0x1x1x1x1x1x1;miopenConvolutionFwdAlgoDirect:ConvOclDirectFwd1x1,0.1984,0,miopenConvolutionFwdAlgoDirect,<unused>;miopenConvolutionFwdAlgoGEMM:gemm,0.19184,0,rocBlas,<unused>;miopenConvolutionFwdAlgoWinograd:ConvBinWinogradRxSf3x2,0.45248,0,miopenConvolutionFwdAlgoWinograd,224x28x28x1x1x128x28x28x32xNCHWxFP32x0x0x1x1x1x1x1x1
256-28-28-1x1-128-28-28-32-0x0-1x1-1x1-0-NCHW-FP32-F=miopenConvolutionFwdAlgoImplicitGEMM:ConvHipImplicitGemmV4_1x1,0.23744,0,miopenConvolutionFwdAlgoImplicitGEMM,256x28x28x1x1x128x28x28x32xNCHWxFP32x0x0x1x1x1x1x1x1;miopenConvolutionFwdAlgoDirect:ConvOclDirectFwd1x1,0.2328,0,miopenConvolutionFwdAlgoDirect,<unused>;miopenConvolutionFwdAlgoGEMM:gemm,0.22208,0,rocBlas,<unused>;miopenConvolutionFwdAlgoWinograd:ConvBinWinogradRxSf3x2,0.43056,0,miopenConvolutionFwdAlgoWinograd,256x28x28x1x1x128x28x28x32xNCHWxFP32x0x0x1x1x1x1x1x1
288-28-28-1x1-128-28-28-32-0x0-1x1-1x1-0-NCHW-FP32-F=miopenConvolutionFwdAlgoImplicitGEMM:ConvHipImplicitGemmV4_1x1,0.23504,0,miopenConvolutionFwdAlgoImplicitGEMM,288x28x28x1x1x128x28x28x32xNCHWxFP32x0x0x1x1x1x1x1x1;miopenConvolutionFwdAlgoDirect:ConvOclDirectFwd1x1,0.24992,0,miopenConvolutionFwdAlgoDirect,<unused>;miopenConvolutionFwdAlgoGEMM:gemm,0.22912,0,rocBlas,<unused>;miopenConvolutionFwdAlgoWinograd:ConvBinWinogradRxSf3x2,0.47504,0,miopenConvolutionFwdAlgoWinograd,288x28x28x1x1x128x28x28x32xNCHWxFP32x0x0x1x1x1x1x1x1
320-28-28-1x1-128-28-28-32-0x0-1x1-1x1-0-NCHW-FP32-F=miopenConvolutionFwdAlgoImplicitGEMM:ConvHipImplicitGemmV4_1x1,0.34064,0,miopenConvolutionFwdAlgoImplicitGEMM,320x28x28x1x1x128x28x28x32xNCHWxFP32x0x0x1x1x1x1x1x1;miopenConvolutionFwdAlgoDirect:ConvOclDirectFwd1x1,0.27344,0,miopenConvolutionFwdAlgoDirect,<unused>;miopenConvolutionFwdAlgoGEMM:gemm,0.25136,0,rocBlas,<unused>;miopenConvolutionFwdAlgoWinograd:ConvBinWinogradRxSf3x2,0.5208,0,miopenConvolutionFwdAlgoWinograd,320x28x28x1x1x128x28x28x32xNCHWxFP32x0x0x1x1x1x1x1x1
352-28-28-1x1-128-28-28-32-0x0-1x1-1x1-0-NCHW-FP32-F=miopenConvolutionFwdAlgoImplicitGEMM:ConvHipImplicitGemmV4_1x1,0.27136,0,miopenConvolutionFwdAlgoImplicitGEMM,352x28x28x1x1x128x28x28x32xNCHWxFP32x0x0x1x1x1x1x1x1;miopenConvolutionFwdAlgoDirect:ConvOclDirectFwd1x1,0.31008,0,miopenConvolutionFwdAlgoDirect,<unused>;miopenConvolutionFwdAlgoGEMM:gemm,0.27232,0,rocBlas,<unused>;miopenConvolutionFwdAlgoWinograd:ConvBinWinogradRxSf3x2,0.56736,0,miopenConvolutionFwdAlgoWinograd,352x28x28x1x1x128x28x28x32xNCHWxFP32x0x0x1x1x1x1x1x1
384-28-28-1x1-128-28-28-32-0x0-1x1-1x1-0-NCHW-FP32-F=miopenConvolutionFwdAlgoImplicitGEMM:ConvHipImplicitGemmV4_1x1,0.33344,0,miopenConvolutionFwdAlgoImplicitGEMM,384x28x28x1x1x128x28x28x32xNCHWxFP32x0x0x1x1x1x1x1x1;miopenConvolutionFwdAlgoDirect:ConvOclDirectFwd1x1,0.34864,0,miopenConvolutionFwdAlgoDirect,<unused>;miopenConvolutionFwdAlgoGEMM:gemm,0.66832,0,rocBlas,<unused>;miopenConvolutionFwdAlgoWinograd:ConvBinWinogradRxSf3x2,0.6136,0,miopenConvolutionFwdAlgoWinograd,384x28x28x1x1x128x28x28x32xNCHWxFP32x0x0x1x1x1x1x1x1
416-28-28-1x1-128-28-28-32-0x0-1x1-1x1-0-NCHW-FP32-F=miopenConvolutionFwdAlgoImplicitGEMM:ConvHipImplicitGemmV4_1x1,0.3152,0,miopenConvolutionFwdAlgoImplicitGEMM,416x28x28x1x1x128x28x28x32xNCHWxFP32x0x0x1x1x1x1x1x1;miopenConvolutionFwdAlgoDirect:ConvOclDirectFwd1x1,0.3584,0,miopenConvolutionFwdAlgoDirect,<unused>;miopenConvolutionFwdAlgoGEMM:gemm,0.73984,0,rocBlas,<unused>;miopenConvolutionFwdAlgoWinograd:ConvBinWinogradRxSf3x2,0.66048,0,miopenConvolutionFwdAlgoWinograd,416x28x28x1x1x128x28x28x32xNCHWxFP32x0x0x1x1x1x1x1x1
448-28-28-1x1-128-28-28-32-0x0-1x1-1x1-0-NCHW-FP32-F=miopenConvolutionFwdAlgoImplicitGEMM:ConvHipImplicitGemmV4_1x1,0.49072,0,miopenConvolutionFwdAlgoImplicitGEMM,448x28x28x1x1x128x28x28x32xNCHWxFP32x0x0x1x1x1x1x1x1;miopenConvolutionFwdAlgoDirect:ConvOclDirectFwd1x1,0.38624,0,miopenConvolutionFwdAlgoDirect,<unused>;miopenConvolutionFwdAlgoGEMM:gemm,0.759039,0,rocBlas,<unused>;miopenConvolutionFwdAlgoWinograd:ConvBinWinogradRxSf3x2,0.70624,0,miopenConvolutionFwdAlgoWinograd,448x28x28x1x1x128x28x28x32xNCHWxFP32x0x0x1x1x1x1x1x1
480-28-28-1x1-128-28-28-32-0x0-1x1-1x1-0-NCHW-FP32-F=miopenConvolutionFwdAlgoImplicitGEMM:ConvHipImplicitGemmV4_1x1,0.36128,0,miopenConvolutionFwdAlgoImplicitGEMM,480x28x28x1x1x128x28x28x32xNCHWxFP32x0x0x1x1x1x1x1x1;miopenConvolutionFwdAlgoDirect:ConvOclDirectFwd1x1,0.41616,0,miopenConvolutionFwdAlgoDirect,<unused>;miopenConvolutionFwdAlgoGEMM:gemm,0.36016,0,rocBlas,<unused>;miopenConvolutionFwdAlgoWinograd:ConvBinWinogradRxSf3x2,0.752319,0,miopenConvolutionFwdAlgoWinograd,480x28x28x1x1x128x28x28x32xNCHWxFP32x0x0x1x1x1x1x1x1
512-28-28-1x1-256-28-28-32-0x0-1x1-1x1-0-NCHW-FP32-F=miopenConvolutionFwdAlgoImplicitGEMM:ConvHipImplicitGemmV4_1x1,0.794399,0,miopenConvolutionFwdAlgoImplicitGEMM,512x28x28x1x1x256x28x28x32xNCHWxFP32x0x0x1x1x1x1x1x1;miopenConvolutionFwdAlgoDirect:ConvOclDirectFwd1x1,0.943839,0,miopenConvolutionFwdAlgoDirect,<unused>;miopenConvolutionFwdAlgoGEMM:gemm,0.74912,0,rocBlas,<unused>;miopenConvolutionFwdAlgoWinograd:ConvBinWinogradRxSf3x2,1.56928,0,miopenConvolutionFwdAlgoWinograd,512x28x28x1x1x256x28x28x32xNCHWxFP32x0x0x1x1x1x1x1x1
256-14-14-1x1-128-14-14-32-0x0-1x1-1x1-0-NCHW-FP32-F=miopenConvolutionFwdAlgoImplicitGEMM:ConvHipImplicitGemmV4_1x1,0.07792,0,miopenConvolutionFwdAlgoImplicitGEMM,256x14x14x1x1x128x14x14x32xNCHWxFP32x0x0x1x1x1x1x1x1;miopenConvolutionFwdAlgoDirect:ConvOclDirectFwd1x1,0.08448,0,miopenConvolutionFwdAlgoDirect,<unused>;miopenConvolutionFwdAlgoGEMM:gemm,0.24256,0,rocBlas,<unused>;miopenConvolutionFwdAlgoWinograd:ConvBinWinogradRxSf3x2,0.15824,0,miopenConvolutionFwdAlgoWinograd,256x14x14x1x1x128x14x14x32xNCHWxFP32x0x0x1x1x1x1x1x1
128-14-14-3x3-32-14-14-32-1x1-1x1-1x1-0-NCHW-FP32-F=miopenConvolutionFwdAlgoWinograd:ConvBinWinograd3x3U,0.04784,0,miopenConvolutionFwdAlgoWinograd,128x14x14x3x3x32x14x14x32xNCHWxFP32x1x1x1x1x1x1x1x1
288-14-14-1x1-128-14-14-32-0x0-1x1-1x1-0-NCHW-FP32-F=miopenConvolutionFwdAlgoImplicitGEMM:ConvHipImplicitGemmV4_1x1,0.10224,0,miopenConvolutionFwdAlgoImplicitGEMM,288x14x14x1x1x128x14x14x32xNCHWxFP32x0x0x1x1x1x1x1x1;miopenConvolutionFwdAlgoDirect:ConvAsm1x1U,0.10256,0,miopenConvolutionFwdAlgoDirect,<unused>;miopenConvolutionFwdAlgoGEMM:gemm,0.25424,0,rocBlas,<unused>;miopenConvolutionFwdAlgoWinograd:ConvBinWinogradRxSf3x2,0.17392,0,miopenConvolutionFwdAlgoWinograd,288x14x14x1x1x128x14x14x32xNCHWxFP32x0x0x1x1x1x1x1x1
320-14-14-1x1-128-14-14-32-0x0-1x1-1x1-0-NCHW-FP32-F=miopenConvolutionFwdAlgoImplicitGEMM:ConvHipImplicitGemmV4_1x1,0.11216,0,miopenConvolutionFwdAlgoImplicitGEMM,320x14x14x1x1x128x14x14x32xNCHWxFP32x0x0x1x1x1x1x1x1;miopenConvolutionFwdAlgoDirect:ConvOclDirectFwd1x1,0.09696,0,miopenConvolutionFwdAlgoDirect,<unused>;miopenConvolutionFwdAlgoGEMM:gemm,0.268,0,rocBlas,<unused>;miopenConvolutionFwdAlgoWinograd:ConvBinWinogradRxSf3x2,0.18464,0,miopenConvolutionFwdAlgoWinograd,320x14x14x1x1x128x14x14x32xNCHWxFP32x0x0x1x1x1x1x1x1
352-14-14-1x1-128-14-14-32-0x0-1x1-1x1-0-NCHW-FP32-F=miopenConvolutionFwdAlgoImplicitGEMM:ConvHipImplicitGemmV4_1x1,0.09408,0,miopenConvolutionFwdAlgoImplicitGEMM,352x14x14x1x1x128x14x14x32xNCHWxFP32x0x0x1x1x1x1x1x1;miopenConvolutionFwdAlgoDirect:ConvOclDirectFwd1x1,0.10576,0,miopenConvolutionFwdAlgoDirect,<unused>;miopenConvolutionFwdAlgoGEMM:gemm,0.26288,0,rocBlas,<unused>;miopenConvolutionFwdAlgoWinograd:ConvBinWinogradRxSf3x2,0.18464,0,miopenConvolutionFwdAlgoWinograd,352x14x14x1x1x128x14x14x32xNCHWxFP32x0x0x1x1x1x1x1x1
384-14-14-1x1-128-14-14-32-0x0-1x1-1x1-0-NCHW-FP32-F=miopenConvolutionFwdAlgoImplicitGEMM:ConvHipImplicitGemmV4_1x1,0.10608,0,miopenConvolutionFwdAlgoImplicitGEMM,384x14x14x1x1x128x14x14x32xNCHWxFP32x0x0x1x1x1x1x1x1;miopenConvolutionFwdAlgoDirect:ConvOclDirectFwd1x1,0.11776,0,miopenConvolutionFwdAlgoDirect,<unused>;miopenConvolutionFwdAlgoGEMM:gemm,0.16096,0,rocBlas,<unused>;miopenConvolutionFwdAlgoWinograd:ConvBinWinogradRxSf3x2,0.20928,0,miopenConvolutionFwdAlgoWinograd,384x14x14x1x1x128x14x14x32xNCHWxFP32x0x0x1x1x1x1x1x1
416-14-14-1x1-128-14-14-32-0x0-1x1-1x1-0-NCHW-FP32-F=miopenConvolutionFwdAlgoImplicitGEMM:ConvHipImplicitGemmV4_1x1,0.10736,0,miopenConvolutionFwdAlgoImplicitGEMM,416x14x14x1x1x128x14x14x32xNCHWxFP32x0x0x1x1x1x1x1x1;miopenConvolutionFwdAlgoDirect:ConvOclDirectFwd1x1,0.12592,0,miopenConvolutionFwdAlgoDirect,<unused>;miopenConvolutionFwdAlgoGEMM:gemm,0.16944,0,rocBlas,<unused>;miopenConvolutionFwdAlgoWinograd:ConvBinWinogradRxSf3x2,0.22208,0,miopenConvolutionFwdAlgoWinograd,416x14x14x1x1x128x14x14x32xNCHWxFP32x0x0x1x1x1x1x1x1
448-14-14-1x1-128-14-14-32-0x0-1x1-1x1-0-NCHW-FP32-F=miopenConvolutionFwdAlgoImplicitGEMM:ConvHipImplicitGemmV4_1x1,0.1208,0,miopenConvolutionFwdAlgoImplicitGEMM,448x14x14x1x1x128x14x14x32xNCHWxFP32x0x0x1x1x1x1x1x1;miopenConvolutionFwdAlgoDirect:ConvOclDirectFwd1x1,0.13328,0,miopenConvolutionFwdAlgoDirect,<unused>;miopenConvolutionFwdAlgoGEMM:gemm,0.15296,0,rocBlas,<unused>;miopenConvolutionFwdAlgoWinograd:ConvBinWinogradRxSf3x2,0.22384,0,miopenConvolutionFwdAlgoWinograd,448x14x14x1x1x128x14x14x32xNCHWxFP32x0x0x1x1x1x1x1x1
480-14-14-1x1-128-14-14-32-0x0-1x1-1x1-0-NCHW-FP32-F=miopenConvolutionFwdAlgoImplicitGEMM:ConvHipImplicitGemmV4_1x1,0.12304,0,miopenConvolutionFwdAlgoImplicitGEMM,480x14x14x1x1x128x14x14x32xNCHWxFP32x0x0x1x1x1x1x1x1;miopenConvolutionFwdAlgoDirect:ConvOclDirectFwd1x1,0.15552,0,miopenConvolutionFwdAlgoDirect,<unused>;miopenConvolutionFwdAlgoGEMM:gemm,0.1896,0,rocBlas,<unused>;miopenConvolutionFwdAlgoWinograd:ConvBinWinogradRxSf3x2,0.24896,0,miopenConvolutionFwdAlgoWinograd,480x14x14x1x1x128x14x14x32xNCHWxFP32x0x0x1x1x1x1x1x1
512-14-14-1x1-128-14-14-32-0x0-1x1-1x1-0-NCHW-FP32-F=miopenConvolutionFwdAlgoImplicitGEMM:ConvHipImplicitGemmV4_1x1,0.14848,0,miopenConvolutionFwdAlgoImplicitGEMM,512x14x14x1x1x128x14x14x32xNCHWxFP32x0x0x1x1x1x1x1x1;miopenConvolutionFwdAlgoDirect:ConvOclDirectFwd1x1,0.1592,0,miopenConvolutionFwdAlgoDirect,<unused>;miopenConvolutionFwdAlgoGEMM:gemm,0.18192,0,rocBlas,<unused>;miopenConvolutionFwdAlgoWinograd:ConvBinWinogradRxSf3x2,0.25024,0,miopenConvolutionFwdAlgoWinograd,512x14x14x1x1x128x14x14x32xNCHWxFP32x0x0x1x1x1x1x1x1
544-14-14-1x1-128-14-14-32-0x0-1x1-1x1-0-NCHW-FP32-F=miopenConvolutionFwdAlgoImplicitGEMM:ConvHipImplicitGemmV4_1x1,0.14384,0,miopenConvolutionFwdAlgoImplicitGEMM,544x14x14x1x1x128x14x14x32xNCHWxFP32x0x0x1x1x1x1x1x1;miopenConvolutionFwdAlgoDirect:ConvOclDirectFwd1x1,0.16336,0,miopenConvolutionFwdAlgoDirect,<unused>;miopenConvolutionFwdAlgoGEMM:gemm,0.17968,0,rocBlas,<unused>;miopenConvolutionFwdAlgoWinograd:ConvBinWinogradRxSf3x2,0.26288,0,miopenConvolutionFwdAlgoWinograd,544x14x14x1x1x128x14x14x32xNCHWxFP32x0x0x1x1x1x1x1x1
576-14-14-1x1-128-14-14-32-0x0-1x1-1x1-0-NCHW-FP32-F=miopenConvolutionFwdAlgoImplicitGEMM:ConvHipImplicitGemmV4_1x1,0.15264,0,miopenConvolutionFwdAlgoImplicitGEMM,576x14x14x1x1x128x14x14x32xNCHWxFP32x0x0x1x1x1x1x1x1;miopenConvolutionFwdAlgoDirect:ConvOclDirectFwd1x1,0.17536,0,miopenConvolutionFwdAlgoDirect,<unused>;miopenConvolutionFwdAlgoGEMM:gemm,0.19888,0,rocBlas,<unused>;miopenConvolutionFwdAlgoWinograd:ConvBinWinogradRxSf3x2,0.27552,0,miopenConvolutionFwdAlgoWinograd,576x14x14x1x1x128x14x14x32xNCHWxFP32x0x0x1x1x1x1x1x1
608-14-14-1x1-128-14-14-32-0x0-1x1-1x1-0-NCHW-FP32-F=miopenConvolutionFwdAlgoImplicitGEMM:ConvHipImplicitGemmV4_1x1,0.1568,0,miopenConvolutionFwdAlgoImplicitGEMM,608x14x14x1x1x128x14x14x32xNCHWxFP32x0x0x1x1x1x1x1x1;miopenConvolutionFwdAlgoDirect:ConvOclDirectFwd1x1,0.18096,0,miopenConvolutionFwdAlgoDirect,<unused>;miopenConvolutionFwdAlgoGEMM:gemm,0.19744,0,rocBlas,<unused>;miopenConvolutionFwdAlgoWinograd:ConvBinWinogradRxSf3x2,0.2888,0,miopenConvolutionFwdAlgoWinograd,608x14x14x1x1x128x14x14x32xNCHWxFP32x0x0x1x1x1x1x1x1
640-14-14-1x1-128-14-14-32-0x0-1x1-1x1-0-NCHW-FP32-F=miopenConvolutionFwdAlgoImplicitGEMM:ConvHipImplicitGemmV4_1x1,0.17248,0,miopenConvolutionFwdAlgoImplicitGEMM,640x14x14x1x1x128x14x14x32xNCHWxFP32x0x0x1x1x1x1x1x1;miopenConvolutionFwdAlgoDirect:ConvOclDirectFwd1x1,0.1896,0,miopenConvolutionFwdAlgoDirect,<unused>;miopenConvolutionFwdAlgoGEMM:gemm,0.20992,0,rocBlas,<unused>;miopenConvolutionFwdAlgoWinograd:ConvBinWinogradRxSf3x2,0.30256,0,miopenConvolutionFwdAlgoWinograd,640x14x14x1x1x128x14x14x32xNCHWxFP32x0x0x1x1x1x1x1x1
672-14-14-1x1-128-14-14-32-0x0-1x1-1x1-0-NCHW-FP32-F=miopenConvolutionFwdAlgoImplicitGEMM:ConvHipImplicitGemmV4_1x1,0.17296,0,miopenConvolutionFwdAlgoImplicitGEMM,672x14x14x1x1x128x14x14x32xNCHWxFP32x0x0x1x1x1x1x1x1;miopenConvolutionFwdAlgoDirect:ConvOclDirectFwd1x1,0.1992,0,miopenConvolutionFwdAlgoDirect,<unused>;miopenConvolutionFwdAlgoGEMM:gemm,0.30832,0,rocBlas,<unused>;miopenConvolutionFwdAlgoWinograd:ConvBinWinogradRxSf3x2,0.31536,0,miopenConvolutionFwdAlgoWinograd,672x14x14x1x1x128x14x14x32xNCHWxFP32x0x0x1x1x1x1x1x1
704-14-14-1x1-128-14-14-32-0x0-1x1-1x1-0-NCHW-FP32-F=miopenConvolutionFwdAlgoImplicitGEMM:ConvHipImplicitGemmV4_1x1,0.1792,0,miopenConvolutionFwdAlgoImplicitGEMM,704x14x14x1x1x128x14x14x32xNCHWxFP32x0x0x1x1x1x1x1x1;miopenConvolutionFwdAlgoDirect:ConvOclDirectFwd1x1,0.21616,0,miopenConvolutionFwdAlgoDirect,<unused>;miopenConvolutionFwdAlgoGEMM:gemm,0.34336,0,rocBlas,<unused>;miopenConvolutionFwdAlgoWinograd:ConvBinWinogradRxSf3x2,0.32784,0,miopenConvolutionFwdAlgoWinograd,704x14x14x1x1x128x14x14x32xNCHWxFP32x0x0x1x1x1x1x1x1
736-14-14-1x1-128-14-14-32-0x0-1x1-1x1-0-NCHW-FP32-F=miopenConvolutionFwdAlgoImplicitGEMM:ConvHipImplicitGemmV4_1x1,0.18528,0,miopenConvolutionFwdAlgoImplicitGEMM,736x14x14x1x1x128x14x14x32xNCHWxFP32x0x0x1x1x1x1x1x1;miopenConvolutionFwdAlgoDirect:ConvOclDirectFwd1x1,0.22112,0,miopenConvolutionFwdAlgoDirect,<unused>;miopenConvolutionFwdAlgoGEMM:gemm,0.35088,0,rocBlas,<unused>;miopenConvolutionFwdAlgoWinograd:ConvBinWinogradRxSf3x2,0.34176,0,miopenConvolutionFwdAlgoWinograd,736x14x14x1x1x128x14x14x32xNCHWxFP32x0x0x1x1x1x1x1x1
768-14-14-1x1-128-14-14-32-0x0-1x1-1x1-0-NCHW-FP32-F=miopenConvolutionFwdAlgoImplicitGEMM:ConvHipImplicitGemmV4_1x1,0.19744,0,miopenConvolutionFwdAlgoImplicitGEMM,768x14x14x1x1x128x14x14x32xNCHWxFP32x0x0x1x1x1x1x1x1;miopenConvolutionFwdAlgoDirect:ConvOclDirectFwd1x1,0.2336,0,miopenConvolutionFwdAlgoDirect,<unused>;miopenConvolutionFwdAlgoGEMM:gemm,0.36848,0,rocBlas,<unused>;miopenConvolutionFwdAlgoWinograd:ConvBinWinogradRxSf3x2,0.35568,0,miopenConvolutionFwdAlgoWinograd,768x14x14x1x1x128x14x14x32xNCHWxFP32x0x0x1x1x1x1x1x1
800-14-14-1x1-128-14-14-32-0x0-1x1-1x1-0-NCHW-FP32-F=miopenConvolutionFwdAlgoImplicitGEMM:ConvHipImplicitGemmV4_1x1,0.1992,0,miopenConvolutionFwdAlgoImplicitGEMM,800x14x14x1x1x128x14x14x32xNCHWxFP32x0x0x1x1x1x1x1x1;miopenConvolutionFwdAlgoDirect:ConvOclDirectFwd1x1,0.24336,0,miopenConvolutionFwdAlgoDirect,<unused>;miopenConvolutionFwdAlgoGEMM:gemm,0.3896,0,rocBlas,<unused>;miopenConvolutionFwdAlgoWinograd:ConvBinWinogradRxSf3x2,0.36688,0,miopenConvolutionFwdAlgoWinograd,800x14x14x1x1x128x14x14x32xNCHWxFP32x0x0x1x1x1x1x1x1
832-14-14-1x1-128-14-14-32-0x0-1x1-1x1-0-NCHW-FP32-F=miopenConvolutionFwdAlgoImplicitGEMM:ConvHipImplicitGemmV4_1x1,0.2136,0,miopenConvolutionFwdAlgoImplicitGEMM,832x14x14x1x1x128x14x14x32xNCHWxFP32x0x0x1x1x1x1x1x1;miopenConvolutionFwdAlgoDirect:ConvOclDirectFwd1x1,0.2472,0,miopenConvolutionFwdAlgoDirect,<unused>;miopenConvolutionFwdAlgoGEMM:gemm,0.38224,0,rocBlas,<unused>;miopenConvolutionFwdAlgoWinograd:ConvBinWinogradRxSf3x2,0.3816,0,miopenConvolutionFwdAlgoWinograd,832x14x14x1x1x128x14x14x32xNCHWxFP32x0x0x1x1x1x1x1x1
864-14-14-1x1-128-14-14-32-0x0-1x1-1x1-0-NCHW-FP32-F=miopenConvolutionFwdAlgoImplicitGEMM:ConvHipImplicitGemmV4_1x1,0.20848,0,miopenConvolutionFwdAlgoImplicitGEMM,864x14x14x1x1x128x14x14x32xNCHWxFP32x0x0x1x1x1x1x1x1;miopenConvolutionFwdAlgoDirect:ConvOclDirectFwd1x1,0.25696,0,miopenConvolutionFwdAlgoDirect,<unused>;miopenConvolutionFwdAlgoGEMM:gemm,0.40976,0,rocBlas,<unused>;miopenConvolutionFwdAlgoWinograd:ConvBinWinogradRxSf3x2,0.41808,0,miopenConvolutionFwdAlgoWinograd,864x14x14x1x1x128x14x14x32xNCHWxFP32x0x0x1x1x1x1x1x1
896-14-14-1x1-128-14-14-32-0x0-1x1-1x1-0-NCHW-FP32-F=miopenConvolutionFwdAlgoImplicitGEMM:ConvHipImplicitGemmV4_1x1,0.22704,0,miopenConvolutionFwdAlgoImplicitGEMM,896x14x14x1x1x128x14x14x32xNCHWxFP32x0x0x1x1x1x1x1x1;miopenConvolutionFwdAlgoDirect:ConvOclDirectFwd1x1,0.26896,0,miopenConvolutionFwdAlgoDirect,<unused>;miopenConvolutionFwdAlgoGEMM:gemm,0.28768,0,rocBlas,<unused>;miopenConvolutionFwdAlgoWinograd:ConvBinWinogradRxSf3x2,0.4072,0,miopenConvolutionFwdAlgoWinograd,896x14x14x1x1x128x14x14x32xNCHWxFP32x0x0x1x1x1x1x1x1
928-14-14-1x1-128-14-14-32-0x0-1x1-1x1-0-NCHW-FP32-F=miopenConvolutionFwdAlgoImplicitGEMM:ConvHipImplicitGemmV4_1x1,0.22832,0,miopenConvolutionFwdAlgoImplicitGEMM,928x14x14x1x1x128x14x14x32xNCHWxFP32x0x0x1x1x1x1x1x1;miopenConvolutionFwdAlgoDirect:ConvOclDirectFwd1x1,0.27936,0,miopenConvolutionFwdAlgoDirect,<unused>;miopenConvolutionFwdAlgoGEMM:gemm,0.29744,0,rocBlas,<unused>;miopenConvolutionFwdAlgoWinograd:ConvBinWinogradRxSf3x2,0.41984,0,miopenConvolutionFwdAlgoWinograd,928x14x14x1x1x128x14x14x32xNCHWxFP32x0x0x1x1x1x1x1x1
960-14-14-1x1-128-14-14-32-0x0-1x1-1x1-0-NCHW-FP32-F=miopenConvolutionFwdAlgoImplicitGEMM:ConvHipImplicitGemmV4_1x1,0.24352,0,miopenConvolutionFwdAlgoImplicitGEMM,960x14x14x1x1x128x14x14x32xNCHWxFP32x0x0x1x1x1x1x1x1;miopenConvolutionFwdAlgoDirect:ConvOclDirectFwd1x1,0.29728,0,miopenConvolutionFwdAlgoDirect,<unused>;miopenConvolutionFwdAlgoGEMM:gemm,0.31088,0,rocBlas,<unused>;miopenConvolutionFwdAlgoWinograd:ConvBinWinogradRxSf3x2,0.43376,0,miopenConvolutionFwdAlgoWinograd,960x14x14x1x1x128x14x14x32xNCHWxFP32x0x0x1x1x1x1x1x1
992-14-14-1x1-128-14-14-32-0x0-1x1-1x1-0-NCHW-FP32-F=miopenConvolutionFwdAlgoImplicitGEMM:ConvHipImplicitGemmV4_1x1,0.23808,0,miopenConvolutionFwdAlgoImplicitGEMM,992x14x14x1x1x128x14x14x32xNCHWxFP32x0x0x1x1x1x1x1x1;miopenConvolutionFwdAlgoDirect:ConvOclDirectFwd1x1,0.2992,0,miopenConvolutionFwdAlgoDirect,<unused>;miopenConvolutionFwdAlgoGEMM:gemm,0.33936,0,rocBlas,<unused>;miopenConvolutionFwdAlgoWinograd:ConvBinWinogradRxSf3x2,0.45872,0,miopenConvolutionFwdAlgoWinograd,992x14x14x1x1x128x14x14x32xNCHWxFP32x0x0x1x1x1x1x1x1
1024-14-14-1x1-512-14-14-32-0x0-1x1-1x1-0-NCHW-FP32-F=miopenConvolutionFwdAlgoImplicitGEMM:ConvHipImplicitGemmV4_1x1,1.14272,0,miopenConvolutionFwdAlgoImplicitGEMM,1024x14x14x1x1x512x14x14x32xNCHWxFP32x0x0x1x1x1x1x1x1;miopenConvolutionFwdAlgoDirect:ConvOclDirectFwd1x1,1.06256,0,miopenConvolutionFwdAlgoDirect,<unused>;miopenConvolutionFwdAlgoGEMM:gemm,1.28704,0,rocBlas,<unused>;miopenConvolutionFwdAlgoWinograd:ConvBinWinogradRxSf3x2,1.54384,0,miopenConvolutionFwdAlgoWinograd,1024x14x14x1x1x512x14x14x32xNCHWxFP32x0x0x1x1x1x1x1x1
512-7-7-1x1-128-7-7-32-0x0-1x1-1x1-0-NCHW-FP32-F=miopenConvolutionFwdAlgoImplicitGEMM:ConvHipImplicitGemmV4R1Fwd,0.08128,0,miopenConvolutionFwdAlgoImplicitGEMM,512x7x7x1x1x128x7x7x32xNCHWxFP32x0x0x1x1x1x1x1x1;miopenConvolutionFwdAlgoDirect:ConvOclDirectFwd1x1,0.0696,0,miopenConvolutionFwdAlgoDirect,<unused>;miopenConvolutionFwdAlgoGEMM:gemm,0.10848,0,rocBlas,<unused>;miopenConvolutionFwdAlgoWinograd:ConvBinWinogradRxSf3x2,0.15248,0,miopenConvolutionFwdAlgoWinograd,512x7x7x1x1x128x7x7x32xNCHWxFP32x0x0x1x1x1x1x1x1
128-7-7-3x3-32-7-7-32-1x1-1x1-1x1-0-NCHW-FP32-F=miopenConvolutionFwdAlgoWinograd:ConvBinWinograd3x3U,0.04704,0,miopenConvolutionFwdAlgoWinograd,128x7x7x3x3x32x7x7x32xNCHWxFP32x1x1x1x1x1x1x1x1
544-7-7-1x1-128-7-7-32-0x0-1x1-1x1-0-NCHW-FP32-F=miopenConvolutionFwdAlgoImplicitGEMM:ConvHipImplicitGemmV4R1Fwd,0.07504,0,miopenConvolutionFwdAlgoImplicitGEMM,544x7x7x1x1x128x7x7x32xNCHWxFP32x0x0x1x1x1x1x1x1;miopenConvolutionFwdAlgoDirect:ConvOclDirectFwd1x1,0.07472,0,miopenConvolutionFwdAlgoDirect,<unused>;miopenConvolutionFwdAlgoGEMM:gemm,0.11488,0,rocBlas,<unused>;miopenConvolutionFwdAlgoWinograd:ConvBinWinogradRxSf3x2,0.13648,0,miopenConvolutionFwdAlgoWinograd,544x7x7x1x1x128x7x7x32xNCHWxFP32x0x0x1x1x1x1x1x1
576-7-7-1x1-128-7-7-32-0x0-1x1-1x1-0-NCHW-FP32-F=miopenConvolutionFwdAlgoImplicitGEMM:ConvHipImplicitGemmV4R1Fwd,0.07952,0,miopenConvolutionFwdAlgoImplicitGEMM,576x7x7x1x1x128x7x7x32xNCHWxFP32x0x0x1x1x1x1x1x1;miopenConvolutionFwdAlgoDirect:ConvOclDirectFwd1x1,0.0792,0,miopenConvolutionFwdAlgoDirect,<unused>;miopenConvolutionFwdAlgoGEMM:gemm,0.10192,0,rocBlas,<unused>;miopenConvolutionFwdAlgoWinograd:ConvBinWinogradRxSf3x2,0.1496,0,miopenConvolutionFwdAlgoWinograd,576x7x7x1x1x128x7x7x32xNCHWxFP32x0x0x1x1x1x1x1x1
608-7-7-1x1-128-7-7-32-0x0-1x1-1x1-0-NCHW-FP32-F=miopenConvolutionFwdAlgoImplicitGEMM:ConvHipImplicitGemmV4R1Fwd,0.08048,0,miopenConvolutionFwdAlgoImplicitGEMM,608x7x7x1x1x128x7x7x32xNCHWxFP32x0x0x1x1x1x1x1x1;miopenConvolutionFwdAlgoDirect:ConvOclDirectFwd1x1,0.08656,0,miopenConvolutionFwdAlgoDirect,<unused>;miopenConvolutionFwdAlgoGEMM:gemm,0.1312,0,rocBlas,<unused>;miopenConvolutionFwdAlgoWinograd:ConvBinWinogradRxSf3x2,0.15552,0,miopenConvolutionFwdAlgoWinograd,608x7x7x1x1x128x7x7x32xNCHWxFP32x0x0x1x1x1x1x1x1
640-7-7-1x1-128-7-7-32-0x0-1x1-1x1-0-NCHW-FP32-F=miopenConvolutionFwdAlgoImplicitGEMM:ConvHipImplicitGemmV4R1Fwd,0.0872,0,miopenConvolutionFwdAlgoImplicitGEMM,640x7x7x1x1x128x7x7x32xNCHWxFP32x0x0x1x1x1x1x1x1;miopenConvolutionFwdAlgoDirect:ConvOclDirectFwd1x1,0.09552,0,miopenConvolutionFwdAlgoDirect,<unused>;miopenConvolutionFwdAlgoGEMM:gemm,0.12096,0,rocBlas,<unused>;miopenConvolutionFwdAlgoWinograd:ConvBinWinogradRxSf3x2,0.17168,0,miopenConvolutionFwdAlgoWinograd,640x7x7x1x1x128x7x7x32xNCHWxFP32x0x0x1x1x1x1x1x1
672-7-7-1x1-128-7-7-32-0x0-1x1-1x1-0-NCHW-FP32-F=miopenConvolutionFwdAlgoImplicitGEMM:ConvHipImplicitGemmV4R1Fwd,0.08608,0,miopenConvolutionFwdAlgoImplicitGEMM,672x7x7x1x1x128x7x7x32xNCHWxFP32x0x0x1x1x1x1x1x1;miopenConvolutionFwdAlgoDirect:ConvOclDirectFwd1x1,0.08048,0,miopenConvolutionFwdAlgoDirect,<unused>;miopenConvolutionFwdAlgoGEMM:gemm,0.11552,0,rocBlas,<unused>;miopenConvolutionFwdAlgoWinograd:ConvBinWinogradRxSf3x2,0.16848,0,miopenConvolutionFwdAlgoWinograd,672x7x7x1x1x128x7x7x32xNCHWxFP32x0x0x1x1x1x1x1x1
704-7-7-1x1-128-7-7-32-0x0-1x1-1x1-0-NCHW-FP32-F=miopenConvolutionFwdAlgoImplicitGEMM:ConvHipImplicitGemmV4R1Fwd,0.09104,0,miopenConvolutionFwdAlgoImplicitGEMM,704x7x7x1x1x128x7x7x32xNCHWxFP32x0x0x1x1x1x1x1x1;miopenConvolutionFwdAlgoDirect:ConvOclDirectFwd1x1,0.10512,0,miopenConvolutionFwdAlgoDirect,<unused>;miopenConvolutionFwdAlgoGEMM:gemm,0.116,0,rocBlas,<unused>;miopenConvolutionFwdAlgoWinograd:ConvBinWinogradRxSf3x2,0.18448,0,miopenConvolutionFwdAlgoWinograd,704x7x7x1x1x128x7x7x32xNCHWxFP32x0x0x1x1x1x1x1x1
736-7-7-1x1-128-7-7-32-0x0-1x1-1x1-0-NCHW-FP32-F=miopenConvolutionFwdAlgoImplicitGEMM:ConvHipImplicitGemmV4R1Fwd,0.09408,0,miopenConvolutionFwdAlgoImplicitGEMM,736x7x7x1x1x128x7x7x32xNCHWxFP32x0x0x1x1x1x1x1x1;miopenConvolutionFwdAlgoDirect:ConvAsm1x1U,0.11008,0,miopenConvolutionFwdAlgoDirect,<unused>;miopenConvolutionFwdAlgoGEMM:gemm,0.11808,0,rocBlas,<unused>;miopenConvolutionFwdAlgoWinograd:ConvBinWinogradRxSf3x2,0.18144,0,miopenConvolutionFwdAlgoWinograd,736x7x7x1x1x128x7x7x32xNCHWxFP32x0x0x1x1x1x1x1x1
768-7-7-1x1-128-7-7-32-0x0-1x1-1x1-0-NCHW-FP32-F=miopenConvolutionFwdAlgoImplicitGEMM:ConvHipImplicitGemmV4R1Fwd,0.11024,0,miopenConvolutionFwdAlgoImplicitGEMM,768x7x7x1x1x128x7x7x32xNCHWxFP32x0x0x1x1x1x1x1x1;miopenConvolutionFwdAlgoDirect:ConvOclDirectFwd1x1,0.10496,0,miopenConvolutionFwdAlgoDirect,<unused>;miopenConvolutionFwdAlgoGEMM:gemm,0.12352,0,rocBlas,<unused>;miopenConvolutionFwdAlgoWinograd:ConvBinWinogradRxSf3x2,0.18912,0,miopenConvolutionFwdAlgoWinograd,768x7x7x1x1x128x7x7x32xNCHWxFP32x0x0x1x1x1x1x1x1
800-7-7-1x1-128-7-7-32-0x0-1x1-1x1-0-NCHW-FP32-F=miopenConvolutionFwdAlgoImplicitGEMM:ConvHipImplicitGemmV4R1Fwd,0.10096,0,miopenConvolutionFwdAlgoImplicitGEMM,800x7x7x1x1x128x7x7x32xNCHWxFP32x0x0x1x1x1x1x1x1;miopenConvolutionFwdAlgoDirect:ConvOclDirectFwd1x1,0.10544,0,miopenConvolutionFwdAlgoDirect,<unused>;miopenConvolutionFwdAlgoGEMM:gemm,0.12784,0,rocBlas,<unused>;miopenConvolutionFwdAlgoWinograd:ConvBinWinogradRxSf3x2,0.20464,0,miopenConvolutionFwdAlgoWinograd,800x7x7x1x1x128x7x7x32xNCHWxFP32x0x0x1x1x1x1x1x1
832-7-7-1x1-128-7-7-32-0x0-1x1-1x1-0-NCHW-FP32-F=miopenConvolutionFwdAlgoImplicitGEMM:ConvHipImplicitGemmV4R1Fwd,0.1048,0,miopenConvolutionFwdAlgoImplicitGEMM,832x7x7x1x1x128x7x7x32xNCHWxFP32x0x0x1x1x1x1x1x1;miopenConvolutionFwdAlgoDirect:ConvAsm1x1U,0.0848,0,miopenConvolutionFwdAlgoDirect,<unused>;miopenConvolutionFwdAlgoGEMM:gemm,0.13344,0,rocBlas,<unused>;miopenConvolutionFwdAlgoWinograd:ConvBinWinogradRxSf3x2,0.21248,0,miopenConvolutionFwdAlgoWinograd,832x7x7x1x1x128x7x7x32xNCHWxFP32x0x0x1x1x1x1x1x1
864-7-7-1x1-128-7-7-32-0x0-1x1-1x1-0-NCHW-FP32-F=miopenConvolutionFwdAlgoImplicitGEMM:ConvHipImplicitGemmV4R1Fwd,0.10816,0,miopenConvolutionFwdAlgoImplicitGEMM,864x7x7x1x1x128x7x7x32xNCHWxFP32x0x0x1x1x1x1x1x1;miopenConvolutionFwdAlgoDirect:ConvOclDirectFwd1x1,0.11008,0,miopenConvolutionFwdAlgoDirect,<unused>;miopenConvolutionFwdAlgoGEMM:gemm,0.1328,0,rocBlas,<unused>;miopenConvolutionFwdAlgoWinograd:ConvBinWinogradRxSf3x2,0.20896,0,miopenConvolutionFwdAlgoWinograd,864x7x7x1x1x128x7x7x32xNCHWxFP32x0x0x1x1x1x1x1x1
896-7-7-1x1-128-7-7-32-0x0-1x1-1x1-0-NCHW-FP32-F=miopenConvolutionFwdAlgoImplicitGEMM:ConvHipImplicitGemmV4R1Fwd,0.1216,0,miopenConvolutionFwdAlgoImplicitGEMM,896x7x7x1x1x128x7x7x32xNCHWxFP32x0x0x1x1x1x1x1x1;miopenConvolutionFwdAlgoDirect:ConvOclDirectFwd1x1,0.12016,0,miopenConvolutionFwdAlgoDirect,<unused>;miopenConvolutionFwdAlgoGEMM:gemm,0.1368,0,rocBlas,<unused>;miopenConvolutionFwdAlgoWinograd:ConvBinWinogradRxSf3x2,0.21488,0,miopenConvolutionFwdAlgoWinograd,896x7x7x1x1x128x7x7x32xNCHWxFP32x0x0x1x1x1x1x1x1
928-7-7-1x1-128-7-7-32-0x0-1x1-1x1-0-NCHW-FP32-F=miopenConvolutionFwdAlgoImplicitGEMM:ConvHipImplicitGemmV4R1Fwd,0.11616,0,miopenConvolutionFwdAlgoImplicitGEMM,928x7x7x1x1x128x7x7x32xNCHWxFP32x0x0x1x1x1x1x1x1;miopenConvolutionFwdAlgoDirect:ConvOclDirectFwd1x1,0.11984,0,miopenConvolutionFwdAlgoDirect,<unused>;miopenConvolutionFwdAlgoGEMM:gemm,0.1376,0,rocBlas,<unused>;miopenConvolutionFwdAlgoWinograd:ConvBinWinogradRxSf3x2,0.22096,0,miopenConvolutionFwdAlgoWinograd,928x7x7x1x1x128x7x7x32xNCHWxFP32x0x0x1x1x1x1x1x1
960-7-7-1x1-128-7-7-32-0x0-1x1-1x1-0-NCHW-FP32-F=miopenConvolutionFwdAlgoImplicitGEMM:ConvHipImplicitGemmV4R1Fwd,0.1192,0,miopenConvolutionFwdAlgoImplicitGEMM,960x7x7x1x1x128x7x7x32xNCHWxFP32x0x0x1x1x1x1x1x1;miopenConvolutionFwdAlgoDirect:ConvOclDirectFwd1x1,0.1168,0,miopenConvolutionFwdAlgoDirect,<unused>;miopenConvolutionFwdAlgoGEMM:gemm,0.14688,0,rocBlas,<unused>;miopenConvolutionFwdAlgoWinograd:ConvBinWinogradRxSf3x2,0.23776,0,miopenConvolutionFwdAlgoWinograd,960x7x7x1x1x128x7x7x32xNCHWxFP32x0x0x1x1x1x1x1x1
992-7-7-1x1-128-7-7-32-0x0-1x1-1x1-0-NCHW-FP32-F=miopenConvolutionFwdAlgoImplicitGEMM:ConvHipImplicitGemmV4R1Fwd,0.1224,0,miopenConvolutionFwdAlgoImplicitGEMM,992x7x7x1x1x128x7x7x32xNCHWxFP32x0x0x1x1x1x1x1x1;miopenConvolutionFwdAlgoDirect:ConvOclDirectFwd1x1,0.1224,0,miopenConvolutionFwdAlgoDirect,<unused>;miopenConvolutionFwdAlgoGEMM:gemm,0.14992,0,rocBlas,<unused>;miopenConvolutionFwdAlgoWinograd:ConvBinWinogradRxSf3x2,0.23392,0,miopenConvolutionFwdAlgoWinograd,992x7x7x1x1x128x7x7x32xNCHWxFP32x0x0x1x1x1x1x1x1
3-224-224-7x7-64-112-112-32-3x3-2x2-1x1-0-NCHW-FP16-F=miopenConvolutionFwdAlgoDirect:ConvOclDirectFwdGen,1.59552,0,miopenConvolutionFwdAlgoDirect,<unused>;miopenConvolutionFwdAlgoGEMM:gemm,3.79904,3687936,rocBlas,<unused>
64-56-56-1x1-128-56-56-32-0x0-1x1-1x1-0-NCHW-FP16-F=miopenConvolutionFwdAlgoImplicitGEMM:ConvHipImplicitGemmV4Fwd,0.30048,0,miopenConvolutionFwdAlgoImplicitGEMM,64x56x56x1x1x128x56x56x32xNCHWxFP16x0x0x1x1x1x1x1x1;miopenConvolutionFwdAlgoDirect:ConvAsm1x1U,0.19824,0,miopenConvolutionFwdAlgoDirect,<unused>;miopenConvolutionFwdAlgoGEMM:gemm,0.1216,0,rocBlas,<unused>;miopenConvolutionFwdAlgoWinograd:ConvBinWinogradRxS,0.51456,0,miopenConvolutionFwdAlgoWinograd,64x56x56x1x1x128x56x56x32xNCHWxFP16x0x0x1x1x1x1x1x1
128-56-56-3x3-32-56-56-32-1x1-1x1-1x1-0-NCHW-FP16-F=miopenConvolutionFwdAlgoImplicitGEMM:ConvHipImplicitGemmV4R1Fwd,0.76464,0,miopenConvolutionFwdAlgoImplicitGEMM,128x56x56x3x3x32x56x56x32xNCHWxFP16x1x1x1x1x1x1x1x1;miopenConvolutionFwdAlgoDirect:ConvOclDirectFwd,1.91888,0,miopenConvolutionFwdAlgoDirect,<unused>;miopenConvolutionFwdAlgoGEMM:gemm,3.63008,7225344,rocBlas,<unused>;miopenConvolutionFwdAlgoWinograd:ConvBinWinogradRxS,0.2656,0,miopenConvolutionFwdAlgoWinograd,128x56x56x3x3x32x56x56x32xNCHWxFP16x1x1x1x1x1x1x1x1
96-56-56-1x1-128-56-56-32-0x0-1x1-1x1-0-NCHW-FP16-F=miopenConvolutionFwdAlgoImplicitGEMM:ConvHipImplicitGemmV4Fwd,0.30016,0,miopenConvolutionFwdAlgoImplicitGEMM,96x56x56x1x1x128x56x56x32xNCHWxFP16x0x0x1x1x1x1x1x1;miopenConvolutionFwdAlgoDirect:ConvAsm1x1U,0.27328,0,miopenConvolutionFwdAlgoDirect,<unused>;miopenConvolutionFwdAlgoGEMM:gemm,0.16336,0,rocBlas,<unused>;miopenConvolutionFwdAlgoWinograd:ConvBinWinogradRxS,0.71872,0,miopenConvolutionFwdAlgoWinograd,96x56x56x1x1x128x56x56x32xNCHWxFP16x0x0x1x1x1x1x1x1
128-56-56-1x1-128-56-56-32-0x0-1x1-1x1-0-NCHW-FP16-F=miopenConvolutionFwdAlgoImplicitGEMM:ConvHipImplicitGemmV4Fwd,0.32944,0,miopenConvolutionFwdAlgoImplicitGEMM,128x56x56x1x1x128x56x56x32xNCHWxFP16x0x0x1x1x1x1x1x1;miopenConvolutionFwdAlgoDirect:ConvAsm1x1U,0.32496,0,miopenConvolutionFwdAlgoDirect,<unused>;miopenConvolutionFwdAlgoGEMM:gemm,0.2088,0,rocBlas,<unused>;miopenConvolutionFwdAlgoWinograd:ConvBinWinogradRxS,0.923039,0,miopenConvolutionFwdAlgoWinograd,128x56x56x1x1x128x56x56x32xNCHWxFP16x0x0x1x1x1x1x1x1
160-56-56-1x1-128-56-56-32-0x0-1x1-1x1-0-NCHW-FP16-F=miopenConvolutionFwdAlgoImplicitGEMM:ConvHipImplicitGemmV4Fwd,0.3728,0,miopenConvolutionFwdAlgoImplicitGEMM,160x56x56x1x1x128x56x56x32xNCHWxFP16x0x0x1x1x1x1x1x1;miopenConvolutionFwdAlgoDirect:ConvAsm1x1U,0.39584,0,miopenConvolutionFwdAlgoDirect,<unused>;miopenConvolutionFwdAlgoGEMM:gemm,0.26064,0,rocBlas,<unused>;miopenConvolutionFwdAlgoWinograd:ConvBinWinogradRxS,1.1288,0,miopenConvolutionFwdAlgoWinograd,160x56x56x1x1x128x56x56x32xNCHWxFP16x0x0x1x1x1x1x1x1
192-56-56-1x1-128-56-56-32-0x0-1x1-1x1-0-NCHW-FP16-F=miopenConvolutionFwdAlgoImplicitGEMM:ConvHipImplicitGemmV4Fwd,0.42544,0,miopenConvolutionFwdAlgoImplicitGEMM,192x56x56x1x1x128x56x56x32xNCHWxFP16x0x0x1x1x1x1x1x1;miopenConvolutionFwdAlgoDirect:ConvAsm1x1U,0.44288,0,miopenConvolutionFwdAlgoDirect,<unused>;miopenConvolutionFwdAlgoGEMM:gemm,0.28528,0,rocBlas,<unused>;miopenConvolutionFwdAlgoWinograd:ConvBinWinogradRxS,1.3336,0,miopenConvolutionFwdAlgoWinograd,192x56x56x1x1x128x56x56x32xNCHWxFP16x0x0x1x1x1x1x1x1
224-56-56-1x1-128-56-56-32-0x0-1x1-1x1-0-NCHW-FP16-F=miopenConvolutionFwdAlgoImplicitGEMM:ConvHipImplicitGemmV4Fwd,0.46512,0,miopenConvolutionFwdAlgoImplicitGEMM,224x56x56x1x1x128x56x56x32xNCHWxFP16x0x0x1x1x1x1x1x1;miopenConvolutionFwdAlgoDirect:ConvAsm1x1U,0.54,0,miopenConvolutionFwdAlgoDirect,<unused>;miopenConvolutionFwdAlgoGEMM:gemm,0.35248,0,rocBlas,<unused>;miopenConvolutionFwdAlgoWinograd:ConvBinWinogradRxS,1.58864,0,miopenConvolutionFwdAlgoWinograd,224x56x56x1x1x128x56x56x32xNCHWxFP16x0x0x1x1x1x1x1x1
256-56-56-1x1-128-56-56-32-0x0-1x1-1x1-0-NCHW-FP16-F=miopenConvolutionFwdAlgoImplicitGEMM:ConvHipImplicitGemmV4Fwd,0.72976,0,miopenConvolutionFwdAlgoImplicitGEMM,256x56x56x1x1x128x56x56x32xNCHWxFP16x0x0x1x1x1x1x1x1;miopenConvolutionFwdAlgoDirect:ConvAsm1x1U,0.54032,0,miopenConvolutionFwdAlgoDirect,<unused>;miopenConvolutionFwdAlgoGEMM:gemm,0.36704,0,rocBlas,<unused>;miopenConvolutionFwdAlgoWinograd:ConvBinWinogradRxS,1.74608,0,miopenConvolutionFwdAlgoWinograd,256x56x56x1x1x128x56x56x32xNCHWxFP16x0x0x1x1x1x1x1x1
128-28-28-1x1-128-28-28-32-0x0-1x1-1x1-0-NCHW-FP16-F=miopenConvolutionFwdAlgoImplicitGEMM:ConvHipImplicitGemmV4Fwd,0.10768,0,miopenConvolutionFwdAlgoImplicitGEMM,128x28x28x1x1x128x28x28x32xNCHWxFP16x0x0x1x1x1x1x1x1;miopenConvolutionFwdAlgoDirect:ConvAsm1x1U,0.09776,0,miopenConvolutionFwdAlgoDirect,<unused>;miopenConvolutionFwdAlgoGEMM:gemm,0.14448,0,rocBlas,<unused>;miopenConvolutionFwdAlgoWinograd:ConvBinWinogradRxS,0.27968,0,miopenConvolutionFwdAlgoWinograd,128x28x28x1x1x128x28x28x32xNCHWxFP16x0x0x1x1x1x1x1x1
128-28-28-3x3-32-28-28-32-1x1-1x1-1x1-0-NCHW-FP16-F=miopenConvolutionFwdAlgoImplicitGEMM:ConvHipImplicitGemmV4R1Fwd,0.2456,0,miopenConvolutionFwdAlgoImplicitGEMM,128x28x28x3x3x32x28x28x32xNCHWxFP16x1x1x1x1x1x1x1x1;miopenConvolutionFwdAlgoDirect:ConvOclDirectFwd,0.56064,0,miopenConvolutionFwdAlgoDirect,<unused>;miopenConvolutionFwdAlgoGEMM:gemm,2.29376,1806336,rocBlas,<unused>;miopenConvolutionFwdAlgoWinograd:ConvBinWinogradRxS,0.09472,0,miopenConvolutionFwdAlgoWinograd,128x28x28x3x3x32x28x28x32xNCHWxFP16x1x1x1x1x1x1x1x1
160-28-28-1x1-128-28-28-32-0x0-1x1-1x1-0-NCHW-FP16-F=miopenConvolutionFwdAlgoImplicitGEMM:ConvHipImplicitGemmV4Fwd,0.11472,0,miopenConvolutionFwdAlgoImplicitGEMM,160x28x28x1x1x128x28x28x32xNCHWxFP16x0x0x1x1x1x1x1x1;miopenConvolutionFwdAlgoDirect:ConvOclDirectFwd1x1,0.21856,0,miopenConvolutionFwdAlgoDirect,<unused>;miopenConvolutionFwdAlgoGEMM:gemm,0.17136,0,rocBlas,<unused>;miopenConvolutionFwdAlgoWinograd:ConvBinWinogradRxS,0.33792,0,miopenConvolutionFwdAlgoWinograd,160x28x28x1x1x128x28x28x32xNCHWxFP16x0x0x1x1x1x1x1x1
192-28-28-1x1-128-28-28-32-0x0-1x1-1x1-0-NCHW-FP16-F=miopenConvolutionFwdAlgoImplicitGEMM:ConvHipImplicitGemmV4Fwd,0.13376,0,miopenConvolutionFwdAlgoImplicitGEMM,192x28x28x1x1x128x28x28x32xNCHWxFP16x0x0x1x1x1x1x1x1;miopenConvolutionFwdAlgoDirect:ConvAsm1x1U,0.12992,0,miopenConvolutionFwdAlgoDirect,<unused>;miopenConvolutionFwdAlgoGEMM:gemm,0.20112,0,rocBlas,<unused>;miopenConvolutionFwdAlgoWinograd:ConvBinWinogradRxS,0.45504,0,miopenConvolutionFwdAlgoWinograd,192x28x28x1x1x128x28x28x32xNCHWxFP16x0x0x1x1x1x1x1x1
224-28-28-1x1-128-28-28-32-0x0-1x1-1x1-0-NCHW-FP16-F=miopenConvolutionFwdAlgoImplicitGEMM:ConvHipImplicitGemmV4Fwd,0.14928,0,miopenConvolutionFwdAlgoImplicitGEMM,224x28x28x1x1x128x28x28x32xNCHWxFP16x0x0x1x1x1x1x1x1;miopenConvolutionFwdAlgoDirect:ConvAsm1x1U,0.14592,0,miopenConvolutionFwdAlgoDirect,<unused>;miopenConvolutionFwdAlgoGEMM:gemm,0.2272,0,rocBlas,<unused>;miopenConvolutionFwdAlgoWinograd:ConvBinWinogradRxS,0.45904,0,miopenConvolutionFwdAlgoWinograd,224x28x28x1x1x128x28x28x32xNCHWxFP16x0x0x1x1x1x1x1x1
256-28-28-1x1-128-28-28-32-0x0-1x1-1x1-0-NCHW-FP16-F=miopenConvolutionFwdAlgoImplicitGEMM:ConvHipImplicitGemmV4Fwd,0.1824,0,miopenConvolutionFwdAlgoImplicitGEMM,256x28x28x1x1x128x28x28x32xNCHWxFP16x0x0x1x1x1x1x1x1;miopenConvolutionFwdAlgoDirect:ConvAsm1x1U,0.15872,0,miopenConvolutionFwdAlgoDirect,<unused>;miopenConvolutionFwdAlgoGEMM:gemm,0.25616,0,rocBlas,<unused>;miopenConvolutionFwdAlgoWinograd:ConvBinWinogradRxS,0.52128,0,miopenConvolutionFwdAlgoWinograd,256x28x28x1x1x128x28x28x32xNCHWxFP16x0x0x1x1x1x1x1x1
288-28-28-1x1-128-28-28-32-0x0-1x1-1x1-0-NCHW-FP16-F=miopenConvolutionFwdAlgoImplicitGEMM:ConvHipImplicitGemmV4Fwd,0.17232,0,miopenConvolutionFwdAlgoImplicitGEMM,288x28x28x1x1x128x28x28x32xNCHWxFP16x0x0x1x1x1x1x1x1;miopenConvolutionFwdAlgoDirect:ConvAsm1x1U,0.19952,0,miopenConvolutionFwdAlgoDirect,<unused>;miopenConvolutionFwdAlgoGEMM:gemm,0.28336,0,rocBlas,<unused>;miopenConvolutionFwdAlgoWinograd:ConvBinWinogradRxS,0.65936,0,miopenConvolutionFwdAlgoWinograd,288x28x28x1x1x128x28x28x32xNCHWxFP16x0x0x1x1x1x1x1x1
320-28-28-1x1-128-28-28-32-0x0-1x1-1x1-0-NCHW-FP16-F=miopenConvolutionFwdAlgoImplicitGEMM:ConvHipImplicitGemmV4Fwd,0.2056,0,miopenConvolutionFwdAlgoImplicitGEMM,320x28x28x1x1x128x28x28x32xNCHWxFP16x0x0x1x1x1x1x1x1;miopenConvolutionFwdAlgoDirect:ConvAsm1x1U,0.19152,0,miopenConvolutionFwdAlgoDirect,<unused>;miopenConvolutionFwdAlgoGEMM:gemm,0.30928,0,rocBlas,<unused>;miopenConvolutionFwdAlgoWinograd:ConvBinWinogradRxS,0.64,0,miopenConvolutionFwdAlgoWinograd,320x28x28x1x1x128x28x28x32xNCHWxFP16x0x0x1x1x1x1x1x1
352-28-28-1x1-128-28-28-32-0x0-1x1-1x1-0-NCHW-FP16-F=miopenConvolutionFwdAlgoImplicitGEMM:ConvHipImplicitGemmV4Fwd,0.2016,0,miopenConvolutionFwdAlgoImplicitGEMM,352x28x28x1x1x128x28x28x32xNCHWxFP16x0x0x1x1x1x1x1x1;miopenConvolutionFwdAlgoDirect:ConvAsm1x1U,0.21936,0,miopenConvolutionFwdAlgoDirect,<unused>;miopenConvolutionFwdAlgoGEMM:gemm,0.35328,0,rocBlas,<unused>;miopenConvolutionFwdAlgoWinograd:ConvBinWinogradRxS,0.70224,0,miopenConvolutionFwdAlgoWinograd,352x28x28x1x1x128x28x28x32xNCHWxFP16x0x0x1x1x1x1x1x1
384-28-28-1x1-128-28-28-32-0x0-1x1-1x1-0-NCHW-FP16-F=miopenConvolutionFwdAlgoImplicitGEMM:ConvHipImplicitGemmV4Fwd,0.2312,0,miopenConvolutionFwdAlgoImplicitGEMM,384x28x28x1x1x128x28x28x32xNCHWxFP16x0x0x1x1x1x1x1x1;miopenConvolutionFwdAlgoDirect:ConvAsm1x1U,0.26016,0,miopenConvolutionFwdAlgoDirect,<unused>;miopenConvolutionFwdAlgoGEMM:gemm,0.18736,0,rocBlas,<unused>;miopenConvolutionFwdAlgoWinograd:ConvBinWinogradRxS,0.7616,0,miopenConvolutionFwdAlgoWinograd,384x28x28x1x1x128x28x28x32xNCHWxFP16x0x0x1x1x1x1x1x1
416-28-28-1x1-128-28-28-32-0x0-1x1-1x1-0-NCHW-FP16-F=miopenConvolutionFwdAlgoImplicitGEMM:ConvHipImplicitGemmV4Fwd,0.24464,0,miopenConvolutionFwdAlgoImplicitGEMM,416x28x28x1x1x128x28x28x32xNCHWxFP16x0x0x1x1x1x1x1x1;miopenConvolutionFwdAlgoDirect:ConvAsm1x1U,0.25648,0,miopenConvolutionFwdAlgoDirect,<unused>;miopenConvolutionFwdAlgoGEMM:gemm,0.2032,0,rocBlas,<unused>;miopenConvolutionFwdAlgoWinograd:ConvBinWinogradRxS,0.986559,0,miopenConvolutionFwdAlgoWinograd,416x28x28x1x1x128x28x28x32xNCHWxFP16x0x0x1x1x1x1x1x1
448-28-28-1x1-128-28-28-32-0x0-1x1-1x1-0-NCHW-FP16-F=miopenConvolutionFwdAlgoImplicitGEMM:ConvHipImplicitGemmV4Fwd,0.25008,0,miopenConvolutionFwdAlgoImplicitGEMM,448x28x28x1x1x128x28x28x32xNCHWxFP16x0x0x1x1x1x1x1x1;miopenConvolutionFwdAlgoDirect:ConvAsm1x1U,0.27072,0,miopenConvolutionFwdAlgoDirect,<unused>;miopenConvolutionFwdAlgoGEMM:gemm,0.216,0,rocBlas,<unused>;miopenConvolutionFwdAlgoWinograd:ConvBinWinogradRxS,0.883359,0,miopenConvolutionFwdAlgoWinograd,448x28x28x1x1x128x28x28x32xNCHWxFP16x0x0x1x1x1x1x1x1
480-28-28-1x1-128-28-28-32-0x0-1x1-1x1-0-NCHW-FP16-F=miopenConvolutionFwdAlgoImplicitGEMM:ConvHipImplicitGemmV4Fwd,0.26384,0,miopenConvolutionFwdAlgoImplicitGEMM,480x28x28x1x1x128x28x28x32xNCHWxFP16x0x0x1x1x1x1x1x1;miopenConvolutionFwdAlgoDirect:ConvAsm1x1U,0.29792,0,miopenConvolutionFwdAlgoDirect,<unused>;miopenConvolutionFwdAlgoGEMM:gemm,0.23168,0,rocBlas,<unused>;miopenConvolutionFwdAlgoWinograd:ConvBinWinogradRxS,1.00416,0,miopenConvolutionFwdAlgoWinograd,480x28x28x1x1x128x28x28x32xNCHWxFP16x0x0x1x1x1x1x1x1
512-28-28-1x1-256-28-28-32-0x0-1x1-1x1-0-NCHW-FP16-F=miopenConvolutionFwdAlgoImplicitGEMM:ConvHipImplicitGemmV4Fwd,0.799679,0,miopenConvolutionFwdAlgoImplicitGEMM,512x28x28x1x1x256x28x28x32xNCHWxFP16x0x0x1x1x1x1x1x1;miopenConvolutionFwdAlgoDirect:ConvAsm1x1U,0.68896,0,miopenConvolutionFwdAlgoDirect,<unused>;miopenConvolutionFwdAlgoGEMM:gemm,0.46496,0,rocBlas,<unused>;miopenConvolutionFwdAlgoWinograd:ConvBinWinogradRxS,1.89872,0,miopenConvolutionFwdAlgoWinograd,512x28x28x1x1x256x28x28x32xNCHWxFP16x0x0x1x1x1x1x1x1
256-14-14-1x1-128-14-14-32-0x0-1x1-1x1-0-NCHW-FP16-F=miopenConvolutionFwdAlgoImplicitGEMM:ConvHipImplicitGemmV4Fwd,0.05632,0,miopenConvolutionFwdAlgoImplicitGEMM,256x14x14x1x1x128x14x14x32xNCHWxFP16x0x0x1x1x1x1x1x1;miopenConvolutionFwdAlgoDirect:ConvAsm1x1U,0.07776,0,miopenConvolutionFwdAlgoDirect,<unused>;miopenConvolutionFwdAlgoGEMM:gemm,0.21488,0,rocBlas,<unused>;miopenConvolutionFwdAlgoWinograd:ConvBinWinogradRxS,0.18864,0,miopenConvolutionFwdAlgoWinograd,256x14x14x1x1x128x14x14x32xNCHWxFP16x0x0x1x1x1x1x1x1
128-14-14-3x3-32-14-14-32-1x1-1x1-1x1-0-NCHW-FP16-F=miopenConvolutionFwdAlgoImplicitGEMM:ConvHipImplicitGemmV4R1Fwd,0.13744,0,miopenConvolutionFwdAlgoImplicitGEMM,128x14x14x3x3x32x14x14x32xNCHWxFP16x1x1x1x1x1x1x1x1;miopenConvolutionFwdAlgoDirect:ConvOclDirectFwd,0.24096,0,miopenConvolutionFwdAlgoDirect,<unused>;miopenConvolutionFwdAlgoGEMM:gemm,2.49344,451584,rocBlas,<unused>;miopenConvolutionFwdAlgoWinograd:ConvBinWinogradRxS,0.04416,0,miopenConvolutionFwdAlgoWinograd,128x14x14x3x3x32x14x14x32xNCHWxFP16x1x1x1x1x1x1x1x1
288-14-14-1x1-128-14-14-32-0x0-1x1-1x1-0-NCHW-FP16-F=miopenConvolutionFwdAlgoImplicitGEMM:ConvHipImplicitGemmV4Fwd,0.05632,0,miopenConvolutionFwdAlgoImplicitGEMM,288x14x14x1x1x128x14x14x32xNCHWxFP16x0x0x1x1x1x1x1x1;miopenConvolutionFwdAlgoDirect:ConvAsm1x1U,0.10064,0,miopenConvolutionFwdAlgoDirect,<unused>;miopenConvolutionFwdAlgoGEMM:gemm,0.27376,0,rocBlas,<unused>;miopenConvolutionFwdAlgoWinograd:ConvBinWinogradRxS,0.20496,0,miopenConvolutionFwdAlgoWinograd,288x14x14x1x1x128x14x14x32xNCHWxFP16x0x0x1x1x1x1x1x1
320-14-14-1x1-128-14-14-32-0x0-1x1-1x1-0-NCHW-FP16-F=miopenConvolutionFwdAlgoImplicitGEMM:ConvHipImplicitGemmV4Fwd,0.05888,0,miopenConvolutionFwdAlgoImplicitGEMM,320x14x14x1x1x128x14x14x32xNCHWxFP16x0x0x1x1x1x1x1x1;miopenConvolutionFwdAlgoDirect:ConvAsm1x1U,0.10928,0,miopenConvolutionFwdAlgoDirect,<unused>;miopenConvolutionFwdAlgoGEMM:gemm,0.25696,0,rocBlas,<unused>;miopenConvolutionFwdAlgoWinograd:ConvBinWinogradRxS,0.26704,0,miopenConvolutionFwdAlgoWinograd,320x14x14x1x1x128x14x14x32xNCHWxFP16x0x0x1x1x1x1x1x1
352-14-14-1x1-128-14-14-32-0x0-1x1-1x1-0-NCHW-FP16-F=miopenConvolutionFwdAlgoImplicitGEMM:ConvHipImplicitGemmV4Fwd,0.0624,0,miopenConvolutionFwdAlgoImplicitGEMM,352x14x14x1x1x128x14x14x32xNCHWxFP16x0x0x1x1x1x1x1x1;miopenConvolutionFwdAlgoDirect:ConvAsm1x1U,0.1192,0,miopenConvolutionFwdAlgoDirect,<unused>;miopenConvolutionFwdAlgoGEMM:gemm,0.3176,0,rocBlas,<unused>;miopenConvolutionFwdAlgoWinograd:ConvBinWinogradRxS,0.2912,0,miopenConvolutionFwdAlgoWinograd,352x14x14x1x1x128x14x14x32xNCHWxFP16x0x0x1x1x1x1x1x1
384-14-14-1x1-128-14-14-32-0x0-1x1-1x1-0-NCHW-FP16-F=miopenConvolutionFwdAlgoImplicitGEMM:ConvHipImplicitGemmV4Fwd,0.07248,0,miopenConvolutionFwdAlgoImplicitGEMM,384x14x14x1x1x128x14x14x32xNCHWxFP16x0x0x1x1x1x1x1x1;miopenConvolutionFwdAlgoDirect:ConvAsm1x1U,0.12704,0,miopenConvolutionFwdAlgoDirect,<unused>;miopenConvolutionFwdAlgoGEMM:gemm,0.2992,0,rocBlas,<unused>;miopenConvolutionFwdAlgoWinograd:ConvBinWinogradRxS,0.26624,0,miopenConvolutionFwdAlgoWinograd,384x14x14x1x1x128x14x14x32xNCHWxFP16x0x0x1x1x1x1x1x1
416-14-14-1x1-128-14-14-32-0x0-1x1-1x1-0-NCHW-FP16-F=miopenConvolutionFwdAlgoImplicitGEMM:ConvHipImplicitGemmV4Fwd,0.07216,0,miopenConvolutionFwdAlgoImplicitGEMM,416x14x14x1x1x128x14x14x32xNCHWxFP16x0x0x1x1x1x1x1x1;miopenConvolutionFwdAlgoDirect:ConvAsm1x1U,0.13744,0,miopenConvolutionFwdAlgoDirect,<unused>;miopenConvolutionFwdAlgoGEMM:gemm,0.35696,0,rocBlas,<unused>;miopenConvolutionFwdAlgoWinograd:ConvBinWinogradRxS,0.28448,0,miopenConvolutionFwdAlgoWinograd,416x14x14x1x1x128x14x14x32xNCHWxFP16x0x0x1x1x1x1x1x1
448-14-14-1x1-128-14-14-32-0x0-1x1-1x1-0-NCHW-FP16-F=miopenConvolutionFwdAlgoImplicitGEMM:ConvHipImplicitGemmV4Fwd,0.07632,0,miopenConvolutionFwdAlgoImplicitGEMM,448x14x14x1x1x128x14x14x32xNCHWxFP16x0x0x1x1x1x1x1x1;miopenConvolutionFwdAlgoDirect:ConvAsm1x1U,0.14592,0,miopenConvolutionFwdAlgoDirect,<unused>;miopenConvolutionFwdAlgoGEMM:gemm,0.34176,0,rocBlas,<unused>;miopenConvolutionFwdAlgoWinograd:ConvBinWinogradRxS,0.36752,0,miopenConvolutionFwdAlgoWinograd,448x14x14x1x1x128x14x14x32xNCHWxFP16x0x0x1x1x1x1x1x1
480-14-14-1x1-128-14-14-32-0x0-1x1-1x1-0-NCHW-FP16-F=miopenConvolutionFwdAlgoImplicitGEMM:ConvHipImplicitGemmV4Fwd,0.07904,0,miopenConvolutionFwdAlgoImplicitGEMM,480x14x14x1x1x128x14x14x32xNCHWxFP16x0x0x1x1x1x1x1x1;miopenConvolutionFwdAlgoDirect:ConvAsm1x1U,0.156,0,miopenConvolutionFwdAlgoDirect,<unused>;miopenConvolutionFwdAlgoGEMM:gemm,0.39904,0,rocBlas,<unused>;miopenConvolutionFwdAlgoWinograd:ConvBinWinogradRxS,0.32256,0,miopenConvolutionFwdAlgoWinograd,480x14x14x1x1x128x14x14x32xNCHWxFP16x0x0x1x1x1x1x1x1
512-14-14-1x1-128-14-14-32-0x0-1x1-1x1-0-NCHW-FP16-F=miopenConvolutionFwdAlgoImplicitGEMM:ConvHipImplicitGemmV4Fwd,0.1104,0,miopenConvolutionFwdAlgoImplicitGEMM,512x14x14x1x1x128x14x14x32xNCHWxFP16x0x0x1x1x1x1x1x1;miopenConvolutionFwdAlgoDirect:ConvAsm1x1U,0.12656,0,miopenConvolutionFwdAlgoDirect,<unused>;miopenConvolutionFwdAlgoGEMM:gemm,0.39376,0,rocBlas,<unused>;miopenConvolutionFwdAlgoWinograd:ConvBinWinogradRxS,0.3464,0,miopenConvolutionFwdAlgoWinograd,512x14x14x1x1x128x14x14x32xNCHWxFP16x0x0x1x1x1x1x1x1
544-14-14-1x1-128-14-14-32-0x0-1x1-1x1-0-NCHW-FP16-F=miopenConvolutionFwdAlgoImplicitGEMM:ConvHipImplicitGemmV4Fwd,0.08864,0,miopenConvolutionFwdAlgoImplicitGEMM,544x14x14x1x1x128x14x14x32xNCHWxFP16x0x0x1x1x1x1x1x1;miopenConvolutionFwdAlgoDirect:ConvAsm1x1U,0.176,0,miopenConvolutionFwdAlgoDirect,<unused>;miopenConvolutionFwdAlgoGEMM:gemm,0.4408,0,rocBlas,<unused>;miopenConvolutionFwdAlgoWinograd:ConvBinWinogradRxS,0.36192,0,miopenConvolutionFwdAlgoWinograd,544x14x14x1x1x128x14x14x32xNCHWxFP16x0x0x1x1x1x1x1x1
576-14-14-1x1-128-14-14-32-0x0-1x1-1x1-0-NCHW-FP16-F=miopenConvolutionFwdAlgoImplicitGEMM:ConvHipImplicitGemmV4Fwd,0.09472,0,miopenConvolutionFwdAlgoImplicitGEMM,576x14x14x1x1x128x14x14x32xNCHWxFP16x0x0x1x1x1x1x1x1;miopenConvolutionFwdAlgoDirect:ConvAsm1x1U,0.15056,0,miopenConvolutionFwdAlgoDirect,<unused>;miopenConvolutionFwdAlgoGEMM:gemm,0.43824,0,rocBlas,<unused>;miopenConvolutionFwdAlgoWinograd:ConvBinWinogradRxS,0.38192,0,miopenConvolutionFwdAlgoWinograd,576x14x14x1x1x128x14x14x32xNCHWxFP16x0x0x1x1x1x1x1x1
608-14-14-1x1-128-14-14-32-0x0-1x1-1x1-0-NCHW-FP16-F=miopenConvolutionFwdAlgoImplicitGEMM:ConvHipImplicitGemmV4Fwd,0.0992,0,miopenConvolutionFwdAlgoImplicitGEMM,608x14x14x1x1x128x14x14x32xNCHWxFP16x0x0x1x1x1x1x1x1;miopenConvolutionFwdAlgoDirect:ConvAsm1x1U,0.1896,0,miopenConvolutionFwdAlgoDirect,<unused>;miopenConvolutionFwdAlgoGEMM:gemm,0.11328,0,rocBlas,<unused>;miopenConvolutionFwdAlgoWinograd:ConvBinWinogradRxS,0.40176,0,miopenConvolutionFwdAlgoWinograd,608x14x14x1x1x128x14x14x32xNCHWxFP16x0x0x1x1x1x1x1x1
640-14-14-1x1-128-14-14-32-0x0-1x1-1x1-0-NCHW-FP16-F=miopenConvolutionFwdAlgoImplicitGEMM:ConvHipImplicitGemmV4Fwd,0.11008,0,miopenConvolutionFwdAlgoImplicitGEMM,640x14x14x1x1x128x14x14x32xNCHWxFP16x0x0x1x1x1x1x1x1;miopenConvolutionFwdAlgoDirect:ConvAsm1x1U,0.17216,0,miopenConvolutionFwdAlgoDirect,<unused>;miopenConvolutionFwdAlgoGEMM:gemm,0.12096,0,rocBlas,<unused>;miopenConvolutionFwdAlgoWinograd:ConvBinWinogradRxS,0.51456,0,miopenConvolutionFwdAlgoWinograd,640x14x14x1x1x128x14x14x32xNCHWxFP16x0x0x1x1x1x1x1x1
672-14-14-1x1-128-14-14-32-0x0-1x1-1x1-0-NCHW-FP16-F=miopenConvolutionFwdAlgoImplicitGEMM:ConvHipImplicitGemmV4Fwd,0.1088,0,miopenConvolutionFwdAlgoImplicitGEMM,672x14x14x1x1x128x14x14x32xNCHWxFP16x0x0x1x1x1x1x1x1;miopenConvolutionFwdAlgoDirect:ConvAsm1x1U,0.212,0,miopenConvolutionFwdAlgoDirect,<unused>;miopenConvolutionFwdAlgoGEMM:gemm,0.12368,0,rocBlas,<unused>;miopenConvolutionFwdAlgoWinograd:ConvBinWinogradRxS,0.44176,0,miopenConvolutionFwdAlgoWinograd,672x14x14x1x1x128x14x14x32xNCHWxFP16x0x0x1x1x1x1x1x1
704-14-14-1x1-128-14-14-32-0x0-1x1-1x1-0-NCHW-FP16-F=miopenConvolutionFwdAlgoImplicitGEMM:ConvHipImplicitGemmV4Fwd,0.1136,0,miopenConvolutionFwdAlgoImplicitGEMM,704x14x14x1x1x128x14x14x32xNCHWxFP16x0x0x1x1x1x1x1x1;miopenConvolutionFwdAlgoDirect:ConvAsm1x1U,0.22,0,miopenConvolutionFwdAlgoDirect,<unused>;miopenConvolutionFwdAlgoGEMM:gemm,0.15392,0,rocBlas,<unused>;miopenConvolutionFwdAlgoWinograd:ConvBinWinogradRxS,0.46048,0,miopenConvolutionFwdAlgoWinograd,704x14x14x1x1x128x14x14x32xNCHWxFP16x0x0x1x1x1x1x1x1
736-14-14-1x1-128-14-14-32-0x0-1x1-1x1-0-NCHW-FP16-F=miopenConvolutionFwdAlgoImplicitGEMM:ConvHipImplicitGemmV4Fwd,0.11712,0,miopenConvolutionFwdAlgoImplicitGEMM,736x14x14x1x1x128x14x14x32xNCHWxFP16x0x0x1x1x1x1x1x1;miopenConvolutionFwdAlgoDirect:ConvAsm1x1U,0.19616,0,miopenConvolutionFwdAlgoDirect,<unused>;miopenConvolutionFwdAlgoGEMM:gemm,0.16832,0,rocBlas,<unused>;miopenConvolutionFwdAlgoWinograd:ConvBinWinogradRxS,0.57952,0,miopenConvolutionFwdAlgoWinograd,736x14x14x1x1x128x14x14x32xNCHWxFP16x0x0x1x1x1x1x1x1
768-14-14-1x1-128-14-14-32-0x0-1x1-1x1-0-NCHW-FP16-F=miopenConvolutionFwdAlgoImplicitGEMM:ConvHipImplicitGemmV4Fwd,0.152,0,miopenConvolutionFwdAlgoImplicitGEMM,768x14x14x1x1x128x14x14x32xNCHWxFP16x0x0x1x1x1x1x1x1;miopenConvolutionFwdAlgoDirect:ConvAsm1x1U,0.20496,0,miopenConvolutionFwdAlgoDirect,<unused>;miopenConvolutionFwdAlgoGEMM:gemm,0.16496,0,rocBlas,<unused>;miopenConvolutionFwdAlgoWinograd:ConvBinWinogradRxS,0.5024,0,miopenConvolutionFwdAlgoWinograd,768x14x14x1x1x128x14x14x32xNCHWxFP16x0x0x1x1x1x1x1x1
800-14-14-1x1-128-14-14-32-0x0-1x1-1x1-0-NCHW-FP16-F=miopenConvolutionFwdAlgoImplicitGEMM:ConvHipImplicitGemmV4Fwd,0.12592,0,miopenConvolutionFwdAlgoImplicitGEMM,800x14x14x1x1x128x14x14x32xNCHWxFP16x0x0x1x1x1x1x1x1;miopenConvolutionFwdAlgoDirect:ConvAsm1x1U,0.24944,0,miopenConvolutionFwdAlgoDirect,<unused>;miopenConvolutionFwdAlgoGEMM:gemm,0.17168,0,rocBlas,<unused>;miopenConvolutionFwdAlgoWinograd:ConvBinWinogradRxS,0.51904,0,miopenConvolutionFwdAlgoWinograd,800x14x14x1x1x128x14x14x32xNCHWxFP16x0x0x1x1x1x1x1x1
832-14-14-1x1-128-14-14-32-0x0-1x1-1x1-0-NCHW-FP16-F=miopenConvolutionFwdAlgoImplicitGEMM:ConvHipImplicitGemmV4Fwd,0.13152,0,miopenConvolutionFwdAlgoImplicitGEMM,832x14x14x1x1x128x14x14x32xNCHWxFP16x0x0x1x1x1x1x1x1;miopenConvolutionFwdAlgoDirect:ConvAsm1x1U,0.22016,0,miopenConvolutionFwdAlgoDirect,<unused>;miopenConvolutionFwdAlgoGEMM:gemm,0.17968,0,rocBlas,<unused>;miopenConvolutionFwdAlgoWinograd:ConvBinWinogradRxS,0.53936,0,miopenConvolutionFwdAlgoWinograd,832x14x14x1x1x128x14x14x32xNCHWxFP16x0x0x1x1x1x1x1x1
864-14-14-1x1-128-14-14-32-0x0-1x1-1x1-0-NCHW-FP16-F=miopenConvolutionFwdAlgoImplicitGEMM:ConvHipImplicitGemmV4Fwd,0.1336,0,miopenConvolutionFwdAlgoImplicitGEMM,864x14x14x1x1x128x14x14x32xNCHWxFP16x0x0x1x1x1x1x1x1;miopenConvolutionFwdAlgoDirect:ConvAsm1x1U,0.23024,0,miopenConvolutionFwdAlgoDirect,<unused>;miopenConvolutionFwdAlgoGEMM:gemm,0.1848,0,rocBlas,<unused>;miopenConvolutionFwdAlgoWinograd:ConvBinWinogradRxS,0.5592,0,miopenConvolutionFwdAlgoWinograd,864x14x14x1x1x128x14x14x32xNCHWxFP16x0x0x1x1x1x1x1x1
896-14-14-1x1-128-14-14-32-0x0-1x1-1x1-0-NCHW-FP16-F=miopenConvolutionFwdAlgoImplicitGEMM:ConvHipImplicitGemmV4Fwd,0.15184,0,miopenConvolutionFwdAlgoImplicitGEMM,896x14x14x1x1x128x14x14x32xNCHWxFP16x0x0x1x1x1x1x1x1;miopenConvolutionFwdAlgoDirect:ConvAsm1x1U,0.23728,0,miopenConvolutionFwdAlgoDirect,<unused>;miopenConvolutionFwdAlgoGEMM:gemm,0.20224,0,rocBlas,<unused>;miopenConvolutionFwdAlgoWinograd:ConvBinWinogradRxS,0.69808,0,miopenConvolutionFwdAlgoWinograd,896x14x14x1x1x128x14x14x32xNCHWxFP16x0x0x1x1x1x1x1x1
928-14-14-1x1-128-14-14-32-0x0-1x1-1x1-0-NCHW-FP16-F=miopenConvolutionFwdAlgoImplicitGEMM:ConvHipImplicitGemmV4Fwd,0.144,0,miopenConvolutionFwdAlgoImplicitGEMM,928x14x14x1x1x128x14x14x32xNCHWxFP16x0x0x1x1x1x1x1x1;miopenConvolutionFwdAlgoDirect:ConvAsm1x1U,0.23472,0,miopenConvolutionFwdAlgoDirect,<unused>;miopenConvolutionFwdAlgoGEMM:gemm,0.20608,0,rocBlas,<unused>;miopenConvolutionFwdAlgoWinograd:ConvBinWinogradRxS,0.62992,0,miopenConvolutionFwdAlgoWinograd,928x14x14x1x1x128x14x14x32xNCHWxFP16x0x0x1x1x1x1x1x1
960-14-14-1x1-128-14-14-32-0x0-1x1-1x1-0-NCHW-FP16-F=miopenConvolutionFwdAlgoImplicitGEMM:ConvHipImplicitGemmV4Fwd,0.15104,0,miopenConvolutionFwdAlgoImplicitGEMM,960x14x14x1x1x128x14x14x32xNCHWxFP16x0x0x1x1x1x1x1x1;miopenConvolutionFwdAlgoDirect:ConvAsm1x1U,0.25184,0,miopenConvolutionFwdAlgoDirect,<unused>;miopenConvolutionFwdAlgoGEMM:gemm,0.2136,0,rocBlas,<unused>;miopenConvolutionFwdAlgoWinograd:ConvBinWinogradRxS,0.74032,0,miopenConvolutionFwdAlgoWinograd,960x14x14x1x1x128x14x14x32xNCHWxFP16x0x0x1x1x1x1x1x1
992-14-14-1x1-128-14-14-32-0x0-1x1-1x1-0-NCHW-FP16-F=miopenConvolutionFwdAlgoImplicitGEMM:ConvHipImplicitGemmV4Fwd,0.15536,0,miopenConvolutionFwdAlgoImplicitGEMM,992x14x14x1x1x128x14x14x32xNCHWxFP16x0x0x1x1x1x1x1x1;miopenConvolutionFwdAlgoDirect:ConvAsm1x1U,0.25824,0,miopenConvolutionFwdAlgoDirect,<unused>;miopenConvolutionFwdAlgoGEMM:gemm,0.21056,0,rocBlas,<unused>;miopenConvolutionFwdAlgoWinograd:ConvBinWinogradRxS,0.63792,0,miopenConvolutionFwdAlgoWinograd,992x14x14x1x1x128x14x14x32xNCHWxFP16x0x0x1x1x1x1x1x1
1024-14-14-1x1-512-14-14-32-0x0-1x1-1x1-0-NCHW-FP16-F=miopenConvolutionFwdAlgoImplicitGEMM:ConvHipImplicitGemmV4Fwd,0.6856,0,miopenConvolutionFwdAlgoImplicitGEMM,1024x14x14x1x1x512x14x14x32xNCHWxFP16x0x0x1x1x1x1x1x1;miopenConvolutionFwdAlgoDirect:ConvAsm1x1U,0.70592,0,miopenConvolutionFwdAlgoDirect,<unused>;miopenConvolutionFwdAlgoGEMM:gemm,0.59024,0,rocBlas,<unused>;miopenConvolutionFwdAlgoWinograd:ConvBinWinogradRxS,2.25408,0,miopenConvolutionFwdAlgoWinograd,1024x14x14x1x1x512x14x14x32xNCHWxFP16x0x0x1x1x1x1x1x1
512-7-7-1x1-128-7-7-32-0x0-1x1-1x1-0-NCHW-FP16-F=miopenConvolutionFwdAlgoImplicitGEMM:ConvHipImplicitGemmV4R1Fwd,0.05632,0,miopenConvolutionFwdAlgoImplicitGEMM,512x7x7x1x1x128x7x7x32xNCHWxFP16x0x0x1x1x1x1x1x1;miopenConvolutionFwdAlgoDirect:ConvAsm1x1U,0.0568,0,miopenConvolutionFwdAlgoDirect,<unused>;miopenConvolutionFwdAlgoGEMM:gemm,0.14032,0,rocBlas,<unused>;miopenConvolutionFwdAlgoWinograd:ConvBinWinogradRxS,0.19024,0,miopenConvolutionFwdAlgoWinograd,512x7x7x1x1x128x7x7x32xNCHWxFP16x0x0x1x1x1x1x1x1
128-7-7-3x3-32-7-7-32-1x1-1x1-1x1-0-NCHW-FP16-F=miopenConvolutionFwdAlgoImplicitGEMM:ConvHipImplicitGemmV4R1Fwd,0.11984,0,miopenConvolutionFwdAlgoImplicitGEMM,128x7x7x3x3x32x7x7x32xNCHWxFP16x1x1x1x1x1x1x1x1;miopenConvolutionFwdAlgoDirect:ConvOclDirectFwd,0.096,0,miopenConvolutionFwdAlgoDirect,<unused>;miopenConvolutionFwdAlgoGEMM:gemm,6.29248,112896,rocBlas,<unused>;miopenConvolutionFwdAlgoWinograd:ConvBinWinogradRxS,0.04032,0,miopenConvolutionFwdAlgoWinograd,128x7x7x3x3x32x7x7x32xNCHWxFP16x1x1x1x1x1x1x1x1
544-7-7-1x1-128-7-7-32-0x0-1x1-1x1-0-NCHW-FP16-F=miopenConvolutionFwdAlgoImplicitGEMM:ConvHipImplicitGemmV4R1Fwd,0.05248,0,miopenConvolutionFwdAlgoImplicitGEMM,544x7x7x1x1x128x7x7x32xNCHWxFP16x0x0x1x1x1x1x1x1;miopenConvolutionFwdAlgoDirect:ConvAsm1x1U,0.0896,0,miopenConvolutionFwdAlgoDirect,<unused>;miopenConvolutionFwdAlgoGEMM:gemm,0.1512,0,rocBlas,<unused>;miopenConvolutionFwdAlgoWinograd:ConvBinWinogradRxS,0.2016,0,miopenConvolutionFwdAlgoWinograd,544x7x7x1x1x128x7x7x32xNCHWxFP16x0x0x1x1x1x1x1x1
576-7-7-1x1-128-7-7-32-0x0-1x1-1x1-0-NCHW-FP16-F=miopenConvolutionFwdAlgoImplicitGEMM:ConvHipImplicitGemmV4R1Fwd,0.05472,0,miopenConvolutionFwdAlgoImplicitGEMM,576x7x7x1x1x128x7x7x32xNCHWxFP16x0x0x1x1x1x1x1x1;miopenConvolutionFwdAlgoDirect:ConvAsm1x1U,0.06464,0,miopenConvolutionFwdAlgoDirect,<unused>;miopenConvolutionFwdAlgoGEMM:gemm,0.15856,0,rocBlas,<unused>;miopenConvolutionFwdAlgoWinograd:ConvBinWinogradRxS,0.2088,0,miopenConvolutionFwdAlgoWinograd,576x7x7x1x1x128x7x7x32xNCHWxFP16x0x0x1x1x1x1x1x1
608-7-7-1x1-128-7-7-32-0x0-1x1-1x1-0-NCHW-FP16-F=miopenConvolutionFwdAlgoImplicitGEMM:ConvHipImplicitGemmV4R1Fwd,0.0568,0,miopenConvolutionFwdAlgoImplicitGEMM,608x7x7x1x1x128x7x7x32xNCHWxFP16x0x0x1x1x1x1x1x1;miopenConvolutionFwdAlgoDirect:ConvAsm1x1U,0.06624,0,miopenConvolutionFwdAlgoDirect,<unused>;miopenConvolutionFwdAlgoGEMM:gemm,0.16896,0,rocBlas,<unused>;miopenConvolutionFwdAlgoWinograd:ConvBinWinogradRxS,0.26192,0,miopenConvolutionFwdAlgoWinograd,608x7x7x1x1x128x7x7x32xNCHWxFP16x0x0x1x1x1x1x1x1
640-7-7-1x1-128-7-7-32-0x0-1x1-1x1-0-NCHW-FP16-F=miopenConvolutionFwdAlgoImplicitGEMM:ConvHipImplicitGemmV4R1Fwd,0.06016,0,miopenConvolutionFwdAlgoImplicitGEMM,640x7x7x1x1x128x7x7x32xNCHWxFP16x0x0x1x1x1x1x1x1;miopenConvolutionFwdAlgoDirect:ConvAsm1x1U,0.06176,0,miopenConvolutionFwdAlgoDirect,<unused>;miopenConvolutionFwdAlgoGEMM:gemm,0.1752,0,rocBlas,<unused>;miopenConvolutionFwdAlgoWinograd:ConvBinWinogradRxS,0.23024,0,miopenConvolutionFwdAlgoWinograd,640x7x7x1x1x128x7x7x32xNCHWxFP16x0x0x1x1x1x1x1x1
672-7-7-1x1-128-7-7-32-0x0-1x1-1x1-0-NCHW-FP16-F=miopenConvolutionFwdAlgoImplicitGEMM:ConvHipImplicitGemmV4R1Fwd,0.06192,0,miopenConvolutionFwdAlgoImplicitGEMM,672x7x7x1x1x128x7x7x32xNCHWxFP16x0x0x1x1x1x1x1x1;miopenConvolutionFwdAlgoDirect:ConvAsm1x1U,0.07168,0,miopenConvolutionFwdAlgoDirect,<unused>;miopenConvolutionFwdAlgoGEMM:gemm,0.1824,0,rocBlas,<unused>;miopenConvolutionFwdAlgoWinograd:ConvBinWinogradRxS,0.23984,0,miopenConvolutionFwdAlgoWinograd,672x7x7x1x1x128x7x7x32xNCHWxFP16x0x0x1x1x1x1x1x1
704-7-7-1x1-128-7-7-32-0x0-1x1-1x1-0-NCHW-FP16-F=miopenConvolutionFwdAlgoImplicitGEMM:ConvHipImplicitGemmV4R1Fwd,0.06304,0,miopenConvolutionFwdAlgoImplicitGEMM,704x7x7x1x1x128x7x7x32xNCHWxFP16x0x0x1x1x1x1x1x1;miopenConvolutionFwdAlgoDirect:ConvAsm1x1U,0.0656,0,miopenConvolutionFwdAlgoDirect,<unused>;miopenConvolutionFwdAlgoGEMM:gemm,0.19056,0,rocBlas,<unused>;miopenConvolutionFwdAlgoWinograd:ConvBinWinogradRxS,0.30048,0,miopenConvolutionFwdAlgoWinograd,704x7x7x1x1x128x7x7x32xNCHWxFP16x0x0x1x1x1x1x1x1
736-7-7-1x1-128-7-7-32-0x0-1x1-1x1-0-NCHW-FP16-F=miopenConvolutionFwdAlgoImplicitGEMM:ConvHipImplicitGemmV4R1Fwd,0.06512,0,miopenConvolutionFwdAlgoImplicitGEMM,736x7x7x1x1x128x7x7x32xNCHWxFP16x0x0x1x1x1x1x1x1;miopenConvolutionFwdAlgoDirect:ConvAsm1x1U,0.07776,0,miopenConvolutionFwdAlgoDirect,<unused>;miopenConvolutionFwdAlgoGEMM:gemm,0.19872,0,rocBlas,<unused>;miopenConvolutionFwdAlgoWinograd:ConvBinWinogradRxS,0.30992,0,miopenConvolutionFwdAlgoWinograd,736x7x7x1x1x128x7x7x32xNCHWxFP16x0x0x1x1x1x1x1x1
768-7-7-1x1-128-7-7-32-0x0-1x1-1x1-0-NCHW-FP16-F=miopenConvolutionFwdAlgoImplicitGEMM:ConvHipImplicitGemmV4R1Fwd,0.06464,0,miopenConvolutionFwdAlgoImplicitGEMM,768x7x7x1x1x128x7x7x32xNCHWxFP16x0x0x1x1x1x1x1x1;miopenConvolutionFwdAlgoDirect:ConvAsm1x1U,0.08016,0,miopenConvolutionFwdAlgoDirect,<unused>;miopenConvolutionFwdAlgoGEMM:gemm,0.2024,0,rocBlas,<unused>;miopenConvolutionFwdAlgoWinograd:ConvBinWinogradRxS,0.27168,0,miopenConvolutionFwdAlgoWinograd,768x7x7x1x1x128x7x7x32xNCHWxFP16x0x0x1x1x1x1x1x1
800-7-7-1x1-128-7-7-32-0x0-1x1-1x1-0-NCHW-FP16-F=miopenConvolutionFwdAlgoImplicitGEMM:ConvHipImplicitGemmV4R1Fwd,0.06992,0,miopenConvolutionFwdAlgoImplicitGEMM,800x7x7x1x1x128x7x7x32xNCHWxFP16x0x0x1x1x1x1x1x1;miopenConvolutionFwdAlgoDirect:ConvAsm1x1U,0.12512,0,miopenConvolutionFwdAlgoDirect,<unused>;miopenConvolutionFwdAlgoGEMM:gemm,0.20976,0,rocBlas,<unused>;miopenConvolutionFwdAlgoWinograd:ConvBinWinogradRxS,0.304,0,miopenConvolutionFwdAlgoWinograd,800x7x7x1x1x128x7x7x32xNCHWxFP16x0x0x1x1x1x1x1x1
832-7-7-1x1-128-7-7-32-0x0-1x1-1x1-0-NCHW-FP16-F=miopenConvolutionFwdAlgoImplicitGEMM:ConvHipImplicitGemmV4R1Fwd,0.072,0,miopenConvolutionFwdAlgoImplicitGEMM,832x7x7x1x1x128x7x7x32xNCHWxFP16x0x0x1x1x1x1x1x1;miopenConvolutionFwdAlgoDirect:ConvAsm1x1U,0.07792,0,miopenConvolutionFwdAlgoDirect,<unused>;miopenConvolutionFwdAlgoGEMM:gemm,0.2168,0,rocBlas,<unused>;miopenConvolutionFwdAlgoWinograd:ConvBinWinogradRxS,0.34928,0,miopenConvolutionFwdAlgoWinograd,832x7x7x1x1x128x7x7x32xNCHWxFP16x0x0x1x1x1x1x1x1
864-7-7-1x1-128-7-7-32-0x0-1x1-1x1-0-NCHW-FP16-F=miopenConvolutionFwdAlgoImplicitGEMM:ConvHipImplicitGemmV4R1Fwd,0.07424,0,miopenConvolutionFwdAlgoImplicitGEMM,864x7x7x1x1x128x7x7x32xNCHWxFP16x0x0x1x1x1x1x1x1;miopenConvolutionFwdAlgoDirect:ConvAsm1x1U,0.13248,0,miopenConvolutionFwdAlgoDirect,<unused>;miopenConvolutionFwdAlgoGEMM:gemm,0.2232,0,rocBlas,<unused>;miopenConvolutionFwdAlgoWinograd:ConvBinWinogradRxS,0.30304,0,miopenConvolutionFwdAlgoWinograd,864x7x7x1x1x128x7x7x32xNCHWxFP16x0x0x1x1x1x1x1x1
896-7-7-1x1-128-7-7-32-0x0-1x1-1x1-0-NCHW-FP16-F=miopenConvolutionFwdAlgoImplicitGEMM:ConvHipImplicitGemmV4R1Fwd,0.07728,0,miopenConvolutionFwdAlgoImplicitGEMM,896x7x7x1x1x128x7x7x32xNCHWxFP16x0x0x1x1x1x1x1x1;miopenConvolutionFwdAlgoDirect:ConvAsm1x1U,0.13584,0,miopenConvolutionFwdAlgoDirect,<unused>;miopenConvolutionFwdAlgoGEMM:gemm,0.232,0,rocBlas,<unused>;miopenConvolutionFwdAlgoWinograd:ConvBinWinogradRxS,0.37792,0,miopenConvolutionFwdAlgoWinograd,896x7x7x1x1x128x7x7x32xNCHWxFP16x0x0x1x1x1x1x1x1
928-7-7-1x1-128-7-7-32-0x0-1x1-1x1-0-NCHW-FP16-F=miopenConvolutionFwdAlgoImplicitGEMM:ConvHipImplicitGemmV4R1Fwd,0.07824,0,miopenConvolutionFwdAlgoImplicitGEMM,928x7x7x1x1x128x7x7x32xNCHWxFP16x0x0x1x1x1x1x1x1;miopenConvolutionFwdAlgoDirect:ConvAsm1x1U,0.08544,0,miopenConvolutionFwdAlgoDirect,<unused>;miopenConvolutionFwdAlgoGEMM:gemm,0.23856,0,rocBlas,<unused>;miopenConvolutionFwdAlgoWinograd:ConvBinWinogradRxS,0.32144,0,miopenConvolutionFwdAlgoWinograd,928x7x7x1x1x128x7x7x32xNCHWxFP16x0x0x1x1x1x1x1x1
960-7-7-1x1-128-7-7-32-0x0-1x1-1x1-0-NCHW-FP16-F=miopenConvolutionFwdAlgoImplicitGEMM:ConvHipImplicitGemmV4R1Fwd,0.0784,0,miopenConvolutionFwdAlgoImplicitGEMM,960x7x7x1x1x128x7x7x32xNCHWxFP16x0x0x1x1x1x1x1x1;miopenConvolutionFwdAlgoDirect:ConvAsm1x1U,0.14672,0,miopenConvolutionFwdAlgoDirect,<unused>;miopenConvolutionFwdAlgoGEMM:gemm,0.24672,0,rocBlas,<unused>;miopenConvolutionFwdAlgoWinograd:ConvBinWinogradRxS,0.33248,0,miopenConvolutionFwdAlgoWinograd,960x7x7x1x1x128x7x7x32xNCHWxFP16x0x0x1x1x1x1x1x1
992-7-7-1x1-128-7-7-32-0x0-1x1-1x1-0-NCHW-FP16-F=miopenConvolutionFwdAlgoImplicitGEMM:ConvHipImplicitGemmV4R1Fwd,0.0824,0,miopenConvolutionFwdAlgoImplicitGEMM,992x7x7x1x1x128x7x7x32xNCHWxFP16x0x0x1x1x1x1x1x1;miopenConvolutionFwdAlgoDirect:ConvAsm1x1U,0.1488,0,miopenConvolutionFwdAlgoDirect,<unused>;miopenConvolutionFwdAlgoGEMM:gemm,0.25408,0,rocBlas,<unused>;miopenConvolutionFwdAlgoWinograd:ConvBinWinogradRxS,0.34112,0,miopenConvolutionFwdAlgoWinograd,992x7x7x1x1x128x7x7x32xNCHWxFP16x0x0x1x1x1x1x1x1
3-299-299-3x3-32-149-149-32-0x0-2x2-1x1-0-NCHW-FP32-F=miopenConvolutionFwdAlgoDirect:ConvOclDirectFwd,0.73312,0,miopenConvolutionFwdAlgoDirect,<unused>;miopenConvolutionFwdAlgoGEMM:gemm,2.2528,2397708,rocBlas,<unused>;miopenConvolutionFwdAlgoWinograd:ConvBinWinogradRxSf2x3,0.52624,0,miopenConvolutionFwdAlgoWinograd,3x299x299x3x3x32x149x149x32xNCHWxFP32x0x0x2x2x1x1x1x1
32-149-149-3x3-32-147-147-32-0x0-1x1-1x1-0-NCHW-FP32-F=miopenConvolutionFwdAlgoImplicitGEMM:ConvHipImplicitGemmV4R1Fwd,1.78032,0,miopenConvolutionFwdAlgoImplicitGEMM,32x149x149x3x3x32x147x147x32xNCHWxFP32x0x0x1x1x1x1x1x1;miopenConvolutionFwdAlgoDirect:ConvOclDirectFwd,4.32991,0,miopenConvolutionFwdAlgoDirect,<unused>;miopenConvolutionFwdAlgoGEMM:gemm,6.7072,24893568,rocBlas,<unused>;miopenConvolutionFwdAlgoWinograd:ConvBinWinogradRxSf2x3,0.817279,0,miopenConvolutionFwdAlgoWinograd,32x149x149x3x3x32x147x147x32xNCHWxFP32x0x0x1x1x1x1x1x1
32-147-147-3x3-64-147-147-32-1x1-1x1-1x1-0-NCHW-FP32-F=miopenConvolutionFwdAlgoWinograd:ConvBinWinograd3x3U,1.55312,0,miopenConvolutionFwdAlgoWinograd,32x147x147x3x3x64x147x147x32xNCHWxFP32x1x1x1x1x1x1x1x1
64-73-73-1x1-80-73-73-32-0x0-1x1-1x1-0-NCHW-FP32-F=miopenConvolutionFwdAlgoDirect:ConvOclDirectFwd1x1,0.35056,0,miopenConvolutionFwdAlgoDirect,<unused>;miopenConvolutionFwdAlgoGEMM:gemm,0.32832,0,rocBlas,<unused>;miopenConvolutionFwdAlgoWinograd:ConvBinWinogradRxSf3x2,0.57712,0,miopenConvolutionFwdAlgoWinograd,64x73x73x1x1x80x73x73x32xNCHWxFP32x0x0x1x1x1x1x1x1
80-73-73-3x3-192-71-71-32-0x0-1x1-1x1-0-NCHW-FP32-F=miopenConvolutionFwdAlgoImplicitGEMM:ConvHipImplicitGemmV4R1Fwd,4.99327,0,miopenConvolutionFwdAlgoImplicitGEMM,80x73x73x3x3x192x71x71x32xNCHWxFP32x0x0x1x1x1x1x1x1;miopenConvolutionFwdAlgoDirect:ConvOclDirectFwd,11.5664,0,miopenConvolutionFwdAlgoDirect,<unused>;miopenConvolutionFwdAlgoGEMM:gemm,6.74816,14518080,rocBlas,<unused>;miopenConvolutionFwdAlgoWinograd:ConvBinWinogradRxS,2.32304,0,miopenConvolutionFwdAlgoWinograd,80x73x73x3x3x192x71x71x32xNCHWxFP32x0x0x1x1x1x1x1x1
192-35-35-1x1-64-35-35-32-0x0-1x1-1x1-0-NCHW-FP32-F=miopenConvolutionFwdAlgoImplicitGEMM:ConvHipImplicitGemmV4R1Fwd,0.22544,0,miopenConvolutionFwdAlgoImplicitGEMM,192x35x35x1x1x64x35x35x32xNCHWxFP32x0x0x1x1x1x1x1x1;miopenConvolutionFwdAlgoDirect:ConvAsm1x1U,0.16944,0,miopenConvolutionFwdAlgoDirect,<unused>;miopenConvolutionFwdAlgoGEMM:gemm,0.12464,0,rocBlas,<unused>;miopenConvolutionFwdAlgoWinograd:ConvBinWinogradRxSf3x2,0.25104,0,miopenConvolutionFwdAlgoWinograd,192x35x35x1x1x64x35x35x32xNCHWxFP32x0x0x1x1x1x1x1x1
192-35-35-1x1-48-35-35-32-0x0-1x1-1x1-0-NCHW-FP32-F=miopenConvolutionFwdAlgoDirect:ConvOclDirectFwd1x1,0.15552,0,miopenConvolutionFwdAlgoDirect,<unused>;miopenConvolutionFwdAlgoGEMM:gemm,0.2032,0,rocBlas,<unused>;miopenConvolutionFwdAlgoWinograd:ConvBinWinogradRxSf3x2,0.30624,0,miopenConvolutionFwdAlgoWinograd,192x35x35x1x1x48x35x35x32xNCHWxFP32x0x0x1x1x1x1x1x1
48-35-35-5x5-64-35-35-32-2x2-1x1-1x1-0-NCHW-FP32-F=miopenConvolutionFwdAlgoImplicitGEMM:ConvHipImplicitGemmV4R1Fwd,0.774559,0,miopenConvolutionFwdAlgoImplicitGEMM,48x35x35x5x5x64x35x35x32xNCHWxFP32x2x2x1x1x1x1x1x1;miopenConvolutionFwdAlgoDirect:ConvOclDirectFwd,2.1496,0,miopenConvolutionFwdAlgoDirect,<unused>;miopenConvolutionFwdAlgoGEMM:gemm,2.41664,5880000,rocBlas,<unused>;miopenConvolutionFwdAlgoWinograd:ConvBinWinogradRxSf2x3,0.46528,0,miopenConvolutionFwdAlgoWinograd,48x35x35x5x5x64x35x35x32xNCHWxFP32x2x2x1x1x1x1x1x1
64-35-35-3x3-96-35-35-32-1x1-1x1-1x1-0-NCHW-FP32-F=miopenConvolutionFwdAlgoWinograd:ConvBinWinograd3x3U,0.27872,0,miopenConvolutionFwdAlgoWinograd,64x35x35x3x3x96x35x35x32xNCHWxFP32x1x1x1x1x1x1x1x1
96-35-35-3x3-96-35-35-32-1x1-1x1-1x1-0-NCHW-FP32-F=miopenConvolutionFwdAlgoWinograd:ConvBinWinograd3x3U,0.38784,0,miopenConvolutionFwdAlgoWinograd,96x35x35x3x3x96x35x35x32xNCHWxFP32x1x1x1x1x1x1x1x1
192-35-35-1x1-32-35-35-32-0x0-1x1-1x1-0-NCHW-FP32-F=miopenConvolutionFwdAlgoImplicitGEMM:ConvHipImplicitGemmV4R1Fwd,0.1872,0,miopenConvolutionFwdAlgoImplicitGEMM,192x35x35x1x1x32x35x35x32xNCHWxFP32x0x0x1x1x1x1x1x1;miopenConvolutionFwdAlgoDirect:ConvAsm1x1U,0.1352,0,miopenConvolutionFwdAlgoDirect,<unused>;miopenConvolutionFwdAlgoGEMM:gemm,0.09568,0,rocBlas,<unused>;miopenConvolutionFwdAlgoWinograd:ConvBinWinogradRxSf3x2,0.156,0,miopenConvolutionFwdAlgoWinograd,192x35x35x1x1x32x35x35x32xNCHWxFP32x0x0x1x1x1x1x1x1
256-35-35-1x1-64-35-35-32-0x0-1x1-1x1-0-NCHW-FP32-F=miopenConvolutionFwdAlgoImplicitGEMM:ConvHipImplicitGemmV4R1Fwd,0.29136,0,miopenConvolutionFwdAlgoImplicitGEMM,256x35x35x1x1x64x35x35x32xNCHWxFP32x0x0x1x1x1x1x1x1;miopenConvolutionFwdAlgoDirect:ConvAsm1x1U,0.2112,0,miopenConvolutionFwdAlgoDirect,<unused>;miopenConvolutionFwdAlgoGEMM:gemm,0.22832,0,rocBlas,<unused>;miopenConvolutionFwdAlgoWinograd:ConvBinWinogradRxSf3x2,0.36432,0,miopenConvolutionFwdAlgoWinograd,256x35x35x1x1x64x35x35x32xNCHWxFP32x0x0x1x1x1x1x1x1
256-35-35-1x1-48-35-35-32-0x0-1x1-1x1-0-NCHW-FP32-F=miopenConvolutionFwdAlgoDirect:ConvAsm1x1U,0.19056,0,miopenConvolutionFwdAlgoDirect,<unused>;miopenConvolutionFwdAlgoGEMM:gemm,0.2216,0,rocBlas,<unused>;miopenConvolutionFwdAlgoWinograd:ConvBinWinogradRxSf3x2,0.36304,0,miopenConvolutionFwdAlgoWinograd,256x35x35x1x1x48x35x35x32xNCHWxFP32x0x0x1x1x1x1x1x1
288-35-35-1x1-64-35-35-32-0x0-1x1-1x1-0-NCHW-FP32-F=miopenConvolutionFwdAlgoImplicitGEMM:ConvHipImplicitGemmV4R1Fwd,0.2888,0,miopenConvolutionFwdAlgoImplicitGEMM,288x35x35x1x1x64x35x35x32xNCHWxFP32x0x0x1x1x1x1x1x1;miopenConvolutionFwdAlgoDirect:ConvAsm1x1U,0.24304,0,miopenConvolutionFwdAlgoDirect,<unused>;miopenConvolutionFwdAlgoGEMM:gemm,0.23136,0,rocBlas,<unused>;miopenConvolutionFwdAlgoWinograd:ConvBinWinogradRxSf3x2,0.42048,0,miopenConvolutionFwdAlgoWinograd,288x35x35x1x1x64x35x35x32xNCHWxFP32x0x0x1x1x1x1x1x1
288-35-35-1x1-48-35-35-32-0x0-1x1-1x1-0-NCHW-FP32-F=miopenConvolutionFwdAlgoDirect:ConvAsm1x1U,0.21648,0,miopenConvolutionFwdAlgoDirect,<unused>;miopenConvolutionFwdAlgoGEMM:gemm,0.2248,0,rocBlas,<unused>;miopenConvolutionFwdAlgoWinograd:ConvBinWinogradRxSf3x2,0.3984,0,miopenConvolutionFwdAlgoWinograd,288x35x35x1x1x48x35x35x32xNCHWxFP32x0x0x1x1x1x1x1x1
288-35-35-3x3-384-17-17-32-0x0-2x2-1x1-0-NCHW-FP32-F=miopenConvolutionFwdAlgoImplicitGEMM:ConvHipImplicitGemmV4R1Fwd,2.40256,0,miopenConvolutionFwdAlgoImplicitGEMM,288x35x35x3x3x384x17x17x32xNCHWxFP32x0x0x2x2x1x1x1x1;miopenConvolutionFwdAlgoDirect:ConvOclDirectFwd,47.851,0,miopenConvolutionFwdAlgoDirect,<unused>;miopenConvolutionFwdAlgoGEMM:gemm,3.7888,2996352,rocBlas,<unused>;miopenConvolutionFwdAlgoWinograd:ConvBinWinogradRxSf2x3,4.08496,0,miopenConvolutionFwdAlgoWinograd,288x35x35x3x3x384x17x17x32xNCHWxFP32x0x0x2x2x1x1x1x1
96-35-35-3x3-96-17-17-32-0x0-2x2-1x1-0-NCHW-FP32-F=miopenConvolutionFwdAlgoImplicitGEMM:ConvHipImplicitGemmV4R1Fwd,0.28144,0,miopenConvolutionFwdAlgoImplicitGEMM,96x35x35x3x3x96x17x17x32xNCHWxFP32x0x0x2x2x1x1x1x1;miopenConvolutionFwdAlgoDirect:ConvOclDirectFwd,1.95584,0,miopenConvolutionFwdAlgoDirect,<unused>;miopenConvolutionFwdAlgoGEMM:gemm,1.65376,998784,rocBlas,<unused>;miopenConvolutionFwdAlgoWinograd:ConvBinWinogradRxSf2x3,0.44848,0,miopenConvolutionFwdAlgoWinograd,96x35x35x3x3x96x17x17x32xNCHWxFP32x0x0x2x2x1x1x1x1
768-17-17-1x1-192-17-17-32-0x0-1x1-1x1-0-NCHW-FP32-F=miopenConvolutionFwdAlgoImplicitGEMM:ConvHipImplicitGemmV4R1Fwd,0.62768,0,miopenConvolutionFwdAlgoImplicitGEMM,768x17x17x1x1x192x17x17x32xNCHWxFP32x0x0x1x1x1x1x1x1;miopenConvolutionFwdAlgoDirect:ConvOclDirectFwd1x1,0.45488,0,miopenConvolutionFwdAlgoDirect,<unused>;miopenConvolutionFwdAlgoGEMM:gemm,0.31152,0,rocBlas,<unused>;miopenConvolutionFwdAlgoWinograd:ConvBinWinogradRxSf3x2,0.68016,0,miopenConvolutionFwdAlgoWinograd,768x17x17x1x1x192x17x17x32xNCHWxFP32x0x0x1x1x1x1x1x1
768-17-17-1x1-128-17-17-32-0x0-1x1-1x1-0-NCHW-FP32-F=miopenConvolutionFwdAlgoImplicitGEMM:ConvHipImplicitGemmV4R1Fwd,0.41744,0,miopenConvolutionFwdAlgoImplicitGEMM,768x17x17x1x1x128x17x17x32xNCHWxFP32x0x0x1x1x1x1x1x1;miopenConvolutionFwdAlgoDirect:ConvAsm1x1U,0.28272,0,miopenConvolutionFwdAlgoDirect,<unused>;miopenConvolutionFwdAlgoGEMM:gemm,0.25136,0,rocBlas,<unused>;miopenConvolutionFwdAlgoWinograd:ConvBinWinogradRxSf3x2,0.51728,0,miopenConvolutionFwdAlgoWinograd,768x17x17x1x1x128x17x17x32xNCHWxFP32x0x0x1x1x1x1x1x1
128-17-17-1x7-128-17-17-32-0x3-1x1-1x1-0-NCHW-FP32-F=miopenConvolutionFwdAlgoImplicitGEMM:ConvHipImplicitGemmV4R1Fwd,0.32048,0,miopenConvolutionFwdAlgoImplicitGEMM,128x17x17x1x7x128x17x17x32xNCHWxFP32x0x3x1x1x1x1x1x1;miopenConvolutionFwdAlgoGEMM:gemm,1.69472,1035776,rocBlas,<unused>;miopenConvolutionFwdAlgoWinograd:ConvBinWinogradRxSf3x2,0.35904,0,miopenConvolutionFwdAlgoWinograd,128x17x17x1x7x128x17x17x32xNCHWxFP32x0x3x1x1x1x1x1x1
128-17-17-7x1-192-17-17-32-3x0-1x1-1x1-0-NCHW-FP32-F=miopenConvolutionFwdAlgoImplicitGEMM:ConvHipImplicitGemmV4R1Fwd,0.53344,0,miopenConvolutionFwdAlgoImplicitGEMM,128x17x17x7x1x192x17x17x32xNCHWxFP32x3x0x1x1x1x1x1x1;miopenConvolutionFwdAlgoGEMM:gemm,1.73056,1035776,rocBlas,<unused>;miopenConvolutionFwdAlgoWinograd:ConvBinWinogradRxSf3x2,0.4752,0,miopenConvolutionFwdAlgoWinograd,128x17x17x7x1x192x17x17x32xNCHWxFP32x3x0x1x1x1x1x1x1
128-17-17-7x1-128-17-17-32-3x0-1x1-1x1-0-NCHW-FP32-F=miopenConvolutionFwdAlgoImplicitGEMM:ConvHipImplicitGemmV4R1Fwd,0.34784,0,miopenConvolutionFwdAlgoImplicitGEMM,128x17x17x7x1x128x17x17x32xNCHWxFP32x3x0x1x1x1x1x1x1;miopenConvolutionFwdAlgoGEMM:gemm,1.50528,1035776,rocBlas,<unused>;miopenConvolutionFwdAlgoWinograd:ConvBinWinogradRxSf3x2,0.36224,0,miopenConvolutionFwdAlgoWinograd,128x17x17x7x1x128x17x17x32xNCHWxFP32x3x0x1x1x1x1x1x1
128-17-17-1x7-192-17-17-32-0x3-1x1-1x1-0-NCHW-FP32-F=miopenConvolutionFwdAlgoImplicitGEMM:ConvHipImplicitGemmV4R1Fwd,0.47792,0,miopenConvolutionFwdAlgoImplicitGEMM,128x17x17x1x7x192x17x17x32xNCHWxFP32x0x3x1x1x1x1x1x1;miopenConvolutionFwdAlgoGEMM:gemm,1.50528,1035776,rocBlas,<unused>;miopenConvolutionFwdAlgoWinograd:ConvBinWinogradRxSf3x2,0.4728,0,miopenConvolutionFwdAlgoWinograd,128x17x17x1x7x192x17x17x32xNCHWxFP32x0x3x1x1x1x1x1x1
768-17-17-1x1-160-17-17-32-0x0-1x1-1x1-0-NCHW-FP32-F=miopenConvolutionFwdAlgoImplicitGEMM:ConvHipImplicitGemmV4R1Fwd,0.864639,0,miopenConvolutionFwdAlgoImplicitGEMM,768x17x17x1x1x160x17x17x32xNCHWxFP32x0x0x1x1x1x1x1x1;miopenConvolutionFwdAlgoDirect:ConvAsm1x1U,0.35984,0,miopenConvolutionFwdAlgoDirect,<unused>;miopenConvolutionFwdAlgoGEMM:gemm,0.31664,0,rocBlas,<unused>;miopenConvolutionFwdAlgoWinograd:ConvBinWinogradRxSf3x2,0.51888,0,miopenConvolutionFwdAlgoWinograd,768x17x17x1x1x160x17x17x32xNCHWxFP32x0x0x1x1x1x1x1x1
160-17-17-1x7-160-17-17-32-0x3-1x1-1x1-0-NCHW-FP32-F=miopenConvolutionFwdAlgoImplicitGEMM:ConvHipImplicitGemmV4R1Fwd,0.48944,0,miopenConvolutionFwdAlgoImplicitGEMM,160x17x17x1x7x160x17x17x32xNCHWxFP32x0x3x1x1x1x1x1x1;miopenConvolutionFwdAlgoGEMM:gemm,1.6384,1294720,rocBlas,<unused>;miopenConvolutionFwdAlgoWinograd:ConvBinWinogradRxSf3x2,0.4408,0,miopenConvolutionFwdAlgoWinograd,160x17x17x1x7x160x17x17x32xNCHWxFP32x0x3x1x1x1x1x1x1
160-17-17-7x1-192-17-17-32-3x0-1x1-1x1-0-NCHW-FP32-F=miopenConvolutionFwdAlgoImplicitGEMM:ConvHipImplicitGemmV4R1Fwd,0.57168,0,miopenConvolutionFwdAlgoImplicitGEMM,160x17x17x7x1x192x17x17x32xNCHWxFP32x3x0x1x1x1x1x1x1;miopenConvolutionFwdAlgoGEMM:gemm,1.71008,1294720,rocBlas,<unused>;miopenConvolutionFwdAlgoWinograd:ConvBinWinogradRxSf3x2,0.58192,0,miopenConvolutionFwdAlgoWinograd,160x17x17x7x1x192x17x17x32xNCHWxFP32x3x0x1x1x1x1x1x1
160-17-17-7x1-160-17-17-32-3x0-1x1-1x1-0-NCHW-FP32-F=miopenConvolutionFwdAlgoImplicitGEMM:ConvHipImplicitGemmV4R1Fwd,0.56192,0,miopenConvolutionFwdAlgoImplicitGEMM,160x17x17x7x1x160x17x17x32xNCHWxFP32x3x0x1x1x1x1x1x1;miopenConvolutionFwdAlgoGEMM:gemm,1.6896,1294720,rocBlas,<unused>;miopenConvolutionFwdAlgoWinograd:ConvBinWinogradRxSf3x2,0.44352,0,miopenConvolutionFwdAlgoWinograd,160x17x17x7x1x160x17x17x32xNCHWxFP32x3x0x1x1x1x1x1x1
160-17-17-1x7-192-17-17-32-0x3-1x1-1x1-0-NCHW-FP32-F=miopenConvolutionFwdAlgoImplicitGEMM:ConvHipImplicitGemmV4R1Fwd,0.55504,0,miopenConvolutionFwdAlgoImplicitGEMM,160x17x17x1x7x192x17x17x32xNCHWxFP32x0x3x1x1x1x1x1x1;miopenConvolutionFwdAlgoGEMM:gemm,1.68448,1294720,rocBlas,<unused>;miopenConvolutionFwdAlgoWinograd:ConvBinWinogradRxSf3x2,0.57696,0,miopenConvolutionFwdAlgoWinograd,160x17x17x1x7x192x17x17x32xNCHWxFP32x0x3x1x1x1x1x1x1
192-17-17-1x7-192-17-17-32-0x3-1x1-1x1-0-NCHW-FP32-F=miopenConvolutionFwdAlgoImplicitGEMM:ConvHipImplicitGemmV4R1Fwd,0.73104,0,miopenConvolutionFwdAlgoImplicitGEMM,192x17x17x1x7x192x17x17x32xNCHWxFP32x0x3x1x1x1x1x1x1;miopenConvolutionFwdAlgoGEMM:gemm,1.8688,1553664,rocBlas,<unused>;miopenConvolutionFwdAlgoWinograd:ConvBinWinogradRxSf3x2,0.68128,0,miopenConvolutionFwdAlgoWinograd,192x17x17x1x7x192x17x17x32xNCHWxFP32x0x3x1x1x1x1x1x1
192-17-17-7x1-192-17-17-32-3x0-1x1-1x1-0-NCHW-FP32-F=miopenConvolutionFwdAlgoImplicitGEMM:ConvHipImplicitGemmV4R1Fwd,0.74656,0,miopenConvolutionFwdAlgoImplicitGEMM,192x17x17x7x1x192x17x17x32xNCHWxFP32x3x0x1x1x1x1x1x1;miopenConvolutionFwdAlgoGEMM:gemm,1.91488,1553664,rocBlas,<unused>;miopenConvolutionFwdAlgoWinograd:ConvBinWinogradRxSf3x2,0.68592,0,miopenConvolutionFwdAlgoWinograd,192x17x17x7x1x192x17x17x32xNCHWxFP32x3x0x1x1x1x1x1x1
192-17-17-3x3-320-8-8-32-0x0-2x2-1x1-0-NCHW-FP32-F=miopenConvolutionFwdAlgoImplicitGEMM:ConvHipImplicitGemmV4Fwd,0.33088,0,miopenConvolutionFwdAlgoImplicitGEMM,192x17x17x3x3x320x8x8x32xNCHWxFP32x0x0x2x2x1x1x1x1;miopenConvolutionFwdAlgoDirect:ConvOclDirectFwd,2.076,0,miopenConvolutionFwdAlgoDirect,<unused>;miopenConvolutionFwdAlgoGEMM:gemm,1.93536,442368,rocBlas,<unused>;miopenConvolutionFwdAlgoWinograd:ConvBinWinogradRxSf2x3,0.50464,0,miopenConvolutionFwdAlgoWinograd,192x17x17x3x3x320x8x8x32xNCHWxFP32x0x0x2x2x1x1x1x1
192-17-17-3x3-192-8-8-32-0x0-2x2-1x1-0-NCHW-FP32-F=miopenConvolutionFwdAlgoImplicitGEMM:ConvHipImplicitGemmV4Fwd,0.33664,0,miopenConvolutionFwdAlgoImplicitGEMM,192x17x17x3x3x192x8x8x32xNCHWxFP32x0x0x2x2x1x1x1x1;miopenConvolutionFwdAlgoDirect:ConvOclDirectFwd,1.03552,0,miopenConvolutionFwdAlgoDirect,<unused>;miopenConvolutionFwdAlgoGEMM:gemm,1.86368,442368,rocBlas,<unused>;miopenConvolutionFwdAlgoWinograd:ConvBinWinogradRxSf2x3,0.34352,0,miopenConvolutionFwdAlgoWinograd,192x17x17x3x3x192x8x8x32xNCHWxFP32x0x0x2x2x1x1x1x1
1280-8-8-1x1-320-8-8-32-0x0-1x1-1x1-0-NCHW-FP32-F=miopenConvolutionFwdAlgoImplicitGEMM:ConvHipImplicitGemmV4_1x1,0.24544,0,miopenConvolutionFwdAlgoImplicitGEMM,1280x8x8x1x1x320x8x8x32xNCHWxFP32x0x0x1x1x1x1x1x1;miopenConvolutionFwdAlgoDirect:ConvAsm1x1U,0.26624,0,miopenConvolutionFwdAlgoDirect,<unused>;miopenConvolutionFwdAlgoGEMM:gemm,0.51072,0,rocBlas,<unused>;miopenConvolutionFwdAlgoWinograd:ConvBinWinogradRxSf3x2,0.56672,0,miopenConvolutionFwdAlgoWinograd,1280x8x8x1x1x320x8x8x32xNCHWxFP32x0x0x1x1x1x1x1x1
1280-8-8-1x1-384-8-8-32-0x0-1x1-1x1-0-NCHW-FP32-F=miopenConvolutionFwdAlgoImplicitGEMM:ConvHipImplicitGemmV4_1x1,0.30992,0,miopenConvolutionFwdAlgoImplicitGEMM,1280x8x8x1x1x384x8x8x32xNCHWxFP32x0x0x1x1x1x1x1x1;miopenConvolutionFwdAlgoDirect:ConvAsm1x1U,0.32784,0,miopenConvolutionFwdAlgoDirect,<unused>;miopenConvolutionFwdAlgoGEMM:gemm,0.55808,0,rocBlas,<unused>;miopenConvolutionFwdAlgoWinograd:ConvBinWinogradRxSf3x2,0.56896,0,miopenConvolutionFwdAlgoWinograd,1280x8x8x1x1x384x8x8x32xNCHWxFP32x0x0x1x1x1x1x1x1
384-8-8-1x3-384-8-8-32-0x1-1x1-1x1-0-NCHW-FP32-F=miopenConvolutionFwdAlgoImplicitGEMM:ConvHipImplicitGemmV4R1Fwd,0.28064,0,miopenConvolutionFwdAlgoImplicitGEMM,384x8x8x1x3x384x8x8x32xNCHWxFP32x0x1x1x1x1x1x1x1;miopenConvolutionFwdAlgoGEMM:gemm,1.69472,294912,rocBlas,<unused>;miopenConvolutionFwdAlgoWinograd:ConvBinWinogradRxS,0.33072,0,miopenConvolutionFwdAlgoWinograd,384x8x8x1x3x384x8x8x32xNCHWxFP32x0x1x1x1x1x1x1x1
384-8-8-3x1-384-8-8-32-1x0-1x1-1x1-0-NCHW-FP32-F=miopenConvolutionFwdAlgoImplicitGEMM:ConvHipImplicitGemmV4R1Fwd,0.27712,0,miopenConvolutionFwdAlgoImplicitGEMM,384x8x8x3x1x384x8x8x32xNCHWxFP32x1x0x1x1x1x1x1x1;miopenConvolutionFwdAlgoGEMM:gemm,2.04288,294912,rocBlas,<unused>;miopenConvolutionFwdAlgoWinograd:ConvBinWinogradRxSf2x3,0.33136,0,miopenConvolutionFwdAlgoWinograd,384x8x8x3x1x384x8x8x32xNCHWxFP32x1x0x1x1x1x1x1x1
1280-8-8-1x1-448-8-8-32-0x0-1x1-1x1-0-NCHW-FP32-F=miopenConvolutionFwdAlgoImplicitGEMM:ConvHipImplicitGemmV4_1x1,0.31216,0,miopenConvolutionFwdAlgoImplicitGEMM,1280x8x8x1x1x448x8x8x32xNCHWxFP32x0x0x1x1x1x1x1x1;miopenConvolutionFwdAlgoDirect:ConvAsm1x1U,0.33776,0,miopenConvolutionFwdAlgoDirect,<unused>;miopenConvolutionFwdAlgoGEMM:gemm,0.72064,0,rocBlas,<unused>;miopenConvolutionFwdAlgoWinograd:ConvBinWinogradRxSf3x2,0.833439,0,miopenConvolutionFwdAlgoWinograd,1280x8x8x1x1x448x8x8x32xNCHWxFP32x0x0x1x1x1x1x1x1
448-8-8-3x3-384-8-8-32-1x1-1x1-1x1-0-NCHW-FP32-F=miopenConvolutionFwdAlgoWinograd:ConvBinWinogradRxS,0.37936,0,miopenConvolutionFwdAlgoWinograd,448x8x8x3x3x384x8x8x32xNCHWxFP32x1x1x1x1x1x1x1x1
1280-8-8-1x1-192-8-8-32-0x0-1x1-1x1-0-NCHW-FP32-F=miopenConvolutionFwdAlgoImplicitGEMM:ConvHipImplicitGemmV4_1x1,0.19104,0,miopenConvolutionFwdAlgoImplicitGEMM,1280x8x8x1x1x192x8x8x32xNCHWxFP32x0x0x1x1x1x1x1x1;miopenConvolutionFwdAlgoDirect:ConvAsm1x1U,0.21056,0,miopenConvolutionFwdAlgoDirect,<unused>;miopenConvolutionFwdAlgoGEMM:gemm,0.2952,0,rocBlas,<unused>;miopenConvolutionFwdAlgoWinograd:ConvBinWinogradRxSf3x2,0.29584,0,miopenConvolutionFwdAlgoWinograd,1280x8x8x1x1x192x8x8x32xNCHWxFP32x0x0x1x1x1x1x1x1
2048-8-8-1x1-320-8-8-32-0x0-1x1-1x1-0-NCHW-FP32-F=miopenConvolutionFwdAlgoImplicitGEMM:ConvHipImplicitGemmV4_1x1,0.51136,0,miopenConvolutionFwdAlgoImplicitGEMM,2048x8x8x1x1x320x8x8x32xNCHWxFP32x0x0x1x1x1x1x1x1;miopenConvolutionFwdAlgoDirect:ConvAsm1x1U,0.68272,0,miopenConvolutionFwdAlgoDirect,<unused>;miopenConvolutionFwdAlgoGEMM:gemm,0.67808,0,rocBlas,<unused>;miopenConvolutionFwdAlgoWinograd:ConvBinWinogradRxSf3x2,0.881279,0,miopenConvolutionFwdAlgoWinograd,2048x8x8x1x1x320x8x8x32xNCHWxFP32x0x0x1x1x1x1x1x1
2048-8-8-1x1-384-8-8-32-0x0-1x1-1x1-0-NCHW-FP32-F=miopenConvolutionFwdAlgoImplicitGEMM:ConvHipImplicitGemmV4_1x1,0.5288,0,miopenConvolutionFwdAlgoImplicitGEMM,2048x8x8x1x1x384x8x8x32xNCHWxFP32x0x0x1x1x1x1x1x1;miopenConvolutionFwdAlgoDirect:ConvAsm1x1U,0.5864,0,miopenConvolutionFwdAlgoDirect,<unused>;miopenConvolutionFwdAlgoGEMM:gemm,0.804799,0,rocBlas,<unused>;miopenConvolutionFwdAlgoWinograd:ConvBinWinogradRxSf3x2,0.883839,0,miopenConvolutionFwdAlgoWinograd,2048x8x8x1x1x384x8x8x32xNCHWxFP32x0x0x1x1x1x1x1x1
2048-8-8-1x1-448-8-8-32-0x0-1x1-1x1-0-NCHW-FP32-F=miopenConvolutionFwdAlgoImplicitGEMM:ConvHipImplicitGemmV4_1x1,0.53616,0,miopenConvolutionFwdAlgoImplicitGEMM,2048x8x8x1x1x448x8x8x32xNCHWxFP32x0x0x1x1x1x1x1x1;miopenConvolutionFwdAlgoDirect:ConvAsm1x1U,0.6024,0,miopenConvolutionFwdAlgoDirect,<unused>;miopenConvolutionFwdAlgoGEMM:gemm,0.937919,0,rocBlas,<unused>;miopenConvolutionFwdAlgoWinograd:ConvBinWinogradRxSf3x2,1.3064,0,miopenConvolutionFwdAlgoWinograd,2048x8x8x1x1x448x8x8x32xNCHWxFP32x0x0x1x1x1x1x1x1
2048-8-8-1x1-192-8-8-32-0x0-1x1-1x1-0-NCHW-FP32-F=miopenConvolutionFwdAlgoImplicitGEMM:ConvHipImplicitGemmV4_1x1,0.32768,0,miopenConvolutionFwdAlgoImplicitGEMM,2048x8x8x1x1x192x8x8x32xNCHWxFP32x0x0x1x1x1x1x1x1;miopenConvolutionFwdAlgoDirect:ConvAsm1x1U,0.39824,0,miopenConvolutionFwdAlgoDirect,<unused>;miopenConvolutionFwdAlgoGEMM:gemm,0.4208,0,rocBlas,<unused>;miopenConvolutionFwdAlgoWinograd:ConvBinWinogradRxSf3x2,0.45744,0,miopenConvolutionFwdAlgoWinograd,2048x8x8x1x1x192x8x8x32xNCHWxFP32x0x0x1x1x1x1x1x1
3-299-299-3x3-32-149-149-32-0x0-2x2-1x1-0-NCHW-FP16-F=miopenConvolutionFwdAlgoDirect:ConvOclDirectFwdGen,0.55248,0,miopenConvolutionFwdAlgoDirect,<unused>;miopenConvolutionFwdAlgoGEMM:gemm,2.52416,1198854,rocBlas,<unused>
32-149-149-3x3-32-147-147-32-0x0-1x1-1x1-0-NCHW-FP16-F=miopenConvolutionFwdAlgoImplicitGEMM:ConvHipImplicitGemmV4R1Fwd,1.31952,0,miopenConvolutionFwdAlgoImplicitGEMM,32x149x149x3x3x32x147x147x32xNCHWxFP16x0x0x1x1x1x1x1x1;miopenConvolutionFwdAlgoGEMM:gemm,8.29952,12446784,rocBlas,<unused>;miopenConvolutionFwdAlgoDirect:ConvOclDirectFwd,2.31248,0,miopenConvolutionFwdAlgoDirect,<unused>
32-147-147-3x3-64-147-147-32-1x1-1x1-1x1-0-NCHW-FP16-F=miopenConvolutionFwdAlgoImplicitGEMM:ConvHipImplicitGemmV4R1Fwd,2.45696,0,miopenConvolutionFwdAlgoImplicitGEMM,32x147x147x3x3x64x147x147x32xNCHWxFP16x1x1x1x1x1x1x1x1;miopenConvolutionFwdAlgoGEMM:gemm,8.704,12446784,rocBlas,<unused>;miopenConvolutionFwdAlgoDirect:ConvOclDirectFwd,4.26351,0,miopenConvolutionFwdAlgoDirect,<unused>
64-73-73-1x1-80-73-73-32-0x0-1x1-1x1-0-NCHW-FP16-F=miopenConvolutionFwdAlgoDirect:ConvAsm1x1U,0.2792,0,miopenConvolutionFwdAlgoDirect,<unused>;miopenConvolutionFwdAlgoGEMM:gemm,0.64112,0,rocBlas,<unused>;miopenConvolutionFwdAlgoWinograd:ConvBinWinogradRxS,0.66624,0,miopenConvolutionFwdAlgoWinograd,64x73x73x1x1x80x73x73x32xNCHWxFP16x0x0x1x1x1x1x1x1
80-73-73-3x3-192-71-71-32-0x0-1x1-1x1-0-NCHW-FP16-F=miopenConvolutionFwdAlgoImplicitGEMM:ConvHipImplicitGemmV4R1Fwd,4.22543,0,miopenConvolutionFwdAlgoImplicitGEMM,80x73x73x3x3x192x71x71x32xNCHWxFP16x0x0x1x1x1x1x1x1;miopenConvolutionFwdAlgoDirect:ConvOclDirectFwd,8.66927,0,miopenConvolutionFwdAlgoDirect,<unused>;miopenConvolutionFwdAlgoGEMM:gemm,11.7094,7259040,rocBlas,<unused>;miopenConvolutionFwdAlgoWinograd:ConvBinWinogradRxS,1.46928,0,miopenConvolutionFwdAlgoWinograd,80x73x73x3x3x192x71x71x32xNCHWxFP16x0x0x1x1x1x1x1x1
192-35-35-1x1-64-35-35-32-0x0-1x1-1x1-0-NCHW-FP16-F=miopenConvolutionFwdAlgoImplicitGEMM:ConvHipImplicitGemmV4R1Fwd,0.2104,0,miopenConvolutionFwdAlgoImplicitGEMM,192x35x35x1x1x64x35x35x32xNCHWxFP16x0x0x1x1x1x1x1x1;miopenConvolutionFwdAlgoDirect:ConvAsm1x1U,0.14768,0,miopenConvolutionFwdAlgoDirect,<unused>;miopenConvolutionFwdAlgoGEMM:gemm,0.22896,0,rocBlas,<unused>;miopenConvolutionFwdAlgoWinograd:ConvBinWinogradRxS,0.35936,0,miopenConvolutionFwdAlgoWinograd,192x35x35x1x1x64x35x35x32xNCHWxFP16x0x0x1x1x1x1x1x1
192-35-35-1x1-48-35-35-32-0x0-1x1-1x1-0-NCHW-FP16-F=miopenConvolutionFwdAlgoDirect:ConvAsm1x1U,0.12,0,miopenConvolutionFwdAlgoDirect,<unused>;miopenConvolutionFwdAlgoGEMM:gemm,0.23776,0,rocBlas,<unused>;miopenConvolutionFwdAlgoWinograd:ConvBinWinogradRxS,0.30576,0,miopenConvolutionFwdAlgoWinograd,192x35x35x1x1x48x35x35x32xNCHWxFP16x0x0x1x1x1x1x1x1
48-35-35-5x5-64-35-35-32-2x2-1x1-1x1-0-NCHW-FP16-F=miopenConvolutionFwdAlgoImplicitGEMM:ConvHipImplicitGemmV4R1Fwd,0.60112,0,miopenConvolutionFwdAlgoImplicitGEMM,48x35x35x5x5x64x35x35x32xNCHWxFP16x2x2x1x1x1x1x1x1;miopenConvolutionFwdAlgoDirect:ConvOclDirectFwd,1.64416,0,miopenConvolutionFwdAlgoDirect,<unused>;miopenConvolutionFwdAlgoGEMM:gemm,8.06912,2940000,rocBlas,<unused>;miopenConvolutionFwdAlgoWinograd:ConvBinWinogradRxS,0.3112,0,miopenConvolutionFwdAlgoWinograd,48x35x35x5x5x64x35x35x32xNCHWxFP16x2x2x1x1x1x1x1x1
64-35-35-3x3-96-35-35-32-1x1-1x1-1x1-0-NCHW-FP16-F=miopenConvolutionFwdAlgoImplicitGEMM:ConvHipImplicitGemmV4R1Fwd,0.45296,0,miopenConvolutionFwdAlgoImplicitGEMM,64x35x35x3x3x96x35x35x32xNCHWxFP16x1x1x1x1x1x1x1x1;miopenConvolutionFwdAlgoDirect:ConvOclDirectFwd,1.67072,0,miopenConvolutionFwdAlgoDirect,<unused>;miopenConvolutionFwdAlgoGEMM:gemm,5.12,1411200,rocBlas,<unused>;miopenConvolutionFwdAlgoWinograd:ConvBinWinogradRxS,0.1864,0,miopenConvolutionFwdAlgoWinograd,64x35x35x3x3x96x35x35x32xNCHWxFP16x1x1x1x1x1x1x1x1
96-35-35-3x3-96-35-35-32-1x1-1x1-1x1-0-NCHW-FP16-F=miopenConvolutionFwdAlgoImplicitGEMM:ConvHipImplicitGemmV4R1Fwd,0.66784,0,miopenConvolutionFwdAlgoImplicitGEMM,96x35x35x3x3x96x35x35x32xNCHWxFP16x1x1x1x1x1x1x1x1;miopenConvolutionFwdAlgoDirect:ConvOclDirectFwd,2.5232,0,miopenConvolutionFwdAlgoDirect,<unused>;miopenConvolutionFwdAlgoGEMM:gemm,6.23616,2116800,rocBlas,<unused>;miopenConvolutionFwdAlgoWinograd:ConvBinWinogradRxS,0.25104,0,miopenConvolutionFwdAlgoWinograd,96x35x35x3x3x96x35x35x32xNCHWxFP16x1x1x1x1x1x1x1x1
192-35-35-1x1-32-35-35-32-0x0-1x1-1x1-0-NCHW-FP16-F=miopenConvolutionFwdAlgoImplicitGEMM:ConvHipImplicitGemmV4R1Fwd,0.0984,0,miopenConvolutionFwdAlgoImplicitGEMM,192x35x35x1x1x32x35x35x32xNCHWxFP16x0x0x1x1x1x1x1x1;miopenConvolutionFwdAlgoDirect:ConvAsm1x1U,0.07888,0,miopenConvolutionFwdAlgoDirect,<unused>;miopenConvolutionFwdAlgoGEMM:gemm,0.22368,0,rocBlas,<unused>;miopenConvolutionFwdAlgoWinograd:ConvBinWinogradRxS,0.22256,0,miopenConvolutionFwdAlgoWinograd,192x35x35x1x1x32x35x35x32xNCHWxFP16x0x0x1x1x1x1x1x1
256-35-35-1x1-64-35-35-32-0x0-1x1-1x1-0-NCHW-FP16-F=miopenConvolutionFwdAlgoImplicitGEMM:ConvHipImplicitGemmV4R1Fwd,0.24528,0,miopenConvolutionFwdAlgoImplicitGEMM,256x35x35x1x1x64x35x35x32xNCHWxFP16x0x0x1x1x1x1x1x1;miopenConvolutionFwdAlgoDirect:ConvAsm1x1U,0.1768,0,miopenConvolutionFwdAlgoDirect,<unused>;miopenConvolutionFwdAlgoGEMM:gemm,0.29488,0,rocBlas,<unused>;miopenConvolutionFwdAlgoWinograd:ConvBinWinogradRxS,0.47728,0,miopenConvolutionFwdAlgoWinograd,256x35x35x1x1x64x35x35x32xNCHWxFP16x0x0x1x1x1x1x1x1
256-35-35-1x1-48-35-35-32-0x0-1x1-1x1-0-NCHW-FP16-F=miopenConvolutionFwdAlgoDirect:ConvAsm1x1U,0.15216,0,miopenConvolutionFwdAlgoDirect,<unused>;miopenConvolutionFwdAlgoGEMM:gemm,0.29072,0,rocBlas,<unused>;miopenConvolutionFwdAlgoWinograd:ConvBinWinogradRxS,0.3928,0,miopenConvolutionFwdAlgoWinograd,256x35x35x1x1x48x35x35x32xNCHWxFP16x0x0x1x1x1x1x1x1
288-35-35-1x1-64-35-35-32-0x0-1x1-1x1-0-NCHW-FP16-F=miopenConvolutionFwdAlgoImplicitGEMM:ConvHipImplicitGemmV4R1Fwd,0.21728,0,miopenConvolutionFwdAlgoImplicitGEMM,288x35x35x1x1x64x35x35x32xNCHWxFP16x0x0x1x1x1x1x1x1;miopenConvolutionFwdAlgoDirect:ConvAsm1x1U,0.1944,0,miopenConvolutionFwdAlgoDirect,<unused>;miopenConvolutionFwdAlgoGEMM:gemm,0.32528,0,rocBlas,<unused>;miopenConvolutionFwdAlgoWinograd:ConvBinWinogradRxS,0.4336,0,miopenConvolutionFwdAlgoWinograd,288x35x35x1x1x64x35x35x32xNCHWxFP16x0x0x1x1x1x1x1x1
288-35-35-1x1-48-35-35-32-0x0-1x1-1x1-0-NCHW-FP16-F=miopenConvolutionFwdAlgoDirect:ConvAsm1x1U,0.14656,0,miopenConvolutionFwdAlgoDirect,<unused>;miopenConvolutionFwdAlgoGEMM:gemm,0.32208,0,rocBlas,<unused>;miopenConvolutionFwdAlgoWinograd:ConvBinWinogradRxS,0.43584,0,miopenConvolutionFwdAlgoWinograd,288x35x35x1x1x48x35x35x32xNCHWxFP16x0x0x1x1x1x1x1x1
288-35-35-3x3-384-17-17-32-0x0-2x2-1x1-0-NCHW-FP16-F=miopenConvolutionFwdAlgoImplicitGEMM:ConvHipImplicitGemmV4R1Fwd,1.78224,0,miopenConvolutionFwdAlgoImplicitGEMM,288x35x35x3x3x384x17x17x32xNCHWxFP16x0x0x2x2x1x1x1x1;miopenConvolutionFwdAlgoDirect:ConvOclDirectFwdGen,12.0297,0,miopenConvolutionFwdAlgoDirect,<unused>;miopenConvolutionFwdAlgoGEMM:gemm,15.5597,1498176,rocBlas,<unused>;miopenConvolutionFwdAlgoWinograd:ConvBinWinogradRxS,3.3192,0,miopenConvolutionFwdAlgoWinograd,288x35x35x3x3x384x17x17x32xNCHWxFP16x0x0x2x2x1x1x1x1
96-35-35-3x3-96-17-17-32-0x0-2x2-1x1-0-NCHW-FP16-F=miopenConvolutionFwdAlgoImplicitGEMM:ConvHipImplicitGemmV4R1Fwd,0.20336,0,miopenConvolutionFwdAlgoImplicitGEMM,96x35x35x3x3x96x17x17x32xNCHWxFP16x0x0x2x2x1x1x1x1;miopenConvolutionFwdAlgoDirect:ConvOclDirectFwdGen,1.12544,0,miopenConvolutionFwdAlgoDirect,<unused>;miopenConvolutionFwdAlgoGEMM:gemm,5.92896,499392,rocBlas,<unused>;miopenConvolutionFwdAlgoWinograd:ConvBinWinogradRxS,0.33152,0,miopenConvolutionFwdAlgoWinograd,96x35x35x3x3x96x17x17x32xNCHWxFP16x0x0x2x2x1x1x1x1
768-17-17-1x1-192-17-17-32-0x0-1x1-1x1-0-NCHW-FP16-F=miopenConvolutionFwdAlgoImplicitGEMM:ConvHipImplicitGemmV4R1Fwd,0.32992,0,miopenConvolutionFwdAlgoImplicitGEMM,768x17x17x1x1x192x17x17x32xNCHWxFP16x0x0x1x1x1x1x1x1;miopenConvolutionFwdAlgoDirect:ConvAsm1x1U,0.34736,0,miopenConvolutionFwdAlgoDirect,<unused>;miopenConvolutionFwdAlgoGEMM:gemm,0.74032,0,rocBlas,<unused>;miopenConvolutionFwdAlgoWinograd:ConvBinWinogradRxS,1.04,0,miopenConvolutionFwdAlgoWinograd,768x17x17x1x1x192x17x17x32xNCHWxFP16x0x0x1x1x1x1x1x1
768-17-17-1x1-128-17-17-32-0x0-1x1-1x1-0-NCHW-FP16-F=miopenConvolutionFwdAlgoImplicitGEMM:ConvHipImplicitGemmV4R1Fwd,0.21744,0,miopenConvolutionFwdAlgoImplicitGEMM,768x17x17x1x1x128x17x17x32xNCHWxFP16x0x0x1x1x1x1x1x1;miopenConvolutionFwdAlgoDirect:ConvAsm1x1U,0.25728,0,miopenConvolutionFwdAlgoDirect,<unused>;miopenConvolutionFwdAlgoGEMM:gemm,0.55472,0,rocBlas,<unused>;miopenConvolutionFwdAlgoWinograd:ConvBinWinogradRxS,0.69744,0,miopenConvolutionFwdAlgoWinograd,768x17x17x1x1x128x17x17x32xNCHWxFP16x0x0x1x1x1x1x1x1
128-17-17-1x7-128-17-17-32-0x3-1x1-1x1-0-NCHW-FP16-F=miopenConvolutionFwdAlgoImplicitGEMM:ConvHipImplicitGemmV4R1Fwd,0.24528,0,miopenConvolutionFwdAlgoImplicitGEMM,128x17x17x1x7x128x17x17x32xNCHWxFP16x0x3x1x1x1x1x1x1;miopenConvolutionFwdAlgoGEMM:gemm,6.01088,517888,rocBlas,<unused>;miopenConvolutionFwdAlgoWinograd:ConvBinWinogradRxS,0.44896,0,miopenConvolutionFwdAlgoWinograd,128x17x17x1x7x128x17x17x32xNCHWxFP16x0x3x1x1x1x1x1x1
128-17-17-7x1-192-17-17-32-3x0-1x1-1x1-0-NCHW-FP16-F=miopenConvolutionFwdAlgoImplicitGEMM:ConvHipImplicitGemmV4R1Fwd,0.3584,0,miopenConvolutionFwdAlgoImplicitGEMM,128x17x17x7x1x192x17x17x32xNCHWxFP16x3x0x1x1x1x1x1x1;miopenConvolutionFwdAlgoGEMM:gemm,5.58592,517888,rocBlas,<unused>;miopenConvolutionFwdAlgoWinograd:ConvBinWinogradRxS,0.5656,0,miopenConvolutionFwdAlgoWinograd,128x17x17x7x1x192x17x17x32xNCHWxFP16x3x0x1x1x1x1x1x1
128-17-17-7x1-128-17-17-32-3x0-1x1-1x1-0-NCHW-FP16-F=miopenConvolutionFwdAlgoImplicitGEMM:ConvHipImplicitGemmV4R1Fwd,0.272,0,miopenConvolutionFwdAlgoImplicitGEMM,128x17x17x7x1x128x17x17x32xNCHWxFP16x3x0x1x1x1x1x1x1;miopenConvolutionFwdAlgoGEMM:gemm,6.00576,517888,rocBlas,<unused>;miopenConvolutionFwdAlgoWinograd:ConvBinWinogradRxS,0.38592,0,miopenConvolutionFwdAlgoWinograd,128x17x17x7x1x128x17x17x32xNCHWxFP16x3x0x1x1x1x1x1x1
128-17-17-1x7-192-17-17-32-0x3-1x1-1x1-0-NCHW-FP16-F=miopenConvolutionFwdAlgoImplicitGEMM:ConvHipImplicitGemmV4R1Fwd,0.34064,0,miopenConvolutionFwdAlgoImplicitGEMM,128x17x17x1x7x192x17x17x32xNCHWxFP16x0x3x1x1x1x1x1x1;miopenConvolutionFwdAlgoGEMM:gemm,5.53984,517888,rocBlas,<unused>;miopenConvolutionFwdAlgoWinograd:ConvBinWinogradRxS,0.66304,0,miopenConvolutionFwdAlgoWinograd,128x17x17x1x7x192x17x17x32xNCHWxFP16x0x3x1x1x1x1x1x1
768-17-17-1x1-160-17-17-32-0x0-1x1-1x1-0-NCHW-FP16-F=miopenConvolutionFwdAlgoImplicitGEMM:ConvHipImplicitGemmV4R1Fwd,0.52672,0,miopenConvolutionFwdAlgoImplicitGEMM,768x17x17x1x1x160x17x17x32xNCHWxFP16x0x0x1x1x1x1x1x1;miopenConvolutionFwdAlgoDirect:ConvAsm1x1U,0.30032,0,miopenConvolutionFwdAlgoDirect,<unused>;miopenConvolutionFwdAlgoGEMM:gemm,0.72608,0,rocBlas,<unused>;miopenConvolutionFwdAlgoWinograd:ConvBinWinogradRxS,0.81104,0,miopenConvolutionFwdAlgoWinograd,768x17x17x1x1x160x17x17x32xNCHWxFP16x0x0x1x1x1x1x1x1
160-17-17-1x7-160-17-17-32-0x3-1x1-1x1-0-NCHW-FP16-F=miopenConvolutionFwdAlgoImplicitGEMM:ConvHipImplicitGemmV4R1Fwd,0.37472,0,miopenConvolutionFwdAlgoImplicitGEMM,160x17x17x1x7x160x17x17x32xNCHWxFP16x0x3x1x1x1x1x1x1;miopenConvolutionFwdAlgoGEMM:gemm,6.73792,647360,rocBlas,<unused>;miopenConvolutionFwdAlgoWinograd:ConvBinWinogradRxS,0.6328,0,miopenConvolutionFwdAlgoWinograd,160x17x17x1x7x160x17x17x32xNCHWxFP16x0x3x1x1x1x1x1x1
160-17-17-7x1-192-17-17-32-3x0-1x1-1x1-0-NCHW-FP16-F=miopenConvolutionFwdAlgoImplicitGEMM:ConvHipImplicitGemmV4R1Fwd,0.39776,0,miopenConvolutionFwdAlgoImplicitGEMM,160x17x17x7x1x192x17x17x32xNCHWxFP16x3x0x1x1x1x1x1x1;miopenConvolutionFwdAlgoGEMM:gemm,6.7072,647360,rocBlas,<unused>;miopenConvolutionFwdAlgoWinograd:ConvBinWinogradRxS,0.692,0,miopenConvolutionFwdAlgoWinograd,160x17x17x7x1x192x17x17x32xNCHWxFP16x3x0x1x1x1x1x1x1
160-17-17-7x1-160-17-17-32-3x0-1x1-1x1-0-NCHW-FP16-F=miopenConvolutionFwdAlgoImplicitGEMM:ConvHipImplicitGemmV4R1Fwd,0.39728,0,miopenConvolutionFwdAlgoImplicitGEMM,160x17x17x7x1x160x17x17x32xNCHWxFP16x3x0x1x1x1x1x1x1;miopenConvolutionFwdAlgoGEMM:gemm,7.20384,647360,rocBlas,<unused>;miopenConvolutionFwdAlgoWinograd:ConvBinWinogradRxS,0.54144,0,miopenConvolutionFwdAlgoWinograd,160x17x17x7x1x160x17x17x32xNCHWxFP16x3x0x1x1x1x1x1x1
160-17-17-1x7-192-17-17-32-0x3-1x1-1x1-0-NCHW-FP16-F=miopenConvolutionFwdAlgoImplicitGEMM:ConvHipImplicitGemmV4R1Fwd,0.40144,0,miopenConvolutionFwdAlgoImplicitGEMM,160x17x17x1x7x192x17x17x32xNCHWxFP16x0x3x1x1x1x1x1x1;miopenConvolutionFwdAlgoGEMM:gemm,6.71744,647360,rocBlas,<unused>;miopenConvolutionFwdAlgoWinograd:ConvBinWinogradRxS,0.81072,0,miopenConvolutionFwdAlgoWinograd,160x17x17x1x7x192x17x17x32xNCHWxFP16x0x3x1x1x1x1x1x1
192-17-17-1x7-192-17-17-32-0x3-1x1-1x1-0-NCHW-FP16-F=miopenConvolutionFwdAlgoImplicitGEMM:ConvHipImplicitGemmV4R1Fwd,0.4888,0,miopenConvolutionFwdAlgoImplicitGEMM,192x17x17x1x7x192x17x17x32xNCHWxFP16x0x3x1x1x1x1x1x1;miopenConvolutionFwdAlgoGEMM:gemm,7.91552,776832,rocBlas,<unused>;miopenConvolutionFwdAlgoWinograd:ConvBinWinogradRxS,0.965119,0,miopenConvolutionFwdAlgoWinograd,192x17x17x1x7x192x17x17x32xNCHWxFP16x0x3x1x1x1x1x1x1
192-17-17-7x1-192-17-17-32-3x0-1x1-1x1-0-NCHW-FP16-F=miopenConvolutionFwdAlgoImplicitGEMM:ConvHipImplicitGemmV4R1Fwd,0.47904,0,miopenConvolutionFwdAlgoImplicitGEMM,192x17x17x7x1x192x17x17x32xNCHWxFP16x3x0x1x1x1x1x1x1;miopenConvolutionFwdAlgoGEMM:gemm,7.8848,776832,rocBlas,<unused>;miopenConvolutionFwdAlgoWinograd:ConvBinWinogradRxS,0.822399,0,miopenConvolutionFwdAlgoWinograd,192x17x17x7x1x192x17x17x32xNCHWxFP16x3x0x1x1x1x1x1x1
192-17-17-3x3-320-8-8-32-0x0-2x2-1x1-0-NCHW-FP16-F=miopenConvolutionFwdAlgoImplicitGEMM:ConvHipImplicitGemmV4Fwd,0.22224,0,miopenConvolutionFwdAlgoImplicitGEMM,192x17x17x3x3x320x8x8x32xNCHWxFP16x0x0x2x2x1x1x1x1;miopenConvolutionFwdAlgoDirect:ConvOclDirectFwdGen,1.8568,0,miopenConvolutionFwdAlgoDirect,<unused>;miopenConvolutionFwdAlgoGEMM:gemm,2.92864,221184,rocBlas,<unused>;miopenConvolutionFwdAlgoWinograd:ConvBinWinogradRxS,0.42704,0,miopenConvolutionFwdAlgoWinograd,192x17x17x3x3x320x8x8x32xNCHWxFP16x0x0x2x2x1x1x1x1
192-17-17-3x3-192-8-8-32-0x0-2x2-1x1-0-NCHW-FP16-F=miopenConvolutionFwdAlgoImplicitGEMM:ConvHipImplicitGemmV4Fwd,0.1664,0,miopenConvolutionFwdAlgoImplicitGEMM,192x17x17x3x3x192x8x8x32xNCHWxFP16x0x0x2x2x1x1x1x1;miopenConvolutionFwdAlgoDirect:ConvOclDirectFwdGen,1.72768,0,miopenConvolutionFwdAlgoDirect,<unused>;miopenConvolutionFwdAlgoGEMM:gemm,3.7376,221184,rocBlas,<unused>;miopenConvolutionFwdAlgoWinograd:ConvBinWinogradRxS,0.29024,0,miopenConvolutionFwdAlgoWinograd,192x17x17x3x3x192x8x8x32xNCHWxFP16x0x0x2x2x1x1x1x1
1280-8-8-1x1-320-8-8-32-0x0-1x1-1x1-0-NCHW-FP16-F=miopenConvolutionFwdAlgoImplicitGEMM:ConvHipImplicitGemmV4Fwd,0.172,0,miopenConvolutionFwdAlgoImplicitGEMM,1280x8x8x1x1x320x8x8x32xNCHWxFP16x0x0x1x1x1x1x1x1;miopenConvolutionFwdAlgoDirect:ConvAsm1x1U,0.18496,0,miopenConvolutionFwdAlgoDirect,<unused>;miopenConvolutionFwdAlgoGEMM:gemm,0.56288,0,rocBlas,<unused>;miopenConvolutionFwdAlgoWinograd:ConvBinWinogradRxS,0.6472,0,miopenConvolutionFwdAlgoWinograd,1280x8x8x1x1x320x8x8x32xNCHWxFP16x0x0x1x1x1x1x1x1
1280-8-8-1x1-384-8-8-32-0x0-1x1-1x1-0-NCHW-FP16-F=miopenConvolutionFwdAlgoImplicitGEMM:ConvHipImplicitGemmV4Fwd,0.24096,0,miopenConvolutionFwdAlgoImplicitGEMM,1280x8x8x1x1x384x8x8x32xNCHWxFP16x0x0x1x1x1x1x1x1;miopenConvolutionFwdAlgoDirect:ConvAsm1x1U,0.23232,0,miopenConvolutionFwdAlgoDirect,<unused>;miopenConvolutionFwdAlgoGEMM:gemm,0.67888,0,rocBlas,<unused>;miopenConvolutionFwdAlgoWinograd:ConvBinWinogradRxS,0.855839,0,miopenConvolutionFwdAlgoWinograd,1280x8x8x1x1x384x8x8x32xNCHWxFP16x0x0x1x1x1x1x1x1
384-8-8-1x3-384-8-8-32-0x1-1x1-1x1-0-NCHW-FP16-F=miopenConvolutionFwdAlgoImplicitGEMM:ConvHipImplicitGemmV4R1Fwd,0.21888,0,miopenConvolutionFwdAlgoImplicitGEMM,384x8x8x1x3x384x8x8x32xNCHWxFP16x0x1x1x1x1x1x1x1;miopenConvolutionFwdAlgoGEMM:gemm,2.0992,147456,rocBlas,<unused>;miopenConvolutionFwdAlgoWinograd:ConvBinWinogradRxS,0.248,0,miopenConvolutionFwdAlgoWinograd,384x8x8x1x3x384x8x8x32xNCHWxFP16x0x1x1x1x1x1x1x1
384-8-8-3x1-384-8-8-32-1x0-1x1-1x1-0-NCHW-FP16-F=miopenConvolutionFwdAlgoImplicitGEMM:ConvHipImplicitGemmV4R1Fwd,0.2152,0,miopenConvolutionFwdAlgoImplicitGEMM,384x8x8x3x1x384x8x8x32xNCHWxFP16x1x0x1x1x1x1x1x1;miopenConvolutionFwdAlgoGEMM:gemm,2.04288,147456,rocBlas,<unused>;miopenConvolutionFwdAlgoWinograd:ConvBinWinogradRxS,0.2848,0,miopenConvolutionFwdAlgoWinograd,384x8x8x3x1x384x8x8x32xNCHWxFP16x1x0x1x1x1x1x1x1
1280-8-8-1x1-448-8-8-32-0x0-1x1-1x1-0-NCHW-FP16-F=miopenConvolutionFwdAlgoImplicitGEMM:ConvHipImplicitGemmV4Fwd,0.24368,0,miopenConvolutionFwdAlgoImplicitGEMM,1280x8x8x1x1x448x8x8x32xNCHWxFP16x0x0x1x1x1x1x1x1;miopenConvolutionFwdAlgoDirect:ConvAsm1x1U,0.24304,0,miopenConvolutionFwdAlgoDirect,<unused>;miopenConvolutionFwdAlgoGEMM:gemm,0.78352,0,rocBlas,<unused>;miopenConvolutionFwdAlgoWinograd:ConvBinWinogradRxS,0.856319,0,miopenConvolutionFwdAlgoWinograd,1280x8x8x1x1x448x8x8x32xNCHWxFP16x0x0x1x1x1x1x1x1
448-8-8-3x3-384-8-8-32-1x1-1x1-1x1-0-NCHW-FP16-F=miopenConvolutionFwdAlgoImplicitGEMM:ConvHipImplicitGemmV4R1Fwd,0.67856,0,miopenConvolutionFwdAlgoImplicitGEMM,448x8x8x3x3x384x8x8x32xNCHWxFP16x1x1x1x1x1x1x1x1;miopenConvolutionFwdAlgoDirect:ConvOclDirectFwd,1.92816,0,miopenConvolutionFwdAlgoDirect,<unused>;miopenConvolutionFwdAlgoGEMM:gemm,5.78048,516096,rocBlas,<unused>;miopenConvolutionFwdAlgoWinograd:ConvBinWinogradRxS,0.25152,0,miopenConvolutionFwdAlgoWinograd,448x8x8x3x3x384x8x8x32xNCHWxFP16x1x1x1x1x1x1x1x1
1280-8-8-1x1-192-8-8-32-0x0-1x1-1x1-0-NCHW-FP16-F=miopenConvolutionFwdAlgoImplicitGEMM:ConvHipImplicitGemmV4Fwd,0.12832,0,miopenConvolutionFwdAlgoImplicitGEMM,1280x8x8x1x1x192x8x8x32xNCHWxFP16x0x0x1x1x1x1x1x1;miopenConvolutionFwdAlgoDirect:ConvAsm1x1U,0.15024,0,miopenConvolutionFwdAlgoDirect,<unused>;miopenConvolutionFwdAlgoGEMM:gemm,0.36112,0,rocBlas,<unused>;miopenConvolutionFwdAlgoWinograd:ConvBinWinogradRxS,0.4856,0,miopenConvolutionFwdAlgoWinograd,1280x8x8x1x1x192x8x8x32xNCHWxFP16x0x0x1x1x1x1x1x1
2048-8-8-1x1-320-8-8-32-0x0-1x1-1x1-0-NCHW-FP16-F=miopenConvolutionFwdAlgoImplicitGEMM:ConvHipImplicitGemmV4Fwd,0.47424,0,miopenConvolutionFwdAlgoImplicitGEMM,2048x8x8x1x1x320x8x8x32xNCHWxFP16x0x0x1x1x1x1x1x1;miopenConvolutionFwdAlgoDirect:ConvAsm1x1U,0.33168,0,miopenConvolutionFwdAlgoDirect,<unused>;miopenConvolutionFwdAlgoGEMM:gemm,0.28704,0,rocBlas,<unused>;miopenConvolutionFwdAlgoWinograd:ConvBinWinogradRxS,1.07968,0,miopenConvolutionFwdAlgoWinograd,2048x8x8x1x1x320x8x8x32xNCHWxFP16x0x0x1x1x1x1x1x1
2048-8-8-1x1-384-8-8-32-0x0-1x1-1x1-0-NCHW-FP16-F=miopenConvolutionFwdAlgoImplicitGEMM:ConvHipImplicitGemmV4Fwd,0.50384,0,miopenConvolutionFwdAlgoImplicitGEMM,2048x8x8x1x1x384x8x8x32xNCHWxFP16x0x0x1x1x1x1x1x1;miopenConvolutionFwdAlgoDirect:ConvAsm1x1U,0.37712,0,miopenConvolutionFwdAlgoDirect,<unused>;miopenConvolutionFwdAlgoGEMM:gemm,0.4736,0,rocBlas,<unused>;miopenConvolutionFwdAlgoWinograd:ConvBinWinogradRxS,1.3376,0,miopenConvolutionFwdAlgoWinograd,2048x8x8x1x1x384x8x8x32xNCHWxFP16x0x0x1x1x1x1x1x1
2048-8-8-1x1-448-8-8-32-0x0-1x1-1x1-0-NCHW-FP16-F=miopenConvolutionFwdAlgoImplicitGEMM:ConvHipImplicitGemmV4Fwd,0.52608,0,miopenConvolutionFwdAlgoImplicitGEMM,2048x8x8x1x1x448x8x8x32xNCHWxFP16x0x0x1x1x1x1x1x1;miopenConvolutionFwdAlgoDirect:ConvAsm1x1U,0.3904,0,miopenConvolutionFwdAlgoDirect,<unused>;miopenConvolutionFwdAlgoGEMM:gemm,1.21024,0,rocBlas,<unused>;miopenConvolutionFwdAlgoWinograd:ConvBinWinogradRxS,1.34192,0,miopenConvolutionFwdAlgoWinograd,2048x8x8x1x1x448x8x8x32xNCHWxFP16x0x0x1x1x1x1x1x1
2048-8-8-1x1-192-8-8-32-0x0-1x1-1x1-0-NCHW-FP16-F=miopenConvolutionFwdAlgoImplicitGEMM:ConvHipImplicitGemmV4Fwd,0.25392,0,miopenConvolutionFwdAlgoImplicitGEMM,2048x8x8x1x1x192x8x8x32xNCHWxFP16x0x0x1x1x1x1x1x1;miopenConvolutionFwdAlgoDirect:ConvAsm1x1U,0.26928,0,miopenConvolutionFwdAlgoDirect,<unused>;miopenConvolutionFwdAlgoGEMM:gemm,0.2,0,rocBlas,<unused>;miopenConvolutionFwdAlgoWinograd:ConvBinWinogradRxS,0.846559,0,miopenConvolutionFwdAlgoWinograd,2048x8x8x1x1x192x8x8x32xNCHWxFP16x0x0x1x1x1x1x1x1
3-224-224-3x3-64-224-224-16-1x1-1x1-1x1-0-NCHW-FP32-F=miopenConvolutionFwdAlgoDirect:ConvOclDirectFwd,15.092,0,miopenConvolutionFwdAlgoDirect,<unused>;miopenConvolutionFwdAlgoGEMM:gemm,1.96608,5419008,rocBlas,<unused>;miopenConvolutionFwdAlgoWinograd:ConvBinWinogradRxSf2x3,0.67488,0,miopenConvolutionFwdAlgoWinograd,3x224x224x3x3x64x224x224x16xNCHWxFP32x1x1x1x1x1x1x1x1
64-224-224-3x3-64-224-224-16-1x1-1x1-1x1-0-NCHW-FP32-F=miopenConvolutionFwdAlgoWinograd:ConvBinWinogradRxS,2.70304,0,miopenConvolutionFwdAlgoWinograd,64x224x224x3x3x64x224x224x16xNCHWxFP32x1x1x1x1x1x1x1x1
64-112-112-3x3-128-112-112-16-1x1-1x1-1x1-0-NCHW-FP32-F=miopenConvolutionFwdAlgoWinograd:ConvBinWinogradRxSf2x3,1.54512,0,miopenConvolutionFwdAlgoWinograd,64x112x112x3x3x128x112x112x16xNCHWxFP32x1x1x1x1x1x1x1x1
128-112-112-3x3-128-112-112-16-1x1-1x1-1x1-0-NCHW-FP32-F=miopenConvolutionFwdAlgoWinograd:ConvBinWinogradRxS,2.48512,0,miopenConvolutionFwdAlgoWinograd,128x112x112x3x3x128x112x112x16xNCHWxFP32x1x1x1x1x1x1x1x1
128-56-56-3x3-256-56-56-16-1x1-1x1-1x1-0-NCHW-FP32-F=miopenConvolutionFwdAlgoWinograd:ConvBinWinograd3x3U,1.45344,0,miopenConvolutionFwdAlgoWinograd,128x56x56x3x3x256x56x56x16xNCHWxFP32x1x1x1x1x1x1x1x1
256-56-56-3x3-256-56-56-16-1x1-1x1-1x1-0-NCHW-FP32-F=miopenConvolutionFwdAlgoWinograd:ConvBinWinogradRxS,2.43296,0,miopenConvolutionFwdAlgoWinograd,256x56x56x3x3x256x56x56x16xNCHWxFP32x1x1x1x1x1x1x1x1
256-28-28-3x3-512-28-28-16-1x1-1x1-1x1-0-NCHW-FP32-F=miopenConvolutionFwdAlgoWinograd:ConvBinWinograd3x3U,1.428,0,miopenConvolutionFwdAlgoWinograd,256x28x28x3x3x512x28x28x16xNCHWxFP32x1x1x1x1x1x1x1x1
512-28-28-3x3-512-28-28-16-1x1-1x1-1x1-0-NCHW-FP32-F=miopenConvolutionFwdAlgoWinograd:ConvBinWinogradRxS,2.44288,0,miopenConvolutionFwdAlgoWinograd,512x28x28x3x3x512x28x28x16xNCHWxFP32x1x1x1x1x1x1x1x1
512-14-14-3x3-512-14-14-16-1x1-1x1-1x1-0-NCHW-FP32-F=miopenConvolutionFwdAlgoWinograd:ConvBinWinogradRxSf2x3,0.74432,0,miopenConvolutionFwdAlgoWinograd,512x14x14x3x3x512x14x14x16xNCHWxFP32x1x1x1x1x1x1x1x1
3-224-224-3x3-64-224-224-16-1x1-1x1-1x1-0-NCHW-FP16-F=miopenConvolutionFwdAlgoDirect:ConvOclDirectFwd,0.59328,0,miopenConvolutionFwdAlgoDirect,<unused>;miopenConvolutionFwdAlgoGEMM:gemm,1.81504,2709504,rocBlas,<unused>
64-224-224-3x3-64-224-224-16-1x1-1x1-1x1-0-NCHW-FP16-F=miopenConvolutionFwdAlgoImplicitGEMM:ConvHipImplicitGemmV4R1Fwd,4.37472,0,miopenConvolutionFwdAlgoImplicitGEMM,64x224x224x3x3x64x224x224x16xNCHWxFP16x1x1x1x1x1x1x1x1;miopenConvolutionFwdAlgoDirect:ConvOclDirectFwd,8.90831,0,miopenConvolutionFwdAlgoDirect,<unused>;miopenConvolutionFwdAlgoGEMM:gemm,8.22784,57802752,rocBlas,<unused>;miopenConvolutionFwdAlgoWinograd:ConvBinWinogradRxS,1.96992,0,miopenConvolutionFwdAlgoWinograd,64x224x224x3x3x64x224x224x16xNCHWxFP16x1x1x1x1x1x1x1x1
64-112-112-3x3-128-112-112-16-1x1-1x1-1x1-0-NCHW-FP16-F=miopenConvolutionFwdAlgoImplicitGEMM:ConvHipImplicitGemmV4R1Fwd,1.99824,0,miopenConvolutionFwdAlgoImplicitGEMM,64x112x112x3x3x128x112x112x16xNCHWxFP16x1x1x1x1x1x1x1x1;miopenConvolutionFwdAlgoDirect:ConvOclDirectFwd,4.84928,0,miopenConvolutionFwdAlgoDirect,<unused>;miopenConvolutionFwdAlgoGEMM:gemm,3.72736,14450688,rocBlas,<unused>;miopenConvolutionFwdAlgoWinograd:ConvBinWinogradRxS,1.02704,0,miopenConvolutionFwdAlgoWinograd,64x112x112x3x3x128x112x112x16xNCHWxFP16x1x1x1x1x1x1x1x1
128-112-112-3x3-128-112-112-16-1x1-1x1-1x1-0-NCHW-FP16-F=miopenConvolutionFwdAlgoImplicitGEMM:ConvHipImplicitGemmV4R1Fwd,3.9424,0,miopenConvolutionFwdAlgoImplicitGEMM,128x112x112x3x3x128x112x112x16xNCHWxFP16x1x1x1x1x1x1x1x1;miopenConvolutionFwdAlgoDirect:ConvOclDirectFwd,9.70943,0,miopenConvolutionFwdAlgoDirect,<unused>;miopenConvolutionFwdAlgoGEMM:gemm,6.74304,28901376,rocBlas,<unused>;miopenConvolutionFwdAlgoWinograd:ConvBinWinogradRxS,1.80704,0,miopenConvolutionFwdAlgoWinograd,128x112x112x3x3x128x112x112x16xNCHWxFP16x1x1x1x1x1x1x1x1
128-56-56-3x3-256-56-56-16-1x1-1x1-1x1-0-NCHW-FP16-F=miopenConvolutionFwdAlgoImplicitGEMM:ConvHipImplicitGemmV4R1Fwd,2.03328,0,miopenConvolutionFwdAlgoImplicitGEMM,128x56x56x3x3x256x56x56x16xNCHWxFP16x1x1x1x1x1x1x1x1;miopenConvolutionFwdAlgoDirect:ConvOclDirectFwd,5.44863,0,miopenConvolutionFwdAlgoDirect,<unused>;miopenConvolutionFwdAlgoGEMM:gemm,3.39456,7225344,rocBlas,<unused>;miopenConvolutionFwdAlgoWinograd:ConvBinWinogradRxS,0.937919,0,miopenConvolutionFwdAlgoWinograd,128x56x56x3x3x256x56x56x16xNCHWxFP16x1x1x1x1x1x1x1x1
256-56-56-3x3-256-56-56-16-1x1-1x1-1x1-0-NCHW-FP16-F=miopenConvolutionFwdAlgoImplicitGEMM:ConvHipImplicitGemmV4R1Fwd,3.97024,0,miopenConvolutionFwdAlgoImplicitGEMM,256x56x56x3x3x256x56x56x16xNCHWxFP16x1x1x1x1x1x1x1x1;miopenConvolutionFwdAlgoDirect:ConvOclDirectFwd,10.9473,0,miopenConvolutionFwdAlgoDirect,<unused>;miopenConvolutionFwdAlgoGEMM:gemm,7.21408,14450688,rocBlas,<unused>;miopenConvolutionFwdAlgoWinograd:ConvBinWinogradRxS,1.72496,0,miopenConvolutionFwdAlgoWinograd,256x56x56x3x3x256x56x56x16xNCHWxFP16x1x1x1x1x1x1x1x1
256-28-28-3x3-512-28-28-16-1x1-1x1-1x1-0-NCHW-FP16-F=miopenConvolutionFwdAlgoImplicitGEMM:ConvHipImplicitGemmV4R1Fwd,2.04416,0,miopenConvolutionFwdAlgoImplicitGEMM,256x28x28x3x3x512x28x28x16xNCHWxFP16x1x1x1x1x1x1x1x1;miopenConvolutionFwdAlgoDirect:ConvOclDirectFwd,5.06655,0,miopenConvolutionFwdAlgoDirect,<unused>;miopenConvolutionFwdAlgoGEMM:gemm,4.6848,3612672,rocBlas,<unused>;miopenConvolutionFwdAlgoWinograd:ConvBinWinogradRxS,0.893599,0,miopenConvolutionFwdAlgoWinograd,256x28x28x3x3x512x28x28x16xNCHWxFP16x1x1x1x1x1x1x1x1
512-28-28-3x3-512-28-28-16-1x1-1x1-1x1-0-NCHW-FP16-F=miopenConvolutionFwdAlgoImplicitGEMM:ConvHipImplicitGemmV4R1Fwd,4.12687,0,miopenConvolutionFwdAlgoImplicitGEMM,512x28x28x3x3x512x28x28x16xNCHWxFP16x1x1x1x1x1x1x1x1;miopenConvolutionFwdAlgoDirect:ConvOclDirectFwd,9.91471,0,miopenConvolutionFwdAlgoDirect,<unused>;miopenConvolutionFwdAlgoGEMM:gemm,9.1648,7225344,rocBlas,<unused>;miopenConvolutionFwdAlgoWinograd:ConvBinWinogradRxS,1.7168,0,miopenConvolutionFwdAlgoWinograd,512x28x28x3x3x512x28x28x16xNCHWxFP16x1x1x1x1x1x1x1x1
512-14-14-3x3-512-14-14-16-1x1-1x1-1x1-0-NCHW-FP16-F=miopenConvolutionFwdAlgoImplicitGEMM:ConvHipImplicitGemmV4R1Fwd,1.30272,0,miopenConvolutionFwdAlgoImplicitGEMM,512x14x14x3x3x512x14x14x16xNCHWxFP16x1x1x1x1x1x1x1x1;miopenConvolutionFwdAlgoDirect:ConvOclDirectFwd,3.33184,0,miopenConvolutionFwdAlgoDirect,<unused>;miopenConvolutionFwdAlgoGEMM:gemm,4.08576,1806336,rocBlas,<unused>;miopenConvolutionFwdAlgoWinograd:ConvBinWinogradRxS,0.46848,0,miopenConvolutionFwdAlgoWinograd,512x14x14x3x3x512x14x14x16xNCHWxFP16x1x1x1x1x1x1x1x1
64-56-56-1x1-288-56-56-32-0x0-1x1-1x1-0-NCHW-FP32-F=miopenConvolutionFwdAlgoImplicitGEMM:ConvHipImplicitGemmV4_1x1,1.45856,0,miopenConvolutionFwdAlgoImplicitGEMM,64x56x56x1x1x288x56x56x32xNCHWxFP32x0x0x1x1x1x1x1x1;miopenConvolutionFwdAlgoDirect:ConvOclDirectFwd1x1,0.57408,0,miopenConvolutionFwdAlgoDirect,<unused>;miopenConvolutionFwdAlgoGEMM:gemm,0.45632,0,rocBlas,<unused>;miopenConvolutionFwdAlgoWinograd:ConvBinWinogradRxSf3x2,0.979999,0,miopenConvolutionFwdAlgoWinograd,64x56x56x1x1x288x56x56x32xNCHWxFP32x0x0x1x1x1x1x1x1
64-56-56-1x1-96-56-56-32-0x0-1x1-1x1-0-NCHW-FP32-F=miopenConvolutionFwdAlgoImplicitGEMM:ConvHipImplicitGemmV4_1x1,0.49072,0,miopenConvolutionFwdAlgoImplicitGEMM,64x56x56x1x1x96x56x56x32xNCHWxFP32x0x0x1x1x1x1x1x1;miopenConvolutionFwdAlgoDirect:ConvOclDirectFwd1x1,0.28576,0,miopenConvolutionFwdAlgoDirect,<unused>;miopenConvolutionFwdAlgoGEMM:gemm,0.28016,0,rocBlas,<unused>;miopenConvolutionFwdAlgoWinograd:ConvBinWinogradRxSf3x2,0.36048,0,miopenConvolutionFwdAlgoWinograd,64x56x56x1x1x96x56x56x32xNCHWxFP32x0x0x1x1x1x1x1x1
96-56-56-3x3-96-56-56-32-1x1-1x1-1x1-0-NCHW-FP32-F_g32=miopenConvolutionFwdAlgoDirect:ConvOclDirectFwd,0.39248,0,miopenConvolutionFwdAlgoDirect,<unused>;miopenConvolutionFwdAlgoGEMM:gemm,3.45088,10838016,rocBlas,<unused>;miopenConvolutionFwdAlgoWinograd:ConvBinWinogradRxSf2x3,1.37152,0,miopenConvolutionFwdAlgoWinograd,96x56x56x3x3x96x56x56x32xNCHWxFP32x1x1x1x1x1x1x32x1
96-56-56-1x1-272-56-56-32-0x0-1x1-1x1-0-NCHW-FP32-F=miopenConvolutionFwdAlgoImplicitGEMM:ConvHipImplicitGemmV4_1x1,2.04288,0,miopenConvolutionFwdAlgoImplicitGEMM,96x56x56x1x1x272x56x56x32xNCHWxFP32x0x0x1x1x1x1x1x1;miopenConvolutionFwdAlgoDirect:ConvOclDirectFwd1x1,0.883039,0,miopenConvolutionFwdAlgoDirect,<unused>;miopenConvolutionFwdAlgoGEMM:gemm,0.61616,0,rocBlas,<unused>;miopenConvolutionFwdAlgoWinograd:ConvBinWinogradRxSf3x2,1.33728,0,miopenConvolutionFwdAlgoWinograd,96x56x56x1x1x272x56x56x32xNCHWxFP32x0x0x1x1x1x1x1x1
304-56-56-1x1-96-56-56-32-0x0-1x1-1x1-0-NCHW-FP32-F=miopenConvolutionFwdAlgoImplicitGEMM:ConvHipImplicitGemmV4_1x1,1.58528,0,miopenConvolutionFwdAlgoImplicitGEMM,304x56x56x1x1x96x56x56x32xNCHWxFP32x0x0x1x1x1x1x1x1;miopenConvolutionFwdAlgoDirect:ConvOclDirectFwd1x1,0.7896,0,miopenConvolutionFwdAlgoDirect,<unused>;miopenConvolutionFwdAlgoGEMM:gemm,0.788959,0,rocBlas,<unused>;miopenConvolutionFwdAlgoWinograd:ConvBinWinogradRxSf3x2,1.31568,0,miopenConvolutionFwdAlgoWinograd,304x56x56x1x1x96x56x56x32xNCHWxFP32x0x0x1x1x1x1x1x1
320-56-56-1x1-96-56-56-32-0x0-1x1-1x1-0-NCHW-FP32-F=miopenConvolutionFwdAlgoImplicitGEMM:ConvHipImplicitGemmV4_1x1,1.50112,0,miopenConvolutionFwdAlgoImplicitGEMM,320x56x56x1x1x96x56x56x32xNCHWxFP32x0x0x1x1x1x1x1x1;miopenConvolutionFwdAlgoDirect:ConvOclDirectFwd1x1,0.80448,0,miopenConvolutionFwdAlgoDirect,<unused>;miopenConvolutionFwdAlgoGEMM:gemm,0.826239,0,rocBlas,<unused>;miopenConvolutionFwdAlgoWinograd:ConvBinWinogradRxSf3x2,1.35984,0,miopenConvolutionFwdAlgoWinograd,320x56x56x1x1x96x56x56x32xNCHWxFP32x0x0x1x1x1x1x1x1
336-56-56-1x1-576-28-28-32-0x0-2x2-1x1-0-NCHW-FP32-F=miopenConvolutionFwdAlgoImplicitGEMM:ConvHipImplicitGemmV4_1x1,1.6528,0,miopenConvolutionFwdAlgoImplicitGEMM,336x56x56x1x1x576x28x28x32xNCHWxFP32x0x0x2x2x1x1x1x1;miopenConvolutionFwdAlgoDirect:ConvAsm1x1U,1.65456,33718272,miopenConvolutionFwdAlgoDirect,<unused>;miopenConvolutionFwdAlgoGEMM:gemm,1.52464,91521024,rocBlas,<unused>;miopenConvolutionFwdAlgoWinograd:ConvBinWinogradRxS,7.21487,0,miopenConvolutionFwdAlgoWinograd,336x56x56x1x1x576x28x28x32xNCHWxFP32x0x0x2x2x1x1x1x1
336-56-56-1x1-192-56-56-32-0x0-1x1-1x1-0-NCHW-FP32-F=miopenConvolutionFwdAlgoImplicitGEMM:ConvHipImplicitGemmV4_1x1,1.70848,0,miopenConvolutionFwdAlgoImplicitGEMM,336x56x56x1x1x192x56x56x32xNCHWxFP32x0x0x1x1x1x1x1x1;miopenConvolutionFwdAlgoDirect:ConvOclDirectFwd1x1,1.65872,0,miopenConvolutionFwdAlgoDirect,<unused>;miopenConvolutionFwdAlgoGEMM:gemm,1.65024,0,rocBlas,<unused>;miopenConvolutionFwdAlgoWinograd:ConvBinWinogradRxSf3x2,2.74768,0,miopenConvolutionFwdAlgoWinograd,336x56x56x1x1x192x56x56x32xNCHWxFP32x0x0x1x1x1x1x1x1
192-56-56-3x3-192-28-28-32-1x1-2x2-1x1-0-NCHW-FP32-F_g32=miopenConvolutionFwdAlgoDirect:ConvOclDirectFwd,0.54736,0,miopenConvolutionFwdAlgoDirect,<unused>;miopenConvolutionFwdAlgoGEMM:gemm,2.4064,5419008,rocBlas,<unused>;miopenConvolutionFwdAlgoWinograd:ConvBinWinogradRxSf2x3,0.941439,0,miopenConvolutionFwdAlgoWinograd,192x56x56x3x3x192x28x28x32xNCHWxFP32x1x1x2x2x1x1x32x1
192-28-28-1x1-544-28-28-32-0x0-1x1-1x1-0-NCHW-FP32-F=miopenConvolutionFwdAlgoWinograd:ConvBinWinogradRxSf3x2,1.30624,0,miopenConvolutionFwdAlgoWinograd,192x28x28x1x1x544x28x28x32xNCHWxFP32x0x0x1x1x1x1x1x1;miopenConvolutionFwdAlgoGEMM:gemm,0.57536,0,rocBlas,<unused>
64-56-56-1x1-64-56-56-32-0x0-1x1-1x1-0-NCHW-FP32-F=miopenConvolutionFwdAlgoImplicitGEMM:ConvHipImplicitGemmV4_1x1,0.23904,0,miopenConvolutionFwdAlgoImplicitGEMM,64x56x56x1x1x64x56x56x32xNCHWxFP32x0x0x1x1x1x1x1x1;miopenConvolutionFwdAlgoDirect:ConvOclDirectFwd1x1,0.20448,0,miopenConvolutionFwdAlgoDirect,<unused>;miopenConvolutionFwdAlgoGEMM:gemm,0.11008,0,rocBlas,<unused>;miopenConvolutionFwdAlgoWinograd:ConvBinWinogradRxSf3x2,0.26064,0,miopenConvolutionFwdAlgoWinograd,64x56x56x1x1x64x56x56x32xNCHWxFP32x0x0x1x1x1x1x1x1
64-56-56-3x3-64-56-56-32-1x1-1x1-1x1-0-NCHW-FP32-F=miopenConvolutionFwdAlgoWinograd:ConvBinWinogradRxSf2x3,0.41984,0,miopenConvolutionFwdAlgoWinograd,64x56x56x3x3x64x56x56x32xNCHWxFP32x1x1x1x1x1x1x1x1
128-56-56-1x1-256-56-56-32-0x0-1x1-1x1-0-NCHW-FP32-F=miopenConvolutionFwdAlgoImplicitGEMM:ConvHipImplicitGemmV4_1x1,1.40496,0,miopenConvolutionFwdAlgoImplicitGEMM,128x56x56x1x1x256x56x56x32xNCHWxFP32x0x0x1x1x1x1x1x1;miopenConvolutionFwdAlgoDirect:ConvOclDirectFwd1x1,0.771999,0,miopenConvolutionFwdAlgoDirect,<unused>;miopenConvolutionFwdAlgoGEMM:gemm,0.650079,0,rocBlas,<unused>;miopenConvolutionFwdAlgoWinograd:ConvBinWinogradRxSf3x2,1.53408,0,miopenConvolutionFwdAlgoWinograd,128x56x56x1x1x256x56x56x32xNCHWxFP32x0x0x1x1x1x1x1x1
256-56-56-1x1-64-56-56-32-0x0-1x1-1x1-0-NCHW-FP32-F=miopenConvolutionFwdAlgoImplicitGEMM:ConvHipImplicitGemmV4_1x1,0.591359,0,miopenConvolutionFwdAlgoImplicitGEMM,256x56x56x1x1x64x56x56x32xNCHWxFP32x0x0x1x1x1x1x1x1;miopenConvolutionFwdAlgoDirect:ConvOclDirectFwd1x1,0.51104,0,miopenConvolutionFwdAlgoDirect,<unused>;miopenConvolutionFwdAlgoGEMM:gemm,0.35728,0,rocBlas,<unused>;miopenConvolutionFwdAlgoWinograd:ConvBinWinogradRxSf3x2,0.770399,0,miopenConvolutionFwdAlgoWinograd,256x56x56x1x1x64x56x56x32xNCHWxFP32x0x0x1x1x1x1x1x1
64-56-56-1x1-256-56-56-32-0x0-1x1-1x1-0-NCHW-FP32-F=miopenConvolutionFwdAlgoImplicitGEMM:ConvHipImplicitGemmV4_1x1,0.695679,0,miopenConvolutionFwdAlgoImplicitGEMM,64x56x56x1x1x256x56x56x32xNCHWxFP32x0x0x1x1x1x1x1x1;miopenConvolutionFwdAlgoDirect:ConvOclDirectFwd1x1,0.51024,0,miopenConvolutionFwdAlgoDirect,<unused>;miopenConvolutionFwdAlgoGEMM:gemm,0.3488,0,rocBlas,<unused>;miopenConvolutionFwdAlgoWinograd:ConvBinWinogradRxSf3x2,0.873119,0,miopenConvolutionFwdAlgoWinograd,64x56x56x1x1x256x56x56x32xNCHWxFP32x0x0x1x1x1x1x1x1
128-56-56-3x3-128-28-28-32-1x1-2x2-1x1-0-NCHW-FP32-F=miopenConvolutionFwdAlgoImplicitGEMM:ConvHipImplicitGemmV4R1Fwd,0.867839,0,miopenConvolutionFwdAlgoImplicitGEMM,128x56x56x3x3x128x28x28x32xNCHWxFP32x1x1x2x2x1x1x1x1;miopenConvolutionFwdAlgoDirect:ConvOclDirectFwd,4.99919,0,miopenConvolutionFwdAlgoDirect,<unused>;miopenConvolutionFwdAlgoGEMM:gemm,3.01056,3612672,rocBlas,<unused>;miopenConvolutionFwdAlgoWinograd:ConvBinWinogradRxS,1.54704,0,miopenConvolutionFwdAlgoWinograd,128x56x56x3x3x128x28x28x32xNCHWxFP32x1x1x2x2x1x1x1x1
384-28-28-1x1-512-28-28-32-0x0-1x1-1x1-0-NCHW-FP32-F=miopenConvolutionFwdAlgoImplicitGEMM:ConvHipImplicitGemmV4_1x1,1.16944,0,miopenConvolutionFwdAlgoImplicitGEMM,384x28x28x1x1x512x28x28x32xNCHWxFP32x0x0x1x1x1x1x1x1;miopenConvolutionFwdAlgoDirect:ConvOclDirectFwd1x1,1.32,0,miopenConvolutionFwdAlgoDirect,<unused>;miopenConvolutionFwdAlgoGEMM:gemm,1.24352,0,rocBlas,<unused>;miopenConvolutionFwdAlgoWinograd:ConvBinWinogradRxSf3x2,2.28528,0,miopenConvolutionFwdAlgoWinograd,384x28x28x1x1x512x28x28x32xNCHWxFP32x0x0x1x1x1x1x1x1
512-28-28-1x1-128-28-28-32-0x0-1x1-1x1-0-NCHW-FP32-F=miopenConvolutionFwdAlgoImplicitGEMM:ConvHipImplicitGemmV4_1x1,0.46336,0,miopenConvolutionFwdAlgoImplicitGEMM,512x28x28x1x1x128x28x28x32xNCHWxFP32x0x0x1x1x1x1x1x1;miopenConvolutionFwdAlgoDirect:ConvOclDirectFwd1x1,0.40528,0,miopenConvolutionFwdAlgoDirect,<unused>;miopenConvolutionFwdAlgoGEMM:gemm,0.42784,0,rocBlas,<unused>;miopenConvolutionFwdAlgoWinograd:ConvBinWinogradRxSf3x2,0.926239,0,miopenConvolutionFwdAlgoWinograd,512x28x28x1x1x128x28x28x32xNCHWxFP32x0x0x1x1x1x1x1x1
128-28-28-3x3-128-28-28-32-1x1-1x1-1x1-0-NCHW-FP32-F=miopenConvolutionFwdAlgoWinograd:ConvBinWinogradRxSf2x3,0.40272,0,miopenConvolutionFwdAlgoWinograd,128x28x28x3x3x128x28x28x32xNCHWxFP32x1x1x1x1x1x1x1x1
128-28-28-1x1-512-28-28-32-0x0-1x1-1x1-0-NCHW-FP32-F=miopenConvolutionFwdAlgoImplicitGEMM:ConvHipImplicitGemmV4_1x1,0.55328,0,miopenConvolutionFwdAlgoImplicitGEMM,128x28x28x1x1x512x28x28x32xNCHWxFP32x0x0x1x1x1x1x1x1;miopenConvolutionFwdAlgoDirect:ConvOclDirectFwd1x1,0.51968,0,miopenConvolutionFwdAlgoDirect,<unused>;miopenConvolutionFwdAlgoGEMM:gemm,0.38432,0,rocBlas,<unused>;miopenConvolutionFwdAlgoWinograd:ConvBinWinogradRxSf3x2,0.862559,0,miopenConvolutionFwdAlgoWinograd,128x28x28x1x1x512x28x28x32xNCHWxFP32x0x0x1x1x1x1x1x1
256-28-28-3x3-256-14-14-32-1x1-2x2-1x1-0-NCHW-FP32-F=miopenConvolutionFwdAlgoImplicitGEMM:ConvHipImplicitGemmV4R1Fwd,0.952959,0,miopenConvolutionFwdAlgoImplicitGEMM,256x28x28x3x3x256x14x14x32xNCHWxFP32x1x1x2x2x1x1x1x1;miopenConvolutionFwdAlgoDirect:ConvOclDirectFwd,4.54111,0,miopenConvolutionFwdAlgoDirect,<unused>;miopenConvolutionFwdAlgoGEMM:gemm,3.1744,1806336,rocBlas,<unused>;miopenConvolutionFwdAlgoWinograd:ConvBinWinogradRxS,1.58144,0,miopenConvolutionFwdAlgoWinograd,256x28x28x3x3x256x14x14x32xNCHWxFP32x1x1x2x2x1x1x1x1
768-14-14-1x1-1024-14-14-32-0x0-1x1-1x1-0-NCHW-FP32-F=miopenConvolutionFwdAlgoImplicitGEMM:ConvHipImplicitGemmV4_1x1,1.50112,0,miopenConvolutionFwdAlgoImplicitGEMM,768x14x14x1x1x1024x14x14x32xNCHWxFP32x0x0x1x1x1x1x1x1;miopenConvolutionFwdAlgoDirect:ConvAsm1x1U,1.54368,0,miopenConvolutionFwdAlgoDirect,<unused>;miopenConvolutionFwdAlgoGEMM:gemm,1.48208,0,rocBlas,<unused>;miopenConvolutionFwdAlgoWinograd:ConvBinWinogradRxSf3x2,2.3096,0,miopenConvolutionFwdAlgoWinograd,768x14x14x1x1x1024x14x14x32xNCHWxFP32x0x0x1x1x1x1x1x1
1024-14-14-1x1-256-14-14-32-0x0-1x1-1x1-0-NCHW-FP32-F=miopenConvolutionFwdAlgoImplicitGEMM:ConvHipImplicitGemmV4_1x1,0.65456,0,miopenConvolutionFwdAlgoImplicitGEMM,1024x14x14x1x1x256x14x14x32xNCHWxFP32x0x0x1x1x1x1x1x1;miopenConvolutionFwdAlgoDirect:ConvAsm1x1U,0.6168,0,miopenConvolutionFwdAlgoDirect,<unused>;miopenConvolutionFwdAlgoGEMM:gemm,0.54272,0,rocBlas,<unused>;miopenConvolutionFwdAlgoWinograd:ConvBinWinogradRxSf3x2,0.917759,0,miopenConvolutionFwdAlgoWinograd,1024x14x14x1x1x256x14x14x32xNCHWxFP32x0x0x1x1x1x1x1x1
256-14-14-3x3-256-14-14-32-1x1-1x1-1x1-0-NCHW-FP32-F=miopenConvolutionFwdAlgoWinograd:ConvBinWinograd3x3U,0.38784,0,miopenConvolutionFwdAlgoWinograd,256x14x14x3x3x256x14x14x32xNCHWxFP32x1x1x1x1x1x1x1x1
256-14-14-1x1-1024-14-14-32-0x0-1x1-1x1-0-NCHW-FP32-F=miopenConvolutionFwdAlgoImplicitGEMM:ConvHipImplicitGemmV4_1x1,0.56656,0,miopenConvolutionFwdAlgoImplicitGEMM,256x14x14x1x1x1024x14x14x32xNCHWxFP32x0x0x1x1x1x1x1x1;miopenConvolutionFwdAlgoDirect:ConvAsm1x1U,0.55088,0,miopenConvolutionFwdAlgoDirect,<unused>;miopenConvolutionFwdAlgoGEMM:gemm,0.46784,0,rocBlas,<unused>;miopenConvolutionFwdAlgoWinograd:ConvBinWinogradRxSf3x2,0.83616,0,miopenConvolutionFwdAlgoWinograd,256x14x14x1x1x1024x14x14x32xNCHWxFP32x0x0x1x1x1x1x1x1
512-14-14-3x3-512-7-7-32-1x1-2x2-1x1-0-NCHW-FP32-F=miopenConvolutionFwdAlgoImplicitGEMM:ConvHipImplicitGemmV4R1Fwd,1.68656,0,miopenConvolutionFwdAlgoImplicitGEMM,512x14x14x3x3x512x7x7x32xNCHWxFP32x1x1x2x2x1x1x1x1;miopenConvolutionFwdAlgoDirect:ConvOclDirectFwd,5.81935,0,miopenConvolutionFwdAlgoDirect,<unused>;miopenConvolutionFwdAlgoGEMM:gemm,13.527,903168,rocBlas,<unused>;miopenConvolutionFwdAlgoWinograd:ConvBinWinogradRxSf2x3,2.20672,0,miopenConvolutionFwdAlgoWinograd,512x14x14x3x3x512x7x7x32xNCHWxFP32x1x1x2x2x1x1x1x1
1536-7-7-1x1-2048-7-7-32-0x0-1x1-1x1-0-NCHW-FP32-F=miopenConvolutionFwdAlgoImplicitGEMM:ConvHipImplicitGemmV4R1Fwd,1.78928,0,miopenConvolutionFwdAlgoImplicitGEMM,1536x7x7x1x1x2048x7x7x32xNCHWxFP32x0x0x1x1x1x1x1x1;miopenConvolutionFwdAlgoDirect:ConvAsm1x1U,1.77312,0,miopenConvolutionFwdAlgoDirect,<unused>;miopenConvolutionFwdAlgoGEMM:gemm,2.09152,0,rocBlas,<unused>;miopenConvolutionFwdAlgoWinograd:ConvBinWinogradRxSf3x2,3.23216,0,miopenConvolutionFwdAlgoWinograd,1536x7x7x1x1x2048x7x7x32xNCHWxFP32x0x0x1x1x1x1x1x1
2048-7-7-1x1-512-7-7-32-0x0-1x1-1x1-0-NCHW-FP32-F=miopenConvolutionFwdAlgoImplicitGEMM:ConvHipImplicitGemmV4R1Fwd,1.26656,0,miopenConvolutionFwdAlgoImplicitGEMM,2048x7x7x1x1x512x7x7x32xNCHWxFP32x0x0x1x1x1x1x1x1;miopenConvolutionFwdAlgoDirect:ConvAsm1x1U,0.81984,0,miopenConvolutionFwdAlgoDirect,<unused>;miopenConvolutionFwdAlgoGEMM:gemm,1.15184,0,rocBlas,<unused>;miopenConvolutionFwdAlgoWinograd:ConvBinWinogradRxSf3x2,1.30496,0,miopenConvolutionFwdAlgoWinograd,2048x7x7x1x1x512x7x7x32xNCHWxFP32x0x0x1x1x1x1x1x1
512-7-7-3x3-512-7-7-32-1x1-1x1-1x1-0-NCHW-FP32-F=miopenConvolutionFwdAlgoWinograd:ConvBinWinogradRxSf2x3,0.53824,0,miopenConvolutionFwdAlgoWinograd,512x7x7x3x3x512x7x7x32xNCHWxFP32x1x1x1x1x1x1x1x1
512-7-7-1x1-2048-7-7-32-0x0-1x1-1x1-0-NCHW-FP32-F=miopenConvolutionFwdAlgoImplicitGEMM:ConvHipImplicitGemmV4R1Fwd,0.64864,0,miopenConvolutionFwdAlgoImplicitGEMM,512x7x7x1x1x2048x7x7x32xNCHWxFP32x0x0x1x1x1x1x1x1;miopenConvolutionFwdAlgoDirect:ConvAsm1x1U,0.63792,0,miopenConvolutionFwdAlgoDirect,<unused>;miopenConvolutionFwdAlgoGEMM:gemm,0.78544,0,rocBlas,<unused>;miopenConvolutionFwdAlgoWinograd:ConvBinWinogradRxSf3x2,1.132,0,miopenConvolutionFwdAlgoWinograd,512x7x7x1x1x2048x7x7x32xNCHWxFP32x0x0x1x1x1x1x1x1
3-299-299-3x3-32-149-149-16-0x0-2x2-1x1-0-NCHW-FP32-F=miopenConvolutionFwdAlgoDirect:ConvOclDirectFwd,0.44976,0,miopenConvolutionFwdAlgoDirect,<unused>;miopenConvolutionFwdAlgoGEMM:gemm,1.1264,2397708,rocBlas,<unused>;miopenConvolutionFwdAlgoWinograd:ConvBinWinogradRxSf2x3,0.27808,0,miopenConvolutionFwdAlgoWinograd,3x299x299x3x3x32x149x149x16xNCHWxFP32x0x0x2x2x1x1x1x1
32-149-149-3x3-32-147-147-16-0x0-1x1-1x1-0-NCHW-FP32-F=miopenConvolutionFwdAlgoDirect:ConvOclDirectFwd,1.76576,0,miopenConvolutionFwdAlgoDirect,<unused>;miopenConvolutionFwdAlgoGEMM:gemm,2.3552,24893568,rocBlas,<unused>;miopenConvolutionFwdAlgoWinograd:ConvBinWinogradRxSf2x3,0.42352,0,miopenConvolutionFwdAlgoWinograd,32x149x149x3x3x32x147x147x16xNCHWxFP32x0x0x1x1x1x1x1x1
32-147-147-3x3-64-147-147-16-1x1-1x1-1x1-0-NCHW-FP32-F=miopenConvolutionFwdAlgoWinograd:ConvBinWinogradRxSf2x3,0.80448,0,miopenConvolutionFwdAlgoWinograd,32x147x147x3x3x64x147x147x16xNCHWxFP32x1x1x1x1x1x1x1x1
64-147-147-3x3-96-73-73-16-0x0-2x2-1x1-0-NCHW-FP32-F=miopenConvolutionFwdAlgoDirect:ConvOclDirectFwd,5.74575,0,miopenConvolutionFwdAlgoDirect,<unused>;miopenConvolutionFwdAlgoGEMM:gemm,3.00032,12278016,rocBlas,<unused>;miopenConvolutionFwdAlgoWinograd:ConvBinWinogradRxS,1.9904,0,miopenConvolutionFwdAlgoWinograd,64x147x147x3x3x96x73x73x16xNCHWxFP32x0x0x2x2x1x1x1x1
160-73-73-1x1-64-73-73-16-0x0-1x1-1x1-0-NCHW-FP32-F=miopenConvolutionFwdAlgoDirect:ConvOclDirectFwd1x1,0.32864,0,miopenConvolutionFwdAlgoDirect,<unused>;miopenConvolutionFwdAlgoGEMM:gemm,0.19936,0,rocBlas,<unused>;miopenConvolutionFwdAlgoWinograd:ConvBinWinogradRxSf3x2,0.44096,0,miopenConvolutionFwdAlgoWinograd,160x73x73x1x1x64x73x73x16xNCHWxFP32x0x0x1x1x1x1x1x1
64-73-73-3x3-96-71-71-16-0x0-1x1-1x1-0-NCHW-FP32-F=miopenConvolutionFwdAlgoDirect:ConvOclDirectFwd,2.59856,0,miopenConvolutionFwdAlgoDirect,<unused>;miopenConvolutionFwdAlgoGEMM:gemm,2.01728,11614464,rocBlas,<unused>;miopenConvolutionFwdAlgoWinograd:ConvBinWinogradRxSf2x3,0.5128,0,miopenConvolutionFwdAlgoWinograd,64x73x73x3x3x96x71x71x16xNCHWxFP32x0x0x1x1x1x1x1x1
64-73-73-1x7-64-73-73-16-0x3-1x1-1x1-0-NCHW-FP32-F=miopenConvolutionFwdAlgoWinograd:ConvBinWinogradRxSf3x2,0.6848,0,miopenConvolutionFwdAlgoWinograd,64x73x73x1x7x64x73x73x16xNCHWxFP32x0x3x1x1x1x1x1x1;miopenConvolutionFwdAlgoGEMM:gemm,1.8048,9549568,rocBlas,<unused>
64-73-73-7x1-64-73-73-16-3x0-1x1-1x1-0-NCHW-FP32-F=miopenConvolutionFwdAlgoWinograd:ConvBinWinogradRxSf3x2,0.732479,0,miopenConvolutionFwdAlgoWinograd,64x73x73x7x1x64x73x73x16xNCHWxFP32x3x0x1x1x1x1x1x1;miopenConvolutionFwdAlgoGEMM:gemm,1.74592,9549568,rocBlas,<unused>
192-71-71-3x3-192-35-35-16-0x0-2x2-1x1-0-NCHW-FP32-F=miopenConvolutionFwdAlgoDirect:ConvOclDirectFwd,10.5894,0,miopenConvolutionFwdAlgoDirect,<unused>;miopenConvolutionFwdAlgoGEMM:gemm,2.56,8467200,rocBlas,<unused>;miopenConvolutionFwdAlgoWinograd:ConvBinWinogradRxSf2x3,2.74592,0,miopenConvolutionFwdAlgoWinograd,192x71x71x3x3x192x35x35x16xNCHWxFP32x0x0x2x2x1x1x1x1
384-35-35-1x1-96-35-35-16-0x0-1x1-1x1-0-NCHW-FP32-F=miopenConvolutionFwdAlgoDirect:ConvAsm1x1U,0.20992,0,miopenConvolutionFwdAlgoDirect,<unused>;miopenConvolutionFwdAlgoGEMM:gemm,0.22432,0,rocBlas,<unused>;miopenConvolutionFwdAlgoWinograd:ConvBinWinogradRxSf3x2,0.36288,0,miopenConvolutionFwdAlgoWinograd,384x35x35x1x1x96x35x35x16xNCHWxFP32x0x0x1x1x1x1x1x1
384-35-35-1x1-64-35-35-16-0x0-1x1-1x1-0-NCHW-FP32-F=miopenConvolutionFwdAlgoDirect:ConvAsm1x1U,0.20784,0,miopenConvolutionFwdAlgoDirect,<unused>;miopenConvolutionFwdAlgoGEMM:gemm,0.16352,0,rocBlas,<unused>;miopenConvolutionFwdAlgoWinograd:ConvBinWinogradRxSf3x2,0.3136,0,miopenConvolutionFwdAlgoWinograd,384x35x35x1x1x64x35x35x16xNCHWxFP32x0x0x1x1x1x1x1x1
64-35-35-3x3-96-35-35-16-1x1-1x1-1x1-0-NCHW-FP32-F=miopenConvolutionFwdAlgoWinograd:ConvBinWinograd3x3U,0.15312,0,miopenConvolutionFwdAlgoWinograd,64x35x35x3x3x96x35x35x16xNCHWxFP32x1x1x1x1x1x1x1x1
96-35-35-3x3-96-35-35-16-1x1-1x1-1x1-0-NCHW-FP32-F=miopenConvolutionFwdAlgoWinograd:ConvBinWinograd3x3U,0.20896,0,miopenConvolutionFwdAlgoWinograd,96x35x35x3x3x96x35x35x16xNCHWxFP32x1x1x1x1x1x1x1x1
