dockerfiles/miopen-rocm53/gfx1030_36.HIP.2_18_0_.ufdb.txt
3-224-224-7x7-64-112-112-64-3x3-2x2-1x1-0-NCHW-FP32-F=miopenConvolutionFwdAlgoDirect:ConvOclDirectFwd,1.97427,0,miopenConvolutionFwdAlgoDirect,<unused>;miopenConvolutionFwdAlgoWinograd:ConvBinWinogradRxSf2x3g1,5.83567,0,miopenConvolutionFwdAlgoWinograd,<unused>;miopenConvolutionFwdAlgoGEMM:GemmFwdRest,12.4261,7375872,miopenConvolutionFwdAlgoGEMM,<unused>
64-56-56-1x1-64-56-56-64-0x0-1x1-1x1-0-NCHW-FP32-F=miopenConvolutionFwdAlgoImplicitGEMM:ConvHipImplicitGemmV4R4Fwd,0.11572,0,miopenConvolutionFwdAlgoImplicitGEMM,<unused>;miopenConvolutionFwdAlgoDirect:ConvDirectNaiveConvFwd,19.0585,0,miopenConvolutionFwdAlgoDirect,<unused>;miopenConvolutionFwdAlgoWinograd:ConvBinWinogradRxSf2x3g1,2.0218,0,miopenConvolutionFwdAlgoWinograd,<unused>;miopenConvolutionFwdAlgoGEMM:GemmFwd1x1_0_1,0.454159,0,miopenConvolutionFwdAlgoGEMM,<unused>
64-56-56-3x3-64-56-56-64-1x1-1x1-1x1-0-NCHW-FP32-F=miopenConvolutionFwdAlgoImplicitGEMM:ConvHipImplicitGemmV4R1Fwd,0.949158,0,miopenConvolutionFwdAlgoImplicitGEMM,<unused>;miopenConvolutionFwdAlgoDirect:ConvOclDirectFwd,3.00107,0,miopenConvolutionFwdAlgoDirect,<unused>;miopenConvolutionFwdAlgoWinograd:ConvBinWinogradRxSf2x3g1,1.26696,0,miopenConvolutionFwdAlgoWinograd,<unused>;miopenConvolutionFwdAlgoGEMM:GemmFwdRest,14.1745,7225344,miopenConvolutionFwdAlgoGEMM,<unused>
128-56-56-1x1-256-56-56-64-0x0-1x1-1x1-0-NCHW-FP32-F=miopenConvolutionFwdAlgoImplicitGEMM:ConvHipImplicitGemmV4R4Fwd,0.954078,0,miopenConvolutionFwdAlgoImplicitGEMM,<unused>;miopenConvolutionFwdAlgoDirect:ConvDirectNaiveConvFwd,55.6332,0,miopenConvolutionFwdAlgoDirect,<unused>;miopenConvolutionFwdAlgoWinograd:ConvBinWinogradRxSf2x3g1,3.21663,0,miopenConvolutionFwdAlgoWinograd,<unused>;miopenConvolutionFwdAlgoGEMM:GemmFwd1x1_0_1,3.51299,0,miopenConvolutionFwdAlgoGEMM,<unused>
256-56-56-1x1-64-56-56-64-0x0-1x1-1x1-0-NCHW-FP32-F=miopenConvolutionFwdAlgoImplicitGEMM:ConvHipImplicitGemmV4R4Fwd,0.893357,0,miopenConvolutionFwdAlgoImplicitGEMM,<unused>;miopenConvolutionFwdAlgoDirect:ConvDirectNaiveConvFwd,28.2892,0,miopenConvolutionFwdAlgoDirect,<unused>;miopenConvolutionFwdAlgoWinograd:ConvBinWinogradRxSf2x3g1,1.6308,0,miopenConvolutionFwdAlgoWinograd,<unused>;miopenConvolutionFwdAlgoGEMM:GemmFwd1x1_0_1,1.97995,0,miopenConvolutionFwdAlgoGEMM,<unused>
64-56-56-1x1-256-56-56-64-0x0-1x1-1x1-0-NCHW-FP32-F=miopenConvolutionFwdAlgoImplicitGEMM:ConvHipImplicitGemmV4R4Fwd,0.557519,0,miopenConvolutionFwdAlgoImplicitGEMM,<unused>;miopenConvolutionFwdAlgoDirect:ConvDirectNaiveConvFwd,28.0379,0,miopenConvolutionFwdAlgoDirect,<unused>;miopenConvolutionFwdAlgoWinograd:ConvBinWinogradRxSf2x3g1,1.73928,0,miopenConvolutionFwdAlgoWinograd,<unused>;miopenConvolutionFwdAlgoGEMM:GemmFwd1x1_0_1,1.97588,0,miopenConvolutionFwdAlgoGEMM,<unused>
256-56-56-1x1-128-56-56-64-0x0-1x1-1x1-0-NCHW-FP32-F=miopenConvolutionFwdAlgoImplicitGEMM:ConvHipImplicitGemmV4R1Fwd,1.00952,0,miopenConvolutionFwdAlgoImplicitGEMM,<unused>;miopenConvolutionFwdAlgoDirect:ConvDirectNaiveConvFwd,55.3883,0,miopenConvolutionFwdAlgoDirect,<unused>;miopenConvolutionFwdAlgoWinograd:ConvBinWinogradRxSf2x3g1,2.93481,0,miopenConvolutionFwdAlgoWinograd,<unused>;miopenConvolutionFwdAlgoGEMM:GemmFwd1x1_0_1,3.46006,0,miopenConvolutionFwdAlgoGEMM,<unused>
128-56-56-3x3-128-28-28-64-1x1-2x2-1x1-0-NCHW-FP32-F=miopenConvolutionFwdAlgoImplicitGEMM:ConvHipImplicitGemmV4R1Fwd,1.04885,0,miopenConvolutionFwdAlgoImplicitGEMM,<unused>;miopenConvolutionFwdAlgoDirect:ConvOclDirectFwd,3.92214,0,miopenConvolutionFwdAlgoDirect,<unused>;miopenConvolutionFwdAlgoWinograd:ConvBinWinogradRxSf2x3g1,5.45927,0,miopenConvolutionFwdAlgoWinograd,<unused>;miopenConvolutionFwdAlgoGEMM:GemmFwdRest,17.9252,3612672,miopenConvolutionFwdAlgoGEMM,<unused>
384-28-28-1x1-512-28-28-64-0x0-1x1-1x1-0-NCHW-FP32-F=miopenConvolutionFwdAlgoImplicitGEMM:ConvHipImplicitGemmV4R4Fwd,1.51284,0,miopenConvolutionFwdAlgoImplicitGEMM,<unused>;miopenConvolutionFwdAlgoDirect:ConvDirectNaiveConvFwd,94.0227,0,miopenConvolutionFwdAlgoDirect,<unused>;miopenConvolutionFwdAlgoWinograd:ConvBinWinogradRxSf2x3g1,4.23899,0,miopenConvolutionFwdAlgoWinograd,<unused>;miopenConvolutionFwdAlgoGEMM:GemmFwd1x1_0_1,5.30123,0,miopenConvolutionFwdAlgoGEMM,<unused>
512-28-28-1x1-128-28-28-64-0x0-1x1-1x1-0-NCHW-FP32-F=miopenConvolutionFwdAlgoImplicitGEMM:ConvHipImplicitGemmV4R1Fwd,0.473118,0,miopenConvolutionFwdAlgoImplicitGEMM,<unused>;miopenConvolutionFwdAlgoDirect:ConvDirectNaiveConvFwd,29.9185,0,miopenConvolutionFwdAlgoDirect,<unused>;miopenConvolutionFwdAlgoWinograd:ConvBinWinogradRxSf2x3g1,1.57424,0,miopenConvolutionFwdAlgoWinograd,<unused>;miopenConvolutionFwdAlgoGEMM:GemmFwd1x1_0_1,2.21163,0,miopenConvolutionFwdAlgoGEMM,<unused>
128-28-28-3x3-128-28-28-64-1x1-1x1-1x1-0-NCHW-FP32-F=miopenConvolutionFwdAlgoImplicitGEMM:ConvHipImplicitGemmV4R1Fwd,0.966118,0,miopenConvolutionFwdAlgoImplicitGEMM,<unused>;miopenConvolutionFwdAlgoDirect:ConvOclDirectFwd,8.86566,0,miopenConvolutionFwdAlgoDirect,<unused>;miopenConvolutionFwdAlgoWinograd:ConvBinWinogradRxSf2x3g1,1.89348,0,miopenConvolutionFwdAlgoWinograd,<unused>;miopenConvolutionFwdAlgoGEMM:GemmFwdRest,16.7935,3612672,miopenConvolutionFwdAlgoGEMM,<unused>
128-28-28-1x1-512-28-28-64-0x0-1x1-1x1-0-NCHW-FP32-F=miopenConvolutionFwdAlgoImplicitGEMM:ConvHipImplicitGemmV4R4Fwd,0.407079,0,miopenConvolutionFwdAlgoImplicitGEMM,<unused>;miopenConvolutionFwdAlgoDirect:ConvDirectNaiveConvFwd,30.1098,0,miopenConvolutionFwdAlgoDirect,<unused>;miopenConvolutionFwdAlgoWinograd:ConvBinWinogradRxSf2x3g1,4.01935,0,miopenConvolutionFwdAlgoWinograd,<unused>;miopenConvolutionFwdAlgoGEMM:GemmFwd1x1_0_1,2.18687,0,miopenConvolutionFwdAlgoGEMM,<unused>
512-28-28-1x1-256-28-28-64-0x0-1x1-1x1-0-NCHW-FP32-F=miopenConvolutionFwdAlgoImplicitGEMM:ConvHipImplicitGemmV4R4Fwd,0.858723,0,miopenConvolutionFwdAlgoImplicitGEMM,<unused>;miopenConvolutionFwdAlgoDirect:ConvDirectNaiveConvFwd,63.2794,0,miopenConvolutionFwdAlgoDirect,<unused>;miopenConvolutionFwdAlgoWinograd:ConvBinWinogradRxSf2x3g1,2.88205,0,miopenConvolutionFwdAlgoWinograd,<unused>;miopenConvolutionFwdAlgoGEMM:GemmFwd1x1_0_1,4.10882,0,miopenConvolutionFwdAlgoGEMM,<unused>
256-28-28-3x3-256-14-14-64-1x1-2x2-1x1-0-NCHW-FP32-F=miopenConvolutionFwdAlgoImplicitGEMM:ConvHipImplicitGemmV4R1Fwd,1.01524,0,miopenConvolutionFwdAlgoImplicitGEMM,<unused>;miopenConvolutionFwdAlgoDirect:ConvOclDirectFwd,3.12369,0,miopenConvolutionFwdAlgoDirect,<unused>;miopenConvolutionFwdAlgoWinograd:ConvBinWinogradRxSf2x3g1,5.20639,0,miopenConvolutionFwdAlgoWinograd,<unused>;miopenConvolutionFwdAlgoGEMM:GemmFwdRest,27.1386,1806336,miopenConvolutionFwdAlgoGEMM,<unused>
768-14-14-1x1-1024-14-14-64-0x0-1x1-1x1-0-NCHW-FP32-F=miopenConvolutionFwdAlgoImplicitGEMM:ConvHipImplicitGemmV4R1Fwd,1.279,0,miopenConvolutionFwdAlgoImplicitGEMM,<unused>;miopenConvolutionFwdAlgoDirect:ConvDirectNaiveConvFwd,107.118,0,miopenConvolutionFwdAlgoDirect,<unused>;miopenConvolutionFwdAlgoWinograd:ConvBinWinogradRxSf2x3g1,4.48087,0,miopenConvolutionFwdAlgoWinograd,<unused>;miopenConvolutionFwdAlgoGEMM:GemmFwd1x1_0_1,6.25458,0,miopenConvolutionFwdAlgoGEMM,<unused>
1024-14-14-1x1-256-14-14-64-0x0-1x1-1x1-0-NCHW-FP32-F=miopenConvolutionFwdAlgoImplicitGEMM:ConvHipImplicitGemmV4R1Fwd,0.503239,0,miopenConvolutionFwdAlgoImplicitGEMM,<unused>;miopenConvolutionFwdAlgoDirect:ConvDirectNaiveConvFwd,35.7848,0,miopenConvolutionFwdAlgoDirect,<unused>;miopenConvolutionFwdAlgoWinograd:ConvBinWinogradRxSf2x3g1,1.56768,0,miopenConvolutionFwdAlgoWinograd,<unused>;miopenConvolutionFwdAlgoGEMM:GemmFwd1x1_0_1,2.38143,0,miopenConvolutionFwdAlgoGEMM,<unused>
256-14-14-3x3-256-14-14-64-1x1-1x1-1x1-0-NCHW-FP32-F=miopenConvolutionFwdAlgoImplicitGEMM:ConvHipImplicitGemmV4R4Fwd,1.10016,0,miopenConvolutionFwdAlgoImplicitGEMM,<unused>;miopenConvolutionFwdAlgoDirect:ConvOclDirectFwd,9.1195,0,miopenConvolutionFwdAlgoDirect,<unused>;miopenConvolutionFwdAlgoWinograd:ConvBinWinogradRxSf2x3g1,1.83748,0,miopenConvolutionFwdAlgoWinograd,<unused>;miopenConvolutionFwdAlgoGEMM:GemmFwdRest,26.8415,1806336,miopenConvolutionFwdAlgoGEMM,<unused>
256-14-14-1x1-1024-14-14-64-0x0-1x1-1x1-0-NCHW-FP32-F=miopenConvolutionFwdAlgoImplicitGEMM:ConvHipImplicitGemmV4R4Fwd,0.405719,0,miopenConvolutionFwdAlgoImplicitGEMM,<unused>;miopenConvolutionFwdAlgoDirect:ConvDirectNaiveConvFwd,36.8017,0,miopenConvolutionFwdAlgoDirect,<unused>;miopenConvolutionFwdAlgoWinograd:ConvBinWinogradRxSf2x3g1,3.97075,0,miopenConvolutionFwdAlgoWinograd,<unused>;miopenConvolutionFwdAlgoGEMM:GemmFwd1x1_0_1,2.37224,0,miopenConvolutionFwdAlgoGEMM,<unused>
1024-14-14-1x1-512-14-14-64-0x0-1x1-1x1-0-NCHW-FP32-F=miopenConvolutionFwdAlgoImplicitGEMM:ConvHipImplicitGemmV4R4Fwd,0.799562,0,miopenConvolutionFwdAlgoImplicitGEMM,<unused>;miopenConvolutionFwdAlgoDirect:ConvDirectNaiveConvFwd,71.5698,0,miopenConvolutionFwdAlgoDirect,<unused>;miopenConvolutionFwdAlgoWinograd:ConvBinWinogradRxSf2x3g1,2.85817,0,miopenConvolutionFwdAlgoWinograd,<unused>;miopenConvolutionFwdAlgoGEMM:GemmFwd1x1_0_1,4.34209,0,miopenConvolutionFwdAlgoGEMM,<unused>
512-14-14-3x3-512-7-7-64-1x1-2x2-1x1-0-NCHW-FP32-F=miopenConvolutionFwdAlgoImplicitGEMM:ConvHipImplicitGemmV4R1Fwd,1.13504,0,miopenConvolutionFwdAlgoImplicitGEMM,<unused>;miopenConvolutionFwdAlgoDirect:ConvOclDirectFwd,4.62261,0,miopenConvolutionFwdAlgoDirect,<unused>;miopenConvolutionFwdAlgoWinograd:ConvBinWinogradRxSf2x3g1,3.5099,0,miopenConvolutionFwdAlgoWinograd,<unused>;miopenConvolutionFwdAlgoGEMM:GemmFwdRest,19.5277,903168,miopenConvolutionFwdAlgoGEMM,<unused>
1536-7-7-1x1-2048-7-7-64-0x0-1x1-1x1-0-NCHW-FP32-F=miopenConvolutionFwdAlgoImplicitGEMM:ConvHipImplicitGemmV4R4Fwd,1.20888,0,miopenConvolutionFwdAlgoImplicitGEMM,<unused>;miopenConvolutionFwdAlgoDirect:ConvDirectNaiveConvFwd,106.919,0,miopenConvolutionFwdAlgoDirect,<unused>;miopenConvolutionFwdAlgoWinograd:ConvBinWinogradRxSf3x2,3.44551,0,miopenConvolutionFwdAlgoWinograd,<unused>;miopenConvolutionFwdAlgoGEMM:GemmFwd1x1_0_1,7.9611,0,miopenConvolutionFwdAlgoGEMM,<unused>
2048-7-7-1x1-512-7-7-64-0x0-1x1-1x1-0-NCHW-FP32-F=miopenConvolutionFwdAlgoImplicitGEMM:ConvHipImplicitGemmV4R4Fwd,0.483599,0,miopenConvolutionFwdAlgoImplicitGEMM,<unused>;miopenConvolutionFwdAlgoDirect:ConvDirectNaiveConvFwd,35.956,0,miopenConvolutionFwdAlgoDirect,<unused>;miopenConvolutionFwdAlgoWinograd:ConvBinWinogradRxSf2x3g1,2.37712,0,miopenConvolutionFwdAlgoWinograd,<unused>;miopenConvolutionFwdAlgoGEMM:GemmFwd1x1_0_1,4.55199,0,miopenConvolutionFwdAlgoGEMM,<unused>
512-7-7-3x3-512-7-7-64-1x1-1x1-1x1-0-NCHW-FP32-F=miopenConvolutionFwdAlgoImplicitGEMM:ConvHipImplicitGemmV4R4Fwd,1.27608,0,miopenConvolutionFwdAlgoImplicitGEMM,<unused>;miopenConvolutionFwdAlgoDirect:ConvOclDirectFwd,7.94426,0,miopenConvolutionFwdAlgoDirect,<unused>;miopenConvolutionFwdAlgoWinograd:ConvBinWinogradRxSf2x3g1,2.54672,0,miopenConvolutionFwdAlgoWinograd,<unused>;miopenConvolutionFwdAlgoGEMM:GemmFwdRest,18.4601,903168,miopenConvolutionFwdAlgoGEMM,<unused>
512-7-7-1x1-2048-7-7-64-0x0-1x1-1x1-0-NCHW-FP32-F=miopenConvolutionFwdAlgoImplicitGEMM:ConvHipImplicitGemmV4R4Fwd,0.485279,0,miopenConvolutionFwdAlgoImplicitGEMM,<unused>;miopenConvolutionFwdAlgoDirect:ConvDirectNaiveConvFwd,35.8376,0,miopenConvolutionFwdAlgoDirect,<unused>;miopenConvolutionFwdAlgoWinograd:ConvBinWinogradRxSf2x3g1,2.42084,0,miopenConvolutionFwdAlgoWinograd,<unused>;miopenConvolutionFwdAlgoGEMM:GemmFwd1x1_0_1,4.43639,0,miopenConvolutionFwdAlgoGEMM,<unused>
3-224-224-7x7-64-112-112-64-3x3-2x2-1x1-0-NCHW-FP16-F=miopenConvolutionFwdAlgoDirect:ConvOclDirectFwdGen,12.1914,0,miopenConvolutionFwdAlgoDirect,<unused>;miopenConvolutionFwdAlgoWinograd:ConvBinWinogradRxSf2x3g1,5.68909,0,miopenConvolutionFwdAlgoWinograd,<unused>;miopenConvolutionFwdAlgoGEMM:GemmFwdRest,9.32864,3687936,miopenConvolutionFwdAlgoGEMM,<unused>
64-56-56-1x1-64-56-56-64-0x0-1x1-1x1-0-NCHW-FP16-F=miopenConvolutionFwdAlgoImplicitGEMM:ConvHipImplicitGemmV4R1Fwd,0.15768,0,miopenConvolutionFwdAlgoImplicitGEMM,<unused>;miopenConvolutionFwdAlgoDirect:ConvDirectNaiveConvFwd,12.4654,0,miopenConvolutionFwdAlgoDirect,<unused>;miopenConvolutionFwdAlgoWinograd:ConvBinWinogradRxSf2x3g1,1.31668,0,miopenConvolutionFwdAlgoWinograd,<unused>;miopenConvolutionFwdAlgoGEMM:GemmFwd1x1_0_1,0.30756,0,miopenConvolutionFwdAlgoGEMM,<unused>
64-56-56-3x3-64-56-56-64-1x1-1x1-1x1-0-NCHW-FP16-F=miopenConvolutionFwdAlgoImplicitGEMM:ConvHipImplicitGemmV4R1Fwd,1.39308,0,miopenConvolutionFwdAlgoImplicitGEMM,<unused>;miopenConvolutionFwdAlgoDirect:ConvOclDirectFwd,5.03464,0,miopenConvolutionFwdAlgoDirect,<unused>;miopenConvolutionFwdAlgoWinograd:ConvBinWinogradRxSf2x3g1,1.3202,0,miopenConvolutionFwdAlgoWinograd,<unused>;miopenConvolutionFwdAlgoGEMM:GemmFwdRest,11.8246,3612672,miopenConvolutionFwdAlgoGEMM,<unused>
128-56-56-1x1-256-56-56-64-0x0-1x1-1x1-0-NCHW-FP16-F=miopenConvolutionFwdAlgoImplicitGEMM:ConvHipImplicitGemmV4R1Fwd,1.30452,0,miopenConvolutionFwdAlgoImplicitGEMM,<unused>;miopenConvolutionFwdAlgoDirect:ConvDirectNaiveConvFwd,56.0281,0,miopenConvolutionFwdAlgoDirect,<unused>;miopenConvolutionFwdAlgoWinograd:ConvBinWinogradRxSf2x3g1,1.98608,0,miopenConvolutionFwdAlgoWinograd,<unused>;miopenConvolutionFwdAlgoGEMM:GemmFwd1x1_0_1,2.12668,0,miopenConvolutionFwdAlgoGEMM,<unused>
256-56-56-1x1-64-56-56-64-0x0-1x1-1x1-0-NCHW-FP16-F=miopenConvolutionFwdAlgoImplicitGEMM:ConvHipImplicitGemmV4R1Fwd,1.63936,0,miopenConvolutionFwdAlgoImplicitGEMM,<unused>;miopenConvolutionFwdAlgoDirect:ConvDirectNaiveConvFwd,29.1557,0,miopenConvolutionFwdAlgoDirect,<unused>;miopenConvolutionFwdAlgoWinograd:ConvBinWinogradRxSf2x3g1,2.71272,0,miopenConvolutionFwdAlgoWinograd,<unused>;miopenConvolutionFwdAlgoGEMM:GemmFwd1x1_0_1,1.1104,0,miopenConvolutionFwdAlgoGEMM,<unused>
64-56-56-1x1-256-56-56-64-0x0-1x1-1x1-0-NCHW-FP16-F=miopenConvolutionFwdAlgoImplicitGEMM:ConvHipImplicitGemmV4R1Fwd,1.03032,0,miopenConvolutionFwdAlgoImplicitGEMM,<unused>;miopenConvolutionFwdAlgoDirect:ConvDirectNaiveConvFwd,27.9086,0,miopenConvolutionFwdAlgoDirect,<unused>;miopenConvolutionFwdAlgoWinograd:ConvBinWinogradRxSf2x3g1,1.15516,0,miopenConvolutionFwdAlgoWinograd,<unused>;miopenConvolutionFwdAlgoGEMM:GemmFwd1x1_0_1,1.12516,0,miopenConvolutionFwdAlgoGEMM,<unused>
256-56-56-1x1-128-56-56-64-0x0-1x1-1x1-0-NCHW-FP16-F=miopenConvolutionFwdAlgoImplicitGEMM:ConvHipImplicitGemmV4R1Fwd,3.13692,0,miopenConvolutionFwdAlgoImplicitGEMM,<unused>;miopenConvolutionFwdAlgoDirect:ConvDirectNaiveConvFwd,58.3925,0,miopenConvolutionFwdAlgoDirect,<unused>;miopenConvolutionFwdAlgoWinograd:ConvBinWinogradRxSf2x3g1,1.76832,0,miopenConvolutionFwdAlgoWinograd,<unused>;miopenConvolutionFwdAlgoGEMM:GemmFwd1x1_0_1,2.18032,0,miopenConvolutionFwdAlgoGEMM,<unused>
128-56-56-3x3-128-28-28-64-1x1-2x2-1x1-0-NCHW-FP16-F=miopenConvolutionFwdAlgoImplicitGEMM:ConvHipImplicitGemmV4R1Fwd,1.67936,0,miopenConvolutionFwdAlgoImplicitGEMM,<unused>;miopenConvolutionFwdAlgoDirect:ConvOclDirectFwdGen,21.4179,0,miopenConvolutionFwdAlgoDirect,<unused>;miopenConvolutionFwdAlgoWinograd:ConvBinWinogradRxSf2x3g1,4.33832,0,miopenConvolutionFwdAlgoWinograd,<unused>;miopenConvolutionFwdAlgoGEMM:GemmFwdRest,13.7958,1806336,miopenConvolutionFwdAlgoGEMM,<unused>
384-28-28-1x1-512-28-28-64-0x0-1x1-1x1-0-NCHW-FP16-F=miopenConvolutionFwdAlgoImplicitGEMM:ConvHipImplicitGemmV4R1Fwd,1.76176,0,miopenConvolutionFwdAlgoImplicitGEMM,<unused>;miopenConvolutionFwdAlgoDirect:ConvDirectNaiveConvFwd,87.1552,0,miopenConvolutionFwdAlgoDirect,<unused>;miopenConvolutionFwdAlgoWinograd:ConvBinWinogradRxSf2x3g1,2.4956,0,miopenConvolutionFwdAlgoWinograd,<unused>;miopenConvolutionFwdAlgoGEMM:GemmFwd1x1_0_1,3.06144,0,miopenConvolutionFwdAlgoGEMM,<unused>
512-28-28-1x1-128-28-28-64-0x0-1x1-1x1-0-NCHW-FP16-F=miopenConvolutionFwdAlgoImplicitGEMM:ConvHipImplicitGemmV4R1Fwd,1.02072,0,miopenConvolutionFwdAlgoImplicitGEMM,<unused>;miopenConvolutionFwdAlgoDirect:ConvDirectNaiveConvFwd,29.2868,0,miopenConvolutionFwdAlgoDirect,<unused>;miopenConvolutionFwdAlgoWinograd:ConvBinWinogradRxSf2x3g1,2.35052,0,miopenConvolutionFwdAlgoWinograd,<unused>;miopenConvolutionFwdAlgoGEMM:GemmFwd1x1_0_1,1.0732,0,miopenConvolutionFwdAlgoGEMM,<unused>
128-28-28-3x3-128-28-28-64-1x1-1x1-1x1-0-NCHW-FP16-F=miopenConvolutionFwdAlgoImplicitGEMM:ConvHipImplicitGemmV4R1Fwd,1.34232,0,miopenConvolutionFwdAlgoImplicitGEMM,<unused>;miopenConvolutionFwdAlgoDirect:ConvOclDirectFwd,6.32261,0,miopenConvolutionFwdAlgoDirect,<unused>;miopenConvolutionFwdAlgoWinograd:ConvBinWinogradRxSf2x3g1,1.17392,0,miopenConvolutionFwdAlgoWinograd,<unused>;miopenConvolutionFwdAlgoGEMM:GemmFwdRest,12.457,1806336,miopenConvolutionFwdAlgoGEMM,<unused>
128-28-28-1x1-512-28-28-64-0x0-1x1-1x1-0-NCHW-FP16-F=miopenConvolutionFwdAlgoImplicitGEMM:ConvHipImplicitGemmV4R1Fwd,0.61948,0,miopenConvolutionFwdAlgoImplicitGEMM,<unused>;miopenConvolutionFwdAlgoDirect:ConvDirectNaiveConvFwd,29.2677,0,miopenConvolutionFwdAlgoDirect,<unused>;miopenConvolutionFwdAlgoWinograd:ConvBinWinogradRxSf2x3g1,1.06024,0,miopenConvolutionFwdAlgoWinograd,<unused>;miopenConvolutionFwdAlgoGEMM:GemmFwd1x1_0_1,1.04812,0,miopenConvolutionFwdAlgoGEMM,<unused>
512-28-28-1x1-256-28-28-64-0x0-1x1-1x1-0-NCHW-FP16-F=miopenConvolutionFwdAlgoImplicitGEMM:ConvHipImplicitGemmV4R1Fwd,1.22648,0,miopenConvolutionFwdAlgoImplicitGEMM,<unused>;miopenConvolutionFwdAlgoDirect:ConvDirectNaiveConvFwd,57.852,0,miopenConvolutionFwdAlgoDirect,<unused>;miopenConvolutionFwdAlgoWinograd:ConvBinWinogradRxSf2x3g1,1.78376,0,miopenConvolutionFwdAlgoWinograd,<unused>;miopenConvolutionFwdAlgoGEMM:GemmFwd1x1_0_1,2.06312,0,miopenConvolutionFwdAlgoGEMM,<unused>
256-28-28-3x3-256-14-14-64-1x1-2x2-1x1-0-NCHW-FP16-F=miopenConvolutionFwdAlgoImplicitGEMM:ConvHipImplicitGemmV4R1Fwd,1.45072,0,miopenConvolutionFwdAlgoImplicitGEMM,<unused>;miopenConvolutionFwdAlgoDirect:ConvOclDirectFwdGen,24.4302,0,miopenConvolutionFwdAlgoDirect,<unused>;miopenConvolutionFwdAlgoWinograd:ConvBinWinogradRxSf2x3g1,4.27324,0,miopenConvolutionFwdAlgoWinograd,<unused>;miopenConvolutionFwdAlgoGEMM:GemmFwdRest,16.9779,903168,miopenConvolutionFwdAlgoGEMM,<unused>
768-14-14-1x1-1024-14-14-64-0x0-1x1-1x1-0-NCHW-FP16-F=miopenConvolutionFwdAlgoImplicitGEMM:ConvHipImplicitGemmV4R1Fwd,1.81616,0,miopenConvolutionFwdAlgoImplicitGEMM,<unused>;miopenConvolutionFwdAlgoDirect:ConvDirectNaiveConvFwd,106.516,0,miopenConvolutionFwdAlgoDirect,<unused>;miopenConvolutionFwdAlgoWinograd:ConvBinWinogradRxSf2x3g1,2.47004,0,miopenConvolutionFwdAlgoWinograd,<unused>;miopenConvolutionFwdAlgoGEMM:GemmFwd1x1_0_1,3.4514,0,miopenConvolutionFwdAlgoGEMM,<unused>
1024-14-14-1x1-256-14-14-64-0x0-1x1-1x1-0-NCHW-FP16-F=miopenConvolutionFwdAlgoImplicitGEMM:ConvHipImplicitGemmV4R1Fwd,0.65444,0,miopenConvolutionFwdAlgoImplicitGEMM,<unused>;miopenConvolutionFwdAlgoDirect:ConvDirectNaiveConvFwd,35.8411,0,miopenConvolutionFwdAlgoDirect,<unused>;miopenConvolutionFwdAlgoWinograd:ConvBinWinogradRxSf2x3g1,1.32576,0,miopenConvolutionFwdAlgoWinograd,<unused>;miopenConvolutionFwdAlgoGEMM:GemmFwd1x1_0_1,1.31316,0,miopenConvolutionFwdAlgoGEMM,<unused>
256-14-14-3x3-256-14-14-64-1x1-1x1-1x1-0-NCHW-FP16-F=miopenConvolutionFwdAlgoImplicitGEMM:ConvHipImplicitGemmV4R1Fwd,1.46688,0,miopenConvolutionFwdAlgoImplicitGEMM,<unused>;miopenConvolutionFwdAlgoDirect:ConvOclDirectFwd,6.00757,0,miopenConvolutionFwdAlgoDirect,<unused>;miopenConvolutionFwdAlgoWinograd:ConvBinWinogradRxSf2x3g1,1.10816,0,miopenConvolutionFwdAlgoWinograd,<unused>;miopenConvolutionFwdAlgoGEMM:GemmFwdRest,16.0666,903168,miopenConvolutionFwdAlgoGEMM,<unused>
256-14-14-1x1-1024-14-14-64-0x0-1x1-1x1-0-NCHW-FP16-F=miopenConvolutionFwdAlgoImplicitGEMM:ConvHipImplicitGemmV4R1Fwd,0.638759,0,miopenConvolutionFwdAlgoImplicitGEMM,<unused>;miopenConvolutionFwdAlgoDirect:ConvDirectNaiveConvFwd,35.8832,0,miopenConvolutionFwdAlgoDirect,<unused>;miopenConvolutionFwdAlgoWinograd:ConvBinWinogradRxSf2x3g1,1.17276,0,miopenConvolutionFwdAlgoWinograd,<unused>;miopenConvolutionFwdAlgoGEMM:GemmFwd1x1_0_1,1.23028,0,miopenConvolutionFwdAlgoGEMM,<unused>
1024-14-14-1x1-512-14-14-64-0x0-1x1-1x1-0-NCHW-FP16-F=miopenConvolutionFwdAlgoImplicitGEMM:ConvHipImplicitGemmV4R1Fwd,1.23168,0,miopenConvolutionFwdAlgoImplicitGEMM,<unused>;miopenConvolutionFwdAlgoDirect:ConvDirectNaiveConvFwd,71.1448,0,miopenConvolutionFwdAlgoDirect,<unused>;miopenConvolutionFwdAlgoWinograd:ConvBinWinogradRxSf2x3g1,1.80876,0,miopenConvolutionFwdAlgoWinograd,<unused>;miopenConvolutionFwdAlgoGEMM:GemmFwd1x1_0_1,2.40396,0,miopenConvolutionFwdAlgoGEMM,<unused>
512-14-14-3x3-512-7-7-64-1x1-2x2-1x1-0-NCHW-FP16-F=miopenConvolutionFwdAlgoImplicitGEMM:ConvHipImplicitGemmV4R1Fwd,1.52624,0,miopenConvolutionFwdAlgoImplicitGEMM,<unused>;miopenConvolutionFwdAlgoDirect:ConvOclDirectFwdGen,42.6016,0,miopenConvolutionFwdAlgoDirect,<unused>;miopenConvolutionFwdAlgoWinograd:ConvBinWinogradRxSf2x3g1,4.19314,0,miopenConvolutionFwdAlgoWinograd,<unused>;miopenConvolutionFwdAlgoGEMM:GemmFwdRest,15.7714,451584,miopenConvolutionFwdAlgoGEMM,<unused>
1536-7-7-1x1-2048-7-7-64-0x0-1x1-1x1-0-NCHW-FP16-F=miopenConvolutionFwdAlgoImplicitGEMM:ConvHipImplicitGemmV4R1Fwd,1.79532,0,miopenConvolutionFwdAlgoImplicitGEMM,<unused>;miopenConvolutionFwdAlgoDirect:ConvDirectNaiveConvFwd,106.558,0,miopenConvolutionFwdAlgoDirect,<unused>;miopenConvolutionFwdAlgoWinograd:ConvBinWinogradRxSf3x2,1.93088,0,miopenConvolutionFwdAlgoWinograd,<unused>;miopenConvolutionFwdAlgoGEMM:GemmFwd1x1_0_1,5.82821,0,miopenConvolutionFwdAlgoGEMM,<unused>
2048-7-7-1x1-512-7-7-64-0x0-1x1-1x1-0-NCHW-FP16-F=miopenConvolutionFwdAlgoImplicitGEMM:ConvHipImplicitGemmV4R1Fwd,0.72456,0,miopenConvolutionFwdAlgoImplicitGEMM,<unused>;miopenConvolutionFwdAlgoDirect:ConvDirectNaiveConvFwd,35.7274,0,miopenConvolutionFwdAlgoDirect,<unused>;miopenConvolutionFwdAlgoWinograd:ConvBinWinogradRxSf2x3g1,1.3022,0,miopenConvolutionFwdAlgoWinograd,<unused>;miopenConvolutionFwdAlgoGEMM:GemmFwd1x1_0_1,2.8102,0,miopenConvolutionFwdAlgoGEMM,<unused>
512-7-7-3x3-512-7-7-64-1x1-1x1-1x1-0-NCHW-FP16-F=miopenConvolutionFwdAlgoImplicitGEMM:ConvHipImplicitGemmV4R1Fwd,1.4914,0,miopenConvolutionFwdAlgoImplicitGEMM,<unused>;miopenConvolutionFwdAlgoDirect:ConvOclDirectFwd,7.58174,0,miopenConvolutionFwdAlgoDirect,<unused>;miopenConvolutionFwdAlgoWinograd:ConvBinWinogradRxSf2x3g1,1.53524,0,miopenConvolutionFwdAlgoWinograd,<unused>;miopenConvolutionFwdAlgoGEMM:GemmFwdRest,14.1765,451584,miopenConvolutionFwdAlgoGEMM,<unused>
512-7-7-1x1-2048-7-7-64-0x0-1x1-1x1-0-NCHW-FP16-F=miopenConvolutionFwdAlgoImplicitGEMM:ConvHipImplicitGemmV4R1Fwd,0.57712,0,miopenConvolutionFwdAlgoImplicitGEMM,<unused>;miopenConvolutionFwdAlgoDirect:ConvDirectNaiveConvFwd,35.6874,0,miopenConvolutionFwdAlgoDirect,<unused>;miopenConvolutionFwdAlgoWinograd:ConvBinWinogradRxSf2x3g1,1.2436,0,miopenConvolutionFwdAlgoWinograd,<unused>;miopenConvolutionFwdAlgoGEMM:GemmFwd1x1_0_1,2.42396,0,miopenConvolutionFwdAlgoGEMM,<unused>
3-224-224-11x11-64-55-55-64-2x2-4x4-1x1-0-NCHW-FP32-F=miopenConvolutionFwdAlgoDirect:ConvOclDirectFwd11x11,7.51888,0,miopenConvolutionFwdAlgoDirect,<unused>;miopenConvolutionFwdAlgoGEMM:GemmFwdRest,12.1957,4392300,miopenConvolutionFwdAlgoGEMM,<unused>
64-27-27-5x5-192-27-27-64-2x2-1x1-1x1-0-NCHW-FP32-F=miopenConvolutionFwdAlgoImplicitGEMM:ConvHipImplicitGemmV4R1Fwd,1.96686,0,miopenConvolutionFwdAlgoImplicitGEMM,<unused>;miopenConvolutionFwdAlgoDirect:ConvOclDirectFwd,2.98161,0,miopenConvolutionFwdAlgoDirect,<unused>;miopenConvolutionFwdAlgoWinograd:ConvBinWinogradRxSf2x3g1,1.20535,0,miopenConvolutionFwdAlgoWinograd,<unused>;miopenConvolutionFwdAlgoFFT:fft,1.38531,143720448,miopenConvolutionFwdAlgoFFT,<unused>;miopenConvolutionFwdAlgoGEMM:GemmFwdRest,23.0219,4665600,miopenConvolutionFwdAlgoGEMM,<unused>
192-13-13-3x3-384-13-13-64-1x1-1x1-1x1-0-NCHW-FP32-F=miopenConvolutionFwdAlgoImplicitGEMM:ConvHipImplicitGemmV4R1Fwd,1.02791,0,miopenConvolutionFwdAlgoImplicitGEMM,<unused>;miopenConvolutionFwdAlgoDirect:ConvOclDirectFwd,4.53428,0,miopenConvolutionFwdAlgoDirect,<unused>;miopenConvolutionFwdAlgoWinograd:ConvBinWinogradRxSf2x3g1,2.1845,0,miopenConvolutionFwdAlgoWinograd,<unused>;miopenConvolutionFwdAlgoGEMM:GemmFwdRest,21.8904,1168128,miopenConvolutionFwdAlgoGEMM,<unused>
384-13-13-3x3-256-13-13-64-1x1-1x1-1x1-0-NCHW-FP32-F=miopenConvolutionFwdAlgoImplicitGEMM:ConvHipImplicitGemmV4R1Fwd,1.37495,0,miopenConvolutionFwdAlgoImplicitGEMM,<unused>;miopenConvolutionFwdAlgoDirect:ConvOclDirectFwd,3.22505,0,miopenConvolutionFwdAlgoDirect,<unused>;miopenConvolutionFwdAlgoWinograd:ConvBinWinogradRxSf2x3g1,2.26123,0,miopenConvolutionFwdAlgoWinograd,<unused>;miopenConvolutionFwdAlgoGEMM:GemmFwdRest,30.2639,2336256,miopenConvolutionFwdAlgoGEMM,<unused>
256-13-13-3x3-256-13-13-64-1x1-1x1-1x1-0-NCHW-FP32-F=miopenConvolutionFwdAlgoImplicitGEMM:ConvHipImplicitGemmV4R1Fwd,0.917272,0,miopenConvolutionFwdAlgoImplicitGEMM,<unused>;miopenConvolutionFwdAlgoDirect:ConvOclDirectFwd,3.21138,0,miopenConvolutionFwdAlgoDirect,<unused>;miopenConvolutionFwdAlgoWinograd:ConvBinWinogradRxSf2x3g1,1.86994,0,miopenConvolutionFwdAlgoWinograd,<unused>;miopenConvolutionFwdAlgoGEMM:GemmFwdRest,24.7754,1557504,miopenConvolutionFwdAlgoGEMM,<unused>
3-224-224-11x11-64-55-55-64-2x2-4x4-1x1-0-NCHW-FP16-F=miopenConvolutionFwdAlgoDirect:ConvOclDirectFwdGen,7.7992,0,miopenConvolutionFwdAlgoDirect,<unused>;miopenConvolutionFwdAlgoGEMM:GemmFwdRest,12.3237,2196150,miopenConvolutionFwdAlgoGEMM,<unused>
64-27-27-5x5-192-27-27-64-2x2-1x1-1x1-0-NCHW-FP16-F=miopenConvolutionFwdAlgoImplicitGEMM:ConvHipImplicitGemmV4R1Fwd,2.52775,0,miopenConvolutionFwdAlgoImplicitGEMM,<unused>;miopenConvolutionFwdAlgoDirect:ConvOclDirectFwd,3.38598,0,miopenConvolutionFwdAlgoDirect,<unused>;miopenConvolutionFwdAlgoWinograd:ConvBinWinogradRxSf2x3g1,3.24146,0,miopenConvolutionFwdAlgoWinograd,<unused>;miopenConvolutionFwdAlgoGEMM:GemmFwdRest,16.1816,2332800,miopenConvolutionFwdAlgoGEMM,<unused>
192-13-13-3x3-384-13-13-64-1x1-1x1-1x1-0-NCHW-FP16-F=miopenConvolutionFwdAlgoImplicitGEMM:ConvHipImplicitGemmV4R1Fwd,1.33783,0,miopenConvolutionFwdAlgoImplicitGEMM,<unused>;miopenConvolutionFwdAlgoDirect:ConvOclDirectFwd,4.83446,0,miopenConvolutionFwdAlgoDirect,<unused>;miopenConvolutionFwdAlgoWinograd:ConvBinWinogradRxSf2x3g1,1.29967,0,miopenConvolutionFwdAlgoWinograd,<unused>;miopenConvolutionFwdAlgoGEMM:GemmFwdRest,21.7087,584064,miopenConvolutionFwdAlgoGEMM,<unused>
384-13-13-3x3-256-13-13-64-1x1-1x1-1x1-0-NCHW-FP16-F=miopenConvolutionFwdAlgoImplicitGEMM:ConvHipImplicitGemmV4R1Fwd,1.79595,0,miopenConvolutionFwdAlgoImplicitGEMM,<unused>;miopenConvolutionFwdAlgoDirect:ConvOclDirectFwd,6.26825,0,miopenConvolutionFwdAlgoDirect,<unused>;miopenConvolutionFwdAlgoWinograd:ConvBinWinogradRxSf2x3g1,1.60159,0,miopenConvolutionFwdAlgoWinograd,<unused>;miopenConvolutionFwdAlgoGEMM:GemmFwdRest,21.0227,1168128,miopenConvolutionFwdAlgoGEMM,<unused>
256-13-13-3x3-256-13-13-64-1x1-1x1-1x1-0-NCHW-FP16-F=miopenConvolutionFwdAlgoImplicitGEMM:ConvHipImplicitGemmV4R1Fwd,1.23272,0,miopenConvolutionFwdAlgoImplicitGEMM,<unused>;miopenConvolutionFwdAlgoDirect:ConvOclDirectFwd,8.48474,0,miopenConvolutionFwdAlgoDirect,<unused>;miopenConvolutionFwdAlgoWinograd:ConvBinWinogradRxSf2x3g1,1.08956,0,miopenConvolutionFwdAlgoWinograd,<unused>;miopenConvolutionFwdAlgoGEMM:GemmFwdRest,15.6569,778752,miopenConvolutionFwdAlgoGEMM,<unused>
3-224-224-7x7-64-112-112-32-3x3-2x2-1x1-0-NCHW-FP32-F=miopenConvolutionFwdAlgoDirect:ConvOclDirectFwd,1.01352,0,miopenConvolutionFwdAlgoDirect,<unused>;miopenConvolutionFwdAlgoWinograd:ConvBinWinogradRxSf2x3g1,3.32455,0,miopenConvolutionFwdAlgoWinograd,<unused>;miopenConvolutionFwdAlgoGEMM:GemmFwdRest,5.51674,7375872,miopenConvolutionFwdAlgoGEMM,<unused>
64-56-56-1x1-128-56-56-32-0x0-1x1-1x1-0-NCHW-FP32-F=miopenConvolutionFwdAlgoImplicitGEMM:ConvHipImplicitGemmV4R4Fwd,0.137959,0,miopenConvolutionFwdAlgoImplicitGEMM,<unused>;miopenConvolutionFwdAlgoDirect:ConvDirectNaiveConvFwd,11.0753,0,miopenConvolutionFwdAlgoDirect,<unused>;miopenConvolutionFwdAlgoWinograd:ConvBinWinogradRxSf3x2,1.16088,0,miopenConvolutionFwdAlgoWinograd,<unused>;miopenConvolutionFwdAlgoGEMM:GemmFwd1x1_0_1,0.452599,0,miopenConvolutionFwdAlgoGEMM,<unused>
128-56-56-3x3-32-56-56-32-1x1-1x1-1x1-0-NCHW-FP32-F=miopenConvolutionFwdAlgoImplicitGEMM:ConvHipImplicitGemmV4R4Fwd,0.621278,0,miopenConvolutionFwdAlgoImplicitGEMM,<unused>;miopenConvolutionFwdAlgoDirect:ConvOclDirectFwd,4.00119,0,miopenConvolutionFwdAlgoDirect,<unused>;miopenConvolutionFwdAlgoWinograd:ConvBinWinogradRxSf2x3g1,0.987077,0,miopenConvolutionFwdAlgoWinograd,<unused>;miopenConvolutionFwdAlgoGEMM:GemmFwdRest,10.6636,14450688,miopenConvolutionFwdAlgoGEMM,<unused>
96-56-56-1x1-128-56-56-32-0x0-1x1-1x1-0-NCHW-FP32-F=miopenConvolutionFwdAlgoImplicitGEMM:ConvHipImplicitGemmV4R4Fwd,0.137239,0,miopenConvolutionFwdAlgoImplicitGEMM,<unused>;miopenConvolutionFwdAlgoDirect:ConvDirectNaiveConvFwd,11.3706,0,miopenConvolutionFwdAlgoDirect,<unused>;miopenConvolutionFwdAlgoWinograd:ConvBinWinogradRxSf2x3g1,2.94295,0,miopenConvolutionFwdAlgoWinograd,<unused>;miopenConvolutionFwdAlgoGEMM:GemmFwd1x1_0_1,0.661398,0,miopenConvolutionFwdAlgoGEMM,<unused>
128-56-56-1x1-128-56-56-32-0x0-1x1-1x1-0-NCHW-FP32-F=miopenConvolutionFwdAlgoImplicitGEMM:ConvHipImplicitGemmV4R1Fwd,0.279239,0,miopenConvolutionFwdAlgoImplicitGEMM,<unused>;miopenConvolutionFwdAlgoDirect:ConvDirectNaiveConvFwd,14.2454,0,miopenConvolutionFwdAlgoDirect,<unused>;miopenConvolutionFwdAlgoWinograd:ConvBinWinogradRxSf2x3g1,3.83219,0,miopenConvolutionFwdAlgoWinograd,<unused>;miopenConvolutionFwdAlgoGEMM:GemmFwd1x1_0_1,0.865718,0,miopenConvolutionFwdAlgoGEMM,<unused>
160-56-56-1x1-128-56-56-32-0x0-1x1-1x1-0-NCHW-FP32-F=miopenConvolutionFwdAlgoImplicitGEMM:ConvHipImplicitGemmV4R4Fwd,0.266759,0,miopenConvolutionFwdAlgoImplicitGEMM,<unused>;miopenConvolutionFwdAlgoDirect:ConvDirectNaiveConvFwd,18.0567,0,miopenConvolutionFwdAlgoDirect,<unused>;miopenConvolutionFwdAlgoWinograd:ConvBinWinogradRxSf2x3g1,2.27315,0,miopenConvolutionFwdAlgoWinograd,<unused>;miopenConvolutionFwdAlgoGEMM:GemmFwd1x1_0_1,1.0968,0,miopenConvolutionFwdAlgoGEMM,<unused>
192-56-56-1x1-128-56-56-32-0x0-1x1-1x1-0-NCHW-FP32-F=miopenConvolutionFwdAlgoImplicitGEMM:ConvHipImplicitGemmV4R4Fwd,0.310399,0,miopenConvolutionFwdAlgoImplicitGEMM,<unused>;miopenConvolutionFwdAlgoDirect:ConvDirectNaiveConvFwd,21.4981,0,miopenConvolutionFwdAlgoDirect,<unused>;miopenConvolutionFwdAlgoWinograd:ConvBinWinogradRxSf2x3g1,1.30196,0,miopenConvolutionFwdAlgoWinograd,<unused>;miopenConvolutionFwdAlgoGEMM:GemmFwd1x1_0_1,1.58332,0,miopenConvolutionFwdAlgoGEMM,<unused>
224-56-56-1x1-128-56-56-32-0x0-1x1-1x1-0-NCHW-FP32-F=miopenConvolutionFwdAlgoImplicitGEMM:ConvHipImplicitGemmV4R4Fwd,0.396559,0,miopenConvolutionFwdAlgoImplicitGEMM,<unused>;miopenConvolutionFwdAlgoDirect:ConvDirectNaiveConvFwd,25.069,0,miopenConvolutionFwdAlgoDirect,<unused>;miopenConvolutionFwdAlgoWinograd:ConvBinWinogradRxSf2x3g1,1.47932,0,miopenConvolutionFwdAlgoWinograd,<unused>;miopenConvolutionFwdAlgoGEMM:GemmFwd1x1_0_1,1.77204,0,miopenConvolutionFwdAlgoGEMM,<unused>
256-56-56-1x1-128-56-56-32-0x0-1x1-1x1-0-NCHW-FP32-F=miopenConvolutionFwdAlgoImplicitGEMM:ConvHipImplicitGemmV4R1Fwd,0.566598,0,miopenConvolutionFwdAlgoImplicitGEMM,<unused>;miopenConvolutionFwdAlgoDirect:ConvDirectNaiveConvFwd,28.2417,0,miopenConvolutionFwdAlgoDirect,<unused>;miopenConvolutionFwdAlgoWinograd:ConvBinWinogradRxSf2x3g1,1.84443,0,miopenConvolutionFwdAlgoWinograd,<unused>;miopenConvolutionFwdAlgoGEMM:GemmFwd1x1_0_1,2.02099,0,miopenConvolutionFwdAlgoGEMM,<unused>
128-28-28-1x1-128-28-28-32-0x0-1x1-1x1-0-NCHW-FP32-F=miopenConvolutionFwdAlgoImplicitGEMM:ConvHipImplicitGemmV4R1Fwd,0.06756,0,miopenConvolutionFwdAlgoImplicitGEMM,<unused>;miopenConvolutionFwdAlgoDirect:ConvDirectNaiveConvFwd,9.74449,0,miopenConvolutionFwdAlgoDirect,<unused>;miopenConvolutionFwdAlgoWinograd:ConvBinWinogradRxSf3x2,0.616959,0,miopenConvolutionFwdAlgoWinograd,<unused>;miopenConvolutionFwdAlgoGEMM:GemmFwd1x1_0_1,0.27856,0,miopenConvolutionFwdAlgoGEMM,<unused>
128-28-28-3x3-32-28-28-32-1x1-1x1-1x1-0-NCHW-FP32-F=miopenConvolutionFwdAlgoImplicitGEMM:ConvHipImplicitGemmV4R1Fwd,0.170679,0,miopenConvolutionFwdAlgoImplicitGEMM,<unused>;miopenConvolutionFwdAlgoDirect:ConvOclDirectFwd,1.44268,0,miopenConvolutionFwdAlgoDirect,<unused>;miopenConvolutionFwdAlgoWinograd:ConvBinWinogradRxSf2x3g1,0.300039,0,miopenConvolutionFwdAlgoWinograd,<unused>;miopenConvolutionFwdAlgoGEMM:GemmFwdRest,9.40285,3612672,miopenConvolutionFwdAlgoGEMM,<unused>
160-28-28-1x1-128-28-28-32-0x0-1x1-1x1-0-NCHW-FP32-F=miopenConvolutionFwdAlgoImplicitGEMM:ConvHipImplicitGemmV4R4Fwd,0.068,0,miopenConvolutionFwdAlgoImplicitGEMM,<unused>;miopenConvolutionFwdAlgoDirect:ConvDirectNaiveConvFwd,10.6677,0,miopenConvolutionFwdAlgoDirect,<unused>;miopenConvolutionFwdAlgoWinograd:ConvBinWinogradRxSf3x2,0.734078,0,miopenConvolutionFwdAlgoWinograd,<unused>;miopenConvolutionFwdAlgoGEMM:GemmFwd1x1_0_1,0.353399,0,miopenConvolutionFwdAlgoGEMM,<unused>
192-28-28-1x1-128-28-28-32-0x0-1x1-1x1-0-NCHW-FP32-F=miopenConvolutionFwdAlgoImplicitGEMM:ConvHipImplicitGemmV4R4Fwd,0.08392,0,miopenConvolutionFwdAlgoImplicitGEMM,<unused>;miopenConvolutionFwdAlgoDirect:ConvDirectNaiveConvFwd,8.70346,0,miopenConvolutionFwdAlgoDirect,<unused>;miopenConvolutionFwdAlgoWinograd:ConvBinWinogradRxSf2x3g1,1.42744,0,miopenConvolutionFwdAlgoWinograd,<unused>;miopenConvolutionFwdAlgoGEMM:GemmFwd1x1_0_1,0.404039,0,miopenConvolutionFwdAlgoGEMM,<unused>
224-28-28-1x1-128-28-28-32-0x0-1x1-1x1-0-NCHW-FP32-F=miopenConvolutionFwdAlgoImplicitGEMM:ConvHipImplicitGemmV4R4Fwd,0.08788,0,miopenConvolutionFwdAlgoImplicitGEMM,<unused>;miopenConvolutionFwdAlgoDirect:ConvDirectNaiveConvFwd,9.30678,0,miopenConvolutionFwdAlgoDirect,<unused>;miopenConvolutionFwdAlgoWinograd:ConvBinWinogradRxSf2x3g1,1.64892,0,miopenConvolutionFwdAlgoWinograd,<unused>;miopenConvolutionFwdAlgoGEMM:GemmFwd1x1_0_1,0.465679,0,miopenConvolutionFwdAlgoGEMM,<unused>
256-28-28-1x1-128-28-28-32-0x0-1x1-1x1-0-NCHW-FP32-F=miopenConvolutionFwdAlgoImplicitGEMM:ConvHipImplicitGemmV4R4Fwd,0.110639,0,miopenConvolutionFwdAlgoImplicitGEMM,<unused>;miopenConvolutionFwdAlgoDirect:ConvDirectNaiveConvFwd,9.61597,0,miopenConvolutionFwdAlgoDirect,<unused>;miopenConvolutionFwdAlgoWinograd:ConvBinWinogradRxSf2x3g1,1.86899,0,miopenConvolutionFwdAlgoWinograd,<unused>;miopenConvolutionFwdAlgoGEMM:GemmFwd1x1_0_1,0.526798,0,miopenConvolutionFwdAlgoGEMM,<unused>
288-28-28-1x1-128-28-28-32-0x0-1x1-1x1-0-NCHW-FP32-F=miopenConvolutionFwdAlgoImplicitGEMM:ConvHipImplicitGemmV4R4Fwd,0.10928,0,miopenConvolutionFwdAlgoImplicitGEMM,<unused>;miopenConvolutionFwdAlgoDirect:ConvDirectNaiveConvFwd,10.3827,0,miopenConvolutionFwdAlgoDirect,<unused>;miopenConvolutionFwdAlgoWinograd:ConvBinWinogradRxSf2x3g1,2.09027,0,miopenConvolutionFwdAlgoWinograd,<unused>;miopenConvolutionFwdAlgoGEMM:GemmFwd1x1_0_1,0.582159,0,miopenConvolutionFwdAlgoGEMM,<unused>
320-28-28-1x1-128-28-28-32-0x0-1x1-1x1-0-NCHW-FP32-F=miopenConvolutionFwdAlgoImplicitGEMM:ConvHipImplicitGemmV4R1Fwd,0.13416,0,miopenConvolutionFwdAlgoImplicitGEMM,<unused>;miopenConvolutionFwdAlgoDirect:ConvDirectNaiveConvFwd,11.3776,0,miopenConvolutionFwdAlgoDirect,<unused>;miopenConvolutionFwdAlgoWinograd:ConvBinWinogradRxSf2x3g1,2.30887,0,miopenConvolutionFwdAlgoWinograd,<unused>;miopenConvolutionFwdAlgoGEMM:GemmFwd1x1_0_1,0.644238,0,miopenConvolutionFwdAlgoGEMM,<unused>
352-28-28-1x1-128-28-28-32-0x0-1x1-1x1-0-NCHW-FP32-F=miopenConvolutionFwdAlgoImplicitGEMM:ConvHipImplicitGemmV4R4Fwd,0.13096,0,miopenConvolutionFwdAlgoImplicitGEMM,<unused>;miopenConvolutionFwdAlgoDirect:ConvDirectNaiveConvFwd,12.2695,0,miopenConvolutionFwdAlgoDirect,<unused>;miopenConvolutionFwdAlgoWinograd:ConvBinWinogradRxSf2x3g1,2.53104,0,miopenConvolutionFwdAlgoWinograd,<unused>;miopenConvolutionFwdAlgoGEMM:GemmFwd1x1_0_1,0.706519,0,miopenConvolutionFwdAlgoGEMM,<unused>
384-28-28-1x1-128-28-28-32-0x0-1x1-1x1-0-NCHW-FP32-F=miopenConvolutionFwdAlgoImplicitGEMM:ConvHipImplicitGemmV4R1Fwd,0.160839,0,miopenConvolutionFwdAlgoImplicitGEMM,<unused>;miopenConvolutionFwdAlgoDirect:ConvDirectNaiveConvFwd,11.206,0,miopenConvolutionFwdAlgoDirect,<unused>;miopenConvolutionFwdAlgoWinograd:ConvBinWinogradRxSf2x3g1,0.64608,0,miopenConvolutionFwdAlgoWinograd,<unused>;miopenConvolutionFwdAlgoGEMM:GemmFwd1x1_0_1,2.53732,0,miopenConvolutionFwdAlgoGEMM,<unused>
416-28-28-1x1-128-28-28-32-0x0-1x1-1x1-0-NCHW-FP32-F=miopenConvolutionFwdAlgoImplicitGEMM:ConvHipImplicitGemmV4R4Fwd,0.18812,0,miopenConvolutionFwdAlgoImplicitGEMM,<unused>;miopenConvolutionFwdAlgoDirect:ConvDirectNaiveConvFwd,12.2625,0,miopenConvolutionFwdAlgoDirect,<unused>;miopenConvolutionFwdAlgoWinograd:ConvBinWinogradRxSf2x3g1,2.9734,0,miopenConvolutionFwdAlgoWinograd,<unused>;miopenConvolutionFwdAlgoGEMM:GemmFwd1x1_0_1,0.88524,0,miopenConvolutionFwdAlgoGEMM,<unused>
448-28-28-1x1-128-28-28-32-0x0-1x1-1x1-0-NCHW-FP32-F=miopenConvolutionFwdAlgoImplicitGEMM:ConvHipImplicitGemmV4R4Fwd,0.19796,0,miopenConvolutionFwdAlgoImplicitGEMM,<unused>;miopenConvolutionFwdAlgoDirect:ConvDirectNaiveConvFwd,13.1289,0,miopenConvolutionFwdAlgoDirect,<unused>;miopenConvolutionFwdAlgoWinograd:ConvBinWinogradRxSf2x3g1,2.25668,0,miopenConvolutionFwdAlgoWinograd,<unused>;miopenConvolutionFwdAlgoGEMM:GemmFwd1x1_0_1,0.93104,0,miopenConvolutionFwdAlgoGEMM,<unused>
480-28-28-1x1-128-28-28-32-0x0-1x1-1x1-0-NCHW-FP32-F=miopenConvolutionFwdAlgoImplicitGEMM:ConvHipImplicitGemmV4R4Fwd,0.2056,0,miopenConvolutionFwdAlgoImplicitGEMM,<unused>;miopenConvolutionFwdAlgoDirect:ConvDirectNaiveConvFwd,14.002,0,miopenConvolutionFwdAlgoDirect,<unused>;miopenConvolutionFwdAlgoWinograd:ConvBinWinogradRxSf2x3g1,1.65916,0,miopenConvolutionFwdAlgoWinograd,<unused>;miopenConvolutionFwdAlgoGEMM:GemmFwd1x1_0_1,1.01144,0,miopenConvolutionFwdAlgoGEMM,<unused>
512-28-28-1x1-256-28-28-32-0x0-1x1-1x1-0-NCHW-FP32-F=miopenConvolutionFwdAlgoImplicitGEMM:ConvHipImplicitGemmV4R1Fwd,0.582641,0,miopenConvolutionFwdAlgoImplicitGEMM,<unused>;miopenConvolutionFwdAlgoDirect:ConvDirectNaiveConvFwd,29.1161,0,miopenConvolutionFwdAlgoDirect,<unused>;miopenConvolutionFwdAlgoWinograd:ConvBinWinogradRxSf2x3g1,1.62752,0,miopenConvolutionFwdAlgoWinograd,<unused>;miopenConvolutionFwdAlgoGEMM:GemmFwd1x1_0_1,2.16964,0,miopenConvolutionFwdAlgoGEMM,<unused>
256-14-14-1x1-128-14-14-32-0x0-1x1-1x1-0-NCHW-FP32-F=miopenConvolutionFwdAlgoImplicitGEMM:ConvHipImplicitGemmV4R4Fwd,0.04344,0,miopenConvolutionFwdAlgoImplicitGEMM,<unused>;miopenConvolutionFwdAlgoDirect:ConvDirectNaiveConvFwd,11.4849,0,miopenConvolutionFwdAlgoDirect,<unused>;miopenConvolutionFwdAlgoWinograd:ConvBinWinogradRxSf3x2,0.41004,0,miopenConvolutionFwdAlgoWinograd,<unused>;miopenConvolutionFwdAlgoGEMM:GemmFwd1x1_0_1,0.50156,0,miopenConvolutionFwdAlgoGEMM,<unused>
128-14-14-3x3-32-14-14-32-1x1-1x1-1x1-0-NCHW-FP32-F=miopenConvolutionFwdAlgoImplicitGEMM:ConvHipImplicitGemmV4R1Fwd,0.43048,0,miopenConvolutionFwdAlgoImplicitGEMM,<unused>;miopenConvolutionFwdAlgoDirect:ConvOclDirectFwd,0.59676,0,miopenConvolutionFwdAlgoDirect,<unused>;miopenConvolutionFwdAlgoWinograd:ConvBinWinogradRxSf2x3g1,0.1246,0,miopenConvolutionFwdAlgoWinograd,<unused>;miopenConvolutionFwdAlgoGEMM:GemmFwdRest,5.54368,903168,miopenConvolutionFwdAlgoGEMM,<unused>
288-14-14-1x1-128-14-14-32-0x0-1x1-1x1-0-NCHW-FP32-F=miopenConvolutionFwdAlgoImplicitGEMM:ConvHipImplicitGemmV4R4Fwd,0.04764,0,miopenConvolutionFwdAlgoImplicitGEMM,<unused>;miopenConvolutionFwdAlgoDirect:ConvDirectNaiveConvFwd,11.5753,0,miopenConvolutionFwdAlgoDirect,<unused>;miopenConvolutionFwdAlgoWinograd:ConvBinWinogradRxSf3x2,0.44708,0,miopenConvolutionFwdAlgoWinograd,<unused>;miopenConvolutionFwdAlgoGEMM:GemmFwd1x1_0_1,0.55928,0,miopenConvolutionFwdAlgoGEMM,<unused>
320-14-14-1x1-128-14-14-32-0x0-1x1-1x1-0-NCHW-FP32-F=miopenConvolutionFwdAlgoImplicitGEMM:ConvHipImplicitGemmV4R4Fwd,0.05108,0,miopenConvolutionFwdAlgoImplicitGEMM,<unused>;miopenConvolutionFwdAlgoDirect:ConvDirectNaiveConvFwd,11.7863,0,miopenConvolutionFwdAlgoDirect,<unused>;miopenConvolutionFwdAlgoWinograd:ConvBinWinogradRxSf3x2,0.487401,0,miopenConvolutionFwdAlgoWinograd,<unused>;miopenConvolutionFwdAlgoGEMM:GemmFwd1x1_0_1,0.61952,0,miopenConvolutionFwdAlgoGEMM,<unused>
352-14-14-1x1-128-14-14-32-0x0-1x1-1x1-0-NCHW-FP32-F=miopenConvolutionFwdAlgoImplicitGEMM:ConvHipImplicitGemmV4R4Fwd,0.05408,0,miopenConvolutionFwdAlgoImplicitGEMM,<unused>;miopenConvolutionFwdAlgoDirect:ConvDirectNaiveConvFwd,11.2602,0,miopenConvolutionFwdAlgoDirect,<unused>;miopenConvolutionFwdAlgoWinograd:ConvBinWinogradRxSf3x2,0.52604,0,miopenConvolutionFwdAlgoWinograd,<unused>;miopenConvolutionFwdAlgoGEMM:GemmFwd1x1_0_1,0.6788,0,miopenConvolutionFwdAlgoGEMM,<unused>
384-14-14-1x1-128-14-14-32-0x0-1x1-1x1-0-NCHW-FP32-F=miopenConvolutionFwdAlgoImplicitGEMM:ConvHipImplicitGemmV4R4Fwd,0.0576,0,miopenConvolutionFwdAlgoImplicitGEMM,<unused>;miopenConvolutionFwdAlgoDirect:ConvDirectNaiveConvFwd,9.6028,0,miopenConvolutionFwdAlgoDirect,<unused>;miopenConvolutionFwdAlgoWinograd:ConvBinWinogradRxSf3x2,0.56128,0,miopenConvolutionFwdAlgoWinograd,<unused>;miopenConvolutionFwdAlgoGEMM:GemmFwd1x1_0_1,0.74344,0,miopenConvolutionFwdAlgoGEMM,<unused>
416-14-14-1x1-128-14-14-32-0x0-1x1-1x1-0-NCHW-FP32-F=miopenConvolutionFwdAlgoImplicitGEMM:ConvHipImplicitGemmV4R4Fwd,0.0594,0,miopenConvolutionFwdAlgoImplicitGEMM,<unused>;miopenConvolutionFwdAlgoDirect:ConvDirectNaiveConvFwd,9.41632,0,miopenConvolutionFwdAlgoDirect,<unused>;miopenConvolutionFwdAlgoWinograd:ConvBinWinogradRxSf3x2,0.599679,0,miopenConvolutionFwdAlgoWinograd,<unused>;miopenConvolutionFwdAlgoGEMM:GemmFwd1x1_0_1,0.796,0,miopenConvolutionFwdAlgoGEMM,<unused>
448-14-14-1x1-128-14-14-32-0x0-1x1-1x1-0-NCHW-FP32-F=miopenConvolutionFwdAlgoImplicitGEMM:ConvHipImplicitGemmV4R4Fwd,0.06408,0,miopenConvolutionFwdAlgoImplicitGEMM,<unused>;miopenConvolutionFwdAlgoDirect:ConvDirectNaiveConvFwd,10.4029,0,miopenConvolutionFwdAlgoDirect,<unused>;miopenConvolutionFwdAlgoWinograd:ConvBinWinogradRxSf3x2,0.63936,0,miopenConvolutionFwdAlgoWinograd,<unused>;miopenConvolutionFwdAlgoGEMM:GemmFwd1x1_0_1,0.862399,0,miopenConvolutionFwdAlgoGEMM,<unused>
480-14-14-1x1-128-14-14-32-0x0-1x1-1x1-0-NCHW-FP32-F=miopenConvolutionFwdAlgoImplicitGEMM:ConvHipImplicitGemmV4R4Fwd,0.06348,0,miopenConvolutionFwdAlgoImplicitGEMM,<unused>;miopenConvolutionFwdAlgoDirect:ConvDirectNaiveConvFwd,9.87244,0,miopenConvolutionFwdAlgoDirect,<unused>;miopenConvolutionFwdAlgoWinograd:ConvBinWinogradRxSf3x2,0.677039,0,miopenConvolutionFwdAlgoWinograd,<unused>;miopenConvolutionFwdAlgoGEMM:GemmFwd1x1_0_1,0.914519,0,miopenConvolutionFwdAlgoGEMM,<unused>
512-14-14-1x1-128-14-14-32-0x0-1x1-1x1-0-NCHW-FP32-F=miopenConvolutionFwdAlgoImplicitGEMM:ConvHipImplicitGemmV4R1Fwd,0.0704,0,miopenConvolutionFwdAlgoImplicitGEMM,<unused>;miopenConvolutionFwdAlgoDirect:ConvDirectNaiveConvFwd,9.9656,0,miopenConvolutionFwdAlgoDirect,<unused>;miopenConvolutionFwdAlgoWinograd:ConvBinWinogradRxSf3x2,0.712999,0,miopenConvolutionFwdAlgoWinograd,<unused>;miopenConvolutionFwdAlgoGEMM:GemmFwd1x1_0_1,0.974439,0,miopenConvolutionFwdAlgoGEMM,<unused>
544-14-14-1x1-128-14-14-32-0x0-1x1-1x1-0-NCHW-FP32-F=miopenConvolutionFwdAlgoImplicitGEMM:ConvHipImplicitGemmV4R4Fwd,0.069679,0,miopenConvolutionFwdAlgoImplicitGEMM,<unused>;miopenConvolutionFwdAlgoDirect:ConvDirectNaiveConvFwd,9.40619,0,miopenConvolutionFwdAlgoDirect,<unused>;miopenConvolutionFwdAlgoWinograd:ConvBinWinogradRxSf3x2,0.74936,0,miopenConvolutionFwdAlgoWinograd,<unused>;miopenConvolutionFwdAlgoGEMM:GemmFwd1x1_0_1,1.0334,0,miopenConvolutionFwdAlgoGEMM,<unused>
576-14-14-1x1-128-14-14-32-0x0-1x1-1x1-0-NCHW-FP32-F=miopenConvolutionFwdAlgoImplicitGEMM:ConvHipImplicitGemmV4R4Fwd,0.07332,0,miopenConvolutionFwdAlgoImplicitGEMM,<unused>;miopenConvolutionFwdAlgoDirect:ConvDirectNaiveConvFwd,7.61481,0,miopenConvolutionFwdAlgoDirect,<unused>;miopenConvolutionFwdAlgoWinograd:ConvBinWinogradRxSf2x3g1,1.15252,0,miopenConvolutionFwdAlgoWinograd,<unused>;miopenConvolutionFwdAlgoGEMM:GemmFwd1x1_0_1,1.10028,0,miopenConvolutionFwdAlgoGEMM,<unused>
608-14-14-1x1-128-14-14-32-0x0-1x1-1x1-0-NCHW-FP32-F=miopenConvolutionFwdAlgoImplicitGEMM:ConvHipImplicitGemmV4R4Fwd,0.077518,0,miopenConvolutionFwdAlgoImplicitGEMM,<unused>;miopenConvolutionFwdAlgoDirect:ConvDirectNaiveConvFwd,7.74211,0,miopenConvolutionFwdAlgoDirect,<unused>;miopenConvolutionFwdAlgoWinograd:ConvBinWinogradRxSf2x3g1,1.20676,0,miopenConvolutionFwdAlgoWinograd,<unused>;miopenConvolutionFwdAlgoGEMM:GemmFwd1x1_0_1,1.15176,0,miopenConvolutionFwdAlgoGEMM,<unused>
640-14-14-1x1-128-14-14-32-0x0-1x1-1x1-0-NCHW-FP32-F=miopenConvolutionFwdAlgoImplicitGEMM:ConvHipImplicitGemmV4R4Fwd,0.0822,0,miopenConvolutionFwdAlgoImplicitGEMM,<unused>;miopenConvolutionFwdAlgoDirect:ConvDirectNaiveConvFwd,9.63798,0,miopenConvolutionFwdAlgoDirect,<unused>;miopenConvolutionFwdAlgoWinograd:ConvBinWinogradRxSf2x3g1,1.25404,0,miopenConvolutionFwdAlgoWinograd,<unused>;miopenConvolutionFwdAlgoGEMM:GemmFwd1x1_0_1,1.2176,0,miopenConvolutionFwdAlgoGEMM,<unused>
672-14-14-1x1-128-14-14-32-0x0-1x1-1x1-0-NCHW-FP32-F=miopenConvolutionFwdAlgoImplicitGEMM:ConvHipImplicitGemmV4R4Fwd,0.08552,0,miopenConvolutionFwdAlgoImplicitGEMM,<unused>;miopenConvolutionFwdAlgoDirect:ConvDirectNaiveConvFwd,7.6071,0,miopenConvolutionFwdAlgoDirect,<unused>;miopenConvolutionFwdAlgoWinograd:ConvBinWinogradRxSf2x3g1,1.3294,0,miopenConvolutionFwdAlgoWinograd,<unused>;miopenConvolutionFwdAlgoGEMM:GemmFwd1x1_0_1,1.26956,0,miopenConvolutionFwdAlgoGEMM,<unused>
704-14-14-1x1-128-14-14-32-0x0-1x1-1x1-0-NCHW-FP32-F=miopenConvolutionFwdAlgoImplicitGEMM:ConvHipImplicitGemmV4R4Fwd,0.08792,0,miopenConvolutionFwdAlgoImplicitGEMM,<unused>;miopenConvolutionFwdAlgoDirect:ConvDirectNaiveConvFwd,6.55452,0,miopenConvolutionFwdAlgoDirect,<unused>;miopenConvolutionFwdAlgoWinograd:ConvBinWinogradRxSf2x3g1,0.86341,0,miopenConvolutionFwdAlgoWinograd,<unused>;miopenConvolutionFwdAlgoGEMM:GemmFwd1x1_0_1,1.32768,0,miopenConvolutionFwdAlgoGEMM,<unused>
736-14-14-1x1-128-14-14-32-0x0-1x1-1x1-0-NCHW-FP32-F=miopenConvolutionFwdAlgoImplicitGEMM:ConvHipImplicitGemmV4R4Fwd,0.09064,0,miopenConvolutionFwdAlgoImplicitGEMM,<unused>;miopenConvolutionFwdAlgoDirect:ConvDirectNaiveConvFwd,8.24277,0,miopenConvolutionFwdAlgoDirect,<unused>;miopenConvolutionFwdAlgoWinograd:ConvBinWinogradRxSf2x3g1,1.45268,0,miopenConvolutionFwdAlgoWinograd,<unused>;miopenConvolutionFwdAlgoGEMM:GemmFwd1x1_0_1,1.3892,0,miopenConvolutionFwdAlgoGEMM,<unused>
768-14-14-1x1-128-14-14-32-0x0-1x1-1x1-0-NCHW-FP32-F=miopenConvolutionFwdAlgoImplicitGEMM:ConvHipImplicitGemmV4R4Fwd,0.09492,0,miopenConvolutionFwdAlgoImplicitGEMM,<unused>;miopenConvolutionFwdAlgoDirect:ConvDirectNaiveConvFwd,7.6995,0,miopenConvolutionFwdAlgoDirect,<unused>;miopenConvolutionFwdAlgoWinograd:ConvBinWinogradRxSf2x3g1,1.50348,0,miopenConvolutionFwdAlgoWinograd,<unused>;miopenConvolutionFwdAlgoGEMM:GemmFwd1x1_0_1,1.44712,0,miopenConvolutionFwdAlgoGEMM,<unused>
800-14-14-1x1-128-14-14-32-0x0-1x1-1x1-0-NCHW-FP32-F=miopenConvolutionFwdAlgoImplicitGEMM:ConvHipImplicitGemmV4R4Fwd,0.0982,0,miopenConvolutionFwdAlgoImplicitGEMM,<unused>;miopenConvolutionFwdAlgoDirect:ConvDirectNaiveConvFwd,10.2396,0,miopenConvolutionFwdAlgoDirect,<unused>;miopenConvolutionFwdAlgoWinograd:ConvBinWinogradRxSf3x2,1.04616,0,miopenConvolutionFwdAlgoWinograd,<unused>;miopenConvolutionFwdAlgoGEMM:GemmFwd1x1_0_1,1.50632,0,miopenConvolutionFwdAlgoGEMM,<unused>
832-14-14-1x1-128-14-14-32-0x0-1x1-1x1-0-NCHW-FP32-F=miopenConvolutionFwdAlgoImplicitGEMM:ConvHipImplicitGemmV4R4Fwd,0.1012,0,miopenConvolutionFwdAlgoImplicitGEMM,<unused>;miopenConvolutionFwdAlgoDirect:ConvDirectNaiveConvFwd,8.59445,0,miopenConvolutionFwdAlgoDirect,<unused>;miopenConvolutionFwdAlgoWinograd:ConvBinWinogradRxSf2x3g1,1.6352,0,miopenConvolutionFwdAlgoWinograd,<unused>;miopenConvolutionFwdAlgoGEMM:GemmFwd1x1_0_1,1.56712,0,miopenConvolutionFwdAlgoGEMM,<unused>
864-14-14-1x1-128-14-14-32-0x0-1x1-1x1-0-NCHW-FP32-F=miopenConvolutionFwdAlgoImplicitGEMM:ConvHipImplicitGemmV4R4Fwd,0.10536,0,miopenConvolutionFwdAlgoImplicitGEMM,<unused>;miopenConvolutionFwdAlgoDirect:ConvDirectNaiveConvFwd,7.87744,0,miopenConvolutionFwdAlgoDirect,<unused>;miopenConvolutionFwdAlgoWinograd:ConvBinWinogradRxSf2x3g1,0.40064,0,miopenConvolutionFwdAlgoWinograd,<unused>;miopenConvolutionFwdAlgoGEMM:GemmFwd1x1_0_1,1.62536,0,miopenConvolutionFwdAlgoGEMM,<unused>
896-14-14-1x1-128-14-14-32-0x0-1x1-1x1-0-NCHW-FP32-F=miopenConvolutionFwdAlgoImplicitGEMM:ConvHipImplicitGemmV4R4Fwd,0.1096,0,miopenConvolutionFwdAlgoImplicitGEMM,<unused>;miopenConvolutionFwdAlgoDirect:ConvDirectNaiveConvFwd,9.09105,0,miopenConvolutionFwdAlgoDirect,<unused>;miopenConvolutionFwdAlgoWinograd:ConvBinWinogradRxSf2x3g1,1.74672,0,miopenConvolutionFwdAlgoWinograd,<unused>;miopenConvolutionFwdAlgoGEMM:GemmFwd1x1_0_1,1.68468,0,miopenConvolutionFwdAlgoGEMM,<unused>
928-14-14-1x1-128-14-14-32-0x0-1x1-1x1-0-NCHW-FP32-F=miopenConvolutionFwdAlgoImplicitGEMM:ConvHipImplicitGemmV4R4Fwd,0.11324,0,miopenConvolutionFwdAlgoImplicitGEMM,<unused>;miopenConvolutionFwdAlgoDirect:ConvDirectNaiveConvFwd,10.3899,0,miopenConvolutionFwdAlgoDirect,<unused>;miopenConvolutionFwdAlgoWinograd:ConvBinWinogradRxSf3x2,1.20984,0,miopenConvolutionFwdAlgoWinograd,<unused>;miopenConvolutionFwdAlgoGEMM:GemmFwd1x1_0_1,1.74596,0,miopenConvolutionFwdAlgoGEMM,<unused>
960-14-14-1x1-128-14-14-32-0x0-1x1-1x1-0-NCHW-FP32-F=miopenConvolutionFwdAlgoImplicitGEMM:ConvHipImplicitGemmV4R4Fwd,0.11624,0,miopenConvolutionFwdAlgoImplicitGEMM,<unused>;miopenConvolutionFwdAlgoDirect:ConvDirectNaiveConvFwd,9.64589,0,miopenConvolutionFwdAlgoDirect,<unused>;miopenConvolutionFwdAlgoWinograd:ConvBinWinogradRxSf2x3g1,1.86656,0,miopenConvolutionFwdAlgoWinograd,<unused>;miopenConvolutionFwdAlgoGEMM:GemmFwd1x1_0_1,1.8028,0,miopenConvolutionFwdAlgoGEMM,<unused>
992-14-14-1x1-128-14-14-32-0x0-1x1-1x1-0-NCHW-FP32-F=miopenConvolutionFwdAlgoImplicitGEMM:ConvHipImplicitGemmV4R4Fwd,0.11848,0,miopenConvolutionFwdAlgoImplicitGEMM,<unused>;miopenConvolutionFwdAlgoDirect:ConvDirectNaiveConvFwd,9.05079,0,miopenConvolutionFwdAlgoDirect,<unused>;miopenConvolutionFwdAlgoWinograd:ConvBinWinogradRxSf2x3g1,0.92355,0,miopenConvolutionFwdAlgoWinograd,<unused>;miopenConvolutionFwdAlgoGEMM:GemmFwd1x1_0_1,1.86148,0,miopenConvolutionFwdAlgoGEMM,<unused>
1024-14-14-1x1-512-14-14-32-0x0-1x1-1x1-0-NCHW-FP32-F=miopenConvolutionFwdAlgoImplicitGEMM:ConvHipImplicitGemmV4R1Fwd,0.488959,0,miopenConvolutionFwdAlgoImplicitGEMM,<unused>;miopenConvolutionFwdAlgoDirect:ConvDirectNaiveConvFwd,35.7085,0,miopenConvolutionFwdAlgoDirect,<unused>;miopenConvolutionFwdAlgoWinograd:ConvBinWinogradRxSf2x3g1,1.60288,0,miopenConvolutionFwdAlgoWinograd,<unused>;miopenConvolutionFwdAlgoGEMM:GemmFwd1x1_0_1,2.37176,0,miopenConvolutionFwdAlgoGEMM,<unused>
512-7-7-1x1-128-7-7-32-0x0-1x1-1x1-0-NCHW-FP32-F=miopenConvolutionFwdAlgoImplicitGEMM:ConvHipImplicitGemmV4R4Fwd,0.16408,0,miopenConvolutionFwdAlgoImplicitGEMM,<unused>;miopenConvolutionFwdAlgoDirect:ConvDirectNaiveConvFwd,5.9672,0,miopenConvolutionFwdAlgoDirect,<unused>;miopenConvolutionFwdAlgoWinograd:ConvBinWinogradRxSf2x3g1,0.36452,0,miopenConvolutionFwdAlgoWinograd,<unused>;miopenConvolutionFwdAlgoGEMM:GemmFwd1x1_0_1,0.31684,0,miopenConvolutionFwdAlgoGEMM,<unused>
128-7-7-3x3-32-7-7-32-1x1-1x1-1x1-0-NCHW-FP32-F=miopenConvolutionFwdAlgoImplicitGEMM:ConvHipImplicitGemmV4R1Fwd,0.37964,0,miopenConvolutionFwdAlgoImplicitGEMM,<unused>;miopenConvolutionFwdAlgoDirect:ConvOclDirectFwd,0.307719,0,miopenConvolutionFwdAlgoDirect,<unused>;miopenConvolutionFwdAlgoWinograd:ConvBinWinogradRxSf2x3,0.13124,0,miopenConvolutionFwdAlgoWinograd,<unused>;miopenConvolutionFwdAlgoGEMM:GemmFwdRest,5.64093,225792,miopenConvolutionFwdAlgoGEMM,<unused>
544-7-7-1x1-128-7-7-32-0x0-1x1-1x1-0-NCHW-FP32-F=miopenConvolutionFwdAlgoImplicitGEMM:ConvHipImplicitGemmV4R4Fwd,0.16956,0,miopenConvolutionFwdAlgoImplicitGEMM,<unused>;miopenConvolutionFwdAlgoDirect:ConvDirectNaiveConvFwd,6.3476,0,miopenConvolutionFwdAlgoDirect,<unused>;miopenConvolutionFwdAlgoWinograd:ConvBinWinogradRxSf2x3g1,0.38512,0,miopenConvolutionFwdAlgoWinograd,<unused>;miopenConvolutionFwdAlgoGEMM:GemmFwd1x1_0_1,0.33372,0,miopenConvolutionFwdAlgoGEMM,<unused>
576-7-7-1x1-128-7-7-32-0x0-1x1-1x1-0-NCHW-FP32-F=miopenConvolutionFwdAlgoImplicitGEMM:ConvHipImplicitGemmV4R4Fwd,0.1778,0,miopenConvolutionFwdAlgoImplicitGEMM,<unused>;miopenConvolutionFwdAlgoDirect:ConvDirectNaiveConvFwd,6.71595,0,miopenConvolutionFwdAlgoDirect,<unused>;miopenConvolutionFwdAlgoWinograd:ConvBinWinogradRxSf2x3g1,0.40544,0,miopenConvolutionFwdAlgoWinograd,<unused>;miopenConvolutionFwdAlgoGEMM:GemmFwd1x1_0_1,0.35288,0,miopenConvolutionFwdAlgoGEMM,<unused>
608-7-7-1x1-128-7-7-32-0x0-1x1-1x1-0-NCHW-FP32-F=miopenConvolutionFwdAlgoImplicitGEMM:ConvHipImplicitGemmV4R4Fwd,0.18504,0,miopenConvolutionFwdAlgoImplicitGEMM,<unused>;miopenConvolutionFwdAlgoDirect:ConvDirectNaiveConvFwd,7.08099,0,miopenConvolutionFwdAlgoDirect,<unused>;miopenConvolutionFwdAlgoWinograd:ConvBinWinogradRxSf2x3g1,0.42504,0,miopenConvolutionFwdAlgoWinograd,<unused>;miopenConvolutionFwdAlgoGEMM:GemmFwd1x1_0_1,0.369999,0,miopenConvolutionFwdAlgoGEMM,<unused>
640-7-7-1x1-128-7-7-32-0x0-1x1-1x1-0-NCHW-FP32-F=miopenConvolutionFwdAlgoImplicitGEMM:ConvHipImplicitGemmV4R1Fwd,0.19908,0,miopenConvolutionFwdAlgoImplicitGEMM,<unused>;miopenConvolutionFwdAlgoDirect:ConvDirectNaiveConvFwd,7.45467,0,miopenConvolutionFwdAlgoDirect,<unused>;miopenConvolutionFwdAlgoWinograd:ConvBinWinogradRxSf2x3g1,0.445239,0,miopenConvolutionFwdAlgoWinograd,<unused>;miopenConvolutionFwdAlgoGEMM:GemmFwd1x1_0_1,0.38852,0,miopenConvolutionFwdAlgoGEMM,<unused>
672-7-7-1x1-128-7-7-32-0x0-1x1-1x1-0-NCHW-FP32-F=miopenConvolutionFwdAlgoImplicitGEMM:ConvHipImplicitGemmV4R4Fwd,0.20376,0,miopenConvolutionFwdAlgoImplicitGEMM,<unused>;miopenConvolutionFwdAlgoDirect:ConvDirectNaiveConvFwd,7.82051,0,miopenConvolutionFwdAlgoDirect,<unused>;miopenConvolutionFwdAlgoWinograd:ConvBinWinogradRxSf2x3g1,0.465399,0,miopenConvolutionFwdAlgoWinograd,<unused>;miopenConvolutionFwdAlgoGEMM:GemmFwd1x1_0_1,0.4066,0,miopenConvolutionFwdAlgoGEMM,<unused>
704-7-7-1x1-128-7-7-32-0x0-1x1-1x1-0-NCHW-FP32-F=miopenConvolutionFwdAlgoImplicitGEMM:ConvHipImplicitGemmV4R4Fwd,0.21124,0,miopenConvolutionFwdAlgoImplicitGEMM,<unused>;miopenConvolutionFwdAlgoDirect:ConvDirectNaiveConvFwd,8.19387,0,miopenConvolutionFwdAlgoDirect,<unused>;miopenConvolutionFwdAlgoWinograd:ConvBinWinogradRxSf2x3g1,0.48644,0,miopenConvolutionFwdAlgoWinograd,<unused>;miopenConvolutionFwdAlgoGEMM:GemmFwd1x1_0_1,0.42336,0,miopenConvolutionFwdAlgoGEMM,<unused>
736-7-7-1x1-128-7-7-32-0x0-1x1-1x1-0-NCHW-FP32-F=miopenConvolutionFwdAlgoImplicitGEMM:ConvHipImplicitGemmV4R4Fwd,0.22036,0,miopenConvolutionFwdAlgoImplicitGEMM,<unused>;miopenConvolutionFwdAlgoDirect:ConvDirectNaiveConvFwd,8.57523,0,miopenConvolutionFwdAlgoDirect,<unused>;miopenConvolutionFwdAlgoWinograd:ConvBinWinogradRxSf2x3g1,0.50548,0,miopenConvolutionFwdAlgoWinograd,<unused>;miopenConvolutionFwdAlgoGEMM:GemmFwd1x1_0_1,0.442799,0,miopenConvolutionFwdAlgoGEMM,<unused>
768-7-7-1x1-128-7-7-32-0x0-1x1-1x1-0-NCHW-FP32-F=miopenConvolutionFwdAlgoImplicitGEMM:ConvHipImplicitGemmV4R4Fwd,0.23504,0,miopenConvolutionFwdAlgoImplicitGEMM,<unused>;miopenConvolutionFwdAlgoDirect:ConvDirectNaiveConvFwd,8.92927,0,miopenConvolutionFwdAlgoDirect,<unused>;miopenConvolutionFwdAlgoWinograd:ConvBinWinogradRxSf2x3g1,0.5144,0,miopenConvolutionFwdAlgoWinograd,<unused>;miopenConvolutionFwdAlgoGEMM:GemmFwd1x1_0_1,0.46048,0,miopenConvolutionFwdAlgoGEMM,<unused>
800-7-7-1x1-128-7-7-32-0x0-1x1-1x1-0-NCHW-FP32-F=miopenConvolutionFwdAlgoImplicitGEMM:ConvHipImplicitGemmV4R4Fwd,0.23712,0,miopenConvolutionFwdAlgoImplicitGEMM,<unused>;miopenConvolutionFwdAlgoDirect:ConvDirectNaiveConvFwd,9.30691,0,miopenConvolutionFwdAlgoDirect,<unused>;miopenConvolutionFwdAlgoWinograd:ConvBinWinogradRxSf2x3g1,0.54692,0,miopenConvolutionFwdAlgoWinograd,<unused>;miopenConvolutionFwdAlgoGEMM:GemmFwd1x1_0_1,0.47776,0,miopenConvolutionFwdAlgoGEMM,<unused>
832-7-7-1x1-128-7-7-32-0x0-1x1-1x1-0-NCHW-FP32-F=miopenConvolutionFwdAlgoImplicitGEMM:ConvHipImplicitGemmV4R4Fwd,0.24652,0,miopenConvolutionFwdAlgoImplicitGEMM,<unused>;miopenConvolutionFwdAlgoDirect:ConvDirectNaiveConvFwd,9.66851,0,miopenConvolutionFwdAlgoDirect,<unused>;miopenConvolutionFwdAlgoWinograd:ConvBinWinogradRxSf2x3g1,0.56684,0,miopenConvolutionFwdAlgoWinograd,<unused>;miopenConvolutionFwdAlgoGEMM:GemmFwd1x1_0_1,0.497119,0,miopenConvolutionFwdAlgoGEMM,<unused>
864-7-7-1x1-128-7-7-32-0x0-1x1-1x1-0-NCHW-FP32-F=miopenConvolutionFwdAlgoImplicitGEMM:ConvHipImplicitGemmV4R4Fwd,0.06392,0,miopenConvolutionFwdAlgoImplicitGEMM,<unused>;miopenConvolutionFwdAlgoDirect:ConvDirectNaiveConvFwd,8.9088,0,miopenConvolutionFwdAlgoDirect,<unused>;miopenConvolutionFwdAlgoWinograd:ConvBinWinogradRxSf2x3g1,0.586079,0,miopenConvolutionFwdAlgoWinograd,<unused>;miopenConvolutionFwdAlgoGEMM:GemmFwd1x1_0_1,0.514639,0,miopenConvolutionFwdAlgoGEMM,<unused>
896-7-7-1x1-128-7-7-32-0x0-1x1-1x1-0-NCHW-FP32-F=miopenConvolutionFwdAlgoImplicitGEMM:ConvHipImplicitGemmV4R4Fwd,0.27092,0,miopenConvolutionFwdAlgoImplicitGEMM,<unused>;miopenConvolutionFwdAlgoDirect:ConvDirectNaiveConvFwd,10.4067,0,miopenConvolutionFwdAlgoDirect,<unused>;miopenConvolutionFwdAlgoWinograd:ConvBinWinogradRxSf2x3g1,0.606279,0,miopenConvolutionFwdAlgoWinograd,<unused>;miopenConvolutionFwdAlgoGEMM:GemmFwd1x1_0_1,0.53224,0,miopenConvolutionFwdAlgoGEMM,<unused>
928-7-7-1x1-128-7-7-32-0x0-1x1-1x1-0-NCHW-FP32-F=miopenConvolutionFwdAlgoImplicitGEMM:ConvHipImplicitGemmV4R4Fwd,0.06784,0,miopenConvolutionFwdAlgoImplicitGEMM,<unused>;miopenConvolutionFwdAlgoDirect:ConvDirectNaiveConvFwd,8.94345,0,miopenConvolutionFwdAlgoDirect,<unused>;miopenConvolutionFwdAlgoWinograd:ConvBinWinogradRxSf3x2,0.627839,0,miopenConvolutionFwdAlgoWinograd,<unused>;miopenConvolutionFwdAlgoGEMM:GemmFwd1x1_0_1,0.55184,0,miopenConvolutionFwdAlgoGEMM,<unused>
960-7-7-1x1-128-7-7-32-0x0-1x1-1x1-0-NCHW-FP32-F=miopenConvolutionFwdAlgoImplicitGEMM:ConvHipImplicitGemmV4R4Fwd,0.0692,0,miopenConvolutionFwdAlgoImplicitGEMM,<unused>;miopenConvolutionFwdAlgoDirect:ConvDirectNaiveConvFwd,7.63434,0,miopenConvolutionFwdAlgoDirect,<unused>;miopenConvolutionFwdAlgoWinograd:ConvBinWinogradRxSf2x3g1,0.657439,0,miopenConvolutionFwdAlgoWinograd,<unused>;miopenConvolutionFwdAlgoGEMM:GemmFwd1x1_0_1,0.5694,0,miopenConvolutionFwdAlgoGEMM,<unused>
992-7-7-1x1-128-7-7-32-0x0-1x1-1x1-0-NCHW-FP32-F=miopenConvolutionFwdAlgoImplicitGEMM:ConvHipImplicitGemmV4R4Fwd,0.06984,0,miopenConvolutionFwdAlgoImplicitGEMM,<unused>;miopenConvolutionFwdAlgoDirect:ConvDirectNaiveConvFwd,7.52755,0,miopenConvolutionFwdAlgoDirect,<unused>;miopenConvolutionFwdAlgoWinograd:ConvBinWinogradRxSf2x3g1,0.6774,0,miopenConvolutionFwdAlgoWinograd,<unused>;miopenConvolutionFwdAlgoGEMM:GemmFwd1x1_0_1,0.588039,0,miopenConvolutionFwdAlgoGEMM,<unused>
3-224-224-7x7-64-112-112-32-3x3-2x2-1x1-0-NCHW-FP16-F=miopenConvolutionFwdAlgoDirect:ConvOclDirectFwdGen,9.5172,0,miopenConvolutionFwdAlgoDirect,<unused>;miopenConvolutionFwdAlgoWinograd:ConvBinWinogradRxSf2x3g1,2.87764,0,miopenConvolutionFwdAlgoWinograd,<unused>;miopenConvolutionFwdAlgoGEMM:GemmFwdRest,4.75136,3687936,miopenConvolutionFwdAlgoGEMM,<unused>
64-56-56-1x1-128-56-56-32-0x0-1x1-1x1-0-NCHW-FP16-F=miopenConvolutionFwdAlgoImplicitGEMM:ConvHipImplicitGemmV4R1Fwd,0.155,0,miopenConvolutionFwdAlgoImplicitGEMM,<unused>;miopenConvolutionFwdAlgoDirect:ConvDirectNaiveConvFwd,12.5824,0,miopenConvolutionFwdAlgoDirect,<unused>;miopenConvolutionFwdAlgoWinograd:ConvBinWinogradRxSf3x2,0.81612,0,miopenConvolutionFwdAlgoWinograd,<unused>;miopenConvolutionFwdAlgoGEMM:GemmFwd1x1_0_1,0.2834,0,miopenConvolutionFwdAlgoGEMM,<unused>
128-56-56-3x3-32-56-56-32-1x1-1x1-1x1-0-NCHW-FP16-F=miopenConvolutionFwdAlgoImplicitGEMM:ConvHipImplicitGemmV4R1Fwd,0.75136,0,miopenConvolutionFwdAlgoImplicitGEMM,<unused>;miopenConvolutionFwdAlgoDirect:ConvOclDirectFwd,7.954,0,miopenConvolutionFwdAlgoDirect,<unused>;miopenConvolutionFwdAlgoWinograd:ConvBinWinogradRxSf2x3g1,0.60816,0,miopenConvolutionFwdAlgoWinograd,<unused>;miopenConvolutionFwdAlgoGEMM:GemmFwdRest,9.28864,7225344,miopenConvolutionFwdAlgoGEMM,<unused>
96-56-56-1x1-128-56-56-32-0x0-1x1-1x1-0-NCHW-FP16-F=miopenConvolutionFwdAlgoImplicitGEMM:ConvHipImplicitGemmV4R1Fwd,0.19544,0,miopenConvolutionFwdAlgoImplicitGEMM,<unused>;miopenConvolutionFwdAlgoDirect:ConvDirectNaiveConvFwd,12.3125,0,miopenConvolutionFwdAlgoDirect,<unused>;miopenConvolutionFwdAlgoWinograd:ConvBinWinogradRxSf2x3g1,1.7998,0,miopenConvolutionFwdAlgoWinograd,<unused>;miopenConvolutionFwdAlgoGEMM:GemmFwd1x1_0_1,0.38572,0,miopenConvolutionFwdAlgoGEMM,<unused>
128-56-56-1x1-128-56-56-32-0x0-1x1-1x1-0-NCHW-FP16-F=miopenConvolutionFwdAlgoImplicitGEMM:ConvHipImplicitGemmV4R1Fwd,0.29124,0,miopenConvolutionFwdAlgoImplicitGEMM,<unused>;miopenConvolutionFwdAlgoDirect:ConvDirectNaiveConvFwd,14.8994,0,miopenConvolutionFwdAlgoDirect,<unused>;miopenConvolutionFwdAlgoWinograd:ConvBinWinogradRxSf2x3g1,2.27192,0,miopenConvolutionFwdAlgoWinograd,<unused>;miopenConvolutionFwdAlgoGEMM:GemmFwd1x1_0_1,0.50416,0,miopenConvolutionFwdAlgoGEMM,<unused>
160-56-56-1x1-128-56-56-32-0x0-1x1-1x1-0-NCHW-FP16-F=miopenConvolutionFwdAlgoImplicitGEMM:ConvHipImplicitGemmV4R1Fwd,0.54824,0,miopenConvolutionFwdAlgoImplicitGEMM,<unused>;miopenConvolutionFwdAlgoDirect:ConvDirectNaiveConvFwd,17.6364,0,miopenConvolutionFwdAlgoDirect,<unused>;miopenConvolutionFwdAlgoWinograd:ConvBinWinogradRxSf2x3g1,2.587,0,miopenConvolutionFwdAlgoWinograd,<unused>;miopenConvolutionFwdAlgoGEMM:GemmFwd1x1_0_1,0.60588,0,miopenConvolutionFwdAlgoGEMM,<unused>
192-56-56-1x1-128-56-56-32-0x0-1x1-1x1-0-NCHW-FP16-F=miopenConvolutionFwdAlgoImplicitGEMM:ConvHipImplicitGemmV4R1Fwd,0.4626,0,miopenConvolutionFwdAlgoImplicitGEMM,<unused>;miopenConvolutionFwdAlgoDirect:ConvDirectNaiveConvFwd,21.0488,0,miopenConvolutionFwdAlgoDirect,<unused>;miopenConvolutionFwdAlgoWinograd:ConvBinWinogradRxSf2x3g1,2.77748,0,miopenConvolutionFwdAlgoWinograd,<unused>;miopenConvolutionFwdAlgoGEMM:GemmFwd1x1_0_1,0.72228,0,miopenConvolutionFwdAlgoGEMM,<unused>
224-56-56-1x1-128-56-56-32-0x0-1x1-1x1-0-NCHW-FP16-F=miopenConvolutionFwdAlgoImplicitGEMM:ConvHipImplicitGemmV4R1Fwd,0.5348,0,miopenConvolutionFwdAlgoImplicitGEMM,<unused>;miopenConvolutionFwdAlgoDirect:ConvDirectNaiveConvFwd,24.4836,0,miopenConvolutionFwdAlgoDirect,<unused>;miopenConvolutionFwdAlgoWinograd:ConvBinWinogradRxSf2x3g1,2.939,0,miopenConvolutionFwdAlgoWinograd,<unused>;miopenConvolutionFwdAlgoGEMM:GemmFwd1x1_0_1,0.83444,0,miopenConvolutionFwdAlgoGEMM,<unused>
256-56-56-1x1-128-56-56-32-0x0-1x1-1x1-0-NCHW-FP16-F=miopenConvolutionFwdAlgoImplicitGEMM:ConvHipImplicitGemmV4R1Fwd,0.633,0,miopenConvolutionFwdAlgoImplicitGEMM,<unused>;miopenConvolutionFwdAlgoDirect:ConvDirectNaiveConvFwd,27.8011,0,miopenConvolutionFwdAlgoDirect,<unused>;miopenConvolutionFwdAlgoWinograd:ConvBinWinogradRxSf2x3g1,1.91837,0,miopenConvolutionFwdAlgoWinograd,<unused>;miopenConvolutionFwdAlgoGEMM:GemmFwd1x1_0_1,0.94744,0,miopenConvolutionFwdAlgoGEMM,<unused>
128-28-28-1x1-128-28-28-32-0x0-1x1-1x1-0-NCHW-FP16-F=miopenConvolutionFwdAlgoImplicitGEMM:ConvHipImplicitGemmV4R1Fwd,0.08924,0,miopenConvolutionFwdAlgoImplicitGEMM,<unused>;miopenConvolutionFwdAlgoDirect:ConvDirectNaiveConvFwd,12.0894,0,miopenConvolutionFwdAlgoDirect,<unused>;miopenConvolutionFwdAlgoWinograd:ConvBinWinogradRxSf3x2,0.42032,0,miopenConvolutionFwdAlgoWinograd,<unused>;miopenConvolutionFwdAlgoGEMM:GemmFwd1x1_0_1,0.46816,0,miopenConvolutionFwdAlgoGEMM,<unused>
128-28-28-3x3-32-28-28-32-1x1-1x1-1x1-0-NCHW-FP16-F=miopenConvolutionFwdAlgoImplicitGEMM:ConvHipImplicitGemmV4R1Fwd,0.22284,0,miopenConvolutionFwdAlgoImplicitGEMM,<unused>;miopenConvolutionFwdAlgoDirect:ConvOclDirectFwd,1.51968,0,miopenConvolutionFwdAlgoDirect,<unused>;miopenConvolutionFwdAlgoWinograd:ConvBinWinogradRxSf2x3g1,0.1952,0,miopenConvolutionFwdAlgoWinograd,<unused>;miopenConvolutionFwdAlgoGEMM:GemmFwdRest,6.22336,1806336,miopenConvolutionFwdAlgoGEMM,<unused>
160-28-28-1x1-128-28-28-32-0x0-1x1-1x1-0-NCHW-FP16-F=miopenConvolutionFwdAlgoImplicitGEMM:ConvHipImplicitGemmV4R1Fwd,0.105,0,miopenConvolutionFwdAlgoImplicitGEMM,<unused>;miopenConvolutionFwdAlgoDirect:ConvDirectNaiveConvFwd,13.1678,0,miopenConvolutionFwdAlgoDirect,<unused>;miopenConvolutionFwdAlgoWinograd:ConvBinWinogradRxSf3x2,0.47768,0,miopenConvolutionFwdAlgoWinograd,<unused>;miopenConvolutionFwdAlgoGEMM:GemmFwd1x1_0_1,0.57876,0,miopenConvolutionFwdAlgoGEMM,<unused>
192-28-28-1x1-128-28-28-32-0x0-1x1-1x1-0-NCHW-FP16-F=miopenConvolutionFwdAlgoImplicitGEMM:ConvHipImplicitGemmV4R1Fwd,0.11664,0,miopenConvolutionFwdAlgoImplicitGEMM,<unused>;miopenConvolutionFwdAlgoDirect:ConvDirectNaiveConvFwd,13.5257,0,miopenConvolutionFwdAlgoDirect,<unused>;miopenConvolutionFwdAlgoWinograd:ConvBinWinogradRxSf3x2,0.54232,0,miopenConvolutionFwdAlgoWinograd,<unused>;miopenConvolutionFwdAlgoGEMM:GemmFwd1x1_0_1,0.68784,0,miopenConvolutionFwdAlgoGEMM,<unused>
224-28-28-1x1-128-28-28-32-0x0-1x1-1x1-0-NCHW-FP16-F=miopenConvolutionFwdAlgoImplicitGEMM:ConvHipImplicitGemmV4R1Fwd,0.13172,0,miopenConvolutionFwdAlgoImplicitGEMM,<unused>;miopenConvolutionFwdAlgoDirect:ConvDirectNaiveConvFwd,14.1748,0,miopenConvolutionFwdAlgoDirect,<unused>;miopenConvolutionFwdAlgoWinograd:ConvBinWinogradRxSf3x2,0.60696,0,miopenConvolutionFwdAlgoWinograd,<unused>;miopenConvolutionFwdAlgoGEMM:GemmFwd1x1_0_1,0.79936,0,miopenConvolutionFwdAlgoGEMM,<unused>
256-28-28-1x1-128-28-28-32-0x0-1x1-1x1-0-NCHW-FP16-F=miopenConvolutionFwdAlgoImplicitGEMM:ConvHipImplicitGemmV4R1Fwd,0.15364,0,miopenConvolutionFwdAlgoImplicitGEMM,<unused>;miopenConvolutionFwdAlgoDirect:ConvDirectNaiveConvFwd,12.9097,0,miopenConvolutionFwdAlgoDirect,<unused>;miopenConvolutionFwdAlgoWinograd:ConvBinWinogradRxSf3x2,0.67248,0,miopenConvolutionFwdAlgoWinograd,<unused>;miopenConvolutionFwdAlgoGEMM:GemmFwd1x1_0_1,0.9168,0,miopenConvolutionFwdAlgoGEMM,<unused>
288-28-28-1x1-128-28-28-32-0x0-1x1-1x1-0-NCHW-FP16-F=miopenConvolutionFwdAlgoImplicitGEMM:ConvHipImplicitGemmV4R1Fwd,0.1644,0,miopenConvolutionFwdAlgoImplicitGEMM,<unused>;miopenConvolutionFwdAlgoDirect:ConvDirectNaiveConvFwd,12.6814,0,miopenConvolutionFwdAlgoDirect,<unused>;miopenConvolutionFwdAlgoWinograd:ConvBinWinogradRxSf3x2,0.73836,0,miopenConvolutionFwdAlgoWinograd,<unused>;miopenConvolutionFwdAlgoGEMM:GemmFwd1x1_0_1,1.02032,0,miopenConvolutionFwdAlgoGEMM,<unused>
320-28-28-1x1-128-28-28-32-0x0-1x1-1x1-0-NCHW-FP16-F=miopenConvolutionFwdAlgoImplicitGEMM:ConvHipImplicitGemmV4R1Fwd,0.18,0,miopenConvolutionFwdAlgoImplicitGEMM,<unused>;miopenConvolutionFwdAlgoDirect:ConvDirectNaiveConvFwd,13.258,0,miopenConvolutionFwdAlgoDirect,<unused>;miopenConvolutionFwdAlgoWinograd:ConvBinWinogradRxSf3x2,0.79876,0,miopenConvolutionFwdAlgoWinograd,<unused>;miopenConvolutionFwdAlgoGEMM:GemmFwd1x1_0_1,1.13036,0,miopenConvolutionFwdAlgoGEMM,<unused>
352-28-28-1x1-128-28-28-32-0x0-1x1-1x1-0-NCHW-FP16-F=miopenConvolutionFwdAlgoImplicitGEMM:ConvHipImplicitGemmV4R1Fwd,0.1974,0,miopenConvolutionFwdAlgoImplicitGEMM,<unused>;miopenConvolutionFwdAlgoDirect:ConvDirectNaiveConvFwd,12.2617,0,miopenConvolutionFwdAlgoDirect,<unused>;miopenConvolutionFwdAlgoWinograd:ConvBinWinogradRxSf2x3g1,1.47564,0,miopenConvolutionFwdAlgoWinograd,<unused>;miopenConvolutionFwdAlgoGEMM:GemmFwd1x1_0_1,1.2414,0,miopenConvolutionFwdAlgoGEMM,<unused>
384-28-28-1x1-128-28-28-32-0x0-1x1-1x1-0-NCHW-FP16-F=miopenConvolutionFwdAlgoImplicitGEMM:ConvHipImplicitGemmV4R1Fwd,0.21456,0,miopenConvolutionFwdAlgoImplicitGEMM,<unused>;miopenConvolutionFwdAlgoDirect:ConvDirectNaiveConvFwd,13.3456,0,miopenConvolutionFwdAlgoDirect,<unused>;miopenConvolutionFwdAlgoWinograd:ConvBinWinogradRxSf2x3g1,1.60144,0,miopenConvolutionFwdAlgoWinograd,<unused>;miopenConvolutionFwdAlgoGEMM:GemmFwd1x1_0_1,0.46268,0,miopenConvolutionFwdAlgoGEMM,<unused>
416-28-28-1x1-128-28-28-32-0x0-1x1-1x1-0-NCHW-FP16-F=miopenConvolutionFwdAlgoImplicitGEMM:ConvHipImplicitGemmV4R1Fwd,0.23008,0,miopenConvolutionFwdAlgoImplicitGEMM,<unused>;miopenConvolutionFwdAlgoDirect:ConvDirectNaiveConvFwd,14.3175,0,miopenConvolutionFwdAlgoDirect,<unused>;miopenConvolutionFwdAlgoWinograd:ConvBinWinogradRxSf2x3g1,1.72068,0,miopenConvolutionFwdAlgoWinograd,<unused>;miopenConvolutionFwdAlgoGEMM:GemmFwd1x1_0_1,0.49488,0,miopenConvolutionFwdAlgoGEMM,<unused>
448-28-28-1x1-128-28-28-32-0x0-1x1-1x1-0-NCHW-FP16-F=miopenConvolutionFwdAlgoImplicitGEMM:ConvHipImplicitGemmV4R1Fwd,0.24616,0,miopenConvolutionFwdAlgoImplicitGEMM,<unused>;miopenConvolutionFwdAlgoDirect:ConvDirectNaiveConvFwd,15.5138,0,miopenConvolutionFwdAlgoDirect,<unused>;miopenConvolutionFwdAlgoWinograd:ConvBinWinogradRxSf2x3g1,1.84824,0,miopenConvolutionFwdAlgoWinograd,<unused>;miopenConvolutionFwdAlgoGEMM:GemmFwd1x1_0_1,0.53352,0,miopenConvolutionFwdAlgoGEMM,<unused>
480-28-28-1x1-128-28-28-32-0x0-1x1-1x1-0-NCHW-FP16-F=miopenConvolutionFwdAlgoImplicitGEMM:ConvHipImplicitGemmV4R1Fwd,0.26124,0,miopenConvolutionFwdAlgoImplicitGEMM,<unused>;miopenConvolutionFwdAlgoDirect:ConvDirectNaiveConvFwd,17.7964,0,miopenConvolutionFwdAlgoDirect,<unused>;miopenConvolutionFwdAlgoWinograd:ConvBinWinogradRxSf3x2,1.11724,0,miopenConvolutionFwdAlgoWinograd,<unused>;miopenConvolutionFwdAlgoGEMM:GemmFwd1x1_0_1,0.57204,0,miopenConvolutionFwdAlgoGEMM,<unused>
512-28-28-1x1-256-28-28-32-0x0-1x1-1x1-0-NCHW-FP16-F=miopenConvolutionFwdAlgoImplicitGEMM:ConvHipImplicitGemmV4R1Fwd,1.02976,0,miopenConvolutionFwdAlgoImplicitGEMM,<unused>;miopenConvolutionFwdAlgoDirect:ConvDirectNaiveConvFwd,29.1507,0,miopenConvolutionFwdAlgoDirect,<unused>;miopenConvolutionFwdAlgoWinograd:ConvBinWinogradRxSf2x3g1,1.0959,0,miopenConvolutionFwdAlgoWinograd,<unused>;miopenConvolutionFwdAlgoGEMM:GemmFwd1x1_0_1,1.0706,0,miopenConvolutionFwdAlgoGEMM,<unused>
256-14-14-1x1-128-14-14-32-0x0-1x1-1x1-0-NCHW-FP16-F=miopenConvolutionFwdAlgoImplicitGEMM:ConvHipImplicitGemmV4R1Fwd,0.22996,0,miopenConvolutionFwdAlgoImplicitGEMM,<unused>;miopenConvolutionFwdAlgoDirect:ConvDirectNaiveConvFwd,11.3945,0,miopenConvolutionFwdAlgoDirect,<unused>;miopenConvolutionFwdAlgoWinograd:ConvBinWinogradRxSf3x2,0.27572,0,miopenConvolutionFwdAlgoWinograd,<unused>;miopenConvolutionFwdAlgoGEMM:GemmFwd1x1_0_1,0.34456,0,miopenConvolutionFwdAlgoGEMM,<unused>
128-14-14-3x3-32-14-14-32-1x1-1x1-1x1-0-NCHW-FP16-F=miopenConvolutionFwdAlgoImplicitGEMM:ConvHipImplicitGemmV4R1Fwd,0.4222,0,miopenConvolutionFwdAlgoImplicitGEMM,<unused>;miopenConvolutionFwdAlgoDirect:ConvOclDirectFwd,0.735721,0,miopenConvolutionFwdAlgoDirect,<unused>;miopenConvolutionFwdAlgoWinograd:ConvBinWinogradRxSf2x3g1,0.08968,0,miopenConvolutionFwdAlgoWinograd,<unused>;miopenConvolutionFwdAlgoGEMM:GemmFwdRest,3.83616,451584,miopenConvolutionFwdAlgoGEMM,<unused>
288-14-14-1x1-128-14-14-32-0x0-1x1-1x1-0-NCHW-FP16-F=miopenConvolutionFwdAlgoImplicitGEMM:ConvHipImplicitGemmV4R1Fwd,0.06448,0,miopenConvolutionFwdAlgoImplicitGEMM,<unused>;miopenConvolutionFwdAlgoDirect:ConvDirectNaiveConvFwd,11.7145,0,miopenConvolutionFwdAlgoDirect,<unused>;miopenConvolutionFwdAlgoWinograd:ConvBinWinogradRxSf3x2,0.29284,0,miopenConvolutionFwdAlgoWinograd,<unused>;miopenConvolutionFwdAlgoGEMM:GemmFwd1x1_0_1,0.32576,0,miopenConvolutionFwdAlgoGEMM,<unused>
320-14-14-1x1-128-14-14-32-0x0-1x1-1x1-0-NCHW-FP16-F=miopenConvolutionFwdAlgoImplicitGEMM:ConvHipImplicitGemmV4R1Fwd,0.0712,0,miopenConvolutionFwdAlgoImplicitGEMM,<unused>;miopenConvolutionFwdAlgoDirect:ConvDirectNaiveConvFwd,12.5478,0,miopenConvolutionFwdAlgoDirect,<unused>;miopenConvolutionFwdAlgoWinograd:ConvBinWinogradRxSf3x2,0.31816,0,miopenConvolutionFwdAlgoWinograd,<unused>;miopenConvolutionFwdAlgoGEMM:GemmFwd1x1_0_1,0.39064,0,miopenConvolutionFwdAlgoGEMM,<unused>
352-14-14-1x1-128-14-14-32-0x0-1x1-1x1-0-NCHW-FP16-F=miopenConvolutionFwdAlgoImplicitGEMM:ConvHipImplicitGemmV4R1Fwd,0.0758,0,miopenConvolutionFwdAlgoImplicitGEMM,<unused>;miopenConvolutionFwdAlgoDirect:ConvDirectNaiveConvFwd,12.1781,0,miopenConvolutionFwdAlgoDirect,<unused>;miopenConvolutionFwdAlgoWinograd:ConvBinWinogradRxSf3x2,0.33972,0,miopenConvolutionFwdAlgoWinograd,<unused>;miopenConvolutionFwdAlgoGEMM:GemmFwd1x1_0_1,0.41744,0,miopenConvolutionFwdAlgoGEMM,<unused>
384-14-14-1x1-128-14-14-32-0x0-1x1-1x1-0-NCHW-FP16-F=miopenConvolutionFwdAlgoImplicitGEMM:ConvHipImplicitGemmV4R1Fwd,0.08196,0,miopenConvolutionFwdAlgoImplicitGEMM,<unused>;miopenConvolutionFwdAlgoDirect:ConvDirectNaiveConvFwd,13.1832,0,miopenConvolutionFwdAlgoDirect,<unused>;miopenConvolutionFwdAlgoWinograd:ConvBinWinogradRxSf3x2,0.35908,0,miopenConvolutionFwdAlgoWinograd,<unused>;miopenConvolutionFwdAlgoGEMM:GemmFwd1x1_0_1,0.50532,0,miopenConvolutionFwdAlgoGEMM,<unused>
416-14-14-1x1-128-14-14-32-0x0-1x1-1x1-0-NCHW-FP16-F=miopenConvolutionFwdAlgoImplicitGEMM:ConvHipImplicitGemmV4R1Fwd,0.08908,0,miopenConvolutionFwdAlgoImplicitGEMM,<unused>;miopenConvolutionFwdAlgoDirect:ConvDirectNaiveConvFwd,13.4421,0,miopenConvolutionFwdAlgoDirect,<unused>;miopenConvolutionFwdAlgoWinograd:ConvBinWinogradRxSf3x2,0.37944,0,miopenConvolutionFwdAlgoWinograd,<unused>;miopenConvolutionFwdAlgoGEMM:GemmFwd1x1_0_1,0.21616,0,miopenConvolutionFwdAlgoGEMM,<unused>
448-14-14-1x1-128-14-14-32-0x0-1x1-1x1-0-NCHW-FP16-F=miopenConvolutionFwdAlgoImplicitGEMM:ConvHipImplicitGemmV4R1Fwd,0.09088,0,miopenConvolutionFwdAlgoImplicitGEMM,<unused>;miopenConvolutionFwdAlgoDirect:ConvDirectNaiveConvFwd,13.1678,0,miopenConvolutionFwdAlgoDirect,<unused>;miopenConvolutionFwdAlgoWinograd:ConvBinWinogradRxSf3x2,0.40008,0,miopenConvolutionFwdAlgoWinograd,<unused>;miopenConvolutionFwdAlgoGEMM:GemmFwd1x1_0_1,0.2134,0,miopenConvolutionFwdAlgoGEMM,<unused>
480-14-14-1x1-128-14-14-32-0x0-1x1-1x1-0-NCHW-FP16-F=miopenConvolutionFwdAlgoImplicitGEMM:ConvHipImplicitGemmV4R1Fwd,0.09708,0,miopenConvolutionFwdAlgoImplicitGEMM,<unused>;miopenConvolutionFwdAlgoDirect:ConvDirectNaiveConvFwd,13.5577,0,miopenConvolutionFwdAlgoDirect,<unused>;miopenConvolutionFwdAlgoWinograd:ConvBinWinogradRxSf3x2,0.4248,0,miopenConvolutionFwdAlgoWinograd,<unused>;miopenConvolutionFwdAlgoGEMM:GemmFwd1x1_0_1,0.2282,0,miopenConvolutionFwdAlgoGEMM,<unused>
512-14-14-1x1-128-14-14-32-0x0-1x1-1x1-0-NCHW-FP16-F=miopenConvolutionFwdAlgoImplicitGEMM:ConvHipImplicitGemmV4R1Fwd,0.11064,0,miopenConvolutionFwdAlgoImplicitGEMM,<unused>;miopenConvolutionFwdAlgoDirect:ConvDirectNaiveConvFwd,14.1889,0,miopenConvolutionFwdAlgoDirect,<unused>;miopenConvolutionFwdAlgoWinograd:ConvBinWinogradRxSf3x2,0.44716,0,miopenConvolutionFwdAlgoWinograd,<unused>;miopenConvolutionFwdAlgoGEMM:GemmFwd1x1_0_1,0.34804,0,miopenConvolutionFwdAlgoGEMM,<unused>
544-14-14-1x1-128-14-14-32-0x0-1x1-1x1-0-NCHW-FP16-F=miopenConvolutionFwdAlgoImplicitGEMM:ConvHipImplicitGemmV4R1Fwd,0.10608,0,miopenConvolutionFwdAlgoImplicitGEMM,<unused>;miopenConvolutionFwdAlgoDirect:ConvDirectNaiveConvFwd,14.031,0,miopenConvolutionFwdAlgoDirect,<unused>;miopenConvolutionFwdAlgoWinograd:ConvBinWinogradRxSf3x2,0.464359,0,miopenConvolutionFwdAlgoWinograd,<unused>;miopenConvolutionFwdAlgoGEMM:GemmFwd1x1_0_1,0.25072,0,miopenConvolutionFwdAlgoGEMM,<unused>
576-14-14-1x1-128-14-14-32-0x0-1x1-1x1-0-NCHW-FP16-F=miopenConvolutionFwdAlgoImplicitGEMM:ConvHipImplicitGemmV4R1Fwd,0.10752,0,miopenConvolutionFwdAlgoImplicitGEMM,<unused>;miopenConvolutionFwdAlgoDirect:ConvDirectNaiveConvFwd,14.2916,0,miopenConvolutionFwdAlgoDirect,<unused>;miopenConvolutionFwdAlgoWinograd:ConvBinWinogradRxSf3x2,0.485959,0,miopenConvolutionFwdAlgoWinograd,<unused>;miopenConvolutionFwdAlgoGEMM:GemmFwd1x1_0_1,0.262,0,miopenConvolutionFwdAlgoGEMM,<unused>
608-14-14-1x1-128-14-14-32-0x0-1x1-1x1-0-NCHW-FP16-F=miopenConvolutionFwdAlgoImplicitGEMM:ConvHipImplicitGemmV4R1Fwd,0.11276,0,miopenConvolutionFwdAlgoImplicitGEMM,<unused>;miopenConvolutionFwdAlgoDirect:ConvDirectNaiveConvFwd,14.0066,0,miopenConvolutionFwdAlgoDirect,<unused>;miopenConvolutionFwdAlgoWinograd:ConvBinWinogradRxSf3x2,0.5104,0,miopenConvolutionFwdAlgoWinograd,<unused>;miopenConvolutionFwdAlgoGEMM:GemmFwd1x1_0_1,0.27592,0,miopenConvolutionFwdAlgoGEMM,<unused>
640-14-14-1x1-128-14-14-32-0x0-1x1-1x1-0-NCHW-FP16-F=miopenConvolutionFwdAlgoImplicitGEMM:ConvHipImplicitGemmV4R1Fwd,0.11524,0,miopenConvolutionFwdAlgoImplicitGEMM,<unused>;miopenConvolutionFwdAlgoDirect:ConvDirectNaiveConvFwd,12.2602,0,miopenConvolutionFwdAlgoDirect,<unused>;miopenConvolutionFwdAlgoWinograd:ConvBinWinogradRxSf3x2,0.530639,0,miopenConvolutionFwdAlgoWinograd,<unused>;miopenConvolutionFwdAlgoGEMM:GemmFwd1x1_0_1,0.26824,0,miopenConvolutionFwdAlgoGEMM,<unused>
672-14-14-1x1-128-14-14-32-0x0-1x1-1x1-0-NCHW-FP16-F=miopenConvolutionFwdAlgoImplicitGEMM:ConvHipImplicitGemmV4R1Fwd,0.12016,0,miopenConvolutionFwdAlgoImplicitGEMM,<unused>;miopenConvolutionFwdAlgoDirect:ConvDirectNaiveConvFwd,13.262,0,miopenConvolutionFwdAlgoDirect,<unused>;miopenConvolutionFwdAlgoWinograd:ConvBinWinogradRxSf3x2,0.552079,0,miopenConvolutionFwdAlgoWinograd,<unused>;miopenConvolutionFwdAlgoGEMM:GemmFwd1x1_0_1,0.279839,0,miopenConvolutionFwdAlgoGEMM,<unused>
704-14-14-1x1-128-14-14-32-0x0-1x1-1x1-0-NCHW-FP16-F=miopenConvolutionFwdAlgoImplicitGEMM:ConvHipImplicitGemmV4R1Fwd,0.12556,0,miopenConvolutionFwdAlgoImplicitGEMM,<unused>;miopenConvolutionFwdAlgoDirect:ConvDirectNaiveConvFwd,12.7264,0,miopenConvolutionFwdAlgoDirect,<unused>;miopenConvolutionFwdAlgoWinograd:ConvBinWinogradRxSf3x2,0.571399,0,miopenConvolutionFwdAlgoWinograd,<unused>;miopenConvolutionFwdAlgoGEMM:GemmFwd1x1_0_1,0.28912,0,miopenConvolutionFwdAlgoGEMM,<unused>
736-14-14-1x1-128-14-14-32-0x0-1x1-1x1-0-NCHW-FP16-F=miopenConvolutionFwdAlgoImplicitGEMM:ConvHipImplicitGemmV4R1Fwd,0.13032,0,miopenConvolutionFwdAlgoImplicitGEMM,<unused>;miopenConvolutionFwdAlgoDirect:ConvDirectNaiveConvFwd,13.1346,0,miopenConvolutionFwdAlgoDirect,<unused>;miopenConvolutionFwdAlgoWinograd:ConvBinWinogradRxSf3x2,0.592119,0,miopenConvolutionFwdAlgoWinograd,<unused>;miopenConvolutionFwdAlgoGEMM:GemmFwd1x1_0_1,0.30148,0,miopenConvolutionFwdAlgoGEMM,<unused>
768-14-14-1x1-128-14-14-32-0x0-1x1-1x1-0-NCHW-FP16-F=miopenConvolutionFwdAlgoImplicitGEMM:ConvHipImplicitGemmV4R1Fwd,0.14112,0,miopenConvolutionFwdAlgoImplicitGEMM,<unused>;miopenConvolutionFwdAlgoDirect:ConvDirectNaiveConvFwd,12.716,0,miopenConvolutionFwdAlgoDirect,<unused>;miopenConvolutionFwdAlgoWinograd:ConvBinWinogradRxSf3x2,0.613559,0,miopenConvolutionFwdAlgoWinograd,<unused>;miopenConvolutionFwdAlgoGEMM:GemmFwd1x1_0_1,0.315719,0,miopenConvolutionFwdAlgoGEMM,<unused>
800-14-14-1x1-128-14-14-32-0x0-1x1-1x1-0-NCHW-FP16-F=miopenConvolutionFwdAlgoImplicitGEMM:ConvHipImplicitGemmV4R1Fwd,0.140919,0,miopenConvolutionFwdAlgoImplicitGEMM,<unused>;miopenConvolutionFwdAlgoDirect:ConvDirectNaiveConvFwd,13.148,0,miopenConvolutionFwdAlgoDirect,<unused>;miopenConvolutionFwdAlgoWinograd:ConvBinWinogradRxSf3x2,0.635158,0,miopenConvolutionFwdAlgoWinograd,<unused>;miopenConvolutionFwdAlgoGEMM:GemmFwd1x1_0_1,0.324119,0,miopenConvolutionFwdAlgoGEMM,<unused>
832-14-14-1x1-128-14-14-32-0x0-1x1-1x1-0-NCHW-FP16-F=miopenConvolutionFwdAlgoImplicitGEMM:ConvHipImplicitGemmV4R1Fwd,0.14692,0,miopenConvolutionFwdAlgoImplicitGEMM,<unused>;miopenConvolutionFwdAlgoDirect:ConvDirectNaiveConvFwd,13.2975,0,miopenConvolutionFwdAlgoDirect,<unused>;miopenConvolutionFwdAlgoWinograd:ConvBinWinogradRxSf3x2,0.657398,0,miopenConvolutionFwdAlgoWinograd,<unused>;miopenConvolutionFwdAlgoGEMM:GemmFwd1x1_0_1,0.336559,0,miopenConvolutionFwdAlgoGEMM,<unused>
864-14-14-1x1-128-14-14-32-0x0-1x1-1x1-0-NCHW-FP16-F=miopenConvolutionFwdAlgoImplicitGEMM:ConvHipImplicitGemmV4R1Fwd,0.15176,0,miopenConvolutionFwdAlgoImplicitGEMM,<unused>;miopenConvolutionFwdAlgoDirect:ConvDirectNaiveConvFwd,16.2617,0,miopenConvolutionFwdAlgoDirect,<unused>;miopenConvolutionFwdAlgoWinograd:ConvBinWinogradRxSf3x2,0.678639,0,miopenConvolutionFwdAlgoWinograd,<unused>;miopenConvolutionFwdAlgoGEMM:GemmFwd1x1_0_1,0.34928,0,miopenConvolutionFwdAlgoGEMM,<unused>
896-14-14-1x1-128-14-14-32-0x0-1x1-1x1-0-NCHW-FP16-F=miopenConvolutionFwdAlgoImplicitGEMM:ConvHipImplicitGemmV4R1Fwd,0.15896,0,miopenConvolutionFwdAlgoImplicitGEMM,<unused>;miopenConvolutionFwdAlgoDirect:ConvDirectNaiveConvFwd,14.4256,0,miopenConvolutionFwdAlgoDirect,<unused>;miopenConvolutionFwdAlgoWinograd:ConvBinWinogradRxSf3x2,0.699119,0,miopenConvolutionFwdAlgoWinograd,<unused>;miopenConvolutionFwdAlgoGEMM:GemmFwd1x1_0_1,0.35764,0,miopenConvolutionFwdAlgoGEMM,<unused>
928-14-14-1x1-128-14-14-32-0x0-1x1-1x1-0-NCHW-FP16-F=miopenConvolutionFwdAlgoImplicitGEMM:ConvHipImplicitGemmV4R1Fwd,0.16216,0,miopenConvolutionFwdAlgoImplicitGEMM,<unused>;miopenConvolutionFwdAlgoDirect:ConvDirectNaiveConvFwd,15.0068,0,miopenConvolutionFwdAlgoDirect,<unused>;miopenConvolutionFwdAlgoWinograd:ConvBinWinogradRxSf3x2,0.721199,0,miopenConvolutionFwdAlgoWinograd,<unused>;miopenConvolutionFwdAlgoGEMM:GemmFwd1x1_0_1,0.37028,0,miopenConvolutionFwdAlgoGEMM,<unused>
960-14-14-1x1-128-14-14-32-0x0-1x1-1x1-0-NCHW-FP16-F=miopenConvolutionFwdAlgoImplicitGEMM:ConvHipImplicitGemmV4R1Fwd,0.167679,0,miopenConvolutionFwdAlgoImplicitGEMM,<unused>;miopenConvolutionFwdAlgoDirect:ConvDirectNaiveConvFwd,14.0813,0,miopenConvolutionFwdAlgoDirect,<unused>;miopenConvolutionFwdAlgoWinograd:ConvBinWinogradRxSf3x2,0.743118,0,miopenConvolutionFwdAlgoWinograd,<unused>;miopenConvolutionFwdAlgoGEMM:GemmFwd1x1_0_1,0.375919,0,miopenConvolutionFwdAlgoGEMM,<unused>
992-14-14-1x1-128-14-14-32-0x0-1x1-1x1-0-NCHW-FP16-F=miopenConvolutionFwdAlgoImplicitGEMM:ConvHipImplicitGemmV4R1Fwd,0.1714,0,miopenConvolutionFwdAlgoImplicitGEMM,<unused>;miopenConvolutionFwdAlgoDirect:ConvDirectNaiveConvFwd,11.9926,0,miopenConvolutionFwdAlgoDirect,<unused>;miopenConvolutionFwdAlgoWinograd:ConvBinWinogradRxSf2x3g1,1.11532,0,miopenConvolutionFwdAlgoWinograd,<unused>;miopenConvolutionFwdAlgoGEMM:GemmFwd1x1_0_1,0.3908,0,miopenConvolutionFwdAlgoGEMM,<unused>
1024-14-14-1x1-512-14-14-32-0x0-1x1-1x1-0-NCHW-FP16-F=miopenConvolutionFwdAlgoImplicitGEMM:ConvHipImplicitGemmV4R1Fwd,0.640559,0,miopenConvolutionFwdAlgoImplicitGEMM,<unused>;miopenConvolutionFwdAlgoDirect:ConvDirectNaiveConvFwd,35.7887,0,miopenConvolutionFwdAlgoDirect,<unused>;miopenConvolutionFwdAlgoWinograd:ConvBinWinogradRxSf2x3g1,1.13808,0,miopenConvolutionFwdAlgoWinograd,<unused>;miopenConvolutionFwdAlgoGEMM:GemmFwd1x1_0_1,1.33096,0,miopenConvolutionFwdAlgoGEMM,<unused>
512-7-7-1x1-128-7-7-32-0x0-1x1-1x1-0-NCHW-FP16-F=miopenConvolutionFwdAlgoImplicitGEMM:ConvHipImplicitGemmV4R1Fwd,0.23284,0,miopenConvolutionFwdAlgoImplicitGEMM,<unused>;miopenConvolutionFwdAlgoDirect:ConvDirectNaiveConvFwd,5.91683,0,miopenConvolutionFwdAlgoDirect,<unused>;miopenConvolutionFwdAlgoWinograd:ConvBinWinogradRxSf2x3g1,0.22308,0,miopenConvolutionFwdAlgoWinograd,<unused>;miopenConvolutionFwdAlgoGEMM:GemmFwd1x1_0_1,0.14184,0,miopenConvolutionFwdAlgoGEMM,<unused>
128-7-7-3x3-32-7-7-32-1x1-1x1-1x1-0-NCHW-FP16-F=miopenConvolutionFwdAlgoImplicitGEMM:ConvHipImplicitGemmV4R1Fwd,0.22232,0,miopenConvolutionFwdAlgoImplicitGEMM,<unused>;miopenConvolutionFwdAlgoDirect:ConvOclDirectFwd,0.519198,0,miopenConvolutionFwdAlgoDirect,<unused>;miopenConvolutionFwdAlgoWinograd:ConvBinWinogradRxSf2x3g1,0.10676,0,miopenConvolutionFwdAlgoWinograd,<unused>;miopenConvolutionFwdAlgoGEMM:GemmFwdRest,3.95258,112896,miopenConvolutionFwdAlgoGEMM,<unused>
544-7-7-1x1-128-7-7-32-0x0-1x1-1x1-0-NCHW-FP16-F=miopenConvolutionFwdAlgoImplicitGEMM:ConvHipImplicitGemmV4R1Fwd,0.144599,0,miopenConvolutionFwdAlgoImplicitGEMM,<unused>;miopenConvolutionFwdAlgoDirect:ConvDirectNaiveConvFwd,6.26694,0,miopenConvolutionFwdAlgoDirect,<unused>;miopenConvolutionFwdAlgoWinograd:ConvBinWinogradRxSf2x3g1,0.23348,0,miopenConvolutionFwdAlgoWinograd,<unused>;miopenConvolutionFwdAlgoGEMM:GemmFwd1x1_0_1,0.152159,0,miopenConvolutionFwdAlgoGEMM,<unused>
576-7-7-1x1-128-7-7-32-0x0-1x1-1x1-0-NCHW-FP16-F=miopenConvolutionFwdAlgoImplicitGEMM:ConvHipImplicitGemmV4R1Fwd,0.152679,0,miopenConvolutionFwdAlgoImplicitGEMM,<unused>;miopenConvolutionFwdAlgoDirect:ConvDirectNaiveConvFwd,6.63302,0,miopenConvolutionFwdAlgoDirect,<unused>;miopenConvolutionFwdAlgoWinograd:ConvBinWinogradRxSf2x3g1,0.2452,0,miopenConvolutionFwdAlgoWinograd,<unused>;miopenConvolutionFwdAlgoGEMM:GemmFwd1x1_0_1,0.157759,0,miopenConvolutionFwdAlgoGEMM,<unused>
608-7-7-1x1-128-7-7-32-0x0-1x1-1x1-0-NCHW-FP16-F=miopenConvolutionFwdAlgoImplicitGEMM:ConvHipImplicitGemmV4R1Fwd,0.158839,0,miopenConvolutionFwdAlgoImplicitGEMM,<unused>;miopenConvolutionFwdAlgoDirect:ConvDirectNaiveConvFwd,6.99758,0,miopenConvolutionFwdAlgoDirect,<unused>;miopenConvolutionFwdAlgoWinograd:ConvBinWinogradRxSf2x3g1,0.25652,0,miopenConvolutionFwdAlgoWinograd,<unused>;miopenConvolutionFwdAlgoGEMM:GemmFwd1x1_0_1,0.161479,0,miopenConvolutionFwdAlgoGEMM,<unused>
640-7-7-1x1-128-7-7-32-0x0-1x1-1x1-0-NCHW-FP16-F=miopenConvolutionFwdAlgoImplicitGEMM:ConvHipImplicitGemmV4R1Fwd,0.173039,0,miopenConvolutionFwdAlgoImplicitGEMM,<unused>;miopenConvolutionFwdAlgoDirect:ConvDirectNaiveConvFwd,7.36442,0,miopenConvolutionFwdAlgoDirect,<unused>;miopenConvolutionFwdAlgoWinograd:ConvBinWinogradRxSf2x3g1,0.267999,0,miopenConvolutionFwdAlgoWinograd,<unused>;miopenConvolutionFwdAlgoGEMM:GemmFwd1x1_0_1,0.168439,0,miopenConvolutionFwdAlgoGEMM,<unused>
672-7-7-1x1-128-7-7-32-0x0-1x1-1x1-0-NCHW-FP16-F=miopenConvolutionFwdAlgoImplicitGEMM:ConvHipImplicitGemmV4R1Fwd,0.17392,0,miopenConvolutionFwdAlgoImplicitGEMM,<unused>;miopenConvolutionFwdAlgoDirect:ConvDirectNaiveConvFwd,7.73598,0,miopenConvolutionFwdAlgoDirect,<unused>;miopenConvolutionFwdAlgoWinograd:ConvBinWinogradRxSf2x3g1,0.278679,0,miopenConvolutionFwdAlgoWinograd,<unused>;miopenConvolutionFwdAlgoGEMM:GemmFwd1x1_0_1,0.174279,0,miopenConvolutionFwdAlgoGEMM,<unused>
704-7-7-1x1-128-7-7-32-0x0-1x1-1x1-0-NCHW-FP16-F=miopenConvolutionFwdAlgoImplicitGEMM:ConvHipImplicitGemmV4R1Fwd,0.18224,0,miopenConvolutionFwdAlgoImplicitGEMM,<unused>;miopenConvolutionFwdAlgoDirect:ConvDirectNaiveConvFwd,8.08994,0,miopenConvolutionFwdAlgoDirect,<unused>;miopenConvolutionFwdAlgoWinograd:ConvBinWinogradRxSf2x3g1,0.288919,0,miopenConvolutionFwdAlgoWinograd,<unused>;miopenConvolutionFwdAlgoGEMM:GemmFwd1x1_0_1,0.185159,0,miopenConvolutionFwdAlgoGEMM,<unused>
736-7-7-1x1-128-7-7-32-0x0-1x1-1x1-0-NCHW-FP16-F=miopenConvolutionFwdAlgoImplicitGEMM:ConvHipImplicitGemmV4R1Fwd,0.187359,0,miopenConvolutionFwdAlgoImplicitGEMM,<unused>;miopenConvolutionFwdAlgoDirect:ConvDirectNaiveConvFwd,8.45817,0,miopenConvolutionFwdAlgoDirect,<unused>;miopenConvolutionFwdAlgoWinograd:ConvBinWinogradRxSf2x3g1,0.301239,0,miopenConvolutionFwdAlgoWinograd,<unused>;miopenConvolutionFwdAlgoGEMM:GemmFwd1x1_0_1,0.187119,0,miopenConvolutionFwdAlgoGEMM,<unused>
768-7-7-1x1-128-7-7-32-0x0-1x1-1x1-0-NCHW-FP16-F=miopenConvolutionFwdAlgoImplicitGEMM:ConvHipImplicitGemmV4R1Fwd,0.250319,0,miopenConvolutionFwdAlgoImplicitGEMM,<unused>;miopenConvolutionFwdAlgoDirect:ConvDirectNaiveConvFwd,8.82813,0,miopenConvolutionFwdAlgoDirect,<unused>;miopenConvolutionFwdAlgoWinograd:ConvBinWinogradRxSf2x3g1,0.312319,0,miopenConvolutionFwdAlgoWinograd,<unused>;miopenConvolutionFwdAlgoGEMM:GemmFwd1x1_0_1,0.24624,0,miopenConvolutionFwdAlgoGEMM,<unused>
800-7-7-1x1-128-7-7-32-0x0-1x1-1x1-0-NCHW-FP16-F=miopenConvolutionFwdAlgoImplicitGEMM:ConvHipImplicitGemmV4R1Fwd,0.205919,0,miopenConvolutionFwdAlgoImplicitGEMM,<unused>;miopenConvolutionFwdAlgoDirect:ConvDirectNaiveConvFwd,9.19065,0,miopenConvolutionFwdAlgoDirect,<unused>;miopenConvolutionFwdAlgoWinograd:ConvBinWinogradRxSf2x3g1,0.322359,0,miopenConvolutionFwdAlgoWinograd,<unused>;miopenConvolutionFwdAlgoGEMM:GemmFwd1x1_0_1,0.255639,0,miopenConvolutionFwdAlgoGEMM,<unused>
832-7-7-1x1-128-7-7-32-0x0-1x1-1x1-0-NCHW-FP16-F=miopenConvolutionFwdAlgoImplicitGEMM:ConvHipImplicitGemmV4R1Fwd,0.21248,0,miopenConvolutionFwdAlgoImplicitGEMM,<unused>;miopenConvolutionFwdAlgoDirect:ConvDirectNaiveConvFwd,9.55837,0,miopenConvolutionFwdAlgoDirect,<unused>;miopenConvolutionFwdAlgoWinograd:ConvBinWinogradRxSf2x3g1,0.334559,0,miopenConvolutionFwdAlgoWinograd,<unused>;miopenConvolutionFwdAlgoGEMM:GemmFwd1x1_0_1,0.318319,0,miopenConvolutionFwdAlgoGEMM,<unused>
864-7-7-1x1-128-7-7-32-0x0-1x1-1x1-0-NCHW-FP16-F=miopenConvolutionFwdAlgoImplicitGEMM:ConvHipImplicitGemmV4R1Fwd,0.21984,0,miopenConvolutionFwdAlgoImplicitGEMM,<unused>;miopenConvolutionFwdAlgoDirect:ConvDirectNaiveConvFwd,9.92637,0,miopenConvolutionFwdAlgoDirect,<unused>;miopenConvolutionFwdAlgoWinograd:ConvBinWinogradRxSf2x3g1,0.345239,0,miopenConvolutionFwdAlgoWinograd,<unused>;miopenConvolutionFwdAlgoGEMM:GemmFwd1x1_0_1,0.330039,0,miopenConvolutionFwdAlgoGEMM,<unused>
896-7-7-1x1-128-7-7-32-0x0-1x1-1x1-0-NCHW-FP16-F=miopenConvolutionFwdAlgoImplicitGEMM:ConvHipImplicitGemmV4R1Fwd,0.23232,0,miopenConvolutionFwdAlgoImplicitGEMM,<unused>;miopenConvolutionFwdAlgoDirect:ConvDirectNaiveConvFwd,10.2976,0,miopenConvolutionFwdAlgoDirect,<unused>;miopenConvolutionFwdAlgoWinograd:ConvBinWinogradRxSf2x3g1,0.356758,0,miopenConvolutionFwdAlgoWinograd,<unused>;miopenConvolutionFwdAlgoGEMM:GemmFwd1x1_0_1,0.341159,0,miopenConvolutionFwdAlgoGEMM,<unused>
928-7-7-1x1-128-7-7-32-0x0-1x1-1x1-0-NCHW-FP16-F=miopenConvolutionFwdAlgoImplicitGEMM:ConvHipImplicitGemmV4R1Fwd,0.234919,0,miopenConvolutionFwdAlgoImplicitGEMM,<unused>;miopenConvolutionFwdAlgoDirect:ConvDirectNaiveConvFwd,10.6617,0,miopenConvolutionFwdAlgoDirect,<unused>;miopenConvolutionFwdAlgoWinograd:ConvBinWinogradRxSf2x3g1,0.368519,0,miopenConvolutionFwdAlgoWinograd,<unused>;miopenConvolutionFwdAlgoGEMM:GemmFwd1x1_0_1,0.359159,0,miopenConvolutionFwdAlgoGEMM,<unused>
960-7-7-1x1-128-7-7-32-0x0-1x1-1x1-0-NCHW-FP16-F=miopenConvolutionFwdAlgoImplicitGEMM:ConvHipImplicitGemmV4R1Fwd,0.241839,0,miopenConvolutionFwdAlgoImplicitGEMM,<unused>;miopenConvolutionFwdAlgoDirect:ConvDirectNaiveConvFwd,11.037,0,miopenConvolutionFwdAlgoDirect,<unused>;miopenConvolutionFwdAlgoWinograd:ConvBinWinogradRxSf2x3g1,0.380998,0,miopenConvolutionFwdAlgoWinograd,<unused>;miopenConvolutionFwdAlgoGEMM:GemmFwd1x1_0_1,0.370519,0,miopenConvolutionFwdAlgoGEMM,<unused>
992-7-7-1x1-128-7-7-32-0x0-1x1-1x1-0-NCHW-FP16-F=miopenConvolutionFwdAlgoImplicitGEMM:ConvHipImplicitGemmV4R1Fwd,0.147239,0,miopenConvolutionFwdAlgoImplicitGEMM,<unused>;miopenConvolutionFwdAlgoDirect:ConvDirectNaiveConvFwd,11.4002,0,miopenConvolutionFwdAlgoDirect,<unused>;miopenConvolutionFwdAlgoWinograd:ConvBinWinogradRxSf2x3g1,0.390559,0,miopenConvolutionFwdAlgoWinograd,<unused>;miopenConvolutionFwdAlgoGEMM:GemmFwd1x1_0_1,0.374199,0,miopenConvolutionFwdAlgoGEMM,<unused>
3-299-299-3x3-32-149-149-32-0x0-2x2-1x1-0-NCHW-FP32-F=miopenConvolutionFwdAlgoDirect:ConvOclDirectFwdGen,2.49991,0,miopenConvolutionFwdAlgoDirect,<unused>;miopenConvolutionFwdAlgoWinograd:ConvBinWinogradRxSf2x3g1,1.55247,0,miopenConvolutionFwdAlgoWinograd,<unused>;miopenConvolutionFwdAlgoGEMM:GemmFwdRest,4.7872,2397708,miopenConvolutionFwdAlgoGEMM,<unused>
32-149-149-3x3-32-147-147-32-0x0-1x1-1x1-0-NCHW-FP32-F=miopenConvolutionFwdAlgoImplicitGEMM:ConvHipImplicitGemmV4R1Fwd,0.874717,0,miopenConvolutionFwdAlgoImplicitGEMM,<unused>;miopenConvolutionFwdAlgoDirect:ConvOclDirectFwd,3.50229,0,miopenConvolutionFwdAlgoDirect,<unused>;miopenConvolutionFwdAlgoWinograd:ConvBinWinogradRxSf2x3g1,2.06351,0,miopenConvolutionFwdAlgoWinograd,<unused>;miopenConvolutionFwdAlgoGEMM:GemmFwdRest,15.4802,24893568,miopenConvolutionFwdAlgoGEMM,<unused>
32-147-147-3x3-64-147-147-32-1x1-1x1-1x1-0-NCHW-FP32-F=miopenConvolutionFwdAlgoImplicitGEMM:ConvHipImplicitGemmV4R1Fwd,1.78971,0,miopenConvolutionFwdAlgoImplicitGEMM,<unused>;miopenConvolutionFwdAlgoDirect:ConvOclDirectFwd,3.32975,0,miopenConvolutionFwdAlgoDirect,<unused>;miopenConvolutionFwdAlgoWinograd:ConvBinWinogradRxSf2x3g1,0.932237,0,miopenConvolutionFwdAlgoWinograd,<unused>;miopenConvolutionFwdAlgoGEMM:GemmFwdRest,18.7916,24893568,miopenConvolutionFwdAlgoGEMM,<unused>
64-73-73-1x1-80-73-73-32-0x0-1x1-1x1-0-NCHW-FP32-F=miopenConvolutionFwdAlgoDirect:ConvDirectNaiveConvFwd,9.33232,0,miopenConvolutionFwdAlgoDirect,<unused>;miopenConvolutionFwdAlgoWinograd:ConvBinWinogradRxSf2x3g1,2.64867,0,miopenConvolutionFwdAlgoWinograd,<unused>;miopenConvolutionFwdAlgoGEMM:GemmFwd1x1_0_1,0.786717,0,miopenConvolutionFwdAlgoGEMM,<unused>
80-73-73-3x3-192-71-71-32-0x0-1x1-1x1-0-NCHW-FP32-F=miopenConvolutionFwdAlgoImplicitGEMM:ConvHipImplicitGemmV4R4Fwd,3.47583,0,miopenConvolutionFwdAlgoImplicitGEMM,<unused>;miopenConvolutionFwdAlgoDirect:ConvOclDirectFwd,6.27085,0,miopenConvolutionFwdAlgoDirect,<unused>;miopenConvolutionFwdAlgoWinograd:ConvBinWinogradRxSf2x3g1,1.34204,0,miopenConvolutionFwdAlgoWinograd,<unused>;miopenConvolutionFwdAlgoGEMM:GemmFwdRest,21.943,14518080,miopenConvolutionFwdAlgoGEMM,<unused>
192-35-35-1x1-128-35-35-32-0x0-1x1-1x1-0-NCHW-FP32-F=miopenConvolutionFwdAlgoImplicitGEMM:ConvHipImplicitGemmV4R1Fwd,0.138599,0,miopenConvolutionFwdAlgoImplicitGEMM,<unused>;miopenConvolutionFwdAlgoDirect:ConvDirectNaiveConvFwd,13.2395,0,miopenConvolutionFwdAlgoDirect,<unused>;miopenConvolutionFwdAlgoWinograd:ConvBinWinogradRxSf3x2,1.10208,0,miopenConvolutionFwdAlgoWinograd,<unused>;miopenConvolutionFwdAlgoGEMM:GemmFwd1x1_0_1,0.551198,0,miopenConvolutionFwdAlgoGEMM,<unused>
192-35-35-1x1-48-35-35-32-0x0-1x1-1x1-0-NCHW-FP32-F=miopenConvolutionFwdAlgoDirect:ConvDirectNaiveConvFwd,10.9,0,miopenConvolutionFwdAlgoDirect,<unused>;miopenConvolutionFwdAlgoWinograd:ConvBinWinogradRxSf3x2,0.585038,0,miopenConvolutionFwdAlgoWinograd,<unused>;miopenConvolutionFwdAlgoGEMM:GemmFwd1x1_0_1,0.550438,0,miopenConvolutionFwdAlgoGEMM,<unused>
48-35-35-5x5-64-35-35-32-2x2-1x1-1x1-0-NCHW-FP32-F=miopenConvolutionFwdAlgoImplicitGEMM:ConvHipImplicitGemmV4R4Fwd,0.465118,0,miopenConvolutionFwdAlgoImplicitGEMM,<unused>;miopenConvolutionFwdAlgoDirect:ConvOclDirectFwd,4.94311,0,miopenConvolutionFwdAlgoDirect,<unused>;miopenConvolutionFwdAlgoWinograd:ConvBinWinogradRxSf2x3g1,1.19275,0,miopenConvolutionFwdAlgoWinograd,<unused>;miopenConvolutionFwdAlgoGEMM:GemmFwdRest,13.6268,5880000,miopenConvolutionFwdAlgoGEMM,<unused>
64-35-35-3x3-96-35-35-32-1x1-1x1-1x1-0-NCHW-FP32-F=miopenConvolutionFwdAlgoImplicitGEMM:ConvHipImplicitGemmV4R1Fwd,0.315599,0,miopenConvolutionFwdAlgoImplicitGEMM,<unused>;miopenConvolutionFwdAlgoDirect:ConvOclDirectFwd,7.26825,0,miopenConvolutionFwdAlgoDirect,<unused>;miopenConvolutionFwdAlgoWinograd:ConvBinWinogradRxSf2x3g1,0.684997,0,miopenConvolutionFwdAlgoWinograd,<unused>;miopenConvolutionFwdAlgoGEMM:GemmFwdRest,10.5727,2822400,miopenConvolutionFwdAlgoGEMM,<unused>
96-35-35-3x3-96-35-35-32-1x1-1x1-1x1-0-NCHW-FP32-F=miopenConvolutionFwdAlgoImplicitGEMM:ConvHipImplicitGemmV4R1Fwd,0.496078,0,miopenConvolutionFwdAlgoImplicitGEMM,<unused>;miopenConvolutionFwdAlgoDirect:ConvOclDirectFwd,7.98862,0,miopenConvolutionFwdAlgoDirect,<unused>;miopenConvolutionFwdAlgoWinograd:ConvBinWinogradRxSf2x3g1,0.963836,0,miopenConvolutionFwdAlgoWinograd,<unused>;miopenConvolutionFwdAlgoGEMM:GemmFwdRest,7.83997,4233600,miopenConvolutionFwdAlgoGEMM,<unused>
192-35-35-1x1-32-35-35-32-0x0-1x1-1x1-0-NCHW-FP32-F=miopenConvolutionFwdAlgoImplicitGEMM:ConvHipImplicitGemmV4R4Fwd,0.05632,0,miopenConvolutionFwdAlgoImplicitGEMM,<unused>;miopenConvolutionFwdAlgoDirect:ConvDirectNaiveConvFwd,9.47942,0,miopenConvolutionFwdAlgoDirect,<unused>;miopenConvolutionFwdAlgoWinograd:ConvBinWinogradRxSf3x2,0.333078,0,miopenConvolutionFwdAlgoWinograd,<unused>;miopenConvolutionFwdAlgoGEMM:GemmFwd1x1_0_1,0.297599,0,miopenConvolutionFwdAlgoGEMM,<unused>
256-35-35-1x1-128-35-35-32-0x0-1x1-1x1-0-NCHW-FP32-F=miopenConvolutionFwdAlgoImplicitGEMM:ConvHipImplicitGemmV4R4Fwd,0.216719,0,miopenConvolutionFwdAlgoImplicitGEMM,<unused>;miopenConvolutionFwdAlgoDirect:ConvDirectNaiveConvFwd,11.6455,0,miopenConvolutionFwdAlgoDirect,<unused>;miopenConvolutionFwdAlgoWinograd:ConvBinWinogradRxSf2x3g1,3.03319,0,miopenConvolutionFwdAlgoWinograd,<unused>;miopenConvolutionFwdAlgoGEMM:GemmFwd1x1_0_1,0.704997,0,miopenConvolutionFwdAlgoGEMM,<unused>
256-35-35-1x1-48-35-35-32-0x0-1x1-1x1-0-NCHW-FP32-F=miopenConvolutionFwdAlgoDirect:ConvDirectNaiveConvFwd,7.79601,0,miopenConvolutionFwdAlgoDirect,<unused>;miopenConvolutionFwdAlgoWinograd:ConvBinWinogradRxSf2x3g1,1.51115,0,miopenConvolutionFwdAlgoWinograd,<unused>;miopenConvolutionFwdAlgoGEMM:GemmFwd1x1_0_1,0.720677,0,miopenConvolutionFwdAlgoGEMM,<unused>
256-35-35-1x1-64-35-35-32-0x0-1x1-1x1-0-NCHW-FP32-F=miopenConvolutionFwdAlgoImplicitGEMM:ConvHipImplicitGemmV4R1Fwd,0.1132,0,miopenConvolutionFwdAlgoImplicitGEMM,<unused>;miopenConvolutionFwdAlgoDirect:ConvDirectNaiveConvFwd,9.86976,0,miopenConvolutionFwdAlgoDirect,<unused>;miopenConvolutionFwdAlgoWinograd:ConvBinWinogradRxSf2x3g1,1.53803,0,miopenConvolutionFwdAlgoWinograd,<unused>;miopenConvolutionFwdAlgoGEMM:GemmFwd1x1_0_1,0.381998,0,miopenConvolutionFwdAlgoGEMM,<unused>
288-35-35-1x1-128-35-35-32-0x0-1x1-1x1-0-NCHW-FP32-F=miopenConvolutionFwdAlgoImplicitGEMM:ConvHipImplicitGemmV4R4Fwd,0.195159,0,miopenConvolutionFwdAlgoImplicitGEMM,<unused>;miopenConvolutionFwdAlgoDirect:ConvDirectNaiveConvFwd,13.0087,0,miopenConvolutionFwdAlgoDirect,<unused>;miopenConvolutionFwdAlgoWinograd:ConvBinWinogradRxSf2x3g1,2.58947,0,miopenConvolutionFwdAlgoWinograd,<unused>;miopenConvolutionFwdAlgoGEMM:GemmFwd1x1_0_1,0.793156,0,miopenConvolutionFwdAlgoGEMM,<unused>
288-35-35-1x1-48-35-35-32-0x0-1x1-1x1-0-NCHW-FP32-F=miopenConvolutionFwdAlgoDirect:ConvDirectNaiveConvFwd,7.01613,0,miopenConvolutionFwdAlgoDirect,<unused>;miopenConvolutionFwdAlgoWinograd:ConvBinWinogradRxSf2x3g1,1.68751,0,miopenConvolutionFwdAlgoWinograd,<unused>;miopenConvolutionFwdAlgoGEMM:GemmFwd1x1_0_1,0.807557,0,miopenConvolutionFwdAlgoGEMM,<unused>
288-35-35-1x1-64-35-35-32-0x0-1x1-1x1-0-NCHW-FP32-F=miopenConvolutionFwdAlgoImplicitGEMM:ConvHipImplicitGemmV4R4Fwd,0.10748,0,miopenConvolutionFwdAlgoImplicitGEMM,<unused>;miopenConvolutionFwdAlgoDirect:ConvDirectNaiveConvFwd,9.52295,0,miopenConvolutionFwdAlgoDirect,<unused>;miopenConvolutionFwdAlgoWinograd:ConvBinWinogradRxSf2x3g1,1.73104,0,miopenConvolutionFwdAlgoWinograd,<unused>;miopenConvolutionFwdAlgoGEMM:GemmFwd1x1_0_1,0.42068,0,miopenConvolutionFwdAlgoGEMM,<unused>
288-35-35-3x3-384-17-17-32-0x0-2x2-1x1-0-NCHW-FP32-F=miopenConvolutionFwdAlgoImplicitGEMM:ConvHipImplicitGemmV4R4Fwd,1.29592,0,miopenConvolutionFwdAlgoImplicitGEMM,<unused>;miopenConvolutionFwdAlgoDirect:ConvOclDirectFwd,6.55701,0,miopenConvolutionFwdAlgoDirect,<unused>;miopenConvolutionFwdAlgoWinograd:ConvBinWinogradRxSf2x3g1,3.88833,0,miopenConvolutionFwdAlgoWinograd,<unused>;miopenConvolutionFwdAlgoGEMM:GemmFwdRest,17.9373,2996352,miopenConvolutionFwdAlgoGEMM,<unused>
96-35-35-3x3-96-17-17-32-0x0-2x2-1x1-0-NCHW-FP32-F=miopenConvolutionFwdAlgoImplicitGEMM:ConvHipImplicitGemmV4R1Fwd,0.1344,0,miopenConvolutionFwdAlgoImplicitGEMM,<unused>;miopenConvolutionFwdAlgoDirect:ConvOclDirectFwd,4.35389,0,miopenConvolutionFwdAlgoDirect,<unused>;miopenConvolutionFwdAlgoWinograd:ConvBinWinogradRxSf2x3g1,1.07996,0,miopenConvolutionFwdAlgoWinograd,<unused>;miopenConvolutionFwdAlgoGEMM:GemmFwdRest,4.98048,998784,miopenConvolutionFwdAlgoGEMM,<unused>
768-17-17-1x1-256-17-17-32-0x0-1x1-1x1-0-NCHW-FP32-F=miopenConvolutionFwdAlgoImplicitGEMM:ConvHipImplicitGemmV4R4Fwd,0.316681,0,miopenConvolutionFwdAlgoImplicitGEMM,<unused>;miopenConvolutionFwdAlgoDirect:ConvDirectNaiveConvFwd,17.0744,0,miopenConvolutionFwdAlgoDirect,<unused>;miopenConvolutionFwdAlgoWinograd:ConvBinWinogradRxSf2x3g1,1.27525,0,miopenConvolutionFwdAlgoWinograd,<unused>;miopenConvolutionFwdAlgoGEMM:GemmFwd1x1_0_1,1.2674,0,miopenConvolutionFwdAlgoGEMM,<unused>
768-17-17-1x1-192-17-17-32-0x0-1x1-1x1-0-NCHW-FP32-F=miopenConvolutionFwdAlgoImplicitGEMM:ConvHipImplicitGemmV4R4Fwd,0.283201,0,miopenConvolutionFwdAlgoImplicitGEMM,<unused>;miopenConvolutionFwdAlgoDirect:ConvDirectNaiveConvFwd,13.0874,0,miopenConvolutionFwdAlgoDirect,<unused>;miopenConvolutionFwdAlgoWinograd:ConvBinWinogradRxSf2x3g1,3.20329,0,miopenConvolutionFwdAlgoWinograd,<unused>;miopenConvolutionFwdAlgoGEMM:GemmFwd1x1_0_1,0.941042,0,miopenConvolutionFwdAlgoGEMM,<unused>
128-17-17-1x7-128-17-17-32-0x3-1x1-1x1-0-NCHW-FP32-F=miopenConvolutionFwdAlgoImplicitGEMM:ConvHipImplicitGemmV4R1Fwd,0.182441,0,miopenConvolutionFwdAlgoImplicitGEMM,<unused>;miopenConvolutionFwdAlgoDirect:ConvDirectNaiveConvFwd,10.9242,0,miopenConvolutionFwdAlgoDirect,<unused>;miopenConvolutionFwdAlgoWinograd:ConvBinWinogradRxSf2x3g1,1.66981,0,miopenConvolutionFwdAlgoWinograd,<unused>;miopenConvolutionFwdAlgoGEMM:GemmFwdRest,5.24803,1035776,miopenConvolutionFwdAlgoGEMM,<unused>
128-17-17-7x1-192-17-17-32-3x0-1x1-1x1-0-NCHW-FP32-F=miopenConvolutionFwdAlgoImplicitGEMM:ConvHipImplicitGemmV4R1Fwd,0.25792,0,miopenConvolutionFwdAlgoImplicitGEMM,<unused>;miopenConvolutionFwdAlgoDirect:ConvDirectNaiveConvFwd,17.7913,0,miopenConvolutionFwdAlgoDirect,<unused>;miopenConvolutionFwdAlgoWinograd:ConvBinWinogradRxSf2x3g1,1.78673,0,miopenConvolutionFwdAlgoWinograd,<unused>;miopenConvolutionFwdAlgoGEMM:GemmFwdRest,5.99808,1035776,miopenConvolutionFwdAlgoGEMM,<unused>
128-17-17-7x1-128-17-17-32-3x0-1x1-1x1-0-NCHW-FP32-F=miopenConvolutionFwdAlgoImplicitGEMM:ConvHipImplicitGemmV4R4Fwd,0.185121,0,miopenConvolutionFwdAlgoImplicitGEMM,<unused>;miopenConvolutionFwdAlgoDirect:ConvDirectNaiveConvFwd,15.3841,0,miopenConvolutionFwdAlgoDirect,<unused>;miopenConvolutionFwdAlgoWinograd:ConvBinWinogradRxSf3x2,0.726082,0,miopenConvolutionFwdAlgoWinograd,<unused>;miopenConvolutionFwdAlgoGEMM:GemmFwdRest,5.33123,1035776,miopenConvolutionFwdAlgoGEMM,<unused>
128-17-17-1x7-192-17-17-32-0x3-1x1-1x1-0-NCHW-FP32-F=miopenConvolutionFwdAlgoImplicitGEMM:ConvHipImplicitGemmV4R1Fwd,0.256801,0,miopenConvolutionFwdAlgoImplicitGEMM,<unused>;miopenConvolutionFwdAlgoDirect:ConvDirectNaiveConvFwd,13.1722,0,miopenConvolutionFwdAlgoDirect,<unused>;miopenConvolutionFwdAlgoWinograd:ConvBinWinogradRxSf2x3g1,2.34013,0,miopenConvolutionFwdAlgoWinograd,<unused>;miopenConvolutionFwdAlgoGEMM:GemmFwdRest,5.75363,1035776,miopenConvolutionFwdAlgoGEMM,<unused>
768-17-17-1x1-320-17-17-32-0x0-1x1-1x1-0-NCHW-FP32-F=miopenConvolutionFwdAlgoImplicitGEMM:ConvHipImplicitGemmV4R4Fwd,0.380361,0,miopenConvolutionFwdAlgoImplicitGEMM,<unused>;miopenConvolutionFwdAlgoDirect:ConvDirectNaiveConvFwd,21.2535,0,miopenConvolutionFwdAlgoDirect,<unused>;miopenConvolutionFwdAlgoWinograd:ConvBinWinogradRxSf2x3g1,1.36584,0,miopenConvolutionFwdAlgoWinograd,<unused>;miopenConvolutionFwdAlgoGEMM:GemmFwd1x1_0_1,1.59732,0,miopenConvolutionFwdAlgoGEMM,<unused>
160-17-17-1x7-160-17-17-32-0x3-1x1-1x1-0-NCHW-FP32-F=miopenConvolutionFwdAlgoImplicitGEMM:ConvHipImplicitGemmV4R1Fwd,0.279521,0,miopenConvolutionFwdAlgoImplicitGEMM,<unused>;miopenConvolutionFwdAlgoDirect:ConvDirectNaiveConvFwd,11.8549,0,miopenConvolutionFwdAlgoDirect,<unused>;miopenConvolutionFwdAlgoWinograd:ConvBinWinogradRxSf2x3g1,2.49933,0,miopenConvolutionFwdAlgoWinograd,<unused>;miopenConvolutionFwdAlgoGEMM:GemmFwdRest,6.11203,1294720,miopenConvolutionFwdAlgoGEMM,<unused>
160-17-17-7x1-192-17-17-32-3x0-1x1-1x1-0-NCHW-FP32-F=miopenConvolutionFwdAlgoImplicitGEMM:ConvHipImplicitGemmV4R4Fwd,0.2914,0,miopenConvolutionFwdAlgoImplicitGEMM,<unused>;miopenConvolutionFwdAlgoDirect:ConvDirectNaiveConvFwd,18.4896,0,miopenConvolutionFwdAlgoDirect,<unused>;miopenConvolutionFwdAlgoWinograd:ConvBinWinogradRxSf2x3g1,2.20681,0,miopenConvolutionFwdAlgoWinograd,<unused>;miopenConvolutionFwdAlgoGEMM:GemmFwdRest,6.88768,1294720,miopenConvolutionFwdAlgoGEMM,<unused>
160-17-17-7x1-160-17-17-32-3x0-1x1-1x1-0-NCHW-FP32-F=miopenConvolutionFwdAlgoImplicitGEMM:ConvHipImplicitGemmV4R4Fwd,0.268481,0,miopenConvolutionFwdAlgoImplicitGEMM,<unused>;miopenConvolutionFwdAlgoDirect:ConvDirectNaiveConvFwd,17.0171,0,miopenConvolutionFwdAlgoDirect,<unused>;miopenConvolutionFwdAlgoWinograd:ConvBinWinogradRxSf2x3g1,1.89676,0,miopenConvolutionFwdAlgoWinograd,<unused>;miopenConvolutionFwdAlgoGEMM:GemmFwdRest,6.43459,1294720,miopenConvolutionFwdAlgoGEMM,<unused>
160-17-17-1x7-192-17-17-32-0x3-1x1-1x1-0-NCHW-FP32-F=miopenConvolutionFwdAlgoImplicitGEMM:ConvHipImplicitGemmV4R4Fwd,0.310561,0,miopenConvolutionFwdAlgoImplicitGEMM,<unused>;miopenConvolutionFwdAlgoDirect:ConvDirectNaiveConvFwd,15.5458,0,miopenConvolutionFwdAlgoDirect,<unused>;miopenConvolutionFwdAlgoWinograd:ConvBinWinogradRxSf2x3g1,2.90589,0,miopenConvolutionFwdAlgoWinograd,<unused>;miopenConvolutionFwdAlgoGEMM:GemmFwdRest,7.09251,1294720,miopenConvolutionFwdAlgoGEMM,<unused>
768-17-17-1x1-576-17-17-32-0x0-1x1-1x1-0-NCHW-FP32-F=miopenConvolutionFwdAlgoImplicitGEMM:ConvHipImplicitGemmV4R4Fwd,0.617642,0,miopenConvolutionFwdAlgoImplicitGEMM,<unused>;miopenConvolutionFwdAlgoDirect:ConvDirectNaiveConvFwd,37.7858,0,miopenConvolutionFwdAlgoDirect,<unused>;miopenConvolutionFwdAlgoWinograd:ConvBinWinogradRxSf2x3g1,2.07325,0,miopenConvolutionFwdAlgoWinograd,<unused>;miopenConvolutionFwdAlgoGEMM:GemmFwd1x1_0_1,4.63853,0,miopenConvolutionFwdAlgoGEMM,<unused>
192-17-17-1x7-192-17-17-32-0x3-1x1-1x1-0-NCHW-FP32-F=miopenConvolutionFwdAlgoImplicitGEMM:ConvHipImplicitGemmV4R4Fwd,0.371401,0,miopenConvolutionFwdAlgoImplicitGEMM,<unused>;miopenConvolutionFwdAlgoDirect:ConvDirectNaiveConvFwd,16.1759,0,miopenConvolutionFwdAlgoDirect,<unused>;miopenConvolutionFwdAlgoWinograd:ConvBinWinogradRxSf2x3g1,3.46077,0,miopenConvolutionFwdAlgoWinograd,<unused>;miopenConvolutionFwdAlgoGEMM:GemmFwdRest,8.09344,1553664,miopenConvolutionFwdAlgoGEMM,<unused>
192-17-17-7x1-192-17-17-32-3x0-1x1-1x1-0-NCHW-FP32-F=miopenConvolutionFwdAlgoImplicitGEMM:ConvHipImplicitGemmV4R1Fwd,0.355881,0,miopenConvolutionFwdAlgoImplicitGEMM,<unused>;miopenConvolutionFwdAlgoDirect:ConvDirectNaiveConvFwd,20.4165,0,miopenConvolutionFwdAlgoDirect,<unused>;miopenConvolutionFwdAlgoWinograd:ConvBinWinogradRxSf2x3g1,1.30734,0,miopenConvolutionFwdAlgoWinograd,<unused>;miopenConvolutionFwdAlgoGEMM:GemmFwdRest,8.31875,1553664,miopenConvolutionFwdAlgoGEMM,<unused>
768-17-17-1x1-384-17-17-32-0x0-1x1-1x1-0-NCHW-FP32-F=miopenConvolutionFwdAlgoImplicitGEMM:ConvHipImplicitGemmV4R4Fwd,0.442721,0,miopenConvolutionFwdAlgoImplicitGEMM,<unused>;miopenConvolutionFwdAlgoDirect:ConvDirectNaiveConvFwd,25.2903,0,miopenConvolutionFwdAlgoDirect,<unused>;miopenConvolutionFwdAlgoWinograd:ConvBinWinogradRxSf2x3g1,1.57404,0,miopenConvolutionFwdAlgoWinograd,<unused>;miopenConvolutionFwdAlgoGEMM:GemmFwd1x1_0_1,1.81624,0,miopenConvolutionFwdAlgoGEMM,<unused>
192-17-17-3x3-320-8-8-32-0x0-2x2-1x1-0-NCHW-FP32-F=miopenConvolutionFwdAlgoImplicitGEMM:ConvHipImplicitGemmV4R1Fwd,0.2058,0,miopenConvolutionFwdAlgoImplicitGEMM,<unused>;miopenConvolutionFwdAlgoDirect:ConvOclDirectFwd,3.62437,0,miopenConvolutionFwdAlgoDirect,<unused>;miopenConvolutionFwdAlgoWinograd:ConvBinWinogradRxSf2x3g1,1.56704,0,miopenConvolutionFwdAlgoWinograd,<unused>;miopenConvolutionFwdAlgoGEMM:GemmFwdRest,7.44576,442368,miopenConvolutionFwdAlgoGEMM,<unused>
192-17-17-3x3-192-8-8-32-0x0-2x2-1x1-0-NCHW-FP32-F=miopenConvolutionFwdAlgoImplicitGEMM:ConvHipImplicitGemmV4R4Fwd,0.143761,0,miopenConvolutionFwdAlgoImplicitGEMM,<unused>;miopenConvolutionFwdAlgoDirect:ConvOclDirectFwd,2.22409,0,miopenConvolutionFwdAlgoDirect,<unused>;miopenConvolutionFwdAlgoWinograd:ConvBinWinogradRxSf2x3g1,1.062,0,miopenConvolutionFwdAlgoWinograd,<unused>;miopenConvolutionFwdAlgoGEMM:GemmFwdRest,7.27171,442368,miopenConvolutionFwdAlgoGEMM,<unused>
1280-8-8-1x1-320-8-8-32-0x0-1x1-1x1-0-NCHW-FP32-F=miopenConvolutionFwdAlgoImplicitGEMM:ConvHipImplicitGemmV4R1Fwd,0.145241,0,miopenConvolutionFwdAlgoImplicitGEMM,<unused>;miopenConvolutionFwdAlgoDirect:ConvDirectNaiveConvFwd,7.4193,0,miopenConvolutionFwdAlgoDirect,<unused>;miopenConvolutionFwdAlgoWinograd:ConvBinWinogradRxSf2x3g1,1.32824,0,miopenConvolutionFwdAlgoWinograd,<unused>;miopenConvolutionFwdAlgoGEMM:GemmFwd1x1_0_1,0.701361,0,miopenConvolutionFwdAlgoGEMM,<unused>
1280-8-8-1x1-384-8-8-32-0x0-1x1-1x1-0-NCHW-FP32-F=miopenConvolutionFwdAlgoImplicitGEMM:ConvHipImplicitGemmV4R4Fwd,0.14904,0,miopenConvolutionFwdAlgoImplicitGEMM,<unused>;miopenConvolutionFwdAlgoDirect:ConvDirectNaiveConvFwd,9.34602,0,miopenConvolutionFwdAlgoDirect,<unused>;miopenConvolutionFwdAlgoWinograd:ConvBinWinogradRxSf2x3g1,2.46009,0,miopenConvolutionFwdAlgoWinograd,<unused>;miopenConvolutionFwdAlgoGEMM:GemmFwd1x1_0_1,0.736802,0,miopenConvolutionFwdAlgoGEMM,<unused>
384-8-8-1x3-384-8-8-32-0x1-1x1-1x1-0-NCHW-FP32-F=miopenConvolutionFwdAlgoImplicitGEMM:ConvHipImplicitGemmV4R1Fwd,0.152,0,miopenConvolutionFwdAlgoImplicitGEMM,<unused>;miopenConvolutionFwdAlgoDirect:ConvDirectNaiveConvFwd,12.571,0,miopenConvolutionFwdAlgoDirect,<unused>;miopenConvolutionFwdAlgoWinograd:ConvBinWinogradRxSf2x3g1,0.789721,0,miopenConvolutionFwdAlgoWinograd,<unused>;miopenConvolutionFwdAlgoGEMM:GemmFwdRest,5.50528,294912,miopenConvolutionFwdAlgoGEMM,<unused>
384-8-8-3x1-384-8-8-32-1x0-1x1-1x1-0-NCHW-FP32-F=miopenConvolutionFwdAlgoImplicitGEMM:ConvHipImplicitGemmV4R1Fwd,0.147241,0,miopenConvolutionFwdAlgoImplicitGEMM,<unused>;miopenConvolutionFwdAlgoDirect:ConvDirectNaiveConvFwd,10.8589,0,miopenConvolutionFwdAlgoDirect,<unused>;miopenConvolutionFwdAlgoWinograd:ConvBinWinogradRxSf2x3g1,0.784521,0,miopenConvolutionFwdAlgoWinograd,<unused>;miopenConvolutionFwdAlgoGEMM:GemmFwdRest,5.26336,294912,miopenConvolutionFwdAlgoGEMM,<unused>
1280-8-8-1x1-448-8-8-32-0x0-1x1-1x1-0-NCHW-FP32-F=miopenConvolutionFwdAlgoImplicitGEMM:ConvHipImplicitGemmV4R1Fwd,0.20052,0,miopenConvolutionFwdAlgoImplicitGEMM,<unused>;miopenConvolutionFwdAlgoDirect:ConvDirectNaiveConvFwd,10.4888,0,miopenConvolutionFwdAlgoDirect,<unused>;miopenConvolutionFwdAlgoWinograd:ConvBinWinogradRxSf2x3g1,2.62528,0,miopenConvolutionFwdAlgoWinograd,<unused>;miopenConvolutionFwdAlgoGEMM:GemmFwd1x1_0_1,0.920761,0,miopenConvolutionFwdAlgoGEMM,<unused>
448-8-8-3x3-384-8-8-32-1x1-1x1-1x1-0-NCHW-FP32-F=miopenConvolutionFwdAlgoImplicitGEMM:ConvHipImplicitGemmV4R4Fwd,0.5648,0,miopenConvolutionFwdAlgoImplicitGEMM,<unused>;miopenConvolutionFwdAlgoDirect:ConvOclDirectFwd,5.20449,0,miopenConvolutionFwdAlgoDirect,<unused>;miopenConvolutionFwdAlgoWinograd:ConvBinWinogradRxSf2x3g1,0.910361,0,miopenConvolutionFwdAlgoWinograd,<unused>;miopenConvolutionFwdAlgoGEMM:GemmFwdRest,8.06912,1032192,miopenConvolutionFwdAlgoGEMM,<unused>
1280-8-8-1x1-192-8-8-32-0x0-1x1-1x1-0-NCHW-FP32-F=miopenConvolutionFwdAlgoImplicitGEMM:ConvHipImplicitGemmV4R4Fwd,0.09308,0,miopenConvolutionFwdAlgoImplicitGEMM,<unused>;miopenConvolutionFwdAlgoDirect:ConvDirectNaiveConvFwd,7.43881,0,miopenConvolutionFwdAlgoDirect,<unused>;miopenConvolutionFwdAlgoWinograd:ConvBinWinogradRxSf2x3g1,1.66192,0,miopenConvolutionFwdAlgoWinograd,<unused>;miopenConvolutionFwdAlgoGEMM:GemmFwd1x1_0_1,0.497241,0,miopenConvolutionFwdAlgoGEMM,<unused>
2048-8-8-1x1-320-8-8-32-0x0-1x1-1x1-0-NCHW-FP32-F=miopenConvolutionFwdAlgoImplicitGEMM:ConvHipImplicitGemmV4R4Fwd,0.318321,0,miopenConvolutionFwdAlgoImplicitGEMM,<unused>;miopenConvolutionFwdAlgoDirect:ConvDirectNaiveConvFwd,11.7296,0,miopenConvolutionFwdAlgoDirect,<unused>;miopenConvolutionFwdAlgoWinograd:ConvBinWinogradRxSf2x3g1,1.54,0,miopenConvolutionFwdAlgoWinograd,<unused>;miopenConvolutionFwdAlgoGEMM:GemmFwd1x1_0_1,1.10748,0,miopenConvolutionFwdAlgoGEMM,<unused>
2048-8-8-1x1-384-8-8-32-0x0-1x1-1x1-0-NCHW-FP32-F=miopenConvolutionFwdAlgoImplicitGEMM:ConvHipImplicitGemmV4R1Fwd,0.40792,0,miopenConvolutionFwdAlgoImplicitGEMM,<unused>;miopenConvolutionFwdAlgoDirect:ConvDirectNaiveConvFwd,14.5513,0,miopenConvolutionFwdAlgoDirect,<unused>;miopenConvolutionFwdAlgoWinograd:ConvBinWinogradRxSf2x3g1,1.28204,0,miopenConvolutionFwdAlgoWinograd,<unused>;miopenConvolutionFwdAlgoGEMM:GemmFwd1x1_0_1,1.15124,0,miopenConvolutionFwdAlgoGEMM,<unused>
2048-8-8-1x1-448-8-8-32-0x0-1x1-1x1-0-NCHW-FP32-F=miopenConvolutionFwdAlgoImplicitGEMM:ConvHipImplicitGemmV4R4Fwd,0.35912,0,miopenConvolutionFwdAlgoImplicitGEMM,<unused>;miopenConvolutionFwdAlgoDirect:ConvDirectNaiveConvFwd,16.0897,0,miopenConvolutionFwdAlgoDirect,<unused>;miopenConvolutionFwdAlgoWinograd:ConvBinWinogradRxSf2x3g1,1.20764,0,miopenConvolutionFwdAlgoWinograd,<unused>;miopenConvolutionFwdAlgoGEMM:GemmFwd1x1_0_1,1.46068,0,miopenConvolutionFwdAlgoGEMM,<unused>
2048-8-8-1x1-192-8-8-32-0x0-1x1-1x1-0-NCHW-FP32-F=miopenConvolutionFwdAlgoImplicitGEMM:ConvHipImplicitGemmV4R1Fwd,0.165961,0,miopenConvolutionFwdAlgoImplicitGEMM,<unused>;miopenConvolutionFwdAlgoDirect:ConvDirectNaiveConvFwd,8.74887,0,miopenConvolutionFwdAlgoDirect,<unused>;miopenConvolutionFwdAlgoWinograd:ConvBinWinogradRxSf2x3g1,2.62156,0,miopenConvolutionFwdAlgoWinograd,<unused>;miopenConvolutionFwdAlgoGEMM:GemmFwd1x1_0_1,0.779081,0,miopenConvolutionFwdAlgoGEMM,<unused>
3-299-299-3x3-32-149-149-32-0x0-2x2-1x1-0-NCHW-FP16-F=miopenConvolutionFwdAlgoDirect:ConvDirectNaiveConvFwd,4.71344,0,miopenConvolutionFwdAlgoDirect,<unused>;miopenConvolutionFwdAlgoWinograd:ConvBinWinogradRxSf2x3g1,1.21148,0,miopenConvolutionFwdAlgoWinograd,<unused>;miopenConvolutionFwdAlgoGEMM:GemmFwdRest,4.46592,1198854,miopenConvolutionFwdAlgoGEMM,<unused>
32-149-149-3x3-32-147-147-32-0x0-1x1-1x1-0-NCHW-FP16-F=miopenConvolutionFwdAlgoImplicitGEMM:ConvHipImplicitGemmV4R1Fwd,1.12564,0,miopenConvolutionFwdAlgoImplicitGEMM,<unused>;miopenConvolutionFwdAlgoDirect:ConvOclDirectFwd,5.00367,0,miopenConvolutionFwdAlgoDirect,<unused>;miopenConvolutionFwdAlgoWinograd:ConvBinWinogradRxSf2x3g1,1.45851,0,miopenConvolutionFwdAlgoWinograd,<unused>;miopenConvolutionFwdAlgoGEMM:GemmFwdRest,11.3753,12446784,miopenConvolutionFwdAlgoGEMM,<unused>
32-147-147-3x3-64-147-147-32-1x1-1x1-1x1-0-NCHW-FP16-F=miopenConvolutionFwdAlgoImplicitGEMM:ConvHipImplicitGemmV4R1Fwd,2.71494,0,miopenConvolutionFwdAlgoImplicitGEMM,<unused>;miopenConvolutionFwdAlgoDirect:ConvOclDirectFwd,3.78082,0,miopenConvolutionFwdAlgoDirect,<unused>;miopenConvolutionFwdAlgoWinograd:ConvBinWinogradRxSf2x3g1,2.72202,0,miopenConvolutionFwdAlgoWinograd,<unused>;miopenConvolutionFwdAlgoGEMM:GemmFwdRest,12.759,12446784,miopenConvolutionFwdAlgoGEMM,<unused>
64-73-73-1x1-80-73-73-32-0x0-1x1-1x1-0-NCHW-FP16-F=miopenConvolutionFwdAlgoDirect:ConvDirectNaiveConvFwd,10.1759,0,miopenConvolutionFwdAlgoDirect,<unused>;miopenConvolutionFwdAlgoWinograd:ConvBinWinogradRxSf2x3g1,1.70531,0,miopenConvolutionFwdAlgoWinograd,<unused>;miopenConvolutionFwdAlgoGEMM:GemmFwd1x1_0_1,0.514837,0,miopenConvolutionFwdAlgoGEMM,<unused>
80-73-73-3x3-192-71-71-32-0x0-1x1-1x1-0-NCHW-FP16-F=miopenConvolutionFwdAlgoImplicitGEMM:ConvHipImplicitGemmV4R1Fwd,3.53362,0,miopenConvolutionFwdAlgoImplicitGEMM,<unused>;miopenConvolutionFwdAlgoDirect:ConvOclDirectFwd,7.71159,0,miopenConvolutionFwdAlgoDirect,<unused>;miopenConvolutionFwdAlgoWinograd:ConvBinWinogradRxSf2x3g1,1.76891,0,miopenConvolutionFwdAlgoWinograd,<unused>;miopenConvolutionFwdAlgoGEMM:GemmFwdRest,13.8008,7259040,miopenConvolutionFwdAlgoGEMM,<unused>
192-35-35-1x1-128-35-35-32-0x0-1x1-1x1-0-NCHW-FP16-F=miopenConvolutionFwdAlgoImplicitGEMM:ConvHipImplicitGemmV4R1Fwd,0.179439,0,miopenConvolutionFwdAlgoImplicitGEMM,<unused>;miopenConvolutionFwdAlgoDirect:ConvDirectNaiveConvFwd,13.6381,0,miopenConvolutionFwdAlgoDirect,<unused>;miopenConvolutionFwdAlgoWinograd:ConvBinWinogradRxSf3x2,0.751556,0,miopenConvolutionFwdAlgoWinograd,<unused>;miopenConvolutionFwdAlgoGEMM:GemmFwd1x1_0_1,0.367638,0,miopenConvolutionFwdAlgoGEMM,<unused>
192-35-35-1x1-48-35-35-32-0x0-1x1-1x1-0-NCHW-FP16-F=miopenConvolutionFwdAlgoDirect:ConvDirectNaiveConvFwd,12.0234,0,miopenConvolutionFwdAlgoDirect,<unused>;miopenConvolutionFwdAlgoWinograd:ConvBinWinogradRxSf3x2,0.383838,0,miopenConvolutionFwdAlgoWinograd,<unused>;miopenConvolutionFwdAlgoGEMM:GemmFwd1x1_0_1,0.314478,0,miopenConvolutionFwdAlgoGEMM,<unused>
48-35-35-5x5-64-35-35-32-2x2-1x1-1x1-0-NCHW-FP16-F=miopenConvolutionFwdAlgoImplicitGEMM:ConvHipImplicitGemmV4R1Fwd,0.569157,0,miopenConvolutionFwdAlgoImplicitGEMM,<unused>;miopenConvolutionFwdAlgoDirect:ConvOclDirectFwd,9.36856,0,miopenConvolutionFwdAlgoDirect,<unused>;miopenConvolutionFwdAlgoWinograd:ConvBinWinogradRxSf2x3g1,0.717636,0,miopenConvolutionFwdAlgoWinograd,<unused>;miopenConvolutionFwdAlgoGEMM:GemmFwdRest,7.79766,2940000,miopenConvolutionFwdAlgoGEMM,<unused>
64-35-35-3x3-96-35-35-32-1x1-1x1-1x1-0-NCHW-FP16-F=miopenConvolutionFwdAlgoImplicitGEMM:ConvHipImplicitGemmV4R1Fwd,0.464077,0,miopenConvolutionFwdAlgoImplicitGEMM,<unused>;miopenConvolutionFwdAlgoDirect:ConvOclDirectFwd,11.2278,0,miopenConvolutionFwdAlgoDirect,<unused>;miopenConvolutionFwdAlgoWinograd:ConvBinWinogradRxSf2x3g1,0.440398,0,miopenConvolutionFwdAlgoWinograd,<unused>;miopenConvolutionFwdAlgoGEMM:GemmFwdRest,5.84438,1411200,miopenConvolutionFwdAlgoGEMM,<unused>
96-35-35-3x3-96-35-35-32-1x1-1x1-1x1-0-NCHW-FP16-F=miopenConvolutionFwdAlgoImplicitGEMM:ConvHipImplicitGemmV4R1Fwd,0.682837,0,miopenConvolutionFwdAlgoImplicitGEMM,<unused>;miopenConvolutionFwdAlgoDirect:ConvOclDirectFwd,8.1664,0,miopenConvolutionFwdAlgoDirect,<unused>;miopenConvolutionFwdAlgoWinograd:ConvBinWinogradRxSf2x3g1,0.596437,0,miopenConvolutionFwdAlgoWinograd,<unused>;miopenConvolutionFwdAlgoGEMM:GemmFwdRest,6.15162,2116800,miopenConvolutionFwdAlgoGEMM,<unused>
192-35-35-1x1-32-35-35-32-0x0-1x1-1x1-0-NCHW-FP16-F=miopenConvolutionFwdAlgoImplicitGEMM:ConvHipImplicitGemmV4R1Fwd,0.412158,0,miopenConvolutionFwdAlgoImplicitGEMM,<unused>;miopenConvolutionFwdAlgoDirect:ConvDirectNaiveConvFwd,11.5529,0,miopenConvolutionFwdAlgoDirect,<unused>;miopenConvolutionFwdAlgoWinograd:ConvBinWinogradRxSf3x2,0.233119,0,miopenConvolutionFwdAlgoWinograd,<unused>;miopenConvolutionFwdAlgoGEMM:GemmFwd1x1_0_1,0.172439,0,miopenConvolutionFwdAlgoGEMM,<unused>
256-35-35-1x1-128-35-35-32-0x0-1x1-1x1-0-NCHW-FP16-F=miopenConvolutionFwdAlgoImplicitGEMM:ConvHipImplicitGemmV4R1Fwd,0.498598,0,miopenConvolutionFwdAlgoImplicitGEMM,<unused>;miopenConvolutionFwdAlgoDirect:ConvDirectNaiveConvFwd,16.2025,0,miopenConvolutionFwdAlgoDirect,<unused>;miopenConvolutionFwdAlgoWinograd:ConvBinWinogradRxSf3x2,0.877196,0,miopenConvolutionFwdAlgoWinograd,<unused>;miopenConvolutionFwdAlgoGEMM:GemmFwd1x1_0_1,0.468038,0,miopenConvolutionFwdAlgoGEMM,<unused>
256-35-35-1x1-48-35-35-32-0x0-1x1-1x1-0-NCHW-FP16-F=miopenConvolutionFwdAlgoDirect:ConvDirectNaiveConvFwd,10.8658,0,miopenConvolutionFwdAlgoDirect,<unused>;miopenConvolutionFwdAlgoWinograd:ConvBinWinogradRxSf3x2,0.473878,0,miopenConvolutionFwdAlgoWinograd,<unused>;miopenConvolutionFwdAlgoGEMM:GemmFwd1x1_0_1,0.400678,0,miopenConvolutionFwdAlgoGEMM,<unused>
256-35-35-1x1-64-35-35-32-0x0-1x1-1x1-0-NCHW-FP16-F=miopenConvolutionFwdAlgoImplicitGEMM:ConvHipImplicitGemmV4R1Fwd,0.1542,0,miopenConvolutionFwdAlgoImplicitGEMM,<unused>;miopenConvolutionFwdAlgoDirect:ConvDirectNaiveConvFwd,12.4377,0,miopenConvolutionFwdAlgoDirect,<unused>;miopenConvolutionFwdAlgoWinograd:ConvBinWinogradRxSf3x2,0.479078,0,miopenConvolutionFwdAlgoWinograd,<unused>;miopenConvolutionFwdAlgoGEMM:GemmFwd1x1_0_1,0.258359,0,miopenConvolutionFwdAlgoGEMM,<unused>
288-35-35-1x1-128-35-35-32-0x0-1x1-1x1-0-NCHW-FP16-F=miopenConvolutionFwdAlgoImplicitGEMM:ConvHipImplicitGemmV4R1Fwd,0.303438,0,miopenConvolutionFwdAlgoImplicitGEMM,<unused>;miopenConvolutionFwdAlgoDirect:ConvDirectNaiveConvFwd,14,0,miopenConvolutionFwdAlgoDirect,<unused>;miopenConvolutionFwdAlgoWinograd:ConvBinWinogradRxSf2x3g1,1.97207,0,miopenConvolutionFwdAlgoWinograd,<unused>;miopenConvolutionFwdAlgoGEMM:GemmFwd1x1_0_1,0.523358,0,miopenConvolutionFwdAlgoGEMM,<unused>
288-35-35-1x1-48-35-35-32-0x0-1x1-1x1-0-NCHW-FP16-F=miopenConvolutionFwdAlgoDirect:ConvDirectNaiveConvFwd,13.9858,0,miopenConvolutionFwdAlgoDirect,<unused>;miopenConvolutionFwdAlgoWinograd:ConvBinWinogradRxSf3x2,0.516838,0,miopenConvolutionFwdAlgoWinograd,<unused>;miopenConvolutionFwdAlgoGEMM:GemmFwd1x1_0_1,0.449678,0,miopenConvolutionFwdAlgoGEMM,<unused>
288-35-35-1x1-64-35-35-32-0x0-1x1-1x1-0-NCHW-FP16-F=miopenConvolutionFwdAlgoImplicitGEMM:ConvHipImplicitGemmV4R1Fwd,0.14612,0,miopenConvolutionFwdAlgoImplicitGEMM,<unused>;miopenConvolutionFwdAlgoDirect:ConvDirectNaiveConvFwd,15.1464,0,miopenConvolutionFwdAlgoDirect,<unused>;miopenConvolutionFwdAlgoWinograd:ConvBinWinogradRxSf3x2,0.517478,0,miopenConvolutionFwdAlgoWinograd,<unused>;miopenConvolutionFwdAlgoGEMM:GemmFwd1x1_0_1,0.287239,0,miopenConvolutionFwdAlgoGEMM,<unused>
288-35-35-3x3-384-17-17-32-0x0-2x2-1x1-0-NCHW-FP16-F=miopenConvolutionFwdAlgoImplicitGEMM:ConvHipImplicitGemmV4R1Fwd,1.68899,0,miopenConvolutionFwdAlgoImplicitGEMM,<unused>;miopenConvolutionFwdAlgoDirect:ConvOclDirectFwdGen,43.1289,0,miopenConvolutionFwdAlgoDirect,<unused>;miopenConvolutionFwdAlgoWinograd:ConvBinWinogradRxSf2x3g1,5.98293,0,miopenConvolutionFwdAlgoWinograd,<unused>;miopenConvolutionFwdAlgoGEMM:GemmFwdRest,14.8901,1498176,miopenConvolutionFwdAlgoGEMM,<unused>
96-35-35-3x3-96-17-17-32-0x0-2x2-1x1-0-NCHW-FP16-F=miopenConvolutionFwdAlgoImplicitGEMM:ConvHipImplicitGemmV4R1Fwd,0.1768,0,miopenConvolutionFwdAlgoImplicitGEMM,<unused>;miopenConvolutionFwdAlgoDirect:ConvDirectNaiveConvFwd,5.62082,0,miopenConvolutionFwdAlgoDirect,<unused>;miopenConvolutionFwdAlgoWinograd:ConvBinWinogradRxSf2x3g1,0.636157,0,miopenConvolutionFwdAlgoWinograd,<unused>;miopenConvolutionFwdAlgoGEMM:GemmFwdRest,9.00733,499392,miopenConvolutionFwdAlgoGEMM,<unused>
768-17-17-1x1-256-17-17-32-0x0-1x1-1x1-0-NCHW-FP16-F=miopenConvolutionFwdAlgoImplicitGEMM:ConvHipImplicitGemmV4R1Fwd,0.455679,0,miopenConvolutionFwdAlgoImplicitGEMM,<unused>;miopenConvolutionFwdAlgoDirect:ConvDirectNaiveConvFwd,17.2117,0,miopenConvolutionFwdAlgoDirect,<unused>;miopenConvolutionFwdAlgoWinograd:ConvBinWinogradRxSf2x3g1,2.50591,0,miopenConvolutionFwdAlgoWinograd,<unused>;miopenConvolutionFwdAlgoGEMM:GemmFwd1x1_0_1,0.833476,0,miopenConvolutionFwdAlgoGEMM,<unused>
768-17-17-1x1-192-17-17-32-0x0-1x1-1x1-0-NCHW-FP16-F=miopenConvolutionFwdAlgoImplicitGEMM:ConvHipImplicitGemmV4R1Fwd,0.345959,0,miopenConvolutionFwdAlgoImplicitGEMM,<unused>;miopenConvolutionFwdAlgoDirect:ConvDirectNaiveConvFwd,15.904,0,miopenConvolutionFwdAlgoDirect,<unused>;miopenConvolutionFwdAlgoWinograd:ConvBinWinogradRxSf3x2,0.891157,0,miopenConvolutionFwdAlgoWinograd,<unused>;miopenConvolutionFwdAlgoGEMM:GemmFwd1x1_0_1,0.620358,0,miopenConvolutionFwdAlgoGEMM,<unused>
128-17-17-1x7-128-17-17-32-0x3-1x1-1x1-0-NCHW-FP16-F=miopenConvolutionFwdAlgoImplicitGEMM:ConvHipImplicitGemmV4R1Fwd,0.240719,0,miopenConvolutionFwdAlgoImplicitGEMM,<unused>;miopenConvolutionFwdAlgoDirect:ConvDirectNaiveConvFwd,12.8668,0,miopenConvolutionFwdAlgoDirect,<unused>;miopenConvolutionFwdAlgoWinograd:ConvBinWinogradRxSf3x2,0.455318,0,miopenConvolutionFwdAlgoWinograd,<unused>;miopenConvolutionFwdAlgoGEMM:GemmFwdRest,9.86493,517888,miopenConvolutionFwdAlgoGEMM,<unused>
128-17-17-7x1-192-17-17-32-3x0-1x1-1x1-0-NCHW-FP16-F=miopenConvolutionFwdAlgoImplicitGEMM:ConvHipImplicitGemmV4R1Fwd,0.331679,0,miopenConvolutionFwdAlgoImplicitGEMM,<unused>;miopenConvolutionFwdAlgoDirect:ConvDirectNaiveConvFwd,19.0672,0,miopenConvolutionFwdAlgoDirect,<unused>;miopenConvolutionFwdAlgoWinograd:ConvBinWinogradRxSf3x2,0.649997,0,miopenConvolutionFwdAlgoWinograd,<unused>;miopenConvolutionFwdAlgoGEMM:GemmFwdRest,6.60733,517888,miopenConvolutionFwdAlgoGEMM,<unused>
128-17-17-7x1-128-17-17-32-3x0-1x1-1x1-0-NCHW-FP16-F=miopenConvolutionFwdAlgoImplicitGEMM:ConvHipImplicitGemmV4R1Fwd,0.232559,0,miopenConvolutionFwdAlgoImplicitGEMM,<unused>;miopenConvolutionFwdAlgoDirect:ConvDirectNaiveConvFwd,18.0208,0,miopenConvolutionFwdAlgoDirect,<unused>;miopenConvolutionFwdAlgoWinograd:ConvBinWinogradRxSf3x2,0.456758,0,miopenConvolutionFwdAlgoWinograd,<unused>;miopenConvolutionFwdAlgoGEMM:GemmFwdRest,9.30045,517888,miopenConvolutionFwdAlgoGEMM,<unused>
128-17-17-1x7-192-17-17-32-0x3-1x1-1x1-0-NCHW-FP16-F=miopenConvolutionFwdAlgoImplicitGEMM:ConvHipImplicitGemmV4R1Fwd,0.345238,0,miopenConvolutionFwdAlgoImplicitGEMM,<unused>;miopenConvolutionFwdAlgoDirect:ConvDirectNaiveConvFwd,15.8695,0,miopenConvolutionFwdAlgoDirect,<unused>;miopenConvolutionFwdAlgoWinograd:ConvBinWinogradRxSf3x2,0.641355,0,miopenConvolutionFwdAlgoWinograd,<unused>;miopenConvolutionFwdAlgoGEMM:GemmFwdRest,6.51766,517888,miopenConvolutionFwdAlgoGEMM,<unused>
768-17-17-1x1-320-17-17-32-0x0-1x1-1x1-0-NCHW-FP16-F=miopenConvolutionFwdAlgoImplicitGEMM:ConvHipImplicitGemmV4R1Fwd,0.566596,0,miopenConvolutionFwdAlgoImplicitGEMM,<unused>;miopenConvolutionFwdAlgoDirect:ConvDirectNaiveConvFwd,21.2606,0,miopenConvolutionFwdAlgoDirect,<unused>;miopenConvolutionFwdAlgoWinograd:ConvBinWinogradRxSf2x3g1,1.64899,0,miopenConvolutionFwdAlgoWinograd,<unused>;miopenConvolutionFwdAlgoGEMM:GemmFwd1x1_0_1,1.04479,0,miopenConvolutionFwdAlgoGEMM,<unused>
160-17-17-1x7-160-17-17-32-0x3-1x1-1x1-0-NCHW-FP16-F=miopenConvolutionFwdAlgoImplicitGEMM:ConvHipImplicitGemmV4R1Fwd,0.367917,0,miopenConvolutionFwdAlgoImplicitGEMM,<unused>;miopenConvolutionFwdAlgoDirect:ConvDirectNaiveConvFwd,14.9254,0,miopenConvolutionFwdAlgoDirect,<unused>;miopenConvolutionFwdAlgoWinograd:ConvBinWinogradRxSf2x3g1,1.44351,0,miopenConvolutionFwdAlgoWinograd,<unused>;miopenConvolutionFwdAlgoGEMM:GemmFwdRest,10.7967,647360,miopenConvolutionFwdAlgoGEMM,<unused>
160-17-17-7x1-192-17-17-32-3x0-1x1-1x1-0-NCHW-FP16-F=miopenConvolutionFwdAlgoImplicitGEMM:ConvHipImplicitGemmV4R1Fwd,0.420917,0,miopenConvolutionFwdAlgoImplicitGEMM,<unused>;miopenConvolutionFwdAlgoDirect:ConvDirectNaiveConvFwd,22.1124,0,miopenConvolutionFwdAlgoDirect,<unused>;miopenConvolutionFwdAlgoWinograd:ConvBinWinogradRxSf3x2,0.774873,0,miopenConvolutionFwdAlgoWinograd,<unused>;miopenConvolutionFwdAlgoGEMM:GemmFwdRest,11.5468,647360,miopenConvolutionFwdAlgoGEMM,<unused>
160-17-17-7x1-160-17-17-32-3x0-1x1-1x1-0-NCHW-FP16-F=miopenConvolutionFwdAlgoImplicitGEMM:ConvHipImplicitGemmV4R1Fwd,0.356837,0,miopenConvolutionFwdAlgoImplicitGEMM,<unused>;miopenConvolutionFwdAlgoDirect:ConvDirectNaiveConvFwd,19.3801,0,miopenConvolutionFwdAlgoDirect,<unused>;miopenConvolutionFwdAlgoWinograd:ConvBinWinogradRxSf3x2,0.779074,0,miopenConvolutionFwdAlgoWinograd,<unused>;miopenConvolutionFwdAlgoGEMM:GemmFwdRest,11.5646,647360,miopenConvolutionFwdAlgoGEMM,<unused>
160-17-17-1x7-192-17-17-32-0x3-1x1-1x1-0-NCHW-FP16-F=miopenConvolutionFwdAlgoImplicitGEMM:ConvHipImplicitGemmV4R1Fwd,0.432476,0,miopenConvolutionFwdAlgoImplicitGEMM,<unused>;miopenConvolutionFwdAlgoDirect:ConvDirectNaiveConvFwd,16.7495,0,miopenConvolutionFwdAlgoDirect,<unused>;miopenConvolutionFwdAlgoWinograd:ConvBinWinogradRxSf3x2,0.773313,0,miopenConvolutionFwdAlgoWinograd,<unused>;miopenConvolutionFwdAlgoGEMM:GemmFwdRest,10.7454,647360,miopenConvolutionFwdAlgoGEMM,<unused>
768-17-17-1x1-576-17-17-32-0x0-1x1-1x1-0-NCHW-FP16-F=miopenConvolutionFwdAlgoImplicitGEMM:ConvHipImplicitGemmV4R1Fwd,0.967511,0,miopenConvolutionFwdAlgoImplicitGEMM,<unused>;miopenConvolutionFwdAlgoDirect:ConvDirectNaiveConvFwd,37.7682,0,miopenConvolutionFwdAlgoDirect,<unused>;miopenConvolutionFwdAlgoWinograd:ConvBinWinogradRxSf2x3g1,1.34207,0,miopenConvolutionFwdAlgoWinograd,<unused>;miopenConvolutionFwdAlgoGEMM:GemmFwd1x1_0_1,1.69711,0,miopenConvolutionFwdAlgoGEMM,<unused>
192-17-17-1x7-192-17-17-32-0x3-1x1-1x1-0-NCHW-FP16-F=miopenConvolutionFwdAlgoImplicitGEMM:ConvHipImplicitGemmV4R1Fwd,0.518556,0,miopenConvolutionFwdAlgoImplicitGEMM,<unused>;miopenConvolutionFwdAlgoDirect:ConvDirectNaiveConvFwd,19.688,0,miopenConvolutionFwdAlgoDirect,<unused>;miopenConvolutionFwdAlgoWinograd:ConvBinWinogradRxSf3x2,0.899632,0,miopenConvolutionFwdAlgoWinograd,<unused>;miopenConvolutionFwdAlgoGEMM:GemmFwdRest,5.7369,776832,miopenConvolutionFwdAlgoGEMM,<unused>
192-17-17-7x1-192-17-17-32-3x0-1x1-1x1-0-NCHW-FP16-F=miopenConvolutionFwdAlgoImplicitGEMM:ConvHipImplicitGemmV4R1Fwd,0.503155,0,miopenConvolutionFwdAlgoImplicitGEMM,<unused>;miopenConvolutionFwdAlgoDirect:ConvDirectNaiveConvFwd,23.6645,0,miopenConvolutionFwdAlgoDirect,<unused>;miopenConvolutionFwdAlgoWinograd:ConvBinWinogradRxSf2x3g1,1.52483,0,miopenConvolutionFwdAlgoWinograd,<unused>;miopenConvolutionFwdAlgoGEMM:GemmFwdRest,5.90586,776832,miopenConvolutionFwdAlgoGEMM,<unused>
768-17-17-1x1-384-17-17-32-0x0-1x1-1x1-0-NCHW-FP16-F=miopenConvolutionFwdAlgoImplicitGEMM:ConvHipImplicitGemmV4R1Fwd,0.640954,0,miopenConvolutionFwdAlgoImplicitGEMM,<unused>;miopenConvolutionFwdAlgoDirect:ConvDirectNaiveConvFwd,25.403,0,miopenConvolutionFwdAlgoDirect,<unused>;miopenConvolutionFwdAlgoWinograd:ConvBinWinogradRxSf2x3g1,2.73753,0,miopenConvolutionFwdAlgoWinograd,<unused>;miopenConvolutionFwdAlgoGEMM:GemmFwd1x1_0_1,1.19487,0,miopenConvolutionFwdAlgoGEMM,<unused>
192-17-17-3x3-320-8-8-32-0x0-2x2-1x1-0-NCHW-FP16-F=miopenConvolutionFwdAlgoImplicitGEMM:ConvHipImplicitGemmV4R1Fwd,0.252198,0,miopenConvolutionFwdAlgoImplicitGEMM,<unused>;miopenConvolutionFwdAlgoDirect:ConvDirectNaiveConvFwd,7.29001,0,miopenConvolutionFwdAlgoDirect,<unused>;miopenConvolutionFwdAlgoWinograd:ConvBinWinogradRxSf2x3g1,0.927671,0,miopenConvolutionFwdAlgoWinograd,<unused>;miopenConvolutionFwdAlgoGEMM:GemmFwdRest,8.97395,221184,miopenConvolutionFwdAlgoGEMM,<unused>
192-17-17-3x3-192-8-8-32-0x0-2x2-1x1-0-NCHW-FP16-F=miopenConvolutionFwdAlgoImplicitGEMM:ConvHipImplicitGemmV4R1Fwd,0.183599,0,miopenConvolutionFwdAlgoImplicitGEMM,<unused>;miopenConvolutionFwdAlgoDirect:ConvDirectNaiveConvFwd,4.63844,0,miopenConvolutionFwdAlgoDirect,<unused>;miopenConvolutionFwdAlgoWinograd:ConvBinWinogradRxSf2x3g1,0.617875,0,miopenConvolutionFwdAlgoWinograd,<unused>;miopenConvolutionFwdAlgoGEMM:GemmFwdRest,8.9983,221184,miopenConvolutionFwdAlgoGEMM,<unused>
1280-8-8-1x1-320-8-8-32-0x0-1x1-1x1-0-NCHW-FP16-F=miopenConvolutionFwdAlgoImplicitGEMM:ConvHipImplicitGemmV4R1Fwd,0.186478,0,miopenConvolutionFwdAlgoImplicitGEMM,<unused>;miopenConvolutionFwdAlgoDirect:ConvDirectNaiveConvFwd,9.83279,0,miopenConvolutionFwdAlgoDirect,<unused>;miopenConvolutionFwdAlgoWinograd:ConvBinWinogradRxSf2x3g1,1.41759,0,miopenConvolutionFwdAlgoWinograd,<unused>;miopenConvolutionFwdAlgoGEMM:GemmFwd1x1_0_1,0.365557,0,miopenConvolutionFwdAlgoGEMM,<unused>
1280-8-8-1x1-384-8-8-32-0x0-1x1-1x1-0-NCHW-FP16-F=miopenConvolutionFwdAlgoImplicitGEMM:ConvHipImplicitGemmV4R1Fwd,0.217798,0,miopenConvolutionFwdAlgoImplicitGEMM,<unused>;miopenConvolutionFwdAlgoDirect:ConvDirectNaiveConvFwd,11.291,0,miopenConvolutionFwdAlgoDirect,<unused>;miopenConvolutionFwdAlgoWinograd:ConvBinWinogradRxSf2x3g1,1.41735,0,miopenConvolutionFwdAlgoWinograd,<unused>;miopenConvolutionFwdAlgoGEMM:GemmFwd1x1_0_1,0.479236,0,miopenConvolutionFwdAlgoGEMM,<unused>
384-8-8-1x3-384-8-8-32-0x1-1x1-1x1-0-NCHW-FP16-F=miopenConvolutionFwdAlgoImplicitGEMM:ConvHipImplicitGemmV4R1Fwd,0.197918,0,miopenConvolutionFwdAlgoImplicitGEMM,<unused>;miopenConvolutionFwdAlgoDirect:ConvDirectNaiveConvFwd,15.5828,0,miopenConvolutionFwdAlgoDirect,<unused>;miopenConvolutionFwdAlgoWinograd:ConvBinWinogradRxSf2x3g1,0.458355,0,miopenConvolutionFwdAlgoWinograd,<unused>;miopenConvolutionFwdAlgoGEMM:GemmFwdRest,7.19859,147456,miopenConvolutionFwdAlgoGEMM,<unused>
384-8-8-3x1-384-8-8-32-1x0-1x1-1x1-0-NCHW-FP16-F=miopenConvolutionFwdAlgoImplicitGEMM:ConvHipImplicitGemmV4R1Fwd,0.189718,0,miopenConvolutionFwdAlgoImplicitGEMM,<unused>;miopenConvolutionFwdAlgoDirect:ConvDirectNaiveConvFwd,17.2168,0,miopenConvolutionFwdAlgoDirect,<unused>;miopenConvolutionFwdAlgoWinograd:ConvBinWinogradRxSf2x3g1,0.458836,0,miopenConvolutionFwdAlgoWinograd,<unused>;miopenConvolutionFwdAlgoGEMM:GemmFwdRest,7.39955,147456,miopenConvolutionFwdAlgoGEMM,<unused>
1280-8-8-1x1-448-8-8-32-0x0-1x1-1x1-0-NCHW-FP16-F=miopenConvolutionFwdAlgoImplicitGEMM:ConvHipImplicitGemmV4R1Fwd,0.256878,0,miopenConvolutionFwdAlgoImplicitGEMM,<unused>;miopenConvolutionFwdAlgoDirect:ConvDirectNaiveConvFwd,14.7878,0,miopenConvolutionFwdAlgoDirect,<unused>;miopenConvolutionFwdAlgoWinograd:ConvBinWinogradRxSf3x2,0.964472,0,miopenConvolutionFwdAlgoWinograd,<unused>;miopenConvolutionFwdAlgoGEMM:GemmFwd1x1_0_1,0.599955,0,miopenConvolutionFwdAlgoGEMM,<unused>
448-8-8-3x3-384-8-8-32-1x1-1x1-1x1-0-NCHW-FP16-F=miopenConvolutionFwdAlgoImplicitGEMM:ConvHipImplicitGemmV4R1Fwd,0.798393,0,miopenConvolutionFwdAlgoImplicitGEMM,<unused>;miopenConvolutionFwdAlgoDirect:ConvOclDirectFwd,9.96472,0,miopenConvolutionFwdAlgoDirect,<unused>;miopenConvolutionFwdAlgoWinograd:ConvBinWinogradRxSf2x3g1,0.526555,0,miopenConvolutionFwdAlgoWinograd,<unused>;miopenConvolutionFwdAlgoGEMM:GemmFwdRest,5.77661,516096,miopenConvolutionFwdAlgoGEMM,<unused>
1280-8-8-1x1-192-8-8-32-0x0-1x1-1x1-0-NCHW-FP16-F=miopenConvolutionFwdAlgoImplicitGEMM:ConvHipImplicitGemmV4R1Fwd,0.138919,0,miopenConvolutionFwdAlgoImplicitGEMM,<unused>;miopenConvolutionFwdAlgoDirect:ConvDirectNaiveConvFwd,9.98983,0,miopenConvolutionFwdAlgoDirect,<unused>;miopenConvolutionFwdAlgoWinograd:ConvBinWinogradRxSf3x2,0.516276,0,miopenConvolutionFwdAlgoWinograd,<unused>;miopenConvolutionFwdAlgoGEMM:GemmFwd1x1_0_1,0.304398,0,miopenConvolutionFwdAlgoGEMM,<unused>
2048-8-8-1x1-320-8-8-32-0x0-1x1-1x1-0-NCHW-FP16-F=miopenConvolutionFwdAlgoImplicitGEMM:ConvHipImplicitGemmV4R1Fwd,0.342038,0,miopenConvolutionFwdAlgoImplicitGEMM,<unused>;miopenConvolutionFwdAlgoDirect:ConvDirectNaiveConvFwd,13.4978,0,miopenConvolutionFwdAlgoDirect,<unused>;miopenConvolutionFwdAlgoWinograd:ConvBinWinogradRxSf2x3g1,2.22087,0,miopenConvolutionFwdAlgoWinograd,<unused>;miopenConvolutionFwdAlgoGEMM:GemmFwd1x1_0_1,0.581116,0,miopenConvolutionFwdAlgoGEMM,<unused>
2048-8-8-1x1-384-8-8-32-0x0-1x1-1x1-0-NCHW-FP16-F=miopenConvolutionFwdAlgoImplicitGEMM:ConvHipImplicitGemmV4R1Fwd,0.565597,0,miopenConvolutionFwdAlgoImplicitGEMM,<unused>;miopenConvolutionFwdAlgoDirect:ConvDirectNaiveConvFwd,14.0557,0,miopenConvolutionFwdAlgoDirect,<unused>;miopenConvolutionFwdAlgoWinograd:ConvBinWinogradRxSf2x3g1,2.21839,0,miopenConvolutionFwdAlgoWinograd,<unused>;miopenConvolutionFwdAlgoGEMM:GemmFwd1x1_0_1,0.754716,0,miopenConvolutionFwdAlgoGEMM,<unused>
2048-8-8-1x1-448-8-8-32-0x0-1x1-1x1-0-NCHW-FP16-F=miopenConvolutionFwdAlgoImplicitGEMM:ConvHipImplicitGemmV4R1Fwd,0.565077,0,miopenConvolutionFwdAlgoImplicitGEMM,<unused>;miopenConvolutionFwdAlgoDirect:ConvDirectNaiveConvFwd,18.6296,0,miopenConvolutionFwdAlgoDirect,<unused>;miopenConvolutionFwdAlgoWinograd:ConvBinWinogradRxSf2x3g1,2.56707,0,miopenConvolutionFwdAlgoWinograd,<unused>;miopenConvolutionFwdAlgoGEMM:GemmFwd1x1_0_1,0.942675,0,miopenConvolutionFwdAlgoGEMM,<unused>
2048-8-8-1x1-192-8-8-32-0x0-1x1-1x1-0-NCHW-FP16-F=miopenConvolutionFwdAlgoImplicitGEMM:ConvHipImplicitGemmV4R1Fwd,0.219599,0,miopenConvolutionFwdAlgoImplicitGEMM,<unused>;miopenConvolutionFwdAlgoDirect:ConvDirectNaiveConvFwd,15.6737,0,miopenConvolutionFwdAlgoDirect,<unused>;miopenConvolutionFwdAlgoWinograd:ConvBinWinogradRxSf2x3g1,1.49727,0,miopenConvolutionFwdAlgoWinograd,<unused>;miopenConvolutionFwdAlgoGEMM:GemmFwd1x1_0_1,0.467758,0,miopenConvolutionFwdAlgoGEMM,<unused>
3-224-224-3x3-64-224-224-16-1x1-1x1-1x1-0-NCHW-FP32-F=miopenConvolutionFwdAlgoDirect:ConvOclDirectFwd,1.32339,0,miopenConvolutionFwdAlgoDirect,<unused>;miopenConvolutionFwdAlgoWinograd:ConvBinWinogradRxSf2x3g1,1.44595,0,miopenConvolutionFwdAlgoWinograd,<unused>;miopenConvolutionFwdAlgoGEMM:GemmFwdRest,7.87984,5419008,miopenConvolutionFwdAlgoGEMM,<unused>
64-224-224-3x3-64-224-224-16-1x1-1x1-1x1-0-NCHW-FP32-F=miopenConvolutionFwdAlgoImplicitGEMM:ConvHipImplicitGemmV4R4Fwd,4.16963,0,miopenConvolutionFwdAlgoImplicitGEMM,<unused>;miopenConvolutionFwdAlgoDirect:ConvOclDirectFwd,5.94334,0,miopenConvolutionFwdAlgoDirect,<unused>;miopenConvolutionFwdAlgoWinograd:ConvBinWinogradRxSf2x3g1,1.63703,0,miopenConvolutionFwdAlgoWinograd,<unused>;miopenConvolutionFwdAlgoGEMM:GemmFwdRest,41.7204,115605504,miopenConvolutionFwdAlgoGEMM,<unused>
64-112-112-3x3-128-112-112-16-1x1-1x1-1x1-0-NCHW-FP32-F=miopenConvolutionFwdAlgoImplicitGEMM:ConvHipImplicitGemmV4R4Fwd,2.22051,0,miopenConvolutionFwdAlgoImplicitGEMM,<unused>;miopenConvolutionFwdAlgoDirect:ConvOclDirectFwd,3.49749,0,miopenConvolutionFwdAlgoDirect,<unused>;miopenConvolutionFwdAlgoWinograd:ConvBinWinogradRxSf2x3g1,0.953213,0,miopenConvolutionFwdAlgoWinograd,<unused>;miopenConvolutionFwdAlgoGEMM:GemmFwdRest,34.7723,28901376,miopenConvolutionFwdAlgoGEMM,<unused>
128-112-112-3x3-128-112-112-16-1x1-1x1-1x1-0-NCHW-FP32-F=miopenConvolutionFwdAlgoImplicitGEMM:ConvHipImplicitGemmV4R4Fwd,3.69592,0,miopenConvolutionFwdAlgoImplicitGEMM,<unused>;miopenConvolutionFwdAlgoDirect:ConvOclDirectFwd,6.75279,0,miopenConvolutionFwdAlgoDirect,<unused>;miopenConvolutionFwdAlgoWinograd:ConvBinWinogradRxSf2x3g1,1.54022,0,miopenConvolutionFwdAlgoWinograd,<unused>;miopenConvolutionFwdAlgoGEMM:GemmFwdRest,59.664,57802752,miopenConvolutionFwdAlgoGEMM,<unused>
128-56-56-3x3-256-56-56-16-1x1-1x1-1x1-0-NCHW-FP32-F=miopenConvolutionFwdAlgoImplicitGEMM:ConvHipImplicitGemmV4R1Fwd,1.85998,0,miopenConvolutionFwdAlgoImplicitGEMM,<unused>;miopenConvolutionFwdAlgoDirect:ConvOclDirectFwd,3.87951,0,miopenConvolutionFwdAlgoDirect,<unused>;miopenConvolutionFwdAlgoWinograd:ConvBinWinogradRxSf2x3g1,1.00757,0,miopenConvolutionFwdAlgoWinograd,<unused>;miopenConvolutionFwdAlgoGEMM:GemmFwdRest,17.4747,14450688,miopenConvolutionFwdAlgoGEMM,<unused>
256-56-56-3x3-256-56-56-16-1x1-1x1-1x1-0-NCHW-FP32-F=miopenConvolutionFwdAlgoImplicitGEMM:ConvHipImplicitGemmV4R1Fwd,3.74707,0,miopenConvolutionFwdAlgoImplicitGEMM,<unused>;miopenConvolutionFwdAlgoDirect:ConvOclDirectFwd,7.31974,0,miopenConvolutionFwdAlgoDirect,<unused>;miopenConvolutionFwdAlgoWinograd:ConvBinWinogradRxSf2x3g1,1.72393,0,miopenConvolutionFwdAlgoWinograd,<unused>;miopenConvolutionFwdAlgoGEMM:GemmFwdRest,36.0201,28901376,miopenConvolutionFwdAlgoGEMM,<unused>
256-28-28-3x3-512-28-28-16-1x1-1x1-1x1-0-NCHW-FP32-F=miopenConvolutionFwdAlgoImplicitGEMM:ConvHipImplicitGemmV4R1Fwd,1.73889,0,miopenConvolutionFwdAlgoImplicitGEMM,<unused>;miopenConvolutionFwdAlgoDirect:ConvOclDirectFwd,3.53259,0,miopenConvolutionFwdAlgoDirect,<unused>;miopenConvolutionFwdAlgoWinograd:ConvBinWinogradRxSf2x3g1,0.858767,0,miopenConvolutionFwdAlgoWinograd,<unused>;miopenConvolutionFwdAlgoGEMM:GemmFwdRest,14.0641,7225344,miopenConvolutionFwdAlgoGEMM,<unused>
512-28-28-3x3-512-28-28-16-1x1-1x1-1x1-0-NCHW-FP32-F=miopenConvolutionFwdAlgoImplicitGEMM:ConvHipImplicitGemmV4R1Fwd,3.49171,0,miopenConvolutionFwdAlgoImplicitGEMM,<unused>;miopenConvolutionFwdAlgoDirect:ConvOclDirectFwd,6.64901,0,miopenConvolutionFwdAlgoDirect,<unused>;miopenConvolutionFwdAlgoWinograd:ConvBinWinogradRxSf2x3g1,1.49033,0,miopenConvolutionFwdAlgoWinograd,<unused>;miopenConvolutionFwdAlgoGEMM:GemmFwdRest,31.8806,14450688,miopenConvolutionFwdAlgoGEMM,<unused>
512-14-14-3x3-512-14-14-16-1x1-1x1-1x1-0-NCHW-FP32-F=miopenConvolutionFwdAlgoImplicitGEMM:ConvHipImplicitGemmV4R1Fwd,1.10573,0,miopenConvolutionFwdAlgoImplicitGEMM,<unused>;miopenConvolutionFwdAlgoDirect:ConvOclDirectFwd,3.54808,0,miopenConvolutionFwdAlgoDirect,<unused>;miopenConvolutionFwdAlgoWinograd:ConvBinWinogradRxSf2x3g1,1.9687,0,miopenConvolutionFwdAlgoWinograd,<unused>;miopenConvolutionFwdAlgoGEMM:GemmFwdRest,13.0228,3612672,miopenConvolutionFwdAlgoGEMM,<unused>
3-224-224-3x3-64-224-224-16-1x1-1x1-1x1-0-NCHW-FP16-F=miopenConvolutionFwdAlgoDirect:ConvOclDirectFwd,1.33997,0,miopenConvolutionFwdAlgoDirect,<unused>;miopenConvolutionFwdAlgoWinograd:ConvBinWinogradRxSf2x3g1,1.42177,0,miopenConvolutionFwdAlgoWinograd,<unused>;miopenConvolutionFwdAlgoGEMM:GemmFwdRest,6.09218,2709504,miopenConvolutionFwdAlgoGEMM,<unused>
64-224-224-3x3-64-224-224-16-1x1-1x1-1x1-0-NCHW-FP16-F=miopenConvolutionFwdAlgoImplicitGEMM:ConvHipImplicitGemmV4R1Fwd,6.89139,0,miopenConvolutionFwdAlgoImplicitGEMM,<unused>;miopenConvolutionFwdAlgoDirect:ConvOclDirectFwd,6.94747,0,miopenConvolutionFwdAlgoDirect,<unused>;miopenConvolutionFwdAlgoWinograd:ConvBinWinogradRxSf2x3g1,1.15261,0,miopenConvolutionFwdAlgoWinograd,<unused>;miopenConvolutionFwdAlgoGEMM:GemmFwdRest,32.861,57802752,miopenConvolutionFwdAlgoGEMM,<unused>
64-112-112-3x3-128-112-112-16-1x1-1x1-1x1-0-NCHW-FP16-F=miopenConvolutionFwdAlgoImplicitGEMM:ConvHipImplicitGemmV4R1Fwd,3.02489,0,miopenConvolutionFwdAlgoImplicitGEMM,<unused>;miopenConvolutionFwdAlgoDirect:ConvOclDirectFwd,3.99786,0,miopenConvolutionFwdAlgoDirect,<unused>;miopenConvolutionFwdAlgoWinograd:ConvBinWinogradRxSf2x3g1,2.47929,0,miopenConvolutionFwdAlgoWinograd,<unused>;miopenConvolutionFwdAlgoGEMM:GemmFwdRest,11.113,14450688,miopenConvolutionFwdAlgoGEMM,<unused>
128-112-112-3x3-128-112-112-16-1x1-1x1-1x1-0-NCHW-FP16-F=miopenConvolutionFwdAlgoImplicitGEMM:ConvHipImplicitGemmV4R1Fwd,6.15027,0,miopenConvolutionFwdAlgoImplicitGEMM,<unused>;miopenConvolutionFwdAlgoDirect:ConvOclDirectFwd,7.39007,0,miopenConvolutionFwdAlgoDirect,<unused>;miopenConvolutionFwdAlgoWinograd:ConvBinWinogradRxSf2x3g1,1.05152,0,miopenConvolutionFwdAlgoWinograd,<unused>;miopenConvolutionFwdAlgoGEMM:GemmFwdRest,28.6388,28901376,miopenConvolutionFwdAlgoGEMM,<unused>
128-56-56-3x3-256-56-56-16-1x1-1x1-1x1-0-NCHW-FP16-F=miopenConvolutionFwdAlgoImplicitGEMM:ConvHipImplicitGemmV4R1Fwd,2.65713,0,miopenConvolutionFwdAlgoImplicitGEMM,<unused>;miopenConvolutionFwdAlgoDirect:ConvOclDirectFwd,4.41534,0,miopenConvolutionFwdAlgoDirect,<unused>;miopenConvolutionFwdAlgoWinograd:ConvBinWinogradRxSf2x3g1,0.537722,0,miopenConvolutionFwdAlgoWinograd,<unused>;miopenConvolutionFwdAlgoGEMM:GemmFwdRest,9.14435,7225344,miopenConvolutionFwdAlgoGEMM,<unused>
256-56-56-3x3-256-56-56-16-1x1-1x1-1x1-0-NCHW-FP16-F=miopenConvolutionFwdAlgoImplicitGEMM:ConvHipImplicitGemmV4R1Fwd,5.79382,0,miopenConvolutionFwdAlgoImplicitGEMM,<unused>;miopenConvolutionFwdAlgoDirect:ConvOclDirectFwd,8.13055,0,miopenConvolutionFwdAlgoDirect,<unused>;miopenConvolutionFwdAlgoWinograd:ConvBinWinogradRxSf2x3g1,0.977244,0,miopenConvolutionFwdAlgoWinograd,<unused>;miopenConvolutionFwdAlgoGEMM:GemmFwdRest,16.9153,14450688,miopenConvolutionFwdAlgoGEMM,<unused>
256-28-28-3x3-512-28-28-16-1x1-1x1-1x1-0-NCHW-FP16-F=miopenConvolutionFwdAlgoImplicitGEMM:ConvHipImplicitGemmV4R1Fwd,2.59301,0,miopenConvolutionFwdAlgoImplicitGEMM,<unused>;miopenConvolutionFwdAlgoDirect:ConvOclDirectFwd,5.52238,0,miopenConvolutionFwdAlgoDirect,<unused>;miopenConvolutionFwdAlgoWinograd:ConvBinWinogradRxSf2x3g1,2.14165,0,miopenConvolutionFwdAlgoWinograd,<unused>;miopenConvolutionFwdAlgoGEMM:GemmFwdRest,9.65059,3612672,miopenConvolutionFwdAlgoGEMM,<unused>
512-28-28-3x3-512-28-28-16-1x1-1x1-1x1-0-NCHW-FP16-F=miopenConvolutionFwdAlgoImplicitGEMM:ConvHipImplicitGemmV4R1Fwd,5.1305,0,miopenConvolutionFwdAlgoImplicitGEMM,<unused>;miopenConvolutionFwdAlgoDirect:ConvOclDirectFwd,7.91458,0,miopenConvolutionFwdAlgoDirect,<unused>;miopenConvolutionFwdAlgoWinograd:ConvBinWinogradRxSf2x3g1,0.954283,0,miopenConvolutionFwdAlgoWinograd,<unused>;miopenConvolutionFwdAlgoGEMM:GemmFwdRest,17.0202,7225344,miopenConvolutionFwdAlgoGEMM,<unused>
512-14-14-3x3-512-14-14-16-1x1-1x1-1x1-0-NCHW-FP16-F=miopenConvolutionFwdAlgoImplicitGEMM:ConvHipImplicitGemmV4R1Fwd,1.48708,0,miopenConvolutionFwdAlgoImplicitGEMM,<unused>;miopenConvolutionFwdAlgoDirect:ConvOclDirectFwd,7.81089,0,miopenConvolutionFwdAlgoDirect,<unused>;miopenConvolutionFwdAlgoWinograd:ConvBinWinogradRxSf2x3g1,1.17268,0,miopenConvolutionFwdAlgoWinograd,<unused>;miopenConvolutionFwdAlgoGEMM:GemmFwdRest,9.30882,1806336,miopenConvolutionFwdAlgoGEMM,<unused>
3-299-299-3x3-32-149-149-16-0x0-2x2-1x1-0-NCHW-FP32-F=miopenConvolutionFwdAlgoDirect:ConvOclDirectFwd,0.662305,0,miopenConvolutionFwdAlgoDirect,<unused>;miopenConvolutionFwdAlgoWinograd:ConvBinWinogradRxSf2x3g1,0.686864,0,miopenConvolutionFwdAlgoWinograd,<unused>;miopenConvolutionFwdAlgoGEMM:GemmFwdRest,2.18936,2397708,miopenConvolutionFwdAlgoGEMM,<unused>
32-149-149-3x3-32-147-147-16-0x0-1x1-1x1-0-NCHW-FP32-F=miopenConvolutionFwdAlgoDirect:ConvOclDirectFwd,3.92252,0,miopenConvolutionFwdAlgoDirect,<unused>;miopenConvolutionFwdAlgoWinograd:ConvBinWinogradRxSf2x3g1,1.30677,0,miopenConvolutionFwdAlgoWinograd,<unused>;miopenConvolutionFwdAlgoGEMM:GemmFwdRest,8.56173,24893568,miopenConvolutionFwdAlgoGEMM,<unused>
32-147-147-3x3-64-147-147-16-1x1-1x1-1x1-0-NCHW-FP32-F=miopenConvolutionFwdAlgoDirect:ConvOclDirectFwd,1.80152,0,miopenConvolutionFwdAlgoDirect,<unused>;miopenConvolutionFwdAlgoWinograd:ConvBinWinogradRxSf2x3g1,1.41605,0,miopenConvolutionFwdAlgoWinograd,<unused>;miopenConvolutionFwdAlgoGEMM:GemmFwdRest,13.6752,24893568,miopenConvolutionFwdAlgoGEMM,<unused>
64-147-147-3x3-96-73-73-16-0x0-2x2-1x1-0-NCHW-FP32-F=miopenConvolutionFwdAlgoDirect:ConvOclDirectFwd,3.85673,0,miopenConvolutionFwdAlgoDirect,<unused>;miopenConvolutionFwdAlgoWinograd:ConvBinWinogradRxSf2x3g1,5.07266,0,miopenConvolutionFwdAlgoWinograd,<unused>;miopenConvolutionFwdAlgoGEMM:GemmFwdRest,8.93102,12278016,miopenConvolutionFwdAlgoGEMM,<unused>
160-73-73-1x1-128-73-73-16-0x0-1x1-1x1-0-NCHW-FP32-F=miopenConvolutionFwdAlgoDirect:ConvDirectNaiveConvFwd,15.7083,0,miopenConvolutionFwdAlgoDirect,<unused>;miopenConvolutionFwdAlgoWinograd:ConvBinWinogradRxSf2x3g1,3.1171,0,miopenConvolutionFwdAlgoWinograd,<unused>;miopenConvolutionFwdAlgoGEMM:GemmFwd1x1_0_1,0.912023,0,miopenConvolutionFwdAlgoGEMM,<unused>
64-73-73-3x3-96-71-71-16-0x0-1x1-1x1-0-NCHW-FP32-F=miopenConvolutionFwdAlgoDirect:ConvOclDirectFwd,3.06266,0,miopenConvolutionFwdAlgoDirect,<unused>;miopenConvolutionFwdAlgoWinograd:ConvBinWinogradRxSf2x3g1,1.28018,0,miopenConvolutionFwdAlgoWinograd,<unused>;miopenConvolutionFwdAlgoGEMM:GemmFwdRest,6.20467,11614464,miopenConvolutionFwdAlgoGEMM,<unused>
64-73-73-1x7-64-73-73-16-0x3-1x1-1x1-0-NCHW-FP32-F=miopenConvolutionFwdAlgoDirect:ConvDirectNaiveConvFwd,16.1715,0,miopenConvolutionFwdAlgoDirect,<unused>;miopenConvolutionFwdAlgoWinograd:ConvBinWinogradRxSf2x3g1,3.32326,0,miopenConvolutionFwdAlgoWinograd,<unused>;miopenConvolutionFwdAlgoGEMM:GemmFwdRest,4.19898,9549568,miopenConvolutionFwdAlgoGEMM,<unused>
64-73-73-7x1-64-73-73-16-3x0-1x1-1x1-0-NCHW-FP32-F=miopenConvolutionFwdAlgoDirect:ConvDirectNaiveConvFwd,23.3726,0,miopenConvolutionFwdAlgoDirect,<unused>;miopenConvolutionFwdAlgoWinograd:ConvBinWinogradRxSf2x3g1,2.56219,0,miopenConvolutionFwdAlgoWinograd,<unused>;miopenConvolutionFwdAlgoGEMM:GemmFwdRest,4.44021,9549568,miopenConvolutionFwdAlgoGEMM,<unused>
192-71-71-3x3-192-35-35-16-0x0-2x2-1x1-0-NCHW-FP32-F=miopenConvolutionFwdAlgoDirect:ConvOclDirectFwd,4.54232,0,miopenConvolutionFwdAlgoDirect,<unused>;miopenConvolutionFwdAlgoWinograd:ConvBinWinogradRxSf2x3g1,4.9576,0,miopenConvolutionFwdAlgoWinograd,<unused>;miopenConvolutionFwdAlgoGEMM:GemmFwdRest,11.1275,8467200,miopenConvolutionFwdAlgoGEMM,<unused>
384-35-35-1x1-128-35-35-16-0x0-1x1-1x1-0-NCHW-FP32-F=miopenConvolutionFwdAlgoDirect:ConvDirectNaiveConvFwd,11.2156,0,miopenConvolutionFwdAlgoDirect,<unused>;miopenConvolutionFwdAlgoWinograd:ConvBinWinogradRxSf3x2,2.23568,0,miopenConvolutionFwdAlgoWinograd,<unused>;miopenConvolutionFwdAlgoGEMM:GemmFwd1x1_0_1,0.62431,0,miopenConvolutionFwdAlgoGEMM,<unused>
384-35-35-1x1-96-35-35-16-0x0-1x1-1x1-0-NCHW-FP32-F=miopenConvolutionFwdAlgoDirect:ConvDirectNaiveConvFwd,10.8377,0,miopenConvolutionFwdAlgoDirect,<unused>;miopenConvolutionFwdAlgoWinograd:ConvBinWinogradRxSf3x2,0.812906,0,miopenConvolutionFwdAlgoWinograd,<unused>;miopenConvolutionFwdAlgoGEMM:GemmFwd1x1_0_1,0.637749,0,miopenConvolutionFwdAlgoGEMM,<unused>
64-35-35-3x3-96-35-35-16-1x1-1x1-1x1-0-NCHW-FP32-F=miopenConvolutionFwdAlgoDirect:ConvOclDirectFwd,3.83066,0,miopenConvolutionFwdAlgoDirect,<unused>;miopenConvolutionFwdAlgoWinograd:ConvBinWinogradRxSf2x3g1,0.361754,0,miopenConvolutionFwdAlgoWinograd,<unused>;miopenConvolutionFwdAlgoGEMM:GemmFwdRest,4.95733,2822400,miopenConvolutionFwdAlgoGEMM,<unused>
96-35-35-3x3-96-35-35-16-1x1-1x1-1x1-0-NCHW-FP32-F=miopenConvolutionFwdAlgoDirect:ConvOclDirectFwd,5.71103,0,miopenConvolutionFwdAlgoDirect,<unused>;miopenConvolutionFwdAlgoWinograd:ConvBinWinogradRxSf2x3g1,0.494072,0,miopenConvolutionFwdAlgoWinograd,<unused>;miopenConvolutionFwdAlgoGEMM:GemmFwdRest,4.13434,4233600,miopenConvolutionFwdAlgoGEMM,<unused>
384-35-35-3x3-384-17-17-16-0x0-2x2-1x1-0-NCHW-FP32-F=miopenConvolutionFwdAlgoDirect:ConvOclDirectFwd,4.81421,0,miopenConvolutionFwdAlgoDirect,<unused>;miopenConvolutionFwdAlgoWinograd:ConvBinWinogradRxSf2x3g1,4.83649,0,miopenConvolutionFwdAlgoWinograd,<unused>;miopenConvolutionFwdAlgoGEMM:GemmFwdRest,11.0993,3995136,miopenConvolutionFwdAlgoGEMM,<unused>
384-35-35-1x1-192-35-35-16-0x0-1x1-1x1-0-NCHW-FP32-F=miopenConvolutionFwdAlgoDirect:ConvDirectNaiveConvFwd,13.1859,0,miopenConvolutionFwdAlgoDirect,<unused>;miopenConvolutionFwdAlgoWinograd:ConvBinWinogradRxSf2x3g1,2.36521,0,miopenConvolutionFwdAlgoWinograd,<unused>;miopenConvolutionFwdAlgoGEMM:GemmFwd1x1_0_1,0.824948,0,miopenConvolutionFwdAlgoGEMM,<unused>
192-35-35-3x3-224-35-35-16-1x1-1x1-1x1-0-NCHW-FP32-F=miopenConvolutionFwdAlgoDirect:ConvOclDirectFwd,4.79045,0,miopenConvolutionFwdAlgoDirect,<unused>;miopenConvolutionFwdAlgoWinograd:ConvBinWinogradRxSf2x3g1,2.02053,0,miopenConvolutionFwdAlgoWinograd,<unused>;miopenConvolutionFwdAlgoGEMM:GemmFwdRest,15.1096,8467200,miopenConvolutionFwdAlgoGEMM,<unused>
224-35-35-3x3-256-17-17-16-0x0-2x2-1x1-0-NCHW-FP32-F=miopenConvolutionFwdAlgoDirect:ConvOclDirectFwd,5.36937,0,miopenConvolutionFwdAlgoDirect,<unused>;miopenConvolutionFwdAlgoWinograd:ConvBinWinogradRxSf2x3g1,2.9826,0,miopenConvolutionFwdAlgoWinograd,<unused>;miopenConvolutionFwdAlgoGEMM:GemmFwdRest,7.23064,2330496,miopenConvolutionFwdAlgoGEMM,<unused>
1024-17-17-1x1-768-17-17-16-0x0-1x1-1x1-0-NCHW-FP32-F=miopenConvolutionFwdAlgoDirect:ConvDirectNaiveConvFwd,33.8969,0,miopenConvolutionFwdAlgoDirect,<unused>;miopenConvolutionFwdAlgoWinograd:ConvBinWinogradRxSf2x3g1,1.86958,0,miopenConvolutionFwdAlgoWinograd,<unused>;miopenConvolutionFwdAlgoGEMM:GemmFwd1x1_0_1,2.68829,0,miopenConvolutionFwdAlgoGEMM,<unused>
192-17-17-1x7-224-17-17-16-0x3-1x1-1x1-0-NCHW-FP32-F=miopenConvolutionFwdAlgoDirect:ConvDirectNaiveConvFwd,12.2995,0,miopenConvolutionFwdAlgoDirect,<unused>;miopenConvolutionFwdAlgoWinograd:ConvBinWinogradRxSf2x3g1,1.97582,0,miopenConvolutionFwdAlgoWinograd,<unused>;miopenConvolutionFwdAlgoGEMM:GemmFwdRest,4.25336,1553664,miopenConvolutionFwdAlgoGEMM,<unused>
224-17-17-7x1-256-17-17-16-3x0-1x1-1x1-0-NCHW-FP32-F=miopenConvolutionFwdAlgoDirect:ConvDirectNaiveConvFwd,18.938,0,miopenConvolutionFwdAlgoDirect,<unused>;miopenConvolutionFwdAlgoWinograd:ConvBinWinogradRxSf2x3g1,2.19341,0,miopenConvolutionFwdAlgoWinograd,<unused>;miopenConvolutionFwdAlgoGEMM:GemmFwdRest,5.40086,1812608,miopenConvolutionFwdAlgoGEMM,<unused>
192-17-17-7x1-192-17-17-16-3x0-1x1-1x1-0-NCHW-FP32-F=miopenConvolutionFwdAlgoDirect:ConvDirectNaiveConvFwd,12.5049,0,miopenConvolutionFwdAlgoDirect,<unused>;miopenConvolutionFwdAlgoWinograd:ConvBinWinogradRxSf2x3g1,1.52734,0,miopenConvolutionFwdAlgoWinograd,<unused>;miopenConvolutionFwdAlgoGEMM:GemmFwdRest,4.10107,1553664,miopenConvolutionFwdAlgoGEMM,<unused>
224-17-17-7x1-224-17-17-16-3x0-1x1-1x1-0-NCHW-FP32-F=miopenConvolutionFwdAlgoDirect:ConvDirectNaiveConvFwd,14.6888,0,miopenConvolutionFwdAlgoDirect,<unused>;miopenConvolutionFwdAlgoWinograd:ConvBinWinogradRxSf2x3g1,1.7729,0,miopenConvolutionFwdAlgoWinograd,<unused>;miopenConvolutionFwdAlgoGEMM:GemmFwdRest,4.94586,1812608,miopenConvolutionFwdAlgoGEMM,<unused>
224-17-17-1x7-256-17-17-16-0x3-1x1-1x1-0-NCHW-FP32-F=miopenConvolutionFwdAlgoDirect:ConvDirectNaiveConvFwd,12.5858,0,miopenConvolutionFwdAlgoDirect,<unused>;miopenConvolutionFwdAlgoWinograd:ConvBinWinogradRxSf2x3g1,2.16709,0,miopenConvolutionFwdAlgoWinograd,<unused>;miopenConvolutionFwdAlgoGEMM:GemmFwdRest,5.65818,1812608,miopenConvolutionFwdAlgoGEMM,<unused>
1024-17-17-1x1-128-17-17-16-0x0-1x1-1x1-0-NCHW-FP32-F=miopenConvolutionFwdAlgoDirect:ConvDirectNaiveConvFwd,9.79708,0,miopenConvolutionFwdAlgoDirect,<unused>;miopenConvolutionFwdAlgoWinograd:ConvBinWinogradRxSf3x2,0.699912,0,miopenConvolutionFwdAlgoWinograd,<unused>;miopenConvolutionFwdAlgoGEMM:GemmFwd1x1_0_1,0.523234,0,miopenConvolutionFwdAlgoGEMM,<unused>
1024-17-17-1x1-192-17-17-16-0x0-1x1-1x1-0-NCHW-FP32-F=miopenConvolutionFwdAlgoDirect:ConvDirectNaiveConvFwd,8.97629,0,miopenConvolutionFwdAlgoDirect,<unused>;miopenConvolutionFwdAlgoWinograd:ConvBinWinogradRxSf2x3g1,2.61489,0,miopenConvolutionFwdAlgoWinograd,<unused>;miopenConvolutionFwdAlgoGEMM:GemmFwd1x1_0_1,0.672552,0,miopenConvolutionFwdAlgoGEMM,<unused>
192-17-17-3x3-192-8-8-16-0x0-2x2-1x1-0-NCHW-FP32-F=miopenConvolutionFwdAlgoImplicitGEMM:ConvHipImplicitGemmV4R1Fwd,0.126798,0,miopenConvolutionFwdAlgoImplicitGEMM,<unused>;miopenConvolutionFwdAlgoDirect:ConvOclDirectFwd,1.5213,0,miopenConvolutionFwdAlgoDirect,<unused>;miopenConvolutionFwdAlgoWinograd:ConvBinWinogradRxSf2x3g1,0.544874,0,miopenConvolutionFwdAlgoWinograd,<unused>;miopenConvolutionFwdAlgoGEMM:GemmFwdRest,3.68058,442368,miopenConvolutionFwdAlgoGEMM,<unused>
1024-17-17-1x1-256-17-17-16-0x0-1x1-1x1-0-NCHW-FP32-F=miopenConvolutionFwdAlgoDirect:ConvDirectNaiveConvFwd,11.6853,0,miopenConvolutionFwdAlgoDirect,<unused>;miopenConvolutionFwdAlgoWinograd:ConvBinWinogradRxSf2x3g1,2.90009,0,miopenConvolutionFwdAlgoWinograd,<unused>;miopenConvolutionFwdAlgoGEMM:GemmFwd1x1_0_1,0.98019,0,miopenConvolutionFwdAlgoGEMM,<unused>
256-17-17-1x7-256-17-17-16-0x3-1x1-1x1-0-NCHW-FP32-F=miopenConvolutionFwdAlgoDirect:ConvDirectNaiveConvFwd,14.3354,0,miopenConvolutionFwdAlgoDirect,<unused>;miopenConvolutionFwdAlgoWinograd:ConvBinWinogradRxSf2x3g1,3.09621,0,miopenConvolutionFwdAlgoWinograd,<unused>;miopenConvolutionFwdAlgoGEMM:GemmFwdRest,6.34166,2071552,miopenConvolutionFwdAlgoGEMM,<unused>
256-17-17-7x1-320-17-17-16-3x0-1x1-1x1-0-NCHW-FP32-F=miopenConvolutionFwdAlgoDirect:ConvDirectNaiveConvFwd,22.9533,0,miopenConvolutionFwdAlgoDirect,<unused>;miopenConvolutionFwdAlgoWinograd:ConvBinWinogradRxSf2x3g1,2.45177,0,miopenConvolutionFwdAlgoWinograd,<unused>;miopenConvolutionFwdAlgoGEMM:GemmFwdRest,7.20122,2071552,miopenConvolutionFwdAlgoGEMM,<unused>
320-17-17-3x3-320-8-8-16-0x0-2x2-1x1-0-NCHW-FP32-F=miopenConvolutionFwdAlgoImplicitGEMM:ConvHipImplicitGemmV4R4Fwd,0.225478,0,miopenConvolutionFwdAlgoImplicitGEMM,<unused>;miopenConvolutionFwdAlgoDirect:ConvOclDirectFwd,3.10557,0,miopenConvolutionFwdAlgoDirect,<unused>;miopenConvolutionFwdAlgoWinograd:ConvBinWinogradRxSf2x3g1,1.72486,0,miopenConvolutionFwdAlgoWinograd,<unused>;miopenConvolutionFwdAlgoGEMM:GemmFwdRest,5.68822,737280,miopenConvolutionFwdAlgoGEMM,<unused>
1536-8-8-1x1-768-8-8-16-0x0-1x1-1x1-0-NCHW-FP32-F=miopenConvolutionFwdAlgoImplicitGEMM:ConvHipImplicitGemmV4R4Fwd,0.210438,0,miopenConvolutionFwdAlgoImplicitGEMM,<unused>;miopenConvolutionFwdAlgoDirect:ConvDirectNaiveConvFwd,10.5544,0,miopenConvolutionFwdAlgoDirect,<unused>;miopenConvolutionFwdAlgoWinograd:ConvBinWinogradRxSf2x3g1,1.74762,0,miopenConvolutionFwdAlgoWinograd,<unused>;miopenConvolutionFwdAlgoGEMM:GemmFwd1x1_0_1,2.24778,0,miopenConvolutionFwdAlgoGEMM,<unused>
1536-8-8-1x1-256-8-8-16-0x0-1x1-1x1-0-NCHW-FP32-F=miopenConvolutionFwdAlgoImplicitGEMM:ConvHipImplicitGemmV4R4Fwd,0.091439,0,miopenConvolutionFwdAlgoImplicitGEMM,<unused>;miopenConvolutionFwdAlgoDirect:ConvDirectNaiveConvFwd,6.37557,0,miopenConvolutionFwdAlgoDirect,<unused>;miopenConvolutionFwdAlgoWinograd:ConvBinWinogradRxSf2x3g1,1.02107,0,miopenConvolutionFwdAlgoWinograd,<unused>;miopenConvolutionFwdAlgoGEMM:GemmFwd1x1_0_1,0.893473,0,miopenConvolutionFwdAlgoGEMM,<unused>
384-8-8-1x3-256-8-8-16-0x1-1x1-1x1-0-NCHW-FP32-F=miopenConvolutionFwdAlgoImplicitGEMM:ConvHipImplicitGemmV4R4Fwd,0.373957,0,miopenConvolutionFwdAlgoImplicitGEMM,<unused>;miopenConvolutionFwdAlgoDirect:ConvDirectNaiveConvFwd,10.1783,0,miopenConvolutionFwdAlgoDirect,<unused>;miopenConvolutionFwdAlgoWinograd:ConvBinWinogradRxSf2x3g1,0.284878,0,miopenConvolutionFwdAlgoWinograd,<unused>;miopenConvolutionFwdAlgoGEMM:GemmFwdRest,2.55038,294912,miopenConvolutionFwdAlgoGEMM,<unused>
384-8-8-3x1-256-8-8-16-1x0-1x1-1x1-0-NCHW-FP32-F=miopenConvolutionFwdAlgoImplicitGEMM:ConvHipImplicitGemmV4R4Fwd,0.092879,0,miopenConvolutionFwdAlgoImplicitGEMM,<unused>;miopenConvolutionFwdAlgoDirect:ConvDirectNaiveConvFwd,12.1491,0,miopenConvolutionFwdAlgoDirect,<unused>;miopenConvolutionFwdAlgoWinograd:ConvBinWinogradRxSf2x3g1,0.281758,0,miopenConvolutionFwdAlgoWinograd,<unused>;miopenConvolutionFwdAlgoGEMM:GemmFwdRest,2.6771,294912,miopenConvolutionFwdAlgoGEMM,<unused>
384-8-8-3x1-448-8-8-16-1x0-1x1-1x1-0-NCHW-FP32-F=miopenConvolutionFwdAlgoImplicitGEMM:ConvHipImplicitGemmV4R4Fwd,0.114199,0,miopenConvolutionFwdAlgoImplicitGEMM,<unused>;miopenConvolutionFwdAlgoDirect:ConvDirectNaiveConvFwd,13.7902,0,miopenConvolutionFwdAlgoDirect,<unused>;miopenConvolutionFwdAlgoWinograd:ConvBinWinogradRxSf2x3g1,0.523317,0,miopenConvolutionFwdAlgoWinograd,<unused>;miopenConvolutionFwdAlgoGEMM:GemmFwdRest,2.64059,294912,miopenConvolutionFwdAlgoGEMM,<unused>
448-8-8-1x3-512-8-8-16-0x1-1x1-1x1-0-NCHW-FP32-F=miopenConvolutionFwdAlgoImplicitGEMM:ConvHipImplicitGemmV4R1Fwd,0.130399,0,miopenConvolutionFwdAlgoImplicitGEMM,<unused>;miopenConvolutionFwdAlgoDirect:ConvDirectNaiveConvFwd,11.5889,0,miopenConvolutionFwdAlgoDirect,<unused>;miopenConvolutionFwdAlgoWinograd:ConvBinWinogradRxSf2x3g1,0.611836,0,miopenConvolutionFwdAlgoWinograd,<unused>;miopenConvolutionFwdAlgoGEMM:GemmFwdRest,2.94395,344064,miopenConvolutionFwdAlgoGEMM,<unused>
512-8-8-1x3-256-8-8-16-0x1-1x1-1x1-0-NCHW-FP32-F=miopenConvolutionFwdAlgoImplicitGEMM:ConvHipImplicitGemmV4R4Fwd,0.1164,0,miopenConvolutionFwdAlgoImplicitGEMM,<unused>;miopenConvolutionFwdAlgoDirect:ConvDirectNaiveConvFwd,9.72115,0,miopenConvolutionFwdAlgoDirect,<unused>;miopenConvolutionFwdAlgoWinograd:ConvBinWinogradRxSf2x3g1,0.366878,0,miopenConvolutionFwdAlgoWinograd,<unused>;miopenConvolutionFwdAlgoGEMM:GemmFwdRest,3.30366,393216,miopenConvolutionFwdAlgoGEMM,<unused>
512-8-8-3x1-256-8-8-16-1x0-1x1-1x1-0-NCHW-FP32-F=miopenConvolutionFwdAlgoImplicitGEMM:ConvHipImplicitGemmV4R4Fwd,0.114839,0,miopenConvolutionFwdAlgoImplicitGEMM,<unused>;miopenConvolutionFwdAlgoDirect:ConvDirectNaiveConvFwd,11.8649,0,miopenConvolutionFwdAlgoDirect,<unused>;miopenConvolutionFwdAlgoWinograd:ConvBinWinogradRxSf2x3g1,0.365038,0,miopenConvolutionFwdAlgoWinograd,<unused>;miopenConvolutionFwdAlgoGEMM:GemmFwdRest,3.30363,393216,miopenConvolutionFwdAlgoGEMM,<unused>
3-224-224-7x7-64-112-112-16-3x3-2x2-1x1-0-NCHW-FP32-F=miopenConvolutionFwdAlgoDirect:ConvOclDirectFwd,3.42443,0,miopenConvolutionFwdAlgoDirect,<unused>;miopenConvolutionFwdAlgoWinograd:ConvBinWinogradRxSf2x3g1,1.68828,0,miopenConvolutionFwdAlgoWinograd,<unused>;miopenConvolutionFwdAlgoGEMM:GemmFwdRest,2.72445,7375872,miopenConvolutionFwdAlgoGEMM,<unused>
64-56-56-1x1-512-56-56-16-0x0-1x1-1x1-0-NCHW-FP32-F=miopenConvolutionFwdAlgoImplicitGEMM:ConvHipImplicitGemmV4R4Fwd,0.23492,0,miopenConvolutionFwdAlgoImplicitGEMM,<unused>;miopenConvolutionFwdAlgoDirect:ConvDirectNaiveConvFwd,14.1552,0,miopenConvolutionFwdAlgoDirect,<unused>;miopenConvolutionFwdAlgoWinograd:ConvBinWinogradRxSf2x3g1,1.09676,0,miopenConvolutionFwdAlgoWinograd,<unused>;miopenConvolutionFwdAlgoGEMM:GemmFwd1x1_0_1,0.871679,0,miopenConvolutionFwdAlgoGEMM,<unused>
256-56-56-3x3-256-56-56-16-1x1-1x1-1x1-0-NCHW-FP32-F_g64=miopenConvolutionFwdAlgoDirect:ConvOclDirectFwd,0.791839,0,miopenConvolutionFwdAlgoDirect,<unused>;miopenConvolutionFwdAlgoWinograd:ConvBinWinogradRxSf2x3,3.65739,0,miopenConvolutionFwdAlgoWinograd,<unused>;miopenConvolutionFwdAlgoGEMM:GemmFwdRest,13.9808,28901376,miopenConvolutionFwdAlgoGEMM,<unused>
256-56-56-1x1-256-56-56-16-0x0-1x1-1x1-0-NCHW-FP32-F=miopenConvolutionFwdAlgoImplicitGEMM:ConvHipImplicitGemmV4R4Fwd,0.413319,0,miopenConvolutionFwdAlgoImplicitGEMM,<unused>;miopenConvolutionFwdAlgoDirect:ConvDirectNaiveConvFwd,28.0525,0,miopenConvolutionFwdAlgoDirect,<unused>;miopenConvolutionFwdAlgoWinograd:ConvBinWinogradRxSf2x3g1,1.88776,0,miopenConvolutionFwdAlgoWinograd,<unused>;miopenConvolutionFwdAlgoGEMM:GemmFwd1x1_0_1,1.99872,0,miopenConvolutionFwdAlgoGEMM,<unused>
256-56-56-1x1-512-56-56-16-0x0-1x1-1x1-0-NCHW-FP32-F=miopenConvolutionFwdAlgoImplicitGEMM:ConvHipImplicitGemmV4R4Fwd,0.818479,0,miopenConvolutionFwdAlgoImplicitGEMM,<unused>;miopenConvolutionFwdAlgoDirect:ConvDirectNaiveConvFwd,55.7962,0,miopenConvolutionFwdAlgoDirect,<unused>;miopenConvolutionFwdAlgoWinograd:ConvBinWinogradRxSf2x3g1,2.89131,0,miopenConvolutionFwdAlgoWinograd,<unused>;miopenConvolutionFwdAlgoGEMM:GemmFwd1x1_0_1,3.84484,0,miopenConvolutionFwdAlgoGEMM,<unused>
512-56-56-3x3-512-28-28-16-1x1-2x2-1x1-0-NCHW-FP32-F_g64=miopenConvolutionFwdAlgoDirect:ConvOclDirectFwd,1.31052,0,miopenConvolutionFwdAlgoDirect,<unused>;miopenConvolutionFwdAlgoWinograd:ConvBinWinogradRxSf2x3,3.25844,0,miopenConvolutionFwdAlgoWinograd,<unused>;miopenConvolutionFwdAlgoGEMM:GemmFwdRest,6.19901,14450688,miopenConvolutionFwdAlgoGEMM,<unused>
768-28-28-1x1-512-28-28-16-0x0-1x1-1x1-0-NCHW-FP32-F=miopenConvolutionFwdAlgoImplicitGEMM:ConvHipImplicitGemmV4R4Fwd,0.627119,0,miopenConvolutionFwdAlgoImplicitGEMM,<unused>;miopenConvolutionFwdAlgoDirect:ConvDirectNaiveConvFwd,43.6512,0,miopenConvolutionFwdAlgoDirect,<unused>;miopenConvolutionFwdAlgoWinograd:ConvBinWinogradRxSf2x3g1,2.14832,0,miopenConvolutionFwdAlgoWinograd,<unused>;miopenConvolutionFwdAlgoGEMM:GemmFwd1x1_0_1,3.88983,0,miopenConvolutionFwdAlgoGEMM,<unused>
512-28-28-1x1-512-28-28-16-0x0-1x1-1x1-0-NCHW-FP32-F=miopenConvolutionFwdAlgoImplicitGEMM:ConvHipImplicitGemmV4R4Fwd,0.426599,0,miopenConvolutionFwdAlgoImplicitGEMM,<unused>;miopenConvolutionFwdAlgoDirect:ConvDirectNaiveConvFwd,29.1938,0,miopenConvolutionFwdAlgoDirect,<unused>;miopenConvolutionFwdAlgoWinograd:ConvBinWinogradRxSf2x3g1,1.64628,0,miopenConvolutionFwdAlgoWinograd,<unused>;miopenConvolutionFwdAlgoGEMM:GemmFwd1x1_0_1,1.9844,0,miopenConvolutionFwdAlgoGEMM,<unused>
512-28-28-3x3-512-28-28-16-1x1-1x1-1x1-0-NCHW-FP32-F_g64=miopenConvolutionFwdAlgoDirect:ConvOclDirectFwd,0.649039,0,miopenConvolutionFwdAlgoDirect,<unused>;miopenConvolutionFwdAlgoWinograd:ConvBinWinogradRxSf2x3,1.48948,0,miopenConvolutionFwdAlgoWinograd,<unused>;miopenConvolutionFwdAlgoGEMM:GemmFwdRest,4.93054,14450688,miopenConvolutionFwdAlgoGEMM,<unused>
512-28-28-1x1-1024-28-28-16-0x0-1x1-1x1-0-NCHW-FP32-F=miopenConvolutionFwdAlgoImplicitGEMM:ConvHipImplicitGemmV4R4Fwd,0.838519,0,miopenConvolutionFwdAlgoImplicitGEMM,<unused>;miopenConvolutionFwdAlgoDirect:ConvDirectNaiveConvFwd,58.198,0,miopenConvolutionFwdAlgoDirect,<unused>;miopenConvolutionFwdAlgoWinograd:ConvBinWinogradRxSf2x3g1,2.84852,0,miopenConvolutionFwdAlgoWinograd,<unused>;miopenConvolutionFwdAlgoGEMM:GemmFwd1x1_0_1,3.86992,0,miopenConvolutionFwdAlgoGEMM,<unused>
1024-28-28-3x3-1024-14-14-16-1x1-2x2-1x1-0-NCHW-FP32-F_g64=miopenConvolutionFwdAlgoImplicitGEMM:ConvHipImplicitGemmV4R1Fwd,0.112,0,miopenConvolutionFwdAlgoImplicitGEMM,<unused>;miopenConvolutionFwdAlgoDirect:ConvOclDirectFwd,1.29288,0,miopenConvolutionFwdAlgoDirect,<unused>;miopenConvolutionFwdAlgoWinograd:ConvBinWinogradRxSf2x3,1.30676,0,miopenConvolutionFwdAlgoWinograd,<unused>;miopenConvolutionFwdAlgoGEMM:GemmFwdRest,4.70878,7225344,miopenConvolutionFwdAlgoGEMM,<unused>
1536-14-14-1x1-1024-14-14-16-0x0-1x1-1x1-0-NCHW-FP32-F=miopenConvolutionFwdAlgoImplicitGEMM:ConvHipImplicitGemmV4R4Fwd,0.653999,0,miopenConvolutionFwdAlgoImplicitGEMM,<unused>;miopenConvolutionFwdAlgoDirect:ConvDirectNaiveConvFwd,53.5149,0,miopenConvolutionFwdAlgoDirect,<unused>;miopenConvolutionFwdAlgoWinograd:ConvBinWinogradRxSf3x2,1.32016,0,miopenConvolutionFwdAlgoWinograd,<unused>;miopenConvolutionFwdAlgoGEMM:GemmFwd1x1_0_1,6.67599,0,miopenConvolutionFwdAlgoGEMM,<unused>
1024-14-14-1x1-1024-14-14-16-0x0-1x1-1x1-0-NCHW-FP32-F=miopenConvolutionFwdAlgoImplicitGEMM:ConvHipImplicitGemmV4R4Fwd,0.4076,0,miopenConvolutionFwdAlgoImplicitGEMM,<unused>;miopenConvolutionFwdAlgoDirect:ConvDirectNaiveConvFwd,35.7344,0,miopenConvolutionFwdAlgoDirect,<unused>;miopenConvolutionFwdAlgoWinograd:ConvBinWinogradRxSf2x3g1,1.7268,0,miopenConvolutionFwdAlgoWinograd,<unused>;miopenConvolutionFwdAlgoGEMM:GemmFwd1x1_0_1,2.37548,0,miopenConvolutionFwdAlgoGEMM,<unused>
1024-14-14-3x3-1024-14-14-16-1x1-1x1-1x1-0-NCHW-FP32-F_g64=miopenConvolutionFwdAlgoImplicitGEMM:ConvHipImplicitGemmV4R1Fwd,0.10768,0,miopenConvolutionFwdAlgoImplicitGEMM,<unused>;miopenConvolutionFwdAlgoDirect:ConvOclDirectFwd,0.738999,0,miopenConvolutionFwdAlgoDirect,<unused>;miopenConvolutionFwdAlgoWinograd:ConvBinWinogradRxSf2x3,0.468839,0,miopenConvolutionFwdAlgoWinograd,<unused>;miopenConvolutionFwdAlgoGEMM:GemmFwdRest,2.70397,7225344,miopenConvolutionFwdAlgoGEMM,<unused>
1024-14-14-1x1-2048-14-14-16-0x0-1x1-1x1-0-NCHW-FP32-F=miopenConvolutionFwdAlgoImplicitGEMM:ConvHipImplicitGemmV4R4Fwd,0.796839,0,miopenConvolutionFwdAlgoImplicitGEMM,<unused>;miopenConvolutionFwdAlgoDirect:ConvDirectNaiveConvFwd,71.5345,0,miopenConvolutionFwdAlgoDirect,<unused>;miopenConvolutionFwdAlgoWinograd:ConvBinWinogradRxSf2x3g1,2.97876,0,miopenConvolutionFwdAlgoWinograd,<unused>;miopenConvolutionFwdAlgoGEMM:GemmFwd1x1_0_1,4.30519,0,miopenConvolutionFwdAlgoGEMM,<unused>
2048-14-14-3x3-2048-7-7-16-1x1-2x2-1x1-0-NCHW-FP32-F_g64=miopenConvolutionFwdAlgoDirect:ConvOclDirectFwd,1.61708,0,miopenConvolutionFwdAlgoDirect,<unused>;miopenConvolutionFwdAlgoWinograd:ConvBinWinogradRxSf2x3,0.782599,0,miopenConvolutionFwdAlgoWinograd,<unused>;miopenConvolutionFwdAlgoGEMM:GemmFwdRest,3.75296,3612672,miopenConvolutionFwdAlgoGEMM,<unused>
3072-7-7-1x1-2048-7-7-16-0x0-1x1-1x1-0-NCHW-FP32-F=miopenConvolutionFwdAlgoDirect:ConvDirectNaiveConvFwd,54.1609,0,miopenConvolutionFwdAlgoDirect,<unused>;miopenConvolutionFwdAlgoWinograd:ConvBinWinogradRxSf3x2,2.1196,0,miopenConvolutionFwdAlgoWinograd,<unused>;miopenConvolutionFwdAlgoGEMM:GemmFwd1x1_0_1,5.06963,0,miopenConvolutionFwdAlgoGEMM,<unused>
2048-7-7-1x1-2048-7-7-16-0x0-1x1-1x1-0-NCHW-FP32-F=miopenConvolutionFwdAlgoDirect:ConvDirectNaiveConvFwd,36.1631,0,miopenConvolutionFwdAlgoDirect,<unused>;miopenConvolutionFwdAlgoWinograd:ConvBinWinogradRxSf2x3g1,2.05164,0,miopenConvolutionFwdAlgoWinograd,<unused>;miopenConvolutionFwdAlgoGEMM:GemmFwd1x1_0_1,4.56027,0,miopenConvolutionFwdAlgoGEMM,<unused>
2048-7-7-3x3-2048-7-7-16-1x1-1x1-1x1-0-NCHW-FP32-F_g64=miopenConvolutionFwdAlgoDirect:ConvOclDirectFwd,1.41148,0,miopenConvolutionFwdAlgoDirect,<unused>;miopenConvolutionFwdAlgoWinograd:ConvBinWinogradRxSf2x3,0.26192,0,miopenConvolutionFwdAlgoWinograd,<unused>;miopenConvolutionFwdAlgoGEMM:GemmFwdRest,3.05662,3612672,miopenConvolutionFwdAlgoGEMM,<unused>
3-225-225-3x3-32-112-112-64-0x0-2x2-1x1-0-NCHW-FP32-F=miopenConvolutionFwdAlgoDirect:ConvOclDirectFwdGen,2.83456,0,miopenConvolutionFwdAlgoDirect,<unused>;miopenConvolutionFwdAlgoWinograd:ConvBinWinogradRxSf2x3g1,1.77944,0,miopenConvolutionFwdAlgoWinograd,<unused>;miopenConvolutionFwdAlgoGEMM:GemmFwdRest,7.10387,1354752,miopenConvolutionFwdAlgoGEMM,<unused>
32-112-112-3x3-32-112-112-64-1x1-1x1-1x1-0-NCHW-FP32-F_g32=miopenConvolutionFwdAlgoDirect:ConvOclDirectFwd,0.35128,0,miopenConvolutionFwdAlgoDirect,<unused>;miopenConvolutionFwdAlgoWinograd:ConvBinWinogradRxSf2x3,4.32735,0,miopenConvolutionFwdAlgoWinograd,<unused>;miopenConvolutionFwdAlgoGEMM:GemmFwdRest,35.2945,14450688,miopenConvolutionFwdAlgoGEMM,<unused>
32-112-112-1x1-64-112-112-64-0x0-1x1-1x1-0-NCHW-FP32-F=miopenConvolutionFwdAlgoImplicitGEMM:ConvHipImplicitGemmV4R4Fwd,0.774839,0,miopenConvolutionFwdAlgoImplicitGEMM,<unused>;miopenConvolutionFwdAlgoDirect:ConvDirectNaiveConvFwd,14.5808,0,miopenConvolutionFwdAlgoDirect,<unused>;miopenConvolutionFwdAlgoWinograd:ConvBinWinogradRxSf2x3g1,1.41028,0,miopenConvolutionFwdAlgoWinograd,<unused>;miopenConvolutionFwdAlgoGEMM:GemmFwd1x1_0_1,1.6987,0,miopenConvolutionFwdAlgoGEMM,<unused>
64-113-113-3x3-64-56-56-64-0x0-2x2-1x1-0-NCHW-FP32-F_g64=miopenConvolutionFwdAlgoDirect:ConvOclDirectFwd,0.591879,0,miopenConvolutionFwdAlgoDirect,<unused>;miopenConvolutionFwdAlgoWinograd:ConvBinWinogradRxSf2x3,13.6946,0,miopenConvolutionFwdAlgoWinograd,<unused>;miopenConvolutionFwdAlgoGEMM:GemmFwdRest,24.2124,7225344,miopenConvolutionFwdAlgoGEMM,<unused>
64-56-56-1x1-128-56-56-64-0x0-1x1-1x1-0-NCHW-FP32-F=miopenConvolutionFwdAlgoImplicitGEMM:ConvHipImplicitGemmV4R4Fwd,0.251039,0,miopenConvolutionFwdAlgoImplicitGEMM,<unused>;miopenConvolutionFwdAlgoDirect:ConvDirectNaiveConvFwd,14.2977,0,miopenConvolutionFwdAlgoDirect,<unused>;miopenConvolutionFwdAlgoWinograd:ConvBinWinogradRxSf2x3g1,2.60852,0,miopenConvolutionFwdAlgoWinograd,<unused>;miopenConvolutionFwdAlgoGEMM:GemmFwd1x1_0_1,0.869079,0,miopenConvolutionFwdAlgoGEMM,<unused>
128-56-56-3x3-128-56-56-64-1x1-1x1-1x1-0-NCHW-FP32-F_g128=miopenConvolutionFwdAlgoDirect:ConvOclDirectFwd,0.34604,0,miopenConvolutionFwdAlgoDirect,<unused>;miopenConvolutionFwdAlgoWinograd:ConvBinWinogradRxSf2x3,4.30799,0,miopenConvolutionFwdAlgoWinograd,<unused>;miopenConvolutionFwdAlgoGEMM:GemmFwdRest,36.5875,14450688,miopenConvolutionFwdAlgoGEMM,<unused>
128-56-56-1x1-128-56-56-64-0x0-1x1-1x1-0-NCHW-FP32-F=miopenConvolutionFwdAlgoImplicitGEMM:ConvHipImplicitGemmV4R4Fwd,0.464479,0,miopenConvolutionFwdAlgoImplicitGEMM,<unused>;miopenConvolutionFwdAlgoDirect:ConvDirectNaiveConvFwd,27.8914,0,miopenConvolutionFwdAlgoDirect,<unused>;miopenConvolutionFwdAlgoWinograd:ConvBinWinogradRxSf2x3g1,1.709,0,miopenConvolutionFwdAlgoWinograd,<unused>;miopenConvolutionFwdAlgoGEMM:GemmFwd1x1_0_1,1.97972,0,miopenConvolutionFwdAlgoGEMM,<unused>
128-57-57-3x3-128-28-28-64-0x0-2x2-1x1-0-NCHW-FP32-F_g128=miopenConvolutionFwdAlgoDirect:ConvOclDirectFwd,0.757439,0,miopenConvolutionFwdAlgoDirect,<unused>;miopenConvolutionFwdAlgoWinograd:ConvBinWinogradRxSf2x3,7.87251,0,miopenConvolutionFwdAlgoWinograd,<unused>;miopenConvolutionFwdAlgoGEMM:GemmFwdRest,7.01952,3612672,miopenConvolutionFwdAlgoGEMM,<unused>
128-28-28-1x1-256-28-28-64-0x0-1x1-1x1-0-NCHW-FP32-F=miopenConvolutionFwdAlgoImplicitGEMM:ConvHipImplicitGemmV4R4Fwd,0.22868,0,miopenConvolutionFwdAlgoImplicitGEMM,<unused>;miopenConvolutionFwdAlgoDirect:ConvDirectNaiveConvFwd,14.901,0,miopenConvolutionFwdAlgoDirect,<unused>;miopenConvolutionFwdAlgoWinograd:ConvBinWinogradRxSf2x3g1,1.2578,0,miopenConvolutionFwdAlgoWinograd,<unused>;miopenConvolutionFwdAlgoGEMM:GemmFwd1x1_0_1,2.0832,0,miopenConvolutionFwdAlgoGEMM,<unused>
256-28-28-3x3-256-28-28-64-1x1-1x1-1x1-0-NCHW-FP32-F_g256=miopenConvolutionFwdAlgoDirect:ConvOclDirectFwd,0.15864,0,miopenConvolutionFwdAlgoDirect,<unused>;miopenConvolutionFwdAlgoWinograd:ConvBinWinogradRxSf2x3,2.38164,0,miopenConvolutionFwdAlgoWinograd,<unused>;miopenConvolutionFwdAlgoGEMM:GemmFwdRest,17.4413,7225344,miopenConvolutionFwdAlgoGEMM,<unused>
256-28-28-1x1-256-28-28-64-0x0-1x1-1x1-0-NCHW-FP32-F=miopenConvolutionFwdAlgoImplicitGEMM:ConvHipImplicitGemmV4R4Fwd,0.419679,0,miopenConvolutionFwdAlgoImplicitGEMM,<unused>;miopenConvolutionFwdAlgoDirect:ConvDirectNaiveConvFwd,29.1843,0,miopenConvolutionFwdAlgoDirect,<unused>;miopenConvolutionFwdAlgoWinograd:ConvBinWinogradRxSf2x3g1,1.80432,0,miopenConvolutionFwdAlgoWinograd,<unused>;miopenConvolutionFwdAlgoGEMM:GemmFwd1x1_0_1,3.86204,0,miopenConvolutionFwdAlgoGEMM,<unused>
256-29-29-3x3-256-14-14-64-0x0-2x2-1x1-0-NCHW-FP32-F_g256=miopenConvolutionFwdAlgoDirect:ConvOclDirectFwd,0.376359,0,miopenConvolutionFwdAlgoDirect,<unused>;miopenConvolutionFwdAlgoWinograd:ConvBinWinogradRxSf2x3,4.58151,0,miopenConvolutionFwdAlgoWinograd,<unused>;miopenConvolutionFwdAlgoGEMM:GemmFwdRest,12.4134,1806336,miopenConvolutionFwdAlgoGEMM,<unused>
256-14-14-1x1-512-14-14-64-0x0-1x1-1x1-0-NCHW-FP32-F=miopenConvolutionFwdAlgoImplicitGEMM:ConvHipImplicitGemmV4R4Fwd,0.320079,0,miopenConvolutionFwdAlgoImplicitGEMM,<unused>;miopenConvolutionFwdAlgoDirect:ConvDirectNaiveConvFwd,18.2051,0,miopenConvolutionFwdAlgoDirect,<unused>;miopenConvolutionFwdAlgoWinograd:ConvBinWinogradRxSf2x3g1,0.866759,0,miopenConvolutionFwdAlgoWinograd,<unused>;miopenConvolutionFwdAlgoGEMM:GemmFwd1x1_0_1,2.28016,0,miopenConvolutionFwdAlgoGEMM,<unused>
512-14-14-3x3-512-14-14-64-1x1-1x1-1x1-0-NCHW-FP32-F_g512=miopenConvolutionFwdAlgoDirect:ConvOclDirectFwd,0.0996,0,miopenConvolutionFwdAlgoDirect,<unused>;miopenConvolutionFwdAlgoWinograd:ConvBinWinogradRxSf2x3,5.23083,0,miopenConvolutionFwdAlgoWinograd,<unused>;miopenConvolutionFwdAlgoGEMM:GemmFwdRest,18.3936,3612672,miopenConvolutionFwdAlgoGEMM,<unused>
512-14-14-1x1-512-14-14-64-0x0-1x1-1x1-0-NCHW-FP32-F=miopenConvolutionFwdAlgoImplicitGEMM:ConvHipImplicitGemmV4R4Fwd,0.43096,0,miopenConvolutionFwdAlgoImplicitGEMM,<unused>;miopenConvolutionFwdAlgoDirect:ConvDirectNaiveConvFwd,35.8857,0,miopenConvolutionFwdAlgoDirect,<unused>;miopenConvolutionFwdAlgoWinograd:ConvBinWinogradRxSf2x3g1,1.57392,0,miopenConvolutionFwdAlgoWinograd,<unused>;miopenConvolutionFwdAlgoGEMM:GemmFwd1x1_0_1,4.39212,0,miopenConvolutionFwdAlgoGEMM,<unused>
512-15-15-3x3-512-7-7-64-0x0-2x2-1x1-0-NCHW-FP32-F_g512=miopenConvolutionFwdAlgoDirect:ConvOclDirectFwd,0.26992,0,miopenConvolutionFwdAlgoDirect,<unused>;miopenConvolutionFwdAlgoWinograd:ConvBinWinogradRxSf2x3,3.2044,0,miopenConvolutionFwdAlgoWinograd,<unused>;miopenConvolutionFwdAlgoGEMM:GemmFwdRest,4.68736,903168,miopenConvolutionFwdAlgoGEMM,<unused>
512-7-7-1x1-1024-7-7-64-0x0-1x1-1x1-0-NCHW-FP32-F=miopenConvolutionFwdAlgoImplicitGEMM:ConvHipImplicitGemmV4R1Fwd,0.363279,0,miopenConvolutionFwdAlgoImplicitGEMM,<unused>;miopenConvolutionFwdAlgoDirect:ConvDirectNaiveConvFwd,18.0183,0,miopenConvolutionFwdAlgoDirect,<unused>;miopenConvolutionFwdAlgoWinograd:ConvBinWinogradRxSf2x3g1,1.12172,0,miopenConvolutionFwdAlgoWinograd,<unused>;miopenConvolutionFwdAlgoGEMM:GemmFwd1x1_0_1,3.91704,0,miopenConvolutionFwdAlgoGEMM,<unused>
1024-7-7-3x3-1024-7-7-64-1x1-1x1-1x1-0-NCHW-FP32-F_g1024=miopenConvolutionFwdAlgoDirect:ConvOclDirectFwd,0.2688,0,miopenConvolutionFwdAlgoDirect,<unused>;miopenConvolutionFwdAlgoWinograd:ConvBinWinogradRxSf2x3,4.07699,0,miopenConvolutionFwdAlgoWinograd,<unused>;miopenConvolutionFwdAlgoGEMM:GemmFwdRest,5.08672,1806336,miopenConvolutionFwdAlgoGEMM,<unused>
1024-7-7-1x1-1024-7-7-64-0x0-1x1-1x1-0-NCHW-FP32-F=miopenConvolutionFwdAlgoImplicitGEMM:ConvHipImplicitGemmV4R4Fwd,0.55232,0,miopenConvolutionFwdAlgoImplicitGEMM,<unused>;miopenConvolutionFwdAlgoDirect:ConvDirectNaiveConvFwd,35.7884,0,miopenConvolutionFwdAlgoDirect,<unused>;miopenConvolutionFwdAlgoWinograd:ConvBinWinogradRxSf2x3g1,2.05412,0,miopenConvolutionFwdAlgoWinograd,<unused>;miopenConvolutionFwdAlgoGEMM:GemmFwd1x1_0_1,2.90616,0,miopenConvolutionFwdAlgoGEMM,<unused>
1024-1-1-1x1-1001-1-1-64-0x0-1x1-1x1-0-NCHW-FP32-F=miopenConvolutionFwdAlgoDirect:ConvDirectNaiveConvFwd,34.8469,0,miopenConvolutionFwdAlgoDirect,<unused>;miopenConvolutionFwdAlgoWinograd:ConvBinWinogradRxSf2x3g1,0.191119,0,miopenConvolutionFwdAlgoWinograd,<unused>;miopenConvolutionFwdAlgoGEMM:GemmFwd1x1_0_1,4.2414,0,miopenConvolutionFwdAlgoGEMM,<unused>
3-331-331-3x3-96-165-165-64-0x0-2x2-1x1-0-NCHW-FP32-F=miopenConvolutionFwdAlgoDirect:ConvOclDirectFwd,2.25904,0,miopenConvolutionFwdAlgoDirect,<unused>;miopenConvolutionFwdAlgoWinograd:ConvBinWinogradRxSf2x3g1,4.01284,0,miopenConvolutionFwdAlgoWinograd,<unused>;miopenConvolutionFwdAlgoGEMM:GemmFwdRest,20.101,2940300,miopenConvolutionFwdAlgoGEMM,<unused>
96-165-165-1x1-42-165-165-64-0x0-1x1-1x1-0-NCHW-FP32-F=miopenConvolutionFwdAlgoDirect:ConvDirectNaiveConvFwd,61.918,0,miopenConvolutionFwdAlgoDirect,<unused>;miopenConvolutionFwdAlgoWinograd:ConvBinWinogradRxSf3x2,3.23088,0,miopenConvolutionFwdAlgoWinograd,<unused>;miopenConvolutionFwdAlgoGEMM:GemmFwd1x1_0_1,2.9008,0,miopenConvolutionFwdAlgoGEMM,<unused>
96-165-165-7x7-96-83-83-64-3x3-2x2-1x1-0-NCHW-FP32-F_g96=miopenConvolutionFwdAlgoDirect:ConvOclDirectFwd,2.22372,0,miopenConvolutionFwdAlgoDirect,<unused>;miopenConvolutionFwdAlgoWinograd:ConvBinWinogradRxSf2x3,29.0081,0,miopenConvolutionFwdAlgoWinograd,<unused>;miopenConvolutionFwdAlgoGEMM:GemmFwdRest,236.308,129623424,miopenConvolutionFwdAlgoGEMM,<unused>
96-83-83-1x1-42-83-83-64-0x0-1x1-1x1-0-NCHW-FP32-F=miopenConvolutionFwdAlgoDirect:ConvDirectNaiveConvFwd,15.7344,0,miopenConvolutionFwdAlgoDirect,<unused>;miopenConvolutionFwdAlgoWinograd:ConvBinWinogradRxSf2x3g1,1.417,0,miopenConvolutionFwdAlgoWinograd,<unused>;miopenConvolutionFwdAlgoGEMM:GemmFwd1x1_0_1,2.12584,0,miopenConvolutionFwdAlgoGEMM,<unused>
42-83-83-7x7-42-83-83-64-3x3-1x1-1x1-0-NCHW-FP32-F_g42=miopenConvolutionFwdAlgoDirect:ConvOclDirectFwd,0.3378,0,miopenConvolutionFwdAlgoDirect,<unused>;miopenConvolutionFwdAlgoWinograd:ConvBinWinogradRxSf2x3,9.02335,0,miopenConvolutionFwdAlgoWinograd,<unused>;miopenConvolutionFwdAlgoGEMM:GemmFwdRest,167.928,56710248,miopenConvolutionFwdAlgoGEMM,<unused>
42-83-83-1x1-42-83-83-64-0x0-1x1-1x1-0-NCHW-FP32-F=miopenConvolutionFwdAlgoDirect:ConvDirectNaiveConvFwd,7.18564,0,miopenConvolutionFwdAlgoDirect,<unused>;miopenConvolutionFwdAlgoWinograd:ConvBinWinogradRxSf2x3g1,1.15612,0,miopenConvolutionFwdAlgoWinograd,<unused>;miopenConvolutionFwdAlgoGEMM:GemmFwd1x1_0_1,1.8632,0,miopenConvolutionFwdAlgoGEMM,<unused>
96-165-165-5x5-96-83-83-64-2x2-2x2-1x1-0-NCHW-FP32-F_g96=miopenConvolutionFwdAlgoDirect:ConvOclDirectFwd,1.992,0,miopenConvolutionFwdAlgoDirect,<unused>;miopenConvolutionFwdAlgoWinograd:ConvBinWinogradRxSf2x3,19.6106,0,miopenConvolutionFwdAlgoWinograd,<unused>;miopenConvolutionFwdAlgoGEMM:GemmFwdRest,93.8828,66134400,miopenConvolutionFwdAlgoGEMM,<unused>
42-83-83-5x5-42-83-83-64-2x2-1x1-1x1-0-NCHW-FP32-F_g42=miopenConvolutionFwdAlgoDirect:ConvOclDirectFwd,0.26904,0,miopenConvolutionFwdAlgoDirect,<unused>;miopenConvolutionFwdAlgoWinograd:ConvBinWinogradRxSf2x3,4.6502,0,miopenConvolutionFwdAlgoWinograd,<unused>;miopenConvolutionFwdAlgoGEMM:GemmFwdRest,72.2353,28933800,miopenConvolutionFwdAlgoGEMM,<unused>
42-165-165-5x5-42-83-83-64-2x2-2x2-1x1-0-NCHW-FP32-F_g42=miopenConvolutionFwdAlgoDirect:ConvOclDirectFwd,0.87388,0,miopenConvolutionFwdAlgoDirect,<unused>;miopenConvolutionFwdAlgoWinograd:ConvBinWinogradRxSf2x3,14.1144,0,miopenConvolutionFwdAlgoWinograd,<unused>;miopenConvolutionFwdAlgoGEMM:GemmFwdRest,38.1439,28933800,miopenConvolutionFwdAlgoGEMM,<unused>
84-83-83-1x1-42-83-83-64-0x0-1x1-1x1-0-NCHW-FP32-F=miopenConvolutionFwdAlgoDirect:ConvDirectNaiveConvFwd,13.9044,0,miopenConvolutionFwdAlgoDirect,<unused>;miopenConvolutionFwdAlgoWinograd:ConvBinWinogradRxSf2x3g1,1.30332,0,miopenConvolutionFwdAlgoWinograd,<unused>;miopenConvolutionFwdAlgoGEMM:GemmFwd1x1_0_1,2.06036,0,miopenConvolutionFwdAlgoGEMM,<unused>
42-83-83-3x3-42-83-83-64-1x1-1x1-1x1-0-NCHW-FP32-F_g42=miopenConvolutionFwdAlgoDirect:ConvOclDirectFwd,0.2338,0,miopenConvolutionFwdAlgoDirect,<unused>;miopenConvolutionFwdAlgoWinograd:ConvBinWinogradRxSf2x3,3.73328,0,miopenConvolutionFwdAlgoWinograd,<unused>;miopenConvolutionFwdAlgoGEMM:GemmFwdRest,28.2469,10416168,miopenConvolutionFwdAlgoGEMM,<unused>
168-83-83-1x1-84-83-83-64-0x0-1x1-1x1-0-NCHW-FP32-F=miopenConvolutionFwdAlgoDirect:ConvDirectNaiveConvFwd,53.5886,0,miopenConvolutionFwdAlgoDirect,<unused>;miopenConvolutionFwdAlgoWinograd:ConvBinWinogradRxSf3x2,1.92424,0,miopenConvolutionFwdAlgoWinograd,<unused>;miopenConvolutionFwdAlgoGEMM:GemmFwd1x1_0_1,4.56596,0,miopenConvolutionFwdAlgoGEMM,<unused>
84-83-83-7x7-84-42-42-64-3x3-2x2-1x1-0-NCHW-FP32-F_g84=miopenConvolutionFwdAlgoDirect:ConvOclDirectFwd,0.53168,0,miopenConvolutionFwdAlgoDirect,<unused>;miopenConvolutionFwdAlgoWinograd:ConvBinWinogradRxSf2x3,14.9183,0,miopenConvolutionFwdAlgoWinograd,<unused>;miopenConvolutionFwdAlgoGEMM:GemmFwdRest,76.1265,29042496,miopenConvolutionFwdAlgoGEMM,<unused>
84-42-42-1x1-84-42-42-64-0x0-1x1-1x1-0-NCHW-FP32-F=miopenConvolutionFwdAlgoDirect:ConvDirectNaiveConvFwd,8.18587,0,miopenConvolutionFwdAlgoDirect,<unused>;miopenConvolutionFwdAlgoWinograd:ConvBinWinogradRxSf2x3g1,2.15968,0,miopenConvolutionFwdAlgoWinograd,<unused>;miopenConvolutionFwdAlgoGEMM:GemmFwd1x1_0_1,0.984479,0,miopenConvolutionFwdAlgoGEMM,<unused>
84-42-42-7x7-84-42-42-64-3x3-1x1-1x1-0-NCHW-FP32-F_g84=miopenConvolutionFwdAlgoDirect:ConvOclDirectFwd,0.2578,0,miopenConvolutionFwdAlgoDirect,<unused>;miopenConvolutionFwdAlgoWinograd:ConvBinWinogradRxSf2x3,4.80632,0,miopenConvolutionFwdAlgoWinograd,<unused>;miopenConvolutionFwdAlgoGEMM:GemmFwdRest,31.6466,29042496,miopenConvolutionFwdAlgoGEMM,<unused>
84-83-83-5x5-84-42-42-64-2x2-2x2-1x1-0-NCHW-FP32-F_g84=miopenConvolutionFwdAlgoDirect:ConvOclDirectFwd,0.71892,0,miopenConvolutionFwdAlgoDirect,<unused>;miopenConvolutionFwdAlgoWinograd:ConvBinWinogradRxSf2x3,12.2542,0,miopenConvolutionFwdAlgoWinograd,<unused>;miopenConvolutionFwdAlgoGEMM:GemmFwdRest,23.4239,14817600,miopenConvolutionFwdAlgoGEMM,<unused>
84-42-42-5x5-84-42-42-64-2x2-1x1-1x1-0-NCHW-FP32-F_g84=miopenConvolutionFwdAlgoDirect:ConvOclDirectFwd,0.45772,0,miopenConvolutionFwdAlgoDirect,<unused>;miopenConvolutionFwdAlgoWinograd:ConvBinWinogradRxSf2x3,2.52012,0,miopenConvolutionFwdAlgoWinograd,<unused>;miopenConvolutionFwdAlgoGEMM:GemmFwdRest,20.6847,14817600,miopenConvolutionFwdAlgoGEMM,<unused>
168-42-42-1x1-84-42-42-64-0x0-1x1-1x1-0-NCHW-FP32-F=miopenConvolutionFwdAlgoDirect:ConvDirectNaiveConvFwd,13.9981,0,miopenConvolutionFwdAlgoDirect,<unused>;miopenConvolutionFwdAlgoWinograd:ConvBinWinogradRxSf2x3g1,0.9642,0,miopenConvolutionFwdAlgoWinograd,<unused>;miopenConvolutionFwdAlgoGEMM:GemmFwd1x1_0_1,2.27048,0,miopenConvolutionFwdAlgoGEMM,<unused>
84-42-42-3x3-84-42-42-64-1x1-1x1-1x1-0-NCHW-FP32-F_g84=miopenConvolutionFwdAlgoDirect:ConvOclDirectFwd,0.16708,0,miopenConvolutionFwdAlgoDirect,<unused>;miopenConvolutionFwdAlgoWinograd:ConvBinWinogradRxSf2x3,4.90248,0,miopenConvolutionFwdAlgoWinograd,<unused>;miopenConvolutionFwdAlgoGEMM:GemmFwdRest,9.59475,5334336,miopenConvolutionFwdAlgoGEMM,<unused>
336-42-42-1x1-336-42-42-64-0x0-1x1-1x1-0-NCHW-FP32-F=miopenConvolutionFwdAlgoImplicitGEMM:ConvHipImplicitGemmV4R1Fwd,8.1686,0,miopenConvolutionFwdAlgoImplicitGEMM,<unused>;miopenConvolutionFwdAlgoDirect:ConvDirectNaiveConvFwd,110.044,0,miopenConvolutionFwdAlgoDirect,<unused>;miopenConvolutionFwdAlgoWinograd:ConvBinWinogradRxSf3x2,2.89728,0,miopenConvolutionFwdAlgoWinograd,<unused>;miopenConvolutionFwdAlgoGEMM:GemmFwd1x1_0_1,5.75564,0,miopenConvolutionFwdAlgoGEMM,<unused>
168-42-42-5x5-168-42-42-64-2x2-1x1-1x1-0-NCHW-FP32-F_g168=miopenConvolutionFwdAlgoDirect:ConvOclDirectFwd,0.335319,0,miopenConvolutionFwdAlgoDirect,<unused>;miopenConvolutionFwdAlgoWinograd:ConvBinWinogradRxSf2x3,4.6468,0,miopenConvolutionFwdAlgoWinograd,<unused>;miopenConvolutionFwdAlgoGEMM:GemmFwdRest,31.5878,29635200,miopenConvolutionFwdAlgoGEMM,<unused>
168-42-42-1x1-168-42-42-64-0x0-1x1-1x1-0-NCHW-FP32-F=miopenConvolutionFwdAlgoDirect:ConvDirectNaiveConvFwd,28.1125,0,miopenConvolutionFwdAlgoDirect,<unused>;miopenConvolutionFwdAlgoWinograd:ConvBinWinogradRxSf2x3g1,1.73852,0,miopenConvolutionFwdAlgoWinograd,<unused>;miopenConvolutionFwdAlgoGEMM:GemmFwd1x1_0_1,4.34896,0,miopenConvolutionFwdAlgoGEMM,<unused>
168-42-42-3x3-168-42-42-64-1x1-1x1-1x1-0-NCHW-FP32-F_g168=miopenConvolutionFwdAlgoDirect:ConvOclDirectFwd,0.28576,0,miopenConvolutionFwdAlgoDirect,<unused>;miopenConvolutionFwdAlgoWinograd:ConvBinWinogradRxSf2x3,3.83836,0,miopenConvolutionFwdAlgoWinograd,<unused>;miopenConvolutionFwdAlgoGEMM:GemmFwdRest,15.6365,10668672,miopenConvolutionFwdAlgoGEMM,<unused>
336-42-42-1x1-168-42-42-64-0x0-1x1-1x1-0-NCHW-FP32-F=miopenConvolutionFwdAlgoDirect:ConvDirectNaiveConvFwd,55.6458,0,miopenConvolutionFwdAlgoDirect,<unused>;miopenConvolutionFwdAlgoWinograd:ConvBinWinogradRxSf3x2,1.66444,0,miopenConvolutionFwdAlgoWinograd,<unused>;miopenConvolutionFwdAlgoGEMM:GemmFwd1x1_0_1,5.09172,0,miopenConvolutionFwdAlgoGEMM,<unused>
1008-42-42-1x1-336-42-42-64-0x0-1x1-1x1-0-NCHW-FP32-F=miopenConvolutionFwdAlgoImplicitGEMM:ConvHipImplicitGemmV4R1Fwd,24.9791,0,miopenConvolutionFwdAlgoImplicitGEMM,<unused>;miopenConvolutionFwdAlgoDirect:ConvDirectNaiveConvFwd,332.198,0,miopenConvolutionFwdAlgoDirect,<unused>;miopenConvolutionFwdAlgoWinograd:ConvBinWinogradRxSf3x2,7.72347,0,miopenConvolutionFwdAlgoWinograd,<unused>;miopenConvolutionFwdAlgoGEMM:GemmFwd1x1_0_1,4.37414,0,miopenConvolutionFwdAlgoGEMM,<unused>
1008-42-42-1x1-168-42-42-64-0x0-1x1-1x1-0-NCHW-FP32-F=miopenConvolutionFwdAlgoDirect:ConvDirectNaiveConvFwd,166.936,0,miopenConvolutionFwdAlgoDirect,<unused>;miopenConvolutionFwdAlgoWinograd:ConvBinWinogradRxSf3x2,4.36044,0,miopenConvolutionFwdAlgoWinograd,<unused>;miopenConvolutionFwdAlgoGEMM:GemmFwd1x1_0_1,4.63811,0,miopenConvolutionFwdAlgoGEMM,<unused>
336-47-47-7x7-336-21-21-64-0x0-2x2-1x1-0-NCHW-FP32-F_g336=miopenConvolutionFwdAlgoDirect:ConvOclDirectFwd,1.07688,0,miopenConvolutionFwdAlgoDirect,<unused>;miopenConvolutionFwdAlgoWinograd:ConvBinWinogradRxSf2x3,15.6273,0,miopenConvolutionFwdAlgoWinograd,<unused>;miopenConvolutionFwdAlgoGEMM:GemmFwdRest,44.997,29042496,miopenConvolutionFwdAlgoGEMM,<unused>
336-21-21-1x1-336-21-21-64-0x0-1x1-1x1-0-NCHW-FP32-F=miopenConvolutionFwdAlgoImplicitGEMM:ConvHipImplicitGemmV4R1Fwd,1.16484,0,miopenConvolutionFwdAlgoImplicitGEMM,<unused>;miopenConvolutionFwdAlgoDirect:ConvDirectNaiveConvFwd,27.4107,0,miopenConvolutionFwdAlgoDirect,<unused>;miopenConvolutionFwdAlgoWinograd:ConvBinWinogradRxSf2x3g1,1.71552,0,miopenConvolutionFwdAlgoWinograd,<unused>;miopenConvolutionFwdAlgoGEMM:GemmFwd1x1_0_1,3.69196,0,miopenConvolutionFwdAlgoGEMM,<unused>
336-21-21-7x7-336-21-21-64-3x3-1x1-1x1-0-NCHW-FP32-F_g336=miopenConvolutionFwdAlgoDirect:ConvOclDirectFwd,0.2628,0,miopenConvolutionFwdAlgoDirect,<unused>;miopenConvolutionFwdAlgoWinograd:ConvBinWinogradRxSf2x3,5.3288,0,miopenConvolutionFwdAlgoWinograd,<unused>;miopenConvolutionFwdAlgoGEMM:GemmFwdRest,34.4472,29042496,miopenConvolutionFwdAlgoGEMM,<unused>
336-45-45-5x5-336-21-21-64-0x0-2x2-1x1-0-NCHW-FP32-F_g336=miopenConvolutionFwdAlgoDirect:ConvOclDirectFwd,0.63092,0,miopenConvolutionFwdAlgoDirect,<unused>;miopenConvolutionFwdAlgoWinograd:ConvBinWinogradRxSf2x3,12.5206,0,miopenConvolutionFwdAlgoWinograd,<unused>;miopenConvolutionFwdAlgoGEMM:GemmFwdRest,23.0322,14817600,miopenConvolutionFwdAlgoGEMM,<unused>
336-21-21-5x5-336-21-21-64-2x2-1x1-1x1-0-NCHW-FP32-F_g336=miopenConvolutionFwdAlgoDirect:ConvOclDirectFwd,0.4576,0,miopenConvolutionFwdAlgoDirect,<unused>;miopenConvolutionFwdAlgoWinograd:ConvBinWinogradRxSf2x3,2.80976,0,miopenConvolutionFwdAlgoWinograd,<unused>;miopenConvolutionFwdAlgoGEMM:GemmFwdRest,17.8456,14817600,miopenConvolutionFwdAlgoGEMM,<unused>
672-21-21-1x1-336-21-21-64-0x0-1x1-1x1-0-NCHW-FP32-F=miopenConvolutionFwdAlgoImplicitGEMM:ConvHipImplicitGemmV4R1Fwd,2.21372,0,miopenConvolutionFwdAlgoImplicitGEMM,<unused>;miopenConvolutionFwdAlgoDirect:ConvDirectNaiveConvFwd,54.4335,0,miopenConvolutionFwdAlgoDirect,<unused>;miopenConvolutionFwdAlgoWinograd:ConvBinWinogradRxSf3x2,1.46512,0,miopenConvolutionFwdAlgoWinograd,<unused>;miopenConvolutionFwdAlgoGEMM:GemmFwd1x1_0_1,6.11524,0,miopenConvolutionFwdAlgoGEMM,<unused>
336-21-21-3x3-336-21-21-64-1x1-1x1-1x1-0-NCHW-FP32-F_g336=miopenConvolutionFwdAlgoDirect:ConvOclDirectFwd,0.1688,0,miopenConvolutionFwdAlgoDirect,<unused>;miopenConvolutionFwdAlgoWinograd:ConvBinWinogradRxSf2x3,5.4708,0,miopenConvolutionFwdAlgoWinograd,<unused>;miopenConvolutionFwdAlgoGEMM:GemmFwdRest,14.5509,5334336,miopenConvolutionFwdAlgoGEMM,<unused>
1344-21-21-1x1-672-21-21-64-0x0-1x1-1x1-0-NCHW-FP32-F=miopenConvolutionFwdAlgoImplicitGEMM:ConvHipImplicitGemmV4R4Fwd,4.57596,0,miopenConvolutionFwdAlgoImplicitGEMM,<unused>;miopenConvolutionFwdAlgoDirect:ConvDirectNaiveConvFwd,235.119,0,miopenConvolutionFwdAlgoDirect,<unused>;miopenConvolutionFwdAlgoWinograd:ConvBinWinogradRxSf3x2,4.7914,0,miopenConvolutionFwdAlgoWinograd,<unused>;miopenConvolutionFwdAlgoGEMM:GemmFwd1x1_0_1,4.33206,0,miopenConvolutionFwdAlgoGEMM,<unused>
1008-21-21-1x1-168-21-21-64-0x0-1x1-1x1-0-NCHW-FP32-F=miopenConvolutionFwdAlgoDirect:ConvDirectNaiveConvFwd,43.2415,0,miopenConvolutionFwdAlgoDirect,<unused>;miopenConvolutionFwdAlgoWinograd:ConvBinWinogradRxSf3x2,1.32756,0,miopenConvolutionFwdAlgoWinograd,<unused>;miopenConvolutionFwdAlgoGEMM:GemmFwd1x1_0_1,5.44597,0,miopenConvolutionFwdAlgoGEMM,<unused>
2016-21-21-1x1-672-21-21-64-0x0-1x1-1x1-0-NCHW-FP32-F=miopenConvolutionFwdAlgoImplicitGEMM:ConvHipImplicitGemmV4R4Fwd,8.28004,0,miopenConvolutionFwdAlgoImplicitGEMM,<unused>;miopenConvolutionFwdAlgoDirect:ConvDirectNaiveConvFwd,370.997,0,miopenConvolutionFwdAlgoDirect,<unused>;miopenConvolutionFwdAlgoWinograd:ConvBinWinogradRxSf3x2,7.67071,0,miopenConvolutionFwdAlgoWinograd,<unused>;miopenConvolutionFwdAlgoGEMM:GemmFwd1x1_0_1,5.98652,0,miopenConvolutionFwdAlgoGEMM,<unused>
2016-21-21-1x1-336-21-21-64-0x0-1x1-1x1-0-NCHW-FP32-F=miopenConvolutionFwdAlgoImplicitGEMM:ConvHipImplicitGemmV4R1Fwd,10.1408,0,miopenConvolutionFwdAlgoImplicitGEMM,<unused>;miopenConvolutionFwdAlgoDirect:ConvDirectNaiveConvFwd,166.491,0,miopenConvolutionFwdAlgoDirect,<unused>;miopenConvolutionFwdAlgoWinograd:ConvBinWinogradRxSf3x2,4.22036,0,miopenConvolutionFwdAlgoWinograd,<unused>;miopenConvolutionFwdAlgoGEMM:GemmFwd1x1_0_1,4.48062,0,miopenConvolutionFwdAlgoGEMM,<unused>
672-21-21-7x7-672-11-11-64-3x3-2x2-1x1-0-NCHW-FP32-F_g672=miopenConvolutionFwdAlgoDirect:ConvOclDirectFwd,0.42684,0,miopenConvolutionFwdAlgoDirect,<unused>;miopenConvolutionFwdAlgoWinograd:ConvBinWinogradRxSf2x3,12.7666,0,miopenConvolutionFwdAlgoWinograd,<unused>;miopenConvolutionFwdAlgoGEMM:GemmFwdRest,28.6208,15937152,miopenConvolutionFwdAlgoGEMM,<unused>
672-11-11-1x1-672-11-11-64-0x0-1x1-1x1-0-NCHW-FP32-F=miopenConvolutionFwdAlgoImplicitGEMM:ConvHipImplicitGemmV4R4Fwd,0.476,0,miopenConvolutionFwdAlgoImplicitGEMM,<unused>;miopenConvolutionFwdAlgoDirect:ConvDirectNaiveConvFwd,31.2001,0,miopenConvolutionFwdAlgoDirect,<unused>;miopenConvolutionFwdAlgoWinograd:ConvBinWinogradRxSf3x2,0.98712,0,miopenConvolutionFwdAlgoWinograd,<unused>;miopenConvolutionFwdAlgoGEMM:GemmFwd1x1_0_1,5.86112,0,miopenConvolutionFwdAlgoGEMM,<unused>
672-11-11-7x7-672-11-11-64-3x3-1x1-1x1-0-NCHW-FP32-F_g672=miopenConvolutionFwdAlgoDirect:ConvOclDirectFwd,0.23044,0,miopenConvolutionFwdAlgoDirect,<unused>;miopenConvolutionFwdAlgoWinograd:ConvBinWinogradRxSf2x3,4.88296,0,miopenConvolutionFwdAlgoWinograd,<unused>;miopenConvolutionFwdAlgoGEMM:GemmFwdRest,28.3928,15937152,miopenConvolutionFwdAlgoGEMM,<unused>
672-21-21-5x5-672-11-11-64-2x2-2x2-1x1-0-NCHW-FP32-F_g672=miopenConvolutionFwdAlgoDirect:ConvOclDirectFwd,1.25956,0,miopenConvolutionFwdAlgoDirect,<unused>;miopenConvolutionFwdAlgoWinograd:ConvBinWinogradRxSf2x3,8.13315,0,miopenConvolutionFwdAlgoWinograd,<unused>;miopenConvolutionFwdAlgoGEMM:GemmFwdRest,19.3048,8131200,miopenConvolutionFwdAlgoGEMM,<unused>
672-11-11-5x5-672-11-11-64-2x2-1x1-1x1-0-NCHW-FP32-F_g672=miopenConvolutionFwdAlgoDirect:ConvOclDirectFwd,0.18452,0,miopenConvolutionFwdAlgoDirect,<unused>;miopenConvolutionFwdAlgoWinograd:ConvBinWinogradRxSf2x3,4.11888,0,miopenConvolutionFwdAlgoWinograd,<unused>;miopenConvolutionFwdAlgoGEMM:GemmFwdRest,17.7407,8131200,miopenConvolutionFwdAlgoGEMM,<unused>
1344-11-11-1x1-672-11-11-64-0x0-1x1-1x1-0-NCHW-FP32-F=miopenConvolutionFwdAlgoImplicitGEMM:ConvHipImplicitGemmV4R4Fwd,0.913599,0,miopenConvolutionFwdAlgoImplicitGEMM,<unused>;miopenConvolutionFwdAlgoDirect:ConvDirectNaiveConvFwd,62.0645,0,miopenConvolutionFwdAlgoDirect,<unused>;miopenConvolutionFwdAlgoWinograd:ConvBinWinogradRxSf3x2,1.87808,0,miopenConvolutionFwdAlgoWinograd,<unused>;miopenConvolutionFwdAlgoGEMM:GemmFwd1x1_0_1,5.76168,0,miopenConvolutionFwdAlgoGEMM,<unused>
672-11-11-3x3-672-11-11-64-1x1-1x1-1x1-0-NCHW-FP32-F_g672=miopenConvolutionFwdAlgoDirect:ConvOclDirectFwd,0.774639,0,miopenConvolutionFwdAlgoDirect,<unused>;miopenConvolutionFwdAlgoWinograd:ConvBinWinogradRxSf2x3,5.37776,0,miopenConvolutionFwdAlgoWinograd,<unused>;miopenConvolutionFwdAlgoGEMM:GemmFwdRest,14.5484,2927232,miopenConvolutionFwdAlgoGEMM,<unused>
2688-11-11-1x1-1344-11-11-64-0x0-1x1-1x1-0-NCHW-FP32-F=miopenConvolutionFwdAlgoImplicitGEMM:ConvHipImplicitGemmV4R4Fwd,3.59992,0,miopenConvolutionFwdAlgoImplicitGEMM,<unused>;miopenConvolutionFwdAlgoDirect:ConvDirectNaiveConvFwd,252.669,0,miopenConvolutionFwdAlgoDirect,<unused>;miopenConvolutionFwdAlgoWinograd:ConvBinWinogradRxSf3x2,6.18752,0,miopenConvolutionFwdAlgoWinograd,<unused>;miopenConvolutionFwdAlgoGEMM:GemmFwd1x1_0_1,13.0472,0,miopenConvolutionFwdAlgoGEMM,<unused>
2016-11-11-1x1-336-11-11-64-0x0-1x1-1x1-0-NCHW-FP32-F=miopenConvolutionFwdAlgoImplicitGEMM:ConvHipImplicitGemmV4R1Fwd,1.90252,0,miopenConvolutionFwdAlgoImplicitGEMM,<unused>;miopenConvolutionFwdAlgoDirect:ConvDirectNaiveConvFwd,46.5706,0,miopenConvolutionFwdAlgoDirect,<unused>;miopenConvolutionFwdAlgoWinograd:ConvBinWinogradRxSf2x3g1,2.7392,0,miopenConvolutionFwdAlgoWinograd,<unused>;miopenConvolutionFwdAlgoGEMM:GemmFwd1x1_0_1,4.23568,0,miopenConvolutionFwdAlgoGEMM,<unused>
4032-11-11-1x1-1344-11-11-64-0x0-1x1-1x1-0-NCHW-FP32-F=miopenConvolutionFwdAlgoImplicitGEMM:ConvHipImplicitGemmV4R4Fwd,4.96124,0,miopenConvolutionFwdAlgoImplicitGEMM,<unused>;miopenConvolutionFwdAlgoDirect:ConvDirectNaiveConvFwd,434.393,0,miopenConvolutionFwdAlgoDirect,<unused>;miopenConvolutionFwdAlgoWinograd:ConvBinWinogradRxSf3x2,9.45863,0,miopenConvolutionFwdAlgoWinograd,<unused>;miopenConvolutionFwdAlgoGEMM:GemmFwd1x1_0_1,11.3399,0,miopenConvolutionFwdAlgoGEMM,<unused>
4032-11-11-1x1-672-11-11-64-0x0-1x1-1x1-0-NCHW-FP32-F=miopenConvolutionFwdAlgoImplicitGEMM:ConvHipImplicitGemmV4R4Fwd,2.94128,0,miopenConvolutionFwdAlgoImplicitGEMM,<unused>;miopenConvolutionFwdAlgoDirect:ConvDirectNaiveConvFwd,222.947,0,miopenConvolutionFwdAlgoDirect,<unused>;miopenConvolutionFwdAlgoWinograd:ConvBinWinogradRxSf3x2,5.10963,0,miopenConvolutionFwdAlgoWinograd,<unused>;miopenConvolutionFwdAlgoGEMM:GemmFwd1x1_0_1,6.25133,0,miopenConvolutionFwdAlgoGEMM,<unused>
64-56-56-3x3-64-28-28-64-1x1-2x2-1x1-0-NCHW-FP32-F=miopenConvolutionFwdAlgoImplicitGEMM:ConvHipImplicitGemmV4R1Fwd,0.268479,0,miopenConvolutionFwdAlgoImplicitGEMM,<unused>;miopenConvolutionFwdAlgoDirect:ConvOclDirectFwd,5.51838,0,miopenConvolutionFwdAlgoDirect,<unused>;miopenConvolutionFwdAlgoWinograd:ConvBinWinogradRxSf2x3g1,1.95223,0,miopenConvolutionFwdAlgoWinograd,<unused>;miopenConvolutionFwdAlgoGEMM:GemmFwdRest,23.5723,1806336,miopenConvolutionFwdAlgoGEMM,<unused>
64-28-28-1x1-256-28-28-64-0x0-1x1-1x1-0-NCHW-FP32-F=miopenConvolutionFwdAlgoImplicitGEMM:ConvHipImplicitGemmV4R4Fwd,0.10724,0,miopenConvolutionFwdAlgoImplicitGEMM,<unused>;miopenConvolutionFwdAlgoDirect:ConvDirectNaiveConvFwd,8.75506,0,miopenConvolutionFwdAlgoDirect,<unused>;miopenConvolutionFwdAlgoWinograd:ConvBinWinogradRxSf2x3g1,2.03375,0,miopenConvolutionFwdAlgoWinograd,<unused>;miopenConvolutionFwdAlgoGEMM:GemmFwd1x1_0_1,0.920837,0,miopenConvolutionFwdAlgoGEMM,<unused>
256-28-28-1x1-128-28-28-64-0x0-1x1-1x1-0-NCHW-FP32-F=miopenConvolutionFwdAlgoImplicitGEMM:ConvHipImplicitGemmV4R1Fwd,0.288879,0,miopenConvolutionFwdAlgoImplicitGEMM,<unused>;miopenConvolutionFwdAlgoDirect:ConvDirectNaiveConvFwd,14.9184,0,miopenConvolutionFwdAlgoDirect,<unused>;miopenConvolutionFwdAlgoWinograd:ConvBinWinogradRxSf2x3g1,2.10563,0,miopenConvolutionFwdAlgoWinograd,<unused>;miopenConvolutionFwdAlgoGEMM:GemmFwd1x1_0_1,0.988797,0,miopenConvolutionFwdAlgoGEMM,<unused>
128-28-28-3x3-128-14-14-64-1x1-2x2-1x1-0-NCHW-FP32-F=miopenConvolutionFwdAlgoImplicitGEMM:ConvHipImplicitGemmV4R1Fwd,0.32304,0,miopenConvolutionFwdAlgoImplicitGEMM,<unused>;miopenConvolutionFwdAlgoDirect:ConvOclDirectFwd,7.78334,0,miopenConvolutionFwdAlgoDirect,<unused>;miopenConvolutionFwdAlgoWinograd:ConvBinWinogradRxSf2x3g1,2.08488,0,miopenConvolutionFwdAlgoWinograd,<unused>;miopenConvolutionFwdAlgoGEMM:GemmFwdRest,11.7658,903168,miopenConvolutionFwdAlgoGEMM,<unused>
128-14-14-1x1-512-14-14-64-0x0-1x1-1x1-0-NCHW-FP32-F=miopenConvolutionFwdAlgoImplicitGEMM:ConvHipImplicitGemmV4R4Fwd,0.11516,0,miopenConvolutionFwdAlgoImplicitGEMM,<unused>;miopenConvolutionFwdAlgoDirect:ConvDirectNaiveConvFwd,9.88398,0,miopenConvolutionFwdAlgoDirect,<unused>;miopenConvolutionFwdAlgoWinograd:ConvBinWinogradRxSf2x3g1,1.92804,0,miopenConvolutionFwdAlgoWinograd,<unused>;miopenConvolutionFwdAlgoGEMM:GemmFwd1x1_0_1,2.04728,0,miopenConvolutionFwdAlgoGEMM,<unused>
512-14-14-1x1-256-14-14-64-0x0-1x1-1x1-0-NCHW-FP32-F=miopenConvolutionFwdAlgoImplicitGEMM:ConvHipImplicitGemmV4R4Fwd,0.3072,0,miopenConvolutionFwdAlgoImplicitGEMM,<unused>;miopenConvolutionFwdAlgoDirect:ConvDirectNaiveConvFwd,18.0866,0,miopenConvolutionFwdAlgoDirect,<unused>;miopenConvolutionFwdAlgoWinograd:ConvBinWinogradRxSf2x3g1,0.840678,0,miopenConvolutionFwdAlgoWinograd,<unused>;miopenConvolutionFwdAlgoGEMM:GemmFwd1x1_0_1,3.78303,0,miopenConvolutionFwdAlgoGEMM,<unused>
256-14-14-3x3-256-7-7-64-1x1-2x2-1x1-0-NCHW-FP32-F=miopenConvolutionFwdAlgoImplicitGEMM:ConvHipImplicitGemmV4R1Fwd,0.383319,0,miopenConvolutionFwdAlgoImplicitGEMM,<unused>;miopenConvolutionFwdAlgoDirect:ConvOclDirectFwd,7.67808,0,miopenConvolutionFwdAlgoDirect,<unused>;miopenConvolutionFwdAlgoWinograd:ConvBinWinogradRxSf2x3g1,2.72751,0,miopenConvolutionFwdAlgoWinograd,<unused>;miopenConvolutionFwdAlgoGEMM:GemmFwdRest,19.9628,451584,miopenConvolutionFwdAlgoGEMM,<unused>
256-7-7-1x1-1024-7-7-64-0x0-1x1-1x1-0-NCHW-FP32-F=miopenConvolutionFwdAlgoImplicitGEMM:ConvHipImplicitGemmV4R4Fwd,0.131679,0,miopenConvolutionFwdAlgoImplicitGEMM,<unused>;miopenConvolutionFwdAlgoDirect:ConvDirectNaiveConvFwd,9.40478,0,miopenConvolutionFwdAlgoDirect,<unused>;miopenConvolutionFwdAlgoWinograd:ConvBinWinogradRxSf2x3g1,2.52983,0,miopenConvolutionFwdAlgoWinograd,<unused>;miopenConvolutionFwdAlgoGEMM:GemmFwd1x1_0_1,1.97124,0,miopenConvolutionFwdAlgoGEMM,<unused>
1024-7-7-1x1-512-7-7-64-0x0-1x1-1x1-0-NCHW-FP32-F=miopenConvolutionFwdAlgoImplicitGEMM:ConvHipImplicitGemmV4R4Fwd,0.27872,0,miopenConvolutionFwdAlgoImplicitGEMM,<unused>;miopenConvolutionFwdAlgoDirect:ConvDirectNaiveConvFwd,17.9868,0,miopenConvolutionFwdAlgoDirect,<unused>;miopenConvolutionFwdAlgoWinograd:ConvBinWinogradRxSf2x3g1,1.15972,0,miopenConvolutionFwdAlgoWinograd,<unused>;miopenConvolutionFwdAlgoGEMM:GemmFwd1x1_0_1,4.32819,0,miopenConvolutionFwdAlgoGEMM,<unused>
2048-1-1-1x1-1001-1-1-64-0x0-1x1-1x1-0-NCHW-FP32-F=miopenConvolutionFwdAlgoDirect:ConvDirectNaiveConvFwd,69.0586,0,miopenConvolutionFwdAlgoDirect,<unused>;miopenConvolutionFwdAlgoWinograd:ConvBinWinogradRxSf2x3g1,0.344039,0,miopenConvolutionFwdAlgoWinograd,<unused>;miopenConvolutionFwdAlgoGEMM:GemmFwd1x1_0_1,5.30689,0,miopenConvolutionFwdAlgoGEMM,<unused>
3-224-224-7x7-64-112-112-1-3x3-2x2-1x1-0-NCHW-FP32-F=miopenConvolutionFwdAlgoDirect:ConvOclDirectFwd,0.178241,0,miopenConvolutionFwdAlgoDirect,<unused>;miopenConvolutionFwdAlgoWinograd:ConvBinWinogradRxSf2x3g1,0.153721,0,miopenConvolutionFwdAlgoWinograd,<unused>;miopenConvolutionFwdAlgoGEMM:GemmFwdRest,0.178,7375872,miopenConvolutionFwdAlgoGEMM,<unused>
64-56-56-1x1-64-56-56-1-0x0-1x1-1x1-0-NCHW-FP32-F=miopenConvolutionFwdAlgoImplicitGEMM:ConvHipImplicitGemmV4R4Fwd,0.03708,0,miopenConvolutionFwdAlgoImplicitGEMM,<unused>;miopenConvolutionFwdAlgoDirect:ConvDirectNaiveConvFwd,1.10112,0,miopenConvolutionFwdAlgoDirect,<unused>;miopenConvolutionFwdAlgoWinograd:ConvBinWinogradRxSf2x3g1,0.08452,0,miopenConvolutionFwdAlgoWinograd,<unused>;miopenConvolutionFwdAlgoGEMM:GemmFwd1x1_0_1,0.056,0,miopenConvolutionFwdAlgoGEMM,<unused>
64-56-56-3x3-64-56-56-1-1x1-1x1-1x1-0-NCHW-FP32-F=miopenConvolutionFwdAlgoImplicitGEMM:ConvHipImplicitGemmV4R4Fwd,0.2048,0,miopenConvolutionFwdAlgoImplicitGEMM,<unused>;miopenConvolutionFwdAlgoDirect:ConvOclDirectFwd,0.32588,0,miopenConvolutionFwdAlgoDirect,<unused>;miopenConvolutionFwdAlgoWinograd:ConvBinWinogradRxSf2x3g1,0.08452,0,miopenConvolutionFwdAlgoWinograd,<unused>;miopenConvolutionFwdAlgoGEMM:GemmFwdRest,0.22172,7225344,miopenConvolutionFwdAlgoGEMM,<unused>
128-56-56-1x1-256-56-56-1-0x0-1x1-1x1-0-NCHW-FP32-F=miopenConvolutionFwdAlgoImplicitGEMM:ConvHipImplicitGemmV4R4Fwd,0.09268,0,miopenConvolutionFwdAlgoImplicitGEMM,<unused>;miopenConvolutionFwdAlgoDirect:ConvDirectNaiveConvFwd,5.59304,0,miopenConvolutionFwdAlgoDirect,<unused>;miopenConvolutionFwdAlgoWinograd:ConvBinWinogradRxSf3x2,0.24892,0,miopenConvolutionFwdAlgoWinograd,<unused>;miopenConvolutionFwdAlgoGEMM:GemmFwd1x1_0_1,0.11212,0,miopenConvolutionFwdAlgoGEMM,<unused>
256-56-56-1x1-64-56-56-1-0x0-1x1-1x1-0-NCHW-FP32-F=miopenConvolutionFwdAlgoImplicitGEMM:ConvHipImplicitGemmV4R4Fwd,0.09044,0,miopenConvolutionFwdAlgoImplicitGEMM,<unused>;miopenConvolutionFwdAlgoDirect:ConvDirectNaiveConvFwd,4.33104,0,miopenConvolutionFwdAlgoDirect,<unused>;miopenConvolutionFwdAlgoWinograd:ConvBinWinogradRxSf2x3g1,0.20476,0,miopenConvolutionFwdAlgoWinograd,<unused>;miopenConvolutionFwdAlgoGEMM:GemmFwd1x1_0_1,0.10612,0,miopenConvolutionFwdAlgoGEMM,<unused>
64-56-56-1x1-256-56-56-1-0x0-1x1-1x1-0-NCHW-FP32-F=miopenConvolutionFwdAlgoImplicitGEMM:ConvHipImplicitGemmV4R4Fwd,0.05864,0,miopenConvolutionFwdAlgoImplicitGEMM,<unused>;miopenConvolutionFwdAlgoDirect:ConvDirectNaiveConvFwd,2.82824,0,miopenConvolutionFwdAlgoDirect,<unused>;miopenConvolutionFwdAlgoWinograd:ConvBinWinogradRxSf3x2,0.17188,0,miopenConvolutionFwdAlgoWinograd,<unused>;miopenConvolutionFwdAlgoGEMM:GemmFwd1x1_0_1,0.07472,0,miopenConvolutionFwdAlgoGEMM,<unused>
256-56-56-1x1-128-56-56-1-0x0-1x1-1x1-0-NCHW-FP32-F=miopenConvolutionFwdAlgoImplicitGEMM:ConvHipImplicitGemmV4R4Fwd,0.10464,0,miopenConvolutionFwdAlgoImplicitGEMM,<unused>;miopenConvolutionFwdAlgoDirect:ConvDirectNaiveConvFwd,6.20752,0,miopenConvolutionFwdAlgoDirect,<unused>;miopenConvolutionFwdAlgoWinograd:ConvBinWinogradRxSf3x2,0.23304,0,miopenConvolutionFwdAlgoWinograd,<unused>;miopenConvolutionFwdAlgoGEMM:GemmFwd1x1_0_1,0.22691,0,miopenConvolutionFwdAlgoGEMM,<unused>
128-56-56-3x3-128-28-28-1-1x1-2x2-1x1-0-NCHW-FP32-F=miopenConvolutionFwdAlgoDirect:ConvOclDirectFwd,0.79272,0,miopenConvolutionFwdAlgoDirect,<unused>;miopenConvolutionFwdAlgoWinograd:ConvBinWinogradRxSf2x3g1,0.37872,0,miopenConvolutionFwdAlgoWinograd,<unused>;miopenConvolutionFwdAlgoGEMM:GemmFwdRest,0.27212,3612672,miopenConvolutionFwdAlgoGEMM,<unused>
384-28-28-1x1-512-28-28-1-0x0-1x1-1x1-0-NCHW-FP32-F=miopenConvolutionFwdAlgoDirect:ConvDirectNaiveConvFwd,8.23468,0,miopenConvolutionFwdAlgoDirect,<unused>;miopenConvolutionFwdAlgoWinograd:ConvBinWinogradRxSf3x2,0.31276,0,miopenConvolutionFwdAlgoWinograd,<unused>;miopenConvolutionFwdAlgoGEMM:GemmFwd1x1_0_1,0.20776,0,miopenConvolutionFwdAlgoGEMM,<unused>
512-28-28-1x1-128-28-28-1-0x0-1x1-1x1-0-NCHW-FP32-F=miopenConvolutionFwdAlgoDirect:ConvDirectNaiveConvFwd,3.17984,0,miopenConvolutionFwdAlgoDirect,<unused>;miopenConvolutionFwdAlgoWinograd:ConvBinWinogradRxSf2x3g1,0.35632,0,miopenConvolutionFwdAlgoWinograd,<unused>;miopenConvolutionFwdAlgoGEMM:GemmFwd1x1_0_1,0.27408,0,miopenConvolutionFwdAlgoGEMM,<unused>
128-28-28-3x3-128-28-28-1-1x1-1x1-1x1-0-NCHW-FP32-F=miopenConvolutionFwdAlgoDirect:ConvOclDirectFwd,0.4816,0,miopenConvolutionFwdAlgoDirect,<unused>;miopenConvolutionFwdAlgoWinograd:ConvBinWinogradRxSf2x3g1,0.13372,0,miopenConvolutionFwdAlgoWinograd,<unused>;miopenConvolutionFwdAlgoGEMM:GemmFwdRest,0.27964,3612672,miopenConvolutionFwdAlgoGEMM,<unused>
128-28-28-1x1-512-28-28-1-0x0-1x1-1x1-0-NCHW-FP32-F=miopenConvolutionFwdAlgoDirect:ConvDirectNaiveConvFwd,2.77904,0,miopenConvolutionFwdAlgoDirect,<unused>;miopenConvolutionFwdAlgoWinograd:ConvBinWinogradRxSf3x2,0.15832,0,miopenConvolutionFwdAlgoWinograd,<unused>;miopenConvolutionFwdAlgoGEMM:GemmFwd1x1_0_1,0.08536,0,miopenConvolutionFwdAlgoGEMM,<unused>
512-28-28-1x1-256-28-28-1-0x0-1x1-1x1-0-NCHW-FP32-F=miopenConvolutionFwdAlgoDirect:ConvDirectNaiveConvFwd,5.81424,0,miopenConvolutionFwdAlgoDirect,<unused>;miopenConvolutionFwdAlgoWinograd:ConvBinWinogradRxSf2x3g1,0.35768,0,miopenConvolutionFwdAlgoWinograd,<unused>;miopenConvolutionFwdAlgoGEMM:GemmFwd1x1_0_1,0.27276,0,miopenConvolutionFwdAlgoGEMM,<unused>
256-28-28-3x3-256-14-14-1-1x1-2x2-1x1-0-NCHW-FP32-F=miopenConvolutionFwdAlgoDirect:ConvOclDirectFwd,1.07084,0,miopenConvolutionFwdAlgoDirect,<unused>;miopenConvolutionFwdAlgoWinograd:ConvBinWinogradRxSf2x3g1,0.71988,0,miopenConvolutionFwdAlgoWinograd,<unused>;miopenConvolutionFwdAlgoGEMM:GemmFwdRest,0.42524,1806336,miopenConvolutionFwdAlgoGEMM,<unused>
768-14-14-1x1-1024-14-14-1-0x0-1x1-1x1-0-NCHW-FP32-F=miopenConvolutionFwdAlgoDirect:ConvDirectNaiveConvFwd,9.19112,0,miopenConvolutionFwdAlgoDirect,<unused>;miopenConvolutionFwdAlgoWinograd:ConvBinWinogradRxSf2x3g1,0.51016,0,miopenConvolutionFwdAlgoWinograd,<unused>;miopenConvolutionFwdAlgoGEMM:GemmFwd1x1_0_1,0.38112,0,miopenConvolutionFwdAlgoGEMM,<unused>
1024-14-14-1x1-256-14-14-1-0x0-1x1-1x1-0-NCHW-FP32-F=miopenConvolutionFwdAlgoDirect:ConvDirectNaiveConvFwd,3.65344,0,miopenConvolutionFwdAlgoDirect,<unused>;miopenConvolutionFwdAlgoWinograd:ConvBinWinogradRxSf2x3g1,0.67596,0,miopenConvolutionFwdAlgoWinograd,<unused>;miopenConvolutionFwdAlgoGEMM:GemmFwd1x1_0_1,0.28936,0,miopenConvolutionFwdAlgoGEMM,<unused>
256-14-14-3x3-256-14-14-1-1x1-1x1-1x1-0-NCHW-FP32-F=miopenConvolutionFwdAlgoDirect:ConvOclDirectFwd,0.54108,0,miopenConvolutionFwdAlgoDirect,<unused>;miopenConvolutionFwdAlgoWinograd:ConvBinWinogradRxSf2x3g1,0.19908,0,miopenConvolutionFwdAlgoWinograd,<unused>;miopenConvolutionFwdAlgoGEMM:GemmFwdRest,0.41604,1806336,miopenConvolutionFwdAlgoGEMM,<unused>
256-14-14-1x1-1024-14-14-1-0x0-1x1-1x1-0-NCHW-FP32-F=miopenConvolutionFwdAlgoDirect:ConvDirectNaiveConvFwd,3.12144,0,miopenConvolutionFwdAlgoDirect,<unused>;miopenConvolutionFwdAlgoWinograd:ConvBinWinogradRxSf2x3g1,0.20284,0,miopenConvolutionFwdAlgoWinograd,<unused>;miopenConvolutionFwdAlgoGEMM:GemmFwd1x1_0_1,0.17296,0,miopenConvolutionFwdAlgoGEMM,<unused>
1024-14-14-1x1-512-14-14-1-0x0-1x1-1x1-0-NCHW-FP32-F=miopenConvolutionFwdAlgoDirect:ConvDirectNaiveConvFwd,6.81976,0,miopenConvolutionFwdAlgoDirect,<unused>;miopenConvolutionFwdAlgoWinograd:ConvBinWinogradRxSf2x3g1,0.67852,0,miopenConvolutionFwdAlgoWinograd,<unused>;miopenConvolutionFwdAlgoGEMM:GemmFwd1x1_0_1,0.47416,0,miopenConvolutionFwdAlgoGEMM,<unused>
512-14-14-3x3-512-7-7-1-1x1-2x2-1x1-0-NCHW-FP32-F=miopenConvolutionFwdAlgoDirect:ConvOclDirectFwd,1.76324,0,miopenConvolutionFwdAlgoDirect,<unused>;miopenConvolutionFwdAlgoWinograd:ConvBinWinogradRxSf2x3g1,1.3876,0,miopenConvolutionFwdAlgoWinograd,<unused>;miopenConvolutionFwdAlgoGEMM:GemmFwdRest,0.30068,903168,miopenConvolutionFwdAlgoGEMM,<unused>
1536-7-7-1x1-2048-7-7-1-0x0-1x1-1x1-0-NCHW-FP32-F=miopenConvolutionFwdAlgoDirect:ConvDirectNaiveConvFwd,4.1825,0,miopenConvolutionFwdAlgoDirect,<unused>;miopenConvolutionFwdAlgoWinograd:ConvBinWinogradRxSf2x3g1,1.05916,0,miopenConvolutionFwdAlgoWinograd,<unused>;miopenConvolutionFwdAlgoGEMM:GemmFwd1x1_0_1,0.3096,0,miopenConvolutionFwdAlgoGEMM,<unused>
2048-7-7-1x1-512-7-7-1-0x0-1x1-1x1-0-NCHW-FP32-F=miopenConvolutionFwdAlgoDirect:ConvDirectNaiveConvFwd,2.47568,0,miopenConvolutionFwdAlgoDirect,<unused>;miopenConvolutionFwdAlgoWinograd:ConvBinWinogradRxSf2x3g1,1.3274,0,miopenConvolutionFwdAlgoWinograd,<unused>;miopenConvolutionFwdAlgoGEMM:GemmFwd1x1_0_1,0.37564,0,miopenConvolutionFwdAlgoGEMM,<unused>
512-7-7-3x3-512-7-7-1-1x1-1x1-1x1-0-NCHW-FP32-F=miopenConvolutionFwdAlgoDirect:ConvOclDirectFwd,0.73192,0,miopenConvolutionFwdAlgoDirect,<unused>;miopenConvolutionFwdAlgoWinograd:ConvBinWinogradRxSf2x3g1,0.35548,0,miopenConvolutionFwdAlgoWinograd,<unused>;miopenConvolutionFwdAlgoGEMM:GemmFwdRest,0.28584,903168,miopenConvolutionFwdAlgoGEMM,<unused>
512-7-7-1x1-2048-7-7-1-0x0-1x1-1x1-0-NCHW-FP32-F=miopenConvolutionFwdAlgoDirect:ConvDirectNaiveConvFwd,3.14996,0,miopenConvolutionFwdAlgoDirect,<unused>;miopenConvolutionFwdAlgoWinograd:ConvBinWinogradRxSf3x2,0.42748,0,miopenConvolutionFwdAlgoWinograd,<unused>;miopenConvolutionFwdAlgoGEMM:GemmFwd1x1_0_1,0.12676,0,miopenConvolutionFwdAlgoGEMM,<unused>
3-299-299-3x3-32-149-149-1-0x0-2x2-1x1-0-NCHW-FP32-F=miopenConvolutionFwdAlgoDirect:ConvOclDirectFwd,0.08032,0,miopenConvolutionFwdAlgoDirect,<unused>;miopenConvolutionFwdAlgoWinograd:ConvBinWinogradRxSf2x3g1,0.09136,0,miopenConvolutionFwdAlgoWinograd,<unused>;miopenConvolutionFwdAlgoGEMM:GemmFwdRest,0.14284,2397708,miopenConvolutionFwdAlgoGEMM,<unused>
32-149-149-3x3-32-147-147-1-0x0-1x1-1x1-0-NCHW-FP32-F=miopenConvolutionFwdAlgoDirect:ConvOclDirectFwd,0.3438,0,miopenConvolutionFwdAlgoDirect,<unused>;miopenConvolutionFwdAlgoWinograd:ConvBinWinogradRxSf2x3g1,0.11812,0,miopenConvolutionFwdAlgoWinograd,<unused>;miopenConvolutionFwdAlgoGEMM:GemmFwdRest,0.401401,24893568,miopenConvolutionFwdAlgoGEMM,<unused>
32-147-147-3x3-64-147-147-1-1x1-1x1-1x1-0-NCHW-FP32-F=miopenConvolutionFwdAlgoDirect:ConvOclDirectFwd,0.629521,0,miopenConvolutionFwdAlgoDirect,<unused>;miopenConvolutionFwdAlgoWinograd:ConvBinWinogradRxSf2x3g1,0.16988,0,miopenConvolutionFwdAlgoWinograd,<unused>;miopenConvolutionFwdAlgoGEMM:GemmFwdRest,0.58512,24893568,miopenConvolutionFwdAlgoGEMM,<unused>
64-73-73-1x1-80-73-73-1-0x0-1x1-1x1-0-NCHW-FP32-F=miopenConvolutionFwdAlgoDirect:ConvDirectNaiveConvFwd,2.72328,0,miopenConvolutionFwdAlgoDirect,<unused>;miopenConvolutionFwdAlgoWinograd:ConvBinWinogradRxSf3x2,0.11972,0,miopenConvolutionFwdAlgoWinograd,<unused>;miopenConvolutionFwdAlgoGEMM:GemmFwd1x1_0_1,0.06792,0,miopenConvolutionFwdAlgoGEMM,<unused>
80-73-73-3x3-192-71-71-1-0x0-1x1-1x1-0-NCHW-FP32-F=miopenConvolutionFwdAlgoDirect:ConvOclDirectFwd,1.38236,0,miopenConvolutionFwdAlgoDirect,<unused>;miopenConvolutionFwdAlgoWinograd:ConvBinWinogradRxSf2x3g1,0.262839,0,miopenConvolutionFwdAlgoWinograd,<unused>;miopenConvolutionFwdAlgoGEMM:GemmFwdRest,0.585278,14518080,miopenConvolutionFwdAlgoGEMM,<unused>
192-35-35-1x1-128-35-35-1-0x0-1x1-1x1-0-NCHW-FP32-F=miopenConvolutionFwdAlgoDirect:ConvDirectNaiveConvFwd,1.92016,0,miopenConvolutionFwdAlgoDirect,<unused>;miopenConvolutionFwdAlgoWinograd:ConvBinWinogradRxSf2x3g1,0.1626,0,miopenConvolutionFwdAlgoWinograd,<unused>;miopenConvolutionFwdAlgoGEMM:GemmFwd1x1_0_1,0.08972,0,miopenConvolutionFwdAlgoGEMM,<unused>
192-35-35-1x1-48-35-35-1-0x0-1x1-1x1-0-NCHW-FP32-F=miopenConvolutionFwdAlgoDirect:ConvDirectNaiveConvFwd,1.30248,0,miopenConvolutionFwdAlgoDirect,<unused>;miopenConvolutionFwdAlgoWinograd:ConvBinWinogradRxSf2x3g1,0.17248,0,miopenConvolutionFwdAlgoWinograd,<unused>;miopenConvolutionFwdAlgoGEMM:GemmFwd1x1_0_1,0.06068,0,miopenConvolutionFwdAlgoGEMM,<unused>
48-35-35-5x5-64-35-35-1-2x2-1x1-1x1-0-NCHW-FP32-F=miopenConvolutionFwdAlgoDirect:ConvOclDirectFwd,0.38652,0,miopenConvolutionFwdAlgoDirect,<unused>;miopenConvolutionFwdAlgoWinograd:ConvBinWinogradRxSf2x3g1,0.16496,0,miopenConvolutionFwdAlgoWinograd,<unused>;miopenConvolutionFwdAlgoGEMM:GemmFwdRest,0.298238,5880000,miopenConvolutionFwdAlgoGEMM,<unused>
64-35-35-3x3-96-35-35-1-1x1-1x1-1x1-0-NCHW-FP32-F=miopenConvolutionFwdAlgoDirect:ConvOclDirectFwd,0.30644,0,miopenConvolutionFwdAlgoDirect,<unused>;miopenConvolutionFwdAlgoWinograd:ConvBinWinogradRxSf2x3g1,0.093201,0,miopenConvolutionFwdAlgoWinograd,<unused>;miopenConvolutionFwdAlgoGEMM:GemmFwdRest,0.29912,2822400,miopenConvolutionFwdAlgoGEMM,<unused>
96-35-35-3x3-96-35-35-1-1x1-1x1-1x1-0-NCHW-FP32-F=miopenConvolutionFwdAlgoDirect:ConvOclDirectFwd,0.450561,0,miopenConvolutionFwdAlgoDirect,<unused>;miopenConvolutionFwdAlgoWinograd:ConvBinWinogradRxSf2x3g1,0.11236,0,miopenConvolutionFwdAlgoWinograd,<unused>;miopenConvolutionFwdAlgoGEMM:GemmFwdRest,0.23884,4233600,miopenConvolutionFwdAlgoGEMM,<unused>
192-35-35-1x1-32-35-35-1-0x0-1x1-1x1-0-NCHW-FP32-F=miopenConvolutionFwdAlgoDirect:ConvDirectNaiveConvFwd,1.29992,0,miopenConvolutionFwdAlgoDirect,<unused>;miopenConvolutionFwdAlgoWinograd:ConvBinWinogradRxSf2x3g1,0.17184,0,miopenConvolutionFwdAlgoWinograd,<unused>;miopenConvolutionFwdAlgoGEMM:GemmFwd1x1_0_1,0.06256,0,miopenConvolutionFwdAlgoGEMM,<unused>
256-35-35-1x1-128-35-35-1-0x0-1x1-1x1-0-NCHW-FP32-F=miopenConvolutionFwdAlgoDirect:ConvDirectNaiveConvFwd,2.55316,0,miopenConvolutionFwdAlgoDirect,<unused>;miopenConvolutionFwdAlgoWinograd:ConvBinWinogradRxSf2x3g1,0.20008,0,miopenConvolutionFwdAlgoWinograd,<unused>;miopenConvolutionFwdAlgoGEMM:GemmFwd1x1_0_1,0.10456,0,miopenConvolutionFwdAlgoGEMM,<unused>
256-35-35-1x1-48-35-35-1-0x0-1x1-1x1-0-NCHW-FP32-F=miopenConvolutionFwdAlgoDirect:ConvDirectNaiveConvFwd,1.72876,0,miopenConvolutionFwdAlgoDirect,<unused>;miopenConvolutionFwdAlgoWinograd:ConvBinWinogradRxSf2x3g1,0.20576,0,miopenConvolutionFwdAlgoWinograd,<unused>;miopenConvolutionFwdAlgoGEMM:GemmFwd1x1_0_1,0.07216,0,miopenConvolutionFwdAlgoGEMM,<unused>
256-35-35-1x1-64-35-35-1-0x0-1x1-1x1-0-NCHW-FP32-F=miopenConvolutionFwdAlgoDirect:ConvDirectNaiveConvFwd,1.72948,0,miopenConvolutionFwdAlgoDirect,<unused>;miopenConvolutionFwdAlgoWinograd:ConvBinWinogradRxSf2x3g1,0.1996,0,miopenConvolutionFwdAlgoWinograd,<unused>;miopenConvolutionFwdAlgoGEMM:GemmFwd1x1_0_1,0.10592,0,miopenConvolutionFwdAlgoGEMM,<unused>
288-35-35-1x1-128-35-35-1-0x0-1x1-1x1-0-NCHW-FP32-F=miopenConvolutionFwdAlgoDirect:ConvDirectNaiveConvFwd,2.87092,0,miopenConvolutionFwdAlgoDirect,<unused>;miopenConvolutionFwdAlgoWinograd:ConvBinWinogradRxSf2x3g1,0.21968,0,miopenConvolutionFwdAlgoWinograd,<unused>;miopenConvolutionFwdAlgoGEMM:GemmFwd1x1_0_1,0.14732,0,miopenConvolutionFwdAlgoGEMM,<unused>
288-35-35-1x1-48-35-35-1-0x0-1x1-1x1-0-NCHW-FP32-F=miopenConvolutionFwdAlgoDirect:ConvDirectNaiveConvFwd,1.94292,0,miopenConvolutionFwdAlgoDirect,<unused>;miopenConvolutionFwdAlgoWinograd:ConvBinWinogradRxSf2x3g1,0.2184,0,miopenConvolutionFwdAlgoWinograd,<unused>;miopenConvolutionFwdAlgoGEMM:GemmFwd1x1_0_1,0.07924,0,miopenConvolutionFwdAlgoGEMM,<unused>
288-35-35-1x1-64-35-35-1-0x0-1x1-1x1-0-NCHW-FP32-F=miopenConvolutionFwdAlgoDirect:ConvDirectNaiveConvFwd,1.9454,0,miopenConvolutionFwdAlgoDirect,<unused>;miopenConvolutionFwdAlgoWinograd:ConvBinWinogradRxSf2x3g1,0.21844,0,miopenConvolutionFwdAlgoWinograd,<unused>;miopenConvolutionFwdAlgoGEMM:GemmFwd1x1_0_1,0.1144,0,miopenConvolutionFwdAlgoGEMM,<unused>
288-35-35-3x3-384-17-17-1-0x0-2x2-1x1-0-NCHW-FP32-F=miopenConvolutionFwdAlgoDirect:ConvOclDirectFwd,1.92244,0,miopenConvolutionFwdAlgoDirect,<unused>;miopenConvolutionFwdAlgoWinograd:ConvBinWinogradRxSf2x3g1,0.80888,0,miopenConvolutionFwdAlgoWinograd,<unused>;miopenConvolutionFwdAlgoGEMM:GemmFwdRest,0.538398,2996352,miopenConvolutionFwdAlgoGEMM,<unused>
96-35-35-3x3-96-17-17-1-0x0-2x2-1x1-0-NCHW-FP32-F=miopenConvolutionFwdAlgoDirect:ConvOclDirectFwd,0.546199,0,miopenConvolutionFwdAlgoDirect,<unused>;miopenConvolutionFwdAlgoWinograd:ConvBinWinogradRxSf2x3g1,0.29384,0,miopenConvolutionFwdAlgoWinograd,<unused>;miopenConvolutionFwdAlgoGEMM:GemmFwdRest,0.15236,998784,miopenConvolutionFwdAlgoGEMM,<unused>
768-17-17-1x1-256-17-17-1-0x0-1x1-1x1-0-NCHW-FP32-F=miopenConvolutionFwdAlgoDirect:ConvDirectNaiveConvFwd,3.66972,0,miopenConvolutionFwdAlgoDirect,<unused>;miopenConvolutionFwdAlgoWinograd:ConvBinWinogradRxSf2x3g1,0.53644,0,miopenConvolutionFwdAlgoWinograd,<unused>;miopenConvolutionFwdAlgoGEMM:GemmFwd1x1_0_1,0.24518,0,miopenConvolutionFwdAlgoGEMM,<unused>
768-17-17-1x1-192-17-17-1-0x0-1x1-1x1-0-NCHW-FP32-F=miopenConvolutionFwdAlgoDirect:ConvDirectNaiveConvFwd,2.8542,0,miopenConvolutionFwdAlgoDirect,<unused>;miopenConvolutionFwdAlgoWinograd:ConvBinWinogradRxSf2x3g1,0.53096,0,miopenConvolutionFwdAlgoWinograd,<unused>;miopenConvolutionFwdAlgoGEMM:GemmFwd1x1_0_1,0.21932,0,miopenConvolutionFwdAlgoGEMM,<unused>
128-17-17-1x7-128-17-17-1-0x3-1x1-1x1-0-NCHW-FP32-F=miopenConvolutionFwdAlgoDirect:ConvDirectNaiveConvFwd,1.45428,0,miopenConvolutionFwdAlgoDirect,<unused>;miopenConvolutionFwdAlgoWinograd:ConvBinWinogradRxSf2x3g1,0.373,0,miopenConvolutionFwdAlgoWinograd,<unused>;miopenConvolutionFwdAlgoGEMM:GemmFwdRest,0.163598,1035776,miopenConvolutionFwdAlgoGEMM,<unused>
128-17-17-7x1-192-17-17-1-3x0-1x1-1x1-0-NCHW-FP32-F=miopenConvolutionFwdAlgoDirect:ConvDirectNaiveConvFwd,2.71724,0,miopenConvolutionFwdAlgoDirect,<unused>;miopenConvolutionFwdAlgoWinograd:ConvBinWinogradRxSf2x3g1,0.28404,0,miopenConvolutionFwdAlgoWinograd,<unused>;miopenConvolutionFwdAlgoGEMM:GemmFwdRest,0.187478,1035776,miopenConvolutionFwdAlgoGEMM,<unused>
128-17-17-7x1-128-17-17-1-3x0-1x1-1x1-0-NCHW-FP32-F=miopenConvolutionFwdAlgoDirect:ConvDirectNaiveConvFwd,1.87932,0,miopenConvolutionFwdAlgoDirect,<unused>;miopenConvolutionFwdAlgoWinograd:ConvBinWinogradRxSf2x3g1,0.2864,0,miopenConvolutionFwdAlgoWinograd,<unused>;miopenConvolutionFwdAlgoGEMM:GemmFwdRest,0.17308,1035776,miopenConvolutionFwdAlgoGEMM,<unused>
128-17-17-1x7-192-17-17-1-0x3-1x1-1x1-0-NCHW-FP32-F=miopenConvolutionFwdAlgoDirect:ConvDirectNaiveConvFwd,2.11372,0,miopenConvolutionFwdAlgoDirect,<unused>;miopenConvolutionFwdAlgoWinograd:ConvBinWinogradRxSf2x3g1,0.35768,0,miopenConvolutionFwdAlgoWinograd,<unused>;miopenConvolutionFwdAlgoGEMM:GemmFwdRest,0.18956,1035776,miopenConvolutionFwdAlgoGEMM,<unused>
768-17-17-1x1-320-17-17-1-0x0-1x1-1x1-0-NCHW-FP32-F=miopenConvolutionFwdAlgoDirect:ConvDirectNaiveConvFwd,4.3832,0,miopenConvolutionFwdAlgoDirect,<unused>;miopenConvolutionFwdAlgoWinograd:ConvBinWinogradRxSf2x3g1,0.510999,0,miopenConvolutionFwdAlgoWinograd,<unused>;miopenConvolutionFwdAlgoGEMM:GemmFwd1x1_0_1,0.22056,0,miopenConvolutionFwdAlgoGEMM,<unused>
160-17-17-1x7-160-17-17-1-0x3-1x1-1x1-0-NCHW-FP32-F=miopenConvolutionFwdAlgoDirect:ConvDirectNaiveConvFwd,2.65192,0,miopenConvolutionFwdAlgoDirect,<unused>;miopenConvolutionFwdAlgoWinograd:ConvBinWinogradRxSf2x3g1,0.45236,0,miopenConvolutionFwdAlgoWinograd,<unused>;miopenConvolutionFwdAlgoGEMM:GemmFwdRest,0.20084,1294720,miopenConvolutionFwdAlgoGEMM,<unused>
160-17-17-7x1-192-17-17-1-3x0-1x1-1x1-0-NCHW-FP32-F=miopenConvolutionFwdAlgoDirect:ConvDirectNaiveConvFwd,3.3948,0,miopenConvolutionFwdAlgoDirect,<unused>;miopenConvolutionFwdAlgoWinograd:ConvBinWinogradRxSf2x3g1,0.33876,0,miopenConvolutionFwdAlgoWinograd,<unused>;miopenConvolutionFwdAlgoGEMM:GemmFwdRest,0.214398,1294720,miopenConvolutionFwdAlgoGEMM,<unused>
160-17-17-7x1-160-17-17-1-3x0-1x1-1x1-0-NCHW-FP32-F=miopenConvolutionFwdAlgoDirect:ConvDirectNaiveConvFwd,3.41824,0,miopenConvolutionFwdAlgoDirect,<unused>;miopenConvolutionFwdAlgoWinograd:ConvBinWinogradRxSf2x3g1,0.34656,0,miopenConvolutionFwdAlgoWinograd,<unused>;miopenConvolutionFwdAlgoGEMM:GemmFwdRest,0.20296,1294720,miopenConvolutionFwdAlgoGEMM,<unused>
160-17-17-1x7-192-17-17-1-0x3-1x1-1x1-0-NCHW-FP32-F=miopenConvolutionFwdAlgoDirect:ConvDirectNaiveConvFwd,2.64012,0,miopenConvolutionFwdAlgoDirect,<unused>;miopenConvolutionFwdAlgoWinograd:ConvBinWinogradRxSf2x3g1,0.45292,0,miopenConvolutionFwdAlgoWinograd,<unused>;miopenConvolutionFwdAlgoGEMM:GemmFwdRest,0.22128,1294720,miopenConvolutionFwdAlgoGEMM,<unused>
768-17-17-1x1-576-17-17-1-0x0-1x1-1x1-0-NCHW-FP32-F=miopenConvolutionFwdAlgoDirect:ConvDirectNaiveConvFwd,6.604,0,miopenConvolutionFwdAlgoDirect,<unused>;miopenConvolutionFwdAlgoWinograd:ConvBinWinogradRxSf2x3g1,0.513999,0,miopenConvolutionFwdAlgoWinograd,<unused>;miopenConvolutionFwdAlgoGEMM:GemmFwd1x1_0_1,0.21376,0,miopenConvolutionFwdAlgoGEMM,<unused>
192-17-17-1x7-192-17-17-1-0x3-1x1-1x1-0-NCHW-FP32-F=miopenConvolutionFwdAlgoDirect:ConvDirectNaiveConvFwd,3.1676,0,miopenConvolutionFwdAlgoDirect,<unused>;miopenConvolutionFwdAlgoWinograd:ConvBinWinogradRxSf2x3g1,0.52432,0,miopenConvolutionFwdAlgoWinograd,<unused>;miopenConvolutionFwdAlgoGEMM:GemmFwdRest,0.245158,1553664,miopenConvolutionFwdAlgoGEMM,<unused>
192-17-17-7x1-192-17-17-1-3x0-1x1-1x1-0-NCHW-FP32-F=miopenConvolutionFwdAlgoDirect:ConvDirectNaiveConvFwd,4.08256,0,miopenConvolutionFwdAlgoDirect,<unused>;miopenConvolutionFwdAlgoWinograd:ConvBinWinogradRxSf2x3g1,0.409121,0,miopenConvolutionFwdAlgoWinograd,<unused>;miopenConvolutionFwdAlgoGEMM:GemmFwdRest,0.2518,1553664,miopenConvolutionFwdAlgoGEMM,<unused>
768-17-17-1x1-384-17-17-1-0x0-1x1-1x1-0-NCHW-FP32-F=miopenConvolutionFwdAlgoDirect:ConvDirectNaiveConvFwd,5.14652,0,miopenConvolutionFwdAlgoDirect,<unused>;miopenConvolutionFwdAlgoWinograd:ConvBinWinogradRxSf2x3g1,0.53352,0,miopenConvolutionFwdAlgoWinograd,<unused>;miopenConvolutionFwdAlgoGEMM:GemmFwd1x1_0_1,0.217,0,miopenConvolutionFwdAlgoGEMM,<unused>
192-17-17-3x3-320-8-8-1-0x0-2x2-1x1-0-NCHW-FP32-F=miopenConvolutionFwdAlgoImplicitGEMM:ConvHipImplicitGemmV4R4Fwd,0.48904,0,miopenConvolutionFwdAlgoImplicitGEMM,<unused>;miopenConvolutionFwdAlgoDirect:ConvOclDirectFwd,0.93364,0,miopenConvolutionFwdAlgoDirect,<unused>;miopenConvolutionFwdAlgoWinograd:ConvBinWinogradRxSf2x3g1,0.542879,0,miopenConvolutionFwdAlgoWinograd,<unused>;miopenConvolutionFwdAlgoGEMM:GemmFwdRest,0.225478,442368,miopenConvolutionFwdAlgoGEMM,<unused>
192-17-17-3x3-192-8-8-1-0x0-2x2-1x1-0-NCHW-FP32-F=miopenConvolutionFwdAlgoImplicitGEMM:ConvHipImplicitGemmV4R4Fwd,0.488481,0,miopenConvolutionFwdAlgoImplicitGEMM,<unused>;miopenConvolutionFwdAlgoDirect:ConvOclDirectFwd,0.904,0,miopenConvolutionFwdAlgoDirect,<unused>;miopenConvolutionFwdAlgoWinograd:ConvBinWinogradRxSf2x3g1,0.556081,0,miopenConvolutionFwdAlgoWinograd,<unused>;miopenConvolutionFwdAlgoGEMM:GemmFwdRest,0.219,442368,miopenConvolutionFwdAlgoGEMM,<unused>
1280-8-8-1x1-320-8-8-1-0x0-1x1-1x1-0-NCHW-FP32-F=miopenConvolutionFwdAlgoImplicitGEMM:ConvHipImplicitGemmV4R4Fwd,0.337479,0,miopenConvolutionFwdAlgoImplicitGEMM,<unused>;miopenConvolutionFwdAlgoDirect:ConvDirectNaiveConvFwd,2.05616,0,miopenConvolutionFwdAlgoDirect,<unused>;miopenConvolutionFwdAlgoWinograd:ConvBinWinogradRxSf2x3g1,0.85376,0,miopenConvolutionFwdAlgoWinograd,<unused>;miopenConvolutionFwdAlgoGEMM:GemmFwd1x1_0_1,0.34656,0,miopenConvolutionFwdAlgoGEMM,<unused>
1280-8-8-1x1-384-8-8-1-0x0-1x1-1x1-0-NCHW-FP32-F=miopenConvolutionFwdAlgoImplicitGEMM:ConvHipImplicitGemmV4R4Fwd,0.33724,0,miopenConvolutionFwdAlgoImplicitGEMM,<unused>;miopenConvolutionFwdAlgoDirect:ConvDirectNaiveConvFwd,2.04312,0,miopenConvolutionFwdAlgoDirect,<unused>;miopenConvolutionFwdAlgoWinograd:ConvBinWinogradRxSf2x3g1,0.857239,0,miopenConvolutionFwdAlgoWinograd,<unused>;miopenConvolutionFwdAlgoGEMM:GemmFwd1x1_0_1,0.3484,0,miopenConvolutionFwdAlgoGEMM,<unused>
384-8-8-1x3-384-8-8-1-0x1-1x1-1x1-0-NCHW-FP32-F=miopenConvolutionFwdAlgoImplicitGEMM:ConvHipImplicitGemmV4R4Fwd,0.36188,0,miopenConvolutionFwdAlgoImplicitGEMM,<unused>;miopenConvolutionFwdAlgoDirect:ConvDirectNaiveConvFwd,1.3204,0,miopenConvolutionFwdAlgoDirect,<unused>;miopenConvolutionFwdAlgoWinograd:ConvBinWinogradRxSf2x3g1,0.28352,0,miopenConvolutionFwdAlgoWinograd,<unused>;miopenConvolutionFwdAlgoGEMM:GemmFwdRest,0.164758,294912,miopenConvolutionFwdAlgoGEMM,<unused>
384-8-8-3x1-384-8-8-1-1x0-1x1-1x1-0-NCHW-FP32-F=miopenConvolutionFwdAlgoImplicitGEMM:ConvHipImplicitGemmV4R4Fwd,0.35536,0,miopenConvolutionFwdAlgoImplicitGEMM,<unused>;miopenConvolutionFwdAlgoDirect:ConvDirectNaiveConvFwd,1.644,0,miopenConvolutionFwdAlgoDirect,<unused>;miopenConvolutionFwdAlgoWinograd:ConvBinWinogradRxSf2x3g1,0.28116,0,miopenConvolutionFwdAlgoWinograd,<unused>;miopenConvolutionFwdAlgoGEMM:GemmFwdRest,0.16256,294912,miopenConvolutionFwdAlgoGEMM,<unused>
1280-8-8-1x1-448-8-8-1-0x0-1x1-1x1-0-NCHW-FP32-F=miopenConvolutionFwdAlgoImplicitGEMM:ConvHipImplicitGemmV4R4Fwd,0.33712,0,miopenConvolutionFwdAlgoImplicitGEMM,<unused>;miopenConvolutionFwdAlgoDirect:ConvDirectNaiveConvFwd,2.27948,0,miopenConvolutionFwdAlgoDirect,<unused>;miopenConvolutionFwdAlgoWinograd:ConvBinWinogradRxSf3x2,0.837839,0,miopenConvolutionFwdAlgoWinograd,<unused>;miopenConvolutionFwdAlgoGEMM:GemmFwd1x1_0_1,0.34632,0,miopenConvolutionFwdAlgoGEMM,<unused>
448-8-8-3x3-384-8-8-1-1x1-1x1-1x1-0-NCHW-FP32-F=miopenConvolutionFwdAlgoImplicitGEMM:ConvHipImplicitGemmV4R4Fwd,1.23016,0,miopenConvolutionFwdAlgoImplicitGEMM,<unused>;miopenConvolutionFwdAlgoDirect:ConvOclDirectFwd,0.57328,0,miopenConvolutionFwdAlgoDirect,<unused>;miopenConvolutionFwdAlgoWinograd:ConvBinWinogradRxSf2x3g1,0.32332,0,miopenConvolutionFwdAlgoWinograd,<unused>;miopenConvolutionFwdAlgoGEMM:GemmFwdRest,0.250158,1032192,miopenConvolutionFwdAlgoGEMM,<unused>
1280-8-8-1x1-192-8-8-1-0x0-1x1-1x1-0-NCHW-FP32-F=miopenConvolutionFwdAlgoImplicitGEMM:ConvHipImplicitGemmV4R4Fwd,0.337159,0,miopenConvolutionFwdAlgoImplicitGEMM,<unused>;miopenConvolutionFwdAlgoDirect:ConvDirectNaiveConvFwd,1.65624,0,miopenConvolutionFwdAlgoDirect,<unused>;miopenConvolutionFwdAlgoWinograd:ConvBinWinogradRxSf2x3g1,0.85144,0,miopenConvolutionFwdAlgoWinograd,<unused>;miopenConvolutionFwdAlgoGEMM:GemmFwd1x1_0_1,0.34624,0,miopenConvolutionFwdAlgoGEMM,<unused>
2048-8-8-1x1-320-8-8-1-0x0-1x1-1x1-0-NCHW-FP32-F=miopenConvolutionFwdAlgoImplicitGEMM:ConvHipImplicitGemmV4R4Fwd,0.52628,0,miopenConvolutionFwdAlgoImplicitGEMM,<unused>;miopenConvolutionFwdAlgoDirect:ConvDirectNaiveConvFwd,3.32632,0,miopenConvolutionFwdAlgoDirect,<unused>;miopenConvolutionFwdAlgoWinograd:ConvBinWinogradRxSf2x3g1,1.3344,0,miopenConvolutionFwdAlgoWinograd,<unused>;miopenConvolutionFwdAlgoGEMM:GemmFwd1x1_0_1,0.52492,0,miopenConvolutionFwdAlgoGEMM,<unused>
2048-8-8-1x1-384-8-8-1-0x0-1x1-1x1-0-NCHW-FP32-F=miopenConvolutionFwdAlgoImplicitGEMM:ConvHipImplicitGemmV4R4Fwd,0.52688,0,miopenConvolutionFwdAlgoImplicitGEMM,<unused>;miopenConvolutionFwdAlgoDirect:ConvDirectNaiveConvFwd,3.29484,0,miopenConvolutionFwdAlgoDirect,<unused>;miopenConvolutionFwdAlgoWinograd:ConvBinWinogradRxSf2x3g1,1.33044,0,miopenConvolutionFwdAlgoWinograd,<unused>;miopenConvolutionFwdAlgoGEMM:GemmFwd1x1_0_1,0.52452,0,miopenConvolutionFwdAlgoGEMM,<unused>
2048-8-8-1x1-448-8-8-1-0x0-1x1-1x1-0-NCHW-FP32-F=miopenConvolutionFwdAlgoImplicitGEMM:ConvHipImplicitGemmV4R4Fwd,0.527079,0,miopenConvolutionFwdAlgoImplicitGEMM,<unused>;miopenConvolutionFwdAlgoDirect:ConvDirectNaiveConvFwd,3.6762,0,miopenConvolutionFwdAlgoDirect,<unused>;miopenConvolutionFwdAlgoWinograd:ConvBinWinogradRxSf2x3g1,1.33604,0,miopenConvolutionFwdAlgoWinograd,<unused>;miopenConvolutionFwdAlgoGEMM:GemmFwd1x1_0_1,0.5254,0,miopenConvolutionFwdAlgoGEMM,<unused>
2048-8-8-1x1-192-8-8-1-0x0-1x1-1x1-0-NCHW-FP32-F=miopenConvolutionFwdAlgoImplicitGEMM:ConvHipImplicitGemmV4R4Fwd,0.52676,0,miopenConvolutionFwdAlgoImplicitGEMM,<unused>;miopenConvolutionFwdAlgoDirect:ConvDirectNaiveConvFwd,2.633,0,miopenConvolutionFwdAlgoDirect,<unused>;miopenConvolutionFwdAlgoWinograd:ConvBinWinogradRxSf2x3g1,1.33748,0,miopenConvolutionFwdAlgoWinograd,<unused>;miopenConvolutionFwdAlgoGEMM:GemmFwd1x1_0_1,0.52556,0,miopenConvolutionFwdAlgoGEMM,<unused>
3-224-224-3x3-64-224-224-1-1x1-1x1-1x1-0-NCHW-FP32-F=miopenConvolutionFwdAlgoDirect:ConvOclDirectFwd,0.14684,0,miopenConvolutionFwdAlgoDirect,<unused>;miopenConvolutionFwdAlgoWinograd:ConvBinWinogradRxSf2x3g1,0.12828,0,miopenConvolutionFwdAlgoWinograd,<unused>;miopenConvolutionFwdAlgoGEMM:GemmFwdRest,0.31972,5419008,miopenConvolutionFwdAlgoGEMM,<unused>
64-224-224-3x3-64-224-224-1-1x1-1x1-1x1-0-NCHW-FP32-F=miopenConvolutionFwdAlgoImplicitGEMM:ConvHipImplicitGemmV4R4Fwd,0.27928,0,miopenConvolutionFwdAlgoImplicitGEMM,<unused>;miopenConvolutionFwdAlgoDirect:ConvOclDirectFwd,2.39336,0,miopenConvolutionFwdAlgoDirect,<unused>;miopenConvolutionFwdAlgoWinograd:ConvBinWinogradRxSf2x3g1,0.548001,0,miopenConvolutionFwdAlgoWinograd,<unused>;miopenConvolutionFwdAlgoGEMM:GemmFwdRest,3.02672,115605504,miopenConvolutionFwdAlgoGEMM,<unused>
64-112-112-3x3-128-112-112-1-1x1-1x1-1x1-0-NCHW-FP32-F=miopenConvolutionFwdAlgoImplicitGEMM:ConvHipImplicitGemmV4R4Fwd,0.2002,0,miopenConvolutionFwdAlgoImplicitGEMM,<unused>;miopenConvolutionFwdAlgoDirect:ConvOclDirectFwd,1.52076,0,miopenConvolutionFwdAlgoDirect,<unused>;miopenConvolutionFwdAlgoWinograd:ConvBinWinogradRxSf2x3g1,0.31376,0,miopenConvolutionFwdAlgoWinograd,<unused>;miopenConvolutionFwdAlgoGEMM:GemmFwdRest,0.68296,28901376,miopenConvolutionFwdAlgoGEMM,<unused>
128-112-112-3x3-128-112-112-1-1x1-1x1-1x1-0-NCHW-FP32-F=miopenConvolutionFwdAlgoImplicitGEMM:ConvHipImplicitGemmV4R4Fwd,0.31552,0,miopenConvolutionFwdAlgoImplicitGEMM,<unused>;miopenConvolutionFwdAlgoDirect:ConvOclDirectFwd,2.96772,0,miopenConvolutionFwdAlgoDirect,<unused>;miopenConvolutionFwdAlgoWinograd:ConvBinWinogradRxSf2x3g1,0.543121,0,miopenConvolutionFwdAlgoWinograd,<unused>;miopenConvolutionFwdAlgoGEMM:GemmFwdRest,1.30476,57802752,miopenConvolutionFwdAlgoGEMM,<unused>
128-56-56-3x3-256-56-56-1-1x1-1x1-1x1-0-NCHW-FP32-F=miopenConvolutionFwdAlgoImplicitGEMM:ConvHipImplicitGemmV4R4Fwd,0.19064,0,miopenConvolutionFwdAlgoImplicitGEMM,<unused>;miopenConvolutionFwdAlgoDirect:ConvOclDirectFwd,1.7612,0,miopenConvolutionFwdAlgoDirect,<unused>;miopenConvolutionFwdAlgoWinograd:ConvBinWinogradRxSf2x3g1,0.289601,0,miopenConvolutionFwdAlgoWinograd,<unused>;miopenConvolutionFwdAlgoGEMM:GemmFwdRest,0.798521,14450688,miopenConvolutionFwdAlgoGEMM,<unused>
256-56-56-3x3-256-56-56-1-1x1-1x1-1x1-0-NCHW-FP32-F=miopenConvolutionFwdAlgoImplicitGEMM:ConvHipImplicitGemmV4R4Fwd,0.374561,0,miopenConvolutionFwdAlgoImplicitGEMM,<unused>;miopenConvolutionFwdAlgoDirect:ConvOclDirectFwd,3.59104,0,miopenConvolutionFwdAlgoDirect,<unused>;miopenConvolutionFwdAlgoWinograd:ConvBinWinogradRxSf2x3g1,0.527921,0,miopenConvolutionFwdAlgoWinograd,<unused>;miopenConvolutionFwdAlgoGEMM:GemmFwdRest,1.8396,28901376,miopenConvolutionFwdAlgoGEMM,<unused>
256-28-28-3x3-512-28-28-1-1x1-1x1-1x1-0-NCHW-FP32-F=miopenConvolutionFwdAlgoDirect:ConvOclDirectFwd,1.99232,0,miopenConvolutionFwdAlgoDirect,<unused>;miopenConvolutionFwdAlgoWinograd:ConvBinWinogradRxSf2x3g1,0.364401,0,miopenConvolutionFwdAlgoWinograd,<unused>;miopenConvolutionFwdAlgoGEMM:GemmFwdRest,0.868441,7225344,miopenConvolutionFwdAlgoGEMM,<unused>
512-28-28-3x3-512-28-28-1-1x1-1x1-1x1-0-NCHW-FP32-F=miopenConvolutionFwdAlgoDirect:ConvOclDirectFwd,3.95637,0,miopenConvolutionFwdAlgoDirect,<unused>;miopenConvolutionFwdAlgoWinograd:ConvBinWinogradRxSf2x3g1,0.677081,0,miopenConvolutionFwdAlgoWinograd,<unused>;miopenConvolutionFwdAlgoGEMM:GemmFwdRest,1.95636,14450688,miopenConvolutionFwdAlgoGEMM,<unused>
512-14-14-3x3-512-14-14-1-1x1-1x1-1x1-0-NCHW-FP32-F=miopenConvolutionFwdAlgoDirect:ConvOclDirectFwd,2.11344,0,miopenConvolutionFwdAlgoDirect,<unused>;miopenConvolutionFwdAlgoWinograd:ConvBinWinogradRxSf2x3g1,0.355761,0,miopenConvolutionFwdAlgoWinograd,<unused>;miopenConvolutionFwdAlgoGEMM:GemmFwdRest,0.822521,3612672,miopenConvolutionFwdAlgoGEMM,<unused>
64-56-56-1x1-288-56-56-1-0x0-1x1-1x1-0-NCHW-FP32-F=miopenConvolutionFwdAlgoImplicitGEMM:ConvHipImplicitGemmV4R4Fwd,0.06376,0,miopenConvolutionFwdAlgoImplicitGEMM,<unused>;miopenConvolutionFwdAlgoDirect:ConvDirectNaiveConvFwd,2.82568,0,miopenConvolutionFwdAlgoDirect,<unused>;miopenConvolutionFwdAlgoWinograd:ConvBinWinogradRxSf3x2,0.173759,0,miopenConvolutionFwdAlgoWinograd,<unused>;miopenConvolutionFwdAlgoGEMM:GemmFwd1x1_0_1,0.08364,0,miopenConvolutionFwdAlgoGEMM,<unused>
64-56-56-1x1-96-56-56-1-0x0-1x1-1x1-0-NCHW-FP32-F=miopenConvolutionFwdAlgoImplicitGEMM:ConvHipImplicitGemmV4R4Fwd,0.03872,0,miopenConvolutionFwdAlgoImplicitGEMM,<unused>;miopenConvolutionFwdAlgoDirect:ConvDirectNaiveConvFwd,1.58792,0,miopenConvolutionFwdAlgoDirect,<unused>;miopenConvolutionFwdAlgoWinograd:ConvBinWinogradRxSf3x2,0.11676,0,miopenConvolutionFwdAlgoWinograd,<unused>;miopenConvolutionFwdAlgoGEMM:GemmFwd1x1_0_1,0.06456,0,miopenConvolutionFwdAlgoGEMM,<unused>
96-56-56-3x3-96-56-56-1-1x1-1x1-1x1-0-NCHW-FP32-F_g32=miopenConvolutionFwdAlgoDirect:ConvOclDirectFwd,0.04336,0,miopenConvolutionFwdAlgoDirect,<unused>;miopenConvolutionFwdAlgoWinograd:ConvBinWinogradRxSf2x3,0.162319,0,miopenConvolutionFwdAlgoWinograd,<unused>;miopenConvolutionFwdAlgoGEMM:GemmFwdRest,0.242558,10838016,miopenConvolutionFwdAlgoGEMM,<unused>
96-56-56-1x1-272-56-56-1-0x0-1x1-1x1-0-NCHW-FP32-F=miopenConvolutionFwdAlgoDirect:ConvDirectNaiveConvFwd,4.21176,0,miopenConvolutionFwdAlgoDirect,<unused>;miopenConvolutionFwdAlgoWinograd:ConvBinWinogradRxSf3x2,0.21144,0,miopenConvolutionFwdAlgoWinograd,<unused>;miopenConvolutionFwdAlgoGEMM:GemmFwd1x1_0_1,0.10024,0,miopenConvolutionFwdAlgoGEMM,<unused>
304-56-56-1x1-96-56-56-1-0x0-1x1-1x1-0-NCHW-FP32-F=miopenConvolutionFwdAlgoImplicitGEMM:ConvHipImplicitGemmV4R4Fwd,0.11072,0,miopenConvolutionFwdAlgoImplicitGEMM,<unused>;miopenConvolutionFwdAlgoDirect:ConvDirectNaiveConvFwd,7.37707,0,miopenConvolutionFwdAlgoDirect,<unused>;miopenConvolutionFwdAlgoWinograd:ConvBinWinogradRxSf3x2,0.25896,0,miopenConvolutionFwdAlgoWinograd,<unused>;miopenConvolutionFwdAlgoGEMM:GemmFwd1x1_0_1,0.19908,0,miopenConvolutionFwdAlgoGEMM,<unused>
320-56-56-1x1-96-56-56-1-0x0-1x1-1x1-0-NCHW-FP32-F=miopenConvolutionFwdAlgoImplicitGEMM:ConvHipImplicitGemmV4R4Fwd,0.117559,0,miopenConvolutionFwdAlgoImplicitGEMM,<unused>;miopenConvolutionFwdAlgoDirect:ConvDirectNaiveConvFwd,7.74451,0,miopenConvolutionFwdAlgoDirect,<unused>;miopenConvolutionFwdAlgoWinograd:ConvBinWinogradRxSf3x2,0.268679,0,miopenConvolutionFwdAlgoWinograd,<unused>;miopenConvolutionFwdAlgoGEMM:GemmFwd1x1_0_1,0.20552,0,miopenConvolutionFwdAlgoGEMM,<unused>
336-56-56-1x1-576-28-28-1-0x0-2x2-1x1-0-NCHW-FP32-F=miopenConvolutionFwdAlgoDirect:ConvDirectNaiveConvFwd,7.23567,0,miopenConvolutionFwdAlgoDirect,<unused>;miopenConvolutionFwdAlgoWinograd:ConvBinWinogradRxSf2x3g1,0.929919,0,miopenConvolutionFwdAlgoWinograd,<unused>;miopenConvolutionFwdAlgoGEMM:GemmFwd1x1_0_2,0.344998,2860032,miopenConvolutionFwdAlgoGEMM,<unused>
336-56-56-1x1-192-56-56-1-0x0-1x1-1x1-0-NCHW-FP32-F=miopenConvolutionFwdAlgoImplicitGEMM:ConvHipImplicitGemmV4R4Fwd,0.04596,0,miopenConvolutionFwdAlgoImplicitGEMM,<unused>;miopenConvolutionFwdAlgoDirect:ConvDirectNaiveConvFwd,11.3304,0,miopenConvolutionFwdAlgoDirect,<unused>;miopenConvolutionFwdAlgoWinograd:ConvBinWinogradRxSf3x2,0.28696,0,miopenConvolutionFwdAlgoWinograd,<unused>;miopenConvolutionFwdAlgoGEMM:GemmFwd1x1_0_1,0.2724,0,miopenConvolutionFwdAlgoGEMM,<unused>
192-56-56-3x3-192-28-28-1-1x1-2x2-1x1-0-NCHW-FP32-F_g32=miopenConvolutionFwdAlgoDirect:ConvOclDirectFwd,0.06784,0,miopenConvolutionFwdAlgoDirect,<unused>;miopenConvolutionFwdAlgoWinograd:ConvBinWinogradRxSf2x3,0.14896,0,miopenConvolutionFwdAlgoWinograd,<unused>;miopenConvolutionFwdAlgoGEMM:GemmFwdRest,0.127718,5419008,miopenConvolutionFwdAlgoGEMM,<unused>
192-28-28-1x1-544-28-28-1-0x0-1x1-1x1-0-NCHW-FP32-F=miopenConvolutionFwdAlgoDirect:ConvDirectNaiveConvFwd,4.14732,0,miopenConvolutionFwdAlgoDirect,<unused>;miopenConvolutionFwdAlgoWinograd:ConvBinWinogradRxSf3x2,0.19808,0,miopenConvolutionFwdAlgoWinograd,<unused>;miopenConvolutionFwdAlgoGEMM:GemmFwd1x1_0_1,0.18268,0,miopenConvolutionFwdAlgoGEMM,<unused>
608-28-28-1x1-192-28-28-1-0x0-1x1-1x1-0-NCHW-FP32-F=miopenConvolutionFwdAlgoDirect:ConvDirectNaiveConvFwd,5.43616,0,miopenConvolutionFwdAlgoDirect,<unused>;miopenConvolutionFwdAlgoWinograd:ConvBinWinogradRxSf2x3g1,0.41472,0,miopenConvolutionFwdAlgoWinograd,<unused>;miopenConvolutionFwdAlgoGEMM:GemmFwd1x1_0_1,0.31712,0,miopenConvolutionFwdAlgoGEMM,<unused>
192-28-28-3x3-192-28-28-1-1x1-1x1-1x1-0-NCHW-FP32-F_g32=miopenConvolutionFwdAlgoDirect:ConvOclDirectFwd,0.05088,0,miopenConvolutionFwdAlgoDirect,<unused>;miopenConvolutionFwdAlgoWinograd:ConvBinWinogradRxSf2x3,0.094,0,miopenConvolutionFwdAlgoWinograd,<unused>;miopenConvolutionFwdAlgoGEMM:GemmFwdRest,0.11576,5419008,miopenConvolutionFwdAlgoGEMM,<unused>
640-28-28-1x1-192-28-28-1-0x0-1x1-1x1-0-NCHW-FP32-F=miopenConvolutionFwdAlgoDirect:ConvDirectNaiveConvFwd,5.73112,0,miopenConvolutionFwdAlgoDirect,<unused>;miopenConvolutionFwdAlgoWinograd:ConvBinWinogradRxSf2x3g1,0.435081,0,miopenConvolutionFwdAlgoWinograd,<unused>;miopenConvolutionFwdAlgoGEMM:GemmFwd1x1_0_1,0.181,0,miopenConvolutionFwdAlgoGEMM,<unused>
672-28-28-1x1-192-28-28-1-0x0-1x1-1x1-0-NCHW-FP32-F=miopenConvolutionFwdAlgoDirect:ConvDirectNaiveConvFwd,6.0166,0,miopenConvolutionFwdAlgoDirect,<unused>;miopenConvolutionFwdAlgoWinograd:ConvBinWinogradRxSf2x3g1,0.453761,0,miopenConvolutionFwdAlgoWinograd,<unused>;miopenConvolutionFwdAlgoGEMM:GemmFwd1x1_0_1,0.18872,0,miopenConvolutionFwdAlgoGEMM,<unused>
704-28-28-1x1-1072-14-14-1-0x0-2x2-1x1-0-NCHW-FP32-F=miopenConvolutionFwdAlgoDirect:ConvDirectNaiveConvFwd,8.52689,0,miopenConvolutionFwdAlgoDirect,<unused>;miopenConvolutionFwdAlgoWinograd:ConvBinWinogradRxSf2x3g1,0.968721,0,miopenConvolutionFwdAlgoWinograd,<unused>;miopenConvolutionFwdAlgoGEMM:GemmFwd1x1_0_2,0.41628,1392384,miopenConvolutionFwdAlgoGEMM,<unused>
704-28-28-1x1-384-28-28-1-0x0-1x1-1x1-0-NCHW-FP32-F=miopenConvolutionFwdAlgoDirect:ConvDirectNaiveConvFwd,8.31927,0,miopenConvolutionFwdAlgoDirect,<unused>;miopenConvolutionFwdAlgoWinograd:ConvBinWinogradRxSf3x2,0.50108,0,miopenConvolutionFwdAlgoWinograd,<unused>;miopenConvolutionFwdAlgoGEMM:GemmFwd1x1_0_1,0.35612,0,miopenConvolutionFwdAlgoGEMM,<unused>
384-28-28-3x3-384-14-14-1-1x1-2x2-1x1-0-NCHW-FP32-F_g32=miopenConvolutionFwdAlgoDirect:ConvOclDirectFwd,0.08828,0,miopenConvolutionFwdAlgoDirect,<unused>;miopenConvolutionFwdAlgoWinograd:ConvBinWinogradRxSf2x3,0.12888,0,miopenConvolutionFwdAlgoWinograd,<unused>;miopenConvolutionFwdAlgoGEMM:GemmFwdRest,0.12164,2709504,miopenConvolutionFwdAlgoGEMM,<unused>
384-14-14-1x1-1048-14-14-1-0x0-1x1-1x1-0-NCHW-FP32-F=miopenConvolutionFwdAlgoDirect:ConvDirectNaiveConvFwd,4.66285,0,miopenConvolutionFwdAlgoDirect,<unused>;miopenConvolutionFwdAlgoWinograd:ConvBinWinogradRxSf2x3g1,0.28088,0,miopenConvolutionFwdAlgoWinograd,<unused>;miopenConvolutionFwdAlgoGEMM:GemmFwd1x1_0_1,0.15088,0,miopenConvolutionFwdAlgoGEMM,<unused>
1096-14-14-1x1-384-14-14-1-0x0-1x1-1x1-0-NCHW-FP32-F=miopenConvolutionFwdAlgoDirect:ConvDirectNaiveConvFwd,5.59393,0,miopenConvolutionFwdAlgoDirect,<unused>;miopenConvolutionFwdAlgoWinograd:ConvBinWinogradRxSf2x3g1,0.719961,0,miopenConvolutionFwdAlgoWinograd,<unused>;miopenConvolutionFwdAlgoGEMM:GemmFwd1x1_0_1,0.470201,0,miopenConvolutionFwdAlgoGEMM,<unused>
384-14-14-3x3-384-14-14-1-1x1-1x1-1x1-0-NCHW-FP32-F_g32=miopenConvolutionFwdAlgoDirect:ConvOclDirectFwd,0.06064,0,miopenConvolutionFwdAlgoDirect,<unused>;miopenConvolutionFwdAlgoWinograd:ConvBinWinogradRxSf2x3,0.06344,0,miopenConvolutionFwdAlgoWinograd,<unused>;miopenConvolutionFwdAlgoGEMM:GemmFwdRest,0.09516,2709504,miopenConvolutionFwdAlgoGEMM,<unused>
1120-14-14-1x1-384-14-14-1-0x0-1x1-1x1-0-NCHW-FP32-F=miopenConvolutionFwdAlgoDirect:ConvDirectNaiveConvFwd,5.72025,0,miopenConvolutionFwdAlgoDirect,<unused>;miopenConvolutionFwdAlgoWinograd:ConvBinWinogradRxSf2x3g1,0.734681,0,miopenConvolutionFwdAlgoWinograd,<unused>;miopenConvolutionFwdAlgoGEMM:GemmFwd1x1_0_1,0.480161,0,miopenConvolutionFwdAlgoGEMM,<unused>
1144-14-14-1x1-384-14-14-1-0x0-1x1-1x1-0-NCHW-FP32-F=miopenConvolutionFwdAlgoDirect:ConvDirectNaiveConvFwd,5.84133,0,miopenConvolutionFwdAlgoDirect,<unused>;miopenConvolutionFwdAlgoWinograd:ConvBinWinogradRxSf2x3g1,0.752681,0,miopenConvolutionFwdAlgoWinograd,<unused>;miopenConvolutionFwdAlgoGEMM:GemmFwd1x1_0_1,0.24436,0,miopenConvolutionFwdAlgoGEMM,<unused>
1168-14-14-1x1-384-14-14-1-0x0-1x1-1x1-0-NCHW-FP32-F=miopenConvolutionFwdAlgoDirect:ConvDirectNaiveConvFwd,5.96661,0,miopenConvolutionFwdAlgoDirect,<unused>;miopenConvolutionFwdAlgoWinograd:ConvBinWinogradRxSf2x3g1,0.780241,0,miopenConvolutionFwdAlgoWinograd,<unused>;miopenConvolutionFwdAlgoGEMM:GemmFwd1x1_0_1,0.248,0,miopenConvolutionFwdAlgoGEMM,<unused>
1192-14-14-1x1-384-14-14-1-0x0-1x1-1x1-0-NCHW-FP32-F=miopenConvolutionFwdAlgoDirect:ConvDirectNaiveConvFwd,6.08297,0,miopenConvolutionFwdAlgoDirect,<unused>;miopenConvolutionFwdAlgoWinograd:ConvBinWinogradRxSf2x3g1,0.794641,0,miopenConvolutionFwdAlgoWinograd,<unused>;miopenConvolutionFwdAlgoGEMM:GemmFwd1x1_0_1,0.23852,0,miopenConvolutionFwdAlgoGEMM,<unused>
1216-14-14-1x1-384-14-14-1-0x0-1x1-1x1-0-NCHW-FP32-F=miopenConvolutionFwdAlgoDirect:ConvDirectNaiveConvFwd,6.20749,0,miopenConvolutionFwdAlgoDirect,<unused>;miopenConvolutionFwdAlgoWinograd:ConvBinWinogradRxSf2x3g1,0.809281,0,miopenConvolutionFwdAlgoWinograd,<unused>;miopenConvolutionFwdAlgoGEMM:GemmFwd1x1_0_1,0.24352,0,miopenConvolutionFwdAlgoGEMM,<unused>
1240-14-14-1x1-384-14-14-1-0x0-1x1-1x1-0-NCHW-FP32-F=miopenConvolutionFwdAlgoDirect:ConvDirectNaiveConvFwd,6.2721,0,miopenConvolutionFwdAlgoDirect,<unused>;miopenConvolutionFwdAlgoWinograd:ConvBinWinogradRxSf2x3g1,0.824641,0,miopenConvolutionFwdAlgoWinograd,<unused>;miopenConvolutionFwdAlgoGEMM:GemmFwd1x1_0_1,0.24672,0,miopenConvolutionFwdAlgoGEMM,<unused>
1264-14-14-1x1-384-14-14-1-0x0-1x1-1x1-0-NCHW-FP32-F=miopenConvolutionFwdAlgoDirect:ConvDirectNaiveConvFwd,6.23042,0,miopenConvolutionFwdAlgoDirect,<unused>;miopenConvolutionFwdAlgoWinograd:ConvBinWinogradRxSf2x3g1,0.839361,0,miopenConvolutionFwdAlgoWinograd,<unused>;miopenConvolutionFwdAlgoGEMM:GemmFwd1x1_0_1,0.25148,0,miopenConvolutionFwdAlgoGEMM,<unused>
1288-14-14-1x1-384-14-14-1-0x0-1x1-1x1-0-NCHW-FP32-F=miopenConvolutionFwdAlgoDirect:ConvDirectNaiveConvFwd,6.56989,0,miopenConvolutionFwdAlgoDirect,<unused>;miopenConvolutionFwdAlgoWinograd:ConvBinWinogradRxSf2x3g1,0.854521,0,miopenConvolutionFwdAlgoWinograd,<unused>;miopenConvolutionFwdAlgoGEMM:GemmFwd1x1_0_1,0.25616,0,miopenConvolutionFwdAlgoGEMM,<unused>
1312-14-14-1x1-384-14-14-1-0x0-1x1-1x1-0-NCHW-FP32-F=miopenConvolutionFwdAlgoDirect:ConvDirectNaiveConvFwd,6.06094,0,miopenConvolutionFwdAlgoDirect,<unused>;miopenConvolutionFwdAlgoWinograd:ConvBinWinogradRxSf2x3g1,0.869281,0,miopenConvolutionFwdAlgoWinograd,<unused>;miopenConvolutionFwdAlgoGEMM:GemmFwd1x1_0_1,0.26068,0,miopenConvolutionFwdAlgoGEMM,<unused>
1336-14-14-1x1-384-14-14-1-0x0-1x1-1x1-0-NCHW-FP32-F=miopenConvolutionFwdAlgoDirect:ConvDirectNaiveConvFwd,6.00373,0,miopenConvolutionFwdAlgoDirect,<unused>;miopenConvolutionFwdAlgoWinograd:ConvBinWinogradRxSf2x3g1,0.884802,0,miopenConvolutionFwdAlgoWinograd,<unused>;miopenConvolutionFwdAlgoGEMM:GemmFwd1x1_0_1,0.27096,0,miopenConvolutionFwdAlgoGEMM,<unused>
1360-14-14-1x1-384-14-14-1-0x0-1x1-1x1-0-NCHW-FP32-F=miopenConvolutionFwdAlgoDirect:ConvDirectNaiveConvFwd,6.93669,0,miopenConvolutionFwdAlgoDirect,<unused>;miopenConvolutionFwdAlgoWinograd:ConvBinWinogradRxSf2x3g1,0.898882,0,miopenConvolutionFwdAlgoWinograd,<unused>;miopenConvolutionFwdAlgoGEMM:GemmFwd1x1_0_1,0.276,0,miopenConvolutionFwdAlgoGEMM,<unused>
1384-14-14-1x1-384-14-14-1-0x0-1x1-1x1-0-NCHW-FP32-F=miopenConvolutionFwdAlgoDirect:ConvDirectNaiveConvFwd,7.05909,0,miopenConvolutionFwdAlgoDirect,<unused>;miopenConvolutionFwdAlgoWinograd:ConvBinWinogradRxSf2x3g1,0.914361,0,miopenConvolutionFwdAlgoWinograd,<unused>;miopenConvolutionFwdAlgoGEMM:GemmFwd1x1_0_1,0.27264,0,miopenConvolutionFwdAlgoGEMM,<unused>
1408-14-14-1x1-384-14-14-1-0x0-1x1-1x1-0-NCHW-FP32-F=miopenConvolutionFwdAlgoDirect:ConvDirectNaiveConvFwd,5.84786,0,miopenConvolutionFwdAlgoDirect,<unused>;miopenConvolutionFwdAlgoWinograd:ConvBinWinogradRxSf2x3g1,0.929761,0,miopenConvolutionFwdAlgoWinograd,<unused>;miopenConvolutionFwdAlgoGEMM:GemmFwd1x1_0_1,0.2778,0,miopenConvolutionFwdAlgoGEMM,<unused>
1432-14-14-1x1-384-14-14-1-0x0-1x1-1x1-0-NCHW-FP32-F=miopenConvolutionFwdAlgoDirect:ConvDirectNaiveConvFwd,6.79339,0,miopenConvolutionFwdAlgoDirect,<unused>;miopenConvolutionFwdAlgoWinograd:ConvBinWinogradRxSf2x3g1,0.944241,0,miopenConvolutionFwdAlgoWinograd,<unused>;miopenConvolutionFwdAlgoGEMM:GemmFwd1x1_0_1,0.28144,0,miopenConvolutionFwdAlgoGEMM,<unused>
1456-14-14-1x1-384-14-14-1-0x0-1x1-1x1-0-NCHW-FP32-F=miopenConvolutionFwdAlgoDirect:ConvDirectNaiveConvFwd,5.96073,0,miopenConvolutionFwdAlgoDirect,<unused>;miopenConvolutionFwdAlgoWinograd:ConvBinWinogradRxSf2x3g1,0.959282,0,miopenConvolutionFwdAlgoWinograd,<unused>;miopenConvolutionFwdAlgoGEMM:GemmFwd1x1_0_1,0.28576,0,miopenConvolutionFwdAlgoGEMM,<unused>
1480-14-14-1x1-384-14-14-1-0x0-1x1-1x1-0-NCHW-FP32-F=miopenConvolutionFwdAlgoDirect:ConvDirectNaiveConvFwd,5.92283,0,miopenConvolutionFwdAlgoDirect,<unused>;miopenConvolutionFwdAlgoWinograd:ConvBinWinogradRxSf2x3g1,0.974042,0,miopenConvolutionFwdAlgoWinograd,<unused>;miopenConvolutionFwdAlgoGEMM:GemmFwd1x1_0_1,0.29008,0,miopenConvolutionFwdAlgoGEMM,<unused>
1504-14-14-1x1-384-14-14-1-0x0-1x1-1x1-0-NCHW-FP32-F=miopenConvolutionFwdAlgoDirect:ConvDirectNaiveConvFwd,6.85937,0,miopenConvolutionFwdAlgoDirect,<unused>;miopenConvolutionFwdAlgoWinograd:ConvBinWinogradRxSf2x3g1,0.972641,0,miopenConvolutionFwdAlgoWinograd,<unused>;miopenConvolutionFwdAlgoGEMM:GemmFwd1x1_0_1,0.28856,0,miopenConvolutionFwdAlgoGEMM,<unused>
1528-14-14-1x1-384-14-14-1-0x0-1x1-1x1-0-NCHW-FP32-F=miopenConvolutionFwdAlgoDirect:ConvDirectNaiveConvFwd,5.98461,0,miopenConvolutionFwdAlgoDirect,<unused>;miopenConvolutionFwdAlgoWinograd:ConvBinWinogradRxSf2x3g1,1.00348,0,miopenConvolutionFwdAlgoWinograd,<unused>;miopenConvolutionFwdAlgoGEMM:GemmFwd1x1_0_1,0.29812,0,miopenConvolutionFwdAlgoGEMM,<unused>
1552-14-14-1x1-2304-7-7-1-0x0-2x2-1x1-0-NCHW-FP32-F=miopenConvolutionFwdAlgoDirect:ConvDirectNaiveConvFwd,5.36223,0,miopenConvolutionFwdAlgoDirect,<unused>;miopenConvolutionFwdAlgoWinograd:ConvBinWinogradRxSf2x3g1,2.0838,0,miopenConvolutionFwdAlgoWinograd,<unused>;miopenConvolutionFwdAlgoGEMM:GemmFwd1x1_0_2,0.370441,755776,miopenConvolutionFwdAlgoGEMM,<unused>
1552-14-14-1x1-768-14-14-1-0x0-1x1-1x1-0-NCHW-FP32-F=miopenConvolutionFwdAlgoDirect:ConvDirectNaiveConvFwd,6.43991,0,miopenConvolutionFwdAlgoDirect,<unused>;miopenConvolutionFwdAlgoWinograd:ConvBinWinogradRxSf2x3g1,1.02088,0,miopenConvolutionFwdAlgoWinograd,<unused>;miopenConvolutionFwdAlgoGEMM:GemmFwd1x1_0_1,0.397081,0,miopenConvolutionFwdAlgoGEMM,<unused>
768-14-14-3x3-768-7-7-1-1x1-2x2-1x1-0-NCHW-FP32-F_g32=miopenConvolutionFwdAlgoDirect:ConvOclDirectFwd,0.114361,0,miopenConvolutionFwdAlgoDirect,<unused>;miopenConvolutionFwdAlgoWinograd:ConvBinWinogradRxSf2x3,0.12012,0,miopenConvolutionFwdAlgoWinograd,<unused>;miopenConvolutionFwdAlgoGEMM:GemmFwdRest,0.12016,1354752,miopenConvolutionFwdAlgoGEMM,<unused>
768-7-7-1x1-2176-7-7-1-0x0-1x1-1x1-0-NCHW-FP32-F=miopenConvolutionFwdAlgoDirect:ConvDirectNaiveConvFwd,5.01713,0,miopenConvolutionFwdAlgoDirect,<unused>;miopenConvolutionFwdAlgoWinograd:ConvBinWinogradRxSf2x3g1,0.51464,0,miopenConvolutionFwdAlgoWinograd,<unused>;miopenConvolutionFwdAlgoGEMM:GemmFwd1x1_0_1,0.16468,0,miopenConvolutionFwdAlgoGEMM,<unused>
2432-7-7-1x1-768-7-7-1-0x0-1x1-1x1-0-NCHW-FP32-F=miopenConvolutionFwdAlgoDirect:ConvDirectNaiveConvFwd,3.46826,0,miopenConvolutionFwdAlgoDirect,<unused>;miopenConvolutionFwdAlgoWinograd:ConvBinWinogradRxSf2x3g1,1.56572,0,miopenConvolutionFwdAlgoWinograd,<unused>;miopenConvolutionFwdAlgoGEMM:GemmFwd1x1_0_1,0.397921,0,miopenConvolutionFwdAlgoGEMM,<unused>
768-7-7-3x3-768-7-7-1-1x1-1x1-1x1-0-NCHW-FP32-F_g32=miopenConvolutionFwdAlgoDirect:ConvOclDirectFwd,0.06272,0,miopenConvolutionFwdAlgoDirect,<unused>;miopenConvolutionFwdAlgoWinograd:ConvBinWinogradRxSf2x3,0.0696,0,miopenConvolutionFwdAlgoWinograd,<unused>;miopenConvolutionFwdAlgoGEMM:GemmFwdRest,0.105,1354752,miopenConvolutionFwdAlgoGEMM,<unused>
2560-7-7-1x1-768-7-7-1-0x0-1x1-1x1-0-NCHW-FP32-F=miopenConvolutionFwdAlgoDirect:ConvDirectNaiveConvFwd,4.61663,0,miopenConvolutionFwdAlgoDirect,<unused>;miopenConvolutionFwdAlgoWinograd:ConvBinWinogradRxSf2x3g1,1.64448,0,miopenConvolutionFwdAlgoWinograd,<unused>;miopenConvolutionFwdAlgoGEMM:GemmFwd1x1_0_1,0.418681,0,miopenConvolutionFwdAlgoGEMM,<unused>
2688-1-1-1x1-1000-1-1-1-0x0-1x1-1x1-0-NCHW-FP32-F=miopenConvolutionFwdAlgoDirect:ConvDirectNaiveConvFwd,3.81389,0,miopenConvolutionFwdAlgoDirect,<unused>;miopenConvolutionFwdAlgoWinograd:ConvBinWinogradRxSf2x3g1,1.72296,0,miopenConvolutionFwdAlgoWinograd,<unused>;miopenConvolutionFwdAlgoGEMM:GemmFwd1x1_0_1,0.316721,0,miopenConvolutionFwdAlgoGEMM,<unused>
64-56-56-1x1-512-56-56-1-0x0-1x1-1x1-0-NCHW-FP32-F=miopenConvolutionFwdAlgoImplicitGEMM:ConvHipImplicitGemmV4R4Fwd,0.09012,0,miopenConvolutionFwdAlgoImplicitGEMM,<unused>;miopenConvolutionFwdAlgoDirect:ConvDirectNaiveConvFwd,5.27498,0,miopenConvolutionFwdAlgoDirect,<unused>;miopenConvolutionFwdAlgoWinograd:ConvBinWinogradRxSf3x2,0.231961,0,miopenConvolutionFwdAlgoWinograd,<unused>;miopenConvolutionFwdAlgoGEMM:GemmFwd1x1_0_1,0.102641,0,miopenConvolutionFwdAlgoGEMM,<unused>
256-56-56-3x3-256-56-56-1-1x1-1x1-1x1-0-NCHW-FP32-F_g64=miopenConvolutionFwdAlgoDirect:ConvOclDirectFwd,0.085201,0,miopenConvolutionFwdAlgoDirect,<unused>;miopenConvolutionFwdAlgoWinograd:ConvBinWinogradRxSf2x3,0.281441,0,miopenConvolutionFwdAlgoWinograd,<unused>;miopenConvolutionFwdAlgoGEMM:GemmFwdRest,0.493961,28901376,miopenConvolutionFwdAlgoGEMM,<unused>
256-56-56-1x1-256-56-56-1-0x0-1x1-1x1-0-NCHW-FP32-F=miopenConvolutionFwdAlgoImplicitGEMM:ConvHipImplicitGemmV4R4Fwd,0.1596,0,miopenConvolutionFwdAlgoImplicitGEMM,<unused>;miopenConvolutionFwdAlgoDirect:ConvDirectNaiveConvFwd,11.1038,0,miopenConvolutionFwdAlgoDirect,<unused>;miopenConvolutionFwdAlgoWinograd:ConvBinWinogradRxSf3x2,0.399681,0,miopenConvolutionFwdAlgoWinograd,<unused>;miopenConvolutionFwdAlgoGEMM:GemmFwd1x1_0_1,0.228241,0,miopenConvolutionFwdAlgoGEMM,<unused>
256-56-56-1x1-512-56-56-1-0x0-1x1-1x1-0-NCHW-FP32-F=miopenConvolutionFwdAlgoImplicitGEMM:ConvHipImplicitGemmV4R4Fwd,0.07556,0,miopenConvolutionFwdAlgoImplicitGEMM,<unused>;miopenConvolutionFwdAlgoDirect:ConvDirectNaiveConvFwd,12.6167,0,miopenConvolutionFwdAlgoDirect,<unused>;miopenConvolutionFwdAlgoWinograd:ConvBinWinogradRxSf3x2,0.570882,0,miopenConvolutionFwdAlgoWinograd,<unused>;miopenConvolutionFwdAlgoGEMM:GemmFwd1x1_0_1,0.275241,0,miopenConvolutionFwdAlgoGEMM,<unused>
512-56-56-3x3-512-28-28-1-1x1-2x2-1x1-0-NCHW-FP32-F_g64=miopenConvolutionFwdAlgoDirect:ConvOclDirectFwd,0.131481,0,miopenConvolutionFwdAlgoDirect,<unused>;miopenConvolutionFwdAlgoWinograd:ConvBinWinogradRxSf2x3,0.25348,0,miopenConvolutionFwdAlgoWinograd,<unused>;miopenConvolutionFwdAlgoGEMM:GemmFwdRest,0.25804,14450688,miopenConvolutionFwdAlgoGEMM,<unused>
768-28-28-1x1-512-28-28-1-0x0-1x1-1x1-0-NCHW-FP32-F=miopenConvolutionFwdAlgoDirect:ConvDirectNaiveConvFwd,8.20978,0,miopenConvolutionFwdAlgoDirect,<unused>;miopenConvolutionFwdAlgoWinograd:ConvBinWinogradRxSf3x2,0.535641,0,miopenConvolutionFwdAlgoWinograd,<unused>;miopenConvolutionFwdAlgoGEMM:GemmFwd1x1_0_1,0.283961,0,miopenConvolutionFwdAlgoGEMM,<unused>
512-28-28-1x1-512-28-28-1-0x0-1x1-1x1-0-NCHW-FP32-F=miopenConvolutionFwdAlgoDirect:ConvDirectNaiveConvFwd,10.4823,0,miopenConvolutionFwdAlgoDirect,<unused>;miopenConvolutionFwdAlgoWinograd:ConvBinWinogradRxSf3x2,0.388041,0,miopenConvolutionFwdAlgoWinograd,<unused>;miopenConvolutionFwdAlgoGEMM:GemmFwd1x1_0_1,0.255401,0,miopenConvolutionFwdAlgoGEMM,<unused>
512-28-28-3x3-512-28-28-1-1x1-1x1-1x1-0-NCHW-FP32-F_g64=miopenConvolutionFwdAlgoDirect:ConvOclDirectFwd,0.08548,0,miopenConvolutionFwdAlgoDirect,<unused>;miopenConvolutionFwdAlgoWinograd:ConvBinWinogradRxSf2x3,0.131401,0,miopenConvolutionFwdAlgoWinograd,<unused>;miopenConvolutionFwdAlgoGEMM:GemmFwdRest,0.221202,14450688,miopenConvolutionFwdAlgoGEMM,<unused>
512-28-28-1x1-1024-28-28-1-0x0-1x1-1x1-0-NCHW-FP32-F=miopenConvolutionFwdAlgoDirect:ConvDirectNaiveConvFwd,9.70746,0,miopenConvolutionFwdAlgoDirect,<unused>;miopenConvolutionFwdAlgoWinograd:ConvBinWinogradRxSf3x2,0.702841,0,miopenConvolutionFwdAlgoWinograd,<unused>;miopenConvolutionFwdAlgoGEMM:GemmFwd1x1_0_1,0.35284,0,miopenConvolutionFwdAlgoGEMM,<unused>
1024-28-28-3x3-1024-14-14-1-1x1-2x2-1x1-0-NCHW-FP32-F_g64=miopenConvolutionFwdAlgoDirect:ConvOclDirectFwd,0.17404,0,miopenConvolutionFwdAlgoDirect,<unused>;miopenConvolutionFwdAlgoWinograd:ConvBinWinogradRxSf2x3,0.151401,0,miopenConvolutionFwdAlgoWinograd,<unused>;miopenConvolutionFwdAlgoGEMM:GemmFwdRest,0.20128,7225344,miopenConvolutionFwdAlgoGEMM,<unused>
1536-14-14-1x1-1024-14-14-1-0x0-1x1-1x1-0-NCHW-FP32-F=miopenConvolutionFwdAlgoDirect:ConvDirectNaiveConvFwd,8.09356,0,miopenConvolutionFwdAlgoDirect,<unused>;miopenConvolutionFwdAlgoWinograd:ConvBinWinogradRxSf2x3g1,1.01212,0,miopenConvolutionFwdAlgoWinograd,<unused>;miopenConvolutionFwdAlgoGEMM:GemmFwd1x1_0_1,0.518801,0,miopenConvolutionFwdAlgoGEMM,<unused>
1024-14-14-1x1-1024-14-14-1-0x0-1x1-1x1-0-NCHW-FP32-F=miopenConvolutionFwdAlgoDirect:ConvDirectNaiveConvFwd,8.38046,0,miopenConvolutionFwdAlgoDirect,<unused>;miopenConvolutionFwdAlgoWinograd:ConvBinWinogradRxSf3x2,0.687962,0,miopenConvolutionFwdAlgoWinograd,<unused>;miopenConvolutionFwdAlgoGEMM:GemmFwd1x1_0_1,0.493921,0,miopenConvolutionFwdAlgoGEMM,<unused>
1024-14-14-3x3-1024-14-14-1-1x1-1x1-1x1-0-NCHW-FP32-F_g64=miopenConvolutionFwdAlgoDirect:ConvOclDirectFwd,0.09508,0,miopenConvolutionFwdAlgoDirect,<unused>;miopenConvolutionFwdAlgoWinograd:ConvBinWinogradRxSf2x3,0.08196,0,miopenConvolutionFwdAlgoWinograd,<unused>;miopenConvolutionFwdAlgoGEMM:GemmFwdRest,0.167921,7225344,miopenConvolutionFwdAlgoGEMM,<unused>
1024-14-14-1x1-2048-14-14-1-0x0-1x1-1x1-0-NCHW-FP32-F=miopenConvolutionFwdAlgoDirect:ConvDirectNaiveConvFwd,8.4437,0,miopenConvolutionFwdAlgoDirect,<unused>;miopenConvolutionFwdAlgoWinograd:ConvBinWinogradRxSf2x3g1,1.3134,0,miopenConvolutionFwdAlgoWinograd,<unused>;miopenConvolutionFwdAlgoGEMM:GemmFwd1x1_0_1,0.400841,0,miopenConvolutionFwdAlgoGEMM,<unused>
2048-14-14-3x3-2048-7-7-1-1x1-2x2-1x1-0-NCHW-FP32-F_g64=miopenConvolutionFwdAlgoDirect:ConvOclDirectFwd,0.208081,0,miopenConvolutionFwdAlgoDirect,<unused>;miopenConvolutionFwdAlgoWinograd:ConvBinWinogradRxSf2x3,0.14224,0,miopenConvolutionFwdAlgoWinograd,<unused>;miopenConvolutionFwdAlgoGEMM:GemmFwdRest,0.241241,3612672,miopenConvolutionFwdAlgoGEMM,<unused>
3072-7-7-1x1-2048-7-7-1-0x0-1x1-1x1-0-NCHW-FP32-F=miopenConvolutionFwdAlgoDirect:ConvDirectNaiveConvFwd,4.20093,0,miopenConvolutionFwdAlgoDirect,<unused>;miopenConvolutionFwdAlgoWinograd:ConvBinWinogradRxSf2x3g1,1.649,0,miopenConvolutionFwdAlgoWinograd,<unused>;miopenConvolutionFwdAlgoGEMM:GemmFwd1x1_0_1,0.582561,0,miopenConvolutionFwdAlgoGEMM,<unused>
2048-7-7-1x1-2048-7-7-1-0x0-1x1-1x1-0-NCHW-FP32-F=miopenConvolutionFwdAlgoDirect:ConvDirectNaiveConvFwd,5.29682,0,miopenConvolutionFwdAlgoDirect,<unused>;miopenConvolutionFwdAlgoWinograd:ConvBinWinogradRxSf2x3g1,1.34632,0,miopenConvolutionFwdAlgoWinograd,<unused>;miopenConvolutionFwdAlgoGEMM:GemmFwd1x1_0_1,0.392601,0,miopenConvolutionFwdAlgoGEMM,<unused>
2048-7-7-3x3-2048-7-7-1-1x1-1x1-1x1-0-NCHW-FP32-F_g64=miopenConvolutionFwdAlgoDirect:ConvOclDirectFwd,0.13716,0,miopenConvolutionFwdAlgoDirect,<unused>;miopenConvolutionFwdAlgoWinograd:ConvBinWinogradRxSf2x3,0.075321,0,miopenConvolutionFwdAlgoWinograd,<unused>;miopenConvolutionFwdAlgoGEMM:GemmFwdRest,0.1846,3612672,miopenConvolutionFwdAlgoGEMM,<unused>
512-7-7-7x7-4096-1-1-1-0x0-1x1-1x1-0-NCHW-FP32-F=miopenConvolutionFwdAlgoDirect:ConvOclDirectFwd,3.3924,0,miopenConvolutionFwdAlgoDirect,<unused>;miopenConvolutionFwdAlgoWinograd:ConvBinWinogradRxSf2x3,2.9436,0,miopenConvolutionFwdAlgoWinograd,<unused>;miopenConvolutionFwdAlgoGEMM:GemmFwdRest,4.2336,100352,miopenConvolutionFwdAlgoGEMM,<unused>
4096-1-1-1x1-4096-1-1-1-0x0-1x1-1x1-0-NCHW-FP32-F=miopenConvolutionFwdAlgoDirect:ConvDirectNaiveConvFwd,9.37825,0,miopenConvolutionFwdAlgoDirect,<unused>;miopenConvolutionFwdAlgoWinograd:ConvBinWinogradRxSf2x3g1,1.18428,0,miopenConvolutionFwdAlgoWinograd,<unused>;miopenConvolutionFwdAlgoGEMM:GemmFwd1x1_0_1,0.734001,0,miopenConvolutionFwdAlgoGEMM,<unused>
4096-1-1-1x1-1000-1-1-1-0x0-1x1-1x1-0-NCHW-FP32-F=miopenConvolutionFwdAlgoDirect:ConvDirectNaiveConvFwd,3.84839,0,miopenConvolutionFwdAlgoDirect,<unused>;miopenConvolutionFwdAlgoWinograd:ConvBinWinogradRxSf3x2,2.53224,0,miopenConvolutionFwdAlgoWinograd,<unused>;miopenConvolutionFwdAlgoGEMM:GemmFwd1x1_0_1,0.678361,0,miopenConvolutionFwdAlgoGEMM,<unused>
3-225-225-3x3-32-112-112-1-0x0-2x2-1x1-0-NCHW-FP32-F=miopenConvolutionFwdAlgoDirect:ConvOclDirectFwd,0.05776,0,miopenConvolutionFwdAlgoDirect,<unused>;miopenConvolutionFwdAlgoWinograd:ConvBinWinogradRxSf2x3g1,0.07304,0,miopenConvolutionFwdAlgoWinograd,<unused>;miopenConvolutionFwdAlgoGEMM:GemmFwdRest,0.10384,1354752,miopenConvolutionFwdAlgoGEMM,<unused>
32-112-112-3x3-32-112-112-1-1x1-1x1-1x1-0-NCHW-FP32-F_g32=miopenConvolutionFwdAlgoDirect:ConvOclDirectFwd,0.03796,0,miopenConvolutionFwdAlgoDirect,<unused>;miopenConvolutionFwdAlgoWinograd:ConvBinWinogradRxSf2x3,0.40168,0,miopenConvolutionFwdAlgoWinograd,<unused>;miopenConvolutionFwdAlgoGEMM:GemmFwdRest,0.34976,14450688,miopenConvolutionFwdAlgoGEMM,<unused>
32-112-112-1x1-64-112-112-1-0x0-1x1-1x1-0-NCHW-FP32-F=miopenConvolutionFwdAlgoImplicitGEMM:ConvHipImplicitGemmV4R4Fwd,0.0442,0,miopenConvolutionFwdAlgoImplicitGEMM,<unused>;miopenConvolutionFwdAlgoDirect:ConvDirectNaiveConvFwd,2.1426,0,miopenConvolutionFwdAlgoDirect,<unused>;miopenConvolutionFwdAlgoWinograd:ConvBinWinogradRxSf2x3g1,0.1178,0,miopenConvolutionFwdAlgoWinograd,<unused>;miopenConvolutionFwdAlgoGEMM:GemmFwd1x1_0_1,0.0524,0,miopenConvolutionFwdAlgoGEMM,<unused>
64-113-113-3x3-64-56-56-1-0x0-2x2-1x1-0-NCHW-FP32-F_g64=miopenConvolutionFwdAlgoDirect:ConvOclDirectFwd,0.04372,0,miopenConvolutionFwdAlgoDirect,<unused>;miopenConvolutionFwdAlgoWinograd:ConvBinWinogradRxSf2x3,0.3178,0,miopenConvolutionFwdAlgoWinograd,<unused>;miopenConvolutionFwdAlgoGEMM:GemmFwdRest,0.22036,7225344,miopenConvolutionFwdAlgoGEMM,<unused>
64-56-56-1x1-128-56-56-1-0x0-1x1-1x1-0-NCHW-FP32-F=miopenConvolutionFwdAlgoImplicitGEMM:ConvHipImplicitGemmV4R4Fwd,0.04108,0,miopenConvolutionFwdAlgoImplicitGEMM,<unused>;miopenConvolutionFwdAlgoDirect:ConvDirectNaiveConvFwd,1.59636,0,miopenConvolutionFwdAlgoDirect,<unused>;miopenConvolutionFwdAlgoWinograd:ConvBinWinogradRxSf3x2,0.11904,0,miopenConvolutionFwdAlgoWinograd,<unused>;miopenConvolutionFwdAlgoGEMM:GemmFwd1x1_0_1,0.06876,0,miopenConvolutionFwdAlgoGEMM,<unused>
128-56-56-3x3-128-56-56-1-1x1-1x1-1x1-0-NCHW-FP32-F_g128=miopenConvolutionFwdAlgoDirect:ConvOclDirectFwd,0.04016,0,miopenConvolutionFwdAlgoDirect,<unused>;miopenConvolutionFwdAlgoWinograd:ConvBinWinogradRxSf2x3,0.43488,0,miopenConvolutionFwdAlgoWinograd,<unused>;miopenConvolutionFwdAlgoGEMM:GemmFwdRest,0.36032,14450688,miopenConvolutionFwdAlgoGEMM,<unused>
128-56-56-1x1-128-56-56-1-0x0-1x1-1x1-0-NCHW-FP32-F=miopenConvolutionFwdAlgoImplicitGEMM:ConvHipImplicitGemmV4R4Fwd,0.0622,0,miopenConvolutionFwdAlgoImplicitGEMM,<unused>;miopenConvolutionFwdAlgoDirect:ConvDirectNaiveConvFwd,3.12916,0,miopenConvolutionFwdAlgoDirect,<unused>;miopenConvolutionFwdAlgoWinograd:ConvBinWinogradRxSf3x2,0.15688,0,miopenConvolutionFwdAlgoWinograd,<unused>;miopenConvolutionFwdAlgoGEMM:GemmFwd1x1_0_1,0.08952,0,miopenConvolutionFwdAlgoGEMM,<unused>
