dockerfiles/miopen-rocm53/gfx906_60.HIP.2_18_0_.ufdb.txt
3-224-224-7x7-64-112-112-64-3x3-2x2-1x1-0-NCHW-FP32-F=miopenConvolutionFwdAlgoImplicitGEMM:ConvMlirIgemmFwd,4.36545,0,miopenConvolutionFwdAlgoImplicitGEMM,<unused>;miopenConvolutionFwdAlgoDirect:ConvAsm7x7c3h224w224k64u2v2p3q3f1,1.62528,0,miopenConvolutionFwdAlgoDirect,<unused>;miopenConvolutionFwdAlgoWinograd:ConvBinWinogradRxS,2.51553,0,miopenConvolutionFwdAlgoWinograd,<unused>;miopenConvolutionFwdAlgoGEMM:GemmFwdRest,6.53312,7375872,miopenConvolutionFwdAlgoGEMM,<unused>
64-56-56-1x1-64-56-56-64-0x0-1x1-1x1-0-NCHW-FP32-F=miopenConvolutionFwdAlgoImplicitGEMM:ConvHipImplicitGemmV4R4Fwd,0.174561,0,miopenConvolutionFwdAlgoImplicitGEMM,<unused>;miopenConvolutionFwdAlgoDirect:ConvAsm1x1U,0.204961,0,miopenConvolutionFwdAlgoDirect,<unused>;miopenConvolutionFwdAlgoWinograd:ConvBinWinogradRxSf3x2,0.461121,0,miopenConvolutionFwdAlgoWinograd,<unused>;miopenConvolutionFwdAlgoGEMM:GemmFwd1x1_0_1,0.201281,0,miopenConvolutionFwdAlgoGEMM,<unused>
64-56-56-3x3-64-56-56-64-1x1-1x1-1x1-0-NCHW-FP32-F=miopenConvolutionFwdAlgoWinograd:ConvBinWinogradRxSf2x3g1,0.812802,0,miopenConvolutionFwdAlgoWinograd,<unused>
128-56-56-1x1-256-56-56-64-0x0-1x1-1x1-0-NCHW-FP32-F=miopenConvolutionFwdAlgoImplicitGEMM:ConvHipImplicitGemmV4R4Fwd,1.28272,0,miopenConvolutionFwdAlgoImplicitGEMM,<unused>;miopenConvolutionFwdAlgoDirect:ConvAsm1x1U,1.25904,0,miopenConvolutionFwdAlgoDirect,<unused>;miopenConvolutionFwdAlgoWinograd:ConvBinWinogradRxSf3x2,2.83025,0,miopenConvolutionFwdAlgoWinograd,<unused>;miopenConvolutionFwdAlgoGEMM:GemmFwd1x1_0_1,1.26352,0,miopenConvolutionFwdAlgoGEMM,<unused>
256-56-56-1x1-64-56-56-64-0x0-1x1-1x1-0-NCHW-FP32-F=miopenConvolutionFwdAlgoImplicitGEMM:ConvHipImplicitGemmV4R4Fwd,0.588001,0,miopenConvolutionFwdAlgoImplicitGEMM,<unused>;miopenConvolutionFwdAlgoDirect:ConvAsm1x1U,0.655362,0,miopenConvolutionFwdAlgoDirect,<unused>;miopenConvolutionFwdAlgoWinograd:ConvBinWinogradRxSf3x2,1.36768,0,miopenConvolutionFwdAlgoWinograd,<unused>;miopenConvolutionFwdAlgoGEMM:GemmFwd1x1_0_1,0.700002,0,miopenConvolutionFwdAlgoGEMM,<unused>
64-56-56-1x1-256-56-56-64-0x0-1x1-1x1-0-NCHW-FP32-F=miopenConvolutionFwdAlgoImplicitGEMM:ConvAsmImplicitGemmV4R1DynamicFwd_1x1,0.711361,0,miopenConvolutionFwdAlgoImplicitGEMM,<unused>;miopenConvolutionFwdAlgoDirect:ConvOclDirectFwd1x1,0.667202,0,miopenConvolutionFwdAlgoDirect,<unused>;miopenConvolutionFwdAlgoWinograd:ConvBinWinogradRxSf3x2,1.64768,0,miopenConvolutionFwdAlgoWinograd,<unused>;miopenConvolutionFwdAlgoGEMM:GemmFwd1x1_0_1,0.689282,0,miopenConvolutionFwdAlgoGEMM,<unused>
256-56-56-1x1-128-56-56-64-0x0-1x1-1x1-0-NCHW-FP32-F=miopenConvolutionFwdAlgoImplicitGEMM:ConvAsmImplicitGemmV4R1DynamicFwd_1x1,1.2152,0,miopenConvolutionFwdAlgoImplicitGEMM,<unused>;miopenConvolutionFwdAlgoDirect:ConvAsm1x1U,1.31184,0,miopenConvolutionFwdAlgoDirect,<unused>;miopenConvolutionFwdAlgoWinograd:ConvBinWinogradRxSf3x2,2.67296,0,miopenConvolutionFwdAlgoWinograd,<unused>;miopenConvolutionFwdAlgoGEMM:GemmFwd1x1_0_1,1.3576,0,miopenConvolutionFwdAlgoGEMM,<unused>
128-56-56-3x3-128-28-28-64-1x1-2x2-1x1-0-NCHW-FP32-F=miopenConvolutionFwdAlgoImplicitGEMM:ConvAsmImplicitGemmV4R1DynamicFwd,1.47152,0,miopenConvolutionFwdAlgoImplicitGEMM,<unused>;miopenConvolutionFwdAlgoDirect:ConvOclDirectFwd,11.2974,0,miopenConvolutionFwdAlgoDirect,<unused>;miopenConvolutionFwdAlgoWinograd:ConvBinWinogradRxS,2.84912,0,miopenConvolutionFwdAlgoWinograd,<unused>;miopenConvolutionFwdAlgoGEMM:GemmFwdRest,8.86771,3612672,miopenConvolutionFwdAlgoGEMM,<unused>
384-28-28-1x1-512-28-28-64-0x0-1x1-1x1-0-NCHW-FP32-F=miopenConvolutionFwdAlgoImplicitGEMM:ConvAsmImplicitGemmV4R1DynamicFwd_1x1,1.78704,0,miopenConvolutionFwdAlgoImplicitGEMM,<unused>;miopenConvolutionFwdAlgoDirect:ConvOclDirectFwd1x1,2.07824,0,miopenConvolutionFwdAlgoDirect,<unused>;miopenConvolutionFwdAlgoWinograd:ConvBinWinogradRxSf3x2,4.20576,0,miopenConvolutionFwdAlgoWinograd,<unused>;miopenConvolutionFwdAlgoGEMM:GemmFwd1x1_0_1,2.51488,0,miopenConvolutionFwdAlgoGEMM,<unused>
512-28-28-1x1-128-28-28-64-0x0-1x1-1x1-0-NCHW-FP32-F=miopenConvolutionFwdAlgoImplicitGEMM:ConvAsmImplicitGemmV4R1DynamicFwd_1x1,0.629281,0,miopenConvolutionFwdAlgoImplicitGEMM,<unused>;miopenConvolutionFwdAlgoDirect:ConvAsm1x1U,0.744161,0,miopenConvolutionFwdAlgoDirect,<unused>;miopenConvolutionFwdAlgoWinograd:ConvBinWinogradRxSf3x2,1.47168,0,miopenConvolutionFwdAlgoWinograd,<unused>;miopenConvolutionFwdAlgoGEMM:GemmFwd1x1_0_1,0.74768,0,miopenConvolutionFwdAlgoGEMM,<unused>
128-28-28-3x3-128-28-28-64-1x1-1x1-1x1-0-NCHW-FP32-F=miopenConvolutionFwdAlgoWinograd:ConvBinWinogradRxSf2x3g1,0.7648,0,miopenConvolutionFwdAlgoWinograd,<unused>
128-28-28-1x1-512-28-28-64-0x0-1x1-1x1-0-NCHW-FP32-F=miopenConvolutionFwdAlgoImplicitGEMM:ConvAsmImplicitGemmV4R1DynamicFwd_1x1,0.6296,0,miopenConvolutionFwdAlgoImplicitGEMM,<unused>;miopenConvolutionFwdAlgoDirect:ConvOclDirectFwd1x1,0.68384,0,miopenConvolutionFwdAlgoDirect,<unused>;miopenConvolutionFwdAlgoWinograd:ConvBinWinogradRxSf3x2,1.6288,0,miopenConvolutionFwdAlgoWinograd,<unused>;miopenConvolutionFwdAlgoGEMM:GemmFwd1x1_0_1,0.68592,0,miopenConvolutionFwdAlgoGEMM,<unused>
512-28-28-1x1-256-28-28-64-0x0-1x1-1x1-0-NCHW-FP32-F=miopenConvolutionFwdAlgoImplicitGEMM:ConvAsmImplicitGemmV4R1DynamicFwd_1x1,1.25088,0,miopenConvolutionFwdAlgoImplicitGEMM,<unused>;miopenConvolutionFwdAlgoDirect:ConvOclDirectFwd1x1,1.34112,0,miopenConvolutionFwdAlgoDirect,<unused>;miopenConvolutionFwdAlgoWinograd:ConvBinWinogradRxSf3x2,2.82144,0,miopenConvolutionFwdAlgoWinograd,<unused>;miopenConvolutionFwdAlgoGEMM:GemmFwd1x1_0_1,1.43616,0,miopenConvolutionFwdAlgoGEMM,<unused>
256-28-28-3x3-256-14-14-64-1x1-2x2-1x1-0-NCHW-FP32-F=miopenConvolutionFwdAlgoImplicitGEMM:ConvHipImplicitGemmV4R1Fwd,1.53744,0,miopenConvolutionFwdAlgoImplicitGEMM,<unused>;miopenConvolutionFwdAlgoDirect:ConvOclDirectFwd,4.83488,0,miopenConvolutionFwdAlgoDirect,<unused>;miopenConvolutionFwdAlgoWinograd:ConvBinWinogradRxS,2.99568,0,miopenConvolutionFwdAlgoWinograd,<unused>;miopenConvolutionFwdAlgoGEMM:GemmFwdRest,9.12371,1806336,miopenConvolutionFwdAlgoGEMM,<unused>
768-14-14-1x1-1024-14-14-64-0x0-1x1-1x1-0-NCHW-FP32-F=miopenConvolutionFwdAlgoImplicitGEMM:ConvHipImplicitGemmV4R4Fwd,1.72928,0,miopenConvolutionFwdAlgoImplicitGEMM,<unused>;miopenConvolutionFwdAlgoDirect:ConvAsm1x1U,2.60944,0,miopenConvolutionFwdAlgoDirect,<unused>;miopenConvolutionFwdAlgoWinograd:ConvBinWinogradRxSf3x2,3.9184,0,miopenConvolutionFwdAlgoWinograd,<unused>;miopenConvolutionFwdAlgoGEMM:GemmFwd1x1_0_1,2.97728,0,miopenConvolutionFwdAlgoGEMM,<unused>
1024-14-14-1x1-256-14-14-64-0x0-1x1-1x1-0-NCHW-FP32-F=miopenConvolutionFwdAlgoImplicitGEMM:ConvHipImplicitGemmV4R4Fwd,0.73456,0,miopenConvolutionFwdAlgoImplicitGEMM,<unused>;miopenConvolutionFwdAlgoDirect:ConvAsm1x1U,0.8944,0,miopenConvolutionFwdAlgoDirect,<unused>;miopenConvolutionFwdAlgoWinograd:ConvBinWinogradRxSf3x2,1.45424,0,miopenConvolutionFwdAlgoWinograd,<unused>;miopenConvolutionFwdAlgoGEMM:GemmFwd1x1_0_1,0.93712,0,miopenConvolutionFwdAlgoGEMM,<unused>
256-14-14-3x3-256-14-14-64-1x1-1x1-1x1-0-NCHW-FP32-F=miopenConvolutionFwdAlgoWinograd:ConvBinWinogradRxSf2x3g1,0.75984,0,miopenConvolutionFwdAlgoWinograd,<unused>
256-14-14-1x1-1024-14-14-64-0x0-1x1-1x1-0-NCHW-FP32-F=miopenConvolutionFwdAlgoImplicitGEMM:ConvHipImplicitGemmV4R4Fwd,0.61568,0,miopenConvolutionFwdAlgoImplicitGEMM,<unused>;miopenConvolutionFwdAlgoDirect:ConvOclDirectFwd1x1,0.7432,0,miopenConvolutionFwdAlgoDirect,<unused>;miopenConvolutionFwdAlgoWinograd:ConvBinWinogradRxSf3x2,1.51104,0,miopenConvolutionFwdAlgoWinograd,<unused>;miopenConvolutionFwdAlgoGEMM:GemmFwd1x1_0_1,0.91248,0,miopenConvolutionFwdAlgoGEMM,<unused>
1024-14-14-1x1-512-14-14-64-0x0-1x1-1x1-0-NCHW-FP32-F=miopenConvolutionFwdAlgoImplicitGEMM:ConvHipImplicitGemmV4R4Fwd,1.34752,0,miopenConvolutionFwdAlgoImplicitGEMM,<unused>;miopenConvolutionFwdAlgoDirect:ConvAsm1x1U,1.884,0,miopenConvolutionFwdAlgoDirect,<unused>;miopenConvolutionFwdAlgoWinograd:ConvBinWinogradRxSf3x2,2.86544,0,miopenConvolutionFwdAlgoWinograd,<unused>;miopenConvolutionFwdAlgoGEMM:GemmFwd1x1_0_1,2.532,0,miopenConvolutionFwdAlgoGEMM,<unused>
512-14-14-3x3-512-7-7-64-1x1-2x2-1x1-0-NCHW-FP32-F=miopenConvolutionFwdAlgoImplicitGEMM:ConvHipImplicitGemmV4R1Fwd,1.82912,0,miopenConvolutionFwdAlgoImplicitGEMM,<unused>;miopenConvolutionFwdAlgoDirect:ConvOclDirectFwd,6.41728,0,miopenConvolutionFwdAlgoDirect,<unused>;miopenConvolutionFwdAlgoWinograd:ConvBinWinogradRxS,3.71088,0,miopenConvolutionFwdAlgoWinograd,<unused>;miopenConvolutionFwdAlgoGEMM:GemmFwdRest,26.2655,903168,miopenConvolutionFwdAlgoGEMM,<unused>
1536-7-7-1x1-2048-7-7-64-0x0-1x1-1x1-0-NCHW-FP32-F=miopenConvolutionFwdAlgoImplicitGEMM:ConvHipImplicitGemmV4R4Fwd,1.96032,0,miopenConvolutionFwdAlgoImplicitGEMM,<unused>;miopenConvolutionFwdAlgoDirect:ConvAsm1x1U,3.02576,0,miopenConvolutionFwdAlgoDirect,<unused>;miopenConvolutionFwdAlgoWinograd:ConvBinWinogradRxSf3x2,5.18048,0,miopenConvolutionFwdAlgoWinograd,<unused>;miopenConvolutionFwdAlgoGEMM:GemmFwd1x1_0_1,3.95952,0,miopenConvolutionFwdAlgoGEMM,<unused>
2048-7-7-1x1-512-7-7-64-0x0-1x1-1x1-0-NCHW-FP32-F=miopenConvolutionFwdAlgoImplicitGEMM:ConvHipImplicitGemmV4R4Fwd,0.78832,0,miopenConvolutionFwdAlgoImplicitGEMM,<unused>;miopenConvolutionFwdAlgoDirect:ConvAsm1x1U,1.10656,0,miopenConvolutionFwdAlgoDirect,<unused>;miopenConvolutionFwdAlgoWinograd:ConvBinWinogradRxSf3x2,2.0392,0,miopenConvolutionFwdAlgoWinograd,<unused>;miopenConvolutionFwdAlgoGEMM:GemmFwd1x1_0_1,2.31536,0,miopenConvolutionFwdAlgoGEMM,<unused>
512-7-7-3x3-512-7-7-64-1x1-1x1-1x1-0-NCHW-FP32-F=miopenConvolutionFwdAlgoWinograd:ConvBinWinogradRxSf2x3g1,0.95744,0,miopenConvolutionFwdAlgoWinograd,<unused>
512-7-7-1x1-2048-7-7-64-0x0-1x1-1x1-0-NCHW-FP32-F=miopenConvolutionFwdAlgoImplicitGEMM:ConvHipImplicitGemmV4R4Fwd,0.66816,0,miopenConvolutionFwdAlgoImplicitGEMM,<unused>;miopenConvolutionFwdAlgoDirect:ConvAsm1x1U,0.932961,0,miopenConvolutionFwdAlgoDirect,<unused>;miopenConvolutionFwdAlgoWinograd:ConvBinWinogradRxSf3x2,2.092,0,miopenConvolutionFwdAlgoWinograd,<unused>;miopenConvolutionFwdAlgoGEMM:GemmFwd1x1_0_1,1.38144,0,miopenConvolutionFwdAlgoGEMM,<unused>
3-224-224-7x7-64-112-112-64-3x3-2x2-1x1-0-NCHW-FP16-F=miopenConvolutionFwdAlgoImplicitGEMM:ConvMlirIgemmFwd,4.71361,0,miopenConvolutionFwdAlgoImplicitGEMM,<unused>;miopenConvolutionFwdAlgoDirect:ConvOclDirectFwdGen,10.3823,0,miopenConvolutionFwdAlgoDirect,<unused>;miopenConvolutionFwdAlgoWinograd:ConvBinWinogradRxSf2x3g1,2.51152,0,miopenConvolutionFwdAlgoWinograd,<unused>;miopenConvolutionFwdAlgoGEMM:GemmFwdRest,6.92224,3687936,miopenConvolutionFwdAlgoGEMM,<unused>
64-56-56-1x1-64-56-56-64-0x0-1x1-1x1-0-NCHW-FP16-F=miopenConvolutionFwdAlgoImplicitGEMM:ConvHipImplicitGemmV4R1Fwd,0.14032,0,miopenConvolutionFwdAlgoImplicitGEMM,<unused>;miopenConvolutionFwdAlgoDirect:ConvAsm1x1U,0.14768,0,miopenConvolutionFwdAlgoDirect,<unused>;miopenConvolutionFwdAlgoWinograd:ConvBinWinogradRxSf3x2,0.34176,0,miopenConvolutionFwdAlgoWinograd,<unused>;miopenConvolutionFwdAlgoGEMM:GemmFwd1x1_0_1,0.14,0,miopenConvolutionFwdAlgoGEMM,<unused>
64-56-56-3x3-64-56-56-64-1x1-1x1-1x1-0-NCHW-FP16-F=miopenConvolutionFwdAlgoImplicitGEMM:ConvHipImplicitGemmV4R1Fwd,1.03712,0,miopenConvolutionFwdAlgoImplicitGEMM,<unused>;miopenConvolutionFwdAlgoDirect:ConvOclDirectFwd,5.98241,0,miopenConvolutionFwdAlgoDirect,<unused>;miopenConvolutionFwdAlgoWinograd:ConvBinWinogradRxSf2x3g1,0.528641,0,miopenConvolutionFwdAlgoWinograd,<unused>;miopenConvolutionFwdAlgoGEMM:GemmFwdRest,6.61504,3612672,miopenConvolutionFwdAlgoGEMM,<unused>
128-56-56-1x1-256-56-56-64-0x0-1x1-1x1-0-NCHW-FP16-F=miopenConvolutionFwdAlgoImplicitGEMM:ConvHipImplicitGemmV4R1Fwd,1.92528,0,miopenConvolutionFwdAlgoImplicitGEMM,<unused>;miopenConvolutionFwdAlgoDirect:ConvAsm1x1U,1.28336,0,miopenConvolutionFwdAlgoDirect,<unused>;miopenConvolutionFwdAlgoWinograd:ConvBinWinogradRxSf3x2,1.91744,0,miopenConvolutionFwdAlgoWinograd,<unused>;miopenConvolutionFwdAlgoGEMM:GemmFwd1x1_0_1,0.793281,0,miopenConvolutionFwdAlgoGEMM,<unused>
256-56-56-1x1-64-56-56-64-0x0-1x1-1x1-0-NCHW-FP16-F=miopenConvolutionFwdAlgoImplicitGEMM:ConvHipImplicitGemmV4R1Fwd,0.48944,0,miopenConvolutionFwdAlgoImplicitGEMM,<unused>;miopenConvolutionFwdAlgoDirect:ConvAsm1x1U,0.4824,0,miopenConvolutionFwdAlgoDirect,<unused>;miopenConvolutionFwdAlgoWinograd:ConvBinWinogradRxSf3x2,0.944801,0,miopenConvolutionFwdAlgoWinograd,<unused>;miopenConvolutionFwdAlgoGEMM:GemmFwd1x1_0_1,0.37856,0,miopenConvolutionFwdAlgoGEMM,<unused>
64-56-56-1x1-256-56-56-64-0x0-1x1-1x1-0-NCHW-FP16-F=miopenConvolutionFwdAlgoImplicitGEMM:ConvHipImplicitGemmV4R1Fwd,1.14096,0,miopenConvolutionFwdAlgoImplicitGEMM,<unused>;miopenConvolutionFwdAlgoDirect:ConvAsm1x1U,0.448801,0,miopenConvolutionFwdAlgoDirect,<unused>;miopenConvolutionFwdAlgoWinograd:ConvBinWinogradRxSf3x2,1.19312,0,miopenConvolutionFwdAlgoWinograd,<unused>;miopenConvolutionFwdAlgoGEMM:GemmFwd1x1_0_1,0.4344,0,miopenConvolutionFwdAlgoGEMM,<unused>
256-56-56-1x1-128-56-56-64-0x0-1x1-1x1-0-NCHW-FP16-F=miopenConvolutionFwdAlgoImplicitGEMM:ConvHipImplicitGemmV4R1Fwd,0.93728,0,miopenConvolutionFwdAlgoImplicitGEMM,<unused>;miopenConvolutionFwdAlgoDirect:ConvAsm1x1U,0.79152,0,miopenConvolutionFwdAlgoDirect,<unused>;miopenConvolutionFwdAlgoWinograd:ConvBinWinogradRxSf3x2,1.6872,0,miopenConvolutionFwdAlgoWinograd,<unused>;miopenConvolutionFwdAlgoGEMM:GemmFwd1x1_0_1,0.730401,0,miopenConvolutionFwdAlgoGEMM,<unused>
128-56-56-3x3-128-28-28-64-1x1-2x2-1x1-0-NCHW-FP16-F=miopenConvolutionFwdAlgoImplicitGEMM:ConvHipImplicitGemmV4R1Fwd,0.9448,0,miopenConvolutionFwdAlgoImplicitGEMM,<unused>;miopenConvolutionFwdAlgoDirect:ConvOclDirectFwdGen,15.3854,0,miopenConvolutionFwdAlgoDirect,<unused>;miopenConvolutionFwdAlgoWinograd:ConvBinWinogradRxSf2x3g1,2.03248,0,miopenConvolutionFwdAlgoWinograd,<unused>;miopenConvolutionFwdAlgoGEMM:GemmFwdRest,8.17152,1806336,miopenConvolutionFwdAlgoGEMM,<unused>
384-28-28-1x1-512-28-28-64-0x0-1x1-1x1-0-NCHW-FP16-F=miopenConvolutionFwdAlgoImplicitGEMM:ConvHipImplicitGemmV4R1Fwd,1.29392,0,miopenConvolutionFwdAlgoImplicitGEMM,<unused>;miopenConvolutionFwdAlgoDirect:ConvAsm1x1U,1.37808,0,miopenConvolutionFwdAlgoDirect,<unused>;miopenConvolutionFwdAlgoWinograd:ConvBinWinogradRxSf3x2,2.81968,0,miopenConvolutionFwdAlgoWinograd,<unused>;miopenConvolutionFwdAlgoGEMM:GemmFwd1x1_0_1,1.93008,0,miopenConvolutionFwdAlgoGEMM,<unused>
512-28-28-1x1-128-28-28-64-0x0-1x1-1x1-0-NCHW-FP16-F=miopenConvolutionFwdAlgoImplicitGEMM:ConvHipImplicitGemmV4R1Fwd,0.62656,0,miopenConvolutionFwdAlgoImplicitGEMM,<unused>;miopenConvolutionFwdAlgoDirect:ConvAsm1x1U,0.53392,0,miopenConvolutionFwdAlgoDirect,<unused>;miopenConvolutionFwdAlgoWinograd:ConvBinWinogradRxSf3x2,1.008,0,miopenConvolutionFwdAlgoWinograd,<unused>;miopenConvolutionFwdAlgoGEMM:GemmFwd1x1_0_1,0.4648,0,miopenConvolutionFwdAlgoGEMM,<unused>
128-28-28-3x3-128-28-28-64-1x1-1x1-1x1-0-NCHW-FP16-F=miopenConvolutionFwdAlgoImplicitGEMM:ConvHipImplicitGemmV4R1Fwd,0.89472,0,miopenConvolutionFwdAlgoImplicitGEMM,<unused>;miopenConvolutionFwdAlgoDirect:ConvOclDirectFwd,5.43744,0,miopenConvolutionFwdAlgoDirect,<unused>;miopenConvolutionFwdAlgoWinograd:ConvBinWinogradRxSf2x3g1,0.47584,0,miopenConvolutionFwdAlgoWinograd,<unused>;miopenConvolutionFwdAlgoGEMM:GemmFwdRest,8.41728,1806336,miopenConvolutionFwdAlgoGEMM,<unused>
128-28-28-1x1-512-28-28-64-0x0-1x1-1x1-0-NCHW-FP16-F=miopenConvolutionFwdAlgoImplicitGEMM:ConvHipImplicitGemmV4R1Fwd,0.50304,0,miopenConvolutionFwdAlgoImplicitGEMM,<unused>;miopenConvolutionFwdAlgoDirect:ConvAsm1x1U,0.47648,0,miopenConvolutionFwdAlgoDirect,<unused>;miopenConvolutionFwdAlgoWinograd:ConvBinWinogradRxSf3x2,1.1176,0,miopenConvolutionFwdAlgoWinograd,<unused>;miopenConvolutionFwdAlgoGEMM:GemmFwd1x1_0_1,0.4112,0,miopenConvolutionFwdAlgoGEMM,<unused>
512-28-28-1x1-256-28-28-64-0x0-1x1-1x1-0-NCHW-FP16-F=miopenConvolutionFwdAlgoImplicitGEMM:ConvHipImplicitGemmV4R1Fwd,0.89712,0,miopenConvolutionFwdAlgoImplicitGEMM,<unused>;miopenConvolutionFwdAlgoDirect:ConvAsm1x1U,1.01776,0,miopenConvolutionFwdAlgoDirect,<unused>;miopenConvolutionFwdAlgoWinograd:ConvBinWinogradRxSf3x2,1.89024,0,miopenConvolutionFwdAlgoWinograd,<unused>;miopenConvolutionFwdAlgoGEMM:GemmFwd1x1_0_1,0.820641,0,miopenConvolutionFwdAlgoGEMM,<unused>
256-28-28-3x3-256-14-14-64-1x1-2x2-1x1-0-NCHW-FP16-F=miopenConvolutionFwdAlgoImplicitGEMM:ConvHipImplicitGemmV4R1Fwd,1.04672,0,miopenConvolutionFwdAlgoImplicitGEMM,<unused>;miopenConvolutionFwdAlgoDirect:ConvOclDirectFwdGen,18.7416,0,miopenConvolutionFwdAlgoDirect,<unused>;miopenConvolutionFwdAlgoWinograd:ConvBinWinogradRxSf2x3,2.2144,0,miopenConvolutionFwdAlgoWinograd,<unused>;miopenConvolutionFwdAlgoGEMM:GemmFwdRest,13.4758,903168,miopenConvolutionFwdAlgoGEMM,<unused>
768-14-14-1x1-1024-14-14-64-0x0-1x1-1x1-0-NCHW-FP16-F=miopenConvolutionFwdAlgoImplicitGEMM:ConvHipImplicitGemmV4R1Fwd,1.28928,0,miopenConvolutionFwdAlgoImplicitGEMM,<unused>;miopenConvolutionFwdAlgoDirect:ConvAsm1x1U,1.53296,0,miopenConvolutionFwdAlgoDirect,<unused>;miopenConvolutionFwdAlgoWinograd:ConvBinWinogradRxSf3x2,3.51136,0,miopenConvolutionFwdAlgoWinograd,<unused>;miopenConvolutionFwdAlgoGEMM:GemmFwd1x1_0_1,2.75968,0,miopenConvolutionFwdAlgoGEMM,<unused>
1024-14-14-1x1-256-14-14-64-0x0-1x1-1x1-0-NCHW-FP16-F=miopenConvolutionFwdAlgoImplicitGEMM:ConvHipImplicitGemmV4R1Fwd,0.73552,0,miopenConvolutionFwdAlgoImplicitGEMM,<unused>;miopenConvolutionFwdAlgoDirect:ConvAsm1x1U,0.627361,0,miopenConvolutionFwdAlgoDirect,<unused>;miopenConvolutionFwdAlgoWinograd:ConvBinWinogradRxSf3x2,1.24192,0,miopenConvolutionFwdAlgoWinograd,<unused>;miopenConvolutionFwdAlgoGEMM:GemmFwd1x1_0_1,0.647681,0,miopenConvolutionFwdAlgoGEMM,<unused>
256-14-14-3x3-256-14-14-64-1x1-1x1-1x1-0-NCHW-FP16-F=miopenConvolutionFwdAlgoImplicitGEMM:ConvHipImplicitGemmV4R1Fwd,1.03776,0,miopenConvolutionFwdAlgoImplicitGEMM,<unused>;miopenConvolutionFwdAlgoDirect:ConvOclDirectFwd,9.25089,0,miopenConvolutionFwdAlgoDirect,<unused>;miopenConvolutionFwdAlgoWinograd:ConvBinWinogradRxSf2x3g1,0.46608,0,miopenConvolutionFwdAlgoWinograd,<unused>;miopenConvolutionFwdAlgoGEMM:GemmFwdRest,12.5747,903168,miopenConvolutionFwdAlgoGEMM,<unused>
256-14-14-1x1-1024-14-14-64-0x0-1x1-1x1-0-NCHW-FP16-F=miopenConvolutionFwdAlgoImplicitGEMM:ConvHipImplicitGemmV4R1Fwd,0.637281,0,miopenConvolutionFwdAlgoImplicitGEMM,<unused>;miopenConvolutionFwdAlgoDirect:ConvAsm1x1U,0.520321,0,miopenConvolutionFwdAlgoDirect,<unused>;miopenConvolutionFwdAlgoWinograd:ConvBinWinogradRxSf3x2,1.42992,0,miopenConvolutionFwdAlgoWinograd,<unused>;miopenConvolutionFwdAlgoGEMM:GemmFwd1x1_0_1,0.473281,0,miopenConvolutionFwdAlgoGEMM,<unused>
1024-14-14-1x1-512-14-14-64-0x0-1x1-1x1-0-NCHW-FP16-F=miopenConvolutionFwdAlgoImplicitGEMM:ConvHipImplicitGemmV4R1Fwd,1.24928,0,miopenConvolutionFwdAlgoImplicitGEMM,<unused>;miopenConvolutionFwdAlgoDirect:ConvAsm1x1U,1.12288,0,miopenConvolutionFwdAlgoDirect,<unused>;miopenConvolutionFwdAlgoWinograd:ConvBinWinogradRxSf3x2,2.4344,0,miopenConvolutionFwdAlgoWinograd,<unused>;miopenConvolutionFwdAlgoGEMM:GemmFwd1x1_0_1,1.11648,0,miopenConvolutionFwdAlgoGEMM,<unused>
512-14-14-3x3-512-7-7-64-1x1-2x2-1x1-0-NCHW-FP16-F=miopenConvolutionFwdAlgoImplicitGEMM:ConvHipImplicitGemmV4R1Fwd,1.25056,0,miopenConvolutionFwdAlgoImplicitGEMM,<unused>;miopenConvolutionFwdAlgoDirect:ConvOclDirectFwdGen,36.8674,0,miopenConvolutionFwdAlgoDirect,<unused>;miopenConvolutionFwdAlgoWinograd:ConvBinWinogradRxS,3.22512,0,miopenConvolutionFwdAlgoWinograd,<unused>;miopenConvolutionFwdAlgoGEMM:GemmFwdRest,49.1213,451584,miopenConvolutionFwdAlgoGEMM,<unused>
1536-7-7-1x1-2048-7-7-64-0x0-1x1-1x1-0-NCHW-FP16-F=miopenConvolutionFwdAlgoImplicitGEMM:ConvHipImplicitGemmV4R1Fwd,1.9424,0,miopenConvolutionFwdAlgoImplicitGEMM,<unused>;miopenConvolutionFwdAlgoDirect:ConvAsm1x1U,2.09136,0,miopenConvolutionFwdAlgoDirect,<unused>;miopenConvolutionFwdAlgoWinograd:ConvBinWinogradRxSf3x2,4.06529,0,miopenConvolutionFwdAlgoWinograd,<unused>;miopenConvolutionFwdAlgoGEMM:GemmFwd1x1_0_1,4.89489,0,miopenConvolutionFwdAlgoGEMM,<unused>
2048-7-7-1x1-512-7-7-64-0x0-1x1-1x1-0-NCHW-FP16-F=miopenConvolutionFwdAlgoImplicitGEMM:ConvHipImplicitGemmV4R1Fwd,0.908801,0,miopenConvolutionFwdAlgoImplicitGEMM,<unused>;miopenConvolutionFwdAlgoDirect:ConvAsm1x1U,0.810241,0,miopenConvolutionFwdAlgoDirect,<unused>;miopenConvolutionFwdAlgoWinograd:ConvBinWinogradRxSf3x2,1.72272,0,miopenConvolutionFwdAlgoWinograd,<unused>;miopenConvolutionFwdAlgoGEMM:GemmFwd1x1_0_1,1.91488,0,miopenConvolutionFwdAlgoGEMM,<unused>
512-7-7-3x3-512-7-7-64-1x1-1x1-1x1-0-NCHW-FP16-F=miopenConvolutionFwdAlgoImplicitGEMM:ConvHipImplicitGemmV4R1Fwd,1.17488,0,miopenConvolutionFwdAlgoImplicitGEMM,<unused>;miopenConvolutionFwdAlgoDirect:ConvOclDirectFwd,14.0239,0,miopenConvolutionFwdAlgoDirect,<unused>;miopenConvolutionFwdAlgoWinograd:ConvBinWinogradRxSf2x3g1,0.615681,0,miopenConvolutionFwdAlgoWinograd,<unused>;miopenConvolutionFwdAlgoGEMM:GemmFwdRest,45.865,451584,miopenConvolutionFwdAlgoGEMM,<unused>
512-7-7-1x1-2048-7-7-64-0x0-1x1-1x1-0-NCHW-FP16-F=miopenConvolutionFwdAlgoImplicitGEMM:ConvHipImplicitGemmV4R1Fwd,0.6352,0,miopenConvolutionFwdAlgoImplicitGEMM,<unused>;miopenConvolutionFwdAlgoDirect:ConvAsm1x1U,0.691841,0,miopenConvolutionFwdAlgoDirect,<unused>;miopenConvolutionFwdAlgoWinograd:ConvBinWinogradRxSf3x2,1.60384,0,miopenConvolutionFwdAlgoWinograd,<unused>;miopenConvolutionFwdAlgoGEMM:GemmFwd1x1_0_1,1.46336,0,miopenConvolutionFwdAlgoGEMM,<unused>
3-224-224-11x11-64-55-55-64-2x2-4x4-1x1-0-NCHW-FP32-F=miopenConvolutionFwdAlgoImplicitGEMM:ConvMlirIgemmFwd,2.5016,0,miopenConvolutionFwdAlgoImplicitGEMM,<unused>;miopenConvolutionFwdAlgoDirect:ConvOclDirectFwd11x11,2.8448,0,miopenConvolutionFwdAlgoDirect,<unused>;miopenConvolutionFwdAlgoGEMM:GemmFwdRest,6.32832,4392300,miopenConvolutionFwdAlgoGEMM,<unused>
64-27-27-5x5-192-27-27-64-2x2-1x1-1x1-0-NCHW-FP32-F=miopenConvolutionFwdAlgoImplicitGEMM:ConvHipImplicitGemmV4R1Fwd,2.73616,0,miopenConvolutionFwdAlgoImplicitGEMM,<unused>;miopenConvolutionFwdAlgoDirect:ConvOclDirectFwd,4.57569,0,miopenConvolutionFwdAlgoDirect,<unused>;miopenConvolutionFwdAlgoWinograd:ConvBinWinogradRxSf2x3g1,2.16608,0,miopenConvolutionFwdAlgoWinograd,<unused>;miopenConvolutionFwdAlgoFFT:fft,1.20352,143720448,miopenConvolutionFwdAlgoFFT,<unused>;miopenConvolutionFwdAlgoGEMM:GemmFwdRest,7.84384,4665600,miopenConvolutionFwdAlgoGEMM,<unused>
192-13-13-3x3-384-13-13-64-1x1-1x1-1x1-0-NCHW-FP32-F=miopenConvolutionFwdAlgoWinograd:ConvBinWinogradRxSf2x3g1,0.826881,0,miopenConvolutionFwdAlgoWinograd,<unused>
384-13-13-3x3-256-13-13-64-1x1-1x1-1x1-0-NCHW-FP32-F=miopenConvolutionFwdAlgoWinograd:ConvBinWinogradRxSf2x3g1,1.11696,0,miopenConvolutionFwdAlgoWinograd,<unused>
256-13-13-3x3-256-13-13-64-1x1-1x1-1x1-0-NCHW-FP32-F=miopenConvolutionFwdAlgoWinograd:ConvBinWinogradRxSf2x3g1,0.764001,0,miopenConvolutionFwdAlgoWinograd,<unused>
3-224-224-11x11-64-55-55-64-2x2-4x4-1x1-0-NCHW-FP16-F=miopenConvolutionFwdAlgoImplicitGEMM:ConvMlirIgemmFwd,2.6632,0,miopenConvolutionFwdAlgoImplicitGEMM,<unused>;miopenConvolutionFwdAlgoDirect:ConvOclDirectFwd11x11,6.20417,0,miopenConvolutionFwdAlgoDirect,<unused>;miopenConvolutionFwdAlgoGEMM:GemmFwdRest,7.89504,2196150,miopenConvolutionFwdAlgoGEMM,<unused>
64-27-27-5x5-192-27-27-64-2x2-1x1-1x1-0-NCHW-FP16-F=miopenConvolutionFwdAlgoImplicitGEMM:ConvHipImplicitGemmV4R1Fwd,1.85776,0,miopenConvolutionFwdAlgoImplicitGEMM,<unused>;miopenConvolutionFwdAlgoDirect:ConvOclDirectFwd,11.2347,0,miopenConvolutionFwdAlgoDirect,<unused>;miopenConvolutionFwdAlgoWinograd:ConvBinWinogradRxSf3x2,1.6816,0,miopenConvolutionFwdAlgoWinograd,<unused>;miopenConvolutionFwdAlgoGEMM:GemmFwdRest,18.729,2332800,miopenConvolutionFwdAlgoGEMM,<unused>
192-13-13-3x3-384-13-13-64-1x1-1x1-1x1-0-NCHW-FP16-F=miopenConvolutionFwdAlgoImplicitGEMM:ConvHipImplicitGemmV4R1Fwd,0.943201,0,miopenConvolutionFwdAlgoImplicitGEMM,<unused>;miopenConvolutionFwdAlgoDirect:ConvOclDirectFwd,6.37025,0,miopenConvolutionFwdAlgoDirect,<unused>;miopenConvolutionFwdAlgoWinograd:ConvBinWinogradRxSf2x3g1,0.504001,0,miopenConvolutionFwdAlgoWinograd,<unused>;miopenConvolutionFwdAlgoGEMM:GemmFwdRest,19.712,584064,miopenConvolutionFwdAlgoGEMM,<unused>
384-13-13-3x3-256-13-13-64-1x1-1x1-1x1-0-NCHW-FP16-F=miopenConvolutionFwdAlgoImplicitGEMM:ConvHipImplicitGemmV4R1Fwd,1.78672,0,miopenConvolutionFwdAlgoImplicitGEMM,<unused>;miopenConvolutionFwdAlgoDirect:ConvOclDirectFwd,8.29121,0,miopenConvolutionFwdAlgoDirect,<unused>;miopenConvolutionFwdAlgoWinograd:ConvBinWinogradRxSf2x3g1,0.674881,0,miopenConvolutionFwdAlgoWinograd,<unused>;miopenConvolutionFwdAlgoGEMM:GemmFwdRest,38.441,1168128,miopenConvolutionFwdAlgoGEMM,<unused>
256-13-13-3x3-256-13-13-64-1x1-1x1-1x1-0-NCHW-FP16-F=miopenConvolutionFwdAlgoImplicitGEMM:ConvHipImplicitGemmV4R1Fwd,0.906561,0,miopenConvolutionFwdAlgoImplicitGEMM,<unused>;miopenConvolutionFwdAlgoDirect:ConvOclDirectFwd,5.85473,0,miopenConvolutionFwdAlgoDirect,<unused>;miopenConvolutionFwdAlgoWinograd:ConvBinWinogradRxSf2x3g1,0.465601,0,miopenConvolutionFwdAlgoWinograd,<unused>;miopenConvolutionFwdAlgoGEMM:GemmFwdRest,27.8118,778752,miopenConvolutionFwdAlgoGEMM,<unused>
3-224-224-7x7-64-112-112-32-3x3-2x2-1x1-0-NCHW-FP32-F=miopenConvolutionFwdAlgoImplicitGEMM:ConvMlirIgemmFwd,2.24624,0,miopenConvolutionFwdAlgoImplicitGEMM,<unused>;miopenConvolutionFwdAlgoDirect:ConvAsm7x7c3h224w224k64u2v2p3q3f1,0.924161,0,miopenConvolutionFwdAlgoDirect,<unused>;miopenConvolutionFwdAlgoWinograd:ConvBinWinogradRxS,1.27776,0,miopenConvolutionFwdAlgoWinograd,<unused>;miopenConvolutionFwdAlgoGEMM:GemmFwdRest,3.1488,7375872,miopenConvolutionFwdAlgoGEMM,<unused>
64-56-56-1x1-128-56-56-32-0x0-1x1-1x1-0-NCHW-FP32-F=miopenConvolutionFwdAlgoImplicitGEMM:ConvHipImplicitGemmV4R4Fwd,0.20192,0,miopenConvolutionFwdAlgoImplicitGEMM,<unused>;miopenConvolutionFwdAlgoDirect:ConvOclDirectFwd1x1,0.21712,0,miopenConvolutionFwdAlgoDirect,<unused>;miopenConvolutionFwdAlgoWinograd:ConvBinWinogradRxSf3x2,0.463361,0,miopenConvolutionFwdAlgoWinograd,<unused>;miopenConvolutionFwdAlgoGEMM:GemmFwd1x1_0_1,0.24528,0,miopenConvolutionFwdAlgoGEMM,<unused>
128-56-56-3x3-32-56-56-32-1x1-1x1-1x1-0-NCHW-FP32-F=miopenConvolutionFwdAlgoWinograd:ConvBinWinogradRxSf2x3g1,0.406561,0,miopenConvolutionFwdAlgoWinograd,<unused>
96-56-56-1x1-128-56-56-32-0x0-1x1-1x1-0-NCHW-FP32-F=miopenConvolutionFwdAlgoImplicitGEMM:ConvHipImplicitGemmV4R4Fwd,0.25152,0,miopenConvolutionFwdAlgoImplicitGEMM,<unused>;miopenConvolutionFwdAlgoDirect:ConvAsm1x1U,0.34752,0,miopenConvolutionFwdAlgoDirect,<unused>;miopenConvolutionFwdAlgoWinograd:ConvBinWinogradRxSf3x2,0.617121,0,miopenConvolutionFwdAlgoWinograd,<unused>;miopenConvolutionFwdAlgoGEMM:GemmFwd1x1_0_1,0.3344,0,miopenConvolutionFwdAlgoGEMM,<unused>
128-56-56-1x1-128-56-56-32-0x0-1x1-1x1-0-NCHW-FP32-F=miopenConvolutionFwdAlgoImplicitGEMM:ConvHipImplicitGemmV4R4Fwd,0.31744,0,miopenConvolutionFwdAlgoImplicitGEMM,<unused>;miopenConvolutionFwdAlgoDirect:ConvOclDirectFwd1x1,0.39056,0,miopenConvolutionFwdAlgoDirect,<unused>;miopenConvolutionFwdAlgoWinograd:ConvBinWinogradRxSf3x2,0.790081,0,miopenConvolutionFwdAlgoWinograd,<unused>;miopenConvolutionFwdAlgoGEMM:GemmFwd1x1_0_1,0.4336,0,miopenConvolutionFwdAlgoGEMM,<unused>
160-56-56-1x1-128-56-56-32-0x0-1x1-1x1-0-NCHW-FP32-F=miopenConvolutionFwdAlgoImplicitGEMM:ConvHipImplicitGemmV4R4Fwd,0.3728,0,miopenConvolutionFwdAlgoImplicitGEMM,<unused>;miopenConvolutionFwdAlgoDirect:ConvAsm1x1U,0.538881,0,miopenConvolutionFwdAlgoDirect,<unused>;miopenConvolutionFwdAlgoWinograd:ConvBinWinogradRxSf3x2,0.951201,0,miopenConvolutionFwdAlgoWinograd,<unused>;miopenConvolutionFwdAlgoGEMM:GemmFwd1x1_0_1,0.5248,0,miopenConvolutionFwdAlgoGEMM,<unused>
192-56-56-1x1-128-56-56-32-0x0-1x1-1x1-0-NCHW-FP32-F=miopenConvolutionFwdAlgoImplicitGEMM:ConvHipImplicitGemmV4R1Fwd,0.47088,0,miopenConvolutionFwdAlgoImplicitGEMM,<unused>;miopenConvolutionFwdAlgoDirect:ConvAsm1x1U,0.566561,0,miopenConvolutionFwdAlgoDirect,<unused>;miopenConvolutionFwdAlgoWinograd:ConvBinWinogradRxSf3x2,1.14368,0,miopenConvolutionFwdAlgoWinograd,<unused>;miopenConvolutionFwdAlgoGEMM:GemmFwd1x1_0_1,0.53264,0,miopenConvolutionFwdAlgoGEMM,<unused>
224-56-56-1x1-128-56-56-32-0x0-1x1-1x1-0-NCHW-FP32-F=miopenConvolutionFwdAlgoImplicitGEMM:ConvHipImplicitGemmV4R4Fwd,0.54704,0,miopenConvolutionFwdAlgoImplicitGEMM,<unused>;miopenConvolutionFwdAlgoDirect:ConvAsm1x1U,0.698401,0,miopenConvolutionFwdAlgoDirect,<unused>;miopenConvolutionFwdAlgoWinograd:ConvBinWinogradRxSf3x2,1.22368,0,miopenConvolutionFwdAlgoWinograd,<unused>;miopenConvolutionFwdAlgoGEMM:GemmFwd1x1_0_1,0.616321,0,miopenConvolutionFwdAlgoGEMM,<unused>
256-56-56-1x1-128-56-56-32-0x0-1x1-1x1-0-NCHW-FP32-F=miopenConvolutionFwdAlgoImplicitGEMM:ConvHipImplicitGemmV4R4Fwd,0.594881,0,miopenConvolutionFwdAlgoImplicitGEMM,<unused>;miopenConvolutionFwdAlgoDirect:ConvAsm1x1U,0.656321,0,miopenConvolutionFwdAlgoDirect,<unused>;miopenConvolutionFwdAlgoWinograd:ConvBinWinogradRxSf3x2,1.3704,0,miopenConvolutionFwdAlgoWinograd,<unused>;miopenConvolutionFwdAlgoGEMM:GemmFwd1x1_0_1,0.700161,0,miopenConvolutionFwdAlgoGEMM,<unused>
128-28-28-1x1-128-28-28-32-0x0-1x1-1x1-0-NCHW-FP32-F=miopenConvolutionFwdAlgoImplicitGEMM:ConvHipImplicitGemmV4R4Fwd,0.10752,0,miopenConvolutionFwdAlgoImplicitGEMM,<unused>;miopenConvolutionFwdAlgoDirect:ConvAsm1x1U,0.12928,0,miopenConvolutionFwdAlgoDirect,<unused>;miopenConvolutionFwdAlgoWinograd:ConvBinWinogradRxSf3x2,0.248,0,miopenConvolutionFwdAlgoWinograd,<unused>;miopenConvolutionFwdAlgoGEMM:GemmFwd1x1_0_1,0.12384,0,miopenConvolutionFwdAlgoGEMM,<unused>
128-28-28-3x3-32-28-28-32-1x1-1x1-1x1-0-NCHW-FP32-F=miopenConvolutionFwdAlgoWinograd:ConvBinWinogradRxSf2x3g1,0.13808,0,miopenConvolutionFwdAlgoWinograd,<unused>
160-28-28-1x1-128-28-28-32-0x0-1x1-1x1-0-NCHW-FP32-F=miopenConvolutionFwdAlgoImplicitGEMM:ConvHipImplicitGemmV4R4Fwd,0.12256,0,miopenConvolutionFwdAlgoImplicitGEMM,<unused>;miopenConvolutionFwdAlgoDirect:ConvAsm1x1U,0.15552,0,miopenConvolutionFwdAlgoDirect,<unused>;miopenConvolutionFwdAlgoWinograd:ConvBinWinogradRxSf3x2,0.288161,0,miopenConvolutionFwdAlgoWinograd,<unused>;miopenConvolutionFwdAlgoGEMM:GemmFwd1x1_0_1,0.152,0,miopenConvolutionFwdAlgoGEMM,<unused>
192-28-28-1x1-128-28-28-32-0x0-1x1-1x1-0-NCHW-FP32-F=miopenConvolutionFwdAlgoImplicitGEMM:ConvHipImplicitGemmV4R4Fwd,0.136001,0,miopenConvolutionFwdAlgoImplicitGEMM,<unused>;miopenConvolutionFwdAlgoDirect:ConvAsm1x1U,0.18208,0,miopenConvolutionFwdAlgoDirect,<unused>;miopenConvolutionFwdAlgoWinograd:ConvBinWinogradRxSf3x2,0.331521,0,miopenConvolutionFwdAlgoWinograd,<unused>;miopenConvolutionFwdAlgoGEMM:GemmFwd1x1_0_1,0.1688,0,miopenConvolutionFwdAlgoGEMM,<unused>
224-28-28-1x1-128-28-28-32-0x0-1x1-1x1-0-NCHW-FP32-F=miopenConvolutionFwdAlgoImplicitGEMM:ConvHipImplicitGemmV4R4Fwd,0.14752,0,miopenConvolutionFwdAlgoImplicitGEMM,<unused>;miopenConvolutionFwdAlgoDirect:ConvAsm1x1U,0.225921,0,miopenConvolutionFwdAlgoDirect,<unused>;miopenConvolutionFwdAlgoWinograd:ConvBinWinogradRxSf3x2,0.375521,0,miopenConvolutionFwdAlgoWinograd,<unused>;miopenConvolutionFwdAlgoGEMM:GemmFwd1x1_0_1,0.19072,0,miopenConvolutionFwdAlgoGEMM,<unused>
256-28-28-1x1-128-28-28-32-0x0-1x1-1x1-0-NCHW-FP32-F=miopenConvolutionFwdAlgoImplicitGEMM:ConvHipImplicitGemmV4R4Fwd,0.17168,0,miopenConvolutionFwdAlgoImplicitGEMM,<unused>;miopenConvolutionFwdAlgoDirect:ConvAsm1x1U,0.23808,0,miopenConvolutionFwdAlgoDirect,<unused>;miopenConvolutionFwdAlgoWinograd:ConvBinWinogradRxSf3x2,0.419521,0,miopenConvolutionFwdAlgoWinograd,<unused>;miopenConvolutionFwdAlgoGEMM:GemmFwd1x1_0_1,0.21264,0,miopenConvolutionFwdAlgoGEMM,<unused>
288-28-28-1x1-128-28-28-32-0x0-1x1-1x1-0-NCHW-FP32-F=miopenConvolutionFwdAlgoImplicitGEMM:ConvHipImplicitGemmV4R4Fwd,0.18464,0,miopenConvolutionFwdAlgoImplicitGEMM,<unused>;miopenConvolutionFwdAlgoDirect:ConvAsm1x1U,0.29264,0,miopenConvolutionFwdAlgoDirect,<unused>;miopenConvolutionFwdAlgoWinograd:ConvBinWinogradRxSf3x2,0.461921,0,miopenConvolutionFwdAlgoWinograd,<unused>;miopenConvolutionFwdAlgoGEMM:GemmFwd1x1_0_1,0.23616,0,miopenConvolutionFwdAlgoGEMM,<unused>
320-28-28-1x1-128-28-28-32-0x0-1x1-1x1-0-NCHW-FP32-F=miopenConvolutionFwdAlgoImplicitGEMM:ConvHipImplicitGemmV4R4Fwd,0.2096,0,miopenConvolutionFwdAlgoImplicitGEMM,<unused>;miopenConvolutionFwdAlgoDirect:ConvAsm1x1U,0.268961,0,miopenConvolutionFwdAlgoDirect,<unused>;miopenConvolutionFwdAlgoWinograd:ConvBinWinogradRxSf3x2,0.502721,0,miopenConvolutionFwdAlgoWinograd,<unused>;miopenConvolutionFwdAlgoGEMM:GemmFwd1x1_0_1,0.2576,0,miopenConvolutionFwdAlgoGEMM,<unused>
352-28-28-1x1-128-28-28-32-0x0-1x1-1x1-0-NCHW-FP32-F=miopenConvolutionFwdAlgoImplicitGEMM:ConvHipImplicitGemmV4R4Fwd,0.22208,0,miopenConvolutionFwdAlgoImplicitGEMM,<unused>;miopenConvolutionFwdAlgoDirect:ConvAsm1x1U,0.34416,0,miopenConvolutionFwdAlgoDirect,<unused>;miopenConvolutionFwdAlgoWinograd:ConvBinWinogradRxSf3x2,0.545761,0,miopenConvolutionFwdAlgoWinograd,<unused>;miopenConvolutionFwdAlgoGEMM:GemmFwd1x1_0_1,0.28416,0,miopenConvolutionFwdAlgoGEMM,<unused>
384-28-28-1x1-128-28-28-32-0x0-1x1-1x1-0-NCHW-FP32-F=miopenConvolutionFwdAlgoImplicitGEMM:ConvHipImplicitGemmV4R4Fwd,0.24848,0,miopenConvolutionFwdAlgoImplicitGEMM,<unused>;miopenConvolutionFwdAlgoDirect:ConvAsm1x1U,0.461121,0,miopenConvolutionFwdAlgoDirect,<unused>;miopenConvolutionFwdAlgoWinograd:ConvBinWinogradRxSf3x2,0.589601,0,miopenConvolutionFwdAlgoWinograd,<unused>;miopenConvolutionFwdAlgoGEMM:GemmFwd1x1_0_1,0.71456,0,miopenConvolutionFwdAlgoGEMM,<unused>
416-28-28-1x1-128-28-28-32-0x0-1x1-1x1-0-NCHW-FP32-F=miopenConvolutionFwdAlgoImplicitGEMM:ConvHipImplicitGemmV4R4Fwd,0.260001,0,miopenConvolutionFwdAlgoImplicitGEMM,<unused>;miopenConvolutionFwdAlgoDirect:ConvAsm1x1U,0.398561,0,miopenConvolutionFwdAlgoDirect,<unused>;miopenConvolutionFwdAlgoWinograd:ConvBinWinogradRxSf3x2,0.630561,0,miopenConvolutionFwdAlgoWinograd,<unused>;miopenConvolutionFwdAlgoGEMM:GemmFwd1x1_0_1,0.34464,0,miopenConvolutionFwdAlgoGEMM,<unused>
448-28-28-1x1-128-28-28-32-0x0-1x1-1x1-0-NCHW-FP32-F=miopenConvolutionFwdAlgoImplicitGEMM:ConvHipImplicitGemmV4R4Fwd,0.32544,0,miopenConvolutionFwdAlgoImplicitGEMM,<unused>;miopenConvolutionFwdAlgoDirect:ConvAsm1x1U,0.423841,0,miopenConvolutionFwdAlgoDirect,<unused>;miopenConvolutionFwdAlgoWinograd:ConvBinWinogradRxSf3x2,0.754561,0,miopenConvolutionFwdAlgoWinograd,<unused>;miopenConvolutionFwdAlgoGEMM:GemmFwd1x1_0_1,0.36576,0,miopenConvolutionFwdAlgoGEMM,<unused>
480-28-28-1x1-128-28-28-32-0x0-1x1-1x1-0-NCHW-FP32-F=miopenConvolutionFwdAlgoImplicitGEMM:ConvHipImplicitGemmV4R4Fwd,0.29712,0,miopenConvolutionFwdAlgoImplicitGEMM,<unused>;miopenConvolutionFwdAlgoDirect:ConvAsm1x1U,0.43872,0,miopenConvolutionFwdAlgoDirect,<unused>;miopenConvolutionFwdAlgoWinograd:ConvBinWinogradRxSf3x2,0.802401,0,miopenConvolutionFwdAlgoWinograd,<unused>;miopenConvolutionFwdAlgoGEMM:GemmFwd1x1_0_1,0.37264,0,miopenConvolutionFwdAlgoGEMM,<unused>
512-28-28-1x1-256-28-28-32-0x0-1x1-1x1-0-NCHW-FP32-F=miopenConvolutionFwdAlgoImplicitGEMM:ConvAsmImplicitGemmV4R1DynamicFwd_1x1,0.63088,0,miopenConvolutionFwdAlgoImplicitGEMM,<unused>;miopenConvolutionFwdAlgoDirect:ConvOclDirectFwd1x1,0.6784,0,miopenConvolutionFwdAlgoDirect,<unused>;miopenConvolutionFwdAlgoWinograd:ConvBinWinogradRxSf3x2,1.47216,0,miopenConvolutionFwdAlgoWinograd,<unused>;miopenConvolutionFwdAlgoGEMM:GemmFwd1x1_0_1,0.74064,0,miopenConvolutionFwdAlgoGEMM,<unused>
256-14-14-1x1-128-14-14-32-0x0-1x1-1x1-0-NCHW-FP32-F=miopenConvolutionFwdAlgoImplicitGEMM:ConvHipImplicitGemmV4R4Fwd,0.07312,0,miopenConvolutionFwdAlgoImplicitGEMM,<unused>;miopenConvolutionFwdAlgoDirect:ConvAsm1x1U,0.10352,0,miopenConvolutionFwdAlgoDirect,<unused>;miopenConvolutionFwdAlgoWinograd:ConvBinWinogradRxSf3x2,0.148,0,miopenConvolutionFwdAlgoWinograd,<unused>;miopenConvolutionFwdAlgoGEMM:GemmFwd1x1_0_1,0.22272,0,miopenConvolutionFwdAlgoGEMM,<unused>
128-14-14-3x3-32-14-14-32-1x1-1x1-1x1-0-NCHW-FP32-F=miopenConvolutionFwdAlgoWinograd:ConvBinWinogradRxS,0.05584,0,miopenConvolutionFwdAlgoWinograd,<unused>
288-14-14-1x1-128-14-14-32-0x0-1x1-1x1-0-NCHW-FP32-F=miopenConvolutionFwdAlgoImplicitGEMM:ConvHipImplicitGemmV4R4Fwd,0.0776,0,miopenConvolutionFwdAlgoImplicitGEMM,<unused>;miopenConvolutionFwdAlgoDirect:ConvAsm1x1U,0.09712,0,miopenConvolutionFwdAlgoDirect,<unused>;miopenConvolutionFwdAlgoWinograd:ConvBinWinogradRxSf3x2,0.16272,0,miopenConvolutionFwdAlgoWinograd,<unused>;miopenConvolutionFwdAlgoGEMM:GemmFwd1x1_0_1,0.23312,0,miopenConvolutionFwdAlgoGEMM,<unused>
320-14-14-1x1-128-14-14-32-0x0-1x1-1x1-0-NCHW-FP32-F=miopenConvolutionFwdAlgoImplicitGEMM:ConvHipImplicitGemmV4R4Fwd,0.0872,0,miopenConvolutionFwdAlgoImplicitGEMM,<unused>;miopenConvolutionFwdAlgoDirect:ConvAsm1x1U,0.12608,0,miopenConvolutionFwdAlgoDirect,<unused>;miopenConvolutionFwdAlgoWinograd:ConvBinWinogradRxSf3x2,0.17312,0,miopenConvolutionFwdAlgoWinograd,<unused>;miopenConvolutionFwdAlgoGEMM:GemmFwd1x1_0_1,0.24928,0,miopenConvolutionFwdAlgoGEMM,<unused>
352-14-14-1x1-128-14-14-32-0x0-1x1-1x1-0-NCHW-FP32-F=miopenConvolutionFwdAlgoImplicitGEMM:ConvHipImplicitGemmV4R4Fwd,0.09168,0,miopenConvolutionFwdAlgoImplicitGEMM,<unused>;miopenConvolutionFwdAlgoDirect:ConvAsm1x1U,0.128,0,miopenConvolutionFwdAlgoDirect,<unused>;miopenConvolutionFwdAlgoWinograd:ConvBinWinogradRxSf3x2,0.18464,0,miopenConvolutionFwdAlgoWinograd,<unused>;miopenConvolutionFwdAlgoGEMM:GemmFwd1x1_0_1,0.26032,0,miopenConvolutionFwdAlgoGEMM,<unused>
384-14-14-1x1-128-14-14-32-0x0-1x1-1x1-0-NCHW-FP32-F=miopenConvolutionFwdAlgoImplicitGEMM:ConvHipImplicitGemmV4R4Fwd,0.100161,0,miopenConvolutionFwdAlgoImplicitGEMM,<unused>;miopenConvolutionFwdAlgoDirect:ConvAsm1x1U,0.13968,0,miopenConvolutionFwdAlgoDirect,<unused>;miopenConvolutionFwdAlgoWinograd:ConvBinWinogradRxSf3x2,0.19744,0,miopenConvolutionFwdAlgoWinograd,<unused>;miopenConvolutionFwdAlgoGEMM:GemmFwd1x1_0_1,0.14656,0,miopenConvolutionFwdAlgoGEMM,<unused>
416-14-14-1x1-128-14-14-32-0x0-1x1-1x1-0-NCHW-FP32-F=miopenConvolutionFwdAlgoImplicitGEMM:ConvHipImplicitGemmV4R4Fwd,0.10544,0,miopenConvolutionFwdAlgoImplicitGEMM,<unused>;miopenConvolutionFwdAlgoDirect:ConvAsm1x1U,0.15504,0,miopenConvolutionFwdAlgoDirect,<unused>;miopenConvolutionFwdAlgoWinograd:ConvBinWinogradRxSf3x2,0.20944,0,miopenConvolutionFwdAlgoWinograd,<unused>;miopenConvolutionFwdAlgoGEMM:GemmFwd1x1_0_1,0.15296,0,miopenConvolutionFwdAlgoGEMM,<unused>
448-14-14-1x1-128-14-14-32-0x0-1x1-1x1-0-NCHW-FP32-F=miopenConvolutionFwdAlgoImplicitGEMM:ConvHipImplicitGemmV4R4Fwd,0.11536,0,miopenConvolutionFwdAlgoImplicitGEMM,<unused>;miopenConvolutionFwdAlgoDirect:ConvAsm1x1U,0.15936,0,miopenConvolutionFwdAlgoDirect,<unused>;miopenConvolutionFwdAlgoWinograd:ConvBinWinogradRxSf3x2,0.22096,0,miopenConvolutionFwdAlgoWinograd,<unused>;miopenConvolutionFwdAlgoGEMM:GemmFwd1x1_0_1,0.16992,0,miopenConvolutionFwdAlgoGEMM,<unused>
480-14-14-1x1-128-14-14-32-0x0-1x1-1x1-0-NCHW-FP32-F=miopenConvolutionFwdAlgoImplicitGEMM:ConvHipImplicitGemmV4R4Fwd,0.12064,0,miopenConvolutionFwdAlgoImplicitGEMM,<unused>;miopenConvolutionFwdAlgoDirect:ConvAsm1x1U,0.168,0,miopenConvolutionFwdAlgoDirect,<unused>;miopenConvolutionFwdAlgoWinograd:ConvBinWinogradRxSf3x2,0.23296,0,miopenConvolutionFwdAlgoWinograd,<unused>;miopenConvolutionFwdAlgoGEMM:GemmFwd1x1_0_1,0.17184,0,miopenConvolutionFwdAlgoGEMM,<unused>
512-14-14-1x1-128-14-14-32-0x0-1x1-1x1-0-NCHW-FP32-F=miopenConvolutionFwdAlgoImplicitGEMM:ConvHipImplicitGemmV4R4Fwd,0.137601,0,miopenConvolutionFwdAlgoImplicitGEMM,<unused>;miopenConvolutionFwdAlgoDirect:ConvAsm1x1U,0.1528,0,miopenConvolutionFwdAlgoDirect,<unused>;miopenConvolutionFwdAlgoWinograd:ConvBinWinogradRxSf3x2,0.24496,0,miopenConvolutionFwdAlgoWinograd,<unused>;miopenConvolutionFwdAlgoGEMM:GemmFwd1x1_0_1,0.19168,0,miopenConvolutionFwdAlgoGEMM,<unused>
544-14-14-1x1-128-14-14-32-0x0-1x1-1x1-0-NCHW-FP32-F=miopenConvolutionFwdAlgoImplicitGEMM:ConvHipImplicitGemmV4R4Fwd,0.13424,0,miopenConvolutionFwdAlgoImplicitGEMM,<unused>;miopenConvolutionFwdAlgoDirect:ConvAsm1x1U,0.19024,0,miopenConvolutionFwdAlgoDirect,<unused>;miopenConvolutionFwdAlgoWinograd:ConvBinWinogradRxSf3x2,0.2592,0,miopenConvolutionFwdAlgoWinograd,<unused>;miopenConvolutionFwdAlgoGEMM:GemmFwd1x1_0_1,0.18976,0,miopenConvolutionFwdAlgoGEMM,<unused>
576-14-14-1x1-128-14-14-32-0x0-1x1-1x1-0-NCHW-FP32-F=miopenConvolutionFwdAlgoImplicitGEMM:ConvHipImplicitGemmV4R4Fwd,0.13088,0,miopenConvolutionFwdAlgoImplicitGEMM,<unused>;miopenConvolutionFwdAlgoDirect:ConvAsm1x1U,0.19776,0,miopenConvolutionFwdAlgoDirect,<unused>;miopenConvolutionFwdAlgoWinograd:ConvBinWinogradRxSf3x2,0.26992,0,miopenConvolutionFwdAlgoWinograd,<unused>;miopenConvolutionFwdAlgoGEMM:GemmFwd1x1_0_1,0.19888,0,miopenConvolutionFwdAlgoGEMM,<unused>
608-14-14-1x1-128-14-14-32-0x0-1x1-1x1-0-NCHW-FP32-F=miopenConvolutionFwdAlgoImplicitGEMM:ConvHipImplicitGemmV4R4Fwd,0.13632,0,miopenConvolutionFwdAlgoImplicitGEMM,<unused>;miopenConvolutionFwdAlgoDirect:ConvAsm1x1U,0.20832,0,miopenConvolutionFwdAlgoDirect,<unused>;miopenConvolutionFwdAlgoWinograd:ConvBinWinogradRxSf3x2,0.28016,0,miopenConvolutionFwdAlgoWinograd,<unused>;miopenConvolutionFwdAlgoGEMM:GemmFwd1x1_0_1,0.21104,0,miopenConvolutionFwdAlgoGEMM,<unused>
640-14-14-1x1-128-14-14-32-0x0-1x1-1x1-0-NCHW-FP32-F=miopenConvolutionFwdAlgoImplicitGEMM:ConvHipImplicitGemmV4R4Fwd,0.13568,0,miopenConvolutionFwdAlgoImplicitGEMM,<unused>;miopenConvolutionFwdAlgoDirect:ConvAsm1x1U,0.27792,0,miopenConvolutionFwdAlgoDirect,<unused>;miopenConvolutionFwdAlgoWinograd:ConvBinWinogradRxSf3x2,0.2928,0,miopenConvolutionFwdAlgoWinograd,<unused>;miopenConvolutionFwdAlgoGEMM:GemmFwd1x1_0_1,0.2176,0,miopenConvolutionFwdAlgoGEMM,<unused>
672-14-14-1x1-128-14-14-32-0x0-1x1-1x1-0-NCHW-FP32-F=miopenConvolutionFwdAlgoImplicitGEMM:ConvHipImplicitGemmV4R4Fwd,0.14192,0,miopenConvolutionFwdAlgoImplicitGEMM,<unused>;miopenConvolutionFwdAlgoDirect:ConvAsm1x1U,0.23216,0,miopenConvolutionFwdAlgoDirect,<unused>;miopenConvolutionFwdAlgoWinograd:ConvBinWinogradRxSf3x2,0.30608,0,miopenConvolutionFwdAlgoWinograd,<unused>;miopenConvolutionFwdAlgoGEMM:GemmFwd1x1_0_1,0.33072,0,miopenConvolutionFwdAlgoGEMM,<unused>
704-14-14-1x1-128-14-14-32-0x0-1x1-1x1-0-NCHW-FP32-F=miopenConvolutionFwdAlgoImplicitGEMM:ConvHipImplicitGemmV4R4Fwd,0.14752,0,miopenConvolutionFwdAlgoImplicitGEMM,<unused>;miopenConvolutionFwdAlgoDirect:ConvAsm1x1U,0.2392,0,miopenConvolutionFwdAlgoDirect,<unused>;miopenConvolutionFwdAlgoWinograd:ConvBinWinogradRxSf3x2,0.31872,0,miopenConvolutionFwdAlgoWinograd,<unused>;miopenConvolutionFwdAlgoGEMM:GemmFwd1x1_0_1,0.33808,0,miopenConvolutionFwdAlgoGEMM,<unused>
736-14-14-1x1-128-14-14-32-0x0-1x1-1x1-0-NCHW-FP32-F=miopenConvolutionFwdAlgoImplicitGEMM:ConvHipImplicitGemmV4R4Fwd,0.153601,0,miopenConvolutionFwdAlgoImplicitGEMM,<unused>;miopenConvolutionFwdAlgoDirect:ConvAsm1x1U,0.24336,0,miopenConvolutionFwdAlgoDirect,<unused>;miopenConvolutionFwdAlgoWinograd:ConvBinWinogradRxSf3x2,0.3304,0,miopenConvolutionFwdAlgoWinograd,<unused>;miopenConvolutionFwdAlgoGEMM:GemmFwd1x1_0_1,0.35392,0,miopenConvolutionFwdAlgoGEMM,<unused>
768-14-14-1x1-128-14-14-32-0x0-1x1-1x1-0-NCHW-FP32-F=miopenConvolutionFwdAlgoImplicitGEMM:ConvHipImplicitGemmV4R4Fwd,0.16256,0,miopenConvolutionFwdAlgoImplicitGEMM,<unused>;miopenConvolutionFwdAlgoDirect:ConvAsm1x1U,0.25552,0,miopenConvolutionFwdAlgoDirect,<unused>;miopenConvolutionFwdAlgoWinograd:ConvBinWinogradRxSf3x2,0.34256,0,miopenConvolutionFwdAlgoWinograd,<unused>;miopenConvolutionFwdAlgoGEMM:GemmFwd1x1_0_1,0.38352,0,miopenConvolutionFwdAlgoGEMM,<unused>
800-14-14-1x1-128-14-14-32-0x0-1x1-1x1-0-NCHW-FP32-F=miopenConvolutionFwdAlgoImplicitGEMM:ConvHipImplicitGemmV4R4Fwd,0.16624,0,miopenConvolutionFwdAlgoImplicitGEMM,<unused>;miopenConvolutionFwdAlgoDirect:ConvAsm1x1U,0.27264,0,miopenConvolutionFwdAlgoDirect,<unused>;miopenConvolutionFwdAlgoWinograd:ConvBinWinogradRxSf3x2,0.35408,0,miopenConvolutionFwdAlgoWinograd,<unused>;miopenConvolutionFwdAlgoGEMM:GemmFwd1x1_0_1,0.37728,0,miopenConvolutionFwdAlgoGEMM,<unused>
832-14-14-1x1-128-14-14-32-0x0-1x1-1x1-0-NCHW-FP32-F=miopenConvolutionFwdAlgoImplicitGEMM:ConvHipImplicitGemmV4R4Fwd,0.17104,0,miopenConvolutionFwdAlgoImplicitGEMM,<unused>;miopenConvolutionFwdAlgoDirect:ConvAsm1x1U,0.27104,0,miopenConvolutionFwdAlgoDirect,<unused>;miopenConvolutionFwdAlgoWinograd:ConvBinWinogradRxSf3x2,0.36672,0,miopenConvolutionFwdAlgoWinograd,<unused>;miopenConvolutionFwdAlgoGEMM:GemmFwd1x1_0_1,0.38656,0,miopenConvolutionFwdAlgoGEMM,<unused>
864-14-14-1x1-128-14-14-32-0x0-1x1-1x1-0-NCHW-FP32-F=miopenConvolutionFwdAlgoImplicitGEMM:ConvHipImplicitGemmV4R4Fwd,0.17808,0,miopenConvolutionFwdAlgoImplicitGEMM,<unused>;miopenConvolutionFwdAlgoDirect:ConvAsm1x1U,0.2848,0,miopenConvolutionFwdAlgoDirect,<unused>;miopenConvolutionFwdAlgoWinograd:ConvBinWinogradRxSf3x2,0.3776,0,miopenConvolutionFwdAlgoWinograd,<unused>;miopenConvolutionFwdAlgoGEMM:GemmFwd1x1_0_1,0.41344,0,miopenConvolutionFwdAlgoGEMM,<unused>
896-14-14-1x1-128-14-14-32-0x0-1x1-1x1-0-NCHW-FP32-F=miopenConvolutionFwdAlgoImplicitGEMM:ConvHipImplicitGemmV4R4Fwd,0.18336,0,miopenConvolutionFwdAlgoImplicitGEMM,<unused>;miopenConvolutionFwdAlgoDirect:ConvAsm1x1U,0.32848,0,miopenConvolutionFwdAlgoDirect,<unused>;miopenConvolutionFwdAlgoWinograd:ConvBinWinogradRxSf3x2,0.38976,0,miopenConvolutionFwdAlgoWinograd,<unused>;miopenConvolutionFwdAlgoGEMM:GemmFwd1x1_0_1,0.29776,0,miopenConvolutionFwdAlgoGEMM,<unused>
928-14-14-1x1-128-14-14-32-0x0-1x1-1x1-0-NCHW-FP32-F=miopenConvolutionFwdAlgoImplicitGEMM:ConvHipImplicitGemmV4R4Fwd,0.19056,0,miopenConvolutionFwdAlgoImplicitGEMM,<unused>;miopenConvolutionFwdAlgoDirect:ConvAsm1x1U,0.30512,0,miopenConvolutionFwdAlgoDirect,<unused>;miopenConvolutionFwdAlgoWinograd:ConvBinWinogradRxSf3x2,0.4024,0,miopenConvolutionFwdAlgoWinograd,<unused>;miopenConvolutionFwdAlgoGEMM:GemmFwd1x1_0_1,0.3096,0,miopenConvolutionFwdAlgoGEMM,<unused>
960-14-14-1x1-128-14-14-32-0x0-1x1-1x1-0-NCHW-FP32-F=miopenConvolutionFwdAlgoImplicitGEMM:ConvHipImplicitGemmV4R4Fwd,0.196,0,miopenConvolutionFwdAlgoImplicitGEMM,<unused>;miopenConvolutionFwdAlgoDirect:ConvAsm1x1U,0.31408,0,miopenConvolutionFwdAlgoDirect,<unused>;miopenConvolutionFwdAlgoWinograd:ConvBinWinogradRxSf3x2,0.41344,0,miopenConvolutionFwdAlgoWinograd,<unused>;miopenConvolutionFwdAlgoGEMM:GemmFwd1x1_0_1,0.32256,0,miopenConvolutionFwdAlgoGEMM,<unused>
992-14-14-1x1-128-14-14-32-0x0-1x1-1x1-0-NCHW-FP32-F=miopenConvolutionFwdAlgoImplicitGEMM:ConvHipImplicitGemmV4R4Fwd,0.20304,0,miopenConvolutionFwdAlgoImplicitGEMM,<unused>;miopenConvolutionFwdAlgoDirect:ConvAsm1x1U,0.34112,0,miopenConvolutionFwdAlgoDirect,<unused>;miopenConvolutionFwdAlgoWinograd:ConvBinWinogradRxSf3x2,0.42704,0,miopenConvolutionFwdAlgoWinograd,<unused>;miopenConvolutionFwdAlgoGEMM:GemmFwd1x1_0_1,0.33312,0,miopenConvolutionFwdAlgoGEMM,<unused>
1024-14-14-1x1-512-14-14-32-0x0-1x1-1x1-0-NCHW-FP32-F=miopenConvolutionFwdAlgoImplicitGEMM:ConvHipImplicitGemmV4R4Fwd,0.74224,0,miopenConvolutionFwdAlgoImplicitGEMM,<unused>;miopenConvolutionFwdAlgoDirect:ConvAsm1x1U,0.96976,0,miopenConvolutionFwdAlgoDirect,<unused>;miopenConvolutionFwdAlgoWinograd:ConvBinWinogradRxSf3x2,1.4496,0,miopenConvolutionFwdAlgoWinograd,<unused>;miopenConvolutionFwdAlgoGEMM:GemmFwd1x1_0_1,1.28352,0,miopenConvolutionFwdAlgoGEMM,<unused>
512-7-7-1x1-128-7-7-32-0x0-1x1-1x1-0-NCHW-FP32-F=miopenConvolutionFwdAlgoImplicitGEMM:ConvHipImplicitGemmV4R4Fwd,0.09872,0,miopenConvolutionFwdAlgoImplicitGEMM,<unused>;miopenConvolutionFwdAlgoDirect:ConvAsm1x1U,0.078721,0,miopenConvolutionFwdAlgoDirect,<unused>;miopenConvolutionFwdAlgoWinograd:ConvBinWinogradRxSf3x2,0.13824,0,miopenConvolutionFwdAlgoWinograd,<unused>;miopenConvolutionFwdAlgoGEMM:GemmFwd1x1_0_1,0.12208,0,miopenConvolutionFwdAlgoGEMM,<unused>
128-7-7-3x3-32-7-7-32-1x1-1x1-1x1-0-NCHW-FP32-F=miopenConvolutionFwdAlgoWinograd:ConvBinWinogradRxSf2x3,0.05328,0,miopenConvolutionFwdAlgoWinograd,<unused>
544-7-7-1x1-128-7-7-32-0x0-1x1-1x1-0-NCHW-FP32-F=miopenConvolutionFwdAlgoImplicitGEMM:ConvHipImplicitGemmV4R4Fwd,0.07392,0,miopenConvolutionFwdAlgoImplicitGEMM,<unused>;miopenConvolutionFwdAlgoDirect:ConvAsm1x1U,0.08736,0,miopenConvolutionFwdAlgoDirect,<unused>;miopenConvolutionFwdAlgoWinograd:ConvBinWinogradRxSf3x2,0.1432,0,miopenConvolutionFwdAlgoWinograd,<unused>;miopenConvolutionFwdAlgoGEMM:GemmFwd1x1_0_1,0.1072,0,miopenConvolutionFwdAlgoGEMM,<unused>
576-7-7-1x1-128-7-7-32-0x0-1x1-1x1-0-NCHW-FP32-F=miopenConvolutionFwdAlgoImplicitGEMM:ConvHipImplicitGemmV4R4Fwd,0.08576,0,miopenConvolutionFwdAlgoImplicitGEMM,<unused>;miopenConvolutionFwdAlgoDirect:ConvAsm1x1U,0.090721,0,miopenConvolutionFwdAlgoDirect,<unused>;miopenConvolutionFwdAlgoWinograd:ConvBinWinogradRxSf3x2,0.14928,0,miopenConvolutionFwdAlgoWinograd,<unused>;miopenConvolutionFwdAlgoGEMM:GemmFwd1x1_0_1,0.11024,0,miopenConvolutionFwdAlgoGEMM,<unused>
608-7-7-1x1-128-7-7-32-0x0-1x1-1x1-0-NCHW-FP32-F=miopenConvolutionFwdAlgoImplicitGEMM:ConvHipImplicitGemmV4R4Fwd,0.07968,0,miopenConvolutionFwdAlgoImplicitGEMM,<unused>;miopenConvolutionFwdAlgoDirect:ConvAsm1x1U,0.090881,0,miopenConvolutionFwdAlgoDirect,<unused>;miopenConvolutionFwdAlgoWinograd:ConvBinWinogradRxSf3x2,0.15424,0,miopenConvolutionFwdAlgoWinograd,<unused>;miopenConvolutionFwdAlgoGEMM:GemmFwd1x1_0_1,0.11696,0,miopenConvolutionFwdAlgoGEMM,<unused>
640-7-7-1x1-128-7-7-32-0x0-1x1-1x1-0-NCHW-FP32-F=miopenConvolutionFwdAlgoImplicitGEMM:ConvHipImplicitGemmV4R4Fwd,0.08336,0,miopenConvolutionFwdAlgoImplicitGEMM,<unused>;miopenConvolutionFwdAlgoDirect:ConvAsm1x1U,0.09392,0,miopenConvolutionFwdAlgoDirect,<unused>;miopenConvolutionFwdAlgoWinograd:ConvBinWinogradRxSf3x2,0.16048,0,miopenConvolutionFwdAlgoWinograd,<unused>;miopenConvolutionFwdAlgoGEMM:GemmFwd1x1_0_1,0.12016,0,miopenConvolutionFwdAlgoGEMM,<unused>
672-7-7-1x1-128-7-7-32-0x0-1x1-1x1-0-NCHW-FP32-F=miopenConvolutionFwdAlgoImplicitGEMM:ConvHipImplicitGemmV4R4Fwd,0.08656,0,miopenConvolutionFwdAlgoImplicitGEMM,<unused>;miopenConvolutionFwdAlgoDirect:ConvAsm1x1U,0.096961,0,miopenConvolutionFwdAlgoDirect,<unused>;miopenConvolutionFwdAlgoWinograd:ConvBinWinogradRxSf3x2,0.1672,0,miopenConvolutionFwdAlgoWinograd,<unused>;miopenConvolutionFwdAlgoGEMM:GemmFwd1x1_0_1,0.12592,0,miopenConvolutionFwdAlgoGEMM,<unused>
704-7-7-1x1-128-7-7-32-0x0-1x1-1x1-0-NCHW-FP32-F=miopenConvolutionFwdAlgoImplicitGEMM:ConvHipImplicitGemmV4R4Fwd,0.0896,0,miopenConvolutionFwdAlgoImplicitGEMM,<unused>;miopenConvolutionFwdAlgoDirect:ConvAsm1x1U,0.10064,0,miopenConvolutionFwdAlgoDirect,<unused>;miopenConvolutionFwdAlgoWinograd:ConvBinWinogradRxSf3x2,0.17232,0,miopenConvolutionFwdAlgoWinograd,<unused>;miopenConvolutionFwdAlgoGEMM:GemmFwd1x1_0_1,0.12304,0,miopenConvolutionFwdAlgoGEMM,<unused>
736-7-7-1x1-128-7-7-32-0x0-1x1-1x1-0-NCHW-FP32-F=miopenConvolutionFwdAlgoImplicitGEMM:ConvHipImplicitGemmV4R4Fwd,0.09296,0,miopenConvolutionFwdAlgoImplicitGEMM,<unused>;miopenConvolutionFwdAlgoDirect:ConvAsm1x1U,0.10784,0,miopenConvolutionFwdAlgoDirect,<unused>;miopenConvolutionFwdAlgoWinograd:ConvBinWinogradRxSf3x2,0.1792,0,miopenConvolutionFwdAlgoWinograd,<unused>;miopenConvolutionFwdAlgoGEMM:GemmFwd1x1_0_1,0.12656,0,miopenConvolutionFwdAlgoGEMM,<unused>
768-7-7-1x1-128-7-7-32-0x0-1x1-1x1-0-NCHW-FP32-F=miopenConvolutionFwdAlgoImplicitGEMM:ConvHipImplicitGemmV4R1Fwd,0.11488,0,miopenConvolutionFwdAlgoImplicitGEMM,<unused>;miopenConvolutionFwdAlgoDirect:ConvAsm1x1U,0.11216,0,miopenConvolutionFwdAlgoDirect,<unused>;miopenConvolutionFwdAlgoWinograd:ConvBinWinogradRxSf3x2,0.20336,0,miopenConvolutionFwdAlgoWinograd,<unused>;miopenConvolutionFwdAlgoGEMM:GemmFwd1x1_0_1,0.1368,0,miopenConvolutionFwdAlgoGEMM,<unused>
800-7-7-1x1-128-7-7-32-0x0-1x1-1x1-0-NCHW-FP32-F=miopenConvolutionFwdAlgoImplicitGEMM:ConvHipImplicitGemmV4R4Fwd,0.11168,0,miopenConvolutionFwdAlgoImplicitGEMM,<unused>;miopenConvolutionFwdAlgoDirect:ConvAsm1x1U,0.11504,0,miopenConvolutionFwdAlgoDirect,<unused>;miopenConvolutionFwdAlgoWinograd:ConvBinWinogradRxSf3x2,0.19232,0,miopenConvolutionFwdAlgoWinograd,<unused>;miopenConvolutionFwdAlgoGEMM:GemmFwd1x1_0_1,0.13696,0,miopenConvolutionFwdAlgoGEMM,<unused>
832-7-7-1x1-128-7-7-32-0x0-1x1-1x1-0-NCHW-FP32-F=miopenConvolutionFwdAlgoImplicitGEMM:ConvHipImplicitGemmV4R4Fwd,0.11776,0,miopenConvolutionFwdAlgoImplicitGEMM,<unused>;miopenConvolutionFwdAlgoDirect:ConvAsm1x1U,0.08848,0,miopenConvolutionFwdAlgoDirect,<unused>;miopenConvolutionFwdAlgoWinograd:ConvBinWinogradRxSf3x2,0.19664,0,miopenConvolutionFwdAlgoWinograd,<unused>;miopenConvolutionFwdAlgoGEMM:GemmFwd1x1_0_1,0.1392,0,miopenConvolutionFwdAlgoGEMM,<unused>
864-7-7-1x1-128-7-7-32-0x0-1x1-1x1-0-NCHW-FP32-F=miopenConvolutionFwdAlgoImplicitGEMM:ConvHipImplicitGemmV4R4Fwd,0.12016,0,miopenConvolutionFwdAlgoImplicitGEMM,<unused>;miopenConvolutionFwdAlgoDirect:ConvAsm1x1U,0.12208,0,miopenConvolutionFwdAlgoDirect,<unused>;miopenConvolutionFwdAlgoWinograd:ConvBinWinogradRxSf3x2,0.20304,0,miopenConvolutionFwdAlgoWinograd,<unused>;miopenConvolutionFwdAlgoGEMM:GemmFwd1x1_0_1,0.14256,0,miopenConvolutionFwdAlgoGEMM,<unused>
896-7-7-1x1-128-7-7-32-0x0-1x1-1x1-0-NCHW-FP32-F=miopenConvolutionFwdAlgoImplicitGEMM:ConvHipImplicitGemmV4R4Fwd,0.10992,0,miopenConvolutionFwdAlgoImplicitGEMM,<unused>;miopenConvolutionFwdAlgoDirect:ConvAsm1x1U,0.12544,0,miopenConvolutionFwdAlgoDirect,<unused>;miopenConvolutionFwdAlgoWinograd:ConvBinWinogradRxSf3x2,0.20896,0,miopenConvolutionFwdAlgoWinograd,<unused>;miopenConvolutionFwdAlgoGEMM:GemmFwd1x1_0_1,0.15088,0,miopenConvolutionFwdAlgoGEMM,<unused>
928-7-7-1x1-128-7-7-32-0x0-1x1-1x1-0-NCHW-FP32-F=miopenConvolutionFwdAlgoImplicitGEMM:ConvHipImplicitGemmV4R4Fwd,0.1128,0,miopenConvolutionFwdAlgoImplicitGEMM,<unused>;miopenConvolutionFwdAlgoDirect:ConvAsm1x1U,0.13632,0,miopenConvolutionFwdAlgoDirect,<unused>;miopenConvolutionFwdAlgoWinograd:ConvBinWinogradRxSf3x2,0.21504,0,miopenConvolutionFwdAlgoWinograd,<unused>;miopenConvolutionFwdAlgoGEMM:GemmFwd1x1_0_1,0.14608,0,miopenConvolutionFwdAlgoGEMM,<unused>
960-7-7-1x1-128-7-7-32-0x0-1x1-1x1-0-NCHW-FP32-F=miopenConvolutionFwdAlgoImplicitGEMM:ConvHipImplicitGemmV4R4Fwd,0.132481,0,miopenConvolutionFwdAlgoImplicitGEMM,<unused>;miopenConvolutionFwdAlgoDirect:ConvAsm1x1U,0.13376,0,miopenConvolutionFwdAlgoDirect,<unused>;miopenConvolutionFwdAlgoWinograd:ConvBinWinogradRxSf3x2,0.22144,0,miopenConvolutionFwdAlgoWinograd,<unused>;miopenConvolutionFwdAlgoGEMM:GemmFwd1x1_0_1,0.15936,0,miopenConvolutionFwdAlgoGEMM,<unused>
992-7-7-1x1-128-7-7-32-0x0-1x1-1x1-0-NCHW-FP32-F=miopenConvolutionFwdAlgoImplicitGEMM:ConvHipImplicitGemmV4R4Fwd,0.11968,0,miopenConvolutionFwdAlgoImplicitGEMM,<unused>;miopenConvolutionFwdAlgoDirect:ConvAsm1x1U,0.14496,0,miopenConvolutionFwdAlgoDirect,<unused>;miopenConvolutionFwdAlgoWinograd:ConvBinWinogradRxSf3x2,0.22688,0,miopenConvolutionFwdAlgoWinograd,<unused>;miopenConvolutionFwdAlgoGEMM:GemmFwd1x1_0_1,0.15552,0,miopenConvolutionFwdAlgoGEMM,<unused>
3-224-224-7x7-64-112-112-32-3x3-2x2-1x1-0-NCHW-FP16-F=miopenConvolutionFwdAlgoImplicitGEMM:ConvMlirIgemmFwd,2.4352,0,miopenConvolutionFwdAlgoImplicitGEMM,<unused>;miopenConvolutionFwdAlgoDirect:ConvOclDirectFwdGen,5.82384,0,miopenConvolutionFwdAlgoDirect,<unused>;miopenConvolutionFwdAlgoWinograd:ConvBinWinogradRxSf2x3g1,1.26816,0,miopenConvolutionFwdAlgoWinograd,<unused>;miopenConvolutionFwdAlgoGEMM:GemmFwdRest,3.57376,3687936,miopenConvolutionFwdAlgoGEMM,<unused>
64-56-56-1x1-128-56-56-32-0x0-1x1-1x1-0-NCHW-FP16-F=miopenConvolutionFwdAlgoImplicitGEMM:ConvHipImplicitGemmV4R1Fwd,0.14816,0,miopenConvolutionFwdAlgoImplicitGEMM,<unused>;miopenConvolutionFwdAlgoDirect:ConvAsm1x1U,0.17744,0,miopenConvolutionFwdAlgoDirect,<unused>;miopenConvolutionFwdAlgoWinograd:ConvBinWinogradRxSf3x2,0.39776,0,miopenConvolutionFwdAlgoWinograd,<unused>;miopenConvolutionFwdAlgoGEMM:GemmFwd1x1_0_1,0.18176,0,miopenConvolutionFwdAlgoGEMM,<unused>
128-56-56-3x3-32-56-56-32-1x1-1x1-1x1-0-NCHW-FP16-F=miopenConvolutionFwdAlgoImplicitGEMM:ConvHipImplicitGemmV4R1Fwd,0.641441,0,miopenConvolutionFwdAlgoImplicitGEMM,<unused>;miopenConvolutionFwdAlgoDirect:ConvOclDirectFwd,2.26208,0,miopenConvolutionFwdAlgoDirect,<unused>;miopenConvolutionFwdAlgoWinograd:ConvBinWinogradRxSf2x3g1,0.258561,0,miopenConvolutionFwdAlgoWinograd,<unused>;miopenConvolutionFwdAlgoGEMM:GemmFwdRest,4.19328,7225344,miopenConvolutionFwdAlgoGEMM,<unused>
96-56-56-1x1-128-56-56-32-0x0-1x1-1x1-0-NCHW-FP16-F=miopenConvolutionFwdAlgoImplicitGEMM:ConvHipImplicitGemmV4R1Fwd,0.19712,0,miopenConvolutionFwdAlgoImplicitGEMM,<unused>;miopenConvolutionFwdAlgoDirect:ConvAsm1x1U,0.218081,0,miopenConvolutionFwdAlgoDirect,<unused>;miopenConvolutionFwdAlgoWinograd:ConvBinWinogradRxSf3x2,0.428001,0,miopenConvolutionFwdAlgoWinograd,<unused>;miopenConvolutionFwdAlgoGEMM:GemmFwd1x1_0_1,0.18032,0,miopenConvolutionFwdAlgoGEMM,<unused>
128-56-56-1x1-128-56-56-32-0x0-1x1-1x1-0-NCHW-FP16-F=miopenConvolutionFwdAlgoImplicitGEMM:ConvHipImplicitGemmV4R1Fwd,0.27456,0,miopenConvolutionFwdAlgoImplicitGEMM,<unused>;miopenConvolutionFwdAlgoDirect:ConvAsm1x1U,0.265281,0,miopenConvolutionFwdAlgoDirect,<unused>;miopenConvolutionFwdAlgoWinograd:ConvBinWinogradRxSf3x2,0.608481,0,miopenConvolutionFwdAlgoWinograd,<unused>;miopenConvolutionFwdAlgoGEMM:GemmFwd1x1_0_1,0.2632,0,miopenConvolutionFwdAlgoGEMM,<unused>
160-56-56-1x1-128-56-56-32-0x0-1x1-1x1-0-NCHW-FP16-F=miopenConvolutionFwdAlgoImplicitGEMM:ConvHipImplicitGemmV4R1Fwd,0.286561,0,miopenConvolutionFwdAlgoImplicitGEMM,<unused>;miopenConvolutionFwdAlgoDirect:ConvAsm1x1U,0.3216,0,miopenConvolutionFwdAlgoDirect,<unused>;miopenConvolutionFwdAlgoWinograd:ConvBinWinogradRxSf3x2,0.805761,0,miopenConvolutionFwdAlgoWinograd,<unused>;miopenConvolutionFwdAlgoGEMM:GemmFwd1x1_0_1,0.28256,0,miopenConvolutionFwdAlgoGEMM,<unused>
192-56-56-1x1-128-56-56-32-0x0-1x1-1x1-0-NCHW-FP16-F=miopenConvolutionFwdAlgoImplicitGEMM:ConvHipImplicitGemmV4R1Fwd,0.373921,0,miopenConvolutionFwdAlgoImplicitGEMM,<unused>;miopenConvolutionFwdAlgoDirect:ConvAsm1x1U,0.403841,0,miopenConvolutionFwdAlgoDirect,<unused>;miopenConvolutionFwdAlgoWinograd:ConvBinWinogradRxSf3x2,0.705761,0,miopenConvolutionFwdAlgoWinograd,<unused>;miopenConvolutionFwdAlgoGEMM:GemmFwd1x1_0_1,0.30832,0,miopenConvolutionFwdAlgoGEMM,<unused>
224-56-56-1x1-128-56-56-32-0x0-1x1-1x1-0-NCHW-FP16-F=miopenConvolutionFwdAlgoImplicitGEMM:ConvHipImplicitGemmV4R1Fwd,0.376641,0,miopenConvolutionFwdAlgoImplicitGEMM,<unused>;miopenConvolutionFwdAlgoDirect:ConvAsm1x1U,0.45584,0,miopenConvolutionFwdAlgoDirect,<unused>;miopenConvolutionFwdAlgoWinograd:ConvBinWinogradRxSf3x2,0.898561,0,miopenConvolutionFwdAlgoWinograd,<unused>;miopenConvolutionFwdAlgoGEMM:GemmFwd1x1_0_1,0.3368,0,miopenConvolutionFwdAlgoGEMM,<unused>
256-56-56-1x1-128-56-56-32-0x0-1x1-1x1-0-NCHW-FP16-F=miopenConvolutionFwdAlgoImplicitGEMM:ConvHipImplicitGemmV4R1Fwd,0.49408,0,miopenConvolutionFwdAlgoImplicitGEMM,<unused>;miopenConvolutionFwdAlgoDirect:ConvAsm1x1U,0.4936,0,miopenConvolutionFwdAlgoDirect,<unused>;miopenConvolutionFwdAlgoWinograd:ConvBinWinogradRxSf3x2,1.00272,0,miopenConvolutionFwdAlgoWinograd,<unused>;miopenConvolutionFwdAlgoGEMM:GemmFwd1x1_0_1,0.421601,0,miopenConvolutionFwdAlgoGEMM,<unused>
128-28-28-1x1-128-28-28-32-0x0-1x1-1x1-0-NCHW-FP16-F=miopenConvolutionFwdAlgoImplicitGEMM:ConvHipImplicitGemmV4R1Fwd,0.10128,0,miopenConvolutionFwdAlgoImplicitGEMM,<unused>;miopenConvolutionFwdAlgoDirect:ConvAsm1x1U,0.087201,0,miopenConvolutionFwdAlgoDirect,<unused>;miopenConvolutionFwdAlgoWinograd:ConvBinWinogradRxSf3x2,0.18288,0,miopenConvolutionFwdAlgoWinograd,<unused>;miopenConvolutionFwdAlgoGEMM:GemmFwd1x1_0_1,0.18,0,miopenConvolutionFwdAlgoGEMM,<unused>
128-28-28-3x3-32-28-28-32-1x1-1x1-1x1-0-NCHW-FP16-F=miopenConvolutionFwdAlgoImplicitGEMM:ConvHipImplicitGemmV4R1Fwd,0.216801,0,miopenConvolutionFwdAlgoImplicitGEMM,<unused>;miopenConvolutionFwdAlgoDirect:ConvOclDirectFwd,1.00256,0,miopenConvolutionFwdAlgoDirect,<unused>;miopenConvolutionFwdAlgoWinograd:ConvBinWinogradRxS,0.10352,0,miopenConvolutionFwdAlgoWinograd,<unused>;miopenConvolutionFwdAlgoGEMM:GemmFwdRest,4.27008,1806336,miopenConvolutionFwdAlgoGEMM,<unused>
160-28-28-1x1-128-28-28-32-0x0-1x1-1x1-0-NCHW-FP16-F=miopenConvolutionFwdAlgoImplicitGEMM:ConvHipImplicitGemmV4R1Fwd,0.10688,0,miopenConvolutionFwdAlgoImplicitGEMM,<unused>;miopenConvolutionFwdAlgoDirect:ConvAsm1x1U,0.10864,0,miopenConvolutionFwdAlgoDirect,<unused>;miopenConvolutionFwdAlgoWinograd:ConvBinWinogradRxSf3x2,0.24496,0,miopenConvolutionFwdAlgoWinograd,<unused>;miopenConvolutionFwdAlgoGEMM:GemmFwd1x1_0_1,0.17744,0,miopenConvolutionFwdAlgoGEMM,<unused>
192-28-28-1x1-128-28-28-32-0x0-1x1-1x1-0-NCHW-FP16-F=miopenConvolutionFwdAlgoImplicitGEMM:ConvHipImplicitGemmV4R1Fwd,0.12528,0,miopenConvolutionFwdAlgoImplicitGEMM,<unused>;miopenConvolutionFwdAlgoDirect:ConvAsm1x1U,0.1176,0,miopenConvolutionFwdAlgoDirect,<unused>;miopenConvolutionFwdAlgoWinograd:ConvBinWinogradRxSf3x2,0.30064,0,miopenConvolutionFwdAlgoWinograd,<unused>;miopenConvolutionFwdAlgoGEMM:GemmFwd1x1_0_1,0.22144,0,miopenConvolutionFwdAlgoGEMM,<unused>
224-28-28-1x1-128-28-28-32-0x0-1x1-1x1-0-NCHW-FP16-F=miopenConvolutionFwdAlgoImplicitGEMM:ConvHipImplicitGemmV4R1Fwd,0.12128,0,miopenConvolutionFwdAlgoImplicitGEMM,<unused>;miopenConvolutionFwdAlgoDirect:ConvAsm1x1U,0.14208,0,miopenConvolutionFwdAlgoDirect,<unused>;miopenConvolutionFwdAlgoWinograd:ConvBinWinogradRxSf3x2,0.390881,0,miopenConvolutionFwdAlgoWinograd,<unused>;miopenConvolutionFwdAlgoGEMM:GemmFwd1x1_0_1,0.24016,0,miopenConvolutionFwdAlgoGEMM,<unused>
256-28-28-1x1-128-28-28-32-0x0-1x1-1x1-0-NCHW-FP16-F=miopenConvolutionFwdAlgoImplicitGEMM:ConvHipImplicitGemmV4R1Fwd,0.14928,0,miopenConvolutionFwdAlgoImplicitGEMM,<unused>;miopenConvolutionFwdAlgoDirect:ConvAsm1x1U,0.14128,0,miopenConvolutionFwdAlgoDirect,<unused>;miopenConvolutionFwdAlgoWinograd:ConvBinWinogradRxSf3x2,0.2952,0,miopenConvolutionFwdAlgoWinograd,<unused>;miopenConvolutionFwdAlgoGEMM:GemmFwd1x1_0_1,0.27392,0,miopenConvolutionFwdAlgoGEMM,<unused>
288-28-28-1x1-128-28-28-32-0x0-1x1-1x1-0-NCHW-FP16-F=miopenConvolutionFwdAlgoImplicitGEMM:ConvHipImplicitGemmV4R1Fwd,0.14624,0,miopenConvolutionFwdAlgoImplicitGEMM,<unused>;miopenConvolutionFwdAlgoDirect:ConvAsm1x1U,0.17856,0,miopenConvolutionFwdAlgoDirect,<unused>;miopenConvolutionFwdAlgoWinograd:ConvBinWinogradRxSf3x2,0.320161,0,miopenConvolutionFwdAlgoWinograd,<unused>;miopenConvolutionFwdAlgoGEMM:GemmFwd1x1_0_1,0.31584,0,miopenConvolutionFwdAlgoGEMM,<unused>
320-28-28-1x1-128-28-28-32-0x0-1x1-1x1-0-NCHW-FP16-F=miopenConvolutionFwdAlgoImplicitGEMM:ConvHipImplicitGemmV4R1Fwd,0.1768,0,miopenConvolutionFwdAlgoImplicitGEMM,<unused>;miopenConvolutionFwdAlgoDirect:ConvAsm1x1U,0.16944,0,miopenConvolutionFwdAlgoDirect,<unused>;miopenConvolutionFwdAlgoWinograd:ConvBinWinogradRxSf3x2,0.347841,0,miopenConvolutionFwdAlgoWinograd,<unused>;miopenConvolutionFwdAlgoGEMM:GemmFwd1x1_0_1,0.32912,0,miopenConvolutionFwdAlgoGEMM,<unused>
352-28-28-1x1-128-28-28-32-0x0-1x1-1x1-0-NCHW-FP16-F=miopenConvolutionFwdAlgoImplicitGEMM:ConvHipImplicitGemmV4R1Fwd,0.17184,0,miopenConvolutionFwdAlgoImplicitGEMM,<unused>;miopenConvolutionFwdAlgoDirect:ConvAsm1x1U,0.20208,0,miopenConvolutionFwdAlgoDirect,<unused>;miopenConvolutionFwdAlgoWinograd:ConvBinWinogradRxSf3x2,0.391041,0,miopenConvolutionFwdAlgoWinograd,<unused>;miopenConvolutionFwdAlgoGEMM:GemmFwd1x1_0_1,0.35568,0,miopenConvolutionFwdAlgoGEMM,<unused>
384-28-28-1x1-128-28-28-32-0x0-1x1-1x1-0-NCHW-FP16-F=miopenConvolutionFwdAlgoImplicitGEMM:ConvHipImplicitGemmV4R1Fwd,0.213281,0,miopenConvolutionFwdAlgoImplicitGEMM,<unused>;miopenConvolutionFwdAlgoDirect:ConvAsm1x1U,0.232,0,miopenConvolutionFwdAlgoDirect,<unused>;miopenConvolutionFwdAlgoWinograd:ConvBinWinogradRxSf3x2,0.42352,0,miopenConvolutionFwdAlgoWinograd,<unused>;miopenConvolutionFwdAlgoGEMM:GemmFwd1x1_0_1,0.1944,0,miopenConvolutionFwdAlgoGEMM,<unused>
416-28-28-1x1-128-28-28-32-0x0-1x1-1x1-0-NCHW-FP16-F=miopenConvolutionFwdAlgoImplicitGEMM:ConvHipImplicitGemmV4R1Fwd,0.19904,0,miopenConvolutionFwdAlgoImplicitGEMM,<unused>;miopenConvolutionFwdAlgoDirect:ConvAsm1x1U,0.2288,0,miopenConvolutionFwdAlgoDirect,<unused>;miopenConvolutionFwdAlgoWinograd:ConvBinWinogradRxSf3x2,0.483201,0,miopenConvolutionFwdAlgoWinograd,<unused>;miopenConvolutionFwdAlgoGEMM:GemmFwd1x1_0_1,0.2232,0,miopenConvolutionFwdAlgoGEMM,<unused>
448-28-28-1x1-128-28-28-32-0x0-1x1-1x1-0-NCHW-FP16-F=miopenConvolutionFwdAlgoImplicitGEMM:ConvHipImplicitGemmV4R1Fwd,0.23472,0,miopenConvolutionFwdAlgoImplicitGEMM,<unused>;miopenConvolutionFwdAlgoDirect:ConvAsm1x1U,0.248481,0,miopenConvolutionFwdAlgoDirect,<unused>;miopenConvolutionFwdAlgoWinograd:ConvBinWinogradRxSf3x2,0.600001,0,miopenConvolutionFwdAlgoWinograd,<unused>;miopenConvolutionFwdAlgoGEMM:GemmFwd1x1_0_1,0.23232,0,miopenConvolutionFwdAlgoGEMM,<unused>
480-28-28-1x1-128-28-28-32-0x0-1x1-1x1-0-NCHW-FP16-F=miopenConvolutionFwdAlgoImplicitGEMM:ConvHipImplicitGemmV4R1Fwd,0.22352,0,miopenConvolutionFwdAlgoImplicitGEMM,<unused>;miopenConvolutionFwdAlgoDirect:ConvAsm1x1U,0.276961,0,miopenConvolutionFwdAlgoDirect,<unused>;miopenConvolutionFwdAlgoWinograd:ConvBinWinogradRxSf3x2,0.490241,0,miopenConvolutionFwdAlgoWinograd,<unused>;miopenConvolutionFwdAlgoGEMM:GemmFwd1x1_0_1,0.2456,0,miopenConvolutionFwdAlgoGEMM,<unused>
512-28-28-1x1-256-28-28-32-0x0-1x1-1x1-0-NCHW-FP16-F=miopenConvolutionFwdAlgoImplicitGEMM:ConvHipImplicitGemmV4R1Fwd,0.595361,0,miopenConvolutionFwdAlgoImplicitGEMM,<unused>;miopenConvolutionFwdAlgoDirect:ConvAsm1x1U,0.541761,0,miopenConvolutionFwdAlgoDirect,<unused>;miopenConvolutionFwdAlgoWinograd:ConvBinWinogradRxSf3x2,0.999041,0,miopenConvolutionFwdAlgoWinograd,<unused>;miopenConvolutionFwdAlgoGEMM:GemmFwd1x1_0_1,0.455361,0,miopenConvolutionFwdAlgoGEMM,<unused>
256-14-14-1x1-128-14-14-32-0x0-1x1-1x1-0-NCHW-FP16-F=miopenConvolutionFwdAlgoImplicitGEMM:ConvHipImplicitGemmV4R1Fwd,0.08512,0,miopenConvolutionFwdAlgoImplicitGEMM,<unused>;miopenConvolutionFwdAlgoDirect:ConvAsm1x1U,0.07168,0,miopenConvolutionFwdAlgoDirect,<unused>;miopenConvolutionFwdAlgoWinograd:ConvBinWinogradRxSf3x2,0.15488,0,miopenConvolutionFwdAlgoWinograd,<unused>;miopenConvolutionFwdAlgoGEMM:GemmFwd1x1_0_1,0.22624,0,miopenConvolutionFwdAlgoGEMM,<unused>
128-14-14-3x3-32-14-14-32-1x1-1x1-1x1-0-NCHW-FP16-F=miopenConvolutionFwdAlgoImplicitGEMM:ConvHipImplicitGemmV4R1Fwd,0.14192,0,miopenConvolutionFwdAlgoImplicitGEMM,<unused>;miopenConvolutionFwdAlgoDirect:ConvOclDirectFwd,0.790721,0,miopenConvolutionFwdAlgoDirect,<unused>;miopenConvolutionFwdAlgoWinograd:ConvBinWinogradRxSf2x3,0.05936,0,miopenConvolutionFwdAlgoWinograd,<unused>;miopenConvolutionFwdAlgoGEMM:GemmFwdRest,3.20512,451584,miopenConvolutionFwdAlgoGEMM,<unused>
288-14-14-1x1-128-14-14-32-0x0-1x1-1x1-0-NCHW-FP16-F=miopenConvolutionFwdAlgoImplicitGEMM:ConvHipImplicitGemmV4R1Fwd,0.06624,0,miopenConvolutionFwdAlgoImplicitGEMM,<unused>;miopenConvolutionFwdAlgoDirect:ConvAsm1x1U,0.09824,0,miopenConvolutionFwdAlgoDirect,<unused>;miopenConvolutionFwdAlgoWinograd:ConvBinWinogradRxSf3x2,0.14304,0,miopenConvolutionFwdAlgoWinograd,<unused>;miopenConvolutionFwdAlgoGEMM:GemmFwd1x1_0_1,0.28096,0,miopenConvolutionFwdAlgoGEMM,<unused>
320-14-14-1x1-128-14-14-32-0x0-1x1-1x1-0-NCHW-FP16-F=miopenConvolutionFwdAlgoImplicitGEMM:ConvHipImplicitGemmV4R1Fwd,0.07648,0,miopenConvolutionFwdAlgoImplicitGEMM,<unused>;miopenConvolutionFwdAlgoDirect:ConvAsm1x1U,0.1072,0,miopenConvolutionFwdAlgoDirect,<unused>;miopenConvolutionFwdAlgoWinograd:ConvBinWinogradRxSf3x2,0.18256,0,miopenConvolutionFwdAlgoWinograd,<unused>;miopenConvolutionFwdAlgoGEMM:GemmFwd1x1_0_1,0.26912,0,miopenConvolutionFwdAlgoGEMM,<unused>
352-14-14-1x1-128-14-14-32-0x0-1x1-1x1-0-NCHW-FP16-F=miopenConvolutionFwdAlgoImplicitGEMM:ConvHipImplicitGemmV4R1Fwd,0.07808,0,miopenConvolutionFwdAlgoImplicitGEMM,<unused>;miopenConvolutionFwdAlgoDirect:ConvAsm1x1U,0.115041,0,miopenConvolutionFwdAlgoDirect,<unused>;miopenConvolutionFwdAlgoWinograd:ConvBinWinogradRxSf3x2,0.163361,0,miopenConvolutionFwdAlgoWinograd,<unused>;miopenConvolutionFwdAlgoGEMM:GemmFwd1x1_0_1,0.33744,0,miopenConvolutionFwdAlgoGEMM,<unused>
384-14-14-1x1-128-14-14-32-0x0-1x1-1x1-0-NCHW-FP16-F=miopenConvolutionFwdAlgoImplicitGEMM:ConvHipImplicitGemmV4R1Fwd,0.11776,0,miopenConvolutionFwdAlgoImplicitGEMM,<unused>;miopenConvolutionFwdAlgoDirect:ConvAsm1x1U,0.124,0,miopenConvolutionFwdAlgoDirect,<unused>;miopenConvolutionFwdAlgoWinograd:ConvBinWinogradRxSf3x2,0.173921,0,miopenConvolutionFwdAlgoWinograd,<unused>;miopenConvolutionFwdAlgoGEMM:GemmFwd1x1_0_1,0.32368,0,miopenConvolutionFwdAlgoGEMM,<unused>
416-14-14-1x1-128-14-14-32-0x0-1x1-1x1-0-NCHW-FP16-F=miopenConvolutionFwdAlgoImplicitGEMM:ConvHipImplicitGemmV4R1Fwd,0.09024,0,miopenConvolutionFwdAlgoImplicitGEMM,<unused>;miopenConvolutionFwdAlgoDirect:ConvAsm1x1U,0.13344,0,miopenConvolutionFwdAlgoDirect,<unused>;miopenConvolutionFwdAlgoWinograd:ConvBinWinogradRxSf3x2,0.1848,0,miopenConvolutionFwdAlgoWinograd,<unused>;miopenConvolutionFwdAlgoGEMM:GemmFwd1x1_0_1,0.375201,0,miopenConvolutionFwdAlgoGEMM,<unused>
448-14-14-1x1-128-14-14-32-0x0-1x1-1x1-0-NCHW-FP16-F=miopenConvolutionFwdAlgoImplicitGEMM:ConvHipImplicitGemmV4R1Fwd,0.096641,0,miopenConvolutionFwdAlgoImplicitGEMM,<unused>;miopenConvolutionFwdAlgoDirect:ConvAsm1x1U,0.14016,0,miopenConvolutionFwdAlgoDirect,<unused>;miopenConvolutionFwdAlgoWinograd:ConvBinWinogradRxSf3x2,0.1968,0,miopenConvolutionFwdAlgoWinograd,<unused>;miopenConvolutionFwdAlgoGEMM:GemmFwd1x1_0_1,0.375681,0,miopenConvolutionFwdAlgoGEMM,<unused>
480-14-14-1x1-128-14-14-32-0x0-1x1-1x1-0-NCHW-FP16-F=miopenConvolutionFwdAlgoImplicitGEMM:ConvHipImplicitGemmV4R1Fwd,0.140641,0,miopenConvolutionFwdAlgoImplicitGEMM,<unused>;miopenConvolutionFwdAlgoDirect:ConvAsm1x1U,0.149281,0,miopenConvolutionFwdAlgoDirect,<unused>;miopenConvolutionFwdAlgoWinograd:ConvBinWinogradRxSf3x2,0.20576,0,miopenConvolutionFwdAlgoWinograd,<unused>;miopenConvolutionFwdAlgoGEMM:GemmFwd1x1_0_1,0.422081,0,miopenConvolutionFwdAlgoGEMM,<unused>
512-14-14-1x1-128-14-14-32-0x0-1x1-1x1-0-NCHW-FP16-F=miopenConvolutionFwdAlgoImplicitGEMM:ConvHipImplicitGemmV4R1Fwd,0.250721,0,miopenConvolutionFwdAlgoImplicitGEMM,<unused>;miopenConvolutionFwdAlgoDirect:ConvAsm1x1U,0.11232,0,miopenConvolutionFwdAlgoDirect,<unused>;miopenConvolutionFwdAlgoWinograd:ConvBinWinogradRxSf3x2,0.21824,0,miopenConvolutionFwdAlgoWinograd,<unused>;miopenConvolutionFwdAlgoGEMM:GemmFwd1x1_0_1,0.395681,0,miopenConvolutionFwdAlgoGEMM,<unused>
544-14-14-1x1-128-14-14-32-0x0-1x1-1x1-0-NCHW-FP16-F=miopenConvolutionFwdAlgoImplicitGEMM:ConvHipImplicitGemmV4R1Fwd,0.10352,0,miopenConvolutionFwdAlgoImplicitGEMM,<unused>;miopenConvolutionFwdAlgoDirect:ConvAsm1x1U,0.16704,0,miopenConvolutionFwdAlgoDirect,<unused>;miopenConvolutionFwdAlgoWinograd:ConvBinWinogradRxSf3x2,0.22656,0,miopenConvolutionFwdAlgoWinograd,<unused>;miopenConvolutionFwdAlgoGEMM:GemmFwd1x1_0_1,0.463041,0,miopenConvolutionFwdAlgoGEMM,<unused>
576-14-14-1x1-128-14-14-32-0x0-1x1-1x1-0-NCHW-FP16-F=miopenConvolutionFwdAlgoImplicitGEMM:ConvHipImplicitGemmV4R1Fwd,0.15152,0,miopenConvolutionFwdAlgoImplicitGEMM,<unused>;miopenConvolutionFwdAlgoDirect:ConvAsm1x1U,0.12992,0,miopenConvolutionFwdAlgoDirect,<unused>;miopenConvolutionFwdAlgoWinograd:ConvBinWinogradRxSf3x2,0.2608,0,miopenConvolutionFwdAlgoWinograd,<unused>;miopenConvolutionFwdAlgoGEMM:GemmFwd1x1_0_1,0.447681,0,miopenConvolutionFwdAlgoGEMM,<unused>
608-14-14-1x1-128-14-14-32-0x0-1x1-1x1-0-NCHW-FP16-F=miopenConvolutionFwdAlgoImplicitGEMM:ConvHipImplicitGemmV4R1Fwd,0.15968,0,miopenConvolutionFwdAlgoImplicitGEMM,<unused>;miopenConvolutionFwdAlgoDirect:ConvAsm1x1U,0.183521,0,miopenConvolutionFwdAlgoDirect,<unused>;miopenConvolutionFwdAlgoWinograd:ConvBinWinogradRxSf3x2,0.289761,0,miopenConvolutionFwdAlgoWinograd,<unused>;miopenConvolutionFwdAlgoGEMM:GemmFwd1x1_0_1,0.13376,0,miopenConvolutionFwdAlgoGEMM,<unused>
640-14-14-1x1-128-14-14-32-0x0-1x1-1x1-0-NCHW-FP16-F=miopenConvolutionFwdAlgoImplicitGEMM:ConvHipImplicitGemmV4R1Fwd,0.16608,0,miopenConvolutionFwdAlgoImplicitGEMM,<unused>;miopenConvolutionFwdAlgoDirect:ConvAsm1x1U,0.14864,0,miopenConvolutionFwdAlgoDirect,<unused>;miopenConvolutionFwdAlgoWinograd:ConvBinWinogradRxSf3x2,0.25776,0,miopenConvolutionFwdAlgoWinograd,<unused>;miopenConvolutionFwdAlgoGEMM:GemmFwd1x1_0_1,0.12736,0,miopenConvolutionFwdAlgoGEMM,<unused>
672-14-14-1x1-128-14-14-32-0x0-1x1-1x1-0-NCHW-FP16-F=miopenConvolutionFwdAlgoImplicitGEMM:ConvHipImplicitGemmV4R1Fwd,0.17376,0,miopenConvolutionFwdAlgoImplicitGEMM,<unused>;miopenConvolutionFwdAlgoDirect:ConvAsm1x1U,0.204321,0,miopenConvolutionFwdAlgoDirect,<unused>;miopenConvolutionFwdAlgoWinograd:ConvBinWinogradRxSf3x2,0.2688,0,miopenConvolutionFwdAlgoWinograd,<unused>;miopenConvolutionFwdAlgoGEMM:GemmFwd1x1_0_1,0.14304,0,miopenConvolutionFwdAlgoGEMM,<unused>
704-14-14-1x1-128-14-14-32-0x0-1x1-1x1-0-NCHW-FP16-F=miopenConvolutionFwdAlgoImplicitGEMM:ConvHipImplicitGemmV4R1Fwd,0.171521,0,miopenConvolutionFwdAlgoImplicitGEMM,<unused>;miopenConvolutionFwdAlgoDirect:ConvAsm1x1U,0.212481,0,miopenConvolutionFwdAlgoDirect,<unused>;miopenConvolutionFwdAlgoWinograd:ConvBinWinogradRxSf3x2,0.279681,0,miopenConvolutionFwdAlgoWinograd,<unused>;miopenConvolutionFwdAlgoGEMM:GemmFwd1x1_0_1,0.17504,0,miopenConvolutionFwdAlgoGEMM,<unused>
736-14-14-1x1-128-14-14-32-0x0-1x1-1x1-0-NCHW-FP16-F=miopenConvolutionFwdAlgoImplicitGEMM:ConvHipImplicitGemmV4R1Fwd,0.1784,0,miopenConvolutionFwdAlgoImplicitGEMM,<unused>;miopenConvolutionFwdAlgoDirect:ConvAsm1x1U,0.16832,0,miopenConvolutionFwdAlgoDirect,<unused>;miopenConvolutionFwdAlgoWinograd:ConvBinWinogradRxSf3x2,0.340641,0,miopenConvolutionFwdAlgoWinograd,<unused>;miopenConvolutionFwdAlgoGEMM:GemmFwd1x1_0_1,0.19328,0,miopenConvolutionFwdAlgoGEMM,<unused>
768-14-14-1x1-128-14-14-32-0x0-1x1-1x1-0-NCHW-FP16-F=miopenConvolutionFwdAlgoImplicitGEMM:ConvHipImplicitGemmV4R1Fwd,0.18528,0,miopenConvolutionFwdAlgoImplicitGEMM,<unused>;miopenConvolutionFwdAlgoDirect:ConvAsm1x1U,0.17504,0,miopenConvolutionFwdAlgoDirect,<unused>;miopenConvolutionFwdAlgoWinograd:ConvBinWinogradRxSf3x2,0.300641,0,miopenConvolutionFwdAlgoWinograd,<unused>;miopenConvolutionFwdAlgoGEMM:GemmFwd1x1_0_1,0.18144,0,miopenConvolutionFwdAlgoGEMM,<unused>
800-14-14-1x1-128-14-14-32-0x0-1x1-1x1-0-NCHW-FP16-F=miopenConvolutionFwdAlgoImplicitGEMM:ConvHipImplicitGemmV4R1Fwd,0.19232,0,miopenConvolutionFwdAlgoImplicitGEMM,<unused>;miopenConvolutionFwdAlgoDirect:ConvAsm1x1U,0.23792,0,miopenConvolutionFwdAlgoDirect,<unused>;miopenConvolutionFwdAlgoWinograd:ConvBinWinogradRxSf3x2,0.344641,0,miopenConvolutionFwdAlgoWinograd,<unused>;miopenConvolutionFwdAlgoGEMM:GemmFwd1x1_0_1,0.18496,0,miopenConvolutionFwdAlgoGEMM,<unused>
832-14-14-1x1-128-14-14-32-0x0-1x1-1x1-0-NCHW-FP16-F=miopenConvolutionFwdAlgoImplicitGEMM:ConvHipImplicitGemmV4R1Fwd,0.19936,0,miopenConvolutionFwdAlgoImplicitGEMM,<unused>;miopenConvolutionFwdAlgoDirect:ConvAsm1x1U,0.1872,0,miopenConvolutionFwdAlgoDirect,<unused>;miopenConvolutionFwdAlgoWinograd:ConvBinWinogradRxSf3x2,0.324161,0,miopenConvolutionFwdAlgoWinograd,<unused>;miopenConvolutionFwdAlgoGEMM:GemmFwd1x1_0_1,0.1984,0,miopenConvolutionFwdAlgoGEMM,<unused>
864-14-14-1x1-128-14-14-32-0x0-1x1-1x1-0-NCHW-FP16-F=miopenConvolutionFwdAlgoImplicitGEMM:ConvHipImplicitGemmV4R1Fwd,0.205761,0,miopenConvolutionFwdAlgoImplicitGEMM,<unused>;miopenConvolutionFwdAlgoDirect:ConvAsm1x1U,0.19312,0,miopenConvolutionFwdAlgoDirect,<unused>;miopenConvolutionFwdAlgoWinograd:ConvBinWinogradRxSf3x2,0.332161,0,miopenConvolutionFwdAlgoWinograd,<unused>;miopenConvolutionFwdAlgoGEMM:GemmFwd1x1_0_1,0.21504,0,miopenConvolutionFwdAlgoGEMM,<unused>
896-14-14-1x1-128-14-14-32-0x0-1x1-1x1-0-NCHW-FP16-F=miopenConvolutionFwdAlgoImplicitGEMM:ConvHipImplicitGemmV4R1Fwd,0.2136,0,miopenConvolutionFwdAlgoImplicitGEMM,<unused>;miopenConvolutionFwdAlgoDirect:ConvAsm1x1U,0.19904,0,miopenConvolutionFwdAlgoDirect,<unused>;miopenConvolutionFwdAlgoWinograd:ConvBinWinogradRxSf3x2,0.342881,0,miopenConvolutionFwdAlgoWinograd,<unused>;miopenConvolutionFwdAlgoGEMM:GemmFwd1x1_0_1,0.22832,0,miopenConvolutionFwdAlgoGEMM,<unused>
928-14-14-1x1-128-14-14-32-0x0-1x1-1x1-0-NCHW-FP16-F=miopenConvolutionFwdAlgoImplicitGEMM:ConvHipImplicitGemmV4R1Fwd,0.21744,0,miopenConvolutionFwdAlgoImplicitGEMM,<unused>;miopenConvolutionFwdAlgoDirect:ConvAsm1x1U,0.19808,0,miopenConvolutionFwdAlgoDirect,<unused>;miopenConvolutionFwdAlgoWinograd:ConvBinWinogradRxSf3x2,0.402401,0,miopenConvolutionFwdAlgoWinograd,<unused>;miopenConvolutionFwdAlgoGEMM:GemmFwd1x1_0_1,0.21856,0,miopenConvolutionFwdAlgoGEMM,<unused>
960-14-14-1x1-128-14-14-32-0x0-1x1-1x1-0-NCHW-FP16-F=miopenConvolutionFwdAlgoImplicitGEMM:ConvHipImplicitGemmV4R1Fwd,0.2256,0,miopenConvolutionFwdAlgoImplicitGEMM,<unused>;miopenConvolutionFwdAlgoDirect:ConvAsm1x1U,0.212961,0,miopenConvolutionFwdAlgoDirect,<unused>;miopenConvolutionFwdAlgoWinograd:ConvBinWinogradRxSf3x2,0.422561,0,miopenConvolutionFwdAlgoWinograd,<unused>;miopenConvolutionFwdAlgoGEMM:GemmFwd1x1_0_1,0.22704,0,miopenConvolutionFwdAlgoGEMM,<unused>
992-14-14-1x1-128-14-14-32-0x0-1x1-1x1-0-NCHW-FP16-F=miopenConvolutionFwdAlgoImplicitGEMM:ConvHipImplicitGemmV4R1Fwd,0.23136,0,miopenConvolutionFwdAlgoImplicitGEMM,<unused>;miopenConvolutionFwdAlgoDirect:ConvAsm1x1U,0.220961,0,miopenConvolutionFwdAlgoDirect,<unused>;miopenConvolutionFwdAlgoWinograd:ConvBinWinogradRxSf3x2,0.440161,0,miopenConvolutionFwdAlgoWinograd,<unused>;miopenConvolutionFwdAlgoGEMM:GemmFwd1x1_0_1,0.23024,0,miopenConvolutionFwdAlgoGEMM,<unused>
1024-14-14-1x1-512-14-14-32-0x0-1x1-1x1-0-NCHW-FP16-F=miopenConvolutionFwdAlgoImplicitGEMM:ConvHipImplicitGemmV4R1Fwd,0.666081,0,miopenConvolutionFwdAlgoImplicitGEMM,<unused>;miopenConvolutionFwdAlgoDirect:ConvAsm1x1U,0.633441,0,miopenConvolutionFwdAlgoDirect,<unused>;miopenConvolutionFwdAlgoWinograd:ConvBinWinogradRxSf3x2,1.26592,0,miopenConvolutionFwdAlgoWinograd,<unused>;miopenConvolutionFwdAlgoGEMM:GemmFwd1x1_0_1,0.629281,0,miopenConvolutionFwdAlgoGEMM,<unused>
512-7-7-1x1-128-7-7-32-0x0-1x1-1x1-0-NCHW-FP16-F=miopenConvolutionFwdAlgoImplicitGEMM:ConvHipImplicitGemmV4R1Fwd,0.07552,0,miopenConvolutionFwdAlgoImplicitGEMM,<unused>;miopenConvolutionFwdAlgoDirect:ConvAsm1x1U,0.06032,0,miopenConvolutionFwdAlgoDirect,<unused>;miopenConvolutionFwdAlgoWinograd:ConvBinWinogradRxSf3x2,0.14784,0,miopenConvolutionFwdAlgoWinograd,<unused>;miopenConvolutionFwdAlgoGEMM:GemmFwd1x1_0_1,0.136961,0,miopenConvolutionFwdAlgoGEMM,<unused>
128-7-7-3x3-32-7-7-32-1x1-1x1-1x1-0-NCHW-FP16-F=miopenConvolutionFwdAlgoImplicitGEMM:ConvHipImplicitGemmV4R1Fwd,0.11744,0,miopenConvolutionFwdAlgoImplicitGEMM,<unused>;miopenConvolutionFwdAlgoDirect:ConvOclDirectFwd,0.355041,0,miopenConvolutionFwdAlgoDirect,<unused>;miopenConvolutionFwdAlgoWinograd:ConvBinWinogradRxSf2x3g1,0.03696,0,miopenConvolutionFwdAlgoWinograd,<unused>;miopenConvolutionFwdAlgoGEMM:GemmFwdRest,7.0912,112896,miopenConvolutionFwdAlgoGEMM,<unused>
544-7-7-1x1-128-7-7-32-0x0-1x1-1x1-0-NCHW-FP16-F=miopenConvolutionFwdAlgoImplicitGEMM:ConvHipImplicitGemmV4R1Fwd,0.06752,0,miopenConvolutionFwdAlgoImplicitGEMM,<unused>;miopenConvolutionFwdAlgoDirect:ConvAsm1x1U,0.08128,0,miopenConvolutionFwdAlgoDirect,<unused>;miopenConvolutionFwdAlgoWinograd:ConvBinWinogradRxSf3x2,0.15936,0,miopenConvolutionFwdAlgoWinograd,<unused>;miopenConvolutionFwdAlgoGEMM:GemmFwd1x1_0_1,0.133601,0,miopenConvolutionFwdAlgoGEMM,<unused>
576-7-7-1x1-128-7-7-32-0x0-1x1-1x1-0-NCHW-FP16-F=miopenConvolutionFwdAlgoImplicitGEMM:ConvHipImplicitGemmV4R1Fwd,0.076,0,miopenConvolutionFwdAlgoImplicitGEMM,<unused>;miopenConvolutionFwdAlgoDirect:ConvAsm1x1U,0.0592,0,miopenConvolutionFwdAlgoDirect,<unused>;miopenConvolutionFwdAlgoWinograd:ConvBinWinogradRxSf3x2,0.1584,0,miopenConvolutionFwdAlgoWinograd,<unused>;miopenConvolutionFwdAlgoGEMM:GemmFwd1x1_0_1,0.156001,0,miopenConvolutionFwdAlgoGEMM,<unused>
608-7-7-1x1-128-7-7-32-0x0-1x1-1x1-0-NCHW-FP16-F=miopenConvolutionFwdAlgoImplicitGEMM:ConvHipImplicitGemmV4R1Fwd,0.07344,0,miopenConvolutionFwdAlgoImplicitGEMM,<unused>;miopenConvolutionFwdAlgoDirect:ConvAsm1x1U,0.06192,0,miopenConvolutionFwdAlgoDirect,<unused>;miopenConvolutionFwdAlgoWinograd:ConvBinWinogradRxSf3x2,0.167521,0,miopenConvolutionFwdAlgoWinograd,<unused>;miopenConvolutionFwdAlgoGEMM:GemmFwd1x1_0_1,0.15808,0,miopenConvolutionFwdAlgoGEMM,<unused>
640-7-7-1x1-128-7-7-32-0x0-1x1-1x1-0-NCHW-FP16-F=miopenConvolutionFwdAlgoImplicitGEMM:ConvHipImplicitGemmV4R1Fwd,0.08432,0,miopenConvolutionFwdAlgoImplicitGEMM,<unused>;miopenConvolutionFwdAlgoDirect:ConvAsm1x1U,0.05888,0,miopenConvolutionFwdAlgoDirect,<unused>;miopenConvolutionFwdAlgoWinograd:ConvBinWinogradRxSf3x2,0.13344,0,miopenConvolutionFwdAlgoWinograd,<unused>;miopenConvolutionFwdAlgoGEMM:GemmFwd1x1_0_1,0.159201,0,miopenConvolutionFwdAlgoGEMM,<unused>
672-7-7-1x1-128-7-7-32-0x0-1x1-1x1-0-NCHW-FP16-F=miopenConvolutionFwdAlgoImplicitGEMM:ConvHipImplicitGemmV4R1Fwd,0.08176,0,miopenConvolutionFwdAlgoImplicitGEMM,<unused>;miopenConvolutionFwdAlgoDirect:ConvAsm1x1U,0.06752,0,miopenConvolutionFwdAlgoDirect,<unused>;miopenConvolutionFwdAlgoWinograd:ConvBinWinogradRxSf3x2,0.17056,0,miopenConvolutionFwdAlgoWinograd,<unused>;miopenConvolutionFwdAlgoGEMM:GemmFwd1x1_0_1,0.16768,0,miopenConvolutionFwdAlgoGEMM,<unused>
704-7-7-1x1-128-7-7-32-0x0-1x1-1x1-0-NCHW-FP16-F=miopenConvolutionFwdAlgoImplicitGEMM:ConvHipImplicitGemmV4R1Fwd,0.0888,0,miopenConvolutionFwdAlgoImplicitGEMM,<unused>;miopenConvolutionFwdAlgoDirect:ConvAsm1x1U,0.064,0,miopenConvolutionFwdAlgoDirect,<unused>;miopenConvolutionFwdAlgoWinograd:ConvBinWinogradRxSf3x2,0.14368,0,miopenConvolutionFwdAlgoWinograd,<unused>;miopenConvolutionFwdAlgoGEMM:GemmFwd1x1_0_1,0.163041,0,miopenConvolutionFwdAlgoGEMM,<unused>
736-7-7-1x1-128-7-7-32-0x0-1x1-1x1-0-NCHW-FP16-F=miopenConvolutionFwdAlgoImplicitGEMM:ConvHipImplicitGemmV4R1Fwd,0.08624,0,miopenConvolutionFwdAlgoImplicitGEMM,<unused>;miopenConvolutionFwdAlgoDirect:ConvAsm1x1U,0.07216,0,miopenConvolutionFwdAlgoDirect,<unused>;miopenConvolutionFwdAlgoWinograd:ConvBinWinogradRxSf3x2,0.14896,0,miopenConvolutionFwdAlgoWinograd,<unused>;miopenConvolutionFwdAlgoGEMM:GemmFwd1x1_0_1,0.17776,0,miopenConvolutionFwdAlgoGEMM,<unused>
768-7-7-1x1-128-7-7-32-0x0-1x1-1x1-0-NCHW-FP16-F=miopenConvolutionFwdAlgoImplicitGEMM:ConvHipImplicitGemmV4R1Fwd,0.10352,0,miopenConvolutionFwdAlgoImplicitGEMM,<unused>;miopenConvolutionFwdAlgoDirect:ConvAsm1x1U,0.0744,0,miopenConvolutionFwdAlgoDirect,<unused>;miopenConvolutionFwdAlgoWinograd:ConvBinWinogradRxSf3x2,0.15328,0,miopenConvolutionFwdAlgoWinograd,<unused>;miopenConvolutionFwdAlgoGEMM:GemmFwd1x1_0_1,0.17472,0,miopenConvolutionFwdAlgoGEMM,<unused>
800-7-7-1x1-128-7-7-32-0x0-1x1-1x1-0-NCHW-FP16-F=miopenConvolutionFwdAlgoImplicitGEMM:ConvHipImplicitGemmV4R1Fwd,0.092,0,miopenConvolutionFwdAlgoImplicitGEMM,<unused>;miopenConvolutionFwdAlgoDirect:ConvAsm1x1U,0.1104,0,miopenConvolutionFwdAlgoDirect,<unused>;miopenConvolutionFwdAlgoWinograd:ConvBinWinogradRxSf3x2,0.20432,0,miopenConvolutionFwdAlgoWinograd,<unused>;miopenConvolutionFwdAlgoGEMM:GemmFwd1x1_0_1,0.19632,0,miopenConvolutionFwdAlgoGEMM,<unused>
832-7-7-1x1-128-7-7-32-0x0-1x1-1x1-0-NCHW-FP16-F=miopenConvolutionFwdAlgoImplicitGEMM:ConvHipImplicitGemmV4R1Fwd,0.1008,0,miopenConvolutionFwdAlgoImplicitGEMM,<unused>;miopenConvolutionFwdAlgoDirect:ConvAsm1x1U,0.07232,0,miopenConvolutionFwdAlgoDirect,<unused>;miopenConvolutionFwdAlgoWinograd:ConvBinWinogradRxSf3x2,0.19456,0,miopenConvolutionFwdAlgoWinograd,<unused>;miopenConvolutionFwdAlgoGEMM:GemmFwd1x1_0_1,0.201761,0,miopenConvolutionFwdAlgoGEMM,<unused>
864-7-7-1x1-128-7-7-32-0x0-1x1-1x1-0-NCHW-FP16-F=miopenConvolutionFwdAlgoImplicitGEMM:ConvHipImplicitGemmV4R1Fwd,0.09776,0,miopenConvolutionFwdAlgoImplicitGEMM,<unused>;miopenConvolutionFwdAlgoDirect:ConvAsm1x1U,0.11792,0,miopenConvolutionFwdAlgoDirect,<unused>;miopenConvolutionFwdAlgoWinograd:ConvBinWinogradRxSf3x2,0.22352,0,miopenConvolutionFwdAlgoWinograd,<unused>;miopenConvolutionFwdAlgoGEMM:GemmFwd1x1_0_1,0.240481,0,miopenConvolutionFwdAlgoGEMM,<unused>
896-7-7-1x1-128-7-7-32-0x0-1x1-1x1-0-NCHW-FP16-F=miopenConvolutionFwdAlgoImplicitGEMM:ConvHipImplicitGemmV4R1Fwd,0.11168,0,miopenConvolutionFwdAlgoImplicitGEMM,<unused>;miopenConvolutionFwdAlgoDirect:ConvAsm1x1U,0.12256,0,miopenConvolutionFwdAlgoDirect,<unused>;miopenConvolutionFwdAlgoWinograd:ConvBinWinogradRxSf3x2,0.171521,0,miopenConvolutionFwdAlgoWinograd,<unused>;miopenConvolutionFwdAlgoGEMM:GemmFwd1x1_0_1,0.21888,0,miopenConvolutionFwdAlgoGEMM,<unused>
928-7-7-1x1-128-7-7-32-0x0-1x1-1x1-0-NCHW-FP16-F=miopenConvolutionFwdAlgoImplicitGEMM:ConvHipImplicitGemmV4R1Fwd,0.10432,0,miopenConvolutionFwdAlgoImplicitGEMM,<unused>;miopenConvolutionFwdAlgoDirect:ConvAsm1x1U,0.07872,0,miopenConvolutionFwdAlgoDirect,<unused>;miopenConvolutionFwdAlgoWinograd:ConvBinWinogradRxSf3x2,0.216,0,miopenConvolutionFwdAlgoWinograd,<unused>;miopenConvolutionFwdAlgoGEMM:GemmFwd1x1_0_1,0.222881,0,miopenConvolutionFwdAlgoGEMM,<unused>
960-7-7-1x1-128-7-7-32-0x0-1x1-1x1-0-NCHW-FP16-F=miopenConvolutionFwdAlgoImplicitGEMM:ConvHipImplicitGemmV4R1Fwd,0.11392,0,miopenConvolutionFwdAlgoImplicitGEMM,<unused>;miopenConvolutionFwdAlgoDirect:ConvAsm1x1U,0.128161,0,miopenConvolutionFwdAlgoDirect,<unused>;miopenConvolutionFwdAlgoWinograd:ConvBinWinogradRxSf3x2,0.22256,0,miopenConvolutionFwdAlgoWinograd,<unused>;miopenConvolutionFwdAlgoGEMM:GemmFwd1x1_0_1,0.235361,0,miopenConvolutionFwdAlgoGEMM,<unused>
992-7-7-1x1-128-7-7-32-0x0-1x1-1x1-0-NCHW-FP16-F=miopenConvolutionFwdAlgoImplicitGEMM:ConvHipImplicitGemmV4R1Fwd,0.11008,0,miopenConvolutionFwdAlgoImplicitGEMM,<unused>;miopenConvolutionFwdAlgoDirect:ConvAsm1x1U,0.13136,0,miopenConvolutionFwdAlgoDirect,<unused>;miopenConvolutionFwdAlgoWinograd:ConvBinWinogradRxSf3x2,0.2232,0,miopenConvolutionFwdAlgoWinograd,<unused>;miopenConvolutionFwdAlgoGEMM:GemmFwd1x1_0_1,0.2312,0,miopenConvolutionFwdAlgoGEMM,<unused>
3-299-299-3x3-32-149-149-32-0x0-2x2-1x1-0-NCHW-FP32-F=miopenConvolutionFwdAlgoImplicitGEMM:ConvMlirIgemmFwd,0.724161,0,miopenConvolutionFwdAlgoImplicitGEMM,<unused>;miopenConvolutionFwdAlgoDirect:ConvOclDirectFwd,0.57664,0,miopenConvolutionFwdAlgoDirect,<unused>;miopenConvolutionFwdAlgoWinograd:ConvBinWinogradRxSf2x3g1,0.558881,0,miopenConvolutionFwdAlgoWinograd,<unused>;miopenConvolutionFwdAlgoGEMM:GemmFwdRest,2.80576,2397708,miopenConvolutionFwdAlgoGEMM,<unused>
32-149-149-3x3-32-147-147-32-0x0-1x1-1x1-0-NCHW-FP32-F=miopenConvolutionFwdAlgoImplicitGEMM:ConvHipImplicitGemmV4R4Fwd,1.40576,0,miopenConvolutionFwdAlgoImplicitGEMM,<unused>;miopenConvolutionFwdAlgoDirect:ConvOclDirectFwd,4.12352,0,miopenConvolutionFwdAlgoDirect,<unused>;miopenConvolutionFwdAlgoWinograd:ConvBinWinogradRxSf2x3g1,0.837441,0,miopenConvolutionFwdAlgoWinograd,<unused>;miopenConvolutionFwdAlgoGEMM:GemmFwdRest,8.02304,24893568,miopenConvolutionFwdAlgoGEMM,<unused>
32-147-147-3x3-64-147-147-32-1x1-1x1-1x1-0-NCHW-FP32-F=miopenConvolutionFwdAlgoWinograd:ConvBinWinogradRxS,1.53232,0,miopenConvolutionFwdAlgoWinograd,<unused>
64-73-73-1x1-80-73-73-32-0x0-1x1-1x1-0-NCHW-FP32-F=miopenConvolutionFwdAlgoImplicitGEMM:ConvMlirIgemmFwd,0.714881,0,miopenConvolutionFwdAlgoImplicitGEMM,<unused>;miopenConvolutionFwdAlgoDirect:ConvAsm1x1U,0.27888,0,miopenConvolutionFwdAlgoDirect,<unused>;miopenConvolutionFwdAlgoWinograd:ConvBinWinogradRxSf3x2,0.809281,0,miopenConvolutionFwdAlgoWinograd,<unused>;miopenConvolutionFwdAlgoGEMM:GemmFwd1x1_0_1,0.44592,0,miopenConvolutionFwdAlgoGEMM,<unused>
80-73-73-3x3-192-71-71-32-0x0-1x1-1x1-0-NCHW-FP32-F=miopenConvolutionFwdAlgoImplicitGEMM:ConvHipImplicitGemmV4R1Fwd,4.62208,0,miopenConvolutionFwdAlgoImplicitGEMM,<unused>;miopenConvolutionFwdAlgoDirect:ConvOclDirectFwd,10.3619,0,miopenConvolutionFwdAlgoDirect,<unused>;miopenConvolutionFwdAlgoWinograd:ConvBinWinogradRxS,2.07824,0,miopenConvolutionFwdAlgoWinograd,<unused>;miopenConvolutionFwdAlgoGEMM:GemmFwdRest,8.4992,14518080,miopenConvolutionFwdAlgoGEMM,<unused>
192-35-35-1x1-128-35-35-32-0x0-1x1-1x1-0-NCHW-FP32-F=miopenConvolutionFwdAlgoImplicitGEMM:ConvHipImplicitGemmV4R1Fwd,0.282561,0,miopenConvolutionFwdAlgoImplicitGEMM,<unused>;miopenConvolutionFwdAlgoDirect:ConvAsm1x1U,0.25888,0,miopenConvolutionFwdAlgoDirect,<unused>;miopenConvolutionFwdAlgoWinograd:ConvBinWinogradRxSf3x2,0.460161,0,miopenConvolutionFwdAlgoWinograd,<unused>;miopenConvolutionFwdAlgoGEMM:GemmFwd1x1_0_1,0.26656,0,miopenConvolutionFwdAlgoGEMM,<unused>
192-35-35-1x1-48-35-35-32-0x0-1x1-1x1-0-NCHW-FP32-F=miopenConvolutionFwdAlgoImplicitGEMM:ConvMlirIgemmFwd,0.324001,0,miopenConvolutionFwdAlgoImplicitGEMM,<unused>;miopenConvolutionFwdAlgoDirect:ConvAsm1x1U,0.12768,0,miopenConvolutionFwdAlgoDirect,<unused>;miopenConvolutionFwdAlgoWinograd:ConvBinWinogradRxSf3x2,0.2984,0,miopenConvolutionFwdAlgoWinograd,<unused>;miopenConvolutionFwdAlgoGEMM:GemmFwd1x1_0_1,0.22064,0,miopenConvolutionFwdAlgoGEMM,<unused>
48-35-35-5x5-64-35-35-32-2x2-1x1-1x1-0-NCHW-FP32-F=miopenConvolutionFwdAlgoImplicitGEMM:ConvHipImplicitGemmV4R1Fwd,0.698241,0,miopenConvolutionFwdAlgoImplicitGEMM,<unused>;miopenConvolutionFwdAlgoDirect:ConvOclDirectFwd,2.0936,0,miopenConvolutionFwdAlgoDirect,<unused>;miopenConvolutionFwdAlgoWinograd:ConvBinWinogradRxSf2x3g1,0.47088,0,miopenConvolutionFwdAlgoWinograd,<unused>;miopenConvolutionFwdAlgoGEMM:GemmFwdRest,2.6368,5880000,miopenConvolutionFwdAlgoGEMM,<unused>
64-35-35-3x3-96-35-35-32-1x1-1x1-1x1-0-NCHW-FP32-F=miopenConvolutionFwdAlgoWinograd:ConvBinWinogradRxS,0.28512,0,miopenConvolutionFwdAlgoWinograd,<unused>
96-35-35-3x3-96-35-35-32-1x1-1x1-1x1-0-NCHW-FP32-F=miopenConvolutionFwdAlgoWinograd:ConvBinWinogradRxSf2x3g1,0.3816,0,miopenConvolutionFwdAlgoWinograd,<unused>
192-35-35-1x1-32-35-35-32-0x0-1x1-1x1-0-NCHW-FP32-F=miopenConvolutionFwdAlgoImplicitGEMM:ConvHipImplicitGemmV4R4Fwd,0.10432,0,miopenConvolutionFwdAlgoImplicitGEMM,<unused>;miopenConvolutionFwdAlgoDirect:ConvAsm1x1U,0.08048,0,miopenConvolutionFwdAlgoDirect,<unused>;miopenConvolutionFwdAlgoWinograd:ConvBinWinogradRxSf3x2,0.18896,0,miopenConvolutionFwdAlgoWinograd,<unused>;miopenConvolutionFwdAlgoGEMM:GemmFwd1x1_0_1,0.16864,0,miopenConvolutionFwdAlgoGEMM,<unused>
256-35-35-1x1-128-35-35-32-0x0-1x1-1x1-0-NCHW-FP32-F=miopenConvolutionFwdAlgoImplicitGEMM:ConvHipImplicitGemmV4R1Fwd,0.38496,0,miopenConvolutionFwdAlgoImplicitGEMM,<unused>;miopenConvolutionFwdAlgoDirect:ConvAsm1x1U,0.34,0,miopenConvolutionFwdAlgoDirect,<unused>;miopenConvolutionFwdAlgoWinograd:ConvBinWinogradRxSf3x2,0.582241,0,miopenConvolutionFwdAlgoWinograd,<unused>;miopenConvolutionFwdAlgoGEMM:GemmFwd1x1_0_1,0.33488,0,miopenConvolutionFwdAlgoGEMM,<unused>
256-35-35-1x1-48-35-35-32-0x0-1x1-1x1-0-NCHW-FP32-F=miopenConvolutionFwdAlgoImplicitGEMM:ConvMlirIgemmFwd,0.416,0,miopenConvolutionFwdAlgoImplicitGEMM,<unused>;miopenConvolutionFwdAlgoDirect:ConvAsm1x1U,0.15744,0,miopenConvolutionFwdAlgoDirect,<unused>;miopenConvolutionFwdAlgoWinograd:ConvBinWinogradRxSf3x2,0.30864,0,miopenConvolutionFwdAlgoWinograd,<unused>;miopenConvolutionFwdAlgoGEMM:GemmFwd1x1_0_1,0.23504,0,miopenConvolutionFwdAlgoGEMM,<unused>
256-35-35-1x1-64-35-35-32-0x0-1x1-1x1-0-NCHW-FP32-F=miopenConvolutionFwdAlgoImplicitGEMM:ConvHipImplicitGemmV4R1Fwd,0.2168,0,miopenConvolutionFwdAlgoImplicitGEMM,<unused>;miopenConvolutionFwdAlgoDirect:ConvAsm1x1U,0.17968,0,miopenConvolutionFwdAlgoDirect,<unused>;miopenConvolutionFwdAlgoWinograd:ConvBinWinogradRxSf3x2,0.3376,0,miopenConvolutionFwdAlgoWinograd,<unused>;miopenConvolutionFwdAlgoGEMM:GemmFwd1x1_0_1,0.24544,0,miopenConvolutionFwdAlgoGEMM,<unused>
288-35-35-1x1-128-35-35-32-0x0-1x1-1x1-0-NCHW-FP32-F=miopenConvolutionFwdAlgoImplicitGEMM:ConvHipImplicitGemmV4R4Fwd,0.342881,0,miopenConvolutionFwdAlgoImplicitGEMM,<unused>;miopenConvolutionFwdAlgoDirect:ConvAsm1x1U,0.36448,0,miopenConvolutionFwdAlgoDirect,<unused>;miopenConvolutionFwdAlgoWinograd:ConvBinWinogradRxSf3x2,0.852481,0,miopenConvolutionFwdAlgoWinograd,<unused>;miopenConvolutionFwdAlgoGEMM:GemmFwd1x1_0_1,0.38912,0,miopenConvolutionFwdAlgoGEMM,<unused>
288-35-35-1x1-48-35-35-32-0x0-1x1-1x1-0-NCHW-FP32-F=miopenConvolutionFwdAlgoImplicitGEMM:ConvMlirIgemmFwd,0.422241,0,miopenConvolutionFwdAlgoImplicitGEMM,<unused>;miopenConvolutionFwdAlgoDirect:ConvAsm1x1U,0.17648,0,miopenConvolutionFwdAlgoDirect,<unused>;miopenConvolutionFwdAlgoWinograd:ConvBinWinogradRxSf3x2,0.416,0,miopenConvolutionFwdAlgoWinograd,<unused>;miopenConvolutionFwdAlgoGEMM:GemmFwd1x1_0_1,0.23216,0,miopenConvolutionFwdAlgoGEMM,<unused>
288-35-35-1x1-64-35-35-32-0x0-1x1-1x1-0-NCHW-FP32-F=miopenConvolutionFwdAlgoImplicitGEMM:ConvHipImplicitGemmV4R4Fwd,0.18464,0,miopenConvolutionFwdAlgoImplicitGEMM,<unused>;miopenConvolutionFwdAlgoDirect:ConvAsm1x1U,0.199681,0,miopenConvolutionFwdAlgoDirect,<unused>;miopenConvolutionFwdAlgoWinograd:ConvBinWinogradRxSf3x2,0.41216,0,miopenConvolutionFwdAlgoWinograd,<unused>;miopenConvolutionFwdAlgoGEMM:GemmFwd1x1_0_1,0.23648,0,miopenConvolutionFwdAlgoGEMM,<unused>
288-35-35-3x3-384-17-17-32-0x0-2x2-1x1-0-NCHW-FP32-F=miopenConvolutionFwdAlgoImplicitGEMM:ConvHipImplicitGemmV4R1Fwd,1.96096,0,miopenConvolutionFwdAlgoImplicitGEMM,<unused>;miopenConvolutionFwdAlgoDirect:ConvOclDirectFwd,40.2807,0,miopenConvolutionFwdAlgoDirect,<unused>;miopenConvolutionFwdAlgoWinograd:ConvBinWinogradRxS,3.65488,0,miopenConvolutionFwdAlgoWinograd,<unused>;miopenConvolutionFwdAlgoGEMM:GemmFwdRest,4.31616,2996352,miopenConvolutionFwdAlgoGEMM,<unused>
96-35-35-3x3-96-17-17-32-0x0-2x2-1x1-0-NCHW-FP32-F=miopenConvolutionFwdAlgoImplicitGEMM:ConvHipImplicitGemmV4R4Fwd,0.22192,0,miopenConvolutionFwdAlgoImplicitGEMM,<unused>;miopenConvolutionFwdAlgoDirect:ConvOclDirectFwd,1.71168,0,miopenConvolutionFwdAlgoDirect,<unused>;miopenConvolutionFwdAlgoWinograd:ConvBinWinogradRxS,0.44912,0,miopenConvolutionFwdAlgoWinograd,<unused>;miopenConvolutionFwdAlgoGEMM:GemmFwdRest,2.11968,998784,miopenConvolutionFwdAlgoGEMM,<unused>
768-17-17-1x1-256-17-17-32-0x0-1x1-1x1-0-NCHW-FP32-F=miopenConvolutionFwdAlgoImplicitGEMM:ConvHipImplicitGemmV4R4Fwd,0.5776,0,miopenConvolutionFwdAlgoImplicitGEMM,<unused>;miopenConvolutionFwdAlgoDirect:ConvAsm1x1U,0.50896,0,miopenConvolutionFwdAlgoDirect,<unused>;miopenConvolutionFwdAlgoWinograd:ConvBinWinogradRxSf3x2,0.80112,0,miopenConvolutionFwdAlgoWinograd,<unused>;miopenConvolutionFwdAlgoGEMM:GemmFwd1x1_0_1,0.47888,0,miopenConvolutionFwdAlgoGEMM,<unused>
768-17-17-1x1-192-17-17-32-0x0-1x1-1x1-0-NCHW-FP32-F=miopenConvolutionFwdAlgoImplicitGEMM:ConvHipImplicitGemmV4R4Fwd,0.462881,0,miopenConvolutionFwdAlgoImplicitGEMM,<unused>;miopenConvolutionFwdAlgoDirect:ConvAsm1x1U,0.5168,0,miopenConvolutionFwdAlgoDirect,<unused>;miopenConvolutionFwdAlgoWinograd:ConvBinWinogradRxSf3x2,0.64736,0,miopenConvolutionFwdAlgoWinograd,<unused>;miopenConvolutionFwdAlgoGEMM:GemmFwd1x1_0_1,0.3472,0,miopenConvolutionFwdAlgoGEMM,<unused>
128-17-17-1x7-128-17-17-32-0x3-1x1-1x1-0-NCHW-FP32-F=miopenConvolutionFwdAlgoImplicitGEMM:ConvHipImplicitGemmV4R1Fwd,0.2968,0,miopenConvolutionFwdAlgoImplicitGEMM,<unused>;miopenConvolutionFwdAlgoDirect:ConvDirectNaiveConvFwd,5.5384,0,miopenConvolutionFwdAlgoDirect,<unused>;miopenConvolutionFwdAlgoWinograd:ConvBinWinogradRxSf3x2,0.36672,0,miopenConvolutionFwdAlgoWinograd,<unused>;miopenConvolutionFwdAlgoGEMM:GemmFwdRest,1.82784,1035776,miopenConvolutionFwdAlgoGEMM,<unused>
128-17-17-7x1-192-17-17-32-3x0-1x1-1x1-0-NCHW-FP32-F=miopenConvolutionFwdAlgoImplicitGEMM:ConvHipImplicitGemmV4R4Fwd,0.4272,0,miopenConvolutionFwdAlgoImplicitGEMM,<unused>;miopenConvolutionFwdAlgoDirect:ConvDirectNaiveConvFwd,12.1013,0,miopenConvolutionFwdAlgoDirect,<unused>;miopenConvolutionFwdAlgoWinograd:ConvBinWinogradRxSf3x2,0.5096,0,miopenConvolutionFwdAlgoWinograd,<unused>;miopenConvolutionFwdAlgoGEMM:GemmFwdRest,2.2016,1035776,miopenConvolutionFwdAlgoGEMM,<unused>
128-17-17-7x1-128-17-17-32-3x0-1x1-1x1-0-NCHW-FP32-F=miopenConvolutionFwdAlgoImplicitGEMM:ConvHipImplicitGemmV4R4Fwd,0.29792,0,miopenConvolutionFwdAlgoImplicitGEMM,<unused>;miopenConvolutionFwdAlgoDirect:ConvDirectNaiveConvFwd,8.7192,0,miopenConvolutionFwdAlgoDirect,<unused>;miopenConvolutionFwdAlgoWinograd:ConvBinWinogradRxSf3x2,0.35408,0,miopenConvolutionFwdAlgoWinograd,<unused>;miopenConvolutionFwdAlgoGEMM:GemmFwdRest,1.7664,1035776,miopenConvolutionFwdAlgoGEMM,<unused>
128-17-17-1x7-192-17-17-32-0x3-1x1-1x1-0-NCHW-FP32-F=miopenConvolutionFwdAlgoImplicitGEMM:ConvHipImplicitGemmV4R1Fwd,0.4064,0,miopenConvolutionFwdAlgoImplicitGEMM,<unused>;miopenConvolutionFwdAlgoDirect:ConvDirectNaiveConvFwd,7.60624,0,miopenConvolutionFwdAlgoDirect,<unused>;miopenConvolutionFwdAlgoWinograd:ConvBinWinogradRxSf3x2,0.455681,0,miopenConvolutionFwdAlgoWinograd,<unused>;miopenConvolutionFwdAlgoGEMM:GemmFwdRest,1.5872,1035776,miopenConvolutionFwdAlgoGEMM,<unused>
768-17-17-1x1-320-17-17-32-0x0-1x1-1x1-0-NCHW-FP32-F=miopenConvolutionFwdAlgoImplicitGEMM:ConvHipImplicitGemmV4R1Fwd,0.7328,0,miopenConvolutionFwdAlgoImplicitGEMM,<unused>;miopenConvolutionFwdAlgoDirect:ConvOclDirectFwd1x1,0.55456,0,miopenConvolutionFwdAlgoDirect,<unused>;miopenConvolutionFwdAlgoWinograd:ConvBinWinogradRxSf3x2,0.9816,0,miopenConvolutionFwdAlgoWinograd,<unused>;miopenConvolutionFwdAlgoGEMM:GemmFwd1x1_0_1,0.56416,0,miopenConvolutionFwdAlgoGEMM,<unused>
160-17-17-1x7-160-17-17-32-0x3-1x1-1x1-0-NCHW-FP32-F=miopenConvolutionFwdAlgoImplicitGEMM:ConvHipImplicitGemmV4R1Fwd,0.4288,0,miopenConvolutionFwdAlgoImplicitGEMM,<unused>;miopenConvolutionFwdAlgoDirect:ConvDirectNaiveConvFwd,8.05104,0,miopenConvolutionFwdAlgoDirect,<unused>;miopenConvolutionFwdAlgoWinograd:ConvBinWinogradRxSf3x2,0.42704,0,miopenConvolutionFwdAlgoWinograd,<unused>;miopenConvolutionFwdAlgoGEMM:GemmFwdRest,2.00704,1294720,miopenConvolutionFwdAlgoGEMM,<unused>
160-17-17-7x1-192-17-17-32-3x0-1x1-1x1-0-NCHW-FP32-F=miopenConvolutionFwdAlgoImplicitGEMM:ConvHipImplicitGemmV4R4Fwd,0.49312,0,miopenConvolutionFwdAlgoImplicitGEMM,<unused>;miopenConvolutionFwdAlgoDirect:ConvDirectNaiveConvFwd,14.7899,0,miopenConvolutionFwdAlgoDirect,<unused>;miopenConvolutionFwdAlgoWinograd:ConvBinWinogradRxSf3x2,0.61952,0,miopenConvolutionFwdAlgoWinograd,<unused>;miopenConvolutionFwdAlgoGEMM:GemmFwdRest,2.40128,1294720,miopenConvolutionFwdAlgoGEMM,<unused>
160-17-17-7x1-160-17-17-32-3x0-1x1-1x1-0-NCHW-FP32-F=miopenConvolutionFwdAlgoImplicitGEMM:ConvHipImplicitGemmV4R4Fwd,0.46112,0,miopenConvolutionFwdAlgoImplicitGEMM,<unused>;miopenConvolutionFwdAlgoDirect:ConvDirectNaiveConvFwd,12.8171,0,miopenConvolutionFwdAlgoDirect,<unused>;miopenConvolutionFwdAlgoWinograd:ConvBinWinogradRxSf3x2,0.43152,0,miopenConvolutionFwdAlgoWinograd,<unused>;miopenConvolutionFwdAlgoGEMM:GemmFwdRest,2.01216,1294720,miopenConvolutionFwdAlgoGEMM,<unused>
160-17-17-1x7-192-17-17-32-0x3-1x1-1x1-0-NCHW-FP32-F=miopenConvolutionFwdAlgoImplicitGEMM:ConvHipImplicitGemmV4R1Fwd,0.48768,0,miopenConvolutionFwdAlgoImplicitGEMM,<unused>;miopenConvolutionFwdAlgoDirect:ConvDirectNaiveConvFwd,9.3128,0,miopenConvolutionFwdAlgoDirect,<unused>;miopenConvolutionFwdAlgoWinograd:ConvBinWinogradRxSf3x2,0.56928,0,miopenConvolutionFwdAlgoWinograd,<unused>;miopenConvolutionFwdAlgoGEMM:GemmFwdRest,2.4832,1294720,miopenConvolutionFwdAlgoGEMM,<unused>
768-17-17-1x1-576-17-17-32-0x0-1x1-1x1-0-NCHW-FP32-F=miopenConvolutionFwdAlgoImplicitGEMM:ConvHipImplicitGemmV4R1Fwd,1.17184,0,miopenConvolutionFwdAlgoImplicitGEMM,<unused>;miopenConvolutionFwdAlgoDirect:ConvAsm1x1U,0.99168,0,miopenConvolutionFwdAlgoDirect,<unused>;miopenConvolutionFwdAlgoWinograd:ConvBinWinogradRxSf3x2,1.71296,0,miopenConvolutionFwdAlgoWinograd,<unused>;miopenConvolutionFwdAlgoGEMM:GemmFwd1x1_0_1,1.07136,0,miopenConvolutionFwdAlgoGEMM,<unused>
192-17-17-1x7-192-17-17-32-0x3-1x1-1x1-0-NCHW-FP32-F=miopenConvolutionFwdAlgoImplicitGEMM:ConvHipImplicitGemmV4R1Fwd,0.584,0,miopenConvolutionFwdAlgoImplicitGEMM,<unused>;miopenConvolutionFwdAlgoDirect:ConvDirectNaiveConvFwd,10.876,0,miopenConvolutionFwdAlgoDirect,<unused>;miopenConvolutionFwdAlgoWinograd:ConvBinWinogradRxSf3x2,0.65216,0,miopenConvolutionFwdAlgoWinograd,<unused>;miopenConvolutionFwdAlgoGEMM:GemmFwdRest,2.23744,1553664,miopenConvolutionFwdAlgoGEMM,<unused>
192-17-17-7x1-192-17-17-32-3x0-1x1-1x1-0-NCHW-FP32-F=miopenConvolutionFwdAlgoImplicitGEMM:ConvHipImplicitGemmV4R4Fwd,0.60528,0,miopenConvolutionFwdAlgoImplicitGEMM,<unused>;miopenConvolutionFwdAlgoDirect:ConvDirectNaiveConvFwd,17.6885,0,miopenConvolutionFwdAlgoDirect,<unused>;miopenConvolutionFwdAlgoWinograd:ConvBinWinogradRxSf3x2,0.65632,0,miopenConvolutionFwdAlgoWinograd,<unused>;miopenConvolutionFwdAlgoGEMM:GemmFwdRest,2.26304,1553664,miopenConvolutionFwdAlgoGEMM,<unused>
768-17-17-1x1-384-17-17-32-0x0-1x1-1x1-0-NCHW-FP32-F=miopenConvolutionFwdAlgoImplicitGEMM:ConvHipImplicitGemmV4R4Fwd,0.84208,0,miopenConvolutionFwdAlgoImplicitGEMM,<unused>;miopenConvolutionFwdAlgoDirect:ConvOclDirectFwd1x1,0.62192,0,miopenConvolutionFwdAlgoDirect,<unused>;miopenConvolutionFwdAlgoWinograd:ConvBinWinogradRxSf3x2,1.34416,0,miopenConvolutionFwdAlgoWinograd,<unused>;miopenConvolutionFwdAlgoGEMM:GemmFwd1x1_0_1,0.65456,0,miopenConvolutionFwdAlgoGEMM,<unused>
192-17-17-3x3-320-8-8-32-0x0-2x2-1x1-0-NCHW-FP32-F=miopenConvolutionFwdAlgoImplicitGEMM:ConvHipImplicitGemmV4R1Fwd,0.29888,0,miopenConvolutionFwdAlgoImplicitGEMM,<unused>;miopenConvolutionFwdAlgoDirect:ConvOclDirectFwd,1.32912,0,miopenConvolutionFwdAlgoDirect,<unused>;miopenConvolutionFwdAlgoWinograd:ConvBinWinogradRxSf2x3g1,0.50752,0,miopenConvolutionFwdAlgoWinograd,<unused>;miopenConvolutionFwdAlgoGEMM:GemmFwdRest,2.6624,442368,miopenConvolutionFwdAlgoGEMM,<unused>
192-17-17-3x3-192-8-8-32-0x0-2x2-1x1-0-NCHW-FP32-F=miopenConvolutionFwdAlgoImplicitGEMM:ConvHipImplicitGemmV4R1Fwd,0.264,0,miopenConvolutionFwdAlgoImplicitGEMM,<unused>;miopenConvolutionFwdAlgoDirect:ConvOclDirectFwd,0.80624,0,miopenConvolutionFwdAlgoDirect,<unused>;miopenConvolutionFwdAlgoWinograd:ConvBinWinogradRxSf2x3g1,0.35536,0,miopenConvolutionFwdAlgoWinograd,<unused>;miopenConvolutionFwdAlgoGEMM:GemmFwdRest,3.05664,442368,miopenConvolutionFwdAlgoGEMM,<unused>
1280-8-8-1x1-320-8-8-32-0x0-1x1-1x1-0-NCHW-FP32-F=miopenConvolutionFwdAlgoImplicitGEMM:ConvHipImplicitGemmV4R4Fwd,0.20992,0,miopenConvolutionFwdAlgoImplicitGEMM,<unused>;miopenConvolutionFwdAlgoDirect:ConvAsm1x1U,0.26512,0,miopenConvolutionFwdAlgoDirect,<unused>;miopenConvolutionFwdAlgoWinograd:ConvBinWinogradRxSf3x2,0.57168,0,miopenConvolutionFwdAlgoWinograd,<unused>;miopenConvolutionFwdAlgoGEMM:GemmFwd1x1_0_1,0.51856,0,miopenConvolutionFwdAlgoGEMM,<unused>
1280-8-8-1x1-384-8-8-32-0x0-1x1-1x1-0-NCHW-FP32-F=miopenConvolutionFwdAlgoImplicitGEMM:ConvHipImplicitGemmV4R4Fwd,0.2624,0,miopenConvolutionFwdAlgoImplicitGEMM,<unused>;miopenConvolutionFwdAlgoDirect:ConvAsm1x1U,0.32272,0,miopenConvolutionFwdAlgoDirect,<unused>;miopenConvolutionFwdAlgoWinograd:ConvBinWinogradRxSf3x2,0.544,0,miopenConvolutionFwdAlgoWinograd,<unused>;miopenConvolutionFwdAlgoGEMM:GemmFwd1x1_0_1,0.58336,0,miopenConvolutionFwdAlgoGEMM,<unused>
384-8-8-1x3-384-8-8-32-0x1-1x1-1x1-0-NCHW-FP32-F=miopenConvolutionFwdAlgoImplicitGEMM:ConvHipImplicitGemmV4R1Fwd,0.26304,0,miopenConvolutionFwdAlgoImplicitGEMM,<unused>;miopenConvolutionFwdAlgoDirect:ConvDirectNaiveConvFwd,6.56176,0,miopenConvolutionFwdAlgoDirect,<unused>;miopenConvolutionFwdAlgoWinograd:ConvBinWinogradRxS,0.34288,0,miopenConvolutionFwdAlgoWinograd,<unused>;miopenConvolutionFwdAlgoGEMM:GemmFwdRest,1.93024,294912,miopenConvolutionFwdAlgoGEMM,<unused>
384-8-8-3x1-384-8-8-32-1x0-1x1-1x1-0-NCHW-FP32-F=miopenConvolutionFwdAlgoImplicitGEMM:ConvHipImplicitGemmV4R4Fwd,0.25296,0,miopenConvolutionFwdAlgoImplicitGEMM,<unused>;miopenConvolutionFwdAlgoDirect:ConvDirectNaiveConvFwd,8.64576,0,miopenConvolutionFwdAlgoDirect,<unused>;miopenConvolutionFwdAlgoWinograd:ConvBinWinogradRxSf2x3,0.33904,0,miopenConvolutionFwdAlgoWinograd,<unused>;miopenConvolutionFwdAlgoGEMM:GemmFwdRest,1.90464,294912,miopenConvolutionFwdAlgoGEMM,<unused>
1280-8-8-1x1-448-8-8-32-0x0-1x1-1x1-0-NCHW-FP32-F=miopenConvolutionFwdAlgoImplicitGEMM:ConvHipImplicitGemmV4R4Fwd,0.26368,0,miopenConvolutionFwdAlgoImplicitGEMM,<unused>;miopenConvolutionFwdAlgoDirect:ConvAsm1x1U,0.33184,0,miopenConvolutionFwdAlgoDirect,<unused>;miopenConvolutionFwdAlgoWinograd:ConvBinWinogradRxSf3x2,0.81648,0,miopenConvolutionFwdAlgoWinograd,<unused>;miopenConvolutionFwdAlgoGEMM:GemmFwd1x1_0_1,0.73248,0,miopenConvolutionFwdAlgoGEMM,<unused>
448-8-8-3x3-384-8-8-32-1x1-1x1-1x1-0-NCHW-FP32-F=miopenConvolutionFwdAlgoWinograd:ConvBinWinogradRxS,0.39392,0,miopenConvolutionFwdAlgoWinograd,<unused>
1280-8-8-1x1-192-8-8-32-0x0-1x1-1x1-0-NCHW-FP32-F=miopenConvolutionFwdAlgoImplicitGEMM:ConvHipImplicitGemmV4R4Fwd,0.16224,0,miopenConvolutionFwdAlgoImplicitGEMM,<unused>;miopenConvolutionFwdAlgoDirect:ConvAsm1x1U,0.185601,0,miopenConvolutionFwdAlgoDirect,<unused>;miopenConvolutionFwdAlgoWinograd:ConvBinWinogradRxSf3x2,0.29744,0,miopenConvolutionFwdAlgoWinograd,<unused>;miopenConvolutionFwdAlgoGEMM:GemmFwd1x1_0_1,0.34032,0,miopenConvolutionFwdAlgoGEMM,<unused>
2048-8-8-1x1-320-8-8-32-0x0-1x1-1x1-0-NCHW-FP32-F=miopenConvolutionFwdAlgoImplicitGEMM:ConvHipImplicitGemmV4R4Fwd,0.44256,0,miopenConvolutionFwdAlgoImplicitGEMM,<unused>;miopenConvolutionFwdAlgoDirect:ConvAsm1x1U,0.66832,0,miopenConvolutionFwdAlgoDirect,<unused>;miopenConvolutionFwdAlgoWinograd:ConvBinWinogradRxSf3x2,0.83488,0,miopenConvolutionFwdAlgoWinograd,<unused>;miopenConvolutionFwdAlgoGEMM:GemmFwd1x1_0_1,0.77072,0,miopenConvolutionFwdAlgoGEMM,<unused>
2048-8-8-1x1-384-8-8-32-0x0-1x1-1x1-0-NCHW-FP32-F=miopenConvolutionFwdAlgoImplicitGEMM:ConvHipImplicitGemmV4R4Fwd,0.43008,0,miopenConvolutionFwdAlgoImplicitGEMM,<unused>;miopenConvolutionFwdAlgoDirect:ConvAsm1x1U,0.52496,0,miopenConvolutionFwdAlgoDirect,<unused>;miopenConvolutionFwdAlgoWinograd:ConvBinWinogradRxSf3x2,0.85104,0,miopenConvolutionFwdAlgoWinograd,<unused>;miopenConvolutionFwdAlgoGEMM:GemmFwd1x1_0_1,0.82848,0,miopenConvolutionFwdAlgoGEMM,<unused>
2048-8-8-1x1-448-8-8-32-0x0-1x1-1x1-0-NCHW-FP32-F=miopenConvolutionFwdAlgoImplicitGEMM:ConvHipImplicitGemmV4R4Fwd,0.46496,0,miopenConvolutionFwdAlgoImplicitGEMM,<unused>;miopenConvolutionFwdAlgoDirect:ConvAsm1x1U,0.5272,0,miopenConvolutionFwdAlgoDirect,<unused>;miopenConvolutionFwdAlgoWinograd:ConvBinWinogradRxSf3x2,1.2144,0,miopenConvolutionFwdAlgoWinograd,<unused>;miopenConvolutionFwdAlgoGEMM:GemmFwd1x1_0_1,0.9744,0,miopenConvolutionFwdAlgoGEMM,<unused>
2048-8-8-1x1-192-8-8-32-0x0-1x1-1x1-0-NCHW-FP32-F=miopenConvolutionFwdAlgoImplicitGEMM:ConvHipImplicitGemmV4R1Fwd,0.28224,0,miopenConvolutionFwdAlgoImplicitGEMM,<unused>;miopenConvolutionFwdAlgoDirect:ConvAsm1x1U,0.33456,0,miopenConvolutionFwdAlgoDirect,<unused>;miopenConvolutionFwdAlgoWinograd:ConvBinWinogradRxSf3x2,0.50128,0,miopenConvolutionFwdAlgoWinograd,<unused>;miopenConvolutionFwdAlgoGEMM:GemmFwd1x1_0_1,0.57248,0,miopenConvolutionFwdAlgoGEMM,<unused>
3-299-299-3x3-32-149-149-32-0x0-2x2-1x1-0-NCHW-FP16-F=miopenConvolutionFwdAlgoImplicitGEMM:ConvMlirIgemmFwd,0.830081,0,miopenConvolutionFwdAlgoImplicitGEMM,<unused>;miopenConvolutionFwdAlgoDirect:ConvOclDirectFwdGen,1.41392,0,miopenConvolutionFwdAlgoDirect,<unused>;miopenConvolutionFwdAlgoWinograd:ConvBinWinogradRxSf2x3g1,0.52336,0,miopenConvolutionFwdAlgoWinograd,<unused>;miopenConvolutionFwdAlgoGEMM:GemmFwdRest,2.43712,1198854,miopenConvolutionFwdAlgoGEMM,<unused>
32-149-149-3x3-32-147-147-32-0x0-1x1-1x1-0-NCHW-FP16-F=miopenConvolutionFwdAlgoImplicitGEMM:ConvHipImplicitGemmV4R1Fwd,1.21008,0,miopenConvolutionFwdAlgoImplicitGEMM,<unused>;miopenConvolutionFwdAlgoDirect:ConvOclDirectFwd,4.90496,0,miopenConvolutionFwdAlgoDirect,<unused>;miopenConvolutionFwdAlgoWinograd:ConvBinWinogradRxSf2x3g1,0.58464,0,miopenConvolutionFwdAlgoWinograd,<unused>;miopenConvolutionFwdAlgoGEMM:GemmFwdRest,7.98723,12446784,miopenConvolutionFwdAlgoGEMM,<unused>
32-147-147-3x3-64-147-147-32-1x1-1x1-1x1-0-NCHW-FP16-F=miopenConvolutionFwdAlgoImplicitGEMM:ConvHipImplicitGemmV4R1Fwd,2.12576,0,miopenConvolutionFwdAlgoImplicitGEMM,<unused>;miopenConvolutionFwdAlgoDirect:ConvOclDirectFwd,10.0448,0,miopenConvolutionFwdAlgoDirect,<unused>;miopenConvolutionFwdAlgoWinograd:ConvBinWinogradRxSf2x3g1,1.13024,0,miopenConvolutionFwdAlgoWinograd,<unused>;miopenConvolutionFwdAlgoGEMM:GemmFwdRest,7.96672,12446784,miopenConvolutionFwdAlgoGEMM,<unused>
64-73-73-1x1-80-73-73-32-0x0-1x1-1x1-0-NCHW-FP16-F=miopenConvolutionFwdAlgoImplicitGEMM:ConvMlirIgemmFwd,0.889441,0,miopenConvolutionFwdAlgoImplicitGEMM,<unused>;miopenConvolutionFwdAlgoDirect:ConvAsm1x1U,0.20512,0,miopenConvolutionFwdAlgoDirect,<unused>;miopenConvolutionFwdAlgoWinograd:ConvBinWinogradRxSf3x2,0.42032,0,miopenConvolutionFwdAlgoWinograd,<unused>;miopenConvolutionFwdAlgoGEMM:GemmFwd1x1_0_1,0.584481,0,miopenConvolutionFwdAlgoGEMM,<unused>
80-73-73-3x3-192-71-71-32-0x0-1x1-1x1-0-NCHW-FP16-F=miopenConvolutionFwdAlgoImplicitGEMM:ConvHipImplicitGemmV4R1Fwd,3.268,0,miopenConvolutionFwdAlgoImplicitGEMM,<unused>;miopenConvolutionFwdAlgoDirect:ConvOclDirectFwd,15.1133,0,miopenConvolutionFwdAlgoDirect,<unused>;miopenConvolutionFwdAlgoWinograd:ConvBinWinogradRxSf2x3g1,1.50272,0,miopenConvolutionFwdAlgoWinograd,<unused>;miopenConvolutionFwdAlgoGEMM:GemmFwdRest,10.6804,7259040,miopenConvolutionFwdAlgoGEMM,<unused>
192-35-35-1x1-128-35-35-32-0x0-1x1-1x1-0-NCHW-FP16-F=miopenConvolutionFwdAlgoImplicitGEMM:ConvHipImplicitGemmV4R1Fwd,0.34208,0,miopenConvolutionFwdAlgoImplicitGEMM,<unused>;miopenConvolutionFwdAlgoDirect:ConvAsm1x1U,0.21424,0,miopenConvolutionFwdAlgoDirect,<unused>;miopenConvolutionFwdAlgoWinograd:ConvBinWinogradRxSf3x2,0.31424,0,miopenConvolutionFwdAlgoWinograd,<unused>;miopenConvolutionFwdAlgoGEMM:GemmFwd1x1_0_1,0.40096,0,miopenConvolutionFwdAlgoGEMM,<unused>
192-35-35-1x1-48-35-35-32-0x0-1x1-1x1-0-NCHW-FP16-F=miopenConvolutionFwdAlgoImplicitGEMM:ConvMlirIgemmFwd,0.4008,0,miopenConvolutionFwdAlgoImplicitGEMM,<unused>;miopenConvolutionFwdAlgoDirect:ConvAsm1x1U,0.0936,0,miopenConvolutionFwdAlgoDirect,<unused>;miopenConvolutionFwdAlgoWinograd:ConvBinWinogradRxSf3x2,0.22992,0,miopenConvolutionFwdAlgoWinograd,<unused>;miopenConvolutionFwdAlgoGEMM:GemmFwd1x1_0_1,0.21216,0,miopenConvolutionFwdAlgoGEMM,<unused>
48-35-35-5x5-64-35-35-32-2x2-1x1-1x1-0-NCHW-FP16-F=miopenConvolutionFwdAlgoImplicitGEMM:ConvHipImplicitGemmV4R1Fwd,0.5248,0,miopenConvolutionFwdAlgoImplicitGEMM,<unused>;miopenConvolutionFwdAlgoDirect:ConvOclDirectFwd,3.4784,0,miopenConvolutionFwdAlgoDirect,<unused>;miopenConvolutionFwdAlgoWinograd:ConvBinWinogradRxSf2x3g1,0.308,0,miopenConvolutionFwdAlgoWinograd,<unused>;miopenConvolutionFwdAlgoGEMM:GemmFwdRest,8.22784,2940000,miopenConvolutionFwdAlgoGEMM,<unused>
64-35-35-3x3-96-35-35-32-1x1-1x1-1x1-0-NCHW-FP16-F=miopenConvolutionFwdAlgoImplicitGEMM:ConvHipImplicitGemmV4R1Fwd,0.372,0,miopenConvolutionFwdAlgoImplicitGEMM,<unused>;miopenConvolutionFwdAlgoDirect:ConvOclDirectFwd,3.11552,0,miopenConvolutionFwdAlgoDirect,<unused>;miopenConvolutionFwdAlgoWinograd:ConvBinWinogradRxSf2x3g1,0.18544,0,miopenConvolutionFwdAlgoWinograd,<unused>;miopenConvolutionFwdAlgoGEMM:GemmFwdRest,4.71552,1411200,miopenConvolutionFwdAlgoGEMM,<unused>
96-35-35-3x3-96-35-35-32-1x1-1x1-1x1-0-NCHW-FP16-F=miopenConvolutionFwdAlgoImplicitGEMM:ConvHipImplicitGemmV4R1Fwd,0.55088,0,miopenConvolutionFwdAlgoImplicitGEMM,<unused>;miopenConvolutionFwdAlgoDirect:ConvOclDirectFwd,6.5152,0,miopenConvolutionFwdAlgoDirect,<unused>;miopenConvolutionFwdAlgoWinograd:ConvBinWinogradRxSf2x3g1,0.247681,0,miopenConvolutionFwdAlgoWinograd,<unused>;miopenConvolutionFwdAlgoGEMM:GemmFwdRest,6.43584,2116800,miopenConvolutionFwdAlgoGEMM,<unused>
192-35-35-1x1-32-35-35-32-0x0-1x1-1x1-0-NCHW-FP16-F=miopenConvolutionFwdAlgoImplicitGEMM:ConvHipImplicitGemmV4R1Fwd,0.12688,0,miopenConvolutionFwdAlgoImplicitGEMM,<unused>;miopenConvolutionFwdAlgoDirect:ConvAsm1x1U,0.06992,0,miopenConvolutionFwdAlgoDirect,<unused>;miopenConvolutionFwdAlgoWinograd:ConvBinWinogradRxSf3x2,0.116,0,miopenConvolutionFwdAlgoWinograd,<unused>;miopenConvolutionFwdAlgoGEMM:GemmFwd1x1_0_1,0.20528,0,miopenConvolutionFwdAlgoGEMM,<unused>
256-35-35-1x1-128-35-35-32-0x0-1x1-1x1-0-NCHW-FP16-F=miopenConvolutionFwdAlgoImplicitGEMM:ConvHipImplicitGemmV4R1Fwd,0.456961,0,miopenConvolutionFwdAlgoImplicitGEMM,<unused>;miopenConvolutionFwdAlgoDirect:ConvAsm1x1U,0.27008,0,miopenConvolutionFwdAlgoDirect,<unused>;miopenConvolutionFwdAlgoWinograd:ConvBinWinogradRxSf3x2,0.38384,0,miopenConvolutionFwdAlgoWinograd,<unused>;miopenConvolutionFwdAlgoGEMM:GemmFwd1x1_0_1,0.494241,0,miopenConvolutionFwdAlgoGEMM,<unused>
256-35-35-1x1-48-35-35-32-0x0-1x1-1x1-0-NCHW-FP16-F=miopenConvolutionFwdAlgoImplicitGEMM:ConvMlirIgemmFwd,0.494081,0,miopenConvolutionFwdAlgoImplicitGEMM,<unused>;miopenConvolutionFwdAlgoDirect:ConvAsm1x1U,0.11712,0,miopenConvolutionFwdAlgoDirect,<unused>;miopenConvolutionFwdAlgoWinograd:ConvBinWinogradRxSf3x2,0.31968,0,miopenConvolutionFwdAlgoWinograd,<unused>;miopenConvolutionFwdAlgoGEMM:GemmFwd1x1_0_1,0.2656,0,miopenConvolutionFwdAlgoGEMM,<unused>
256-35-35-1x1-64-35-35-32-0x0-1x1-1x1-0-NCHW-FP16-F=miopenConvolutionFwdAlgoImplicitGEMM:ConvHipImplicitGemmV4R1Fwd,0.25296,0,miopenConvolutionFwdAlgoImplicitGEMM,<unused>;miopenConvolutionFwdAlgoDirect:ConvAsm1x1U,0.15536,0,miopenConvolutionFwdAlgoDirect,<unused>;miopenConvolutionFwdAlgoWinograd:ConvBinWinogradRxSf3x2,0.28608,0,miopenConvolutionFwdAlgoWinograd,<unused>;miopenConvolutionFwdAlgoGEMM:GemmFwd1x1_0_1,0.27136,0,miopenConvolutionFwdAlgoGEMM,<unused>
288-35-35-1x1-128-35-35-32-0x0-1x1-1x1-0-NCHW-FP16-F=miopenConvolutionFwdAlgoImplicitGEMM:ConvHipImplicitGemmV4R1Fwd,0.4776,0,miopenConvolutionFwdAlgoImplicitGEMM,<unused>;miopenConvolutionFwdAlgoDirect:ConvAsm1x1U,0.301761,0,miopenConvolutionFwdAlgoDirect,<unused>;miopenConvolutionFwdAlgoWinograd:ConvBinWinogradRxSf3x2,0.4248,0,miopenConvolutionFwdAlgoWinograd,<unused>;miopenConvolutionFwdAlgoGEMM:GemmFwd1x1_0_1,0.558081,0,miopenConvolutionFwdAlgoGEMM,<unused>
288-35-35-1x1-48-35-35-32-0x0-1x1-1x1-0-NCHW-FP16-F=miopenConvolutionFwdAlgoImplicitGEMM:ConvMlirIgemmFwd,0.556961,0,miopenConvolutionFwdAlgoImplicitGEMM,<unused>;miopenConvolutionFwdAlgoDirect:ConvAsm1x1U,0.13056,0,miopenConvolutionFwdAlgoDirect,<unused>;miopenConvolutionFwdAlgoWinograd:ConvBinWinogradRxSf3x2,0.23056,0,miopenConvolutionFwdAlgoWinograd,<unused>;miopenConvolutionFwdAlgoGEMM:GemmFwd1x1_0_1,0.30704,0,miopenConvolutionFwdAlgoGEMM,<unused>
288-35-35-1x1-64-35-35-32-0x0-1x1-1x1-0-NCHW-FP16-F=miopenConvolutionFwdAlgoImplicitGEMM:ConvHipImplicitGemmV4R1Fwd,0.2472,0,miopenConvolutionFwdAlgoImplicitGEMM,<unused>;miopenConvolutionFwdAlgoDirect:ConvAsm1x1U,0.16912,0,miopenConvolutionFwdAlgoDirect,<unused>;miopenConvolutionFwdAlgoWinograd:ConvBinWinogradRxSf3x2,0.30848,0,miopenConvolutionFwdAlgoWinograd,<unused>;miopenConvolutionFwdAlgoGEMM:GemmFwd1x1_0_1,0.29232,0,miopenConvolutionFwdAlgoGEMM,<unused>
288-35-35-3x3-384-17-17-32-0x0-2x2-1x1-0-NCHW-FP16-F=miopenConvolutionFwdAlgoImplicitGEMM:ConvHipImplicitGemmV4R1Fwd,1.67792,0,miopenConvolutionFwdAlgoImplicitGEMM,<unused>;miopenConvolutionFwdAlgoDirect:ConvOclDirectFwdGen,36.0496,0,miopenConvolutionFwdAlgoDirect,<unused>;miopenConvolutionFwdAlgoWinograd:ConvBinWinogradRxS,2.84752,0,miopenConvolutionFwdAlgoWinograd,<unused>;miopenConvolutionFwdAlgoGEMM:GemmFwdRest,14.6125,1498176,miopenConvolutionFwdAlgoGEMM,<unused>
96-35-35-3x3-96-17-17-32-0x0-2x2-1x1-0-NCHW-FP16-F=miopenConvolutionFwdAlgoImplicitGEMM:ConvHipImplicitGemmV4R1Fwd,0.17968,0,miopenConvolutionFwdAlgoImplicitGEMM,<unused>;miopenConvolutionFwdAlgoDirect:ConvOclDirectFwdGen,3.59424,0,miopenConvolutionFwdAlgoDirect,<unused>;miopenConvolutionFwdAlgoWinograd:ConvBinWinogradRxSf2x3g1,0.33216,0,miopenConvolutionFwdAlgoWinograd,<unused>;miopenConvolutionFwdAlgoGEMM:GemmFwdRest,6.22592,499392,miopenConvolutionFwdAlgoGEMM,<unused>
768-17-17-1x1-256-17-17-32-0x0-1x1-1x1-0-NCHW-FP16-F=miopenConvolutionFwdAlgoImplicitGEMM:ConvHipImplicitGemmV4R1Fwd,0.68224,0,miopenConvolutionFwdAlgoImplicitGEMM,<unused>;miopenConvolutionFwdAlgoDirect:ConvAsm1x1U,0.44512,0,miopenConvolutionFwdAlgoDirect,<unused>;miopenConvolutionFwdAlgoWinograd:ConvBinWinogradRxSf3x2,0.59936,0,miopenConvolutionFwdAlgoWinograd,<unused>;miopenConvolutionFwdAlgoGEMM:GemmFwd1x1_0_1,0.891041,0,miopenConvolutionFwdAlgoGEMM,<unused>
768-17-17-1x1-192-17-17-32-0x0-1x1-1x1-0-NCHW-FP16-F=miopenConvolutionFwdAlgoImplicitGEMM:ConvHipImplicitGemmV4R1Fwd,0.50976,0,miopenConvolutionFwdAlgoImplicitGEMM,<unused>;miopenConvolutionFwdAlgoDirect:ConvAsm1x1U,0.31952,0,miopenConvolutionFwdAlgoDirect,<unused>;miopenConvolutionFwdAlgoWinograd:ConvBinWinogradRxSf3x2,0.458241,0,miopenConvolutionFwdAlgoWinograd,<unused>;miopenConvolutionFwdAlgoGEMM:GemmFwd1x1_0_1,0.67856,0,miopenConvolutionFwdAlgoGEMM,<unused>
128-17-17-1x7-128-17-17-32-0x3-1x1-1x1-0-NCHW-FP16-F=miopenConvolutionFwdAlgoImplicitGEMM:ConvHipImplicitGemmV4R1Fwd,0.23664,0,miopenConvolutionFwdAlgoImplicitGEMM,<unused>;miopenConvolutionFwdAlgoDirect:ConvDirectNaiveConvFwd,5.69744,0,miopenConvolutionFwdAlgoDirect,<unused>;miopenConvolutionFwdAlgoWinograd:ConvBinWinogradRxSf3x2,0.22896,0,miopenConvolutionFwdAlgoWinograd,<unused>;miopenConvolutionFwdAlgoGEMM:GemmFwdRest,6.0416,517888,miopenConvolutionFwdAlgoGEMM,<unused>
128-17-17-7x1-192-17-17-32-3x0-1x1-1x1-0-NCHW-FP16-F=miopenConvolutionFwdAlgoImplicitGEMM:ConvHipImplicitGemmV4R1Fwd,0.31152,0,miopenConvolutionFwdAlgoImplicitGEMM,<unused>;miopenConvolutionFwdAlgoDirect:ConvDirectNaiveConvFwd,12.3162,0,miopenConvolutionFwdAlgoDirect,<unused>;miopenConvolutionFwdAlgoWinograd:ConvBinWinogradRxSf3x2,0.34032,0,miopenConvolutionFwdAlgoWinograd,<unused>;miopenConvolutionFwdAlgoGEMM:GemmFwdRest,6.0672,517888,miopenConvolutionFwdAlgoGEMM,<unused>
128-17-17-7x1-128-17-17-32-3x0-1x1-1x1-0-NCHW-FP16-F=miopenConvolutionFwdAlgoImplicitGEMM:ConvHipImplicitGemmV4R1Fwd,0.22176,0,miopenConvolutionFwdAlgoImplicitGEMM,<unused>;miopenConvolutionFwdAlgoDirect:ConvDirectNaiveConvFwd,8.77376,0,miopenConvolutionFwdAlgoDirect,<unused>;miopenConvolutionFwdAlgoWinograd:ConvBinWinogradRxSf3x2,0.2632,0,miopenConvolutionFwdAlgoWinograd,<unused>;miopenConvolutionFwdAlgoGEMM:GemmFwdRest,6.07235,517888,miopenConvolutionFwdAlgoGEMM,<unused>
128-17-17-1x7-192-17-17-32-0x3-1x1-1x1-0-NCHW-FP16-F=miopenConvolutionFwdAlgoImplicitGEMM:ConvHipImplicitGemmV4R1Fwd,0.2864,0,miopenConvolutionFwdAlgoImplicitGEMM,<unused>;miopenConvolutionFwdAlgoDirect:ConvDirectNaiveConvFwd,7.87344,0,miopenConvolutionFwdAlgoDirect,<unused>;miopenConvolutionFwdAlgoWinograd:ConvBinWinogradRxSf3x2,0.33632,0,miopenConvolutionFwdAlgoWinograd,<unused>;miopenConvolutionFwdAlgoGEMM:GemmFwdRest,6.08768,517888,miopenConvolutionFwdAlgoGEMM,<unused>
768-17-17-1x1-320-17-17-32-0x0-1x1-1x1-0-NCHW-FP16-F=miopenConvolutionFwdAlgoImplicitGEMM:ConvHipImplicitGemmV4R1Fwd,0.83136,0,miopenConvolutionFwdAlgoImplicitGEMM,<unused>;miopenConvolutionFwdAlgoDirect:ConvAsm1x1U,0.51968,0,miopenConvolutionFwdAlgoDirect,<unused>;miopenConvolutionFwdAlgoWinograd:ConvBinWinogradRxSf3x2,0.8184,0,miopenConvolutionFwdAlgoWinograd,<unused>;miopenConvolutionFwdAlgoGEMM:GemmFwd1x1_0_1,1.12016,0,miopenConvolutionFwdAlgoGEMM,<unused>
160-17-17-1x7-160-17-17-32-0x3-1x1-1x1-0-NCHW-FP16-F=miopenConvolutionFwdAlgoImplicitGEMM:ConvHipImplicitGemmV4R1Fwd,0.32368,0,miopenConvolutionFwdAlgoImplicitGEMM,<unused>;miopenConvolutionFwdAlgoDirect:ConvDirectNaiveConvFwd,8.40032,0,miopenConvolutionFwdAlgoDirect,<unused>;miopenConvolutionFwdAlgoWinograd:ConvBinWinogradRxSf3x2,0.27296,0,miopenConvolutionFwdAlgoWinograd,<unused>;miopenConvolutionFwdAlgoGEMM:GemmFwdRest,7.10144,647360,miopenConvolutionFwdAlgoGEMM,<unused>
160-17-17-7x1-192-17-17-32-3x0-1x1-1x1-0-NCHW-FP16-F=miopenConvolutionFwdAlgoImplicitGEMM:ConvHipImplicitGemmV4R1Fwd,0.3624,0,miopenConvolutionFwdAlgoImplicitGEMM,<unused>;miopenConvolutionFwdAlgoDirect:ConvDirectNaiveConvFwd,15.0866,0,miopenConvolutionFwdAlgoDirect,<unused>;miopenConvolutionFwdAlgoWinograd:ConvBinWinogradRxSf3x2,0.47792,0,miopenConvolutionFwdAlgoWinograd,<unused>;miopenConvolutionFwdAlgoGEMM:GemmFwdRest,7.40352,647360,miopenConvolutionFwdAlgoGEMM,<unused>
160-17-17-7x1-160-17-17-32-3x0-1x1-1x1-0-NCHW-FP16-F=miopenConvolutionFwdAlgoImplicitGEMM:ConvHipImplicitGemmV4R1Fwd,0.34064,0,miopenConvolutionFwdAlgoImplicitGEMM,<unused>;miopenConvolutionFwdAlgoDirect:ConvDirectNaiveConvFwd,12.8926,0,miopenConvolutionFwdAlgoDirect,<unused>;miopenConvolutionFwdAlgoWinograd:ConvBinWinogradRxSf3x2,0.31568,0,miopenConvolutionFwdAlgoWinograd,<unused>;miopenConvolutionFwdAlgoGEMM:GemmFwdRest,6.82496,647360,miopenConvolutionFwdAlgoGEMM,<unused>
160-17-17-1x7-192-17-17-32-0x3-1x1-1x1-0-NCHW-FP16-F=miopenConvolutionFwdAlgoImplicitGEMM:ConvHipImplicitGemmV4R1Fwd,0.33872,0,miopenConvolutionFwdAlgoImplicitGEMM,<unused>;miopenConvolutionFwdAlgoDirect:ConvDirectNaiveConvFwd,9.6864,0,miopenConvolutionFwdAlgoDirect,<unused>;miopenConvolutionFwdAlgoWinograd:ConvBinWinogradRxSf3x2,0.34944,0,miopenConvolutionFwdAlgoWinograd,<unused>;miopenConvolutionFwdAlgoGEMM:GemmFwdRest,6.97856,647360,miopenConvolutionFwdAlgoGEMM,<unused>
768-17-17-1x1-576-17-17-32-0x0-1x1-1x1-0-NCHW-FP16-F=miopenConvolutionFwdAlgoImplicitGEMM:ConvHipImplicitGemmV4R1Fwd,1.60768,0,miopenConvolutionFwdAlgoImplicitGEMM,<unused>;miopenConvolutionFwdAlgoDirect:ConvAsm1x1U,0.803041,0,miopenConvolutionFwdAlgoDirect,<unused>;miopenConvolutionFwdAlgoWinograd:ConvBinWinogradRxSf3x2,1.30848,0,miopenConvolutionFwdAlgoWinograd,<unused>;miopenConvolutionFwdAlgoGEMM:GemmFwd1x1_0_1,1.87152,0,miopenConvolutionFwdAlgoGEMM,<unused>
192-17-17-1x7-192-17-17-32-0x3-1x1-1x1-0-NCHW-FP16-F=miopenConvolutionFwdAlgoImplicitGEMM:ConvHipImplicitGemmV4R1Fwd,0.403361,0,miopenConvolutionFwdAlgoImplicitGEMM,<unused>;miopenConvolutionFwdAlgoDirect:ConvDirectNaiveConvFwd,11.2133,0,miopenConvolutionFwdAlgoDirect,<unused>;miopenConvolutionFwdAlgoWinograd:ConvBinWinogradRxSf3x2,0.46336,0,miopenConvolutionFwdAlgoWinograd,<unused>;miopenConvolutionFwdAlgoGEMM:GemmFwdRest,8.54016,776832,miopenConvolutionFwdAlgoGEMM,<unused>
192-17-17-7x1-192-17-17-32-3x0-1x1-1x1-0-NCHW-FP16-F=miopenConvolutionFwdAlgoImplicitGEMM:ConvHipImplicitGemmV4R1Fwd,0.48032,0,miopenConvolutionFwdAlgoImplicitGEMM,<unused>;miopenConvolutionFwdAlgoDirect:ConvDirectNaiveConvFwd,17.9498,0,miopenConvolutionFwdAlgoDirect,<unused>;miopenConvolutionFwdAlgoWinograd:ConvBinWinogradRxSf3x2,0.50912,0,miopenConvolutionFwdAlgoWinograd,<unused>;miopenConvolutionFwdAlgoGEMM:GemmFwdRest,8.32,776832,miopenConvolutionFwdAlgoGEMM,<unused>
768-17-17-1x1-384-17-17-32-0x0-1x1-1x1-0-NCHW-FP16-F=miopenConvolutionFwdAlgoImplicitGEMM:ConvHipImplicitGemmV4R1Fwd,1.1352,0,miopenConvolutionFwdAlgoImplicitGEMM,<unused>;miopenConvolutionFwdAlgoDirect:ConvAsm1x1U,0.60576,0,miopenConvolutionFwdAlgoDirect,<unused>;miopenConvolutionFwdAlgoWinograd:ConvBinWinogradRxSf3x2,0.930721,0,miopenConvolutionFwdAlgoWinograd,<unused>;miopenConvolutionFwdAlgoGEMM:GemmFwd1x1_0_1,1.26272,0,miopenConvolutionFwdAlgoGEMM,<unused>
192-17-17-3x3-320-8-8-32-0x0-2x2-1x1-0-NCHW-FP16-F=miopenConvolutionFwdAlgoImplicitGEMM:ConvHipImplicitGemmV4R1Fwd,0.2464,0,miopenConvolutionFwdAlgoImplicitGEMM,<unused>;miopenConvolutionFwdAlgoDirect:ConvOclDirectFwdGen,5.30592,0,miopenConvolutionFwdAlgoDirect,<unused>;miopenConvolutionFwdAlgoWinograd:ConvBinWinogradRxSf2x3g1,0.4336,0,miopenConvolutionFwdAlgoWinograd,<unused>;miopenConvolutionFwdAlgoGEMM:GemmFwdRest,3.86048,221184,miopenConvolutionFwdAlgoGEMM,<unused>
192-17-17-3x3-192-8-8-32-0x0-2x2-1x1-0-NCHW-FP16-F=miopenConvolutionFwdAlgoImplicitGEMM:ConvHipImplicitGemmV4R1Fwd,0.15632,0,miopenConvolutionFwdAlgoImplicitGEMM,<unused>;miopenConvolutionFwdAlgoDirect:ConvOclDirectFwdGen,3.74048,0,miopenConvolutionFwdAlgoDirect,<unused>;miopenConvolutionFwdAlgoWinograd:ConvBinWinogradRxSf2x3g1,0.29328,0,miopenConvolutionFwdAlgoWinograd,<unused>;miopenConvolutionFwdAlgoGEMM:GemmFwdRest,4.37248,221184,miopenConvolutionFwdAlgoGEMM,<unused>
1280-8-8-1x1-320-8-8-32-0x0-1x1-1x1-0-NCHW-FP16-F=miopenConvolutionFwdAlgoImplicitGEMM:ConvHipImplicitGemmV4R1Fwd,0.186401,0,miopenConvolutionFwdAlgoImplicitGEMM,<unused>;miopenConvolutionFwdAlgoDirect:ConvAsm1x1U,0.17728,0,miopenConvolutionFwdAlgoDirect,<unused>;miopenConvolutionFwdAlgoWinograd:ConvBinWinogradRxSf3x2,0.43152,0,miopenConvolutionFwdAlgoWinograd,<unused>;miopenConvolutionFwdAlgoGEMM:GemmFwd1x1_0_1,0.592,0,miopenConvolutionFwdAlgoGEMM,<unused>
1280-8-8-1x1-384-8-8-32-0x0-1x1-1x1-0-NCHW-FP16-F=miopenConvolutionFwdAlgoImplicitGEMM:ConvHipImplicitGemmV4R1Fwd,0.37536,0,miopenConvolutionFwdAlgoImplicitGEMM,<unused>;miopenConvolutionFwdAlgoDirect:ConvAsm1x1U,0.22608,0,miopenConvolutionFwdAlgoDirect,<unused>;miopenConvolutionFwdAlgoWinograd:ConvBinWinogradRxSf3x2,0.42896,0,miopenConvolutionFwdAlgoWinograd,<unused>;miopenConvolutionFwdAlgoGEMM:GemmFwd1x1_0_1,0.6832,0,miopenConvolutionFwdAlgoGEMM,<unused>
384-8-8-1x3-384-8-8-32-0x1-1x1-1x1-0-NCHW-FP16-F=miopenConvolutionFwdAlgoImplicitGEMM:ConvHipImplicitGemmV4R1Fwd,0.18704,0,miopenConvolutionFwdAlgoImplicitGEMM,<unused>;miopenConvolutionFwdAlgoDirect:ConvDirectNaiveConvFwd,6.88064,0,miopenConvolutionFwdAlgoDirect,<unused>;miopenConvolutionFwdAlgoWinograd:ConvBinWinogradRxS,0.25936,0,miopenConvolutionFwdAlgoWinograd,<unused>;miopenConvolutionFwdAlgoGEMM:GemmFwdRest,2.51904,147456,miopenConvolutionFwdAlgoGEMM,<unused>
384-8-8-3x1-384-8-8-32-1x0-1x1-1x1-0-NCHW-FP16-F=miopenConvolutionFwdAlgoImplicitGEMM:ConvHipImplicitGemmV4R1Fwd,0.1768,0,miopenConvolutionFwdAlgoImplicitGEMM,<unused>;miopenConvolutionFwdAlgoDirect:ConvDirectNaiveConvFwd,8.73344,0,miopenConvolutionFwdAlgoDirect,<unused>;miopenConvolutionFwdAlgoWinograd:ConvBinWinogradRxSf2x3g1,0.29392,0,miopenConvolutionFwdAlgoWinograd,<unused>;miopenConvolutionFwdAlgoGEMM:GemmFwdRest,2.20672,147456,miopenConvolutionFwdAlgoGEMM,<unused>
1280-8-8-1x1-448-8-8-32-0x0-1x1-1x1-0-NCHW-FP16-F=miopenConvolutionFwdAlgoImplicitGEMM:ConvHipImplicitGemmV4R1Fwd,0.366401,0,miopenConvolutionFwdAlgoImplicitGEMM,<unused>;miopenConvolutionFwdAlgoDirect:ConvAsm1x1U,0.25456,0,miopenConvolutionFwdAlgoDirect,<unused>;miopenConvolutionFwdAlgoWinograd:ConvBinWinogradRxSf3x2,0.61472,0,miopenConvolutionFwdAlgoWinograd,<unused>;miopenConvolutionFwdAlgoGEMM:GemmFwd1x1_0_1,0.80176,0,miopenConvolutionFwdAlgoGEMM,<unused>
448-8-8-3x3-384-8-8-32-1x1-1x1-1x1-0-NCHW-FP16-F=miopenConvolutionFwdAlgoImplicitGEMM:ConvHipImplicitGemmV4R1Fwd,0.57968,0,miopenConvolutionFwdAlgoImplicitGEMM,<unused>;miopenConvolutionFwdAlgoDirect:ConvOclDirectFwd,6.35696,0,miopenConvolutionFwdAlgoDirect,<unused>;miopenConvolutionFwdAlgoWinograd:ConvBinWinogradRxSf2x3g1,0.2568,0,miopenConvolutionFwdAlgoWinograd,<unused>;miopenConvolutionFwdAlgoGEMM:GemmFwdRest,6.53312,516096,miopenConvolutionFwdAlgoGEMM,<unused>
1280-8-8-1x1-192-8-8-32-0x0-1x1-1x1-0-NCHW-FP16-F=miopenConvolutionFwdAlgoImplicitGEMM:ConvHipImplicitGemmV4R1Fwd,0.12976,0,miopenConvolutionFwdAlgoImplicitGEMM,<unused>;miopenConvolutionFwdAlgoDirect:ConvAsm1x1U,0.13504,0,miopenConvolutionFwdAlgoDirect,<unused>;miopenConvolutionFwdAlgoWinograd:ConvBinWinogradRxSf3x2,0.28912,0,miopenConvolutionFwdAlgoWinograd,<unused>;miopenConvolutionFwdAlgoGEMM:GemmFwd1x1_0_1,0.3712,0,miopenConvolutionFwdAlgoGEMM,<unused>
2048-8-8-1x1-320-8-8-32-0x0-1x1-1x1-0-NCHW-FP16-F=miopenConvolutionFwdAlgoImplicitGEMM:ConvHipImplicitGemmV4R1Fwd,0.37872,0,miopenConvolutionFwdAlgoImplicitGEMM,<unused>;miopenConvolutionFwdAlgoDirect:ConvAsm1x1U,0.3056,0,miopenConvolutionFwdAlgoDirect,<unused>;miopenConvolutionFwdAlgoWinograd:ConvBinWinogradRxSf3x2,0.86096,0,miopenConvolutionFwdAlgoWinograd,<unused>;miopenConvolutionFwdAlgoGEMM:GemmFwd1x1_0_1,0.3408,0,miopenConvolutionFwdAlgoGEMM,<unused>
2048-8-8-1x1-384-8-8-32-0x0-1x1-1x1-0-NCHW-FP16-F=miopenConvolutionFwdAlgoImplicitGEMM:ConvHipImplicitGemmV4R1Fwd,0.45872,0,miopenConvolutionFwdAlgoImplicitGEMM,<unused>;miopenConvolutionFwdAlgoDirect:ConvAsm1x1U,0.35696,0,miopenConvolutionFwdAlgoDirect,<unused>;miopenConvolutionFwdAlgoWinograd:ConvBinWinogradRxSf3x2,0.67216,0,miopenConvolutionFwdAlgoWinograd,<unused>;miopenConvolutionFwdAlgoGEMM:GemmFwd1x1_0_1,0.51728,0,miopenConvolutionFwdAlgoGEMM,<unused>
2048-8-8-1x1-448-8-8-32-0x0-1x1-1x1-0-NCHW-FP16-F=miopenConvolutionFwdAlgoImplicitGEMM:ConvHipImplicitGemmV4R1Fwd,0.4688,0,miopenConvolutionFwdAlgoImplicitGEMM,<unused>;miopenConvolutionFwdAlgoDirect:ConvAsm1x1U,0.34368,0,miopenConvolutionFwdAlgoDirect,<unused>;miopenConvolutionFwdAlgoWinograd:ConvBinWinogradRxSf3x2,0.947201,0,miopenConvolutionFwdAlgoWinograd,<unused>;miopenConvolutionFwdAlgoGEMM:GemmFwd1x1_0_1,1.26352,0,miopenConvolutionFwdAlgoGEMM,<unused>
2048-8-8-1x1-192-8-8-32-0x0-1x1-1x1-0-NCHW-FP16-F=miopenConvolutionFwdAlgoImplicitGEMM:ConvHipImplicitGemmV4R1Fwd,0.27456,0,miopenConvolutionFwdAlgoImplicitGEMM,<unused>;miopenConvolutionFwdAlgoDirect:ConvAsm1x1U,0.22784,0,miopenConvolutionFwdAlgoDirect,<unused>;miopenConvolutionFwdAlgoWinograd:ConvBinWinogradRxSf3x2,0.46144,0,miopenConvolutionFwdAlgoWinograd,<unused>;miopenConvolutionFwdAlgoGEMM:GemmFwd1x1_0_1,0.21776,0,miopenConvolutionFwdAlgoGEMM,<unused>
3-224-224-3x3-64-224-224-16-1x1-1x1-1x1-0-NCHW-FP32-F=miopenConvolutionFwdAlgoImplicitGEMM:ConvMlirIgemmFwd,1.0112,0,miopenConvolutionFwdAlgoImplicitGEMM,<unused>;miopenConvolutionFwdAlgoDirect:ConvOclDirectFwd,0.841921,0,miopenConvolutionFwdAlgoDirect,<unused>;miopenConvolutionFwdAlgoWinograd:ConvBinWinogradRxSf2x3g1,0.64512,0,miopenConvolutionFwdAlgoWinograd,<unused>;miopenConvolutionFwdAlgoGEMM:GemmFwdRest,2.22464,5419008,miopenConvolutionFwdAlgoGEMM,<unused>
64-224-224-3x3-64-224-224-16-1x1-1x1-1x1-0-NCHW-FP32-F=miopenConvolutionFwdAlgoWinograd:ConvBinWinogradRxSf2x3g1,2.72848,0,miopenConvolutionFwdAlgoWinograd,<unused>
64-112-112-3x3-128-112-112-16-1x1-1x1-1x1-0-NCHW-FP32-F=miopenConvolutionFwdAlgoWinograd:ConvBinWinogradRxS,1.46752,0,miopenConvolutionFwdAlgoWinograd,<unused>
128-112-112-3x3-128-112-112-16-1x1-1x1-1x1-0-NCHW-FP32-F=miopenConvolutionFwdAlgoWinograd:ConvBinWinogradRxSf2x3g1,2.492,0,miopenConvolutionFwdAlgoWinograd,<unused>
128-56-56-3x3-256-56-56-16-1x1-1x1-1x1-0-NCHW-FP32-F=miopenConvolutionFwdAlgoWinograd:ConvBinWinogradRxS,1.40976,0,miopenConvolutionFwdAlgoWinograd,<unused>
256-56-56-3x3-256-56-56-16-1x1-1x1-1x1-0-NCHW-FP32-F=miopenConvolutionFwdAlgoWinograd:ConvBinWinogradRxSf2x3g1,2.43216,0,miopenConvolutionFwdAlgoWinograd,<unused>
256-28-28-3x3-512-28-28-16-1x1-1x1-1x1-0-NCHW-FP32-F=miopenConvolutionFwdAlgoWinograd:ConvBinWinogradRxS,1.38864,0,miopenConvolutionFwdAlgoWinograd,<unused>
512-28-28-3x3-512-28-28-16-1x1-1x1-1x1-0-NCHW-FP32-F=miopenConvolutionFwdAlgoWinograd:ConvBinWinogradRxSf2x3g1,2.42848,0,miopenConvolutionFwdAlgoWinograd,<unused>
512-14-14-3x3-512-14-14-16-1x1-1x1-1x1-0-NCHW-FP32-F=miopenConvolutionFwdAlgoWinograd:ConvBinWinogradRxSf2x3g1,0.75136,0,miopenConvolutionFwdAlgoWinograd,<unused>
3-224-224-3x3-64-224-224-16-1x1-1x1-1x1-0-NCHW-FP16-F=miopenConvolutionFwdAlgoImplicitGEMM:ConvMlirIgemmFwd,0.879841,0,miopenConvolutionFwdAlgoImplicitGEMM,<unused>;miopenConvolutionFwdAlgoDirect:ConvOclDirectFwd,0.683521,0,miopenConvolutionFwdAlgoDirect,<unused>;miopenConvolutionFwdAlgoWinograd:ConvBinWinogradRxSf2x3g1,0.58928,0,miopenConvolutionFwdAlgoWinograd,<unused>;miopenConvolutionFwdAlgoGEMM:GemmFwdRest,1.82528,2709504,miopenConvolutionFwdAlgoGEMM,<unused>
64-224-224-3x3-64-224-224-16-1x1-1x1-1x1-0-NCHW-FP16-F=miopenConvolutionFwdAlgoImplicitGEMM:ConvHipImplicitGemmV4R1Fwd,3.956,0,miopenConvolutionFwdAlgoImplicitGEMM,<unused>;miopenConvolutionFwdAlgoDirect:ConvOclDirectFwd,17.1823,0,miopenConvolutionFwdAlgoDirect,<unused>;miopenConvolutionFwdAlgoWinograd:ConvBinWinogradRxS,1.79248,0,miopenConvolutionFwdAlgoWinograd,<unused>;miopenConvolutionFwdAlgoGEMM:GemmFwdRest,8.78592,57802752,miopenConvolutionFwdAlgoGEMM,<unused>
64-112-112-3x3-128-112-112-16-1x1-1x1-1x1-0-NCHW-FP16-F=miopenConvolutionFwdAlgoImplicitGEMM:ConvHipImplicitGemmV4R1Fwd,1.75824,0,miopenConvolutionFwdAlgoImplicitGEMM,<unused>;miopenConvolutionFwdAlgoDirect:ConvOclDirectFwd,8.45009,0,miopenConvolutionFwdAlgoDirect,<unused>;miopenConvolutionFwdAlgoWinograd:ConvBinWinogradRxS,1.02992,0,miopenConvolutionFwdAlgoWinograd,<unused>;miopenConvolutionFwdAlgoGEMM:GemmFwdRest,4.83584,14450688,miopenConvolutionFwdAlgoGEMM,<unused>
128-112-112-3x3-128-112-112-16-1x1-1x1-1x1-0-NCHW-FP16-F=miopenConvolutionFwdAlgoImplicitGEMM:ConvHipImplicitGemmV4R1Fwd,3.4304,0,miopenConvolutionFwdAlgoImplicitGEMM,<unused>;miopenConvolutionFwdAlgoDirect:ConvOclDirectFwd,10.7472,0,miopenConvolutionFwdAlgoDirect,<unused>;miopenConvolutionFwdAlgoWinograd:ConvBinWinogradRxS,1.72944,0,miopenConvolutionFwdAlgoWinograd,<unused>;miopenConvolutionFwdAlgoGEMM:GemmFwdRest,7.08096,28901376,miopenConvolutionFwdAlgoGEMM,<unused>
128-56-56-3x3-256-56-56-16-1x1-1x1-1x1-0-NCHW-FP16-F=miopenConvolutionFwdAlgoImplicitGEMM:ConvHipImplicitGemmV4R1Fwd,2.02064,0,miopenConvolutionFwdAlgoImplicitGEMM,<unused>;miopenConvolutionFwdAlgoDirect:ConvOclDirectFwd,12.5573,0,miopenConvolutionFwdAlgoDirect,<unused>;miopenConvolutionFwdAlgoWinograd:ConvBinWinogradRxSf2x3g1,0.91104,0,miopenConvolutionFwdAlgoWinograd,<unused>;miopenConvolutionFwdAlgoGEMM:GemmFwdRest,3.5712,7225344,miopenConvolutionFwdAlgoGEMM,<unused>
256-56-56-3x3-256-56-56-16-1x1-1x1-1x1-0-NCHW-FP16-F=miopenConvolutionFwdAlgoImplicitGEMM:ConvHipImplicitGemmV4R1Fwd,3.79024,0,miopenConvolutionFwdAlgoImplicitGEMM,<unused>;miopenConvolutionFwdAlgoDirect:ConvOclDirectFwd,13.7371,0,miopenConvolutionFwdAlgoDirect,<unused>;miopenConvolutionFwdAlgoWinograd:ConvBinWinogradRxS,1.65296,0,miopenConvolutionFwdAlgoWinograd,<unused>;miopenConvolutionFwdAlgoGEMM:GemmFwdRest,7.6672,14450688,miopenConvolutionFwdAlgoGEMM,<unused>
256-28-28-3x3-512-28-28-16-1x1-1x1-1x1-0-NCHW-FP16-F=miopenConvolutionFwdAlgoImplicitGEMM:ConvHipImplicitGemmV4R1Fwd,1.7728,0,miopenConvolutionFwdAlgoImplicitGEMM,<unused>;miopenConvolutionFwdAlgoDirect:ConvOclDirectFwd,12.0482,0,miopenConvolutionFwdAlgoDirect,<unused>;miopenConvolutionFwdAlgoWinograd:ConvBinWinogradRxSf2x3g1,0.878881,0,miopenConvolutionFwdAlgoWinograd,<unused>;miopenConvolutionFwdAlgoGEMM:GemmFwdRest,5.66784,3612672,miopenConvolutionFwdAlgoGEMM,<unused>
512-28-28-3x3-512-28-28-16-1x1-1x1-1x1-0-NCHW-FP16-F=miopenConvolutionFwdAlgoImplicitGEMM:ConvHipImplicitGemmV4R1Fwd,3.5664,0,miopenConvolutionFwdAlgoImplicitGEMM,<unused>;miopenConvolutionFwdAlgoDirect:ConvOclDirectFwd,23.5955,0,miopenConvolutionFwdAlgoDirect,<unused>;miopenConvolutionFwdAlgoWinograd:ConvBinWinogradRxS,1.51056,0,miopenConvolutionFwdAlgoWinograd,<unused>;miopenConvolutionFwdAlgoGEMM:GemmFwdRest,9.28256,7225344,miopenConvolutionFwdAlgoGEMM,<unused>
512-14-14-3x3-512-14-14-16-1x1-1x1-1x1-0-NCHW-FP16-F=miopenConvolutionFwdAlgoImplicitGEMM:ConvHipImplicitGemmV4R1Fwd,1.46144,0,miopenConvolutionFwdAlgoImplicitGEMM,<unused>;miopenConvolutionFwdAlgoDirect:ConvOclDirectFwd,10.0998,0,miopenConvolutionFwdAlgoDirect,<unused>;miopenConvolutionFwdAlgoWinograd:ConvBinWinogradRxSf2x3g1,0.459361,0,miopenConvolutionFwdAlgoWinograd,<unused>;miopenConvolutionFwdAlgoGEMM:GemmFwdRest,6.96576,1806336,miopenConvolutionFwdAlgoGEMM,<unused>
64-56-56-1x1-288-56-56-32-0x0-1x1-1x1-0-NCHW-FP32-F=miopenConvolutionFwdAlgoImplicitGEMM:ConvHipImplicitGemmV4R4Fwd,0.56672,0,miopenConvolutionFwdAlgoImplicitGEMM,<unused>;miopenConvolutionFwdAlgoDirect:ConvAsm1x1U,0.455681,0,miopenConvolutionFwdAlgoDirect,<unused>;miopenConvolutionFwdAlgoWinograd:ConvBinWinogradRxSf3x2,0.996161,0,miopenConvolutionFwdAlgoWinograd,<unused>;miopenConvolutionFwdAlgoGEMM:GemmFwd1x1_0_1,0.50864,0,miopenConvolutionFwdAlgoGEMM,<unused>
64-56-56-1x1-96-56-56-32-0x0-1x1-1x1-0-NCHW-FP32-F=miopenConvolutionFwdAlgoImplicitGEMM:ConvHipImplicitGemmV4R4Fwd,0.19952,0,miopenConvolutionFwdAlgoImplicitGEMM,<unused>;miopenConvolutionFwdAlgoDirect:ConvAsm1x1U,0.16864,0,miopenConvolutionFwdAlgoDirect,<unused>;miopenConvolutionFwdAlgoWinograd:ConvBinWinogradRxSf3x2,0.53216,0,miopenConvolutionFwdAlgoWinograd,<unused>;miopenConvolutionFwdAlgoGEMM:GemmFwd1x1_0_1,0.35792,0,miopenConvolutionFwdAlgoGEMM,<unused>
96-56-56-3x3-96-56-56-32-1x1-1x1-1x1-0-NCHW-FP32-F_g32=miopenConvolutionFwdAlgoImplicitGEMM:ConvMlirIgemmFwd,3.06912,0,miopenConvolutionFwdAlgoImplicitGEMM,<unused>;miopenConvolutionFwdAlgoDirect:ConvOclDirectFwd,0.25728,0,miopenConvolutionFwdAlgoDirect,<unused>;miopenConvolutionFwdAlgoWinograd:ConvBinWinogradRxSf2x3,1.44752,0,miopenConvolutionFwdAlgoWinograd,<unused>;miopenConvolutionFwdAlgoGEMM:GemmFwdRest,4.5568,10838016,miopenConvolutionFwdAlgoGEMM,<unused>
96-56-56-1x1-272-56-56-32-0x0-1x1-1x1-0-NCHW-FP32-F=miopenConvolutionFwdAlgoImplicitGEMM:ConvMlirIgemmFwd,1.12976,0,miopenConvolutionFwdAlgoImplicitGEMM,<unused>;miopenConvolutionFwdAlgoDirect:ConvAsm1x1U,0.56992,0,miopenConvolutionFwdAlgoDirect,<unused>;miopenConvolutionFwdAlgoWinograd:ConvBinWinogradRxSf3x2,1.37936,0,miopenConvolutionFwdAlgoWinograd,<unused>;miopenConvolutionFwdAlgoGEMM:GemmFwd1x1_0_1,0.6832,0,miopenConvolutionFwdAlgoGEMM,<unused>
304-56-56-1x1-96-56-56-32-0x0-1x1-1x1-0-NCHW-FP32-F=miopenConvolutionFwdAlgoImplicitGEMM:ConvHipImplicitGemmV4R4Fwd,0.65392,0,miopenConvolutionFwdAlgoImplicitGEMM,<unused>;miopenConvolutionFwdAlgoDirect:ConvOclDirectFwd1x1,0.670561,0,miopenConvolutionFwdAlgoDirect,<unused>;miopenConvolutionFwdAlgoWinograd:ConvBinWinogradRxSf3x2,1.22864,0,miopenConvolutionFwdAlgoWinograd,<unused>;miopenConvolutionFwdAlgoGEMM:GemmFwd1x1_0_1,0.920801,0,miopenConvolutionFwdAlgoGEMM,<unused>
320-56-56-1x1-96-56-56-32-0x0-1x1-1x1-0-NCHW-FP32-F=miopenConvolutionFwdAlgoImplicitGEMM:ConvHipImplicitGemmV4R4Fwd,0.711201,0,miopenConvolutionFwdAlgoImplicitGEMM,<unused>;miopenConvolutionFwdAlgoDirect:ConvAsm1x1U,0.59904,0,miopenConvolutionFwdAlgoDirect,<unused>;miopenConvolutionFwdAlgoWinograd:ConvBinWinogradRxSf3x2,1.29952,0,miopenConvolutionFwdAlgoWinograd,<unused>;miopenConvolutionFwdAlgoGEMM:GemmFwd1x1_0_1,0.914721,0,miopenConvolutionFwdAlgoGEMM,<unused>
336-56-56-1x1-576-28-28-32-0x0-2x2-1x1-0-NCHW-FP32-F=miopenConvolutionFwdAlgoImplicitGEMM:ConvHipImplicitGemmV4R4Fwd,1.25056,0,miopenConvolutionFwdAlgoImplicitGEMM,<unused>;miopenConvolutionFwdAlgoDirect:ConvAsm1x1U,1.09728,33718272,miopenConvolutionFwdAlgoDirect,<unused>;miopenConvolutionFwdAlgoWinograd:ConvBinWinogradRxSf2x3g1,7.23824,0,miopenConvolutionFwdAlgoWinograd,<unused>;miopenConvolutionFwdAlgoGEMM:GemmFwd1x1_0_2,1.5552,91521024,miopenConvolutionFwdAlgoGEMM,<unused>
336-56-56-1x1-192-56-56-32-0x0-1x1-1x1-0-NCHW-FP32-F=miopenConvolutionFwdAlgoImplicitGEMM:ConvHipImplicitGemmV4R1Fwd,1.19936,0,miopenConvolutionFwdAlgoImplicitGEMM,<unused>;miopenConvolutionFwdAlgoDirect:ConvAsm1x1U,1.5368,0,miopenConvolutionFwdAlgoDirect,<unused>;miopenConvolutionFwdAlgoWinograd:ConvBinWinogradRxSf3x2,2.58576,0,miopenConvolutionFwdAlgoWinograd,<unused>;miopenConvolutionFwdAlgoGEMM:GemmFwd1x1_0_1,1.3176,0,miopenConvolutionFwdAlgoGEMM,<unused>
192-56-56-3x3-192-28-28-32-1x1-2x2-1x1-0-NCHW-FP32-F_g32=miopenConvolutionFwdAlgoImplicitGEMM:ConvMlirIgemmFwd,1.91824,0,miopenConvolutionFwdAlgoImplicitGEMM,<unused>;miopenConvolutionFwdAlgoDirect:ConvOclDirectFwd,0.3528,0,miopenConvolutionFwdAlgoDirect,<unused>;miopenConvolutionFwdAlgoWinograd:ConvBinWinogradRxSf2x3,0.98032,0,miopenConvolutionFwdAlgoWinograd,<unused>;miopenConvolutionFwdAlgoGEMM:GemmFwdRest,2.84672,5419008,miopenConvolutionFwdAlgoGEMM,<unused>
192-28-28-1x1-544-28-28-32-0x0-1x1-1x1-0-NCHW-FP32-F=miopenConvolutionFwdAlgoImplicitGEMM:ConvHipImplicitGemmV4R4Fwd,0.695041,0,miopenConvolutionFwdAlgoImplicitGEMM,<unused>;miopenConvolutionFwdAlgoDirect:ConvAsm1x1U,0.542881,0,miopenConvolutionFwdAlgoDirect,<unused>;miopenConvolutionFwdAlgoWinograd:ConvBinWinogradRxSf3x2,1.2504,0,miopenConvolutionFwdAlgoWinograd,<unused>;miopenConvolutionFwdAlgoGEMM:GemmFwd1x1_0_1,0.6264,0,miopenConvolutionFwdAlgoGEMM,<unused>
608-28-28-1x1-192-28-28-32-0x0-1x1-1x1-0-NCHW-FP32-F=miopenConvolutionFwdAlgoImplicitGEMM:ConvHipImplicitGemmV4R1Fwd,0.5472,0,miopenConvolutionFwdAlgoImplicitGEMM,<unused>;miopenConvolutionFwdAlgoDirect:ConvAsm1x1U,0.59152,0,miopenConvolutionFwdAlgoDirect,<unused>;miopenConvolutionFwdAlgoWinograd:ConvBinWinogradRxSf3x2,1.24896,0,miopenConvolutionFwdAlgoWinograd,<unused>;miopenConvolutionFwdAlgoGEMM:GemmFwd1x1_0_1,0.87968,0,miopenConvolutionFwdAlgoGEMM,<unused>
192-28-28-3x3-192-28-28-32-1x1-1x1-1x1-0-NCHW-FP32-F_g32=miopenConvolutionFwdAlgoImplicitGEMM:ConvMlirIgemmFwd,1.95296,0,miopenConvolutionFwdAlgoImplicitGEMM,<unused>;miopenConvolutionFwdAlgoDirect:ConvOclDirectFwd,0.224161,0,miopenConvolutionFwdAlgoDirect,<unused>;miopenConvolutionFwdAlgoWinograd:ConvBinWinogradRxSf2x3,0.49696,0,miopenConvolutionFwdAlgoWinograd,<unused>;miopenConvolutionFwdAlgoGEMM:GemmFwdRest,2.42688,5419008,miopenConvolutionFwdAlgoGEMM,<unused>
640-28-28-1x1-192-28-28-32-0x0-1x1-1x1-0-NCHW-FP32-F=miopenConvolutionFwdAlgoImplicitGEMM:ConvHipImplicitGemmV4R4Fwd,0.608321,0,miopenConvolutionFwdAlgoImplicitGEMM,<unused>;miopenConvolutionFwdAlgoDirect:ConvAsm1x1U,0.688,0,miopenConvolutionFwdAlgoDirect,<unused>;miopenConvolutionFwdAlgoWinograd:ConvBinWinogradRxSf3x2,1.3288,0,miopenConvolutionFwdAlgoWinograd,<unused>;miopenConvolutionFwdAlgoGEMM:GemmFwd1x1_0_1,0.903361,0,miopenConvolutionFwdAlgoGEMM,<unused>
672-28-28-1x1-192-28-28-32-0x0-1x1-1x1-0-NCHW-FP32-F=miopenConvolutionFwdAlgoImplicitGEMM:ConvHipImplicitGemmV4R1Fwd,0.606881,0,miopenConvolutionFwdAlgoImplicitGEMM,<unused>;miopenConvolutionFwdAlgoDirect:ConvAsm1x1U,0.67808,0,miopenConvolutionFwdAlgoDirect,<unused>;miopenConvolutionFwdAlgoWinograd:ConvBinWinogradRxSf3x2,1.37408,0,miopenConvolutionFwdAlgoWinograd,<unused>;miopenConvolutionFwdAlgoGEMM:GemmFwd1x1_0_1,0.946081,0,miopenConvolutionFwdAlgoGEMM,<unused>
704-28-28-1x1-1072-14-14-32-0x0-2x2-1x1-0-NCHW-FP32-F=miopenConvolutionFwdAlgoImplicitGEMM:ConvMlirIgemmFwd,2.1952,0,miopenConvolutionFwdAlgoImplicitGEMM,<unused>;miopenConvolutionFwdAlgoDirect:ConvAsm1x1U,1.42496,17661952,miopenConvolutionFwdAlgoDirect,<unused>;miopenConvolutionFwdAlgoWinograd:ConvBinWinogradRxSf2x3g1,7.15296,0,miopenConvolutionFwdAlgoWinograd,<unused>;miopenConvolutionFwdAlgoGEMM:GemmFwd1x1_0_2,1.34432,44556288,miopenConvolutionFwdAlgoGEMM,<unused>
704-28-28-1x1-384-28-28-32-0x0-1x1-1x1-0-NCHW-FP32-F=miopenConvolutionFwdAlgoImplicitGEMM:ConvAsmImplicitGemmV4R1DynamicFwd_1x1,1.19904,0,miopenConvolutionFwdAlgoImplicitGEMM,<unused>;miopenConvolutionFwdAlgoDirect:ConvAsm1x1U,1.43328,0,miopenConvolutionFwdAlgoDirect,<unused>;miopenConvolutionFwdAlgoWinograd:ConvBinWinogradRxSf3x2,2.8272,0,miopenConvolutionFwdAlgoWinograd,<unused>;miopenConvolutionFwdAlgoGEMM:GemmFwd1x1_0_1,1.51392,0,miopenConvolutionFwdAlgoGEMM,<unused>
384-28-28-3x3-384-14-14-32-1x1-2x2-1x1-0-NCHW-FP32-F_g32=miopenConvolutionFwdAlgoImplicitGEMM:ConvMlirIgemmFwd,0.851361,0,miopenConvolutionFwdAlgoImplicitGEMM,<unused>;miopenConvolutionFwdAlgoDirect:ConvOclDirectFwd,0.32912,0,miopenConvolutionFwdAlgoDirect,<unused>;miopenConvolutionFwdAlgoWinograd:ConvBinWinogradRxSf2x3,0.41712,0,miopenConvolutionFwdAlgoWinograd,<unused>;miopenConvolutionFwdAlgoGEMM:GemmFwdRest,3.00032,2709504,miopenConvolutionFwdAlgoGEMM,<unused>
384-14-14-1x1-1048-14-14-32-0x0-1x1-1x1-0-NCHW-FP32-F=miopenConvolutionFwdAlgoImplicitGEMM:ConvMlirIgemmFwd,0.957441,0,miopenConvolutionFwdAlgoImplicitGEMM,<unused>;miopenConvolutionFwdAlgoDirect:ConvAsm1x1U,0.68096,0,miopenConvolutionFwdAlgoDirect,<unused>;miopenConvolutionFwdAlgoWinograd:ConvBinWinogradRxSf3x2,1.21712,0,miopenConvolutionFwdAlgoWinograd,<unused>;miopenConvolutionFwdAlgoGEMM:GemmFwd1x1_0_1,0.680481,0,miopenConvolutionFwdAlgoGEMM,<unused>
1096-14-14-1x1-384-14-14-32-0x0-1x1-1x1-0-NCHW-FP32-F=miopenConvolutionFwdAlgoImplicitGEMM:ConvHipImplicitGemmV4R4Fwd,0.48832,0,miopenConvolutionFwdAlgoImplicitGEMM,<unused>;miopenConvolutionFwdAlgoDirect:ConvAsm1x1U,0.724,0,miopenConvolutionFwdAlgoDirect,<unused>;miopenConvolutionFwdAlgoWinograd:ConvBinWinogradRxSf3x2,1.1216,0,miopenConvolutionFwdAlgoWinograd,<unused>;miopenConvolutionFwdAlgoGEMM:GemmFwd1x1_0_1,0.736481,0,miopenConvolutionFwdAlgoGEMM,<unused>
384-14-14-3x3-384-14-14-32-1x1-1x1-1x1-0-NCHW-FP32-F_g32=miopenConvolutionFwdAlgoImplicitGEMM:ConvMlirIgemmFwd,0.84112,0,miopenConvolutionFwdAlgoImplicitGEMM,<unused>;miopenConvolutionFwdAlgoDirect:ConvOclDirectFwd,0.21584,0,miopenConvolutionFwdAlgoDirect,<unused>;miopenConvolutionFwdAlgoWinograd:ConvBinWinogradRxSf2x3,0.20448,0,miopenConvolutionFwdAlgoWinograd,<unused>;miopenConvolutionFwdAlgoGEMM:GemmFwdRest,3.92192,2709504,miopenConvolutionFwdAlgoGEMM,<unused>
1120-14-14-1x1-384-14-14-32-0x0-1x1-1x1-0-NCHW-FP32-F=miopenConvolutionFwdAlgoImplicitGEMM:ConvHipImplicitGemmV4R4Fwd,0.53744,0,miopenConvolutionFwdAlgoImplicitGEMM,<unused>;miopenConvolutionFwdAlgoDirect:ConvAsm1x1U,0.64688,0,miopenConvolutionFwdAlgoDirect,<unused>;miopenConvolutionFwdAlgoWinograd:ConvBinWinogradRxSf3x2,1.14576,0,miopenConvolutionFwdAlgoWinograd,<unused>;miopenConvolutionFwdAlgoGEMM:GemmFwd1x1_0_1,0.737761,0,miopenConvolutionFwdAlgoGEMM,<unused>
1144-14-14-1x1-384-14-14-32-0x0-1x1-1x1-0-NCHW-FP32-F=miopenConvolutionFwdAlgoImplicitGEMM:ConvHipImplicitGemmV4R4Fwd,0.508321,0,miopenConvolutionFwdAlgoImplicitGEMM,<unused>;miopenConvolutionFwdAlgoDirect:ConvAsm1x1U,0.666881,0,miopenConvolutionFwdAlgoDirect,<unused>;miopenConvolutionFwdAlgoWinograd:ConvBinWinogradRxSf3x2,1.16576,0,miopenConvolutionFwdAlgoWinograd,<unused>;miopenConvolutionFwdAlgoGEMM:GemmFwd1x1_0_1,1.65008,0,miopenConvolutionFwdAlgoGEMM,<unused>
1168-14-14-1x1-384-14-14-32-0x0-1x1-1x1-0-NCHW-FP32-F=miopenConvolutionFwdAlgoImplicitGEMM:ConvHipImplicitGemmV4R1Fwd,0.55888,0,miopenConvolutionFwdAlgoImplicitGEMM,<unused>;miopenConvolutionFwdAlgoDirect:ConvOclDirectFwd1x1,0.67168,0,miopenConvolutionFwdAlgoDirect,<unused>;miopenConvolutionFwdAlgoWinograd:ConvBinWinogradRxSf3x2,1.18992,0,miopenConvolutionFwdAlgoWinograd,<unused>;miopenConvolutionFwdAlgoGEMM:GemmFwd1x1_0_1,1.64432,0,miopenConvolutionFwdAlgoGEMM,<unused>
1192-14-14-1x1-384-14-14-32-0x0-1x1-1x1-0-NCHW-FP32-F=miopenConvolutionFwdAlgoImplicitGEMM:ConvHipImplicitGemmV4R1Fwd,0.56576,0,miopenConvolutionFwdAlgoImplicitGEMM,<unused>;miopenConvolutionFwdAlgoDirect:ConvAsm1x1U,0.73824,0,miopenConvolutionFwdAlgoDirect,<unused>;miopenConvolutionFwdAlgoWinograd:ConvBinWinogradRxSf3x2,1.2112,0,miopenConvolutionFwdAlgoWinograd,<unused>;miopenConvolutionFwdAlgoGEMM:GemmFwd1x1_0_1,1.10944,0,miopenConvolutionFwdAlgoGEMM,<unused>
1216-14-14-1x1-384-14-14-32-0x0-1x1-1x1-0-NCHW-FP32-F=miopenConvolutionFwdAlgoImplicitGEMM:ConvHipImplicitGemmV4R4Fwd,0.589921,0,miopenConvolutionFwdAlgoImplicitGEMM,<unused>;miopenConvolutionFwdAlgoDirect:ConvOclDirectFwd1x1,0.71536,0,miopenConvolutionFwdAlgoDirect,<unused>;miopenConvolutionFwdAlgoWinograd:ConvBinWinogradRxSf3x2,1.236,0,miopenConvolutionFwdAlgoWinograd,<unused>;miopenConvolutionFwdAlgoGEMM:GemmFwd1x1_0_1,1.09664,0,miopenConvolutionFwdAlgoGEMM,<unused>
1240-14-14-1x1-384-14-14-32-0x0-1x1-1x1-0-NCHW-FP32-F=miopenConvolutionFwdAlgoImplicitGEMM:ConvHipImplicitGemmV4R1Fwd,0.58912,0,miopenConvolutionFwdAlgoImplicitGEMM,<unused>;miopenConvolutionFwdAlgoDirect:ConvAsm1x1U,0.72784,0,miopenConvolutionFwdAlgoDirect,<unused>;miopenConvolutionFwdAlgoWinograd:ConvBinWinogradRxSf3x2,1.25776,0,miopenConvolutionFwdAlgoWinograd,<unused>;miopenConvolutionFwdAlgoGEMM:GemmFwd1x1_0_1,1.13728,0,miopenConvolutionFwdAlgoGEMM,<unused>
1264-14-14-1x1-384-14-14-32-0x0-1x1-1x1-0-NCHW-FP32-F=miopenConvolutionFwdAlgoImplicitGEMM:ConvHipImplicitGemmV4R4Fwd,0.55808,0,miopenConvolutionFwdAlgoImplicitGEMM,<unused>;miopenConvolutionFwdAlgoDirect:ConvAsm1x1U,0.7368,0,miopenConvolutionFwdAlgoDirect,<unused>;miopenConvolutionFwdAlgoWinograd:ConvBinWinogradRxSf3x2,1.28208,0,miopenConvolutionFwdAlgoWinograd,<unused>;miopenConvolutionFwdAlgoGEMM:GemmFwd1x1_0_1,1.13072,0,miopenConvolutionFwdAlgoGEMM,<unused>
1288-14-14-1x1-384-14-14-32-0x0-1x1-1x1-0-NCHW-FP32-F=miopenConvolutionFwdAlgoImplicitGEMM:ConvHipImplicitGemmV4R1Fwd,0.61088,0,miopenConvolutionFwdAlgoImplicitGEMM,<unused>;miopenConvolutionFwdAlgoDirect:ConvAsm1x1U,0.818081,0,miopenConvolutionFwdAlgoDirect,<unused>;miopenConvolutionFwdAlgoWinograd:ConvBinWinogradRxSf3x2,1.30048,0,miopenConvolutionFwdAlgoWinograd,<unused>;miopenConvolutionFwdAlgoGEMM:GemmFwd1x1_0_1,1.17072,0,miopenConvolutionFwdAlgoGEMM,<unused>
1312-14-14-1x1-384-14-14-32-0x0-1x1-1x1-0-NCHW-FP32-F=miopenConvolutionFwdAlgoImplicitGEMM:ConvHipImplicitGemmV4R4Fwd,0.6264,0,miopenConvolutionFwdAlgoImplicitGEMM,<unused>;miopenConvolutionFwdAlgoDirect:ConvOclDirectFwd1x1,0.75584,0,miopenConvolutionFwdAlgoDirect,<unused>;miopenConvolutionFwdAlgoWinograd:ConvBinWinogradRxSf3x2,1.32624,0,miopenConvolutionFwdAlgoWinograd,<unused>;miopenConvolutionFwdAlgoGEMM:GemmFwd1x1_0_1,1.15248,0,miopenConvolutionFwdAlgoGEMM,<unused>
1336-14-14-1x1-384-14-14-32-0x0-1x1-1x1-0-NCHW-FP32-F=miopenConvolutionFwdAlgoImplicitGEMM:ConvHipImplicitGemmV4R4Fwd,0.638401,0,miopenConvolutionFwdAlgoImplicitGEMM,<unused>;miopenConvolutionFwdAlgoDirect:ConvAsm1x1U,0.82288,0,miopenConvolutionFwdAlgoDirect,<unused>;miopenConvolutionFwdAlgoWinograd:ConvBinWinogradRxSf3x2,1.58336,0,miopenConvolutionFwdAlgoWinograd,<unused>;miopenConvolutionFwdAlgoGEMM:GemmFwd1x1_0_1,1.19328,0,miopenConvolutionFwdAlgoGEMM,<unused>
1360-14-14-1x1-384-14-14-32-0x0-1x1-1x1-0-NCHW-FP32-F=miopenConvolutionFwdAlgoImplicitGEMM:ConvHipImplicitGemmV4R4Fwd,0.598241,0,miopenConvolutionFwdAlgoImplicitGEMM,<unused>;miopenConvolutionFwdAlgoDirect:ConvOclDirectFwd1x1,0.780481,0,miopenConvolutionFwdAlgoDirect,<unused>;miopenConvolutionFwdAlgoWinograd:ConvBinWinogradRxSf3x2,1.372,0,miopenConvolutionFwdAlgoWinograd,<unused>;miopenConvolutionFwdAlgoGEMM:GemmFwd1x1_0_1,1.2048,0,miopenConvolutionFwdAlgoGEMM,<unused>
1384-14-14-1x1-384-14-14-32-0x0-1x1-1x1-0-NCHW-FP32-F=miopenConvolutionFwdAlgoImplicitGEMM:ConvHipImplicitGemmV4R4Fwd,0.611361,0,miopenConvolutionFwdAlgoImplicitGEMM,<unused>;miopenConvolutionFwdAlgoDirect:ConvAsm1x1U,0.847201,0,miopenConvolutionFwdAlgoDirect,<unused>;miopenConvolutionFwdAlgoWinograd:ConvBinWinogradRxSf3x2,1.39344,0,miopenConvolutionFwdAlgoWinograd,<unused>;miopenConvolutionFwdAlgoGEMM:GemmFwd1x1_0_1,1.24176,0,miopenConvolutionFwdAlgoGEMM,<unused>
1408-14-14-1x1-384-14-14-32-0x0-1x1-1x1-0-NCHW-FP32-F=miopenConvolutionFwdAlgoImplicitGEMM:ConvHipImplicitGemmV4R4Fwd,0.669601,0,miopenConvolutionFwdAlgoImplicitGEMM,<unused>;miopenConvolutionFwdAlgoDirect:ConvOclDirectFwd1x1,0.918241,0,miopenConvolutionFwdAlgoDirect,<unused>;miopenConvolutionFwdAlgoWinograd:ConvBinWinogradRxSf3x2,1.41936,0,miopenConvolutionFwdAlgoWinograd,<unused>;miopenConvolutionFwdAlgoGEMM:GemmFwd1x1_0_1,1.23696,0,miopenConvolutionFwdAlgoGEMM,<unused>
1432-14-14-1x1-384-14-14-32-0x0-1x1-1x1-0-NCHW-FP32-F=miopenConvolutionFwdAlgoImplicitGEMM:ConvHipImplicitGemmV4R1Fwd,0.6792,0,miopenConvolutionFwdAlgoImplicitGEMM,<unused>;miopenConvolutionFwdAlgoDirect:ConvAsm1x1U,0.901121,0,miopenConvolutionFwdAlgoDirect,<unused>;miopenConvolutionFwdAlgoWinograd:ConvBinWinogradRxSf3x2,1.44048,0,miopenConvolutionFwdAlgoWinograd,<unused>;miopenConvolutionFwdAlgoGEMM:GemmFwd1x1_0_1,1.28528,0,miopenConvolutionFwdAlgoGEMM,<unused>
1456-14-14-1x1-384-14-14-32-0x0-1x1-1x1-0-NCHW-FP32-F=miopenConvolutionFwdAlgoImplicitGEMM:ConvHipImplicitGemmV4R1Fwd,0.68976,0,miopenConvolutionFwdAlgoImplicitGEMM,<unused>;miopenConvolutionFwdAlgoDirect:ConvOclDirectFwd1x1,0.87136,0,miopenConvolutionFwdAlgoDirect,<unused>;miopenConvolutionFwdAlgoWinograd:ConvBinWinogradRxSf3x2,1.46368,0,miopenConvolutionFwdAlgoWinograd,<unused>;miopenConvolutionFwdAlgoGEMM:GemmFwd1x1_0_1,1.25824,0,miopenConvolutionFwdAlgoGEMM,<unused>
1480-14-14-1x1-384-14-14-32-0x0-1x1-1x1-0-NCHW-FP32-F=miopenConvolutionFwdAlgoImplicitGEMM:ConvHipImplicitGemmV4R4Fwd,0.70496,0,miopenConvolutionFwdAlgoImplicitGEMM,<unused>;miopenConvolutionFwdAlgoDirect:ConvAsm1x1U,0.93248,0,miopenConvolutionFwdAlgoDirect,<unused>;miopenConvolutionFwdAlgoWinograd:ConvBinWinogradRxSf3x2,1.48256,0,miopenConvolutionFwdAlgoWinograd,<unused>;miopenConvolutionFwdAlgoGEMM:GemmFwd1x1_0_1,1.26928,0,miopenConvolutionFwdAlgoGEMM,<unused>
1504-14-14-1x1-384-14-14-32-0x0-1x1-1x1-0-NCHW-FP32-F=miopenConvolutionFwdAlgoImplicitGEMM:ConvHipImplicitGemmV4R4Fwd,0.71776,0,miopenConvolutionFwdAlgoImplicitGEMM,<unused>;miopenConvolutionFwdAlgoDirect:ConvOclDirectFwd1x1,0.87328,0,miopenConvolutionFwdAlgoDirect,<unused>;miopenConvolutionFwdAlgoWinograd:ConvBinWinogradRxSf3x2,1.51024,0,miopenConvolutionFwdAlgoWinograd,<unused>;miopenConvolutionFwdAlgoGEMM:GemmFwd1x1_0_1,1.24672,0,miopenConvolutionFwdAlgoGEMM,<unused>
1528-14-14-1x1-384-14-14-32-0x0-1x1-1x1-0-NCHW-FP32-F=miopenConvolutionFwdAlgoImplicitGEMM:ConvHipImplicitGemmV4R4Fwd,0.726881,0,miopenConvolutionFwdAlgoImplicitGEMM,<unused>;miopenConvolutionFwdAlgoDirect:ConvAsm1x1U,0.9408,0,miopenConvolutionFwdAlgoDirect,<unused>;miopenConvolutionFwdAlgoWinograd:ConvBinWinogradRxSf3x2,1.53088,0,miopenConvolutionFwdAlgoWinograd,<unused>;miopenConvolutionFwdAlgoGEMM:GemmFwd1x1_0_1,1.31136,0,miopenConvolutionFwdAlgoGEMM,<unused>
1552-14-14-1x1-2304-7-7-32-0x0-2x2-1x1-0-NCHW-FP32-F=miopenConvolutionFwdAlgoImplicitGEMM:ConvHipImplicitGemmV4R4Fwd,1.4952,0,miopenConvolutionFwdAlgoImplicitGEMM,<unused>;miopenConvolutionFwdAlgoDirect:ConvAsm1x1U,1.58992,9734144,miopenConvolutionFwdAlgoDirect,<unused>;miopenConvolutionFwdAlgoWinograd:ConvBinWinogradRxSf2x3g1,11.2261,0,miopenConvolutionFwdAlgoWinograd,<unused>;miopenConvolutionFwdAlgoGEMM:GemmFwd1x1_0_2,1.39616,24184832,miopenConvolutionFwdAlgoGEMM,<unused>
1552-14-14-1x1-768-14-14-32-0x0-1x1-1x1-0-NCHW-FP32-F=miopenConvolutionFwdAlgoImplicitGEMM:ConvHipImplicitGemmV4R1Fwd,1.30368,0,miopenConvolutionFwdAlgoImplicitGEMM,<unused>;miopenConvolutionFwdAlgoDirect:ConvAsm1x1U,1.79728,0,miopenConvolutionFwdAlgoDirect,<unused>;miopenConvolutionFwdAlgoWinograd:ConvBinWinogradRxSf3x2,3.07152,0,miopenConvolutionFwdAlgoWinograd,<unused>;miopenConvolutionFwdAlgoGEMM:GemmFwd1x1_0_1,2.06256,0,miopenConvolutionFwdAlgoGEMM,<unused>
768-14-14-3x3-768-7-7-32-1x1-2x2-1x1-0-NCHW-FP32-F_g32=miopenConvolutionFwdAlgoImplicitGEMM:ConvMlirIgemmFwd,0.49616,0,miopenConvolutionFwdAlgoImplicitGEMM,<unused>;miopenConvolutionFwdAlgoDirect:ConvOclDirectFwd,0.29584,0,miopenConvolutionFwdAlgoDirect,<unused>;miopenConvolutionFwdAlgoWinograd:ConvBinWinogradRxSf2x3,0.29712,0,miopenConvolutionFwdAlgoWinograd,<unused>;miopenConvolutionFwdAlgoGEMM:GemmFwdRest,2.64192,1354752,miopenConvolutionFwdAlgoGEMM,<unused>
768-7-7-1x1-2176-7-7-32-0x0-1x1-1x1-0-NCHW-FP32-F=miopenConvolutionFwdAlgoImplicitGEMM:ConvHipImplicitGemmV4R1Fwd,0.73968,0,miopenConvolutionFwdAlgoImplicitGEMM,<unused>;miopenConvolutionFwdAlgoDirect:ConvAsm1x1U,0.73648,0,miopenConvolutionFwdAlgoDirect,<unused>;miopenConvolutionFwdAlgoWinograd:ConvBinWinogradRxSf3x2,1.69248,0,miopenConvolutionFwdAlgoWinograd,<unused>;miopenConvolutionFwdAlgoGEMM:GemmFwd1x1_0_1,0.96592,0,miopenConvolutionFwdAlgoGEMM,<unused>
2432-7-7-1x1-768-7-7-32-0x0-1x1-1x1-0-NCHW-FP32-F=miopenConvolutionFwdAlgoImplicitGEMM:ConvHipImplicitGemmV4R1Fwd,0.87888,0,miopenConvolutionFwdAlgoImplicitGEMM,<unused>;miopenConvolutionFwdAlgoDirect:ConvAsm1x1U,0.87952,0,miopenConvolutionFwdAlgoDirect,<unused>;miopenConvolutionFwdAlgoWinograd:ConvBinWinogradRxSf3x2,1.9152,0,miopenConvolutionFwdAlgoWinograd,<unused>;miopenConvolutionFwdAlgoGEMM:GemmFwd1x1_0_1,1.78928,0,miopenConvolutionFwdAlgoGEMM,<unused>
768-7-7-3x3-768-7-7-32-1x1-1x1-1x1-0-NCHW-FP32-F_g32=miopenConvolutionFwdAlgoImplicitGEMM:ConvMlirIgemmFwd,0.49504,0,miopenConvolutionFwdAlgoImplicitGEMM,<unused>;miopenConvolutionFwdAlgoDirect:ConvOclDirectFwd,0.20784,0,miopenConvolutionFwdAlgoDirect,<unused>;miopenConvolutionFwdAlgoWinograd:ConvBinWinogradRxSf2x3,0.13904,0,miopenConvolutionFwdAlgoWinograd,<unused>;miopenConvolutionFwdAlgoGEMM:GemmFwdRest,2.08384,1354752,miopenConvolutionFwdAlgoGEMM,<unused>
2560-7-7-1x1-768-7-7-32-0x0-1x1-1x1-0-NCHW-FP32-F=miopenConvolutionFwdAlgoImplicitGEMM:ConvHipImplicitGemmV4R1Fwd,1.13072,0,miopenConvolutionFwdAlgoImplicitGEMM,<unused>;miopenConvolutionFwdAlgoDirect:ConvAsm1x1U,0.992001,0,miopenConvolutionFwdAlgoDirect,<unused>;miopenConvolutionFwdAlgoWinograd:ConvBinWinogradRxSf3x2,2.01856,0,miopenConvolutionFwdAlgoWinograd,<unused>;miopenConvolutionFwdAlgoGEMM:GemmFwd1x1_0_1,1.87408,0,miopenConvolutionFwdAlgoGEMM,<unused>
2688-1-1-1x1-1000-1-1-32-0x0-1x1-1x1-0-NCHW-FP32-F=miopenConvolutionFwdAlgoImplicitGEMM:ConvMlirIgemmFwd,1.1488,0,miopenConvolutionFwdAlgoImplicitGEMM,<unused>;miopenConvolutionFwdAlgoDirect:ConvOclDirectFwd1x1,0.2096,0,miopenConvolutionFwdAlgoDirect,<unused>;miopenConvolutionFwdAlgoWinograd:ConvBinWinogradRxSf3x2,0.55104,0,miopenConvolutionFwdAlgoWinograd,<unused>;miopenConvolutionFwdAlgoGEMM:GemmFwd1x1_0_1,0.860641,0,miopenConvolutionFwdAlgoGEMM,<unused>
64-56-56-1x1-64-56-56-32-0x0-1x1-1x1-0-NCHW-FP32-F=miopenConvolutionFwdAlgoImplicitGEMM:ConvHipImplicitGemmV4R4Fwd,0.11408,0,miopenConvolutionFwdAlgoImplicitGEMM,<unused>;miopenConvolutionFwdAlgoDirect:ConvAsm1x1U,0.12336,0,miopenConvolutionFwdAlgoDirect,<unused>;miopenConvolutionFwdAlgoWinograd:ConvBinWinogradRxSf3x2,0.265281,0,miopenConvolutionFwdAlgoWinograd,<unused>;miopenConvolutionFwdAlgoGEMM:GemmFwd1x1_0_1,0.12272,0,miopenConvolutionFwdAlgoGEMM,<unused>
64-56-56-3x3-64-56-56-32-1x1-1x1-1x1-0-NCHW-FP32-F=miopenConvolutionFwdAlgoWinograd:ConvBinWinogradRxSf2x3g1,0.424161,0,miopenConvolutionFwdAlgoWinograd,<unused>
128-56-56-1x1-256-56-56-32-0x0-1x1-1x1-0-NCHW-FP32-F=miopenConvolutionFwdAlgoImplicitGEMM:ConvHipImplicitGemmV4R4Fwd,0.608001,0,miopenConvolutionFwdAlgoImplicitGEMM,<unused>;miopenConvolutionFwdAlgoDirect:ConvAsm1x1U,0.686881,0,miopenConvolutionFwdAlgoDirect,<unused>;miopenConvolutionFwdAlgoWinograd:ConvBinWinogradRxSf3x2,1.45136,0,miopenConvolutionFwdAlgoWinograd,<unused>;miopenConvolutionFwdAlgoGEMM:GemmFwd1x1_0_1,0.660321,0,miopenConvolutionFwdAlgoGEMM,<unused>
256-56-56-1x1-64-56-56-32-0x0-1x1-1x1-0-NCHW-FP32-F=miopenConvolutionFwdAlgoImplicitGEMM:ConvHipImplicitGemmV4R4Fwd,0.326721,0,miopenConvolutionFwdAlgoImplicitGEMM,<unused>;miopenConvolutionFwdAlgoDirect:ConvAsm1x1U,0.41824,0,miopenConvolutionFwdAlgoDirect,<unused>;miopenConvolutionFwdAlgoWinograd:ConvBinWinogradRxSf3x2,0.779361,0,miopenConvolutionFwdAlgoWinograd,<unused>;miopenConvolutionFwdAlgoGEMM:GemmFwd1x1_0_1,0.391841,0,miopenConvolutionFwdAlgoGEMM,<unused>
64-56-56-1x1-256-56-56-32-0x0-1x1-1x1-0-NCHW-FP32-F=miopenConvolutionFwdAlgoImplicitGEMM:ConvAsmImplicitGemmV4R1DynamicFwd,0.390561,0,miopenConvolutionFwdAlgoImplicitGEMM,<unused>;miopenConvolutionFwdAlgoDirect:ConvAsm1x1U,0.383681,0,miopenConvolutionFwdAlgoDirect,<unused>;miopenConvolutionFwdAlgoWinograd:ConvBinWinogradRxSf3x2,0.961762,0,miopenConvolutionFwdAlgoWinograd,<unused>;miopenConvolutionFwdAlgoGEMM:GemmFwd1x1_0_1,0.472961,0,miopenConvolutionFwdAlgoGEMM,<unused>
128-56-56-3x3-128-28-28-32-1x1-2x2-1x1-0-NCHW-FP32-F=miopenConvolutionFwdAlgoImplicitGEMM:ConvHipImplicitGemmV4R1Fwd,0.852161,0,miopenConvolutionFwdAlgoImplicitGEMM,<unused>;miopenConvolutionFwdAlgoDirect:ConvOclDirectFwd,4.37313,0,miopenConvolutionFwdAlgoDirect,<unused>;miopenConvolutionFwdAlgoWinograd:ConvBinWinogradRxSf2x3g1,1.54768,0,miopenConvolutionFwdAlgoWinograd,<unused>;miopenConvolutionFwdAlgoGEMM:GemmFwdRest,4.5824,3612672,miopenConvolutionFwdAlgoGEMM,<unused>
384-28-28-1x1-512-28-28-32-0x0-1x1-1x1-0-NCHW-FP32-F=miopenConvolutionFwdAlgoImplicitGEMM:ConvHipImplicitGemmV4R4Fwd,0.92048,0,miopenConvolutionFwdAlgoImplicitGEMM,<unused>;miopenConvolutionFwdAlgoDirect:ConvOclDirectFwd1x1,1.03664,0,miopenConvolutionFwdAlgoDirect,<unused>;miopenConvolutionFwdAlgoWinograd:ConvBinWinogradRxSf3x2,2.15104,0,miopenConvolutionFwdAlgoWinograd,<unused>;miopenConvolutionFwdAlgoGEMM:GemmFwd1x1_0_1,1.27456,0,miopenConvolutionFwdAlgoGEMM,<unused>
512-28-28-1x1-128-28-28-32-0x0-1x1-1x1-0-NCHW-FP32-F=miopenConvolutionFwdAlgoImplicitGEMM:ConvHipImplicitGemmV4R1Fwd,0.34624,0,miopenConvolutionFwdAlgoImplicitGEMM,<unused>;miopenConvolutionFwdAlgoDirect:ConvAsm1x1U,0.51024,0,miopenConvolutionFwdAlgoDirect,<unused>;miopenConvolutionFwdAlgoWinograd:ConvBinWinogradRxSf3x2,0.75712,0,miopenConvolutionFwdAlgoWinograd,<unused>;miopenConvolutionFwdAlgoGEMM:GemmFwd1x1_0_1,0.42144,0,miopenConvolutionFwdAlgoGEMM,<unused>
128-28-28-3x3-128-28-28-32-1x1-1x1-1x1-0-NCHW-FP32-F=miopenConvolutionFwdAlgoWinograd:ConvBinWinogradRxSf2x3g1,0.40592,0,miopenConvolutionFwdAlgoWinograd,<unused>
128-28-28-1x1-512-28-28-32-0x0-1x1-1x1-0-NCHW-FP32-F=miopenConvolutionFwdAlgoImplicitGEMM:ConvHipImplicitGemmV4R4Fwd,0.33568,0,miopenConvolutionFwdAlgoImplicitGEMM,<unused>;miopenConvolutionFwdAlgoDirect:ConvOclDirectFwd1x1,0.40672,0,miopenConvolutionFwdAlgoDirect,<unused>;miopenConvolutionFwdAlgoWinograd:ConvBinWinogradRxSf3x2,0.89072,0,miopenConvolutionFwdAlgoWinograd,<unused>;miopenConvolutionFwdAlgoGEMM:GemmFwd1x1_0_1,0.3832,0,miopenConvolutionFwdAlgoGEMM,<unused>
256-28-28-3x3-256-14-14-32-1x1-2x2-1x1-0-NCHW-FP32-F=miopenConvolutionFwdAlgoImplicitGEMM:ConvAsmImplicitGemmV4R1DynamicFwd,0.8784,0,miopenConvolutionFwdAlgoImplicitGEMM,<unused>;miopenConvolutionFwdAlgoDirect:ConvOclDirectFwd,2.9824,0,miopenConvolutionFwdAlgoDirect,<unused>;miopenConvolutionFwdAlgoWinograd:ConvBinWinogradRxSf2x3g1,1.53088,0,miopenConvolutionFwdAlgoWinograd,<unused>;miopenConvolutionFwdAlgoGEMM:GemmFwdRest,5.04826,1806336,miopenConvolutionFwdAlgoGEMM,<unused>
768-14-14-1x1-1024-14-14-32-0x0-1x1-1x1-0-NCHW-FP32-F=miopenConvolutionFwdAlgoImplicitGEMM:ConvAsmImplicitGemmV4R1DynamicFwd_1x1,0.93328,0,miopenConvolutionFwdAlgoImplicitGEMM,<unused>;miopenConvolutionFwdAlgoDirect:ConvAsm1x1U,1.26576,0,miopenConvolutionFwdAlgoDirect,<unused>;miopenConvolutionFwdAlgoWinograd:ConvBinWinogradRxSf3x2,2.16912,0,miopenConvolutionFwdAlgoWinograd,<unused>;miopenConvolutionFwdAlgoGEMM:GemmFwd1x1_0_1,1.51408,0,miopenConvolutionFwdAlgoGEMM,<unused>
1024-14-14-1x1-256-14-14-32-0x0-1x1-1x1-0-NCHW-FP32-F=miopenConvolutionFwdAlgoImplicitGEMM:ConvHipImplicitGemmV4R4Fwd,0.40672,0,miopenConvolutionFwdAlgoImplicitGEMM,<unused>;miopenConvolutionFwdAlgoDirect:ConvAsm1x1U,0.59104,0,miopenConvolutionFwdAlgoDirect,<unused>;miopenConvolutionFwdAlgoWinograd:ConvBinWinogradRxSf3x2,0.83904,0,miopenConvolutionFwdAlgoWinograd,<unused>;miopenConvolutionFwdAlgoGEMM:GemmFwd1x1_0_1,0.53088,0,miopenConvolutionFwdAlgoGEMM,<unused>
256-14-14-3x3-256-14-14-32-1x1-1x1-1x1-0-NCHW-FP32-F=miopenConvolutionFwdAlgoWinograd:ConvBinWinogradRxSf2x3g1,0.39152,0,miopenConvolutionFwdAlgoWinograd,<unused>
256-14-14-1x1-1024-14-14-32-0x0-1x1-1x1-0-NCHW-FP32-F=miopenConvolutionFwdAlgoImplicitGEMM:ConvHipImplicitGemmV4R1Fwd,0.33904,0,miopenConvolutionFwdAlgoImplicitGEMM,<unused>;miopenConvolutionFwdAlgoDirect:ConvAsm1x1U,0.56512,0,miopenConvolutionFwdAlgoDirect,<unused>;miopenConvolutionFwdAlgoWinograd:ConvBinWinogradRxSf3x2,0.804,0,miopenConvolutionFwdAlgoWinograd,<unused>;miopenConvolutionFwdAlgoGEMM:GemmFwd1x1_0_1,0.49712,0,miopenConvolutionFwdAlgoGEMM,<unused>
512-14-14-3x3-512-7-7-32-1x1-2x2-1x1-0-NCHW-FP32-F=miopenConvolutionFwdAlgoImplicitGEMM:ConvHipImplicitGemmV4R1Fwd,1.41648,0,miopenConvolutionFwdAlgoImplicitGEMM,<unused>;miopenConvolutionFwdAlgoDirect:ConvOclDirectFwd,4.28,0,miopenConvolutionFwdAlgoDirect,<unused>;miopenConvolutionFwdAlgoWinograd:ConvBinWinogradRxSf2x3,2.17664,0,miopenConvolutionFwdAlgoWinograd,<unused>;miopenConvolutionFwdAlgoGEMM:GemmFwdRest,14.9299,903168,miopenConvolutionFwdAlgoGEMM,<unused>
1536-7-7-1x1-2048-7-7-32-0x0-1x1-1x1-0-NCHW-FP32-F=miopenConvolutionFwdAlgoImplicitGEMM:ConvHipImplicitGemmV4R1Fwd,1.54704,0,miopenConvolutionFwdAlgoImplicitGEMM,<unused>;miopenConvolutionFwdAlgoDirect:ConvAsm1x1U,1.42656,0,miopenConvolutionFwdAlgoDirect,<unused>;miopenConvolutionFwdAlgoWinograd:ConvBinWinogradRxSf3x2,3.01616,0,miopenConvolutionFwdAlgoWinograd,<unused>;miopenConvolutionFwdAlgoGEMM:GemmFwd1x1_0_1,2.06304,0,miopenConvolutionFwdAlgoGEMM,<unused>
2048-7-7-1x1-512-7-7-32-0x0-1x1-1x1-0-NCHW-FP32-F=miopenConvolutionFwdAlgoImplicitGEMM:ConvHipImplicitGemmV4R4Fwd,0.78672,0,miopenConvolutionFwdAlgoImplicitGEMM,<unused>;miopenConvolutionFwdAlgoDirect:ConvAsm1x1U,0.63424,0,miopenConvolutionFwdAlgoDirect,<unused>;miopenConvolutionFwdAlgoWinograd:ConvBinWinogradRxSf3x2,1.22128,0,miopenConvolutionFwdAlgoWinograd,<unused>;miopenConvolutionFwdAlgoGEMM:GemmFwd1x1_0_1,1.20272,0,miopenConvolutionFwdAlgoGEMM,<unused>
512-7-7-3x3-512-7-7-32-1x1-1x1-1x1-0-NCHW-FP32-F=miopenConvolutionFwdAlgoWinograd:ConvBinWinogradRxSf2x3g1,0.5456,0,miopenConvolutionFwdAlgoWinograd,<unused>
512-7-7-1x1-2048-7-7-32-0x0-1x1-1x1-0-NCHW-FP32-F=miopenConvolutionFwdAlgoImplicitGEMM:ConvHipImplicitGemmV4R1Fwd,0.56144,0,miopenConvolutionFwdAlgoImplicitGEMM,<unused>;miopenConvolutionFwdAlgoDirect:ConvAsm1x1U,0.59536,0,miopenConvolutionFwdAlgoDirect,<unused>;miopenConvolutionFwdAlgoWinograd:ConvBinWinogradRxSf3x2,1.25456,0,miopenConvolutionFwdAlgoWinograd,<unused>;miopenConvolutionFwdAlgoGEMM:GemmFwd1x1_0_1,0.69744,0,miopenConvolutionFwdAlgoGEMM,<unused>
3-299-299-3x3-32-149-149-16-0x0-2x2-1x1-0-NCHW-FP32-F=miopenConvolutionFwdAlgoImplicitGEMM:ConvMlirIgemmFwd,0.393284,0,miopenConvolutionFwdAlgoImplicitGEMM,<unused>;miopenConvolutionFwdAlgoDirect:ConvOclDirectFwd,0.297763,0,miopenConvolutionFwdAlgoDirect,<unused>;miopenConvolutionFwdAlgoWinograd:ConvBinWinogradRxSf2x3g1,0.289603,0,miopenConvolutionFwdAlgoWinograd,<unused>;miopenConvolutionFwdAlgoGEMM:GemmFwdRest,1.24416,2397708,miopenConvolutionFwdAlgoGEMM,<unused>
32-149-149-3x3-32-147-147-16-0x0-1x1-1x1-0-NCHW-FP32-F=miopenConvolutionFwdAlgoImplicitGEMM:ConvMlirIgemmFwd,2.33267,0,miopenConvolutionFwdAlgoImplicitGEMM,<unused>;miopenConvolutionFwdAlgoDirect:ConvOclDirectFwd,1.66898,0,miopenConvolutionFwdAlgoDirect,<unused>;miopenConvolutionFwdAlgoWinograd:ConvBinWinogradRxSf2x3g1,0.429285,0,miopenConvolutionFwdAlgoWinograd,<unused>;miopenConvolutionFwdAlgoGEMM:GemmFwdRest,3.24098,24893568,miopenConvolutionFwdAlgoGEMM,<unused>
32-147-147-3x3-64-147-147-16-1x1-1x1-1x1-0-NCHW-FP32-F=miopenConvolutionFwdAlgoWinograd:ConvBinWinograd3x3U,0.812008,0,miopenConvolutionFwdAlgoWinograd,<unused>
64-147-147-3x3-96-73-73-16-0x0-2x2-1x1-0-NCHW-FP32-F=miopenConvolutionFwdAlgoImplicitGEMM:ConvMlirIgemmFwd,2.45619,0,miopenConvolutionFwdAlgoImplicitGEMM,<unused>;miopenConvolutionFwdAlgoDirect:ConvOclDirectFwd,5.19206,0,miopenConvolutionFwdAlgoDirect,<unused>;miopenConvolutionFwdAlgoWinograd:ConvBinWinogradRxSf2x3g1,1.99298,0,miopenConvolutionFwdAlgoWinograd,<unused>;miopenConvolutionFwdAlgoGEMM:GemmFwdRest,3.04643,12278016,miopenConvolutionFwdAlgoGEMM,<unused>
160-73-73-1x1-128-73-73-16-0x0-1x1-1x1-0-NCHW-FP32-F=miopenConvolutionFwdAlgoImplicitGEMM:ConvMlirIgemmFwd,0.877126,0,miopenConvolutionFwdAlgoImplicitGEMM,<unused>;miopenConvolutionFwdAlgoDirect:ConvOclDirectFwd1x1,0.424803,0,miopenConvolutionFwdAlgoDirect,<unused>;miopenConvolutionFwdAlgoWinograd:ConvBinWinogradRxSf3x2,0.778565,0,miopenConvolutionFwdAlgoWinograd,<unused>;miopenConvolutionFwdAlgoGEMM:GemmFwd1x1_0_1,0.370242,0,miopenConvolutionFwdAlgoGEMM,<unused>
64-73-73-3x3-96-71-71-16-0x0-1x1-1x1-0-NCHW-FP32-F=miopenConvolutionFwdAlgoImplicitGEMM:ConvMlirIgemmFwd,2.24977,0,miopenConvolutionFwdAlgoImplicitGEMM,<unused>;miopenConvolutionFwdAlgoDirect:ConvOclDirectFwd,2.51378,0,miopenConvolutionFwdAlgoDirect,<unused>;miopenConvolutionFwdAlgoWinograd:ConvBinWinogradRxSf2x3g1,0.519363,0,miopenConvolutionFwdAlgoWinograd,<unused>;miopenConvolutionFwdAlgoGEMM:GemmFwdRest,3.09506,11614464,miopenConvolutionFwdAlgoGEMM,<unused>
64-73-73-1x7-64-73-73-16-0x3-1x1-1x1-0-NCHW-FP32-F=miopenConvolutionFwdAlgoDirect:ConvDirectNaiveConvFwd,11.1293,0,miopenConvolutionFwdAlgoDirect,<unused>;miopenConvolutionFwdAlgoWinograd:ConvBinWinogradRxSf3x2,0.676644,0,miopenConvolutionFwdAlgoWinograd,<unused>;miopenConvolutionFwdAlgoGEMM:GemmFwdRest,2.10176,9549568,miopenConvolutionFwdAlgoGEMM,<unused>
64-73-73-7x1-64-73-73-16-3x0-1x1-1x1-0-NCHW-FP32-F=miopenConvolutionFwdAlgoDirect:ConvDirectNaiveConvFwd,18.3356,0,miopenConvolutionFwdAlgoDirect,<unused>;miopenConvolutionFwdAlgoWinograd:ConvBinWinogradRxSf3x2,0.719684,0,miopenConvolutionFwdAlgoWinograd,<unused>;miopenConvolutionFwdAlgoGEMM:GemmFwdRest,2.01984,9549568,miopenConvolutionFwdAlgoGEMM,<unused>
192-71-71-3x3-192-35-35-16-0x0-2x2-1x1-0-NCHW-FP32-F=miopenConvolutionFwdAlgoImplicitGEMM:ConvMlirIgemmFwd,13.2236,0,miopenConvolutionFwdAlgoImplicitGEMM,<unused>;miopenConvolutionFwdAlgoDirect:ConvOclDirectFwd,7.68165,0,miopenConvolutionFwdAlgoDirect,<unused>;miopenConvolutionFwdAlgoWinograd:ConvBinWinogradRxSf2x3g1,2.79506,0,miopenConvolutionFwdAlgoWinograd,<unused>;miopenConvolutionFwdAlgoGEMM:GemmFwdRest,3.10272,8467200,miopenConvolutionFwdAlgoGEMM,<unused>
384-35-35-1x1-128-35-35-16-0x0-1x1-1x1-0-NCHW-FP32-F=miopenConvolutionFwdAlgoImplicitGEMM:ConvMlirIgemmFwd,0.538563,0,miopenConvolutionFwdAlgoImplicitGEMM,<unused>;miopenConvolutionFwdAlgoDirect:ConvAsm1x1U,0.267201,0,miopenConvolutionFwdAlgoDirect,<unused>;miopenConvolutionFwdAlgoWinograd:ConvBinWinogradRxSf3x2,0.433122,0,miopenConvolutionFwdAlgoWinograd,<unused>;miopenConvolutionFwdAlgoGEMM:GemmFwd1x1_0_1,0.244481,0,miopenConvolutionFwdAlgoGEMM,<unused>
384-35-35-1x1-96-35-35-16-0x0-1x1-1x1-0-NCHW-FP32-F=miopenConvolutionFwdAlgoImplicitGEMM:ConvMlirIgemmFwd,0.517442,0,miopenConvolutionFwdAlgoImplicitGEMM,<unused>;miopenConvolutionFwdAlgoDirect:ConvAsm1x1U,0.188641,0,miopenConvolutionFwdAlgoDirect,<unused>;miopenConvolutionFwdAlgoWinograd:ConvBinWinogradRxSf3x2,0.352642,0,miopenConvolutionFwdAlgoWinograd,<unused>;miopenConvolutionFwdAlgoGEMM:GemmFwd1x1_0_1,0.180161,0,miopenConvolutionFwdAlgoGEMM,<unused>
64-35-35-3x3-96-35-35-16-1x1-1x1-1x1-0-NCHW-FP32-F=miopenConvolutionFwdAlgoWinograd:ConvBinWinogradRxSf2x3g1,0.154401,0,miopenConvolutionFwdAlgoWinograd,<unused>
96-35-35-3x3-96-35-35-16-1x1-1x1-1x1-0-NCHW-FP32-F=miopenConvolutionFwdAlgoWinograd:ConvBinWinograd3x3U,0.21776,0,miopenConvolutionFwdAlgoWinograd,<unused>
384-35-35-3x3-384-17-17-16-0x0-2x2-1x1-0-NCHW-FP32-F=miopenConvolutionFwdAlgoImplicitGEMM:ConvMlirIgemmFwd,2.66817,0,miopenConvolutionFwdAlgoImplicitGEMM,<unused>;miopenConvolutionFwdAlgoDirect:ConvOclDirectFwd,27.2019,0,miopenConvolutionFwdAlgoDirect,<unused>;miopenConvolutionFwdAlgoWinograd:ConvBinWinogradRxS,2.89761,0,miopenConvolutionFwdAlgoWinograd,<unused>;miopenConvolutionFwdAlgoGEMM:GemmFwdRest,2.64448,3995136,miopenConvolutionFwdAlgoGEMM,<unused>
384-35-35-1x1-192-35-35-16-0x0-1x1-1x1-0-NCHW-FP32-F=miopenConvolutionFwdAlgoImplicitGEMM:ConvMlirIgemmFwd,0.703524,0,miopenConvolutionFwdAlgoImplicitGEMM,<unused>;miopenConvolutionFwdAlgoDirect:ConvAsm1x1U,0.415362,0,miopenConvolutionFwdAlgoDirect,<unused>;miopenConvolutionFwdAlgoWinograd:ConvBinWinogradRxSf3x2,0.666722,0,miopenConvolutionFwdAlgoWinograd,<unused>;miopenConvolutionFwdAlgoGEMM:GemmFwd1x1_0_1,0.320481,0,miopenConvolutionFwdAlgoGEMM,<unused>
192-35-35-3x3-224-35-35-16-1x1-1x1-1x1-0-NCHW-FP32-F=miopenConvolutionFwdAlgoWinograd:ConvBinWinogradRxSf2x3g1,0.785604,0,miopenConvolutionFwdAlgoWinograd,<unused>
224-35-35-3x3-256-17-17-16-0x0-2x2-1x1-0-NCHW-FP32-F=miopenConvolutionFwdAlgoImplicitGEMM:ConvMlirIgemmFwd,1.53937,0,miopenConvolutionFwdAlgoImplicitGEMM,<unused>;miopenConvolutionFwdAlgoDirect:ConvOclDirectFwd,10.5061,0,miopenConvolutionFwdAlgoDirect,<unused>;miopenConvolutionFwdAlgoWinograd:ConvBinWinogradRxSf2x3g1,1.15697,0,miopenConvolutionFwdAlgoWinograd,<unused>;miopenConvolutionFwdAlgoGEMM:GemmFwdRest,1.6717,2330496,miopenConvolutionFwdAlgoGEMM,<unused>
1024-17-17-1x1-768-17-17-16-0x0-1x1-1x1-0-NCHW-FP32-F=miopenConvolutionFwdAlgoImplicitGEMM:ConvMlirIgemmFwd,1.95793,0,miopenConvolutionFwdAlgoImplicitGEMM,<unused>;miopenConvolutionFwdAlgoDirect:ConvAsm1x1U,0.988803,0,miopenConvolutionFwdAlgoDirect,<unused>;miopenConvolutionFwdAlgoWinograd:ConvBinWinogradRxSf3x2,1.63345,0,miopenConvolutionFwdAlgoWinograd,<unused>;miopenConvolutionFwdAlgoGEMM:GemmFwd1x1_0_1,0.892803,0,miopenConvolutionFwdAlgoGEMM,<unused>
192-17-17-1x7-224-17-17-16-0x3-1x1-1x1-0-NCHW-FP32-F=miopenConvolutionFwdAlgoDirect:ConvDirectNaiveConvFwd,7.2061,0,miopenConvolutionFwdAlgoDirect,<unused>;miopenConvolutionFwdAlgoWinograd:ConvBinWinogradRxSf3x2,0.490402,0,miopenConvolutionFwdAlgoWinograd,<unused>;miopenConvolutionFwdAlgoGEMM:GemmFwdRest,1.2032,1553664,miopenConvolutionFwdAlgoGEMM,<unused>
224-17-17-7x1-256-17-17-16-3x0-1x1-1x1-0-NCHW-FP32-F=miopenConvolutionFwdAlgoDirect:ConvDirectNaiveConvFwd,13.9821,0,miopenConvolutionFwdAlgoDirect,<unused>;miopenConvolutionFwdAlgoWinograd:ConvBinWinogradRxSf3x2,0.602562,0,miopenConvolutionFwdAlgoWinograd,<unused>;miopenConvolutionFwdAlgoGEMM:GemmFwdRest,1.37728,1812608,miopenConvolutionFwdAlgoGEMM,<unused>
192-17-17-7x1-192-17-17-16-3x0-1x1-1x1-0-NCHW-FP32-F=miopenConvolutionFwdAlgoDirect:ConvDirectNaiveConvFwd,9.54675,0,miopenConvolutionFwdAlgoDirect,<unused>;miopenConvolutionFwdAlgoWinograd:ConvBinWinogradRxSf3x2,0.357601,0,miopenConvolutionFwdAlgoWinograd,<unused>;miopenConvolutionFwdAlgoGEMM:GemmFwdRest,1.21856,1553664,miopenConvolutionFwdAlgoGEMM,<unused>
224-17-17-7x1-224-17-17-16-3x0-1x1-1x1-0-NCHW-FP32-F=miopenConvolutionFwdAlgoDirect:ConvDirectNaiveConvFwd,12.4356,0,miopenConvolutionFwdAlgoDirect,<unused>;miopenConvolutionFwdAlgoWinograd:ConvBinWinogradRxSf3x2,0.571842,0,miopenConvolutionFwdAlgoWinograd,<unused>;miopenConvolutionFwdAlgoGEMM:GemmFwdRest,1.41824,1812608,miopenConvolutionFwdAlgoGEMM,<unused>
224-17-17-1x7-256-17-17-16-0x3-1x1-1x1-0-NCHW-FP32-F=miopenConvolutionFwdAlgoDirect:ConvDirectNaiveConvFwd,8.84771,0,miopenConvolutionFwdAlgoDirect,<unused>;miopenConvolutionFwdAlgoWinograd:ConvBinWinogradRxSf3x2,0.554242,0,miopenConvolutionFwdAlgoWinograd,<unused>;miopenConvolutionFwdAlgoGEMM:GemmFwdRest,1.38496,1812608,miopenConvolutionFwdAlgoGEMM,<unused>
1024-17-17-1x1-128-17-17-16-0x0-1x1-1x1-0-NCHW-FP32-F=miopenConvolutionFwdAlgoImplicitGEMM:ConvMlirIgemmFwd,0.468481,0,miopenConvolutionFwdAlgoImplicitGEMM,<unused>;miopenConvolutionFwdAlgoDirect:ConvAsm1x1U,0.324961,0,miopenConvolutionFwdAlgoDirect,<unused>;miopenConvolutionFwdAlgoWinograd:ConvBinWinogradRxSf3x2,0.465122,0,miopenConvolutionFwdAlgoWinograd,<unused>;miopenConvolutionFwdAlgoGEMM:GemmFwd1x1_0_1,0.240801,0,miopenConvolutionFwdAlgoGEMM,<unused>
1024-17-17-1x1-192-17-17-16-0x0-1x1-1x1-0-NCHW-FP32-F=miopenConvolutionFwdAlgoImplicitGEMM:ConvMlirIgemmFwd,0.549282,0,miopenConvolutionFwdAlgoImplicitGEMM,<unused>;miopenConvolutionFwdAlgoDirect:ConvAsm1x1U,0.330721,0,miopenConvolutionFwdAlgoDirect,<unused>;miopenConvolutionFwdAlgoWinograd:ConvBinWinogradRxSf3x2,0.470722,0,miopenConvolutionFwdAlgoWinograd,<unused>;miopenConvolutionFwdAlgoGEMM:GemmFwd1x1_0_1,0.262401,0,miopenConvolutionFwdAlgoGEMM,<unused>
192-17-17-3x3-192-8-8-16-0x0-2x2-1x1-0-NCHW-FP32-F=miopenConvolutionFwdAlgoImplicitGEMM:ConvHipImplicitGemmV4R1Fwd,0.20608,0,miopenConvolutionFwdAlgoImplicitGEMM,<unused>;miopenConvolutionFwdAlgoDirect:ConvOclDirectFwd,0.629922,0,miopenConvolutionFwdAlgoDirect,<unused>;miopenConvolutionFwdAlgoWinograd:ConvBinWinogradRxSf2x3g1,0.190241,0,miopenConvolutionFwdAlgoWinograd,<unused>;miopenConvolutionFwdAlgoGEMM:GemmFwdRest,1.22112,442368,miopenConvolutionFwdAlgoGEMM,<unused>
1024-17-17-1x1-256-17-17-16-0x0-1x1-1x1-0-NCHW-FP32-F=miopenConvolutionFwdAlgoImplicitGEMM:ConvMlirIgemmFwd,0.956162,0,miopenConvolutionFwdAlgoImplicitGEMM,<unused>;miopenConvolutionFwdAlgoDirect:ConvAsm1x1U,0.594082,0,miopenConvolutionFwdAlgoDirect,<unused>;miopenConvolutionFwdAlgoWinograd:ConvBinWinogradRxSf3x2,0.674882,0,miopenConvolutionFwdAlgoWinograd,<unused>;miopenConvolutionFwdAlgoGEMM:GemmFwd1x1_0_1,0.368481,0,miopenConvolutionFwdAlgoGEMM,<unused>
256-17-17-1x7-256-17-17-16-0x3-1x1-1x1-0-NCHW-FP32-F=miopenConvolutionFwdAlgoDirect:ConvDirectNaiveConvFwd,9.83251,0,miopenConvolutionFwdAlgoDirect,<unused>;miopenConvolutionFwdAlgoWinograd:ConvBinWinogradRxSf3x2,0.638882,0,miopenConvolutionFwdAlgoWinograd,<unused>;miopenConvolutionFwdAlgoGEMM:GemmFwdRest,1.6256,2071552,miopenConvolutionFwdAlgoGEMM,<unused>
256-17-17-7x1-320-17-17-16-3x0-1x1-1x1-0-NCHW-FP32-F=miopenConvolutionFwdAlgoDirect:ConvDirectNaiveConvFwd,19.6146,0,miopenConvolutionFwdAlgoDirect,<unused>;miopenConvolutionFwdAlgoWinograd:ConvBinWinogradRxSf3x2,0.659682,0,miopenConvolutionFwdAlgoWinograd,<unused>;miopenConvolutionFwdAlgoGEMM:GemmFwdRest,1.69986,2071552,miopenConvolutionFwdAlgoGEMM,<unused>
320-17-17-3x3-320-8-8-16-0x0-2x2-1x1-0-NCHW-FP32-F=miopenConvolutionFwdAlgoImplicitGEMM:ConvHipImplicitGemmV4R1Fwd,0.365441,0,miopenConvolutionFwdAlgoImplicitGEMM,<unused>;miopenConvolutionFwdAlgoDirect:ConvOclDirectFwd,1.20976,0,miopenConvolutionFwdAlgoDirect,<unused>;miopenConvolutionFwdAlgoWinograd:ConvBinWinogradRxSf2x3g1,0.566081,0,miopenConvolutionFwdAlgoWinograd,<unused>;miopenConvolutionFwdAlgoGEMM:GemmFwdRest,1.6461,737280,miopenConvolutionFwdAlgoGEMM,<unused>
1536-8-8-1x1-768-8-8-16-0x0-1x1-1x1-0-NCHW-FP32-F=miopenConvolutionFwdAlgoImplicitGEMM:ConvHipImplicitGemmV4R4Fwd,0.323361,0,miopenConvolutionFwdAlgoImplicitGEMM,<unused>;miopenConvolutionFwdAlgoDirect:ConvAsm1x1U,0.465442,0,miopenConvolutionFwdAlgoDirect,<unused>;miopenConvolutionFwdAlgoWinograd:ConvBinWinogradRxSf3x2,0.647842,0,miopenConvolutionFwdAlgoWinograd,<unused>;miopenConvolutionFwdAlgoGEMM:GemmFwd1x1_0_1,0.539522,0,miopenConvolutionFwdAlgoGEMM,<unused>
1536-8-8-1x1-256-8-8-16-0x0-1x1-1x1-0-NCHW-FP32-F=miopenConvolutionFwdAlgoImplicitGEMM:ConvHipImplicitGemmV4R4Fwd,0.191521,0,miopenConvolutionFwdAlgoImplicitGEMM,<unused>;miopenConvolutionFwdAlgoDirect:ConvAsm1x1U,0.241921,0,miopenConvolutionFwdAlgoDirect,<unused>;miopenConvolutionFwdAlgoWinograd:ConvBinWinogradRxSf3x2,0.342401,0,miopenConvolutionFwdAlgoWinograd,<unused>;miopenConvolutionFwdAlgoGEMM:GemmFwd1x1_0_1,0.227681,0,miopenConvolutionFwdAlgoGEMM,<unused>
384-8-8-1x3-256-8-8-16-0x1-1x1-1x1-0-NCHW-FP32-F=miopenConvolutionFwdAlgoImplicitGEMM:ConvHipImplicitGemmV4R1Fwd,0.20496,0,miopenConvolutionFwdAlgoImplicitGEMM,<unused>;miopenConvolutionFwdAlgoDirect:ConvDirectNaiveConvFwd,2.43073,0,miopenConvolutionFwdAlgoDirect,<unused>;miopenConvolutionFwdAlgoWinograd:ConvBinWinogradRxS,0.185281,0,miopenConvolutionFwdAlgoWinograd,<unused>;miopenConvolutionFwdAlgoGEMM:GemmFwdRest,1.07008,294912,miopenConvolutionFwdAlgoGEMM,<unused>
384-8-8-3x1-256-8-8-16-1x0-1x1-1x1-0-NCHW-FP32-F=miopenConvolutionFwdAlgoImplicitGEMM:ConvHipImplicitGemmV4R1Fwd,0.1824,0,miopenConvolutionFwdAlgoImplicitGEMM,<unused>;miopenConvolutionFwdAlgoDirect:ConvDirectNaiveConvFwd,3.40609,0,miopenConvolutionFwdAlgoDirect,<unused>;miopenConvolutionFwdAlgoWinograd:ConvBinWinogradRxSf2x3,0.18448,0,miopenConvolutionFwdAlgoWinograd,<unused>;miopenConvolutionFwdAlgoGEMM:GemmFwdRest,0.87552,294912,miopenConvolutionFwdAlgoGEMM,<unused>
384-8-8-3x1-448-8-8-16-1x0-1x1-1x1-0-NCHW-FP32-F=miopenConvolutionFwdAlgoImplicitGEMM:ConvHipImplicitGemmV4R4Fwd,0.19424,0,miopenConvolutionFwdAlgoImplicitGEMM,<unused>;miopenConvolutionFwdAlgoDirect:ConvDirectNaiveConvFwd,5.47281,0,miopenConvolutionFwdAlgoDirect,<unused>;miopenConvolutionFwdAlgoWinograd:ConvBinWinogradRxSf2x3g1,0.1752,0,miopenConvolutionFwdAlgoWinograd,<unused>;miopenConvolutionFwdAlgoGEMM:GemmFwdRest,0.97536,294912,miopenConvolutionFwdAlgoGEMM,<unused>
448-8-8-1x3-512-8-8-16-0x1-1x1-1x1-0-NCHW-FP32-F=miopenConvolutionFwdAlgoImplicitGEMM:ConvHipImplicitGemmV4R4Fwd,0.30304,0,miopenConvolutionFwdAlgoImplicitGEMM,<unused>;miopenConvolutionFwdAlgoDirect:ConvDirectNaiveConvFwd,5.18673,0,miopenConvolutionFwdAlgoDirect,<unused>;miopenConvolutionFwdAlgoWinograd:ConvBinWinogradRxSf2x3,0.298081,0,miopenConvolutionFwdAlgoWinograd,<unused>;miopenConvolutionFwdAlgoGEMM:GemmFwdRest,1.12896,344064,miopenConvolutionFwdAlgoGEMM,<unused>
512-8-8-1x3-256-8-8-16-0x1-1x1-1x1-0-NCHW-FP32-F=miopenConvolutionFwdAlgoImplicitGEMM:ConvHipImplicitGemmV4R4Fwd,0.27696,0,miopenConvolutionFwdAlgoImplicitGEMM,<unused>;miopenConvolutionFwdAlgoDirect:ConvDirectNaiveConvFwd,3.26208,0,miopenConvolutionFwdAlgoDirect,<unused>;miopenConvolutionFwdAlgoWinograd:ConvBinWinogradRxSf2x3,0.2344,0,miopenConvolutionFwdAlgoWinograd,<unused>;miopenConvolutionFwdAlgoGEMM:GemmFwdRest,1.16224,393216,miopenConvolutionFwdAlgoGEMM,<unused>
512-8-8-3x1-256-8-8-16-1x0-1x1-1x1-0-NCHW-FP32-F=miopenConvolutionFwdAlgoImplicitGEMM:ConvHipImplicitGemmV4R1Fwd,0.244,0,miopenConvolutionFwdAlgoImplicitGEMM,<unused>;miopenConvolutionFwdAlgoDirect:ConvDirectNaiveConvFwd,4.44304,0,miopenConvolutionFwdAlgoDirect,<unused>;miopenConvolutionFwdAlgoWinograd:ConvBinWinogradRxSf2x3,0.23728,0,miopenConvolutionFwdAlgoWinograd,<unused>;miopenConvolutionFwdAlgoGEMM:GemmFwdRest,1.21856,393216,miopenConvolutionFwdAlgoGEMM,<unused>
3-224-224-7x7-64-112-112-16-3x3-2x2-1x1-0-NCHW-FP32-F=miopenConvolutionFwdAlgoImplicitGEMM:ConvMlirIgemmFwd,1.17568,0,miopenConvolutionFwdAlgoImplicitGEMM,<unused>;miopenConvolutionFwdAlgoDirect:ConvAsm7x7c3h224w224k64u2v2p3q3f1,0.471039,0,miopenConvolutionFwdAlgoDirect,<unused>;miopenConvolutionFwdAlgoWinograd:ConvBinWinogradRxS,0.661759,0,miopenConvolutionFwdAlgoWinograd,<unused>;miopenConvolutionFwdAlgoGEMM:GemmFwdRest,1.54368,7375872,miopenConvolutionFwdAlgoGEMM,<unused>
64-56-56-1x1-512-56-56-16-0x0-1x1-1x1-0-NCHW-FP32-F=miopenConvolutionFwdAlgoImplicitGEMM:ConvHipImplicitGemmV4R4Fwd,0.37392,0,miopenConvolutionFwdAlgoImplicitGEMM,<unused>;miopenConvolutionFwdAlgoDirect:ConvAsm1x1U,0.386399,0,miopenConvolutionFwdAlgoDirect,<unused>;miopenConvolutionFwdAlgoWinograd:ConvBinWinogradRxSf3x2,0.969279,0,miopenConvolutionFwdAlgoWinograd,<unused>;miopenConvolutionFwdAlgoGEMM:GemmFwd1x1_0_1,0.608479,0,miopenConvolutionFwdAlgoGEMM,<unused>
256-56-56-3x3-256-56-56-16-1x1-1x1-1x1-0-NCHW-FP32-F_g64=miopenConvolutionFwdAlgoImplicitGEMM:ConvMlirIgemmFwd,4.93663,0,miopenConvolutionFwdAlgoImplicitGEMM,<unused>;miopenConvolutionFwdAlgoDirect:ConvAsm3x3U,0.1696,0,miopenConvolutionFwdAlgoDirect,<unused>;miopenConvolutionFwdAlgoWinograd:ConvBinWinogradRxSf2x3,1.47024,0,miopenConvolutionFwdAlgoWinograd,<unused>;miopenConvolutionFwdAlgoGEMM:GemmFwdRest,3.53277,28901376,miopenConvolutionFwdAlgoGEMM,<unused>
256-56-56-1x1-256-56-56-16-0x0-1x1-1x1-0-NCHW-FP32-F=miopenConvolutionFwdAlgoImplicitGEMM:ConvHipImplicitGemmV4R4Fwd,0.624799,0,miopenConvolutionFwdAlgoImplicitGEMM,<unused>;miopenConvolutionFwdAlgoDirect:ConvAsm1x1U,0.811679,0,miopenConvolutionFwdAlgoDirect,<unused>;miopenConvolutionFwdAlgoWinograd:ConvBinWinogradRxSf3x2,1.36912,0,miopenConvolutionFwdAlgoWinograd,<unused>;miopenConvolutionFwdAlgoGEMM:GemmFwd1x1_0_1,0.702399,0,miopenConvolutionFwdAlgoGEMM,<unused>
256-56-56-1x1-512-56-56-16-0x0-1x1-1x1-0-NCHW-FP32-F=miopenConvolutionFwdAlgoImplicitGEMM:ConvHipImplicitGemmV4R4Fwd,1.20656,0,miopenConvolutionFwdAlgoImplicitGEMM,<unused>;miopenConvolutionFwdAlgoDirect:ConvAsm1x1U,1.37568,0,miopenConvolutionFwdAlgoDirect,<unused>;miopenConvolutionFwdAlgoWinograd:ConvBinWinogradRxSf3x2,2.66224,0,miopenConvolutionFwdAlgoWinograd,<unused>;miopenConvolutionFwdAlgoGEMM:GemmFwd1x1_0_1,1.32496,0,miopenConvolutionFwdAlgoGEMM,<unused>
512-56-56-3x3-512-28-28-16-1x1-2x2-1x1-0-NCHW-FP32-F_g64=miopenConvolutionFwdAlgoImplicitGEMM:ConvMlirIgemmFwd,2.30576,0,miopenConvolutionFwdAlgoImplicitGEMM,<unused>;miopenConvolutionFwdAlgoDirect:ConvOclDirectFwd,0.540319,0,miopenConvolutionFwdAlgoDirect,<unused>;miopenConvolutionFwdAlgoWinograd:ConvBinWinogradRxSf2x3,1.17216,0,miopenConvolutionFwdAlgoWinograd,<unused>;miopenConvolutionFwdAlgoGEMM:GemmFwdRest,2.12224,14450688,miopenConvolutionFwdAlgoGEMM,<unused>
768-28-28-1x1-512-28-28-16-0x0-1x1-1x1-0-NCHW-FP32-F=miopenConvolutionFwdAlgoImplicitGEMM:ConvAsmImplicitGemmV4R1DynamicFwd_1x1,0.926721,0,miopenConvolutionFwdAlgoImplicitGEMM,<unused>;miopenConvolutionFwdAlgoDirect:ConvAsm1x1U,1.18272,0,miopenConvolutionFwdAlgoDirect,<unused>;miopenConvolutionFwdAlgoWinograd:ConvBinWinogradRxSf3x2,2.15232,0,miopenConvolutionFwdAlgoWinograd,<unused>;miopenConvolutionFwdAlgoGEMM:GemmFwd1x1_0_1,1.11216,0,miopenConvolutionFwdAlgoGEMM,<unused>
512-28-28-1x1-512-28-28-16-0x0-1x1-1x1-0-NCHW-FP32-F=miopenConvolutionFwdAlgoImplicitGEMM:ConvAsmImplicitGemmV4R1DynamicFwd_1x1,0.628003,0,miopenConvolutionFwdAlgoImplicitGEMM,<unused>;miopenConvolutionFwdAlgoDirect:ConvAsm1x1U,0.869925,0,miopenConvolutionFwdAlgoDirect,<unused>;miopenConvolutionFwdAlgoWinograd:ConvBinWinogradRxSf3x2,1.47473,0,miopenConvolutionFwdAlgoWinograd,<unused>;miopenConvolutionFwdAlgoGEMM:GemmFwd1x1_0_1,0.754884,0,miopenConvolutionFwdAlgoGEMM,<unused>
512-28-28-3x3-512-28-28-16-1x1-1x1-1x1-0-NCHW-FP32-F_g64=miopenConvolutionFwdAlgoImplicitGEMM:ConvMlirIgemmFwd,2.23313,0,miopenConvolutionFwdAlgoImplicitGEMM,<unused>;miopenConvolutionFwdAlgoDirect:ConvAsm3x3U,0.218561,0,miopenConvolutionFwdAlgoDirect,<unused>;miopenConvolutionFwdAlgoWinograd:ConvBinWinogradRxSf2x3,0.522243,0,miopenConvolutionFwdAlgoWinograd,<unused>;miopenConvolutionFwdAlgoGEMM:GemmFwdRest,1.86882,14450688,miopenConvolutionFwdAlgoGEMM,<unused>
512-28-28-1x1-1024-28-28-16-0x0-1x1-1x1-0-NCHW-FP32-F=miopenConvolutionFwdAlgoImplicitGEMM:ConvHipImplicitGemmV4R1Fwd,1.24289,0,miopenConvolutionFwdAlgoImplicitGEMM,<unused>;miopenConvolutionFwdAlgoDirect:ConvAsm1x1U,1.53793,0,miopenConvolutionFwdAlgoDirect,<unused>;miopenConvolutionFwdAlgoWinograd:ConvBinWinogradRxSf3x2,2.82514,0,miopenConvolutionFwdAlgoWinograd,<unused>;miopenConvolutionFwdAlgoGEMM:GemmFwd1x1_0_1,1.44353,0,miopenConvolutionFwdAlgoGEMM,<unused>
1024-28-28-3x3-1024-14-14-16-1x1-2x2-1x1-0-NCHW-FP32-F_g64=miopenConvolutionFwdAlgoImplicitGEMM:ConvHipImplicitGemmV4R1Fwd,0.247041,0,miopenConvolutionFwdAlgoImplicitGEMM,<unused>;miopenConvolutionFwdAlgoDirect:ConvOclDirectFwd,0.403683,0,miopenConvolutionFwdAlgoDirect,<unused>;miopenConvolutionFwdAlgoWinograd:ConvBinWinogradRxSf2x3,0.558564,0,miopenConvolutionFwdAlgoWinograd,<unused>;miopenConvolutionFwdAlgoGEMM:GemmFwdRest,1.68194,7225344,miopenConvolutionFwdAlgoGEMM,<unused>
1536-14-14-1x1-1024-14-14-16-0x0-1x1-1x1-0-NCHW-FP32-F=miopenConvolutionFwdAlgoImplicitGEMM:ConvHipImplicitGemmV4R1Fwd,1.03153,0,miopenConvolutionFwdAlgoImplicitGEMM,<unused>;miopenConvolutionFwdAlgoDirect:ConvAsm1x1U,1.40401,0,miopenConvolutionFwdAlgoDirect,<unused>;miopenConvolutionFwdAlgoWinograd:ConvBinWinogradRxSf3x2,2.14865,0,miopenConvolutionFwdAlgoWinograd,<unused>;miopenConvolutionFwdAlgoGEMM:GemmFwd1x1_0_1,1.42945,0,miopenConvolutionFwdAlgoGEMM,<unused>
1024-14-14-1x1-1024-14-14-16-0x0-1x1-1x1-0-NCHW-FP32-F=miopenConvolutionFwdAlgoImplicitGEMM:ConvHipImplicitGemmV4R1Fwd,0.762564,0,miopenConvolutionFwdAlgoImplicitGEMM,<unused>;miopenConvolutionFwdAlgoDirect:ConvAsm1x1U,1.07297,0,miopenConvolutionFwdAlgoDirect,<unused>;miopenConvolutionFwdAlgoWinograd:ConvBinWinogradRxSf3x2,1.45601,0,miopenConvolutionFwdAlgoWinograd,<unused>;miopenConvolutionFwdAlgoGEMM:GemmFwd1x1_0_1,1.0488,0,miopenConvolutionFwdAlgoGEMM,<unused>
1024-14-14-3x3-1024-14-14-16-1x1-1x1-1x1-0-NCHW-FP32-F_g64=miopenConvolutionFwdAlgoImplicitGEMM:ConvHipImplicitGemmV4R1Fwd,0.198881,0,miopenConvolutionFwdAlgoImplicitGEMM,<unused>;miopenConvolutionFwdAlgoDirect:ConvOclDirectFwd,0.293602,0,miopenConvolutionFwdAlgoDirect,<unused>;miopenConvolutionFwdAlgoWinograd:ConvBinWinogradRxSf2x3,0.232322,0,miopenConvolutionFwdAlgoWinograd,<unused>;miopenConvolutionFwdAlgoGEMM:GemmFwdRest,1.40546,7225344,miopenConvolutionFwdAlgoGEMM,<unused>
1024-14-14-1x1-2048-14-14-16-0x0-1x1-1x1-0-NCHW-FP32-F=miopenConvolutionFwdAlgoImplicitGEMM:ConvHipImplicitGemmV4R1Fwd,1.34961,0,miopenConvolutionFwdAlgoImplicitGEMM,<unused>;miopenConvolutionFwdAlgoDirect:ConvAsm1x1U,1.96273,0,miopenConvolutionFwdAlgoDirect,<unused>;miopenConvolutionFwdAlgoWinograd:ConvBinWinogradRxSf3x2,2.88978,0,miopenConvolutionFwdAlgoWinograd,<unused>;miopenConvolutionFwdAlgoGEMM:GemmFwd1x1_0_1,2.13009,0,miopenConvolutionFwdAlgoGEMM,<unused>
2048-14-14-3x3-2048-7-7-16-1x1-2x2-1x1-0-NCHW-FP32-F_g64=miopenConvolutionFwdAlgoImplicitGEMM:ConvMlirIgemmFwd,0.518723,0,miopenConvolutionFwdAlgoImplicitGEMM,<unused>;miopenConvolutionFwdAlgoDirect:ConvOclDirectFwd,0.577443,0,miopenConvolutionFwdAlgoDirect,<unused>;miopenConvolutionFwdAlgoWinograd:ConvBinWinogradRxSf2x3,0.367522,0,miopenConvolutionFwdAlgoWinograd,<unused>;miopenConvolutionFwdAlgoGEMM:GemmFwdRest,1.65376,3612672,miopenConvolutionFwdAlgoGEMM,<unused>
3072-7-7-1x1-2048-7-7-16-0x0-1x1-1x1-0-NCHW-FP32-F=miopenConvolutionFwdAlgoImplicitGEMM:ConvMlirIgemmFwd,2.87281,0,miopenConvolutionFwdAlgoImplicitGEMM,<unused>;miopenConvolutionFwdAlgoDirect:ConvAsm1x1U,1.86609,0,miopenConvolutionFwdAlgoDirect,<unused>;miopenConvolutionFwdAlgoWinograd:ConvBinWinogradRxSf3x2,3.55746,0,miopenConvolutionFwdAlgoWinograd,<unused>;miopenConvolutionFwdAlgoGEMM:GemmFwd1x1_0_1,2.00337,0,miopenConvolutionFwdAlgoGEMM,<unused>
2048-7-7-1x1-2048-7-7-16-0x0-1x1-1x1-0-NCHW-FP32-F=miopenConvolutionFwdAlgoImplicitGEMM:ConvMlirIgemmFwd,1.95553,0,miopenConvolutionFwdAlgoImplicitGEMM,<unused>;miopenConvolutionFwdAlgoDirect:ConvAsm1x1U,1.32017,0,miopenConvolutionFwdAlgoDirect,<unused>;miopenConvolutionFwdAlgoWinograd:ConvBinWinogradRxSf3x2,2.45841,0,miopenConvolutionFwdAlgoWinograd,<unused>;miopenConvolutionFwdAlgoGEMM:GemmFwd1x1_0_1,1.15905,0,miopenConvolutionFwdAlgoGEMM,<unused>
2048-7-7-3x3-2048-7-7-16-1x1-1x1-1x1-0-NCHW-FP32-F_g64=miopenConvolutionFwdAlgoImplicitGEMM:ConvMlirIgemmFwd,0.517123,0,miopenConvolutionFwdAlgoImplicitGEMM,<unused>;miopenConvolutionFwdAlgoDirect:ConvOclDirectFwd,0.364002,0,miopenConvolutionFwdAlgoDirect,<unused>;miopenConvolutionFwdAlgoWinograd:ConvBinWinogradRxSf2x3,0.14848,0,miopenConvolutionFwdAlgoWinograd,<unused>;miopenConvolutionFwdAlgoGEMM:GemmFwdRest,2.01218,3612672,miopenConvolutionFwdAlgoGEMM,<unused>
3-225-225-3x3-32-112-112-64-0x0-2x2-1x1-0-NCHW-FP32-F=miopenConvolutionFwdAlgoImplicitGEMM:ConvMlirIgemmFwd,0.776643,0,miopenConvolutionFwdAlgoImplicitGEMM,<unused>;miopenConvolutionFwdAlgoDirect:ConvOclDirectFwd,0.576482,0,miopenConvolutionFwdAlgoDirect,<unused>;miopenConvolutionFwdAlgoWinograd:ConvBinWinogradRxSf2x3g1,0.703363,0,miopenConvolutionFwdAlgoWinograd,<unused>;miopenConvolutionFwdAlgoGEMM:GemmFwdRest,5.2224,1354752,miopenConvolutionFwdAlgoGEMM,<unused>
32-112-112-3x3-32-112-112-64-1x1-1x1-1x1-0-NCHW-FP32-F_g32=miopenConvolutionFwdAlgoImplicitGEMM:ConvMlirIgemmFwd,11.3423,0,miopenConvolutionFwdAlgoImplicitGEMM,<unused>;miopenConvolutionFwdAlgoDirect:ConvOclDirectFwd,0.424481,0,miopenConvolutionFwdAlgoDirect,<unused>;miopenConvolutionFwdAlgoWinograd:ConvBinWinogradRxSf2x3,7.14819,0,miopenConvolutionFwdAlgoWinograd,<unused>;miopenConvolutionFwdAlgoGEMM:GemmFwdRest,16.0871,14450688,miopenConvolutionFwdAlgoGEMM,<unused>
32-112-112-1x1-64-112-112-64-0x0-1x1-1x1-0-NCHW-FP32-F=miopenConvolutionFwdAlgoImplicitGEMM:ConvHipImplicitGemmV4R4Fwd,0.385121,0,miopenConvolutionFwdAlgoImplicitGEMM,<unused>;miopenConvolutionFwdAlgoDirect:ConvAsm1x1U,0.418881,0,miopenConvolutionFwdAlgoDirect,<unused>;miopenConvolutionFwdAlgoWinograd:ConvBinWinogradRxSf3x2,1.12368,0,miopenConvolutionFwdAlgoWinograd,<unused>;miopenConvolutionFwdAlgoGEMM:GemmFwd1x1_0_1,0.489762,0,miopenConvolutionFwdAlgoGEMM,<unused>
64-113-113-3x3-64-56-56-64-0x0-2x2-1x1-0-NCHW-FP32-F_g64=miopenConvolutionFwdAlgoImplicitGEMM:ConvMlirIgemmFwd,5.52946,0,miopenConvolutionFwdAlgoImplicitGEMM,<unused>;miopenConvolutionFwdAlgoDirect:ConvOclDirectFwd,0.608162,0,miopenConvolutionFwdAlgoDirect,<unused>;miopenConvolutionFwdAlgoWinograd:ConvBinWinogradRxSf2x3,6.71298,0,miopenConvolutionFwdAlgoWinograd,<unused>;miopenConvolutionFwdAlgoGEMM:GemmFwdRest,10.9364,7225344,miopenConvolutionFwdAlgoGEMM,<unused>
64-56-56-1x1-128-56-56-64-0x0-1x1-1x1-0-NCHW-FP32-F=miopenConvolutionFwdAlgoImplicitGEMM:ConvAsmImplicitGemmV4R1DynamicFwd_1x1,0.373921,0,miopenConvolutionFwdAlgoImplicitGEMM,<unused>;miopenConvolutionFwdAlgoDirect:ConvAsm1x1U,0.388641,0,miopenConvolutionFwdAlgoDirect,<unused>;miopenConvolutionFwdAlgoWinograd:ConvBinWinogradRxSf3x2,0.868002,0,miopenConvolutionFwdAlgoWinograd,<unused>;miopenConvolutionFwdAlgoGEMM:GemmFwd1x1_0_1,0.462241,0,miopenConvolutionFwdAlgoGEMM,<unused>
128-56-56-3x3-128-56-56-64-1x1-1x1-1x1-0-NCHW-FP32-F_g128=miopenConvolutionFwdAlgoImplicitGEMM:ConvMlirIgemmFwd,11.205,0,miopenConvolutionFwdAlgoImplicitGEMM,<unused>;miopenConvolutionFwdAlgoDirect:ConvOclDirectFwd,0.448161,0,miopenConvolutionFwdAlgoDirect,<unused>;miopenConvolutionFwdAlgoWinograd:ConvBinWinogradRxSf2x3,7.22305,0,miopenConvolutionFwdAlgoWinograd,<unused>;miopenConvolutionFwdAlgoGEMM:GemmFwdRest,18.6163,14450688,miopenConvolutionFwdAlgoGEMM,<unused>
128-56-56-1x1-128-56-56-64-0x0-1x1-1x1-0-NCHW-FP32-F=miopenConvolutionFwdAlgoImplicitGEMM:ConvHipImplicitGemmV4R4Fwd,0.6304,0,miopenConvolutionFwdAlgoImplicitGEMM,<unused>;miopenConvolutionFwdAlgoDirect:ConvOclDirectFwd1x1,0.642879,0,miopenConvolutionFwdAlgoDirect,<unused>;miopenConvolutionFwdAlgoWinograd:ConvBinWinogradRxSf3x2,1.52496,0,miopenConvolutionFwdAlgoWinograd,<unused>;miopenConvolutionFwdAlgoGEMM:GemmFwd1x1_0_1,0.845119,0,miopenConvolutionFwdAlgoGEMM,<unused>
128-57-57-3x3-128-28-28-64-0x0-2x2-1x1-0-NCHW-FP32-F_g128=miopenConvolutionFwdAlgoImplicitGEMM:ConvMlirIgemmFwd,3.18336,0,miopenConvolutionFwdAlgoImplicitGEMM,<unused>;miopenConvolutionFwdAlgoDirect:ConvOclDirectFwd,0.3096,0,miopenConvolutionFwdAlgoDirect,<unused>;miopenConvolutionFwdAlgoWinograd:ConvBinWinogradRxSf2x3,3.40992,0,miopenConvolutionFwdAlgoWinograd,<unused>;miopenConvolutionFwdAlgoGEMM:GemmFwdRest,7.35226,3612672,miopenConvolutionFwdAlgoGEMM,<unused>
128-28-28-1x1-256-28-28-64-0x0-1x1-1x1-0-NCHW-FP32-F=miopenConvolutionFwdAlgoImplicitGEMM:ConvAsmImplicitGemmV4R1DynamicFwd_1x1,0.33584,0,miopenConvolutionFwdAlgoImplicitGEMM,<unused>;miopenConvolutionFwdAlgoDirect:ConvAsm1x1U,0.495999,0,miopenConvolutionFwdAlgoDirect,<unused>;miopenConvolutionFwdAlgoWinograd:ConvBinWinogradRxSf3x2,0.864158,0,miopenConvolutionFwdAlgoWinograd,<unused>;miopenConvolutionFwdAlgoGEMM:GemmFwd1x1_0_1,0.473919,0,miopenConvolutionFwdAlgoGEMM,<unused>
256-28-28-3x3-256-28-28-64-1x1-1x1-1x1-0-NCHW-FP32-F_g256=miopenConvolutionFwdAlgoImplicitGEMM:ConvMlirIgemmFwd,5.64735,0,miopenConvolutionFwdAlgoImplicitGEMM,<unused>;miopenConvolutionFwdAlgoDirect:ConvOclDirectFwd,0.222239,0,miopenConvolutionFwdAlgoDirect,<unused>;miopenConvolutionFwdAlgoWinograd:ConvBinWinogradRxSf2x3,4.09535,0,miopenConvolutionFwdAlgoWinograd,<unused>;miopenConvolutionFwdAlgoGEMM:GemmFwdRest,8.2944,7225344,miopenConvolutionFwdAlgoGEMM,<unused>
256-28-28-1x1-256-28-28-64-0x0-1x1-1x1-0-NCHW-FP32-F=miopenConvolutionFwdAlgoImplicitGEMM:ConvHipImplicitGemmV4R1Fwd,0.618719,0,miopenConvolutionFwdAlgoImplicitGEMM,<unused>;miopenConvolutionFwdAlgoDirect:ConvOclDirectFwd1x1,0.632478,0,miopenConvolutionFwdAlgoDirect,<unused>;miopenConvolutionFwdAlgoWinograd:ConvBinWinogradRxSf3x2,1.49472,0,miopenConvolutionFwdAlgoWinograd,<unused>;miopenConvolutionFwdAlgoGEMM:GemmFwd1x1_0_1,0.758719,0,miopenConvolutionFwdAlgoGEMM,<unused>
256-29-29-3x3-256-14-14-64-0x0-2x2-1x1-0-NCHW-FP32-F_g256=miopenConvolutionFwdAlgoImplicitGEMM:ConvMlirIgemmFwd,1.61008,0,miopenConvolutionFwdAlgoImplicitGEMM,<unused>;miopenConvolutionFwdAlgoDirect:ConvOclDirectFwd,0.15104,0,miopenConvolutionFwdAlgoDirect,<unused>;miopenConvolutionFwdAlgoWinograd:ConvBinWinogradRxSf2x3,1.824,0,miopenConvolutionFwdAlgoWinograd,<unused>;miopenConvolutionFwdAlgoGEMM:GemmFwdRest,6.63552,1806336,miopenConvolutionFwdAlgoGEMM,<unused>
256-14-14-1x1-512-14-14-64-0x0-1x1-1x1-0-NCHW-FP32-F=miopenConvolutionFwdAlgoImplicitGEMM:ConvHipImplicitGemmV4R4Fwd,0.329759,0,miopenConvolutionFwdAlgoImplicitGEMM,<unused>;miopenConvolutionFwdAlgoDirect:ConvOclDirectFwd1x1,0.414879,0,miopenConvolutionFwdAlgoDirect,<unused>;miopenConvolutionFwdAlgoWinograd:ConvBinWinogradRxSf3x2,0.806238,0,miopenConvolutionFwdAlgoWinograd,<unused>;miopenConvolutionFwdAlgoGEMM:GemmFwd1x1_0_1,0.475839,0,miopenConvolutionFwdAlgoGEMM,<unused>
512-14-14-3x3-512-14-14-64-1x1-1x1-1x1-0-NCHW-FP32-F_g512=miopenConvolutionFwdAlgoImplicitGEMM:ConvMlirIgemmFwd,3.30383,0,miopenConvolutionFwdAlgoImplicitGEMM,<unused>;miopenConvolutionFwdAlgoDirect:ConvOclDirectFwd,0.13424,0,miopenConvolutionFwdAlgoDirect,<unused>;miopenConvolutionFwdAlgoWinograd:ConvBinWinogradRxSf2x3,2.31888,0,miopenConvolutionFwdAlgoWinograd,<unused>;miopenConvolutionFwdAlgoGEMM:GemmFwdRest,5.23264,3612672,miopenConvolutionFwdAlgoGEMM,<unused>
512-14-14-1x1-512-14-14-64-0x0-1x1-1x1-0-NCHW-FP32-F=miopenConvolutionFwdAlgoImplicitGEMM:ConvAsmImplicitGemmV4R1DynamicFwd_1x1,0.637439,0,miopenConvolutionFwdAlgoImplicitGEMM,<unused>;miopenConvolutionFwdAlgoDirect:ConvOclDirectFwd1x1,0.745118,0,miopenConvolutionFwdAlgoDirect,<unused>;miopenConvolutionFwdAlgoWinograd:ConvBinWinogradRxSf3x2,1.48864,0,miopenConvolutionFwdAlgoWinograd,<unused>;miopenConvolutionFwdAlgoGEMM:GemmFwd1x1_0_1,1.10816,0,miopenConvolutionFwdAlgoGEMM,<unused>
512-15-15-3x3-512-7-7-64-0x0-2x2-1x1-0-NCHW-FP32-F_g512=miopenConvolutionFwdAlgoImplicitGEMM:ConvMlirIgemmFwd,0.823199,0,miopenConvolutionFwdAlgoImplicitGEMM,<unused>;miopenConvolutionFwdAlgoDirect:ConvOclDirectFwd,0.09776,0,miopenConvolutionFwdAlgoDirect,<unused>;miopenConvolutionFwdAlgoWinograd:ConvBinWinogradRxSf2x3,1.35632,0,miopenConvolutionFwdAlgoWinograd,<unused>;miopenConvolutionFwdAlgoGEMM:GemmFwdRest,5.632,903168,miopenConvolutionFwdAlgoGEMM,<unused>
512-7-7-1x1-1024-7-7-64-0x0-1x1-1x1-0-NCHW-FP32-F=miopenConvolutionFwdAlgoImplicitGEMM:ConvHipImplicitGemmV4R4Fwd,0.36512,0,miopenConvolutionFwdAlgoImplicitGEMM,<unused>;miopenConvolutionFwdAlgoDirect:ConvAsm1x1U,0.520159,0,miopenConvolutionFwdAlgoDirect,<unused>;miopenConvolutionFwdAlgoWinograd:ConvBinWinogradRxSf3x2,1.06768,0,miopenConvolutionFwdAlgoWinograd,<unused>;miopenConvolutionFwdAlgoGEMM:GemmFwd1x1_0_1,0.812478,0,miopenConvolutionFwdAlgoGEMM,<unused>
1024-7-7-3x3-1024-7-7-64-1x1-1x1-1x1-0-NCHW-FP32-F_g1024=miopenConvolutionFwdAlgoImplicitGEMM:ConvMlirIgemmFwd,1.65536,0,miopenConvolutionFwdAlgoImplicitGEMM,<unused>;miopenConvolutionFwdAlgoDirect:ConvOclDirectFwd,0.18128,0,miopenConvolutionFwdAlgoDirect,<unused>;miopenConvolutionFwdAlgoWinograd:ConvBinWinogradRxSf2x3,1.66864,0,miopenConvolutionFwdAlgoWinograd,<unused>;miopenConvolutionFwdAlgoGEMM:GemmFwdRest,3.13344,1806336,miopenConvolutionFwdAlgoGEMM,<unused>
1024-7-7-1x1-1024-7-7-64-0x0-1x1-1x1-0-NCHW-FP32-F=miopenConvolutionFwdAlgoImplicitGEMM:ConvHipImplicitGemmV4R4Fwd,0.742399,0,miopenConvolutionFwdAlgoImplicitGEMM,<unused>;miopenConvolutionFwdAlgoDirect:ConvAsm1x1U,1.03456,0,miopenConvolutionFwdAlgoDirect,<unused>;miopenConvolutionFwdAlgoWinograd:ConvBinWinogradRxSf3x2,2.05232,0,miopenConvolutionFwdAlgoWinograd,<unused>;miopenConvolutionFwdAlgoGEMM:GemmFwd1x1_0_1,1.48448,0,miopenConvolutionFwdAlgoGEMM,<unused>
1024-1-1-1x1-1001-1-1-64-0x0-1x1-1x1-0-NCHW-FP32-F=miopenConvolutionFwdAlgoImplicitGEMM:ConvMlirIgemmFwd,0.497119,0,miopenConvolutionFwdAlgoImplicitGEMM,<unused>;miopenConvolutionFwdAlgoDirect:ConvAsm1x1U,0.266079,0,miopenConvolutionFwdAlgoDirect,<unused>;miopenConvolutionFwdAlgoWinograd:ConvBinWinogradRxSf3x2,0.434719,0,miopenConvolutionFwdAlgoWinograd,<unused>;miopenConvolutionFwdAlgoGEMM:GemmFwd1x1_0_1,0.722238,0,miopenConvolutionFwdAlgoGEMM,<unused>
3-331-331-3x3-96-165-165-64-0x0-2x2-1x1-0-NCHW-FP32-F=miopenConvolutionFwdAlgoImplicitGEMM:ConvMlirIgemmFwd,3.5664,0,miopenConvolutionFwdAlgoImplicitGEMM,<unused>;miopenConvolutionFwdAlgoDirect:ConvOclDirectFwd,3.28064,0,miopenConvolutionFwdAlgoDirect,<unused>;miopenConvolutionFwdAlgoWinograd:ConvBinWinogradRxSf2x3g1,3.7632,0,miopenConvolutionFwdAlgoWinograd,<unused>;miopenConvolutionFwdAlgoGEMM:GemmFwdRest,8.57088,2940300,miopenConvolutionFwdAlgoGEMM,<unused>
96-165-165-1x1-42-165-165-64-0x0-1x1-1x1-0-NCHW-FP32-F=miopenConvolutionFwdAlgoImplicitGEMM:ConvMlirIgemmFwd,4.82144,0,miopenConvolutionFwdAlgoImplicitGEMM,<unused>;miopenConvolutionFwdAlgoDirect:ConvAsm1x1U,2.4144,0,miopenConvolutionFwdAlgoDirect,<unused>;miopenConvolutionFwdAlgoWinograd:ConvBinWinogradRxSf3x2,4.68496,0,miopenConvolutionFwdAlgoWinograd,<unused>;miopenConvolutionFwdAlgoGEMM:GemmFwd1x1_0_1,2.59936,0,miopenConvolutionFwdAlgoGEMM,<unused>
96-165-165-7x7-96-83-83-64-3x3-2x2-1x1-0-NCHW-FP32-F_g96=miopenConvolutionFwdAlgoImplicitGEMM:ConvMlirIgemmFwd,68.644,0,miopenConvolutionFwdAlgoImplicitGEMM,<unused>;miopenConvolutionFwdAlgoDirect:ConvOclDirectFwd,2.54288,0,miopenConvolutionFwdAlgoDirect,<unused>;miopenConvolutionFwdAlgoWinograd:ConvBinWinogradRxSf2x3,40.0619,0,miopenConvolutionFwdAlgoWinograd,<unused>;miopenConvolutionFwdAlgoGEMM:GemmFwdRest,69.4682,129623424,miopenConvolutionFwdAlgoGEMM,<unused>
96-83-83-1x1-42-83-83-64-0x0-1x1-1x1-0-NCHW-FP32-F=miopenConvolutionFwdAlgoImplicitGEMM:ConvMlirIgemmFwd,1.2616,0,miopenConvolutionFwdAlgoImplicitGEMM,<unused>;miopenConvolutionFwdAlgoDirect:ConvAsm1x1U,0.50192,0,miopenConvolutionFwdAlgoDirect,<unused>;miopenConvolutionFwdAlgoWinograd:ConvBinWinogradRxSf3x2,1.30464,0,miopenConvolutionFwdAlgoWinograd,<unused>;miopenConvolutionFwdAlgoGEMM:GemmFwd1x1_0_1,1.2664,0,miopenConvolutionFwdAlgoGEMM,<unused>
42-83-83-7x7-42-83-83-64-3x3-1x1-1x1-0-NCHW-FP32-F_g42=miopenConvolutionFwdAlgoImplicitGEMM:ConvMlirIgemmFwd,29.9899,0,miopenConvolutionFwdAlgoImplicitGEMM,<unused>;miopenConvolutionFwdAlgoDirect:ConvOclDirectFwd,0.4824,0,miopenConvolutionFwdAlgoDirect,<unused>;miopenConvolutionFwdAlgoWinograd:ConvBinWinogradRxSf3x2,12.2914,0,miopenConvolutionFwdAlgoWinograd,<unused>;miopenConvolutionFwdAlgoGEMM:GemmFwdRest,33.1571,56710248,miopenConvolutionFwdAlgoGEMM,<unused>
42-83-83-1x1-42-83-83-64-0x0-1x1-1x1-0-NCHW-FP32-F=miopenConvolutionFwdAlgoImplicitGEMM:ConvMlirIgemmFwd,0.5544,0,miopenConvolutionFwdAlgoImplicitGEMM,<unused>;miopenConvolutionFwdAlgoDirect:ConvAsm1x1U,0.30256,0,miopenConvolutionFwdAlgoDirect,<unused>;miopenConvolutionFwdAlgoWinograd:ConvBinWinogradRxSf3x2,0.70048,0,miopenConvolutionFwdAlgoWinograd,<unused>;miopenConvolutionFwdAlgoGEMM:GemmFwd1x1_0_1,0.696641,0,miopenConvolutionFwdAlgoGEMM,<unused>
96-165-165-5x5-96-83-83-64-2x2-2x2-1x1-0-NCHW-FP32-F_g96=miopenConvolutionFwdAlgoImplicitGEMM:ConvMlirIgemmFwd,34.8439,0,miopenConvolutionFwdAlgoImplicitGEMM,<unused>;miopenConvolutionFwdAlgoDirect:ConvOclDirectFwd,2.19696,0,miopenConvolutionFwdAlgoDirect,<unused>;miopenConvolutionFwdAlgoWinograd:ConvBinWinogradRxSf2x3,19.8957,0,miopenConvolutionFwdAlgoWinograd,<unused>;miopenConvolutionFwdAlgoGEMM:GemmFwdRest,41.2774,66134400,miopenConvolutionFwdAlgoGEMM,<unused>
42-83-83-5x5-42-83-83-64-2x2-1x1-1x1-0-NCHW-FP32-F_g42=miopenConvolutionFwdAlgoImplicitGEMM:ConvMlirIgemmFwd,15.6544,0,miopenConvolutionFwdAlgoImplicitGEMM,<unused>;miopenConvolutionFwdAlgoDirect:ConvOclDirectFwd,0.404,0,miopenConvolutionFwdAlgoDirect,<unused>;miopenConvolutionFwdAlgoWinograd:ConvBinWinogradRxSf2x3,8.07681,0,miopenConvolutionFwdAlgoWinograd,<unused>;miopenConvolutionFwdAlgoGEMM:GemmFwdRest,18.2272,28933800,miopenConvolutionFwdAlgoGEMM,<unused>
42-165-165-5x5-42-83-83-64-2x2-2x2-1x1-0-NCHW-FP32-F_g42=miopenConvolutionFwdAlgoImplicitGEMM:ConvMlirIgemmFwd,15.2552,0,miopenConvolutionFwdAlgoImplicitGEMM,<unused>;miopenConvolutionFwdAlgoDirect:ConvOclDirectFwd,0.964161,0,miopenConvolutionFwdAlgoDirect,<unused>;miopenConvolutionFwdAlgoWinograd:ConvBinWinogradRxSf2x3,9.41329,0,miopenConvolutionFwdAlgoWinograd,<unused>;miopenConvolutionFwdAlgoGEMM:GemmFwdRest,19.1283,28933800,miopenConvolutionFwdAlgoGEMM,<unused>
84-83-83-1x1-42-83-83-64-0x0-1x1-1x1-0-NCHW-FP32-F=miopenConvolutionFwdAlgoImplicitGEMM:ConvMlirIgemmFwd,0.987201,0,miopenConvolutionFwdAlgoImplicitGEMM,<unused>;miopenConvolutionFwdAlgoDirect:ConvAsm1x1U,0.449761,0,miopenConvolutionFwdAlgoDirect,<unused>;miopenConvolutionFwdAlgoWinograd:ConvBinWinogradRxSf3x2,1.14032,0,miopenConvolutionFwdAlgoWinograd,<unused>;miopenConvolutionFwdAlgoGEMM:GemmFwd1x1_0_1,1.13072,0,miopenConvolutionFwdAlgoGEMM,<unused>
42-83-83-3x3-42-83-83-64-1x1-1x1-1x1-0-NCHW-FP32-F_g42=miopenConvolutionFwdAlgoImplicitGEMM:ConvMlirIgemmFwd,8.02128,0,miopenConvolutionFwdAlgoImplicitGEMM,<unused>;miopenConvolutionFwdAlgoDirect:ConvOclDirectFwd,0.35984,0,miopenConvolutionFwdAlgoDirect,<unused>;miopenConvolutionFwdAlgoWinograd:ConvBinWinogradRxSf2x3,5.4536,0,miopenConvolutionFwdAlgoWinograd,<unused>;miopenConvolutionFwdAlgoGEMM:GemmFwdRest,8.12032,10416168,miopenConvolutionFwdAlgoGEMM,<unused>
168-83-83-1x1-84-83-83-64-0x0-1x1-1x1-0-NCHW-FP32-F=miopenConvolutionFwdAlgoImplicitGEMM:ConvMlirIgemmFwd,3.48239,0,miopenConvolutionFwdAlgoImplicitGEMM,<unused>;miopenConvolutionFwdAlgoDirect:ConvAsm1x1U,1.49792,0,miopenConvolutionFwdAlgoDirect,<unused>;miopenConvolutionFwdAlgoWinograd:ConvBinWinogradRxSf3x2,2.66496,0,miopenConvolutionFwdAlgoWinograd,<unused>;miopenConvolutionFwdAlgoGEMM:GemmFwd1x1_0_1,3.09967,0,miopenConvolutionFwdAlgoGEMM,<unused>
84-83-83-7x7-84-42-42-64-3x3-2x2-1x1-0-NCHW-FP32-F_g84=miopenConvolutionFwdAlgoImplicitGEMM:ConvMlirIgemmFwd,15.4089,0,miopenConvolutionFwdAlgoImplicitGEMM,<unused>;miopenConvolutionFwdAlgoDirect:ConvOclDirectFwd,0.615199,0,miopenConvolutionFwdAlgoDirect,<unused>;miopenConvolutionFwdAlgoWinograd:ConvBinWinogradRxSf2x3,9.72927,0,miopenConvolutionFwdAlgoWinograd,<unused>;miopenConvolutionFwdAlgoGEMM:GemmFwdRest,18.8005,29042496,miopenConvolutionFwdAlgoGEMM,<unused>
84-42-42-1x1-84-42-42-64-0x0-1x1-1x1-0-NCHW-FP32-F=miopenConvolutionFwdAlgoImplicitGEMM:ConvMlirIgemmFwd,0.534399,0,miopenConvolutionFwdAlgoImplicitGEMM,<unused>;miopenConvolutionFwdAlgoDirect:ConvAsm1x1U,0.257439,0,miopenConvolutionFwdAlgoDirect,<unused>;miopenConvolutionFwdAlgoWinograd:ConvBinWinogradRxSf3x2,0.458719,0,miopenConvolutionFwdAlgoWinograd,<unused>;miopenConvolutionFwdAlgoGEMM:GemmFwd1x1_0_1,0.500479,0,miopenConvolutionFwdAlgoGEMM,<unused>
84-42-42-7x7-84-42-42-64-3x3-1x1-1x1-0-NCHW-FP32-F_g84=miopenConvolutionFwdAlgoImplicitGEMM:ConvMlirIgemmFwd,15.4206,0,miopenConvolutionFwdAlgoImplicitGEMM,<unused>;miopenConvolutionFwdAlgoDirect:ConvOclDirectFwd,0.30128,0,miopenConvolutionFwdAlgoDirect,<unused>;miopenConvolutionFwdAlgoWinograd:ConvBinWinogradRxSf3x2,6.60079,0,miopenConvolutionFwdAlgoWinograd,<unused>;miopenConvolutionFwdAlgoGEMM:GemmFwdRest,19.1692,29042496,miopenConvolutionFwdAlgoGEMM,<unused>
84-83-83-5x5-84-42-42-64-2x2-2x2-1x1-0-NCHW-FP32-F_g84=miopenConvolutionFwdAlgoImplicitGEMM:ConvMlirIgemmFwd,7.99103,0,miopenConvolutionFwdAlgoImplicitGEMM,<unused>;miopenConvolutionFwdAlgoDirect:ConvOclDirectFwd,0.529439,0,miopenConvolutionFwdAlgoDirect,<unused>;miopenConvolutionFwdAlgoWinograd:ConvBinWinogradRxSf2x3,4.93839,0,miopenConvolutionFwdAlgoWinograd,<unused>;miopenConvolutionFwdAlgoGEMM:GemmFwdRest,12.9535,14817600,miopenConvolutionFwdAlgoGEMM,<unused>
84-42-42-5x5-84-42-42-64-2x2-1x1-1x1-0-NCHW-FP32-F_g84=miopenConvolutionFwdAlgoImplicitGEMM:ConvMlirIgemmFwd,8.00895,0,miopenConvolutionFwdAlgoImplicitGEMM,<unused>;miopenConvolutionFwdAlgoDirect:ConvOclDirectFwd,0.22048,0,miopenConvolutionFwdAlgoDirect,<unused>;miopenConvolutionFwdAlgoWinograd:ConvBinWinogradRxSf2x3,4.40671,0,miopenConvolutionFwdAlgoWinograd,<unused>;miopenConvolutionFwdAlgoGEMM:GemmFwdRest,12.1855,14817600,miopenConvolutionFwdAlgoGEMM,<unused>
168-42-42-1x1-84-42-42-64-0x0-1x1-1x1-0-NCHW-FP32-F=miopenConvolutionFwdAlgoImplicitGEMM:ConvMlirIgemmFwd,0.930879,0,miopenConvolutionFwdAlgoImplicitGEMM,<unused>;miopenConvolutionFwdAlgoDirect:ConvAsm1x1U,0.423839,0,miopenConvolutionFwdAlgoDirect,<unused>;miopenConvolutionFwdAlgoWinograd:ConvBinWinogradRxSf3x2,0.77744,0,miopenConvolutionFwdAlgoWinograd,<unused>;miopenConvolutionFwdAlgoGEMM:GemmFwd1x1_0_1,0.917599,0,miopenConvolutionFwdAlgoGEMM,<unused>
84-42-42-3x3-84-42-42-64-1x1-1x1-1x1-0-NCHW-FP32-F_g84=miopenConvolutionFwdAlgoImplicitGEMM:ConvMlirIgemmFwd,4.27632,0,miopenConvolutionFwdAlgoImplicitGEMM,<unused>;miopenConvolutionFwdAlgoDirect:ConvOclDirectFwd,0.2504,0,miopenConvolutionFwdAlgoDirect,<unused>;miopenConvolutionFwdAlgoWinograd:ConvBinWinogradRxSf2x3,3.09888,0,miopenConvolutionFwdAlgoWinograd,<unused>;miopenConvolutionFwdAlgoGEMM:GemmFwdRest,5.71379,5334336,miopenConvolutionFwdAlgoGEMM,<unused>
336-42-42-1x1-336-42-42-64-0x0-1x1-1x1-0-NCHW-FP32-F=miopenConvolutionFwdAlgoImplicitGEMM:ConvMlirIgemmFwd,4.98896,0,miopenConvolutionFwdAlgoImplicitGEMM,<unused>;miopenConvolutionFwdAlgoDirect:ConvAsm1x1U,2.78912,0,miopenConvolutionFwdAlgoDirect,<unused>;miopenConvolutionFwdAlgoWinograd:ConvBinWinogradRxSf3x2,4.57968,0,miopenConvolutionFwdAlgoWinograd,<unused>;miopenConvolutionFwdAlgoGEMM:GemmFwd1x1_0_1,3.10096,0,miopenConvolutionFwdAlgoGEMM,<unused>
168-42-42-5x5-168-42-42-64-2x2-1x1-1x1-0-NCHW-FP32-F_g168=miopenConvolutionFwdAlgoImplicitGEMM:ConvMlirIgemmFwd,15.9739,0,miopenConvolutionFwdAlgoImplicitGEMM,<unused>;miopenConvolutionFwdAlgoDirect:ConvOclDirectFwd,0.42672,0,miopenConvolutionFwdAlgoDirect,<unused>;miopenConvolutionFwdAlgoWinograd:ConvBinWinogradRxSf2x3,8.37792,0,miopenConvolutionFwdAlgoWinograd,<unused>;miopenConvolutionFwdAlgoGEMM:GemmFwdRest,22.016,29635200,miopenConvolutionFwdAlgoGEMM,<unused>
168-42-42-1x1-168-42-42-64-0x0-1x1-1x1-0-NCHW-FP32-F=miopenConvolutionFwdAlgoImplicitGEMM:ConvMlirIgemmFwd,1.3792,0,miopenConvolutionFwdAlgoImplicitGEMM,<unused>;miopenConvolutionFwdAlgoDirect:ConvAsm1x1U,0.701921,0,miopenConvolutionFwdAlgoDirect,<unused>;miopenConvolutionFwdAlgoWinograd:ConvBinWinogradRxSf3x2,1.508,0,miopenConvolutionFwdAlgoWinograd,<unused>;miopenConvolutionFwdAlgoGEMM:GemmFwd1x1_0_1,1.84736,0,miopenConvolutionFwdAlgoGEMM,<unused>
168-42-42-3x3-168-42-42-64-1x1-1x1-1x1-0-NCHW-FP32-F_g168=miopenConvolutionFwdAlgoImplicitGEMM:ConvMlirIgemmFwd,8.21585,0,miopenConvolutionFwdAlgoImplicitGEMM,<unused>;miopenConvolutionFwdAlgoDirect:ConvOclDirectFwd,0.367041,0,miopenConvolutionFwdAlgoDirect,<unused>;miopenConvolutionFwdAlgoWinograd:ConvBinWinogradRxSf2x3,5.544,0,miopenConvolutionFwdAlgoWinograd,<unused>;miopenConvolutionFwdAlgoGEMM:GemmFwdRest,9.30816,10668672,miopenConvolutionFwdAlgoGEMM,<unused>
336-42-42-1x1-168-42-42-64-0x0-1x1-1x1-0-NCHW-FP32-F=miopenConvolutionFwdAlgoImplicitGEMM:ConvMlirIgemmFwd,2.55728,0,miopenConvolutionFwdAlgoImplicitGEMM,<unused>;miopenConvolutionFwdAlgoDirect:ConvAsm1x1U,1.4384,0,miopenConvolutionFwdAlgoDirect,<unused>;miopenConvolutionFwdAlgoWinograd:ConvBinWinogradRxSf3x2,2.97232,0,miopenConvolutionFwdAlgoWinograd,<unused>;miopenConvolutionFwdAlgoGEMM:GemmFwd1x1_0_1,1.58112,0,miopenConvolutionFwdAlgoGEMM,<unused>
1008-42-42-1x1-336-42-42-64-0x0-1x1-1x1-0-NCHW-FP32-F=miopenConvolutionFwdAlgoImplicitGEMM:ConvMlirIgemmFwd,14.5776,0,miopenConvolutionFwdAlgoImplicitGEMM,<unused>;miopenConvolutionFwdAlgoDirect:ConvAsm1x1U,8.60608,0,miopenConvolutionFwdAlgoDirect,<unused>;miopenConvolutionFwdAlgoWinograd:ConvBinWinogradRxSf3x2,13.428,0,miopenConvolutionFwdAlgoWinograd,<unused>;miopenConvolutionFwdAlgoGEMM:GemmFwd1x1_0_1,6.98208,0,miopenConvolutionFwdAlgoGEMM,<unused>
1008-42-42-1x1-168-42-42-64-0x0-1x1-1x1-0-NCHW-FP32-F=miopenConvolutionFwdAlgoImplicitGEMM:ConvMlirIgemmFwd,7.54288,0,miopenConvolutionFwdAlgoImplicitGEMM,<unused>;miopenConvolutionFwdAlgoDirect:ConvAsm1x1U,4.3144,0,miopenConvolutionFwdAlgoDirect,<unused>;miopenConvolutionFwdAlgoWinograd:ConvBinWinogradRxSf3x2,6.99248,0,miopenConvolutionFwdAlgoWinograd,<unused>;miopenConvolutionFwdAlgoGEMM:GemmFwd1x1_0_1,4.37616,0,miopenConvolutionFwdAlgoGEMM,<unused>
336-47-47-7x7-336-21-21-64-0x0-2x2-1x1-0-NCHW-FP32-F_g336=miopenConvolutionFwdAlgoImplicitGEMM:ConvMlirIgemmFwd,15.1571,0,miopenConvolutionFwdAlgoImplicitGEMM,<unused>;miopenConvolutionFwdAlgoDirect:ConvOclDirectFwd,0.938401,0,miopenConvolutionFwdAlgoDirect,<unused>;miopenConvolutionFwdAlgoWinograd:ConvBinWinogradRxSf2x3,10.6973,0,miopenConvolutionFwdAlgoWinograd,<unused>;miopenConvolutionFwdAlgoGEMM:GemmFwdRest,16.937,29042496,miopenConvolutionFwdAlgoGEMM,<unused>
336-21-21-1x1-336-21-21-64-0x0-1x1-1x1-0-NCHW-FP32-F=miopenConvolutionFwdAlgoImplicitGEMM:ConvAsmImplicitGemmV4R1DynamicFwd,1.58768,0,miopenConvolutionFwdAlgoImplicitGEMM,<unused>;miopenConvolutionFwdAlgoDirect:ConvAsm1x1U,0.727041,0,miopenConvolutionFwdAlgoDirect,<unused>;miopenConvolutionFwdAlgoWinograd:ConvBinWinogradRxSf3x2,1.29664,0,miopenConvolutionFwdAlgoWinograd,<unused>;miopenConvolutionFwdAlgoGEMM:GemmFwd1x1_0_1,1.90896,0,miopenConvolutionFwdAlgoGEMM,<unused>
336-21-21-7x7-336-21-21-64-3x3-1x1-1x1-0-NCHW-FP32-F_g336=miopenConvolutionFwdAlgoImplicitGEMM:ConvMlirIgemmFwd,15.4728,0,miopenConvolutionFwdAlgoImplicitGEMM,<unused>;miopenConvolutionFwdAlgoDirect:ConvOclDirectFwd,0.342721,0,miopenConvolutionFwdAlgoDirect,<unused>;miopenConvolutionFwdAlgoWinograd:ConvBinWinogradRxSf3x2,6.79472,0,miopenConvolutionFwdAlgoWinograd,<unused>;miopenConvolutionFwdAlgoGEMM:GemmFwdRest,16.64,29042496,miopenConvolutionFwdAlgoGEMM,<unused>
336-45-45-5x5-336-21-21-64-0x0-2x2-1x1-0-NCHW-FP32-F_g336=miopenConvolutionFwdAlgoImplicitGEMM:ConvMlirIgemmFwd,7.88352,0,miopenConvolutionFwdAlgoImplicitGEMM,<unused>;miopenConvolutionFwdAlgoDirect:ConvOclDirectFwd,0.91312,0,miopenConvolutionFwdAlgoDirect,<unused>;miopenConvolutionFwdAlgoWinograd:ConvBinWinogradRxSf2x3,5.556,0,miopenConvolutionFwdAlgoWinograd,<unused>;miopenConvolutionFwdAlgoGEMM:GemmFwdRest,11.4278,14817600,miopenConvolutionFwdAlgoGEMM,<unused>
336-21-21-5x5-336-21-21-64-2x2-1x1-1x1-0-NCHW-FP32-F_g336=miopenConvolutionFwdAlgoImplicitGEMM:ConvMlirIgemmFwd,7.93856,0,miopenConvolutionFwdAlgoImplicitGEMM,<unused>;miopenConvolutionFwdAlgoDirect:ConvOclDirectFwd,0.265601,0,miopenConvolutionFwdAlgoDirect,<unused>;miopenConvolutionFwdAlgoWinograd:ConvBinWinogradRxSf2x3,4.9008,0,miopenConvolutionFwdAlgoWinograd,<unused>;miopenConvolutionFwdAlgoGEMM:GemmFwdRest,10.4038,14817600,miopenConvolutionFwdAlgoGEMM,<unused>
672-21-21-1x1-336-21-21-64-0x0-1x1-1x1-0-NCHW-FP32-F=miopenConvolutionFwdAlgoImplicitGEMM:ConvMlirIgemmFwd,3.3568,0,miopenConvolutionFwdAlgoImplicitGEMM,<unused>;miopenConvolutionFwdAlgoDirect:ConvAsm1x1U,1.41184,0,miopenConvolutionFwdAlgoDirect,<unused>;miopenConvolutionFwdAlgoWinograd:ConvBinWinogradRxSf3x2,2.45872,0,miopenConvolutionFwdAlgoWinograd,<unused>;miopenConvolutionFwdAlgoGEMM:GemmFwd1x1_0_1,1.4432,0,miopenConvolutionFwdAlgoGEMM,<unused>
336-21-21-3x3-336-21-21-64-1x1-1x1-1x1-0-NCHW-FP32-F_g336=miopenConvolutionFwdAlgoImplicitGEMM:ConvMlirIgemmFwd,4.20048,0,miopenConvolutionFwdAlgoImplicitGEMM,<unused>;miopenConvolutionFwdAlgoDirect:ConvOclDirectFwd,0.211041,0,miopenConvolutionFwdAlgoDirect,<unused>;miopenConvolutionFwdAlgoWinograd:ConvBinWinogradRxSf3x2,3.43968,0,miopenConvolutionFwdAlgoWinograd,<unused>;miopenConvolutionFwdAlgoGEMM:GemmFwdRest,14.0493,5334336,miopenConvolutionFwdAlgoGEMM,<unused>
1344-21-21-1x1-672-21-21-64-0x0-1x1-1x1-0-NCHW-FP32-F=miopenConvolutionFwdAlgoImplicitGEMM:ConvHipImplicitGemmV4R4Fwd,6.03584,0,miopenConvolutionFwdAlgoImplicitGEMM,<unused>;miopenConvolutionFwdAlgoDirect:ConvAsm1x1U,5.64432,0,miopenConvolutionFwdAlgoDirect,<unused>;miopenConvolutionFwdAlgoWinograd:ConvBinWinogradRxSf3x2,8.0032,0,miopenConvolutionFwdAlgoWinograd,<unused>;miopenConvolutionFwdAlgoGEMM:GemmFwd1x1_0_1,5.30976,0,miopenConvolutionFwdAlgoGEMM,<unused>
1008-21-21-1x1-168-21-21-64-0x0-1x1-1x1-0-NCHW-FP32-F=miopenConvolutionFwdAlgoImplicitGEMM:ConvMlirIgemmFwd,2.54704,0,miopenConvolutionFwdAlgoImplicitGEMM,<unused>;miopenConvolutionFwdAlgoDirect:ConvAsm1x1U,1.08048,0,miopenConvolutionFwdAlgoDirect,<unused>;miopenConvolutionFwdAlgoWinograd:ConvBinWinogradRxSf3x2,2.0352,0,miopenConvolutionFwdAlgoWinograd,<unused>;miopenConvolutionFwdAlgoGEMM:GemmFwd1x1_0_1,1.34944,0,miopenConvolutionFwdAlgoGEMM,<unused>
2016-21-21-1x1-672-21-21-64-0x0-1x1-1x1-0-NCHW-FP32-F=miopenConvolutionFwdAlgoImplicitGEMM:ConvHipImplicitGemmV4R4Fwd,8.60977,0,miopenConvolutionFwdAlgoImplicitGEMM,<unused>;miopenConvolutionFwdAlgoDirect:ConvAsm1x1U,8.51424,0,miopenConvolutionFwdAlgoDirect,<unused>;miopenConvolutionFwdAlgoWinograd:ConvBinWinogradRxSf3x2,12.5136,0,miopenConvolutionFwdAlgoWinograd,<unused>;miopenConvolutionFwdAlgoGEMM:GemmFwd1x1_0_1,7.24112,0,miopenConvolutionFwdAlgoGEMM,<unused>
2016-21-21-1x1-336-21-21-64-0x0-1x1-1x1-0-NCHW-FP32-F=miopenConvolutionFwdAlgoImplicitGEMM:ConvMlirIgemmFwd,9.92625,0,miopenConvolutionFwdAlgoImplicitGEMM,<unused>;miopenConvolutionFwdAlgoDirect:ConvAsm1x1U,4.31088,0,miopenConvolutionFwdAlgoDirect,<unused>;miopenConvolutionFwdAlgoWinograd:ConvBinWinogradRxSf3x2,6.26992,0,miopenConvolutionFwdAlgoWinograd,<unused>;miopenConvolutionFwdAlgoGEMM:GemmFwd1x1_0_1,4.81856,0,miopenConvolutionFwdAlgoGEMM,<unused>
672-21-21-7x7-672-11-11-64-3x3-2x2-1x1-0-NCHW-FP32-F_g672=miopenConvolutionFwdAlgoImplicitGEMM:ConvMlirIgemmFwd,8.40097,0,miopenConvolutionFwdAlgoImplicitGEMM,<unused>;miopenConvolutionFwdAlgoDirect:ConvOclDirectFwd,0.51008,0,miopenConvolutionFwdAlgoDirect,<unused>;miopenConvolutionFwdAlgoWinograd:ConvBinWinogradRxSf2x3,6.77248,0,miopenConvolutionFwdAlgoWinograd,<unused>;miopenConvolutionFwdAlgoGEMM:GemmFwdRest,11.305,15937152,miopenConvolutionFwdAlgoGEMM,<unused>
672-11-11-1x1-672-11-11-64-0x0-1x1-1x1-0-NCHW-FP32-F=miopenConvolutionFwdAlgoImplicitGEMM:ConvHipImplicitGemmV4R4Fwd,0.875041,0,miopenConvolutionFwdAlgoImplicitGEMM,<unused>;miopenConvolutionFwdAlgoDirect:ConvAsm1x1U,0.818081,0,miopenConvolutionFwdAlgoDirect,<unused>;miopenConvolutionFwdAlgoWinograd:ConvBinWinogradRxSf3x2,1.63632,0,miopenConvolutionFwdAlgoWinograd,<unused>;miopenConvolutionFwdAlgoGEMM:GemmFwd1x1_0_1,1.29424,0,miopenConvolutionFwdAlgoGEMM,<unused>
672-11-11-7x7-672-11-11-64-3x3-1x1-1x1-0-NCHW-FP32-F_g672=miopenConvolutionFwdAlgoImplicitGEMM:ConvMlirIgemmFwd,8.47377,0,miopenConvolutionFwdAlgoImplicitGEMM,<unused>;miopenConvolutionFwdAlgoDirect:ConvOclDirectFwd,0.22544,0,miopenConvolutionFwdAlgoDirect,<unused>;miopenConvolutionFwdAlgoWinograd:ConvBinWinogradRxSf3x2,4.57936,0,miopenConvolutionFwdAlgoWinograd,<unused>;miopenConvolutionFwdAlgoGEMM:GemmFwdRest,11.4483,15937152,miopenConvolutionFwdAlgoGEMM,<unused>
672-21-21-5x5-672-11-11-64-2x2-2x2-1x1-0-NCHW-FP32-F_g672=miopenConvolutionFwdAlgoImplicitGEMM:ConvMlirIgemmFwd,4.75824,0,miopenConvolutionFwdAlgoImplicitGEMM,<unused>;miopenConvolutionFwdAlgoDirect:ConvOclDirectFwd,0.3368,0,miopenConvolutionFwdAlgoDirect,<unused>;miopenConvolutionFwdAlgoWinograd:ConvBinWinogradRxSf2x3,3.452,0,miopenConvolutionFwdAlgoWinograd,<unused>;miopenConvolutionFwdAlgoGEMM:GemmFwdRest,6.74816,8131200,miopenConvolutionFwdAlgoGEMM,<unused>
672-11-11-5x5-672-11-11-64-2x2-1x1-1x1-0-NCHW-FP32-F_g672=miopenConvolutionFwdAlgoImplicitGEMM:ConvMlirIgemmFwd,4.3392,0,miopenConvolutionFwdAlgoImplicitGEMM,<unused>;miopenConvolutionFwdAlgoDirect:ConvOclDirectFwd,0.148961,0,miopenConvolutionFwdAlgoDirect,<unused>;miopenConvolutionFwdAlgoWinograd:ConvBinWinogradRxSf2x3,3.29424,0,miopenConvolutionFwdAlgoWinograd,<unused>;miopenConvolutionFwdAlgoGEMM:GemmFwdRest,8.4992,8131200,miopenConvolutionFwdAlgoGEMM,<unused>
1344-11-11-1x1-672-11-11-64-0x0-1x1-1x1-0-NCHW-FP32-F=miopenConvolutionFwdAlgoImplicitGEMM:ConvHipImplicitGemmV4R4Fwd,1.6704,0,miopenConvolutionFwdAlgoImplicitGEMM,<unused>;miopenConvolutionFwdAlgoDirect:ConvAsm1x1U,1.56704,0,miopenConvolutionFwdAlgoDirect,<unused>;miopenConvolutionFwdAlgoWinograd:ConvBinWinogradRxSf3x2,3.12896,0,miopenConvolutionFwdAlgoWinograd,<unused>;miopenConvolutionFwdAlgoGEMM:GemmFwd1x1_0_1,2.57776,0,miopenConvolutionFwdAlgoGEMM,<unused>
672-11-11-3x3-672-11-11-64-1x1-1x1-1x1-0-NCHW-FP32-F_g672=miopenConvolutionFwdAlgoImplicitGEMM:ConvMlirIgemmFwd,2.63792,0,miopenConvolutionFwdAlgoImplicitGEMM,<unused>;miopenConvolutionFwdAlgoDirect:ConvOclDirectFwd,0.12672,0,miopenConvolutionFwdAlgoDirect,<unused>;miopenConvolutionFwdAlgoWinograd:ConvBinWinogradRxSf2x3,2.23456,0,miopenConvolutionFwdAlgoWinograd,<unused>;miopenConvolutionFwdAlgoGEMM:GemmFwdRest,2.88768,2927232,miopenConvolutionFwdAlgoGEMM,<unused>
2688-11-11-1x1-1344-11-11-64-0x0-1x1-1x1-0-NCHW-FP32-F=miopenConvolutionFwdAlgoImplicitGEMM:ConvHipImplicitGemmV4R4Fwd,5.31024,0,miopenConvolutionFwdAlgoImplicitGEMM,<unused>;miopenConvolutionFwdAlgoDirect:ConvAsm1x1U,6.12848,0,miopenConvolutionFwdAlgoDirect,<unused>;miopenConvolutionFwdAlgoWinograd:ConvBinWinogradRxSf3x2,10.7267,0,miopenConvolutionFwdAlgoWinograd,<unused>;miopenConvolutionFwdAlgoGEMM:GemmFwd1x1_0_1,8.98497,0,miopenConvolutionFwdAlgoGEMM,<unused>
2016-11-11-1x1-336-11-11-64-0x0-1x1-1x1-0-NCHW-FP32-F=miopenConvolutionFwdAlgoImplicitGEMM:ConvAsmImplicitGemmV4R1DynamicFwd,2.75696,0,miopenConvolutionFwdAlgoImplicitGEMM,<unused>;miopenConvolutionFwdAlgoDirect:ConvAsm1x1U,1.23104,0,miopenConvolutionFwdAlgoDirect,<unused>;miopenConvolutionFwdAlgoWinograd:ConvBinWinogradRxSf3x2,2.37856,0,miopenConvolutionFwdAlgoWinograd,<unused>;miopenConvolutionFwdAlgoGEMM:GemmFwd1x1_0_1,1.89888,0,miopenConvolutionFwdAlgoGEMM,<unused>
4032-11-11-1x1-1344-11-11-64-0x0-1x1-1x1-0-NCHW-FP32-F=miopenConvolutionFwdAlgoImplicitGEMM:ConvHipImplicitGemmV4R4Fwd,8.04033,0,miopenConvolutionFwdAlgoImplicitGEMM,<unused>;miopenConvolutionFwdAlgoDirect:ConvAsm1x1U,9.15809,0,miopenConvolutionFwdAlgoDirect,<unused>;miopenConvolutionFwdAlgoWinograd:ConvBinWinogradRxSf3x2,16.4016,0,miopenConvolutionFwdAlgoWinograd,<unused>;miopenConvolutionFwdAlgoGEMM:GemmFwd1x1_0_1,7.94208,0,miopenConvolutionFwdAlgoGEMM,<unused>
4032-11-11-1x1-672-11-11-64-0x0-1x1-1x1-0-NCHW-FP32-F=miopenConvolutionFwdAlgoImplicitGEMM:ConvHipImplicitGemmV4R4Fwd,5.09072,0,miopenConvolutionFwdAlgoImplicitGEMM,<unused>;miopenConvolutionFwdAlgoDirect:ConvAsm1x1U,4.62912,0,miopenConvolutionFwdAlgoDirect,<unused>;miopenConvolutionFwdAlgoWinograd:ConvBinWinogradRxSf3x2,8.16497,0,miopenConvolutionFwdAlgoWinograd,<unused>;miopenConvolutionFwdAlgoGEMM:GemmFwd1x1_0_1,4.91664,0,miopenConvolutionFwdAlgoGEMM,<unused>
64-56-56-3x3-64-28-28-64-1x1-2x2-1x1-0-NCHW-FP32-F=miopenConvolutionFwdAlgoImplicitGEMM:ConvHipImplicitGemmV4R1Fwd,0.42576,0,miopenConvolutionFwdAlgoImplicitGEMM,<unused>;miopenConvolutionFwdAlgoDirect:ConvOclDirectFwd,1.84592,0,miopenConvolutionFwdAlgoDirect,<unused>;miopenConvolutionFwdAlgoWinograd:ConvBinWinogradRxSf2x3g1,0.802561,0,miopenConvolutionFwdAlgoWinograd,<unused>;miopenConvolutionFwdAlgoGEMM:GemmFwdRest,10.1171,1806336,miopenConvolutionFwdAlgoGEMM,<unused>
64-28-28-1x1-256-28-28-64-0x0-1x1-1x1-0-NCHW-FP32-F=miopenConvolutionFwdAlgoImplicitGEMM:ConvAsmImplicitGemmV4R1DynamicFwd_1x1,0.20384,0,miopenConvolutionFwdAlgoImplicitGEMM,<unused>;miopenConvolutionFwdAlgoDirect:ConvOclDirectFwd1x1,0.20736,0,miopenConvolutionFwdAlgoDirect,<unused>;miopenConvolutionFwdAlgoWinograd:ConvBinWinogradRxSf3x2,0.50464,0,miopenConvolutionFwdAlgoWinograd,<unused>;miopenConvolutionFwdAlgoGEMM:GemmFwd1x1_0_1,0.30704,0,miopenConvolutionFwdAlgoGEMM,<unused>
256-28-28-1x1-128-28-28-64-0x0-1x1-1x1-0-NCHW-FP32-F=miopenConvolutionFwdAlgoImplicitGEMM:ConvHipImplicitGemmV4R4Fwd,0.32752,0,miopenConvolutionFwdAlgoImplicitGEMM,<unused>;miopenConvolutionFwdAlgoDirect:ConvAsm1x1U,0.40096,0,miopenConvolutionFwdAlgoDirect,<unused>;miopenConvolutionFwdAlgoWinograd:ConvBinWinogradRxSf3x2,0.81168,0,miopenConvolutionFwdAlgoWinograd,<unused>;miopenConvolutionFwdAlgoGEMM:GemmFwd1x1_0_1,0.41184,0,miopenConvolutionFwdAlgoGEMM,<unused>
128-28-28-3x3-128-14-14-64-1x1-2x2-1x1-0-NCHW-FP32-F=miopenConvolutionFwdAlgoImplicitGEMM:ConvAsmImplicitGemmV4R1DynamicFwd,0.45248,0,miopenConvolutionFwdAlgoImplicitGEMM,<unused>;miopenConvolutionFwdAlgoDirect:ConvOclDirectFwd,2.07904,0,miopenConvolutionFwdAlgoDirect,<unused>;miopenConvolutionFwdAlgoWinograd:ConvBinWinogradRxSf2x3g1,0.78544,0,miopenConvolutionFwdAlgoWinograd,<unused>;miopenConvolutionFwdAlgoGEMM:GemmFwdRest,4.34176,903168,miopenConvolutionFwdAlgoGEMM,<unused>
128-14-14-1x1-512-14-14-64-0x0-1x1-1x1-0-NCHW-FP32-F=miopenConvolutionFwdAlgoImplicitGEMM:ConvHipImplicitGemmV4R4Fwd,0.18288,0,miopenConvolutionFwdAlgoImplicitGEMM,<unused>;miopenConvolutionFwdAlgoDirect:ConvAsm1x1U,0.30592,0,miopenConvolutionFwdAlgoDirect,<unused>;miopenConvolutionFwdAlgoWinograd:ConvBinWinogradRxSf3x2,0.46304,0,miopenConvolutionFwdAlgoWinograd,<unused>;miopenConvolutionFwdAlgoGEMM:GemmFwd1x1_0_1,0.33376,0,miopenConvolutionFwdAlgoGEMM,<unused>
512-14-14-1x1-256-14-14-64-0x0-1x1-1x1-0-NCHW-FP32-F=miopenConvolutionFwdAlgoImplicitGEMM:ConvHipImplicitGemmV4R4Fwd,0.36256,0,miopenConvolutionFwdAlgoImplicitGEMM,<unused>;miopenConvolutionFwdAlgoDirect:ConvOclDirectFwd1x1,0.40192,0,miopenConvolutionFwdAlgoDirect,<unused>;miopenConvolutionFwdAlgoWinograd:ConvBinWinogradRxSf3x2,0.77072,0,miopenConvolutionFwdAlgoWinograd,<unused>;miopenConvolutionFwdAlgoGEMM:GemmFwd1x1_0_1,0.71152,0,miopenConvolutionFwdAlgoGEMM,<unused>
256-14-14-3x3-256-7-7-64-1x1-2x2-1x1-0-NCHW-FP32-F=miopenConvolutionFwdAlgoImplicitGEMM:ConvHipImplicitGemmV4R1Fwd,0.52592,0,miopenConvolutionFwdAlgoImplicitGEMM,<unused>;miopenConvolutionFwdAlgoDirect:ConvOclDirectFwd,2.0376,0,miopenConvolutionFwdAlgoDirect,<unused>;miopenConvolutionFwdAlgoWinograd:ConvBinWinogradRxSf2x3g1,1.10416,0,miopenConvolutionFwdAlgoWinograd,<unused>;miopenConvolutionFwdAlgoGEMM:GemmFwdRest,6.42048,451584,miopenConvolutionFwdAlgoGEMM,<unused>
256-7-7-1x1-1024-7-7-64-0x0-1x1-1x1-0-NCHW-FP32-F=miopenConvolutionFwdAlgoImplicitGEMM:ConvHipImplicitGemmV4R1Fwd,0.18432,0,miopenConvolutionFwdAlgoImplicitGEMM,<unused>;miopenConvolutionFwdAlgoDirect:ConvAsm1x1U,0.28272,0,miopenConvolutionFwdAlgoDirect,<unused>;miopenConvolutionFwdAlgoWinograd:ConvBinWinogradRxSf3x2,0.58368,0,miopenConvolutionFwdAlgoWinograd,<unused>;miopenConvolutionFwdAlgoGEMM:GemmFwd1x1_0_1,0.69792,0,miopenConvolutionFwdAlgoGEMM,<unused>
1024-7-7-1x1-512-7-7-64-0x0-1x1-1x1-0-NCHW-FP32-F=miopenConvolutionFwdAlgoImplicitGEMM:ConvHipImplicitGemmV4R4Fwd,0.43968,0,miopenConvolutionFwdAlgoImplicitGEMM,<unused>;miopenConvolutionFwdAlgoDirect:ConvAsm1x1U,0.52816,0,miopenConvolutionFwdAlgoDirect,<unused>;miopenConvolutionFwdAlgoWinograd:ConvBinWinogradRxSf3x2,1.04816,0,miopenConvolutionFwdAlgoWinograd,<unused>;miopenConvolutionFwdAlgoGEMM:GemmFwd1x1_0_1,1.1712,0,miopenConvolutionFwdAlgoGEMM,<unused>
2048-1-1-1x1-1001-1-1-64-0x0-1x1-1x1-0-NCHW-FP32-F=miopenConvolutionFwdAlgoImplicitGEMM:ConvMlirIgemmFwd,0.96912,0,miopenConvolutionFwdAlgoImplicitGEMM,<unused>;miopenConvolutionFwdAlgoDirect:ConvAsm1x1U,0.61008,0,miopenConvolutionFwdAlgoDirect,<unused>;miopenConvolutionFwdAlgoWinograd:ConvBinWinogradRxSf3x2,0.823681,0,miopenConvolutionFwdAlgoWinograd,<unused>;miopenConvolutionFwdAlgoGEMM:GemmFwd1x1_0_1,2.05344,0,miopenConvolutionFwdAlgoGEMM,<unused>
3-224-224-7x7-64-112-112-1-3x3-2x2-1x1-0-NCHW-FP32-F=miopenConvolutionFwdAlgoImplicitGEMM:ConvMlirIgemmFwd,0.12064,0,miopenConvolutionFwdAlgoImplicitGEMM,<unused>;miopenConvolutionFwdAlgoDirect:ConvAsm7x7c3h224w224k64u2v2p3q3f1,0.05584,0,miopenConvolutionFwdAlgoDirect,<unused>;miopenConvolutionFwdAlgoWinograd:ConvBinWinogradRxSf2x3g1,0.07488,0,miopenConvolutionFwdAlgoWinograd,<unused>;miopenConvolutionFwdAlgoGEMM:GemmFwdRest,0.10112,7375872,miopenConvolutionFwdAlgoGEMM,<unused>
64-56-56-1x1-64-56-56-1-0x0-1x1-1x1-0-NCHW-FP32-F=miopenConvolutionFwdAlgoImplicitGEMM:ConvHipImplicitGemmV4R4Fwd,0.02224,0,miopenConvolutionFwdAlgoImplicitGEMM,<unused>;miopenConvolutionFwdAlgoDirect:ConvAsm1x1U,0.01856,0,miopenConvolutionFwdAlgoDirect,<unused>;miopenConvolutionFwdAlgoWinograd:ConvBinWinogradRxSf2x3g1,0.0432,0,miopenConvolutionFwdAlgoWinograd,<unused>;miopenConvolutionFwdAlgoGEMM:GemmFwd1x1_0_1,0.04096,0,miopenConvolutionFwdAlgoGEMM,<unused>
64-56-56-3x3-64-56-56-1-1x1-1x1-1x1-0-NCHW-FP32-F=miopenConvolutionFwdAlgoWinograd:ConvBinWinograd3x3U,0.04912,0,miopenConvolutionFwdAlgoWinograd,<unused>
128-56-56-1x1-256-56-56-1-0x0-1x1-1x1-0-NCHW-FP32-F=miopenConvolutionFwdAlgoImplicitGEMM:ConvHipImplicitGemmV4R4Fwd,0.04288,0,miopenConvolutionFwdAlgoImplicitGEMM,<unused>;miopenConvolutionFwdAlgoDirect:ConvAsm1x1U,0.04304,0,miopenConvolutionFwdAlgoDirect,<unused>;miopenConvolutionFwdAlgoWinograd:ConvBinWinogradRxSf3x2,0.1088,0,miopenConvolutionFwdAlgoWinograd,<unused>;miopenConvolutionFwdAlgoGEMM:GemmFwd1x1_0_1,0.05328,0,miopenConvolutionFwdAlgoGEMM,<unused>
256-56-56-1x1-64-56-56-1-0x0-1x1-1x1-0-NCHW-FP32-F=miopenConvolutionFwdAlgoImplicitGEMM:ConvHipImplicitGemmV4R4Fwd,0.04272,0,miopenConvolutionFwdAlgoImplicitGEMM,<unused>;miopenConvolutionFwdAlgoDirect:ConvAsm1x1U,0.02944,0,miopenConvolutionFwdAlgoDirect,<unused>;miopenConvolutionFwdAlgoWinograd:ConvBinWinogradRxS,0.08128,0,miopenConvolutionFwdAlgoWinograd,<unused>;miopenConvolutionFwdAlgoGEMM:GemmFwd1x1_0_1,0.07856,0,miopenConvolutionFwdAlgoGEMM,<unused>
64-56-56-1x1-256-56-56-1-0x0-1x1-1x1-0-NCHW-FP32-F=miopenConvolutionFwdAlgoImplicitGEMM:ConvHipImplicitGemmV4R4Fwd,0.02928,0,miopenConvolutionFwdAlgoImplicitGEMM,<unused>;miopenConvolutionFwdAlgoDirect:ConvAsm1x1U,0.03184,0,miopenConvolutionFwdAlgoDirect,<unused>;miopenConvolutionFwdAlgoWinograd:ConvBinWinogradRxSf3x2,0.0856,0,miopenConvolutionFwdAlgoWinograd,<unused>;miopenConvolutionFwdAlgoGEMM:GemmFwd1x1_0_1,0.0432,0,miopenConvolutionFwdAlgoGEMM,<unused>
256-56-56-1x1-128-56-56-1-0x0-1x1-1x1-0-NCHW-FP32-F=miopenConvolutionFwdAlgoImplicitGEMM:ConvHipImplicitGemmV4R4Fwd,0.04944,0,miopenConvolutionFwdAlgoImplicitGEMM,<unused>;miopenConvolutionFwdAlgoDirect:ConvAsm1x1U,0.05104,0,miopenConvolutionFwdAlgoDirect,<unused>;miopenConvolutionFwdAlgoWinograd:ConvBinWinogradRxSf3x2,0.09168,0,miopenConvolutionFwdAlgoWinograd,<unused>;miopenConvolutionFwdAlgoGEMM:GemmFwd1x1_0_1,0.06288,0,miopenConvolutionFwdAlgoGEMM,<unused>
128-56-56-3x3-128-28-28-1-1x1-2x2-1x1-0-NCHW-FP32-F=miopenConvolutionFwdAlgoImplicitGEMM:ConvMlirIgemmFwd,0.60768,0,miopenConvolutionFwdAlgoImplicitGEMM,<unused>;miopenConvolutionFwdAlgoDirect:ConvOclDirectFwd,0.41968,0,miopenConvolutionFwdAlgoDirect,<unused>;miopenConvolutionFwdAlgoWinograd:ConvBinWinogradRxSf2x3g1,0.1368,0,miopenConvolutionFwdAlgoWinograd,<unused>;miopenConvolutionFwdAlgoGEMM:GemmFwdRest,0.15584,3612672,miopenConvolutionFwdAlgoGEMM,<unused>
384-28-28-1x1-512-28-28-1-0x0-1x1-1x1-0-NCHW-FP32-F=miopenConvolutionFwdAlgoImplicitGEMM:ConvMlirIgemmFwd,0.20384,0,miopenConvolutionFwdAlgoImplicitGEMM,<unused>;miopenConvolutionFwdAlgoDirect:ConvAsm1x1U,0.06576,0,miopenConvolutionFwdAlgoDirect,<unused>;miopenConvolutionFwdAlgoWinograd:ConvBinWinogradRxSf2x3g1,0.17408,0,miopenConvolutionFwdAlgoWinograd,<unused>;miopenConvolutionFwdAlgoGEMM:GemmFwd1x1_0_1,0.06816,0,miopenConvolutionFwdAlgoGEMM,<unused>
512-28-28-1x1-128-28-28-1-0x0-1x1-1x1-0-NCHW-FP32-F=miopenConvolutionFwdAlgoImplicitGEMM:ConvMlirIgemmFwd,0.264,0,miopenConvolutionFwdAlgoImplicitGEMM,<unused>;miopenConvolutionFwdAlgoDirect:ConvAsm1x1U,0.04368,0,miopenConvolutionFwdAlgoDirect,<unused>;miopenConvolutionFwdAlgoWinograd:ConvBinWinogradRxSf2x3,0.13776,0,miopenConvolutionFwdAlgoWinograd,<unused>;miopenConvolutionFwdAlgoGEMM:GemmFwd1x1_0_1,0.12976,0,miopenConvolutionFwdAlgoGEMM,<unused>
128-28-28-3x3-128-28-28-1-1x1-1x1-1x1-0-NCHW-FP32-F=miopenConvolutionFwdAlgoWinograd:ConvBinWinogradRxSf2x3g1,0.06176,0,miopenConvolutionFwdAlgoWinograd,<unused>
128-28-28-1x1-512-28-28-1-0x0-1x1-1x1-0-NCHW-FP32-F=miopenConvolutionFwdAlgoImplicitGEMM:ConvMlirIgemmFwd,0.08208,0,miopenConvolutionFwdAlgoImplicitGEMM,<unused>;miopenConvolutionFwdAlgoDirect:ConvAsm1x1U,0.03728,0,miopenConvolutionFwdAlgoDirect,<unused>;miopenConvolutionFwdAlgoWinograd:ConvBinWinogradRxSf2x3g1,0.07584,0,miopenConvolutionFwdAlgoWinograd,<unused>;miopenConvolutionFwdAlgoGEMM:GemmFwd1x1_0_1,0.04992,0,miopenConvolutionFwdAlgoGEMM,<unused>
512-28-28-1x1-256-28-28-1-0x0-1x1-1x1-0-NCHW-FP32-F=miopenConvolutionFwdAlgoImplicitGEMM:ConvMlirIgemmFwd,0.26432,0,miopenConvolutionFwdAlgoImplicitGEMM,<unused>;miopenConvolutionFwdAlgoDirect:ConvAsm1x1U,0.05184,0,miopenConvolutionFwdAlgoDirect,<unused>;miopenConvolutionFwdAlgoWinograd:ConvBinWinogradRxSf2x3g1,0.12128,0,miopenConvolutionFwdAlgoWinograd,<unused>;miopenConvolutionFwdAlgoGEMM:GemmFwd1x1_0_1,0.11104,0,miopenConvolutionFwdAlgoGEMM,<unused>
256-28-28-3x3-256-14-14-1-1x1-2x2-1x1-0-NCHW-FP32-F=miopenConvolutionFwdAlgoImplicitGEMM:ConvMlirIgemmFwd,1.19472,0,miopenConvolutionFwdAlgoImplicitGEMM,<unused>;miopenConvolutionFwdAlgoDirect:ConvOclDirectFwd,0.60448,0,miopenConvolutionFwdAlgoDirect,<unused>;miopenConvolutionFwdAlgoWinograd:ConvBinWinogradRxSf2x3,0.23824,0,miopenConvolutionFwdAlgoWinograd,<unused>;miopenConvolutionFwdAlgoGEMM:GemmFwdRest,0.16032,1806336,miopenConvolutionFwdAlgoGEMM,<unused>
768-14-14-1x1-1024-14-14-1-0x0-1x1-1x1-0-NCHW-FP32-F=miopenConvolutionFwdAlgoImplicitGEMM:ConvMlirIgemmFwd,0.3872,0,miopenConvolutionFwdAlgoImplicitGEMM,<unused>;miopenConvolutionFwdAlgoDirect:ConvAsm1x1U,0.09952,0,miopenConvolutionFwdAlgoDirect,<unused>;miopenConvolutionFwdAlgoWinograd:ConvBinWinogradRxSf3x2,0.20576,0,miopenConvolutionFwdAlgoWinograd,<unused>;miopenConvolutionFwdAlgoGEMM:GemmFwd1x1_0_1,0.0968,0,miopenConvolutionFwdAlgoGEMM,<unused>
1024-14-14-1x1-256-14-14-1-0x0-1x1-1x1-0-NCHW-FP32-F=miopenConvolutionFwdAlgoImplicitGEMM:ConvMlirIgemmFwd,0.50992,0,miopenConvolutionFwdAlgoImplicitGEMM,<unused>;miopenConvolutionFwdAlgoDirect:ConvAsm1x1U,0.04848,0,miopenConvolutionFwdAlgoDirect,<unused>;miopenConvolutionFwdAlgoWinograd:ConvBinWinogradRxSf2x3g1,0.23712,0,miopenConvolutionFwdAlgoWinograd,<unused>;miopenConvolutionFwdAlgoGEMM:GemmFwd1x1_0_1,0.11904,0,miopenConvolutionFwdAlgoGEMM,<unused>
256-14-14-3x3-256-14-14-1-1x1-1x1-1x1-0-NCHW-FP32-F=miopenConvolutionFwdAlgoWinograd:ConvBinWinogradRxSf2x3g1,0.08736,0,miopenConvolutionFwdAlgoWinograd,<unused>
256-14-14-1x1-1024-14-14-1-0x0-1x1-1x1-0-NCHW-FP32-F=miopenConvolutionFwdAlgoImplicitGEMM:ConvMlirIgemmFwd,0.14272,0,miopenConvolutionFwdAlgoImplicitGEMM,<unused>;miopenConvolutionFwdAlgoDirect:ConvAsm1x1U,0.04176,0,miopenConvolutionFwdAlgoDirect,<unused>;miopenConvolutionFwdAlgoWinograd:ConvBinWinogradRxSf3x2,0.10128,0,miopenConvolutionFwdAlgoWinograd,<unused>;miopenConvolutionFwdAlgoGEMM:GemmFwd1x1_0_1,0.05168,0,miopenConvolutionFwdAlgoGEMM,<unused>
1024-14-14-1x1-512-14-14-1-0x0-1x1-1x1-0-NCHW-FP32-F=miopenConvolutionFwdAlgoImplicitGEMM:ConvMlirIgemmFwd,0.505601,0,miopenConvolutionFwdAlgoImplicitGEMM,<unused>;miopenConvolutionFwdAlgoDirect:ConvAsm1x1U,0.0824,0,miopenConvolutionFwdAlgoDirect,<unused>;miopenConvolutionFwdAlgoWinograd:ConvBinWinogradRxSf3x2,0.232481,0,miopenConvolutionFwdAlgoWinograd,<unused>;miopenConvolutionFwdAlgoGEMM:GemmFwd1x1_0_1,0.08128,0,miopenConvolutionFwdAlgoGEMM,<unused>
512-14-14-3x3-512-7-7-1-1x1-2x2-1x1-0-NCHW-FP32-F=miopenConvolutionFwdAlgoImplicitGEMM:ConvMlirIgemmFwd,2.36144,0,miopenConvolutionFwdAlgoImplicitGEMM,<unused>;miopenConvolutionFwdAlgoDirect:ConvOclDirectFwd,1.088,0,miopenConvolutionFwdAlgoDirect,<unused>;miopenConvolutionFwdAlgoWinograd:ConvBinWinogradRxSf2x3,0.45024,0,miopenConvolutionFwdAlgoWinograd,<unused>;miopenConvolutionFwdAlgoGEMM:GemmFwdRest,0.41568,903168,miopenConvolutionFwdAlgoGEMM,<unused>
1536-7-7-1x1-2048-7-7-1-0x0-1x1-1x1-0-NCHW-FP32-F=miopenConvolutionFwdAlgoImplicitGEMM:ConvMlirIgemmFwd,0.77456,0,miopenConvolutionFwdAlgoImplicitGEMM,<unused>;miopenConvolutionFwdAlgoDirect:ConvAsm1x1U,0.17472,0,miopenConvolutionFwdAlgoDirect,<unused>;miopenConvolutionFwdAlgoWinograd:ConvBinWinogradRxSf2x3g1,0.631041,0,miopenConvolutionFwdAlgoWinograd,<unused>;miopenConvolutionFwdAlgoGEMM:GemmFwd1x1_0_1,0.15312,0,miopenConvolutionFwdAlgoGEMM,<unused>
2048-7-7-1x1-512-7-7-1-0x0-1x1-1x1-0-NCHW-FP32-F=miopenConvolutionFwdAlgoImplicitGEMM:ConvMlirIgemmFwd,1.00992,0,miopenConvolutionFwdAlgoImplicitGEMM,<unused>;miopenConvolutionFwdAlgoDirect:ConvAsm1x1U,0.0736,0,miopenConvolutionFwdAlgoDirect,<unused>;miopenConvolutionFwdAlgoWinograd:ConvBinWinogradRxSf2x3,0.42784,0,miopenConvolutionFwdAlgoWinograd,<unused>;miopenConvolutionFwdAlgoGEMM:GemmFwd1x1_0_1,0.19696,0,miopenConvolutionFwdAlgoGEMM,<unused>
512-7-7-3x3-512-7-7-1-1x1-1x1-1x1-0-NCHW-FP32-F=miopenConvolutionFwdAlgoWinograd:ConvBinWinogradRxSf2x3g1,0.136,0,miopenConvolutionFwdAlgoWinograd,<unused>
512-7-7-1x1-2048-7-7-1-0x0-1x1-1x1-0-NCHW-FP32-F=miopenConvolutionFwdAlgoImplicitGEMM:ConvMlirIgemmFwd,0.27488,0,miopenConvolutionFwdAlgoImplicitGEMM,<unused>;miopenConvolutionFwdAlgoDirect:ConvAsm1x1U,0.05904,0,miopenConvolutionFwdAlgoDirect,<unused>;miopenConvolutionFwdAlgoWinograd:ConvBinWinogradRxSf2x3g1,0.23232,0,miopenConvolutionFwdAlgoWinograd,<unused>;miopenConvolutionFwdAlgoGEMM:GemmFwd1x1_0_1,0.08576,0,miopenConvolutionFwdAlgoGEMM,<unused>
3-299-299-3x3-32-149-149-1-0x0-2x2-1x1-0-NCHW-FP32-F=miopenConvolutionFwdAlgoImplicitGEMM:ConvMlirIgemmFwd,0.06816,0,miopenConvolutionFwdAlgoImplicitGEMM,<unused>;miopenConvolutionFwdAlgoDirect:ConvOclDirectFwd,0.0472,0,miopenConvolutionFwdAlgoDirect,<unused>;miopenConvolutionFwdAlgoWinograd:ConvBinWinogradRxSf2x3g1,0.03952,0,miopenConvolutionFwdAlgoWinograd,<unused>;miopenConvolutionFwdAlgoGEMM:GemmFwdRest,0.07536,2397708,miopenConvolutionFwdAlgoGEMM,<unused>
32-149-149-3x3-32-147-147-1-0x0-1x1-1x1-0-NCHW-FP32-F=miopenConvolutionFwdAlgoImplicitGEMM:ConvMlirIgemmFwd,0.23952,0,miopenConvolutionFwdAlgoImplicitGEMM,<unused>;miopenConvolutionFwdAlgoDirect:ConvOclDirectFwd,0.14784,0,miopenConvolutionFwdAlgoDirect,<unused>;miopenConvolutionFwdAlgoWinograd:ConvBinWinogradRxSf2x3g1,0.04576,0,miopenConvolutionFwdAlgoWinograd,<unused>;miopenConvolutionFwdAlgoGEMM:GemmFwdRest,0.1624,24893568,miopenConvolutionFwdAlgoGEMM,<unused>
32-147-147-3x3-64-147-147-1-1x1-1x1-1x1-0-NCHW-FP32-F=miopenConvolutionFwdAlgoWinograd:ConvBinWinogradRxSf2x3g1,0.07552,0,miopenConvolutionFwdAlgoWinograd,<unused>
64-73-73-1x1-80-73-73-1-0x0-1x1-1x1-0-NCHW-FP32-F=miopenConvolutionFwdAlgoImplicitGEMM:ConvMlirIgemmFwd,0.05504,0,miopenConvolutionFwdAlgoImplicitGEMM,<unused>;miopenConvolutionFwdAlgoDirect:ConvAsm1x1U,0.02416,0,miopenConvolutionFwdAlgoDirect,<unused>;miopenConvolutionFwdAlgoWinograd:ConvBinWinogradRxS,0.07392,0,miopenConvolutionFwdAlgoWinograd,<unused>;miopenConvolutionFwdAlgoGEMM:GemmFwd1x1_0_1,0.04464,0,miopenConvolutionFwdAlgoGEMM,<unused>
80-73-73-3x3-192-71-71-1-0x0-1x1-1x1-0-NCHW-FP32-F=miopenConvolutionFwdAlgoImplicitGEMM:ConvMlirIgemmFwd,0.58736,0,miopenConvolutionFwdAlgoImplicitGEMM,<unused>;miopenConvolutionFwdAlgoDirect:ConvOclDirectFwd,0.769441,0,miopenConvolutionFwdAlgoDirect,<unused>;miopenConvolutionFwdAlgoWinograd:ConvBinWinogradRxS,0.12032,0,miopenConvolutionFwdAlgoWinograd,<unused>;miopenConvolutionFwdAlgoGEMM:GemmFwdRest,0.28528,14518080,miopenConvolutionFwdAlgoGEMM,<unused>
192-35-35-1x1-128-35-35-1-0x0-1x1-1x1-0-NCHW-FP32-F=miopenConvolutionFwdAlgoImplicitGEMM:ConvMlirIgemmFwd,0.109601,0,miopenConvolutionFwdAlgoImplicitGEMM,<unused>;miopenConvolutionFwdAlgoDirect:ConvAsm1x1U,0.02416,0,miopenConvolutionFwdAlgoDirect,<unused>;miopenConvolutionFwdAlgoWinograd:ConvBinWinogradRxSf2x3g1,0.0672,0,miopenConvolutionFwdAlgoWinograd,<unused>;miopenConvolutionFwdAlgoGEMM:GemmFwd1x1_0_1,0.04752,0,miopenConvolutionFwdAlgoGEMM,<unused>
192-35-35-1x1-48-35-35-1-0x0-1x1-1x1-0-NCHW-FP32-F=miopenConvolutionFwdAlgoImplicitGEMM:ConvMlirIgemmFwd,0.11312,0,miopenConvolutionFwdAlgoImplicitGEMM,<unused>;miopenConvolutionFwdAlgoDirect:ConvAsm1x1U,0.02016,0,miopenConvolutionFwdAlgoDirect,<unused>;miopenConvolutionFwdAlgoWinograd:ConvBinWinogradRxSf2x3g1,0.07424,0,miopenConvolutionFwdAlgoWinograd,<unused>;miopenConvolutionFwdAlgoGEMM:GemmFwd1x1_0_1,0.05488,0,miopenConvolutionFwdAlgoGEMM,<unused>
48-35-35-5x5-64-35-35-1-2x2-1x1-1x1-0-NCHW-FP32-F=miopenConvolutionFwdAlgoImplicitGEMM:ConvMlirIgemmFwd,0.637441,0,miopenConvolutionFwdAlgoImplicitGEMM,<unused>;miopenConvolutionFwdAlgoDirect:ConvOclDirectFwd,0.16432,0,miopenConvolutionFwdAlgoDirect,<unused>;miopenConvolutionFwdAlgoWinograd:ConvBinWinogradRxSf2x3g1,0.07536,0,miopenConvolutionFwdAlgoWinograd,<unused>;miopenConvolutionFwdAlgoGEMM:GemmFwdRest,0.10512,5880000,miopenConvolutionFwdAlgoGEMM,<unused>
64-35-35-3x3-96-35-35-1-1x1-1x1-1x1-0-NCHW-FP32-F=miopenConvolutionFwdAlgoWinograd:ConvBinWinogradRxSf2x3g1,0.0472,0,miopenConvolutionFwdAlgoWinograd,<unused>
96-35-35-3x3-96-35-35-1-1x1-1x1-1x1-0-NCHW-FP32-F=miopenConvolutionFwdAlgoWinograd:ConvBinWinograd3x3U,0.04752,0,miopenConvolutionFwdAlgoWinograd,<unused>
192-35-35-1x1-32-35-35-1-0x0-1x1-1x1-0-NCHW-FP32-F=miopenConvolutionFwdAlgoImplicitGEMM:ConvMlirIgemmFwd,0.10592,0,miopenConvolutionFwdAlgoImplicitGEMM,<unused>;miopenConvolutionFwdAlgoDirect:ConvAsm1x1U,0.02032,0,miopenConvolutionFwdAlgoDirect,<unused>;miopenConvolutionFwdAlgoWinograd:ConvBinWinogradRxSf2x3g1,0.072,0,miopenConvolutionFwdAlgoWinograd,<unused>;miopenConvolutionFwdAlgoGEMM:GemmFwd1x1_0_1,0.08016,0,miopenConvolutionFwdAlgoGEMM,<unused>
256-35-35-1x1-128-35-35-1-0x0-1x1-1x1-0-NCHW-FP32-F=miopenConvolutionFwdAlgoImplicitGEMM:ConvMlirIgemmFwd,0.14416,0,miopenConvolutionFwdAlgoImplicitGEMM,<unused>;miopenConvolutionFwdAlgoDirect:ConvAsm1x1U,0.02784,0,miopenConvolutionFwdAlgoDirect,<unused>;miopenConvolutionFwdAlgoWinograd:ConvBinWinogradRxSf2x3g1,0.080321,0,miopenConvolutionFwdAlgoWinograd,<unused>;miopenConvolutionFwdAlgoGEMM:GemmFwd1x1_0_1,0.07744,0,miopenConvolutionFwdAlgoGEMM,<unused>
256-35-35-1x1-48-35-35-1-0x0-1x1-1x1-0-NCHW-FP32-F=miopenConvolutionFwdAlgoImplicitGEMM:ConvMlirIgemmFwd,0.13648,0,miopenConvolutionFwdAlgoImplicitGEMM,<unused>;miopenConvolutionFwdAlgoDirect:ConvAsm1x1U,0.02224,0,miopenConvolutionFwdAlgoDirect,<unused>;miopenConvolutionFwdAlgoWinograd:ConvBinWinogradRxSf2x3g1,0.08688,0,miopenConvolutionFwdAlgoWinograd,<unused>;miopenConvolutionFwdAlgoGEMM:GemmFwd1x1_0_1,0.07808,0,miopenConvolutionFwdAlgoGEMM,<unused>
256-35-35-1x1-64-35-35-1-0x0-1x1-1x1-0-NCHW-FP32-F=miopenConvolutionFwdAlgoImplicitGEMM:ConvMlirIgemmFwd,0.14032,0,miopenConvolutionFwdAlgoImplicitGEMM,<unused>;miopenConvolutionFwdAlgoDirect:ConvAsm1x1U,0.02656,0,miopenConvolutionFwdAlgoDirect,<unused>;miopenConvolutionFwdAlgoWinograd:ConvBinWinogradRxSf2x3g1,0.08656,0,miopenConvolutionFwdAlgoWinograd,<unused>;miopenConvolutionFwdAlgoGEMM:GemmFwd1x1_0_1,0.07504,0,miopenConvolutionFwdAlgoGEMM,<unused>
288-35-35-1x1-128-35-35-1-0x0-1x1-1x1-0-NCHW-FP32-F=miopenConvolutionFwdAlgoImplicitGEMM:ConvMlirIgemmFwd,0.15312,0,miopenConvolutionFwdAlgoImplicitGEMM,<unused>;miopenConvolutionFwdAlgoDirect:ConvAsm1x1U,0.02896,0,miopenConvolutionFwdAlgoDirect,<unused>;miopenConvolutionFwdAlgoWinograd:ConvBinWinogradRxS,0.08832,0,miopenConvolutionFwdAlgoWinograd,<unused>;miopenConvolutionFwdAlgoGEMM:GemmFwd1x1_0_1,0.08304,0,miopenConvolutionFwdAlgoGEMM,<unused>
288-35-35-1x1-48-35-35-1-0x0-1x1-1x1-0-NCHW-FP32-F=miopenConvolutionFwdAlgoImplicitGEMM:ConvMlirIgemmFwd,0.15184,0,miopenConvolutionFwdAlgoImplicitGEMM,<unused>;miopenConvolutionFwdAlgoDirect:ConvAsm1x1U,0.01856,0,miopenConvolutionFwdAlgoDirect,<unused>;miopenConvolutionFwdAlgoWinograd:ConvBinWinogradRxSf2x3g1,0.08512,0,miopenConvolutionFwdAlgoWinograd,<unused>;miopenConvolutionFwdAlgoGEMM:GemmFwd1x1_0_1,0.07792,0,miopenConvolutionFwdAlgoGEMM,<unused>
288-35-35-1x1-64-35-35-1-0x0-1x1-1x1-0-NCHW-FP32-F=miopenConvolutionFwdAlgoImplicitGEMM:ConvMlirIgemmFwd,0.15184,0,miopenConvolutionFwdAlgoImplicitGEMM,<unused>;miopenConvolutionFwdAlgoDirect:ConvAsm1x1U,0.02768,0,miopenConvolutionFwdAlgoDirect,<unused>;miopenConvolutionFwdAlgoWinograd:ConvBinWinogradRxSf2x3,0.09456,0,miopenConvolutionFwdAlgoWinograd,<unused>;miopenConvolutionFwdAlgoGEMM:GemmFwd1x1_0_1,0.0856,0,miopenConvolutionFwdAlgoGEMM,<unused>
288-35-35-3x3-384-17-17-1-0x0-2x2-1x1-0-NCHW-FP32-F=miopenConvolutionFwdAlgoImplicitGEMM:ConvMlirIgemmFwd,1.30976,0,miopenConvolutionFwdAlgoImplicitGEMM,<unused>;miopenConvolutionFwdAlgoDirect:ConvOclDirectFwd,1.15088,0,miopenConvolutionFwdAlgoDirect,<unused>;miopenConvolutionFwdAlgoWinograd:ConvBinWinogradRxSf2x3g1,0.27232,0,miopenConvolutionFwdAlgoWinograd,<unused>;miopenConvolutionFwdAlgoGEMM:GemmFwdRest,0.1504,2996352,miopenConvolutionFwdAlgoGEMM,<unused>
96-35-35-3x3-96-17-17-1-0x0-2x2-1x1-0-NCHW-FP32-F=miopenConvolutionFwdAlgoImplicitGEMM:ConvMlirIgemmFwd,0.45152,0,miopenConvolutionFwdAlgoImplicitGEMM,<unused>;miopenConvolutionFwdAlgoDirect:ConvOclDirectFwd,0.3792,0,miopenConvolutionFwdAlgoDirect,<unused>;miopenConvolutionFwdAlgoWinograd:ConvBinWinogradRxSf2x3g1,0.11584,0,miopenConvolutionFwdAlgoWinograd,<unused>;miopenConvolutionFwdAlgoGEMM:GemmFwdRest,0.068,998784,miopenConvolutionFwdAlgoGEMM,<unused>
768-17-17-1x1-256-17-17-1-0x0-1x1-1x1-0-NCHW-FP32-F=miopenConvolutionFwdAlgoImplicitGEMM:ConvMlirIgemmFwd,0.38272,0,miopenConvolutionFwdAlgoImplicitGEMM,<unused>;miopenConvolutionFwdAlgoDirect:ConvAsm1x1U,0.04304,0,miopenConvolutionFwdAlgoDirect,<unused>;miopenConvolutionFwdAlgoWinograd:ConvBinWinogradRxSf2x3,0.1904,0,miopenConvolutionFwdAlgoWinograd,<unused>;miopenConvolutionFwdAlgoGEMM:GemmFwd1x1_0_1,0.15984,0,miopenConvolutionFwdAlgoGEMM,<unused>
768-17-17-1x1-192-17-17-1-0x0-1x1-1x1-0-NCHW-FP32-F=miopenConvolutionFwdAlgoImplicitGEMM:ConvMlirIgemmFwd,0.38192,0,miopenConvolutionFwdAlgoImplicitGEMM,<unused>;miopenConvolutionFwdAlgoDirect:ConvAsm1x1U,0.03904,0,miopenConvolutionFwdAlgoDirect,<unused>;miopenConvolutionFwdAlgoWinograd:ConvBinWinogradRxSf2x3,0.1896,0,miopenConvolutionFwdAlgoWinograd,<unused>;miopenConvolutionFwdAlgoGEMM:GemmFwd1x1_0_1,0.16416,0,miopenConvolutionFwdAlgoGEMM,<unused>
128-17-17-1x7-128-17-17-1-0x3-1x1-1x1-0-NCHW-FP32-F=miopenConvolutionFwdAlgoDirect:ConvDirectNaiveConvFwd,0.55216,0,miopenConvolutionFwdAlgoDirect,<unused>;miopenConvolutionFwdAlgoWinograd:ConvBinWinogradRxSf2x3,0.1304,0,miopenConvolutionFwdAlgoWinograd,<unused>;miopenConvolutionFwdAlgoGEMM:GemmFwdRest,0.05952,1035776,miopenConvolutionFwdAlgoGEMM,<unused>
128-17-17-7x1-192-17-17-1-3x0-1x1-1x1-0-NCHW-FP32-F=miopenConvolutionFwdAlgoDirect:ConvDirectNaiveConvFwd,0.90208,0,miopenConvolutionFwdAlgoDirect,<unused>;miopenConvolutionFwdAlgoWinograd:ConvBinWinogradRxSf2x3,0.10528,0,miopenConvolutionFwdAlgoWinograd,<unused>;miopenConvolutionFwdAlgoGEMM:GemmFwdRest,0.06224,1035776,miopenConvolutionFwdAlgoGEMM,<unused>
128-17-17-7x1-128-17-17-1-3x0-1x1-1x1-0-NCHW-FP32-F=miopenConvolutionFwdAlgoDirect:ConvDirectNaiveConvFwd,0.86592,0,miopenConvolutionFwdAlgoDirect,<unused>;miopenConvolutionFwdAlgoWinograd:ConvBinWinogradRxSf2x3,0.10544,0,miopenConvolutionFwdAlgoWinograd,<unused>;miopenConvolutionFwdAlgoGEMM:GemmFwdRest,0.06448,1035776,miopenConvolutionFwdAlgoGEMM,<unused>
128-17-17-1x7-192-17-17-1-0x3-1x1-1x1-0-NCHW-FP32-F=miopenConvolutionFwdAlgoDirect:ConvDirectNaiveConvFwd,0.60656,0,miopenConvolutionFwdAlgoDirect,<unused>;miopenConvolutionFwdAlgoWinograd:ConvBinWinogradRxSf3x2,0.1224,0,miopenConvolutionFwdAlgoWinograd,<unused>;miopenConvolutionFwdAlgoGEMM:GemmFwdRest,0.06224,1035776,miopenConvolutionFwdAlgoGEMM,<unused>
768-17-17-1x1-320-17-17-1-0x0-1x1-1x1-0-NCHW-FP32-F=miopenConvolutionFwdAlgoImplicitGEMM:ConvMlirIgemmFwd,0.38432,0,miopenConvolutionFwdAlgoImplicitGEMM,<unused>;miopenConvolutionFwdAlgoDirect:ConvAsm1x1U,0.04848,0,miopenConvolutionFwdAlgoDirect,<unused>;miopenConvolutionFwdAlgoWinograd:ConvBinWinogradRxSf3x2,0.18096,0,miopenConvolutionFwdAlgoWinograd,<unused>;miopenConvolutionFwdAlgoGEMM:GemmFwd1x1_0_1,0.175841,0,miopenConvolutionFwdAlgoGEMM,<unused>
160-17-17-1x7-160-17-17-1-0x3-1x1-1x1-0-NCHW-FP32-F=miopenConvolutionFwdAlgoDirect:ConvDirectNaiveConvFwd,0.68816,0,miopenConvolutionFwdAlgoDirect,<unused>;miopenConvolutionFwdAlgoWinograd:ConvBinWinogradRxSf3x2,0.14336,0,miopenConvolutionFwdAlgoWinograd,<unused>;miopenConvolutionFwdAlgoGEMM:GemmFwdRest,0.06992,1294720,miopenConvolutionFwdAlgoGEMM,<unused>
160-17-17-7x1-192-17-17-1-3x0-1x1-1x1-0-NCHW-FP32-F=miopenConvolutionFwdAlgoDirect:ConvDirectNaiveConvFwd,1.1264,0,miopenConvolutionFwdAlgoDirect,<unused>;miopenConvolutionFwdAlgoWinograd:ConvBinWinogradRxSf2x3,0.13264,0,miopenConvolutionFwdAlgoWinograd,<unused>;miopenConvolutionFwdAlgoGEMM:GemmFwdRest,0.07296,1294720,miopenConvolutionFwdAlgoGEMM,<unused>
160-17-17-7x1-160-17-17-1-3x0-1x1-1x1-0-NCHW-FP32-F=miopenConvolutionFwdAlgoDirect:ConvDirectNaiveConvFwd,1.09104,0,miopenConvolutionFwdAlgoDirect,<unused>;miopenConvolutionFwdAlgoWinograd:ConvBinWinogradRxSf2x3g1,0.13056,0,miopenConvolutionFwdAlgoWinograd,<unused>;miopenConvolutionFwdAlgoGEMM:GemmFwdRest,0.0696,1294720,miopenConvolutionFwdAlgoGEMM,<unused>
160-17-17-1x7-192-17-17-1-0x3-1x1-1x1-0-NCHW-FP32-F=miopenConvolutionFwdAlgoDirect:ConvDirectNaiveConvFwd,0.73808,0,miopenConvolutionFwdAlgoDirect,<unused>;miopenConvolutionFwdAlgoWinograd:ConvBinWinogradRxSf3x2,0.14304,0,miopenConvolutionFwdAlgoWinograd,<unused>;miopenConvolutionFwdAlgoGEMM:GemmFwdRest,0.07056,1294720,miopenConvolutionFwdAlgoGEMM,<unused>
768-17-17-1x1-576-17-17-1-0x0-1x1-1x1-0-NCHW-FP32-F=miopenConvolutionFwdAlgoImplicitGEMM:ConvMlirIgemmFwd,0.39104,0,miopenConvolutionFwdAlgoImplicitGEMM,<unused>;miopenConvolutionFwdAlgoDirect:ConvAsm1x1U,0.07728,0,miopenConvolutionFwdAlgoDirect,<unused>;miopenConvolutionFwdAlgoWinograd:ConvBinWinogradRxSf2x3g1,0.1712,0,miopenConvolutionFwdAlgoWinograd,<unused>;miopenConvolutionFwdAlgoGEMM:GemmFwd1x1_0_1,0.06704,0,miopenConvolutionFwdAlgoGEMM,<unused>
192-17-17-1x7-192-17-17-1-0x3-1x1-1x1-0-NCHW-FP32-F=miopenConvolutionFwdAlgoDirect:ConvDirectNaiveConvFwd,0.94032,0,miopenConvolutionFwdAlgoDirect,<unused>;miopenConvolutionFwdAlgoWinograd:ConvBinWinogradRxSf3x2,0.16672,0,miopenConvolutionFwdAlgoWinograd,<unused>;miopenConvolutionFwdAlgoGEMM:GemmFwdRest,0.0776,1553664,miopenConvolutionFwdAlgoGEMM,<unused>
192-17-17-7x1-192-17-17-1-3x0-1x1-1x1-0-NCHW-FP32-F=miopenConvolutionFwdAlgoDirect:ConvDirectNaiveConvFwd,1.34832,0,miopenConvolutionFwdAlgoDirect,<unused>;miopenConvolutionFwdAlgoWinograd:ConvBinWinogradRxSf2x3,0.14224,0,miopenConvolutionFwdAlgoWinograd,<unused>;miopenConvolutionFwdAlgoGEMM:GemmFwdRest,0.08432,1553664,miopenConvolutionFwdAlgoGEMM,<unused>
768-17-17-1x1-384-17-17-1-0x0-1x1-1x1-0-NCHW-FP32-F=miopenConvolutionFwdAlgoImplicitGEMM:ConvMlirIgemmFwd,0.38576,0,miopenConvolutionFwdAlgoImplicitGEMM,<unused>;miopenConvolutionFwdAlgoDirect:ConvAsm1x1U,0.0544,0,miopenConvolutionFwdAlgoDirect,<unused>;miopenConvolutionFwdAlgoWinograd:ConvBinWinogradRxSf2x3g1,0.18032,0,miopenConvolutionFwdAlgoWinograd,<unused>;miopenConvolutionFwdAlgoGEMM:GemmFwd1x1_0_1,0.1528,0,miopenConvolutionFwdAlgoGEMM,<unused>
192-17-17-3x3-320-8-8-1-0x0-2x2-1x1-0-NCHW-FP32-F=miopenConvolutionFwdAlgoImplicitGEMM:ConvHipImplicitGemmV4R4Fwd,0.24592,0,miopenConvolutionFwdAlgoImplicitGEMM,<unused>;miopenConvolutionFwdAlgoDirect:ConvOclDirectFwd,0.5376,0,miopenConvolutionFwdAlgoDirect,<unused>;miopenConvolutionFwdAlgoWinograd:ConvBinWinogradRxSf2x3g1,0.1904,0,miopenConvolutionFwdAlgoWinograd,<unused>;miopenConvolutionFwdAlgoGEMM:GemmFwdRest,0.08032,442368,miopenConvolutionFwdAlgoGEMM,<unused>
192-17-17-3x3-192-8-8-1-0x0-2x2-1x1-0-NCHW-FP32-F=miopenConvolutionFwdAlgoImplicitGEMM:ConvHipImplicitGemmV4R4Fwd,0.245441,0,miopenConvolutionFwdAlgoImplicitGEMM,<unused>;miopenConvolutionFwdAlgoDirect:ConvOclDirectFwd,0.53424,0,miopenConvolutionFwdAlgoDirect,<unused>;miopenConvolutionFwdAlgoWinograd:ConvBinWinogradRxSf2x3,0.1856,0,miopenConvolutionFwdAlgoWinograd,<unused>;miopenConvolutionFwdAlgoGEMM:GemmFwdRest,0.07248,442368,miopenConvolutionFwdAlgoGEMM,<unused>
1280-8-8-1x1-320-8-8-1-0x0-1x1-1x1-0-NCHW-FP32-F=miopenConvolutionFwdAlgoImplicitGEMM:ConvHipImplicitGemmV4R4Fwd,0.14224,0,miopenConvolutionFwdAlgoImplicitGEMM,<unused>;miopenConvolutionFwdAlgoDirect:ConvAsm1x1U,0.04272,0,miopenConvolutionFwdAlgoDirect,<unused>;miopenConvolutionFwdAlgoWinograd:ConvBinWinogradRxSf2x3g1,0.2928,0,miopenConvolutionFwdAlgoWinograd,<unused>;miopenConvolutionFwdAlgoGEMM:GemmFwd1x1_0_1,0.0576,0,miopenConvolutionFwdAlgoGEMM,<unused>
1280-8-8-1x1-384-8-8-1-0x0-1x1-1x1-0-NCHW-FP32-F=miopenConvolutionFwdAlgoImplicitGEMM:ConvHipImplicitGemmV4R4Fwd,0.14288,0,miopenConvolutionFwdAlgoImplicitGEMM,<unused>;miopenConvolutionFwdAlgoDirect:ConvAsm1x1U,0.04384,0,miopenConvolutionFwdAlgoDirect,<unused>;miopenConvolutionFwdAlgoWinograd:ConvBinWinogradRxSf3x2,0.29296,0,miopenConvolutionFwdAlgoWinograd,<unused>;miopenConvolutionFwdAlgoGEMM:GemmFwd1x1_0_1,0.06448,0,miopenConvolutionFwdAlgoGEMM,<unused>
384-8-8-1x3-384-8-8-1-0x1-1x1-1x1-0-NCHW-FP32-F=miopenConvolutionFwdAlgoImplicitGEMM:ConvHipImplicitGemmV4R4Fwd,0.157441,0,miopenConvolutionFwdAlgoImplicitGEMM,<unused>;miopenConvolutionFwdAlgoDirect:ConvDirectNaiveConvFwd,0.46992,0,miopenConvolutionFwdAlgoDirect,<unused>;miopenConvolutionFwdAlgoWinograd:ConvBinWinogradRxSf2x3g1,0.10512,0,miopenConvolutionFwdAlgoWinograd,<unused>;miopenConvolutionFwdAlgoGEMM:GemmFwdRest,0.06736,294912,miopenConvolutionFwdAlgoGEMM,<unused>
384-8-8-3x1-384-8-8-1-1x0-1x1-1x1-0-NCHW-FP32-F=miopenConvolutionFwdAlgoImplicitGEMM:ConvHipImplicitGemmV4R4Fwd,0.151201,0,miopenConvolutionFwdAlgoImplicitGEMM,<unused>;miopenConvolutionFwdAlgoDirect:ConvDirectNaiveConvFwd,0.5776,0,miopenConvolutionFwdAlgoDirect,<unused>;miopenConvolutionFwdAlgoWinograd:ConvBinWinogradRxSf2x3g1,0.11232,0,miopenConvolutionFwdAlgoWinograd,<unused>;miopenConvolutionFwdAlgoGEMM:GemmFwdRest,0.0672,294912,miopenConvolutionFwdAlgoGEMM,<unused>
1280-8-8-1x1-448-8-8-1-0x0-1x1-1x1-0-NCHW-FP32-F=miopenConvolutionFwdAlgoImplicitGEMM:ConvHipImplicitGemmV4R4Fwd,0.1432,0,miopenConvolutionFwdAlgoImplicitGEMM,<unused>;miopenConvolutionFwdAlgoDirect:ConvAsm1x1U,0.04368,0,miopenConvolutionFwdAlgoDirect,<unused>;miopenConvolutionFwdAlgoWinograd:ConvBinWinogradRxSf2x3g1,0.28912,0,miopenConvolutionFwdAlgoWinograd,<unused>;miopenConvolutionFwdAlgoGEMM:GemmFwd1x1_0_1,0.06608,0,miopenConvolutionFwdAlgoGEMM,<unused>
448-8-8-3x3-384-8-8-1-1x1-1x1-1x1-0-NCHW-FP32-F=miopenConvolutionFwdAlgoWinograd:ConvBinWinogradRxSf2x3g1,0.12304,0,miopenConvolutionFwdAlgoWinograd,<unused>
1280-8-8-1x1-192-8-8-1-0x0-1x1-1x1-0-NCHW-FP32-F=miopenConvolutionFwdAlgoImplicitGEMM:ConvHipImplicitGemmV4R4Fwd,0.14224,0,miopenConvolutionFwdAlgoImplicitGEMM,<unused>;miopenConvolutionFwdAlgoDirect:ConvAsm1x1U,0.04528,0,miopenConvolutionFwdAlgoDirect,<unused>;miopenConvolutionFwdAlgoWinograd:ConvBinWinogradRxSf2x3g1,0.28864,0,miopenConvolutionFwdAlgoWinograd,<unused>;miopenConvolutionFwdAlgoGEMM:GemmFwd1x1_0_1,0.05616,0,miopenConvolutionFwdAlgoGEMM,<unused>
2048-8-8-1x1-320-8-8-1-0x0-1x1-1x1-0-NCHW-FP32-F=miopenConvolutionFwdAlgoImplicitGEMM:ConvHipImplicitGemmV4R4Fwd,0.22224,0,miopenConvolutionFwdAlgoImplicitGEMM,<unused>;miopenConvolutionFwdAlgoDirect:ConvAsm1x1U,0.06704,0,miopenConvolutionFwdAlgoDirect,<unused>;miopenConvolutionFwdAlgoWinograd:ConvBinWinogradRxSf2x3g1,0.431841,0,miopenConvolutionFwdAlgoWinograd,<unused>;miopenConvolutionFwdAlgoGEMM:GemmFwd1x1_0_1,0.1592,0,miopenConvolutionFwdAlgoGEMM,<unused>
2048-8-8-1x1-384-8-8-1-0x0-1x1-1x1-0-NCHW-FP32-F=miopenConvolutionFwdAlgoImplicitGEMM:ConvHipImplicitGemmV4R4Fwd,0.2224,0,miopenConvolutionFwdAlgoImplicitGEMM,<unused>;miopenConvolutionFwdAlgoDirect:ConvAsm1x1U,0.06688,0,miopenConvolutionFwdAlgoDirect,<unused>;miopenConvolutionFwdAlgoWinograd:ConvBinWinogradRxSf2x3g1,0.448961,0,miopenConvolutionFwdAlgoWinograd,<unused>;miopenConvolutionFwdAlgoGEMM:GemmFwd1x1_0_1,0.16336,0,miopenConvolutionFwdAlgoGEMM,<unused>
2048-8-8-1x1-448-8-8-1-0x0-1x1-1x1-0-NCHW-FP32-F=miopenConvolutionFwdAlgoImplicitGEMM:ConvHipImplicitGemmV4R4Fwd,0.2232,0,miopenConvolutionFwdAlgoImplicitGEMM,<unused>;miopenConvolutionFwdAlgoDirect:ConvAsm1x1U,0.07056,0,miopenConvolutionFwdAlgoDirect,<unused>;miopenConvolutionFwdAlgoWinograd:ConvBinWinogradRxSf2x3g1,0.444801,0,miopenConvolutionFwdAlgoWinograd,<unused>;miopenConvolutionFwdAlgoGEMM:GemmFwd1x1_0_1,0.18624,0,miopenConvolutionFwdAlgoGEMM,<unused>
2048-8-8-1x1-192-8-8-1-0x0-1x1-1x1-0-NCHW-FP32-F=miopenConvolutionFwdAlgoImplicitGEMM:ConvHipImplicitGemmV4R4Fwd,0.22064,0,miopenConvolutionFwdAlgoImplicitGEMM,<unused>;miopenConvolutionFwdAlgoDirect:ConvAsm1x1U,0.06144,0,miopenConvolutionFwdAlgoDirect,<unused>;miopenConvolutionFwdAlgoWinograd:ConvBinWinogradRxSf3x2,0.424,0,miopenConvolutionFwdAlgoWinograd,<unused>;miopenConvolutionFwdAlgoGEMM:GemmFwd1x1_0_1,0.09568,0,miopenConvolutionFwdAlgoGEMM,<unused>
64-56-56-1x1-128-56-56-1-0x0-1x1-1x1-0-NCHW-FP32-F=miopenConvolutionFwdAlgoImplicitGEMM:ConvHipImplicitGemmV4R4Fwd,0.02336,0,miopenConvolutionFwdAlgoImplicitGEMM,<unused>;miopenConvolutionFwdAlgoDirect:ConvAsm1x1U,0.02016,0,miopenConvolutionFwdAlgoDirect,<unused>;miopenConvolutionFwdAlgoWinograd:ConvBinWinogradRxSf3x2,0.05584,0,miopenConvolutionFwdAlgoWinograd,<unused>;miopenConvolutionFwdAlgoGEMM:GemmFwd1x1_0_1,0.04688,0,miopenConvolutionFwdAlgoGEMM,<unused>
128-56-56-3x3-32-56-56-1-1x1-1x1-1x1-0-NCHW-FP32-F=miopenConvolutionFwdAlgoWinograd:ConvBinWinogradRxSf2x3g1,0.06144,0,miopenConvolutionFwdAlgoWinograd,<unused>
96-56-56-1x1-128-56-56-1-0x0-1x1-1x1-0-NCHW-FP32-F=miopenConvolutionFwdAlgoImplicitGEMM:ConvHipImplicitGemmV4R4Fwd,0.02688,0,miopenConvolutionFwdAlgoImplicitGEMM,<unused>;miopenConvolutionFwdAlgoDirect:ConvAsm1x1U,0.02768,0,miopenConvolutionFwdAlgoDirect,<unused>;miopenConvolutionFwdAlgoWinograd:ConvBinWinogradRxSf3x2,0.07264,0,miopenConvolutionFwdAlgoWinograd,<unused>;miopenConvolutionFwdAlgoGEMM:GemmFwd1x1_0_1,0.03776,0,miopenConvolutionFwdAlgoGEMM,<unused>
128-56-56-1x1-128-56-56-1-0x0-1x1-1x1-0-NCHW-FP32-F=miopenConvolutionFwdAlgoImplicitGEMM:ConvHipImplicitGemmV4R4Fwd,0.03344,0,miopenConvolutionFwdAlgoImplicitGEMM,<unused>;miopenConvolutionFwdAlgoDirect:ConvAsm1x1U,0.02768,0,miopenConvolutionFwdAlgoDirect,<unused>;miopenConvolutionFwdAlgoWinograd:ConvBinWinogradRxSf3x2,0.06768,0,miopenConvolutionFwdAlgoWinograd,<unused>;miopenConvolutionFwdAlgoGEMM:GemmFwd1x1_0_1,0.03616,0,miopenConvolutionFwdAlgoGEMM,<unused>
160-56-56-1x1-128-56-56-1-0x0-1x1-1x1-0-NCHW-FP32-F=miopenConvolutionFwdAlgoImplicitGEMM:ConvHipImplicitGemmV4R4Fwd,0.03808,0,miopenConvolutionFwdAlgoImplicitGEMM,<unused>;miopenConvolutionFwdAlgoDirect:ConvAsm1x1U,0.03824,0,miopenConvolutionFwdAlgoDirect,<unused>;miopenConvolutionFwdAlgoWinograd:ConvBinWinogradRxSf3x2,0.0848,0,miopenConvolutionFwdAlgoWinograd,<unused>;miopenConvolutionFwdAlgoGEMM:GemmFwd1x1_0_1,0.04864,0,miopenConvolutionFwdAlgoGEMM,<unused>
