tools/onnxruntime/miopen33/gfx906_60.HIP.2_3_0.ufdb.txt
3-299-299-7x7-64-150-150-1-3x3-2x2-1x1-0-NCHW-FP32-F=miopenConvolutionFwdAlgoDirect:ConvOclDirectFwd,0.10608,0,miopenConvolutionFwdAlgoDirect,<unused>;miopenConvolutionFwdAlgoWinograd:ConvBinWinogradRxS,0.09472,0,miopenConvolutionFwdAlgoWinograd,3x299x299x7x7x64x150x150x1xNCHWxFP32x3x3x2x2x1x1x1x1;miopenConvolutionFwdAlgoGEMM:gemm,0.1064,13230000,rocBlas,<unused>
64-75-75-1x1-64-75-75-1-0x0-1x1-1x1-0-NCHW-FP32-F=miopenConvolutionFwdAlgoDirect:ConvAsm1x1U,0.01536,0,miopenConvolutionFwdAlgoDirect,<unused>;miopenConvolutionFwdAlgoWinograd:ConvBinWinogradRxSf3x2,0.04368,0,miopenConvolutionFwdAlgoWinograd,64x75x75x1x1x64x75x75x1xNCHWxFP32x0x0x1x1x1x1x1x1;miopenConvolutionFwdAlgoGEMM:gemm,0.158239,0,rocBlas,<unused>
64-75-75-3x3-64-75-75-1-1x1-1x1-1x1-0-NCHW-FP32-F=miopenConvolutionFwdAlgoWinograd:ConvBinWinogradRxS,0.05008,0,miopenConvolutionFwdAlgoWinograd,64x75x75x3x3x64x75x75x1xNCHWxFP32x1x1x1x1x1x1x1x1
128-75-75-1x1-256-75-75-1-0x0-1x1-1x1-0-NCHW-FP32-F=miopenConvolutionFwdAlgoDirect:ConvAsm1x1U,0.0664,0,miopenConvolutionFwdAlgoDirect,<unused>;miopenConvolutionFwdAlgoWinograd:ConvBinWinogradRxSf3x2,0.12064,0,miopenConvolutionFwdAlgoWinograd,128x75x75x1x1x256x75x75x1xNCHWxFP32x0x0x1x1x1x1x1x1;miopenConvolutionFwdAlgoGEMM:gemm,0.08816,0,rocBlas,<unused>
256-75-75-1x1-64-75-75-1-0x0-1x1-1x1-0-NCHW-FP32-F=miopenConvolutionFwdAlgoDirect:ConvAsm1x1U,0.0368,0,miopenConvolutionFwdAlgoDirect,<unused>;miopenConvolutionFwdAlgoWinograd:ConvBinWinogradRxSf3x2,0.0824,0,miopenConvolutionFwdAlgoWinograd,256x75x75x1x1x64x75x75x1xNCHWxFP32x0x0x1x1x1x1x1x1;miopenConvolutionFwdAlgoGEMM:gemm,0.05008,0,rocBlas,<unused>
64-75-75-1x1-256-75-75-1-0x0-1x1-1x1-0-NCHW-FP32-F=miopenConvolutionFwdAlgoDirect:ConvAsm1x1U,0.03728,0,miopenConvolutionFwdAlgoDirect,<unused>;miopenConvolutionFwdAlgoWinograd:ConvBinWinogradRxSf3x2,0.08224,0,miopenConvolutionFwdAlgoWinograd,64x75x75x1x1x256x75x75x1xNCHWxFP32x0x0x1x1x1x1x1x1;miopenConvolutionFwdAlgoGEMM:gemm,0.05984,0,rocBlas,<unused>
64-75-75-3x3-64-38-38-1-1x1-2x2-1x1-0-NCHW-FP32-F=miopenConvolutionFwdAlgoDirect:ConvOclDirectFwd,0.206079,0,miopenConvolutionFwdAlgoDirect,<unused>;miopenConvolutionFwdAlgoWinograd:ConvBinWinogradRxS,0.0784,0,miopenConvolutionFwdAlgoWinograd,64x75x75x3x3x64x38x38x1xNCHWxFP32x1x1x2x2x1x1x1x1;miopenConvolutionFwdAlgoGEMM:gemm,0.05792,3326976,rocBlas,<unused>
64-38-38-1x1-256-38-38-1-0x0-1x1-1x1-0-NCHW-FP32-F=miopenConvolutionFwdAlgoDirect:ConvAsm1x1U,0.0176,0,miopenConvolutionFwdAlgoDirect,<unused>;miopenConvolutionFwdAlgoWinograd:ConvBinWinogradRxSf3x2,0.04464,0,miopenConvolutionFwdAlgoWinograd,64x38x38x1x1x256x38x38x1xNCHWxFP32x0x0x1x1x1x1x1x1;miopenConvolutionFwdAlgoGEMM:gemm,0.0312,0,rocBlas,<unused>
256-38-38-1x1-128-38-38-1-0x0-1x1-1x1-0-NCHW-FP32-F=miopenConvolutionFwdAlgoDirect:ConvAsm1x1U,0.024,0,miopenConvolutionFwdAlgoDirect,<unused>;miopenConvolutionFwdAlgoWinograd:ConvBinWinogradRxS,0.07456,0,miopenConvolutionFwdAlgoWinograd,256x38x38x1x1x128x38x38x1xNCHWxFP32x0x0x1x1x1x1x1x1;miopenConvolutionFwdAlgoGEMM:gemm,0.04192,0,rocBlas,<unused>
128-38-38-3x3-128-38-38-1-1x1-1x1-1x1-0-NCHW-FP32-F=miopenConvolutionFwdAlgoWinograd:ConvBinWinograd3x3U,0.04624,0,miopenConvolutionFwdAlgoWinograd,128x38x38x3x3x128x38x38x1xNCHWxFP32x1x1x1x1x1x1x1x1
384-38-38-1x1-512-38-38-1-0x0-1x1-1x1-0-NCHW-FP32-F=miopenConvolutionFwdAlgoDirect:ConvAsm1x1U,0.09392,0,miopenConvolutionFwdAlgoDirect,<unused>;miopenConvolutionFwdAlgoWinograd:ConvBinWinogradRxSf3x2,0.192159,0,miopenConvolutionFwdAlgoWinograd,384x38x38x1x1x512x38x38x1xNCHWxFP32x0x0x1x1x1x1x1x1;miopenConvolutionFwdAlgoGEMM:gemm,0.10016,0,rocBlas,<unused>
512-38-38-1x1-128-38-38-1-0x0-1x1-1x1-0-NCHW-FP32-F=miopenConvolutionFwdAlgoDirect:ConvOclDirectFwd1x1,0.04944,0,miopenConvolutionFwdAlgoDirect,<unused>;miopenConvolutionFwdAlgoWinograd:ConvBinWinogradRxSf2x3,0.12592,0,miopenConvolutionFwdAlgoWinograd,512x38x38x1x1x128x38x38x1xNCHWxFP32x0x0x1x1x1x1x1x1;miopenConvolutionFwdAlgoGEMM:gemm,0.05984,0,rocBlas,<unused>
128-38-38-1x1-512-38-38-1-0x0-1x1-1x1-0-NCHW-FP32-F=miopenConvolutionFwdAlgoDirect:ConvAsm1x1U,0.03856,0,miopenConvolutionFwdAlgoDirect,<unused>;miopenConvolutionFwdAlgoWinograd:ConvBinWinogradRxSf3x2,0.08816,0,miopenConvolutionFwdAlgoWinograd,128x38x38x1x1x512x38x38x1xNCHWxFP32x0x0x1x1x1x1x1x1;miopenConvolutionFwdAlgoGEMM:gemm,0.06656,0,rocBlas,<unused>
128-38-38-3x3-128-19-19-1-1x1-2x2-1x1-0-NCHW-FP32-F=miopenConvolutionFwdAlgoDirect:ConvOclDirectFwd,0.401598,0,miopenConvolutionFwdAlgoDirect,<unused>;miopenConvolutionFwdAlgoWinograd:ConvBinWinogradRxSf2x3,0.1312,0,miopenConvolutionFwdAlgoWinograd,128x38x38x3x3x128x19x19x1xNCHWxFP32x1x1x2x2x1x1x1x1;miopenConvolutionFwdAlgoGEMM:gemm,0.06096,1663488,rocBlas,<unused>
128-19-19-1x1-512-19-19-1-0x0-1x1-1x1-0-NCHW-FP32-F=miopenConvolutionFwdAlgoDirect:ConvAsm1x1U,0.01728,0,miopenConvolutionFwdAlgoDirect,<unused>;miopenConvolutionFwdAlgoWinograd:ConvBinWinogradRxSf3x2,0.05488,0,miopenConvolutionFwdAlgoWinograd,128x19x19x1x1x512x19x19x1xNCHWxFP32x0x0x1x1x1x1x1x1;miopenConvolutionFwdAlgoGEMM:gemm,0.04,0,rocBlas,<unused>
512-19-19-1x1-256-19-19-1-0x0-1x1-1x1-0-NCHW-FP32-F=miopenConvolutionFwdAlgoDirect:ConvAsm1x1U,0.03712,0,miopenConvolutionFwdAlgoDirect,<unused>;miopenConvolutionFwdAlgoWinograd:ConvBinWinogradRxSf2x3,0.12624,0,miopenConvolutionFwdAlgoWinograd,512x19x19x1x1x256x19x19x1xNCHWxFP32x0x0x1x1x1x1x1x1;miopenConvolutionFwdAlgoGEMM:gemm,0.0432,0,rocBlas,<unused>
256-19-19-3x3-256-19-19-1-1x1-1x1-1x1-0-NCHW-FP32-F=miopenConvolutionFwdAlgoWinograd:ConvBinWinograd3x3U,0.07312,0,miopenConvolutionFwdAlgoWinograd,256x19x19x3x3x256x19x19x1xNCHWxFP32x1x1x1x1x1x1x1x1
768-19-19-1x1-1024-19-19-1-0x0-1x1-1x1-0-NCHW-FP32-F=miopenConvolutionFwdAlgoDirect:ConvAsm1x1U,0.13648,0,miopenConvolutionFwdAlgoDirect,<unused>;miopenConvolutionFwdAlgoWinograd:ConvBinWinogradRxSf3x2,0.348158,0,miopenConvolutionFwdAlgoWinograd,768x19x19x1x1x1024x19x19x1xNCHWxFP32x0x0x1x1x1x1x1x1;miopenConvolutionFwdAlgoGEMM:gemm,0.0984,0,rocBlas,<unused>
1024-19-19-1x1-256-19-19-1-0x0-1x1-1x1-0-NCHW-FP32-F=miopenConvolutionFwdAlgoDirect:ConvOclDirectFwd1x1,0.05984,0,miopenConvolutionFwdAlgoDirect,<unused>;miopenConvolutionFwdAlgoWinograd:ConvBinWinogradRxSf2x3,0.227839,0,miopenConvolutionFwdAlgoWinograd,1024x19x19x1x1x256x19x19x1xNCHWxFP32x0x0x1x1x1x1x1x1;miopenConvolutionFwdAlgoGEMM:gemm,0.08624,0,rocBlas,<unused>
256-19-19-1x1-1024-19-19-1-0x0-1x1-1x1-0-NCHW-FP32-F=miopenConvolutionFwdAlgoDirect:ConvAsm1x1U,0.0464,0,miopenConvolutionFwdAlgoDirect,<unused>;miopenConvolutionFwdAlgoWinograd:ConvBinWinogradRxSf3x2,0.13776,0,miopenConvolutionFwdAlgoWinograd,256x19x19x1x1x1024x19x19x1xNCHWxFP32x0x0x1x1x1x1x1x1;miopenConvolutionFwdAlgoGEMM:gemm,0.04832,0,rocBlas,<unused>
256-19-19-3x3-256-10-10-1-1x1-2x2-1x1-0-NCHW-FP32-F=miopenConvolutionFwdAlgoDirect:ConvOclDirectFwd,0.389918,0,miopenConvolutionFwdAlgoDirect,<unused>;miopenConvolutionFwdAlgoWinograd:ConvBinWinogradRxSf2x3,0.237119,0,miopenConvolutionFwdAlgoWinograd,256x19x19x3x3x256x10x10x1xNCHWxFP32x1x1x2x2x1x1x1x1;miopenConvolutionFwdAlgoGEMM:gemm,0.08192,921600,rocBlas,<unused>
256-10-10-1x1-1024-10-10-1-0x0-1x1-1x1-0-NCHW-FP32-F=miopenConvolutionFwdAlgoDirect:ConvAsm1x1U,0.02272,0,miopenConvolutionFwdAlgoDirect,<unused>;miopenConvolutionFwdAlgoWinograd:ConvBinWinogradRxSf2x3,0.07584,0,miopenConvolutionFwdAlgoWinograd,256x10x10x1x1x1024x10x10x1xNCHWxFP32x0x0x1x1x1x1x1x1;miopenConvolutionFwdAlgoGEMM:gemm,0.05312,0,rocBlas,<unused>
1024-10-10-1x1-512-10-10-1-0x0-1x1-1x1-0-NCHW-FP32-F=miopenConvolutionFwdAlgoDirect:ConvAsm1x1U,0.04368,0,miopenConvolutionFwdAlgoDirect,<unused>;miopenConvolutionFwdAlgoWinograd:ConvBinWinogradRxSf2x3,0.228639,0,miopenConvolutionFwdAlgoWinograd,1024x10x10x1x1x512x10x10x1xNCHWxFP32x0x0x1x1x1x1x1x1;miopenConvolutionFwdAlgoGEMM:gemm,0.05232,0,rocBlas,<unused>
512-10-10-3x3-512-10-10-1-1x1-1x1-1x1-0-NCHW-FP32-F=miopenConvolutionFwdAlgoWinograd:ConvBinWinogradRxSf2x3,0.132,0,miopenConvolutionFwdAlgoWinograd,512x10x10x3x3x512x10x10x1xNCHWxFP32x1x1x1x1x1x1x1x1
1536-10-10-1x1-2048-10-10-1-0x0-1x1-1x1-0-NCHW-FP32-F=miopenConvolutionFwdAlgoDirect:ConvAsm1x1U,0.179519,0,miopenConvolutionFwdAlgoDirect,<unused>;miopenConvolutionFwdAlgoWinograd:ConvBinWinogradRxSf2x3,0.629596,0,miopenConvolutionFwdAlgoWinograd,1536x10x10x1x1x2048x10x10x1xNCHWxFP32x0x0x1x1x1x1x1x1;miopenConvolutionFwdAlgoGEMM:gemm,0.173919,0,rocBlas,<unused>
2048-10-10-1x1-512-10-10-1-0x0-1x1-1x1-0-NCHW-FP32-F=miopenConvolutionFwdAlgoDirect:ConvAsm1x1U,0.08064,0,miopenConvolutionFwdAlgoDirect,<unused>;miopenConvolutionFwdAlgoWinograd:ConvBinWinogradRxSf2x3,0.432638,0,miopenConvolutionFwdAlgoWinograd,2048x10x10x1x1x512x10x10x1xNCHWxFP32x0x0x1x1x1x1x1x1;miopenConvolutionFwdAlgoGEMM:gemm,0.09456,0,rocBlas,<unused>
512-10-10-1x1-2048-10-10-1-0x0-1x1-1x1-0-NCHW-FP32-F=miopenConvolutionFwdAlgoDirect:ConvAsm1x1U,0.06656,0,miopenConvolutionFwdAlgoDirect,<unused>;miopenConvolutionFwdAlgoWinograd:ConvBinWinogradRxSf2x3,0.228639,0,miopenConvolutionFwdAlgoWinograd,512x10x10x1x1x2048x10x10x1xNCHWxFP32x0x0x1x1x1x1x1x1;miopenConvolutionFwdAlgoGEMM:gemm,0.06992,0,rocBlas,<unused>
2048-1-1-1x1-1001-1-1-1-0x0-1x1-1x1-0-NCHW-FP32-F=miopenConvolutionFwdAlgoDirect:ConvOclDirectFwd1x1,0.1048,0,miopenConvolutionFwdAlgoDirect,<unused>;miopenConvolutionFwdAlgoWinograd:ConvBinWinogradRxSf2x3,0.37936,0,miopenConvolutionFwdAlgoWinograd,2048x1x1x1x1x1001x1x1x1xNCHWxFP32x0x0x1x1x1x1x1x1;miopenConvolutionFwdAlgoGEMM:gemm,0.08768,0,rocBlas,<unused>
3-299-299-3x3-32-149-149-1-0x0-2x2-1x1-0-NCHW-FP32-F=miopenConvolutionFwdAlgoDirect:ConvOclDirectFwd,0.03344,0,miopenConvolutionFwdAlgoDirect,<unused>;miopenConvolutionFwdAlgoWinograd:ConvBinWinogradRxSf2x3,0.0416,0,miopenConvolutionFwdAlgoWinograd,3x299x299x3x3x32x149x149x1xNCHWxFP32x0x0x2x2x1x1x1x1;miopenConvolutionFwdAlgoGEMM:gemm,0.05744,2397708,rocBlas,<unused>
32-149-149-3x3-32-147-147-1-0x0-1x1-1x1-0-NCHW-FP32-F=miopenConvolutionFwdAlgoDirect:ConvOclDirectFwd,0.14336,0,miopenConvolutionFwdAlgoDirect,<unused>;miopenConvolutionFwdAlgoWinograd:ConvBinWinogradRxS,0.04784,0,miopenConvolutionFwdAlgoWinograd,32x149x149x3x3x32x147x147x1xNCHWxFP32x0x0x1x1x1x1x1x1;miopenConvolutionFwdAlgoGEMM:gemm,0.156,24893568,rocBlas,<unused>
32-147-147-3x3-64-147-147-1-1x1-1x1-1x1-0-NCHW-FP32-F=miopenConvolutionFwdAlgoWinograd:ConvBinWinograd3x3U,0.07136,0,miopenConvolutionFwdAlgoWinograd,32x147x147x3x3x64x147x147x1xNCHWxFP32x1x1x1x1x1x1x1x1
64-147-147-3x3-96-73-73-1-0x0-2x2-1x1-0-NCHW-FP32-F=miopenConvolutionFwdAlgoDirect:ConvOclDirectFwd,0.40128,0,miopenConvolutionFwdAlgoDirect,<unused>;miopenConvolutionFwdAlgoWinograd:ConvBinWinogradRxSf2x3,0.192,0,miopenConvolutionFwdAlgoWinograd,64x147x147x3x3x96x73x73x1xNCHWxFP32x0x0x2x2x1x1x1x1;miopenConvolutionFwdAlgoGEMM:gemm,0.15216,12278016,rocBlas,<unused>
160-73-73-1x1-128-73-73-1-0x0-1x1-1x1-0-NCHW-FP32-F=miopenConvolutionFwdAlgoDirect:ConvAsm1x1U,0.03888,0,miopenConvolutionFwdAlgoDirect,<unused>;miopenConvolutionFwdAlgoWinograd:ConvBinWinogradRxSf3x2,0.10032,0,miopenConvolutionFwdAlgoWinograd,160x73x73x1x1x128x73x73x1xNCHWxFP32x0x0x1x1x1x1x1x1;miopenConvolutionFwdAlgoGEMM:gemm,0.05456,0,rocBlas,<unused>
64-73-73-1x7-64-73-73-1-0x3-1x1-1x1-0-NCHW-FP32-F=miopenConvolutionFwdAlgoWinograd:ConvBinWinogradRxSf3x2,0.0832,0,miopenConvolutionFwdAlgoWinograd,64x73x73x1x7x64x73x73x1xNCHWxFP32x0x3x1x1x1x1x1x1;miopenConvolutionFwdAlgoGEMM:gemm,0.09488,9549568,rocBlas,<unused>
64-73-73-7x1-64-73-73-1-3x0-1x1-1x1-0-NCHW-FP32-F=miopenConvolutionFwdAlgoWinograd:ConvBinWinogradRxSf3x2,0.0832,0,miopenConvolutionFwdAlgoWinograd,64x73x73x7x1x64x73x73x1xNCHWxFP32x3x0x1x1x1x1x1x1;miopenConvolutionFwdAlgoGEMM:gemm,0.1024,9549568,rocBlas,<unused>
64-73-73-3x3-96-71-71-1-0x0-1x1-1x1-0-NCHW-FP32-F=miopenConvolutionFwdAlgoDirect:ConvOclDirectFwd,0.23104,0,miopenConvolutionFwdAlgoDirect,<unused>;miopenConvolutionFwdAlgoWinograd:ConvBinWinogradRxS,0.06512,0,miopenConvolutionFwdAlgoWinograd,64x73x73x3x3x96x71x71x1xNCHWxFP32x0x0x1x1x1x1x1x1;miopenConvolutionFwdAlgoGEMM:gemm,0.13088,11614464,rocBlas,<unused>
192-71-71-3x3-192-35-35-1-0x0-2x2-1x1-0-NCHW-FP32-F=miopenConvolutionFwdAlgoDirect:ConvOclDirectFwd,0.85696,0,miopenConvolutionFwdAlgoDirect,<unused>;miopenConvolutionFwdAlgoWinograd:ConvBinWinogradRxSf2x3,0.3464,0,miopenConvolutionFwdAlgoWinograd,192x71x71x3x3x192x35x35x1xNCHWxFP32x0x0x2x2x1x1x1x1;miopenConvolutionFwdAlgoGEMM:gemm,0.1544,8467200,rocBlas,<unused>
384-35-35-1x1-128-35-35-1-0x0-1x1-1x1-0-NCHW-FP32-F=miopenConvolutionFwdAlgoDirect:ConvAsm1x1U,0.032,0,miopenConvolutionFwdAlgoDirect,<unused>;miopenConvolutionFwdAlgoWinograd:ConvBinWinogradRxS,0.10048,0,miopenConvolutionFwdAlgoWinograd,384x35x35x1x1x128x35x35x1xNCHWxFP32x0x0x1x1x1x1x1x1;miopenConvolutionFwdAlgoGEMM:gemm,0.07152,0,rocBlas,<unused>
384-35-35-1x1-96-35-35-1-0x0-1x1-1x1-0-NCHW-FP32-F=miopenConvolutionFwdAlgoDirect:ConvAsm1x1U,0.02528,0,miopenConvolutionFwdAlgoDirect,<unused>;miopenConvolutionFwdAlgoWinograd:ConvBinWinogradRxSf2x3,0.09984,0,miopenConvolutionFwdAlgoWinograd,384x35x35x1x1x96x35x35x1xNCHWxFP32x0x0x1x1x1x1x1x1;miopenConvolutionFwdAlgoGEMM:gemm,0.07504,0,rocBlas,<unused>
64-35-35-3x3-96-35-35-1-1x1-1x1-1x1-0-NCHW-FP32-F=miopenConvolutionFwdAlgoWinograd:ConvBinWinograd3x3U,0.03504,0,miopenConvolutionFwdAlgoWinograd,64x35x35x3x3x96x35x35x1xNCHWxFP32x1x1x1x1x1x1x1x1
96-35-35-3x3-96-35-35-1-1x1-1x1-1x1-0-NCHW-FP32-F=miopenConvolutionFwdAlgoWinograd:ConvBinWinograd3x3U,0.04048,0,miopenConvolutionFwdAlgoWinograd,96x35x35x3x3x96x35x35x1xNCHWxFP32x1x1x1x1x1x1x1x1
384-35-35-1x1-192-35-35-1-0x0-1x1-1x1-0-NCHW-FP32-F=miopenConvolutionFwdAlgoDirect:ConvAsm1x1U,0.03376,0,miopenConvolutionFwdAlgoDirect,<unused>;miopenConvolutionFwdAlgoWinograd:ConvBinWinogradRxSf3x2,0.10896,0,miopenConvolutionFwdAlgoWinograd,384x35x35x1x1x192x35x35x1xNCHWxFP32x0x0x1x1x1x1x1x1;miopenConvolutionFwdAlgoGEMM:gemm,0.0728,0,rocBlas,<unused>
192-35-35-3x3-224-35-35-1-1x1-1x1-1x1-0-NCHW-FP32-F=miopenConvolutionFwdAlgoWinograd:ConvBinWinograd3x3U,0.09968,0,miopenConvolutionFwdAlgoWinograd,192x35x35x3x3x224x35x35x1xNCHWxFP32x1x1x1x1x1x1x1x1
224-35-35-3x3-256-17-17-1-0x0-2x2-1x1-0-NCHW-FP32-F=miopenConvolutionFwdAlgoDirect:ConvOclDirectFwd,0.79536,0,miopenConvolutionFwdAlgoDirect,<unused>;miopenConvolutionFwdAlgoWinograd:ConvBinWinogradRxSf2x3,0.21056,0,miopenConvolutionFwdAlgoWinograd,224x35x35x3x3x256x17x17x1xNCHWxFP32x0x0x2x2x1x1x1x1;miopenConvolutionFwdAlgoGEMM:gemm,0.09552,2330496,rocBlas,<unused>
384-35-35-3x3-384-17-17-1-0x0-2x2-1x1-0-NCHW-FP32-F=miopenConvolutionFwdAlgoDirect:ConvOclDirectFwd,1.48416,0,miopenConvolutionFwdAlgoDirect,<unused>;miopenConvolutionFwdAlgoWinograd:ConvBinWinogradRxSf2x3,0.3432,0,miopenConvolutionFwdAlgoWinograd,384x35x35x3x3x384x17x17x1xNCHWxFP32x0x0x2x2x1x1x1x1;miopenConvolutionFwdAlgoGEMM:gemm,0.1536,3995136,rocBlas,<unused>
1024-17-17-1x1-768-17-17-1-0x0-1x1-1x1-0-NCHW-FP32-F=miopenConvolutionFwdAlgoDirect:ConvAsm1x1U,0.10016,0,miopenConvolutionFwdAlgoDirect,<unused>;miopenConvolutionFwdAlgoWinograd:ConvBinWinogradRxSf3x2,0.2432,0,miopenConvolutionFwdAlgoWinograd,1024x17x17x1x1x768x17x17x1xNCHWxFP32x0x0x1x1x1x1x1x1;miopenConvolutionFwdAlgoGEMM:gemm,0.08784,0,rocBlas,<unused>
1024-17-17-1x1-128-17-17-1-0x0-1x1-1x1-0-NCHW-FP32-F=miopenConvolutionFwdAlgoDirect:ConvOclDirectFwd1x1,0.036,0,miopenConvolutionFwdAlgoDirect,<unused>;miopenConvolutionFwdAlgoWinograd:ConvBinWinogradRxSf2x3,0.2296,0,miopenConvolutionFwdAlgoWinograd,1024x17x17x1x1x128x17x17x1xNCHWxFP32x0x0x1x1x1x1x1x1;miopenConvolutionFwdAlgoGEMM:gemm,0.0456,0,rocBlas,<unused>
192-17-17-7x1-192-17-17-1-3x0-1x1-1x1-0-NCHW-FP32-F=miopenConvolutionFwdAlgoWinograd:ConvBinWinogradRxSf2x3,0.13824,0,miopenConvolutionFwdAlgoWinograd,192x17x17x7x1x192x17x17x1xNCHWxFP32x3x0x1x1x1x1x1x1;miopenConvolutionFwdAlgoGEMM:gemm,0.0648,1553664,rocBlas,<unused>
192-17-17-1x7-224-17-17-1-0x3-1x1-1x1-0-NCHW-FP32-F=miopenConvolutionFwdAlgoWinograd:ConvBinWinogradRxS,0.17408,0,miopenConvolutionFwdAlgoWinograd,192x17x17x1x7x224x17x17x1xNCHWxFP32x0x3x1x1x1x1x1x1;miopenConvolutionFwdAlgoGEMM:gemm,0.06976,1553664,rocBlas,<unused>
224-17-17-7x1-224-17-17-1-3x0-1x1-1x1-0-NCHW-FP32-F=miopenConvolutionFwdAlgoWinograd:ConvBinWinogradRxSf2x3,0.15792,0,miopenConvolutionFwdAlgoWinograd,224x17x17x7x1x224x17x17x1xNCHWxFP32x3x0x1x1x1x1x1x1;miopenConvolutionFwdAlgoGEMM:gemm,0.076,1812608,rocBlas,<unused>
224-17-17-1x7-256-17-17-1-0x3-1x1-1x1-0-NCHW-FP32-F=miopenConvolutionFwdAlgoWinograd:ConvBinWinogradRxS,0.19968,0,miopenConvolutionFwdAlgoWinograd,224x17x17x1x7x256x17x17x1xNCHWxFP32x0x3x1x1x1x1x1x1;miopenConvolutionFwdAlgoGEMM:gemm,0.07584,1812608,rocBlas,<unused>
224-17-17-7x1-256-17-17-1-3x0-1x1-1x1-0-NCHW-FP32-F=miopenConvolutionFwdAlgoWinograd:ConvBinWinogradRxSf2x3,0.15824,0,miopenConvolutionFwdAlgoWinograd,224x17x17x7x1x256x17x17x1xNCHWxFP32x3x0x1x1x1x1x1x1;miopenConvolutionFwdAlgoGEMM:gemm,0.07792,1812608,rocBlas,<unused>
1024-17-17-1x1-256-17-17-1-0x0-1x1-1x1-0-NCHW-FP32-F=miopenConvolutionFwdAlgoDirect:ConvOclDirectFwd1x1,0.0512,0,miopenConvolutionFwdAlgoDirect,<unused>;miopenConvolutionFwdAlgoWinograd:ConvBinWinogradRxSf2x3,0.22992,0,miopenConvolutionFwdAlgoWinograd,1024x17x17x1x1x256x17x17x1xNCHWxFP32x0x0x1x1x1x1x1x1;miopenConvolutionFwdAlgoGEMM:gemm,0.08928,0,rocBlas,<unused>
256-17-17-1x7-256-17-17-1-0x3-1x1-1x1-0-NCHW-FP32-F=miopenConvolutionFwdAlgoWinograd:ConvBinWinogradRxS,0.22448,0,miopenConvolutionFwdAlgoWinograd,256x17x17x1x7x256x17x17x1xNCHWxFP32x0x3x1x1x1x1x1x1;miopenConvolutionFwdAlgoGEMM:gemm,0.08416,2071552,rocBlas,<unused>
256-17-17-7x1-320-17-17-1-3x0-1x1-1x1-0-NCHW-FP32-F=miopenConvolutionFwdAlgoWinograd:ConvBinWinogradRxSf2x3,0.17632,0,miopenConvolutionFwdAlgoWinograd,256x17x17x7x1x320x17x17x1xNCHWxFP32x3x0x1x1x1x1x1x1;miopenConvolutionFwdAlgoGEMM:gemm,0.08864,2071552,rocBlas,<unused>
320-17-17-3x3-320-8-8-1-0x0-2x2-1x1-0-NCHW-FP32-F=miopenConvolutionFwdAlgoDirect:ConvOclDirectFwd,0.90224,0,miopenConvolutionFwdAlgoDirect,<unused>;miopenConvolutionFwdAlgoImplicitGEMM:ConvHipImplicitGemmV4R4Fwd,0.34752,0,miopenConvolutionFwdAlgoImplicitGEMM,320x17x17x3x3x320x8x8x1xNCHWxFP32x0x0x2x2x1x1x1x1;miopenConvolutionFwdAlgoWinograd:ConvBinWinogradRxSf2x3,0.28864,0,miopenConvolutionFwdAlgoWinograd,320x17x17x3x3x320x8x8x1xNCHWxFP32x0x0x2x2x1x1x1x1;miopenConvolutionFwdAlgoGEMM:gemm,0.07632,737280,rocBlas,<unused>
1024-17-17-1x1-192-17-17-1-0x0-1x1-1x1-0-NCHW-FP32-F=miopenConvolutionFwdAlgoDirect:ConvOclDirectFwd1x1,0.04512,0,miopenConvolutionFwdAlgoDirect,<unused>;miopenConvolutionFwdAlgoWinograd:ConvBinWinogradRxSf2x3,0.22864,0,miopenConvolutionFwdAlgoWinograd,1024x17x17x1x1x192x17x17x1xNCHWxFP32x0x0x1x1x1x1x1x1;miopenConvolutionFwdAlgoGEMM:gemm,0.09376,0,rocBlas,<unused>
192-17-17-3x3-192-8-8-1-0x0-2x2-1x1-0-NCHW-FP32-F=miopenConvolutionFwdAlgoDirect:ConvOclDirectFwd,0.53872,0,miopenConvolutionFwdAlgoDirect,<unused>;miopenConvolutionFwdAlgoImplicitGEMM:ConvHipImplicitGemmV4R4Fwd,0.2064,0,miopenConvolutionFwdAlgoImplicitGEMM,192x17x17x3x3x192x8x8x1xNCHWxFP32x0x0x2x2x1x1x1x1;miopenConvolutionFwdAlgoWinograd:ConvBinWinogradRxSf2x3,0.184,0,miopenConvolutionFwdAlgoWinograd,192x17x17x3x3x192x8x8x1xNCHWxFP32x0x0x2x2x1x1x1x1;miopenConvolutionFwdAlgoGEMM:gemm,0.06112,442368,rocBlas,<unused>
1536-8-8-1x1-768-8-8-1-0x0-1x1-1x1-0-NCHW-FP32-F=miopenConvolutionFwdAlgoDirect:ConvOclDirectFwd1x1,0.07184,0,miopenConvolutionFwdAlgoDirect,<unused>;miopenConvolutionFwdAlgoImplicitGEMM:ConvHipImplicitGemmV4R4Fwd,0.17056,0,miopenConvolutionFwdAlgoImplicitGEMM,1536x8x8x1x1x768x8x8x1xNCHWxFP32x0x0x1x1x1x1x1x1;miopenConvolutionFwdAlgoWinograd:ConvBinWinogradRxSf2x3,0.3288,0,miopenConvolutionFwdAlgoWinograd,1536x8x8x1x1x768x8x8x1xNCHWxFP32x0x0x1x1x1x1x1x1;miopenConvolutionFwdAlgoGEMM:gemm,0.06848,0,rocBlas,<unused>
1536-8-8-1x1-256-8-8-1-0x0-1x1-1x1-0-NCHW-FP32-F=miopenConvolutionFwdAlgoDirect:ConvOclDirectFwd1x1,0.04464,0,miopenConvolutionFwdAlgoDirect,<unused>;miopenConvolutionFwdAlgoImplicitGEMM:ConvHipImplicitGemmV4R4Fwd,0.17088,0,miopenConvolutionFwdAlgoImplicitGEMM,1536x8x8x1x1x256x8x8x1xNCHWxFP32x0x0x1x1x1x1x1x1;miopenConvolutionFwdAlgoWinograd:ConvBinWinogradRxSf2x3,0.32928,0,miopenConvolutionFwdAlgoWinograd,1536x8x8x1x1x256x8x8x1xNCHWxFP32x0x0x1x1x1x1x1x1;miopenConvolutionFwdAlgoGEMM:gemm,0.04592,0,rocBlas,<unused>
384-8-8-3x1-448-8-8-1-1x0-1x1-1x1-0-NCHW-FP32-F=miopenConvolutionFwdAlgoImplicitGEMM:ConvHipImplicitGemmV4R4Fwd,0.14672,0,miopenConvolutionFwdAlgoImplicitGEMM,384x8x8x3x1x448x8x8x1xNCHWxFP32x1x0x1x1x1x1x1x1;miopenConvolutionFwdAlgoWinograd:ConvBinWinogradRxSf2x3,0.10128,0,miopenConvolutionFwdAlgoWinograd,384x8x8x3x1x448x8x8x1xNCHWxFP32x1x0x1x1x1x1x1x1;miopenConvolutionFwdAlgoGEMM:gemm,0.05024,294912,rocBlas,<unused>
448-8-8-1x3-512-8-8-1-0x1-1x1-1x1-0-NCHW-FP32-F=miopenConvolutionFwdAlgoImplicitGEMM:ConvHipImplicitGemmV4R4Fwd,0.17232,0,miopenConvolutionFwdAlgoImplicitGEMM,448x8x8x1x3x512x8x8x1xNCHWxFP32x0x1x1x1x1x1x1x1;miopenConvolutionFwdAlgoWinograd:ConvBinWinogradRxS,0.11056,0,miopenConvolutionFwdAlgoWinograd,448x8x8x1x3x512x8x8x1xNCHWxFP32x0x1x1x1x1x1x1x1;miopenConvolutionFwdAlgoGEMM:gemm,0.05856,344064,rocBlas,<unused>
512-8-8-3x1-256-8-8-1-1x0-1x1-1x1-0-NCHW-FP32-F=miopenConvolutionFwdAlgoImplicitGEMM:ConvHipImplicitGemmV4R4Fwd,0.19168,0,miopenConvolutionFwdAlgoImplicitGEMM,512x8x8x3x1x256x8x8x1xNCHWxFP32x1x0x1x1x1x1x1x1;miopenConvolutionFwdAlgoWinograd:ConvBinWinogradRxSf2x3,0.12768,0,miopenConvolutionFwdAlgoWinograd,512x8x8x3x1x256x8x8x1xNCHWxFP32x1x0x1x1x1x1x1x1;miopenConvolutionFwdAlgoGEMM:gemm,0.05552,393216,rocBlas,<unused>
512-8-8-1x3-256-8-8-1-0x1-1x1-1x1-0-NCHW-FP32-F=miopenConvolutionFwdAlgoImplicitGEMM:ConvHipImplicitGemmV4R4Fwd,0.19664,0,miopenConvolutionFwdAlgoImplicitGEMM,512x8x8x1x3x256x8x8x1xNCHWxFP32x0x1x1x1x1x1x1x1;miopenConvolutionFwdAlgoWinograd:ConvBinWinogradRxS,0.12528,0,miopenConvolutionFwdAlgoWinograd,512x8x8x1x3x256x8x8x1xNCHWxFP32x0x1x1x1x1x1x1x1;miopenConvolutionFwdAlgoGEMM:gemm,0.05616,393216,rocBlas,<unused>
384-8-8-3x1-256-8-8-1-1x0-1x1-1x1-0-NCHW-FP32-F=miopenConvolutionFwdAlgoImplicitGEMM:ConvHipImplicitGemmV4R4Fwd,0.14752,0,miopenConvolutionFwdAlgoImplicitGEMM,384x8x8x3x1x256x8x8x1xNCHWxFP32x1x0x1x1x1x1x1x1;miopenConvolutionFwdAlgoWinograd:ConvBinWinogradRxSf2x3,0.10048,0,miopenConvolutionFwdAlgoWinograd,384x8x8x3x1x256x8x8x1xNCHWxFP32x1x0x1x1x1x1x1x1;miopenConvolutionFwdAlgoGEMM:gemm,0.0472,294912,rocBlas,<unused>
384-8-8-1x3-256-8-8-1-0x1-1x1-1x1-0-NCHW-FP32-F=miopenConvolutionFwdAlgoImplicitGEMM:ConvHipImplicitGemmV4R4Fwd,0.15184,0,miopenConvolutionFwdAlgoImplicitGEMM,384x8x8x1x3x256x8x8x1xNCHWxFP32x0x1x1x1x1x1x1x1;miopenConvolutionFwdAlgoWinograd:ConvBinWinogradRxS,0.09904,0,miopenConvolutionFwdAlgoWinograd,384x8x8x1x3x256x8x8x1xNCHWxFP32x0x1x1x1x1x1x1x1;miopenConvolutionFwdAlgoGEMM:gemm,0.0464,294912,rocBlas,<unused>
3-225-225-3x3-48-112-112-1-0x0-2x2-1x1-0-NCHW-FP32-F=miopenConvolutionFwdAlgoDirect:ConvOclDirectFwd,0.02592,0,miopenConvolutionFwdAlgoDirect,<unused>;miopenConvolutionFwdAlgoWinograd:ConvBinWinogradRxSf2x3,0.04528,0,miopenConvolutionFwdAlgoWinograd,3x225x225x3x3x48x112x112x1xNCHWxFP32x0x0x2x2x1x1x1x1;miopenConvolutionFwdAlgoGEMM:gemm,0.05648,1354752,rocBlas,<unused>
48-112-112-3x3-48-112-112-1-1x1-1x1-1x1-0-NCHW-FP32-F_g48=miopenConvolutionFwdAlgoDirect:ConvOclDirectFwd,0.01792,0,miopenConvolutionFwdAlgoDirect,<unused>;miopenConvolutionFwdAlgoWinograd:ConvBinWinogradRxSf2x3,0.235359,0,miopenConvolutionFwdAlgoWinograd,48x112x112x3x3x48x112x112x1xNCHWxFP32x1x1x1x1x1x1x48x1;miopenConvolutionFwdAlgoGEMM:gemm,0.213599,21676032,rocBlas,<unused>
48-112-112-1x1-24-112-112-1-0x0-1x1-1x1-0-NCHW-FP32-F=miopenConvolutionFwdAlgoDirect:ConvOclDirectFwd1x1,0.01312,0,miopenConvolutionFwdAlgoDirect,<unused>;miopenConvolutionFwdAlgoWinograd:ConvBinWinogradRxSf3x2,0.04128,0,miopenConvolutionFwdAlgoWinograd,48x112x112x1x1x24x112x112x1xNCHWxFP32x0x0x1x1x1x1x1x1;miopenConvolutionFwdAlgoGEMM:gemm,0.03424,0,rocBlas,<unused>
24-112-112-1x1-144-112-112-1-0x0-1x1-1x1-0-NCHW-FP32-F=miopenConvolutionFwdAlgoDirect:ConvOclDirectFwd1x1,0.02096,0,miopenConvolutionFwdAlgoDirect,<unused>;miopenConvolutionFwdAlgoWinograd:ConvBinWinogradRxSf3x2,0.06336,0,miopenConvolutionFwdAlgoWinograd,24x112x112x1x1x144x112x112x1xNCHWxFP32x0x0x1x1x1x1x1x1;miopenConvolutionFwdAlgoGEMM:gemm,0.04272,0,rocBlas,<unused>
144-113-113-3x3-144-56-56-1-0x0-2x2-1x1-0-NCHW-FP32-F_g144=miopenConvolutionFwdAlgoDirect:ConvOclDirectFwd,0.02864,0,miopenConvolutionFwdAlgoDirect,<unused>;miopenConvolutionFwdAlgoWinograd:ConvBinWinogradRxSf2x3,0.394878,0,miopenConvolutionFwdAlgoWinograd,144x113x113x3x3x144x56x56x1xNCHWxFP32x0x0x2x2x1x1x144x1;miopenConvolutionFwdAlgoGEMM:gemm,0.14208,16257024,rocBlas,<unused>
144-56-56-1x1-32-56-56-1-0x0-1x1-1x1-0-NCHW-FP32-F=miopenConvolutionFwdAlgoDirect:ConvAsm1x1U,0.01456,0,miopenConvolutionFwdAlgoDirect,<unused>;miopenConvolutionFwdAlgoImplicitGEMM:ConvHipImplicitGemmV4R4Fwd,0.02496,0,miopenConvolutionFwdAlgoImplicitGEMM,144x56x56x1x1x32x56x56x1xNCHWxFP32x0x0x1x1x1x1x1x1;miopenConvolutionFwdAlgoWinograd:ConvBinWinogradRxS,0.05232,0,miopenConvolutionFwdAlgoWinograd,144x56x56x1x1x32x56x56x1xNCHWxFP32x0x0x1x1x1x1x1x1;miopenConvolutionFwdAlgoGEMM:gemm,0.05152,0,rocBlas,<unused>
32-56-56-1x1-192-56-56-1-0x0-1x1-1x1-0-NCHW-FP32-F=miopenConvolutionFwdAlgoDirect:ConvOclDirectFwd1x1,0.01312,0,miopenConvolutionFwdAlgoDirect,<unused>;miopenConvolutionFwdAlgoImplicitGEMM:ConvHipImplicitGemmV4R4Fwd,0.01648,0,miopenConvolutionFwdAlgoImplicitGEMM,32x56x56x1x1x192x56x56x1xNCHWxFP32x0x0x1x1x1x1x1x1;miopenConvolutionFwdAlgoWinograd:ConvBinWinogradRxS,0.0456,0,miopenConvolutionFwdAlgoWinograd,32x56x56x1x1x192x56x56x1xNCHWxFP32x0x0x1x1x1x1x1x1;miopenConvolutionFwdAlgoGEMM:gemm,0.0248,0,rocBlas,<unused>
192-56-56-3x3-192-56-56-1-1x1-1x1-1x1-0-NCHW-FP32-F_g192=miopenConvolutionFwdAlgoDirect:ConvOclDirectFwd,0.01872,0,miopenConvolutionFwdAlgoDirect,<unused>;miopenConvolutionFwdAlgoWinograd:ConvBinWinogradRxSf2x3,0.324958,0,miopenConvolutionFwdAlgoWinograd,192x56x56x3x3x192x56x56x1xNCHWxFP32x1x1x1x1x1x1x192x1;miopenConvolutionFwdAlgoGEMM:gemm,0.1584,21676032,rocBlas,<unused>
192-56-56-1x1-32-56-56-1-0x0-1x1-1x1-0-NCHW-FP32-F=miopenConvolutionFwdAlgoDirect:ConvAsm1x1U,0.01568,0,miopenConvolutionFwdAlgoDirect,<unused>;miopenConvolutionFwdAlgoImplicitGEMM:ConvHipImplicitGemmV4R4Fwd,0.03056,0,miopenConvolutionFwdAlgoImplicitGEMM,192x56x56x1x1x32x56x56x1xNCHWxFP32x0x0x1x1x1x1x1x1;miopenConvolutionFwdAlgoWinograd:ConvBinWinogradRxS,0.06144,0,miopenConvolutionFwdAlgoWinograd,192x56x56x1x1x32x56x56x1xNCHWxFP32x0x0x1x1x1x1x1x1;miopenConvolutionFwdAlgoGEMM:gemm,0.052,0,rocBlas,<unused>
192-57-57-3x3-192-28-28-1-0x0-2x2-1x1-0-NCHW-FP32-F_g192=miopenConvolutionFwdAlgoDirect:ConvOclDirectFwd,0.01456,0,miopenConvolutionFwdAlgoDirect,<unused>;miopenConvolutionFwdAlgoWinograd:ConvBinWinogradRxSf2x3,0.169919,0,miopenConvolutionFwdAlgoWinograd,192x57x57x3x3x192x28x28x1xNCHWxFP32x0x0x2x2x1x1x192x1;miopenConvolutionFwdAlgoGEMM:gemm,0.06416,5419008,rocBlas,<unused>
192-28-28-1x1-48-28-28-1-0x0-1x1-1x1-0-NCHW-FP32-F=miopenConvolutionFwdAlgoDirect:ConvAsm1x1U,0.01248,0,miopenConvolutionFwdAlgoDirect,<unused>;miopenConvolutionFwdAlgoWinograd:ConvBinWinogradRxS,0.06192,0,miopenConvolutionFwdAlgoWinograd,192x28x28x1x1x48x28x28x1xNCHWxFP32x0x0x1x1x1x1x1x1;miopenConvolutionFwdAlgoGEMM:gemm,0.03776,0,rocBlas,<unused>
48-28-28-1x1-288-28-28-1-0x0-1x1-1x1-0-NCHW-FP32-F=miopenConvolutionFwdAlgoDirect:ConvAsm1x1U,0.01168,0,miopenConvolutionFwdAlgoDirect,<unused>;miopenConvolutionFwdAlgoWinograd:ConvBinWinogradRxSf3x2,0.03968,0,miopenConvolutionFwdAlgoWinograd,48x28x28x1x1x288x28x28x1xNCHWxFP32x0x0x1x1x1x1x1x1;miopenConvolutionFwdAlgoGEMM:gemm,0.02416,0,rocBlas,<unused>
288-28-28-3x3-288-28-28-1-1x1-1x1-1x1-0-NCHW-FP32-F_g288=miopenConvolutionFwdAlgoDirect:ConvOclDirectFwd,0.01136,0,miopenConvolutionFwdAlgoDirect,<unused>;miopenConvolutionFwdAlgoWinograd:ConvBinWinogradRxSf2x3,0.136,0,miopenConvolutionFwdAlgoWinograd,288x28x28x3x3x288x28x28x1xNCHWxFP32x1x1x1x1x1x1x288x1;miopenConvolutionFwdAlgoGEMM:gemm,0.07328,8128512,rocBlas,<unused>
288-28-28-1x1-48-28-28-1-0x0-1x1-1x1-0-NCHW-FP32-F=miopenConvolutionFwdAlgoDirect:ConvAsm1x1U,0.01504,0,miopenConvolutionFwdAlgoDirect,<unused>;miopenConvolutionFwdAlgoWinograd:ConvBinWinogradRxS,0.08128,0,miopenConvolutionFwdAlgoWinograd,288x28x28x1x1x48x28x28x1xNCHWxFP32x0x0x1x1x1x1x1x1;miopenConvolutionFwdAlgoGEMM:gemm,0.05152,0,rocBlas,<unused>
288-29-29-3x3-288-14-14-1-0x0-2x2-1x1-0-NCHW-FP32-F_g288=miopenConvolutionFwdAlgoDirect:ConvOclDirectFwd,0.0104,0,miopenConvolutionFwdAlgoDirect,<unused>;miopenConvolutionFwdAlgoWinograd:ConvBinWinogradRxSf2x3,0.08896,0,miopenConvolutionFwdAlgoWinograd,288x29x29x3x3x288x14x14x1xNCHWxFP32x0x0x2x2x1x1x288x1;miopenConvolutionFwdAlgoGEMM:gemm,0.04496,2032128,rocBlas,<unused>
288-14-14-1x1-88-14-14-1-0x0-1x1-1x1-0-NCHW-FP32-F=miopenConvolutionFwdAlgoDirect:ConvAsm1x1U,0.0152,0,miopenConvolutionFwdAlgoDirect,<unused>;miopenConvolutionFwdAlgoWinograd:ConvBinWinogradRxS,0.08128,0,miopenConvolutionFwdAlgoWinograd,288x14x14x1x1x88x14x14x1xNCHWxFP32x0x0x1x1x1x1x1x1;miopenConvolutionFwdAlgoGEMM:gemm,0.03968,0,rocBlas,<unused>
88-14-14-1x1-528-14-14-1-0x0-1x1-1x1-0-NCHW-FP32-F=miopenConvolutionFwdAlgoDirect:ConvAsm1x1U,0.01344,0,miopenConvolutionFwdAlgoDirect,<unused>;miopenConvolutionFwdAlgoWinograd:ConvBinWinogradRxS,0.04112,0,miopenConvolutionFwdAlgoWinograd,88x14x14x1x1x528x14x14x1xNCHWxFP32x0x0x1x1x1x1x1x1;miopenConvolutionFwdAlgoGEMM:gemm,0.02464,0,rocBlas,<unused>
528-14-14-3x3-528-14-14-1-1x1-1x1-1x1-0-NCHW-FP32-F_g528=miopenConvolutionFwdAlgoDirect:ConvOclDirectFwd,0.0096,0,miopenConvolutionFwdAlgoDirect,<unused>;miopenConvolutionFwdAlgoWinograd:ConvBinWinogradRxSf2x3,0.12672,0,miopenConvolutionFwdAlgoWinograd,528x14x14x3x3x528x14x14x1xNCHWxFP32x1x1x1x1x1x1x528x1;miopenConvolutionFwdAlgoGEMM:gemm,0.07904,3725568,rocBlas,<unused>
528-14-14-1x1-88-14-14-1-0x0-1x1-1x1-0-NCHW-FP32-F=miopenConvolutionFwdAlgoDirect:ConvAsm1x1U,0.02096,0,miopenConvolutionFwdAlgoDirect,<unused>;miopenConvolutionFwdAlgoWinograd:ConvBinWinogradRxSf2x3,0.12848,0,miopenConvolutionFwdAlgoWinograd,528x14x14x1x1x88x14x14x1xNCHWxFP32x0x0x1x1x1x1x1x1;miopenConvolutionFwdAlgoGEMM:gemm,0.02848,0,rocBlas,<unused>
528-14-14-1x1-136-14-14-1-0x0-1x1-1x1-0-NCHW-FP32-F=miopenConvolutionFwdAlgoDirect:ConvAsm1x1U,0.02128,0,miopenConvolutionFwdAlgoDirect,<unused>;miopenConvolutionFwdAlgoWinograd:ConvBinWinogradRxSf2x3,0.12784,0,miopenConvolutionFwdAlgoWinograd,528x14x14x1x1x136x14x14x1xNCHWxFP32x0x0x1x1x1x1x1x1;miopenConvolutionFwdAlgoGEMM:gemm,0.03008,0,rocBlas,<unused>
136-14-14-1x1-816-14-14-1-0x0-1x1-1x1-0-NCHW-FP32-F=miopenConvolutionFwdAlgoDirect:ConvOclDirectFwd1x1,0.01904,0,miopenConvolutionFwdAlgoDirect,<unused>;miopenConvolutionFwdAlgoWinograd:ConvBinWinogradRxS,0.04976,0,miopenConvolutionFwdAlgoWinograd,136x14x14x1x1x816x14x14x1xNCHWxFP32x0x0x1x1x1x1x1x1;miopenConvolutionFwdAlgoGEMM:gemm,0.04112,0,rocBlas,<unused>
816-14-14-3x3-816-14-14-1-1x1-1x1-1x1-0-NCHW-FP32-F_g816=miopenConvolutionFwdAlgoDirect:ConvOclDirectFwd,0.01088,0,miopenConvolutionFwdAlgoDirect,<unused>;miopenConvolutionFwdAlgoWinograd:ConvBinWinogradRxSf2x3,0.188799,0,miopenConvolutionFwdAlgoWinograd,816x14x14x3x3x816x14x14x1xNCHWxFP32x1x1x1x1x1x1x816x1;miopenConvolutionFwdAlgoGEMM:gemm,0.072,5757696,rocBlas,<unused>
816-14-14-1x1-136-14-14-1-0x0-1x1-1x1-0-NCHW-FP32-F=miopenConvolutionFwdAlgoDirect:ConvAsm1x1U,0.02848,0,miopenConvolutionFwdAlgoDirect,<unused>;miopenConvolutionFwdAlgoWinograd:ConvBinWinogradRxSf2x3,0.183359,0,miopenConvolutionFwdAlgoWinograd,816x14x14x1x1x136x14x14x1xNCHWxFP32x0x0x1x1x1x1x1x1;miopenConvolutionFwdAlgoGEMM:gemm,0.0392,0,rocBlas,<unused>
816-15-15-3x3-816-7-7-1-0x0-2x2-1x1-0-NCHW-FP32-F_g816=miopenConvolutionFwdAlgoDirect:ConvOclDirectFwd,0.01024,0,miopenConvolutionFwdAlgoDirect,<unused>;miopenConvolutionFwdAlgoWinograd:ConvBinWinogradRxSf2x3,0.173279,0,miopenConvolutionFwdAlgoWinograd,816x15x15x3x3x816x7x7x1xNCHWxFP32x0x0x2x2x1x1x816x1;miopenConvolutionFwdAlgoGEMM:gemm,0.048,1439424,rocBlas,<unused>
816-7-7-1x1-224-7-7-1-0x0-1x1-1x1-0-NCHW-FP32-F=miopenConvolutionFwdAlgoDirect:ConvAsm1x1U,0.02576,0,miopenConvolutionFwdAlgoDirect,<unused>;miopenConvolutionFwdAlgoWinograd:ConvBinWinogradRxSf2x3,0.184479,0,miopenConvolutionFwdAlgoWinograd,816x7x7x1x1x224x7x7x1xNCHWxFP32x0x0x1x1x1x1x1x1;miopenConvolutionFwdAlgoGEMM:gemm,0.03232,0,rocBlas,<unused>
224-7-7-1x1-1344-7-7-1-0x0-1x1-1x1-0-NCHW-FP32-F=miopenConvolutionFwdAlgoDirect:ConvAsm1x1U,0.02048,0,miopenConvolutionFwdAlgoDirect,<unused>;miopenConvolutionFwdAlgoWinograd:ConvBinWinogradRxS,0.06832,0,miopenConvolutionFwdAlgoWinograd,224x7x7x1x1x1344x7x7x1xNCHWxFP32x0x0x1x1x1x1x1x1;miopenConvolutionFwdAlgoGEMM:gemm,0.0472,0,rocBlas,<unused>
1344-7-7-3x3-1344-7-7-1-1x1-1x1-1x1-0-NCHW-FP32-F_g1344=miopenConvolutionFwdAlgoDirect:ConvOclDirectFwd,0.0096,0,miopenConvolutionFwdAlgoDirect,<unused>;miopenConvolutionFwdAlgoWinograd:ConvBinWinogradRxSf2x3,0.240959,0,miopenConvolutionFwdAlgoWinograd,1344x7x7x3x3x1344x7x7x1xNCHWxFP32x1x1x1x1x1x1x1344x1;miopenConvolutionFwdAlgoGEMM:gemm,0.0576,2370816,rocBlas,<unused>
1344-7-7-1x1-224-7-7-1-0x0-1x1-1x1-0-NCHW-FP32-F=miopenConvolutionFwdAlgoDirect:ConvOclDirectFwd1x1,0.03296,0,miopenConvolutionFwdAlgoDirect,<unused>;miopenConvolutionFwdAlgoWinograd:ConvBinWinogradRxSf2x3,0.286399,0,miopenConvolutionFwdAlgoWinograd,1344x7x7x1x1x224x7x7x1xNCHWxFP32x0x0x1x1x1x1x1x1;miopenConvolutionFwdAlgoGEMM:gemm,0.0504,0,rocBlas,<unused>
1344-7-7-1x1-448-7-7-1-0x0-1x1-1x1-0-NCHW-FP32-F=miopenConvolutionFwdAlgoDirect:ConvOclDirectFwd1x1,0.03664,0,miopenConvolutionFwdAlgoDirect,<unused>;miopenConvolutionFwdAlgoWinograd:ConvBinWinogradRxSf2x3,0.285919,0,miopenConvolutionFwdAlgoWinograd,1344x7x7x1x1x448x7x7x1xNCHWxFP32x0x0x1x1x1x1x1x1;miopenConvolutionFwdAlgoGEMM:gemm,0.05408,0,rocBlas,<unused>
448-7-7-1x1-1792-7-7-1-0x0-1x1-1x1-0-NCHW-FP32-F=miopenConvolutionFwdAlgoDirect:ConvOclDirectFwd1x1,0.03776,0,miopenConvolutionFwdAlgoDirect,<unused>;miopenConvolutionFwdAlgoWinograd:ConvBinWinogradRxSf2x3,0.11328,0,miopenConvolutionFwdAlgoWinograd,448x7x7x1x1x1792x7x7x1xNCHWxFP32x0x0x1x1x1x1x1x1;miopenConvolutionFwdAlgoGEMM:gemm,0.05984,0,rocBlas,<unused>
1792-1-1-1x1-1001-1-1-1-0x0-1x1-1x1-0-NCHW-FP32-F=miopenConvolutionFwdAlgoDirect:ConvOclDirectFwd1x1,0.0832,0,miopenConvolutionFwdAlgoDirect,<unused>;miopenConvolutionFwdAlgoWinograd:ConvBinWinogradRxSf2x3,0.326718,0,miopenConvolutionFwdAlgoWinograd,1792x1x1x1x1x1001x1x1x1xNCHWxFP32x0x0x1x1x1x1x1x1;miopenConvolutionFwdAlgoGEMM:gemm,0.06368,0,rocBlas,<unused>
3-224-224-7x7-64-112-112-1-3x3-2x2-1x1-0-NCHW-FP32-F=miopenConvolutionFwdAlgoDirect:ConvAsm7x7c3h224w224k64u2v2p3q3f1,0.04208,0,miopenConvolutionFwdAlgoDirect,<unused>;miopenConvolutionFwdAlgoWinograd:ConvBinWinogradRxS,0.0688,0,miopenConvolutionFwdAlgoWinograd,3x224x224x7x7x64x112x112x1xNCHWxFP32x3x3x2x2x1x1x1x1;miopenConvolutionFwdAlgoGEMM:gemm,0.07296,7375872,rocBlas,<unused>
64-56-56-1x1-64-56-56-1-0x0-1x1-1x1-0-NCHW-FP32-F=miopenConvolutionFwdAlgoDirect:ConvAsm1x1U,0.01264,0,miopenConvolutionFwdAlgoDirect,<unused>;miopenConvolutionFwdAlgoImplicitGEMM:ConvHipImplicitGemmV4R4Fwd,0.01568,0,miopenConvolutionFwdAlgoImplicitGEMM,64x56x56x1x1x64x56x56x1xNCHWxFP32x0x0x1x1x1x1x1x1;miopenConvolutionFwdAlgoWinograd:ConvBinWinogradRxS,0.03744,0,miopenConvolutionFwdAlgoWinograd,64x56x56x1x1x64x56x56x1xNCHWxFP32x0x0x1x1x1x1x1x1;miopenConvolutionFwdAlgoGEMM:gemm,0.02752,0,rocBlas,<unused>
64-56-56-3x3-64-56-56-1-1x1-1x1-1x1-0-NCHW-FP32-F=miopenConvolutionFwdAlgoWinograd:ConvBinWinograd3x3U,0.03504,0,miopenConvolutionFwdAlgoWinograd,64x56x56x3x3x64x56x56x1xNCHWxFP32x1x1x1x1x1x1x1x1
128-56-56-1x1-256-56-56-1-0x0-1x1-1x1-0-NCHW-FP32-F=miopenConvolutionFwdAlgoDirect:ConvAsm1x1U,0.03904,0,miopenConvolutionFwdAlgoDirect,<unused>;miopenConvolutionFwdAlgoImplicitGEMM:ConvHipImplicitGemmV4R4Fwd,0.04016,0,miopenConvolutionFwdAlgoImplicitGEMM,128x56x56x1x1x256x56x56x1xNCHWxFP32x0x0x1x1x1x1x1x1;miopenConvolutionFwdAlgoWinograd:ConvBinWinogradRxSf3x2,0.08816,0,miopenConvolutionFwdAlgoWinograd,128x56x56x1x1x256x56x56x1xNCHWxFP32x0x0x1x1x1x1x1x1;miopenConvolutionFwdAlgoGEMM:gemm,0.05552,0,rocBlas,<unused>
256-56-56-1x1-64-56-56-1-0x0-1x1-1x1-0-NCHW-FP32-F=miopenConvolutionFwdAlgoDirect:ConvAsm1x1U,0.02464,0,miopenConvolutionFwdAlgoDirect,<unused>;miopenConvolutionFwdAlgoImplicitGEMM:ConvHipImplicitGemmV4R4Fwd,0.04048,0,miopenConvolutionFwdAlgoImplicitGEMM,256x56x56x1x1x64x56x56x1xNCHWxFP32x0x0x1x1x1x1x1x1;miopenConvolutionFwdAlgoWinograd:ConvBinWinogradRxS,0.0736,0,miopenConvolutionFwdAlgoWinograd,256x56x56x1x1x64x56x56x1xNCHWxFP32x0x0x1x1x1x1x1x1;miopenConvolutionFwdAlgoGEMM:gemm,0.06064,0,rocBlas,<unused>
64-56-56-1x1-256-56-56-1-0x0-1x1-1x1-0-NCHW-FP32-F=miopenConvolutionFwdAlgoDirect:ConvOclDirectFwd1x1,0.02224,0,miopenConvolutionFwdAlgoDirect,<unused>;miopenConvolutionFwdAlgoImplicitGEMM:ConvHipImplicitGemmV4R4Fwd,0.0248,0,miopenConvolutionFwdAlgoImplicitGEMM,64x56x56x1x1x256x56x56x1xNCHWxFP32x0x0x1x1x1x1x1x1;miopenConvolutionFwdAlgoWinograd:ConvBinWinogradRxSf3x2,0.06128,0,miopenConvolutionFwdAlgoWinograd,64x56x56x1x1x256x56x56x1xNCHWxFP32x0x0x1x1x1x1x1x1;miopenConvolutionFwdAlgoGEMM:gemm,0.03728,0,rocBlas,<unused>
256-56-56-1x1-128-56-56-1-0x0-1x1-1x1-0-NCHW-FP32-F=miopenConvolutionFwdAlgoDirect:ConvOclDirectFwd1x1,0.03904,0,miopenConvolutionFwdAlgoDirect,<unused>;miopenConvolutionFwdAlgoImplicitGEMM:ConvHipImplicitGemmV4R4Fwd,0.05136,0,miopenConvolutionFwdAlgoImplicitGEMM,256x56x56x1x1x128x56x56x1xNCHWxFP32x0x0x1x1x1x1x1x1;miopenConvolutionFwdAlgoWinograd:ConvBinWinogradRxSf3x2,0.08384,0,miopenConvolutionFwdAlgoWinograd,256x56x56x1x1x128x56x56x1xNCHWxFP32x0x0x1x1x1x1x1x1;miopenConvolutionFwdAlgoGEMM:gemm,0.06,0,rocBlas,<unused>
128-56-56-3x3-128-28-28-1-1x1-2x2-1x1-0-NCHW-FP32-F=miopenConvolutionFwdAlgoDirect:ConvOclDirectFwd,0.40624,0,miopenConvolutionFwdAlgoDirect,<unused>;miopenConvolutionFwdAlgoWinograd:ConvBinWinogradRxSf2x3,0.1312,0,miopenConvolutionFwdAlgoWinograd,128x56x56x3x3x128x28x28x1xNCHWxFP32x1x1x2x2x1x1x1x1;miopenConvolutionFwdAlgoGEMM:gemm,0.10016,3612672,rocBlas,<unused>
384-28-28-1x1-512-28-28-1-0x0-1x1-1x1-0-NCHW-FP32-F=miopenConvolutionFwdAlgoDirect:ConvAsm1x1U,0.05888,0,miopenConvolutionFwdAlgoDirect,<unused>;miopenConvolutionFwdAlgoWinograd:ConvBinWinogradRxSf2x3,0.17632,0,miopenConvolutionFwdAlgoWinograd,384x28x28x1x1x512x28x28x1xNCHWxFP32x0x0x1x1x1x1x1x1;miopenConvolutionFwdAlgoGEMM:gemm,0.06464,0,rocBlas,<unused>
512-28-28-1x1-128-28-28-1-0x0-1x1-1x1-0-NCHW-FP32-F=miopenConvolutionFwdAlgoDirect:ConvAsm1x1U,0.03264,0,miopenConvolutionFwdAlgoDirect,<unused>;miopenConvolutionFwdAlgoWinograd:ConvBinWinogradRxSf2x3,0.1256,0,miopenConvolutionFwdAlgoWinograd,512x28x28x1x1x128x28x28x1xNCHWxFP32x0x0x1x1x1x1x1x1;miopenConvolutionFwdAlgoGEMM:gemm,0.10928,0,rocBlas,<unused>
128-28-28-3x3-128-28-28-1-1x1-1x1-1x1-0-NCHW-FP32-F=miopenConvolutionFwdAlgoWinograd:ConvBinWinograd3x3U,0.04608,0,miopenConvolutionFwdAlgoWinograd,128x28x28x3x3x128x28x28x1xNCHWxFP32x1x1x1x1x1x1x1x1
128-28-28-1x1-512-28-28-1-0x0-1x1-1x1-0-NCHW-FP32-F=miopenConvolutionFwdAlgoDirect:ConvOclDirectFwd1x1,0.02528,0,miopenConvolutionFwdAlgoDirect,<unused>;miopenConvolutionFwdAlgoWinograd:ConvBinWinogradRxS,0.07488,0,miopenConvolutionFwdAlgoWinograd,128x28x28x1x1x512x28x28x1xNCHWxFP32x0x0x1x1x1x1x1x1;miopenConvolutionFwdAlgoGEMM:gemm,0.04928,0,rocBlas,<unused>
512-28-28-1x1-256-28-28-1-0x0-1x1-1x1-0-NCHW-FP32-F=miopenConvolutionFwdAlgoDirect:ConvAsm1x1U,0.04432,0,miopenConvolutionFwdAlgoDirect,<unused>;miopenConvolutionFwdAlgoWinograd:ConvBinWinogradRxSf2x3,0.12512,0,miopenConvolutionFwdAlgoWinograd,512x28x28x1x1x256x28x28x1xNCHWxFP32x0x0x1x1x1x1x1x1;miopenConvolutionFwdAlgoGEMM:gemm,0.10448,0,rocBlas,<unused>
256-28-28-3x3-256-14-14-1-1x1-2x2-1x1-0-NCHW-FP32-F=miopenConvolutionFwdAlgoDirect:ConvOclDirectFwd,0.65984,0,miopenConvolutionFwdAlgoDirect,<unused>;miopenConvolutionFwdAlgoWinograd:ConvBinWinogradRxSf2x3,0.236,0,miopenConvolutionFwdAlgoWinograd,256x28x28x3x3x256x14x14x1xNCHWxFP32x1x1x2x2x1x1x1x1;miopenConvolutionFwdAlgoGEMM:gemm,0.1032,1806336,rocBlas,<unused>
768-14-14-1x1-1024-14-14-1-0x0-1x1-1x1-0-NCHW-FP32-F=miopenConvolutionFwdAlgoDirect:ConvAsm1x1U,0.09232,0,miopenConvolutionFwdAlgoDirect,<unused>;miopenConvolutionFwdAlgoWinograd:ConvBinWinogradRxSf3x2,0.18752,0,miopenConvolutionFwdAlgoWinograd,768x14x14x1x1x1024x14x14x1xNCHWxFP32x0x0x1x1x1x1x1x1;miopenConvolutionFwdAlgoGEMM:gemm,0.08592,0,rocBlas,<unused>
1024-14-14-1x1-256-14-14-1-0x0-1x1-1x1-0-NCHW-FP32-F=miopenConvolutionFwdAlgoDirect:ConvAsm1x1U,0.04224,0,miopenConvolutionFwdAlgoDirect,<unused>;miopenConvolutionFwdAlgoWinograd:ConvBinWinogradRxSf2x3,0.22688,0,miopenConvolutionFwdAlgoWinograd,1024x14x14x1x1x256x14x14x1xNCHWxFP32x0x0x1x1x1x1x1x1;miopenConvolutionFwdAlgoGEMM:gemm,0.08656,0,rocBlas,<unused>
256-14-14-3x3-256-14-14-1-1x1-1x1-1x1-0-NCHW-FP32-F=miopenConvolutionFwdAlgoWinograd:ConvBinWinograd3x3U,0.07216,0,miopenConvolutionFwdAlgoWinograd,256x14x14x3x3x256x14x14x1xNCHWxFP32x1x1x1x1x1x1x1x1
256-14-14-1x1-1024-14-14-1-0x0-1x1-1x1-0-NCHW-FP32-F=miopenConvolutionFwdAlgoDirect:ConvAsm1x1U,0.03296,0,miopenConvolutionFwdAlgoDirect,<unused>;miopenConvolutionFwdAlgoWinograd:ConvBinWinogradRxSf3x2,0.08128,0,miopenConvolutionFwdAlgoWinograd,256x14x14x1x1x1024x14x14x1xNCHWxFP32x0x0x1x1x1x1x1x1;miopenConvolutionFwdAlgoGEMM:gemm,0.0456,0,rocBlas,<unused>
1024-14-14-1x1-512-14-14-1-0x0-1x1-1x1-0-NCHW-FP32-F=miopenConvolutionFwdAlgoDirect:ConvAsm1x1U,0.0704,0,miopenConvolutionFwdAlgoDirect,<unused>;miopenConvolutionFwdAlgoWinograd:ConvBinWinogradRxSf2x3,0.22848,0,miopenConvolutionFwdAlgoWinograd,1024x14x14x1x1x512x14x14x1xNCHWxFP32x0x0x1x1x1x1x1x1;miopenConvolutionFwdAlgoGEMM:gemm,0.07952,0,rocBlas,<unused>
512-14-14-3x3-512-7-7-1-1x1-2x2-1x1-0-NCHW-FP32-F=miopenConvolutionFwdAlgoDirect:ConvOclDirectFwd,1.10128,0,miopenConvolutionFwdAlgoDirect,<unused>;miopenConvolutionFwdAlgoWinograd:ConvBinWinogradRxSf2x3,0.44912,0,miopenConvolutionFwdAlgoWinograd,512x14x14x3x3x512x7x7x1xNCHWxFP32x1x1x2x2x1x1x1x1;miopenConvolutionFwdAlgoGEMM:gemm,0.35984,903168,rocBlas,<unused>
1536-7-7-1x1-2048-7-7-1-0x0-1x1-1x1-0-NCHW-FP32-F=miopenConvolutionFwdAlgoDirect:ConvOclDirectFwd1x1,0.14832,0,miopenConvolutionFwdAlgoDirect,<unused>;miopenConvolutionFwdAlgoWinograd:ConvBinWinogradRxSf2x3,0.62976,0,miopenConvolutionFwdAlgoWinograd,1536x7x7x1x1x2048x7x7x1xNCHWxFP32x0x0x1x1x1x1x1x1;miopenConvolutionFwdAlgoGEMM:gemm,0.11152,0,rocBlas,<unused>
2048-7-7-1x1-512-7-7-1-0x0-1x1-1x1-0-NCHW-FP32-F=miopenConvolutionFwdAlgoDirect:ConvOclDirectFwd1x1,0.05808,0,miopenConvolutionFwdAlgoDirect,<unused>;miopenConvolutionFwdAlgoWinograd:ConvBinWinogradRxSf2x3,0.42896,0,miopenConvolutionFwdAlgoWinograd,2048x7x7x1x1x512x7x7x1xNCHWxFP32x0x0x1x1x1x1x1x1;miopenConvolutionFwdAlgoGEMM:gemm,0.076,0,rocBlas,<unused>
512-7-7-3x3-512-7-7-1-1x1-1x1-1x1-0-NCHW-FP32-F=miopenConvolutionFwdAlgoWinograd:ConvBinWinogradRxSf2x3,0.132,0,miopenConvolutionFwdAlgoWinograd,512x7x7x3x3x512x7x7x1xNCHWxFP32x1x1x1x1x1x1x1x1
512-7-7-1x1-2048-7-7-1-0x0-1x1-1x1-0-NCHW-FP32-F=miopenConvolutionFwdAlgoDirect:ConvOclDirectFwd1x1,0.04704,0,miopenConvolutionFwdAlgoDirect,<unused>;miopenConvolutionFwdAlgoWinograd:ConvBinWinogradRxSf2x3,0.22736,0,miopenConvolutionFwdAlgoWinograd,512x7x7x1x1x2048x7x7x1xNCHWxFP32x0x0x1x1x1x1x1x1;miopenConvolutionFwdAlgoGEMM:gemm,0.04672,0,rocBlas,<unused>
