tools/onnxruntime/old/miopen37/gfx906_60.HIP.2_6_0_8145-rocm-rel-3.7-20-c16087a4.ufdb.txt
3-299-299-7x7-64-150-150-1-3x3-2x2-1x1-0-NCHW-FP32-F=miopenConvolutionFwdAlgoDirect:ConvOclDirectFwd,0.10624,0,miopenConvolutionFwdAlgoDirect,<unused>;miopenConvolutionFwdAlgoGEMM:gemm,5.68242,13230000,rocBlas,<unused>;miopenConvolutionFwdAlgoWinograd:ConvBinWinogradRxS,0.092961,0,miopenConvolutionFwdAlgoWinograd,<unused>
64-75-75-1x1-64-75-75-1-0x0-1x1-1x1-0-NCHW-FP32-F=miopenConvolutionFwdAlgoDirect:ConvAsm1x1U,0.01504,0,miopenConvolutionFwdAlgoDirect,<unused>;miopenConvolutionFwdAlgoGEMM:gemm,0.024,0,rocBlas,<unused>;miopenConvolutionFwdAlgoWinograd:ConvBinWinogradRxSf3x2,0.04576,0,miopenConvolutionFwdAlgoWinograd,<unused>
64-75-75-3x3-64-75-75-1-1x1-1x1-1x1-0-NCHW-FP32-F=miopenConvolutionFwdAlgoWinograd:ConvBinWinogradRxSf2x3,0.05024,0,miopenConvolutionFwdAlgoWinograd,<unused>
128-75-75-1x1-256-75-75-1-0x0-1x1-1x1-0-NCHW-FP32-F=miopenConvolutionFwdAlgoDirect:ConvAsm1x1U,0.06128,0,miopenConvolutionFwdAlgoDirect,<unused>;miopenConvolutionFwdAlgoGEMM:gemm,0.08016,0,rocBlas,<unused>;miopenConvolutionFwdAlgoWinograd:ConvBinWinogradRxSf3x2,0.12144,0,miopenConvolutionFwdAlgoWinograd,<unused>
256-75-75-1x1-64-75-75-1-0x0-1x1-1x1-0-NCHW-FP32-F=miopenConvolutionFwdAlgoDirect:ConvAsm1x1U,0.03632,0,miopenConvolutionFwdAlgoDirect,<unused>;miopenConvolutionFwdAlgoGEMM:gemm,0.04096,0,rocBlas,<unused>;miopenConvolutionFwdAlgoWinograd:ConvBinWinogradRxSf3x2,0.08432,0,miopenConvolutionFwdAlgoWinograd,<unused>
64-75-75-1x1-256-75-75-1-0x0-1x1-1x1-0-NCHW-FP32-F=miopenConvolutionFwdAlgoDirect:ConvAsm1x1U,0.03232,0,miopenConvolutionFwdAlgoDirect,<unused>;miopenConvolutionFwdAlgoGEMM:gemm,0.05056,0,rocBlas,<unused>;miopenConvolutionFwdAlgoWinograd:ConvBinWinogradRxSf3x2,0.08368,0,miopenConvolutionFwdAlgoWinograd,<unused>
64-75-75-3x3-64-38-38-1-1x1-2x2-1x1-0-NCHW-FP32-F=miopenConvolutionFwdAlgoDirect:ConvOclDirectFwd,0.21184,0,miopenConvolutionFwdAlgoDirect,<unused>;miopenConvolutionFwdAlgoGEMM:gemm,0.04528,3326976,rocBlas,<unused>;miopenConvolutionFwdAlgoWinograd:ConvBinWinogradRxS,0.07696,0,miopenConvolutionFwdAlgoWinograd,<unused>
64-38-38-1x1-256-38-38-1-0x0-1x1-1x1-0-NCHW-FP32-F=miopenConvolutionFwdAlgoDirect:ConvAsm1x1U,0.01552,0,miopenConvolutionFwdAlgoDirect,<unused>;miopenConvolutionFwdAlgoGEMM:gemm,0.02656,0,rocBlas,<unused>;miopenConvolutionFwdAlgoWinograd:ConvBinWinogradRxSf3x2,0.04608,0,miopenConvolutionFwdAlgoWinograd,<unused>
256-38-38-1x1-128-38-38-1-0x0-1x1-1x1-0-NCHW-FP32-F=miopenConvolutionFwdAlgoDirect:ConvAsm1x1U,0.02352,0,miopenConvolutionFwdAlgoDirect,<unused>;miopenConvolutionFwdAlgoGEMM:gemm,0.0336,0,rocBlas,<unused>;miopenConvolutionFwdAlgoWinograd:ConvBinWinogradRxS,0.07344,0,miopenConvolutionFwdAlgoWinograd,<unused>
128-38-38-3x3-128-38-38-1-1x1-1x1-1x1-0-NCHW-FP32-F=miopenConvolutionFwdAlgoWinograd:ConvBinWinograd3x3U,0.04816,0,miopenConvolutionFwdAlgoWinograd,<unused>
384-38-38-1x1-512-38-38-1-0x0-1x1-1x1-0-NCHW-FP32-F=miopenConvolutionFwdAlgoDirect:ConvAsm1x1U,0.0984,0,miopenConvolutionFwdAlgoDirect,<unused>;miopenConvolutionFwdAlgoGEMM:gemm,0.08976,0,rocBlas,<unused>;miopenConvolutionFwdAlgoWinograd:ConvBinWinogradRxSf3x2,0.19488,0,miopenConvolutionFwdAlgoWinograd,<unused>
512-38-38-1x1-128-38-38-1-0x0-1x1-1x1-0-NCHW-FP32-F=miopenConvolutionFwdAlgoDirect:ConvAsm1x1U,0.04016,0,miopenConvolutionFwdAlgoDirect,<unused>;miopenConvolutionFwdAlgoGEMM:gemm,0.08016,0,rocBlas,<unused>;miopenConvolutionFwdAlgoWinograd:ConvBinWinogradRxSf2x3,0.12272,0,miopenConvolutionFwdAlgoWinograd,<unused>
128-38-38-1x1-512-38-38-1-0x0-1x1-1x1-0-NCHW-FP32-F=miopenConvolutionFwdAlgoDirect:ConvAsm1x1U,0.03616,0,miopenConvolutionFwdAlgoDirect,<unused>;miopenConvolutionFwdAlgoGEMM:gemm,0.0576,0,rocBlas,<unused>;miopenConvolutionFwdAlgoWinograd:ConvBinWinogradRxSf3x2,0.09072,0,miopenConvolutionFwdAlgoWinograd,<unused>
128-38-38-3x3-128-19-19-1-1x1-2x2-1x1-0-NCHW-FP32-F=miopenConvolutionFwdAlgoDirect:ConvOclDirectFwd,0.412481,0,miopenConvolutionFwdAlgoDirect,<unused>;miopenConvolutionFwdAlgoGEMM:gemm,0.04816,1663488,rocBlas,<unused>;miopenConvolutionFwdAlgoWinograd:ConvBinWinogradRxSf2x3,0.12848,0,miopenConvolutionFwdAlgoWinograd,<unused>
128-19-19-1x1-512-19-19-1-0x0-1x1-1x1-0-NCHW-FP32-F=miopenConvolutionFwdAlgoDirect:ConvAsm1x1U,0.0144,0,miopenConvolutionFwdAlgoDirect,<unused>;miopenConvolutionFwdAlgoGEMM:gemm,0.03008,0,rocBlas,<unused>;miopenConvolutionFwdAlgoWinograd:ConvBinWinogradRxSf3x2,0.05696,0,miopenConvolutionFwdAlgoWinograd,<unused>
512-19-19-1x1-256-19-19-1-0x0-1x1-1x1-0-NCHW-FP32-F=miopenConvolutionFwdAlgoDirect:ConvAsm1x1U,0.032,0,miopenConvolutionFwdAlgoDirect,<unused>;miopenConvolutionFwdAlgoGEMM:gemm,0.03296,0,rocBlas,<unused>;miopenConvolutionFwdAlgoWinograd:ConvBinWinogradRxSf2x3,0.12256,0,miopenConvolutionFwdAlgoWinograd,<unused>
256-19-19-3x3-256-19-19-1-1x1-1x1-1x1-0-NCHW-FP32-F=miopenConvolutionFwdAlgoWinograd:ConvBinWinogradRxSf2x3,0.07328,0,miopenConvolutionFwdAlgoWinograd,<unused>
768-19-19-1x1-1024-19-19-1-0x0-1x1-1x1-0-NCHW-FP32-F=miopenConvolutionFwdAlgoDirect:ConvOclDirectFwd1x1,0.13696,0,miopenConvolutionFwdAlgoDirect,<unused>;miopenConvolutionFwdAlgoGEMM:gemm,0.08912,0,rocBlas,<unused>;miopenConvolutionFwdAlgoWinograd:ConvBinWinogradRxSf3x2,0.349601,0,miopenConvolutionFwdAlgoWinograd,<unused>
1024-19-19-1x1-256-19-19-1-0x0-1x1-1x1-0-NCHW-FP32-F=miopenConvolutionFwdAlgoDirect:ConvAsm1x1U,0.06176,0,miopenConvolutionFwdAlgoDirect,<unused>;miopenConvolutionFwdAlgoGEMM:gemm,0.0904,0,rocBlas,<unused>;miopenConvolutionFwdAlgoWinograd:ConvBinWinogradRxSf2x3,0.21984,0,miopenConvolutionFwdAlgoWinograd,<unused>
256-19-19-1x1-1024-19-19-1-0x0-1x1-1x1-0-NCHW-FP32-F=miopenConvolutionFwdAlgoDirect:ConvAsm1x1U,0.04336,0,miopenConvolutionFwdAlgoDirect,<unused>;miopenConvolutionFwdAlgoGEMM:gemm,0.03712,0,rocBlas,<unused>;miopenConvolutionFwdAlgoWinograd:ConvBinWinogradRxSf3x2,0.14016,0,miopenConvolutionFwdAlgoWinograd,<unused>
256-19-19-3x3-256-10-10-1-1x1-2x2-1x1-0-NCHW-FP32-F=miopenConvolutionFwdAlgoDirect:ConvOclDirectFwd,0.397761,0,miopenConvolutionFwdAlgoDirect,<unused>;miopenConvolutionFwdAlgoGEMM:gemm,0.07056,921600,rocBlas,<unused>;miopenConvolutionFwdAlgoWinograd:ConvBinWinogradRxSf2x3,0.231361,0,miopenConvolutionFwdAlgoWinograd,<unused>
256-10-10-1x1-1024-10-10-1-0x0-1x1-1x1-0-NCHW-FP32-F=miopenConvolutionFwdAlgoDirect:ConvAsm1x1U,0.02048,0,miopenConvolutionFwdAlgoDirect,<unused>;miopenConvolutionFwdAlgoGEMM:gemm,0.04192,0,rocBlas,<unused>;miopenConvolutionFwdAlgoWinograd:ConvBinWinogradRxSf2x3,0.07456,0,miopenConvolutionFwdAlgoWinograd,<unused>
1024-10-10-1x1-512-10-10-1-0x0-1x1-1x1-0-NCHW-FP32-F=miopenConvolutionFwdAlgoDirect:ConvAsm1x1U,0.04416,0,miopenConvolutionFwdAlgoDirect,<unused>;miopenConvolutionFwdAlgoGEMM:gemm,0.048,0,rocBlas,<unused>;miopenConvolutionFwdAlgoWinograd:ConvBinWinogradRxSf2x3,0.22,0,miopenConvolutionFwdAlgoWinograd,<unused>
512-10-10-3x3-512-10-10-1-1x1-1x1-1x1-0-NCHW-FP32-F=miopenConvolutionFwdAlgoWinograd:ConvBinWinogradRxSf2x3,0.1232,0,miopenConvolutionFwdAlgoWinograd,<unused>
1536-10-10-1x1-2048-10-10-1-0x0-1x1-1x1-0-NCHW-FP32-F=miopenConvolutionFwdAlgoDirect:ConvAsm1x1U,0.18496,0,miopenConvolutionFwdAlgoDirect,<unused>;miopenConvolutionFwdAlgoGEMM:gemm,0.17296,0,rocBlas,<unused>;miopenConvolutionFwdAlgoWinograd:ConvBinWinogradRxSf2x3,0.611042,0,miopenConvolutionFwdAlgoWinograd,<unused>
2048-10-10-1x1-512-10-10-1-0x0-1x1-1x1-0-NCHW-FP32-F=miopenConvolutionFwdAlgoDirect:ConvAsm1x1U,0.08064,0,miopenConvolutionFwdAlgoDirect,<unused>;miopenConvolutionFwdAlgoGEMM:gemm,0.08976,0,rocBlas,<unused>;miopenConvolutionFwdAlgoWinograd:ConvBinWinogradRxSf2x3,0.419201,0,miopenConvolutionFwdAlgoWinograd,<unused>
512-10-10-1x1-2048-10-10-1-0x0-1x1-1x1-0-NCHW-FP32-F=miopenConvolutionFwdAlgoDirect:ConvAsm1x1U,0.06752,0,miopenConvolutionFwdAlgoDirect,<unused>;miopenConvolutionFwdAlgoGEMM:gemm,0.06688,0,rocBlas,<unused>;miopenConvolutionFwdAlgoWinograd:ConvBinWinogradRxSf2x3,0.22384,0,miopenConvolutionFwdAlgoWinograd,<unused>
2048-1-1-1x1-1001-1-1-1-0x0-1x1-1x1-0-NCHW-FP32-F=miopenConvolutionFwdAlgoDirect:ConvAsm1x1U,0.10048,0,miopenConvolutionFwdAlgoDirect,<unused>;miopenConvolutionFwdAlgoGEMM:gemm,0.0776,0,rocBlas,<unused>;miopenConvolutionFwdAlgoWinograd:ConvBinWinogradRxSf2x3,0.421441,0,miopenConvolutionFwdAlgoWinograd,<unused>
3-299-299-3x3-32-149-149-1-0x0-2x2-1x1-0-NCHW-FP32-F=miopenConvolutionFwdAlgoDirect:ConvOclDirectFwd,0.03328,0,miopenConvolutionFwdAlgoDirect,<unused>;miopenConvolutionFwdAlgoGEMM:gemm,5.80046,2397708,rocBlas,<unused>;miopenConvolutionFwdAlgoWinograd:ConvBinWinogradRxSf2x3,0.04112,0,miopenConvolutionFwdAlgoWinograd,<unused>
32-149-149-3x3-32-147-147-1-0x0-1x1-1x1-0-NCHW-FP32-F=miopenConvolutionFwdAlgoDirect:ConvOclDirectFwd,0.14352,0,miopenConvolutionFwdAlgoDirect,<unused>;miopenConvolutionFwdAlgoGEMM:gemm,0.14112,24893568,rocBlas,<unused>;miopenConvolutionFwdAlgoWinograd:ConvBinWinogradRxS,0.0464,0,miopenConvolutionFwdAlgoWinograd,<unused>
32-147-147-3x3-64-147-147-1-1x1-1x1-1x1-0-NCHW-FP32-F=miopenConvolutionFwdAlgoWinograd:ConvBinWinogradRxS,0.07168,0,miopenConvolutionFwdAlgoWinograd,<unused>
64-147-147-3x3-96-73-73-1-0x0-2x2-1x1-0-NCHW-FP32-F=miopenConvolutionFwdAlgoDirect:ConvOclDirectFwd,0.418558,0,miopenConvolutionFwdAlgoDirect,<unused>;miopenConvolutionFwdAlgoGEMM:gemm,0.1344,12278016,rocBlas,<unused>;miopenConvolutionFwdAlgoWinograd:ConvBinWinogradRxSf2x3,0.18656,0,miopenConvolutionFwdAlgoWinograd,<unused>
160-73-73-1x1-128-73-73-1-0x0-1x1-1x1-0-NCHW-FP32-F=miopenConvolutionFwdAlgoDirect:ConvAsm1x1U,0.03824,0,miopenConvolutionFwdAlgoDirect,<unused>;miopenConvolutionFwdAlgoGEMM:gemm,0.04208,0,rocBlas,<unused>;miopenConvolutionFwdAlgoWinograd:ConvBinWinogradRxSf3x2,0.10192,0,miopenConvolutionFwdAlgoWinograd,<unused>
64-73-73-1x7-64-73-73-1-0x3-1x1-1x1-0-NCHW-FP32-F=miopenConvolutionFwdAlgoWinograd:ConvBinWinogradRxSf3x2,0.08576,0,miopenConvolutionFwdAlgoWinograd,<unused>;miopenConvolutionFwdAlgoGEMM:gemm,0.0832,9549568,rocBlas,<unused>
64-73-73-7x1-64-73-73-1-3x0-1x1-1x1-0-NCHW-FP32-F=miopenConvolutionFwdAlgoWinograd:ConvBinWinogradRxSf3x2,0.0848,0,miopenConvolutionFwdAlgoWinograd,<unused>;miopenConvolutionFwdAlgoGEMM:gemm,0.08528,9549568,rocBlas,<unused>
64-73-73-3x3-96-71-71-1-0x0-1x1-1x1-0-NCHW-FP32-F=miopenConvolutionFwdAlgoDirect:ConvOclDirectFwd,0.311359,0,miopenConvolutionFwdAlgoDirect,<unused>;miopenConvolutionFwdAlgoGEMM:gemm,0.11584,11614464,rocBlas,<unused>;miopenConvolutionFwdAlgoWinograd:ConvBinWinogradRxSf2x3,0.06448,0,miopenConvolutionFwdAlgoWinograd,<unused>
192-71-71-3x3-192-35-35-1-0x0-2x2-1x1-0-NCHW-FP32-F=miopenConvolutionFwdAlgoDirect:ConvOclDirectFwd,0.869276,0,miopenConvolutionFwdAlgoDirect,<unused>;miopenConvolutionFwdAlgoGEMM:gemm,0.14128,8467200,rocBlas,<unused>;miopenConvolutionFwdAlgoWinograd:ConvBinWinogradRxSf2x3,0.337599,0,miopenConvolutionFwdAlgoWinograd,<unused>
384-35-35-1x1-128-35-35-1-0x0-1x1-1x1-0-NCHW-FP32-F=miopenConvolutionFwdAlgoDirect:ConvAsm1x1U,0.03104,0,miopenConvolutionFwdAlgoDirect,<unused>;miopenConvolutionFwdAlgoGEMM:gemm,0.06608,0,rocBlas,<unused>;miopenConvolutionFwdAlgoWinograd:ConvBinWinogradRxSf2x3,0.09824,0,miopenConvolutionFwdAlgoWinograd,<unused>
384-35-35-1x1-96-35-35-1-0x0-1x1-1x1-0-NCHW-FP32-F=miopenConvolutionFwdAlgoDirect:ConvAsm1x1U,0.02576,0,miopenConvolutionFwdAlgoDirect,<unused>;miopenConvolutionFwdAlgoGEMM:gemm,0.06736,0,rocBlas,<unused>;miopenConvolutionFwdAlgoWinograd:ConvBinWinogradRxSf2x3,0.09824,0,miopenConvolutionFwdAlgoWinograd,<unused>
64-35-35-3x3-96-35-35-1-1x1-1x1-1x1-0-NCHW-FP32-F=miopenConvolutionFwdAlgoWinograd:ConvBinWinogradRxS,0.0352,0,miopenConvolutionFwdAlgoWinograd,<unused>
96-35-35-3x3-96-35-35-1-1x1-1x1-1x1-0-NCHW-FP32-F=miopenConvolutionFwdAlgoWinograd:ConvBinWinograd3x3U,0.0416,0,miopenConvolutionFwdAlgoWinograd,<unused>
384-35-35-1x1-192-35-35-1-0x0-1x1-1x1-0-NCHW-FP32-F=miopenConvolutionFwdAlgoDirect:ConvAsm1x1U,0.03312,0,miopenConvolutionFwdAlgoDirect,<unused>;miopenConvolutionFwdAlgoGEMM:gemm,0.06224,0,rocBlas,<unused>;miopenConvolutionFwdAlgoWinograd:ConvBinWinogradRxSf3x2,0.10928,0,miopenConvolutionFwdAlgoWinograd,<unused>
192-35-35-3x3-224-35-35-1-1x1-1x1-1x1-0-NCHW-FP32-F=miopenConvolutionFwdAlgoWinograd:ConvBinWinogradRxSf2x3,0.09936,0,miopenConvolutionFwdAlgoWinograd,<unused>
224-35-35-3x3-256-17-17-1-0x0-2x2-1x1-0-NCHW-FP32-F=miopenConvolutionFwdAlgoDirect:ConvOclDirectFwd,0.818557,0,miopenConvolutionFwdAlgoDirect,<unused>;miopenConvolutionFwdAlgoGEMM:gemm,0.08288,2330496,rocBlas,<unused>;miopenConvolutionFwdAlgoWinograd:ConvBinWinogradRxSf2x3,0.20656,0,miopenConvolutionFwdAlgoWinograd,<unused>
384-35-35-3x3-384-17-17-1-0x0-2x2-1x1-0-NCHW-FP32-F=miopenConvolutionFwdAlgoDirect:ConvOclDirectFwd,1.50735,0,miopenConvolutionFwdAlgoDirect,<unused>;miopenConvolutionFwdAlgoGEMM:gemm,0.1336,3995136,rocBlas,<unused>;miopenConvolutionFwdAlgoWinograd:ConvBinWinogradRxSf2x3,0.333599,0,miopenConvolutionFwdAlgoWinograd,<unused>
1024-17-17-1x1-768-17-17-1-0x0-1x1-1x1-0-NCHW-FP32-F=miopenConvolutionFwdAlgoDirect:ConvAsm1x1U,0.10064,0,miopenConvolutionFwdAlgoDirect,<unused>;miopenConvolutionFwdAlgoGEMM:gemm,0.08672,0,rocBlas,<unused>;miopenConvolutionFwdAlgoWinograd:ConvBinWinogradRxSf3x2,0.243039,0,miopenConvolutionFwdAlgoWinograd,<unused>
1024-17-17-1x1-128-17-17-1-0x0-1x1-1x1-0-NCHW-FP32-F=miopenConvolutionFwdAlgoDirect:ConvAsm1x1U,0.03424,0,miopenConvolutionFwdAlgoDirect,<unused>;miopenConvolutionFwdAlgoGEMM:gemm,0.0872,0,rocBlas,<unused>;miopenConvolutionFwdAlgoWinograd:ConvBinWinogradRxSf2x3,0.21952,0,miopenConvolutionFwdAlgoWinograd,<unused>
192-17-17-7x1-192-17-17-1-3x0-1x1-1x1-0-NCHW-FP32-F=miopenConvolutionFwdAlgoWinograd:ConvBinWinogradRxSf2x3,0.13488,0,miopenConvolutionFwdAlgoWinograd,<unused>;miopenConvolutionFwdAlgoGEMM:gemm,0.05056,1553664,rocBlas,<unused>
192-17-17-1x7-224-17-17-1-0x3-1x1-1x1-0-NCHW-FP32-F=miopenConvolutionFwdAlgoWinograd:ConvBinWinogradRxSf2x3,0.17104,0,miopenConvolutionFwdAlgoWinograd,<unused>;miopenConvolutionFwdAlgoGEMM:gemm,0.05696,1553664,rocBlas,<unused>
224-17-17-7x1-224-17-17-1-3x0-1x1-1x1-0-NCHW-FP32-F=miopenConvolutionFwdAlgoWinograd:ConvBinWinogradRxSf2x3,0.15344,0,miopenConvolutionFwdAlgoWinograd,<unused>;miopenConvolutionFwdAlgoGEMM:gemm,0.06528,1812608,rocBlas,<unused>
224-17-17-1x7-256-17-17-1-0x3-1x1-1x1-0-NCHW-FP32-F=miopenConvolutionFwdAlgoWinograd:ConvBinWinogradRxSf2x3,0.19584,0,miopenConvolutionFwdAlgoWinograd,<unused>;miopenConvolutionFwdAlgoGEMM:gemm,0.06448,1812608,rocBlas,<unused>
224-17-17-7x1-256-17-17-1-3x0-1x1-1x1-0-NCHW-FP32-F=miopenConvolutionFwdAlgoWinograd:ConvBinWinogradRxSf2x3,0.1528,0,miopenConvolutionFwdAlgoWinograd,<unused>;miopenConvolutionFwdAlgoGEMM:gemm,0.06464,1812608,rocBlas,<unused>
1024-17-17-1x1-256-17-17-1-0x0-1x1-1x1-0-NCHW-FP32-F=miopenConvolutionFwdAlgoDirect:ConvOclDirectFwd1x1,0.05584,0,miopenConvolutionFwdAlgoDirect,<unused>;miopenConvolutionFwdAlgoGEMM:gemm,0.08176,0,rocBlas,<unused>;miopenConvolutionFwdAlgoWinograd:ConvBinWinogradRxSf2x3,0.22016,0,miopenConvolutionFwdAlgoWinograd,<unused>
256-17-17-1x7-256-17-17-1-0x3-1x1-1x1-0-NCHW-FP32-F=miopenConvolutionFwdAlgoWinograd:ConvBinWinogradRxSf2x3,0.2192,0,miopenConvolutionFwdAlgoWinograd,<unused>;miopenConvolutionFwdAlgoGEMM:gemm,0.07216,2071552,rocBlas,<unused>
256-17-17-7x1-320-17-17-1-3x0-1x1-1x1-0-NCHW-FP32-F=miopenConvolutionFwdAlgoWinograd:ConvBinWinogradRxSf2x3,0.17152,0,miopenConvolutionFwdAlgoWinograd,<unused>;miopenConvolutionFwdAlgoGEMM:gemm,0.07376,2071552,rocBlas,<unused>
320-17-17-3x3-320-8-8-1-0x0-2x2-1x1-0-NCHW-FP32-F=miopenConvolutionFwdAlgoImplicitGEMM:ConvHipImplicitGemmV4R4Fwd,0.327359,0,miopenConvolutionFwdAlgoImplicitGEMM,<unused>;miopenConvolutionFwdAlgoDirect:ConvOclDirectFwd,0.917117,0,miopenConvolutionFwdAlgoDirect,<unused>;miopenConvolutionFwdAlgoGEMM:gemm,0.068,737280,rocBlas,<unused>;miopenConvolutionFwdAlgoWinograd:ConvBinWinogradRxSf2x3,0.281919,0,miopenConvolutionFwdAlgoWinograd,<unused>
1024-17-17-1x1-192-17-17-1-0x0-1x1-1x1-0-NCHW-FP32-F=miopenConvolutionFwdAlgoDirect:ConvOclDirectFwd1x1,0.04864,0,miopenConvolutionFwdAlgoDirect,<unused>;miopenConvolutionFwdAlgoGEMM:gemm,0.0824,0,rocBlas,<unused>;miopenConvolutionFwdAlgoWinograd:ConvBinWinogradRxSf2x3,0.21888,0,miopenConvolutionFwdAlgoWinograd,<unused>
192-17-17-3x3-192-8-8-1-0x0-2x2-1x1-0-NCHW-FP32-F=miopenConvolutionFwdAlgoImplicitGEMM:ConvHipImplicitGemmV4R4Fwd,0.20064,0,miopenConvolutionFwdAlgoImplicitGEMM,<unused>;miopenConvolutionFwdAlgoDirect:ConvOclDirectFwd,0.545598,0,miopenConvolutionFwdAlgoDirect,<unused>;miopenConvolutionFwdAlgoGEMM:gemm,0.05376,442368,rocBlas,<unused>;miopenConvolutionFwdAlgoWinograd:ConvBinWinogradRxSf2x3,0.17984,0,miopenConvolutionFwdAlgoWinograd,<unused>
1536-8-8-1x1-768-8-8-1-0x0-1x1-1x1-0-NCHW-FP32-F=miopenConvolutionFwdAlgoImplicitGEMM:ConvHipImplicitGemmV4R4Fwd,0.20144,0,miopenConvolutionFwdAlgoImplicitGEMM,<unused>;miopenConvolutionFwdAlgoDirect:ConvOclDirectFwd1x1,0.0648,0,miopenConvolutionFwdAlgoDirect,<unused>;miopenConvolutionFwdAlgoGEMM:gemm,0.06592,0,rocBlas,<unused>;miopenConvolutionFwdAlgoWinograd:ConvBinWinogradRxSf2x3,0.317599,0,miopenConvolutionFwdAlgoWinograd,<unused>
1536-8-8-1x1-256-8-8-1-0x0-1x1-1x1-0-NCHW-FP32-F=miopenConvolutionFwdAlgoImplicitGEMM:ConvHipImplicitGemmV4R4Fwd,0.16624,0,miopenConvolutionFwdAlgoImplicitGEMM,<unused>;miopenConvolutionFwdAlgoDirect:ConvAsm1x1U,0.04896,0,miopenConvolutionFwdAlgoDirect,<unused>;miopenConvolutionFwdAlgoGEMM:gemm,0.03968,0,rocBlas,<unused>;miopenConvolutionFwdAlgoWinograd:ConvBinWinogradRxSf2x3,0.316479,0,miopenConvolutionFwdAlgoWinograd,<unused>
384-8-8-3x1-448-8-8-1-1x0-1x1-1x1-0-NCHW-FP32-F=miopenConvolutionFwdAlgoImplicitGEMM:ConvHipImplicitGemmV4R4Fwd,0.14192,0,miopenConvolutionFwdAlgoImplicitGEMM,<unused>;miopenConvolutionFwdAlgoGEMM:gemm,0.0408,294912,rocBlas,<unused>;miopenConvolutionFwdAlgoWinograd:ConvBinWinogradRxSf2x3,0.09824,0,miopenConvolutionFwdAlgoWinograd,<unused>
448-8-8-1x3-512-8-8-1-0x1-1x1-1x1-0-NCHW-FP32-F=miopenConvolutionFwdAlgoImplicitGEMM:ConvHipImplicitGemmV4R4Fwd,0.17296,0,miopenConvolutionFwdAlgoImplicitGEMM,<unused>;miopenConvolutionFwdAlgoGEMM:gemm,0.0488,344064,rocBlas,<unused>;miopenConvolutionFwdAlgoWinograd:ConvBinWinogradRxSf2x3,0.10976,0,miopenConvolutionFwdAlgoWinograd,<unused>
512-8-8-3x1-256-8-8-1-1x0-1x1-1x1-0-NCHW-FP32-F=miopenConvolutionFwdAlgoImplicitGEMM:ConvHipImplicitGemmV4R4Fwd,0.18848,0,miopenConvolutionFwdAlgoImplicitGEMM,<unused>;miopenConvolutionFwdAlgoGEMM:gemm,0.04816,393216,rocBlas,<unused>;miopenConvolutionFwdAlgoWinograd:ConvBinWinogradRxSf2x3,0.1216,0,miopenConvolutionFwdAlgoWinograd,<unused>
512-8-8-1x3-256-8-8-1-0x1-1x1-1x1-0-NCHW-FP32-F=miopenConvolutionFwdAlgoImplicitGEMM:ConvHipImplicitGemmV4R4Fwd,0.1936,0,miopenConvolutionFwdAlgoImplicitGEMM,<unused>;miopenConvolutionFwdAlgoGEMM:gemm,0.0472,393216,rocBlas,<unused>;miopenConvolutionFwdAlgoWinograd:ConvBinWinogradRxSf2x3,0.12208,0,miopenConvolutionFwdAlgoWinograd,<unused>
384-8-8-3x1-256-8-8-1-1x0-1x1-1x1-0-NCHW-FP32-F=miopenConvolutionFwdAlgoImplicitGEMM:ConvHipImplicitGemmV4R4Fwd,0.14128,0,miopenConvolutionFwdAlgoImplicitGEMM,<unused>;miopenConvolutionFwdAlgoGEMM:gemm,0.03856,294912,rocBlas,<unused>;miopenConvolutionFwdAlgoWinograd:ConvBinWinogradRxSf2x3,0.0976,0,miopenConvolutionFwdAlgoWinograd,<unused>
384-8-8-1x3-256-8-8-1-0x1-1x1-1x1-0-NCHW-FP32-F=miopenConvolutionFwdAlgoImplicitGEMM:ConvHipImplicitGemmV4R4Fwd,0.14896,0,miopenConvolutionFwdAlgoImplicitGEMM,<unused>;miopenConvolutionFwdAlgoGEMM:gemm,0.03856,294912,rocBlas,<unused>;miopenConvolutionFwdAlgoWinograd:ConvBinWinogradRxSf2x3,0.09744,0,miopenConvolutionFwdAlgoWinograd,<unused>
3-225-225-3x3-48-112-112-1-0x0-2x2-1x1-0-NCHW-FP32-F=miopenConvolutionFwdAlgoDirect:ConvOclDirectFwd,0.02736,0,miopenConvolutionFwdAlgoDirect,<unused>;miopenConvolutionFwdAlgoGEMM:gemm,5.62174,1354752,rocBlas,<unused>;miopenConvolutionFwdAlgoWinograd:ConvBinWinogradRxSf2x3,0.04288,0,miopenConvolutionFwdAlgoWinograd,<unused>
48-112-112-3x3-48-112-112-1-1x1-1x1-1x1-0-NCHW-FP32-F_g48=miopenConvolutionFwdAlgoDirect:ConvOclDirectFwd,0.01728,0,miopenConvolutionFwdAlgoDirect,<unused>;miopenConvolutionFwdAlgoGEMM:gemm,0.14672,21676032,rocBlas,<unused>;miopenConvolutionFwdAlgoWinograd:ConvBinWinogradRxSf2x3,0.24256,0,miopenConvolutionFwdAlgoWinograd,<unused>
48-112-112-1x1-24-112-112-1-0x0-1x1-1x1-0-NCHW-FP32-F=miopenConvolutionFwdAlgoDirect:ConvOclDirectFwd1x1,0.01136,0,miopenConvolutionFwdAlgoDirect,<unused>;miopenConvolutionFwdAlgoGEMM:gemm,0.02288,0,rocBlas,<unused>;miopenConvolutionFwdAlgoWinograd:ConvBinWinogradRxSf3x2,0.03968,0,miopenConvolutionFwdAlgoWinograd,<unused>
24-112-112-1x1-144-112-112-1-0x0-1x1-1x1-0-NCHW-FP32-F=miopenConvolutionFwdAlgoDirect:ConvOclDirectFwd1x1,0.02064,0,miopenConvolutionFwdAlgoDirect,<unused>;miopenConvolutionFwdAlgoGEMM:gemm,0.03216,0,rocBlas,<unused>;miopenConvolutionFwdAlgoWinograd:ConvBinWinogradRxSf3x2,0.06448,0,miopenConvolutionFwdAlgoWinograd,<unused>
144-113-113-3x3-144-56-56-1-0x0-2x2-1x1-0-NCHW-FP32-F_g144=miopenConvolutionFwdAlgoDirect:ConvOclDirectFwd,0.02896,0,miopenConvolutionFwdAlgoDirect,<unused>;miopenConvolutionFwdAlgoGEMM:gemm,0.13168,16257024,rocBlas,<unused>;miopenConvolutionFwdAlgoWinograd:ConvBinWinogradRxSf2x3,0.29664,0,miopenConvolutionFwdAlgoWinograd,<unused>
144-56-56-1x1-32-56-56-1-0x0-1x1-1x1-0-NCHW-FP32-F=miopenConvolutionFwdAlgoImplicitGEMM:ConvHipImplicitGemmV4R4Fwd,0.02384,0,miopenConvolutionFwdAlgoImplicitGEMM,<unused>;miopenConvolutionFwdAlgoDirect:ConvAsm1x1U,0.01472,0,miopenConvolutionFwdAlgoDirect,<unused>;miopenConvolutionFwdAlgoGEMM:gemm,0.0368,0,rocBlas,<unused>;miopenConvolutionFwdAlgoWinograd:ConvBinWinogradRxSf2x3,0.05024,0,miopenConvolutionFwdAlgoWinograd,<unused>
32-56-56-1x1-192-56-56-1-0x0-1x1-1x1-0-NCHW-FP32-F=miopenConvolutionFwdAlgoImplicitGEMM:ConvHipImplicitGemmV4R4Fwd,0.01488,0,miopenConvolutionFwdAlgoImplicitGEMM,<unused>;miopenConvolutionFwdAlgoDirect:ConvOclDirectFwd1x1,0.01328,0,miopenConvolutionFwdAlgoDirect,<unused>;miopenConvolutionFwdAlgoGEMM:gemm,0.01504,0,rocBlas,<unused>;miopenConvolutionFwdAlgoWinograd:ConvBinWinogradRxS,0.04608,0,miopenConvolutionFwdAlgoWinograd,<unused>
192-56-56-3x3-192-56-56-1-1x1-1x1-1x1-0-NCHW-FP32-F_g192=miopenConvolutionFwdAlgoDirect:ConvOclDirectFwd,0.01776,0,miopenConvolutionFwdAlgoDirect,<unused>;miopenConvolutionFwdAlgoGEMM:gemm,0.15216,21676032,rocBlas,<unused>;miopenConvolutionFwdAlgoWinograd:ConvBinWinogradRxSf2x3,0.28128,0,miopenConvolutionFwdAlgoWinograd,<unused>
192-56-56-1x1-32-56-56-1-0x0-1x1-1x1-0-NCHW-FP32-F=miopenConvolutionFwdAlgoImplicitGEMM:ConvHipImplicitGemmV4R4Fwd,0.03056,0,miopenConvolutionFwdAlgoImplicitGEMM,<unused>;miopenConvolutionFwdAlgoDirect:ConvAsm1x1U,0.01584,0,miopenConvolutionFwdAlgoDirect,<unused>;miopenConvolutionFwdAlgoGEMM:gemm,0.0464,0,rocBlas,<unused>;miopenConvolutionFwdAlgoWinograd:ConvBinWinogradRxSf2x3,0.05936,0,miopenConvolutionFwdAlgoWinograd,<unused>
192-57-57-3x3-192-28-28-1-0x0-2x2-1x1-0-NCHW-FP32-F_g192=miopenConvolutionFwdAlgoDirect:ConvOclDirectFwd,0.01376,0,miopenConvolutionFwdAlgoDirect,<unused>;miopenConvolutionFwdAlgoGEMM:gemm,0.07376,5419008,rocBlas,<unused>;miopenConvolutionFwdAlgoWinograd:ConvBinWinogradRxSf2x3,0.14768,0,miopenConvolutionFwdAlgoWinograd,<unused>
192-28-28-1x1-48-28-28-1-0x0-1x1-1x1-0-NCHW-FP32-F=miopenConvolutionFwdAlgoDirect:ConvAsm1x1U,0.012,0,miopenConvolutionFwdAlgoDirect,<unused>;miopenConvolutionFwdAlgoGEMM:gemm,0.03136,0,rocBlas,<unused>;miopenConvolutionFwdAlgoWinograd:ConvBinWinogradRxS,0.06048,0,miopenConvolutionFwdAlgoWinograd,<unused>
48-28-28-1x1-288-28-28-1-0x0-1x1-1x1-0-NCHW-FP32-F=miopenConvolutionFwdAlgoDirect:ConvAsm1x1U,0.01072,0,miopenConvolutionFwdAlgoDirect,<unused>;miopenConvolutionFwdAlgoGEMM:gemm,0.0192,0,rocBlas,<unused>;miopenConvolutionFwdAlgoWinograd:ConvBinWinogradRxSf3x2,0.04144,0,miopenConvolutionFwdAlgoWinograd,<unused>
288-28-28-3x3-288-28-28-1-1x1-1x1-1x1-0-NCHW-FP32-F_g288=miopenConvolutionFwdAlgoDirect:ConvOclDirectFwd,0.00976,0,miopenConvolutionFwdAlgoDirect,<unused>;miopenConvolutionFwdAlgoGEMM:gemm,0.09168,8128512,rocBlas,<unused>;miopenConvolutionFwdAlgoWinograd:ConvBinWinogradRxSf2x3,0.13872,0,miopenConvolutionFwdAlgoWinograd,<unused>
288-28-28-1x1-48-28-28-1-0x0-1x1-1x1-0-NCHW-FP32-F=miopenConvolutionFwdAlgoDirect:ConvAsm1x1U,0.01376,0,miopenConvolutionFwdAlgoDirect,<unused>;miopenConvolutionFwdAlgoGEMM:gemm,0.03968,0,rocBlas,<unused>;miopenConvolutionFwdAlgoWinograd:ConvBinWinogradRxSf2x3,0.07872,0,miopenConvolutionFwdAlgoWinograd,<unused>
288-29-29-3x3-288-14-14-1-0x0-2x2-1x1-0-NCHW-FP32-F_g288=miopenConvolutionFwdAlgoDirect:ConvOclDirectFwd,0.00928,0,miopenConvolutionFwdAlgoDirect,<unused>;miopenConvolutionFwdAlgoGEMM:gemm,0.03168,2032128,rocBlas,<unused>;miopenConvolutionFwdAlgoWinograd:ConvBinWinogradRxSf2x3,0.0912,0,miopenConvolutionFwdAlgoWinograd,<unused>
288-14-14-1x1-88-14-14-1-0x0-1x1-1x1-0-NCHW-FP32-F=miopenConvolutionFwdAlgoDirect:ConvAsm1x1U,0.01344,0,miopenConvolutionFwdAlgoDirect,<unused>;miopenConvolutionFwdAlgoGEMM:gemm,0.02544,0,rocBlas,<unused>;miopenConvolutionFwdAlgoWinograd:ConvBinWinogradRxSf2x3,0.07952,0,miopenConvolutionFwdAlgoWinograd,<unused>
88-14-14-1x1-528-14-14-1-0x0-1x1-1x1-0-NCHW-FP32-F=miopenConvolutionFwdAlgoDirect:ConvOclDirectFwd1x1,0.01184,0,miopenConvolutionFwdAlgoDirect,<unused>;miopenConvolutionFwdAlgoGEMM:gemm,0.01488,0,rocBlas,<unused>;miopenConvolutionFwdAlgoWinograd:ConvBinWinogradRxS,0.03984,0,miopenConvolutionFwdAlgoWinograd,<unused>
528-14-14-3x3-528-14-14-1-1x1-1x1-1x1-0-NCHW-FP32-F_g528=miopenConvolutionFwdAlgoDirect:ConvOclDirectFwd,0.00784,0,miopenConvolutionFwdAlgoDirect,<unused>;miopenConvolutionFwdAlgoGEMM:gemm,0.03376,3725568,rocBlas,<unused>;miopenConvolutionFwdAlgoWinograd:ConvBinWinogradRxSf2x3,0.13008,0,miopenConvolutionFwdAlgoWinograd,<unused>
528-14-14-1x1-88-14-14-1-0x0-1x1-1x1-0-NCHW-FP32-F=miopenConvolutionFwdAlgoDirect:ConvAsm1x1U,0.01984,0,miopenConvolutionFwdAlgoDirect,<unused>;miopenConvolutionFwdAlgoGEMM:gemm,0.02128,0,rocBlas,<unused>;miopenConvolutionFwdAlgoWinograd:ConvBinWinogradRxSf2x3,0.12528,0,miopenConvolutionFwdAlgoWinograd,<unused>
528-14-14-1x1-136-14-14-1-0x0-1x1-1x1-0-NCHW-FP32-F=miopenConvolutionFwdAlgoDirect:ConvAsm1x1U,0.02,0,miopenConvolutionFwdAlgoDirect,<unused>;miopenConvolutionFwdAlgoGEMM:gemm,0.02224,0,rocBlas,<unused>;miopenConvolutionFwdAlgoWinograd:ConvBinWinogradRxSf2x3,0.12432,0,miopenConvolutionFwdAlgoWinograd,<unused>
136-14-14-1x1-816-14-14-1-0x0-1x1-1x1-0-NCHW-FP32-F=miopenConvolutionFwdAlgoDirect:ConvOclDirectFwd1x1,0.01632,0,miopenConvolutionFwdAlgoDirect,<unused>;miopenConvolutionFwdAlgoGEMM:gemm,0.02528,0,rocBlas,<unused>;miopenConvolutionFwdAlgoWinograd:ConvBinWinogradRxS,0.05008,0,miopenConvolutionFwdAlgoWinograd,<unused>
816-14-14-3x3-816-14-14-1-1x1-1x1-1x1-0-NCHW-FP32-F_g816=miopenConvolutionFwdAlgoDirect:ConvOclDirectFwd,0.00928,0,miopenConvolutionFwdAlgoDirect,<unused>;miopenConvolutionFwdAlgoGEMM:gemm,0.04544,5757696,rocBlas,<unused>;miopenConvolutionFwdAlgoWinograd:ConvBinWinogradRxSf2x3,0.19392,0,miopenConvolutionFwdAlgoWinograd,<unused>
816-14-14-1x1-136-14-14-1-0x0-1x1-1x1-0-NCHW-FP32-F=miopenConvolutionFwdAlgoDirect:ConvAsm1x1U,0.02768,0,miopenConvolutionFwdAlgoDirect,<unused>;miopenConvolutionFwdAlgoGEMM:gemm,0.0296,0,rocBlas,<unused>;miopenConvolutionFwdAlgoWinograd:ConvBinWinogradRxSf2x3,0.1784,0,miopenConvolutionFwdAlgoWinograd,<unused>
816-15-15-3x3-816-7-7-1-0x0-2x2-1x1-0-NCHW-FP32-F_g816=miopenConvolutionFwdAlgoDirect:ConvOclDirectFwd,0.00928,0,miopenConvolutionFwdAlgoDirect,<unused>;miopenConvolutionFwdAlgoGEMM:gemm,0.03088,1439424,rocBlas,<unused>;miopenConvolutionFwdAlgoWinograd:ConvBinWinogradRxSf2x3,0.1768,0,miopenConvolutionFwdAlgoWinograd,<unused>
816-7-7-1x1-224-7-7-1-0x0-1x1-1x1-0-NCHW-FP32-F=miopenConvolutionFwdAlgoDirect:ConvAsm1x1U,0.02688,0,miopenConvolutionFwdAlgoDirect,<unused>;miopenConvolutionFwdAlgoGEMM:gemm,0.02496,0,rocBlas,<unused>;miopenConvolutionFwdAlgoWinograd:ConvBinWinogradRxSf2x3,0.17984,0,miopenConvolutionFwdAlgoWinograd,<unused>
224-7-7-1x1-1344-7-7-1-0x0-1x1-1x1-0-NCHW-FP32-F=miopenConvolutionFwdAlgoDirect:ConvAsm1x1U,0.02016,0,miopenConvolutionFwdAlgoDirect,<unused>;miopenConvolutionFwdAlgoGEMM:gemm,0.03536,0,rocBlas,<unused>;miopenConvolutionFwdAlgoWinograd:ConvBinWinogradRxSf2x3,0.06752,0,miopenConvolutionFwdAlgoWinograd,<unused>
1344-7-7-3x3-1344-7-7-1-1x1-1x1-1x1-0-NCHW-FP32-F_g1344=miopenConvolutionFwdAlgoDirect:ConvOclDirectFwd,0.008,0,miopenConvolutionFwdAlgoDirect,<unused>;miopenConvolutionFwdAlgoGEMM:gemm,0.02816,2370816,rocBlas,<unused>;miopenConvolutionFwdAlgoWinograd:ConvBinWinogradRxSf2x3,0.2496,0,miopenConvolutionFwdAlgoWinograd,<unused>
1344-7-7-1x1-224-7-7-1-0x0-1x1-1x1-0-NCHW-FP32-F=miopenConvolutionFwdAlgoDirect:ConvOclDirectFwd1x1,0.03312,0,miopenConvolutionFwdAlgoDirect,<unused>;miopenConvolutionFwdAlgoGEMM:gemm,0.03408,0,rocBlas,<unused>;miopenConvolutionFwdAlgoWinograd:ConvBinWinogradRxSf2x3,0.28032,0,miopenConvolutionFwdAlgoWinograd,<unused>
1344-7-7-1x1-448-7-7-1-0x0-1x1-1x1-0-NCHW-FP32-F=miopenConvolutionFwdAlgoDirect:ConvOclDirectFwd1x1,0.03728,0,miopenConvolutionFwdAlgoDirect,<unused>;miopenConvolutionFwdAlgoGEMM:gemm,0.04112,0,rocBlas,<unused>;miopenConvolutionFwdAlgoWinograd:ConvBinWinogradRxSf2x3,0.28,0,miopenConvolutionFwdAlgoWinograd,<unused>
448-7-7-1x1-1792-7-7-1-0x0-1x1-1x1-0-NCHW-FP32-F=miopenConvolutionFwdAlgoDirect:ConvOclDirectFwd1x1,0.03712,0,miopenConvolutionFwdAlgoDirect,<unused>;miopenConvolutionFwdAlgoGEMM:gemm,0.04624,0,rocBlas,<unused>;miopenConvolutionFwdAlgoWinograd:ConvBinWinogradRxSf2x3,0.11072,0,miopenConvolutionFwdAlgoWinograd,<unused>
1792-1-1-1x1-1001-1-1-1-0x0-1x1-1x1-0-NCHW-FP32-F=miopenConvolutionFwdAlgoDirect:ConvOclDirectFwd1x1,0.08784,0,miopenConvolutionFwdAlgoDirect,<unused>;miopenConvolutionFwdAlgoGEMM:gemm,0.04944,0,rocBlas,<unused>;miopenConvolutionFwdAlgoWinograd:ConvBinWinogradRxSf2x3,0.364799,0,miopenConvolutionFwdAlgoWinograd,<unused>
3-1-1-7x7-64-1-1-1-3x3-2x2-1x1-0-NCHW-FP32-F=miopenConvolutionFwdAlgoDirect:ConvOclDirectFwd,0.00864,0,miopenConvolutionFwdAlgoDirect,<unused>;miopenConvolutionFwdAlgoGEMM:gemm,0.03952,588,rocBlas,<unused>;miopenConvolutionFwdAlgoWinograd:ConvBinWinogradRxS,0.03264,0,miopenConvolutionFwdAlgoWinograd,<unused>
64-1-1-1x1-64-1-1-1-0x0-1x1-1x1-0-NCHW-FP32-F=miopenConvolutionFwdAlgoDirect:ConvAsm1x1U,0.00832,0,miopenConvolutionFwdAlgoDirect,<unused>;miopenConvolutionFwdAlgoGEMM:gemm,0.01712,0,rocBlas,<unused>;miopenConvolutionFwdAlgoWinograd:ConvBinWinogradRxS,0.03616,0,miopenConvolutionFwdAlgoWinograd,<unused>
64-1-1-3x3-64-1-1-1-1x1-1x1-1x1-0-NCHW-FP32-F=miopenConvolutionFwdAlgoWinograd:ConvBinWinograd3x3U,0.03408,0,miopenConvolutionFwdAlgoWinograd,<unused>
128-1-1-1x1-256-1-1-1-0x0-1x1-1x1-0-NCHW-FP32-F=miopenConvolutionFwdAlgoDirect:ConvAsm1x1U,0.00944,0,miopenConvolutionFwdAlgoDirect,<unused>;miopenConvolutionFwdAlgoGEMM:gemm,0.0248,0,rocBlas,<unused>;miopenConvolutionFwdAlgoWinograd:ConvBinWinogradRxSf2x3,0.04896,0,miopenConvolutionFwdAlgoWinograd,<unused>
256-1-1-1x1-64-1-1-1-0x0-1x1-1x1-0-NCHW-FP32-F=miopenConvolutionFwdAlgoDirect:ConvAsm1x1U,0.012,0,miopenConvolutionFwdAlgoDirect,<unused>;miopenConvolutionFwdAlgoGEMM:gemm,0.03808,0,rocBlas,<unused>;miopenConvolutionFwdAlgoWinograd:ConvBinWinogradRxSf2x3,0.0744,0,miopenConvolutionFwdAlgoWinograd,<unused>
64-1-1-1x1-256-1-1-1-0x0-1x1-1x1-0-NCHW-FP32-F=miopenConvolutionFwdAlgoDirect:ConvAsm1x1U,0.00896,0,miopenConvolutionFwdAlgoDirect,<unused>;miopenConvolutionFwdAlgoGEMM:gemm,0.01456,0,rocBlas,<unused>;miopenConvolutionFwdAlgoWinograd:ConvBinWinogradRxS,0.03616,0,miopenConvolutionFwdAlgoWinograd,<unused>
256-1-1-1x1-128-1-1-1-0x0-2x2-1x1-0-NCHW-FP32-F=miopenConvolutionFwdAlgoDirect:ConvAsm1x1U,0.0152,1024,miopenConvolutionFwdAlgoDirect,<unused>;miopenConvolutionFwdAlgoGEMM:gemm,0.04448,1536,rocBlas,<unused>;miopenConvolutionFwdAlgoWinograd:ConvBinWinogradRxSf2x3,0.12832,0,miopenConvolutionFwdAlgoWinograd,<unused>
128-1-1-3x3-128-1-1-1-1x1-1x1-1x1-0-NCHW-FP32-F=miopenConvolutionFwdAlgoWinograd:ConvBinWinograd3x3U,0.04736,0,miopenConvolutionFwdAlgoWinograd,<unused>
384-1-1-1x1-512-1-1-1-0x0-1x1-1x1-0-NCHW-FP32-F=miopenConvolutionFwdAlgoDirect:ConvAsm1x1U,0.01584,0,miopenConvolutionFwdAlgoDirect,<unused>;miopenConvolutionFwdAlgoGEMM:gemm,0.04928,0,rocBlas,<unused>;miopenConvolutionFwdAlgoWinograd:ConvBinWinogradRxSf2x3,0.09888,0,miopenConvolutionFwdAlgoWinograd,<unused>
512-1-1-1x1-128-1-1-1-0x0-1x1-1x1-0-NCHW-FP32-F=miopenConvolutionFwdAlgoDirect:ConvAsm1x1U,0.01728,0,miopenConvolutionFwdAlgoDirect,<unused>;miopenConvolutionFwdAlgoGEMM:gemm,0.06352,0,rocBlas,<unused>;miopenConvolutionFwdAlgoWinograd:ConvBinWinogradRxSf2x3,0.12176,0,miopenConvolutionFwdAlgoWinograd,<unused>
128-1-1-1x1-512-1-1-1-0x0-1x1-1x1-0-NCHW-FP32-F=miopenConvolutionFwdAlgoDirect:ConvAsm1x1U,0.0104,0,miopenConvolutionFwdAlgoDirect,<unused>;miopenConvolutionFwdAlgoGEMM:gemm,0.02048,0,rocBlas,<unused>;miopenConvolutionFwdAlgoWinograd:ConvBinWinogradRxSf2x3,0.04928,0,miopenConvolutionFwdAlgoWinograd,<unused>
512-1-1-1x1-256-1-1-1-0x0-2x2-1x1-0-NCHW-FP32-F=miopenConvolutionFwdAlgoDirect:ConvAsm1x1U,0.0208,2048,miopenConvolutionFwdAlgoDirect,<unused>;miopenConvolutionFwdAlgoGEMM:gemm,0.07088,3072,rocBlas,<unused>;miopenConvolutionFwdAlgoWinograd:ConvBinWinogradRxSf2x3,0.23104,0,miopenConvolutionFwdAlgoWinograd,<unused>
256-1-1-3x3-256-1-1-1-1x1-1x1-1x1-0-NCHW-FP32-F=miopenConvolutionFwdAlgoWinograd:ConvBinWinogradRxSf2x3,0.07264,0,miopenConvolutionFwdAlgoWinograd,<unused>
768-1-1-1x1-1024-1-1-1-0x0-1x1-1x1-0-NCHW-FP32-F=miopenConvolutionFwdAlgoDirect:ConvOclDirectFwd1x1,0.03792,0,miopenConvolutionFwdAlgoDirect,<unused>;miopenConvolutionFwdAlgoGEMM:gemm,0.088,0,rocBlas,<unused>;miopenConvolutionFwdAlgoWinograd:ConvBinWinogradRxSf2x3,0.17104,0,miopenConvolutionFwdAlgoWinograd,<unused>
1024-1-1-1x1-256-1-1-1-0x0-1x1-1x1-0-NCHW-FP32-F=miopenConvolutionFwdAlgoDirect:ConvAsm1x1U,0.02912,0,miopenConvolutionFwdAlgoDirect,<unused>;miopenConvolutionFwdAlgoGEMM:gemm,0.03184,0,rocBlas,<unused>;miopenConvolutionFwdAlgoWinograd:ConvBinWinogradRxSf2x3,0.21968,0,miopenConvolutionFwdAlgoWinograd,<unused>
256-1-1-1x1-1024-1-1-1-0x0-1x1-1x1-0-NCHW-FP32-F=miopenConvolutionFwdAlgoDirect:ConvAsm1x1U,0.0176,0,miopenConvolutionFwdAlgoDirect,<unused>;miopenConvolutionFwdAlgoGEMM:gemm,0.0328,0,rocBlas,<unused>;miopenConvolutionFwdAlgoWinograd:ConvBinWinogradRxSf2x3,0.07376,0,miopenConvolutionFwdAlgoWinograd,<unused>
1024-1-1-1x1-512-1-1-1-0x0-2x2-1x1-0-NCHW-FP32-F=miopenConvolutionFwdAlgoDirect:ConvAsm1x1U,0.0368,4096,miopenConvolutionFwdAlgoDirect,<unused>;miopenConvolutionFwdAlgoGEMM:gemm,0.126239,6144,rocBlas,<unused>;miopenConvolutionFwdAlgoWinograd:ConvBinWinogradRxSf2x3,0.43632,0,miopenConvolutionFwdAlgoWinograd,<unused>
512-1-1-3x3-512-1-1-1-1x1-1x1-1x1-0-NCHW-FP32-F=miopenConvolutionFwdAlgoWinograd:ConvBinWinogradRxSf2x3,0.12272,0,miopenConvolutionFwdAlgoWinograd,<unused>
1536-1-1-1x1-2048-1-1-1-0x0-1x1-1x1-0-NCHW-FP32-F=miopenConvolutionFwdAlgoDirect:ConvOclDirectFwd1x1,0.11104,0,miopenConvolutionFwdAlgoDirect,<unused>;miopenConvolutionFwdAlgoGEMM:gemm,0.2328,0,rocBlas,<unused>;miopenConvolutionFwdAlgoWinograd:ConvBinWinogradRxSf2x3,0.610719,0,miopenConvolutionFwdAlgoWinograd,<unused>
2048-1-1-1x1-512-1-1-1-0x0-1x1-1x1-0-NCHW-FP32-F=miopenConvolutionFwdAlgoDirect:ConvOclDirectFwd1x1,0.05424,0,miopenConvolutionFwdAlgoDirect,<unused>;miopenConvolutionFwdAlgoGEMM:gemm,0.05264,0,rocBlas,<unused>;miopenConvolutionFwdAlgoWinograd:ConvBinWinogradRxSf2x3,0.41728,0,miopenConvolutionFwdAlgoWinograd,<unused>
512-1-1-1x1-2048-1-1-1-0x0-1x1-1x1-0-NCHW-FP32-F=miopenConvolutionFwdAlgoDirect:ConvOclDirectFwd1x1,0.0504,0,miopenConvolutionFwdAlgoDirect,<unused>;miopenConvolutionFwdAlgoGEMM:gemm,0.14944,0,rocBlas,<unused>;miopenConvolutionFwdAlgoWinograd:ConvBinWinogradRxSf2x3,0.22352,0,miopenConvolutionFwdAlgoWinograd,<unused>
2048-1-1-1x1-256-1-1-1-0x0-1x1-1x1-0-NCHW-FP32-F=miopenConvolutionFwdAlgoDirect:ConvOclDirectFwd1x1,0.04704,0,miopenConvolutionFwdAlgoDirect,<unused>;miopenConvolutionFwdAlgoGEMM:gemm,0.0416,0,rocBlas,<unused>;miopenConvolutionFwdAlgoWinograd:ConvBinWinogradRxSf2x3,0.41648,0,miopenConvolutionFwdAlgoWinograd,<unused>
256-1-1-1x1-3-1-1-1-0x0-1x1-1x1-0-NCHW-FP32-F=miopenConvolutionFwdAlgoDirect:ConvAsm1x1U,0.0072,0,miopenConvolutionFwdAlgoDirect,<unused>;miopenConvolutionFwdAlgoGEMM:gemm,0.04,0,rocBlas,<unused>;miopenConvolutionFwdAlgoWinograd:ConvBinWinogradRxS,0.07168,0,miopenConvolutionFwdAlgoWinograd,<unused>
3-800-1088-7x7-64-400-544-1-3x3-2x2-1x1-0-NCHW-FP32-F=miopenConvolutionFwdAlgoDirect:ConvOclDirectFwdGen,0.779359,0,miopenConvolutionFwdAlgoDirect,<unused>;miopenConvolutionFwdAlgoGEMM:gemm,0.6992,127948800,rocBlas,<unused>;miopenConvolutionFwdAlgoWinograd:ConvBinWinogradRxS,0.709599,0,miopenConvolutionFwdAlgoWinograd,<unused>
64-200-272-1x1-64-200-272-1-0x0-1x1-1x1-0-NCHW-FP32-F=miopenConvolutionFwdAlgoImplicitGEMM:ConvHipImplicitGemmV4R4Fwd,0.06928,0,miopenConvolutionFwdAlgoImplicitGEMM,<unused>;miopenConvolutionFwdAlgoDirect:ConvOclDirectFwd1x1,0.06304,0,miopenConvolutionFwdAlgoDirect,<unused>;miopenConvolutionFwdAlgoGEMM:gemm,0.06624,0,rocBlas,<unused>;miopenConvolutionFwdAlgoWinograd:ConvBinWinogradRxSf3x2,0.1552,0,miopenConvolutionFwdAlgoWinograd,<unused>
64-200-272-3x3-64-200-272-1-1x1-1x1-1x1-0-NCHW-FP32-F=miopenConvolutionFwdAlgoWinograd:ConvBinWinograd3x3U,0.23584,0,miopenConvolutionFwdAlgoWinograd,<unused>
128-200-272-1x1-256-200-272-1-0x0-1x1-1x1-0-NCHW-FP32-F=miopenConvolutionFwdAlgoImplicitGEMM:ConvHipImplicitGemmV4R4Fwd,0.37456,0,miopenConvolutionFwdAlgoImplicitGEMM,<unused>;miopenConvolutionFwdAlgoDirect:ConvOclDirectFwd1x1,0.39408,0,miopenConvolutionFwdAlgoDirect,<unused>;miopenConvolutionFwdAlgoGEMM:gemm,0.34224,0,rocBlas,<unused>;miopenConvolutionFwdAlgoWinograd:ConvBinWinogradRxSf3x2,0.816159,0,miopenConvolutionFwdAlgoWinograd,<unused>
256-200-272-1x1-64-200-272-1-0x0-1x1-1x1-0-NCHW-FP32-F=miopenConvolutionFwdAlgoImplicitGEMM:ConvHipImplicitGemmV4R4Fwd,0.21264,0,miopenConvolutionFwdAlgoImplicitGEMM,<unused>;miopenConvolutionFwdAlgoDirect:ConvOclDirectFwd1x1,0.22304,0,miopenConvolutionFwdAlgoDirect,<unused>;miopenConvolutionFwdAlgoGEMM:gemm,0.19536,0,rocBlas,<unused>;miopenConvolutionFwdAlgoWinograd:ConvBinWinogradRxSf3x2,0.4304,0,miopenConvolutionFwdAlgoWinograd,<unused>
64-200-272-1x1-256-200-272-1-0x0-1x1-1x1-0-NCHW-FP32-F=miopenConvolutionFwdAlgoImplicitGEMM:ConvHipImplicitGemmV4R4Fwd,0.22128,0,miopenConvolutionFwdAlgoImplicitGEMM,<unused>;miopenConvolutionFwdAlgoDirect:ConvOclDirectFwd1x1,0.20368,0,miopenConvolutionFwdAlgoDirect,<unused>;miopenConvolutionFwdAlgoGEMM:gemm,0.19184,0,rocBlas,<unused>;miopenConvolutionFwdAlgoWinograd:ConvBinWinogradRxSf3x2,0.48176,0,miopenConvolutionFwdAlgoWinograd,<unused>
256-200-272-1x1-128-100-136-1-0x0-2x2-1x1-0-NCHW-FP32-F=miopenConvolutionFwdAlgoImplicitGEMM:ConvHipImplicitGemmV4R4Fwd,0.16464,0,miopenConvolutionFwdAlgoImplicitGEMM,<unused>;miopenConvolutionFwdAlgoDirect:ConvOclDirectFwd1x1,0.23232,0,miopenConvolutionFwdAlgoDirect,<unused>;miopenConvolutionFwdAlgoGEMM:gemm,0.21664,20889600,rocBlas,<unused>;miopenConvolutionFwdAlgoWinograd:ConvBinWinogradRxSf2x3,0.874719,0,miopenConvolutionFwdAlgoWinograd,<unused>
128-100-136-3x3-128-100-136-1-1x1-1x1-1x1-0-NCHW-FP32-F=miopenConvolutionFwdAlgoWinograd:ConvBinWinograd3x3U,0.23792,0,miopenConvolutionFwdAlgoWinograd,<unused>
384-100-136-1x1-512-100-136-1-0x0-1x1-1x1-0-NCHW-FP32-F=miopenConvolutionFwdAlgoImplicitGEMM:ConvHipImplicitGemmV4R4Fwd,0.771519,0,miopenConvolutionFwdAlgoImplicitGEMM,<unused>;miopenConvolutionFwdAlgoDirect:ConvOclDirectFwd1x1,0.693599,0,miopenConvolutionFwdAlgoDirect,<unused>;miopenConvolutionFwdAlgoGEMM:gemm,0.500319,0,rocBlas,<unused>;miopenConvolutionFwdAlgoWinograd:ConvBinWinogradRxSf3x2,1.1944,0,miopenConvolutionFwdAlgoWinograd,<unused>
512-100-136-1x1-128-100-136-1-0x0-1x1-1x1-0-NCHW-FP32-F=miopenConvolutionFwdAlgoImplicitGEMM:ConvHipImplicitGemmV4R4Fwd,0.32448,0,miopenConvolutionFwdAlgoImplicitGEMM,<unused>;miopenConvolutionFwdAlgoDirect:ConvOclDirectFwd1x1,0.248,0,miopenConvolutionFwdAlgoDirect,<unused>;miopenConvolutionFwdAlgoGEMM:gemm,0.21648,0,rocBlas,<unused>;miopenConvolutionFwdAlgoWinograd:ConvBinWinogradRxSf3x2,0.46688,0,miopenConvolutionFwdAlgoWinograd,<unused>
128-100-136-1x1-512-100-136-1-0x0-1x1-1x1-0-NCHW-FP32-F=miopenConvolutionFwdAlgoImplicitGEMM:ConvHipImplicitGemmV4R4Fwd,0.27328,0,miopenConvolutionFwdAlgoImplicitGEMM,<unused>;miopenConvolutionFwdAlgoDirect:ConvOclDirectFwd1x1,0.22512,0,miopenConvolutionFwdAlgoDirect,<unused>;miopenConvolutionFwdAlgoGEMM:gemm,0.19904,0,rocBlas,<unused>;miopenConvolutionFwdAlgoWinograd:ConvBinWinogradRxSf3x2,0.45808,0,miopenConvolutionFwdAlgoWinograd,<unused>
512-100-136-1x1-256-50-68-1-0x0-2x2-1x1-0-NCHW-FP32-F=miopenConvolutionFwdAlgoDirect:ConvOclDirectFwd1x1,0.27632,0,miopenConvolutionFwdAlgoDirect,<unused>;miopenConvolutionFwdAlgoGEMM:gemm,0.17312,10444800,rocBlas,<unused>;miopenConvolutionFwdAlgoWinograd:ConvBinWinogradRxSf2x3,0.865279,0,miopenConvolutionFwdAlgoWinograd,<unused>
256-50-68-3x3-256-50-68-1-1x1-1x1-1x1-0-NCHW-FP32-F=miopenConvolutionFwdAlgoWinograd:ConvBinWinograd3x3U,0.23184,0,miopenConvolutionFwdAlgoWinograd,<unused>
768-50-68-1x1-1024-50-68-1-0x0-1x1-1x1-0-NCHW-FP32-F=miopenConvolutionFwdAlgoDirect:ConvAsm1x1U,0.658079,0,miopenConvolutionFwdAlgoDirect,<unused>;miopenConvolutionFwdAlgoGEMM:gemm,0.551199,0,rocBlas,<unused>;miopenConvolutionFwdAlgoWinograd:ConvBinWinogradRxSf3x2,1.16656,0,miopenConvolutionFwdAlgoWinograd,<unused>
1024-50-68-1x1-256-50-68-1-0x0-1x1-1x1-0-NCHW-FP32-F=miopenConvolutionFwdAlgoDirect:ConvAsm1x1U,0.2624,0,miopenConvolutionFwdAlgoDirect,<unused>;miopenConvolutionFwdAlgoGEMM:gemm,0.24688,0,rocBlas,<unused>;miopenConvolutionFwdAlgoWinograd:ConvBinWinogradRxSf3x2,0.45808,0,miopenConvolutionFwdAlgoWinograd,<unused>
256-50-68-1x1-1024-50-68-1-0x0-1x1-1x1-0-NCHW-FP32-F=miopenConvolutionFwdAlgoDirect:ConvAsm1x1U,0.26,0,miopenConvolutionFwdAlgoDirect,<unused>;miopenConvolutionFwdAlgoGEMM:gemm,0.22928,0,rocBlas,<unused>;miopenConvolutionFwdAlgoWinograd:ConvBinWinogradRxSf3x2,0.43024,0,miopenConvolutionFwdAlgoWinograd,<unused>
1024-50-68-1x1-512-25-34-1-0x0-2x2-1x1-0-NCHW-FP32-F=miopenConvolutionFwdAlgoDirect:ConvAsm1x1U,0.19744,3481600,miopenConvolutionFwdAlgoDirect,<unused>;miopenConvolutionFwdAlgoGEMM:gemm,0.20672,5222400,rocBlas,<unused>;miopenConvolutionFwdAlgoWinograd:ConvBinWinogradRxSf2x3,0.861279,0,miopenConvolutionFwdAlgoWinograd,<unused>
512-25-34-3x3-512-25-34-1-1x1-1x1-1x1-0-NCHW-FP32-F=miopenConvolutionFwdAlgoWinograd:ConvBinWinogradRxSf2x3,0.23104,0,miopenConvolutionFwdAlgoWinograd,<unused>
1536-25-34-1x1-2048-25-34-1-0x0-1x1-1x1-0-NCHW-FP32-F=miopenConvolutionFwdAlgoDirect:ConvAsm1x1U,0.903039,0,miopenConvolutionFwdAlgoDirect,<unused>;miopenConvolutionFwdAlgoGEMM:gemm,0.630559,0,rocBlas,<unused>;miopenConvolutionFwdAlgoWinograd:ConvBinWinogradRxSf3x2,1.62816,0,miopenConvolutionFwdAlgoWinograd,<unused>
2048-25-34-1x1-512-25-34-1-0x0-1x1-1x1-0-NCHW-FP32-F=miopenConvolutionFwdAlgoDirect:ConvAsm1x1U,0.32288,0,miopenConvolutionFwdAlgoDirect,<unused>;miopenConvolutionFwdAlgoGEMM:gemm,0.2064,0,rocBlas,<unused>;miopenConvolutionFwdAlgoWinograd:ConvBinWinogradRxSf2x3,0.822239,0,miopenConvolutionFwdAlgoWinograd,<unused>
512-25-34-1x1-2048-25-34-1-0x0-1x1-1x1-0-NCHW-FP32-F=miopenConvolutionFwdAlgoDirect:ConvAsm1x1U,0.32368,0,miopenConvolutionFwdAlgoDirect,<unused>;miopenConvolutionFwdAlgoGEMM:gemm,0.2024,0,rocBlas,<unused>;miopenConvolutionFwdAlgoWinograd:ConvBinWinogradRxSf3x2,0.578559,0,miopenConvolutionFwdAlgoWinograd,<unused>
2048-25-34-1x1-256-25-34-1-0x0-1x1-1x1-0-NCHW-FP32-F=miopenConvolutionFwdAlgoDirect:ConvOclDirectFwd1x1,0.17984,0,miopenConvolutionFwdAlgoDirect,<unused>;miopenConvolutionFwdAlgoGEMM:gemm,0.13728,0,rocBlas,<unused>;miopenConvolutionFwdAlgoWinograd:ConvBinWinogradRxSf2x3,0.4224,0,miopenConvolutionFwdAlgoWinograd,<unused>
256-25-34-3x3-256-25-34-1-1x1-1x1-1x1-0-NCHW-FP32-F=miopenConvolutionFwdAlgoWinograd:ConvBinWinogradRxS,0.0736,0,miopenConvolutionFwdAlgoWinograd,<unused>
256-13-17-3x3-256-13-17-1-1x1-1x1-1x1-0-NCHW-FP32-F=miopenConvolutionFwdAlgoWinograd:ConvBinWinogradRxS,0.07344,0,miopenConvolutionFwdAlgoWinograd,<unused>
256-13-17-1x1-3-13-17-1-0x0-1x1-1x1-0-NCHW-FP32-F=miopenConvolutionFwdAlgoDirect:ConvAsm1x1U,0.01024,0,miopenConvolutionFwdAlgoDirect,<unused>;miopenConvolutionFwdAlgoGEMM:gemm,0.01824,0,rocBlas,<unused>;miopenConvolutionFwdAlgoWinograd:ConvBinWinogradRxSf2x3,0.07312,0,miopenConvolutionFwdAlgoWinograd,<unused>
3-800-1440-7x7-64-400-720-1-3x3-2x2-1x1-0-NCHW-FP32-F=miopenConvolutionFwdAlgoDirect:ConvOclDirectFwdGen,1.02432,0,miopenConvolutionFwdAlgoDirect,<unused>;miopenConvolutionFwdAlgoGEMM:gemm,0.92448,169344000,rocBlas,<unused>;miopenConvolutionFwdAlgoWinograd:ConvBinWinogradRxS,0.936319,0,miopenConvolutionFwdAlgoWinograd,<unused>
64-200-360-1x1-64-200-360-1-0x0-1x1-1x1-0-NCHW-FP32-F=miopenConvolutionFwdAlgoImplicitGEMM:ConvHipImplicitGemmV4R4Fwd,0.08608,0,miopenConvolutionFwdAlgoImplicitGEMM,<unused>;miopenConvolutionFwdAlgoDirect:ConvOclDirectFwd1x1,0.08752,0,miopenConvolutionFwdAlgoDirect,<unused>;miopenConvolutionFwdAlgoGEMM:gemm,0.09184,0,rocBlas,<unused>;miopenConvolutionFwdAlgoWinograd:ConvBinWinogradRxSf3x2,0.18832,0,miopenConvolutionFwdAlgoWinograd,<unused>
64-200-360-3x3-64-200-360-1-1x1-1x1-1x1-0-NCHW-FP32-F=miopenConvolutionFwdAlgoWinograd:ConvBinWinograd3x3U,0.2952,0,miopenConvolutionFwdAlgoWinograd,<unused>
128-200-360-1x1-256-200-360-1-0x0-1x1-1x1-0-NCHW-FP32-F=miopenConvolutionFwdAlgoImplicitGEMM:ConvHipImplicitGemmV4R4Fwd,0.48592,0,miopenConvolutionFwdAlgoImplicitGEMM,<unused>;miopenConvolutionFwdAlgoDirect:ConvOclDirectFwd1x1,0.51984,0,miopenConvolutionFwdAlgoDirect,<unused>;miopenConvolutionFwdAlgoGEMM:gemm,0.45072,0,rocBlas,<unused>;miopenConvolutionFwdAlgoWinograd:ConvBinWinogradRxSf3x2,1.07536,0,miopenConvolutionFwdAlgoWinograd,<unused>
256-200-360-1x1-64-200-360-1-0x0-1x1-1x1-0-NCHW-FP32-F=miopenConvolutionFwdAlgoImplicitGEMM:ConvHipImplicitGemmV4R4Fwd,0.26608,0,miopenConvolutionFwdAlgoImplicitGEMM,<unused>;miopenConvolutionFwdAlgoDirect:ConvOclDirectFwd1x1,0.28464,0,miopenConvolutionFwdAlgoDirect,<unused>;miopenConvolutionFwdAlgoGEMM:gemm,0.2488,0,rocBlas,<unused>;miopenConvolutionFwdAlgoWinograd:ConvBinWinogradRxSf3x2,0.5448,0,miopenConvolutionFwdAlgoWinograd,<unused>
64-200-360-1x1-256-200-360-1-0x0-1x1-1x1-0-NCHW-FP32-F=miopenConvolutionFwdAlgoImplicitGEMM:ConvHipImplicitGemmV4R4Fwd,0.28336,0,miopenConvolutionFwdAlgoImplicitGEMM,<unused>;miopenConvolutionFwdAlgoDirect:ConvOclDirectFwd1x1,0.264,0,miopenConvolutionFwdAlgoDirect,<unused>;miopenConvolutionFwdAlgoGEMM:gemm,0.2512,0,rocBlas,<unused>;miopenConvolutionFwdAlgoWinograd:ConvBinWinogradRxSf3x2,0.634079,0,miopenConvolutionFwdAlgoWinograd,<unused>
256-200-360-1x1-128-100-180-1-0x0-2x2-1x1-0-NCHW-FP32-F=miopenConvolutionFwdAlgoDirect:ConvOclDirectFwd1x1,0.28192,0,miopenConvolutionFwdAlgoDirect,<unused>;miopenConvolutionFwdAlgoGEMM:gemm,0.2728,27648000,rocBlas,<unused>;miopenConvolutionFwdAlgoWinograd:ConvBinWinogradRxSf2x3,1.09008,0,miopenConvolutionFwdAlgoWinograd,<unused>
128-100-180-3x3-128-100-180-1-1x1-1x1-1x1-0-NCHW-FP32-F=miopenConvolutionFwdAlgoWinograd:ConvBinWinogradRxSf2x3,0.292,0,miopenConvolutionFwdAlgoWinograd,<unused>
384-100-180-1x1-512-100-180-1-0x0-1x1-1x1-0-NCHW-FP32-F=miopenConvolutionFwdAlgoDirect:ConvOclDirectFwd1x1,0.900159,0,miopenConvolutionFwdAlgoDirect,<unused>;miopenConvolutionFwdAlgoGEMM:gemm,0.676159,0,rocBlas,<unused>;miopenConvolutionFwdAlgoWinograd:ConvBinWinogradRxSf3x2,1.52208,0,miopenConvolutionFwdAlgoWinograd,<unused>
512-100-180-1x1-128-100-180-1-0x0-1x1-1x1-0-NCHW-FP32-F=miopenConvolutionFwdAlgoDirect:ConvOclDirectFwd1x1,0.30112,0,miopenConvolutionFwdAlgoDirect,<unused>;miopenConvolutionFwdAlgoGEMM:gemm,0.248,0,rocBlas,<unused>;miopenConvolutionFwdAlgoWinograd:ConvBinWinogradRxSf3x2,0.575679,0,miopenConvolutionFwdAlgoWinograd,<unused>
128-100-180-1x1-512-100-180-1-0x0-1x1-1x1-0-NCHW-FP32-F=miopenConvolutionFwdAlgoDirect:ConvOclDirectFwd1x1,0.29072,0,miopenConvolutionFwdAlgoDirect,<unused>;miopenConvolutionFwdAlgoGEMM:gemm,0.26208,0,rocBlas,<unused>;miopenConvolutionFwdAlgoWinograd:ConvBinWinogradRxSf3x2,0.577279,0,miopenConvolutionFwdAlgoWinograd,<unused>
512-100-180-1x1-256-50-90-1-0x0-2x2-1x1-0-NCHW-FP32-F=miopenConvolutionFwdAlgoDirect:ConvOclDirectFwd1x1,0.33216,0,miopenConvolutionFwdAlgoDirect,<unused>;miopenConvolutionFwdAlgoGEMM:gemm,0.21344,13824000,rocBlas,<unused>;miopenConvolutionFwdAlgoWinograd:ConvBinWinogradRxSf2x3,1.08,0,miopenConvolutionFwdAlgoWinograd,<unused>
256-50-90-3x3-256-50-90-1-1x1-1x1-1x1-0-NCHW-FP32-F=miopenConvolutionFwdAlgoWinograd:ConvBinWinogradRxS,0.284,0,miopenConvolutionFwdAlgoWinograd,<unused>
768-50-90-1x1-1024-50-90-1-0x0-1x1-1x1-0-NCHW-FP32-F=miopenConvolutionFwdAlgoDirect:ConvOclDirectFwd1x1,1.08544,0,miopenConvolutionFwdAlgoDirect,<unused>;miopenConvolutionFwdAlgoGEMM:gemm,0.679999,0,rocBlas,<unused>;miopenConvolutionFwdAlgoWinograd:ConvBinWinogradRxSf3x2,1.4944,0,miopenConvolutionFwdAlgoWinograd,<unused>
1024-50-90-1x1-256-50-90-1-0x0-1x1-1x1-0-NCHW-FP32-F=miopenConvolutionFwdAlgoDirect:ConvOclDirectFwd1x1,0.42176,0,miopenConvolutionFwdAlgoDirect,<unused>;miopenConvolutionFwdAlgoGEMM:gemm,0.31664,0,rocBlas,<unused>;miopenConvolutionFwdAlgoWinograd:ConvBinWinogradRxSf3x2,0.670399,0,miopenConvolutionFwdAlgoWinograd,<unused>
256-50-90-1x1-1024-50-90-1-0x0-1x1-1x1-0-NCHW-FP32-F=miopenConvolutionFwdAlgoDirect:ConvOclDirectFwd1x1,0.35392,0,miopenConvolutionFwdAlgoDirect,<unused>;miopenConvolutionFwdAlgoGEMM:gemm,0.29296,0,rocBlas,<unused>;miopenConvolutionFwdAlgoWinograd:ConvBinWinogradRxSf3x2,0.545919,0,miopenConvolutionFwdAlgoWinograd,<unused>
1024-50-90-1x1-512-25-45-1-0x0-2x2-1x1-0-NCHW-FP32-F=miopenConvolutionFwdAlgoDirect:ConvOclDirectFwd1x1,0.44944,0,miopenConvolutionFwdAlgoDirect,<unused>;miopenConvolutionFwdAlgoGEMM:gemm,0.21088,6912000,rocBlas,<unused>;miopenConvolutionFwdAlgoWinograd:ConvBinWinogradRxSf2x3,1.27936,0,miopenConvolutionFwdAlgoWinograd,<unused>
512-25-45-3x3-512-25-45-1-1x1-1x1-1x1-0-NCHW-FP32-F=miopenConvolutionFwdAlgoWinograd:ConvBinWinogradRxSf2x3,0.33168,0,miopenConvolutionFwdAlgoWinograd,<unused>
1536-25-45-1x1-2048-25-45-1-0x0-1x1-1x1-0-NCHW-FP32-F=miopenConvolutionFwdAlgoDirect:ConvAsm1x1U,1.0144,0,miopenConvolutionFwdAlgoDirect,<unused>;miopenConvolutionFwdAlgoGEMM:gemm,0.886239,0,rocBlas,<unused>;miopenConvolutionFwdAlgoWinograd:ConvBinWinogradRxSf3x2,1.944,0,miopenConvolutionFwdAlgoWinograd,<unused>
2048-25-45-1x1-512-25-45-1-0x0-1x1-1x1-0-NCHW-FP32-F=miopenConvolutionFwdAlgoDirect:ConvAsm1x1U,0.40032,0,miopenConvolutionFwdAlgoDirect,<unused>;miopenConvolutionFwdAlgoGEMM:gemm,0.34,0,rocBlas,<unused>;miopenConvolutionFwdAlgoWinograd:ConvBinWinogradRxSf3x2,0.874239,0,miopenConvolutionFwdAlgoWinograd,<unused>
512-25-45-1x1-2048-25-45-1-0x0-1x1-1x1-0-NCHW-FP32-F=miopenConvolutionFwdAlgoDirect:ConvAsm1x1U,0.37872,0,miopenConvolutionFwdAlgoDirect,<unused>;miopenConvolutionFwdAlgoGEMM:gemm,0.26784,0,rocBlas,<unused>;miopenConvolutionFwdAlgoWinograd:ConvBinWinogradRxSf3x2,0.685439,0,miopenConvolutionFwdAlgoWinograd,<unused>
2048-25-45-1x1-256-25-45-1-0x0-1x1-1x1-0-NCHW-FP32-F=miopenConvolutionFwdAlgoDirect:ConvAsm1x1U,0.24928,0,miopenConvolutionFwdAlgoDirect,<unused>;miopenConvolutionFwdAlgoGEMM:gemm,0.19104,0,rocBlas,<unused>;miopenConvolutionFwdAlgoWinograd:ConvBinWinogradRxSf3x2,0.452,0,miopenConvolutionFwdAlgoWinograd,<unused>
256-25-45-3x3-256-25-45-1-1x1-1x1-1x1-0-NCHW-FP32-F=miopenConvolutionFwdAlgoWinograd:ConvBinWinogradRxSf2x3,0.12448,0,miopenConvolutionFwdAlgoWinograd,<unused>
256-13-23-3x3-256-13-23-1-1x1-1x1-1x1-0-NCHW-FP32-F=miopenConvolutionFwdAlgoWinograd:ConvBinWinogradRxSf2x3,0.07296,0,miopenConvolutionFwdAlgoWinograd,<unused>
256-13-23-1x1-3-13-23-1-0x0-1x1-1x1-0-NCHW-FP32-F=miopenConvolutionFwdAlgoDirect:ConvAsm1x1U,0.01056,0,miopenConvolutionFwdAlgoDirect,<unused>;miopenConvolutionFwdAlgoGEMM:gemm,0.017599,0,rocBlas,<unused>;miopenConvolutionFwdAlgoWinograd:ConvBinWinogradRxS,0.07216,0,miopenConvolutionFwdAlgoWinograd,<unused>
3-224-224-7x7-64-112-112-1-3x3-2x2-1x1-0-NCHW-FP32-F=miopenConvolutionFwdAlgoDirect:ConvAsm7x7c3h224w224k64u2v2p3q3f1,0.03792,0,miopenConvolutionFwdAlgoDirect,<unused>;miopenConvolutionFwdAlgoGEMM:gemm,5.63423,7375872,rocBlas,<unused>;miopenConvolutionFwdAlgoWinograd:ConvBinWinogradRxS,0.06848,0,miopenConvolutionFwdAlgoWinograd,<unused>
64-56-56-1x1-64-56-56-1-0x0-1x1-1x1-0-NCHW-FP32-F=miopenConvolutionFwdAlgoImplicitGEMM:ConvHipImplicitGemmV4R4Fwd,0.01584,0,miopenConvolutionFwdAlgoImplicitGEMM,<unused>;miopenConvolutionFwdAlgoDirect:ConvAsm1x1U,0.01184,0,miopenConvolutionFwdAlgoDirect,<unused>;miopenConvolutionFwdAlgoGEMM:gemm,0.01824,0,rocBlas,<unused>;miopenConvolutionFwdAlgoWinograd:ConvBinWinogradRxS,0.03552,0,miopenConvolutionFwdAlgoWinograd,<unused>
64-56-56-3x3-64-56-56-1-1x1-1x1-1x1-0-NCHW-FP32-F=miopenConvolutionFwdAlgoWinograd:ConvBinWinogradRxS,0.03488,0,miopenConvolutionFwdAlgoWinograd,<unused>
128-56-56-1x1-256-56-56-1-0x0-1x1-1x1-0-NCHW-FP32-F=miopenConvolutionFwdAlgoImplicitGEMM:ConvHipImplicitGemmV4R4Fwd,0.03712,0,miopenConvolutionFwdAlgoImplicitGEMM,<unused>;miopenConvolutionFwdAlgoDirect:ConvOclDirectFwd1x1,0.0368,0,miopenConvolutionFwdAlgoDirect,<unused>;miopenConvolutionFwdAlgoGEMM:gemm,0.04432,0,rocBlas,<unused>;miopenConvolutionFwdAlgoWinograd:ConvBinWinogradRxSf3x2,0.08944,0,miopenConvolutionFwdAlgoWinograd,<unused>
256-56-56-1x1-64-56-56-1-0x0-1x1-1x1-0-NCHW-FP32-F=miopenConvolutionFwdAlgoImplicitGEMM:ConvHipImplicitGemmV4R4Fwd,0.03488,0,miopenConvolutionFwdAlgoImplicitGEMM,<unused>;miopenConvolutionFwdAlgoDirect:ConvAsm1x1U,0.02416,0,miopenConvolutionFwdAlgoDirect,<unused>;miopenConvolutionFwdAlgoGEMM:gemm,0.05472,0,rocBlas,<unused>;miopenConvolutionFwdAlgoWinograd:ConvBinWinogradRxS,0.0736,0,miopenConvolutionFwdAlgoWinograd,<unused>
64-56-56-1x1-256-56-56-1-0x0-1x1-1x1-0-NCHW-FP32-F=miopenConvolutionFwdAlgoImplicitGEMM:ConvHipImplicitGemmV4R4Fwd,0.02224,0,miopenConvolutionFwdAlgoImplicitGEMM,<unused>;miopenConvolutionFwdAlgoDirect:ConvOclDirectFwd1x1,0.02112,0,miopenConvolutionFwdAlgoDirect,<unused>;miopenConvolutionFwdAlgoGEMM:gemm,0.02656,0,rocBlas,<unused>;miopenConvolutionFwdAlgoWinograd:ConvBinWinogradRxSf3x2,0.06208,0,miopenConvolutionFwdAlgoWinograd,<unused>
256-56-56-1x1-128-56-56-1-0x0-1x1-1x1-0-NCHW-FP32-F=miopenConvolutionFwdAlgoImplicitGEMM:ConvHipImplicitGemmV4R4Fwd,0.04224,0,miopenConvolutionFwdAlgoImplicitGEMM,<unused>;miopenConvolutionFwdAlgoDirect:ConvOclDirectFwd1x1,0.04496,0,miopenConvolutionFwdAlgoDirect,<unused>;miopenConvolutionFwdAlgoGEMM:gemm,0.05168,0,rocBlas,<unused>;miopenConvolutionFwdAlgoWinograd:ConvBinWinogradRxSf3x2,0.08416,0,miopenConvolutionFwdAlgoWinograd,<unused>
128-56-56-3x3-128-28-28-1-1x1-2x2-1x1-0-NCHW-FP32-F=miopenConvolutionFwdAlgoDirect:ConvOclDirectFwd,0.41584,0,miopenConvolutionFwdAlgoDirect,<unused>;miopenConvolutionFwdAlgoGEMM:gemm,0.0832,3612672,rocBlas,<unused>;miopenConvolutionFwdAlgoWinograd:ConvBinWinogradRxSf2x3,0.1288,0,miopenConvolutionFwdAlgoWinograd,<unused>
384-28-28-1x1-512-28-28-1-0x0-1x1-1x1-0-NCHW-FP32-F=miopenConvolutionFwdAlgoDirect:ConvAsm1x1U,0.05872,0,miopenConvolutionFwdAlgoDirect,<unused>;miopenConvolutionFwdAlgoGEMM:gemm,0.05312,0,rocBlas,<unused>;miopenConvolutionFwdAlgoWinograd:ConvBinWinogradRxSf2x3,0.17536,0,miopenConvolutionFwdAlgoWinograd,<unused>
512-28-28-1x1-128-28-28-1-0x0-1x1-1x1-0-NCHW-FP32-F=miopenConvolutionFwdAlgoDirect:ConvAsm1x1U,0.03072,0,miopenConvolutionFwdAlgoDirect,<unused>;miopenConvolutionFwdAlgoGEMM:gemm,0.1032,0,rocBlas,<unused>;miopenConvolutionFwdAlgoWinograd:ConvBinWinogradRxSf2x3,0.12144,0,miopenConvolutionFwdAlgoWinograd,<unused>
128-28-28-3x3-128-28-28-1-1x1-1x1-1x1-0-NCHW-FP32-F=miopenConvolutionFwdAlgoWinograd:ConvBinWinogradRxS,0.04736,0,miopenConvolutionFwdAlgoWinograd,<unused>
128-28-28-1x1-512-28-28-1-0x0-1x1-1x1-0-NCHW-FP32-F=miopenConvolutionFwdAlgoDirect:ConvAsm1x1U,0.02528,0,miopenConvolutionFwdAlgoDirect,<unused>;miopenConvolutionFwdAlgoGEMM:gemm,0.0344,0,rocBlas,<unused>;miopenConvolutionFwdAlgoWinograd:ConvBinWinogradRxS,0.0752,0,miopenConvolutionFwdAlgoWinograd,<unused>
512-28-28-1x1-256-28-28-1-0x0-1x1-1x1-0-NCHW-FP32-F=miopenConvolutionFwdAlgoDirect:ConvAsm1x1U,0.0432,0,miopenConvolutionFwdAlgoDirect,<unused>;miopenConvolutionFwdAlgoGEMM:gemm,0.09632,0,rocBlas,<unused>;miopenConvolutionFwdAlgoWinograd:ConvBinWinogradRxSf2x3,0.12368,0,miopenConvolutionFwdAlgoWinograd,<unused>
256-28-28-3x3-256-14-14-1-1x1-2x2-1x1-0-NCHW-FP32-F=miopenConvolutionFwdAlgoDirect:ConvOclDirectFwd,0.679839,0,miopenConvolutionFwdAlgoDirect,<unused>;miopenConvolutionFwdAlgoGEMM:gemm,0.09104,1806336,rocBlas,<unused>;miopenConvolutionFwdAlgoWinograd:ConvBinWinogradRxSf2x3,0.23088,0,miopenConvolutionFwdAlgoWinograd,<unused>
768-14-14-1x1-1024-14-14-1-0x0-1x1-1x1-0-NCHW-FP32-F=miopenConvolutionFwdAlgoDirect:ConvAsm1x1U,0.10128,0,miopenConvolutionFwdAlgoDirect,<unused>;miopenConvolutionFwdAlgoGEMM:gemm,0.0784,0,rocBlas,<unused>;miopenConvolutionFwdAlgoWinograd:ConvBinWinogradRxSf3x2,0.18976,0,miopenConvolutionFwdAlgoWinograd,<unused>
1024-14-14-1x1-256-14-14-1-0x0-1x1-1x1-0-NCHW-FP32-F=miopenConvolutionFwdAlgoDirect:ConvAsm1x1U,0.0432,0,miopenConvolutionFwdAlgoDirect,<unused>;miopenConvolutionFwdAlgoGEMM:gemm,0.07872,0,rocBlas,<unused>;miopenConvolutionFwdAlgoWinograd:ConvBinWinogradRxSf2x3,0.21792,0,miopenConvolutionFwdAlgoWinograd,<unused>
256-14-14-3x3-256-14-14-1-1x1-1x1-1x1-0-NCHW-FP32-F=miopenConvolutionFwdAlgoWinograd:ConvBinWinogradRxSf2x3,0.07296,0,miopenConvolutionFwdAlgoWinograd,<unused>
256-14-14-1x1-1024-14-14-1-0x0-1x1-1x1-0-NCHW-FP32-F=miopenConvolutionFwdAlgoDirect:ConvAsm1x1U,0.03472,0,miopenConvolutionFwdAlgoDirect,<unused>;miopenConvolutionFwdAlgoGEMM:gemm,0.03904,0,rocBlas,<unused>;miopenConvolutionFwdAlgoWinograd:ConvBinWinogradRxSf3x2,0.0848,0,miopenConvolutionFwdAlgoWinograd,<unused>
1024-14-14-1x1-512-14-14-1-0x0-1x1-1x1-0-NCHW-FP32-F=miopenConvolutionFwdAlgoDirect:ConvAsm1x1U,0.07072,0,miopenConvolutionFwdAlgoDirect,<unused>;miopenConvolutionFwdAlgoGEMM:gemm,0.0728,0,rocBlas,<unused>;miopenConvolutionFwdAlgoWinograd:ConvBinWinogradRxSf2x3,0.21984,0,miopenConvolutionFwdAlgoWinograd,<unused>
512-14-14-3x3-512-7-7-1-1x1-2x2-1x1-0-NCHW-FP32-F=miopenConvolutionFwdAlgoDirect:ConvOclDirectFwd,1.11968,0,miopenConvolutionFwdAlgoDirect,<unused>;miopenConvolutionFwdAlgoGEMM:gemm,0.35296,903168,rocBlas,<unused>;miopenConvolutionFwdAlgoWinograd:ConvBinWinogradRxSf2x3,0.435839,0,miopenConvolutionFwdAlgoWinograd,<unused>
1536-7-7-1x1-2048-7-7-1-0x0-1x1-1x1-0-NCHW-FP32-F=miopenConvolutionFwdAlgoDirect:ConvOclDirectFwd1x1,0.11872,0,miopenConvolutionFwdAlgoDirect,<unused>;miopenConvolutionFwdAlgoGEMM:gemm,0.10464,0,rocBlas,<unused>;miopenConvolutionFwdAlgoWinograd:ConvBinWinogradRxSf2x3,0.612319,0,miopenConvolutionFwdAlgoWinograd,<unused>
2048-7-7-1x1-512-7-7-1-0x0-1x1-1x1-0-NCHW-FP32-F=miopenConvolutionFwdAlgoDirect:ConvOclDirectFwd1x1,0.05696,0,miopenConvolutionFwdAlgoDirect,<unused>;miopenConvolutionFwdAlgoGEMM:gemm,0.07296,0,rocBlas,<unused>;miopenConvolutionFwdAlgoWinograd:ConvBinWinogradRxSf2x3,0.4176,0,miopenConvolutionFwdAlgoWinograd,<unused>
512-7-7-3x3-512-7-7-1-1x1-1x1-1x1-0-NCHW-FP32-F=miopenConvolutionFwdAlgoWinograd:ConvBinWinogradRxSf2x3,0.12304,0,miopenConvolutionFwdAlgoWinograd,<unused>
512-7-7-1x1-2048-7-7-1-0x0-1x1-1x1-0-NCHW-FP32-F=miopenConvolutionFwdAlgoDirect:ConvOclDirectFwd1x1,0.0472,0,miopenConvolutionFwdAlgoDirect,<unused>;miopenConvolutionFwdAlgoGEMM:gemm,0.05152,0,rocBlas,<unused>;miopenConvolutionFwdAlgoWinograd:ConvBinWinogradRxSf2x3,0.2224,0,miopenConvolutionFwdAlgoWinograd,<unused>
